B2: Periodo: | D2: 37987 | E2: a | F2: 38356 | H2: 38352 | I2: Vendas Acumuladas por Filial - Ano | R2: =NOW() -> 38357.755738194399
D4: Vendas 2005 | H4: Vendas de Anos Anteriores | L4: Percentuais ( % ) | R4: Meta Mensal | V4: Margem
B5: Lojas | D5: Previsao | E5: Realizada | F5: Mes Anterior | H5: Vendas 2004 | I5: Vendas 2003 | J5: Vendas 2002 | L5: % Prev | M5: % MA | N5: 2004 | O5: 2003 | P5: 2002 | R5: Previsao Mes | S5: Final | T5: Part. | V5: Meta | W5: Real
A7: 2 | B7: Xaxim | D7: 9540000 | E7: 9824989 | F7: 161234 | H7: 8663437 | I7: 6705460 | J7: 6350353 | L7: =IF(D7=0,0,((E7/D7)*100)-100) -> 2.99 | M7: =IF(E7=0,0,IF(F7=0,0,((E7/F7)*100)-100)) -> 5993.62 | N7: =IF(H7=0,0,((E7/H7)*100)-100) -> 13.41 | O7: =IF(I7=0,0,((E7/I7)*100)-100) -> 46.52 | P7: =IF(E7=0,0,IF(J7=0,0,((E7/J7)*100)-100)) -> 54.72 | R7: 9540000 | S7: =IF(E7=0,0,((E7/R7)*100)-100) -> 2.99 | T7: =IF(E7=0,0,(E7/$E$33)*100) -> 1.61 | V7: 17 | W7: 9.02
A8: 3 | B8: S. Felicidade | D8: 9289000 | E8: 8792249 | F8: 146321 | H8: 8990318 | I8: 6990164 | J8: 6887386 | L8: =IF(D8=0,0,((E8/D8)*100)-100) -> -5.35 | M8: =IF(E8=0,0,IF(F8=0,0,((E8/F8)*100)-100)) -> 5908.88 | N8: =IF(H8=0,0,((E8/H8)*100)-100) -> -2.2 | O8: =IF(I8=0,0,((E8/I8)*100)-100) -> 25.78 | P8: =IF(E8=0,0,IF(J8=0,0,((E8/J8)*100)-100)) -> 27.66 | R8: 9289000 | S8: =IF(E8=0,0,((E8/R8)*100)-100) -> -5.35 | T8: =IF(E8=0,0,(E8/$E$33)*100) -> 1.44 | V8: 16.75 | W8: 10.45
A9: 4 | B9: Lapa | D9: 14022000 | E9: 13955999 | F9: 235944 | H9: 12529965 | I9: 10376916 | J9: 8724833 | L9: =IF(D9=0,0,((E9/D9)*100)-100) -> -00.47 | M9: =IF(E9=0,0,IF(F9=0,0,((E9/F9)*100)-100)) -> 5814.96 | N9: =IF(H9=0,0,((E9/H9)*100)-100) -> 11.38 | O9: =IF(I9=0,0,((E9/I9)*100)-100) -> 34.49 | P9: =IF(E9=0,0,IF(J9=0,0,((E9/J9)*100)-100)) -> 59.96 | R9: 14022000 | S9: =IF(E9=0,0,((E9/R9)*100)-100) -> -00.47 | T9: =IF(E9=0,0,(E9/$E$33)*100) -> 2.29 | V9: 16.9 | W9: 12
A10: 5 | B10: Araucaria | D10: 14018000 | E10: 12008944 | F10: 206942 | H10: 12511462 | I10: 16573164 | J10: 17770815 | L10: =IF(D10=0,0,((E10/D10)*100)-100) -> -14.33 | M10: =IF(E10=0,0,IF(F10=0,0,((E10/F10)*100)-100)) -> 5703.05 | N10: =IF(H10=0,0,((E10/H10)*100)-100) -> -4.02 | O10: =IF(I10=0,0,((E10/I10)*100)-100) -> -27.54 | P10: =IF(E10=0,0,IF(J10=0,0,((E10/J10)*100)-100)) -> -32.42 | R10: 14018000 | S10: =IF(E10=0,0,((E10/R10)*100)-100) -> -14.33 | T10: =IF(E10=0,0,(E10/$E$33)*100) -> 1.97 | V10: 17.3 | W10: 13.97
A11: 6 | B11: Pinheirinho | D11: 27140000 | E11: 25057308 | F11: 384233 | H11: 22745716 | I11: 20177279 | J11: 20052382 | L11: =IF(D11=0,0,((E11/D11)*100)-100) -> -7.67 | M11: =IF(E11=0,0,IF(F11=0,0,((E11/F11)*100)-100)) -> 6421.38 | N11: =IF(H11=0,0,((E11/H11)*100)-100) -> 10.16 | O11: =IF(I11=0,0,((E11/I11)*100)-100) -> 24.19 | P11: =IF(E11=0,0,IF(J11=0,0,((E11/J11)*100)-100)) -> 24.96 | R11: 27140000 | S11: =IF(E11=0,0,((E11/R11)*100)-100) -> -7.67 | T11: =IF(E11=0,0,(E11/$E$33)*100) -> 4.11 | V11: 17.24 | W11: 11.18
A12: 7 | B12: Hauer | D12: 39190000 | E12: 37395692 | F12: 656042 | H12: 35258648 | I12: 29254447 | J12: 27253855 | L12: =IF(D12=0,0,((E12/D12)*100)-100) -> -4.58 | M12: =IF(E12=0,0,IF(F12=0,0,((E12/F12)*100)-100)) -> 5600.2 | N12: =IF(H12=0,0,((E12/H12)*100)-100) -> 6.06 | O12: =IF(I12=0,0,((E12/I12)*100)-100) -> 27.83 | P12: =IF(E12=0,0,IF(J12=0,0,((E12/J12)*100)-100)) -> 37.21 | R12: 39190000 | S12: =IF(E12=0,0,((E12/R12)*100)-100) -> -4.58 | T12: =IF(E12=0,0,(E12/$E$33)*100) -> 6.14 | V12: 16.6 | W12: 13.3
A13: 8 | B13: Paranagua | D13: 41122000 | E13: 40785839 | F13: 642325 | H13: 37010986 | I13: 32281519 | J13: 29068477 | L13: =IF(D13=0,0,((E13/D13)*100)-100) -> -00.82 | M13: =IF(E13=0,0,IF(F13=0,0,((E13/F13)*100)-100)) -> 6249.72 | N13: =IF(H13=0,0,((E13/H13)*100)-100) -> 10.2 | O13: =IF(I13=0,0,((E13/I13)*100)-100) -> 26.34 | P13: =IF(E13=0,0,IF(J13=0,0,((E13/J13)*100)-100)) -> 40.31 | R13: 41122000 | S13: =IF(E13=0,0,((E13/R13)*100)-100) -> -00.82 | T13: =IF(E13=0,0,(E13/$E$33)*100) -> 6.7 | V13: 17.59 | W13: 15.87
A14: 10 | B14: Centenario | D14: 12250000 | E14: 11671130 | F14: 176398 | H14: 11137943 | I14: 8921765 | J14: 8084831 | L14: =IF(D14=0,0,((E14/D14)*100)-100) -> -4.73 | M14: =IF(E14=0,0,IF(F14=0,0,((E14/F14)*100)-100)) -> 6516.36 | N14: =IF(H14=0,0,((E14/H14)*100)-100) -> 4.79 | O14: =IF(I14=0,0,((E14/I14)*100)-100) -> 30.82 | P14: =IF(E14=0,0,IF(J14=0,0,((E14/J14)*100)-100)) -> 44.36 | R14: 12250000 | S14: =IF(E14=0,0,((E14/R14)*100)-100) -> -4.73 | T14: =IF(E14=0,0,(E14/$E$33)*100) -> 1.92 | V14: 17.1 | W14: 8.65
A15: 12 | B15: Arapongas | D15: 0 | E15: 0 | F15: 0 | H15: 0 | I15: 0 | J15: 0 | L15: =IF(D15=0,0,((E15/D15)*100)-100) -> 0 | M15: =IF(E15=0,0,IF(F15=0,0,((E15/F15)*100)-100)) -> 0 | N15: =IF(E15=0,0,IF(H15=0,0,((E15/H15)*100)-100)) -> 0 | O15: =IF(E15=0,0,IF(I15=0,0,((E15/I15)*100)-100)) -> 0 | P15: =IF(E15=0,0,IF(J15=0,0,((E15/J15)*100)-100)) -> 0 | R15: 0 | S15: =IF(E15=0,0,((E15/R15)*100)-100) -> 0 | T15: =IF(E15=0,0,(E15/$E$33)*100) -> 0 | V15: 0 | W15: 0
A16: 11 | B16: Sao Braz | D16: 40108000 | E16: 37784047 | F16: 578646 | H16: 37039653 | I16: 30409720 | J16: 29970046 | L16: =IF(D16=0,0,((E16/D16)*100)-100) -> -5.79 | M16: =IF(E16=0,0,IF(F16=0,0,((E16/F16)*100)-100)) -> 6429.73 | N16: =IF(H16=0,0,((E16/H16)*100)-100) -> 2.01 | O16: =IF(I16=0,0,((E16/I16)*100)-100) -> 24.25 | P16: =IF(E16=0,0,IF(J16=0,0,((E16/J16)*100)-100)) -> 26.07 | R16: 40108000 | S16: =IF(E16=0,0,((E16/R16)*100)-100) -> -5.79 | T16: =IF(E16=0,0,(E16/$E$33)*100) -> 6.2 | V16: 16.65 | W16: 13.18
A17: 13 | B17: Guarapuava | D17: 18860000 | E17: 20010476 | F17: 371484 | H17: 16052983 | I17: 10819180 | J17: 10290898 | L17: =IF(D17=0,0,((E17/D17)*100)-100) -> 6.1 | M17: =IF(E17=0,0,IF(F17=0,0,((E17/F17)*100)-100)) -> 5286.63 | N17: =IF(H17=0,0,((E17/H17)*100)-100) -> 24.65 | O17: =IF(I17=0,0,((E17/I17)*100)-100) -> 84.95 | P17: =IF(E17=0,0,IF(J17=0,0,((E17/J17)*100)-100)) -> 94.45 | R17: 18860000 | S17: =IF(E17=0,0,((E17/R17)*100)-100) -> 6.1 | T17: =IF(E17=0,0,(E17/$E$33)*100) -> 3.29 | V17: 18 | W17: 12.94
A18: 15 | B18: Apucarana | D18: 18997000 | E18: 18858471 | F18: 328030 | H18: 16689271 | I18: 14551405 | J18: 13787506 | L18: =IF(D18=0,0,((E18/D18)*100)-100) -> -00.73 | M18: =IF(E18=0,0,IF(F18=0,0,((E18/F18)*100)-100)) -> 5649.01 | N18: =IF(H18=0,0,((E18/H18)*100)-100) -> 13 | O18: =IF(I18=0,0,((E18/I18)*100)-100) -> 29.6 | P18: =IF(E18=0,0,IF(J18=0,0,((E18/J18)*100)-100)) -> 36.78 | R18: 18997000 | S18: =IF(E18=0,0,((E18/R18)*100)-100) -> -00.73 | T18: =IF(E18=0,0,(E18/$E$33)*100) -> 3.1 | V18: 18 | W18: 9.89
A19: 17 | B19: Ahu | D19: 15191000 | E19: 13787524 | F19: 193358 | H19: 15060207 | I19: 13132530 | J19: 14242116 | L19: =IF(D19=0,0,((E19/D19)*100)-100) -> -9.24 | M19: =IF(E19=0,0,IF(F19=0,0,((E19/F19)*100)-100)) -> 7030.57 | N19: =IF(H19=0,0,((E19/H19)*100)-100) -> -8.45 | O19: =IF(I19=0,0,((E19/I19)*100)-100) -> 4.99 | P19: =IF(E19=0,0,IF(J19=0,0,((E19/J19)*100)-100)) -> -3.19 | R19: 15191000 | S19: =IF(E19=0,0,((E19/R19)*100)-100) -> -9.24 | T19: =IF(E19=0,0,(E19/$E$33)*100) -> 2.26 | V19: 17.91 | W19: 12.29
A20: 18 | B20: P.G. Centro | D20: 22110000 | E20: 20780783 | F20: 372925 | H20: 19621374 | I20: 15869584 | J20: 13984602 | L20: =IF(D20=0,0,((E20/D20)*100)-100) -> -6.01 | M20: =IF(E20=0,0,IF(F20=0,0,((E20/F20)*100)-100)) -> 5472.38 | N20: =IF(H20=0,0,((E20/H20)*100)-100) -> 5.91 | O20: =IF(I20=0,0,((E20/I20)*100)-100) -> 30.95 | P20: =IF(E20=0,0,IF(J20=0,0,((E20/J20)*100)-100)) -> 48.6 | R20: 22110000 | S20: =IF(E20=0,0,((E20/R20)*100)-100) -> -6.01 | T20: =IF(E20=0,0,(E20/$E$33)*100) -> 3.41 | V20: 18.25 | W20: 12.91
A21: 20 | B21: Maringa | D21: 27750000 | E21: 26612848 | F21: 428654 | H21: 24413222 | I21: 20869120 | J21: 19833849 | L21: =IF(D21=0,0,((E21/D21)*100)-100) -> -4.1 | M21: =IF(E21=0,0,IF(F21=0,0,((E21/F21)*100)-100)) -> 6108.47 | N21: =IF(H21=0,0,((E21/H21)*100)-100) -> 9.01 | O21: =IF(I21=0,0,((E21/I21)*100)-100) -> 27.52 | P21: =IF(E21=0,0,IF(J21=0,0,((E21/J21)*100)-100)) -> 34.18 | R21: 27750000 | S21: =IF(E21=0,0,((E21/R21)*100)-100) -> -4.1 | T21: =IF(E21=0,0,(E21/$E$33)*100) -> 4.37 | V21: 19 | W21: 13.61
A22: 23 | B22: Araucaria Nova | D22: 25865000 | E22: 25755181 | F22: 383341 | H22: 23362540 | I22: 7510505 | J22: 0 | L22: =IF(D22=0,0,((E22/D22)*100)-100) -> -00.42 | M22: =IF(E22=0,0,IF(F22=0,0,((E22/F22)*100)-100)) -> 6618.61 | N22: =IF(H22=0,0,((E22/H22)*100)-100) -> 10.24 | O22: =IF(I22=0,0,((E22/I22)*100)-100) -> 242.92 | P22: =IF(E22=0,0,IF(J22=0,0,((E22/J22)*100)-100)) -> 0 | R22: 25865000 | S22: =IF(E22=0,0,((E22/R22)*100)-100) -> -00.42 | T22: =IF(E22=0,0,(E22/$E$33)*100) -> 4.23 | V22: 17.5 | W22: 14.54
B23: Total Super | D23: =SUM(D7:D22) -> 335452000 | E23: =SUM(E7:E22) -> 323081480 | F23: =SUM(F7:F22) -> 5265877 | H23: =SUM(H7:H22) -> 301087725 | I23: =SUM(I7:I22) -> 244442758 | J23: =SUM(J7:J22) -> 226301949 | K23: =SUM(D23:J23) -> 1435631789 | L23: =IF(E23=0,0,((E23/D23)*100)-100) -> -3.69 | M23: =IF(E23=0,0,IF(F23=0,0,((E23/F23)*100)-100)) -> 6035.38 | N23: =IF(H23=0,0,IF(E23=0,0,((E23/H23)*100)-100)) -> 7.3 | O23: =IF(I23=0,0,IF(E23=0,0,((E23/I23)*100)-100)) -> 32.17 | P23: =IF(E23=0,0,IF(J23=0,0,((E23/J23)*100)-100)) -> 42.77 | R23: =SUM(R7:R22) -> 335452000 | S23: =IF(E23=0,0,((E23/R23)*100)-100) -> -3.69 | T23: =IF(E23=0,0,(E23/$E$33)*100) -> 53.05 | V23: 17.46 | W23: 12.56
A25: 9 | B25: Londrina | D25: 30595000 | E25: 29070629 | F25: 456056 | H25: 26825293 | I25: 24151348 | J25: 24292974 | L25: =IF(D25=0,0,((E25/D25)*100)-100) -> -4.98 | M25: =IF(E25=0,0,IF(F25=0,0,((E25/F25)*100)-100)) -> 6274.36 | N25: =IF(H25=0,0,((E25/H25)*100)-100) -> 8.37 | O25: =IF(I25=0,0,((E25/I25)*100)-100) -> 20.37 | P25: =IF(E25=0,0,IF(J25=0,0,((E25/J25)*100)-100)) -> 19.67 | R25: 30595000 | S25: =IF(E25=0,0,IF(R25=0,0,((E25/R25)*100)-100)) -> -4.98 | T25: =IF(E25=0,0,(E25/$E$33)*100) -> 4.77 | V25: 18 | W25: 11.61
A26: 14 | B26: S.J. Pinhais | D26: 54160000 | E26: 52670502 | F26: 800912 | H26: 48776629 | I26: 40508428 | J26: 33786782 | L26: =IF(D26=0,0,((E26/D26)*100)-100) -> -2.75 | M26: =IF(E26=0,0,IF(F26=0,0,((E26/F26)*100)-100)) -> 6476.32 | N26: =IF(H26=0,0,((E26/H26)*100)-100) -> 7.98 | O26: =IF(I26=0,0,((E26/I26)*100)-100) -> 30.02 | P26: =IF(E26=0,0,IF(J26=0,0,((E26/J26)*100)-100)) -> 55.89 | R26: 54160000 | S26: =IF(E26=0,0,IF(R26=0,0,((E26/R26)*100)-100)) -> -2.75 | T26: =IF(E26=0,0,(E26/$E$33)*100) -> 8.65 | V26: 16.7 | W26: 13.34
A27: 19 | B27: P.G. Nova | D27: 42047000 | E27: 41338628 | F27: 716354 | H27: 36077051 | I27: 32615048 | J27: 28021642 | L27: =IF(D27=0,0,((E27/D27)*100)-100) -> -1.68 | M27: =IF(E27=0,0,IF(F27=0,0,((E27/F27)*100)-100)) -> 5670.7 | N27: =IF(H27=0,0,((E27/H27)*100)-100) -> 14.58 | O27: =IF(I27=0,0,((E27/I27)*100)-100) -> 26.75 | P27: =IF(E27=0,0,IF(J27=0,0,((E27/J27)*100)-100)) -> 47.52 | R27: 42047000 | S27: =IF(E27=0,0,IF(R27=0,0,((E27/R27)*100)-100)) -> -1.68 | T27: =IF(E27=0,0,(E27/$E$33)*100) -> 6.79 | V27: 16 | W27: 13.31
A28: 21 | B28: Nilo Pecanha | D28: 106202000 | E28: 101360383 | F28: 1454692 | H28: 98179715 | I28: 61857574 | J28: 0 | L28: =IF(D28=0,0,((E28/D28)*100)-100) -> -4.56 | M28: =IF(E28=0,0,IF(F28=0,0,((E28/F28)*100)-100)) -> 6867.82 | N28: =IF(H28=0,0,((E28/H28)*100)-100) -> 3.24 | O28: =IF(I28=0,0,((E28/I28)*100)-100) -> 63.86 | P28: =IF(E28=0,0,IF(J28=0,0,((E28/J28)*100)-100)) -> 0 | R28: 106202000 | S28: =IF(E28=0,0,IF(R28=0,0,((E28/R28)*100)-100)) -> -4.56 | T28: =IF(E28=0,0,(E28/$E$33)*100) -> 16.64 | V28: 15.79 | W28: 13.58
A29: 22 | B29: Champagnat | D29: 54409955 | E29: 50217909 | F29: 947008 | H29: 0 | I29: 0 | J29: 0 | L29: =IF(D29=0,0,((E29/D29)*100)-100) -> -7.7 | M29: =IF(E29=0,0,IF(F29=0,0,((E29/F29)*100)-100)) -> 5202.8 | N29: =IF(H29=0,0,((E29/H29)*100)-100) -> 0 | O29: =IF(I29=0,0,((E29/I29)*100)-100) -> 0 | P29: =IF(E29=0,0,IF(J29=0,0,((E29/J29)*100)-100)) -> 0 | R29: 54446289 | S29: =IF(E29=0,0,IF(R29=0,0,((E29/R29)*100)-100)) -> -7.77 | T29: =IF(E29=0,0,(E29/$E$33)*100) -> 8.25 | V29: 16.2 | W29: 14.78
A30: 24 | B30: Santa Candida | D30: 11897636 | E30: 11330328 | F30: 1030690 | H30: 0 | I30: 0 | J30: 0 | L30: =IF(D30=0,0,((E30/D30)*100)-100) -> -4.77 | M30: =IF(E30=0,0,IF(F30=0,0,((E30/F30)*100)-100)) -> 999.3 | N30: =IF(H30=0,0,((E30/H30)*100)-100) -> 0 | O30: =IF(I30=0,0,((E30/I30)*100)-100) -> 0 | P30: =IF(E30=0,0,IF(J30=0,0,((E30/J30)*100)-100)) -> 0 | R30: 7500000 | S30: =IF(E30=0,0,IF(R30=0,0,((E30/R30)*100)-100)) -> 51.07 | T30: =IF(E30=0,0,(E30/$E$33)*100) -> 1.86 | V30: 14.6 | W30: 10.95
B31: Total Hiper | D31: =SUM(D25:D30) -> 299311591 | E31: =SUM(E25:E30) -> 285988379 | F31: =SUM(F25:F30) -> 5405712 | H31: =SUM(H25:H30) -> 209858688 | I31: =SUM(I25:I30) -> 159132398 | J31: =SUM(J25:J30) -> 86101398 | K31: =SUM(D31:J31) -> 1045798166 | L31: =IF(E31=0,0,((E31/D31)*100)-100) -> -4.45 | M31: =IF(E31=0,0,IF(F31=0,0,((E31/F31)*100)-100)) -> 5190.48 | N31: =IF(H31=0,0,IF(E31=0,0,((E31/H31)*100)-100)) -> 36.28 | O31: =IF(I31=0,0,IF(E31=0,0,((E31/I31)*100)-100)) -> 79.72 | P31: =IF(E31=0,0,IF(J31=0,0,((E31/J31)*100)-100)) -> 232.15 | R31: =SUM(R25:R30) -> 294950289 | S31: =IF(E31=0,0,((E31/R31)*100)-100) -> -3.04 | T31: =IF(E31=0,0,(E31/$E$33)*100) -> 46.95 | V31: 16.01 | W31: 13.12
B33: Total Geral | D33: =D23+D31 -> 634763591 | E33: =E23+E31 -> 609069859 | F33: =F23+F31 -> 10671589 | H33: =H23+H31 -> 510946413 | I33: =I23+I31 -> 403575156 | J33: =J23+J31 -> 312403347 | L33: =IF(E31=0,0,((E33/D33)*100)-100) -> -4.05 | M33: =IF(E33=0,0,IF(F33=0,0,((E33/F33)*100)-100)) -> 5607.4 | N33: =IF(H33=0,0,IF(E33=0,0,((E33/H33)*100)-100)) -> 19.2 | O33: =IF(I33=0,0,IF(E33=0,0,((E33/I33)*100)-100)) -> 50.92 | P33: =IF(E33=0,0,IF(J33=0,0,((E33/J33)*100)-100)) -> 94.96 | R33: =R23+R31 -> 630402289 | S33: =IF(E33=0,0,((E33/R33)*100)-100) -> -3.38 | T33: =T23+T31 -> 100 | V33: 16.94 | W33: 12.84
D34: Resumo por Regiao - Outubro/2002