A3: Periodo: | B3: 40269 | C3: a | D3: 04/04/2010
A5: v.1 | B5: Vendas 2010 | E5: Margem
A6: Lojas | B6: Previsao | C6: Realizada | D6: Mes Anterior | E6: Meta | F6: Coml | G6: Dif
A8: S. Felicidade | B8: 520000 | C8: 621599 | D8: 353157 | E8: 17 | F8: 15.37 | G8: =F8-E8 -> -1.63
A9: Lapa | B9: 470000 | C9: 512530 | D9: 335406 | E9: 16.3 | F9: 15.62 | G9: =F9-E9 -> -0.68
A10: Araucaria | B10: 219000 | C10: 283315 | D10: 215501 | E10: 17.45 | F10: 15.78 | G10: =F10-E10 -> -1.67
A11: Hauer | B11: 569000 | C11: 706438 | D11: 487217 | E11: 16.4 | F11: 15.13 | G11: =F11-E11 -> -1.27
A12: Paranagua | B12: 510000 | C12: 898533 | D12: 341781 | E12: 17.95 | F12: 15.61 | G12: =F12-E12 -> -2.34
A13: Centenario | B13: 218000 | C13: 271788 | D13: 176624 | E13: 17.25 | F13: 14.51 | G13: =F13-E13 -> -2.74
A14: Sitio Cercado | B14: 445000 | C14: 531832 | D14: 287537 | E14: 16.29 | F14: 12.46 | G14: =F14-E14 -> -3.83
A15: Apucarana | B15: 450000 | C15: 502371 | D15: 350820 | E15: 17 | F15: 14.49 | G15: =F15-E15 -> -2.51
A16: Ahú | B16: 245000 | C16: 359641 | D16: 230991 | E16: 17.4 | F16: 15.04 | G16: =F16-E16 -> -2.36
A17: P.G. Centro | B17: 375000 | C17: 386687 | D17: 329326 | E17: 18.95 | F17: 14.73 | G17: =F17-E17 -> -4.22
A18: Maringa | B18: 445000 | C18: 470913 | D18: 457492 | E18: 18.8 | F18: 15.05 | G18: =F18-E18 -> -3.75
A19: Araucaria Nova | B19: 825000 | C19: 804509 | D19: 462940 | E19: 16.1 | F19: 14.75 | G19: =F19-E19 -> -1.35
A20: Cristo Rei | B20: 350000 | C20: 385916 | D20: 299122 | E20: 18.3 | F20: 15.56 | G20: =F20-E20 -> -2.74
A21: Campo Largo | B21: 670000 | C21: 784032 | D21: 408129 | E21: 16.4 | F21: 15.49 | G21: =F21-E21 -> -0.91
A22: Brasilia | B22: 535000 | C22: 528623 | D22: 288931 | E22: 16.73 | F22: 14.68 | G22: =F22-E22 -> -2.05
A23: Total Super | B23: =SUM(B8:B22) -> 6846000 | C23: =SUM(C8:C22) -> 8048727 | D23: =SUM(D8:D22) -> 5024974 | E23: 17.14 | F23: 14.98 | G23: =F23-E23 -> -2.16
A25: Pinheirinho | B25: 1027000 | C25: 1035173 | D25: 619212 | E25: 16.3 | F25: 13.66 | G25: =F25-E25 -> -2.64
A26: Londrina | B26: 480000 | C26: 647862 | D26: 427996 | E26: 16.98 | F26: 14.13 | G26: =F26-E26 -> -2.85
A27: Sao Braz | B27: 990000 | C27: 1007815 | D27: 601956 | E27: 16.1 | F27: 14.61 | G27: =F27-E27 -> -1.49
A28: SJ_Pinhais | B28: 920000 | C28: 1083945 | D28: 741271 | E28: 15.67 | F28: 13.43 | G28: =F28-E28 -> -2.24
A29: PG_Nova | B29: 910000 | C29: 1014795 | D29: 635132 | E29: 16.5 | F29: 14.98 | G29: =F29-E29 -> -1.52
A30: Nilo_Pecanha | B30: 2190000 | C30: 2239161 | D30: 1579703 | E30: 16.4 | F30: 14.84 | G30: =F30-E30 -> -1.56
A31: Champagnat | B31: 1011700 | C31: 1106745 | D31: 829558 | E31: 16.65 | F31: 15.22 | G31: =F31-E31 -> -1.43
A32: Santa_Candida | B32: 1200000 | C32: 1379334 | D32: 783515 | E32: 15.87 | F32: 14.22 | G32: =F32-E32 -> -1.65
A33: Paranagua_Raia | B33: 0 | C33: 0 | D33: 915010 | E33: 17.9 | F33: 0 | G33: =F33-E33 -> -17.9
A34: Total Hiper | B34: =SUM(B25:B33) -> 8728700 | C34: =SUM(C25:C33) -> 9514830 | D34: =SUM(D25:D33) -> 7133353 | E34: 16.22 | F34: 14.42 | G34: =F34-E34 -> -1.8
A36: Total s/ 27, 32 | B36: =B23+B34 -> 15574700 | C36: =C23+C34 -> 17563557 | D36: =D23+D34 -> 12158327 | E36: 16.61 | F36: 14.66 | G36: =F36-E36 -> -1.95
A38: Campo Largo | B38: 0 | C38: 0 | D38: 740919 | E38: 0 | F38: 0 | G38: =F38-E38 -> 0
A39: Uvaranas | B39: 813000 | C39: 1006558 | D39: 537790 | E39: 16 | F39: 15.06 | G39: =F39-E39 -> -0.94
A40: Novo Mundo | B40: =C40 -> 1110987 | C40: 1110987 | D40: 591447 | E40: 15.5 | F40: 14.78 | G40: =F40-E40 -> -0.72
A41: Torres | B41: 1020000 | C41: 1121686 | D41: 541594 | E41: 15.6 | F41: 14.2 | G41: =F41-E41 -> -1.4
A42: Total Lojas Novas | B42: =SUM(B38:B41) -> 2943987 | C42: =SUM(C38:C41) -> 3239231 | D42: =SUM(D38:D41) -> 2411750 | E42: =E41 -> 15.6 | F42: =F41 -> 14.2 | G42: =F42-E42 -> -1.4
A44: Total Geral | B44: =B23+B34+B42 -> 18518687 | C44: =C23+C34+C42 -> 20802788 | D44: =D23+D34+D42 -> 14570077 | E44: 16.52 | F44: 14.69 | G44: =F44-E44 -> -1.83
B45: Resumo por Regiao - Outubro/2002