A2: Periodo: | C2: 38777 | D2: a | E2: 38807 | H2: Vendas Acumuladas por Filial | Q2: =NOW() -> 38817.591011689801
A4: v.1 | C4: Vendas 2006 | G4: Vendas de Anos Anteriores | K4: Percentuais ( % ) | Q4: Meta Mensal | U4: Margem
A5: Lojas | C5: Previsao | D5: Realizada | E5: Mes Anterior | G5: Vendas 2005 | H5: Vendas 2004 | I5: Vendas 2003 | K5: % Prev | L5: % MA | M5: 2005 | N5: 2004 | O5: 2003 | Q5: Previsao Mes | R5: Final | S5: Part. | U5: Meta | V5: Condor
A7: Xaxim | C7: 791081 | D7: 707279 | E7: 673502 | G7: 858818 | H7: 726814 | I7: 669625 | K7: =IF(C7=0,0,((D7/C7)*100)-100) -> -10.59 | L7: =IF(D7=0,0,IF(E7=0,0,((D7/E7)*100)-100)) -> 5.02 | M7: =IF(G7=0,0,((D7/G7)*100)-100) -> -17.65 | N7: =IF(H7=0,0,((D7/H7)*100)-100) -> -2.69 | O7: =IF(D7=0,0,IF(I7=0,0,((D7/I7)*100)-100)) -> 5.62 | Q7: 791081 | R7: =IF(D7=0,0,((D7/Q7)*100)-100) -> -10.59 | S7: =IF(D7=0,0,(D7/$D$35)*100) -> 1.2 | U7: 16.4 | V7: 15.94
A8: S. Felicidade | C8: 800000 | D8: 783784 | E8: 706305 | G8: 793065 | H8: 662420 | I8: 714359 | K8: =IF(C8=0,0,((D8/C8)*100)-100) -> -2.03 | L8: =IF(D8=0,0,IF(E8=0,0,((D8/E8)*100)-100)) -> 10.97 | M8: =IF(G8=0,0,((D8/G8)*100)-100) -> -1.17 | N8: =IF(H8=0,0,((D8/H8)*100)-100) -> 18.32 | O8: =IF(D8=0,0,IF(I8=0,0,((D8/I8)*100)-100)) -> 9.72 | Q8: 800000 | R8: =IF(D8=0,0,((D8/Q8)*100)-100) -> -2.03 | S8: =IF(D8=0,0,(D8/$D$35)*100) -> 1.33 | U8: 16.5 | V8: 16.4
A9: Lapa | C9: 1240000 | D9: 1338989 | E9: 1173718 | G9: 1308588 | H9: 1087978 | I9: 1012412 | K9: =IF(C9=0,0,((D9/C9)*100)-100) -> 7.98 | L9: =IF(D9=0,0,IF(E9=0,0,((D9/E9)*100)-100)) -> 14.08 | M9: =IF(G9=0,0,((D9/G9)*100)-100) -> 2.32 | N9: =IF(H9=0,0,((D9/H9)*100)-100) -> 23.07 | O9: =IF(D9=0,0,IF(I9=0,0,((D9/I9)*100)-100)) -> 32.26 | Q9: 1240000 | R9: =IF(D9=0,0,((D9/Q9)*100)-100) -> 7.98 | S9: =IF(D9=0,0,(D9/$D$35)*100) -> 2.28 | U9: 16.25 | V9: 15.54
A10: Araucaria | C10: 1055000 | D10: 1014386 | E10: 921061 | G10: 1118579 | H10: 955077 | I10: 1086755 | K10: =IF(C10=0,0,((D10/C10)*100)-100) -> -3.85 | L10: =IF(D10=0,0,IF(E10=0,0,((D10/E10)*100)-100)) -> 10.13 | M10: =IF(G10=0,0,((D10/G10)*100)-100) -> -9.31 | N10: =IF(H10=0,0,((D10/H10)*100)-100) -> 6.21 | O10: =IF(D10=0,0,IF(I10=0,0,((D10/I10)*100)-100)) -> -6.66 | Q10: 1055000 | R10: =IF(D10=0,0,((D10/Q10)*100)-100) -> -3.85 | S10: =IF(D10=0,0,(D10/$D$35)*100) -> 1.73 | U10: 17.55 | V10: 17.18
A11: Pinheirinho | C11: 2100000 | D11: 1906209 | E11: 1776930 | G11: 2360409 | H11: 1878353 | I11: 1884252 | K11: =IF(C11=0,0,((D11/C11)*100)-100) -> -9.23 | L11: =IF(D11=0,0,IF(E11=0,0,((D11/E11)*100)-100)) -> 7.28 | M11: =IF(G11=0,0,((D11/G11)*100)-100) -> -19.24 | N11: =IF(H11=0,0,((D11/H11)*100)-100) -> 1.48 | O11: =IF(D11=0,0,IF(I11=0,0,((D11/I11)*100)-100)) -> 1.17 | Q11: 2100000 | R11: =IF(D11=0,0,((D11/Q11)*100)-100) -> -9.23 | S11: =IF(D11=0,0,(D11/$D$35)*100) -> 3.24 | U11: 16.8 | V11: 15.97
A12: Hauer | C12: 3260000 | D12: 3086552 | E12: 2898708 | G12: 3467208 | H12: 2747488 | I12: 2896663 | K12: =IF(C12=0,0,((D12/C12)*100)-100) -> -5.32 | L12: =IF(D12=0,0,IF(E12=0,0,((D12/E12)*100)-100)) -> 6.48 | M12: =IF(G12=0,0,((D12/G12)*100)-100) -> -10.98 | N12: =IF(H12=0,0,((D12/H12)*100)-100) -> 12.34 | O12: =IF(D12=0,0,IF(I12=0,0,((D12/I12)*100)-100)) -> 6.56 | Q12: 3260000 | R12: =IF(D12=0,0,((D12/Q12)*100)-100) -> -5.32 | S12: =IF(D12=0,0,(D12/$D$35)*100) -> 5.25 | U12: 16.96 | V12: 16.45
A13: Paranagua | C13: 1750000 | D13: 1563844 | E13: 1446960 | G13: 2140908 | H13: 3201285 | I13: 3046003 | K13: =IF(C13=0,0,((D13/C13)*100)-100) -> -10.64 | L13: =IF(D13=0,0,IF(E13=0,0,((D13/E13)*100)-100)) -> 8.08 | M13: =IF(G13=0,0,((D13/G13)*100)-100) -> -26.95 | N13: =IF(H13=0,0,((D13/H13)*100)-100) -> -51.15 | O13: =IF(D13=0,0,IF(I13=0,0,((D13/I13)*100)-100)) -> -48.66 | Q13: 1750000 | R13: =IF(D13=0,0,((D13/Q13)*100)-100) -> -10.64 | S13: =IF(D13=0,0,(D13/$D$35)*100) -> 2.66 | U13: 17.4 | V13: 17.68
A14: Centenario | C14: 996000 | D14: 926040 | E14: 853919 | G14: 1047816 | H14: 846451 | I14: 878606 | K14: =IF(C14=0,0,((D14/C14)*100)-100) -> -7.02 | L14: =IF(D14=0,0,IF(E14=0,0,((D14/E14)*100)-100)) -> 8.45 | M14: =IF(G14=0,0,((D14/G14)*100)-100) -> -11.62 | N14: =IF(H14=0,0,((D14/H14)*100)-100) -> 9.4 | O14: =IF(D14=0,0,IF(I14=0,0,((D14/I14)*100)-100)) -> 5.4 | Q14: 996000 | R14: =IF(D14=0,0,((D14/Q14)*100)-100) -> -7.02 | S14: =IF(D14=0,0,(D14/$D$35)*100) -> 1.58 | U14: 16.6 | V14: 16.22
A15: Arapongas | C15: 0 | D15: 0 | E15: 0 | G15: 0 | H15: 0 | I15: 0 | K15: =IF(C15=0,0,((D15/C15)*100)-100) -> 0 | L15: =IF(D15=0,0,IF(E15=0,0,((D15/E15)*100)-100)) -> 0 | M15: =IF(D15=0,0,IF(G15=0,0,((D15/G15)*100)-100)) -> 0 | N15: =IF(D15=0,0,IF(H15=0,0,((D15/H15)*100)-100)) -> 0 | O15: =IF(D15=0,0,IF(I15=0,0,((D15/I15)*100)-100)) -> 0 | Q15: 0 | R15: =IF(D15=0,0,((D15/Q15)*100)-100) -> 0 | S15: =IF(D15=0,0,(D15/$D$35)*100) -> 0 | U15: 0 | V15: 0
A16: Sao Braz | C16: 3275000 | D16: 3107877 | E16: 2919802 | G16: 3450181 | H16: 2909061 | I16: 3063453 | K16: =IF(C16=0,0,((D16/C16)*100)-100) -> -5.1 | L16: =IF(D16=0,0,IF(E16=0,0,((D16/E16)*100)-100)) -> 6.44 | M16: =IF(G16=0,0,((D16/G16)*100)-100) -> -9.92 | N16: =IF(H16=0,0,((D16/H16)*100)-100) -> 6.83 | O16: =IF(D16=0,0,IF(I16=0,0,((D16/I16)*100)-100)) -> 1.45 | Q16: 3275000 | R16: =IF(D16=0,0,((D16/Q16)*100)-100) -> -5.1 | S16: =IF(D16=0,0,(D16/$D$35)*100) -> 5.29 | U16: 16.84 | V16: 15.85
A17: Sitio Cercado | C17: 1400000 | D17: 1246945 | E17: 1216792 | G17: 2117345 | H17: 1548924 | I17: 1333408 | K17: =IF(C17=0,0,((D17/C17)*100)-100) -> -10.93 | L17: =IF(D17=0,0,IF(E17=0,0,((D17/E17)*100)-100)) -> 2.48 | M17: =IF(G17=0,0,((D17/G17)*100)-100) -> -41.11 | N17: =IF(H17=0,0,((D17/H17)*100)-100) -> -19.5 | O17: =IF(D17=0,0,IF(I17=0,0,((D17/I17)*100)-100)) -> -6.48 | Q17: 1400000 | R17: =IF(D17=0,0,((D17/Q17)*100)-100) -> -10.93 | S17: =IF(D17=0,0,(D17/$D$35)*100) -> 2.12 | U17: 16.9 | V17: 16.77
A18: Apucarana | C18: 1800000 | D18: 1957014 | E18: 1817653 | G18: 1987495 | H18: 1473884 | I18: 1395490 | K18: =IF(C18=0,0,((D18/C18)*100)-100) -> 8.72 | L18: =IF(D18=0,0,IF(E18=0,0,((D18/E18)*100)-100)) -> 7.67 | M18: =IF(G18=0,0,((D18/G18)*100)-100) -> -1.53 | N18: =IF(H18=0,0,((D18/H18)*100)-100) -> 32.78 | O18: =IF(D18=0,0,IF(I18=0,0,((D18/I18)*100)-100)) -> 40.24 | Q18: 1800000 | R18: =IF(D18=0,0,((D18/Q18)*100)-100) -> 8.72 | S18: =IF(D18=0,0,(D18/$D$35)*100) -> 3.33 | U18: 15.4 | V18: 14.73
A19: Ahu | C19: 1195000 | D19: 1142814 | E19: 1047721 | G19: 1155295 | H19: 1068945 | I19: 1235424 | K19: =IF(C19=0,0,((D19/C19)*100)-100) -> -4.37 | L19: =IF(D19=0,0,IF(E19=0,0,((D19/E19)*100)-100)) -> 9.08 | M19: =IF(G19=0,0,((D19/G19)*100)-100) -> -1.08 | N19: =IF(H19=0,0,((D19/H19)*100)-100) -> 6.91 | O19: =IF(D19=0,0,IF(I19=0,0,((D19/I19)*100)-100)) -> -7.5 | Q19: 1195000 | R19: =IF(D19=0,0,((D19/Q19)*100)-100) -> -4.37 | S19: =IF(D19=0,0,(D19/$D$35)*100) -> 1.94 | U19: 17.15 | V19: 16.53
A20: P.G. Centro | C20: 1850000 | D20: 1669633 | E20: 1496126 | G20: 1891893 | H20: 1688433 | I20: 1566980 | K20: =IF(C20=0,0,((D20/C20)*100)-100) -> -9.75 | L20: =IF(D20=0,0,IF(E20=0,0,((D20/E20)*100)-100)) -> 11.6 | M20: =IF(G20=0,0,((D20/G20)*100)-100) -> -11.75 | N20: =IF(H20=0,0,((D20/H20)*100)-100) -> -1.11 | O20: =IF(D20=0,0,IF(I20=0,0,((D20/I20)*100)-100)) -> 6.55 | Q20: 1850000 | R20: =IF(D20=0,0,((D20/Q20)*100)-100) -> -9.75 | S20: =IF(D20=0,0,(D20/$D$35)*100) -> 2.84 | U20: 17.98 | V20: 17.37
A21: Maringa | C21: 2440000 | D21: 2569506 | E21: 2111535 | G21: 2681869 | H21: 2096430 | I21: 2075741 | K21: =IF(C21=0,0,((D21/C21)*100)-100) -> 5.31 | L21: =IF(D21=0,0,IF(E21=0,0,((D21/E21)*100)-100)) -> 21.69 | M21: =IF(G21=0,0,((D21/G21)*100)-100) -> -4.19 | N21: =IF(H21=0,0,((D21/H21)*100)-100) -> 22.57 | O21: =IF(D21=0,0,IF(I21=0,0,((D21/I21)*100)-100)) -> 23.79 | Q21: 2440000 | R21: =IF(D21=0,0,((D21/Q21)*100)-100) -> 5.31 | S21: =IF(D21=0,0,(D21/$D$35)*100) -> 4.37 | U21: 18 | V21: 16.73
A22: Araucaria Nova | C22: 2290000 | D22: 2040588 | E22: 1968842 | G22: 2366594 | H22: 1932605 | I22: 2057036 | K22: =IF(C22=0,0,((D22/C22)*100)-100) -> -10.89 | L22: =IF(D22=0,0,IF(E22=0,0,((D22/E22)*100)-100)) -> 3.64 | M22: =IF(G22=0,0,((D22/G22)*100)-100) -> -13.78 | N22: =IF(H22=0,0,((D22/H22)*100)-100) -> 5.59 | O22: =IF(D22=0,0,IF(I22=0,0,((D22/I22)*100)-100)) -> -0.8 | Q22: 2290000 | R22: =IF(D22=0,0,((D22/Q22)*100)-100) -> -10.89 | S22: =IF(D22=0,0,(D22/$D$35)*100) -> 3.47 | U22: 17.5 | V22: 17.28
A23: Sitio Cercado | C23: 0 | D23: 0 | E23: 0 | G23: 0 | H23: 0 | I23: 0 | K23: =IF(C23=0,0,((D23/C23)*100)-100) -> 0 | L23: =IF(D23=0,0,IF(E23=0,0,((D23/E23)*100)-100)) -> 0 | M23: =IF(G23=0,0,((D23/G23)*100)-100) -> 0 | N23: =IF(H23=0,0,((D23/H23)*100)-100) -> 0 | O23: =IF(D23=0,0,IF(I23=0,0,((D23/I23)*100)-100)) -> 0 | Q23: 0 | R23: =IF(Q23=0,0,IF(D23=0,0,((D23/Q23)*100)-100)) -> 0 | S23: =IF(D23=0,0,(D23/$D$35)*100) -> 0 | U23: 0 | V23: 0
A24: Total Super | C24: =SUM(C7:C23) -> 26242081 | D24: =SUM(D7:D23) -> 25061460 | E24: =SUM(E7:E23) -> 23029574 | G24: =SUM(G7:G23) -> 28746063 | H24: =SUM(H7:H23) -> 24824148 | I24: =SUM(I7:I23) -> 24916207 | J24: =SUM(C24:I24) -> 152819533 | K24: =IF(D24=0,0,((D24/C24)*100)-100) -> -4.5 | L24: =IF(D24=0,0,IF(E24=0,0,((D24/E24)*100)-100)) -> 8.82 | M24: =IF(G24=0,0,IF(D24=0,0,((D24/G24)*100)-100)) -> -12.82 | N24: =IF(H24=0,0,IF(D24=0,0,((D24/H24)*100)-100)) -> 0.96 | O24: =IF(D24=0,0,IF(I24=0,0,((D24/I24)*100)-100)) -> 0.58 | Q24: =SUM(Q7:Q23) -> 26242081 | R24: =IF(D24=0,0,((D24/Q24)*100)-100) -> -4.5 | S24: =IF(D24=0,0,(D24/$D$35)*100) -> 42.64 | U24: 17.02 | V24: 16.41
A26: Londrina | C26: 2900000 | D26: 2826318 | E26: 2735504 | G26: 2967264 | H26: 2125125 | I26: 2176502 | K26: =IF(C26=0,0,((D26/C26)*100)-100) -> -2.54 | L26: =IF(D26=0,0,IF(E26=0,0,((D26/E26)*100)-100)) -> 3.32 | M26: =IF(G26=0,0,((D26/G26)*100)-100) -> -4.75 | N26: =IF(H26=0,0,((D26/H26)*100)-100) -> 33 | O26: =IF(D26=0,0,IF(I26=0,0,((D26/I26)*100)-100)) -> 29.86 | Q26: 2900000 | R26: =IF(D26=0,0,IF(Q26=0,0,((D26/Q26)*100)-100)) -> -2.54 | S26: =IF(D26=0,0,(D26/$D$35)*100) -> 4.81 | U26: 15.7 | V26: 14.1
A27: S.J. Pinhais | C27: 3990000 | D27: 4000323 | E27: 3814272 | G27: 4961922 | H27: 3967363 | I27: 4062990 | K27: =IF(C27=0,0,((D27/C27)*100)-100) -> 0.26 | L27: =IF(D27=0,0,IF(E27=0,0,((D27/E27)*100)-100)) -> 4.88 | M27: =IF(G27=0,0,((D27/G27)*100)-100) -> -19.38 | N27: =IF(H27=0,0,((D27/H27)*100)-100) -> 0.83 | O27: =IF(D27=0,0,IF(I27=0,0,((D27/I27)*100)-100)) -> -1.54 | Q27: 3990000 | R27: =IF(D27=0,0,IF(Q27=0,0,((D27/Q27)*100)-100)) -> 0.26 | S27: =IF(D27=0,0,(D27/$D$35)*100) -> 6.81 | U27: 16.1 | V27: 15.57
A28: P.G. Nova | C28: 3775000 | D28: 3624033 | E28: 3321449 | G28: 3807048 | H28: 3046593 | I28: 3017129 | K28: =IF(C28=0,0,((D28/C28)*100)-100) -> -4 | L28: =IF(D28=0,0,IF(E28=0,0,((D28/E28)*100)-100)) -> 9.11 | M28: =IF(G28=0,0,((D28/G28)*100)-100) -> -4.81 | N28: =IF(H28=0,0,((D28/H28)*100)-100) -> 18.95 | O28: =IF(D28=0,0,IF(I28=0,0,((D28/I28)*100)-100)) -> 20.12 | Q28: 3775000 | R28: =IF(D28=0,0,IF(Q28=0,0,((D28/Q28)*100)-100)) -> -4 | S28: =IF(D28=0,0,(D28/$D$35)*100) -> 6.17 | U28: 16.4 | V28: 15.77
A29: Nilo Pecanha | C29: 9238000 | D29: 9111719 | E29: 8314379 | G29: 9128123 | H29: 8101747 | I29: 8022240 | K29: =IF(C29=0,0,((D29/C29)*100)-100) -> -1.37 | L29: =IF(D29=0,0,IF(E29=0,0,((D29/E29)*100)-100)) -> 9.59 | M29: =IF(G29=0,0,((D29/G29)*100)-100) -> -0.18 | N29: =IF(H29=0,0,((D29/H29)*100)-100) -> 12.47 | O29: =IF(D29=0,0,IF(I29=0,0,((D29/I29)*100)-100)) -> 13.58 | Q29: 9238000 | R29: =IF(D29=0,0,IF(Q29=0,0,((D29/Q29)*100)-100)) -> -1.37 | S29: =IF(D29=0,0,(D29/$D$35)*100) -> 15.5 | U29: 16.2 | V29: 15.72
A30: Champagnat | C30: 5900000 | D30: 5563419 | E30: 4965267 | G30: 5821017 | H30: 2359955 | I30: 0 | K30: =IF(C30=0,0,((D30/C30)*100)-100) -> -5.7 | L30: =IF(D30=0,0,IF(E30=0,0,((D30/E30)*100)-100)) -> 12.05 | M30: =IF(G30=0,0,((D30/G30)*100)-100) -> -4.43 | N30: =IF(H30=0,0,((D30/H30)*100)-100) -> 135.74 | O30: =IF(D30=0,0,IF(I30=0,0,((D30/I30)*100)-100)) -> 0 | Q30: 5900000 | R30: =IF(D30=0,0,IF(Q30=0,0,((D30/Q30)*100)-100)) -> -5.7 | S30: =IF(D30=0,0,(D30/$D$35)*100) -> 9.47 | U30: 16.4 | V30: 16.9
A31: Santa Candida | C31: 4911056 | D31: 4101942 | E31: 4087571 | G31: 4983764 | H31: 0 | I31: 0 | K31: =IF(C31=0,0,((D31/C31)*100)-100) -> -16.48 | L31: =IF(D31=0,0,IF(E31=0,0,((D31/E31)*100)-100)) -> 0.35 | M31: =IF(G31=0,0,((D31/G31)*100)-100) -> -17.69 | N31: =IF(H31=0,0,((D31/H31)*100)-100) -> 0 | O31: =IF(D31=0,0,IF(I31=0,0,((D31/I31)*100)-100)) -> 0 | Q31: 4911056 | R31: =IF(D31=0,0,IF(Q31=0,0,((D31/Q31)*100)-100)) -> -16.48 | S31: =IF(D31=0,0,(D31/$D$35)*100) -> 6.98 | U31: 16.3 | V31: 16.07
A32: Paranagu Raia | C32: 5090000 | D32: 4489234 | E32: 4259365 | G32: 4771309 | H32: 0 | I32: 0 | K32: =IF(C32=0,0,((D32/C32)*100)-100) -> -11.8 | L32: =IF(D32=0,0,IF(E32=0,0,((D32/E32)*100)-100)) -> 5.4 | M32: =IF(G32=0,0,((D32/G32)*100)-100) -> -5.91 | N32: =IF(H32=0,0,((D32/H32)*100)-100) -> 0 | O32: =IF(D32=0,0,IF(I32=0,0,((D32/I32)*100)-100)) -> 0 | Q32: 5090000 | R32: =IF(D32=0,0,IF(Q32=0,0,((D32/Q32)*100)-100)) -> -11.8 | S32: =IF(D32=0,0,(D32/$D$35)*100) -> 7.64 | U32: 16.3 | V32: 17.11
A33: Total Hiper | C33: =SUM(C26:C32) -> 35804056 | D33: =SUM(D26:D32) -> 33716988 | E33: =SUM(E26:E32) -> 31497807 | G33: =SUM(G26:G32) -> 36440447 | H33: =SUM(H26:H32) -> 19600783 | I33: =SUM(I26:I32) -> 17278861 | J33: =SUM(C33:I33) -> 174338942 | K33: =IF(D33=0,0,((D33/C33)*100)-100) -> -5.83 | L33: =IF(D33=0,0,IF(E33=0,0,((D33/E33)*100)-100)) -> 7.05 | M33: =IF(G33=0,0,IF(D33=0,0,((D33/G33)*100)-100)) -> -7.47 | N33: =IF(H33=0,0,IF(D33=0,0,((D33/H33)*100)-100)) -> 72.02 | O33: =IF(D33=0,0,IF(I33=0,0,((D33/I33)*100)-100)) -> 95.13 | Q33: =SUM(Q26:Q32) -> 35804056 | R33: =IF(D33=0,0,((D33/Q33)*100)-100) -> -5.83 | S33: =IF(D33=0,0,(D33/$D$35)*100) -> 57.36 | U33: 16.23 | V33: 15.99
A35: Total Geral | C35: =C24+C33 -> 62046137 | D35: =D24+D33 -> 58778448 | E35: =E24+E33 -> 54527381 | G35: =G24+G33 -> 65186510 | H35: =H24+H33 -> 44424931 | I35: =I24+I33 -> 42195068 | K35: =IF(D33=0,0,((D35/C35)*100)-100) -> -5.27 | L35: =IF(D35=0,0,IF(E35=0,0,((D35/E35)*100)-100)) -> 7.8 | M35: =IF(G35=0,0,IF(D35=0,0,((D35/G35)*100)-100)) -> -9.83 | N35: =IF(H35=0,0,IF(D35=0,0,((D35/H35)*100)-100)) -> 32.31 | O35: =IF(D35=0,0,IF(I35=0,0,((D35/I35)*100)-100)) -> 39.3 | Q35: =Q24+Q33 -> 62046137 | R35: =IF(D35=0,0,((D35/Q35)*100)-100) -> -5.27 | S35: =S24+S33 -> 100 | U35: 16.56 | V35: 16.17
C36: Resumo por Regiao - Outubro/2002
C37: Descricao das Aberturas | H37: Valor | I37: %
C38: Curitiba (2,3,6,7,10,11,17,21,22) | H38: =D7+D8+D11+D12+D14+D16+D19+D29+D30+D32 -> 30824927 | I38: =IF(D35=0,0,H38/$D$35) -> 0.52439999999999998
C39: Curitiba e Metrop. (Ctba. 4,5,8,14,23) | H39: =H38+D9+D10+D13+D28+D23 -> 38366179 | I39: =IF(D35=0,0,H39/$D$35) -> 0.65269999999999995
C40: Metropolitana (4,5,8,14,23) | H40: =H39-H38 -> 7541252 | I40: =IF(D35=0,0,H40/$D$35) -> 0.1283
C41: Norte (9,15,20) | H41: =D26+D18+D23 -> 4783332 | I41: =IF(D35=0,0,H41/$D$35) -> 8.14E-2
C42: Centro-Oeste (13,18,19) | H42: =D17+D20+D28 -> 6540611 | I42: =IF(D35=0,0,H42/$D$35) -> 0.1113
C43: Ponta Grossa (18,19) | H43: =H42-D17 -> 5293666 | I43: =IF(D35=0,0,H43/$D$35) -> 9.01E-2
C44: Super (2,3,4,5,6,7,8,10,11,13,15,17,18,20,23) | H44: =D24 -> 25061460 | I44: =IF(D35=0,0,H44/$D$35) -> 0.4264
C45: Hiper (9,14,19,21,22,24) | H45: =D33 -> 33716988 | I45: =IF(D35=0,0,H45/$D$35) -> 0.5736
C46: Curitiba, Metropolitana e Centro-Oeste | H46: =D35-H41 -> 53995116 | I46: =IF(D35=0,0,H46/$D$35) -> 0.91859999999999997
C47: Araucaria | H47: =D10+D23 -> 1014386 | I47: =IF(D35=0,0,H47/$D$35) -> 1.7299999999999999E-2