A2: Periodo: | B2: 40940 | C2: a | D2: 40968 | G2: Vendas Acumuladas por Filial | P2: =NOW() -> 40969.374804398147
A4: v.New | B4: Vendas 2012 | F4: Vendas de Anos Anteriores | J4: Percentuais ( % ) | P4: Meta Mensal | T4: Margem
A5: Lojas | B5: Previsao | C5: Realizada | D5: Mes Anterior | F5: Vendas 2011 | G5: Vendas 2010 | H5: Vendas 2009 | J5: % Prev | K5: % MA | L5: 2011 | M5: 2010 | N5: 2009 | P5: Previsao Mes | Q5: Final | R5: Part. | T5: Meta | U5: Coml | V5: Dif
A6: S. Felicidade | B6: 3650000 | C6: 3911190.07 | D6: 3740807.62 | F6: 3071982.1 | G6: 2884982.06 | H6: 2407705.32 | J6: =IF(B6=0,0,((C6/B6)*100)-100) -> 7.1558923287671234 | K6: =IF(C6=0,0,IF(D6=0,0,((C6/D6)*100)-100)) -> 4.5546969346688826 | L6: =IF(F6=0,0,((C6/F6)*100)-100) -> 27.318126951325652 | M6: =IF(G6=0,0,((C6/G6)*100)-100) -> 35.570689475968521 | N6: =IF(C6=0,0,IF(H6=0,0,((C6/H6)*100)-100)) -> 62.444716033604976 | P6: 3650000 | Q6: =IF(C6=0,0,((C6/P6)*100)-100) -> 7.1558923287671234 | R6: =IF(C6=0,0,(C6/$C$43)*100) -> 2.3828134466407396 | T6: 16.48 | U6: 17.165282893040278 | V6: =U6-T6 -> 0.68528289304027723
A7: Lapa | B7: 2500000 | C7: 2562600.74 | D7: 2424485.61 | F7: 2280257.61 | G7: 2348908.66 | H7: 2018977.76 | J7: =IF(B7=0,0,((C7/B7)*100)-100) -> 2.5040295999999955 | K7: =IF(C7=0,0,IF(D7=0,0,((C7/D7)*100)-100)) -> 5.6966776552656313 | L7: =IF(F7=0,0,((C7/F7)*100)-100) -> 12.382071602865977 | M7: =IF(G7=0,0,((C7/G7)*100)-100) -> 9.0975048812668575 | N7: =IF(C7=0,0,IF(H7=0,0,((C7/H7)*100)-100)) -> 26.925654693690149 | P7: 2500000 | Q7: =IF(C7=0,0,((C7/P7)*100)-100) -> 2.5040295999999955 | R7: =IF(C7=0,0,(C7/$C$43)*100) -> 1.5612126724497208 | T7: 15.6 | U7: 15.358620789284561 | V7: =U7-T7 -> -0.24137921071543822
A8: Araucaria | B8: 1550000 | C8: 1497509.96 | D8: 1533223.01 | F8: 1415296.14 | G8: 1286196.97 | H8: 1215689.31 | J8: =IF(B8=0,0,((C8/B8)*100)-100) -> -3.3864541935483885 | K8: =IF(C8=0,0,IF(D8=0,0,((C8/D8)*100)-100)) -> -2.3292795481852409 | L8: =IF(F8=0,0,((C8/F8)*100)-100) -> 5.8089482247863771 | M8: =IF(G8=0,0,((C8/G8)*100)-100) -> 16.429286876643772 | N8: =IF(C8=0,0,IF(H8=0,0,((C8/H8)*100)-100)) -> 23.181963325810599 | P8: 1550000 | Q8: =IF(C8=0,0,((C8/P8)*100)-100) -> -3.3864541935483885 | R8: =IF(C8=0,0,(C8/$C$43)*100) -> 0.91232765611067235 | T8: 17.817399999999999 | U8: 17.320035053389564 | V8: =U8-T8 -> -0.49736494661043551
A9: Hauer | B9: 4200000 | C9: 4411869.17 | D9: 4359148.94 | F9: 3685694.09 | G9: 3395139.6 | H9: 3312952.36 | J9: =IF(B9=0,0,((C9/B9)*100)-100) -> 5.0445040476190428 | K9: =IF(C9=0,0,IF(D9=0,0,((C9/D9)*100)-100)) -> 1.2094156617644671 | L9: =IF(F9=0,0,((C9/F9)*100)-100) -> 19.702532610350204 | M9: =IF(G9=0,0,((C9/G9)*100)-100) -> 29.946620457079263 | N9: =IF(C9=0,0,IF(H9=0,0,((C9/H9)*100)-100)) -> 33.170317305739957 | P9: 4200000 | Q9: =IF(C9=0,0,((C9/P9)*100)-100) -> 5.0445040476190428 | R9: =IF(C9=0,0,(C9/$C$43)*100) -> 2.6878420621209336 | T9: 17.0992 | U9: 16.447842899203653 | V9: =U9-T9 -> -0.65135710079634634
A10: Paranagua | B10: 2250000 | C10: 2380503.54 | D10: 2351921.99 | F10: 2127985.23 | G10: 2046448.94 | H10: 1767173.85 | J10: =IF(B10=0,0,((C10/B10)*100)-100) -> 5.8001573333333454 | K10: =IF(C10=0,0,IF(D10=0,0,((C10/D10)*100)-100)) -> 1.2152422623506993 | L10: =IF(F10=0,0,((C10/F10)*100)-100) -> 11.866544299275986 | M10: =IF(G10=0,0,((C10/G10)*100)-100) -> 16.323622518527145 | N10: =IF(C10=0,0,IF(H10=0,0,((C10/H10)*100)-100)) -> 34.706811104068777 | P10: 2250000 | Q10: =IF(C10=0,0,((C10/P10)*100)-100) -> 5.8001573333333454 | R10: =IF(C10=0,0,(C10/$C$43)*100) -> 1.4502736362510456 | T10: 17.48 | U10: 18.020996935799559 | V10: =U10-T10 -> 0.54099693579955854
A11: Sitio Cercado | B11: 3300000 | C11: 3365758.18 | D11: 3328544.13 | F11: 2824644.12 | G11: 2310759.96 | H11: 2019602.77 | J11: =IF(B11=0,0,((C11/B11)*100)-100) -> 1.9926721212121237 | K11: =IF(C11=0,0,IF(D11=0,0,((C11/D11)*100)-100)) -> 1.1180278387957117 | L11: =IF(F11=0,0,((C11/F11)*100)-100) -> 19.156893293870951 | M11: =IF(G11=0,0,((C11/G11)*100)-100) -> 45.655898417073161 | N11: =IF(C11=0,0,IF(H11=0,0,((C11/H11)*100)-100)) -> 66.654464432131874 | P11: 3300000 | Q11: =IF(C11=0,0,((C11/P11)*100)-100) -> 1.9926721212121237 | R11: =IF(C11=0,0,(C11/$C$43)*100) -> 2.0505200989746486 | T11: 15.887700000000001 | U11: 15.440535303103683 | V11: =U11-T11 -> -0.44716469689631744
A12: Apucarana | B12: 2599999 | C12: 2705640.2 | D12: 2628723.09 | F12: 2542866.67 | G12: 2591801.3 | H12: 2398096.53 | J12: =IF(B12=0,0,((C12/B12)*100)-100) -> 4.0631246396633429 | K12: =IF(C12=0,0,IF(D12=0,0,((C12/D12)*100)-100)) -> 2.9260255784492131 | L12: =IF(F12=0,0,((C12/F12)*100)-100) -> 6.4011822530986535 | M12: =IF(G12=0,0,((C12/G12)*100)-100) -> 4.3922695771470046 | N12: =IF(C12=0,0,IF(H12=0,0,((C12/H12)*100)-100)) -> 12.824490847330509 | P12: 2600000 | Q12: =IF(C12=0,0,((C12/P12)*100)-100) -> 4.063084615384625 | R12: =IF(C12=0,0,(C12/$C$43)*100) -> 1.6483565704930676 | T12: 16.103100000000001 | U12: 15.442592108145051 | V12: =U12-T12 -> -0.66050789185494985
A13: Ahú | B13: 2100000 | C13: 2247058.83 | D13: 2148341.56 | F13: 2019505.84 | G13: 1665083.31 | H13: 1487360.5 | J13: =IF(B13=0,0,((C13/B13)*100)-100) -> 7.0028014285714306 | K13: =IF(C13=0,0,IF(D13=0,0,((C13/D13)*100)-100)) -> 4.5950453986469455 | L13: =IF(F13=0,0,((C13/F13)*100)-100) -> 11.267755977373156 | M13: =IF(G13=0,0,((C13/G13)*100)-100) -> 34.951735838370752 | N13: =IF(C13=0,0,IF(H13=0,0,((C13/H13)*100)-100)) -> 51.076946711977342 | P13: 2100000 | Q13: =IF(C13=0,0,((C13/P13)*100)-100) -> 7.0028014285714306 | R13: =IF(C13=0,0,(C13/$C$43)*100) -> 1.3689751455921466 | T13: 17.232900000000001 | U13: 17.133015160088174 | V13: =U13-T13 -> -9.9884839911826617E-2
A14: P.G. Centro | B14: 2200000 | C14: 2250370.71 | D14: 2208161.35 | F14: 2006352.32 | G14: 1784432.19 | H14: 1897226.38 | J14: =IF(B14=0,0,((C14/B14)*100)-100) -> 2.2895777272727145 | K14: =IF(C14=0,0,IF(D14=0,0,((C14/D14)*100)-100)) -> 1.9115161127152334 | L14: =IF(F14=0,0,((C14/F14)*100)-100) -> 12.162290120610521 | M14: =IF(G14=0,0,((C14/G14)*100)-100) -> 26.111304347182852 | N14: =IF(C14=0,0,IF(H14=0,0,((C14/H14)*100)-100)) -> 18.613715986808074 | P14: 2200000 | Q14: =IF(C14=0,0,((C14/P14)*100)-100) -> 2.2895777272727145 | R14: =IF(C14=0,0,(C14/$C$43)*100) -> 1.3709928414996382 | T14: 18.6188 | U14: 17.854894671998288 | V14: =U14-T14 -> -0.76390532800171229
A15: Maringa | B15: 3599999 | C15: 3923344.29 | D15: 3664623.76 | F15: 3291429.84 | G15: 2747690.22 | H15: 2667294.46 | J15: =IF(B15=0,0,((C15/B15)*100)-100) -> 8.9818161060600374 | K15: =IF(C15=0,0,IF(D15=0,0,((C15/D15)*100)-100)) -> 7.0599479494724449 | L15: =IF(F15=0,0,((C15/F15)*100)-100) -> 19.198782314010998 | M15: =IF(G15=0,0,((C15/G15)*100)-100) -> 42.78699474353408 | N15: =IF(C15=0,0,IF(H15=0,0,((C15/H15)*100)-100)) -> 47.090782395281536 | P15: 3600000 | Q15: =IF(C15=0,0,((C15/P15)*100)-100) -> 8.9817858333333334 | R15: =IF(C15=0,0,(C15/$C$43)*100) -> 2.3902181593576111 | T15: 17.1754 | U15: 17.740193277811976 | V15: =U15-T15 -> 0.56479327781197597
A16: Centenario | B16: 0 | C16: 0 | D16: 0 | F16: 0 | G16: 1165567.53 | H16: 1145767.2 | J16: =IF(B16=0,0,((C16/B16)*100)-100) -> 0 | K16: =IF(C16=0,0,IF(D16=0,0,((C16/D16)*100)-100)) -> 0 | L16: =IF(F16=0,0,((C16/F16)*100)-100) -> 0 | M16: =IF(G16=0,0,((C16/G16)*100)-100) -> -100 | N16: =IF(C16=0,0,IF(H16=0,0,((C16/H16)*100)-100)) -> 0 | P16: 0 | Q16: =IF(C16=0,0,((C16/P16)*100)-100) -> 0 | R16: =IF(C16=0,0,(C16/$C$43)*100) -> 0 | T16: 0 | U16: 0 | V16: =U16-T16 -> 0
A17: Cristo Rei | B17: 2750000 | C17: 2896951.08 | D17: 2715623.46 | F17: 2446720.74 | G17: 2039129.7 | H17: 1657888.58 | J17: =IF(B17=0,0,((C17/B17)*100)-100) -> 5.343675636363642 | K17: =IF(C17=0,0,IF(D17=0,0,((C17/D17)*100)-100)) -> 6.6772003803502287 | L17: =IF(F17=0,0,((C17/F17)*100)-100) -> 18.401378328120927 | M17: =IF(G17=0,0,((C17/G17)*100)-100) -> 42.068014604465844 | N17: =IF(C17=0,0,IF(H17=0,0,((C17/H17)*100)-100)) -> 74.737380723136397 | P17: 2750000 | Q17: =IF(C17=0,0,((C17/P17)*100)-100) -> 5.343675636363642 | R17: =IF(C17=0,0,(C17/$C$43)*100) -> 1.7649088548858005 | T17: 17.619599999999998 | U17: 17.982786233311195 | V17: =U17-T17 -> 0.36318623331119682
A18: Fazenda | B18: 3800000 | C18: 3942511.24 | D18: 4026341.97 | F18: 2665615.13 | G18: 0 | H18: 0 | J18: =IF(B18=0,0,((C18/B18)*100)-100) -> 3.7502957894736966 | K18: =IF(C18=0,0,IF(D18=0,0,((C18/D18)*100)-100)) -> -2.0820568800319847 | L18: =IF(F18=0,0,((C18/F18)*100)-100) -> 47.902493335562667 | M18: =IF(G18=0,0,((C18/G18)*100)-100) -> 0 | N18: =IF(C18=0,0,IF(H18=0,0,((C18/H18)*100)-100)) -> 0 | P18: 3800000 | Q18: =IF(C18=0,0,((C18/P18)*100)-100) -> 3.7502957894736966 | R18: =IF(C18=0,0,(C18/$C$43)*100) -> 2.4018952359950783 | T18: 15.33 | U18: 15.545971912054712 | V18: =U18-T18 -> 0.21597191205471233
A19: Campo Largo | B19: 4300000 | C19: 4465932.29 | D19: 4362075.79 | F19: 3721124.66 | G19: 3438098.62 | H19: 2533789.23 | J19: =IF(B19=0,0,((C19/B19)*100)-100) -> 3.858890465116275 | K19: =IF(C19=0,0,IF(D19=0,0,((C19/D19)*100)-100)) -> 2.3808962750736526 | L19: =IF(F19=0,0,((C19/F19)*100)-100) -> 20.015659190520111 | M19: =IF(G19=0,0,((C19/G19)*100)-100) -> 29.895409748310243 | N19: =IF(C19=0,0,IF(H19=0,0,((C19/H19)*100)-100)) -> 76.255082195609447 | P19: 4300000 | Q19: =IF(C19=0,0,((C19/P19)*100)-100) -> 3.858890465116275 | R19: =IF(C19=0,0,(C19/$C$43)*100) -> 2.7207789245586502 | T19: 16.8658 | U19: 16.952882194279752 | V19: =U19-T19 -> 8.7082194279751945E-2
A20: Brasilia | B20: 3050000 | C20: 3245308.19 | D20: 3121893.47 | F20: 2661205.62 | G20: 2415370.43 | H20: 2228824.27 | J20: =IF(B20=0,0,((C20/B20)*100)-100) -> 6.4035472131147628 | K20: =IF(C20=0,0,IF(D20=0,0,((C20/D20)*100)-100)) -> 3.9532008758773998 | L20: =IF(F20=0,0,((C20/F20)*100)-100) -> 21.948795147967544 | M20: =IF(G20=0,0,((C20/G20)*100)-100) -> 34.360682307433876 | N20: =IF(C20=0,0,IF(H20=0,0,((C20/H20)*100)-100)) -> 45.606283711187331 | P20: 3050000 | Q20: =IF(C20=0,0,((C20/P20)*100)-100) -> 6.4035472131147628 | R20: =IF(C20=0,0,(C20/$C$43)*100) -> 1.9771383786585754 | T20: 16.287400000000002 | U20: 15.805730302612647 | V20: =U20-T20 -> -0.4816696973873551
A21: Cajuru | B21: 5400000 | C21: 5450430.7699999996 | D21: 5477206.3300000001 | F21: 4032632.03 | G21: 0 | H21: 0 | J21: =IF(B21=0,0,((C21/B21)*100)-100) -> 0.93390314814814701 | K21: =IF(C21=0,0,IF(D21=0,0,((C21/D21)*100)-100)) -> -0.48885432439060139 | L21: =IF(F21=0,0,((C21/F21)*100)-100) -> 35.158148064404458 | M21: =IF(G21=0,0,((C21/G21)*100)-100) -> 0 | N21: =IF(C21=0,0,IF(H21=0,0,((C21/H21)*100)-100)) -> 0 | P21: 5400000 | Q21: =IF(C21=0,0,((C21/P21)*100)-100) -> 0.93390314814814701 | R21: =IF(C21=0,0,(C21/$C$43)*100) -> 3.3205647120955284 | T21: 16.422899999999998 | U21: 15.666236046880384 | V21: =U21-T21 -> -0.75666395311961487
A22: Total Super | B22: =SUM(B6:B21) -> 47249998 | C22: =SUM(C6:C21) -> 49256979.25999999 | D22: =SUM(D6:D21) -> 48091122.079999998 | F22: =SUM(F6:F21) -> 40793312.140000001 | G22: =SUM(G6:G21) -> 32119609.490000002 | H22: =SUM(H6:H21) -> 28758348.519999996 | I22: =SUM(B22:H22) -> 246269369.48999995 | J22: =IF(C22=0,0,((C22/B22)*100)-100) -> 4.2475795660350997 | K22: =IF(C22=0,0,IF(D22=0,0,((C22/D22)*100)-100)) -> 2.4242669531822969 | L22: =IF(F22=0,0,IF(C22=0,0,((C22/F22)*100)-100)) -> 20.747683078425297 | M22: =IF(G22=0,0,IF(C22=0,0,((C22/G22)*100)-100)) -> 53.354850952766014 | N22: =IF(C22=0,0,IF(H22=0,0,((C22/H22)*100)-100)) -> 71.278886983876077 | P22: =SUM(P6:P21) -> 47250000 | Q22: =IF(C22=0,0,((C22/P22)*100)-100) -> 4.2475751534391435 | R22: =IF(C22=0,0,(C22/$C$43)*100) -> 30.00881839568385 | T22: 16.693884446757014 | U22: 16.560202741916989 | V22: =U22-T22 -> -0.13368170484002562
A23: Pinheirinho | B23: 5400000 | C23: 5020929.52 | D23: 5326775.56 | F23: 4585412.42 | G23: 4998766.79 | H23: 3991772.1 | J23: =IF(B23=0,0,((C23/B23)*100)-100) -> -7.0198237037037075 | K23: =IF(C23=0,0,IF(D23=0,0,((C23/D23)*100)-100)) -> -5.7416731107777395 | L23: =IF(F23=0,0,((C23/F23)*100)-100) -> 9.497882853468596 | M23: =IF(G23=0,0,((C23/G23)*100)-100) -> 0.44336395217187885 | N23: =IF(C23=0,0,IF(H23=0,0,((C23/H23)*100)-100)) -> 25.781968364376297 | P23: 5400000 | Q23: =IF(C23=0,0,IF(P23=0,0,((C23/P23)*100)-100)) -> -7.0198237037037075 | R23: =IF(C23=0,0,(C23/$C$43)*100) -> 3.0588997621615035 | T23: 16.31 | U23: 15.862336980185296 | V23: =U23-T23 -> -0.44766301981470313
A24: Londrina | B24: 5800000 | C24: 5434775.9500000002 | D24: 5835951.4500000002 | F24: 4163796.81 | G24: 3378368.85 | H24: 3120673.66 | J24: =IF(B24=0,0,((C24/B24)*100)-100) -> -6.2969663793103479 | K24: =IF(C24=0,0,IF(D24=0,0,((C24/D24)*100)-100)) -> -6.8742090032294527 | L24: =IF(F24=0,0,((C24/F24)*100)-100) -> 30.524523601813314 | M24: =IF(G24=0,0,((C24/G24)*100)-100) -> 60.869821837245524 | N24: =IF(C24=0,0,IF(H24=0,0,((C24/H24)*100)-100)) -> 74.153934122031842 | P24: 5800000 | Q24: =IF(C24=0,0,IF(P24=0,0,((C24/P24)*100)-100)) -> -6.2969663793103479 | R24: =IF(C24=0,0,(C24/$C$43)*100) -> 3.3110273296280126 | T24: 16.37 | U24: 15.651126703760438 | V24: =U24-T24 -> -0.71887329623956298
A25: São Bráz | B25: 5800000 | C25: 5855361.8499999996 | D25: 5783490.8700000001 | F25: 5090289.93 | G25: 4763326.83 | H25: 4498859.9 | J25: =IF(B25=0,0,((C25/B25)*100)-100) -> 0.95451465517240308 | K25: =IF(C25=0,0,IF(D25=0,0,((C25/D25)*100)-100)) -> 1.2426920283181744 | L25: =IF(F25=0,0,((C25/F25)*100)-100) -> 15.030026393801108 | M25: =IF(G25=0,0,((C25/G25)*100)-100) -> 22.925888963197579 | N25: =IF(C25=0,0,IF(H25=0,0,((C25/H25)*100)-100)) -> 30.152126986661642 | P25: 5800000 | Q25: =IF(C25=0,0,IF(P25=0,0,((C25/P25)*100)-100)) -> 0.95451465517240308 | R25: =IF(C25=0,0,(C25/$C$43)*100) -> 3.5672607828867791 | T25: 15.77 | U25: 15.324419958776758 | V25: =U25-T25 -> -0.44558004122324135
A26: S.J. Pinhais | B26: 5800000 | C26: 5605996.7699999996 | D26: 5514001.29 | F26: 6051322.9199999999 | G26: 5533045.0300000003 | H26: 4954894.07 | J26: =IF(B26=0,0,((C26/B26)*100)-100) -> -3.3448832758620739 | K26: =IF(C26=0,0,IF(D26=0,0,((C26/D26)*100)-100)) -> 1.6683978686555605 | L26: =IF(F26=0,0,((C26/F26)*100)-100) -> -7.3591536245433105 | M26: =IF(G26=0,0,((C26/G26)*100)-100) -> 1.3184736362067895 | N26: =IF(C26=0,0,IF(H26=0,0,((C26/H26)*100)-100)) -> 13.140597776694733 | P26: 5800000 | Q26: =IF(C26=0,0,IF(P26=0,0,((C26/P26)*100)-100)) -> -3.3448832758620739 | R26: =IF(C26=0,0,(C26/$C$43)*100) -> 3.4153401512856041 | T26: 16.8 | U26: 16.177788486310529 | V26: =U26-T26 -> -0.62221151368947147
A27: P.G. Nova | B27: 7300000 | C27: 6978002.1500000004 | D27: 7145045.4900000002 | F27: 5873708.3300000001 | G27: 4619949.08 | H27: 4893666.91 | J27: =IF(B27=0,0,((C27/B27)*100)-100) -> -4.4109294520547877 | K27: =IF(C27=0,0,IF(D27=0,0,((C27/D27)*100)-100)) -> -2.3378905037594109 | L27: =IF(F27=0,0,((C27/F27)*100)-100) -> 18.800624034390893 | M27: =IF(G27=0,0,((C27/G27)*100)-100) -> 51.040672292431424 | N27: =IF(C27=0,0,IF(H27=0,0,((C27/H27)*100)-100)) -> 42.592503297287152 | P27: 7300000 | Q27: =IF(C27=0,0,IF(P27=0,0,((C27/P27)*100)-100)) -> -4.4109294520547877 | R27: =IF(C27=0,0,(C27/$C$43)*100) -> 4.2512066803513822 | T27: 15.734299999999999 | U27: 15.674584737696017 | V27: =U27-T27 -> -5.9715262303981831E-2
A28: Nilo Pecanha | B28: 14900000 | C28: 14858050.859999999 | D28: 14683010.609999999 | F28: 13352611.300000001 | G28: 12114351.49 | H28: 10687235.5 | J28: =IF(B28=0,0,((C28/B28)*100)-100) -> -0.28153785234900397 | K28: =IF(C28=0,0,IF(D28=0,0,((C28/D28)*100)-100)) -> 1.1921277907460421 | L28: =IF(F28=0,0,((C28/F28)*100)-100) -> 11.274495498869186 | M28: =IF(G28=0,0,((C28/G28)*100)-100) -> 22.648338809261332 | N28: =IF(C28=0,0,IF(H28=0,0,((C28/H28)*100)-100)) -> 39.026138798943833 | P28: 14900000 | Q28: =IF(C28=0,0,IF(P28=0,0,((C28/P28)*100)-100)) -> -0.28153785234900397 | R28: =IF(C28=0,0,(C28/$C$43)*100) -> 9.0519669835631387 | T28: 16.72 | U28: 16.786172247629523 | V28: =U28-T28 -> 6.6172247629523895E-2
A29: Champagnat | B29: 6650000 | C29: 6584960.0300000003 | D29: 6590204.3899999997 | F29: 5928589.2300000004 | G29: 5961299.1799999997 | H29: 6072734.7000000002 | J29: =IF(B29=0,0,((C29/B29)*100)-100) -> -0.97804466165413828 | K29: =IF(C29=0,0,IF(D29=0,0,((C29/D29)*100)-100)) -> -7.9578108502332157E-2 | L29: =IF(F29=0,0,((C29/F29)*100)-100) -> 11.071281455605259 | M29: =IF(G29=0,0,((C29/G29)*100)-100) -> 10.461827718567889 | N29: =IF(C29=0,0,IF(H29=0,0,((C29/H29)*100)-100)) -> 8.4348379322416207 | P29: 6650000 | Q29: =IF(C29=0,0,IF(P29=0,0,((C29/P29)*100)-100)) -> -0.97804466165413828 | R29: =IF(C29=0,0,(C29/$C$43)*100) -> 4.0117537179868652 | T29: 17 | U29: 17.303412090718492 | V29: =U29-T29 -> 0.30341209071849207
A30: Araucária Nova | B30: 7450000 | C30: 7365267.4699999997 | D30: 7378439.9900000002 | F30: 4555252.62 | G30: 3901584.07 | H30: 3411624.06 | J30: =IF(B30=0,0,((C30/B30)*100)-100) -> -1.1373493959731462 | K30: =IF(C30=0,0,IF(D30=0,0,((C30/D30)*100)-100)) -> -0.17852716858649842 | L30: =IF(F30=0,0,((C30/F30)*100)-100) -> 61.687354893612905 | M30: =IF(G30=0,0,((C30/G30)*100)-100) -> 88.776336427885838 | N30: =IF(C30=0,0,IF(H30=0,0,((C30/H30)*100)-100)) -> 115.88742899180983 | P30: 7450000 | Q30: =IF(C30=0,0,IF(P30=0,0,((C30/P30)*100)-100)) -> -1.1373493959731462 | R30: =IF(C30=0,0,(C30/$C$43)*100) -> 4.4871402441512176 | T30: 16.490600000000001 | U30: 16.016707846728071 | V30: =U30-T30 -> -0.47389215327192957
A31: Santa Candida | B31: 8800000 | C31: 8584060.8800000008 | D31: 8882174.1300000008 | F31: 7694802.1500000004 | G31: 6787184.29 | H31: 5553450.7999999998 | J31: =IF(B31=0,0,((C31/B31)*100)-100) -> -2.4538536363636183 | K31: =IF(C31=0,0,IF(D31=0,0,((C31/D31)*100)-100)) -> -3.3563094534828792 | L31: =IF(F31=0,0,((C31/F31)*100)-100) -> 11.556615916368969 | M31: =IF(G31=0,0,((C31/G31)*100)-100) -> 26.474551348892291 | N31: =IF(C31=0,0,IF(H31=0,0,((C31/H31)*100)-100)) -> 54.571656239396248 | P31: 8800000 | Q31: =IF(C31=0,0,IF(P31=0,0,((C31/P31)*100)-100)) -> -2.4538536363636183 | R31: =IF(C31=0,0,(C31/$C$43)*100) -> 5.2296654791943524 | T31: 16.714400000000001 | U31: 15.995409389500972 | V31: =U31-T31 -> -0.7189906104990289
A32: Paranaguá Raia | B32: 8800000 | C32: 8664308.9199999999 | D32: 8918866.7799999993 | F32: 7437288.8600000003 | G32: 7176509.4299999997 | H32: 5977947.2599999998 | J32: =IF(B32=0,0,((C32/B32)*100)-100) -> -1.5419440909090838 | K32: =IF(C32=0,0,IF(D32=0,0,((C32/D32)*100)-100)) -> -2.8541502668346794 | L32: =IF(F32=0,0,((C32/F32)*100)-100) -> 16.498217066695986 | M32: =IF(G32=0,0,((C32/G32)*100)-100) -> 20.731520030901706 | N32: =IF(C32=0,0,IF(H32=0,0,((C32/H32)*100)-100)) -> 44.937861495954365 | P32: 8800000 | Q32: =IF(C32=0,0,IF(P32=0,0,((C32/P32)*100)-100)) -> -1.5419440909090838 | R32: =IF(C32=0,0,(C32/$C$43)*100) -> 5.2785549745541527 | T32: 18.3871 | U32: 18.509680054205642 | V32: =U32-T32 -> 0.12258005420564189
A33: Novo Mundo | B33: 6750000 | C33: 6768696.46 | D33: 6823571.5800000001 | F33: 5342595.14 | G33: 5125172.17 | H33: 0 | J33: =IF(B33=0,0,((C33/B33)*100)-100) -> 0.27698459259259778 | K33: =IF(C33=0,0,IF(D33=0,0,((C33/D33)*100)-100)) -> -0.80419937501410743 | L33: =IF(F33=0,0,((C33/F33)*100)-100) -> 26.693044908508654 | M33: =IF(G33=0,0,((C33/G33)*100)-100) -> 32.067689347497577 | N33: =IF(C33=0,0,IF(H33=0,0,((C33/H33)*100)-100)) -> 0 | P33: 6750000 | Q33: =IF(C33=0,0,IF(P33=0,0,((C33/P33)*100)-100)) -> 0.27698459259259778 | R33: =IF(C33=0,0,(C33/$C$43)*100) -> 4.1236914219097445 | T33: 16.402000000000001 | U33: 16.18143251765791 | V33: =U33-T33 -> -0.22056748234209067
A34: Água Verde | B34: 6750000 | C34: 7109535.3499999996 | D34: 6808659.7400000002 | F34: 5870207.71 | G34: 0 | H34: 0 | J34: =IF(B34=0,0,((C34/B34)*100)-100) -> 5.3264496296296215 | K34: =IF(C34=0,0,IF(D34=0,0,((C34/D34)*100)-100)) -> 4.419013748511972 | L34: =IF(F34=0,0,((C34/F34)*100)-100) -> 21.112159930708813 | M34: =IF(G34=0,0,((C34/G34)*100)-100) -> 0 | N34: =IF(C34=0,0,IF(H34=0,0,((C34/H34)*100)-100)) -> 0 | P34: 6750000 | Q34: =IF(C34=0,0,IF(P34=0,0,((C34/P34)*100)-100)) -> 5.3264496296296215 | R34: =IF(C34=0,0,(C34/$C$43)*100) -> 4.3313406222029185 | T34: 16.978400000000001 | U34: 16.824486849200351 | V34: =U34-T34 -> -0.1539131507996494
A35: Uvaranas | B35: 6300000 | C35: 6140944.9199999999 | D35: 6317533.5 | F35: 5311315.86 | G35: 4418078.02 | H35: 0 | J35: =IF(B35=0,0,((C35/B35)*100)-100) -> -2.5246838095238076 | K35: =IF(C35=0,0,IF(D35=0,0,((C35/D35)*100)-100)) -> -2.7952139865977728 | L35: =IF(F35=0,0,((C35/F35)*100)-100) -> 15.62002866837598 | M35: =IF(G35=0,0,((C35/G35)*100)-100) -> 38.995845981008728 | N35: =IF(C35=0,0,IF(H35=0,0,((C35/H35)*100)-100)) -> 0 | P35: 6300000 | Q35: =IF(C35=0,0,IF(P35=0,0,((C35/P35)*100)-100)) -> -2.5246838095238076 | R35: =IF(C35=0,0,(C35/$C$43)*100) -> 3.7412464923894992 | T35: 15.917299999999999 | U35: 16.523567353540113 | V35: =U35-T35 -> 0.60626735354011352
A36: Torres | B36: 6750000 | C36: 6749025.5899999999 | D36: 6873857.9100000001 | F36: 5830916.4500000002 | G36: 5068869.13 | H36: 4195714.74 | J36: =IF(B36=0,0,((C36/B36)*100)-100) -> -1.4435703703711056E-2 | K36: =IF(C36=0,0,IF(D36=0,0,((C36/D36)*100)-100)) -> -1.8160445216418566 | L36: =IF(F36=0,0,((C36/F36)*100)-100) -> 15.745537564682465 | M36: =IF(G36=0,0,((C36/G36)*100)-100) -> 33.146574056450334 | N36: =IF(C36=0,0,IF(H36=0,0,((C36/H36)*100)-100)) -> 60.855206042916052 | P36: 6750000 | Q36: =IF(C36=0,0,IF(P36=0,0,((C36/P36)*100)-100)) -> -1.4435703703711056E-2 | R36: =IF(C36=0,0,(C36/$C$43)*100) -> 4.1117073422040189 | T36: 16.501000000000001 | U36: 16.609872863143195 | V36: =U36-T36 -> 0.10887286314319411
A37: Total Hiper | B37: =SUM(B23:B36) -> 103250000 | C37: =SUM(C23:C36) -> 101719916.71999998 | D37: =SUM(D23:D36) -> 102881583.28999999 | F37: =SUM(F23:F36) -> 87088109.729999989 | G37: =SUM(G23:G36) -> 73846504.359999999 | H37: =SUM(H23:H36) -> 57358573.700000003 | I37: =SUM(B37:H37) -> 526144687.80000001 | J37: =IF(C37=0,0,((C37/B37)*100)-100) -> -1.4819208523002487 | K37: =IF(C37=0,0,IF(D37=0,0,((C37/D37)*100)-100)) -> -1.1291297556390845 | L37: =IF(F37=0,0,IF(C37=0,0,((C37/F37)*100)-100)) -> 16.801153493126805 | M37: =IF(G37=0,0,IF(C37=0,0,((C37/G37)*100)-100)) -> 37.745066745634631 | N37: =IF(C37=0,0,IF(H37=0,0,((C37/H37)*100)-100)) -> 77.340387248855137 | P37: =SUM(P23:P36) -> 103250000 | Q37: =IF(C37=0,0,((C37/P37)*100)-100) -> -1.4819208523002487 | R37: =IF(C37=0,0,(C37/$C$43)*100) -> 61.970801984469183 | T37: 16.636232445520584 | U37: 16.478727758832559 | V37: =U37-T37 -> -0.15750468668802498
A38: Total s/ 33,36,38 | B38: =B22+B37 -> 150499998 | C38: =C22+C37 -> 150976895.97999996 | D38: =D22+D37 -> 150972705.37 | E38: =E22+E37 -> 0 | F38: =F22+F37 -> 127881421.86999999 | G38: =G22+G37 -> 105966113.84999999 | H38: =H22+H37 -> 86116922.219999999 | I38: =SUM(B38:H38) -> 772414057.28999996 | J38: =IF(C38=0,0,((C38/B38)*100)-100) -> 0.31687573843022676 | K38: =IF(C38=0,0,IF(D38=0,0,((C38/D38)*100)-100)) -> 2.7757401509802548E-3 | L38: =IF(F38=0,0,IF(C38=0,0,((C38/F38)*100)-100)) -> 18.060069846172084 | M38: =IF(G38=0,0,IF(C38=0,0,((C38/G38)*100)-100)) -> 42.476580950882891 | N38: =IF(C38=0,0,IF(H38=0,0,((C38/H38)*100)-100)) -> 75.316177225080537 | P38: =P22+P37 -> 150500000 | Q38: =IF(C38=0,0,((C38/P38)*100)-100) -> 0.31687440531558764 | R38: =IF(C38=0,0,(C38/$C$43)*100) -> 91.979620380153023 | T38: 16.654332491894781 | U38: 16.505309385948078 | V38: =U38-T38 -> -0.14902310594670354
A39: S.J.P - Rua Joinvile | B39: 5800000 | C39: 5266956.24 | D39: 5550136.8700000001 | F39: 0 | G39: 0 | H39: 0 | J39: =IF(B39=0,0,((C39/B39)*100)-100) -> -9.1904096551724024 | K39: =IF(C39=0,0,IF(D39=0,0,((C39/D39)*100)-100)) -> -5.1022278663192679 | L39: =IF(F39=0,0,((C39/F39)*100)-100) -> 0 | M39: =IF(G39=0,0,((C39/G39)*100)-100) -> 0 | N39: =IF(C39=0,0,IF(H39=0,0,((C39/H39)*100)-100)) -> 0 | P39: 5800000 | Q39: =IF(P39=0,0,IF(C39=0,0,((C39/P39)*100)-100)) -> -9.1904096551724024 | R39: =IF(C39=0,0,(C39/$C$43)*100) -> 3.2087865654507426 | T39: 15.7171 | U39: 15.561109161598047 | V39: =U39-T39 -> -0.15599083840195327
A40: Castro | B40: 3900000 | C40: 3625279.36 | D40: 3707324.18 | F40: 0 | G40: 0 | H40: 0 | J40: =IF(B40=0,0,((C40/B40)*100)-100) -> -7.0441189743589803 | K40: =IF(C40=0,0,IF(D40=0,0,((C40/D40)*100)-100)) -> -2.2130468234369545 | L40: =IF(F40=0,0,((C40/F40)*100)-100) -> 0 | M40: =IF(G40=0,0,((C40/G40)*100)-100) -> 0 | N40: =IF(C40=0,0,IF(H40=0,0,((C40/H40)*100)-100)) -> 0 | P40: 3900000 | Q40: =IF(P40=0,0,IF(C40=0,0,((C40/P40)*100)-100)) -> -7.0441189743589803 | R40: =IF(C40=0,0,(C40/$C$43)*100) -> 2.208628129094512 | T40: 16.845199999999998 | U40: 16.297349564807053 | V40: =U40-T40 -> -0.54785043519294518
B41: 0 | C41: 0 | D41: 0 | F41: 0 | G41: 0 | H41: 0 | J41: =IF(B41=0,0,((C41/B41)*100)-100) -> 0 | K41: =IF(C41=0,0,IF(D41=0,0,((C41/D41)*100)-100)) -> 0 | L41: =IF(F41=0,0,((C41/F41)*100)-100) -> 0 | M41: =IF(G41=0,0,((C41/G41)*100)-100) -> 0 | N41: =IF(C41=0,0,IF(H41=0,0,((C41/H41)*100)-100)) -> 0 | P41: 0 | Q41: =IF(P41=0,0,IF(C41=0,0,((C41/P41)*100)-100)) -> 0 | R41: =IF(C41=0,0,(C41/$C$43)*100) -> 0 | T41: 0 | U41: 0 | V41: =U41-T41 -> 0
A42: Colombo | B42: 4300000 | C42: 4272550.41 | D42: 4403416.05 | F42: 0 | G42: 0 | H42: 0 | J42: =IF(B42=0,0,((C42/B42)*100)-100) -> -0.63836255813953358 | K42: =IF(C42=0,0,IF(D42=0,0,((C42/D42)*100)-100)) -> -2.9719117729063953 | L42: =IF(F42=0,0,((C42/F42)*100)-100) -> 0 | M42: =IF(G42=0,0,((C42/G42)*100)-100) -> 0 | N42: =IF(C42=0,0,IF(H42=0,0,((C42/H42)*100)-100)) -> 0 | P42: 4300000 | Q42: =IF(P42=0,0,IF(C42=0,0,((C42/P42)*100)-100)) -> -0.63836255813953358 | R42: =IF(C42=0,0,(C42/$C$43)*100) -> 2.6029649253017269 | T42: 15.8942 | U42: 14.889628417514681 | V42: =U42-T42 -> -1.004571582485319
A43: Total Geral | B43: =B22+B37+SUM(B39:B42) -> 164499998 | C43: =C22+C37+SUM(C39:C42) -> 164141681.98999995 | D43: =D22+D37+SUM(D39:D42) -> 164633582.47 | F43: =F22+F37+SUM(F39:F42) -> 127881421.86999999 | G43: =G22+G37+SUM(G39:G42) -> 105966113.84999999 | H43: =H22+H37+SUM(H39:H42) -> 86116922.219999999 | J43: =IF(C43=0,0,((C43/B43)*100)-100) -> -0.2178212853230832 | K43: =IF(C43=0,0,IF(D43=0,0,((C43/D43)*100)-100)) -> -0.29878501859708706 | L43: =IF(F43=0,0,IF(C43=0,0,((C43/F43)*100)-100)) -> 28.354595679160468 | M43: =IF(G43=0,0,IF(C43=0,0,((C43/G43)*100)-100)) -> 54.900161972864481 | N43: =IF(C43=0,0,IF(H43=0,0,((C43/H43)*100)-100)) -> 90.603284184579564 | P43: =P22+P37+SUM(P39:P42) -> 164500000 | Q43: =IF(C43=0,0,((C43/P43)*100)-100) -> -0.21782249848027391 | R43: =R22+R37+SUM(R39:R42) -> 100 | T43: 16.6 | U43: 16.428363347978149 | V43: =U43-T43 -> -0.17163665202185285
A45: Água Verde | B45: 0 | C45: 0 | D45: 0 | F45: 0 | G45: 0 | H45: 0 | J45: =IF(B45=0,0,((C45/B45)*100)-100) -> 0 | K45: =IF(C45=0,0,IF(D45=0,0,((C45/D45)*100)-100)) -> 0 | L45: =IF(F45=0,0,((C45/F45)*100)-100) -> 0 | M45: =IF(G45=0,0,((C45/G45)*100)-100) -> 0 | N45: =IF(C45=0,0,IF(H45=0,0,((C45/H45)*100)-100)) -> 0 | P45: =B45 -> 0 | Q45: =IF(C45=0,0,IF(P45=0,0,((C45/P45)*100)-100)) -> 0 | R45: =IF(C45=0,0,(C45/$C$43)*100) -> 0 | T45: 14.95 | U45: 0 | V45: =U45-T45 -> -14.95
A46: Total Geral | B46: =B43+B45 -> 164499998 | C46: =C43+C45 -> 164141681.98999995 | D46: =D43+D45 -> 164633582.47 | F46: =F43+F45 -> 127881421.86999999 | G46: =G43+G45 -> 105966113.84999999 | H46: =H43+H45 -> 86116922.219999999 | J46: =IF(C46=0,0,((C46/B46)*100)-100) -> -0.2178212853230832 | K46: =IF(C46=0,0,IF(D46=0,0,((C46/D46)*100)-100)) -> -0.29878501859708706 | L46: =IF(F46=0,0,IF(C46=0,0,((C46/F46)*100)-100)) -> 28.354595679160468 | M46: =IF(G46=0,0,IF(C46=0,0,((C46/G46)*100)-100)) -> 54.900161972864481 | N46: =IF(C46=0,0,IF(H46=0,0,((C46/H46)*100)-100)) -> 90.603284184579564 | P46: =P43+P45 -> 164500000 | Q46: =IF(C46=0,0,((C46/P46)*100)-100) -> -0.21782249848027391 | R46: =R25+R40+R45 -> 5.7758889119812906 | T46: 16.605942613576811 | U46: 16.428363347978149 | V46: =U46-T46 -> -0.17757926559866277