A2: Periodo: | C2: 39142 | D2: a | E2: 39172 | H2: Vendas Acumuladas por Filial | Q2: =NOW() -> 39183.457105439797
A4: v.1 | C4: Vendas 2007 | G4: Vendas de Anos Anteriores | K4: Percentuais ( % ) | Q4: Meta Mensal | U4: Margem
A5: Lojas | C5: Previsao | D5: Realizada | E5: Mes Anterior | G5: Vendas 2006 | H5: Vendas 2005 | I5: Vendas 2004 | K5: % Prev | L5: % MA | M5: 2006 | N5: 2005 | O5: 2004 | Q5: Previsao Mes | R5: Final | S5: Part. | U5: Meta | V5: Coml | W5: Dif
A7: Xaxim | C7: 765000 | D7: 788213 | E7: 708986 | G7: 707279 | H7: 858818 | I7: 726814 | K7: =IF(C7=0,0,((D7/C7)*100)-100) -> 3.03 | L7: =IF(D7=0,0,IF(E7=0,0,((D7/E7)*100)-100)) -> 11.17 | M7: =IF(G7=0,0,((D7/G7)*100)-100) -> 11.44 | N7: =IF(H7=0,0,((D7/H7)*100)-100) -> -8.22 | O7: =IF(D7=0,0,IF(I7=0,0,((D7/I7)*100)-100)) -> 8.45 | Q7: 765000 | R7: =IF(D7=0,0,((D7/Q7)*100)-100) -> 3.03 | S7: =IF(D7=0,0,(D7/$D$37)*100) -> 1.24 | U7: 17.5 | V7: 16.52 | W7: =V7-U7 -> -0.98
A8: S. Felicidade | C8: 800000 | D8: 832774 | E8: 743404 | G8: 783784 | H8: 793065 | I8: 662420 | K8: =IF(C8=0,0,((D8/C8)*100)-100) -> 4.1 | L8: =IF(D8=0,0,IF(E8=0,0,((D8/E8)*100)-100)) -> 12.02 | M8: =IF(G8=0,0,((D8/G8)*100)-100) -> 6.25 | N8: =IF(H8=0,0,((D8/H8)*100)-100) -> 5.01 | O8: =IF(D8=0,0,IF(I8=0,0,((D8/I8)*100)-100)) -> 25.72 | Q8: 800000 | R8: =IF(D8=0,0,((D8/Q8)*100)-100) -> 4.1 | S8: =IF(D8=0,0,(D8/$D$37)*100) -> 1.31 | U8: 18 | V8: 16.33 | W8: =V8-U8 -> -1.67
A9: Lapa | C9: 1450000 | D9: 1392057 | E9: 1171248 | G9: 1338989 | H9: 1308588 | I9: 1087978 | K9: =IF(C9=0,0,((D9/C9)*100)-100) -> -4 | L9: =IF(D9=0,0,IF(E9=0,0,((D9/E9)*100)-100)) -> 18.85 | M9: =IF(G9=0,0,((D9/G9)*100)-100) -> 3.96 | N9: =IF(H9=0,0,((D9/H9)*100)-100) -> 6.38 | O9: =IF(D9=0,0,IF(I9=0,0,((D9/I9)*100)-100)) -> 27.95 | Q9: 1450000 | R9: =IF(D9=0,0,((D9/Q9)*100)-100) -> -4 | S9: =IF(D9=0,0,(D9/$D$37)*100) -> 2.18 | U9: 17.4 | V9: 14.4 | W9: =V9-U9 -> -3
A10: Araucaria | C10: 1140000 | D10: 977958 | E10: 871634 | G10: 1014386 | H10: 1118579 | I10: 955077 | K10: =IF(C10=0,0,((D10/C10)*100)-100) -> -14.21 | L10: =IF(D10=0,0,IF(E10=0,0,((D10/E10)*100)-100)) -> 12.2 | M10: =IF(G10=0,0,((D10/G10)*100)-100) -> -3.59 | N10: =IF(H10=0,0,((D10/H10)*100)-100) -> -12.57 | O10: =IF(D10=0,0,IF(I10=0,0,((D10/I10)*100)-100)) -> 2.4 | Q10: 1140000 | R10: =IF(D10=0,0,((D10/Q10)*100)-100) -> -14.21 | S10: =IF(D10=0,0,(D10/$D$37)*100) -> 1.53 | U10: 19 | V10: 16.88 | W10: =V10-U10 -> -2.12
A11: Pinheirinho | C11: 0 | D11: 0 | E11: 0 | G11: 0 | H11: 0 | I11: 0 | K11: =IF(C11=0,0,((D11/C11)*100)-100) -> 0 | L11: =IF(D11=0,0,IF(E11=0,0,((D11/E11)*100)-100)) -> 0 | M11: =IF(G11=0,0,((D11/G11)*100)-100) -> 0 | N11: =IF(H11=0,0,((D11/H11)*100)-100) -> 0 | O11: =IF(D11=0,0,IF(I11=0,0,((D11/I11)*100)-100)) -> 0 | Q11: 0 | R11: =IF(D11=0,0,((D11/Q11)*100)-100) -> 0 | S11: =IF(D11=0,0,(D11/$D$37)*100) -> 0 | U11: 0 | V11: 0 | W11: =V11-U11 -> 0
A12: Hauer | C12: 3120000 | D12: 3111741 | E12: 2699868 | G12: 3045391 | H12: 3467208 | I12: 2747488 | K12: =IF(C12=0,0,((D12/C12)*100)-100) -> -0.26 | L12: =IF(D12=0,0,IF(E12=0,0,((D12/E12)*100)-100)) -> 15.26 | M12: =IF(G12=0,0,((D12/G12)*100)-100) -> 2.18 | N12: =IF(H12=0,0,((D12/H12)*100)-100) -> -10.25 | O12: =IF(D12=0,0,IF(I12=0,0,((D12/I12)*100)-100)) -> 13.26 | Q12: 3120000 | R12: =IF(D12=0,0,((D12/Q12)*100)-100) -> -0.26 | S12: =IF(D12=0,0,(D12/$D$37)*100) -> 4.88 | U12: 18.23 | V12: 17.66 | W12: =V12-U12 -> -0.57
A13: Paranagua | C13: 1635000 | D13: 1660177 | E13: 1500528 | G13: 1563844 | H13: 2140908 | I13: 3201285 | K13: =IF(C13=0,0,((D13/C13)*100)-100) -> 1.54 | L13: =IF(D13=0,0,IF(E13=0,0,((D13/E13)*100)-100)) -> 10.64 | M13: =IF(G13=0,0,((D13/G13)*100)-100) -> 6.16 | N13: =IF(H13=0,0,((D13/H13)*100)-100) -> -22.45 | O13: =IF(D13=0,0,IF(I13=0,0,((D13/I13)*100)-100)) -> -48.14 | Q13: 1635000 | R13: =IF(D13=0,0,((D13/Q13)*100)-100) -> 1.54 | S13: =IF(D13=0,0,(D13/$D$37)*100) -> 2.6 | U13: 19.4 | V13: 18.72 | W13: =V13-U13 -> -0.68
A14: Centenario | C14: 961000 | D14: 1006642 | E14: 863291 | G14: 926040 | H14: 1047816 | I14: 846451 | K14: =IF(C14=0,0,((D14/C14)*100)-100) -> 4.75 | L14: =IF(D14=0,0,IF(E14=0,0,((D14/E14)*100)-100)) -> 16.61 | M14: =IF(G14=0,0,((D14/G14)*100)-100) -> 8.7 | N14: =IF(H14=0,0,((D14/H14)*100)-100) -> -3.93 | O14: =IF(D14=0,0,IF(I14=0,0,((D14/I14)*100)-100)) -> 18.93 | Q14: 961000 | R14: =IF(D14=0,0,((D14/Q14)*100)-100) -> 4.75 | S14: =IF(D14=0,0,(D14/$D$37)*100) -> 1.58 | U14: 18.35 | V14: 16.77 | W14: =V14-U14 -> -1.58
A15: Sao Braz | C15: 3350000 | D15: 3170705 | E15: 2789700 | G15: 3107877 | H15: 3450181 | I15: 2909061 | K15: =IF(C15=0,0,((D15/C15)*100)-100) -> -5.35 | L15: =IF(D15=0,0,IF(E15=0,0,((D15/E15)*100)-100)) -> 13.66 | M15: =IF(G15=0,0,((D15/G15)*100)-100) -> 2.02 | N15: =IF(H15=0,0,((D15/H15)*100)-100) -> -8.1 | O15: =IF(D15=0,0,IF(I15=0,0,((D15/I15)*100)-100)) -> 8.99 | Q15: 3350000 | R15: =IF(D15=0,0,((D15/Q15)*100)-100) -> -5.35 | S15: =IF(D15=0,0,(D15/$D$37)*100) -> 4.97 | U15: 18.19 | V15: 16.67 | W15: =V15-U15 -> -1.52
A16: Sitio Cercado | C16: 1331359 | D16: 1297562 | E16: 1187345 | G16: 1246945 | H16: 2117345 | I16: 1548924 | K16: =IF(C16=0,0,((D16/C16)*100)-100) -> -2.54 | L16: =IF(D16=0,0,IF(E16=0,0,((D16/E16)*100)-100)) -> 9.28 | M16: =IF(G16=0,0,((D16/G16)*100)-100) -> 4.06 | N16: =IF(H16=0,0,((D16/H16)*100)-100) -> -38.72 | O16: =IF(D16=0,0,IF(I16=0,0,((D16/I16)*100)-100)) -> -16.23 | Q16: 1331359 | R16: =IF(D16=0,0,((D16/Q16)*100)-100) -> -2.54 | S16: =IF(D16=0,0,(D16/$D$37)*100) -> 2.04 | U16: 18.5 | V16: 17.03 | W16: =V16-U16 -> -1.47
A17: Apucarana | C17: 2200000 | D17: 2158421 | E17: 1872882 | G17: 1957014 | H17: 1987495 | I17: 1473884 | K17: =IF(C17=0,0,((D17/C17)*100)-100) -> -1.89 | L17: =IF(D17=0,0,IF(E17=0,0,((D17/E17)*100)-100)) -> 15.25 | M17: =IF(G17=0,0,((D17/G17)*100)-100) -> 10.29 | N17: =IF(H17=0,0,((D17/H17)*100)-100) -> 8.6 | O17: =IF(D17=0,0,IF(I17=0,0,((D17/I17)*100)-100)) -> 46.44 | Q17: 2200000 | R17: =IF(D17=0,0,((D17/Q17)*100)-100) -> -1.89 | S17: =IF(D17=0,0,(D17/$D$37)*100) -> 3.39 | U17: 16.9 | V17: 16.08 | W17: =V17-U17 -> -0.82
A18: Ahu | C18: 1290000 | D18: 1308949 | E18: 1012666 | G18: 1142814 | H18: 1155295 | I18: 1068945 | K18: =IF(C18=0,0,((D18/C18)*100)-100) -> 1.47 | L18: =IF(D18=0,0,IF(E18=0,0,((D18/E18)*100)-100)) -> 29.26 | M18: =IF(G18=0,0,((D18/G18)*100)-100) -> 14.54 | N18: =IF(H18=0,0,((D18/H18)*100)-100) -> 13.3 | O18: =IF(D18=0,0,IF(I18=0,0,((D18/I18)*100)-100)) -> 22.45 | Q18: 1290000 | R18: =IF(D18=0,0,((D18/Q18)*100)-100) -> 1.47 | S18: =IF(D18=0,0,(D18/$D$37)*100) -> 2.05 | U18: 19.1 | V18: 17.05 | W18: =V18-U18 -> -2.05
A19: P.G. Centro | C19: 1745000 | D19: 1784329 | E19: 1461658 | G19: 1669633 | H19: 1891893 | I19: 1688433 | K19: =IF(C19=0,0,((D19/C19)*100)-100) -> 2.25 | L19: =IF(D19=0,0,IF(E19=0,0,((D19/E19)*100)-100)) -> 22.08 | M19: =IF(G19=0,0,((D19/G19)*100)-100) -> 6.87 | N19: =IF(H19=0,0,((D19/H19)*100)-100) -> -5.69 | O19: =IF(D19=0,0,IF(I19=0,0,((D19/I19)*100)-100)) -> 5.68 | Q19: 1745000 | R19: =IF(D19=0,0,((D19/Q19)*100)-100) -> 2.25 | S19: =IF(D19=0,0,(D19/$D$37)*100) -> 2.8 | U19: 19.8 | V19: 18.26 | W19: =V19-U19 -> -1.54
A20: Maringa | C20: 2878583 | D20: 2599592 | E20: 1982114 | G20: 2569506 | H20: 2681869 | I20: 2096430 | K20: =IF(C20=0,0,((D20/C20)*100)-100) -> -9.69 | L20: =IF(D20=0,0,IF(E20=0,0,((D20/E20)*100)-100)) -> 31.15 | M20: =IF(G20=0,0,((D20/G20)*100)-100) -> 1.17 | N20: =IF(H20=0,0,((D20/H20)*100)-100) -> -3.07 | O20: =IF(D20=0,0,IF(I20=0,0,((D20/I20)*100)-100)) -> 24 | Q20: 2878583 | R20: =IF(D20=0,0,((D20/Q20)*100)-100) -> -9.69 | S20: =IF(D20=0,0,(D20/$D$37)*100) -> 4.08 | U20: 17.6 | V20: 17.5 | W20: =V20-U20 -> -0.1
A21: Araucaria Nova | C21: 2290000 | D21: 2259876 | E21: 1967009 | G21: 2040588 | H21: 2366594 | I21: 1932605 | K21: =IF(C21=0,0,((D21/C21)*100)-100) -> -1.32 | L21: =IF(D21=0,0,IF(E21=0,0,((D21/E21)*100)-100)) -> 14.89 | M21: =IF(G21=0,0,((D21/G21)*100)-100) -> 10.75 | N21: =IF(H21=0,0,((D21/H21)*100)-100) -> -4.51 | O21: =IF(D21=0,0,IF(I21=0,0,((D21/I21)*100)-100)) -> 16.93 | Q21: 2290000 | R21: =IF(D21=0,0,((D21/Q21)*100)-100) -> -1.32 | S21: =IF(D21=0,0,(D21/$D$37)*100) -> 3.54 | U21: 18.3 | V21: 17.12 | W21: =V21-U21 -> -1.18
A22: Total Super | C22: =SUM(C7:C21) -> 24955942 | D22: =SUM(D7:D21) -> 24348996 | E22: =SUM(E7:E21) -> 20832333 | G22: =SUM(G7:G21) -> 23114090 | H22: =SUM(H7:H21) -> 26385654 | I22: =SUM(I7:I21) -> 22945795 | J22: =SUM(C22:I22) -> 142582810 | K22: =IF(D22=0,0,((D22/C22)*100)-100) -> -2.43 | L22: =IF(D22=0,0,IF(E22=0,0,((D22/E22)*100)-100)) -> 16.88 | M22: =IF(G22=0,0,IF(D22=0,0,((D22/G22)*100)-100)) -> 5.34 | N22: =IF(H22=0,0,IF(D22=0,0,((D22/H22)*100)-100)) -> -7.72 | O22: =IF(D22=0,0,IF(I22=0,0,((D22/I22)*100)-100)) -> 6.12 | Q22: =SUM(Q7:Q21) -> 24955942 | R22: =IF(D22=0,0,((D22/Q22)*100)-100) -> -2.43 | S22: =IF(D22=0,0,(D22/$D$37)*100) -> 38.19 | U22: 18.36 | V22: 17.12 | W22: =V22-U22 -> -1.24
A24: Pinheirinho | C24: 3050000 | D24: 2998738 | E24: 2637182 | G24: 1906209 | H24: 2360409 | I24: 1878353 | K24: =IF(C24=0,0,((D24/C24)*100)-100) -> -1.68 | L24: =IF(D24=0,0,IF(E24=0,0,((D24/E24)*100)-100)) -> 13.71 | M24: =IF(G24=0,0,((D24/G24)*100)-100) -> 57.31 | N24: =IF(H24=0,0,((D24/H24)*100)-100) -> 27.04 | O24: =IF(D24=0,0,IF(I24=0,0,((D24/I24)*100)-100)) -> 59.65 | Q24: 3050000 | R24: =IF(D24=0,0,IF(Q24=0,0,((D24/Q24)*100)-100)) -> -1.68 | S24: =IF(D24=0,0,(D24/$D$37)*100) -> 4.7 | U24: 18 | V24: 16.31 | W24: =V24-U24 -> -1.69
A25: Londrina | C25: 3262685 | D25: 2746775 | E25: 2546916 | G25: 2826318 | H25: 2967264 | I25: 2125125 | K25: =IF(C25=0,0,((D25/C25)*100)-100) -> -15.81 | L25: =IF(D25=0,0,IF(E25=0,0,((D25/E25)*100)-100)) -> 7.85 | M25: =IF(G25=0,0,((D25/G25)*100)-100) -> -2.81 | N25: =IF(H25=0,0,((D25/H25)*100)-100) -> -7.43 | O25: =IF(D25=0,0,IF(I25=0,0,((D25/I25)*100)-100)) -> 29.25 | Q25: 3262685 | R25: =IF(D25=0,0,IF(Q25=0,0,((D25/Q25)*100)-100)) -> -15.81 | S25: =IF(D25=0,0,(D25/$D$37)*100) -> 4.31 | U25: 16.95 | V25: 15.66 | W25: =V25-U25 -> -1.29
A26: S.J. Pinhais | C26: 4265000 | D26: 4025375 | E26: 3498588 | G26: 4000323 | H26: 4961922 | I26: 3967363 | K26: =IF(C26=0,0,((D26/C26)*100)-100) -> -5.62 | L26: =IF(D26=0,0,IF(E26=0,0,((D26/E26)*100)-100)) -> 15.06 | M26: =IF(G26=0,0,((D26/G26)*100)-100) -> 0.63 | N26: =IF(H26=0,0,((D26/H26)*100)-100) -> -18.87 | O26: =IF(D26=0,0,IF(I26=0,0,((D26/I26)*100)-100)) -> 1.46 | Q26: 4265000 | R26: =IF(D26=0,0,IF(Q26=0,0,((D26/Q26)*100)-100)) -> -5.62 | S26: =IF(D26=0,0,(D26/$D$37)*100) -> 6.31 | U26: 17.5 | V26: 17.36 | W26: =V26-U26 -> -0.14
A27: P.G. Nova | C27: 3860000 | D27: 3915224 | E27: 3279872 | G27: 3624033 | H27: 3807048 | I27: 3046593 | K27: =IF(C27=0,0,((D27/C27)*100)-100) -> 1.43 | L27: =IF(D27=0,0,IF(E27=0,0,((D27/E27)*100)-100)) -> 19.37 | M27: =IF(G27=0,0,((D27/G27)*100)-100) -> 8.03 | N27: =IF(H27=0,0,((D27/H27)*100)-100) -> 2.84 | O27: =IF(D27=0,0,IF(I27=0,0,((D27/I27)*100)-100)) -> 28.51 | Q27: 3860000 | R27: =IF(D27=0,0,IF(Q27=0,0,((D27/Q27)*100)-100)) -> 1.43 | S27: =IF(D27=0,0,(D27/$D$37)*100) -> 6.14 | U27: 18 | V27: 16.62 | W27: =V27-U27 -> -1.38
A28: Nilo Pecanha | C28: 9690000 | D28: 9648905 | E28: 8256958 | G28: 9111719 | H28: 9128123 | I28: 8101747 | K28: =IF(C28=0,0,((D28/C28)*100)-100) -> -0.42 | L28: =IF(D28=0,0,IF(E28=0,0,((D28/E28)*100)-100)) -> 16.86 | M28: =IF(G28=0,0,((D28/G28)*100)-100) -> 5.9 | N28: =IF(H28=0,0,((D28/H28)*100)-100) -> 5.71 | O28: =IF(D28=0,0,IF(I28=0,0,((D28/I28)*100)-100)) -> 19.1 | Q28: 9690000 | R28: =IF(D28=0,0,IF(Q28=0,0,((D28/Q28)*100)-100)) -> -0.42 | S28: =IF(D28=0,0,(D28/$D$37)*100) -> 15.13 | U28: 17.4 | V28: 17.39 | W28: =V28-U28 -> -0.01
A29: Champagnat | C29: 5900000 | D29: 5662879 | E29: 4652840 | G29: 5563419 | H29: 5821017 | I29: 2359955 | K29: =IF(C29=0,0,((D29/C29)*100)-100) -> -4.02 | L29: =IF(D29=0,0,IF(E29=0,0,((D29/E29)*100)-100)) -> 21.71 | M29: =IF(G29=0,0,((D29/G29)*100)-100) -> 1.79 | N29: =IF(H29=0,0,((D29/H29)*100)-100) -> -2.72 | O29: =IF(D29=0,0,IF(I29=0,0,((D29/I29)*100)-100)) -> 139.96 | Q29: 5900000 | R29: =IF(D29=0,0,IF(Q29=0,0,((D29/Q29)*100)-100)) -> -4.02 | S29: =IF(D29=0,0,(D29/$D$37)*100) -> 8.88 | U29: 18.5 | V29: 18.07 | W29: =V29-U29 -> -0.43
A30: Santa Candida | C30: 4600000 | D30: 4127924 | E30: 3632785 | G30: 4101942 | H30: 4983764 | I30: 0 | K30: =IF(C30=0,0,((D30/C30)*100)-100) -> -10.26 | L30: =IF(D30=0,0,IF(E30=0,0,((D30/E30)*100)-100)) -> 13.63 | M30: =IF(G30=0,0,((D30/G30)*100)-100) -> 0.63 | N30: =IF(H30=0,0,((D30/H30)*100)-100) -> -17.17 | O30: =IF(D30=0,0,IF(I30=0,0,((D30/I30)*100)-100)) -> 0 | Q30: 4600000 | R30: =IF(D30=0,0,IF(Q30=0,0,((D30/Q30)*100)-100)) -> -10.26 | S30: =IF(D30=0,0,(D30/$D$37)*100) -> 6.47 | U30: 18.2 | V30: 17.08 | W30: =V30-U30 -> -1.12
A31: Paranagu Raia | C31: 4710000 | D31: 4895482 | E31: 4365705 | G31: 4489234 | H31: 4771309 | I31: 0 | K31: =IF(C31=0,0,((D31/C31)*100)-100) -> 3.94 | L31: =IF(D31=0,0,IF(E31=0,0,((D31/E31)*100)-100)) -> 12.13 | M31: =IF(G31=0,0,((D31/G31)*100)-100) -> 9.05 | N31: =IF(H31=0,0,((D31/H31)*100)-100) -> 2.6 | O31: =IF(D31=0,0,IF(I31=0,0,((D31/I31)*100)-100)) -> 0 | Q31: 4710000 | R31: =IF(D31=0,0,IF(Q31=0,0,((D31/Q31)*100)-100)) -> 3.94 | S31: =IF(D31=0,0,(D31/$D$37)*100) -> 7.68 | U31: 18.2 | V31: 18.55 | W31: =V31-U31 -> 0.35
A32: Total Hiper | C32: =SUM(C24:C31) -> 39337685 | D32: =SUM(D24:D31) -> 38021302 | E32: =SUM(E24:E31) -> 32870846 | G32: =SUM(G24:G31) -> 35623197 | H32: =SUM(H24:H31) -> 38800856 | I32: =SUM(I24:I31) -> 21479136 | J32: =SUM(C32:I32) -> 206133022 | K32: =IF(D32=0,0,((D32/C32)*100)-100) -> -3.35 | L32: =IF(D32=0,0,IF(E32=0,0,((D32/E32)*100)-100)) -> 15.67 | M32: =IF(G32=0,0,IF(D32=0,0,((D32/G32)*100)-100)) -> 6.73 | N32: =IF(H32=0,0,IF(D32=0,0,((D32/H32)*100)-100)) -> -2.01 | O32: =IF(D32=0,0,IF(I32=0,0,((D32/I32)*100)-100)) -> 77.02 | Q32: =SUM(Q24:Q31) -> 39337685 | R32: =IF(D32=0,0,((D32/Q32)*100)-100) -> -3.35 | S32: =IF(D32=0,0,(D32/$D$37)*100) -> 59.64 | U32: 17.83 | V32: 17.31 | W32: =V32-U32 -> -0.52
A34: Cristo Rei | C34: 1550000 | D34: 1384282 | E34: 1139920 | G34: 0 | H34: 0 | I34: 0 | K34: =IF(C34=0,0,((D34/C34)*100)-100) -> -10.69 | L34: =IF(D34=0,0,IF(E34=0,0,((D34/E34)*100)-100)) -> 21.44 | M34: =IF(G34=0,0,((D34/G34)*100)-100) -> 0 | N34: =IF(H34=0,0,((D34/H34)*100)-100) -> 0 | O34: =IF(D34=0,0,IF(I34=0,0,((D34/I34)*100)-100)) -> 0 | Q34: 1550000 | R34: =IF(Q34=0,0,IF(D34=0,0,((D34/Q34)*100)-100)) -> -10.69 | S34: =IF(D34=0,0,(D34/$D$37)*100) -> 2.17 | U34: 19.2 | V34: 18.68 | W34: =V34-U34 -> -0.52
A35: Total Lojas Novas | C35: =SUM(C34) -> 1550000 | D35: =SUM(D34) -> 1384282 | E35: =SUM(E34) -> 1139920 | G35: =SUM(G34) -> 0 | H35: =SUM(H34) -> 0 | I35: =SUM(I34) -> 0 | K35: =IF(D35=0,0,((D35/C35)*100)-100) -> -10.69 | L35: =IF(D35=0,0,IF(E35=0,0,((D35/E35)*100)-100)) -> 21.44 | M35: =IF(G35=0,0,IF(D35=0,0,((D35/G35)*100)-100)) -> 0 | N35: =IF(H35=0,0,IF(D35=0,0,((D35/H35)*100)-100)) -> 0 | O35: =IF(D35=0,0,IF(I35=0,0,((D35/I35)*100)-100)) -> 0 | Q35: =SUM(Q34) -> 1550000 | R35: =IF(D35=0,0,((D35/Q35)*100)-100) -> -10.69 | S35: =IF(D35=0,0,(D35/$D$37)*100) -> 2.17 | U35: =U34 -> 19.2 | V35: =V34 -> 18.68 | W35: =V35-U35 -> -0.52
A37: Total Geral | C37: =C22+C32+C35 -> 65843627 | D37: =D22+D32+D35 -> 63754580 | E37: =E22+E32+E35 -> 54843099 | G37: =G22+G32+G35 -> 58737287 | H37: =H22+H32+H35 -> 65186510 | I37: =I22+I32+I35 -> 44424931 | K37: =IF(D37=0,0,((D37/C37)*100)-100) -> -3.17 | L37: =IF(D37=0,0,IF(E37=0,0,((D37/E37)*100)-100)) -> 16.25 | M37: =IF(G37=0,0,IF(D37=0,0,((D37/G37)*100)-100)) -> 8.54 | N37: =IF(H37=0,0,IF(D37=0,0,((D37/H37)*100)-100)) -> -2.2 | O37: =IF(D37=0,0,IF(I37=0,0,((D37/I37)*100)-100)) -> 43.51 | Q37: =Q22+Q32+Q35 -> 65843627 | R37: =IF(D37=0,0,((D37/Q37)*100)-100) -> -3.17 | S37: =S22+S32+S35 -> 100 | U37: 18.05 | V37: 17.24 | W37: =V37-U37 -> -0.81
C38: Resumo por Regiao - Outubro/2002
C39: Descricao das Aberturas | H39: Valor | I39: % | M39: Margem Comercial | R39: Meta | S39: Real | U39: Dif
C40: Curitiba (2,3,6,7,10,11,13,17,21,22) | H40: =D7+D8+D11+D12+D14+D15+D16+D18+D28+D29+D30+D24+D34 -> 35339314 | I40: =IF(D37=0,0,H40/$D$37) -> 0.55430000000000001 | L40: 99 | M40: Empresa | R40: 18.05 | S40: 17.24 | U40: =S40-R40 -> -0.81
C41: Curitiba e Metrop. (Ctba. 4,5,8,13,14,23) | H41: =H40+D9+D10+D13+D26+D21+D31 -> 50550239 | I41: =IF(D37=0,0,H41/$D$37) -> 0.79290000000000005 | L41: 207 | M41: Super | R41: 18.36 | S41: 17.12 | U41: =S41-R41 -> -1.24
C42: Metropolitana (4,5,8,14,23) | H42: =H41-H40 -> 15210925 | I42: =IF(D37=0,0,H42/$D$37) -> 0.23860000000000001 | L42: 208 | M42: Hiper | R42: 17.83 | S42: 17.31 | U42: =S42-R42 -> -0.52
C43: Norte (9,15,20) | H43: =D25+D17+D20 -> 7504788 | I43: =IF(D37=0,0,H43/$D$37) -> 0.1177 | L43: 204 | M43: Regional Gilberto | R43: 18.39 | S43: 17.08 | U43: =S43-R43 -> -1.31
C44: Ponta Grossa (18,19) | H44: =D19+D27 -> 5699553 | I44: =IF(D37=0,0,H44/$D$37) -> 8.9399999999999993E-2 | L44: 205 | M44: Regional Edison | R44: 17.84 | S44: 17.39 | U44: =S44-R44 -> -0.45
C45: Super (2,3,4,5,6,7,8,10,11,13,15,17,18,20,23) | H45: =D22 -> 24348996 | I45: =IF(D37=0,0,H45/$D$37) -> 0.38190000000000002 | L45: 200 | M45: Regio - Curitiba | R45: 18.09 | S45: 17.29 | U45: =S45-R45 -> -0.8
C46: Hiper (6,9,14,19,21,22,24) | H46: =D32 -> 38021302 | I46: =IF(D37=0,0,H46/$D$37) -> 0.59640000000000004 | L46: 201 | M46: Regio - Metropolitana | R46: 18.13 | S46: 17.55 | U46: =S46-R46 -> -0.58
C47: Curitiba, Metropolitana e Ponta Grossa | H47: =D37-H43 -> 56249792 | I47: =IF(D37=0,0,H47/$D$37) -> 0.88229999999999997 | L47: 202 | M47: Regio - Centro Oeste | R47: 18.56 | S47: 17.13 | U47: =S47-R47 -> -1.43
C48: Araucaria | H48: =D10+D21 -> 3237834 | I48: =IF(D37=0,0,H48/$D$37) -> 5.0799999999999998E-2 | L48: 203 | M48: Regio - Norte | R48: 17.32 | S48: 16.42 | U48: =S48-R48 -> -0.9