A2: Perodo: | C2: 38169 | E2: 38199 | H2: Vendas Acumuladas por Filial | Q2: =NOW() -> 38204.395968171302
A4: v.1 | C4: Vendas 2004 | G4: Vendas de Anos Anteriores | K4: Percentuais ( % ) | Q4: Meta Mensal | U4: Margem
A5: Lojas | C5: Previso | D5: Realizada | E5: Ms Anterior | G5: Vendas 2003 | H5: Vendas 2002 | I5: Vendas 2001 | K5: % Prev | L5: % MA | M5: 2003 | N5: 2002 | O5: 2001 | Q5: Previso Ms | R5: Final | S5: Part. | U5: Meta | V5: Real
A7: Xaxim | C7: 780000 | D7: 875027 | E7: 717141 | G7: 745682 | H7: 512341 | I7: 521020 | K7: =IF(C7=0,0,((D7/C7)*100)-100) -> 12.18 | L7: =IF(D7=0,0,IF(E7=0,0,((D7/E7)*100)-100)) -> 22.02 | M7: =IF(G7=0,0,((D7/G7)*100)-100) -> 17.35 | N7: =IF(H7=0,0,((D7/H7)*100)-100) -> 70.79 | O7: =IF(D7=0,0,IF(I7=0,0,((D7/I7)*100)-100)) -> 67.94 | Q7: 780000 | R7: =IF(D7=0,0,((D7/Q7)*100)-100) -> 12.18 | S7: =IF(D7=0,0,(D7/$D$32)*100) -> 1.7 | U7: 16.45 | V7: 14.27
A8: S. Felicidade | C8: 760000 | D8: 717811 | E8: 630404 | G8: 750766 | H8: 531086 | I8: 580736 | K8: =IF(C8=0,0,((D8/C8)*100)-100) -> -5.55 | L8: =IF(D8=0,0,IF(E8=0,0,((D8/E8)*100)-100)) -> 13.87 | M8: =IF(G8=0,0,((D8/G8)*100)-100) -> -4.39 | N8: =IF(H8=0,0,((D8/H8)*100)-100) -> 35.16 | O8: =IF(D8=0,0,IF(I8=0,0,((D8/I8)*100)-100)) -> 23.6 | Q8: 760000 | R8: =IF(D8=0,0,((D8/Q8)*100)-100) -> -5.55 | S8: =IF(D8=0,0,(D8/$D$32)*100) -> 1.39 | U8: 18 | V8: 15.88
A9: Lapa | C9: 1170000 | D9: 1224191 | E9: 1051047 | G9: 1060476 | H9: 776128 | I9: 649412 | K9: =IF(C9=0,0,((D9/C9)*100)-100) -> 4.63 | L9: =IF(D9=0,0,IF(E9=0,0,((D9/E9)*100)-100)) -> 16.47 | M9: =IF(G9=0,0,((D9/G9)*100)-100) -> 15.44 | N9: =IF(H9=0,0,((D9/H9)*100)-100) -> 57.73 | O9: =IF(D9=0,0,IF(I9=0,0,((D9/I9)*100)-100)) -> 88.51 | Q9: 1170000 | R9: =IF(D9=0,0,((D9/Q9)*100)-100) -> 4.63 | S9: =IF(D9=0,0,(D9/$D$32)*100) -> 2.38 | U9: 16.05 | V9: 14.85
A10: Araucria | C10: 1200000 | D10: 1024263 | E10: 960060 | G10: 1008677 | H10: 1577000 | I10: 1448354 | K10: =IF(C10=0,0,((D10/C10)*100)-100) -> -14.64 | L10: =IF(D10=0,0,IF(E10=0,0,((D10/E10)*100)-100)) -> 6.69 | M10: =IF(G10=0,0,((D10/G10)*100)-100) -> 1.55 | N10: =IF(H10=0,0,((D10/H10)*100)-100) -> -35.05 | O10: =IF(D10=0,0,IF(I10=0,0,((D10/I10)*100)-100)) -> -29.28 | Q10: 1200000 | R10: =IF(D10=0,0,((D10/Q10)*100)-100) -> -14.64 | S10: =IF(D10=0,0,(D10/$D$32)*100) -> 1.99 | U10: 17.24 | V10: 16.3
A11: Pinheirinho | C11: 2330000 | D11: 2135571 | E11: 1828470 | G11: 1866151 | H11: 1546641 | I11: 1631774 | K11: =IF(C11=0,0,((D11/C11)*100)-100) -> -8.34 | L11: =IF(D11=0,0,IF(E11=0,0,((D11/E11)*100)-100)) -> 16.8 | M11: =IF(G11=0,0,((D11/G11)*100)-100) -> 14.44 | N11: =IF(H11=0,0,((D11/H11)*100)-100) -> 38.08 | O11: =IF(D11=0,0,IF(I11=0,0,((D11/I11)*100)-100)) -> 30.87 | Q11: 2330000 | R11: =IF(D11=0,0,((D11/Q11)*100)-100) -> -8.34 | S11: =IF(D11=0,0,(D11/$D$32)*100) -> 4.15 | U11: 16.3 | V11: 15.42
A12: Hauer | C12: 3200000 | D12: 3150643 | E12: 2720835 | G12: 2918248 | H12: 2286293 | I12: 2168426 | K12: =IF(C12=0,0,((D12/C12)*100)-100) -> -1.54 | L12: =IF(D12=0,0,IF(E12=0,0,((D12/E12)*100)-100)) -> 15.8 | M12: =IF(G12=0,0,((D12/G12)*100)-100) -> 7.96 | N12: =IF(H12=0,0,((D12/H12)*100)-100) -> 37.81 | O12: =IF(D12=0,0,IF(I12=0,0,((D12/I12)*100)-100)) -> 45.3 | Q12: 3200000 | R12: =IF(D12=0,0,((D12/Q12)*100)-100) -> -1.54 | S12: =IF(D12=0,0,(D12/$D$32)*100) -> 6.12 | U12: 16.1 | V12: 15.67
A13: Paranagu | C13: 3400000 | D13: 3451663 | E13: 2989738 | G13: 3144865 | H13: 2593279 | I13: 2364084 | K13: =IF(C13=0,0,((D13/C13)*100)-100) -> 1.52 | L13: =IF(D13=0,0,IF(E13=0,0,((D13/E13)*100)-100)) -> 15.45 | M13: =IF(G13=0,0,((D13/G13)*100)-100) -> 9.76 | N13: =IF(H13=0,0,((D13/H13)*100)-100) -> 33.1 | O13: =IF(D13=0,0,IF(I13=0,0,((D13/I13)*100)-100)) -> 46 | Q13: 3400000 | R13: =IF(D13=0,0,((D13/Q13)*100)-100) -> 1.52 | S13: =IF(D13=0,0,(D13/$D$32)*100) -> 6.7 | U13: 17 | V13: 16.4
A14: Centenrio | C14: 970000 | D14: 996850 | E14: 814210 | G14: 936047 | H14: 674207 | I14: 655811 | K14: =IF(C14=0,0,((D14/C14)*100)-100) -> 2.77 | L14: =IF(D14=0,0,IF(E14=0,0,((D14/E14)*100)-100)) -> 22.43 | M14: =IF(G14=0,0,((D14/G14)*100)-100) -> 6.5 | N14: =IF(H14=0,0,((D14/H14)*100)-100) -> 47.86 | O14: =IF(D14=0,0,IF(I14=0,0,((D14/I14)*100)-100)) -> 52 | Q14: 970000 | R14: =IF(D14=0,0,((D14/Q14)*100)-100) -> 2.77 | S14: =IF(D14=0,0,(D14/$D$32)*100) -> 1.94 | U14: 16.85 | V14: 14.76
A15: Arapongas | C15: 0 | D15: 0 | E15: 0 | G15: 558281 | H15: 486822 | I15: 519016 | K15: =IF(C15=0,0,((D15/C15)*100)-100) -> 0 | L15: =IF(D15=0,0,IF(E15=0,0,((D15/E15)*100)-100)) -> 0 | M15: =IF(D15=0,0,IF(G15=0,0,((D15/G15)*100)-100)) -> 0 | N15: =IF(D15=0,0,IF(H15=0,0,((D15/H15)*100)-100)) -> 0 | O15: =IF(D15=0,0,IF(I15=0,0,((D15/I15)*100)-100)) -> 0 | Q15: 0 | R15: =IF(D15=0,0,((D15/Q15)*100)-100) -> 0 | S15: =IF(D15=0,0,(D15/$D$32)*100) -> 0 | U15: 0 | V15: 0
A16: So Brz | C16: 3200000 | D16: 3190832 | E16: 2816856 | G16: 3051671 | H16: 2356603 | I16: 2904762 | K16: =IF(C16=0,0,((D16/C16)*100)-100) -> -00.29 | L16: =IF(D16=0,0,IF(E16=0,0,((D16/E16)*100)-100)) -> 13.28 | M16: =IF(G16=0,0,((D16/G16)*100)-100) -> 4.56 | N16: =IF(H16=0,0,((D16/H16)*100)-100) -> 35.4 | O16: =IF(D16=0,0,IF(I16=0,0,((D16/I16)*100)-100)) -> 9.85 | Q16: 3200000 | R16: =IF(D16=0,0,((D16/Q16)*100)-100) -> -00.29 | S16: =IF(D16=0,0,(D16/$D$32)*100) -> 6.19 | U16: 16.7 | V16: 15.37
A17: Guarapuava | C17: 1520000 | D17: 1746727 | E17: 1444058 | G17: 1344526 | H17: 837116 | I17: 796932 | K17: =IF(C17=0,0,((D17/C17)*100)-100) -> 14.92 | L17: =IF(D17=0,0,IF(E17=0,0,((D17/E17)*100)-100)) -> 20.96 | M17: =IF(G17=0,0,((D17/G17)*100)-100) -> 29.91 | N17: =IF(H17=0,0,((D17/H17)*100)-100) -> 108.66 | O17: =IF(D17=0,0,IF(I17=0,0,((D17/I17)*100)-100)) -> 119.18 | Q17: 1520000 | R17: =IF(D17=0,0,((D17/Q17)*100)-100) -> 14.92 | S17: =IF(D17=0,0,(D17/$D$32)*100) -> 3.39 | U17: 17.5 | V17: 15.65
A18: Apucarana | C18: 1540000 | D18: 1555017 | E18: 1336992 | G18: 1315361 | H18: 1089987 | I18: 1031596 | K18: =IF(C18=0,0,((D18/C18)*100)-100) -> 00.98 | L18: =IF(D18=0,0,IF(E18=0,0,((D18/E18)*100)-100)) -> 16.31 | M18: =IF(G18=0,0,((D18/G18)*100)-100) -> 18.22 | N18: =IF(H18=0,0,((D18/H18)*100)-100) -> 42.66 | O18: =IF(D18=0,0,IF(I18=0,0,((D18/I18)*100)-100)) -> 50.74 | Q18: 1540000 | R18: =IF(D18=0,0,((D18/Q18)*100)-100) -> 00.98 | S18: =IF(D18=0,0,(D18/$D$32)*100) -> 3.02 | U18: 17.33 | V18: 16.41
A19: Ah | C19: 1250000 | D19: 1186684 | E19: 1013318 | G19: 1293035 | H19: 975821 | I19: 1092187 | K19: =IF(C19=0,0,((D19/C19)*100)-100) -> -5.07 | L19: =IF(D19=0,0,IF(E19=0,0,((D19/E19)*100)-100)) -> 17.11 | M19: =IF(G19=0,0,((D19/G19)*100)-100) -> -8.22 | N19: =IF(H19=0,0,((D19/H19)*100)-100) -> 21.61 | O19: =IF(D19=0,0,IF(I19=0,0,((D19/I19)*100)-100)) -> 8.65 | Q19: 1250000 | R19: =IF(D19=0,0,((D19/Q19)*100)-100) -> -5.07 | S19: =IF(D19=0,0,(D19/$D$32)*100) -> 2.3 | U19: 17.5 | V19: 15.96
A20: P.G. Centro | C20: 1840000 | D20: 1802233 | E20: 1603418 | G20: 1670409 | H20: 1242064 | I20: 1053559 | K20: =IF(C20=0,0,((D20/C20)*100)-100) -> -2.05 | L20: =IF(D20=0,0,IF(E20=0,0,((D20/E20)*100)-100)) -> 12.4 | M20: =IF(G20=0,0,((D20/G20)*100)-100) -> 7.89 | N20: =IF(H20=0,0,((D20/H20)*100)-100) -> 45.1 | O20: =IF(D20=0,0,IF(I20=0,0,((D20/I20)*100)-100)) -> 71.06 | Q20: 1840000 | R20: =IF(D20=0,0,((D20/Q20)*100)-100) -> -2.05 | S20: =IF(D20=0,0,(D20/$D$32)*100) -> 3.5 | U20: 17.5 | V20: 17.14
A21: Maring | C21: 2280000 | D21: 2292168 | E21: 2026575 | G21: 2044843 | H21: 1557279 | I21: 1589317 | K21: =IF(C21=0,0,((D21/C21)*100)-100) -> 00.53 | L21: =IF(D21=0,0,IF(E21=0,0,((D21/E21)*100)-100)) -> 13.11 | M21: =IF(G21=0,0,((D21/G21)*100)-100) -> 12.1 | N21: =IF(H21=0,0,((D21/H21)*100)-100) -> 47.19 | O21: =IF(D21=0,0,IF(I21=0,0,((D21/I21)*100)-100)) -> 44.22 | Q21: 2280000 | R21: =IF(D21=0,0,((D21/Q21)*100)-100) -> 00.53 | S21: =IF(D21=0,0,(D21/$D$32)*100) -> 4.45 | U21: 17.85 | V21: 17.21
A22: Araucria Nova | C22: 2100000 | D22: 2266852 | E22: 1949037 | G22: 1864701 | H22: 0 | I22: 0 | K22: =IF(C22=0,0,((D22/C22)*100)-100) -> 7.95 | L22: =IF(D22=0,0,IF(E22=0,0,((D22/E22)*100)-100)) -> 16.31 | M22: =IF(G22=0,0,((D22/G22)*100)-100) -> 21.57 | N22: =IF(H22=0,0,((D22/H22)*100)-100) -> 0 | O22: =IF(D22=0,0,IF(I22=0,0,((D22/I22)*100)-100)) -> 0 | Q22: 2100000 | R22: =IF(D22=0,0,((D22/Q22)*100)-100) -> 7.95 | S22: =IF(D22=0,0,(D22/$D$32)*100) -> 4.4 | U22: 17 | V22: 16.26
A23: Total Super | C23: =SUM(C7:C22) -> 27540000 | D23: =SUM(D7:D22) -> 27616532 | E23: =SUM(E7:E22) -> 23902159 | G23: =SUM(G7:G22) -> 25573739 | H23: =SUM(H7:H22) -> 19042667 | I23: =SUM(I7:I22) -> 19006986 | J23: =SUM(C23:I23) -> 142682083 | K23: =IF(D23=0,0,((D23/C23)*100)-100) -> 00.28 | L23: =IF(D23=0,0,IF(E23=0,0,((D23/E23)*100)-100)) -> 15.54 | M23: =IF(G23=0,0,IF(D23=0,0,((D23/G23)*100)-100)) -> 7.99 | N23: =IF(H23=0,0,IF(D23=0,0,((D23/H23)*100)-100)) -> 45.02 | O23: =IF(D23=0,0,IF(I23=0,0,((D23/I23)*100)-100)) -> 45.3 | Q23: =SUM(Q7:Q22) -> 27540000 | R23: =IF(D23=0,0,((D23/Q23)*100)-100) -> 00.28 | S23: =IF(D23=0,0,(D23/$D$32)*100) -> 53.62 | U23: 17.04 | V23: 15.69
A25: Londrina | C25: 2480000 | D25: 2254586 | E25: 2174739 | G25: 2280901 | H25: 2007608 | I25: 2097439 | K25: =IF(C25=0,0,((D25/C25)*100)-100) -> -9.09 | L25: =IF(D25=0,0,IF(E25=0,0,((D25/E25)*100)-100)) -> 3.67 | M25: =IF(G25=0,0,((D25/G25)*100)-100) -> -1.15 | N25: =IF(H25=0,0,((D25/H25)*100)-100) -> 12.3 | O25: =IF(D25=0,0,IF(I25=0,0,((D25/I25)*100)-100)) -> 7.49 | Q25: 2480000 | R25: =IF(D25=0,0,((D25/Q25)*100)-100) -> -9.09 | S25: =IF(D25=0,0,(D25/$D$32)*100) -> 4.38 | U25: 17.75 | V25: 15.01
A26: S.J. Pinhais | C26: 4450000 | D26: 4422237 | E26: 3950795 | G26: 4038347 | H26: 3155804 | I26: 2762050 | K26: =IF(C26=0,0,((D26/C26)*100)-100) -> -00.62 | L26: =IF(D26=0,0,IF(E26=0,0,((D26/E26)*100)-100)) -> 11.93 | M26: =IF(G26=0,0,((D26/G26)*100)-100) -> 9.51 | N26: =IF(H26=0,0,((D26/H26)*100)-100) -> 40.13 | O26: =IF(D26=0,0,IF(I26=0,0,((D26/I26)*100)-100)) -> 60.11 | Q26: 4450000 | R26: =IF(D25=0,0,((D26/Q26)*100)-100) -> -00.62 | S26: =IF(D26=0,0,(D26/$D$32)*100) -> 8.59 | U26: 16.3 | V26: 15.41
A27: P.G. Nova | C27: 3350000 | D27: 3487523 | E27: 3023353 | G27: 2860146 | H27: 2447725 | I27: 2104835 | K27: =IF(C27=0,0,((D27/C27)*100)-100) -> 4.11 | L27: =IF(D27=0,0,IF(E27=0,0,((D27/E27)*100)-100)) -> 15.35 | M27: =IF(G27=0,0,((D27/G27)*100)-100) -> 21.94 | N27: =IF(H27=0,0,((D27/H27)*100)-100) -> 42.48 | O27: =IF(D27=0,0,IF(I27=0,0,((D27/I27)*100)-100)) -> 65.69 | Q27: 3350000 | R27: =IF(D26=0,0,((D27/Q27)*100)-100) -> 4.11 | S27: =IF(D27=0,0,(D27/$D$32)*100) -> 6.77 | U27: 16.35 | V27: 15.5
A28: Nilo Peanha | C28: 8700000 | D28: 8727528 | E28: 7815025 | G28: 8253285 | H28: 5740631 | I28: 0 | K28: =IF(C28=0,0,((D28/C28)*100)-100) -> 00.32 | L28: =IF(D28=0,0,IF(E28=0,0,((D28/E28)*100)-100)) -> 11.68 | M28: =IF(G28=0,0,((D28/G28)*100)-100) -> 5.75 | N28: =IF(H28=0,0,((D28/H28)*100)-100) -> 52.03 | O28: =IF(D28=0,0,IF(I28=0,0,((D28/I28)*100)-100)) -> 0 | Q28: 8700000 | R28: =IF(D26=0,0,((D28/Q28)*100)-100) -> 00.32 | S28: =IF(D28=0,0,(D28/$D$32)*100) -> 16.94 | U28: 15.53 | V28: 14.71
A29: Champagnat | C29: 5300000 | D29: 5000066 | E29: 4527364 | G29: 0 | H29: 0 | I29: 0 | K29: =IF(C29=0,0,((D29/C29)*100)-100) -> -5.66 | L29: =IF(D29=0,0,IF(E29=0,0,((D29/E29)*100)-100)) -> 10.44 | M29: =IF(G29=0,0,((D29/G29)*100)-100) -> 0 | N29: =IF(H29=0,0,((D29/H29)*100)-100) -> 0 | O29: =IF(D29=0,0,IF(I29=0,0,((D29/I29)*100)-100)) -> 0 | Q29: 5300000 | R29: 0 | S29: =IF(D29=0,0,(D29/$D$32)*100) -> 9.71 | U29: 14.5 | V29: 13.72
A30: Total Hiper | C30: =SUM(C25:C29) -> 24280000 | D30: =SUM(D25:D29) -> 23891940 | E30: =SUM(E25:E29) -> 21491276 | G30: =SUM(G25:G29) -> 17432679 | H30: =SUM(H25:H29) -> 13351768 | I30: =SUM(I25:I29) -> 6964324 | J30: =SUM(C30:I30) -> 107411987 | K30: =IF(D30=0,0,((D30/C30)*100)-100) -> -1.6 | L30: =IF(D30=0,0,IF(E30=0,0,((D30/E30)*100)-100)) -> 11.17 | M30: =IF(G30=0,0,IF(D30=0,0,((D30/G30)*100)-100)) -> 37.05 | N30: =IF(H30=0,0,IF(D30=0,0,((D30/H30)*100)-100)) -> 78.94 | O30: =IF(D30=0,0,IF(I30=0,0,((D30/I30)*100)-100)) -> 243.06 | Q30: =SUM(Q25:Q29) -> 24280000 | R30: =IF(D30=0,0,((D30/Q30)*100)-100) -> -1.6 | S30: =IF(D30=0,0,(D30/$D$32)*100) -> 46.38 | U30: 15.79 | V30: 15.22
A32: Total Geral | C32: =C23+C30 -> 51820000 | D32: =D23+D30 -> 51508472 | E32: =E23+E30 -> 45393435 | G32: =G23+G30 -> 43006418 | H32: =H23+H30 -> 32394435 | I32: =I23+I30 -> 25971310 | K32: =IF(D30=0,0,((D32/C32)*100)-100) -> -00.6 | L32: =IF(D32=0,0,IF(E32=0,0,((D32/E32)*100)-100)) -> 13.47 | M32: =IF(G32=0,0,IF(D32=0,0,((D32/G32)*100)-100)) -> 19.77 | N32: =IF(H32=0,0,IF(D32=0,0,((D32/H32)*100)-100)) -> 59 | O32: =IF(D32=0,0,IF(I32=0,0,((D32/I32)*100)-100)) -> 98.33 | Q32: =Q23+Q30 -> 51820000 | R32: =IF(D32=0,0,((D32/Q32)*100)-100) -> -00.6 | S32: =S23+S30 -> 100 | U32: 16.41 | V32: 15.4
C33: Resumo por Regio - Outubro/2002
C34: Descrio das Aberturas | H34: Valor | I34: %
C35: Curitiba (2,3,6,7,10,11,17,21,22) | H35: =D7+D8+D11+D12+D14+D16+D19+D28+D29 -> 25981012 | I35: =IF(D32=0,0,H35/$D$32) -> 0.50439999999999996
C36: Curitiba e Metrop. (Ctba. 4,5,8,14,23) | H36: =H35+D9+D10+D13+D27+D22 -> 37435504 | I36: =IF(D32=0,0,H36/$D$32) -> 0.7268
C37: Metropolitana (4,5,8,14,23) | H37: =H36-H35 -> 11454492 | I37: =IF(D32=0,0,H37/$D$32) -> 0.22239999999999999
C38: Norte (9,15,20) | H38: =D25+D18+D22 -> 6076455 | I38: =IF(D32=0,0,H38/$D$32) -> 0.11799999999999999
C39: Centro-Oeste (13,18,19) | H39: =D17+D20+D27 -> 7036483 | I39: =IF(D32=0,0,H39/$D$32) -> 0.1366
C40: Ponta Grossa (18,19) | H40: =H39-D17 -> 5289756 | I40: =IF(D32=0,0,H40/$D$32) -> 0.1027
C41: Super (2,3,4,5,6,7,8,10,11,13,15,17,18,20,23) | H41: =D23 -> 27616532 | I41: =IF(D32=0,0,H41/$D$32) -> 0.53620000000000001
C42: Hiper (9,14,19,21,22) | H42: =D30 -> 23891940 | I42: =IF(D32=0,0,H42/$D$32) -> 0.46379999999999999
C43: Curitiba, Metropolitana e Centro-Oeste | H43: =D32-H38 -> 45432017 | I43: =IF(D32=0,0,H43/$D$32) -> 0.88200000000000001
C44: Araucria | H44: =D10+D22 -> 3291115 | I44: =IF(D32=0,0,H44/$D$32) -> 6.3899999999999998E-2