A2: Periodo: | B2: 40756 | C2: a | D2: 40786 | G2: Vendas Acumuladas por Filial | P2: =NOW() -> 40787.374989814816
A4: v.New | B4: Vendas 2011 | F4: Vendas de Anos Anteriores | J4: Percentuais ( % ) | P4: Meta Mensal | T4: Margem
A5: Lojas | B5: Previsao | C5: Realizada | D5: Mes Anterior | F5: Vendas 2010 | G5: Vendas 2009 | H5: Vendas 2008 | J5: % Prev | K5: % MA | L5: 2010 | M5: 2009 | N5: 2008 | P5: Previsao Mes | Q5: Final | R5: Part. | T5: Meta | U5: Coml | V5: Dif
A6: S. Felicidade | B6: 3300000 | C6: 3479679.04 | D6: 3628901.57 | F6: 2954912.29 | G6: 2927116.09 | H6: 2450587.39 | J6: =IF(B6=0,0,((C6/B6)*100)-100) -> 5.4448193939393974 | K6: =IF(C6=0,0,IF(D6=0,0,((C6/D6)*100)-100)) -> -4.1120577982499498 | L6: =IF(F6=0,0,((C6/F6)*100)-100) -> 17.759131185582504 | M6: =IF(G6=0,0,((C6/G6)*100)-100) -> 18.877384190115947 | N6: =IF(C6=0,0,IF(H6=0,0,((C6/H6)*100)-100)) -> 41.993672790424341 | P6: 3300000 | Q6: =IF(C6=0,0,((C6/P6)*100)-100) -> 5.4448193939393974 | R6: =IF(C6=0,0,(C6/$C$40)*100) -> 2.4385912289399987 | T6: 17.2 | U6: 16.523590609667266 | V6: =U6-T6 -> -0.67640939033273284
A7: Lapa | B7: 2400000 | C7: 2428673.56 | D7: 2592981.67 | F7: 2256853.47 | G7: 2194545.64 | H7: 2109908.91 | J7: =IF(B7=0,0,((C7/B7)*100)-100) -> 1.1947316666666552 | K7: =IF(C7=0,0,IF(D7=0,0,((C7/D7)*100)-100)) -> -6.336647570671019 | L7: =IF(F7=0,0,((C7/F7)*100)-100) -> 7.6132585603796485 | M7: =IF(G7=0,0,((C7/G7)*100)-100) -> 10.668628427340423 | N7: =IF(C7=0,0,IF(H7=0,0,((C7/H7)*100)-100)) -> 15.107981604760369 | P7: 2400000 | Q7: =IF(C7=0,0,((C7/P7)*100)-100) -> 1.1947316666666552 | R7: =IF(C7=0,0,(C7/$C$40)*100) -> 1.7020368756120914 | T7: 16 | U7: 14.70611142981274 | V7: =U7-T7 -> -1.29388857018726
A8: Araucaria | B8: 1499999 | C8: 1563670.39 | D8: 1571967.05 | F8: 1434345.09 | G8: 1395128.03 | H8: 1171432.72 | J8: =IF(B8=0,0,((C8/B8)*100)-100) -> 4.2447621631747694 | K8: =IF(C8=0,0,IF(D8=0,0,((C8/D8)*100)-100)) -> -0.52778841643024066 | L8: =IF(F8=0,0,((C8/F8)*100)-100) -> 9.0163309305154655 | M8: =IF(G8=0,0,((C8/G8)*100)-100) -> 12.080780858513734 | N8: =IF(C8=0,0,IF(H8=0,0,((C8/H8)*100)-100)) -> 33.483584955694255 | P8: 1500000 | Q8: =IF(C8=0,0,((C8/P8)*100)-100) -> 4.2446926666666513 | R8: =IF(C8=0,0,(C8/$C$40)*100) -> 1.0958346600861173 | T8: 16.85 | U8: 16.693385746084253 | V8: =U8-T8 -> -0.15661425391574824
A9: Hauer | B9: 4000000 | C9: 4020317.34 | D9: 4272621.88 | F9: 3743117.98 | G9: 4025689.1 | H9: 3766960.7 | J9: =IF(B9=0,0,((C9/B9)*100)-100) -> 0.50793350000000714 | K9: =IF(C9=0,0,IF(D9=0,0,((C9/D9)*100)-100)) -> -5.9051455309216436 | L9: =IF(F9=0,0,((C9/F9)*100)-100) -> 7.4055736816502957 | M9: =IF(G9=0,0,((C9/G9)*100)-100) -> -0.13343703069369894 | N9: =IF(C9=0,0,IF(H9=0,0,((C9/H9)*100)-100)) -> 6.7257574521549799 | P9: 4000000 | Q9: =IF(C9=0,0,((C9/P9)*100)-100) -> 0.50793350000000714 | R9: =IF(C9=0,0,(C9/$C$40)*100) -> 2.8174755459283354 | T9: 16.33 | U9: 15.86557095017778 | V9: =U9-T9 -> -0.46442904982221833
A10: Paranagua | B10: 2150000 | C10: 2346615.75 | D10: 2295514.16 | F10: 2221148.85 | G10: 2074746.43 | H10: 1865698.74 | J10: =IF(B10=0,0,((C10/B10)*100)-100) -> 9.144918604651167 | K10: =IF(C10=0,0,IF(D10=0,0,((C10/D10)*100)-100)) -> 2.2261500665279925 | L10: =IF(F10=0,0,((C10/F10)*100)-100) -> 5.6487389397608325 | M10: =IF(G10=0,0,((C10/G10)*100)-100) -> 13.103737211877032 | N10: =IF(C10=0,0,IF(H10=0,0,((C10/H10)*100)-100)) -> 25.776777337588811 | P10: 2150000 | Q10: =IF(C10=0,0,((C10/P10)*100)-100) -> 9.144918604651167 | R10: =IF(C10=0,0,(C10/$C$40)*100) -> 1.6445300040208468 | T10: 17.49 | U10: 17.063655607016191 | V10: =U10-T10 -> -0.42634439298380755
A11: Sitio Cercado | B11: 3000000 | C11: 3044989.17 | D11: 3310090.36 | F11: 2407630.8 | G11: 2345310.64 | H11: 1963916.61 | J11: =IF(B11=0,0,((C11/B11)*100)-100) -> 1.4996390000000019 | K11: =IF(C11=0,0,IF(D11=0,0,((C11/D11)*100)-100)) -> -8.0088807605844323 | L11: =IF(F11=0,0,((C11/F11)*100)-100) -> 26.472429659896363 | M11: =IF(G11=0,0,((C11/G11)*100)-100) -> 29.833085565159905 | N11: =IF(C11=0,0,IF(H11=0,0,((C11/H11)*100)-100)) -> 55.046764943853702 | P11: 3000000 | Q11: =IF(C11=0,0,((C11/P11)*100)-100) -> 1.4996390000000019 | R11: =IF(C11=0,0,(C11/$C$40)*100) -> 2.133956550825816 | T11: 15.29 | U11: 14.032046508066893 | V11: =U11-T11 -> -1.2579534919331063
A12: Apucarana | B12: 3020000 | C12: 2799211.03 | D12: 3130976.14 | F12: 2608380.29 | G12: 2689766.58 | H12: 2348659.1 | J12: =IF(B12=0,0,((C12/B12)*100)-100) -> -7.3108930463576201 | K12: =IF(C12=0,0,IF(D12=0,0,((C12/D12)*100)-100)) -> -10.596219682466185 | L12: =IF(F12=0,0,((C12/F12)*100)-100) -> 7.3160627969627683 | M12: =IF(G12=0,0,((C12/G12)*100)-100) -> 4.0689199878451774 | N12: =IF(C12=0,0,IF(H12=0,0,((C12/H12)*100)-100)) -> 19.183368501627143 | P12: 3000000 | Q12: =IF(C12=0,0,((C12/P12)*100)-100) -> -6.6929656666666659 | R12: =IF(C12=0,0,(C12/$C$40)*100) -> 1.9617129589371836 | T12: 16.3 | U12: 14.90134811307885 | V12: =U12-T12 -> -1.3986518869211508
A13: Ahú | B13: 2150000 | C13: 2242304.99 | D13: 2310955.64 | F13: 1874908.07 | G13: 1756091.51 | H13: 1648684.85 | J13: =IF(B13=0,0,((C13/B13)*100)-100) -> 4.2932553488372207 | K13: =IF(C13=0,0,IF(D13=0,0,((C13/D13)*100)-100)) -> -2.9706606570777723 | L13: =IF(F13=0,0,((C13/F13)*100)-100) -> 19.595463152494744 | M13: =IF(G13=0,0,((C13/G13)*100)-100) -> 27.687251901810072 | N13: =IF(C13=0,0,IF(H13=0,0,((C13/H13)*100)-100)) -> 36.005676888460528 | P13: 2150000 | Q13: =IF(C13=0,0,((C13/P13)*100)-100) -> 4.2932553488372207 | R13: =IF(C13=0,0,(C13/$C$40)*100) -> 1.5714280594173398 | T13: 17.02 | U13: 16.199799385898881 | V13: =U13-T13 -> -0.82020061410111822
A14: P.G. Centro | B14: 2150000 | C14: 2325101.25 | D14: 2296929.47 | F14: 1917936.27 | G14: 1932278.69 | H14: 2067849.34 | J14: =IF(B14=0,0,((C14/B14)*100)-100) -> 8.1442441860465067 | K14: =IF(C14=0,0,IF(D14=0,0,((C14/D14)*100)-100)) -> 1.2264973900134635 | L14: =IF(F14=0,0,((C14/F14)*100)-100) -> 21.229327917136672 | M14: =IF(G14=0,0,((C14/G14)*100)-100) -> 20.329498122240338 | N14: =IF(C14=0,0,IF(H14=0,0,((C14/H14)*100)-100)) -> 12.440553817136404 | P14: 2150000 | Q14: =IF(C14=0,0,((C14/P14)*100)-100) -> 8.1442441860465067 | R14: =IF(C14=0,0,(C14/$C$40)*100) -> 1.6294524435930238 | T14: 18.29 | U14: 17.921915271431725 | V14: =U14-T14 -> -0.36808472856827379
A15: Maringa | B15: 3399999 | C15: 3528095.76 | D15: 3475395.94 | F15: 3130508.11 | G15: 2774162.76 | H15: 2980523 | J15: =IF(B15=0,0,((C15/B15)*100)-100) -> 3.7675528728096594 | K15: =IF(C15=0,0,IF(D15=0,0,((C15/D15)*100)-100)) -> 1.5163688083263338 | L15: =IF(F15=0,0,((C15/F15)*100)-100) -> 12.700419102252368 | M15: =IF(G15=0,0,((C15/G15)*100)-100) -> 27.176956264815558 | N15: =IF(C15=0,0,IF(H15=0,0,((C15/H15)*100)-100)) -> 18.371700537120489 | P15: 3400000 | Q15: =IF(C15=0,0,((C15/P15)*100)-100) -> 3.767522352941171 | R15: =IF(C15=0,0,(C15/$C$40)*100) -> 2.4725221137626523 | T15: 17.31 | U15: 16.628866105380315 | V15: =U15-T15 -> -0.6811338946196841
A16: Araucaria Nova | B16: 4750000 | C16: 4944687.41 | D16: 5355180.78 | F16: 4367701.21 | G16: 3845093.08 | H16: 3275597.95 | J16: =IF(B16=0,0,((C16/B16)*100)-100) -> 4.0986823157894747 | K16: =IF(C16=0,0,IF(D16=0,0,((C16/D16)*100)-100)) -> -7.6653503749690373 | L16: =IF(F16=0,0,((C16/F16)*100)-100) -> 13.210294666653738 | M16: =IF(G16=0,0,((C16/G16)*100)-100) -> 28.597339703412331 | N16: =IF(C16=0,0,IF(H16=0,0,((C16/H16)*100)-100)) -> 50.955260244927189 | P16: 4750000 | Q16: =IF(C16=0,0,((C16/P16)*100)-100) -> 4.0986823157894747 | R16: =IF(C16=0,0,(C16/$C$40)*100) -> 3.4652826336178522 | T16: 16.23 | U16: 16.064048829327312 | V16: =U16-T16 -> -0.16595117067268816
A17: Cristo Rei | B17: 2850000 | C17: 2970522.53 | D17: 2903347.11 | F17: 2479694.32 | G17: 2125436.33 | H17: 1775110.29 | J17: =IF(B17=0,0,((C17/B17)*100)-100) -> 4.2288607017543853 | K17: =IF(C17=0,0,IF(D17=0,0,((C17/D17)*100)-100)) -> 2.3137233494619807 | L17: =IF(F17=0,0,((C17/F17)*100)-100) -> 19.793899838428473 | M17: =IF(G17=0,0,((C17/G17)*100)-100) -> 39.760598239138943 | N17: =IF(C17=0,0,IF(H17=0,0,((C17/H17)*100)-100)) -> 67.342984080160988 | P17: 2850000 | Q17: =IF(C17=0,0,((C17/P17)*100)-100) -> 4.2288607017543853 | R17: =IF(C17=0,0,(C17/$C$40)*100) -> 2.0817696413249234 | T17: 17.43 | U17: 17.420975090197345 | V17: =U17-T17 -> -9.0249098026546903E-3
A18: Fazenda | B18: 2950000 | C18: 2939834.97 | D18: 3124776.47 | F18: 2695948.09 | G18: 0 | H18: 0 | J18: =IF(B18=0,0,((C18/B18)*100)-100) -> -0.34457728813558219 | K18: =IF(C18=0,0,IF(D18=0,0,((C18/D18)*100)-100)) -> -5.9185513516107591 | L18: =IF(F18=0,0,((C18/F18)*100)-100) -> 9.0464234420774829 | M18: =IF(G18=0,0,((C18/G18)*100)-100) -> 0 | N18: =IF(C18=0,0,IF(H18=0,0,((C18/H18)*100)-100)) -> 0 | P18: 2950000 | Q18: =IF(C18=0,0,((C18/P18)*100)-100) -> -0.34457728813558219 | R18: =IF(C18=0,0,(C18/$C$40)*100) -> 2.0602635156755964 | T18: 16 | U18: 15.801859109118633 | V18: =U18-T18 -> -0.19814089088136733
A19: Campo Largo | B19: 4000000 | C19: 4146796.43 | D19: 4327869.34 | F19: 3600758.67 | G19: 3233086.91 | H19: 2479370.44 | J19: =IF(B19=0,0,((C19/B19)*100)-100) -> 3.6699107499999997 | K19: =IF(C19=0,0,IF(D19=0,0,((C19/D19)*100)-100)) -> -4.1838811612552007 | L19: =IF(F19=0,0,((C19/F19)*100)-100) -> 15.164519759387261 | M19: =IF(G19=0,0,((C19/G19)*100)-100) -> 28.261211202639771 | N19: =IF(C19=0,0,IF(H19=0,0,((C19/H19)*100)-100)) -> 67.251991194990609 | P19: 4000000 | Q19: =IF(C19=0,0,((C19/P19)*100)-100) -> 3.6699107499999997 | R19: =IF(C19=0,0,(C19/$C$40)*100) -> 2.9061132610660834 | T19: 16.5 | U19: 15.851793332425531 | V19: =U19-T19 -> -0.64820666757446865
A20: Brasilia | B20: 2750000 | C20: 2925240.76 | D20: 3115367.56 | F20: 2406203.81 | G20: 2713596.46 | H20: 2651139.08 | J20: =IF(B20=0,0,((C20/B20)*100)-100) -> 6.3723912727272563 | K20: =IF(C20=0,0,IF(D20=0,0,((C20/D20)*100)-100)) -> -6.1028689661261097 | L20: =IF(F20=0,0,((C20/F20)*100)-100) -> 21.570780822593733 | M20: =IF(G20=0,0,((C20/G20)*100)-100) -> 7.7994021262837236 | N20: =IF(C20=0,0,IF(H20=0,0,((C20/H20)*100)-100)) -> 10.339015484619523 | P20: 2750000 | Q20: =IF(C20=0,0,((C20/P20)*100)-100) -> 6.3723912727272563 | R20: =IF(C20=0,0,(C20/$C$40)*100) -> 2.0500357584341384 | T20: 16.5 | U20: 15.661068868738177 | V20: =U20-T20 -> -0.83893113126182328
A21: Total Super | B21: =SUM(B6:B20) -> 44369998 | C21: =SUM(C6:C20) -> 45705740.379999995 | D21: =SUM(D6:D20) -> 47712875.140000001 | F21: =SUM(F6:F20) -> 40100047.320000008 | G21: =SUM(G6:G20) -> 36032048.25 | H21: =SUM(H6:H20) -> 32555439.119999997 | I21: =SUM(B21:H21) -> 246476148.20999998 | J21: =IF(C21=0,0,((C21/B21)*100)-100) -> 3.0104630160226549 | K21: =IF(C21=0,0,IF(D21=0,0,((C21/D21)*100)-100)) -> -4.2066942185115295 | L21: =IF(F21=0,0,IF(C21=0,0,((C21/F21)*100)-100)) -> 13.979267942669324 | M21: =IF(G21=0,0,IF(C21=0,0,((C21/G21)*100)-100)) -> 26.847466629932697 | N21: =IF(C21=0,0,IF(H21=0,0,((C21/H21)*100)-100)) -> 40.393561307920692 | P21: =SUM(P6:P20) -> 44350000 | Q21: =IF(C21=0,0,((C21/P21)*100)-100) -> 3.0569117925591769 | R21: =IF(C21=0,0,(C21/$C$40)*100) -> 32.031005251241993 | T21: 16.645661463405968 | U21: 16.046735225427717 | V21: =U21-T21 -> -0.59892623797825095
A22: Pinheirinho | B22: 5100000 | C22: 5067076.75 | D22: 5316147.84 | F22: 4333747.36 | G22: 4921055.23 | H22: 4050066.52 | J22: =IF(B22=0,0,((C22/B22)*100)-100) -> -0.64555392156863434 | K22: =IF(C22=0,0,IF(D22=0,0,((C22/D22)*100)-100)) -> -4.6851798989848987 | L22: =IF(F22=0,0,((C22/F22)*100)-100) -> 16.921369177367083 | M22: =IF(G22=0,0,((C22/G22)*100)-100) -> 2.9672806578112727 | N22: =IF(C22=0,0,IF(H22=0,0,((C22/H22)*100)-100)) -> 25.110951264079489 | P22: 5100000 | Q22: =IF(C22=0,0,IF(P22=0,0,((C22/P22)*100)-100)) -> -0.64555392156863434 | R22: =IF(C22=0,0,(C22/$C$40)*100) -> 3.5510542141598767 | T22: 16.19 | U22: 15.399285988711341 | V22: =U22-T22 -> -0.79071401128866015
A23: Londrina | B23: 4399999 | C23: 4535938.19 | D23: 4739840.58 | F23: 3649138.59 | G23: 3505373.97 | H23: 3380529.65 | J23: =IF(B23=0,0,((C23/B23)*100)-100) -> 3.0895277476199396 | K23: =IF(C23=0,0,IF(D23=0,0,((C23/D23)*100)-100)) -> -4.3018828704994121 | L23: =IF(F23=0,0,((C23/F23)*100)-100) -> 24.301614699703705 | M23: =IF(G23=0,0,((C23/G23)*100)-100) -> 29.39955134088018 | N23: =IF(C23=0,0,IF(H23=0,0,((C23/H23)*100)-100)) -> 34.178328830809107 | P23: 4400000 | Q23: =IF(C23=0,0,IF(P23=0,0,((C23/P23)*100)-100)) -> 3.0895043181818238 | R23: =IF(C23=0,0,(C23/$C$40)*100) -> 3.1788274027560814 | T23: 15.75 | U23: 14.95841062155214 | V23: =U23-T23 -> -0.79158937844785981
A24: São Bráz | B24: 5600000 | C24: 5621580.4299999997 | D24: 6112421.1600000001 | F24: 5158006.82 | G24: 5265304.38 | H24: 4691817.11 | J24: =IF(B24=0,0,((C24/B24)*100)-100) -> 0.38536482142856698 | K24: =IF(C24=0,0,IF(D24=0,0,((C24/D24)*100)-100)) -> -8.030217767258705 | L24: =IF(F24=0,0,((C24/F24)*100)-100) -> 8.987456321354756 | M24: =IF(G24=0,0,((C24/G24)*100)-100) -> 6.7664853593896197 | N24: =IF(C24=0,0,IF(H24=0,0,((C24/H24)*100)-100)) -> 19.816699973627053 | P24: 5600000 | Q24: =IF(C24=0,0,IF(P24=0,0,((C24/P24)*100)-100)) -> 0.38536482142856698 | R24: =IF(C24=0,0,(C24/$C$40)*100) -> 3.9396555175901349 | T24: 15.75 | U24: 14.918066555173349 | V24: =U24-T24 -> -0.83193344482665132
A25: S.J. Pinhais | B25: 6300000 | C25: 6779515.5999999996 | D25: 7077042.3799999999 | F25: 5716395.5999999996 | G25: 5679269.7000000002 | H25: 5083034.32 | J25: =IF(B25=0,0,((C25/B25)*100)-100) -> 7.6113587301587273 | K25: =IF(C25=0,0,IF(D25=0,0,((C25/D25)*100)-100)) -> -4.2041118877685761 | L25: =IF(F25=0,0,((C25/F25)*100)-100) -> 18.597733158985719 | M25: =IF(G25=0,0,((C25/G25)*100)-100) -> 19.373017273682194 | N25: =IF(C25=0,0,IF(H25=0,0,((C25/H25)*100)-100)) -> 33.375365445102858 | P25: 6300000 | Q25: =IF(C25=0,0,IF(P25=0,0,((C25/P25)*100)-100)) -> 7.6113587301587273 | R25: =IF(C25=0,0,(C25/$C$40)*100) -> 4.7511471858685823 | T25: 16 | U25: 15.553714044112532 | V25: =U25-T25 -> -0.44628595588746833
A26: P.G. Nova | B26: 6400000 | C26: 6693806.6699999999 | D26: 7075854.96 | F26: 5263337.1 | G26: 4754274.72 | H26: 4624818.1 | J26: =IF(B26=0,0,((C26/B26)*100)-100) -> 4.5907292187499849 | K26: =IF(C26=0,0,IF(D26=0,0,((C26/D26)*100)-100)) -> -5.3993233631798461 | L26: =IF(F26=0,0,((C26/F26)*100)-100) -> 27.177996446398993 | M26: =IF(G26=0,0,((C26/G26)*100)-100) -> 40.795537999537402 | N26: =IF(C26=0,0,IF(H26=0,0,((C26/H26)*100)-100)) -> 44.736647480254419 | P26: 6400000 | Q26: =IF(C26=0,0,IF(P26=0,0,((C26/P26)*100)-100)) -> 4.5907292187499849 | R26: =IF(C26=0,0,(C26/$C$40)*100) -> 4.6910815756392461 | T26: 15.45 | U26: 14.331583018366439 | V26: =U26-T26 -> -1.1184169816335601
A27: Nilo Pecanha | B27: 14100000 | C27: 14590293.23 | D27: 15108402.640000001 | F27: 13033104.09 | G27: 12483871.65 | H27: 11312240.210000001 | J27: =IF(B27=0,0,((C27/B27)*100)-100) -> 3.4772569503546151 | K27: =IF(C27=0,0,IF(D27=0,0,((C27/D27)*100)-100)) -> -3.4292798672725837 | L27: =IF(F27=0,0,((C27/F27)*100)-100) -> 11.94795291472272 | M27: =IF(G27=0,0,((C27/G27)*100)-100) -> 16.873143517139582 | N27: =IF(C27=0,0,IF(H27=0,0,((C27/H27)*100)-100)) -> 28.977929739347331 | P27: 14100000 | Q27: =IF(C27=0,0,IF(P27=0,0,((C27/P27)*100)-100)) -> 3.4772569503546151 | R27: =IF(C27=0,0,(C27/$C$40)*100) -> 10.225012332844537 | T27: 16.35 | U27: 15.992790656887983 | V27: =U27-T27 -> -0.35720934311201802
A28: Champagnat | B28: 6500000 | C28: 6857590.4000000004 | D28: 7106008.4699999997 | F28: 6276968.7599999998 | G28: 7107216.8399999999 | H28: 6432557.5199999996 | J28: =IF(B28=0,0,((C28/B28)*100)-100) -> 5.5013907692307669 | K28: =IF(C28=0,0,IF(D28=0,0,((C28/D28)*100)-100)) -> -3.495887614668149 | L28: =IF(F28=0,0,((C28/F28)*100)-100) -> 9.2500323356715484 | M28: =IF(G28=0,0,((C28/G28)*100)-100) -> -3.5122952573373141 | N28: =IF(C28=0,0,IF(H28=0,0,((C28/H28)*100)-100)) -> 6.6075255243112281 | P28: 6500000 | Q28: =IF(C28=0,0,IF(P28=0,0,((C28/P28)*100)-100)) -> 5.5013907692307669 | R28: =IF(C28=0,0,(C28/$C$40)*100) -> 4.80586272724255 | T28: 16.85 | U28: 16.113587944826801 | V28: =U28-T28 -> -0.73641205517320074
A29: Santa Candida | B29: 8200000 | C29: 8695058.6099999994 | D29: 9227453.8900000006 | F29: 7117284.4900000002 | G29: 6687518.0099999998 | H29: 5524310.6699999999 | J29: =IF(B29=0,0,((C29/B29)*100)-100) -> 6.0373001219512048 | K29: =IF(C29=0,0,IF(D29=0,0,((C29/D29)*100)-100)) -> -5.7696877854569379 | L29: =IF(F29=0,0,((C29/F29)*100)-100) -> 22.168203648692412 | M29: =IF(G29=0,0,((C29/G29)*100)-100) -> 30.019217847310131 | N29: =IF(C29=0,0,IF(H29=0,0,((C29/H29)*100)-100)) -> 57.396264066372623 | P29: 8200000 | Q29: =IF(C29=0,0,IF(P29=0,0,((C29/P29)*100)-100)) -> 6.0373001219512048 | R29: =IF(C29=0,0,(C29/$C$40)*100) -> 6.0935774299072172 | T29: 16.25 | U29: 15.503366687484585 | V29: =U29-T29 -> -0.74663331251541543
A30: Paranaguá Raia | B30: 7800000 | C30: 8254600.4100000001 | D30: 8466449.5899999999 | F30: 7921748.7999999998 | G30: 6881639.6500000004 | H30: 5976249.3799999999 | J30: =IF(B30=0,0,((C30/B30)*100)-100) -> 5.8282103846153888 | K30: =IF(C30=0,0,IF(D30=0,0,((C30/D30)*100)-100)) -> -2.5022198236462856 | L30: =IF(F30=0,0,((C30/F30)*100)-100) -> 4.2017440643914483 | M30: =IF(G30=0,0,((C30/G30)*100)-100) -> 19.951070236582353 | N30: =IF(C30=0,0,IF(H30=0,0,((C30/H30)*100)-100)) -> 38.123426335331402 | P30: 7800000 | Q30: =IF(C30=0,0,IF(P30=0,0,((C30/P30)*100)-100)) -> 5.8282103846153888 | R30: =IF(C30=0,0,(C30/$C$40)*100) -> 5.7849002528205924 | T30: 17.68 | U30: 17.736735847641107 | V30: =U30-T30 -> 5.6735847641107284E-2
A31: Novo Mundo | B31: 5900000 | C31: 6101780.71 | D31: 6495092.8499999996 | F31: 5131600.7 | G31: 0 | H31: 0 | J31: =IF(B31=0,0,((C31/B31)*100)-100) -> 3.4200120338983027 | K31: =IF(C31=0,0,IF(D31=0,0,((C31/D31)*100)-100)) -> -6.0555275972690623 | L31: =IF(F31=0,0,((C31/F31)*100)-100) -> 18.905991847728927 | M31: =IF(G31=0,0,((C31/G31)*100)-100) -> 0 | N31: =IF(C31=0,0,IF(H31=0,0,((C31/H31)*100)-100)) -> 0 | P31: 5900000 | Q31: =IF(C31=0,0,IF(P31=0,0,((C31/P31)*100)-100)) -> 3.4200120338983027 | R31: =IF(C31=0,0,(C31/$C$40)*100) -> 4.2761843116200957 | T31: 15.71 | U31: 15.181851826989043 | V31: =U31-T31 -> -0.52814817301095829
A32: Uvaranas | B32: 5600000 | C32: 5879344.8099999996 | D32: 6485147.46 | F32: 4931330.99 | G32: 4700870.67 | H32: 0 | J32: =IF(B32=0,0,((C32/B32)*100)-100) -> 4.9883001785714214 | K32: =IF(C32=0,0,IF(D32=0,0,((C32/D32)*100)-100)) -> -9.3413858934828369 | L32: =IF(F32=0,0,((C32/F32)*100)-100) -> 19.224299117670853 | M32: =IF(G32=0,0,((C32/G32)*100)-100) -> 25.069273816035434 | N32: =IF(C32=0,0,IF(H32=0,0,((C32/H32)*100)-100)) -> 0 | P32: 5600000 | Q32: =IF(C32=0,0,IF(P32=0,0,((C32/P32)*100)-100)) -> 4.9883001785714214 | R32: =IF(C32=0,0,(C32/$C$40)*100) -> 4.1202991772424795 | T32: 15.5 | U32: 15.007403690616336 | V32: =U32-T32 -> -0.49259630938366428
A33: Torres | B33: 6300000 | C33: 6407423.8499999996 | D33: 7095670.75 | F33: 5429992.6200000001 | G33: 5156231.54 | H33: 0 | J33: =IF(B33=0,0,((C33/B33)*100)-100) -> 1.7051404761904791 | K33: =IF(C33=0,0,IF(D33=0,0,((C33/D33)*100)-100)) -> -9.6995326340360464 | L33: =IF(F33=0,0,((C33/F33)*100)-100) -> 18.000599603024867 | M33: =IF(G33=0,0,((C33/G33)*100)-100) -> 24.265634704216538 | N33: =IF(C33=0,0,IF(H33=0,0,((C33/H33)*100)-100)) -> 0 | P33: 6300000 | Q33: =IF(C33=0,0,IF(P33=0,0,((C33/P33)*100)-100)) -> 1.7051404761904791 | R33: =IF(C33=0,0,(C33/$C$40)*100) -> 4.4903818487554981 | T33: 16.1 | U33: 15.914957928060277 | V33: =U33-T33 -> -0.18504207193972455
A34: Total Hiper | B34: =SUM(B22:B33) -> 82199999 | C34: =SUM(C22:C33) -> 85484009.659999996 | D34: =SUM(D22:D33) -> 90305532.569999993 | F34: =SUM(F22:F33) -> 73962655.920000002 | G34: =SUM(G22:G33) -> 67142626.359999999 | H34: =SUM(H22:H33) -> 51075623.480000012 | I34: =SUM(B34:H34) -> 450170446.99000001 | J34: =IF(C34=0,0,((C34/B34)*100)-100) -> 3.9951468369239223 | K34: =IF(C34=0,0,IF(D34=0,0,((C34/D34)*100)-100)) -> -5.3391223912694414 | L34: =IF(F34=0,0,IF(C34=0,0,((C34/F34)*100)-100)) -> 15.577258004988082 | M34: =IF(G34=0,0,IF(C34=0,0,((C34/G34)*100)-100)) -> 27.317047744987846 | N34: =IF(C34=0,0,IF(H34=0,0,((C34/H34)*100)-100)) -> 67.367530410027172 | P34: =SUM(P22:P33) -> 82200000 | Q34: =IF(C34=0,0,((C34/P34)*100)-100) -> 3.9951455717761633 | R34: =IF(C34=0,0,(C34/$C$40)*100) -> 59.907983976446886 | T34: 16.202944044439711 | U34: 15.663965134482439 | V34: =U34-T34 -> -0.53897890995727238
A35: Total s/ 29,30,37 | B35: =B21+B34 -> 126569997 | C35: =C21+C34 -> 131189750.03999999 | D35: =D21+D34 -> 138018407.70999998 | E35: =E21+E34 -> 0 | F35: =F21+F34 -> 114062703.24000001 | G35: =G21+G34 -> 103174674.61 | H35: =H21+H34 -> 83631062.600000009 | I35: =SUM(B35:H35) -> 696646595.20000005 | J35: =IF(C35=0,0,((C35/B35)*100)-100) -> 3.649959034130319 | K35: =IF(C35=0,0,IF(D35=0,0,((C35/D35)*100)-100)) -> -4.9476426973046728 | L35: =IF(F35=0,0,IF(C35=0,0,((C35/F35)*100)-100)) -> 15.015466329921054 | M35: =IF(G35=0,0,IF(C35=0,0,((C35/G35)*100)-100)) -> 27.153054309012276 | N35: =IF(C35=0,0,IF(H35=0,0,((C35/H35)*100)-100)) -> 56.867252383805038 | P35: =P21+P34 -> 126550000 | Q35: =IF(C35=0,0,((C35/P35)*100)-100) -> 3.6663374476491413 | R35: =IF(C35=0,0,(C35/$C$40)*100) -> 91.938989227688879 | T35: 16.358141733147075 | U35: 15.797319991829447 | V35: =U35-T35 -> -0.56082174131762841
A36: Centenário | B36: 0 | C36: 0 | D36: 0 | F36: 1326363.91 | G36: 1309042.17 | H36: 1297352.18 | J36: =IF(B36=0,0,((C36/B36)*100)-100) -> 0 | K36: =IF(C36=0,0,IF(D36=0,0,((C36/D36)*100)-100)) -> 0 | L36: =IF(F36=0,0,((C36/F36)*100)-100) -> -100 | M36: =IF(G36=0,0,((C36/G36)*100)-100) -> -100 | N36: =IF(C36=0,0,IF(H36=0,0,((C36/H36)*100)-100)) -> 0 | P36: 0 | Q36: =IF(P36=0,0,IF(C36=0,0,((C36/P36)*100)-100)) -> 0 | R36: =IF(C36=0,0,(C36/$C$40)*100) -> 0 | T36: 0 | U36: 0 | V36: =U36-T36 -> 0
A37: Cajuru | B37: 4750000 | C37: 4811069.21 | D37: 5228187.57 | F37: 0 | G37: 0 | H37: 0 | J37: =IF(B37=0,0,((C37/B37)*100)-100) -> 1.2856675789473684 | K37: =IF(C37=0,0,IF(D37=0,0,((C37/D37)*100)-100)) -> -7.9782592803953349 | L37: =IF(F37=0,0,((C37/F37)*100)-100) -> 0 | M37: =IF(G37=0,0,((C37/G37)*100)-100) -> 0 | N37: =IF(C37=0,0,IF(H37=0,0,((C37/H37)*100)-100)) -> 0 | P37: 4750000 | Q37: =IF(P37=0,0,IF(C37=0,0,((C37/P37)*100)-100)) -> 1.2856675789473684 | R37: =IF(C37=0,0,(C37/$C$40)*100) -> 3.3716417642154974 | T37: 15.9 | U37: 15.655701614818382 | V37: =U37-T37 -> -0.24429838518161873
A38: Água Verde | B38: 6400000 | C38: 6691362.9699999997 | D38: 6878287.2400000002 | F38: 0 | G38: 0 | H38: 0 | J38: =IF(B38=0,0,((C38/B38)*100)-100) -> 4.5525464062500021 | K38: =IF(C38=0,0,IF(D38=0,0,((C38/D38)*100)-100)) -> -2.7175990690380161 | L38: =IF(F38=0,0,((C38/F38)*100)-100) -> 0 | M38: =IF(G38=0,0,((C38/G38)*100)-100) -> 0 | N38: =IF(C38=0,0,IF(H38=0,0,((C38/H38)*100)-100)) -> 0 | P38: 6400000 | Q38: =IF(P38=0,0,IF(C38=0,0,((C38/P38)*100)-100)) -> 4.5525464062500021 | R38: =IF(C38=0,0,(C38/$C$40)*100) -> 4.6893690080956141 | T38: 16.35 | U38: 16.168152211297546 | V38: =U38-T38 -> -0.18184778870245566
B39: 0 | C39: 0 | D39: 0 | F39: 0 | G39: 0 | H39: 0 | J39: =IF(B39=0,0,((C39/B39)*100)-100) -> 0 | K39: =IF(C39=0,0,IF(D39=0,0,((C39/D39)*100)-100)) -> 0 | L39: =IF(F39=0,0,((C39/F39)*100)-100) -> 0 | M39: =IF(G39=0,0,((C39/G39)*100)-100) -> 0 | N39: =IF(C39=0,0,IF(H39=0,0,((C39/H39)*100)-100)) -> 0 | P39: 0 | Q39: =IF(P39=0,0,IF(C39=0,0,((C39/P39)*100)-100)) -> 0 | R39: =IF(C39=0,0,(C39/$C$40)*100) -> 0 | T39: 0 | U39: 0 | V39: =U39-T39 -> 0
A40: Total Geral | B40: =B21+B34+SUM(B36:B39) -> 137719997 | C40: =C21+C34+SUM(C36:C39) -> 142692182.22 | D40: =D21+D34+SUM(D36:D39) -> 150124882.51999998 | F40: =F21+F34+SUM(F36:F39) -> 115389067.15000001 | G40: =G21+G34+SUM(G36:G39) -> 104483716.78 | H40: =H21+H34+SUM(H36:H39) -> 84928414.780000016 | J40: =IF(C40=0,0,((C40/B40)*100)-100) -> 3.6103582110882542 | K40: =IF(C40=0,0,IF(D40=0,0,((C40/D40)*100)-100)) -> -4.9510115679922535 | L40: =IF(F40=0,0,IF(C40=0,0,((C40/F40)*100)-100)) -> 23.661786809063386 | M40: =IF(G40=0,0,IF(C40=0,0,((C40/G40)*100)-100)) -> 36.568822987462653 | N40: =IF(C40=0,0,IF(H40=0,0,((C40/H40)*100)-100)) -> 68.014653976095303 | P40: =P21+P34+SUM(P36:P39) -> 137700000 | Q40: =IF(C40=0,0,((C40/P40)*100)-100) -> 3.6254046623093643 | R40: =R21+R34+SUM(R36:R39) -> 100 | T40: 16.34 | U40: 15.80993481865611 | V40: =U40-T40 -> -0.53006518134388969
A42: Água Verde | B42: 0 | C42: 0 | D42: 0 | F42: 0 | G42: 0 | H42: 0 | J42: =IF(B42=0,0,((C42/B42)*100)-100) -> 0 | K42: =IF(C42=0,0,IF(D42=0,0,((C42/D42)*100)-100)) -> 0 | L42: =IF(F42=0,0,((C42/F42)*100)-100) -> 0 | M42: =IF(G42=0,0,((C42/G42)*100)-100) -> 0 | N42: =IF(C42=0,0,IF(H42=0,0,((C42/H42)*100)-100)) -> 0 | P42: =B42 -> 0 | Q42: =IF(C42=0,0,IF(P42=0,0,((C42/P42)*100)-100)) -> 0 | R42: =IF(C42=0,0,(C42/$C$40)*100) -> 0 | T42: 14.95 | U42: 0 | V42: =U42-T42 -> -14.95
A43: Total Geral | B43: =B40+B42 -> 137719997 | C43: =C40+C42 -> 142692182.22 | D43: =D40+D42 -> 150124882.51999998 | F43: =F40+F42 -> 115389067.15000001 | G43: =G40+G42 -> 104483716.78 | H43: =H40+H42 -> 84928414.780000016 | J43: =IF(C43=0,0,((C43/B43)*100)-100) -> 3.6103582110882542 | K43: =IF(C43=0,0,IF(D43=0,0,((C43/D43)*100)-100)) -> -4.9510115679922535 | L43: =IF(F43=0,0,IF(C43=0,0,((C43/F43)*100)-100)) -> 23.661786809063386 | M43: =IF(G43=0,0,IF(C43=0,0,((C43/G43)*100)-100)) -> 36.568822987462653 | N43: =IF(C43=0,0,IF(H43=0,0,((C43/H43)*100)-100)) -> 68.014653976095303 | P43: =P40+P42 -> 137700000 | Q43: =IF(C43=0,0,((C43/P43)*100)-100) -> 3.6254046623093643 | R43: =R24+R37+R42 -> 7.3112972818056328 | T43: 16.341961945366585 | U43: 15.80993481865611 | V43: =U43-T43 -> -0.53202712671047436