A2: Periodo: | B2: 40179 | C2: a | D2: 40209 | G2: Vendas Acumuladas por Filial | P2: =NOW() -> 40259.459226041668
A4: v.New | B4: Vendas 2010 | F4: Vendas de Anos Anteriores | J4: Percentuais ( % ) | P4: Meta Mensal | T4: Margem
A5: Lojas | B5: Previsao | C5: Realizada | D5: Mes Anterior | F5: Vendas 2009 | G5: Vendas 2008 | H5: Vendas 2007 | J5: % Prev | K5: % MA | L5: 2009 | M5: 2008 | N5: 2007 | P5: Previsao Mes | Q5: Final | R5: Part. | T5: Meta | U5: Coml | V5: Dif
A6: S. Felicidade | B6: 2669000 | C6: 2833083.79 | D6: 3470654 | F6: 2472373.56 | G6: 1995836.05 | H6: 760828.19 | J6: =IF(B6=0,0,((C6/B6)*100)-100) -> 6.1477628325215363 | K6: =IF(C6=0,0,IF(D6=0,0,((C6/D6)*100)-100)) -> -18.370318965820275 | L6: =IF(F6=0,0,((C6/F6)*100)-100) -> 14.589633048818087 | M6: =IF(G6=0,0,((C6/G6)*100)-100) -> 41.949725279288344 | N6: =IF(C6=0,0,IF(H6=0,0,((C6/H6)*100)-100)) -> 272.36840422540081 | P6: 2669000 | Q6: =IF(C6=0,0,((C6/P6)*100)-100) -> 6.1477628325215363 | R6: =IF(C6=0,0,(C6/$C$37)*100) -> 2.6234827832395644 | T6: 17.297499999999999 | U6: 17.832428810727126 | V6: =U6-T6 -> 0.53492881072712706
A7: Lapa | B7: 2130000 | C7: 2275537.43 | D7: 2775609.1 | F7: 2076477.01 | G7: 1532309.65 | H7: 1046389.34 | J7: =IF(B7=0,0,((C7/B7)*100)-100) -> 6.8327431924882802 | K7: =IF(C7=0,0,IF(D7=0,0,((C7/D7)*100)-100)) -> -18.016646148047286 | L7: =IF(F7=0,0,((C7/F7)*100)-100) -> 9.5864495027565937 | M7: =IF(G7=0,0,((C7/G7)*100)-100) -> 48.503759015026759 | N7: =IF(C7=0,0,IF(H7=0,0,((C7/H7)*100)-100)) -> 117.46565480110877 | P7: 2130000 | Q7: =IF(C7=0,0,((C7/P7)*100)-100) -> 6.8327431924882802 | R7: =IF(C7=0,0,(C7/$C$37)*100) -> 2.107185566234949 | T7: 16.595099999999999 | U7: 16.095071659621084 | V7: =U7-T7 -> -0.50002834037891475
A8: Araucaria | B8: 1300000 | C8: 1321106.31 | D8: 1613967.61 | F8: 1258741.47 | G8: 1026668.49 | H8: 910260.34 | J8: =IF(B8=0,0,((C8/B8)*100)-100) -> 1.6235623076923105 | K8: =IF(C8=0,0,IF(D8=0,0,((C8/D8)*100)-100)) -> -18.145426103067834 | L8: =IF(F8=0,0,((C8/F8)*100)-100) -> 4.954539235129829 | M8: =IF(G8=0,0,((C8/G8)*100)-100) -> 28.678957508474809 | N8: =IF(C8=0,0,IF(H8=0,0,((C8/H8)*100)-100)) -> 45.134996214379726 | P8: 1300000 | Q8: =IF(C8=0,0,((C8/P8)*100)-100) -> 1.6235623076923105 | R8: =IF(C8=0,0,(C8/$C$37)*100) -> 1.223366450137414 | T8: 17.4833 | U8: 16.78785411296688 | V8: =U8-T8 -> -0.69544588703312016
A9: Hauer | B9: 3810000 | C9: 3606109.5 | D9: 4451948.03 | F9: 3451415.24 | G9: 3144041.2 | H9: 2794475.46 | J9: =IF(B9=0,0,((C9/B9)*100)-100) -> -5.3514566929133878 | K9: =IF(C9=0,0,IF(D9=0,0,((C9/D9)*100)-100)) -> -18.99929029494983 | L9: =IF(F9=0,0,((C9/F9)*100)-100) -> 4.4820529911086453 | M9: =IF(G9=0,0,((C9/G9)*100)-100) -> 14.696636290898482 | N9: =IF(C9=0,0,IF(H9=0,0,((C9/H9)*100)-100)) -> 29.044235729305711 | P9: 3810000 | Q9: =IF(C9=0,0,((C9/P9)*100)-100) -> -5.3514566929133878 | R9: =IF(C9=0,0,(C9/$C$37)*100) -> 3.3393174678136273 | T9: 16.1981 | U9: 15.960682003694011 | V9: =U9-T9 -> -0.23741799630598948
A10: Paranagua | B10: 1890000 | C10: 2029156.98 | D10: 2814642.97 | F10: 1776572.55 | G10: 1780561.27 | H10: 1551521.29 | J10: =IF(B10=0,0,((C10/B10)*100)-100) -> 7.3628031746031866 | K10: =IF(C10=0,0,IF(D10=0,0,((C10/D10)*100)-100)) -> -27.907127062726545 | L10: =IF(F10=0,0,((C10/F10)*100)-100) -> 14.217512817025124 | M10: =IF(G10=0,0,((C10/G10)*100)-100) -> 13.961648733379434 | N10: =IF(C10=0,0,IF(H10=0,0,((C10/H10)*100)-100)) -> 30.784991032897778 | P10: 1890000 | Q10: =IF(C10=0,0,((C10/P10)*100)-100) -> 7.3628031746031866 | R10: =IF(C10=0,0,(C10/$C$37)*100) -> 1.8790331653129075 | T10: 17.954799999999999 | U10: 16.671384882208571 | V10: =U10-T10 -> -1.2834151177914279
A11: Centenario | B11: 1330000 | C11: 1219404.04 | D11: 1449006.26 | F11: 1216247.66 | G11: 1056621.39 | H11: 943941.64 | J11: =IF(B11=0,0,((C11/B11)*100)-100) -> -8.3154857142857139 | K11: =IF(C11=0,0,IF(D11=0,0,((C11/D11)*100)-100)) -> -15.845495381089663 | L11: =IF(F11=0,0,((C11/F11)*100)-100) -> 0.25951786826048817 | M11: =IF(G11=0,0,((C11/G11)*100)-100) -> 15.405958230696058 | N11: =IF(C11=0,0,IF(H11=0,0,((C11/H11)*100)-100)) -> 29.182143082489716 | P11: 1330000 | Q11: =IF(C11=0,0,((C11/P11)*100)-100) -> -8.3154857142857139 | R11: =IF(C11=0,0,(C11/$C$37)*100) -> 1.1291884539541872 | T11: 17.247299999999999 | U11: 15.644826795883009 | V11: =U11-T11 -> -1.6024732041169898
A12: Sitio Cercado | B12: 2216786 | C12: 2348602.24 | D12: 2872142.89 | F12: 2043910.71 | G12: 1637395.78 | H12: 1258813.5 | J12: =IF(B12=0,0,((C12/B12)*100)-100) -> 5.9462771778602104 | K12: =IF(C12=0,0,IF(D12=0,0,((C12/D12)*100)-100)) -> -18.228224362472432 | L12: =IF(F12=0,0,((C12/F12)*100)-100) -> 14.907281835222648 | M12: =IF(G12=0,0,((C12/G12)*100)-100) -> 43.435220041913169 | N12: =IF(C12=0,0,IF(H12=0,0,((C12/H12)*100)-100)) -> 86.572692460003026 | P12: 2216786 | Q12: =IF(C12=0,0,((C12/P12)*100)-100) -> 5.9462771778602104 | R12: =IF(C12=0,0,(C12/$C$37)*100) -> 2.1748447974134488 | T12: 16.712299999999999 | U12: 15.478239516624152 | V12: =U12-T12 -> -1.2340604833758473
A13: Apucarana | B13: 2719999 | C13: 2573682.57 | D13: 3563739.74 | F13: 2474780.01 | G13: 2197387.15 | H13: 1887838.84 | J13: =IF(B13=0,0,((C13/B13)*100)-100) -> -5.3792824923832683 | K13: =IF(C13=0,0,IF(D13=0,0,((C13/D13)*100)-100)) -> -27.78141060323334 | L13: =IF(F13=0,0,((C13/F13)*100)-100) -> 3.9964182513337931 | M13: =IF(G13=0,0,((C13/G13)*100)-100) -> 17.124675549322291 | N13: =IF(C13=0,0,IF(H13=0,0,((C13/H13)*100)-100)) -> 36.329569848239771 | P13: 2720000 | Q13: =IF(C13=0,0,((C13/P13)*100)-100) -> -5.3793172794117652 | R13: =IF(C13=0,0,(C13/$C$37)*100) -> 2.3832729323966637 | T13: 17.5959 | U13: 16.720250780577032 | V13: =U13-T13 -> -0.87564921942296792
A14: Ahú | B14: 1595920 | C14: 1602846.59 | D14: 1992791.01 | F14: 1477101.43 | G14: 1416694.44 | H14: 1048564.91 | J14: =IF(B14=0,0,((C14/B14)*100)-100) -> 0.43401862248735767 | K14: =IF(C14=0,0,IF(D14=0,0,((C14/D14)*100)-100)) -> -19.567752867371667 | L14: =IF(F14=0,0,((C14/F14)*100)-100) -> 8.5129671833030613 | M14: =IF(G14=0,0,((C14/G14)*100)-100) -> 13.139894160945545 | N14: =IF(C14=0,0,IF(H14=0,0,((C14/H14)*100)-100)) -> 52.860979297886303 | P14: 1595920 | Q14: =IF(C14=0,0,((C14/P14)*100)-100) -> 0.43401862248735767 | R14: =IF(C14=0,0,(C14/$C$37)*100) -> 1.4842626426658723 | T14: 18.104700000000001 | U14: 16.966361078885285 | V14: =U14-T14 -> -1.1383389211147161
A15: P.G. Centro | B15: 1980000 | C15: 1796991.47 | D15: 2343619.24 | F15: 2079804.56 | G15: 1826961.35 | H15: 1542013.77 | J15: =IF(B15=0,0,((C15/B15)*100)-100) -> -9.2428550505050566 | K15: =IF(C15=0,0,IF(D15=0,0,((C15/D15)*100)-100)) -> -23.324086125867453 | L15: =IF(F15=0,0,((C15/F15)*100)-100) -> -13.598060867796164 | M15: =IF(G15=0,0,((C15/G15)*100)-100) -> -1.640422223491484 | N15: =IF(C15=0,0,IF(H15=0,0,((C15/H15)*100)-100)) -> 16.535371146523545 | P15: 1980000 | Q15: =IF(C15=0,0,((C15/P15)*100)-100) -> -9.2428550505050566 | R15: =IF(C15=0,0,(C15/$C$37)*100) -> 1.6640440356242892 | T15: 18.547000000000001 | U15: 18.081965074658925 | V15: =U15-T15 -> -0.46503492534107593
A16: Maringa | B16: 2949999 | C16: 2729996.46 | D16: 3215739.75 | F16: 2771932.02 | G16: 2330695.91 | H16: 2041985.24 | J16: =IF(B16=0,0,((C16/B16)*100)-100) -> -7.4577157483782202 | K16: =IF(C16=0,0,IF(D16=0,0,((C16/D16)*100)-100)) -> -15.105180386565792 | L16: =IF(F16=0,0,((C16/F16)*100)-100) -> -1.5128639410139613 | M16: =IF(G16=0,0,((C16/G16)*100)-100) -> 17.132245707677924 | N16: =IF(C16=0,0,IF(H16=0,0,((C16/H16)*100)-100)) -> 33.693251377272446 | P16: 2950000 | Q16: =IF(C16=0,0,((C16/P16)*100)-100) -> -7.4577471186440647 | R16: =IF(C16=0,0,(C16/$C$37)*100) -> 2.5280221984239155 | T16: 18.801300000000001 | U16: 16.490665705844908 | V16: =U16-T16 -> -2.3106342941550935
A17: Araucaria Nova | B17: 3900000 | C17: 3896088.59 | D17: 4741181.51 | F17: 3412250.57 | G17: 2565286.04 | H17: 1998127.15 | J17: =IF(B17=0,0,((C17/B17)*100)-100) -> -0.10029256410255982 | K17: =IF(C17=0,0,IF(D17=0,0,((C17/D17)*100)-100)) -> -17.82452155053646 | L17: =IF(F17=0,0,((C17/F17)*100)-100) -> 14.179439934858024 | M17: =IF(G17=0,0,((C17/G17)*100)-100) -> 51.877355166209838 | N17: =IF(C17=0,0,IF(H17=0,0,((C17/H17)*100)-100)) -> 94.987020220409903 | P17: 3900000 | Q17: =IF(C17=0,0,((C17/P17)*100)-100) -> -0.10029256410255982 | R17: =IF(C17=0,0,(C17/$C$37)*100) -> 3.6078429356447339 | T17: 16.9511 | U17: 16.642960882981363 | V17: =U17-T17 -> -0.30813911701863717
A18: Cristo Rei | B18: 1710000 | C18: 1856604.72 | D18: 2341489.4 | F18: 1544135.33 | G18: 1330166.74 | H18: 1124970.34 | J18: =IF(B18=0,0,((C18/B18)*100)-100) -> 8.5733754385964858 | K18: =IF(C18=0,0,IF(D18=0,0,((C18/D18)*100)-100)) -> -20.708386721716522 | L18: =IF(F18=0,0,((C18/F18)*100)-100) -> 20.235881138734115 | M18: =IF(G18=0,0,((C18/G18)*100)-100) -> 39.576841321412076 | N18: =IF(C18=0,0,IF(H18=0,0,((C18/H18)*100)-100)) -> 65.035881746002275 | P18: 1710000 | Q18: =IF(C18=0,0,((C18/P18)*100)-100) -> 8.5733754385964858 | R18: =IF(C18=0,0,(C18/$C$37)*100) -> 1.7192468981658011 | T18: 18.296800000000001 | U18: 18.272487748496083 | V18: =U18-T18 -> -2.4312251503918247E-2
A19: Campo Largo | B19: 2800000 | C19: 3369202.78 | D19: 4029883.15 | F19: 2519617.05 | G19: 0 | H19: 0 | J19: =IF(B19=0,0,((C19/B19)*100)-100) -> 20.328670714285707 | K19: =IF(C19=0,0,IF(D19=0,0,((C19/D19)*100)-100)) -> -16.394529206138401 | L19: =IF(F19=0,0,((C19/F19)*100)-100) -> 33.718843504412689 | M19: =IF(G19=0,0,((C19/G19)*100)-100) -> 0 | N19: =IF(C19=0,0,IF(H19=0,0,((C19/H19)*100)-100)) -> 0 | P19: 2800000 | Q19: =IF(C19=0,0,((C19/P19)*100)-100) -> 20.328670714285707 | R19: =IF(C19=0,0,(C19/$C$37)*100) -> 3.1199378986856146 | T19: 17.299700000000001 | U19: 17.461087931311749 | V19: =U19-T19 -> 0.16138793131174722
A20: Brasilia | B20: 2355000 | C20: 2347034.85 | D20: 2886002.73 | F20: 2205514.3 | G20: 863438 | H20: 760180.48 | J20: =IF(B20=0,0,((C20/B20)*100)-100) -> -0.33822292993630754 | K20: =IF(C20=0,0,IF(D20=0,0,((C20/D20)*100)-100)) -> -18.675238051489984 | L20: =IF(F20=0,0,((C20/F20)*100)-100) -> 6.4166688921491186 | M20: =IF(G20=0,0,((C20/G20)*100)-100) -> 171.82436376439307 | N20: =IF(C20=0,0,IF(H20=0,0,((C20/H20)*100)-100)) -> 208.74705569919399 | P20: 2355000 | Q20: =IF(C20=0,0,((C20/P20)*100)-100) -> -0.33822292993630754 | R20: =IF(C20=0,0,(C20/$C$37)*100) -> 2.1733933681637612 | T20: 17.001899999999999 | U20: 16.582568852780348 | V20: =U20-T20 -> -0.41933114721965126
A21: Total Super | B21: =SUM(B6:B20) -> 35356704 | C21: =SUM(C6:C20) -> 35805448.32 | D21: =SUM(D6:D20) -> 44562417.389999993 | F21: =SUM(F6:F20) -> 32780873.470000006 | G21: =SUM(G6:G20) -> 24704063.459999997 | H21: =SUM(H6:H20) -> 19669910.489999998 | I21: =SUM(B21:H21) -> 192879417.13 | J21: =IF(C21=0,0,((C21/B21)*100)-100) -> 1.2691916079055261 | K21: =IF(C21=0,0,IF(D21=0,0,((C21/D21)*100)-100)) -> -19.651018914348882 | L21: =IF(F21=0,0,IF(C21=0,0,((C21/F21)*100)-100)) -> 9.2266450824380399 | M21: =IF(G21=0,0,IF(C21=0,0,((C21/G21)*100)-100)) -> 44.937485195401138 | N21: =IF(C21=0,0,IF(H21=0,0,((C21/H21)*100)-100)) -> 82.031577307904683 | P21: =SUM(P6:P20) -> 35356706 | Q21: =IF(C21=0,0,((C21/P21)*100)-100) -> 1.2691858794764386 | R21: =IF(C21=0,0,(C21/$C$37)*100) -> 33.15644159387675 | T21: 17.38 | U21: 16.76 | V21: =U21-T21 -> -0.61999999999999744
A22: Pinheirinho | B22: 4700000 | C22: 5259158.26 | D22: 6494079.9199999999 | F22: 4339989.85 | G22: 3719224.08 | H22: 2900422.02 | J22: =IF(B22=0,0,((C22/B22)*100)-100) -> 11.896984255319154 | K22: =IF(C22=0,0,IF(D22=0,0,((C22/D22)*100)-100)) -> -19.016114295063986 | L22: =IF(F22=0,0,((C22/F22)*100)-100) -> 21.179045153757684 | M22: =IF(G22=0,0,((C22/G22)*100)-100) -> 41.404716329971677 | N22: =IF(C22=0,0,IF(H22=0,0,((C22/H22)*100)-100)) -> 81.323897823669114 | P22: 4700000 | Q22: =IF(C22=0,0,IF(P22=0,0,((C22/P22)*100)-100)) -> 11.896984255319154 | R22: =IF(C22=0,0,(C22/$C$37)*100) -> 4.8700681561706105 | T22: 16.1524 | U22: 16.700451223918865 | V22: =U22-T22 -> 0.54805122391886485
A23: Londrina | B23: 3500000 | C23: 3799735.54 | D23: 4486826.61 | F23: 3459874 | G23: 3160704.96 | H23: 2775716.76 | J23: =IF(B23=0,0,((C23/B23)*100)-100) -> 8.5638725714285613 | K23: =IF(C23=0,0,IF(D23=0,0,((C23/D23)*100)-100)) -> -15.313519547839178 | L23: =IF(F23=0,0,((C23/F23)*100)-100) -> 9.8229455754747192 | M23: =IF(G23=0,0,((C23/G23)*100)-100) -> 20.217976308677677 | N23: =IF(C23=0,0,IF(H23=0,0,((C23/H23)*100)-100)) -> 36.892048740592685 | P23: 3500000 | Q23: =IF(C23=0,0,IF(P23=0,0,((C23/P23)*100)-100)) -> 8.5638725714285613 | R23: =IF(C23=0,0,(C23/$C$37)*100) -> 3.518618406289173 | T23: 16.651199999999999 | U23: 15.259044843947217 | V23: =U23-T23 -> -1.3921551560527821
A24: São Bráz | B24: 4949348 | C24: 5082146.08 | D24: 6289858.5099999998 | F24: 4691597.2 | G24: 4318068.23 | H24: 2926994.12 | J24: =IF(B24=0,0,((C24/B24)*100)-100) -> 2.6831429109450511 | K24: =IF(C24=0,0,IF(D24=0,0,((C24/D24)*100)-100)) -> -19.20094749476327 | L24: =IF(F24=0,0,((C24/F24)*100)-100) -> 8.3244333081279791 | M24: =IF(G24=0,0,((C24/G24)*100)-100) -> 17.694899878874764 | N24: =IF(C24=0,0,IF(H24=0,0,((C24/H24)*100)-100)) -> 73.630211460759597 | P24: 4949348 | Q24: =IF(C24=0,0,IF(P24=0,0,((C24/P24)*100)-100)) -> 2.6831429109450511 | R24: =IF(C24=0,0,(C24/$C$37)*100) -> 4.7061519288098577 | T24: 16.019300000000001 | U24: 15.723171420527132 | V24: =U24-T24 -> -0.29612857947286919
A25: S.J. Pinhais | B25: 5650000 | C25: 5740328.4800000004 | D25: 7024457.2599999998 | F25: 5289679.34 | G25: 4704463.8 | H25: 3806562.46 | J25: =IF(B25=0,0,((C25/B25)*100)-100) -> 1.5987341592920359 | K25: =IF(C25=0,0,IF(D25=0,0,((C25/D25)*100)-100)) -> -18.280825585092956 | L25: =IF(F25=0,0,((C25/F25)*100)-100) -> 8.51940374896148 | M25: =IF(G25=0,0,((C25/G25)*100)-100) -> 22.01876184061615 | N25: =IF(C25=0,0,IF(H25=0,0,((C25/H25)*100)-100)) -> 50.800848280314312 | P25: 5650000 | Q25: =IF(C25=0,0,IF(P25=0,0,((C25/P25)*100)-100)) -> 1.5987341592920359 | R25: =IF(C25=0,0,(C25/$C$37)*100) -> 5.3156397952563692 | T25: 16.302800000000001 | U25: 15.945848450818968 | V25: =U25-T25 -> -0.35695154918103356
A26: P.G. Nova | B26: 4900000 | C26: 4894746.61 | D26: 6153431.1500000004 | F26: 5234241.53 | G26: 4222460.05 | H26: 3347318.77 | J26: =IF(B26=0,0,((C26/B26)*100)-100) -> -0.10721204081632152 | K26: =IF(C26=0,0,IF(D26=0,0,((C26/D26)*100)-100)) -> -20.455003222064164 | L26: =IF(F26=0,0,((C26/F26)*100)-100) -> -6.4860384843570529 | M26: =IF(G26=0,0,((C26/G26)*100)-100) -> 15.921679590550553 | N26: =IF(C26=0,0,IF(H26=0,0,((C26/H26)*100)-100)) -> 46.228875895198939 | P26: 4900000 | Q26: =IF(C26=0,0,IF(P26=0,0,((C26/P26)*100)-100)) -> -0.10721204081632152 | R26: =IF(C26=0,0,(C26/$C$37)*100) -> 4.5326168978769328 | T26: 16.100300000000001 | U26: 15.346025644420436 | V26: =U26-T26 -> -0.75427435557956457
A27: Nilo Pecanha | B27: 11700000 | C27: 11892506.789999999 | D27: 15408519.51 | F27: 10949009.189999999 | G27: 9612433.5999999996 | H27: 8301451.5199999996 | J27: =IF(B27=0,0,((C27/B27)*100)-100) -> 1.6453571794871777 | K27: =IF(C27=0,0,IF(D27=0,0,((C27/D27)*100)-100)) -> -22.81862782286214 | L27: =IF(F27=0,0,((C27/F27)*100)-100) -> 8.6171961647609123 | M27: =IF(G27=0,0,((C27/G27)*100)-100) -> 23.720040989411871 | N27: =IF(C27=0,0,IF(H27=0,0,((C27/H27)*100)-100)) -> 43.25816107398046 | P27: 11700000 | Q27: =IF(C27=0,0,IF(P27=0,0,((C27/P27)*100)-100)) -> 1.6453571794871777 | R27: =IF(C27=0,0,(C27/$C$37)*100) -> 11.012659393714795 | T27: 16.380500000000001 | U27: 16.559827164916843 | V27: =U27-T27 -> 0.17932716491684175
A28: Champagnat | B28: 6450000 | C28: 6057070.3300000001 | D28: 7480767.1500000004 | F28: 6012635.54 | G28: 5444638.1600000001 | H28: 4795420.4 | J28: =IF(B28=0,0,((C28/B28)*100)-100) -> -6.0919328682170573 | K28: =IF(C28=0,0,IF(D28=0,0,((C28/D28)*100)-100)) -> -19.031428080206993 | L28: =IF(F28=0,0,((C28/F28)*100)-100) -> 0.73902350648712911 | M28: =IF(G28=0,0,((C28/G28)*100)-100) -> 11.248353921833427 | N28: =IF(C28=0,0,IF(H28=0,0,((C28/H28)*100)-100)) -> 26.309474973247376 | P28: 6450000 | Q28: =IF(C28=0,0,IF(P28=0,0,((C28/P28)*100)-100)) -> -6.0919328682170573 | R28: =IF(C28=0,0,(C28/$C$37)*100) -> 5.6089480246633254 | T28: 16.452500000000001 | U28: 16.647157207434969 | V28: =U28-T28 -> 0.19465720743496817
A29: Santa Candida | B29: 6450000 | C29: 7005264.1799999997 | D29: 8640009.5399999991 | F29: 5892670.6100000003 | G29: 4929174.54 | H29: 3662302.33 | J29: =IF(B29=0,0,((C29/B29)*100)-100) -> 8.608746976744186 | K29: =IF(C29=0,0,IF(D29=0,0,((C29/D29)*100)-100)) -> -18.920642997345567 | L29: =IF(F29=0,0,((C29/F29)*100)-100) -> 18.880973392809409 | M29: =IF(G29=0,0,((C29/G29)*100)-100) -> 42.118403865650095 | N29: =IF(C29=0,0,IF(H29=0,0,((C29/H29)*100)-100)) -> 91.280335394920826 | P29: 6450000 | Q29: =IF(C29=0,0,IF(P29=0,0,((C29/P29)*100)-100)) -> 8.608746976744186 | R29: =IF(C29=0,0,(C29/$C$37)*100) -> 6.4869913248399982 | T29: 15.896800000000001 | U29: 16.194782250167762 | V29: =U29-T29 -> 0.29798225016776136
A30: Paranaguá Raia | B30: 7040000 | C30: 7253944.75 | D30: 9502619.0099999998 | F30: 6236805.9199999999 | G30: 5706989.1399999997 | H30: 4580924.97 | J30: =IF(B30=0,0,((C30/B30)*100)-100) -> 3.0389879261363717 | K30: =IF(C30=0,0,IF(D30=0,0,((C30/D30)*100)-100)) -> -23.663731626340351 | L30: =IF(F30=0,0,((C30/F30)*100)-100) -> 16.308649700614694 | M30: =IF(G30=0,0,((C30/G30)*100)-100) -> 27.106335268056952 | N30: =IF(C30=0,0,IF(H30=0,0,((C30/H30)*100)-100)) -> 58.351092792510883 | P30: 7040000 | Q30: =IF(C30=0,0,IF(P30=0,0,((C30/P30)*100)-100)) -> 3.0389879261363717 | R30: =IF(C30=0,0,(C30/$C$37)*100) -> 6.7172736751975934 | T30: 18.2029 | U30: 17.367841545801681 | V30: =U30-T30 -> -0.83505845419831815
A31: Torres | B31: 4800000 | C31: 5067486.77 | D31: 6528879.3300000001 | F31: 4524687.94 | G31: 0 | H31: 0 | J31: =IF(B31=0,0,((C31/B31)*100)-100) -> 5.5726410416666567 | K31: =IF(C31=0,0,IF(D31=0,0,((C31/D31)*100)-100)) -> -22.383513098257865 | L31: =IF(F31=0,0,((C31/F31)*100)-100) -> 11.996381567034646 | M31: =IF(G31=0,0,((C31/G31)*100)-100) -> 0 | N31: =IF(C31=0,0,IF(H31=0,0,((C31/H31)*100)-100)) -> 0 | P31: 4800000 | Q31: =IF(C31=0,0,IF(P31=0,0,((C31/P31)*100)-100)) -> 5.5726410416666567 | R31: =IF(C31=0,0,(C31/$C$37)*100) -> 4.6925771635540894 | T31: 16.098199999999999 | U31: 16.040358404329886 | V31: =U31-T31 -> -5.7841595670112156E-2
A32: Total Hiper | B32: =SUM(B22:B31) -> 60139348 | C32: =SUM(C22:C31) -> 62052387.789999992 | D32: =SUM(D22:D31) -> 78009447.989999995 | F32: =SUM(F22:F31) -> 56631191.119999997 | G32: =SUM(G22:G31) -> 45818156.559999995 | H32: =SUM(H22:H31) -> 37097113.349999994 | I32: =SUM(B32:H32) -> 339747644.80999994 | J32: =IF(C32=0,0,((C32/B32)*100)-100) -> 3.1810118559981504 | K32: =IF(C32=0,0,IF(D32=0,0,((C32/D32)*100)-100)) -> -20.455291777023646 | L32: =IF(F32=0,0,IF(C32=0,0,((C32/F32)*100)-100)) -> 9.5728106062834115 | M32: =IF(G32=0,0,IF(C32=0,0,((C32/G32)*100)-100)) -> 35.431873407523227 | N32: =IF(C32=0,0,IF(H32=0,0,((C32/H32)*100)-100)) -> 67.270124779129219 | P32: =SUM(P22:P31) -> 60139348 | Q32: =IF(C32=0,0,((C32/P32)*100)-100) -> 3.1810118559981504 | R32: =IF(C32=0,0,(C32/$C$37)*100) -> 57.461544766372739 | T32: 16.35 | U32: 16.12 | V32: =U32-T32 -> -0.23
A33: Total s/ 27, 32 | B33: =B21+B32 -> 95496052 | C33: =C21+C32 -> 97857836.109999985 | D33: =D21+D32 -> 122571865.38 | E33: =E21+E32 -> 0 | F33: =F21+F32 -> 89412064.590000004 | G33: =G21+G32 -> 70522220.019999996 | H33: =H21+H32 -> 56767023.839999989 | I33: =SUM(B33:H33) -> 532627061.94 | J33: =IF(C33=0,0,((C33/B33)*100)-100) -> 2.4731746083073602 | K33: =IF(C33=0,0,IF(D33=0,0,((C33/D33)*100)-100)) -> -20.162889088275705 | L33: =IF(F33=0,0,IF(C33=0,0,((C33/F33)*100)-100)) -> 9.4458969924563974 | M33: =IF(G33=0,0,IF(C33=0,0,((C33/G33)*100)-100)) -> 38.76170671066177 | N33: =IF(C33=0,0,IF(H33=0,0,((C33/H33)*100)-100)) -> 72.385003634884924 | P33: =P21+P32 -> 95496054 | Q33: =IF(C33=0,0,((C33/P33)*100)-100) -> 2.4731724621836122 | R33: =IF(C33=0,0,(C33/$C$37)*100) -> 90.617986360249475 | T33: 0 | U33: 0 | V33: =U33-T33 -> 0
A34: Uvaranas | B34: 4750000 | C34: 4786753.71 | D34: 5949869.7199999997 | F34: 0 | G34: 0 | H34: 0 | J34: =IF(B34=0,0,((C34/B34)*100)-100) -> 0.77376231578946886 | K34: =IF(C34=0,0,IF(D34=0,0,((C34/D34)*100)-100)) -> -19.548596267415405 | L34: =IF(F34=0,0,((C34/F34)*100)-100) -> 0 | M34: =IF(G34=0,0,((C34/G34)*100)-100) -> 0 | N34: =IF(C34=0,0,IF(H34=0,0,((C34/H34)*100)-100)) -> 0 | P34: 4750000 | Q34: =IF(P34=0,0,IF(C34=0,0,((C34/P34)*100)-100)) -> 0.77376231578946886 | R34: =IF(C34=0,0,(C34/$C$37)*100) -> 4.4326136735239698 | T34: 15.791600000000001 | U34: 15.211928252728091 | V34: =U34-T34 -> -0.57967174727190951
A35: Novo Mundo | B35: 4950000 | C35: 5344828.22 | D35: 6667827.6600000001 | F35: 5.9999999999999995E-4 | G35: 0 | H35: 0 | J35: =IF(B35=0,0,((C35/B35)*100)-100) -> 7.9763276767676814 | K35: =IF(C35=0,0,IF(D35=0,0,((C35/D35)*100)-100)) -> -19.841536216309478 | L35: =IF(F35=0,0,((C35/F35)*100)-100) -> 890804703233.33337 | M35: =IF(G35=0,0,((C35/G35)*100)-100) -> 0 | N35: =IF(C35=0,0,IF(H35=0,0,((C35/H35)*100)-100)) -> 0 | P35: 4950000 | Q35: =IF(P35=0,0,IF(C35=0,0,((C35/P35)*100)-100)) -> 7.9763276767676814 | R35: =IF(C35=0,0,(C35/$C$37)*100) -> 4.9493999662265429 | T35: 15.497400000000001 | U35: 15.014615942137802 | V35: =U35-T35 -> -0.48278405786219913
A36: Total Lojas Novas | B36: =SUM(B34:B35) -> 9700000 | C36: =SUM(C34:C35) -> 10131581.93 | D36: =SUM(D34:D35) -> 12617697.379999999 | F36: =SUM(F34:F35) -> 5.9999999999999995E-4 | G36: =SUM(G34:G35) -> 0 | H36: =SUM(H34:H35) -> 0 | J36: =IF(C36=0,0,((C36/B36)*100)-100) -> 4.4492982474226892 | K36: =IF(C36=0,0,IF(D36=0,0,((C36/D36)*100)-100)) -> -19.703400510624704 | L36: =IF(F36=0,0,IF(C36=0,0,((C36/F36)*100)-100)) -> 1688596988233.3335 | M36: =IF(G36=0,0,IF(C36=0,0,((C36/G36)*100)-100)) -> 0 | N36: =IF(C36=0,0,IF(H36=0,0,((C36/H36)*100)-100)) -> 0 | P36: =SUM(P34:P35) -> 9700000 | Q36: =IF(P36=0,0,IF(C36=0,0,((C36/P36)*100)-100)) -> 4.4492982474226892 | R36: =IF(C36=0,0,(C36/$C$37)*100) -> 9.3820136397505127
A37: Total Geral | B37: =B21+B32+B36 -> 105196052 | C37: =C21+C32+C36 -> 107989418.03999999 | D37: =D21+D32+D36 -> 135189562.75999999 | F37: =F21+F32+F36 -> 89412064.590599999 | G37: =G21+G32+G36 -> 70522220.019999996 | H37: =H21+H32+H36 -> 56767023.839999989 | J37: =IF(C37=0,0,((C37/B37)*100)-100) -> 2.6553905654177896 | K37: =IF(C37=0,0,IF(D37=0,0,((C37/D37)*100)-100)) -> -20.120003471191055 | L37: =IF(F37=0,0,IF(C37=0,0,((C37/F37)*100)-100)) -> 20.77723351368968 | M37: =IF(G37=0,0,IF(C37=0,0,((C37/G37)*100)-100)) -> 53.128216907202244 | N37: =IF(C37=0,0,IF(H37=0,0,((C37/H37)*100)-100)) -> 90.232657509705405 | P37: =P21+P32+P36 -> 105196054 | Q37: =IF(C37=0,0,((C37/P37)*100)-100) -> 2.6553886137211862 | R37: =R21+R32+R36 -> 100 | T37: 16.69 | U37: 16.33 | V37: =U37-T37 -> -0.36000000000000298