A2: Periodo: | B2: 40969 | C2: a | D2: 40999 | G2: Vendas Acumuladas por Filial | P2: =NOW() -> 41000.347696759258
A4: v.New | B4: Vendas 2012 | F4: Vendas de Anos Anteriores | J4: Percentuais ( % ) | P4: Meta Mensal | T4: Margem
A5: Lojas | B5: Previsao | C5: Realizada | D5: Mes Anterior | F5: Vendas 2011 | G5: Vendas 2010 | H5: Vendas 2009 | J5: % Prev | K5: % MA | L5: 2011 | M5: 2010 | N5: 2009 | P5: Previsao Mes | Q5: Final | R5: Part. | T5: Meta | U5: Coml | V5: Sell O. | W5: Dif
A6: S. Felicidade | B6: 4700000 | C6: 4330581.1 | D6: 4248970.27 | F6: 3320029.65 | G6: 3161277.72 | H6: 2608840.61 | J6: =IF(B6=0,0,((C6/B6)*100)-100) -> -7.8599765957446834 | K6: =IF(C6=0,0,IF(D6=0,0,((C6/D6)*100)-100)) -> 1.9207201936953169 | L6: =IF(F6=0,0,((C6/F6)*100)-100) -> 30.438024853181645 | M6: =IF(G6=0,0,((C6/G6)*100)-100) -> 36.988315597909548 | N6: =IF(C6=0,0,IF(H6=0,0,((C6/H6)*100)-100)) -> 65.996384884548377 | P6: 4700000 | Q6: =IF(C6=0,0,((C6/P6)*100)-100) -> -7.8599765957446834 | R6: =IF(C6=0,0,(C6/$C$43)*100) -> 2.3036207154957711 | T6: 16.3 | U6: 16.149337094737703 | V6: 18.304138767889604 | W6: =U6-T6 -> -0.15066290526229764
A7: Lapa | B7: 3100000 | C7: 2983431.85 | D7: 2834764.71 | F7: 2454796.82 | G7: 2746699.78 | H7: 2076522.59 | J7: =IF(B7=0,0,((C7/B7)*100)-100) -> -3.7602629032258079 | K7: =IF(C7=0,0,IF(D7=0,0,((C7/D7)*100)-100)) -> 5.2444260885412319 | L7: =IF(F7=0,0,((C7/F7)*100)-100) -> 21.534777367032774 | M7: =IF(G7=0,0,((C7/G7)*100)-100) -> 8.6187821371580782 | N7: =IF(C7=0,0,IF(H7=0,0,((C7/H7)*100)-100)) -> 43.67442301699208 | P7: 3100000 | Q7: =IF(C7=0,0,((C7/P7)*100)-100) -> -3.7602629032258079 | R7: =IF(C7=0,0,(C7/$C$43)*100) -> 1.5870145955539021 | T7: 15.6 | U7: 15.223542646030275 | V7: 17.798301415867769 | W7: =U7-T7 -> -0.37645735396972491
A8: Araucaria | B8: 1650000 | C8: 1697096.77 | D8: 1654065.19 | F8: 1489200.15 | G8: 1549398.3 | H8: 1246258.51 | J8: =IF(B8=0,0,((C8/B8)*100)-100) -> 2.8543496969696918 | K8: =IF(C8=0,0,IF(D8=0,0,((C8/D8)*100)-100)) -> 2.6015649359019619 | L8: =IF(F8=0,0,((C8/F8)*100)-100) -> 13.960287339482207 | M8: =IF(G8=0,0,((C8/G8)*100)-100) -> 9.5326340554265414 | N8: =IF(C8=0,0,IF(H8=0,0,((C8/H8)*100)-100)) -> 36.175340539901299 | P8: 1650000 | Q8: =IF(C8=0,0,((C8/P8)*100)-100) -> 2.8543496969696918 | R8: =IF(C8=0,0,(C8/$C$43)*100) -> 0.90275812536404465 | T8: 17.2 | U8: 16.652074589712406 | V8: 18.524037306369987 | W8: =U8-T8 -> -0.54792541028759345
A9: Hauer | B9: 5200000 | C9: 5080103.28 | D9: 4797043.88 | F9: 3936564.16 | G9: 4025785.53 | H9: 3609513.28 | J9: =IF(B9=0,0,((C9/B9)*100)-100) -> -2.3057061538461596 | K9: =IF(C9=0,0,IF(D9=0,0,((C9/D9)*100)-100)) -> 5.9007048315764052 | L9: =IF(F9=0,0,((C9/F9)*100)-100) -> 29.049167586792237 | M9: =IF(G9=0,0,((C9/G9)*100)-100) -> 26.18911867369151 | N9: =IF(C9=0,0,IF(H9=0,0,((C9/H9)*100)-100)) -> 40.742058164695294 | P9: 5200000 | Q9: =IF(C9=0,0,((C9/P9)*100)-100) -> -2.3057061538461596 | R9: =IF(C9=0,0,(C9/$C$43)*100) -> 2.7023235178914016 | T9: 16.55 | U9: 16.065831244281313 | V9: 17.694419444952704 | W9: =U9-T9 -> -0.484168755718688
A10: Paranagua | B10: 2850000 | C10: 2717002.39 | D10: 2624076.75 | F10: 2391168.89 | G10: 3439850.11 | H10: 1873033.17 | J10: =IF(B10=0,0,((C10/B10)*100)-100) -> -4.6665828070175337 | K10: =IF(C10=0,0,IF(D10=0,0,((C10/D10)*100)-100)) -> 3.5412698961644367 | L10: =IF(F10=0,0,((C10/F10)*100)-100) -> 13.626536434237394 | M10: =IF(G10=0,0,((C10/G10)*100)-100) -> -21.013930749441869 | N10: =IF(C10=0,0,IF(H10=0,0,((C10/H10)*100)-100)) -> 45.058957498334138 | P10: 2850000 | Q10: =IF(C10=0,0,((C10/P10)*100)-100) -> -4.6665828070175337 | R10: =IF(C10=0,0,(C10/$C$43)*100) -> 1.4452894069240549 | T10: 17.75 | U10: 17.858654883259046 | V10: 19.630170108168361 | W10: =U10-T10 -> 0.10865488325904593
A11: Sitio Cercado | B11: 4100000 | C11: 3892806.19 | D11: 3641241.73 | F11: 3064982.36 | G11: 2712080.43 | H11: 2115152.14 | J11: =IF(B11=0,0,((C11/B11)*100)-100) -> -5.0535075609756177 | K11: =IF(C11=0,0,IF(D11=0,0,((C11/D11)*100)-100)) -> 6.9087547230762993 | L11: =IF(F11=0,0,((C11/F11)*100)-100) -> 27.009089540078151 | M11: =IF(G11=0,0,((C11/G11)*100)-100) -> 43.53579440120069 | N11: =IF(C11=0,0,IF(H11=0,0,((C11/H11)*100)-100)) -> 84.043791289642172 | P11: 4100000 | Q11: =IF(C11=0,0,((C11/P11)*100)-100) -> -5.0535075609756177 | R11: =IF(C11=0,0,(C11/$C$43)*100) -> 2.0707495769318736 | T11: 16.48 | U11: 14.194370668116923 | V11: 16.273104667458412 | W11: =U11-T11 -> -2.2856293318830776
A12: Apucarana | B12: 2900000 | C12: 3405552.95 | D12: 2957219.22 | F12: 2383089.69 | G12: 3270355.32 | H12: 2655040.76 | J12: =IF(B12=0,0,((C12/B12)*100)-100) -> 17.432860344827589 | K12: =IF(C12=0,0,IF(D12=0,0,((C12/D12)*100)-100)) -> 15.160652513275636 | L12: =IF(F12=0,0,((C12/F12)*100)-100) -> 42.904942448892882 | M12: =IF(G12=0,0,((C12/G12)*100)-100) -> 4.1340348913524281 | N12: =IF(C12=0,0,IF(H12=0,0,((C12/H12)*100)-100)) -> 28.267445129542949 | P12: 2900000 | Q12: =IF(C12=0,0,((C12/P12)*100)-100) -> 17.432860344827589 | R12: =IF(C12=0,0,(C12/$C$43)*100) -> 1.811558805200008 | T12: 15.3 | U12: 14.857827419773342 | V12: 16.871373683971054 | W12: =U12-T12 -> -0.44217258022665895
A13: Ahú | B13: 2600000 | C13: 2599696.78 | D13: 2461886.12 | F13: 2188513.62 | G13: 1971048 | H13: 1661996.21 | J13: =IF(B13=0,0,((C13/B13)*100)-100) -> -1.1662307692319018E-2 | K13: =IF(C13=0,0,IF(D13=0,0,((C13/D13)*100)-100)) -> 5.5977674548163066 | L13: =IF(F13=0,0,((C13/F13)*100)-100) -> 18.788238567142173 | M13: =IF(G13=0,0,((C13/G13)*100)-100) -> 31.894138549644651 | N13: =IF(C13=0,0,IF(H13=0,0,((C13/H13)*100)-100)) -> 56.42013888828302 | P13: 2600000 | Q13: =IF(C13=0,0,((C13/P13)*100)-100) -> -1.1662307692319018E-2 | R13: =IF(C13=0,0,(C13/$C$43)*100) -> 1.3828895518007163 | T13: 17.2 | U13: 16.768794089901519 | V13: 18.487302122980669 | W13: =U13-T13 -> -0.43120591009848042
A14: P.G. Centro | B14: 2650000 | C14: 2724497.02 | D14: 2489984.61 | F14: 2256065.06 | G14: 2230608.11 | H14: 2077088.71 | J14: =IF(B14=0,0,((C14/B14)*100)-100) -> 2.8112083018867935 | K14: =IF(C14=0,0,IF(D14=0,0,((C14/D14)*100)-100)) -> 9.4182272877582278 | L14: =IF(F14=0,0,((C14/F14)*100)-100) -> 20.763229230632206 | M14: =IF(G14=0,0,((C14/G14)*100)-100) -> 22.141446890014223 | N14: =IF(C14=0,0,IF(H14=0,0,((C14/H14)*100)-100)) -> 31.169025515525533 | P14: 2650000 | Q14: =IF(C14=0,0,((C14/P14)*100)-100) -> 2.8112083018867935 | R14: =IF(C14=0,0,(C14/$C$43)*100) -> 1.4492761201443607 | T14: 18.15 | U14: 17.263481536125884 | V14: 19.055559616651735 | W14: =U14-T14 -> -0.88651846387411481
A15: Maringa | B15: 4300000 | C15: 4691234.54 | D15: 4259044.47 | F15: 3464363.73 | G15: 3489969.41 | H15: 3087918.73 | J15: =IF(B15=0,0,((C15/B15)*100)-100) -> 9.0984776744186036 | K15: =IF(C15=0,0,IF(D15=0,0,((C15/D15)*100)-100)) -> 10.147582938949682 | L15: =IF(F15=0,0,((C15/F15)*100)-100) -> 35.414029981199462 | M15: =IF(G15=0,0,((C15/G15)*100)-100) -> 34.420505995208686 | N15: =IF(C15=0,0,IF(H15=0,0,((C15/H15)*100)-100)) -> 51.922215258560243 | P15: 4300000 | Q15: =IF(C15=0,0,((C15/P15)*100)-100) -> 9.0984776744186036 | R15: =IF(C15=0,0,(C15/$C$43)*100) -> 2.4954676561982123 | T15: 17.37 | U15: 17.212480704492766 | V15: 18.556506663169305 | W15: =U15-T15 -> -0.15751929550723531
A16: Centenario | B16: 0 | C16: 0 | D16: 0 | F16: 0 | G16: 1404634.28 | H16: 1214437.59 | J16: =IF(B16=0,0,((C16/B16)*100)-100) -> 0 | K16: =IF(C16=0,0,IF(D16=0,0,((C16/D16)*100)-100)) -> 0 | L16: =IF(F16=0,0,((C16/F16)*100)-100) -> 0 | M16: =IF(G16=0,0,((C16/G16)*100)-100) -> -100 | N16: =IF(C16=0,0,IF(H16=0,0,((C16/H16)*100)-100)) -> 0 | P16: 0 | Q16: =IF(C16=0,0,((C16/P16)*100)-100) -> 0 | R16: =IF(C16=0,0,(C16/$C$43)*100) -> 0 | T16: 0 | U16: 0 | V16: 0 | W16: =U16-T16 -> 0
A17: Cristo Rei | B17: 3300000 | C17: 3486827.67 | D17: 3153321.26 | F17: 2643155.13 | G17: 2608320.01 | H17: 2042787.01 | J17: =IF(B17=0,0,((C17/B17)*100)-100) -> 5.6614445454545432 | K17: =IF(C17=0,0,IF(D17=0,0,((C17/D17)*100)-100)) -> 10.576353707772881 | L17: =IF(F17=0,0,((C17/F17)*100)-100) -> 31.919145812678806 | M17: =IF(G17=0,0,((C17/G17)*100)-100) -> 33.68097689822963 | N17: =IF(C17=0,0,IF(H17=0,0,((C17/H17)*100)-100)) -> 70.68973186783677 | P17: 3300000 | Q17: =IF(C17=0,0,((C17/P17)*100)-100) -> 5.6614445454545432 | R17: =IF(C17=0,0,(C17/$C$43)*100) -> 1.8547922938046013 | T17: 17.79 | U17: 17.648798513750467 | V17: 19.212673705207806 | W17: =U17-T17 -> -0.14120148624953188
A18: Fazenda | B18: 4700000 | C18: 4557467.34 | D18: 4239468.46 | F18: 2867652.9 | G18: 1745185.89 | H18: 0 | J18: =IF(B18=0,0,((C18/B18)*100)-100) -> -3.032609787234037 | K18: =IF(C18=0,0,IF(D18=0,0,((C18/D18)*100)-100)) -> 7.5009139235346538 | L18: =IF(F18=0,0,((C18/F18)*100)-100) -> 58.926742493835292 | M18: =IF(G18=0,0,((C18/G18)*100)-100) -> 161.14509440596038 | N18: =IF(C18=0,0,IF(H18=0,0,((C18/H18)*100)-100)) -> 0 | P18: 4700000 | Q18: =IF(C18=0,0,((C18/P18)*100)-100) -> -3.032609787234037 | R18: =IF(C18=0,0,(C18/$C$43)*100) -> 2.4243111795364851 | T18: 13.8 | U18: 15.112677252888442 | V18: 16.872944250215955 | W18: =U18-T18 -> 1.3126772528884416
A19: Campo Largo | B19: 5200000 | C19: 4983606.82 | D19: 4834218.23 | F19: 3940395.67 | G19: 3825441.48 | H19: 2732975.77 | J19: =IF(B19=0,0,((C19/B19)*100)-100) -> -4.1614073076923006 | K19: =IF(C19=0,0,IF(D19=0,0,((C19/D19)*100)-100)) -> 3.090232647606399 | L19: =IF(F19=0,0,((C19/F19)*100)-100) -> 26.474781655619893 | M19: =IF(G19=0,0,((C19/G19)*100)-100) -> 30.275338050655535 | N19: =IF(C19=0,0,IF(H19=0,0,((C19/H19)*100)-100)) -> 82.350933173476335 | P19: 5200000 | Q19: =IF(C19=0,0,((C19/P19)*100)-100) -> -4.1614073076923006 | R19: =IF(C19=0,0,(C19/$C$43)*100) -> 2.6509929368227296 | T19: 16 | U19: 16.27434545488482 | V19: 18.312985577782797 | W19: =U19-T19 -> 0.27434545488481987
A20: Brasilia | B20: 3750000 | C20: 3744969.95 | D20: 3514657.75 | F20: 2814956.05 | G20: 2702264.88 | H20: 2407394.89 | J20: =IF(B20=0,0,((C20/B20)*100)-100) -> -0.13413466666666807 | K20: =IF(C20=0,0,IF(D20=0,0,((C20/D20)*100)-100)) -> 6.5529054713791197 | L20: =IF(F20=0,0,((C20/F20)*100)-100) -> 33.038309781071035 | M20: =IF(G20=0,0,((C20/G20)*100)-100) -> 38.586338360730963 | N20: =IF(C20=0,0,IF(H20=0,0,((C20/H20)*100)-100)) -> 55.561099076687015 | P20: 3750000 | Q20: =IF(C20=0,0,((C20/P20)*100)-100) -> -0.13413466666666807 | R20: =IF(C20=0,0,(C20/$C$43)*100) -> 1.9921091780798574 | T20: 15.91 | U20: 15.534767108077862 | V20: 17.607537027099511 | W20: =U20-T20 -> -0.37523289192213838
A21: Cajuru | B21: 6650000 | C21: 5988931.7999999998 | D21: 5864153.0700000003 | F21: 4459876.85 | G21: 0 | H21: 0 | J21: =IF(B21=0,0,((C21/B21)*100)-100) -> -9.9408751879699366 | K21: =IF(C21=0,0,IF(D21=0,0,((C21/D21)*100)-100)) -> 2.1278218441865988 | L21: =IF(F21=0,0,((C21/F21)*100)-100) -> 34.284689946091248 | M21: =IF(G21=0,0,((C21/G21)*100)-100) -> 0 | N21: =IF(C21=0,0,IF(H21=0,0,((C21/H21)*100)-100)) -> 0 | P21: 6650000 | Q21: =IF(C21=0,0,((C21/P21)*100)-100) -> -9.9408751879699366 | R21: =IF(C21=0,0,(C21/$C$43)*100) -> 3.185768154341083 | T21: 15 | U21: 15.65473996548099 | V21: 17.620187132536724 | W21: =U21-T21 -> 0.65473996548099045
A22: Total Super | B22: =SUM(B6:B21) -> 57650000 | C22: =SUM(C6:C21) -> 56883806.45000001 | D22: =SUM(D6:D21) -> 53574115.720000006 | F22: =SUM(F6:F21) -> 43674810.729999997 | G22: =SUM(G6:G21) -> 40882919.25 | H22: =SUM(H6:H21) -> 31408959.970000003 | I22: =SUM(B22:H22) -> 284074612.12 | J22: =IF(C22=0,0,((C22/B22)*100)-100) -> -1.3290434518646919 | K22: =IF(C22=0,0,IF(D22=0,0,((C22/D22)*100)-100)) -> 6.1777794845887684 | L22: =IF(F22=0,0,IF(C22=0,0,((C22/F22)*100)-100)) -> 30.243967859777882 | M22: =IF(G22=0,0,IF(C22=0,0,((C22/G22)*100)-100)) -> 39.138318626794273 | N22: =IF(C22=0,0,IF(H22=0,0,((C22/H22)*100)-100)) -> 81.106940517394037 | P22: =SUM(P6:P21) -> 57650000 | Q22: =IF(C22=0,0,((C22/P22)*100)-100) -> -1.3290434518646919 | R22: =IF(C22=0,0,(C22/$C$43)*100) -> 30.258921814089106 | T22: 16.229375542064179 | U22: 16.07548548643231 | V22: 17.957387725237222 | W22: =U22-T22 -> -0.15389005563186942
A23: Pinheirinho | B23: 6100000 | C23: 5962524.5899999999 | D23: 5443216.5800000001 | F23: 4916183.26 | G23: 5723971.3499999996 | H23: 4394928.72 | J23: =IF(B23=0,0,((C23/B23)*100)-100) -> -2.2536952459016391 | K23: =IF(C23=0,0,IF(D23=0,0,((C23/D23)*100)-100)) -> 9.5404620111588514 | L23: =IF(F23=0,0,((C23/F23)*100)-100) -> 21.283611180922506 | M23: =IF(G23=0,0,((C23/G23)*100)-100) -> 4.1676176453957936 | N23: =IF(C23=0,0,IF(H23=0,0,((C23/H23)*100)-100)) -> 35.668288836320414 | P23: 6100000 | Q23: =IF(C23=0,0,IF(P23=0,0,((C23/P23)*100)-100)) -> -2.2536952459016391 | R23: =IF(C23=0,0,(C23/$C$43)*100) -> 3.1717210335067811 | T23: 15.75 | U23: 15.404868795685756 | V23: 17.171230077895576 | W23: =U23-T23 -> -0.34513120431424404
A24: Londrina | B24: 6350000 | C24: 6006608.5800000001 | D24: 5850736.9800000004 | F24: 4440297.76 | G24: 3997406.1 | H24: 3281941.17 | J24: =IF(B24=0,0,((C24/B24)*100)-100) -> -5.4077388976377989 | K24: =IF(C24=0,0,IF(D24=0,0,((C24/D24)*100)-100)) -> 2.6641361683635125 | L24: =IF(F24=0,0,((C24/F24)*100)-100) -> 35.274905077536971 | M24: =IF(G24=0,0,((C24/G24)*100)-100) -> 50.262656075898803 | N24: =IF(C24=0,0,IF(H24=0,0,((C24/H24)*100)-100)) -> 83.019995449827036 | P24: 6350000 | Q24: =IF(C24=0,0,IF(P24=0,0,((C24/P24)*100)-100)) -> -5.4077388976377989 | R24: =IF(C24=0,0,(C24/$C$43)*100) -> 3.1951711872484365 | T24: 16.59 | U24: 15.242097230181095 | V24: 17.159067045450797 | W24: =U24-T24 -> -1.347902769818905
A25: São Bráz | B25: 7000000 | C25: 6602864.3700000001 | D25: 6325163.46 | F25: 5505828.0700000003 | G25: 5334827.78 | H25: 4756069.55 | J25: =IF(B25=0,0,((C25/B25)*100)-100) -> -5.6733661428571338 | K25: =IF(C25=0,0,IF(D25=0,0,((C25/D25)*100)-100)) -> 4.3904147577555221 | L25: =IF(F25=0,0,((C25/F25)*100)-100) -> 19.925001036220152 | M25: =IF(G25=0,0,((C25/G25)*100)-100) -> 23.76902577349928 | N25: =IF(C25=0,0,IF(H25=0,0,((C25/H25)*100)-100)) -> 38.830273623732012 | P25: 7000000 | Q25: =IF(C25=0,0,IF(P25=0,0,((C25/P25)*100)-100)) -> -5.6733661428571338 | R25: =IF(C25=0,0,(C25/$C$43)*100) -> 3.5123450625000272 | T25: 16.05 | U25: 15.176154224109862 | V25: 16.737430266192185 | W25: =U25-T25 -> -0.87384577589013901
A26: S.J. Pinhais | B26: 6750000 | C26: 6505268.2699999996 | D26: 6075988.4800000004 | F26: 6539051.54 | G26: 6293264.6699999999 | H26: 5297492.33 | J26: =IF(B26=0,0,((C26/B26)*100)-100) -> -3.6256552592592612 | K26: =IF(C26=0,0,IF(D26=0,0,((C26/D26)*100)-100)) -> 7.0651843961363028 | L26: =IF(F26=0,0,((C26/F26)*100)-100) -> -0.51663868671695923 | M26: =IF(G26=0,0,((C26/G26)*100)-100) -> 3.368738025759825 | N26: =IF(C26=0,0,IF(H26=0,0,((C26/H26)*100)-100)) -> 22.799012528254096 | P26: 6750000 | Q26: =IF(C26=0,0,IF(P26=0,0,((C26/P26)*100)-100)) -> -3.6256552592592612 | R26: =IF(C26=0,0,(C26/$C$43)*100) -> 3.4604295360337067 | T26: 16.2 | U26: 16.014356929818057 | V26: 17.636379955165172 | W26: =U26-T26 -> -0.1856430701819427
A27: P.G. Nova | B27: 8250000 | C27: 7845547.2699999996 | D27: 7594240.5300000003 | F27: 6292834.6699999999 | G27: 5350964.02 | H27: 5267288.85 | J27: =IF(B27=0,0,((C27/B27)*100)-100) -> -4.902457333333345 | K27: =IF(C27=0,0,IF(D27=0,0,((C27/D27)*100)-100)) -> 3.3091754074320789 | L27: =IF(F27=0,0,((C27/F27)*100)-100) -> 24.674295153538495 | M27: =IF(G27=0,0,((C27/G27)*100)-100) -> 46.619323932587378 | N27: =IF(C27=0,0,IF(H27=0,0,((C27/H27)*100)-100)) -> 48.948491214792597 | P27: 8250000 | Q27: =IF(C27=0,0,IF(P27=0,0,((C27/P27)*100)-100)) -> -4.902457333333345 | R27: =IF(C27=0,0,(C27/$C$43)*100) -> 4.1733810770968578 | T27: 15.58 | U27: 15.430349832051931 | V27: 17.244026780301333 | W27: =U27-T27 -> -0.14965016794806907
A28: Nilo Pecanha | B28: 17800000 | C28: 16886146.460000001 | D28: 16067032.42 | F28: 14521926.4 | G28: 14039862.640000001 | H28: 11899225.35 | J28: =IF(B28=0,0,((C28/B28)*100)-100) -> -5.1340086516853773 | K28: =IF(C28=0,0,IF(D28=0,0,((C28/D28)*100)-100)) -> 5.0981041090100803 | L28: =IF(F28=0,0,((C28/F28)*100)-100) -> 16.280347351161353 | M28: =IF(G28=0,0,((C28/G28)*100)-100) -> 20.272875119809569 | N28: =IF(C28=0,0,IF(H28=0,0,((C28/H28)*100)-100)) -> 41.909628259960641 | P28: 17800000 | Q28: =IF(C28=0,0,IF(P28=0,0,((C28/P28)*100)-100)) -> -5.1340086516853773 | R28: =IF(C28=0,0,(C28/$C$43)*100) -> 8.9824612198468206 | T28: 16.08 | U28: 16.281881757408375 | V28: 17.952021760446105 | W28: =U28-T28 -> 0.20188175740837622
A29: Champagnat | B29: 7850000 | C29: 7759834.0599999996 | D29: 7136725.5899999999 | F29: 6472752.7199999997 | G29: 7244937.2300000004 | H29: 6786149.1200000001 | J29: =IF(B29=0,0,((C29/B29)*100)-100) -> -1.1486107006369366 | K29: =IF(C29=0,0,IF(D29=0,0,((C29/D29)*100)-100)) -> 8.7310134338512597 | L29: =IF(F29=0,0,((C29/F29)*100)-100) -> 19.884605448051175 | M29: =IF(G29=0,0,((C29/G29)*100)-100) -> 7.1069881443265359 | N29: =IF(C29=0,0,IF(H29=0,0,((C29/H29)*100)-100)) -> 14.348121781326256 | P29: 7850000 | Q29: =IF(C29=0,0,IF(P29=0,0,((C29/P29)*100)-100)) -> -1.1486107006369366 | R29: =IF(C29=0,0,(C29/$C$43)*100) -> 4.1277865664323103 | T29: 16.4 | U29: 16.463432209012986 | V29: 17.975733773616287 | W29: =U29-T29 -> 6.3432209012987073E-2
A30: Araucária Nova | B30: 8400000 | C30: 8290322.5199999996 | D30: 7969288.0300000003 | F30: 4743041.02 | G30: 4306784.2 | H30: 3489729.87 | J30: =IF(B30=0,0,((C30/B30)*100)-100) -> -1.3056842857142925 | K30: =IF(C30=0,0,IF(D30=0,0,((C30/D30)*100)-100)) -> 4.0283961226081857 | L30: =IF(F30=0,0,((C30/F30)*100)-100) -> 74.789180296821456 | M30: =IF(G30=0,0,((C30/G30)*100)-100) -> 92.494495544959022 | N30: =IF(C30=0,0,IF(H30=0,0,((C30/H30)*100)-100)) -> 137.56344556262169 | P30: 8400000 | Q30: =IF(C30=0,0,IF(P30=0,0,((C30/P30)*100)-100)) -> -1.3056842857142925 | R30: =IF(C30=0,0,(C30/$C$43)*100) -> 4.4099759949566835 | T30: 15.5 | U30: 15.583804331897088 | V30: 17.622237378287185 | W30: =U30-T30 -> 8.3804331897088247E-2
A31: Santa Candida | B31: 10500000 | C31: 9714384.4000000004 | D31: 9311566.3000000007 | F31: 8419071.3100000005 | G31: 7717844.2300000004 | H31: 5987047.3300000001 | J31: =IF(B31=0,0,((C31/B31)*100)-100) -> -7.4820533333333259 | K31: =IF(C31=0,0,IF(D31=0,0,((C31/D31)*100)-100)) -> 4.3259972277703582 | L31: =IF(F31=0,0,((C31/F31)*100)-100) -> 15.385462865262284 | M31: =IF(G31=0,0,((C31/G31)*100)-100) -> 25.869143124698695 | N31: =IF(C31=0,0,IF(H31=0,0,((C31/H31)*100)-100)) -> 62.256682878102453 | P31: 10500000 | Q31: =IF(C31=0,0,IF(P31=0,0,((C31/P31)*100)-100)) -> -7.4820533333333259 | R31: =IF(C31=0,0,(C31/$C$43)*100) -> 5.1674952218604009 | T31: 15.58 | U31: 15.840518931904732 | V31: 17.773811026049167 | W31: =U31-T31 -> 0.2605189319047323
A32: Paranaguá Raia | B32: 10200000 | C32: 9568020.8499999996 | D32: 9440637.4100000001 | F32: 8017513.1500000004 | G32: 5276472.67 | H32: 6260880.0300000003 | J32: =IF(B32=0,0,((C32/B32)*100)-100) -> -6.1958740196078566 | K32: =IF(C32=0,0,IF(D32=0,0,((C32/D32)*100)-100)) -> 1.3493097390338278 | L32: =IF(F32=0,0,((C32/F32)*100)-100) -> 19.33901037630352 | M32: =IF(G32=0,0,((C32/G32)*100)-100) -> 81.333656940935128 | N32: =IF(C32=0,0,IF(H32=0,0,((C32/H32)*100)-100)) -> 52.822299806949019 | P32: 10200000 | Q32: =IF(C32=0,0,IF(P32=0,0,((C32/P32)*100)-100)) -> -6.1958740196078566 | R32: =IF(C32=0,0,(C32/$C$43)*100) -> 5.0896382096055097 | T32: 18.06 | U32: 17.808466418632442 | V32: 19.338028995829372 | W32: =U32-T32 -> -0.25153358136755699
A33: Novo Mundo | B33: 8150000 | C33: 7915229.71 | D33: 7295219.8200000003 | F33: 5759257.3899999997 | G33: 5779756.5199999996 | H33: 0 | J33: =IF(B33=0,0,((C33/B33)*100)-100) -> -2.8806170552147279 | K33: =IF(C33=0,0,IF(D33=0,0,((C33/D33)*100)-100)) -> 8.4988513752557395 | L33: =IF(F33=0,0,((C33/F33)*100)-100) -> 37.434901307649341 | M33: =IF(G33=0,0,((C33/G33)*100)-100) -> 36.947459336920332 | N33: =IF(C33=0,0,IF(H33=0,0,((C33/H33)*100)-100)) -> 0 | P33: 8150000 | Q33: =IF(C33=0,0,IF(P33=0,0,((C33/P33)*100)-100)) -> -2.8806170552147279 | R33: =IF(C33=0,0,(C33/$C$43)*100) -> 4.2104481377484388 | T33: 15.3 | U33: 15.666116909195804 | V33: 17.334842479258889 | W33: =U33-T33 -> 0.36611690919580298
A34: Água Verde | B34: 8600000 | C34: 8359504.1100000003 | D34: 7676900.1900000004 | F34: 6441083.0300000003 | G34: 0 | H34: 0 | J34: =IF(B34=0,0,((C34/B34)*100)-100) -> -2.796463837209302 | K34: =IF(C34=0,0,IF(D34=0,0,((C34/D34)*100)-100)) -> 8.8916607368318523 | L34: =IF(F34=0,0,((C34/F34)*100)-100) -> 29.784138336127 | M34: =IF(G34=0,0,((C34/G34)*100)-100) -> 0 | N34: =IF(C34=0,0,IF(H34=0,0,((C34/H34)*100)-100)) -> 0 | P34: 8600000 | Q34: =IF(C34=0,0,IF(P34=0,0,((C34/P34)*100)-100)) -> -2.796463837209302 | R34: =IF(C34=0,0,(C34/$C$43)*100) -> 4.4467766321402094 | T34: 15.6 | U34: 16.308272022609245 | V34: 17.857391337534732 | W34: =U34-T34 -> 0.70827202260924516
A35: Uvaranas | B35: 7300000 | C35: 7177277.7300000004 | D35: 6724164.3099999996 | F35: 5753717.1200000001 | G35: 4991975.82 | H35: 0 | J35: =IF(B35=0,0,((C35/B35)*100)-100) -> -1.6811269863013649 | K35: =IF(C35=0,0,IF(D35=0,0,((C35/D35)*100)-100)) -> 6.7385834002619873 | L35: =IF(F35=0,0,((C35/F35)*100)-100) -> 24.74158149088845 | M35: =IF(G35=0,0,((C35/G35)*100)-100) -> 43.776291969298853 | N35: =IF(C35=0,0,IF(H35=0,0,((C35/H35)*100)-100)) -> 0 | P35: 7300000 | Q35: =IF(C35=0,0,IF(P35=0,0,((C35/P35)*100)-100)) -> -1.6811269863013649 | R35: =IF(C35=0,0,(C35/$C$43)*100) -> 3.8179000180124714 | T35: 15.79 | U35: 16.008603445808134 | V35: 17.515224707627414 | W35: =U35-T35 -> 0.21860344580813518
A36: Torres | B36: 8250000 | C36: 7638941.7800000003 | D36: 7268700.8300000001 | F36: 6370556.29 | G36: 5595286.8799999999 | H36: 4734724.05 | J36: =IF(B36=0,0,((C36/B36)*100)-100) -> -7.4067663030302953 | K36: =IF(C36=0,0,IF(D36=0,0,((C36/D36)*100)-100)) -> 5.093633080507459 | L36: =IF(F36=0,0,((C36/F36)*100)-100) -> 19.910121381252253 | M36: =IF(G36=0,0,((C36/G36)*100)-100) -> 36.524577628091151 | N36: =IF(C36=0,0,IF(H36=0,0,((C36/H36)*100)-100)) -> 61.33869047764253 | P36: 8250000 | Q36: =IF(C36=0,0,IF(P36=0,0,((C36/P36)*100)-100)) -> -7.4067663030302953 | R36: =IF(C36=0,0,(C36/$C$43)*100) -> 4.0634788086231994 | T36: 15.6 | U36: 15.934793785010365 | V36: 17.863126321667032 | W36: =U36-T36 -> 0.3347937850103655
A37: Total Hiper | B37: =SUM(B23:B36) -> 121500000 | C37: =SUM(C23:C36) -> 116232474.7 | D37: =SUM(D23:D36) -> 110179580.92999999 | F37: =SUM(F23:F36) -> 94193113.730000019 | G37: =SUM(G23:G36) -> 81653354.110000014 | H37: =SUM(H23:H36) -> 62155476.36999999 | I37: =SUM(B37:H37) -> 585913999.84000003 | J37: =IF(C37=0,0,((C37/B37)*100)-100) -> -4.3354117695473207 | K37: =IF(C37=0,0,IF(D37=0,0,((C37/D37)*100)-100)) -> 5.4936620006256618 | L37: =IF(F37=0,0,IF(C37=0,0,((C37/F37)*100)-100)) -> 23.398059685312816 | M37: =IF(G37=0,0,IF(C37=0,0,((C37/G37)*100)-100)) -> 42.348683611228552 | N37: =IF(C37=0,0,IF(H37=0,0,((C37/H37)*100)-100)) -> 87.002789598280458 | P37: =SUM(P23:P36) -> 121500000 | Q37: =IF(C37=0,0,((C37/P37)*100)-100) -> -4.3354117695473207 | R37: =IF(C37=0,0,(C37/$C$43)*100) -> 61.829008705611855 | T37: 16.028349794238682 | U37: 16.01928248371021 | V37: 17.73214927678039 | W37: =U37-T37 -> -9.0673105284722055E-3
A38: Total s/ 33,36,38 | B38: =B22+B37 -> 179150000 | C38: =C22+C37 -> 173116281.15000001 | D38: =D22+D37 -> 163753696.65000001 | E38: =E22+E37 -> 0 | F38: =F22+F37 -> 137867924.46000001 | G38: =G22+G37 -> 122536273.36000001 | H38: =H22+H37 -> 93564436.339999989 | I38: =SUM(B38:H38) -> 869988611.96000004 | J38: =IF(C38=0,0,((C38/B38)*100)-100) -> -3.3679703321239174 | K38: =IF(C38=0,0,IF(D38=0,0,((C38/D38)*100)-100)) -> 5.717479783073955 | L38: =IF(F38=0,0,IF(C38=0,0,((C38/F38)*100)-100)) -> 25.566756610038539 | M38: =IF(G38=0,0,IF(C38=0,0,((C38/G38)*100)-100)) -> 41.27757961220243 | N38: =IF(C38=0,0,IF(H38=0,0,((C38/H38)*100)-100)) -> 85.02359221287864 | P38: =P22+P37 -> 179150000 | Q38: =IF(C38=0,0,((C38/P38)*100)-100) -> -3.3679703321239174 | R38: =IF(C38=0,0,(C38/$C$43)*100) -> 92.087930519700961 | T38: 16.093039352497907 | U38: 16.037750075016554 | V38: 17.806159763962789 | W38: =U38-T38 -> -5.5289277481353594E-2
A39: S.J.P - Rua Joinvile | B39: 6750000 | C39: 5824736.5700000003 | D39: 5675491.1399999997 | F39: 0 | G39: 0 | H39: 0 | J39: =IF(B39=0,0,((C39/B39)*100)-100) -> -13.707606370370357 | K39: =IF(C39=0,0,IF(D39=0,0,((C39/D39)*100)-100)) -> 2.6296478369623628 | L39: =IF(F39=0,0,((C39/F39)*100)-100) -> 0 | M39: =IF(G39=0,0,((C39/G39)*100)-100) -> 0 | N39: =IF(C39=0,0,IF(H39=0,0,((C39/H39)*100)-100)) -> 0 | P39: 6750000 | Q39: =IF(P39=0,0,IF(C39=0,0,((C39/P39)*100)-100)) -> -13.707606370370357 | R39: =IF(C39=0,0,(C39/$C$43)*100) -> 3.098425711264889 | T39: 15.82 | U39: 15.239868779164375 | V39: 16.942738677364769 | W39: =U39-T39 -> -0.58013122083562507
A40: Castro | B40: 4750000 | C40: 4220952.65 | D40: 3886275.79 | F40: 0 | G40: 0 | H40: 0 | J40: =IF(B40=0,0,((C40/B40)*100)-100) -> -11.137838947368422 | K40: =IF(C40=0,0,IF(D40=0,0,((C40/D40)*100)-100)) -> 8.6117629855600057 | L40: =IF(F40=0,0,((C40/F40)*100)-100) -> 0 | M40: =IF(G40=0,0,((C40/G40)*100)-100) -> 0 | N40: =IF(C40=0,0,IF(H40=0,0,((C40/H40)*100)-100)) -> 0 | P40: 4750000 | Q40: =IF(P40=0,0,IF(C40=0,0,((C40/P40)*100)-100)) -> -11.137838947368422 | R40: =IF(C40=0,0,(C40/$C$43)*100) -> 2.2453046690816558 | T40: 16.9 | U40: 16.007537066306586 | V40: 17.85395175423254 | W40: =U40-T40 -> -0.89246293369341245
B41: 0 | C41: 0 | D41: 0 | F41: 0 | G41: 0 | H41: 0 | J41: =IF(B41=0,0,((C41/B41)*100)-100) -> 0 | K41: =IF(C41=0,0,IF(D41=0,0,((C41/D41)*100)-100)) -> 0 | L41: =IF(F41=0,0,((C41/F41)*100)-100) -> 0 | M41: =IF(G41=0,0,((C41/G41)*100)-100) -> 0 | N41: =IF(C41=0,0,IF(H41=0,0,((C41/H41)*100)-100)) -> 0 | P41: 0 | Q41: =IF(P41=0,0,IF(C41=0,0,((C41/P41)*100)-100)) -> 0 | R41: =IF(C41=0,0,(C41/$C$43)*100) -> 0 | T41: 0 | U41: 0 | W41: =U41-T41 -> 0
A42: Colombo | B42: 5100000 | C42: 4828225.71 | D42: 4596766.18 | F42: 0 | G42: 0 | H42: 0 | J42: =IF(B42=0,0,((C42/B42)*100)-100) -> -5.328907647058827 | K42: =IF(C42=0,0,IF(D42=0,0,((C42/D42)*100)-100)) -> 5.0352687288523441 | L42: =IF(F42=0,0,((C42/F42)*100)-100) -> 0 | M42: =IF(G42=0,0,((C42/G42)*100)-100) -> 0 | N42: =IF(C42=0,0,IF(H42=0,0,((C42/H42)*100)-100)) -> 0 | P42: 5100000 | Q42: =IF(P42=0,0,IF(C42=0,0,((C42/P42)*100)-100)) -> -5.328907647058827 | R42: =IF(C42=0,0,(C42/$C$43)*100) -> 2.5683390999524933 | T42: 15 | U42: 14.653449579514376 | V42: 16.991437651741432 | W42: =U42-T42 -> -0.34655042048562379
A43: Total Geral | B43: =B22+B37+SUM(B39:B42) -> 195750000 | C43: =C22+C37+SUM(C39:C42) -> 187990196.08000001 | D43: =D22+D37+SUM(D39:D42) -> 177912229.75999999 | F43: =F22+F37+SUM(F39:F42) -> 137867924.46000001 | G43: =G22+G37+SUM(G39:G42) -> 122536273.36000001 | H43: =H22+H37+SUM(H39:H42) -> 93564436.339999989 | J43: =IF(C43=0,0,((C43/B43)*100)-100) -> -3.9641399335887542 | K43: =IF(C43=0,0,IF(D43=0,0,((C43/D43)*100)-100)) -> 5.6645719822605827 | L43: =IF(F43=0,0,IF(C43=0,0,((C43/F43)*100)-100)) -> 36.355281198522817 | M43: =IF(G43=0,0,IF(C43=0,0,((C43/G43)*100)-100)) -> 53.415956700186683 | N43: =IF(C43=0,0,IF(H43=0,0,((C43/H43)*100)-100)) -> 100.9205670804985 | P43: =P22+P37+SUM(P39:P42) -> 195750000 | Q43: =IF(C43=0,0,((C43/P43)*100)-100) -> -3.9641399335887542 | R43: =R22+R37+SUM(R39:R42) -> 100 | T43: 16.07 | U43: 15.976796410818444 | V43: 17.759555552243985 | W43: =U43-T43 -> -9.3203589181555913E-2
A45: Água Verde | B45: 0 | C45: 0 | D45: 0 | F45: 0 | G45: 0 | H45: 0 | J45: =IF(B45=0,0,((C45/B45)*100)-100) -> 0 | K45: =IF(C45=0,0,IF(D45=0,0,((C45/D45)*100)-100)) -> 0 | L45: =IF(F45=0,0,((C45/F45)*100)-100) -> 0 | M45: =IF(G45=0,0,((C45/G45)*100)-100) -> 0 | N45: =IF(C45=0,0,IF(H45=0,0,((C45/H45)*100)-100)) -> 0 | P45: =B45 -> 0 | Q45: =IF(C45=0,0,IF(P45=0,0,((C45/P45)*100)-100)) -> 0 | R45: =IF(C45=0,0,(C45/$C$43)*100) -> 0 | T45: 14.95 | U45: 0 | W45: =U45-T45 -> -14.95
A46: Total Geral | B46: =B43+B45 -> 195750000 | C46: =C43+C45 -> 187990196.08000001 | D46: =D43+D45 -> 177912229.75999999 | F46: =F43+F45 -> 137867924.46000001 | G46: =G43+G45 -> 122536273.36000001 | H46: =H43+H45 -> 93564436.339999989 | J46: =IF(C46=0,0,((C46/B46)*100)-100) -> -3.9641399335887542 | K46: =IF(C46=0,0,IF(D46=0,0,((C46/D46)*100)-100)) -> 5.6645719822605827 | L46: =IF(F46=0,0,IF(C46=0,0,((C46/F46)*100)-100)) -> 36.355281198522817 | M46: =IF(G46=0,0,IF(C46=0,0,((C46/G46)*100)-100)) -> 53.415956700186683 | N46: =IF(C46=0,0,IF(H46=0,0,((C46/H46)*100)-100)) -> 100.9205670804985 | P46: =P43+P45 -> 195750000 | Q46: =IF(C46=0,0,((C46/P46)*100)-100) -> -3.9641399335887542 | R46: =R25+R40+R45 -> 5.757649731581683 | T46: 16.074727969348661 | U46: 15.976796410818444 | W46: =U46-T46 -> -9.7931558530216734E-2