A2: Periodo: | C2: 38869 | D2: a | E2: 38898 | H2: Vendas Acumuladas por Filial | Q2: =NOW() -> 38908.395807638903
A4: v.1 | C4: Vendas 2006 | G4: Vendas de Anos Anteriores | K4: Percentuais ( % ) | Q4: Meta Mensal | U4: Margem
A5: Lojas | C5: Previsao | D5: Realizada | E5: Mes Anterior | G5: Vendas 2005 | H5: Vendas 2004 | I5: Vendas 2003 | K5: % Prev | L5: % MA | M5: 2005 | N5: 2004 | O5: 2003 | Q5: Previsao Mes | R5: Final | S5: Part. | U5: Meta | V5: Condor
A7: Xaxim | C7: 780000 | D7: 644824 | E7: 644754 | G7: 739593 | H7: 717141 | I7: 679172 | K7: =IF(C7=0,0,((D7/C7)*100)-100) -> -17.33 | L7: =IF(D7=0,0,IF(E7=0,0,((D7/E7)*100)-100)) -> 0.01 | M7: =IF(G7=0,0,((D7/G7)*100)-100) -> -12.81 | N7: =IF(H7=0,0,((D7/H7)*100)-100) -> -10.08 | O7: =IF(D7=0,0,IF(I7=0,0,((D7/I7)*100)-100)) -> -5.06 | Q7: 780000 | R7: =IF(D7=0,0,((D7/Q7)*100)-100) -> -17.33 | S7: =IF(D7=0,0,(D7/$D$35)*100) -> 1.16 | U7: 16 | V7: 15.85
A8: S. Felicidade | C8: 810000 | D8: 841856 | E8: 816923 | G8: 716033 | H8: 630404 | I8: 717340 | K8: =IF(C8=0,0,((D8/C8)*100)-100) -> 3.93 | L8: =IF(D8=0,0,IF(E8=0,0,((D8/E8)*100)-100)) -> 3.05 | M8: =IF(G8=0,0,((D8/G8)*100)-100) -> 17.57 | N8: =IF(H8=0,0,((D8/H8)*100)-100) -> 33.54 | O8: =IF(D8=0,0,IF(I8=0,0,((D8/I8)*100)-100)) -> 17.36 | Q8: 810000 | R8: =IF(D8=0,0,((D8/Q8)*100)-100) -> 3.93 | S8: =IF(D8=0,0,(D8/$D$35)*100) -> 1.51 | U8: 16.5 | V8: 16.55
A9: Lapa | C9: 1240000 | D9: 1006998 | E9: 982751 | G9: 1114880 | H9: 1051047 | I9: 962008 | K9: =IF(C9=0,0,((D9/C9)*100)-100) -> -18.79 | L9: =IF(D9=0,0,IF(E9=0,0,((D9/E9)*100)-100)) -> 2.47 | M9: =IF(G9=0,0,((D9/G9)*100)-100) -> -9.68 | N9: =IF(H9=0,0,((D9/H9)*100)-100) -> -4.19 | O9: =IF(D9=0,0,IF(I9=0,0,((D9/I9)*100)-100)) -> 4.68 | Q9: 1240000 | R9: =IF(D9=0,0,((D9/Q9)*100)-100) -> -18.79 | S9: =IF(D9=0,0,(D9/$D$35)*100) -> 1.81 | U9: 16.25 | V9: 14.73
A10: Araucaria | C10: 1000000 | D10: 877033 | E10: 897934 | G10: 926628 | H10: 960060 | I10: 980761 | K10: =IF(C10=0,0,((D10/C10)*100)-100) -> -12.3 | L10: =IF(D10=0,0,IF(E10=0,0,((D10/E10)*100)-100)) -> -2.33 | M10: =IF(G10=0,0,((D10/G10)*100)-100) -> -5.35 | N10: =IF(H10=0,0,((D10/H10)*100)-100) -> -8.65 | O10: =IF(D10=0,0,IF(I10=0,0,((D10/I10)*100)-100)) -> -10.58 | Q10: 1000000 | R10: =IF(D10=0,0,((D10/Q10)*100)-100) -> -12.3 | S10: =IF(D10=0,0,(D10/$D$35)*100) -> 1.58 | U10: 17.8 | V10: 17
A11: Pinheirinho | C11: 2800000 | D11: 2566516 | E11: 2161332 | G11: 1805768 | H11: 1828470 | I11: 1820985 | K11: =IF(C11=0,0,((D11/C11)*100)-100) -> -8.34 | L11: =IF(D11=0,0,IF(E11=0,0,((D11/E11)*100)-100)) -> 18.75 | M11: =IF(G11=0,0,((D11/G11)*100)-100) -> 42.13 | N11: =IF(H11=0,0,((D11/H11)*100)-100) -> 40.36 | O11: =IF(D11=0,0,IF(I11=0,0,((D11/I11)*100)-100)) -> 40.94 | Q11: 2800000 | R11: =IF(D11=0,0,((D11/Q11)*100)-100) -> -8.34 | S11: =IF(D11=0,0,(D11/$D$35)*100) -> 4.61 | U11: 16.1 | V11: 14.64
A12: Hauer | C12: 3040000 | D12: 2908178 | E12: 2847537 | G12: 2907759 | H12: 2720835 | I12: 2735855 | K12: =IF(C12=0,0,((D12/C12)*100)-100) -> -4.34 | L12: =IF(D12=0,0,IF(E12=0,0,((D12/E12)*100)-100)) -> 2.13 | M12: =IF(G12=0,0,((D12/G12)*100)-100) -> 0.01 | N12: =IF(H12=0,0,((D12/H12)*100)-100) -> 6.89 | O12: =IF(D12=0,0,IF(I12=0,0,((D12/I12)*100)-100)) -> 6.3 | Q12: 3040000 | R12: =IF(D12=0,0,((D12/Q12)*100)-100) -> -4.34 | S12: =IF(D12=0,0,(D12/$D$35)*100) -> 5.23 | U12: 16.97 | V12: 17.07
A13: Paranagua | C13: 1500000 | D13: 1413914 | E13: 1443145 | G13: 1606019 | H13: 2989738 | I13: 2737779 | K13: =IF(C13=0,0,((D13/C13)*100)-100) -> -5.74 | L13: =IF(D13=0,0,IF(E13=0,0,((D13/E13)*100)-100)) -> -2.03 | M13: =IF(G13=0,0,((D13/G13)*100)-100) -> -11.96 | N13: =IF(H13=0,0,((D13/H13)*100)-100) -> -52.71 | O13: =IF(D13=0,0,IF(I13=0,0,((D13/I13)*100)-100)) -> -48.36 | Q13: 1500000 | R13: =IF(D13=0,0,((D13/Q13)*100)-100) -> -5.74 | S13: =IF(D13=0,0,(D13/$D$35)*100) -> 2.54 | U13: 17.4 | V13: 17.68
A14: Centenario | C14: 980000 | D14: 882018 | E14: 859987 | G14: 934116 | H14: 814210 | I14: 929659 | K14: =IF(C14=0,0,((D14/C14)*100)-100) -> -10 | L14: =IF(D14=0,0,IF(E14=0,0,((D14/E14)*100)-100)) -> 2.56 | M14: =IF(G14=0,0,((D14/G14)*100)-100) -> -5.58 | N14: =IF(H14=0,0,((D14/H14)*100)-100) -> 8.33 | O14: =IF(D14=0,0,IF(I14=0,0,((D14/I14)*100)-100)) -> -5.12 | Q14: 980000 | R14: =IF(D14=0,0,((D14/Q14)*100)-100) -> -10 | S14: =IF(D14=0,0,(D14/$D$35)*100) -> 1.59 | U14: 16.6 | V14: 15.95
A15: Arapongas | C15: 0 | D15: 0 | E15: 0 | G15: 0 | H15: 0 | I15: 0 | K15: =IF(C15=0,0,((D15/C15)*100)-100) -> 0 | L15: =IF(D15=0,0,IF(E15=0,0,((D15/E15)*100)-100)) -> 0 | M15: =IF(D15=0,0,IF(G15=0,0,((D15/G15)*100)-100)) -> 0 | N15: =IF(D15=0,0,IF(H15=0,0,((D15/H15)*100)-100)) -> 0 | O15: =IF(D15=0,0,IF(I15=0,0,((D15/I15)*100)-100)) -> 0 | Q15: 0 | R15: =IF(D15=0,0,((D15/Q15)*100)-100) -> 0 | S15: =IF(D15=0,0,(D15/$D$35)*100) -> 0 | U15: 0 | V15: 0
A16: Sao Braz | C16: 3100000 | D16: 2921765 | E16: 2889687 | G16: 3058550 | H16: 2816856 | I16: 3004389 | K16: =IF(C16=0,0,((D16/C16)*100)-100) -> -5.75 | L16: =IF(D16=0,0,IF(E16=0,0,((D16/E16)*100)-100)) -> 1.11 | M16: =IF(G16=0,0,((D16/G16)*100)-100) -> -4.47 | N16: =IF(H16=0,0,((D16/H16)*100)-100) -> 3.72 | O16: =IF(D16=0,0,IF(I16=0,0,((D16/I16)*100)-100)) -> -2.75 | Q16: 3100000 | R16: =IF(D16=0,0,((D16/Q16)*100)-100) -> -5.75 | S16: =IF(D16=0,0,(D16/$D$35)*100) -> 5.25 | U16: 16.95 | V16: 16.05
A17: Sitio Cercado | C17: 1400000 | D17: 1142549 | E17: 1142164 | G17: 1162383 | H17: 1444058 | I17: 1288308 | K17: =IF(C17=0,0,((D17/C17)*100)-100) -> -18.39 | L17: =IF(D17=0,0,IF(E17=0,0,((D17/E17)*100)-100)) -> 0.03 | M17: =IF(G17=0,0,((D17/G17)*100)-100) -> -1.71 | N17: =IF(H17=0,0,((D17/H17)*100)-100) -> -20.88 | O17: =IF(D17=0,0,IF(I17=0,0,((D17/I17)*100)-100)) -> -11.31 | Q17: 1400000 | R17: =IF(D17=0,0,((D17/Q17)*100)-100) -> -18.39 | S17: =IF(D17=0,0,(D17/$D$35)*100) -> 2.05 | U17: 16.9 | V17: 16.1
A18: Apucarana | C18: 1850000 | D18: 1597831 | E18: 1662468 | G18: 1429338 | H18: 1336992 | I18: 1221294 | K18: =IF(C18=0,0,((D18/C18)*100)-100) -> -13.63 | L18: =IF(D18=0,0,IF(E18=0,0,((D18/E18)*100)-100)) -> -3.89 | M18: =IF(G18=0,0,((D18/G18)*100)-100) -> 11.79 | N18: =IF(H18=0,0,((D18/H18)*100)-100) -> 19.51 | O18: =IF(D18=0,0,IF(I18=0,0,((D18/I18)*100)-100)) -> 30.83 | Q18: 1850000 | R18: =IF(D18=0,0,((D18/Q18)*100)-100) -> -13.63 | S18: =IF(D18=0,0,(D18/$D$35)*100) -> 2.87 | U18: 15.75 | V18: 15.17
A19: Ahu | C19: 1190000 | D19: 1126688 | E19: 1120831 | G19: 1045089 | H19: 1013318 | I19: 1223100 | K19: =IF(C19=0,0,((D19/C19)*100)-100) -> -5.32 | L19: =IF(D19=0,0,IF(E19=0,0,((D19/E19)*100)-100)) -> 0.52 | M19: =IF(G19=0,0,((D19/G19)*100)-100) -> 7.81 | N19: =IF(H19=0,0,((D19/H19)*100)-100) -> 11.19 | O19: =IF(D19=0,0,IF(I19=0,0,((D19/I19)*100)-100)) -> -7.88 | Q19: 1190000 | R19: =IF(D19=0,0,((D19/Q19)*100)-100) -> -5.32 | S19: =IF(D19=0,0,(D19/$D$35)*100) -> 2.03 | U19: 17.15 | V19: 17.22
A20: P.G. Centro | C20: 1780000 | D20: 1545040 | E20: 1537966 | G20: 1617439 | H20: 1603418 | I20: 1555339 | K20: =IF(C20=0,0,((D20/C20)*100)-100) -> -13.2 | L20: =IF(D20=0,0,IF(E20=0,0,((D20/E20)*100)-100)) -> 0.46 | M20: =IF(G20=0,0,((D20/G20)*100)-100) -> -4.48 | N20: =IF(H20=0,0,((D20/H20)*100)-100) -> -3.64 | O20: =IF(D20=0,0,IF(I20=0,0,((D20/I20)*100)-100)) -> -0.66 | Q20: 1780000 | R20: =IF(D20=0,0,((D20/Q20)*100)-100) -> -13.2 | S20: =IF(D20=0,0,(D20/$D$35)*100) -> 2.78 | U20: 17.98 | V20: 17.86
A21: Maringa | C21: 2400000 | D21: 2233127 | E21: 2315533 | G21: 2156760 | H21: 2026575 | I21: 1818608 | K21: =IF(C21=0,0,((D21/C21)*100)-100) -> -6.95 | L21: =IF(D21=0,0,IF(E21=0,0,((D21/E21)*100)-100)) -> -3.56 | M21: =IF(G21=0,0,((D21/G21)*100)-100) -> 3.54 | N21: =IF(H21=0,0,((D21/H21)*100)-100) -> 10.19 | O21: =IF(D21=0,0,IF(I21=0,0,((D21/I21)*100)-100)) -> 22.79 | Q21: 2400000 | R21: =IF(D21=0,0,((D21/Q21)*100)-100) -> -6.95 | S21: =IF(D21=0,0,(D21/$D$35)*100) -> 4.02 | U21: 18.4 | V21: 16.73
A22: Araucaria Nova | C22: 2150000 | D22: 1873018 | E22: 1904421 | G22: 1928021 | H22: 1949037 | I22: 1844683 | K22: =IF(C22=0,0,((D22/C22)*100)-100) -> -12.88 | L22: =IF(D22=0,0,IF(E22=0,0,((D22/E22)*100)-100)) -> -1.65 | M22: =IF(G22=0,0,((D22/G22)*100)-100) -> -2.85 | N22: =IF(H22=0,0,((D22/H22)*100)-100) -> -3.9 | O22: =IF(D22=0,0,IF(I22=0,0,((D22/I22)*100)-100)) -> 1.54 | Q22: 2150000 | R22: =IF(D22=0,0,((D22/Q22)*100)-100) -> -12.88 | S22: =IF(D22=0,0,(D22/$D$35)*100) -> 3.37 | U22: 17.5 | V22: 17.16
A23: Sitio Cercado | C23: 0 | D23: 0 | E23: 0 | G23: 0 | H23: 0 | I23: 0 | K23: =IF(C23=0,0,((D23/C23)*100)-100) -> 0 | L23: =IF(D23=0,0,IF(E23=0,0,((D23/E23)*100)-100)) -> 0 | M23: =IF(G23=0,0,((D23/G23)*100)-100) -> 0 | N23: =IF(H23=0,0,((D23/H23)*100)-100) -> 0 | O23: =IF(D23=0,0,IF(I23=0,0,((D23/I23)*100)-100)) -> 0 | Q23: 0 | R23: =IF(Q23=0,0,IF(D23=0,0,((D23/Q23)*100)-100)) -> 0 | S23: =IF(D23=0,0,(D23/$D$35)*100) -> 0 | U23: 0 | V23: 0
A24: Total Super | C24: =SUM(C7:C23) -> 26020000 | D24: =SUM(D7:D23) -> 23581355 | E24: =SUM(E7:E23) -> 23227433 | G24: =SUM(G7:G23) -> 23148376 | H24: =SUM(H7:H23) -> 23902159 | I24: =SUM(I7:I23) -> 23519280 | J24: =SUM(C24:I24) -> 143398603 | K24: =IF(D24=0,0,((D24/C24)*100)-100) -> -9.37 | L24: =IF(D24=0,0,IF(E24=0,0,((D24/E24)*100)-100)) -> 1.52 | M24: =IF(G24=0,0,IF(D24=0,0,((D24/G24)*100)-100)) -> 1.87 | N24: =IF(H24=0,0,IF(D24=0,0,((D24/H24)*100)-100)) -> -1.34 | O24: =IF(D24=0,0,IF(I24=0,0,((D24/I24)*100)-100)) -> 0.26 | Q24: =SUM(Q7:Q23) -> 26020000 | R24: =IF(D24=0,0,((D24/Q24)*100)-100) -> -9.37 | S24: =IF(D24=0,0,(D24/$D$35)*100) -> 42.4 | U24: 17 | V24: 16.38
A26: Londrina | C26: 2800000 | D26: 2674747 | E26: 2794054 | G26: 2490522 | H26: 2174739 | I26: 2015177 | K26: =IF(C26=0,0,((D26/C26)*100)-100) -> -4.47 | L26: =IF(D26=0,0,IF(E26=0,0,((D26/E26)*100)-100)) -> -4.27 | M26: =IF(G26=0,0,((D26/G26)*100)-100) -> 7.4 | N26: =IF(H26=0,0,((D26/H26)*100)-100) -> 22.99 | O26: =IF(D26=0,0,IF(I26=0,0,((D26/I26)*100)-100)) -> 32.73 | Q26: 2800000 | R26: =IF(D26=0,0,IF(Q26=0,0,((D26/Q26)*100)-100)) -> -4.47 | S26: =IF(D26=0,0,(D26/$D$35)*100) -> 4.81 | U26: 15.7 | V26: 15.11
A27: S.J. Pinhais | C27: 4100000 | D27: 3844127 | E27: 3863756 | G27: 3804231 | H27: 3950795 | I27: 3765254 | K27: =IF(C27=0,0,((D27/C27)*100)-100) -> -6.24 | L27: =IF(D27=0,0,IF(E27=0,0,((D27/E27)*100)-100)) -> -0.51 | M27: =IF(G27=0,0,((D27/G27)*100)-100) -> 1.05 | N27: =IF(H27=0,0,((D27/H27)*100)-100) -> -2.7 | O27: =IF(D27=0,0,IF(I27=0,0,((D27/I27)*100)-100)) -> 2.09 | Q27: 4100000 | R27: =IF(D27=0,0,IF(Q27=0,0,((D27/Q27)*100)-100)) -> -6.24 | S27: =IF(D27=0,0,(D27/$D$35)*100) -> 6.91 | U27: 16.2 | V27: 15.56
A28: P.G. Nova | C28: 3700000 | D28: 3436033 | E28: 3380907 | G28: 3235323 | H28: 3023353 | I28: 2746314 | K28: =IF(C28=0,0,((D28/C28)*100)-100) -> -7.13 | L28: =IF(D28=0,0,IF(E28=0,0,((D28/E28)*100)-100)) -> 1.63 | M28: =IF(G28=0,0,((D28/G28)*100)-100) -> 6.2 | N28: =IF(H28=0,0,((D28/H28)*100)-100) -> 13.65 | O28: =IF(D28=0,0,IF(I28=0,0,((D28/I28)*100)-100)) -> 25.11 | Q28: 3700000 | R28: =IF(D28=0,0,IF(Q28=0,0,((D28/Q28)*100)-100)) -> -7.13 | S28: =IF(D28=0,0,(D28/$D$35)*100) -> 6.18 | U28: 16.4 | V28: 16.18
A29: Nilo Pecanha | C29: 8900000 | D29: 8779151 | E29: 8689542 | G29: 8562033 | H29: 7815025 | I29: 7956506 | K29: =IF(C29=0,0,((D29/C29)*100)-100) -> -1.36 | L29: =IF(D29=0,0,IF(E29=0,0,((D29/E29)*100)-100)) -> 1.03 | M29: =IF(G29=0,0,((D29/G29)*100)-100) -> 2.54 | N29: =IF(H29=0,0,((D29/H29)*100)-100) -> 12.34 | O29: =IF(D29=0,0,IF(I29=0,0,((D29/I29)*100)-100)) -> 10.34 | Q29: 8900000 | R29: =IF(D29=0,0,IF(Q29=0,0,((D29/Q29)*100)-100)) -> -1.36 | S29: =IF(D29=0,0,(D29/$D$35)*100) -> 15.78 | U29: 16.3 | V29: 15.55
A30: Champagnat | C30: 5950000 | D30: 5275736 | E30: 5375900 | G30: 5475749 | H30: 4527364 | I30: 0 | K30: =IF(C30=0,0,((D30/C30)*100)-100) -> -11.33 | L30: =IF(D30=0,0,IF(E30=0,0,((D30/E30)*100)-100)) -> -1.86 | M30: =IF(G30=0,0,((D30/G30)*100)-100) -> -3.65 | N30: =IF(H30=0,0,((D30/H30)*100)-100) -> 16.53 | O30: =IF(D30=0,0,IF(I30=0,0,((D30/I30)*100)-100)) -> 0 | Q30: 5950000 | R30: =IF(D30=0,0,IF(Q30=0,0,((D30/Q30)*100)-100)) -> -11.33 | S30: =IF(D30=0,0,(D30/$D$35)*100) -> 9.49 | U30: 16.4 | V30: 16.74
A31: Santa Candida | C31: 4800000 | D31: 3908014 | E31: 3905400 | G31: 4118036 | H31: 0 | I31: 0 | K31: =IF(C31=0,0,((D31/C31)*100)-100) -> -18.58 | L31: =IF(D31=0,0,IF(E31=0,0,((D31/E31)*100)-100)) -> 0.07 | M31: =IF(G31=0,0,((D31/G31)*100)-100) -> -5.1 | N31: =IF(H31=0,0,((D31/H31)*100)-100) -> 0 | O31: =IF(D31=0,0,IF(I31=0,0,((D31/I31)*100)-100)) -> 0 | Q31: 4800000 | R31: =IF(D31=0,0,IF(Q31=0,0,((D31/Q31)*100)-100)) -> -18.58 | S31: =IF(D31=0,0,(D31/$D$35)*100) -> 7.03 | U31: 16.38 | V31: 15.98
A32: Paranagu Raia | C32: 4900000 | D32: 4119756 | E32: 4175921 | G32: 3567369 | H32: 0 | I32: 0 | K32: =IF(C32=0,0,((D32/C32)*100)-100) -> -15.92 | L32: =IF(D32=0,0,IF(E32=0,0,((D32/E32)*100)-100)) -> -1.34 | M32: =IF(G32=0,0,((D32/G32)*100)-100) -> 15.48 | N32: =IF(H32=0,0,((D32/H32)*100)-100) -> 0 | O32: =IF(D32=0,0,IF(I32=0,0,((D32/I32)*100)-100)) -> 0 | Q32: 4900000 | R32: =IF(D32=0,0,IF(Q32=0,0,((D32/Q32)*100)-100)) -> -15.92 | S32: =IF(D32=0,0,(D32/$D$35)*100) -> 7.41 | U32: 16.3 | V32: 16.35
A33: Total Hiper | C33: =SUM(C26:C32) -> 35150000 | D33: =SUM(D26:D32) -> 32037564 | E33: =SUM(E26:E32) -> 32185480 | G33: =SUM(G26:G32) -> 31253263 | H33: =SUM(H26:H32) -> 21491276 | I33: =SUM(I26:I32) -> 16483251 | J33: =SUM(C33:I33) -> 168600834 | K33: =IF(D33=0,0,((D33/C33)*100)-100) -> -8.85 | L33: =IF(D33=0,0,IF(E33=0,0,((D33/E33)*100)-100)) -> -0.46 | M33: =IF(G33=0,0,IF(D33=0,0,((D33/G33)*100)-100)) -> 2.51 | N33: =IF(H33=0,0,IF(D33=0,0,((D33/H33)*100)-100)) -> 49.07 | O33: =IF(D33=0,0,IF(I33=0,0,((D33/I33)*100)-100)) -> 94.36 | Q33: =SUM(Q26:Q32) -> 35150000 | R33: =IF(D33=0,0,((D33/Q33)*100)-100) -> -8.85 | S33: =IF(D33=0,0,(D33/$D$35)*100) -> 57.6 | U33: 16.28 | V33: 15.93
A35: Total Geral | C35: =C24+C33 -> 61170000 | D35: =D24+D33 -> 55618919 | E35: =E24+E33 -> 55412913 | G35: =G24+G33 -> 54401639 | H35: =H24+H33 -> 45393435 | I35: =I24+I33 -> 40002531 | K35: =IF(D33=0,0,((D35/C35)*100)-100) -> -9.07 | L35: =IF(D35=0,0,IF(E35=0,0,((D35/E35)*100)-100)) -> 0.37 | M35: =IF(G35=0,0,IF(D35=0,0,((D35/G35)*100)-100)) -> 2.24 | N35: =IF(H35=0,0,IF(D35=0,0,((D35/H35)*100)-100)) -> 22.53 | O35: =IF(D35=0,0,IF(I35=0,0,((D35/I35)*100)-100)) -> 39.04 | Q35: =Q24+Q33 -> 61170000 | R35: =IF(D35=0,0,((D35/Q35)*100)-100) -> -9.07 | S35: =S24+S33 -> 100 | U35: 16.59 | V35: 16.12
C36: Resumo por Regiao - Outubro/2002
C37: Descricao das Aberturas | H37: Valor | I37: %
C38: Curitiba (2,3,6,7,10,11,13,17,21,22) | H38: =D7+D8+D11+D12+D14+D16+D17+D19+D29+D30+D32 -> 31209037 | I38: =IF(D35=0,0,H38/$D$35) -> 0.56110000000000004
C39: Curitiba e Metrop. (Ctba. 4,5,8,13,14,23) | H39: =H38+D9+D10+D13+D17+D28+D23 -> 39085564 | I39: =IF(D35=0,0,H39/$D$35) -> 0.70269999999999999
C40: Metropolitana (4,5,8,14,23) | H40: =H39-H38 -> 7876527 | I40: =IF(D35=0,0,H40/$D$35) -> 0.1416
C41: Norte (9,15,20) | H41: =D26+D18+D23 -> 4272578 | I41: =IF(D35=0,0,H41/$D$35) -> 7.6799999999999993E-2
C42: Centro-Oeste (18,19) | H42: =D20+D28 -> 4981073 | I42: =IF(D35=0,0,H42/$D$35) -> 8.9599999999999999E-2
C43: Ponta Grossa (18,19) | H43: =H42-D17 -> 3838524 | I43: =IF(D35=0,0,H43/$D$35) -> 6.9000000000000006E-2
C44: Super (2,3,4,5,6,7,8,10,11,13,15,17,18,20,23) | H44: =D24 -> 23581355 | I44: =IF(D35=0,0,H44/$D$35) -> 0.42399999999999999
C45: Hiper (9,14,19,21,22,24) | H45: =D33 -> 32037564 | I45: =IF(D35=0,0,H45/$D$35) -> 0.57599999999999996
C46: Curitiba, Metropolitana e Centro-Oeste | H46: =D35-H41 -> 51346341 | I46: =IF(D35=0,0,H46/$D$35) -> 0.92320000000000002
C47: Araucaria | H47: =D10+D23 -> 877033 | I47: =IF(D35=0,0,H47/$D$35) -> 1.5800000000000002E-2