A2: Periodo: | B2: 41091 | C2: a | D2: 41121 | G2: Vendas Acumuladas por Filial | P2: =NOW() -> 41122.355483680556
A4: v.New | B4: Vendas 2012 | F4: Vendas de Anos Anteriores | J4: Percentuais ( % ) | P4: Meta Mensal | T4: Margem
A5: Lojas | B5: Previsao | C5: Realizada | D5: Mes Anterior | F5: Vendas 2011 | G5: Vendas 2010 | H5: Vendas 2009 | J5: % Prev | K5: % MA | L5: 2011 | M5: 2010 | N5: 2009 | P5: Previsao Mes | Q5: Final | R5: Part. | T5: Meta | U5: Coml | V5: Sell O. | W5: Dif
A6: S. Felicidade | B6: 4300000 | C6: 4141453.25 | D6: 4097524.15 | F6: 3628901.57 | G6: 3101115.42 | H6: 2744208.52 | J6: =IF(B6=0,0,((C6/B6)*100)-100) -> -3.6871337209302339 | K6: =IF(C6=0,0,IF(D6=0,0,((C6/D6)*100)-100)) -> 1.0720888612700321 | L6: =IF(F6=0,0,((C6/F6)*100)-100) -> 14.124154929889727 | M6: =IF(G6=0,0,((C6/G6)*100)-100) -> 33.547214118202675 | N6: =IF(C6=0,0,IF(H6=0,0,((C6/H6)*100)-100)) -> 50.916128268561749 | P6: 4300000 | Q6: =IF(C6=0,0,((C6/P6)*100)-100) -> -3.6871337209302339 | R6: =IF(C6=0,0,(C6/$C$44)*100) -> 2.2376361039376689 | T6: 17.3 | U6: 17.251377158488992 | V6: 19.15076042691053 | W6: =U6-T6 -> -4.8622841511008374E-2
A7: Lapa | B7: 2900000 | C7: 2709477.8 | D7: 2709819.46 | F7: 2592981.67 | G7: 2489752.94 | H7: 2174727.3 | J7: =IF(B7=0,0,((C7/B7)*100)-100) -> -6.5697310344827571 | K7: =IF(C7=0,0,IF(D7=0,0,((C7/D7)*100)-100)) -> -1.2608220032490181E-2 | L7: =IF(F7=0,0,((C7/F7)*100)-100) -> 4.4927479182681509 | M7: =IF(G7=0,0,((C7/G7)*100)-100) -> 8.8251672071527025 | N7: =IF(C7=0,0,IF(H7=0,0,((C7/H7)*100)-100)) -> 24.589312876147744 | P7: 2900000 | Q7: =IF(C7=0,0,((C7/P7)*100)-100) -> -6.5697310344827571 | R7: =IF(C7=0,0,(C7/$C$44)*100) -> 1.4639366864995049 | T7: 15.3 | U7: 16.449261551432535 | V7: 18.318601004961177 | W7: =U7-T7 -> 1.1492615514325344
A8: Araucaria | B8: 1600000 | C8: 1468228.04 | D8: 1523149.37 | F8: 1571967.05 | G8: 1506680.49 | H8: 1346452.29 | J8: =IF(B8=0,0,((C8/B8)*100)-100) -> -8.2357475000000022 | K8: =IF(C8=0,0,IF(D8=0,0,((C8/D8)*100)-100)) -> -3.605774396243234 | L8: =IF(F8=0,0,((C8/F8)*100)-100) -> -6.5993119893957015 | M8: =IF(G8=0,0,((C8/G8)*100)-100) -> -2.5521303458306477 | N8: =IF(C8=0,0,IF(H8=0,0,((C8/H8)*100)-100)) -> 9.0441934634015126 | P8: 1600000 | Q8: =IF(C8=0,0,((C8/P8)*100)-100) -> -8.2357475000000022 | R8: =IF(C8=0,0,(C8/$C$44)*100) -> 0.79328676983559809 | T8: 16.59 | U8: 17.660689139270218 | V8: 19.079465101347608 | W8: =U8-T8 -> 1.0706891392702182
A9: Hauer | B9: 5200000 | C9: 4778904.09 | D9: 4941512.24 | F9: 4272621.88 | G9: 3881089.46 | H9: 3804584.01 | J9: =IF(B9=0,0,((C9/B9)*100)-100) -> -8.0979982692307715 | K9: =IF(C9=0,0,IF(D9=0,0,((C9/D9)*100)-100)) -> -3.2906556151725823 | L9: =IF(F9=0,0,((C9/F9)*100)-100) -> 11.849450389464366 | M9: =IF(G9=0,0,((C9/G9)*100)-100) -> 23.13305681956632 | N9: =IF(C9=0,0,IF(H9=0,0,((C9/H9)*100)-100)) -> 25.609109364889534 | P9: 5200000 | Q9: =IF(C9=0,0,((C9/P9)*100)-100) -> -8.0979982692307715 | R9: =IF(C9=0,0,(C9/$C$44)*100) -> 2.582052164669344 | T9: 16.42 | U9: 16.253636301790689 | V9: 17.757580813889071 | W9: =U9-T9 -> -0.16636369820931307
A10: Paranagua | B10: 2450000 | C10: 2405208.26 | D10: 2409707.83 | F10: 2295514.16 | G10: 5201886.79 | H10: 2012380.99 | J10: =IF(B10=0,0,((C10/B10)*100)-100) -> -1.8282342857142879 | K10: =IF(C10=0,0,IF(D10=0,0,((C10/D10)*100)-100)) -> -0.18672678670759524 | L10: =IF(F10=0,0,((C10/F10)*100)-100) -> 4.7786287669861167 | M10: =IF(G10=0,0,((C10/G10)*100)-100) -> -53.762771911458692 | N10: =IF(C10=0,0,IF(H10=0,0,((C10/H10)*100)-100)) -> 19.520521807354172 | P10: 2450000 | Q10: =IF(C10=0,0,((C10/P10)*100)-100) -> -1.8282342857142879 | R10: =IF(C10=0,0,(C10/$C$44)*100) -> 1.2995391992086591 | T10: 17.43 | U10: 18.552921899578042 | V10: 19.924099000890678 | W10: =U10-T10 -> 1.1229218995780421
A11: Sitio Cercado | B11: 3900000 | C11: 3672002.62 | D11: 3640763.89 | F11: 3310090.36 | G11: 2559461.69 | H11: 2206140.2 | J11: =IF(B11=0,0,((C11/B11)*100)-100) -> -5.8460866666666647 | K11: =IF(C11=0,0,IF(D11=0,0,((C11/D11)*100)-100)) -> 0.85802680272134069 | L11: =IF(F11=0,0,((C11/F11)*100)-100) -> 10.933606658399512 | M11: =IF(G11=0,0,((C11/G11)*100)-100) -> 43.467770365416186 | N11: =IF(C11=0,0,IF(H11=0,0,((C11/H11)*100)-100)) -> 66.444662945718505 | P11: 3900000 | Q11: =IF(C11=0,0,((C11/P11)*100)-100) -> -5.8460866666666647 | R11: =IF(C11=0,0,(C11/$C$44)*100) -> 1.9839909182279705 | T11: 15.32 | U11: 15.382244471274371 | V11: 17.208020404408099 | W11: =U11-T11 -> 6.2244471274370383E-2
A12: Apucarana | B12: 3150000 | C12: 2877746.44 | D12: 2838702.05 | F12: 3130976.14 | G12: 2803913.3 | H12: 2600487.21 | J12: =IF(B12=0,0,((C12/B12)*100)-100) -> -8.6429701587301508 | K12: =IF(C12=0,0,IF(D12=0,0,((C12/D12)*100)-100)) -> 1.3754310706895154 | L12: =IF(F12=0,0,((C12/F12)*100)-100) -> -8.0878834164478803 | M12: =IF(G12=0,0,((C12/G12)*100)-100) -> 2.633217653341859 | N12: =IF(C12=0,0,IF(H12=0,0,((C12/H12)*100)-100)) -> 10.66181863667002 | P12: 3150000 | Q12: =IF(C12=0,0,((C12/P12)*100)-100) -> -8.6429701587301508 | R12: =IF(C12=0,0,(C12/$C$44)*100) -> 1.5548525948281793 | T12: 15.91 | U12: 15.906704066672392 | V12: 17.955793196985066 | W12: =U12-T12 -> -3.29593332760858E-3
A13: Ahú | B13: 2590000 | C13: 2516289.11 | D13: 2490417.6 | F13: 2310955.64 | G13: 1923325.96 | H13: 1743325.93 | J13: =IF(B13=0,0,((C13/B13)*100)-100) -> -2.8459803088803142 | K13: =IF(C13=0,0,IF(D13=0,0,((C13/D13)*100)-100)) -> 1.0388422407551161 | L13: =IF(F13=0,0,((C13/F13)*100)-100) -> 8.8852190170123606 | M13: =IF(G13=0,0,((C13/G13)*100)-100) -> 30.830091327837124 | N13: =IF(C13=0,0,IF(H13=0,0,((C13/H13)*100)-100)) -> 44.338420412297751 | P13: 2590000 | Q13: =IF(C13=0,0,((C13/P13)*100)-100) -> -2.8459803088803142 | R13: =IF(C13=0,0,(C13/$C$44)*100) -> 1.3595564215245417 | T13: 16.96 | U13: 17.521875695754215 | V13: 19.021479745624305 | W13: =U13-T13 -> 0.56187569575421392
A14: P.G. Centro | B14: 2400000 | C14: 2340986.56 | D14: 2357109.65 | F14: 2296929.47 | G14: 2015217.52 | H14: 1976229.65 | J14: =IF(B14=0,0,((C14/B14)*100)-100) -> -2.4588933333333358 | K14: =IF(C14=0,0,IF(D14=0,0,((C14/D14)*100)-100)) -> -0.68401951517188309 | L14: =IF(F14=0,0,((C14/F14)*100)-100) -> 1.9180863224328704 | M14: =IF(G14=0,0,((C14/G14)*100)-100) -> 16.165452948225663 | N14: =IF(C14=0,0,IF(H14=0,0,((C14/H14)*100)-100)) -> 18.457212702987235 | P14: 2400000 | Q14: =IF(C14=0,0,((C14/P14)*100)-100) -> -2.4588933333333358 | R14: =IF(C14=0,0,(C14/$C$44)*100) -> 1.2648400764849501 | T14: 18.5 | U14: 18.475849344474664 | V14: 19.876096759820783 | W14: =U14-T14 -> -2.4150655525335907E-2
A15: Maringa | B15: 4500000 | C15: 4113650.56 | D15: 4300910.71 | F15: 3475395.94 | G15: 3174981.94 | H15: 2919876.58 | J15: =IF(B15=0,0,((C15/B15)*100)-100) -> -8.5855431111111074 | K15: =IF(C15=0,0,IF(D15=0,0,((C15/D15)*100)-100)) -> -4.3539650698770203 | L15: =IF(F15=0,0,((C15/F15)*100)-100) -> 18.364946930334497 | M15: =IF(G15=0,0,((C15/G15)*100)-100) -> 29.564534152909232 | N15: =IF(C15=0,0,IF(H15=0,0,((C15/H15)*100)-100)) -> 40.884398613861947 | P15: 4500000 | Q15: =IF(C15=0,0,((C15/P15)*100)-100) -> -8.5855431111111074 | R15: =IF(C15=0,0,(C15/$C$44)*100) -> 2.2226142506955524 | T15: 17.16 | U15: 17.496668214813074 | V15: 18.872141621577114 | W15: =U15-T15 -> 0.33666821481307352
A16: Centenario | B16: 0 | C16: 0 | D16: 0 | F16: 0 | G16: 0 | H16: 0 | J16: =IF(B16=0,0,((C16/B16)*100)-100) -> 0 | K16: =IF(C16=0,0,IF(D16=0,0,((C16/D16)*100)-100)) -> 0 | L16: =IF(F16=0,0,((C16/F16)*100)-100) -> 0 | M16: =IF(G16=0,0,((C16/G16)*100)-100) -> 0 | N16: =IF(C16=0,0,IF(H16=0,0,((C16/H16)*100)-100)) -> 0 | P16: 0 | Q16: =IF(C16=0,0,((C16/P16)*100)-100) -> 0 | R16: =IF(C16=0,0,(C16/$C$44)*100) -> 0 | T16: 0 | U16: 0 | V16: 0 | W16: =U16-T16 -> 0
A17: Cristo Rei | B17: 3300000 | C17: 3140736.17 | D17: 3233019.68 | F17: 2903347.11 | G17: 2451640.76 | H17: 2065192.97 | J17: =IF(B17=0,0,((C17/B17)*100)-100) -> -4.8261766666666688 | K17: =IF(C17=0,0,IF(D17=0,0,((C17/D17)*100)-100)) -> -2.8544060703026872 | L17: =IF(F17=0,0,((C17/F17)*100)-100) -> 8.1763926601253161 | M17: =IF(G17=0,0,((C17/G17)*100)-100) -> 28.107519716714137 | N17: =IF(C17=0,0,IF(H17=0,0,((C17/H17)*100)-100)) -> 52.079549738153531 | P17: 3300000 | Q17: =IF(C17=0,0,((C17/P17)*100)-100) -> -4.8261766666666688 | R17: =IF(C17=0,0,(C17/$C$44)*100) -> 1.6969465119363389 | T17: 17.56 | U17: 18.551525453346184 | V17: 20.065344294742211 | W17: =U17-T17 -> 0.9915254533461848
A18: Fazenda | B18: 4950000 | C18: 4275922.72 | D18: 4338862.02 | F18: 3124776.47 | G18: 2886047.51 | H18: 0 | J18: =IF(B18=0,0,((C18/B18)*100)-100) -> -13.617722828282837 | K18: =IF(C18=0,0,IF(D18=0,0,((C18/D18)*100)-100)) -> -1.4505946423251288 | L18: =IF(F18=0,0,((C18/F18)*100)-100) -> 36.83931510147346 | M18: =IF(G18=0,0,((C18/G18)*100)-100) -> 48.158431390479763 | N18: =IF(C18=0,0,IF(H18=0,0,((C18/H18)*100)-100)) -> 0 | P18: 4950000 | Q18: =IF(C18=0,0,((C18/P18)*100)-100) -> -13.617722828282837 | R18: =IF(C18=0,0,(C18/$C$44)*100) -> 2.3102902479749976 | T18: 16 | U18: 16.270584749950768 | V18: 17.810551522315635 | W18: =U18-T18 -> 0.27058474995076764
A19: Campo Largo | B19: 5200000 | C19: 4767797.28 | D19: 4732273.93 | F19: 4327869.34 | G19: 3812045.62 | H19: 3051237.27 | J19: =IF(B19=0,0,((C19/B19)*100)-100) -> -8.3115907692307616 | K19: =IF(C19=0,0,IF(D19=0,0,((C19/D19)*100)-100)) -> 0.750661321078681 | L19: =IF(F19=0,0,((C19/F19)*100)-100) -> 10.165000498836704 | M19: =IF(G19=0,0,((C19/G19)*100)-100) -> 25.071884108249478 | N19: =IF(C19=0,0,IF(H19=0,0,((C19/H19)*100)-100)) -> 56.257834383361484 | P19: 5200000 | Q19: =IF(C19=0,0,((C19/P19)*100)-100) -> -8.3115907692307616 | R19: =IF(C19=0,0,(C19/$C$44)*100) -> 2.5760511313230001 | T19: 16 | U19: 16.859943550284502 | V19: 18.590911950434268 | W19: =U19-T19 -> 0.85994355028450187
A20: Brasilia | B20: 3850000 | C20: 3439907.56 | D20: 3454338.07 | F20: 3115367.56 | G20: 2546087.81 | H20: 2512122.98 | J20: =IF(B20=0,0,((C20/B20)*100)-100) -> -10.651751688311677 | K20: =IF(C20=0,0,IF(D20=0,0,((C20/D20)*100)-100)) -> -0.4177503680176784 | L20: =IF(F20=0,0,((C20/F20)*100)-100) -> 10.417390364044238 | M20: =IF(G20=0,0,((C20/G20)*100)-100) -> 35.105613659098424 | N20: =IF(C20=0,0,IF(H20=0,0,((C20/H20)*100)-100)) -> 36.932291427866318 | P20: 3850000 | Q20: =IF(C20=0,0,((C20/P20)*100)-100) -> -10.651751688311677 | R20: =IF(C20=0,0,(C20/$C$44)*100) -> 1.8585894578102824 | T20: 16 | U20: 16.473156621685494 | V20: 18.471407728758848 | W20: =U20-T20 -> 0.47315662168549366
A21: Cajuru | B21: 6450000 | C21: 5580347.46 | D21: 5715977.6699999999 | F21: 5228187.57 | G21: 0 | H21: 0 | J21: =IF(B21=0,0,((C21/B21)*100)-100) -> -13.482985116279067 | K21: =IF(C21=0,0,IF(D21=0,0,((C21/D21)*100)-100)) -> -2.3728260995813173 | L21: =IF(F21=0,0,((C21/F21)*100)-100) -> 6.7357929547275006 | M21: =IF(G21=0,0,((C21/G21)*100)-100) -> 0 | N21: =IF(C21=0,0,IF(H21=0,0,((C21/H21)*100)-100)) -> 0 | P21: 6450000 | Q21: =IF(C21=0,0,((C21/P21)*100)-100) -> -13.482985116279067 | R21: =IF(C21=0,0,(C21/$C$44)*100) -> 3.0150737422939318 | T21: 15.8 | U21: 16.694212621663524 | V21: 18.468382010033473 | W21: =U21-T21 -> 0.89421262166352378
A22: Total Super | B22: =SUM(B6:B21) -> 56740000 | C22: =SUM(C6:C21) -> 52228657.920000002 | D22: =SUM(D6:D21) -> 52784088.320000008 | F22: =SUM(F6:F21) -> 47585881.93 | G22: =SUM(G6:G21) -> 40353247.210000001 | H22: =SUM(H6:H21) -> 31156965.899999999 | I22: =SUM(B22:H22) -> 280848841.28000003 | J22: =IF(C22=0,0,((C22/B22)*100)-100) -> -7.9509025026436291 | K22: =IF(C22=0,0,IF(D22=0,0,((C22/D22)*100)-100)) -> -1.0522686242731822 | L22: =IF(F22=0,0,IF(C22=0,0,((C22/F22)*100)-100)) -> 9.7566248679169973 | M22: =IF(G22=0,0,IF(C22=0,0,((C22/G22)*100)-100)) -> 29.428637175590524 | N22: =IF(C22=0,0,IF(H22=0,0,((C22/H22)*100)-100)) -> 67.630757396695032 | P22: =SUM(P6:P21) -> 56740000 | Q22: =IF(C22=0,0,((C22/P22)*100)-100) -> -7.9509025026436291 | R22: =IF(C22=0,0,(C22/$C$44)*100) -> 28.219256277250519 | T22: 16.437440958759254 | U22: 16.923018764024945 | V22: 18.592150295291368 | W22: =U22-T22 -> 0.48557780526569161
A23: Pinheirinho | B23: 6100000 | C23: 5579524.5499999998 | D23: 5712381.7300000004 | F23: 5316147.84 | G23: 4329409.29 | H23: 4639532.62 | J23: =IF(B23=0,0,((C23/B23)*100)-100) -> -8.5323844262295125 | K23: =IF(C23=0,0,IF(D23=0,0,((C23/D23)*100)-100)) -> -2.3257755920313912 | L23: =IF(F23=0,0,((C23/F23)*100)-100) -> 4.9542773814205958 | M23: =IF(G23=0,0,((C23/G23)*100)-100) -> 28.874961369152516 | N23: =IF(C23=0,0,IF(H23=0,0,((C23/H23)*100)-100)) -> 20.26048757471608 | P23: 6100000 | Q23: =IF(C23=0,0,IF(P23=0,0,((C23/P23)*100)-100)) -> -8.5323844262295125 | R23: =IF(C23=0,0,(C23/$C$44)*100) -> 3.0146291222499189 | T23: 15.5 | U23: 16.35193504077332 | V23: 17.760304071069999 | W23: =U23-T23 -> 0.85193504077331994
A24: Londrina | B24: 6850000 | C24: 6185419.9699999997 | D24: 6396956.5800000001 | F24: 4739840.58 | G24: 3927436.69 | H24: 3651179.34 | J24: =IF(B24=0,0,((C24/B24)*100)-100) -> -9.7018982481751834 | K24: =IF(C24=0,0,IF(D24=0,0,((C24/D24)*100)-100)) -> -3.3068320435590692 | L24: =IF(F24=0,0,((C24/F24)*100)-100) -> 30.498481237949136 | M24: =IF(G24=0,0,((C24/G24)*100)-100) -> 57.492544329212336 | N24: =IF(C24=0,0,IF(H24=0,0,((C24/H24)*100)-100)) -> 69.408823670655408 | P24: 6850000 | Q24: =IF(C24=0,0,IF(P24=0,0,((C24/P24)*100)-100)) -> -9.7018982481751834 | R24: =IF(C24=0,0,(C24/$C$44)*100) -> 3.3419957216440999 | T24: 16.09 | U24: 15.985769515986478 | V24: 17.274402538264514 | W24: =U24-T24 -> -0.10423048401352197
A25: São Bráz | B25: 7200000 | C25: 6489125.0800000001 | D25: 6702303.5499999998 | F25: 6112421.1600000001 | G25: 5382611.0199999996 | H25: 5089482.99 | J25: =IF(B25=0,0,((C25/B25)*100)-100) -> -9.8732627777777822 | K25: =IF(C25=0,0,IF(D25=0,0,((C25/D25)*100)-100)) -> -3.1806746502849705 | L25: =IF(F25=0,0,((C25/F25)*100)-100) -> 6.1629248073606249 | M25: =IF(G25=0,0,((C25/G25)*100)-100) -> 20.557199022715196 | N25: =IF(C25=0,0,IF(H25=0,0,((C25/H25)*100)-100)) -> 27.500673305128771 | P25: 7200000 | Q25: =IF(C25=0,0,IF(P25=0,0,((C25/P25)*100)-100)) -> -9.8732627777777822 | R25: =IF(C25=0,0,(C25/$C$44)*100) -> 3.5060882461912164 | T25: 15.45 | U25: 16.108830807126314 | V25: 17.475800651387662 | W25: =U25-T25 -> 0.65883080712631426
A26: S.J. Pinhais | B26: 7100000 | C26: 6254988.1299999999 | D26: 6402768.1500000004 | F26: 7077042.3799999999 | G26: 6004699.2999999998 | H26: 5607342.1100000003 | J26: =IF(B26=0,0,((C26/B26)*100)-100) -> -11.901575633802821 | K26: =IF(C26=0,0,IF(D26=0,0,((C26/D26)*100)-100)) -> -2.3080645204996273 | L26: =IF(F26=0,0,((C26/F26)*100)-100) -> -11.615788147929678 | M26: =IF(G26=0,0,((C26/G26)*100)-100) -> 4.1682158838494985 | N26: =IF(C26=0,0,IF(H26=0,0,((C26/H26)*100)-100)) -> 11.549964444741164 | P26: 7100000 | Q26: =IF(C26=0,0,IF(P26=0,0,((C26/P26)*100)-100)) -> -11.901575633802821 | R26: =IF(C26=0,0,(C26/$C$44)*100) -> 3.3795835482121075 | T26: 16.7 | U26: 16.543296781603964 | V26: 17.99573888400009 | W26: =U26-T26 -> -0.15670321839603574
A27: P.G. Nova | B27: 8500000 | C27: 7517586.4699999997 | D27: 7710728.2599999998 | F27: 7075854.96 | G27: 5746817.6699999999 | H27: 4786404.66 | J27: =IF(B27=0,0,((C27/B27)*100)-100) -> -11.557806235294123 | K27: =IF(C27=0,0,IF(D27=0,0,((C27/D27)*100)-100)) -> -2.5048449833453219 | L27: =IF(F27=0,0,((C27/F27)*100)-100) -> 6.242800516645957 | M27: =IF(G27=0,0,((C27/G27)*100)-100) -> 30.813032563115911 | N27: =IF(C27=0,0,IF(H27=0,0,((C27/H27)*100)-100)) -> 57.061239155654675 | P27: 8500000 | Q27: =IF(C27=0,0,IF(P27=0,0,((C27/P27)*100)-100)) -> -11.557806235294123 | R27: =IF(C27=0,0,(C27/$C$44)*100) -> 4.0617681485950206 | T27: 15.66 | U27: 16.507827012730058 | V27: 17.764236888119228 | W27: =U27-T27 -> 0.84782701273005756
A28: Nilo Pecanha | B28: 17500000 | C28: 16759172.720000001 | D28: 16900508.969999999 | F28: 15108402.640000001 | G28: 13492288.15 | H28: 12528963.73 | J28: =IF(B28=0,0,((C28/B28)*100)-100) -> -4.2332987428571442 | K28: =IF(C28=0,0,IF(D28=0,0,((C28/D28)*100)-100)) -> -0.83628398559406492 | L28: =IF(F28=0,0,((C28/F28)*100)-100) -> 10.926172139664402 | M28: =IF(G28=0,0,((C28/G28)*100)-100) -> 24.212976580996013 | N28: =IF(C28=0,0,IF(H28=0,0,((C28/H28)*100)-100)) -> 33.763438710186108 | P28: 17500000 | Q28: =IF(C28=0,0,IF(P28=0,0,((C28/P28)*100)-100)) -> -4.2332987428571442 | R28: =IF(C28=0,0,(C28/$C$44)*100) -> 9.0550170886027175 | T28: 16.8 | U28: 16.902678057726945 | V28: 18.64153173904398 | W28: =U28-T28 -> 0.10267805772694416
A29: Champagnat | B29: 8000000 | C29: 7294569.71 | D29: 7540207.7300000004 | F29: 7106008.4699999997 | G29: 6457497.8300000001 | H29: 7166575.3399999999 | J29: =IF(B29=0,0,((C29/B29)*100)-100) -> -8.8178786249999916 | K29: =IF(C29=0,0,IF(D29=0,0,((C29/D29)*100)-100)) -> -3.2577089225630687 | L29: =IF(F29=0,0,((C29/F29)*100)-100) -> 2.6535465134338523 | M29: =IF(G29=0,0,((C29/G29)*100)-100) -> 12.962789954201199 | N29: =IF(C29=0,0,IF(H29=0,0,((C29/H29)*100)-100)) -> 1.7859907128248977 | P29: 8000000 | Q29: =IF(C29=0,0,IF(P29=0,0,((C29/P29)*100)-100)) -> -8.8178786249999916 | R29: =IF(C29=0,0,(C29/$C$44)*100) -> 3.9412717132050514 | T29: 16.9 | U29: 17.596162502092263 | V29: 18.976308606693678 | W29: =U29-T29 -> 0.69616250209226394
A30: Araucária Nova | B30: 8900000 | C30: 8075729.8600000003 | D30: 8301939.0499999998 | F30: 5355180.78 | G30: 4409243.07 | H30: 3569374.18 | J30: =IF(B30=0,0,((C30/B30)*100)-100) -> -9.2614622471910053 | K30: =IF(C30=0,0,IF(D30=0,0,((C30/D30)*100)-100)) -> -2.7247753643770665 | L30: =IF(F30=0,0,((C30/F30)*100)-100) -> 50.802189352046469 | M30: =IF(G30=0,0,((C30/G30)*100)-100) -> 83.154562626550756 | N30: =IF(C30=0,0,IF(H30=0,0,((C30/H30)*100)-100)) -> 126.25058211184793 | P30: 8900000 | Q30: =IF(C30=0,0,IF(P30=0,0,((C30/P30)*100)-100)) -> -9.2614622471910053 | R30: =IF(C30=0,0,(C30/$C$44)*100) -> 4.3633342234114307 | T30: 15.7 | U30: 16.398861068391408 | V30: 17.575461653691324 | W30: =U30-T30 -> 0.69886106839140893
A31: Santa Candida | B31: 10000000 | C31: 9084818.6899999995 | D31: 9407850.8399999999 | F31: 9227453.8900000006 | G31: 7452795.0300000003 | H31: 6512664.2599999998 | J31: =IF(B31=0,0,((C31/B31)*100)-100) -> -9.1518131000000125 | K31: =IF(C31=0,0,IF(D31=0,0,((C31/D31)*100)-100)) -> -3.4336444687934744 | L31: =IF(F31=0,0,((C31/F31)*100)-100) -> -1.5457698483281206 | M31: =IF(G31=0,0,((C31/G31)*100)-100) -> 21.898142286626125 | N31: =IF(C31=0,0,IF(H31=0,0,((C31/H31)*100)-100)) -> 39.494657290993217 | P31: 10000000 | Q31: =IF(C31=0,0,IF(P31=0,0,((C31/P31)*100)-100)) -> -9.1518131000000125 | R31: =IF(C31=0,0,(C31/$C$44)*100) -> 4.9085470899548884 | T31: 16.95 | U31: 16.771387432058919 | V31: 18.302738420418603 | W31: =U31-T31 -> -0.17861256794108016
A32: Paranaguá Raia | B32: 9500000 | C32: 9266376.5700000003 | D32: 9033921.2100000009 | F32: 8466449.5899999999 | G32: 1555088.03 | H32: 6909272 | J32: =IF(B32=0,0,((C32/B32)*100)-100) -> -2.4591939999999965 | K32: =IF(C32=0,0,IF(D32=0,0,((C32/D32)*100)-100)) -> 2.5731391119803675 | L32: =IF(F32=0,0,((C32/F32)*100)-100) -> 9.4481986988361797 | M32: =IF(G32=0,0,((C32/G32)*100)-100) -> 495.8747280692528 | N32: =IF(C32=0,0,IF(H32=0,0,((C32/H32)*100)-100)) -> 34.115093022824993 | P32: 9500000 | Q32: =IF(C32=0,0,IF(P32=0,0,((C32/P32)*100)-100)) -> -2.4591939999999965 | R32: =IF(C32=0,0,(C32/$C$44)*100) -> 5.0066432032557895 | T32: 18.37 | U32: 18.422018111443965 | V32: 19.681122167043551 | W32: =U32-T32 -> 5.2018111443963733E-2
A33: Novo Mundo | B33: 8850000 | C33: 7488258.8099999996 | D33: 7839108.2000000002 | F33: 6495092.8499999996 | G33: 5488993.1900000004 | H33: 0 | J33: =IF(B33=0,0,((C33/B33)*100)-100) -> -15.386906101694919 | K33: =IF(C33=0,0,IF(D33=0,0,((C33/D33)*100)-100)) -> -4.4756288731924911 | L33: =IF(F33=0,0,((C33/F33)*100)-100) -> 15.291020204584143 | M33: =IF(G33=0,0,((C33/G33)*100)-100) -> 36.423175449412412 | N33: =IF(C33=0,0,IF(H33=0,0,((C33/H33)*100)-100)) -> 0 | P33: 8850000 | Q33: =IF(C33=0,0,IF(P33=0,0,((C33/P33)*100)-100)) -> -15.386906101694919 | R33: =IF(C33=0,0,(C33/$C$44)*100) -> 4.0459223507799642 | T33: 15.85 | U33: 16.43152568868009 | V33: 17.877353754283504 | W33: =U33-T33 -> 0.58152568868008991
A34: Água Verde | B34: 8850000 | C34: 7955832.6900000004 | D34: 8143044.7999999998 | F34: 6878287.2400000002 | G34: 0 | H34: 0 | J34: =IF(B34=0,0,((C34/B34)*100)-100) -> -10.103585423728816 | K34: =IF(C34=0,0,IF(D34=0,0,((C34/D34)*100)-100)) -> -2.299043104859237 | L34: =IF(F34=0,0,((C34/F34)*100)-100) -> 15.665897808594579 | M34: =IF(G34=0,0,((C34/G34)*100)-100) -> 0 | N34: =IF(C34=0,0,IF(H34=0,0,((C34/H34)*100)-100)) -> 0 | P34: 8850000 | Q34: =IF(C34=0,0,IF(P34=0,0,((C34/P34)*100)-100)) -> -10.103585423728816 | R34: =IF(C34=0,0,(C34/$C$44)*100) -> 4.2985535244256452 | T34: 16.01 | U34: 17.693060485916277 | V34: 18.90599970874953 | W34: =U34-T34 -> 1.6830604859162754
A35: Uvaranas | B35: 7800000 | C35: 6568318.5999999996 | D35: 6786993.7400000002 | F35: 6485147.46 | G35: 5317688.54 | H35: 4816166.89 | J35: =IF(B35=0,0,((C35/B35)*100)-100) -> -15.790787179487182 | K35: =IF(C35=0,0,IF(D35=0,0,((C35/D35)*100)-100)) -> -3.2219735036915012 | L35: =IF(F35=0,0,((C35/F35)*100)-100) -> 1.2824864895207782 | M35: =IF(G35=0,0,((C35/G35)*100)-100) -> 23.518302183226396 | N35: =IF(C35=0,0,IF(H35=0,0,((C35/H35)*100)-100)) -> 36.380626959544571 | P35: 7800000 | Q35: =IF(C35=0,0,IF(P35=0,0,((C35/P35)*100)-100)) -> -15.790787179487182 | R35: =IF(C35=0,0,(C35/$C$44)*100) -> 3.5488766754822891 | T35: 15.85 | U35: 16.213985874558524 | V35: 17.6712296142273 | W35: =U35-T35 -> 0.36398587455852471
A36: Torres | B36: 8700000 | C36: 7474651.5599999996 | D36: 7739015.0300000003 | F36: 7095670.75 | G36: 5658950.2699999996 | H36: 5054366.48 | J36: =IF(B36=0,0,((C36/B36)*100)-100) -> -14.084464827586203 | K36: =IF(C36=0,0,IF(D36=0,0,((C36/D36)*100)-100)) -> -3.4159834161738445 | L36: =IF(F36=0,0,((C36/F36)*100)-100) -> 5.3410145897764494 | M36: =IF(G36=0,0,((C36/G36)*100)-100) -> 32.085478814430388 | N36: =IF(C36=0,0,IF(H36=0,0,((C36/H36)*100)-100)) -> 47.885033457249392 | P36: 8700000 | Q36: =IF(C36=0,0,IF(P36=0,0,((C36/P36)*100)-100)) -> -14.084464827586203 | R36: =IF(C36=0,0,(C36/$C$44)*100) -> 4.0385703243203377 | T36: 16.1 | U36: 16.595755535124905 | V36: 18.055322572120001 | W36: =U36-T36 -> 0.49575553512490345
A37: Total Hiper | B37: =SUM(B23:B36) -> 123850000 | C37: =SUM(C23:C36) -> 111994373.41 | D37: =SUM(D23:D36) -> 114617727.83999999 | F37: =SUM(F23:F36) -> 102539000.58999999 | G37: =SUM(G23:G36) -> 75223518.079999998 | H37: =SUM(H23:H36) -> 70331324.600000009 | I37: =SUM(B37:H37) -> 598555944.51999998 | J37: =IF(C37=0,0,((C37/B37)*100)-100) -> -9.5725689059346024 | K37: =IF(C37=0,0,IF(D37=0,0,((C37/D37)*100)-100)) -> -2.2887859316684853 | L37: =IF(F37=0,0,IF(C37=0,0,((C37/F37)*100)-100)) -> 9.2212453462532835 | M37: =IF(G37=0,0,IF(C37=0,0,((C37/G37)*100)-100)) -> 48.882126585590271 | N37: =IF(C37=0,0,IF(H37=0,0,((C37/H37)*100)-100)) -> 59.238254144867881 | P37: =SUM(P23:P36) -> 123850000 | Q37: =IF(C37=0,0,((C37/P37)*100)-100) -> -9.5725689059346024 | R37: =IF(C37=0,0,(C37/$C$44)*100) -> 60.51080098033048 | T37: 16.360859911182882 | U37: 16.819695156505095 | V37: 18.234748948625779 | W37: =U37-T37 -> 0.45883524532221287
A38: Total 33,36,38,39,10 | B38: =B22+B37 -> 180590000 | C38: =C22+C37 -> 164223031.32999998 | D38: =D22+D37 -> 167401816.16 | E38: =E22+E37 -> 0 | F38: =F22+F37 -> 150124882.51999998 | G38: =G22+G37 -> 115576765.28999999 | H38: =H22+H37 -> 101488290.5 | I38: =SUM(B38:H38) -> 879404785.79999995 | J38: =IF(C38=0,0,((C38/B38)*100)-100) -> -9.0630536962179633 | K38: =IF(C38=0,0,IF(D38=0,0,((C38/D38)*100)-100)) -> -1.8988950675193195 | L38: =IF(F38=0,0,IF(C38=0,0,((C38/F38)*100)-100)) -> 9.3909474387910592 | M38: =IF(G38=0,0,IF(C38=0,0,((C38/G38)*100)-100)) -> 42.090004784213306 | N38: =IF(C38=0,0,IF(H38=0,0,((C38/H38)*100)-100)) -> 61.814757664087352 | P38: =P22+P37 -> 180590000 | Q38: =IF(C38=0,0,((C38/P38)*100)-100) -> -9.0630536962179633 | R38: =IF(C38=0,0,(C38/$C$44)*100) -> 88.730057257580981 | T38: 16.384921091976302 | U38: 16.852555671309325 | V38: 18.348415055772684 | W38: =U38-T38 -> 0.46763457933302277
A39: S.J.P - Rua Joinvile | B39: 6300000 | C39: 5875960.1399999997 | D39: 5939798.3300000001 | F39: 0 | G39: 0 | H39: 0 | J39: =IF(B39=0,0,((C39/B39)*100)-100) -> -6.7307914285714361 | K39: =IF(C39=0,0,IF(D39=0,0,((C39/D39)*100)-100)) -> -1.0747534925146169 | L39: =IF(F39=0,0,((C39/F39)*100)-100) -> 0 | M39: =IF(G39=0,0,((C39/G39)*100)-100) -> 0 | N39: =IF(C39=0,0,IF(H39=0,0,((C39/H39)*100)-100)) -> 0 | P39: 6300000 | Q39: =IF(P39=0,0,IF(C39=0,0,((C39/P39)*100)-100)) -> -6.7307914285714361 | R39: =IF(C39=0,0,(C39/$C$44)*100) -> 3.1747939094960533 | T39: 16.3 | U39: 16.263989156332162 | V39: 17.757355547684163 | W39: =U39-T39 -> -3.6010843667838799E-2
A40: Castro | B40: 4200000 | C40: 3791130.76 | D40: 3766155.87 | F40: 0 | G40: 0 | H40: 0 | J40: =IF(B40=0,0,((C40/B40)*100)-100) -> -9.7349819047619093 | K40: =IF(C40=0,0,IF(D40=0,0,((C40/D40)*100)-100)) -> 0.66314010524475009 | L40: =IF(F40=0,0,((C40/F40)*100)-100) -> 0 | M40: =IF(G40=0,0,((C40/G40)*100)-100) -> 0 | N40: =IF(C40=0,0,IF(H40=0,0,((C40/H40)*100)-100)) -> 0 | P40: 4200000 | Q40: =IF(P40=0,0,IF(C40=0,0,((C40/P40)*100)-100)) -> -9.7349819047619093 | R40: =IF(C40=0,0,(C40/$C$44)*100) -> 2.0483561086497 | T40: 16.71 | U40: 16.593049932152695 | V40: 18.135264643311857 | W40: =U40-T40 -> -0.11695006784730566
A41: Colombo | B41: 4800000 | C41: 4492252.26 | D41: 4623034.27 | F41: 0 | G41: 0 | H41: 0 | J41: =IF(B41=0,0,((C41/B41)*100)-100) -> -6.4114112500000147 | K41: =IF(C41=0,0,IF(D41=0,0,((C41/D41)*100)-100)) -> -2.8289214909929683 | L41: =IF(F41=0,0,((C41/F41)*100)-100) -> 0 | M41: =IF(G41=0,0,((C41/G41)*100)-100) -> 0 | N41: =IF(C41=0,0,IF(H41=0,0,((C41/H41)*100)-100)) -> 0 | P41: 4800000 | Q41: =IF(P41=0,0,IF(C41=0,0,((C41/P41)*100)-100)) -> -6.4114112500000147 | R41: =IF(C41=0,0,(C41/$C$44)*100) -> 2.4271735640071723 | T41: 16.3 | U41: 16.678555357886339 | V41: 18.427547154264218 | W41: =U41-T41 -> 0.37855535788633787
A42: Pinhais | B42: 6000000 | C42: 6284855.7599999998 | D42: 5041504.51 | F42: 0 | G42: 0 | H42: 0 | J42: =IF(B42=0,0,((C42/B42)*100)-100) -> 4.7475959999999873 | K42: =IF(C42=0,0,IF(D42=0,0,((C42/D42)*100)-100)) -> 24.662305617971185 | L42: =IF(F42=0,0,((C42/F42)*100)-100) -> 0 | M42: =IF(G42=0,0,((C42/G42)*100)-100) -> 0 | N42: =IF(C42=0,0,IF(H42=0,0,((C42/H42)*100)-100)) -> 0 | P42: 6000000 | Q42: =IF(P42=0,0,IF(C42=0,0,((C42/P42)*100)-100)) -> 4.7475959999999873 | R42: =IF(C42=0,0,(C42/$C$44)*100) -> 3.3957210929802515 | T42: 16 | U42: 16.241035577879355 | V42: 17.977869105463768 | W42: =U42-T42 -> 0.24103557787935515
A43: Campo Comprido | B43: 421236.59 | C43: 414394.18 | D43: 0 | F43: 0 | G43: 1457571.8 | H43: 1274013.25 | J43: =IF(B43=0,0,((C43/B43)*100)-100) -> -1.6243626889107787 | K43: =IF(C43=0,0,IF(D43=0,0,((C43/D43)*100)-100)) -> 0 | L43: =IF(F43=0,0,((C43/F43)*100)-100) -> 0 | M43: =IF(G43=0,0,((C43/G43)*100)-100) -> -71.56955286868201 | N43: =IF(C43=0,0,IF(H43=0,0,((C43/H43)*100)-100)) -> -67.473322589070406 | P43: 0 | Q43: =IF(P43=0,0,IF(C43=0,0,((C43/P43)*100)-100)) -> 0 | R43: =IF(C43=0,0,(C43/$C$44)*100) -> 0.22389806728583622 | T43: 0 | U43: 16.473818889058723 | V43: 18.098951341449826 | W43: =U43-T43 -> 16.473818889058723
A44: Total Geral | B44: =B22+B37+SUM(B39:B43) -> 202311236.59 | C44: =C22+C37+SUM(C39:C43) -> 185081624.42999998 | D44: =D22+D37+SUM(D39:D43) -> 186772309.13999999 | F44: =F22+F37+SUM(F39:F43) -> 150124882.51999998 | G44: =G22+G37+SUM(G39:G43) -> 117034337.08999999 | H44: =H22+H37+SUM(H39:H43) -> 102762303.75 | J44: =IF(C44=0,0,((C44/B44)*100)-100) -> -8.5163891291501557 | K44: =IF(C44=0,0,IF(D44=0,0,((C44/D44)*100)-100)) -> -0.90521165465310105 | L44: =IF(F44=0,0,IF(C44=0,0,((C44/F44)*100)-100)) -> 23.28510858640837 | M44: =IF(G44=0,0,IF(C44=0,0,((C44/G44)*100)-100)) -> 58.143010873527885 | N44: =IF(C44=0,0,IF(H44=0,0,((C44/H44)*100)-100)) -> 80.106534863471268 | P44: =P22+P37+SUM(P39:P43) -> 201890000 | Q44: =IF(C44=0,0,((C44/P44)*100)-100) -> -8.3255116994402982 | R44: =R22+R37+SUM(R39:R43) -> 100 | T44: 16.380700000000001 | U44: 16.80271750503352 | V44: 18.314063476960595 | W44: =U44-T44 -> 0.42201750503351931
A46: Água Verde | B46: 0 | C46: 0 | D46: 0 | F46: 0 | G46: 0 | H46: 0 | J46: =IF(B46=0,0,((C46/B46)*100)-100) -> 0 | K46: =IF(C46=0,0,IF(D46=0,0,((C46/D46)*100)-100)) -> 0 | L46: =IF(F46=0,0,((C46/F46)*100)-100) -> 0 | M46: =IF(G46=0,0,((C46/G46)*100)-100) -> 0 | N46: =IF(C46=0,0,IF(H46=0,0,((C46/H46)*100)-100)) -> 0 | P46: =B46 -> 0 | Q46: =IF(C46=0,0,IF(P46=0,0,((C46/P46)*100)-100)) -> 0 | R46: =IF(C46=0,0,(C46/$C$44)*100) -> 0 | T46: 14.95 | U46: 0 | W46: =U46-T46 -> -14.95
A47: Total Geral | B47: =B44+B46 -> 202311236.59 | C47: =C44+C46 -> 185081624.42999998 | D47: =D44+D46 -> 186772309.13999999 | F47: =F44+F46 -> 150124882.51999998 | G47: =G44+G46 -> 117034337.08999999 | H47: =H44+H46 -> 102762303.75 | J47: =IF(C47=0,0,((C47/B47)*100)-100) -> -8.5163891291501557 | K47: =IF(C47=0,0,IF(D47=0,0,((C47/D47)*100)-100)) -> -0.90521165465310105 | L47: =IF(F47=0,0,IF(C47=0,0,((C47/F47)*100)-100)) -> 23.28510858640837 | M47: =IF(G47=0,0,IF(C47=0,0,((C47/G47)*100)-100)) -> 58.143010873527885 | N47: =IF(C47=0,0,IF(H47=0,0,((C47/H47)*100)-100)) -> 80.106534863471268 | P47: =P44+P46 -> 201890000 | Q47: =IF(C47=0,0,((C47/P47)*100)-100) -> -8.3255116994402982 | R47: =R25+R40+R46 -> 5.5544443548409159 | T47: 16.341479374672634 | U47: 16.80271750503352 | W47: =U47-T47 -> 0.46123813036088634