A2: Periodo: | C2: 38473 | D2: a | E2: 38503 | H2: Vendas Acumuladas por Filial | Q2: =NOW() -> 38538.656471759299
A4: v.1 | C4: Vendas 2005 | G4: Vendas de Anos Anteriores | K4: Percentuais ( % ) | Q4: Meta Mensal | U4: Margem
A5: Lojas | C5: Previsao | D5: Realizada | E5: Mes Anterior | G5: Vendas 2004 | H5: Vendas 2003 | I5: Vendas 2002 | K5: % Prev | L5: % MA | M5: 2004 | N5: 2003 | O5: 2002 | Q5: Previsao Mes | R5: Final | S5: Part. | U5: Meta | V5: Real
A7: Xaxim | C7: 800000 | D7: 720477 | E7: 784915 | G7: 713750 | H7: 717557 | I7: 565081 | K7: =IF(C7=0,0,((D7/C7)*100)-100) -> -9.94 | L7: =IF(D7=0,0,IF(E7=0,0,((D7/E7)*100)-100)) -> -8.21 | M7: =IF(G7=0,0,((D7/G7)*100)-100) -> 00.94 | N7: =IF(H7=0,0,((D7/H7)*100)-100) -> 00.41 | O7: =IF(D7=0,0,IF(I7=0,0,((D7/I7)*100)-100)) -> 27.5 | Q7: 800000 | R7: =IF(D7=0,0,((D7/Q7)*100)-100) -> -9.94 | S7: =IF(D7=0,0,(D7/$D$35)*100) -> 1.3 | U7: 17.43 | V7: 16.94
A8: S. Felicidade | C8: 750000 | D8: 705284 | E8: 769116 | G8: 650037 | H8: 786952 | I8: 515654 | K8: =IF(C8=0,0,((D8/C8)*100)-100) -> -5.96 | L8: =IF(D8=0,0,IF(E8=0,0,((D8/E8)*100)-100)) -> -8.3 | M8: =IF(G8=0,0,((D8/G8)*100)-100) -> 8.5 | N8: =IF(H8=0,0,((D8/H8)*100)-100) -> -10.38 | O8: =IF(D8=0,0,IF(I8=0,0,((D8/I8)*100)-100)) -> 36.77 | Q8: 750000 | R8: =IF(D8=0,0,((D8/Q8)*100)-100) -> -5.96 | S8: =IF(D8=0,0,(D8/$D$35)*100) -> 1.27 | U8: 16.75 | V8: 17.09
A9: Lapa | C9: 1200000 | D9: 1125051 | E9: 1166636 | G9: 1074434 | H9: 1056313 | I9: 830517 | K9: =IF(C9=0,0,((D9/C9)*100)-100) -> -6.25 | L9: =IF(D9=0,0,IF(E9=0,0,((D9/E9)*100)-100)) -> -3.56 | M9: =IF(G9=0,0,((D9/G9)*100)-100) -> 4.71 | N9: =IF(H9=0,0,((D9/H9)*100)-100) -> 6.51 | O9: =IF(D9=0,0,IF(I9=0,0,((D9/I9)*100)-100)) -> 35.46 | Q9: 1200000 | R9: =IF(D9=0,0,((D9/Q9)*100)-100) -> -6.25 | S9: =IF(D9=0,0,(D9/$D$35)*100) -> 2.03 | U9: 16.9 | V9: 15.92
A10: Araucaria | C10: 1020000 | D10: 927768 | E10: 986346 | G10: 1024926 | H10: 1099845 | I10: 1479227 | K10: =IF(C10=0,0,((D10/C10)*100)-100) -> -9.04 | L10: =IF(D10=0,0,IF(E10=0,0,((D10/E10)*100)-100)) -> -5.94 | M10: =IF(G10=0,0,((D10/G10)*100)-100) -> -9.48 | N10: =IF(H10=0,0,((D10/H10)*100)-100) -> -15.65 | O10: =IF(D10=0,0,IF(I10=0,0,((D10/I10)*100)-100)) -> -37.28 | Q10: 1020000 | R10: =IF(D10=0,0,((D10/Q10)*100)-100) -> -9.04 | S10: =IF(D10=0,0,(D10/$D$35)*100) -> 1.67 | U10: 17.95 | V10: 17.57
A11: Pinheirinho | C11: 2140000 | D11: 1852216 | E11: 1990911 | G11: 1876577 | H11: 1964985 | I11: 1631159 | K11: =IF(C11=0,0,((D11/C11)*100)-100) -> -13.45 | L11: =IF(D11=0,0,IF(E11=0,0,((D11/E11)*100)-100)) -> -6.97 | M11: =IF(G11=0,0,((D11/G11)*100)-100) -> -1.3 | N11: =IF(H11=0,0,((D11/H11)*100)-100) -> -5.74 | O11: =IF(D11=0,0,IF(I11=0,0,((D11/I11)*100)-100)) -> 13.55 | Q11: 2140000 | R11: =IF(D11=0,0,((D11/Q11)*100)-100) -> -13.45 | S11: =IF(D11=0,0,(D11/$D$35)*100) -> 3.33 | U11: 17.38 | V11: 17.32
A12: Hauer | C12: 3180000 | D12: 2924646 | E12: 3196391 | G12: 2801803 | H12: 2926180 | I12: 2385161 | K12: =IF(C12=0,0,((D12/C12)*100)-100) -> -8.03 | L12: =IF(D12=0,0,IF(E12=0,0,((D12/E12)*100)-100)) -> -8.5 | M12: =IF(G12=0,0,((D12/G12)*100)-100) -> 4.38 | N12: =IF(H12=0,0,((D12/H12)*100)-100) -> -00.05 | O12: =IF(D12=0,0,IF(I12=0,0,((D12/I12)*100)-100)) -> 22.62 | Q12: 3180000 | R12: =IF(D12=0,0,((D12/Q12)*100)-100) -> -8.03 | S12: =IF(D12=0,0,(D12/$D$35)*100) -> 5.26 | U12: 16.8 | V12: 16.99
A13: Paranagua | C13: 1800000 | D13: 1666775 | E13: 1763034 | G13: 3104473 | H13: 3030035 | I13: 2563014 | K13: =IF(C13=0,0,((D13/C13)*100)-100) -> -7.4 | L13: =IF(D13=0,0,IF(E13=0,0,((D13/E13)*100)-100)) -> -5.46 | M13: =IF(G13=0,0,((D13/G13)*100)-100) -> -46.31 | N13: =IF(H13=0,0,((D13/H13)*100)-100) -> -44.99 | O13: =IF(D13=0,0,IF(I13=0,0,((D13/I13)*100)-100)) -> -34.97 | Q13: 1800000 | R13: =IF(D13=0,0,((D13/Q13)*100)-100) -> -7.4 | S13: =IF(D13=0,0,(D13/$D$35)*100) -> 3 | U13: 17.59 | V13: 17.14
A14: Centenario | C14: 1020000 | D14: 905257 | E14: 947018 | G14: 847250 | H14: 954235 | I14: 727275 | K14: =IF(C14=0,0,((D14/C14)*100)-100) -> -11.25 | L14: =IF(D14=0,0,IF(E14=0,0,((D14/E14)*100)-100)) -> -4.41 | M14: =IF(G14=0,0,((D14/G14)*100)-100) -> 6.85 | N14: =IF(H14=0,0,((D14/H14)*100)-100) -> -5.13 | O14: =IF(D14=0,0,IF(I14=0,0,((D14/I14)*100)-100)) -> 24.47 | Q14: 1020000 | R14: =IF(D14=0,0,((D14/Q14)*100)-100) -> -11.25 | S14: =IF(D14=0,0,(D14/$D$35)*100) -> 1.63 | U14: 17.1 | V14: 16.21
A15: Arapongas | C15: 0 | D15: 0 | E15: 0 | G15: 0 | H15: 0 | I15: 0 | K15: =IF(C15=0,0,((D15/C15)*100)-100) -> 0 | L15: =IF(D15=0,0,IF(E15=0,0,((D15/E15)*100)-100)) -> 0 | M15: =IF(D15=0,0,IF(G15=0,0,((D15/G15)*100)-100)) -> 0 | N15: =IF(D15=0,0,IF(H15=0,0,((D15/H15)*100)-100)) -> 0 | O15: =IF(D15=0,0,IF(I15=0,0,((D15/I15)*100)-100)) -> 0 | Q15: 0 | R15: =IF(D15=0,0,((D15/Q15)*100)-100) -> 0 | S15: =IF(D15=0,0,(D15/$D$35)*100) -> 0 | U15: 0 | V15: 0
A16: Sao Braz | C16: 3200000 | D16: 3069672 | E16: 3245220 | G16: 2919242 | H16: 3163213 | I16: 2408074 | K16: =IF(C16=0,0,((D16/C16)*100)-100) -> -4.07 | L16: =IF(D16=0,0,IF(E16=0,0,((D16/E16)*100)-100)) -> -5.41 | M16: =IF(G16=0,0,((D16/G16)*100)-100) -> 5.15 | N16: =IF(H16=0,0,((D16/H16)*100)-100) -> -2.96 | O16: =IF(D16=0,0,IF(I16=0,0,((D16/I16)*100)-100)) -> 27.47 | Q16: 3200000 | R16: =IF(D16=0,0,((D16/Q16)*100)-100) -> -4.07 | S16: =IF(D16=0,0,(D16/$D$35)*100) -> 5.53 | U16: 17.3 | V16: 16.59
A17: Sitio Cercado | C17: 1650000 | D17: 1421495 | E17: 1790948 | G17: 1374627 | H17: 1380337 | I17: 795625 | K17: =IF(C17=0,0,((D17/C17)*100)-100) -> -13.85 | L17: =IF(D17=0,0,IF(E17=0,0,((D17/E17)*100)-100)) -> -20.63 | M17: =IF(G17=0,0,((D17/G17)*100)-100) -> 3.41 | N17: =IF(H17=0,0,((D17/H17)*100)-100) -> 2.98 | O17: =IF(D17=0,0,IF(I17=0,0,((D17/I17)*100)-100)) -> 78.66 | Q17: 1650000 | R17: =IF(D17=0,0,((D17/Q17)*100)-100) -> -13.85 | S17: =IF(D17=0,0,(D17/$D$35)*100) -> 2.56 | U17: 17.35 | V17: 17.3
A18: Apucarana | C18: 1600000 | D18: 1498441 | E18: 1648560 | G18: 1320974 | H18: 1321561 | I18: 1124216 | K18: =IF(C18=0,0,((D18/C18)*100)-100) -> -6.35 | L18: =IF(D18=0,0,IF(E18=0,0,((D18/E18)*100)-100)) -> -9.11 | M18: =IF(G18=0,0,((D18/G18)*100)-100) -> 13.43 | N18: =IF(H18=0,0,((D18/H18)*100)-100) -> 13.38 | O18: =IF(D18=0,0,IF(I18=0,0,((D18/I18)*100)-100)) -> 33.29 | Q18: 1600000 | R18: =IF(D18=0,0,((D18/Q18)*100)-100) -> -6.35 | S18: =IF(D18=0,0,(D18/$D$35)*100) -> 2.7 | U18: 18 | V18: 18
A19: Ahu | C19: 1200000 | D19: 1031099 | E19: 1074517 | G19: 1034805 | H19: 1330141 | I19: 1031374 | K19: =IF(C19=0,0,((D19/C19)*100)-100) -> -14.08 | L19: =IF(D19=0,0,IF(E19=0,0,((D19/E19)*100)-100)) -> -4.04 | M19: =IF(G19=0,0,((D19/G19)*100)-100) -> -00.36 | N19: =IF(H19=0,0,((D19/H19)*100)-100) -> -22.48 | O19: =IF(D19=0,0,IF(I19=0,0,((D19/I19)*100)-100)) -> -00.03 | Q19: 1200000 | R19: =IF(D19=0,0,((D19/Q19)*100)-100) -> -14.08 | S19: =IF(D19=0,0,(D19/$D$35)*100) -> 1.86 | U19: 17.91 | V19: 16.27
A20: P.G. Centro | C20: 1800000 | D20: 1591444 | E20: 1613205 | G20: 1601128 | H20: 1645181 | I20: 1244340 | K20: =IF(C20=0,0,((D20/C20)*100)-100) -> -11.59 | L20: =IF(D20=0,0,IF(E20=0,0,((D20/E20)*100)-100)) -> -1.35 | M20: =IF(G20=0,0,((D20/G20)*100)-100) -> -00.6 | N20: =IF(H20=0,0,((D20/H20)*100)-100) -> -3.27 | O20: =IF(D20=0,0,IF(I20=0,0,((D20/I20)*100)-100)) -> 27.89 | Q20: 1800000 | R20: =IF(D20=0,0,((D20/Q20)*100)-100) -> -11.59 | S20: =IF(D20=0,0,(D20/$D$35)*100) -> 2.86 | U20: 18.85 | V20: 18.68
A21: Maringa | C21: 2270000 | D21: 2135621 | E21: 2280199 | G21: 1999804 | H21: 2035446 | I21: 1584197 | K21: =IF(C21=0,0,((D21/C21)*100)-100) -> -5.92 | L21: =IF(D21=0,0,IF(E21=0,0,((D21/E21)*100)-100)) -> -6.34 | M21: =IF(G21=0,0,((D21/G21)*100)-100) -> 6.79 | N21: =IF(H21=0,0,((D21/H21)*100)-100) -> 4.92 | O21: =IF(D21=0,0,IF(I21=0,0,((D21/I21)*100)-100)) -> 34.81 | Q21: 2270000 | R21: =IF(D21=0,0,((D21/Q21)*100)-100) -> -5.92 | S21: =IF(D21=0,0,(D21/$D$35)*100) -> 3.84 | U21: 18.95 | V21: 17.93
A22: Araucaria Nova | C22: 2290000 | D22: 1991626 | E22: 2105168 | G22: 2036417 | H22: 2025173 | I22: 0 | K22: =IF(C22=0,0,((D22/C22)*100)-100) -> -13.03 | L22: =IF(D22=0,0,IF(E22=0,0,((D22/E22)*100)-100)) -> -5.39 | M22: =IF(G22=0,0,((D22/G22)*100)-100) -> -2.2 | N22: =IF(H22=0,0,((D22/H22)*100)-100) -> -1.66 | O22: =IF(D22=0,0,IF(I22=0,0,((D22/I22)*100)-100)) -> 0 | Q22: 2290000 | R22: =IF(D22=0,0,((D22/Q22)*100)-100) -> -13.03 | S22: =IF(D22=0,0,(D22/$D$35)*100) -> 3.58 | U22: 18.35 | V22: 17.49
A23: Sitio Cercado | C23: 0 | D23: 0 | E23: 0 | G23: 0 | H23: 0 | I23: 0 | K23: =IF(C23=0,0,((D23/C23)*100)-100) -> 0 | L23: =IF(D23=0,0,IF(E23=0,0,((D23/E23)*100)-100)) -> 0 | M23: =IF(G23=0,0,((D23/G23)*100)-100) -> 0 | N23: =IF(H23=0,0,((D23/H23)*100)-100) -> 0 | O23: =IF(D23=0,0,IF(I23=0,0,((D23/I23)*100)-100)) -> 0 | Q23: 0 | R23: =IF(Q23=0,0,IF(D23=0,0,((D23/Q23)*100)-100)) -> 0 | S23: =IF(D23=0,0,(D23/$D$35)*100) -> 0 | U23: 0 | V23: 0
A24: Total Super | C24: =SUM(C7:C23) -> 25920000 | D24: =SUM(D7:D23) -> 23566872 | E24: =SUM(E7:E23) -> 25362184 | G24: =SUM(G7:G23) -> 24380247 | H24: =SUM(H7:H23) -> 25437154 | I24: =SUM(I7:I23) -> 18884914 | J24: =SUM(C24:I24) -> 143551371 | K24: =IF(D24=0,0,((D24/C24)*100)-100) -> -9.08 | L24: =IF(D24=0,0,IF(E24=0,0,((D24/E24)*100)-100)) -> -7.08 | M24: =IF(G24=0,0,IF(D24=0,0,((D24/G24)*100)-100)) -> -3.34 | N24: =IF(H24=0,0,IF(D24=0,0,((D24/H24)*100)-100)) -> -7.35 | O24: =IF(D24=0,0,IF(I24=0,0,((D24/I24)*100)-100)) -> 24.79 | Q24: =SUM(Q7:Q23) -> 25920000 | R24: =IF(D24=0,0,((D24/Q24)*100)-100) -> -9.08 | S24: =IF(D24=0,0,(D24/$D$35)*100) -> 42.42 | U24: 17.67 | V24: 17.21
A26: Londrina | C26: 2650000 | D26: 2537580 | E26: 2529405 | G26: 2260669 | H26: 2230622 | I26: 2111241 | K26: =IF(C26=0,0,((D26/C26)*100)-100) -> -4.24 | L26: =IF(D26=0,0,IF(E26=0,0,((D26/E26)*100)-100)) -> 00.32 | M26: =IF(G26=0,0,((D26/G26)*100)-100) -> 12.25 | N26: =IF(H26=0,0,((D26/H26)*100)-100) -> 13.76 | O26: =IF(D26=0,0,IF(I26=0,0,((D26/I26)*100)-100)) -> 20.19 | Q26: 2650000 | R26: =IF(D26=0,0,IF(Q26=0,0,((D26/Q26)*100)-100)) -> -4.24 | S26: =IF(D26=0,0,(D26/$D$35)*100) -> 4.57 | U26: 17.95 | V26: 14.36
A27: S.J. Pinhais | C27: 4380000 | D27: 3726317 | E27: 4601450 | G27: 4106455 | H27: 4095351 | I27: 3326194 | K27: =IF(C27=0,0,((D27/C27)*100)-100) -> -14.92 | L27: =IF(D27=0,0,IF(E27=0,0,((D27/E27)*100)-100)) -> -19.02 | M27: =IF(G27=0,0,((D27/G27)*100)-100) -> -9.26 | N27: =IF(H27=0,0,((D27/H27)*100)-100) -> -9.01 | O27: =IF(D27=0,0,IF(I27=0,0,((D27/I27)*100)-100)) -> 12.03 | Q27: 4380000 | R27: =IF(D27=0,0,IF(Q27=0,0,((D27/Q27)*100)-100)) -> -14.92 | S27: =IF(D27=0,0,(D27/$D$35)*100) -> 6.71 | U27: 16.8 | V27: 13.5
A28: P.G. Nova | C28: 3460000 | D28: 3302780 | E28: 3270489 | G28: 3147362 | H28: 3081480 | I28: 2720901 | K28: =IF(C28=0,0,((D28/C28)*100)-100) -> -4.54 | L28: =IF(D28=0,0,IF(E28=0,0,((D28/E28)*100)-100)) -> 00.99 | M28: =IF(G28=0,0,((D28/G28)*100)-100) -> 4.94 | N28: =IF(H28=0,0,((D28/H28)*100)-100) -> 7.18 | O28: =IF(D28=0,0,IF(I28=0,0,((D28/I28)*100)-100)) -> 21.39 | Q28: 3460000 | R28: =IF(D28=0,0,IF(Q28=0,0,((D28/Q28)*100)-100)) -> -4.54 | S28: =IF(D28=0,0,(D28/$D$35)*100) -> 5.95 | U28: 17.4 | V28: 16.09
A29: Nilo Pecanha | C29: 8600000 | D29: 8752387 | E29: 8723695 | G29: 8054371 | H29: 8453240 | I29: 6043686 | K29: =IF(C29=0,0,((D29/C29)*100)-100) -> 1.77 | L29: =IF(D29=0,0,IF(E29=0,0,((D29/E29)*100)-100)) -> 00.33 | M29: =IF(G29=0,0,((D29/G29)*100)-100) -> 8.67 | N29: =IF(H29=0,0,((D29/H29)*100)-100) -> 3.54 | O29: =IF(D29=0,0,IF(I29=0,0,((D29/I29)*100)-100)) -> 44.82 | Q29: 8600000 | R29: =IF(D29=0,0,IF(Q29=0,0,((D29/Q29)*100)-100)) -> 1.77 | S29: =IF(D29=0,0,(D29/$D$35)*100) -> 15.75 | U29: 16.55 | V29: 15.88
A30: Champagnat | C30: 5750000 | D30: 5615394 | E30: 5553138 | G30: 5072944 | H30: 0 | I30: 0 | K30: =IF(C30=0,0,((D30/C30)*100)-100) -> -2.34 | L30: =IF(D30=0,0,IF(E30=0,0,((D30/E30)*100)-100)) -> 1.12 | M30: =IF(G30=0,0,((D30/G30)*100)-100) -> 10.69 | N30: =IF(H30=0,0,((D30/H30)*100)-100) -> 0 | O30: =IF(D30=0,0,IF(I30=0,0,((D30/I30)*100)-100)) -> 0 | Q30: 5750000 | R30: =IF(D30=0,0,IF(Q30=0,0,((D30/Q30)*100)-100)) -> -2.34 | S30: =IF(D30=0,0,(D30/$D$35)*100) -> 10.11 | U30: 16.5 | V30: 16.43
A31: Santa Candida | C31: 5500000 | D31: 4453803 | E31: 4430277 | G31: 0 | H31: 0 | I31: 0 | K31: =IF(C31=0,0,((D31/C31)*100)-100) -> -19.02 | L31: =IF(D31=0,0,IF(E31=0,0,((D31/E31)*100)-100)) -> 00.53 | M31: =IF(G31=0,0,((D31/G31)*100)-100) -> 0 | N31: =IF(H31=0,0,((D31/H31)*100)-100) -> 0 | O31: =IF(D31=0,0,IF(I31=0,0,((D31/I31)*100)-100)) -> 0 | Q31: 5500000 | R31: =IF(D31=0,0,IF(Q31=0,0,((D31/Q31)*100)-100)) -> -19.02 | S31: =IF(D31=0,0,(D31/$D$35)*100) -> 8.02 | U31: 15.5 | V31: 14.81
A32: Paranagu Raia | C32: 4500000 | D32: 3599612 | E32: 3510124 | G32: 0 | H32: 0 | I32: 0 | K32: =IF(C32=0,0,((D32/C32)*100)-100) -> -20.01 | L32: =IF(D32=0,0,IF(E32=0,0,((D32/E32)*100)-100)) -> 2.55 | M32: =IF(G32=0,0,((D32/G32)*100)-100) -> 0 | N32: =IF(H32=0,0,((D32/H32)*100)-100) -> 0 | O32: =IF(D32=0,0,IF(I32=0,0,((D32/I32)*100)-100)) -> 0 | Q32: 4500000 | R32: =IF(D32=0,0,IF(Q32=0,0,((D32/Q32)*100)-100)) -> -20.01 | S32: =IF(D32=0,0,(D32/$D$35)*100) -> 6.48 | U32: 15.5 | V32: 14.19
A33: Total Hiper | C33: =SUM(C26:C32) -> 34840000 | D33: =SUM(D26:D32) -> 31987873 | E33: =SUM(E26:E32) -> 32618578 | G33: =SUM(G26:G32) -> 22641801 | H33: =SUM(H26:H32) -> 17860693 | I33: =SUM(I26:I32) -> 14202022 | J33: =SUM(C33:I33) -> 154150967 | K33: =IF(D33=0,0,((D33/C33)*100)-100) -> -8.19 | L33: =IF(D33=0,0,IF(E33=0,0,((D33/E33)*100)-100)) -> -1.93 | M33: =IF(G33=0,0,IF(D33=0,0,((D33/G33)*100)-100)) -> 41.28 | N33: =IF(H33=0,0,IF(D33=0,0,((D33/H33)*100)-100)) -> 79.1 | O33: =IF(D33=0,0,IF(I33=0,0,((D33/I33)*100)-100)) -> 125.23 | Q33: =SUM(Q26:Q32) -> 34840000 | R33: =IF(D33=0,0,((D33/Q33)*100)-100) -> -8.19 | S33: =IF(D33=0,0,(D33/$D$35)*100) -> 57.58 | U33: 16.46 | V33: 15.26
A35: Total Geral | C35: =C24+C33 -> 60760000 | D35: =D24+D33 -> 55554745 | E35: =E24+E33 -> 57980762 | G35: =G24+G33 -> 47022048 | H35: =H24+H33 -> 43297847 | I35: =I24+I33 -> 33086936 | K35: =IF(D33=0,0,((D35/C35)*100)-100) -> -8.57 | L35: =IF(D35=0,0,IF(E35=0,0,((D35/E35)*100)-100)) -> -4.18 | M35: =IF(G35=0,0,IF(D35=0,0,((D35/G35)*100)-100)) -> 18.15 | N35: =IF(H35=0,0,IF(D35=0,0,((D35/H35)*100)-100)) -> 28.31 | O35: =IF(D35=0,0,IF(I35=0,0,((D35/I35)*100)-100)) -> 67.91 | Q35: =Q24+Q33 -> 60760000 | R35: =IF(D35=0,0,((D35/Q35)*100)-100) -> -8.57 | S35: =S24+S33 -> 100 | U35: 16.98 | V35: 16.08
C36: Resumo por Regiao - Outubro/2002
C37: Descricao das Aberturas | H37: Valor | I37: %
C38: Curitiba (2,3,6,7,10,11,17,21,22) | H38: =D7+D8+D11+D12+D14+D16+D19+D29+D30+D32 -> 29176044 | I38: =IF(D35=0,0,H38/$D$35) -> 0.5252
C39: Curitiba e Metrop. (Ctba. 4,5,8,14,23) | H39: =H38+D9+D10+D13+D28+D23 -> 36198418 | I39: =IF(D35=0,0,H39/$D$35) -> 0.65159999999999996
C40: Metropolitana (4,5,8,14,23) | H40: =H39-H38 -> 7022374 | I40: =IF(D35=0,0,H40/$D$35) -> 0.12640000000000001
C41: Norte (9,15,20) | H41: =D26+D18+D23 -> 4036021 | I41: =IF(D35=0,0,H41/$D$35) -> 7.2599999999999998E-2
C42: Centro-Oeste (13,18,19) | H42: =D17+D20+D28 -> 6315719 | I42: =IF(D35=0,0,H42/$D$35) -> 0.1137
C43: Ponta Grossa (18,19) | H43: =H42-D17 -> 4894224 | I43: =IF(D35=0,0,H43/$D$35) -> 8.8099999999999998E-2
C44: Super (2,3,4,5,6,7,8,10,11,13,15,17,18,20,23) | H44: =D24 -> 23566872 | I44: =IF(D35=0,0,H44/$D$35) -> 0.42420000000000002
C45: Hiper (9,14,19,21,22,24) | H45: =D33 -> 31987873 | I45: =IF(D35=0,0,H45/$D$35) -> 0.57579999999999998
C46: Curitiba, Metropolitana e Centro-Oeste | H46: =D35-H41 -> 51518724 | I46: =IF(D35=0,0,H46/$D$35) -> 0.9274
C47: Araucaria | H47: =D10+D23 -> 927768 | I47: =IF(D35=0,0,H47/$D$35) -> 1.67E-2