A2: Periodo: | C2: 38838 | D2: a | E2: 38868 | H2: Vendas Acumuladas por Filial | Q2: =NOW() -> 39084.620241435201
A4: v.1 | C4: Vendas 2006 | G4: Vendas de Anos Anteriores | K4: Percentuais ( % ) | Q4: Meta Mensal | U4: Margem
A5: Lojas | C5: Previsao | D5: Realizada | E5: Mes Anterior | G5: Vendas 2005 | H5: Vendas 2004 | I5: Vendas 2003 | K5: % Prev | L5: % MA | M5: 2005 | N5: 2004 | O5: 2003 | Q5: Previsao Mes | R5: Final | S5: Part. | U5: Meta | V5: Condor
A7: Xaxim | C7: 740000 | D7: 644754 | E7: 754244 | G7: 720477 | H7: 713750 | I7: 717557 | K7: =IF(C7=0,0,((D7/C7)*100)-100) -> -12.87 | L7: =IF(D7=0,0,IF(E7=0,0,((D7/E7)*100)-100)) -> -14.52 | M7: =IF(G7=0,0,((D7/G7)*100)-100) -> -10.51 | N7: =IF(H7=0,0,((D7/H7)*100)-100) -> -9.67 | O7: =IF(D7=0,0,IF(I7=0,0,((D7/I7)*100)-100)) -> -10.15 | Q7: 740000 | R7: =IF(D7=0,0,((D7/Q7)*100)-100) -> -12.87 | S7: =IF(D7=0,0,(D7/$D$37)*100) -> 1.16 | U7: 16.4 | V7: 15.83
A8: S. Felicidade | C8: 750000 | D8: 816923 | E8: 820021 | G8: 705284 | H8: 650037 | I8: 786952 | K8: =IF(C8=0,0,((D8/C8)*100)-100) -> 8.92 | L8: =IF(D8=0,0,IF(E8=0,0,((D8/E8)*100)-100)) -> -0.38 | M8: =IF(G8=0,0,((D8/G8)*100)-100) -> 15.83 | N8: =IF(H8=0,0,((D8/H8)*100)-100) -> 25.67 | O8: =IF(D8=0,0,IF(I8=0,0,((D8/I8)*100)-100)) -> 3.81 | Q8: 750000 | R8: =IF(D8=0,0,((D8/Q8)*100)-100) -> 8.92 | S8: =IF(D8=0,0,(D8/$D$37)*100) -> 1.47 | U8: 16.5 | V8: 17.06
A9: Lapa | C9: 1250000 | D9: 982751 | E9: 1593658 | G9: 1125051 | H9: 1074434 | I9: 1056313 | K9: =IF(C9=0,0,((D9/C9)*100)-100) -> -21.38 | L9: =IF(D9=0,0,IF(E9=0,0,((D9/E9)*100)-100)) -> -38.33 | M9: =IF(G9=0,0,((D9/G9)*100)-100) -> -12.65 | N9: =IF(H9=0,0,((D9/H9)*100)-100) -> -8.53 | O9: =IF(D9=0,0,IF(I9=0,0,((D9/I9)*100)-100)) -> -6.96 | Q9: 1250000 | R9: =IF(D9=0,0,((D9/Q9)*100)-100) -> -21.38 | S9: =IF(D9=0,0,(D9/$D$37)*100) -> 1.77 | U9: 16.25 | V9: 14.69
A10: Araucaria | C10: 1055000 | D10: 897934 | E10: 1077809 | G10: 927768 | H10: 1024926 | I10: 1099845 | K10: =IF(C10=0,0,((D10/C10)*100)-100) -> -14.89 | L10: =IF(D10=0,0,IF(E10=0,0,((D10/E10)*100)-100)) -> -16.69 | M10: =IF(G10=0,0,((D10/G10)*100)-100) -> -3.22 | N10: =IF(H10=0,0,((D10/H10)*100)-100) -> -12.39 | O10: =IF(D10=0,0,IF(I10=0,0,((D10/I10)*100)-100)) -> -18.36 | Q10: 1055000 | R10: =IF(D10=0,0,((D10/Q10)*100)-100) -> -14.89 | S10: =IF(D10=0,0,(D10/$D$37)*100) -> 1.62 | U10: 17.55 | V10: 17.23
A11: Pinheirinho | C11: 0 | D11: 0 | E11: 0 | G11: 0 | H11: 0 | I11: 0 | K11: =IF(C11=0,0,((D11/C11)*100)-100) -> 0 | L11: =IF(D11=0,0,IF(E11=0,0,((D11/E11)*100)-100)) -> 0 | M11: =IF(G11=0,0,((D11/G11)*100)-100) -> 0 | N11: =IF(H11=0,0,((D11/H11)*100)-100) -> 0 | O11: =IF(D11=0,0,IF(I11=0,0,((D11/I11)*100)-100)) -> 0 | Q11: 0 | R11: =IF(D11=0,0,((D11/Q11)*100)-100) -> 0 | S11: =IF(D11=0,0,(D11/$D$37)*100) -> 0 | U11: 0 | V11: 0
A12: Hauer | C12: 3135000 | D12: 2847537 | E12: 3398737 | G12: 2924646 | H12: 2801803 | I12: 2926180 | K12: =IF(C12=0,0,((D12/C12)*100)-100) -> -9.17 | L12: =IF(D12=0,0,IF(E12=0,0,((D12/E12)*100)-100)) -> -16.22 | M12: =IF(G12=0,0,((D12/G12)*100)-100) -> -2.64 | N12: =IF(H12=0,0,((D12/H12)*100)-100) -> 1.63 | O12: =IF(D12=0,0,IF(I12=0,0,((D12/I12)*100)-100)) -> -2.69 | Q12: 3135000 | R12: =IF(D12=0,0,((D12/Q12)*100)-100) -> -9.17 | S12: =IF(D12=0,0,(D12/$D$37)*100) -> 5.14 | U12: 16.96 | V12: 16.99
A13: Paranagua | C13: 1600000 | D13: 1443145 | E13: 1724412 | G13: 1666775 | H13: 3104473 | I13: 3030035 | K13: =IF(C13=0,0,((D13/C13)*100)-100) -> -9.8 | L13: =IF(D13=0,0,IF(E13=0,0,((D13/E13)*100)-100)) -> -16.31 | M13: =IF(G13=0,0,((D13/G13)*100)-100) -> -13.42 | N13: =IF(H13=0,0,((D13/H13)*100)-100) -> -53.51 | O13: =IF(D13=0,0,IF(I13=0,0,((D13/I13)*100)-100)) -> -52.37 | Q13: 1600000 | R13: =IF(D13=0,0,((D13/Q13)*100)-100) -> -9.8 | S13: =IF(D13=0,0,(D13/$D$37)*100) -> 2.6 | U13: 17.4 | V13: 17.93
A14: Centenario | C14: 940000 | D14: 859987 | E14: 975696 | G14: 905257 | H14: 847250 | I14: 954235 | K14: =IF(C14=0,0,((D14/C14)*100)-100) -> -8.51 | L14: =IF(D14=0,0,IF(E14=0,0,((D14/E14)*100)-100)) -> -11.86 | M14: =IF(G14=0,0,((D14/G14)*100)-100) -> -5 | N14: =IF(H14=0,0,((D14/H14)*100)-100) -> 1.5 | O14: =IF(D14=0,0,IF(I14=0,0,((D14/I14)*100)-100)) -> -9.88 | Q14: 940000 | R14: =IF(D14=0,0,((D14/Q14)*100)-100) -> -8.51 | S14: =IF(D14=0,0,(D14/$D$37)*100) -> 1.55 | U14: 16.6 | V14: 15.86
A15: Sao Braz | C15: 3335000 | D15: 2889687 | E15: 3382264 | G15: 3069672 | H15: 2919242 | I15: 3163213 | K15: =IF(C15=0,0,((D15/C15)*100)-100) -> -13.35 | L15: =IF(D15=0,0,IF(E15=0,0,((D15/E15)*100)-100)) -> -14.56 | M15: =IF(G15=0,0,((D15/G15)*100)-100) -> -5.86 | N15: =IF(H15=0,0,((D15/H15)*100)-100) -> -1.01 | O15: =IF(D15=0,0,IF(I15=0,0,((D15/I15)*100)-100)) -> -8.65 | Q15: 3335000 | R15: =IF(D15=0,0,((D15/Q15)*100)-100) -> -13.35 | S15: =IF(D15=0,0,(D15/$D$37)*100) -> 5.21 | U15: 16.89 | V15: 15.55
A16: Sitio Cercado | C16: 1450000 | D16: 1142164 | E16: 1500576 | G16: 1421495 | H16: 1374627 | I16: 1380337 | K16: =IF(C16=0,0,((D16/C16)*100)-100) -> -21.23 | L16: =IF(D16=0,0,IF(E16=0,0,((D16/E16)*100)-100)) -> -23.88 | M16: =IF(G16=0,0,((D16/G16)*100)-100) -> -19.65 | N16: =IF(H16=0,0,((D16/H16)*100)-100) -> -16.91 | O16: =IF(D16=0,0,IF(I16=0,0,((D16/I16)*100)-100)) -> -17.25 | Q16: 1450000 | R16: =IF(D16=0,0,((D16/Q16)*100)-100) -> -21.23 | S16: =IF(D16=0,0,(D16/$D$37)*100) -> 2.06 | U16: 16.9 | V16: 16.14
A17: Apucarana | C17: 1900000 | D17: 1662468 | E17: 2193534 | G17: 1498441 | H17: 1320974 | I17: 1321561 | K17: =IF(C17=0,0,((D17/C17)*100)-100) -> -12.5 | L17: =IF(D17=0,0,IF(E17=0,0,((D17/E17)*100)-100)) -> -24.21 | M17: =IF(G17=0,0,((D17/G17)*100)-100) -> 10.95 | N17: =IF(H17=0,0,((D17/H17)*100)-100) -> 25.85 | O17: =IF(D17=0,0,IF(I17=0,0,((D17/I17)*100)-100)) -> 25.8 | Q17: 1900000 | R17: =IF(D17=0,0,((D17/Q17)*100)-100) -> -12.5 | S17: =IF(D17=0,0,(D17/$D$37)*100) -> 3 | U17: 15.7 | V17: 15.22
A18: Ahu | C18: 1190000 | D18: 1120831 | E18: 1234746 | G18: 1031099 | H18: 1034805 | I18: 1330141 | K18: =IF(C18=0,0,((D18/C18)*100)-100) -> -5.81 | L18: =IF(D18=0,0,IF(E18=0,0,((D18/E18)*100)-100)) -> -9.23 | M18: =IF(G18=0,0,((D18/G18)*100)-100) -> 8.7 | N18: =IF(H18=0,0,((D18/H18)*100)-100) -> 8.31 | O18: =IF(D18=0,0,IF(I18=0,0,((D18/I18)*100)-100)) -> -15.74 | Q18: 1190000 | R18: =IF(D18=0,0,((D18/Q18)*100)-100) -> -5.81 | S18: =IF(D18=0,0,(D18/$D$37)*100) -> 2.02 | U18: 17.15 | V18: 17.54
A19: P.G. Centro | C19: 1750000 | D19: 1537966 | E19: 1795660 | G19: 1591444 | H19: 1601128 | I19: 1645181 | K19: =IF(C19=0,0,((D19/C19)*100)-100) -> -12.12 | L19: =IF(D19=0,0,IF(E19=0,0,((D19/E19)*100)-100)) -> -14.35 | M19: =IF(G19=0,0,((D19/G19)*100)-100) -> -3.36 | N19: =IF(H19=0,0,((D19/H19)*100)-100) -> -3.94 | O19: =IF(D19=0,0,IF(I19=0,0,((D19/I19)*100)-100)) -> -6.52 | Q19: 1750000 | R19: =IF(D19=0,0,((D19/Q19)*100)-100) -> -12.12 | S19: =IF(D19=0,0,(D19/$D$37)*100) -> 2.78 | U19: 17.98 | V19: 17.83
A20: Maringa | C20: 2400000 | D20: 2315533 | E20: 2604418 | G20: 2135621 | H20: 1999804 | I20: 2035446 | K20: =IF(C20=0,0,((D20/C20)*100)-100) -> -3.52 | L20: =IF(D20=0,0,IF(E20=0,0,((D20/E20)*100)-100)) -> -11.09 | M20: =IF(G20=0,0,((D20/G20)*100)-100) -> 8.42 | N20: =IF(H20=0,0,((D20/H20)*100)-100) -> 15.79 | O20: =IF(D20=0,0,IF(I20=0,0,((D20/I20)*100)-100)) -> 13.76 | Q20: 2400000 | R20: =IF(D20=0,0,((D20/Q20)*100)-100) -> -3.52 | S20: =IF(D20=0,0,(D20/$D$37)*100) -> 4.18 | U20: 18.3 | V20: 16.56
A21: Araucaria Nova | C21: 2100000 | D21: 1904421 | E21: 2346038 | G21: 1991626 | H21: 2036417 | I21: 2025173 | K21: =IF(C21=0,0,((D21/C21)*100)-100) -> -9.31 | L21: =IF(D21=0,0,IF(E21=0,0,((D21/E21)*100)-100)) -> -18.82 | M21: =IF(G21=0,0,((D21/G21)*100)-100) -> -4.38 | N21: =IF(H21=0,0,((D21/H21)*100)-100) -> -6.48 | O21: =IF(D21=0,0,IF(I21=0,0,((D21/I21)*100)-100)) -> -5.96 | Q21: 2100000 | R21: =IF(D21=0,0,((D21/Q21)*100)-100) -> -9.31 | S21: =IF(D21=0,0,(D21/$D$37)*100) -> 3.44 | U21: 17.4 | V21: 17.36
A22: Total Super | C22: =SUM(C7:C21) -> 23595000 | D22: =SUM(D7:D21) -> 21066101 | E22: =SUM(E7:E21) -> 25401813 | G22: =SUM(G7:G21) -> 21714656 | H22: =SUM(H7:H21) -> 22503670 | I22: =SUM(I7:I21) -> 23472169 | J22: =SUM(C22:I22) -> 137753409 | K22: =IF(D22=0,0,((D22/C22)*100)-100) -> -10.72 | L22: =IF(D22=0,0,IF(E22=0,0,((D22/E22)*100)-100)) -> -17.07 | M22: =IF(G22=0,0,IF(D22=0,0,((D22/G22)*100)-100)) -> -2.99 | N22: =IF(H22=0,0,IF(D22=0,0,((D22/H22)*100)-100)) -> -6.39 | O22: =IF(D22=0,0,IF(I22=0,0,((D22/I22)*100)-100)) -> -10.25 | Q22: =SUM(Q7:Q21) -> 23595000 | R22: =IF(D22=0,0,((D22/Q22)*100)-100) -> -10.72 | S22: =IF(D22=0,0,(D22/$D$37)*100) -> 38.02 | U22: 16.97 | V22: 16.39
A24: Pinheirinho | C24: 2200000 | D24: 2161332 | E24: 2196079 | G24: 1852216 | H24: 1876577 | I24: 1964985 | K24: =IF(C24=0,0,((D24/C24)*100)-100) -> -1.76 | L24: =IF(D24=0,0,IF(E24=0,0,((D24/E24)*100)-100)) -> -1.58 | M24: =IF(G24=0,0,((D24/G24)*100)-100) -> 16.69 | N24: =IF(H24=0,0,((D24/H24)*100)-100) -> 15.17 | O24: =IF(D24=0,0,IF(I24=0,0,((D24/I24)*100)-100)) -> 9.99 | Q24: 2200000 | R24: =IF(D24=0,0,IF(Q24=0,0,((D24/Q24)*100)-100)) -> -1.76 | S24: =IF(D24=0,0,(D24/$D$37)*100) -> 3.9 | U24: 16 | V24: 14.64
A25: Londrina | C25: 2800000 | D25: 2794054 | E25: 3238956 | G25: 2537580 | H25: 2260669 | I25: 2230622 | K25: =IF(C25=0,0,((D25/C25)*100)-100) -> -0.21 | L25: =IF(D25=0,0,IF(E25=0,0,((D25/E25)*100)-100)) -> -13.74 | M25: =IF(G25=0,0,((D25/G25)*100)-100) -> 10.11 | N25: =IF(H25=0,0,((D25/H25)*100)-100) -> 23.59 | O25: =IF(D25=0,0,IF(I25=0,0,((D25/I25)*100)-100)) -> 25.26 | Q25: 2800000 | R25: =IF(D25=0,0,IF(Q25=0,0,((D25/Q25)*100)-100)) -> -0.21 | S25: =IF(D25=0,0,(D25/$D$37)*100) -> 5.04 | U25: 15.8 | V25: 14.12
A26: S.J. Pinhais | C26: 4100000 | D26: 3863756 | E26: 4376302 | G26: 3726317 | H26: 4106455 | I26: 4095351 | K26: =IF(C26=0,0,((D26/C26)*100)-100) -> -5.76 | L26: =IF(D26=0,0,IF(E26=0,0,((D26/E26)*100)-100)) -> -11.71 | M26: =IF(G26=0,0,((D26/G26)*100)-100) -> 3.69 | N26: =IF(H26=0,0,((D26/H26)*100)-100) -> -5.91 | O26: =IF(D26=0,0,IF(I26=0,0,((D26/I26)*100)-100)) -> -5.66 | Q26: 4100000 | R26: =IF(D26=0,0,IF(Q26=0,0,((D26/Q26)*100)-100)) -> -5.76 | S26: =IF(D26=0,0,(D26/$D$37)*100) -> 6.97 | U26: 16.2 | V26: 15.29
A27: P.G. Nova | C27: 3680000 | D27: 3380907 | E27: 3840889 | G27: 3302780 | H27: 3147362 | I27: 3081480 | K27: =IF(C27=0,0,((D27/C27)*100)-100) -> -8.13 | L27: =IF(D27=0,0,IF(E27=0,0,((D27/E27)*100)-100)) -> -11.98 | M27: =IF(G27=0,0,((D27/G27)*100)-100) -> 2.37 | N27: =IF(H27=0,0,((D27/H27)*100)-100) -> 7.42 | O27: =IF(D27=0,0,IF(I27=0,0,((D27/I27)*100)-100)) -> 9.72 | Q27: 3680000 | R27: =IF(D27=0,0,IF(Q27=0,0,((D27/Q27)*100)-100)) -> -8.13 | S27: =IF(D27=0,0,(D27/$D$37)*100) -> 6.1 | U27: 16.4 | V27: 15.76
A28: Nilo Pecanha | C28: 8900000 | D28: 8689542 | E28: 9643478 | G28: 8752387 | H28: 8054371 | I28: 8453240 | K28: =IF(C28=0,0,((D28/C28)*100)-100) -> -2.36 | L28: =IF(D28=0,0,IF(E28=0,0,((D28/E28)*100)-100)) -> -9.89 | M28: =IF(G28=0,0,((D28/G28)*100)-100) -> -0.72 | N28: =IF(H28=0,0,((D28/H28)*100)-100) -> 7.89 | O28: =IF(D28=0,0,IF(I28=0,0,((D28/I28)*100)-100)) -> 2.8 | Q28: 8900000 | R28: =IF(D28=0,0,IF(Q28=0,0,((D28/Q28)*100)-100)) -> -2.36 | S28: =IF(D28=0,0,(D28/$D$37)*100) -> 15.68 | U28: 16.3 | V28: 15.54
A29: Champagnat | C29: 5900000 | D29: 5375900 | E29: 5779597 | G29: 5615394 | H29: 5072944 | I29: 0 | K29: =IF(C29=0,0,((D29/C29)*100)-100) -> -8.88 | L29: =IF(D29=0,0,IF(E29=0,0,((D29/E29)*100)-100)) -> -6.98 | M29: =IF(G29=0,0,((D29/G29)*100)-100) -> -4.26 | N29: =IF(H29=0,0,((D29/H29)*100)-100) -> 5.97 | O29: =IF(D29=0,0,IF(I29=0,0,((D29/I29)*100)-100)) -> 0 | Q29: 5900000 | R29: =IF(D29=0,0,IF(Q29=0,0,((D29/Q29)*100)-100)) -> -8.88 | S29: =IF(D29=0,0,(D29/$D$37)*100) -> 9.7 | U29: 16.4 | V29: 16.59
A30: Santa Candida | C30: 5000000 | D30: 3905400 | E30: 4695594 | G30: 4453803 | H30: 0 | I30: 0 | K30: =IF(C30=0,0,((D30/C30)*100)-100) -> -21.89 | L30: =IF(D30=0,0,IF(E30=0,0,((D30/E30)*100)-100)) -> -16.83 | M30: =IF(G30=0,0,((D30/G30)*100)-100) -> -12.31 | N30: =IF(H30=0,0,((D30/H30)*100)-100) -> 0 | O30: =IF(D30=0,0,IF(I30=0,0,((D30/I30)*100)-100)) -> 0 | Q30: 5000000 | R30: =IF(D30=0,0,IF(Q30=0,0,((D30/Q30)*100)-100)) -> -21.89 | S30: =IF(D30=0,0,(D30/$D$37)*100) -> 7.05 | U30: 16.18 | V30: 15.37
A31: Paranagu Raia | C31: 5000000 | D31: 4175921 | E31: 4787564 | G31: 3599612 | H31: 0 | I31: 0 | K31: =IF(C31=0,0,((D31/C31)*100)-100) -> -16.48 | L31: =IF(D31=0,0,IF(E31=0,0,((D31/E31)*100)-100)) -> -12.78 | M31: =IF(G31=0,0,((D31/G31)*100)-100) -> 16.01 | N31: =IF(H31=0,0,((D31/H31)*100)-100) -> 0 | O31: =IF(D31=0,0,IF(I31=0,0,((D31/I31)*100)-100)) -> 0 | Q31: 5000000 | R31: =IF(D31=0,0,IF(Q31=0,0,((D31/Q31)*100)-100)) -> -16.48 | S31: =IF(D31=0,0,(D31/$D$37)*100) -> 7.54 | U31: 16.3 | V31: 16.55
A32: Total Hiper | C32: =SUM(C24:C31) -> 37580000 | D32: =SUM(D24:D31) -> 34346812 | E32: =SUM(E24:E31) -> 38558459 | G32: =SUM(G24:G31) -> 33840089 | H32: =SUM(H24:H31) -> 24518378 | I32: =SUM(I24:I31) -> 19825678 | J32: =SUM(C32:I32) -> 188669416 | K32: =IF(D32=0,0,((D32/C32)*100)-100) -> -8.6 | L32: =IF(D32=0,0,IF(E32=0,0,((D32/E32)*100)-100)) -> -10.92 | M32: =IF(G32=0,0,IF(D32=0,0,((D32/G32)*100)-100)) -> 1.5 | N32: =IF(H32=0,0,IF(D32=0,0,((D32/H32)*100)-100)) -> 40.09 | O32: =IF(D32=0,0,IF(I32=0,0,((D32/I32)*100)-100)) -> 73.24 | Q32: =SUM(Q24:Q31) -> 37580000 | R32: =IF(D32=0,0,((D32/Q32)*100)-100) -> -8.6 | S32: =IF(D32=0,0,(D32/$D$37)*100) -> 61.98 | U32: 16.27 | V32: 15.68
A34: Cristo Rei | C34: 0 | D34: 0 | E34: 0 | G34: 0 | H34: 0 | I34: 0 | K34: =IF(C34=0,0,((D34/C34)*100)-100) -> 0 | L34: =IF(D34=0,0,IF(E34=0,0,((D34/E34)*100)-100)) -> 0 | M34: =IF(G34=0,0,((D34/G34)*100)-100) -> 0 | N34: =IF(H34=0,0,((D34/H34)*100)-100) -> 0 | O34: =IF(D34=0,0,IF(I34=0,0,((D34/I34)*100)-100)) -> 0 | Q34: 0 | R34: =IF(Q34=0,0,IF(D34=0,0,((D34/Q34)*100)-100)) -> 0 | S34: =IF(D34=0,0,(D34/$D$37)*100) -> 0 | U34: 0 | V34: 0
A35: Total Lojas Novas | C35: =SUM(C34) -> 0 | D35: =SUM(D34) -> 0 | E35: =SUM(E34) -> 0 | G35: =SUM(G34) -> 0 | H35: =SUM(H34) -> 0 | I35: =SUM(I34) -> 0 | K35: =IF(D35=0,0,((D35/C35)*100)-100) -> 0 | L35: =IF(D35=0,0,IF(E35=0,0,((D35/E35)*100)-100)) -> 0 | M35: =IF(G35=0,0,IF(D35=0,0,((D35/G35)*100)-100)) -> 0 | N35: =IF(H35=0,0,IF(D35=0,0,((D35/H35)*100)-100)) -> 0 | O35: =IF(D35=0,0,IF(I35=0,0,((D35/I35)*100)-100)) -> 0 | Q35: =SUM(Q34) -> 0 | R35: =IF(D35=0,0,((D35/Q35)*100)-100) -> 0 | S35: =IF(D35=0,0,(D35/$D$37)*100) -> 0 | U35: =U34 -> 0 | V35: =V34 -> 0
A37: Total Geral | C37: =C22+C32+C35 -> 61175000 | D37: =D22+D32+D35 -> 55412913 | E37: =E22+E32+E35 -> 63960272 | G37: =G22+G32+G35 -> 55554745 | H37: =H22+H32+H35 -> 47022048 | I37: =I22+I32+I35 -> 43297847 | K37: =IF(D37=0,0,((D37/C37)*100)-100) -> -9.42 | L37: =IF(D37=0,0,IF(E37=0,0,((D37/E37)*100)-100)) -> -13.36 | M37: =IF(G37=0,0,IF(D37=0,0,((D37/G37)*100)-100)) -> -0.26 | N37: =IF(H37=0,0,IF(D37=0,0,((D37/H37)*100)-100)) -> 17.84 | O37: =IF(D37=0,0,IF(I37=0,0,((D37/I37)*100)-100)) -> 27.98 | Q37: =Q22+Q32+Q35 -> 61175000 | R37: =IF(D37=0,0,((D37/Q37)*100)-100) -> -9.42 | S37: =S22+S32+S35 -> 100 | U37: 16.54 | V37: 15.98
C38: Resumo por Regiao - Outubro/2002
C39: Descricao das Aberturas | H39: Valor | I39: %
C40: Curitiba (2,3,6,7,10,11,13,17,21,22) | H40: =D7+D8+D11+D12+D14+D15+D16+D18+D28+D29+D30+D24+D34 -> 30454057 | I40: =IF(D37=0,0,H40/$D$37) -> 0.54959999999999998
C41: Curitiba e Metrop. (Ctba. 4,5,8,13,14,23) | H41: =H40+D9+D10+D13+D26+D21+D31 -> 43721985 | I41: =IF(D37=0,0,H41/$D$37) -> 0.78900000000000003
C42: Metropolitana (4,5,8,14,23) | H42: =H41-H40 -> 13267928 | I42: =IF(D37=0,0,H42/$D$37) -> 0.2394
C43: Norte (9,15,20) | H43: =D25+D17+D20 -> 6772055 | I43: =IF(D37=0,0,H43/$D$37) -> 0.1222
C44: Ponta Grossa (18,19) | H44: =D19+D27 -> 4918873 | I44: =IF(D37=0,0,H44/$D$37) -> 8.8800000000000004E-2
C45: Super (2,3,4,5,6,7,8,10,11,13,15,17,18,20,23) | H45: =D22 -> 21066101 | I45: =IF(D37=0,0,H45/$D$37) -> 0.38019999999999998
C46: Hiper (6,9,14,19,21,22,24) | H46: =D32 -> 34346812 | I46: =IF(D37=0,0,H46/$D$37) -> 0.61980000000000002
C47: Curitiba, Metropolitana e Ponta Grossa | H47: =D37-H43 -> 48640858 | I47: =IF(D37=0,0,H47/$D$37) -> 0.87780000000000002
C48: Araucaria | H48: =D10+D21 -> 2802355 | I48: =IF(D37=0,0,H48/$D$37) -> 5.0599999999999999E-2