A2: Perodo: | C2: 37653 | E2: 37680 | H2: Vendas Acumuladas por Filial
C4: Vendas 2003 | G4: Vendas de Anos Anteriores | K4: Percentuais ( % ) | R4: %
A5: Lojas | C5: Previso | D5: Realizada | E5: Ms Anterior | G5: Vendas 2002 | H5: Vendas 2001 | I5: Vendas 2000 | K5: % Prev | L5: % MA | M5: 2002 | N5: 2001 | O5: 2000 | Q5: Previso Ms | R5: Final | S5: Part.
A7: Xaxim | C7: 550000 | D7: 618469.45 | E7: 648112.45 | G7: 496543.93 | H7: 470368.83 | I7: 421958.71 | K7: =IF(C7=0,0,((D7/C7)*100)-100) -> 12.45 | L7: =IF(E7=0,0,((D7/E7)*100)-100) -> -4.57 | M7: =IF(G7=0,0,((D7/G7)*100)-100) -> 24.55 | N7: =IF(H7=0,0,((D7/H7)*100)-100) -> 31.49 | O7: =IF(I7=0,0,((D7/I7)*100)-100) -> 46.57 | Q7: 550000 | R7: =((D7/Q7)*100)-100 -> 12.45 | S7: =D7/$D$31*100 -> 1.59
A8: S. Felicidade | C8: 590000 | D8: 686678.61 | E8: 701361.08 | G8: 506825.9 | H8: 532052.69 | I8: 474557.48 | K8: =IF(C8=0,0,((D8/C8)*100)-100) -> 16.39 | L8: =IF(E8=0,0,((D8/E8)*100)-100) -> -2.09 | M8: =IF(G8=0,0,((D8/G8)*100)-100) -> 35.49 | N8: =IF(H8=0,0,((D8/H8)*100)-100) -> 29.06 | O8: =IF(I8=0,0,((D8/I8)*100)-100) -> 44.7 | Q8: 590000 | R8: =((D8/Q8)*100)-100 -> 16.39 | S8: =D8/$D$31*100 -> 1.77
A9: Lapa | C9: 830000 | D9: 913056.33 | E9: 961645.85 | G9: 753218.69 | H9: 598054.07 | I9: 537685.73 | K9: =IF(C9=0,0,((D9/C9)*100)-100) -> 10.01 | L9: =IF(E9=0,0,((D9/E9)*100)-100) -> -5.05 | M9: =IF(G9=0,0,((D9/G9)*100)-100) -> 21.22 | N9: =IF(H9=0,0,((D9/H9)*100)-100) -> 52.67 | O9: =IF(I9=0,0,((D9/I9)*100)-100) -> 69.81 | Q9: 830000 | R9: =((D9/Q9)*100)-100 -> 10.01 | S9: =D9/$D$31*100 -> 2.35
A10: Araucria | C10: 940000 | D10: 993989.84 | E10: 1032374.48 | G10: 1395945.61 | H10: 1275575.45 | I10: 1169070.21 | K10: =IF(C10=0,0,((D10/C10)*100)-100) -> 5.74 | L10: =IF(E10=0,0,((D10/E10)*100)-100) -> -3.72 | M10: =IF(G10=0,0,((D10/G10)*100)-100) -> -28.79 | N10: =IF(H10=0,0,((D10/H10)*100)-100) -> -22.08 | O10: =IF(I10=0,0,((D10/I10)*100)-100) -> -14.98 | Q10: 940000 | R10: =((D10/Q10)*100)-100 -> 5.74 | S10: =D10/$D$31*100 -> 2.56
A11: Pinheirinho | C11: 1640000 | D11: 1717330.43 | E11: 1857893 | G11: 1530670.64 | H11: 1460190.14 | I11: 1230939.16 | K11: =IF(C11=0,0,((D11/C11)*100)-100) -> 4.72 | L11: =IF(E11=0,0,((D11/E11)*100)-100) -> -7.57 | M11: =IF(G11=0,0,((D11/G11)*100)-100) -> 12.19 | N11: =IF(H11=0,0,((D11/H11)*100)-100) -> 17.61 | O11: =IF(I11=0,0,((D11/I11)*100)-100) -> 39.51 | Q11: 1640000 | R11: =((D11/Q11)*100)-100 -> 4.72 | S11: =D11/$D$31*100 -> 4.42
A12: Hauer | C12: 2290000 | D12: 2685568.53 | E12: 2685121.28 | G12: 2044686.18 | H12: 1971707.06 | I12: 1694447.61 | K12: =IF(C12=0,0,((D12/C12)*100)-100) -> 17.27 | L12: =IF(E12=0,0,((D12/E12)*100)-100) -> 00.02 | M12: =IF(G12=0,0,((D12/G12)*100)-100) -> 31.34 | N12: =IF(H12=0,0,((D12/H12)*100)-100) -> 36.21 | O12: =IF(I12=0,0,((D12/I12)*100)-100) -> 58.49 | Q12: 2290000 | R12: =((D12/Q12)*100)-100 -> 17.27 | S12: =D12/$D$31*100 -> 6.92
A13: Paranagu | C13: 2560000 | D13: 2761429.56 | E13: 2825976.18 | G13: 2209341.17 | H13: 1963138.01 | I13: 1282532.91 | K13: =IF(C13=0,0,((D13/C13)*100)-100) -> 7.87 | L13: =IF(E13=0,0,((D13/E13)*100)-100) -> -2.28 | M13: =IF(G13=0,0,((D13/G13)*100)-100) -> 24.99 | N13: =IF(H13=0,0,((D13/H13)*100)-100) -> 40.66 | O13: =IF(I13=0,0,((D13/I13)*100)-100) -> 115.31 | Q13: 2560000 | R13: =((D13/Q13)*100)-100 -> 7.87 | S13: =D13/$D$31*100 -> 7.11
A14: Centenrio | C14: 710000 | D14: 830168.17 | E14: 866268.99 | G14: 641317.92 | H14: 604781.48 | I14: 532754.45 | K14: =IF(C14=0,0,((D14/C14)*100)-100) -> 16.93 | L14: =IF(E14=0,0,((D14/E14)*100)-100) -> -4.17 | M14: =IF(G14=0,0,((D14/G14)*100)-100) -> 29.45 | N14: =IF(H14=0,0,((D14/H14)*100)-100) -> 37.27 | O14: =IF(I14=0,0,((D14/I14)*100)-100) -> 55.83 | Q14: 710000 | R14: =((D14/Q14)*100)-100 -> 16.93 | S14: =D14/$D$31*100 -> 2.14
A15: So Brz | C15: 2480000 | D15: 2761728.07 | E15: 2781333.7 | G15: 2297239.1 | H15: 2245328.89 | I15: 1697158.03 | K15: =IF(C15=0,0,((D15/C15)*100)-100) -> 11.36 | L15: =IF(E15=0,0,((D15/E15)*100)-100) -> -00.7 | M15: =IF(G15=0,0,((D15/G15)*100)-100) -> 20.22 | N15: =IF(H15=0,0,((D15/H15)*100)-100) -> 23 | O15: =IF(I15=0,0,((D15/I15)*100)-100) -> 62.73 | Q15: 2480000 | R15: =((D15/Q15)*100)-100 -> 11.36 | S15: =D15/$D$31*100 -> 7.12
A16: Arapongas | C16: 500000 | D16: 555475.45 | E16: 559275.97 | G16: 416175.54 | H16: 510051.63 | I16: 466645.13 | K16: =IF(C16=0,0,((D16/C16)*100)-100) -> 11.1 | L16: =IF(E16=0,0,((D16/E16)*100)-100) -> -00.68 | M16: =IF(G16=0,0,((D16/G16)*100)-100) -> 33.47 | N16: =IF(H16=0,0,((D16/H16)*100)-100) -> 8.91 | O16: =IF(I16=0,0,((D16/I16)*100)-100) -> 19.04 | Q16: 500000 | R16: =((D16/Q16)*100)-100 -> 11.1 | S16: =D16/$D$31*100 -> 1.43
A17: Guarapuava | C17: 960000 | D17: 1115250.68 | E17: 1099203.27 | G17: 692635.49 | H17: 790559.6 | I17: 761355.68 | K17: =IF(C17=0,0,((D17/C17)*100)-100) -> 16.17 | L17: =IF(E17=0,0,((D17/E17)*100)-100) -> 1.46 | M17: =IF(G17=0,0,((D17/G17)*100)-100) -> 61.02 | N17: =IF(H17=0,0,((D17/H17)*100)-100) -> 41.07 | O17: =IF(I17=0,0,((D17/I17)*100)-100) -> 46.48 | Q17: 960000 | R17: =((D17/Q17)*100)-100 -> 16.17 | S17: =D17/$D$31*100 -> 2.87
A18: Apucarana | C18: 1230000 | D18: 1250362.16 | E18: 1225401.95 | G18: 1064971.92 | H18: 1082617.99 | I18: 1091224.03 | K18: =IF(C18=0,0,((D18/C18)*100)-100) -> 1.66 | L18: =IF(E18=0,0,((D18/E18)*100)-100) -> 2.04 | M18: =IF(G18=0,0,((D18/G18)*100)-100) -> 17.41 | N18: =IF(H18=0,0,((D18/H18)*100)-100) -> 15.49 | O18: =IF(I18=0,0,((D18/I18)*100)-100) -> 14.58 | Q18: 1230000 | R18: =((D18/Q18)*100)-100 -> 1.66 | S18: =D18/$D$31*100 -> 3.22
A19: Ah | C19: 990000 | D19: 1111721.66 | E19: 1062414.06 | G19: 1147277.7 | H19: 1028789.89 | I19: 821111.59 | K19: =IF(C19=0,0,((D19/C19)*100)-100) -> 12.3 | L19: =IF(E19=0,0,((D19/E19)*100)-100) -> 4.64 | M19: =IF(G19=0,0,((D19/G19)*100)-100) -> -3.1 | N19: =IF(H19=0,0,((D19/H19)*100)-100) -> 8.06 | O19: =IF(I19=0,0,((D19/I19)*100)-100) -> 35.39 | Q19: 990000 | R19: =((D19/Q19)*100)-100 -> 12.3 | S19: =D19/$D$31*100 -> 2.86
A20: P.G. Centro | C20: 1360000 | D20: 1474374.74 | E20: 1479222.83 | G20: 1088386.68 | H20: 1120870.19 | I20: 1133057.84 | K20: =IF(C20=0,0,((D20/C20)*100)-100) -> 8.41 | L20: =IF(E20=0,0,((D20/E20)*100)-100) -> -00.33 | M20: =IF(G20=0,0,((D20/G20)*100)-100) -> 35.46 | N20: =IF(H20=0,0,((D20/H20)*100)-100) -> 31.54 | O20: =IF(I20=0,0,((D20/I20)*100)-100) -> 30.12 | Q20: 1360000 | R20: =((D20/Q20)*100)-100 -> 8.41 | S20: =D20/$D$31*100 -> 3.8
A21: Maring | C21: 1750000 | D21: 1888400.63 | E21: 1859959.59 | G21: 1558548.89 | H21: 1457787.51 | I21: 1427848.45 | K21: =IF(C21=0,0,((D21/C21)*100)-100) -> 7.91 | L21: =IF(E21=0,0,((D21/E21)*100)-100) -> 1.53 | M21: =IF(G21=0,0,((D21/G21)*100)-100) -> 21.16 | N21: =IF(H21=0,0,((D21/H21)*100)-100) -> 29.54 | O21: =IF(I21=0,0,((D21/I21)*100)-100) -> 32.25 | Q21: 1750000 | R21: =((D21/Q21)*100)-100 -> 7.91 | S21: =D21/$D$31*100 -> 4.87
A22: Araucria Nova | C22: 1720000 | D22: 1737414.79 | E22: 1701529.98 | G22: 0 | H22: 0 | I22: 0 | K22: =IF(C22=0,0,((D22/C22)*100)-100) -> 1.01 | L22: =IF(E22=0,0,((D22/E22)*100)-100) -> 2.11 | M22: =IF(G22=0,0,((D22/G22)*100)-100) -> 0 | N22: =IF(H22=0,0,((D22/H22)*100)-100) -> 0 | O22: =IF(I22=0,0,((D22/I22)*100)-100) -> 0 | Q22: 1720000 | R22: =((D22/Q22)*100)-100 -> 1.01 | S22: =D22/$D$31*100 -> 4.48
A23: Total Super | C23: =SUM(C7:C22) -> 21100000 | D23: =SUM(D7:D22) -> 23101419.100000001 | E23: =SUM(E7:E22) -> 23347094.66 | G23: =SUM(G7:G22) -> 17843785.359999999 | H23: =SUM(H7:H22) -> 17111873.43 | I23: =SUM(I7:I22) -> 14742347.01 | J23: =SUM(C23:I23) -> 117246519.56 | K23: =((D23/C23)*100)-100 -> 9.49 | L23: =IF(E23=0,0,((D23/E23)*100)-100) -> -1.05 | M23: =((D23/G23)*100)-100 -> 29.46 | N23: =((D23/H23)*100)-100 -> 35 | O23: =IF(I23=0,0,((D23/I23)*100)-100) -> 56.7 | Q23: =SUM(Q7:Q22) -> 21100000 | R23: =((D23/Q23)*100)-100 -> 9.49 | S23: =D23/$D$31*100 -> 59.52
A25: Londrina | C25: 2040000 | D25: 2022076.13 | E25: 2140316.17 | G25: 1492342.42 | H25: 1982743.68 | I25: 0 | K25: =IF(C25=0,0,((D25/C25)*100)-100) -> -00.88 | L25: =IF(E25=0,0,((D25/E25)*100)-100) -> -5.52 | M25: =IF(G25=0,0,((D25/G25)*100)-100) -> 35.5 | N25: =IF(H25=0,0,((D25/H25)*100)-100) -> 1.98 | O25: =IF(I25=0,0,((D25/I25)*100)-100) -> 0 | Q25: 2040000 | R25: =((D25/Q25)*100)-100 -> -00.88 | S25: =D25/$D$31*100 -> 5.21
A26: S.J. Pinhais | C26: 3350000 | D26: 3663832.12 | E26: 3644722.91 | G26: 2795400.73 | H26: 2258322.13 | I26: 1293994.16 | K26: =IF(C26=0,0,((D26/C26)*100)-100) -> 9.37 | L26: =IF(E26=0,0,((D26/E26)*100)-100) -> 00.52 | M26: =IF(G26=0,0,((D26/G26)*100)-100) -> 31.07 | N26: =IF(H26=0,0,((D26/H26)*100)-100) -> 62.24 | O26: =IF(I26=0,0,((D26/I26)*100)-100) -> 183.14 | Q26: 3350000 | R26: =((D26/Q26)*100)-100 -> 9.37 | S26: =D26/$D$31*100 -> 9.44
A27: P.G. Nova | C27: 2650000 | D27: 2901488.38 | E27: 3004210.35 | G27: 2161033.18 | H27: 2139191.67 | I27: 1646111.41 | K27: =IF(C27=0,0,((D27/C27)*100)-100) -> 9.49 | L27: =IF(E27=0,0,((D27/E27)*100)-100) -> -3.42 | M27: =IF(G27=0,0,((D27/G27)*100)-100) -> 34.26 | N27: =IF(H27=0,0,((D27/H27)*100)-100) -> 35.63 | O27: =IF(I27=0,0,((D27/I27)*100)-100) -> 76.26 | Q27: 2650000 | R27: =((D27/Q27)*100)-100 -> 9.49 | S27: =D27/$D$31*100 -> 7.48
A28: Nilo Peanha | C28: 6150000 | D28: 7125975.3600000003 | E28: 6702998.1900000004 | G28: 0 | H28: 0 | I28: 0 | K28: =IF(C28=0,0,((D28/C28)*100)-100) -> 15.87 | L28: =IF(E28=0,0,((D28/E28)*100)-100) -> 6.31 | M28: =IF(G28=0,0,((D28/G28)*100)-100) -> 0 | N28: =IF(H28=0,0,((D28/H28)*100)-100) -> 0 | O28: =IF(I28=0,0,((D28/I28)*100)-100) -> 0 | Q28: 6150000 | R28: =((D28/Q28)*100)-100 -> 15.87 | S28: =D28/$D$31*100 -> 18.36
A29: Total Hiper | C29: =SUM(C25:C28) -> 14190000 | D29: =SUM(D25:D28) -> 15713371.99 | E29: =SUM(E25:E28) -> 15492247.619999999 | G29: =SUM(G25:G28) -> 6448776.3300000001 | H29: =SUM(H25:H28) -> 6380257.4800000004 | I29: =SUM(I25:I28) -> 2940105.57 | J29: =SUM(C29:I29) -> 61164758.990000002 | K29: =((D29/C29)*100)-100 -> 10.74 | L29: =IF(E29=0,0,((D29/E29)*100)-100) -> 1.43 | M29: =((D29/G29)*100)-100 -> 143.66 | N29: =((D29/H29)*100)-100 -> 146.28 | O29: =IF(I29=0,0,((D29/I29)*100)-100) -> 434.45 | Q29: =SUM(Q25:Q28) -> 14190000 | R29: =((D29/Q29)*100)-100 -> 10.74 | S29: =D29/$D$31*100 -> 40.48
A31: Total Geral | C31: =C23+C29 -> 35290000 | D31: =D23+D29 -> 38814791.090000004 | E31: =E23+E29 -> 38839342.280000001 | G31: =G23+G29 -> 24292561.690000001 | H31: =H23+H29 -> 23492130.91 | I31: =I23+I29 -> 17682452.579999998 | K31: =((D31/C31)*100)-100 -> 9.99 | L31: =IF(E31=0,0,((D31/E31)*100)-100) -> -00.06 | M31: =((D31/G31)*100)-100 -> 59.78 | N31: =((D31/H31)*100)-100 -> 65.22 | O31: =IF(I31=0,0,((D31/I31)*100)-100) -> 119.51 | Q31: =Q23+Q29 -> 35290000 | R31: =((D31/Q31)*100)-100 -> 9.99 | S31: =S23+S29 -> 100
C32: Resumo por Regio - Outubro/2002
C33: Descrio das Aberturas | H33: Valor | I33: %
C34: Curitiba (2,3,6,7,10,11,17,21) | H34: =D7+D8+D11+D12+D14+D15+D19+D28 -> 17537640 | I34: =H34/$D$31 -> 0.45179999999999998
C35: Curitiba e Metrop. (Ctba. 4,5,8,14,23) | H35: =H34+D9+D10+D13+D27+D22 -> 26845019 | I35: =H35/$D$31 -> 0.69159999999999999
C36: Metropolitana (4,5,8,14,23) | H36: =H35-H34 -> 9307379 | I36: =H36/$D$31 -> 0.23980000000000001
C37: Norte (9,12,15,20) | H37: =D25+D16+D18+D22 -> 5565329 | I37: =H37/$D$31 -> 0.1434
C38: Centro-Oeste (13,18,19) | H38: =D17+D20+D27 -> 5491114 | I38: =H38/$D$31 -> 0.14149999999999999
C39: Ponta Grossa (18,19) | H39: =H38-D17 -> 4375863 | I39: =H39/$D$31 -> 0.11269999999999999
C40: Super (2,3,4,5,6,7,8,10,11,12,13,15,17,18,20,23) | H40: =D23 -> 23101419 | I40: =H40/$D$31 -> 0.59519999999999995
C41: Hiper (9,14,19,21) | H41: =D29 -> 15713372 | I41: =H41/$D$31 -> 0.40479999999999999
C42: Curitiba, Metropolitana e Centro-Oeste | H42: =D31-H37 -> 33249462 | I42: =H42/$D$31 -> 0.85660000000000003
C43: Araucria | H43: =D10+D22 -> 2731405 | I43: =H43/$D$31 -> 7.0400000000000004E-2