A2: Periodo: | B2: 40575 | C2: a | D2: 40602 | G2: Vendas Acumuladas por Filial | P2: =NOW() -> 40637.340837268515
A4: v.New | B4: Vendas 2010 | F4: Vendas de Anos Anteriores | J4: Percentuais ( % ) | P4: Meta Mensal | T4: Margem
A5: Lojas | B5: Previsao | C5: Realizada | D5: Mes Anterior | F5: Vendas 2009 | G5: Vendas 2008 | H5: Vendas 2007 | J5: % Prev | K5: % MA | L5: 2009 | M5: 2008 | N5: 2007 | P5: Previsao Mes | Q5: Final | R5: Part. | T5: Meta | U5: Coml | V5: Dif
A6: S. Felicidade | B6: 3189929 | C6: 3071982.1 | D6: 3194619.22 | F6: 2884982.06 | G6: 2414551.96 | H6: 2067243.01 | J6: =IF(B6=0,0,((C6/B6)*100)-100) -> -3.6974772792748638 | K6: =IF(C6=0,0,IF(D6=0,0,((C6/D6)*100)-100)) -> -3.8388650275509235 | L6: =IF(F6=0,0,((C6/F6)*100)-100) -> 6.4818441193357046 | M6: =IF(G6=0,0,((C6/G6)*100)-100) -> 27.227831535255092 | N6: =IF(C6=0,0,IF(H6=0,0,((C6/H6)*100)-100)) -> 48.602853420701621 | P6: 3189929 | Q6: =IF(C6=0,0,((C6/P6)*100)-100) -> -3.6974772792748638 | R6: =IF(C6=0,0,(C6/$C$41)*100) -> 2.4022114041888547 | T6: 17.11 | U6: 17.410239467215643 | V6: =U6-T6 -> 0.30023946721564343
A7: Lapa | B7: 2540773 | C7: 2280257.61 | D7: 2327341.94 | F7: 2348908.66 | G7: 2010631.83 | H7: 1540583.54 | J7: =IF(B7=0,0,((C7/B7)*100)-100) -> -10.253390995574975 | K7: =IF(C7=0,0,IF(D7=0,0,((C7/D7)*100)-100)) -> -2.02309463816907 | L7: =IF(F7=0,0,((C7/F7)*100)-100) -> -2.9226785685229686 | M7: =IF(G7=0,0,((C7/G7)*100)-100) -> 13.410002566208234 | N7: =IF(C7=0,0,IF(H7=0,0,((C7/H7)*100)-100)) -> 48.012590735585803 | P7: 2540773 | Q7: =IF(C7=0,0,((C7/P7)*100)-100) -> -10.253390995574975 | R7: =IF(C7=0,0,(C7/$C$41)*100) -> 1.7831031096276313 | T7: 16.5 | U7: 15.857762228891323 | V7: =U7-T7 -> -0.64223777110867708
A8: Araucaria | B8: 1406787 | C8: 1415296.14 | D8: 1531967 | F8: 1286196.97 | G8: 1207814.63 | H8: 975970.66 | J8: =IF(B8=0,0,((C8/B8)*100)-100) -> 0.60486342282092664 | K8: =IF(C8=0,0,IF(D8=0,0,((C8/D8)*100)-100)) -> -7.6157554307632012 | L8: =IF(F8=0,0,((C8/F8)*100)-100) -> 10.037278349365096 | M8: =IF(G8=0,0,((C8/G8)*100)-100) -> 17.178257726518837 | N8: =IF(C8=0,0,IF(H8=0,0,((C8/H8)*100)-100)) -> 45.014209750936544 | P8: 1406787 | Q8: =IF(C8=0,0,((C8/P8)*100)-100) -> 0.60486342282092664 | R8: =IF(C8=0,0,(C8/$C$41)*100) -> 1.1067253705067048 | T8: 17.27 | U8: 17.81543684560604 | V8: =U8-T8 -> 0.54543684560604078
A9: Hauer | B9: 3562700 | C9: 3685694.09 | D9: 4044783.01 | F9: 3395139.6 | G9: 3310820.01 | H9: 3074982.61 | J9: =IF(B9=0,0,((C9/B9)*100)-100) -> 3.4522718724562651 | K9: =IF(C9=0,0,IF(D9=0,0,((C9/D9)*100)-100)) -> -8.8778290235154032 | L9: =IF(F9=0,0,((C9/F9)*100)-100) -> 8.5579541412671176 | M9: =IF(G9=0,0,((C9/G9)*100)-100) -> 11.322695853828677 | N9: =IF(C9=0,0,IF(H9=0,0,((C9/H9)*100)-100)) -> 19.860648252576624 | P9: 3562700 | Q9: =IF(C9=0,0,((C9/P9)*100)-100) -> 3.4522718724562651 | R9: =IF(C9=0,0,(C9/$C$41)*100) -> 2.8821184782780671 | T9: 16.32 | U9: 16.732045713538859 | V9: =U9-T9 -> 0.4120457135388591
A10: Paranagua | B10: 2250000 | C10: 2127985.23 | D10: 2119665.35 | F10: 2046448.94 | G10: 1756602.91 | H10: 1643772.28 | J10: =IF(B10=0,0,((C10/B10)*100)-100) -> -5.4228786666666622 | K10: =IF(C10=0,0,IF(D10=0,0,((C10/D10)*100)-100)) -> 0.3925091288584639 | L10: =IF(F10=0,0,((C10/F10)*100)-100) -> 3.9842816698861867 | M10: =IF(G10=0,0,((C10/G10)*100)-100) -> 21.142075871888437 | N10: =IF(C10=0,0,IF(H10=0,0,((C10/H10)*100)-100)) -> 29.457422776347073 | P10: 2250000 | Q10: =IF(C10=0,0,((C10/P10)*100)-100) -> -5.4228786666666622 | R10: =IF(C10=0,0,(C10/$C$41)*100) -> 1.6640300044233467 | T10: 16.9 | U10: 16.844345766441247 | V10: =U10-T10 -> -5.5654233558751542E-2
A11: Centenario | B11: 0 | C11: 0 | D11: 0 | F11: 0 | G11: 0 | H11: 0 | J11: =IF(B11=0,0,((C11/B11)*100)-100) -> 0 | K11: =IF(C11=0,0,IF(D11=0,0,((C11/D11)*100)-100)) -> 0 | L11: =IF(F11=0,0,((C11/F11)*100)-100) -> 0 | M11: =IF(G11=0,0,((C11/G11)*100)-100) -> 0 | N11: =IF(C11=0,0,IF(H11=0,0,((C11/H11)*100)-100)) -> 0 | P11: 0 | Q11: =IF(C11=0,0,((C11/P11)*100)-100) -> 0 | R11: =IF(C11=0,0,(C11/$C$41)*100) -> 0 | T11: 0 | U11: 0 | V11: =U11-T11 -> 0
A12: Sitio Cercado | B12: 2514708 | C12: 2824644.12 | D12: 2991945.25 | F12: 2310759.96 | G12: 2020224.79 | H12: 1618245.61 | J12: =IF(B12=0,0,((C12/B12)*100)-100) -> 12.324934743914611 | K12: =IF(C12=0,0,IF(D12=0,0,((C12/D12)*100)-100)) -> -5.5917176291912369 | L12: =IF(F12=0,0,((C12/F12)*100)-100) -> 22.238751272113973 | M12: =IF(G12=0,0,((C12/G12)*100)-100) -> 39.818308040859165 | N12: =IF(C12=0,0,IF(H12=0,0,((C12/H12)*100)-100)) -> 74.54977801546454 | P12: 2514708 | Q12: =IF(C12=0,0,((C12/P12)*100)-100) -> 12.324934743914611 | R12: =IF(C12=0,0,(C12/$C$41)*100) -> 2.208799432079696 | T12: 15.48 | U12: 15.313437078225625 | V12: =U12-T12 -> -0.16656292177437493
A13: Apucarana | B13: 2699999 | C13: 2542866.67 | D13: 2717803.88 | F13: 2591801.3 | G13: 2379883.31 | H13: 2184601.57 | J13: =IF(B13=0,0,((C13/B13)*100)-100) -> -5.8197180813770615 | K13: =IF(C13=0,0,IF(D13=0,0,((C13/D13)*100)-100)) -> -6.4367120559118547 | L13: =IF(F13=0,0,((C13/F13)*100)-100) -> -1.8880548443277547 | M13: =IF(G13=0,0,((C13/G13)*100)-100) -> 6.8483761079865673 | N13: =IF(C13=0,0,IF(H13=0,0,((C13/H13)*100)-100)) -> 16.399562506951781 | P13: 2700000 | Q13: =IF(C13=0,0,((C13/P13)*100)-100) -> -5.8197529629629656 | R13: =IF(C13=0,0,(C13/$C$41)*100) -> 1.9884566755795017 | T13: 16.67 | U13: 16.533357999458147 | V13: =U13-T13 -> -0.13664200054185471
A14: Ahú | B14: 1761137 | C14: 2019505.84 | D14: 2030398.75 | F14: 1665083.31 | G14: 1485146.53 | H14: 1423846.28 | J14: =IF(B14=0,0,((C14/B14)*100)-100) -> 14.670570205497938 | K14: =IF(C14=0,0,IF(D14=0,0,((C14/D14)*100)-100)) -> -0.5364911695301231 | L14: =IF(F14=0,0,((C14/F14)*100)-100) -> 21.285573392721119 | M14: =IF(G14=0,0,((C14/G14)*100)-100) -> 35.980241626393592 | N14: =IF(C14=0,0,IF(H14=0,0,((C14/H14)*100)-100)) -> 41.83454129612926 | P14: 1761137 | Q14: =IF(C14=0,0,((C14/P14)*100)-100) -> 14.670570205497938 | R14: =IF(C14=0,0,(C14/$C$41)*100) -> 1.5792018969361807 | T14: 16.59 | U14: 16.816428220876052 | V14: =U14-T14 -> 0.22642822087605197
A15: P.G. Centro | B15: 1890000 | C15: 2006352.32 | D15: 1968341.51 | F15: 1784432.19 | G15: 1893901.14 | H15: 1731168.27 | J15: =IF(B15=0,0,((C15/B15)*100)-100) -> 6.1562074074074076 | K15: =IF(C15=0,0,IF(D15=0,0,((C15/D15)*100)-100)) -> 1.9311084894003017 | L15: =IF(F15=0,0,((C15/F15)*100)-100) -> 12.43645632732057 | M15: =IF(G15=0,0,((C15/G15)*100)-100) -> 5.9375422309529995 | N15: =IF(C15=0,0,IF(H15=0,0,((C15/H15)*100)-100)) -> 15.895858003451053 | P15: 1890000 | Q15: =IF(C15=0,0,((C15/P15)*100)-100) -> 6.1562074074074076 | R15: =IF(C15=0,0,(C15/$C$41)*100) -> 1.5689161808347667 | T15: 18.22 | U15: 18.58506286672522 | V15: =U15-T15 -> 0.36506286672522137
A16: Maringa | B16: 2988000 | C16: 3291429.84 | D16: 3270802.63 | F16: 2747690.22 | G16: 2597386.9 | H16: 2554039.1 | J16: =IF(B16=0,0,((C16/B16)*100)-100) -> 10.154947791164659 | K16: =IF(C16=0,0,IF(D16=0,0,((C16/D16)*100)-100)) -> 0.63064673517155256 | L16: =IF(F16=0,0,((C16/F16)*100)-100) -> 19.788970970679486 | M16: =IF(G16=0,0,((C16/G16)*100)-100) -> 26.720814677243496 | N16: =IF(C16=0,0,IF(H16=0,0,((C16/H16)*100)-100)) -> 28.871552514603223 | P16: 2988000 | Q16: =IF(C16=0,0,((C16/P16)*100)-100) -> 10.154947791164659 | R16: =IF(C16=0,0,(C16/$C$41)*100) -> 2.573813922202052 | T16: 17.11 | U16: 17.605660401985055 | V16: =U16-T16 -> 0.4956604019850559
A17: Araucaria Nova | B17: 4350000 | C17: 4555252.62 | D17: 4996433.9 | F17: 3901584.07 | G17: 3408197.01 | H17: 2605738.75 | J17: =IF(B17=0,0,((C17/B17)*100)-100) -> 4.7184510344827686 | K17: =IF(C17=0,0,IF(D17=0,0,((C17/D17)*100)-100)) -> -8.8299232778802548 | L17: =IF(F17=0,0,((C17/F17)*100)-100) -> 16.753927078649383 | M17: =IF(G17=0,0,((C17/G17)*100)-100) -> 33.655789458016102 | N17: =IF(C17=0,0,IF(H17=0,0,((C17/H17)*100)-100)) -> 74.816167583952932 | P17: 4350000 | Q17: =IF(C17=0,0,((C17/P17)*100)-100) -> 4.7184510344827686 | R17: =IF(C17=0,0,(C17/$C$41)*100) -> 3.5620910007011952 | T17: 16.36 | U17: 16.628422684492083 | V17: =U17-T17 -> 0.26842268449208362
A18: Cristo Rei | B18: 2255959 | C18: 2446720.74 | D18: 2386637.92 | F18: 2039129.7 | G18: 1644313.44 | H18: 1345432.76 | J18: =IF(B18=0,0,((C18/B18)*100)-100) -> 8.455904562095327 | K18: =IF(C18=0,0,IF(D18=0,0,((C18/D18)*100)-100)) -> 2.5174669142942463 | L18: =IF(F18=0,0,((C18/F18)*100)-100) -> 19.988480379644329 | M18: =IF(G18=0,0,((C18/G18)*100)-100) -> 48.798926073364726 | N18: =IF(C18=0,0,IF(H18=0,0,((C18/H18)*100)-100)) -> 81.853810368048443 | P18: 2255959 | Q18: =IF(C18=0,0,((C18/P18)*100)-100) -> 8.455904562095327 | R18: =IF(C18=0,0,(C18/$C$41)*100) -> 1.9132730182553452 | T18: 17.73 | U18: 18.066989124390222 | V18: =U18-T18 -> 0.33698912439022166
A19: Campo Largo | B19: 3750000 | C19: 3721124.66 | D19: 3936450.53 | F19: 3438098.62 | G19: 2538178.19 | H19: 0 | J19: =IF(B19=0,0,((C19/B19)*100)-100) -> -0.77000906666665969 | K19: =IF(C19=0,0,IF(D19=0,0,((C19/D19)*100)-100)) -> -5.4700514679146721 | L19: =IF(F19=0,0,((C19/F19)*100)-100) -> 8.2320512376692534 | M19: =IF(G19=0,0,((C19/G19)*100)-100) -> 46.606123819856805 | N19: =IF(C19=0,0,IF(H19=0,0,((C19/H19)*100)-100)) -> 0 | P19: 3750000 | Q19: =IF(C19=0,0,((C19/P19)*100)-100) -> -0.77000906666665969 | R19: =IF(C19=0,0,(C19/$C$41)*100) -> 2.9098242775113743 | T19: 17 | U19: 17.264356308880014 | V19: =U19-T19 -> 0.26435630888001427
A20: Brasilia | B20: 2620000 | C20: 2661205.62 | D20: 2862160.04 | F20: 2415370.43 | G20: 2214487.37 | H20: 842091.21 | J20: =IF(B20=0,0,((C20/B20)*100)-100) -> 1.5727335877862743 | K20: =IF(C20=0,0,IF(D20=0,0,((C20/D20)*100)-100)) -> -7.0210755929636974 | L20: =IF(F20=0,0,((C20/F20)*100)-100) -> 10.177949806233229 | M20: =IF(G20=0,0,((C20/G20)*100)-100) -> 20.172535461333425 | N20: =IF(C20=0,0,IF(H20=0,0,((C20/H20)*100)-100)) -> 216.02344121368992 | P20: 2620000 | Q20: =IF(C20=0,0,((C20/P20)*100)-100) -> 1.5727335877862743 | R20: =IF(C20=0,0,(C20/$C$41)*100) -> 2.0809947067254955 | T20: 16.46 | U20: 16.515642259916767 | V20: =U20-T20 -> 5.5642259916766079E-2
A21: Total Super | B21: =SUM(B6:B20) -> 37779992 | C21: =SUM(C6:C20) -> 38650317.600000001 | D21: =SUM(D6:D20) -> 40379350.93 | F21: =SUM(F6:F20) -> 34855626.030000001 | G21: =SUM(G6:G20) -> 30882140.02 | H21: =SUM(H6:H20) -> 23607715.650000002 | I21: =SUM(B21:H21) -> 206155142.23000002 | J21: =IF(C21=0,0,((C21/B21)*100)-100) -> 2.3036680367745959 | K21: =IF(C21=0,0,IF(D21=0,0,((C21/D21)*100)-100)) -> -4.2819740540093818 | L21: =IF(F21=0,0,IF(C21=0,0,((C21/F21)*100)-100)) -> 10.886883990360502 | M21: =IF(G21=0,0,IF(C21=0,0,((C21/G21)*100)-100)) -> 25.154272258882145 | N21: =IF(C21=0,0,IF(H21=0,0,((C21/H21)*100)-100)) -> 63.719006840884219 | P21: =SUM(P6:P20) -> 37779993 | Q21: =IF(C21=0,0,((C21/P21)*100)-100) -> 2.3036653288951214 | R21: =IF(C21=0,0,(C21/$C$41)*100) -> 30.223559477850216 | T21: 16.773949402900879 | U21: 16.947116677768257 | V21: =U21-T21 -> 0.17316727486737804
A22: Pinheirinho | B22: 4587638 | C22: 4585412.42 | D22: 5149724.14 | F22: 4998766.79 | G22: 3966353.84 | H22: 3583429.83 | J22: =IF(B22=0,0,((C22/B22)*100)-100) -> -4.8512546107602361E-2 | K22: =IF(C22=0,0,IF(D22=0,0,((C22/D22)*100)-100)) -> -10.958096097162979 | L22: =IF(F22=0,0,((C22/F22)*100)-100) -> -8.2691269140003243 | M22: =IF(G22=0,0,((C22/G22)*100)-100) -> 15.607749711004089 | N22: =IF(C22=0,0,IF(H22=0,0,((C22/H22)*100)-100)) -> 27.961551852125993 | P22: 4587638 | Q22: =IF(C22=0,0,IF(P22=0,0,((C22/P22)*100)-100)) -> -4.8512546107602361E-2 | R22: =IF(C22=0,0,(C22/$C$41)*100) -> 3.5856751926494663 | T22: 15.99 | U22: 16.467889926463801 | V22: =U22-T22 -> 0.47788992646380102
A23: Londrina | B23: 3794500 | C23: 4163796.81 | D23: 4776234.74 | F23: 3378368.85 | G23: 3133724.54 | H23: 2925095.66 | J23: =IF(B23=0,0,((C23/B23)*100)-100) -> 9.7324235077085319 | K23: =IF(C23=0,0,IF(D23=0,0,((C23/D23)*100)-100)) -> -12.822609510185018 | L23: =IF(F23=0,0,((C23/F23)*100)-100) -> 23.248733186727094 | M23: =IF(G23=0,0,((C23/G23)*100)-100) -> 32.87054292270372 | N23: =IF(C23=0,0,IF(H23=0,0,((C23/H23)*100)-100)) -> 42.347372324910538 | P23: 3794500 | Q23: =IF(C23=0,0,IF(P23=0,0,((C23/P23)*100)-100)) -> 9.7324235077085319 | R23: =IF(C23=0,0,(C23/$C$41)*100) -> 3.2559825728500087 | T23: 15.86 | U23: 15.685249059979947 | V23: =U23-T23 -> -0.17475094002005243
A24: São Bráz | B24: 5137862 | C24: 5090289.93 | D24: 5819043.3499999996 | F24: 4763326.83 | G24: 4465091.11 | H24: 4085332.05 | J24: =IF(B24=0,0,((C24/B24)*100)-100) -> -0.92591178976780952 | K24: =IF(C24=0,0,IF(D24=0,0,((C24/D24)*100)-100)) -> -12.523594965141484 | L24: =IF(F24=0,0,((C24/F24)*100)-100) -> 6.8641752218375274 | M24: =IF(G24=0,0,((C24/G24)*100)-100) -> 14.00192749930244 | N24: =IF(C24=0,0,IF(H24=0,0,((C24/H24)*100)-100)) -> 24.599172544616053 | P24: 5137862 | Q24: =IF(C24=0,0,IF(P24=0,0,((C24/P24)*100)-100)) -> -0.92591178976780952 | R24: =IF(C24=0,0,(C24/$C$41)*100) -> 3.980476487956647 | T24: 16.1 | U24: 16.010836145044493 | V24: =U24-T24 -> -8.916385495550827E-2
A25: S.J. Pinhais | B25: 6052440 | C25: 6051322.9199999999 | D25: 6590191.5700000003 | F25: 5533045.0300000003 | G25: 4946423.27 | H25: 4384308.65 | J25: =IF(B25=0,0,((C25/B25)*100)-100) -> -1.8456688542144661E-2 | K25: =IF(C25=0,0,IF(D25=0,0,((C25/D25)*100)-100)) -> -8.1768283103187684 | L25: =IF(F25=0,0,((C25/F25)*100)-100) -> 9.366955938184347 | M25: =IF(G25=0,0,((C25/G25)*100)-100) -> 22.33734538451661 | N25: =IF(C25=0,0,IF(H25=0,0,((C25/H25)*100)-100)) -> 38.022283627317137 | P25: 6052440 | Q25: =IF(C25=0,0,IF(P25=0,0,((C25/P25)*100)-100)) -> -1.8456688542144661E-2 | R25: =IF(C25=0,0,(C25/$C$41)*100) -> 4.7319796976855431 | T25: 15.97 | U25: 16.637369271312991 | V25: =U25-T25 -> 0.66736927131299062
A26: P.G. Nova | B26: 5336291 | C26: 5873708.3300000001 | D26: 6107563.2699999996 | F26: 4619949.08 | G26: 4897133.98 | H26: 4058127.66 | J26: =IF(B26=0,0,((C26/B26)*100)-100) -> 10.070989944139114 | K26: =IF(C26=0,0,IF(D26=0,0,((C26/D26)*100)-100)) -> -3.8289401134603338 | L26: =IF(F26=0,0,((C26/F26)*100)-100) -> 27.137945208694816 | M26: =IF(G26=0,0,((C26/G26)*100)-100) -> 19.941752747389614 | N26: =IF(C26=0,0,IF(H26=0,0,((C26/H26)*100)-100)) -> 44.739368056252829 | P26: 5336291 | Q26: =IF(C26=0,0,IF(P26=0,0,((C26/P26)*100)-100)) -> 10.070989944139114 | R26: =IF(C26=0,0,(C26/$C$41)*100) -> 4.5930896326528314 | T26: 15.8 | U26: 15.919103357997347 | V26: =U26-T26 -> 0.11910335799734639
A27: Nilo Pecanha | B27: 12870000 | C27: 13352611.300000001 | D27: 13548840.119999999 | F27: 12114351.49 | G27: 10620163.539999999 | H27: 9463614.3200000003 | J27: =IF(B27=0,0,((C27/B27)*100)-100) -> 3.749893550893546 | K27: =IF(C27=0,0,IF(D27=0,0,((C27/D27)*100)-100)) -> -1.4483071485236252 | L27: =IF(F27=0,0,((C27/F27)*100)-100) -> 10.221428782400309 | M27: =IF(G27=0,0,((C27/G27)*100)-100) -> 25.728867071664709 | N27: =IF(C27=0,0,IF(H27=0,0,((C27/H27)*100)-100)) -> 41.094204058814597 | P27: 12870000 | Q27: =IF(C27=0,0,IF(P27=0,0,((C27/P27)*100)-100)) -> 3.749893550893546 | R27: =IF(C27=0,0,(C27/$C$41)*100) -> 10.441400404175848 | T27: 16.43 | U27: 16.873942926804137 | V27: =U27-T27 -> 0.44394292680413727
A28: Champagnat | B28: 6340000 | C28: 5928589.2300000004 | D28: 6027420.25 | F28: 5961299.1799999997 | G28: 6060712.8099999996 | H28: 5406810.54 | J28: =IF(B28=0,0,((C28/B28)*100)-100) -> -6.4891288643533045 | K28: =IF(C28=0,0,IF(D28=0,0,((C28/D28)*100)-100)) -> -1.6396902140679401 | L28: =IF(F28=0,0,((C28/F28)*100)-100) -> -0.54870505593378027 | M28: =IF(G28=0,0,((C28/G28)*100)-100) -> -2.1800006722311451 | N28: =IF(C28=0,0,IF(H28=0,0,((C28/H28)*100)-100)) -> 9.6503971452271458 | P28: 6340000 | Q28: =IF(C28=0,0,IF(P28=0,0,((C28/P28)*100)-100)) -> -6.4891288643533045 | R28: =IF(C28=0,0,(C28/$C$41)*100) -> 4.636005092300902 | T28: 17.06 | U28: 17.158351009587484 | V28: =U28-T28 -> 9.8351009587485549E-2
A29: Santa Candida | B29: 7200000 | C29: 7694802.1500000004 | D29: 8368806.9199999999 | F29: 6787184.29 | G29: 5535550.8600000003 | H29: 4671194.54 | J29: =IF(B29=0,0,((C29/B29)*100)-100) -> 6.8722520833333363 | K29: =IF(C29=0,0,IF(D29=0,0,((C29/D29)*100)-100)) -> -8.0537736913160813 | L29: =IF(F29=0,0,((C29/F29)*100)-100) -> 13.372524175264445 | M29: =IF(G29=0,0,((C29/G29)*100)-100) -> 39.006981321457857 | N29: =IF(C29=0,0,IF(H29=0,0,((C29/H29)*100)-100)) -> 64.72878798149992 | P29: 7200000 | Q29: =IF(C29=0,0,IF(P29=0,0,((C29/P29)*100)-100)) -> 6.8722520833333363 | R29: =IF(C29=0,0,(C29/$C$41)*100) -> 6.0171384064076801 | T29: 16.05 | U29: 15.913024482377367 | V29: =U29-T29 -> -0.13697551762263416
A30: Paranaguá Raia | B30: 7600000 | C30: 7437288.8600000003 | D30: 8261686.5199999996 | F30: 7176509.4299999997 | G30: 5949127.0599999996 | H30: 5220340.26 | J30: =IF(B30=0,0,((C30/B30)*100)-100) -> -2.1409360526315737 | K30: =IF(C30=0,0,IF(D30=0,0,((C30/D30)*100)-100)) -> -9.9785637957127307 | L30: =IF(F30=0,0,((C30/F30)*100)-100) -> 3.6337920620554485 | M30: =IF(G30=0,0,((C30/G30)*100)-100) -> 25.014792674473512 | N30: =IF(C30=0,0,IF(H30=0,0,((C30/H30)*100)-100)) -> 42.467511495122352 | P30: 7600000 | Q30: =IF(C30=0,0,IF(P30=0,0,((C30/P30)*100)-100)) -> -2.1409360526315737 | R30: =IF(C30=0,0,(C30/$C$41)*100) -> 5.8157696022182961 | T30: 17.68 | U30: 18.070700698856541 | V30: =U30-T30 -> 0.39070069885654135
A31: Novo Mundo | B31: 5246316 | C31: 5342595.14 | D31: 5940484.9299999997 | F31: 5125172.17 | G31: 0 | H31: 0 | J31: =IF(B31=0,0,((C31/B31)*100)-100) -> 1.8351761502738242 | K31: =IF(C31=0,0,IF(D31=0,0,((C31/D31)*100)-100)) -> -10.064663020700564 | L31: =IF(F31=0,0,((C31/F31)*100)-100) -> 4.2422568996350378 | M31: =IF(G31=0,0,((C31/G31)*100)-100) -> 0 | N31: =IF(C31=0,0,IF(H31=0,0,((C31/H31)*100)-100)) -> 0 | P31: 5246316 | Q31: =IF(C31=0,0,IF(P31=0,0,((C31/P31)*100)-100)) -> 1.8351761502738242 | R31: =IF(C31=0,0,(C31/$C$41)*100) -> 4.1777727068370449 | T31: 15.81 | U31: 16.161694969834457 | V31: =U31-T31 -> 0.35169496983445647
A32: Uvaranas | B32: 5000000 | C32: 5311315.86 | D32: 5604327.2000000002 | F32: 4418078.02 | G32: 0 | H32: 0 | J32: =IF(B32=0,0,((C32/B32)*100)-100) -> 6.2263171999999969 | K32: =IF(C32=0,0,IF(D32=0,0,((C32/D32)*100)-100)) -> -5.2283053708926985 | L32: =IF(F32=0,0,((C32/F32)*100)-100) -> 20.217792351254161 | M32: =IF(G32=0,0,((C32/G32)*100)-100) -> 0 | N32: =IF(C32=0,0,IF(H32=0,0,((C32/H32)*100)-100)) -> 0 | P32: 5000000 | Q32: =IF(C32=0,0,IF(P32=0,0,((C32/P32)*100)-100)) -> 6.2263171999999969 | R32: =IF(C32=0,0,(C32/$C$41)*100) -> 4.1533131101711609 | T32: 15.96 | U32: 15.685854352484318 | V32: =U32-T32 -> -0.27414564751568271
A33: Torres | B33: 5415000 | C33: 5830916.4500000002 | D33: 6407939.0599999996 | F33: 5068869.13 | G33: 4187096.11 | H33: 0 | J33: =IF(B33=0,0,((C33/B33)*100)-100) -> 7.6808208679593832 | K33: =IF(C33=0,0,IF(D33=0,0,((C33/D33)*100)-100)) -> -9.0048080138889333 | L33: =IF(F33=0,0,((C33/F33)*100)-100) -> 15.033872456675553 | M33: =IF(G33=0,0,((C33/G33)*100)-100) -> 39.25919770683268 | N33: =IF(C33=0,0,IF(H33=0,0,((C33/H33)*100)-100)) -> 0 | P33: 5415000 | Q33: =IF(C33=0,0,IF(P33=0,0,((C33/P33)*100)-100)) -> 7.6808208679593832 | R33: =IF(C33=0,0,(C33/$C$41)*100) -> 4.5596274773418735 | T33: 16.25 | U33: 16.361841027579807 | V33: =U33-T33 -> 0.11184102757980696
A34: Total Hiper | B34: =SUM(B22:B33) -> 74580047 | C34: =SUM(C22:C33) -> 76662649.400000006 | D34: =SUM(D22:D33) -> 82602262.070000008 | F34: =SUM(F22:F33) -> 69944920.289999992 | G34: =SUM(G22:G33) -> 53761377.120000005 | H34: =SUM(H22:H33) -> 43798253.509999998 | I34: =SUM(B34:H34) -> 401349509.38999999 | J34: =IF(C34=0,0,((C34/B34)*100)-100) -> 2.7924391090823519 | K34: =IF(C34=0,0,IF(D34=0,0,((C34/D34)*100)-100)) -> -7.1906174493945088 | L34: =IF(F34=0,0,IF(C34=0,0,((C34/F34)*100)-100)) -> 9.6043130539680561 | M34: =IF(G34=0,0,IF(C34=0,0,((C34/G34)*100)-100)) -> 42.598001589286667 | N34: =IF(C34=0,0,IF(H34=0,0,((C34/H34)*100)-100)) -> 75.035859323697508 | P34: =SUM(P22:P33) -> 74580047 | Q34: =IF(C34=0,0,((C34/P34)*100)-100) -> 2.7924391090823519 | R34: =IF(C34=0,0,(C34/$C$41)*100) -> 59.948230383247306 | T34: 16.324849599250051 | U34: 16.506700315003719 | V34: =U34-T34 -> 0.18185071575366862
A35: Total s/ 29,30,37 | B35: =B21+B34 -> 112360039 | C35: =C21+C34 -> 115312967 | D35: =D21+D34 -> 122981613 | E35: =E21+E34 -> 0 | F35: =F21+F34 -> 104800546.31999999 | G35: =G21+G34 -> 84643517.140000001 | H35: =H21+H34 -> 67405969.159999996 | I35: =SUM(B35:H35) -> 607504651.62 | J35: =IF(C35=0,0,((C35/B35)*100)-100) -> 2.6280944954104086 | K35: =IF(C35=0,0,IF(D35=0,0,((C35/D35)*100)-100)) -> -6.2356036914233641 | L35: =IF(F35=0,0,IF(C35=0,0,((C35/F35)*100)-100)) -> 10.030883472592961 | M35: =IF(G35=0,0,IF(C35=0,0,((C35/G35)*100)-100)) -> 36.233666672041608 | N35: =IF(C35=0,0,IF(H35=0,0,((C35/H35)*100)-100)) -> 71.072337416118529 | P35: =P21+P34 -> 112360040 | Q35: =IF(C35=0,0,((C35/P35)*100)-100) -> 2.6280935820243627 | R35: =IF(C35=0,0,(C35/$C$41)*100) -> 90.171789861097508 | T35: 16.475855127017176 | U35: 16.65431799183521 | V35: =U35-T35 -> 0.17846286481803375
A36: Centenario | B36: 0 | C36: 0 | D36: 0 | F36: 1165567.53 | G36: 1145033.02 | H36: 1009259.67 | J36: =IF(B36=0,0,((C36/B36)*100)-100) -> 0 | K36: =IF(C36=0,0,IF(D36=0,0,((C36/D36)*100)-100)) -> 0 | L36: =IF(F36=0,0,((C36/F36)*100)-100) -> -100 | M36: =IF(G36=0,0,((C36/G36)*100)-100) -> -100 | N36: =IF(C36=0,0,IF(H36=0,0,((C36/H36)*100)-100)) -> 0 | P36: 0 | Q36: =IF(P36=0,0,IF(C36=0,0,((C36/P36)*100)-100)) -> 0 | R36: =IF(C36=0,0,(C36/$C$41)*100) -> 0 | T36: 0 | U36: 0 | V36: =U36-T36 -> 0
A37: Cajuru | B37: 3567007 | C37: 4032632.03 | D37: 4571411.98 | F37: 0 | G37: 0 | H37: 0 | J37: =IF(B37=0,0,((C37/B37)*100)-100) -> 13.053661795449216 | K37: =IF(C37=0,0,IF(D37=0,0,((C37/D37)*100)-100)) -> -11.785854181534532 | L37: =IF(F37=0,0,((C37/F37)*100)-100) -> 0 | M37: =IF(G37=0,0,((C37/G37)*100)-100) -> 0 | N37: =IF(C37=0,0,IF(H37=0,0,((C37/H37)*100)-100)) -> 0 | P37: 3567007 | Q37: =IF(P37=0,0,IF(C37=0,0,((C37/P37)*100)-100)) -> 13.053661795449216 | R37: =IF(C37=0,0,(C37/$C$41)*100) -> 3.1534150707985082 | T37: 16.16 | U37: 16.457093408544893 | V37: =U37-T37 -> 0.29709340854489241
A38: Água Verde | B38: 6303776 | C38: 5870207.71 | D38: 6613188.5099999998 | F38: 0 | G38: 0 | H38: 0 | J38: =IF(B38=0,0,((C38/B38)*100)-100) -> -6.8779139677552052 | K38: =IF(C38=0,0,IF(D38=0,0,((C38/D38)*100)-100)) -> -11.234834737835115 | L38: =IF(F38=0,0,((C38/F38)*100)-100) -> 0 | M38: =IF(G38=0,0,((C38/G38)*100)-100) -> 0 | N38: =IF(C38=0,0,IF(H38=0,0,((C38/H38)*100)-100)) -> 0 | P38: 6303776 | Q38: =IF(P38=0,0,IF(C38=0,0,((C38/P38)*100)-100)) -> -6.8779139677552052 | R38: =IF(C38=0,0,(C38/$C$41)*100) -> 4.590352237377731 | T38: 15.43 | U38: 16.934091247002911 | V38: =U38-T38 -> 1.5040912470029113
A39: Fazenda | B39: 2750000 | C39: 2665615.13 | D39: 2979541.05 | F39: 0 | G39: 0 | H39: 0 | J39: =IF(B39=0,0,((C39/B39)*100)-100) -> -3.0685407272727332 | K39: =IF(C39=0,0,IF(D39=0,0,((C39/D39)*100)-100)) -> -10.536049503328698 | L39: =IF(F39=0,0,((C39/F39)*100)-100) -> 0 | M39: =IF(G39=0,0,((C39/G39)*100)-100) -> 0 | N39: =IF(C39=0,0,IF(H39=0,0,((C39/H39)*100)-100)) -> 0 | P39: 2750000 | Q39: =IF(P39=0,0,IF(C39=0,0,((C39/P39)*100)-100)) -> -3.0685407272727332 | R39: =IF(C39=0,0,(C39/$C$41)*100) -> 2.0844428307262453 | T39: 15.3 | U39: 16.461873848982844 | V39: =U39-T39 -> 1.1618738489828431
A40: Total Lojas Novas | B40: =SUM(B36:B39) -> 12620783 | C40: =SUM(C36:C39) -> 12568454.870000001 | D40: =SUM(D36:D39) -> 14164141.539999999 | F40: =SUM(F36:F39) -> 1165567.53 | G40: =SUM(G36:G39) -> 1145033.02 | H40: =SUM(H36:H39) -> 1009259.67 | J40: =IF(C40=0,0,((C40/B40)*100)-100) -> -0.41461872848934433 | K40: =IF(C40=0,0,IF(D40=0,0,((C40/D40)*100)-100)) -> -11.265678654041452 | L40: =IF(F40=0,0,IF(C40=0,0,((C40/F40)*100)-100)) -> 978.31202796117714 | M40: =IF(G40=0,0,IF(C40=0,0,((C40/G40)*100)-100)) -> 997.64999353468443 | N40: =IF(C40=0,0,IF(H40=0,0,((C40/H40)*100)-100)) -> 1145.3142876500754 | P40: =SUM(P36:P39) -> 12620783 | Q40: =IF(P40=0,0,IF(C40=0,0,((C40/P40)*100)-100)) -> -0.41461872848934433 | R40: =IF(C40=0,0,(C40/$C$41)*100) -> 9.8282101389024845 | T40: 7.9010813449530035 | U40: 8.7716766412672005 | V40: =U40-T40 -> 0.87059529631419696
A41: Total sem 29 | B41: =B21+B34+B40 -> 124980822 | C41: =C21+C34+C40 -> 127881421.87 | D41: =D21+D34+D40 -> 137145754.53999999 | F41: =F21+F34+F40 -> 105966113.84999999 | G41: =G21+G34+G40 -> 85788550.159999996 | H41: =H21+H34+H40 -> 68415228.829999998 | J41: =IF(C41=0,0,((C41/B41)*100)-100) -> 2.3208359679375548 | K41: =IF(C41=0,0,IF(D41=0,0,((C41/D41)*100)-100)) -> -6.7550998578654031 | L41: =IF(F41=0,0,IF(C41=0,0,((C41/F41)*100)-100)) -> 20.68143034010113 | M41: =IF(G41=0,0,IF(C41=0,0,((C41/G41)*100)-100)) -> 49.065838776264059 | N41: =IF(C41=0,0,IF(H41=0,0,((C41/H41)*100)-100)) -> 86.91952662727067 | P41: =P21+P34+P40 -> 124980823 | Q41: =IF(C41=0,0,((C41/P41)*100)-100) -> 2.320835149245255 | R41: =R21+R34+R40 -> 100 | T41: 15.609959404411661 | U41: 15.879595435405363 | V41: =U41-T41 -> 0.26963603099370204
A43: Água Verde | B43: 0 | C43: 0 | D43: 0 | F43: 0 | G43: 0 | H43: 0 | J43: =IF(B43=0,0,((C43/B43)*100)-100) -> 0 | K43: =IF(C43=0,0,IF(D43=0,0,((C43/D43)*100)-100)) -> 0 | L43: =IF(F43=0,0,((C43/F43)*100)-100) -> 0 | M43: =IF(G43=0,0,((C43/G43)*100)-100) -> 0 | N43: =IF(C43=0,0,IF(H43=0,0,((C43/H43)*100)-100)) -> 0 | P43: =C43 -> 0 | Q43: =IF(C43=0,0,IF(P43=0,0,((C43/P43)*100)-100)) -> 0 | R43: =IF(C43=0,0,(C43/$C$41)*100) -> 0 | T43: 14.9 | U43: 0 | V43: =U43-T43 -> -14.9
A44: Total Geral | B44: =B41+B43 -> 124980822 | C44: =C41+C43 -> 127881421.87 | D44: =D41+D43 -> 137145754.53999999 | F44: =F41+F43 -> 105966113.84999999 | G44: =G41+G43 -> 85788550.159999996 | H44: =H41+H43 -> 68415228.829999998 | I44: =SUM(B44:H44) -> 650177891.25 | J44: =IF(C44=0,0,((C44/B44)*100)-100) -> 2.3208359679375548 | K44: =IF(C44=0,0,IF(D44=0,0,((C44/D44)*100)-100)) -> -6.7550998578654031 | L44: =IF(F44=0,0,IF(C44=0,0,((C44/F44)*100)-100)) -> 20.68143034010113 | M44: =IF(G44=0,0,IF(C44=0,0,((C44/G44)*100)-100)) -> 49.065838776264059 | N44: =IF(C44=0,0,IF(H44=0,0,((C44/H44)*100)-100)) -> 86.91952662727067 | P44: =P41+P43 -> 124980823 | Q44: =IF(C44=0,0,((C44/P44)*100)-100) -> 2.320835149245255 | R44: =IF(C44=0,0,(C44/$C$41)*100) -> 100 | T44: 15.609959404411661 | U44: 15.879595435405363 | V44: =U44-T44 -> 0.26963603099370204
B46: =B38-P38 -> 0