A2: Periodo: | C2: 38443 | D2: a | E2: 38472 | H2: Vendas Acumuladas por Filial | Q2: =NOW() -> 38475.729554629601
A4: v.1 | C4: Vendas 2005 | G4: Vendas de Anos Anteriores | K4: Percentuais ( % ) | Q4: Meta Mensal | U4: Margem
A5: Lojas | C5: Previsao | D5: Realizada | E5: Mes Anterior | G5: Vendas 2004 | H5: Vendas 2003 | I5: Vendas 2002 | K5: % Prev | L5: % MA | M5: 2004 | N5: 2003 | O5: 2002 | Q5: Previsao Mes | R5: Final | S5: Part. | U5: Meta | V5: Real
A7: Xaxim | C7: 850000 | D7: 785242 | E7: 858818 | G7: 805540 | H7: 705281 | I7: 536632 | K7: =IF(C7=0,0,((D7/C7)*100)-100) -> -7.62 | L7: =IF(D7=0,0,IF(E7=0,0,((D7/E7)*100)-100)) -> -8.57 | M7: =IF(G7=0,0,((D7/G7)*100)-100) -> -2.52 | N7: =IF(H7=0,0,((D7/H7)*100)-100) -> 11.34 | O7: =IF(D7=0,0,IF(I7=0,0,((D7/I7)*100)-100)) -> 46.33 | Q7: 850000 | R7: =IF(D7=0,0,((D7/Q7)*100)-100) -> -7.62 | S7: =IF(D7=0,0,(D7/$D$34)*100) -> 1.35 | U7: 17 | V7: 18.69
A8: S. Felicidade | C8: 785000 | D8: 769678 | E8: 793065 | G8: 713656 | H8: 756536 | I8: 507659 | K8: =IF(C8=0,0,((D8/C8)*100)-100) -> -1.95 | L8: =IF(D8=0,0,IF(E8=0,0,((D8/E8)*100)-100)) -> -2.95 | M8: =IF(G8=0,0,((D8/G8)*100)-100) -> 7.85 | N8: =IF(H8=0,0,((D8/H8)*100)-100) -> 1.74 | O8: =IF(D8=0,0,IF(I8=0,0,((D8/I8)*100)-100)) -> 51.61 | Q8: 785000 | R8: =IF(D8=0,0,((D8/Q8)*100)-100) -> -1.95 | S8: =IF(D8=0,0,(D8/$D$34)*100) -> 1.33 | U8: 16.75 | V8: 18.28
A9: Lapa | C9: 1240000 | D9: 1167031 | E9: 1308588 | G9: 1215860 | H9: 1078805 | I9: 751829 | K9: =IF(C9=0,0,((D9/C9)*100)-100) -> -5.88 | L9: =IF(D9=0,0,IF(E9=0,0,((D9/E9)*100)-100)) -> -10.82 | M9: =IF(G9=0,0,((D9/G9)*100)-100) -> -4.02 | N9: =IF(H9=0,0,((D9/H9)*100)-100) -> 8.18 | O9: =IF(D9=0,0,IF(I9=0,0,((D9/I9)*100)-100)) -> 55.23 | Q9: 1240000 | R9: =IF(D9=0,0,((D9/Q9)*100)-100) -> -5.88 | S9: =IF(D9=0,0,(D9/$D$34)*100) -> 2.01 | U9: 16.9 | V9: 17.71
A10: Araucaria | C10: 1060000 | D10: 986365 | E10: 1118579 | G10: 1104134 | H10: 1164095 | I10: 1336969 | K10: =IF(C10=0,0,((D10/C10)*100)-100) -> -6.95 | L10: =IF(D10=0,0,IF(E10=0,0,((D10/E10)*100)-100)) -> -11.82 | M10: =IF(G10=0,0,((D10/G10)*100)-100) -> -10.67 | N10: =IF(H10=0,0,((D10/H10)*100)-100) -> -15.27 | O10: =IF(D10=0,0,IF(I10=0,0,((D10/I10)*100)-100)) -> -26.22 | Q10: 1060000 | R10: =IF(D10=0,0,((D10/Q10)*100)-100) -> -6.95 | S10: =IF(D10=0,0,(D10/$D$34)*100) -> 1.7 | U10: 17.9 | V10: 18.88
A11: Pinheirinho | C11: 2190000 | D11: 1992846 | E11: 2360409 | G11: 2097557 | H11: 1971919 | I11: 1487836 | K11: =IF(C11=0,0,((D11/C11)*100)-100) -> -9 | L11: =IF(D11=0,0,IF(E11=0,0,((D11/E11)*100)-100)) -> -15.57 | M11: =IF(G11=0,0,((D11/G11)*100)-100) -> -4.99 | N11: =IF(H11=0,0,((D11/H11)*100)-100) -> 1.06 | O11: =IF(D11=0,0,IF(I11=0,0,((D11/I11)*100)-100)) -> 33.94 | Q11: 2190000 | R11: =IF(D11=0,0,((D11/Q11)*100)-100) -> -9 | S11: =IF(D11=0,0,(D11/$D$34)*100) -> 3.43 | U11: 17.24 | V11: 19.23
A12: Hauer | C12: 3300000 | D12: 3197643 | E12: 3467208 | G12: 3019480 | H12: 2916807 | I12: 2104929 | K12: =IF(C12=0,0,((D12/C12)*100)-100) -> -3.1 | L12: =IF(D12=0,0,IF(E12=0,0,((D12/E12)*100)-100)) -> -7.77 | M12: =IF(G12=0,0,((D12/G12)*100)-100) -> 5.9 | N12: =IF(H12=0,0,((D12/H12)*100)-100) -> 9.63 | O12: =IF(D12=0,0,IF(I12=0,0,((D12/I12)*100)-100)) -> 51.91 | Q12: 3300000 | R12: =IF(D12=0,0,((D12/Q12)*100)-100) -> -3.1 | S12: =IF(D12=0,0,(D12/$D$34)*100) -> 5.51 | U12: 16.87 | V12: 18.54
A13: Paranagua | C13: 1900000 | D13: 1764216 | E13: 2140908 | G13: 3511810 | H13: 3265218 | I13: 2332842 | K13: =IF(C13=0,0,((D13/C13)*100)-100) -> -7.15 | L13: =IF(D13=0,0,IF(E13=0,0,((D13/E13)*100)-100)) -> -17.59 | M13: =IF(G13=0,0,((D13/G13)*100)-100) -> -49.76 | N13: =IF(H13=0,0,((D13/H13)*100)-100) -> -45.97 | O13: =IF(D13=0,0,IF(I13=0,0,((D13/I13)*100)-100)) -> -24.37 | Q13: 1900000 | R13: =IF(D13=0,0,((D13/Q13)*100)-100) -> -7.15 | S13: =IF(D13=0,0,(D13/$D$34)*100) -> 3.04 | U13: 17.59 | V13: 18.41
A14: Centenario | C14: 1050000 | D14: 947564 | E14: 1047816 | G14: 949309 | H14: 886703 | I14: 677267 | K14: =IF(C14=0,0,((D14/C14)*100)-100) -> -9.76 | L14: =IF(D14=0,0,IF(E14=0,0,((D14/E14)*100)-100)) -> -9.57 | M14: =IF(G14=0,0,((D14/G14)*100)-100) -> -00.18 | N14: =IF(H14=0,0,((D14/H14)*100)-100) -> 6.86 | O14: =IF(D14=0,0,IF(I14=0,0,((D14/I14)*100)-100)) -> 39.91 | Q14: 1050000 | R14: =IF(D14=0,0,((D14/Q14)*100)-100) -> -9.76 | S14: =IF(D14=0,0,(D14/$D$34)*100) -> 1.63 | U14: 17.1 | V14: 18.26
A15: Arapongas | C15: 0 | D15: 0 | E15: 0 | G15: 0 | H15: 0 | I15: 0 | K15: =IF(C15=0,0,((D15/C15)*100)-100) -> 0 | L15: =IF(D15=0,0,IF(E15=0,0,((D15/E15)*100)-100)) -> 0 | M15: =IF(D15=0,0,IF(G15=0,0,((D15/G15)*100)-100)) -> 0 | N15: =IF(D15=0,0,IF(H15=0,0,((D15/H15)*100)-100)) -> 0 | O15: =IF(D15=0,0,IF(I15=0,0,((D15/I15)*100)-100)) -> 0 | Q15: 0 | R15: =IF(D15=0,0,((D15/Q15)*100)-100) -> 0 | S15: =IF(D15=0,0,(D15/$D$34)*100) -> 0 | U15: 0 | V15: 0
A16: Sao Braz | C16: 3310000 | D16: 3246403 | E16: 3450181 | G16: 2976538 | H16: 3019719 | I16: 2135079 | K16: =IF(C16=0,0,((D16/C16)*100)-100) -> -1.92 | L16: =IF(D16=0,0,IF(E16=0,0,((D16/E16)*100)-100)) -> -5.91 | M16: =IF(G16=0,0,((D16/G16)*100)-100) -> 9.07 | N16: =IF(H16=0,0,((D16/H16)*100)-100) -> 7.51 | O16: =IF(D16=0,0,IF(I16=0,0,((D16/I16)*100)-100)) -> 52.05 | Q16: 3310000 | R16: =IF(D16=0,0,((D16/Q16)*100)-100) -> -1.92 | S16: =IF(D16=0,0,(D16/$D$34)*100) -> 5.59 | U16: 16.77 | V16: 18.4
A17: Guarapuava | C17: 1730000 | D17: 1791813 | E17: 2117345 | G17: 1751058 | H17: 1486376 | I17: 704613 | K17: =IF(C17=0,0,((D17/C17)*100)-100) -> 3.57 | L17: =IF(D17=0,0,IF(E17=0,0,((D17/E17)*100)-100)) -> -15.37 | M17: =IF(G17=0,0,((D17/G17)*100)-100) -> 2.33 | N17: =IF(H17=0,0,((D17/H17)*100)-100) -> 20.55 | O17: =IF(D17=0,0,IF(I17=0,0,((D17/I17)*100)-100)) -> 154.3 | Q17: 1730000 | R17: =IF(D17=0,0,((D17/Q17)*100)-100) -> 3.57 | S17: =IF(D17=0,0,(D17/$D$34)*100) -> 3.09 | U17: 17.93 | V17: 18.86
A18: Apucarana | C18: 1520000 | D18: 1649098 | E18: 1987495 | G18: 1641009 | H18: 1504472 | I18: 1061197 | K18: =IF(C18=0,0,((D18/C18)*100)-100) -> 8.49 | L18: =IF(D18=0,0,IF(E18=0,0,((D18/E18)*100)-100)) -> -17.03 | M18: =IF(G18=0,0,((D18/G18)*100)-100) -> 00.49 | N18: =IF(H18=0,0,((D18/H18)*100)-100) -> 9.61 | O18: =IF(D18=0,0,IF(I18=0,0,((D18/I18)*100)-100)) -> 55.4 | Q18: 1520000 | R18: =IF(D18=0,0,((D18/Q18)*100)-100) -> 8.49 | S18: =IF(D18=0,0,(D18/$D$34)*100) -> 2.84 | U18: 17.95 | V18: 19.21
A19: Ahu | C19: 1140000 | D19: 1075549 | E19: 1155295 | G19: 1096104 | H19: 1322206 | I19: 980790 | K19: =IF(C19=0,0,((D19/C19)*100)-100) -> -5.65 | L19: =IF(D19=0,0,IF(E19=0,0,((D19/E19)*100)-100)) -> -6.9 | M19: =IF(G19=0,0,((D19/G19)*100)-100) -> -1.88 | N19: =IF(H19=0,0,((D19/H19)*100)-100) -> -18.65 | O19: =IF(D19=0,0,IF(I19=0,0,((D19/I19)*100)-100)) -> 9.66 | Q19: 1140000 | R19: =IF(D19=0,0,((D19/Q19)*100)-100) -> -5.65 | S19: =IF(D19=0,0,(D19/$D$34)*100) -> 1.85 | U19: 17.91 | V19: 17.86
A20: P.G. Centro | C20: 1900000 | D20: 1614167 | E20: 1891893 | G20: 1799929 | H20: 1776703 | I20: 1203379 | K20: =IF(C20=0,0,((D20/C20)*100)-100) -> -15.04 | L20: =IF(D20=0,0,IF(E20=0,0,((D20/E20)*100)-100)) -> -14.68 | M20: =IF(G20=0,0,((D20/G20)*100)-100) -> -10.32 | N20: =IF(H20=0,0,((D20/H20)*100)-100) -> -9.15 | O20: =IF(D20=0,0,IF(I20=0,0,((D20/I20)*100)-100)) -> 34.14 | Q20: 1900000 | R20: =IF(D20=0,0,((D20/Q20)*100)-100) -> -15.04 | S20: =IF(D20=0,0,(D20/$D$34)*100) -> 2.78 | U20: 18.9 | V20: 19.43
A21: Maringa | C21: 2300000 | D21: 2281120 | E21: 2681869 | G21: 2332592 | H21: 2180025 | I21: 1566572 | K21: =IF(C21=0,0,((D21/C21)*100)-100) -> -00.82 | L21: =IF(D21=0,0,IF(E21=0,0,((D21/E21)*100)-100)) -> -14.94 | M21: =IF(G21=0,0,((D21/G21)*100)-100) -> -2.21 | N21: =IF(H21=0,0,((D21/H21)*100)-100) -> 4.64 | O21: =IF(D21=0,0,IF(I21=0,0,((D21/I21)*100)-100)) -> 45.61 | Q21: 2300000 | R21: =IF(D21=0,0,((D21/Q21)*100)-100) -> -00.82 | S21: =IF(D21=0,0,(D21/$D$34)*100) -> 3.93 | U21: 19.4 | V21: 19.35
A22: Araucaria Nova | C22: 2250000 | D22: 2107040 | E22: 2366594 | G22: 2110050 | H22: 1940028 | I22: 0 | K22: =IF(C22=0,0,((D22/C22)*100)-100) -> -6.35 | L22: =IF(D22=0,0,IF(E22=0,0,((D22/E22)*100)-100)) -> -10.97 | M22: =IF(G22=0,0,((D22/G22)*100)-100) -> -00.14 | N22: =IF(H22=0,0,((D22/H22)*100)-100) -> 8.61 | O22: =IF(D22=0,0,IF(I22=0,0,((D22/I22)*100)-100)) -> 0 | Q22: 2250000 | R22: =IF(D22=0,0,((D22/Q22)*100)-100) -> -6.35 | S22: =IF(D22=0,0,(D22/$D$34)*100) -> 3.63 | U22: 17.9 | V22: 19.06
A23: Total Super | C23: =SUM(C7:C22) -> 26525000 | D23: =SUM(D7:D22) -> 25375775 | E23: =SUM(E7:E22) -> 28746063 | G23: =SUM(G7:G22) -> 27124626 | H23: =SUM(H7:H22) -> 25974893 | I23: =SUM(I7:I22) -> 17387593 | J23: =SUM(C23:I23) -> 151133950 | K23: =IF(D23=0,0,((D23/C23)*100)-100) -> -4.33 | L23: =IF(D23=0,0,IF(E23=0,0,((D23/E23)*100)-100)) -> -11.72 | M23: =IF(G23=0,0,IF(D23=0,0,((D23/G23)*100)-100)) -> -6.45 | N23: =IF(H23=0,0,IF(D23=0,0,((D23/H23)*100)-100)) -> -2.31 | O23: =IF(D23=0,0,IF(I23=0,0,((D23/I23)*100)-100)) -> 45.94 | Q23: =SUM(Q7:Q22) -> 26525000 | R23: =IF(D23=0,0,((D23/Q23)*100)-100) -> -4.33 | S23: =IF(D23=0,0,(D23/$D$34)*100) -> 43.73 | U23: 16.41 | V23: 18.74
A25: Londrina | C25: 2700000 | D25: 2533777 | E25: 2967264 | G25: 2344414 | H25: 2255224 | I25: 1860444 | K25: =IF(C25=0,0,((D25/C25)*100)-100) -> -6.16 | L25: =IF(D25=0,0,IF(E25=0,0,((D25/E25)*100)-100)) -> -14.61 | M25: =IF(G25=0,0,((D25/G25)*100)-100) -> 8.08 | N25: =IF(H25=0,0,((D25/H25)*100)-100) -> 12.35 | O25: =IF(D25=0,0,IF(I25=0,0,((D25/I25)*100)-100)) -> 36.19 | Q25: 2700000 | R25: =IF(D25=0,0,IF(Q25=0,0,((D25/Q25)*100)-100)) -> -6.16 | S25: =IF(D25=0,0,(D25/$D$34)*100) -> 4.37 | U25: 17.4 | V25: 16.76
A26: S.J. Pinhais | C26: 4430000 | D26: 4606729 | E26: 4961922 | G26: 4259322 | H26: 3994726 | I26: 2963372 | K26: =IF(C26=0,0,((D26/C26)*100)-100) -> 3.99 | L26: =IF(D26=0,0,IF(E26=0,0,((D26/E26)*100)-100)) -> -7.16 | M26: =IF(G26=0,0,((D26/G26)*100)-100) -> 8.16 | N26: =IF(H26=0,0,((D26/H26)*100)-100) -> 15.32 | O26: =IF(D26=0,0,IF(I26=0,0,((D26/I26)*100)-100)) -> 55.46 | Q26: 4430000 | R26: =IF(D26=0,0,IF(Q26=0,0,((D26/Q26)*100)-100)) -> 3.99 | S26: =IF(D26=0,0,(D26/$D$34)*100) -> 7.94 | U26: 16.8 | V26: 17.4
A27: P.G. Nova | C27: 3500000 | D27: 3272393 | E27: 3807048 | G27: 3435618 | H27: 3068031 | I27: 2397847 | K27: =IF(C27=0,0,((D27/C27)*100)-100) -> -6.5 | L27: =IF(D27=0,0,IF(E27=0,0,((D27/E27)*100)-100)) -> -14.04 | M27: =IF(G27=0,0,((D27/G27)*100)-100) -> -4.75 | N27: =IF(H27=0,0,((D27/H27)*100)-100) -> 6.66 | O27: =IF(D27=0,0,IF(I27=0,0,((D27/I27)*100)-100)) -> 36.47 | Q27: 3500000 | R27: =IF(D27=0,0,IF(Q27=0,0,((D27/Q27)*100)-100)) -> -6.5 | S27: =IF(D27=0,0,(D27/$D$34)*100) -> 5.64 | U27: 16.5 | V27: 17.83
A28: Nilo Pecanha | C28: 8600000 | D28: 8733216 | E28: 9128123 | G28: 7829163 | H28: 8042823 | I28: 5723909 | K28: =IF(C28=0,0,((D28/C28)*100)-100) -> 1.55 | L28: =IF(D28=0,0,IF(E28=0,0,((D28/E28)*100)-100)) -> -4.33 | M28: =IF(G28=0,0,((D28/G28)*100)-100) -> 11.55 | N28: =IF(H28=0,0,((D28/H28)*100)-100) -> 8.58 | O28: =IF(D28=0,0,IF(I28=0,0,((D28/I28)*100)-100)) -> 52.57 | Q28: 8600000 | R28: =IF(D28=0,0,IF(Q28=0,0,((D28/Q28)*100)-100)) -> 1.55 | S28: =IF(D28=0,0,(D28/$D$34)*100) -> 15.05 | U28: 16.55 | V28: 18.03
A29: Champagnat | C29: 5800000 | D29: 5557542 | E29: 5821017 | G29: 5507896 | H29: 0 | I29: 0 | K29: =IF(C29=0,0,((D29/C29)*100)-100) -> -4.18 | L29: =IF(D29=0,0,IF(E29=0,0,((D29/E29)*100)-100)) -> -4.53 | M29: =IF(G29=0,0,((D29/G29)*100)-100) -> 00.9 | N29: =IF(H29=0,0,((D29/H29)*100)-100) -> 0 | O29: =IF(D29=0,0,IF(I29=0,0,((D29/I29)*100)-100)) -> 0 | Q29: 5800000 | R29: =IF(D29=0,0,IF(Q29=0,0,((D29/Q29)*100)-100)) -> -4.18 | S29: =IF(D29=0,0,(D29/$D$34)*100) -> 9.58 | U29: 16.6 | V29: 18.55
A30: Santa Candida | C30: 5500000 | D30: 4438133 | E30: 4983764 | G30: 0 | H30: 0 | I30: 0 | K30: =IF(C30=0,0,((D30/C30)*100)-100) -> -19.31 | L30: =IF(D30=0,0,IF(E30=0,0,((D30/E30)*100)-100)) -> -10.95 | M30: =IF(G30=0,0,((D30/G30)*100)-100) -> 0 | N30: =IF(H30=0,0,((D30/H30)*100)-100) -> 0 | O30: =IF(D30=0,0,IF(I30=0,0,((D30/I30)*100)-100)) -> 0 | Q30: 5500000 | R30: =IF(D30=0,0,IF(Q30=0,0,((D30/Q30)*100)-100)) -> -19.31 | S30: =IF(D30=0,0,(D30/$D$34)*100) -> 7.65 | U30: 15.5 | V30: 16.81
A31: Paranagu Raia | C31: 4900000 | D31: 3512808 | E31: 4771309 | G31: 0 | H31: 0 | I31: 0 | K31: =IF(C31=0,0,((D31/C31)*100)-100) -> -28.31 | L31: =IF(D31=0,0,IF(E31=0,0,((D31/E31)*100)-100)) -> -26.38 | M31: =IF(G31=0,0,((D31/G31)*100)-100) -> 0 | N31: =IF(H31=0,0,((D31/H31)*100)-100) -> 0 | O31: =IF(D31=0,0,IF(I31=0,0,((D31/I31)*100)-100)) -> 0 | Q31: 4900000 | R31: =IF(D31=0,0,IF(Q31=0,0,((D31/Q31)*100)-100)) -> -28.31 | S31: =IF(D31=0,0,(D31/$D$34)*100) -> 6.05 | U31: 13 | V31: 17.34
A32: Total Hiper | C32: =SUM(C25:C31) -> 35430000 | D32: =SUM(D25:D31) -> 32654598 | E32: =SUM(E25:E31) -> 36440447 | G32: =SUM(G25:G31) -> 23376413 | H32: =SUM(H25:H31) -> 17360804 | I32: =SUM(I25:I31) -> 12945572 | J32: =SUM(C32:I32) -> 158207834 | K32: =IF(D32=0,0,((D32/C32)*100)-100) -> -7.83 | L32: =IF(D32=0,0,IF(E32=0,0,((D32/E32)*100)-100)) -> -10.39 | M32: =IF(G32=0,0,IF(D32=0,0,((D32/G32)*100)-100)) -> 39.69 | N32: =IF(H32=0,0,IF(D32=0,0,((D32/H32)*100)-100)) -> 88.09 | O32: =IF(D32=0,0,IF(I32=0,0,((D32/I32)*100)-100)) -> 152.25 | Q32: =SUM(Q25:Q31) -> 35430000 | R32: =IF(D32=0,0,((D32/Q32)*100)-100) -> -7.83 | S32: =IF(D32=0,0,(D32/$D$34)*100) -> 56.27 | U32: 16.95 | V32: 17.67
A34: Total Geral | C34: =C23+C32 -> 61955000 | D34: =D23+D32 -> 58030373 | E34: =E23+E32 -> 65186510 | G34: =G23+G32 -> 50501039 | H34: =H23+H32 -> 43335697 | I34: =I23+I32 -> 30333165 | K34: =IF(D32=0,0,((D34/C34)*100)-100) -> -6.33 | L34: =IF(D34=0,0,IF(E34=0,0,((D34/E34)*100)-100)) -> -10.98 | M34: =IF(G34=0,0,IF(D34=0,0,((D34/G34)*100)-100)) -> 14.91 | N34: =IF(H34=0,0,IF(D34=0,0,((D34/H34)*100)-100)) -> 33.91 | O34: =IF(D34=0,0,IF(I34=0,0,((D34/I34)*100)-100)) -> 91.31 | Q34: =Q23+Q32 -> 61955000 | R34: =IF(D34=0,0,((D34/Q34)*100)-100) -> -6.33 | S34: =S23+S32 -> 100 | U34: 16.69 | V34: 18.14
C35: Resumo por Regiao - Outubro/2002
C36: Descricao das Aberturas | H36: Valor | I36: %
C37: Curitiba (2,3,6,7,10,11,17,21,22) | H37: =D7+D8+D11+D12+D14+D16+D19+D28+D29+D31 -> 29818491 | I37: =IF(D34=0,0,H37/$D$34) -> 0.51380000000000003
C38: Curitiba e Metrop. (Ctba. 4,5,8,14,23) | H38: =H37+D9+D10+D13+D27+D22 -> 39115536 | I38: =IF(D34=0,0,H38/$D$34) -> 0.67410000000000003
C39: Metropolitana (4,5,8,14,23) | H39: =H38-H37 -> 9297045 | I39: =IF(D34=0,0,H39/$D$34) -> 0.16020000000000001
C40: Norte (9,15,20) | H40: =D25+D18+D22 -> 6289915 | I40: =IF(D34=0,0,H40/$D$34) -> 0.1084
C41: Centro-Oeste (13,18,19) | H41: =D17+D20+D27 -> 6678373 | I41: =IF(D34=0,0,H41/$D$34) -> 0.11509999999999999
C42: Ponta Grossa (18,19) | H42: =H41-D17 -> 4886560 | I42: =IF(D34=0,0,H42/$D$34) -> 8.4199999999999997E-2
C43: Super (2,3,4,5,6,7,8,10,11,13,15,17,18,20,23) | H43: =D23 -> 25375775 | I43: =IF(D34=0,0,H43/$D$34) -> 0.43730000000000002
C44: Hiper (9,14,19,21,22,24) | H44: =D32 -> 32654598 | I44: =IF(D34=0,0,H44/$D$34) -> 0.56269999999999998
C45: Curitiba, Metropolitana e Centro-Oeste | H45: =D34-H40 -> 51740458 | I45: =IF(D34=0,0,H45/$D$34) -> 0.89159999999999995
C46: Araucaria | H46: =D10+D22 -> 3093405 | I46: =IF(D34=0,0,H46/$D$34) -> 5.33E-2