A2: Perodo: | C2: 37834 | E2: 37864 | H2: Vendas Acumuladas por Filial
C4: Vendas 2003 | G4: Vendas de Anos Anteriores | K4: Percentuais ( % ) | R4: %
A5: Lojas | C5: Previso | D5: Realizada | E5: Ms Anterior | G5: Vendas 2002 | H5: Vendas 2001 | I5: Vendas 2000 | K5: % Prev | L5: % MA | M5: 2002 | N5: 2001 | O5: 2000 | Q5: Previso Ms | R5: Final | S5: Part.
A7: Xaxim | C7: 800000 | D7: 748461.23 | E7: 745682.16 | G7: 566867.44 | H7: 556104.71 | I7: 513684.5 | K7: =IF(C7=0,0,((D7/C7)*100)-100) -> -6.44 | L7: =IF(E7=0,0,((D7/E7)*100)-100) -> 00.37 | M7: =IF(G7=0,0,((D7/G7)*100)-100) -> 32.03 | N7: =IF(H7=0,0,((D7/H7)*100)-100) -> 34.59 | O7: =IF(I7=0,0,((D7/I7)*100)-100) -> 45.7 | Q7: 800000 | R7: =((D7/Q7)*100)-100 -> -6.44 | S7: =D7/$D$31*100 -> 1.68
A8: S. Felicidade | C8: 850000 | D8: 788451.38 | E8: 750766.43 | G8: 586519.77 | H8: 571310.88 | I8: 567660.39 | K8: =IF(C8=0,0,((D8/C8)*100)-100) -> -7.24 | L8: =IF(E8=0,0,((D8/E8)*100)-100) -> 5.02 | M8: =IF(G8=0,0,((D8/G8)*100)-100) -> 34.43 | N8: =IF(H8=0,0,((D8/H8)*100)-100) -> 38.01 | O8: =IF(I8=0,0,((D8/I8)*100)-100) -> 38.89 | Q8: 850000 | R8: =((D8/Q8)*100)-100 -> -7.24 | S8: =D8/$D$31*100 -> 1.77
A9: Lapa | C9: 1200000 | D9: 1083326.01 | E9: 1060476.23 | G9: 892002.33 | H9: 731322.17 | I9: 621957.19 | K9: =IF(C9=0,0,((D9/C9)*100)-100) -> -9.72 | L9: =IF(E9=0,0,((D9/E9)*100)-100) -> 2.15 | M9: =IF(G9=0,0,((D9/G9)*100)-100) -> 21.45 | N9: =IF(H9=0,0,((D9/H9)*100)-100) -> 48.13 | O9: =IF(I9=0,0,((D9/I9)*100)-100) -> 74.18 | Q9: 1200000 | R9: =((D9/Q9)*100)-100 -> -9.72 | S9: =D9/$D$31*100 -> 2.43
A10: Araucria | C10: 1230000 | D10: 1038785.32 | E10: 1008677.08 | G10: 1984355.79 | H10: 1490355.25 | I10: 1321608.69 | K10: =IF(C10=0,0,((D10/C10)*100)-100) -> -15.55 | L10: =IF(E10=0,0,((D10/E10)*100)-100) -> 2.98 | M10: =IF(G10=0,0,((D10/G10)*100)-100) -> -47.65 | N10: =IF(H10=0,0,((D10/H10)*100)-100) -> -30.3 | O10: =IF(I10=0,0,((D10/I10)*100)-100) -> -21.4 | Q10: 1230000 | R10: =((D10/Q10)*100)-100 -> -15.55 | S10: =D10/$D$31*100 -> 2.33
A11: Pinheirinho | C11: 2050000 | D11: 1845777.71 | E11: 1866150.99 | G11: 1739398.77 | H11: 1700887.86 | I11: 1515514.38 | K11: =IF(C11=0,0,((D11/C11)*100)-100) -> -9.96 | L11: =IF(E11=0,0,((D11/E11)*100)-100) -> -1.09 | M11: =IF(G11=0,0,((D11/G11)*100)-100) -> 6.12 | N11: =IF(H11=0,0,((D11/H11)*100)-100) -> 8.52 | O11: =IF(I11=0,0,((D11/I11)*100)-100) -> 21.79 | Q11: 2050000 | R11: =((D11/Q11)*100)-100 -> -9.96 | S11: =D11/$D$31*100 -> 4.14
A12: Hauer | C12: 3200000 | D12: 3104644.25 | E12: 2918247.41 | G12: 2614496.05 | H12: 2294778.08 | I12: 2022270.55 | K12: =IF(C12=0,0,((D12/C12)*100)-100) -> -2.98 | L12: =IF(E12=0,0,((D12/E12)*100)-100) -> 6.39 | M12: =IF(G12=0,0,((D12/G12)*100)-100) -> 18.75 | N12: =IF(H12=0,0,((D12/H12)*100)-100) -> 35.29 | O12: =IF(I12=0,0,((D12/I12)*100)-100) -> 53.52 | Q12: 3200000 | R12: =((D12/Q12)*100)-100 -> -2.98 | S12: =D12/$D$31*100 -> 6.96
A13: Paranagu | C13: 3350000 | D13: 3184960.35 | E13: 3144865.27 | G13: 2865772.29 | H13: 2554490.35 | I13: 1808210.58 | K13: =IF(C13=0,0,((D13/C13)*100)-100) -> -4.93 | L13: =IF(E13=0,0,((D13/E13)*100)-100) -> 1.27 | M13: =IF(G13=0,0,((D13/G13)*100)-100) -> 11.14 | N13: =IF(H13=0,0,((D13/H13)*100)-100) -> 24.68 | O13: =IF(I13=0,0,((D13/I13)*100)-100) -> 76.14 | Q13: 3350000 | R13: =((D13/Q13)*100)-100 -> -4.93 | S13: =D13/$D$31*100 -> 7.14
A14: Centenrio | C14: 970000 | D14: 954057.59 | E14: 936046.91 | G14: 757981.57 | H14: 698903.26 | I14: 629972.04 | K14: =IF(C14=0,0,((D14/C14)*100)-100) -> -1.64 | L14: =IF(E14=0,0,((D14/E14)*100)-100) -> 1.92 | M14: =IF(G14=0,0,((D14/G14)*100)-100) -> 25.87 | N14: =IF(H14=0,0,((D14/H14)*100)-100) -> 36.51 | O14: =IF(I14=0,0,((D14/I14)*100)-100) -> 51.44 | Q14: 970000 | R14: =((D14/Q14)*100)-100 -> -1.64 | S14: =D14/$D$31*100 -> 2.14
A15: So Brz | C15: 3400000 | D15: 3259268.54 | E15: 3051671.2 | G15: 2627403.41 | H15: 2487530.52 | I15: 2126202 | K15: =IF(C15=0,0,((D15/C15)*100)-100) -> -4.14 | L15: =IF(E15=0,0,((D15/E15)*100)-100) -> 6.8 | M15: =IF(G15=0,0,((D15/G15)*100)-100) -> 24.05 | N15: =IF(H15=0,0,((D15/H15)*100)-100) -> 31.02 | O15: =IF(I15=0,0,((D15/I15)*100)-100) -> 53.29 | Q15: 3400000 | R15: =((D15/Q15)*100)-100 -> -4.14 | S15: =D15/$D$31*100 -> 7.31
A16: Arapongas | C16: 630000 | D16: 595417.74 | E16: 558280.6 | G16: 529456.89 | H16: 510516.13 | I16: 456102.22 | K16: =IF(C16=0,0,((D16/C16)*100)-100) -> -5.49 | L16: =IF(E16=0,0,((D16/E16)*100)-100) -> 6.65 | M16: =IF(G16=0,0,((D16/G16)*100)-100) -> 12.46 | N16: =IF(H16=0,0,((D16/H16)*100)-100) -> 16.63 | O16: =IF(I16=0,0,((D16/I16)*100)-100) -> 30.54 | Q16: 630000 | R16: =((D16/Q16)*100)-100 -> -5.49 | S16: =D16/$D$31*100 -> 1.34
A17: Guarapuava | C17: 1430000 | D17: 1308299.53 | E17: 1344526.41 | G17: 942176.78 | H17: 856947.56 | I17: 820960.58 | K17: =IF(C17=0,0,((D17/C17)*100)-100) -> -8.51 | L17: =IF(E17=0,0,((D17/E17)*100)-100) -> -2.69 | M17: =IF(G17=0,0,((D17/G17)*100)-100) -> 38.86 | N17: =IF(H17=0,0,((D17/H17)*100)-100) -> 52.67 | O17: =IF(I17=0,0,((D17/I17)*100)-100) -> 59.36 | Q17: 1430000 | R17: =((D17/Q17)*100)-100 -> -8.51 | S17: =D17/$D$31*100 -> 2.93
A18: Apucarana | C18: 1440000 | D18: 1407605.33 | E18: 1315361.42 | G18: 1269379.15 | H18: 1055718.94 | I18: 1171011.9 | K18: =IF(C18=0,0,((D18/C18)*100)-100) -> -2.25 | L18: =IF(E18=0,0,((D18/E18)*100)-100) -> 7.01 | M18: =IF(G18=0,0,((D18/G18)*100)-100) -> 10.89 | N18: =IF(H18=0,0,((D18/H18)*100)-100) -> 33.33 | O18: =IF(I18=0,0,((D18/I18)*100)-100) -> 20.2 | Q18: 1440000 | R18: =((D18/Q18)*100)-100 -> -2.25 | S18: =D18/$D$31*100 -> 3.16
A19: Ah | C19: 1400000 | D19: 1321358.24 | E19: 1293034.94 | G19: 1045982.59 | H19: 1187037.63 | I19: 1066112.05 | K19: =IF(C19=0,0,((D19/C19)*100)-100) -> -5.62 | L19: =IF(E19=0,0,((D19/E19)*100)-100) -> 2.19 | M19: =IF(G19=0,0,((D19/G19)*100)-100) -> 26.33 | N19: =IF(H19=0,0,((D19/H19)*100)-100) -> 11.32 | O19: =IF(I19=0,0,((D19/I19)*100)-100) -> 23.94 | Q19: 1400000 | R19: =((D19/Q19)*100)-100 -> -5.62 | S19: =D19/$D$31*100 -> 2.96
A20: P.G. Centro | C20: 1800000 | D20: 1667495.19 | E20: 1670408.89 | G20: 1394463.34 | H20: 1119820.72 | I20: 1269033.35 | K20: =IF(C20=0,0,((D20/C20)*100)-100) -> -7.36 | L20: =IF(E20=0,0,((D20/E20)*100)-100) -> -00.17 | M20: =IF(G20=0,0,((D20/G20)*100)-100) -> 19.58 | N20: =IF(H20=0,0,((D20/H20)*100)-100) -> 48.91 | O20: =IF(I20=0,0,((D20/I20)*100)-100) -> 31.4 | Q20: 1800000 | R20: =((D20/Q20)*100)-100 -> -7.36 | S20: =D20/$D$31*100 -> 3.74
A21: Maring | C21: 2240000 | D21: 2125876.06 | E21: 2044842.44 | G21: 1885013.32 | H21: 1734876.65 | I21: 1685260.76 | K21: =IF(C21=0,0,((D21/C21)*100)-100) -> -5.09 | L21: =IF(E21=0,0,((D21/E21)*100)-100) -> 3.96 | M21: =IF(G21=0,0,((D21/G21)*100)-100) -> 12.78 | N21: =IF(H21=0,0,((D21/H21)*100)-100) -> 22.54 | O21: =IF(I21=0,0,((D21/I21)*100)-100) -> 26.15 | Q21: 2240000 | R21: =((D21/Q21)*100)-100 -> -5.09 | S21: =D21/$D$31*100 -> 4.77
A22: Araucria Nova | C22: 2200000 | D22: 1999164 | E22: 1864700.54 | G22: 0 | H22: 0 | I22: 0 | K22: =IF(C22=0,0,((D22/C22)*100)-100) -> -9.13 | L22: =IF(E22=0,0,((D22/E22)*100)-100) -> 7.21 | M22: =IF(G22=0,0,((D22/G22)*100)-100) -> 0 | N22: =IF(H22=0,0,((D22/H22)*100)-100) -> 0 | O22: =IF(I22=0,0,((D22/I22)*100)-100) -> 0 | Q22: 2200000 | R22: =((D22/Q22)*100)-100 -> -9.13 | S22: =D22/$D$31*100 -> 4.48
A23: Total Super | C23: =SUM(C7:C22) -> 28190000 | D23: =SUM(D7:D22) -> 26432948.469999999 | E23: =SUM(E7:E22) -> 25573738.920000002 | G23: =SUM(G7:G22) -> 21701269.489999998 | H23: =SUM(H7:H22) -> 19550600.710000001 | I23: =SUM(I7:I22) -> 17595561.18 | J23: =SUM(C23:I23) -> 139044118.77000001 | K23: =((D23/C23)*100)-100 -> -6.23 | L23: =IF(E23=0,0,((D23/E23)*100)-100) -> 3.36 | M23: =((D23/G23)*100)-100 -> 21.8 | N23: =((D23/H23)*100)-100 -> 35.2 | O23: =IF(I23=0,0,((D23/I23)*100)-100) -> 50.23 | Q23: =SUM(Q7:Q22) -> 28190000 | R23: =((D23/Q23)*100)-100 -> -6.23 | S23: =D23/$D$31*100 -> 59.28
A25: Londrina | C25: 2500000 | D25: 2295834.75 | E25: 2280900.4 | G25: 2084843.6 | H25: 1849518.04 | I25: 2141595.02 | K25: =IF(C25=0,0,((D25/C25)*100)-100) -> -8.17 | L25: =IF(E25=0,0,((D25/E25)*100)-100) -> 00.65 | M25: =IF(G25=0,0,((D25/G25)*100)-100) -> 10.12 | N25: =IF(H25=0,0,((D25/H25)*100)-100) -> 24.13 | O25: =IF(I25=0,0,((D25/I25)*100)-100) -> 7.2 | Q25: 2500000 | R25: =((D25/Q25)*100)-100 -> -8.17 | S25: =D25/$D$31*100 -> 5.15
A26: S.J. Pinhais | C26: 4350000 | D26: 4216272.17 | E26: 4038347.37 | G26: 3475763.02 | H26: 2873632.61 | I26: 1804334.98 | K26: =IF(C26=0,0,((D26/C26)*100)-100) -> -3.07 | L26: =IF(E26=0,0,((D26/E26)*100)-100) -> 4.41 | M26: =IF(G26=0,0,((D26/G26)*100)-100) -> 21.3 | N26: =IF(H26=0,0,((D26/H26)*100)-100) -> 46.72 | O26: =IF(I26=0,0,((D26/I26)*100)-100) -> 133.67 | Q26: 4350000 | R26: =((D26/Q26)*100)-100 -> -3.07 | S26: =D26/$D$31*100 -> 9.46
A27: P.G. Nova | C27: 3320000 | D27: 3036783.89 | E27: 2860145.67 | G27: 2907395.77 | H27: 2212335.29 | I27: 1783396.33 | K27: =IF(C27=0,0,((D27/C27)*100)-100) -> -8.53 | L27: =IF(E27=0,0,((D27/E27)*100)-100) -> 6.18 | M27: =IF(G27=0,0,((D27/G27)*100)-100) -> 4.45 | N27: =IF(H27=0,0,((D27/H27)*100)-100) -> 37.27 | O27: =IF(I27=0,0,((D27/I27)*100)-100) -> 70.28 | Q27: 3320000 | R27: =((D27/Q27)*100)-100 -> -8.53 | S27: =D27/$D$31*100 -> 6.81
A28: Nilo Peanha | C28: 8990000 | D28: 8606903.0399999991 | E28: 8253285.0899999999 | G28: 6611968.4900000002 | H28: 0 | I28: 0 | K28: =IF(C28=0,0,((D28/C28)*100)-100) -> -4.26 | L28: =IF(E28=0,0,((D28/E28)*100)-100) -> 4.28 | M28: =IF(G28=0,0,((D28/G28)*100)-100) -> 30.17 | N28: =IF(H28=0,0,((D28/H28)*100)-100) -> 0 | O28: =IF(I28=0,0,((D28/I28)*100)-100) -> 0 | Q28: 8990000 | R28: =((D28/Q28)*100)-100 -> -4.26 | S28: =D28/$D$31*100 -> 19.3
A29: Total Hiper | C29: =SUM(C25:C28) -> 19160000 | D29: =SUM(D25:D28) -> 18155793.850000001 | E29: =SUM(E25:E28) -> 17432678.530000001 | G29: =SUM(G25:G28) -> 15079970.880000001 | H29: =SUM(H25:H28) -> 6935485.9400000004 | I29: =SUM(I25:I28) -> 5729326.3300000001 | J29: =SUM(C29:I29) -> 82493255.530000001 | K29: =((D29/C29)*100)-100 -> -5.24 | L29: =IF(E29=0,0,((D29/E29)*100)-100) -> 4.15 | M29: =((D29/G29)*100)-100 -> 20.4 | N29: =((D29/H29)*100)-100 -> 161.78 | O29: =IF(I29=0,0,((D29/I29)*100)-100) -> 216.89 | Q29: =SUM(Q25:Q28) -> 19160000 | R29: =((D29/Q29)*100)-100 -> -5.24 | S29: =D29/$D$31*100 -> 40.72
A31: Total Geral | C31: =C23+C29 -> 47350000 | D31: =D23+D29 -> 44588742.32 | E31: =E23+E29 -> 43006417.450000003 | G31: =G23+G29 -> 36781240.369999997 | H31: =H23+H29 -> 26486086.649999999 | I31: =I23+I29 -> 23324887.510000002 | K31: =((D31/C31)*100)-100 -> -5.83 | L31: =IF(E31=0,0,((D31/E31)*100)-100) -> 3.68 | M31: =((D31/G31)*100)-100 -> 21.23 | N31: =((D31/H31)*100)-100 -> 68.35 | O31: =IF(I31=0,0,((D31/I31)*100)-100) -> 91.16 | Q31: =Q23+Q29 -> 47350000 | R31: =((D31/Q31)*100)-100 -> -5.83 | S31: =S23+S29 -> 100
C32: Resumo por Regio - Outubro/2002
C33: Descrio das Aberturas | H33: Valor | I33: %
C34: Curitiba (2,3,6,7,10,11,17,21) | H34: =D7+D8+D11+D12+D14+D15+D19+D28 -> 20628922 | I34: =H34/$D$31 -> 0.46260000000000001
C35: Curitiba e Metrop. (Ctba. 4,5,8,14,23) | H35: =H34+D9+D10+D13+D27+D22 -> 30971942 | I35: =H35/$D$31 -> 0.6946
C36: Metropolitana (4,5,8,14,23) | H36: =H35-H34 -> 10343020 | I36: =H36/$D$31 -> 0.23200000000000001
C37: Norte (9,12,15,20) | H37: =D25+D16+D18+D22 -> 6298022 | I37: =H37/$D$31 -> 0.14119999999999999
C38: Centro-Oeste (13,18,19) | H38: =D17+D20+D27 -> 6012579 | I38: =H38/$D$31 -> 0.1348
C39: Ponta Grossa (18,19) | H39: =H38-D17 -> 4704279 | I39: =H39/$D$31 -> 0.1055
C40: Super (2,3,4,5,6,7,8,10,11,12,13,15,17,18,20,23) | H40: =D23 -> 26432948 | I40: =H40/$D$31 -> 0.59279999999999999
C41: Hiper (9,14,19,21) | H41: =D29 -> 18155794 | I41: =H41/$D$31 -> 0.40720000000000001
C42: Curitiba, Metropolitana e Centro-Oeste | H42: =D31-H37 -> 38290720 | I42: =H42/$D$31 -> 0.85880000000000001
C43: Araucria | H43: =D10+D22 -> 3037949 | I43: =H43/$D$31 -> 6.8099999999999994E-2