A2: Periodo: | C2: 39234 | D2: a | E2: 39263 | H2: Vendas Acumuladas por Filial | Q2: =NOW() -> 39279.604697569397
A4: v.1 | C4: Vendas 2007 | G4: Vendas de Anos Anteriores | K4: Percentuais ( % ) | Q4: Meta Mensal | U4: Margem
A5: Lojas | C5: Previsao | D5: Realizada | E5: Mes Anterior | G5: Vendas 2006 | H5: Vendas 2005 | I5: Vendas 2004 | K5: % Prev | L5: % MA | M5: 2006 | N5: 2005 | O5: 2004 | Q5: Previsao Mes | R5: Final | S5: Part. | U5: Meta | V5: Coml | W5: Dif
A7: Xaxim | C7: 760000 | D7: 787925 | E7: 774551 | G7: 644824 | H7: 739593 | I7: 717141 | K7: =IF(C7=0,0,((D7/C7)*100)-100) -> 3.67 | L7: =IF(D7=0,0,IF(E7=0,0,((D7/E7)*100)-100)) -> 1.73 | M7: =IF(G7=0,0,((D7/G7)*100)-100) -> 22.19 | N7: =IF(H7=0,0,((D7/H7)*100)-100) -> 6.53 | O7: =IF(D7=0,0,IF(I7=0,0,((D7/I7)*100)-100)) -> 9.87 | Q7: 760000 | R7: =IF(D7=0,0,((D7/Q7)*100)-100) -> 3.67 | S7: =IF(D7=0,0,(D7/$D$38)*100) -> 1.25 | U7: 17.5 | V7: 15.98 | W7: =V7-U7 -> -1.52
A8: S. Felicidade | C8: 810000 | D8: 1039475 | E8: 823956 | G8: 841856 | H8: 716033 | I8: 630404 | K8: =IF(C8=0,0,((D8/C8)*100)-100) -> 28.33 | L8: =IF(D8=0,0,IF(E8=0,0,((D8/E8)*100)-100)) -> 26.16 | M8: =IF(G8=0,0,((D8/G8)*100)-100) -> 23.47 | N8: =IF(H8=0,0,((D8/H8)*100)-100) -> 45.17 | O8: =IF(D8=0,0,IF(I8=0,0,((D8/I8)*100)-100)) -> 64.89 | Q8: 810000 | R8: =IF(D8=0,0,((D8/Q8)*100)-100) -> 28.33 | S8: =IF(D8=0,0,(D8/$D$38)*100) -> 1.65 | U8: 18.1 | V8: 15.98 | W8: =V8-U8 -> -2.12
A9: Lapa | C9: 1260000 | D9: 1354391 | E9: 1245869 | G9: 1006998 | H9: 1114880 | I9: 1051047 | K9: =IF(C9=0,0,((D9/C9)*100)-100) -> 7.49 | L9: =IF(D9=0,0,IF(E9=0,0,((D9/E9)*100)-100)) -> 8.71 | M9: =IF(G9=0,0,((D9/G9)*100)-100) -> 34.5 | N9: =IF(H9=0,0,((D9/H9)*100)-100) -> 21.48 | O9: =IF(D9=0,0,IF(I9=0,0,((D9/I9)*100)-100)) -> 28.86 | Q9: 1260000 | R9: =IF(D9=0,0,((D9/Q9)*100)-100) -> 7.49 | S9: =IF(D9=0,0,(D9/$D$38)*100) -> 2.15 | U9: 17.4 | V9: 14.51 | W9: =V9-U9 -> -2.89
A10: Araucaria | C10: 930000 | D10: 936030 | E10: 907534 | G10: 877033 | H10: 926628 | I10: 960060 | K10: =IF(C10=0,0,((D10/C10)*100)-100) -> 0.65 | L10: =IF(D10=0,0,IF(E10=0,0,((D10/E10)*100)-100)) -> 3.14 | M10: =IF(G10=0,0,((D10/G10)*100)-100) -> 6.73 | N10: =IF(H10=0,0,((D10/H10)*100)-100) -> 1.01 | O10: =IF(D10=0,0,IF(I10=0,0,((D10/I10)*100)-100)) -> -2.5 | Q10: 930000 | R10: =IF(D10=0,0,((D10/Q10)*100)-100) -> 0.65 | S10: =IF(D10=0,0,(D10/$D$38)*100) -> 1.48 | U10: 19 | V10: 16.99 | W10: =V10-U10 -> -2.01
A11: Pinheirinho | C11: 0 | D11: 0 | E11: 0 | G11: 0 | H11: 0 | I11: 0 | K11: =IF(C11=0,0,((D11/C11)*100)-100) -> 0 | L11: =IF(D11=0,0,IF(E11=0,0,((D11/E11)*100)-100)) -> 0 | M11: =IF(G11=0,0,((D11/G11)*100)-100) -> 0 | N11: =IF(H11=0,0,((D11/H11)*100)-100) -> 0 | O11: =IF(D11=0,0,IF(I11=0,0,((D11/I11)*100)-100)) -> 0 | Q11: 0 | R11: =IF(D11=0,0,((D11/Q11)*100)-100) -> 0 | S11: =IF(D11=0,0,(D11/$D$38)*100) -> 0 | U11: 0 | V11: 0 | W11: =V11-U11 -> 0
A12: Hauer | C12: 3012000 | D12: 2979642 | E12: 2948755 | G12: 2908178 | H12: 2907759 | I12: 2720835 | K12: =IF(C12=0,0,((D12/C12)*100)-100) -> -1.07 | L12: =IF(D12=0,0,IF(E12=0,0,((D12/E12)*100)-100)) -> 1.05 | M12: =IF(G12=0,0,((D12/G12)*100)-100) -> 2.46 | N12: =IF(H12=0,0,((D12/H12)*100)-100) -> 2.47 | O12: =IF(D12=0,0,IF(I12=0,0,((D12/I12)*100)-100)) -> 9.51 | Q12: 3012000 | R12: =IF(D12=0,0,((D12/Q12)*100)-100) -> -1.07 | S12: =IF(D12=0,0,(D12/$D$38)*100) -> 4.72 | U12: 18.3 | V12: 16.85 | W12: =V12-U12 -> -1.45
A13: Paranagua | C13: 1500000 | D13: 1544475 | E13: 1528828 | G13: 1413914 | H13: 1606019 | I13: 2989738 | K13: =IF(C13=0,0,((D13/C13)*100)-100) -> 2.96 | L13: =IF(D13=0,0,IF(E13=0,0,((D13/E13)*100)-100)) -> 1.02 | M13: =IF(G13=0,0,((D13/G13)*100)-100) -> 9.23 | N13: =IF(H13=0,0,((D13/H13)*100)-100) -> -3.83 | O13: =IF(D13=0,0,IF(I13=0,0,((D13/I13)*100)-100)) -> -48.34 | Q13: 1500000 | R13: =IF(D13=0,0,((D13/Q13)*100)-100) -> 2.96 | S13: =IF(D13=0,0,(D13/$D$38)*100) -> 2.45 | U13: 19.4 | V13: 18.91 | W13: =V13-U13 -> -0.49
A14: Centenario | C14: 935000 | D14: 963325 | E14: 934139 | G14: 882018 | H14: 934116 | I14: 814210 | K14: =IF(C14=0,0,((D14/C14)*100)-100) -> 3.03 | L14: =IF(D14=0,0,IF(E14=0,0,((D14/E14)*100)-100)) -> 3.12 | M14: =IF(G14=0,0,((D14/G14)*100)-100) -> 9.22 | N14: =IF(H14=0,0,((D14/H14)*100)-100) -> 3.13 | O14: =IF(D14=0,0,IF(I14=0,0,((D14/I14)*100)-100)) -> 18.31 | Q14: 935000 | R14: =IF(D14=0,0,((D14/Q14)*100)-100) -> 3.03 | S14: =IF(D14=0,0,(D14/$D$38)*100) -> 1.53 | U14: 18.32 | V14: 17.29 | W14: =V14-U14 -> -1.03
A15: Sao Braz | C15: 0 | D15: 0 | E15: 0 | G15: 0 | H15: 0 | I15: 0 | K15: =IF(C15=0,0,((D15/C15)*100)-100) -> 0 | L15: =IF(D15=0,0,IF(E15=0,0,((D15/E15)*100)-100)) -> 0 | M15: =IF(G15=0,0,((D15/G15)*100)-100) -> 0 | N15: =IF(H15=0,0,((D15/H15)*100)-100) -> 0 | O15: =IF(D15=0,0,IF(I15=0,0,((D15/I15)*100)-100)) -> 0 | Q15: 0 | R15: =IF(D15=0,0,((D15/Q15)*100)-100) -> 0 | S15: =IF(D15=0,0,(D15/$D$38)*100) -> 0 | U15: 0 | V15: 0 | W15: =V15-U15 -> 0
A16: Sitio Cercado | C16: 1319000 | D16: 1349409 | E16: 1263723 | G16: 1142549 | H16: 1162383 | I16: 1444058 | K16: =IF(C16=0,0,((D16/C16)*100)-100) -> 2.31 | L16: =IF(D16=0,0,IF(E16=0,0,((D16/E16)*100)-100)) -> 6.78 | M16: =IF(G16=0,0,((D16/G16)*100)-100) -> 18.11 | N16: =IF(H16=0,0,((D16/H16)*100)-100) -> 16.09 | O16: =IF(D16=0,0,IF(I16=0,0,((D16/I16)*100)-100)) -> -6.55 | Q16: 1319000 | R16: =IF(D16=0,0,((D16/Q16)*100)-100) -> 2.31 | S16: =IF(D16=0,0,(D16/$D$38)*100) -> 2.14 | U16: 17.66 | V16: 15.69 | W16: =V16-U16 -> -1.97
A17: Apucarana | C17: 2000000 | D17: 2225160 | E17: 2005186 | G17: 1597831 | H17: 1429338 | I17: 1336992 | K17: =IF(C17=0,0,((D17/C17)*100)-100) -> 11.26 | L17: =IF(D17=0,0,IF(E17=0,0,((D17/E17)*100)-100)) -> 10.97 | M17: =IF(G17=0,0,((D17/G17)*100)-100) -> 39.26 | N17: =IF(H17=0,0,((D17/H17)*100)-100) -> 55.68 | O17: =IF(D17=0,0,IF(I17=0,0,((D17/I17)*100)-100)) -> 66.43 | Q17: 2000000 | R17: =IF(D17=0,0,((D17/Q17)*100)-100) -> 11.26 | S17: =IF(D17=0,0,(D17/$D$38)*100) -> 3.53 | U17: 16.53 | V17: 14.32 | W17: =V17-U17 -> -2.21
A18: Ahu | C18: 1380000 | D18: 1388335 | E18: 1347490 | G18: 1126688 | H18: 1045089 | I18: 1013318 | K18: =IF(C18=0,0,((D18/C18)*100)-100) -> 0.6 | L18: =IF(D18=0,0,IF(E18=0,0,((D18/E18)*100)-100)) -> 3.03 | M18: =IF(G18=0,0,((D18/G18)*100)-100) -> 23.22 | N18: =IF(H18=0,0,((D18/H18)*100)-100) -> 32.84 | O18: =IF(D18=0,0,IF(I18=0,0,((D18/I18)*100)-100)) -> 37.01 | Q18: 1380000 | R18: =IF(D18=0,0,((D18/Q18)*100)-100) -> 0.6 | S18: =IF(D18=0,0,(D18/$D$38)*100) -> 2.2 | U18: 19.1 | V18: 16.92 | W18: =V18-U18 -> -2.18
A19: P.G. Centro | C19: 1585000 | D19: 1681251 | E19: 1695587 | G19: 1545040 | H19: 1617439 | I19: 1603418 | K19: =IF(C19=0,0,((D19/C19)*100)-100) -> 6.07 | L19: =IF(D19=0,0,IF(E19=0,0,((D19/E19)*100)-100)) -> -0.85 | M19: =IF(G19=0,0,((D19/G19)*100)-100) -> 8.82 | N19: =IF(H19=0,0,((D19/H19)*100)-100) -> 3.95 | O19: =IF(D19=0,0,IF(I19=0,0,((D19/I19)*100)-100)) -> 4.85 | Q19: 1585000 | R19: =IF(D19=0,0,((D19/Q19)*100)-100) -> 6.07 | S19: =IF(D19=0,0,(D19/$D$38)*100) -> 2.67 | U19: 20.1 | V19: 17.87 | W19: =V19-U19 -> -2.23
A20: Maringa | C20: 2387497 | D20: 2337245 | E20: 2314916 | G20: 2233127 | H20: 2156760 | I20: 2026575 | K20: =IF(C20=0,0,((D20/C20)*100)-100) -> -2.1 | L20: =IF(D20=0,0,IF(E20=0,0,((D20/E20)*100)-100)) -> 0.96 | M20: =IF(G20=0,0,((D20/G20)*100)-100) -> 4.66 | N20: =IF(H20=0,0,((D20/H20)*100)-100) -> 8.37 | O20: =IF(D20=0,0,IF(I20=0,0,((D20/I20)*100)-100)) -> 15.33 | Q20: 2387497 | R20: =IF(D20=0,0,((D20/Q20)*100)-100) -> -2.1 | S20: =IF(D20=0,0,(D20/$D$38)*100) -> 3.71 | U20: 19.19 | V20: 17.71 | W20: =V20-U20 -> -1.48
A21: Araucaria Nova | C21: 2090000 | D21: 2202561 | E21: 2062725 | G21: 1873018 | H21: 1928021 | I21: 1949037 | K21: =IF(C21=0,0,((D21/C21)*100)-100) -> 5.39 | L21: =IF(D21=0,0,IF(E21=0,0,((D21/E21)*100)-100)) -> 6.78 | M21: =IF(G21=0,0,((D21/G21)*100)-100) -> 17.59 | N21: =IF(H21=0,0,((D21/H21)*100)-100) -> 14.24 | O21: =IF(D21=0,0,IF(I21=0,0,((D21/I21)*100)-100)) -> 13.01 | Q21: 2090000 | R21: =IF(D21=0,0,((D21/Q21)*100)-100) -> 5.39 | S21: =IF(D21=0,0,(D21/$D$38)*100) -> 3.49 | U21: 18.9 | V21: 17.08 | W21: =V21-U21 -> -1.82
A22: Total Super | C22: =SUM(C7:C21) -> 19968497 | D22: =SUM(D7:D21) -> 20789224 | E22: =SUM(E7:E21) -> 19853259 | G22: =SUM(G7:G21) -> 18093074 | H22: =SUM(H7:H21) -> 18284058 | I22: =SUM(I7:I21) -> 19256833 | J22: =SUM(C22:I22) -> 116244945 | K22: =IF(D22=0,0,((D22/C22)*100)-100) -> 4.11 | L22: =IF(D22=0,0,IF(E22=0,0,((D22/E22)*100)-100)) -> 4.71 | M22: =IF(G22=0,0,IF(D22=0,0,((D22/G22)*100)-100)) -> 14.9 | N22: =IF(H22=0,0,IF(D22=0,0,((D22/H22)*100)-100)) -> 13.7 | O22: =IF(D22=0,0,IF(I22=0,0,((D22/I22)*100)-100)) -> 7.96 | Q22: =SUM(Q7:Q21) -> 19968497 | R22: =IF(D22=0,0,((D22/Q22)*100)-100) -> 4.11 | S22: =IF(D22=0,0,(D22/$D$38)*100) -> 32.96 | U22: 18.4 | V22: 16.74 | W22: =V22-U22 -> -1.66
A24: Pinheirinho | C24: 2880000 | D24: 3064538 | E24: 2927977 | G24: 2566516 | H24: 1805768 | I24: 1828470 | K24: =IF(C24=0,0,((D24/C24)*100)-100) -> 6.41 | L24: =IF(D24=0,0,IF(E24=0,0,((D24/E24)*100)-100)) -> 4.66 | M24: =IF(G24=0,0,((D24/G24)*100)-100) -> 19.4 | N24: =IF(H24=0,0,((D24/H24)*100)-100) -> 69.71 | O24: =IF(D24=0,0,IF(I24=0,0,((D24/I24)*100)-100)) -> 67.6 | Q24: 2880000 | R24: =IF(D24=0,0,IF(Q24=0,0,((D24/Q24)*100)-100)) -> 6.41 | S24: =IF(D24=0,0,(D24/$D$38)*100) -> 4.86 | U24: 17.8 | V24: 16.45 | W24: =V24-U24 -> -1.35
A25: Londrina | C25: 2915470 | D25: 2643314 | E25: 2510656 | G25: 2674747 | H25: 2490522 | I25: 2174739 | K25: =IF(C25=0,0,((D25/C25)*100)-100) -> -9.33 | L25: =IF(D25=0,0,IF(E25=0,0,((D25/E25)*100)-100)) -> 5.28 | M25: =IF(G25=0,0,((D25/G25)*100)-100) -> -1.18 | N25: =IF(H25=0,0,((D25/H25)*100)-100) -> 6.13 | O25: =IF(D25=0,0,IF(I25=0,0,((D25/I25)*100)-100)) -> 21.55 | Q25: 2915470 | R25: =IF(D25=0,0,IF(Q25=0,0,((D25/Q25)*100)-100)) -> -9.33 | S25: =IF(D25=0,0,(D25/$D$38)*100) -> 4.19 | U25: 16.97 | V25: 15.41 | W25: =V25-U25 -> -1.56
A26: So Brz | C26: 4480000 | D26: 4516721 | E26: 3060707 | G26: 2921765 | H26: 3058550 | I26: 2816856 | K26: =IF(C26=0,0,((D26/C26)*100)-100) -> 0.82 | L26: =IF(D26=0,0,IF(E26=0,0,((D26/E26)*100)-100)) -> 47.57 | M26: =IF(G26=0,0,((D26/G26)*100)-100) -> 54.59 | N26: =IF(H26=0,0,((D26/H26)*100)-100) -> 47.68 | O26: =IF(D26=0,0,IF(I26=0,0,((D26/I26)*100)-100)) -> 60.35 | Q26: 4480000 | R26: =IF(D26=0,0,IF(Q26=0,0,((D26/Q26)*100)-100)) -> 0.82 | S26: =IF(D26=0,0,(D26/$D$38)*100) -> 7.16 | U26: 17.84 | V26: 13.8 | W26: =V26-U26 -> -4.04
A27: S.J. Pinhais | C27: 4125000 | D27: 3991420 | E27: 3871884 | G27: 3844127 | H27: 3804231 | I27: 3950795 | K27: =IF(C27=0,0,((D27/C27)*100)-100) -> -3.24 | L27: =IF(D27=0,0,IF(E27=0,0,((D27/E27)*100)-100)) -> 3.09 | M27: =IF(G27=0,0,((D27/G27)*100)-100) -> 3.83 | N27: =IF(H27=0,0,((D27/H27)*100)-100) -> 4.92 | O27: =IF(D27=0,0,IF(I27=0,0,((D27/I27)*100)-100)) -> 1.03 | Q27: 4125000 | R27: =IF(D27=0,0,IF(Q27=0,0,((D27/Q27)*100)-100)) -> -3.24 | S27: =IF(D27=0,0,(D27/$D$38)*100) -> 6.33 | U27: 17.5 | V27: 16.68 | W27: =V27-U27 -> -0.82
A28: P.G. Nova | C28: 3600000 | D28: 3698979 | E28: 3614962 | G28: 3436033 | H28: 3235323 | I28: 3023353 | K28: =IF(C28=0,0,((D28/C28)*100)-100) -> 2.75 | L28: =IF(D28=0,0,IF(E28=0,0,((D28/E28)*100)-100)) -> 2.32 | M28: =IF(G28=0,0,((D28/G28)*100)-100) -> 7.65 | N28: =IF(H28=0,0,((D28/H28)*100)-100) -> 14.33 | O28: =IF(D28=0,0,IF(I28=0,0,((D28/I28)*100)-100)) -> 22.35 | Q28: 3600000 | R28: =IF(D28=0,0,IF(Q28=0,0,((D28/Q28)*100)-100)) -> 2.75 | S28: =IF(D28=0,0,(D28/$D$38)*100) -> 5.86 | U28: 18.3 | V28: 17.31 | W28: =V28-U28 -> -0.99
A29: Nilo Pecanha | C29: 9090000 | D29: 9101567 | E29: 9125972 | G29: 8779151 | H29: 8562033 | I29: 7815025 | K29: =IF(C29=0,0,((D29/C29)*100)-100) -> 0.13 | L29: =IF(D29=0,0,IF(E29=0,0,((D29/E29)*100)-100)) -> -0.27 | M29: =IF(G29=0,0,((D29/G29)*100)-100) -> 3.67 | N29: =IF(H29=0,0,((D29/H29)*100)-100) -> 6.3 | O29: =IF(D29=0,0,IF(I29=0,0,((D29/I29)*100)-100)) -> 16.46 | Q29: 9090000 | R29: =IF(D29=0,0,IF(Q29=0,0,((D29/Q29)*100)-100)) -> 0.13 | S29: =IF(D29=0,0,(D29/$D$38)*100) -> 14.43 | U29: 17.5 | V29: 17.5 | W29: =V29-U29 -> 0
A30: Champagnat | C30: 5600000 | D30: 5139378 | E30: 5435231 | G30: 5275736 | H30: 5475749 | I30: 4527364 | K30: =IF(C30=0,0,((D30/C30)*100)-100) -> -8.23 | L30: =IF(D30=0,0,IF(E30=0,0,((D30/E30)*100)-100)) -> -5.44 | M30: =IF(G30=0,0,((D30/G30)*100)-100) -> -2.58 | N30: =IF(H30=0,0,((D30/H30)*100)-100) -> -6.14 | O30: =IF(D30=0,0,IF(I30=0,0,((D30/I30)*100)-100)) -> 13.52 | Q30: 5600000 | R30: =IF(D30=0,0,IF(Q30=0,0,((D30/Q30)*100)-100)) -> -8.23 | S30: =IF(D30=0,0,(D30/$D$38)*100) -> 8.15 | U30: 18.5 | V30: 18.16 | W30: =V30-U30 -> -0.34
A31: Santa Candida | C31: 4250000 | D31: 4107367 | E31: 4034522 | G31: 3908014 | H31: 4118036 | I31: 0 | K31: =IF(C31=0,0,((D31/C31)*100)-100) -> -3.36 | L31: =IF(D31=0,0,IF(E31=0,0,((D31/E31)*100)-100)) -> 1.81 | M31: =IF(G31=0,0,((D31/G31)*100)-100) -> 5.1 | N31: =IF(H31=0,0,((D31/H31)*100)-100) -> -0.26 | O31: =IF(D31=0,0,IF(I31=0,0,((D31/I31)*100)-100)) -> 0 | Q31: 4250000 | R31: =IF(D31=0,0,IF(Q31=0,0,((D31/Q31)*100)-100)) -> -3.36 | S31: =IF(D31=0,0,(D31/$D$38)*100) -> 6.51 | U31: 18.7 | V31: 17.4 | W31: =V31-U31 -> -1.3
A32: Paranagu Raia | C32: 4490000 | D32: 4693325 | E32: 4566930 | G32: 4119756 | H32: 3567369 | I32: 0 | K32: =IF(C32=0,0,((D32/C32)*100)-100) -> 4.53 | L32: =IF(D32=0,0,IF(E32=0,0,((D32/E32)*100)-100)) -> 2.77 | M32: =IF(G32=0,0,((D32/G32)*100)-100) -> 13.92 | N32: =IF(H32=0,0,((D32/H32)*100)-100) -> 31.56 | O32: =IF(D32=0,0,IF(I32=0,0,((D32/I32)*100)-100)) -> 0 | Q32: 4490000 | R32: =IF(D32=0,0,IF(Q32=0,0,((D32/Q32)*100)-100)) -> 4.53 | S32: =IF(D32=0,0,(D32/$D$38)*100) -> 7.44 | U32: 18.2 | V32: 18.52 | W32: =V32-U32 -> 0.32
A33: Total Hiper | C33: =SUM(C24:C32) -> 41430470 | D33: =SUM(D24:D32) -> 40956609 | E33: =SUM(E24:E32) -> 39148841 | G33: =SUM(G24:G32) -> 37525845 | H33: =SUM(H24:H32) -> 36117581 | I33: =SUM(I24:I32) -> 26136602 | J33: =SUM(C33:I33) -> 221315948 | K33: =IF(D33=0,0,((D33/C33)*100)-100) -> -1.14 | L33: =IF(D33=0,0,IF(E33=0,0,((D33/E33)*100)-100)) -> 4.62 | M33: =IF(G33=0,0,IF(D33=0,0,((D33/G33)*100)-100)) -> 9.14 | N33: =IF(H33=0,0,IF(D33=0,0,((D33/H33)*100)-100)) -> 13.4 | O33: =IF(D33=0,0,IF(I33=0,0,((D33/I33)*100)-100)) -> 56.7 | Q33: =SUM(Q24:Q32) -> 41430470 | R33: =IF(D33=0,0,((D33/Q33)*100)-100) -> -1.14 | S33: =IF(D33=0,0,(D33/$D$38)*100) -> 64.93 | U33: 17.93 | V33: 16.97 | W33: =V33-U33 -> -0.96
A35: Cristo Rei | C35: 1350000 | D35: 1329696 | E35: 1334020 | G35: 0 | H35: 0 | I35: 0 | K35: =IF(C35=0,0,((D35/C35)*100)-100) -> -1.5 | L35: =IF(D35=0,0,IF(E35=0,0,((D35/E35)*100)-100)) -> -0.32 | M35: =IF(G35=0,0,((D35/G35)*100)-100) -> 0 | N35: =IF(H35=0,0,((D35/H35)*100)-100) -> 0 | O35: =IF(D35=0,0,IF(I35=0,0,((D35/I35)*100)-100)) -> 0 | Q35: 1350000 | R35: =IF(Q35=0,0,IF(D35=0,0,((D35/Q35)*100)-100)) -> -1.5 | S35: =IF(D35=0,0,(D35/$D$38)*100) -> 2.11 | U35: 19.22 | V35: 17.91 | W35: =V35-U35 -> -1.31
A36: Total Lojas Novas | C36: =SUM(C35) -> 1350000 | D36: =SUM(D35) -> 1329696 | E36: =SUM(E35) -> 1334020 | G36: =SUM(G35) -> 0 | H36: =SUM(H35) -> 0 | I36: =SUM(I35) -> 0 | K36: =IF(D36=0,0,((D36/C36)*100)-100) -> -1.5 | L36: =IF(D36=0,0,IF(E36=0,0,((D36/E36)*100)-100)) -> -0.32 | M36: =IF(G36=0,0,IF(D36=0,0,((D36/G36)*100)-100)) -> 0 | N36: =IF(H36=0,0,IF(D36=0,0,((D36/H36)*100)-100)) -> 0 | O36: =IF(D36=0,0,IF(I36=0,0,((D36/I36)*100)-100)) -> 0 | Q36: =SUM(Q35) -> 1350000 | R36: =IF(D36=0,0,((D36/Q36)*100)-100) -> -1.5 | S36: =IF(D36=0,0,(D36/$D$38)*100) -> 2.11 | U36: =U35 -> 19.22 | V36: =V35 -> 17.91 | W36: =V36-U36 -> -1.31
A38: Total Geral | C38: =C22+C33+C36 -> 62748967 | D38: =D22+D33+D36 -> 63075529 | E38: =E22+E33+E36 -> 60336120 | G38: =G22+G33+G36 -> 55618919 | H38: =H22+H33+H36 -> 54401639 | I38: =I22+I33+I36 -> 45393435 | K38: =IF(D38=0,0,((D38/C38)*100)-100) -> 0.52 | L38: =IF(D38=0,0,IF(E38=0,0,((D38/E38)*100)-100)) -> 4.54 | M38: =IF(G38=0,0,IF(D38=0,0,((D38/G38)*100)-100)) -> 13.41 | N38: =IF(H38=0,0,IF(D38=0,0,((D38/H38)*100)-100)) -> 15.94 | O38: =IF(D38=0,0,IF(I38=0,0,((D38/I38)*100)-100)) -> 38.95 | Q38: =Q22+Q33+Q36 -> 62748967 | R38: =IF(D38=0,0,((D38/Q38)*100)-100) -> 0.52 | S38: =S22+S33+S36 -> 100 | U38: 18.13 | V38: 16.89 | W38: =V38-U38 -> -1.24
C39: Resumo por Regiao - Outubro/2002
C40: Descricao das Aberturas | H40: Valor | I40: % | M40: Margem Comercial | R40: Meta | S40: Real | U40: Dif
C41: Curitiba (2,3,6,7,10,11,13,17,21,22) | H41: =D7+D8+D11+D12+D14+D15+D16+D18+D29+D30+D31+D24+D35 -> 31250657 | I41: =IF(D38=0,0,H41/$D$38) -> 0.49540000000000001 | L41: 99 | M41: Empresa | R41: 18.13 | S41: 16.89 | U41: =S41-R41 -> -1.24
C42: Curitiba e Metrop. (Ctba. 4,5,8,13,14,23) | H42: =H41+D9+D10+D13+D27+D21+D32 -> 45972859 | I42: =IF(D38=0,0,H42/$D$38) -> 0.72889999999999999 | L42: 207 | M42: Super | R42: 18.4 | S42: 16.74 | U42: =S42-R42 -> -1.66
C43: Metropolitana (4,5,8,14,23) | H43: =H42-H41 -> 14722202 | I43: =IF(D38=0,0,H43/$D$38) -> 0.2334 | L43: 208 | M43: Hiper | R43: 17.93 | S43: 16.97 | U43: =S43-R43 -> -0.96
C44: Norte (9,15,20) | H44: =D25+D17+D20 -> 7205719 | I44: =IF(D38=0,0,H44/$D$38) -> 0.1142 | L44: 204 | M44: Regional Gilberto | R44: 18.44 | S44: 16.66 | U44: =S44-R44 -> -1.78
C45: Ponta Grossa (18,19) | H45: =D19+D28 -> 5380230 | I45: =IF(D38=0,0,H45/$D$38) -> 8.5300000000000001E-2 | L45: 205 | M45: Regional Edison | R45: 17.94 | S45: 16.97 | U45: =S45-R45 -> -0.97
C46: Super (2,3,4,5,6,7,8,10,13,15,17,18,20,23,28) | H46: =D22+D35 -> 22118920 | I46: =IF(D38=0,0,H46/$D$38) -> 0.35070000000000001 | L46: 200 | M46: Regio - Curitiba | R46: 18.1 | S46: 16.81 | U46: =S46-R46 -> -1.29
C47: Hiper (6,9,11,14,19,21,22,24) | H47: =D33 -> 40956609 | I47: =IF(D38=0,0,H47/$D$38) -> 0.64929999999999999 | L47: 201 | M47: Regio - Metropolitana | R47: 18.21 | S47: 17.38 | U47: =S47-R47 -> -0.83
C48: Curitiba, Metropolitana e Ponta Grossa | H48: =D38-H44 -> 55869810 | I48: =IF(D38=0,0,H48/$D$38) -> 0.88580000000000003 | L48: 202 | M48: Regio - Centro Oeste | R48: 18.85 | S48: 17.48 | U48: =S48-R48 -> -1.37
C49: Araucaria | H49: =D10+D21 -> 3138591 | I49: =IF(D38=0,0,H49/$D$38) -> 4.9799999999999997E-2 | L49: 203 | M49: Regio - Norte | R49: 17.58 | S49: 15.82 | U49: =S49-R49 -> -1.76