A2: Perodo: | C2: 38047 | E2: 38077 | H2: Vendas Acumuladas por Filial | Q2: =NOW() -> 38188.613402199102
A4: v.1 | C4: Vendas 2004 | G4: Vendas de Anos Anteriores | K4: Percentuais ( % ) | Q4: Meta Mensal | U4: Margem
A5: Lojas | C5: Previso | D5: Realizada | E5: Ms Anterior | G5: Vendas 2003 | H5: Vendas 2002 | I5: Vendas 2001 | K5: % Prev | L5: % MA | M5: 2003 | N5: 2002 | O5: 2001 | Q5: Previso Ms | R5: Final | S5: Part. | U5: Meta | V5: Real
A7: Xaxim | C7: 740000 | D7: 726814 | E7: 774480 | G7: 669625 | H7: 621376 | I7: 529565 | K7: =IF(C7=0,0,((D7/C7)*100)-100) -> -1.78 | L7: =IF(D7=0,0,IF(E7=0,0,((D7/E7)*100)-100)) -> -6.15 | M7: =IF(G7=0,0,((D7/G7)*100)-100) -> 8.54 | N7: =IF(H7=0,0,((D7/H7)*100)-100) -> 16.97 | O7: =IF(D7=0,0,IF(I7=0,0,((D7/I7)*100)-100)) -> 37.25 | Q7: 740000 | R7: =IF(D7=0,0,((D7/Q7)*100)-100) -> -1.78 | S7: =IF(D7=0,0,(D7/$D$32)*100) -> 1.64 | U7: 16.45 | V7: 16.04
A8: S. Felicidade | C8: 760000 | D8: 662420 | E8: 691981 | G8: 714359 | H8: 597986 | I8: 578265 | K8: =IF(C8=0,0,((D8/C8)*100)-100) -> -12.84 | L8: =IF(D8=0,0,IF(E8=0,0,((D8/E8)*100)-100)) -> -4.27 | M8: =IF(G8=0,0,((D8/G8)*100)-100) -> -7.27 | N8: =IF(H8=0,0,((D8/H8)*100)-100) -> 10.78 | O8: =IF(D8=0,0,IF(I8=0,0,((D8/I8)*100)-100)) -> 14.55 | Q8: 760000 | R8: =IF(D8=0,0,((D8/Q8)*100)-100) -> -12.84 | S8: =IF(D8=0,0,(D8/$D$32)*100) -> 1.49 | U8: 17.1 | V8: 17.26
A9: Lapa | C9: 1107000 | D9: 1087978 | E9: 1067570 | G9: 1012412 | H9: 981302 | I9: 706450 | K9: =IF(C9=0,0,((D9/C9)*100)-100) -> -1.72 | L9: =IF(D9=0,0,IF(E9=0,0,((D9/E9)*100)-100)) -> 1.91 | M9: =IF(G9=0,0,((D9/G9)*100)-100) -> 7.46 | N9: =IF(H9=0,0,((D9/H9)*100)-100) -> 10.87 | O9: =IF(D9=0,0,IF(I9=0,0,((D9/I9)*100)-100)) -> 54.01 | Q9: 1107000 | R9: =IF(D9=0,0,((D9/Q9)*100)-100) -> -1.72 | S9: =IF(D9=0,0,(D9/$D$32)*100) -> 2.45 | U9: 16.05 | V9: 15.66
A10: Araucria | C10: 1192000 | D10: 955077 | E10: 883203 | G10: 1086755 | H10: 1697512 | I10: 1438397 | K10: =IF(C10=0,0,((D10/C10)*100)-100) -> -19.88 | L10: =IF(D10=0,0,IF(E10=0,0,((D10/E10)*100)-100)) -> 8.14 | M10: =IF(G10=0,0,((D10/G10)*100)-100) -> -12.12 | N10: =IF(H10=0,0,((D10/H10)*100)-100) -> -43.74 | O10: =IF(D10=0,0,IF(I10=0,0,((D10/I10)*100)-100)) -> -33.6 | Q10: 1192000 | R10: =IF(D10=0,0,((D10/Q10)*100)-100) -> -19.88 | S10: =IF(D10=0,0,(D10/$D$32)*100) -> 2.15 | U10: 17.19 | V10: 16.56
A11: Pinheirinho | C11: 2260000 | D11: 1878353 | E11: 1941937 | G11: 1884252 | H11: 1932772 | I11: 1593904 | K11: =IF(C11=0,0,((D11/C11)*100)-100) -> -16.89 | L11: =IF(D11=0,0,IF(E11=0,0,((D11/E11)*100)-100)) -> -3.27 | M11: =IF(G11=0,0,((D11/G11)*100)-100) -> -00.31 | N11: =IF(H11=0,0,((D11/H11)*100)-100) -> -2.82 | O11: =IF(D11=0,0,IF(I11=0,0,((D11/I11)*100)-100)) -> 17.85 | Q11: 2260000 | R11: =IF(D11=0,0,((D11/Q11)*100)-100) -> -16.89 | S11: =IF(D11=0,0,(D11/$D$32)*100) -> 4.23 | U11: 16.3 | V11: 15.61
A12: Hauer | C12: 3200000 | D12: 2747488 | E12: 2814495 | G12: 2896663 | H12: 2623209 | I12: 2179786 | K12: =IF(C12=0,0,((D12/C12)*100)-100) -> -14.14 | L12: =IF(D12=0,0,IF(E12=0,0,((D12/E12)*100)-100)) -> -2.38 | M12: =IF(G12=0,0,((D12/G12)*100)-100) -> -5.15 | N12: =IF(H12=0,0,((D12/H12)*100)-100) -> 4.74 | O12: =IF(D12=0,0,IF(I12=0,0,((D12/I12)*100)-100)) -> 26.04 | Q12: 3200000 | R12: =IF(D12=0,0,((D12/Q12)*100)-100) -> -14.14 | S12: =IF(D12=0,0,(D12/$D$32)*100) -> 6.18 | U12: 16.1 | V12: 16.71
A13: Paranagu | C13: 3374000 | D13: 3201285 | E13: 2922947 | G13: 3046003 | H13: 2816004 | I13: 2218846 | K13: =IF(C13=0,0,((D13/C13)*100)-100) -> -5.12 | L13: =IF(D13=0,0,IF(E13=0,0,((D13/E13)*100)-100)) -> 9.52 | M13: =IF(G13=0,0,((D13/G13)*100)-100) -> 5.1 | N13: =IF(H13=0,0,((D13/H13)*100)-100) -> 13.68 | O13: =IF(D13=0,0,IF(I13=0,0,((D13/I13)*100)-100)) -> 44.28 | Q13: 3374000 | R13: =IF(D13=0,0,((D13/Q13)*100)-100) -> -5.12 | S13: =IF(D13=0,0,(D13/$D$32)*100) -> 7.21 | U13: 17.3 | V13: 17.43
A14: Centenrio | C14: 970000 | D14: 846451 | E14: 893141 | G14: 878606 | H14: 792518 | I14: 658358 | K14: =IF(C14=0,0,((D14/C14)*100)-100) -> -12.74 | L14: =IF(D14=0,0,IF(E14=0,0,((D14/E14)*100)-100)) -> -5.23 | M14: =IF(G14=0,0,((D14/G14)*100)-100) -> -3.66 | N14: =IF(H14=0,0,((D14/H14)*100)-100) -> 6.81 | O14: =IF(D14=0,0,IF(I14=0,0,((D14/I14)*100)-100)) -> 28.57 | Q14: 970000 | R14: =IF(D14=0,0,((D14/Q14)*100)-100) -> -12.74 | S14: =IF(D14=0,0,(D14/$D$32)*100) -> 1.91 | U14: 16.85 | V14: 16.11
A15: Arapongas | C15: 0 | D15: 0 | E15: 0 | G15: 610257 | H15: 597254 | I15: 588532 | K15: =IF(C15=0,0,((D15/C15)*100)-100) -> 0 | L15: =IF(D15=0,0,IF(E15=0,0,((D15/E15)*100)-100)) -> 0 | M15: =IF(D15=0,0,IF(G15=0,0,((D15/G15)*100)-100)) -> 0 | N15: =IF(D15=0,0,IF(H15=0,0,((D15/H15)*100)-100)) -> 0 | O15: =IF(D15=0,0,IF(I15=0,0,((D15/I15)*100)-100)) -> 0 | Q15: 0 | R15: =IF(D15=0,0,((D15/Q15)*100)-100) -> 0 | S15: =IF(D15=0,0,(D15/$D$32)*100) -> 0 | U15: 0 | V15: 0
A16: So Brz | C16: 3347000 | D16: 2909061 | E16: 3020628 | G16: 3063453 | H16: 2766547 | I16: 2438048 | K16: =IF(C16=0,0,((D16/C16)*100)-100) -> -13.08 | L16: =IF(D16=0,0,IF(E16=0,0,((D16/E16)*100)-100)) -> -3.69 | M16: =IF(G16=0,0,((D16/G16)*100)-100) -> -5.04 | N16: =IF(H16=0,0,((D16/H16)*100)-100) -> 5.15 | O16: =IF(D16=0,0,IF(I16=0,0,((D16/I16)*100)-100)) -> 19.32 | Q16: 3347000 | R16: =IF(D16=0,0,((D16/Q16)*100)-100) -> -13.08 | S16: =IF(D16=0,0,(D16/$D$32)*100) -> 6.55 | U16: 16 | V16: 16.09
A17: Guarapuava | C17: 1390000 | D17: 1548924 | E17: 1489523 | G17: 1333408 | H17: 954191 | I17: 913141 | K17: =IF(C17=0,0,((D17/C17)*100)-100) -> 11.43 | L17: =IF(D17=0,0,IF(E17=0,0,((D17/E17)*100)-100)) -> 3.99 | M17: =IF(G17=0,0,((D17/G17)*100)-100) -> 16.16 | N17: =IF(H17=0,0,((D17/H17)*100)-100) -> 62.33 | O17: =IF(D17=0,0,IF(I17=0,0,((D17/I17)*100)-100)) -> 69.63 | Q17: 1390000 | R17: =IF(D17=0,0,((D17/Q17)*100)-100) -> 11.43 | S17: =IF(D17=0,0,(D17/$D$32)*100) -> 3.49 | U17: 17.8 | V17: 16.75
A18: Apucarana | C18: 1525000 | D18: 1473884 | E18: 1284382 | G18: 1395490 | H18: 1437347 | I18: 1257487 | K18: =IF(C18=0,0,((D18/C18)*100)-100) -> -3.35 | L18: =IF(D18=0,0,IF(E18=0,0,((D18/E18)*100)-100)) -> 14.75 | M18: =IF(G18=0,0,((D18/G18)*100)-100) -> 5.62 | N18: =IF(H18=0,0,((D18/H18)*100)-100) -> 2.54 | O18: =IF(D18=0,0,IF(I18=0,0,((D18/I18)*100)-100)) -> 17.21 | Q18: 1525000 | R18: =IF(D18=0,0,((D18/Q18)*100)-100) -> -3.35 | S18: =IF(D18=0,0,(D18/$D$32)*100) -> 3.32 | U18: 17.1 | V18: 17.16
A19: Ah | C19: 1335000 | D19: 1068945 | E19: 1086790 | G19: 1235424 | H19: 1321169 | I19: 1178508 | K19: =IF(C19=0,0,((D19/C19)*100)-100) -> -19.93 | L19: =IF(D19=0,0,IF(E19=0,0,((D19/E19)*100)-100)) -> -1.64 | M19: =IF(G19=0,0,((D19/G19)*100)-100) -> -13.48 | N19: =IF(H19=0,0,((D19/H19)*100)-100) -> -19.09 | O19: =IF(D19=0,0,IF(I19=0,0,((D19/I19)*100)-100)) -> -9.3 | Q19: 1335000 | R19: =IF(D19=0,0,((D19/Q19)*100)-100) -> -19.93 | S19: =IF(D19=0,0,(D19/$D$32)*100) -> 2.41 | U19: 17.3 | V19: 16.95
A20: P.G. Centro | C20: 1730000 | D20: 1688433 | E20: 1559531 | G20: 1566980 | H20: 1393625 | I20: 1280804 | K20: =IF(C20=0,0,((D20/C20)*100)-100) -> -2.4 | L20: =IF(D20=0,0,IF(E20=0,0,((D20/E20)*100)-100)) -> 8.27 | M20: =IF(G20=0,0,((D20/G20)*100)-100) -> 7.75 | N20: =IF(H20=0,0,((D20/H20)*100)-100) -> 21.15 | O20: =IF(D20=0,0,IF(I20=0,0,((D20/I20)*100)-100)) -> 31.83 | Q20: 1730000 | R20: =IF(D20=0,0,((D20/Q20)*100)-100) -> -2.4 | S20: =IF(D20=0,0,(D20/$D$32)*100) -> 3.8 | U20: 17.2 | V20: 18.02
A21: Maring | C21: 2290000 | D21: 2096430 | E21: 1868747 | G21: 2075741 | H21: 1974460 | I21: 1806805 | K21: =IF(C21=0,0,((D21/C21)*100)-100) -> -8.45 | L21: =IF(D21=0,0,IF(E21=0,0,((D21/E21)*100)-100)) -> 12.18 | M21: =IF(G21=0,0,((D21/G21)*100)-100) -> 1 | N21: =IF(H21=0,0,((D21/H21)*100)-100) -> 6.18 | O21: =IF(D21=0,0,IF(I21=0,0,((D21/I21)*100)-100)) -> 16.03 | Q21: 2290000 | R21: =IF(D21=0,0,((D21/Q21)*100)-100) -> -8.45 | S21: =IF(D21=0,0,(D21/$D$32)*100) -> 4.72 | U21: 17.2 | V21: 17.48
A22: Araucria Nova | C22: 2100000 | D22: 1932605 | E22: 1884823 | G22: 2057036 | H22: 0 | I22: 0 | K22: =IF(C22=0,0,((D22/C22)*100)-100) -> -7.97 | L22: =IF(D22=0,0,IF(E22=0,0,((D22/E22)*100)-100)) -> 2.54 | M22: =IF(G22=0,0,((D22/G22)*100)-100) -> -6.05 | N22: =IF(H22=0,0,((D22/H22)*100)-100) -> 0 | O22: =IF(D22=0,0,IF(I22=0,0,((D22/I22)*100)-100)) -> 0 | Q22: 2100000 | R22: =IF(D22=0,0,((D22/Q22)*100)-100) -> -7.97 | S22: =IF(D22=0,0,(D22/$D$32)*100) -> 4.35 | U22: 17.2 | V22: 16.84
A23: Total Super | C23: =SUM(C7:C22) -> 27320000 | D23: =SUM(D7:D22) -> 24824148 | E23: =SUM(E7:E22) -> 24184178 | G23: =SUM(G7:G22) -> 25526464 | H23: =SUM(H7:H22) -> 22507272 | I23: =SUM(I7:I22) -> 19366896 | J23: =SUM(C23:I23) -> 143728958 | K23: =IF(D23=0,0,((D23/C23)*100)-100) -> -9.14 | L23: =IF(D23=0,0,IF(E23=0,0,((D23/E23)*100)-100)) -> 2.65 | M23: =IF(G23=0,0,IF(D23=0,0,((D23/G23)*100)-100)) -> -2.75 | N23: =IF(H23=0,0,IF(D23=0,0,((D23/H23)*100)-100)) -> 10.29 | O23: =IF(D23=0,0,IF(I23=0,0,((D23/I23)*100)-100)) -> 28.18 | Q23: =SUM(Q7:Q22) -> 27320000 | R23: =IF(D23=0,0,((D23/Q23)*100)-100) -> -9.14 | S23: =IF(D23=0,0,(D23/$D$32)*100) -> 55.88 | U23: 16.91 | V23: 16.55
A25: Londrina | C25: 2414000 | D25: 2125125 | E25: 2080991 | G25: 2176502 | H25: 2143932 | I25: 2096263 | K25: =IF(C25=0,0,((D25/C25)*100)-100) -> -11.97 | L25: =IF(D25=0,0,IF(E25=0,0,((D25/E25)*100)-100)) -> 2.12 | M25: =IF(G25=0,0,((D25/G25)*100)-100) -> -2.36 | N25: =IF(H25=0,0,((D25/H25)*100)-100) -> -00.88 | O25: =IF(D25=0,0,IF(I25=0,0,((D25/I25)*100)-100)) -> 1.38 | Q25: 2414000 | R25: =IF(D25=0,0,((D25/Q25)*100)-100) -> -11.97 | S25: =IF(D25=0,0,(D25/$D$32)*100) -> 4.78 | U25: 17.7 | V25: 15.94
A26: S.J. Pinhais | C26: 4390000 | D26: 3967363 | E26: 3988876 | G26: 4062990 | H26: 3619457 | I26: 2667881 | K26: =IF(C26=0,0,((D26/C26)*100)-100) -> -9.63 | L26: =IF(D26=0,0,IF(E26=0,0,((D26/E26)*100)-100)) -> -00.54 | M26: =IF(G26=0,0,((D26/G26)*100)-100) -> -2.35 | N26: =IF(H26=0,0,((D26/H26)*100)-100) -> 9.61 | O26: =IF(D26=0,0,IF(I26=0,0,((D26/I26)*100)-100)) -> 48.71 | Q26: 4390000 | R26: =IF(D25=0,0,((D26/Q26)*100)-100) -> -9.63 | S26: =IF(D26=0,0,(D26/$D$32)*100) -> 8.93 | U26: 16.35 | V26: 15.87
A27: P.G. Nova | C27: 3347000 | D27: 3046593 | E27: 2984840 | G27: 3017129 | H27: 2910297 | I27: 2447400 | K27: =IF(C27=0,0,((D27/C27)*100)-100) -> -8.98 | L27: =IF(D27=0,0,IF(E27=0,0,((D27/E27)*100)-100)) -> 2.07 | M27: =IF(G27=0,0,((D27/G27)*100)-100) -> 00.98 | N27: =IF(H27=0,0,((D27/H27)*100)-100) -> 4.68 | O27: =IF(D27=0,0,IF(I27=0,0,((D27/I27)*100)-100)) -> 24.48 | Q27: 3347000 | R27: =IF(D26=0,0,((D27/Q27)*100)-100) -> -8.98 | S27: =IF(D27=0,0,(D27/$D$32)*100) -> 6.86 | U27: 16.4 | V27: 15.93
A28: Nilo Peanha | C28: 8809000 | D28: 8101747 | E28: 7975512 | G28: 8022240 | H28: 3752768 | I28: 0 | K28: =IF(C28=0,0,((D28/C28)*100)-100) -> -8.03 | L28: =IF(D28=0,0,IF(E28=0,0,((D28/E28)*100)-100)) -> 1.58 | M28: =IF(G28=0,0,((D28/G28)*100)-100) -> 00.99 | N28: =IF(H28=0,0,((D28/H28)*100)-100) -> 115.89 | O28: =IF(D28=0,0,IF(I28=0,0,((D28/I28)*100)-100)) -> 0 | Q28: 8809000 | R28: =IF(D26=0,0,((D28/Q28)*100)-100) -> -8.03 | S28: =IF(D28=0,0,(D28/$D$32)*100) -> 18.24 | U28: 15.1 | V28: 15.18
A29: Champagnat | C29: 2359955 | D29: 2359955 | E29: 0 | G29: 0 | H29: 0 | I29: 0 | K29: =IF(C29=0,0,((D29/C29)*100)-100) -> 0 | L29: =IF(D29=0,0,IF(E29=0,0,((D29/E29)*100)-100)) -> 0 | M29: =IF(G29=0,0,((D29/G29)*100)-100) -> 0 | N29: =IF(H29=0,0,((D29/H29)*100)-100) -> 0 | O29: =IF(D29=0,0,IF(I29=0,0,((D29/I29)*100)-100)) -> 0 | Q29: 2396289 | R29: 0 | S29: =IF(D29=0,0,(D29/$D$32)*100) -> 5.31 | U29: 0 | V29: 9.93
A30: Total Hiper | C30: =SUM(C25:C29) -> 21319955 | D30: =SUM(D25:D29) -> 19600783 | E30: =SUM(E25:E29) -> 17030219 | G30: =SUM(G25:G29) -> 17278861 | H30: =SUM(H25:H29) -> 12426454 | I30: =SUM(I25:I29) -> 7211544 | J30: =SUM(C30:I30) -> 94867816 | K30: =IF(D30=0,0,((D30/C30)*100)-100) -> -8.06 | L30: =IF(D30=0,0,IF(E30=0,0,((D30/E30)*100)-100)) -> 15.09 | M30: =IF(G30=0,0,IF(D30=0,0,((D30/G30)*100)-100)) -> 13.44 | N30: =IF(H30=0,0,IF(D30=0,0,((D30/H30)*100)-100)) -> 57.73 | O30: =IF(D30=0,0,IF(I30=0,0,((D30/I30)*100)-100)) -> 171.8 | Q30: =SUM(Q25:Q29) -> 21356289 | R30: =IF(D30=0,0,((D30/Q30)*100)-100) -> -8.22 | S30: =IF(D30=0,0,(D30/$D$32)*100) -> 44.12 | U30: 15.95 | V30: 15.52
A32: Total Geral | C32: =C23+C30 -> 48639955 | D32: =D23+D30 -> 44424931 | E32: =E23+E30 -> 41214397 | G32: =G23+G30 -> 42805325 | H32: =H23+H30 -> 34933726 | I32: =I23+I30 -> 26578440 | K32: =IF(D30=0,0,((D32/C32)*100)-100) -> -8.67 | L32: =IF(D32=0,0,IF(E32=0,0,((D32/E32)*100)-100)) -> 7.79 | M32: =IF(G32=0,0,IF(D32=0,0,((D32/G32)*100)-100)) -> 3.78 | N32: =IF(H32=0,0,IF(D32=0,0,((D32/H32)*100)-100)) -> 27.17 | O32: =IF(D32=0,0,IF(I32=0,0,((D32/I32)*100)-100)) -> 67.15 | Q32: =Q23+Q30 -> 48676289 | R32: =IF(D32=0,0,((D32/Q32)*100)-100) -> -8.73 | S32: =S23+S30 -> 100 | U32: 16.46 | V32: 15.94
C33: Resumo por Regio - Outubro/2002
C34: Descrio das Aberturas | H34: Valor | I34: %
C35: Curitiba (2,3,6,7,10,11,17,21,22) | H35: =D7+D8+D11+D12+D14+D16+D19+D28+D29 -> 21301234 | I35: =IF(D32=0,0,H35/$D$32) -> 0.47949999999999998
C36: Curitiba e Metrop. (Ctba. 4,5,8,14,23) | H36: =H35+D9+D10+D13+D27+D22 -> 31524772 | I36: =IF(D32=0,0,H36/$D$32) -> 0.70960000000000001
C37: Metropolitana (4,5,8,14,23) | H37: =H36-H35 -> 10223538 | I37: =IF(D32=0,0,H37/$D$32) -> 0.2301
C38: Norte (9,15,20) | H38: =D25+D18+D22 -> 5531614 | I38: =IF(D32=0,0,H38/$D$32) -> 0.1245
C39: Centro-Oeste (13,18,19) | H39: =D17+D20+D27 -> 6283950 | I39: =IF(D32=0,0,H39/$D$32) -> 0.14149999999999999
C40: Ponta Grossa (18,19) | H40: =H39-D17 -> 4735026 | I40: =IF(D32=0,0,H40/$D$32) -> 0.1066
C41: Super (2,3,4,5,6,7,8,10,11,13,15,17,18,20,23) | H41: =D23 -> 24824148 | I41: =IF(D32=0,0,H41/$D$32) -> 0.55879999999999996
C42: Hiper (9,14,19,21,22) | H42: =D30 -> 19600783 | I42: =IF(D32=0,0,H42/$D$32) -> 0.44119999999999998
C43: Curitiba, Metropolitana e Centro-Oeste | H43: =D32-H38 -> 38893317 | I43: =IF(D32=0,0,H43/$D$32) -> 0.87549999999999994
C44: Araucria | H44: =D10+D22 -> 2887682 | I44: =IF(D32=0,0,H44/$D$32) -> 6.5000000000000002E-2