A2: Periodo: | C2: 38718 | D2: a | E2: 38748 | H2: Vendas Acumuladas por Filial | Q2: =NOW() -> 38755.468536689797
A4: v.1 | C4: Vendas 2006 | G4: Vendas de Anos Anteriores | K4: Percentuais ( % ) | Q4: Meta Mensal | U4: Margem
A5: Lojas | C5: Previsao | D5: Realizada | E5: Mes Anterior | G5: Vendas 2005 | H5: Vendas 2004 | I5: Vendas 2003 | K5: % Prev | L5: % MA | M5: 2005 | N5: 2004 | O5: 2003 | Q5: Previsao Mes | R5: Final | S5: Part. | U5: Meta | V5: Condor
A7: Xaxim | C7: 798077 | D7: 651011 | E7: 981107 | G7: 837675 | H7: 894663 | I7: 648112 | K7: =IF(C7=0,0,((D7/C7)*100)-100) -> -18.43 | L7: =IF(D7=0,0,IF(E7=0,0,((D7/E7)*100)-100)) -> -33.65 | M7: =IF(G7=0,0,((D7/G7)*100)-100) -> -22.28 | N7: =IF(H7=0,0,((D7/H7)*100)-100) -> -27.23 | O7: =IF(D7=0,0,IF(I7=0,0,((D7/I7)*100)-100)) -> 0.45 | Q7: 798077 | R7: =IF(D7=0,0,((D7/Q7)*100)-100) -> -18.43 | S7: =IF(D7=0,0,(D7/$D$35)*100) -> 1.22 | U7: 16.4 | V7: 16.25
A8: S. Felicidade | C8: 790000 | D8: 721831 | E8: 995390 | G8: 764402 | H8: 766874 | I8: 701361 | K8: =IF(C8=0,0,((D8/C8)*100)-100) -> -8.63 | L8: =IF(D8=0,0,IF(E8=0,0,((D8/E8)*100)-100)) -> -27.48 | M8: =IF(G8=0,0,((D8/G8)*100)-100) -> -5.57 | N8: =IF(H8=0,0,((D8/H8)*100)-100) -> -5.87 | O8: =IF(D8=0,0,IF(I8=0,0,((D8/I8)*100)-100)) -> 2.92 | Q8: 790000 | R8: =IF(D8=0,0,((D8/Q8)*100)-100) -> -8.63 | S8: =IF(D8=0,0,(D8/$D$35)*100) -> 1.35 | U8: 16.5 | V8: 16.46
A9: Lapa | C9: 1190000 | D9: 1054478 | E9: 1603316 | G9: 1161706 | H9: 1089890 | I9: 961646 | K9: =IF(C9=0,0,((D9/C9)*100)-100) -> -11.39 | L9: =IF(D9=0,0,IF(E9=0,0,((D9/E9)*100)-100)) -> -34.23 | M9: =IF(G9=0,0,((D9/G9)*100)-100) -> -9.23 | N9: =IF(H9=0,0,((D9/H9)*100)-100) -> -3.25 | O9: =IF(D9=0,0,IF(I9=0,0,((D9/I9)*100)-100)) -> 9.65 | Q9: 1190000 | R9: =IF(D9=0,0,((D9/Q9)*100)-100) -> -11.39 | S9: =IF(D9=0,0,(D9/$D$35)*100) -> 1.98 | U9: 16.25 | V9: 15.27
A10: Araucaria | C10: 995000 | D10: 919300 | E10: 1188414 | G10: 965307 | H10: 994437 | I10: 1032375 | K10: =IF(C10=0,0,((D10/C10)*100)-100) -> -7.61 | L10: =IF(D10=0,0,IF(E10=0,0,((D10/E10)*100)-100)) -> -22.64 | M10: =IF(G10=0,0,((D10/G10)*100)-100) -> -4.77 | N10: =IF(H10=0,0,((D10/H10)*100)-100) -> -7.56 | O10: =IF(D10=0,0,IF(I10=0,0,((D10/I10)*100)-100)) -> -10.95 | Q10: 995000 | R10: =IF(D10=0,0,((D10/Q10)*100)-100) -> -7.61 | S10: =IF(D10=0,0,(D10/$D$35)*100) -> 1.72 | U10: 17.55 | V10: 17.08
A11: Pinheirinho | C11: 2200000 | D11: 1763676 | E11: 2697444 | G11: 2214628 | H11: 2277973 | I11: 1857893 | K11: =IF(C11=0,0,((D11/C11)*100)-100) -> -19.83 | L11: =IF(D11=0,0,IF(E11=0,0,((D11/E11)*100)-100)) -> -34.62 | M11: =IF(G11=0,0,((D11/G11)*100)-100) -> -20.36 | N11: =IF(H11=0,0,((D11/H11)*100)-100) -> -22.58 | O11: =IF(D11=0,0,IF(I11=0,0,((D11/I11)*100)-100)) -> -5.07 | Q11: 2200000 | R11: =IF(D11=0,0,((D11/Q11)*100)-100) -> -19.83 | S11: =IF(D11=0,0,(D11/$D$35)*100) -> 3.31 | U11: 16.8 | V11: 16.86
A12: Hauer | C12: 3285000 | D12: 2792165 | E12: 4067771 | G12: 3227643 | H12: 2992755 | I12: 2685121 | K12: =IF(C12=0,0,((D12/C12)*100)-100) -> -15 | L12: =IF(D12=0,0,IF(E12=0,0,((D12/E12)*100)-100)) -> -31.36 | M12: =IF(G12=0,0,((D12/G12)*100)-100) -> -13.49 | N12: =IF(H12=0,0,((D12/H12)*100)-100) -> -6.7 | O12: =IF(D12=0,0,IF(I12=0,0,((D12/I12)*100)-100)) -> 3.99 | Q12: 3285000 | R12: =IF(D12=0,0,((D12/Q12)*100)-100) -> -15 | S12: =IF(D12=0,0,(D12/$D$35)*100) -> 5.24 | U12: 16.96 | V12: 17.27
A13: Paranagua | C13: 1750000 | D13: 1458107 | E13: 2137266 | G13: 3552885 | H13: 2943719 | I13: 2825976 | K13: =IF(C13=0,0,((D13/C13)*100)-100) -> -16.68 | L13: =IF(D13=0,0,IF(E13=0,0,((D13/E13)*100)-100)) -> -31.78 | M13: =IF(G13=0,0,((D13/G13)*100)-100) -> -58.96 | N13: =IF(H13=0,0,((D13/H13)*100)-100) -> -50.47 | O13: =IF(D13=0,0,IF(I13=0,0,((D13/I13)*100)-100)) -> -48.4 | Q13: 1750000 | R13: =IF(D13=0,0,((D13/Q13)*100)-100) -> -16.68 | S13: =IF(D13=0,0,(D13/$D$35)*100) -> 2.73 | U13: 17.4 | V13: 17.27
A14: Centenario | C14: 1078000 | D14: 866241 | E14: 1212315 | G14: 1026796 | H14: 1100371 | I14: 866269 | K14: =IF(C14=0,0,((D14/C14)*100)-100) -> -19.64 | L14: =IF(D14=0,0,IF(E14=0,0,((D14/E14)*100)-100)) -> -28.55 | M14: =IF(G14=0,0,((D14/G14)*100)-100) -> -15.64 | N14: =IF(H14=0,0,((D14/H14)*100)-100) -> -21.28 | O14: =IF(D14=0,0,IF(I14=0,0,((D14/I14)*100)-100)) -> 0 | Q14: 1078000 | R14: =IF(D14=0,0,((D14/Q14)*100)-100) -> -19.64 | S14: =IF(D14=0,0,(D14/$D$35)*100) -> 1.62 | U14: 16.6 | V14: 16.03
A15: Arapongas | C15: 0 | D15: 0 | E15: 0 | G15: 0 | H15: 0 | I15: 0 | K15: =IF(C15=0,0,((D15/C15)*100)-100) -> 0 | L15: =IF(D15=0,0,IF(E15=0,0,((D15/E15)*100)-100)) -> 0 | M15: =IF(D15=0,0,IF(G15=0,0,((D15/G15)*100)-100)) -> 0 | N15: =IF(D15=0,0,IF(H15=0,0,((D15/H15)*100)-100)) -> 0 | O15: =IF(D15=0,0,IF(I15=0,0,((D15/I15)*100)-100)) -> 0 | Q15: 0 | R15: =IF(D15=0,0,((D15/Q15)*100)-100) -> 0 | S15: =IF(D15=0,0,(D15/$D$35)*100) -> 0 | U15: 0 | V15: 0
A16: Sao Braz | C16: 3160000 | D16: 2825747 | E16: 3979406 | G16: 3160561 | H16: 3212288 | I16: 2781334 | K16: =IF(C16=0,0,((D16/C16)*100)-100) -> -10.58 | L16: =IF(D16=0,0,IF(E16=0,0,((D16/E16)*100)-100)) -> -28.99 | M16: =IF(G16=0,0,((D16/G16)*100)-100) -> -10.59 | N16: =IF(H16=0,0,((D16/H16)*100)-100) -> -12.03 | O16: =IF(D16=0,0,IF(I16=0,0,((D16/I16)*100)-100)) -> 1.6 | Q16: 3160000 | R16: =IF(D16=0,0,((D16/Q16)*100)-100) -> -10.58 | S16: =IF(D16=0,0,(D16/$D$35)*100) -> 5.3 | U16: 16.71 | V16: 17.15
A17: Sitio Cercado | C17: 1350000 | D17: 1259172 | E17: 1801665 | G17: 1668157 | H17: 1504207 | I17: 1099203 | K17: =IF(C17=0,0,((D17/C17)*100)-100) -> -6.73 | L17: =IF(D17=0,0,IF(E17=0,0,((D17/E17)*100)-100)) -> -30.11 | M17: =IF(G17=0,0,((D17/G17)*100)-100) -> -24.52 | N17: =IF(H17=0,0,((D17/H17)*100)-100) -> -16.29 | O17: =IF(D17=0,0,IF(I17=0,0,((D17/I17)*100)-100)) -> 14.55 | Q17: 1350000 | R17: =IF(D17=0,0,((D17/Q17)*100)-100) -> -6.73 | S17: =IF(D17=0,0,(D17/$D$35)*100) -> 2.36 | U17: 16.9 | V17: 16.68
A18: Apucarana | C18: 1750000 | D18: 1752201 | E18: 2534044 | G18: 1683121 | H18: 1460770 | I18: 1225402 | K18: =IF(C18=0,0,((D18/C18)*100)-100) -> 0.13 | L18: =IF(D18=0,0,IF(E18=0,0,((D18/E18)*100)-100)) -> -30.85 | M18: =IF(G18=0,0,((D18/G18)*100)-100) -> 4.1 | N18: =IF(H18=0,0,((D18/H18)*100)-100) -> 19.95 | O18: =IF(D18=0,0,IF(I18=0,0,((D18/I18)*100)-100)) -> 42.99 | Q18: 1750000 | R18: =IF(D18=0,0,((D18/Q18)*100)-100) -> 0.13 | S18: =IF(D18=0,0,(D18/$D$35)*100) -> 3.29 | U18: 15.4 | V18: 15.11
A19: Ahu | C19: 1170000 | D19: 1008283 | E19: 1476110 | G19: 1052068 | H19: 1192190 | I19: 1062709 | K19: =IF(C19=0,0,((D19/C19)*100)-100) -> -13.82 | L19: =IF(D19=0,0,IF(E19=0,0,((D19/E19)*100)-100)) -> -31.69 | M19: =IF(G19=0,0,((D19/G19)*100)-100) -> -4.16 | N19: =IF(H19=0,0,((D19/H19)*100)-100) -> -15.43 | O19: =IF(D19=0,0,IF(I19=0,0,((D19/I19)*100)-100)) -> -5.12 | Q19: 1170000 | R19: =IF(D19=0,0,((D19/Q19)*100)-100) -> -13.82 | S19: =IF(D19=0,0,(D19/$D$35)*100) -> 1.89 | U19: 17.15 | V19: 16.6
A20: P.G. Centro | C20: 1730000 | D20: 1474547 | E20: 2042921 | G20: 1711238 | H20: 1720468 | I20: 1479223 | K20: =IF(C20=0,0,((D20/C20)*100)-100) -> -14.77 | L20: =IF(D20=0,0,IF(E20=0,0,((D20/E20)*100)-100)) -> -27.82 | M20: =IF(G20=0,0,((D20/G20)*100)-100) -> -13.83 | N20: =IF(H20=0,0,((D20/H20)*100)-100) -> -14.29 | O20: =IF(D20=0,0,IF(I20=0,0,((D20/I20)*100)-100)) -> -0.32 | Q20: 1730000 | R20: =IF(D20=0,0,((D20/Q20)*100)-100) -> -14.77 | S20: =IF(D20=0,0,(D20/$D$35)*100) -> 2.76 | U20: 17.98 | V20: 17.28
A21: Maringa | C21: 2435000 | D21: 2071793 | E21: 2937386 | G21: 2315661 | H21: 2049388 | I21: 1859960 | K21: =IF(C21=0,0,((D21/C21)*100)-100) -> -14.92 | L21: =IF(D21=0,0,IF(E21=0,0,((D21/E21)*100)-100)) -> -29.47 | M21: =IF(G21=0,0,((D21/G21)*100)-100) -> -10.53 | N21: =IF(H21=0,0,((D21/H21)*100)-100) -> 1.09 | O21: =IF(D21=0,0,IF(I21=0,0,((D21/I21)*100)-100)) -> 11.39 | Q21: 2435000 | R21: =IF(D21=0,0,((D21/Q21)*100)-100) -> -14.92 | S21: =IF(D21=0,0,(D21/$D$35)*100) -> 3.88 | U21: 15.9 | V21: 17.13
A22: Araucaria Nova | C22: 2190000 | D22: 1904973 | E22: 2709318 | G22: 2110423 | H22: 1885054 | I22: 1701530 | K22: =IF(C22=0,0,((D22/C22)*100)-100) -> -13.01 | L22: =IF(D22=0,0,IF(E22=0,0,((D22/E22)*100)-100)) -> -29.69 | M22: =IF(G22=0,0,((D22/G22)*100)-100) -> -9.74 | N22: =IF(H22=0,0,((D22/H22)*100)-100) -> 1.06 | O22: =IF(D22=0,0,IF(I22=0,0,((D22/I22)*100)-100)) -> 11.96 | Q22: 2190000 | R22: =IF(D22=0,0,((D22/Q22)*100)-100) -> -13.01 | S22: =IF(D22=0,0,(D22/$D$35)*100) -> 3.57 | U22: 17.5 | V22: 17.34
A23: Sitio Cercado | C23: 0 | D23: 0 | E23: 0 | G23: 0 | H23: 0 | I23: 0 | K23: =IF(C23=0,0,((D23/C23)*100)-100) -> 0 | L23: =IF(D23=0,0,IF(E23=0,0,((D23/E23)*100)-100)) -> 0 | M23: =IF(G23=0,0,((D23/G23)*100)-100) -> 0 | N23: =IF(H23=0,0,((D23/H23)*100)-100) -> 0 | O23: =IF(D23=0,0,IF(I23=0,0,((D23/I23)*100)-100)) -> 0 | Q23: 0 | R23: =IF(Q23=0,0,IF(D23=0,0,((D23/Q23)*100)-100)) -> 0 | S23: =IF(D23=0,0,(D23/$D$35)*100) -> 0 | U23: 0 | V23: 0
A24: Total Super | C24: =SUM(C7:C23) -> 25871077 | D24: =SUM(D7:D23) -> 22523525 | E24: =SUM(E7:E23) -> 32363873 | G24: =SUM(G7:G23) -> 27452271 | H24: =SUM(H7:H23) -> 26085047 | I24: =SUM(I7:I23) -> 22788114 | J24: =SUM(C24:I24) -> 157083907 | K24: =IF(D24=0,0,((D24/C24)*100)-100) -> -12.94 | L24: =IF(D24=0,0,IF(E24=0,0,((D24/E24)*100)-100)) -> -30.41 | M24: =IF(G24=0,0,IF(D24=0,0,((D24/G24)*100)-100)) -> -17.95 | N24: =IF(H24=0,0,IF(D24=0,0,((D24/H24)*100)-100)) -> -13.65 | O24: =IF(D24=0,0,IF(I24=0,0,((D24/I24)*100)-100)) -> -1.16 | Q24: =SUM(Q7:Q23) -> 25871077 | R24: =IF(D24=0,0,((D24/Q24)*100)-100) -> -12.94 | S24: =IF(D24=0,0,(D24/$D$35)*100) -> 42.23 | U24: 16.8 | V24: 16.78
A26: Londrina | C26: 2800000 | D26: 2619373 | E26: 3736165 | G26: 2896426 | H26: 2382375 | I26: 2140316 | K26: =IF(C26=0,0,((D26/C26)*100)-100) -> -6.45 | L26: =IF(D26=0,0,IF(E26=0,0,((D26/E26)*100)-100)) -> -29.89 | M26: =IF(G26=0,0,((D26/G26)*100)-100) -> -9.57 | N26: =IF(H26=0,0,((D26/H26)*100)-100) -> 9.95 | O26: =IF(D26=0,0,IF(I26=0,0,((D26/I26)*100)-100)) -> 22.38 | Q26: 2800000 | R26: =IF(D26=0,0,IF(Q26=0,0,((D26/Q26)*100)-100)) -> -6.45 | S26: =IF(D26=0,0,(D26/$D$35)*100) -> 4.91 | U26: 15.7 | V26: 14.6
A27: S.J. Pinhais | C27: 4100000 | D27: 3888347 | E27: 5568251 | G27: 4579048 | H27: 4247253 | I27: 3644723 | K27: =IF(C27=0,0,((D27/C27)*100)-100) -> -5.16 | L27: =IF(D27=0,0,IF(E27=0,0,((D27/E27)*100)-100)) -> -30.17 | M27: =IF(G27=0,0,((D27/G27)*100)-100) -> -15.08 | N27: =IF(H27=0,0,((D27/H27)*100)-100) -> -8.45 | O27: =IF(D27=0,0,IF(I27=0,0,((D27/I27)*100)-100)) -> 6.68 | Q27: 4100000 | R27: =IF(D27=0,0,IF(Q27=0,0,((D27/Q27)*100)-100)) -> -5.16 | S27: =IF(D27=0,0,(D27/$D$35)*100) -> 7.29 | U27: 15.6 | V27: 15.85
A28: P.G. Nova | C28: 3655000 | D28: 3272190 | E28: 5062487 | G28: 3608479 | H28: 3202694 | I28: 3004210 | K28: =IF(C28=0,0,((D28/C28)*100)-100) -> -10.47 | L28: =IF(D28=0,0,IF(E28=0,0,((D28/E28)*100)-100)) -> -35.36 | M28: =IF(G28=0,0,((D28/G28)*100)-100) -> -9.32 | N28: =IF(H28=0,0,((D28/H28)*100)-100) -> 2.17 | O28: =IF(D28=0,0,IF(I28=0,0,((D28/I28)*100)-100)) -> 8.92 | Q28: 3655000 | R28: =IF(D28=0,0,IF(Q28=0,0,((D28/Q28)*100)-100)) -> -10.47 | S28: =IF(D28=0,0,(D28/$D$35)*100) -> 6.14 | U28: 16.4 | V28: 16.43
A29: Nilo Pecanha | C29: 8250000 | D29: 7881610 | E29: 11637386 | G29: 7779783 | H29: 7997117 | I29: 6702998 | K29: =IF(C29=0,0,((D29/C29)*100)-100) -> -4.47 | L29: =IF(D29=0,0,IF(E29=0,0,((D29/E29)*100)-100)) -> -32.27 | M29: =IF(G29=0,0,((D29/G29)*100)-100) -> 1.31 | N29: =IF(H29=0,0,((D29/H29)*100)-100) -> -1.44 | O29: =IF(D29=0,0,IF(I29=0,0,((D29/I29)*100)-100)) -> 17.58 | Q29: 8250000 | R29: =IF(D29=0,0,IF(Q29=0,0,((D29/Q29)*100)-100)) -> -4.47 | S29: =IF(D29=0,0,(D29/$D$35)*100) -> 14.78 | U29: 16.2 | V29: 16.05
A30: Champagnat | C30: 5500000 | D30: 4933361 | E30: 6686545 | G30: 5159047 | H30: 0 | I30: 0 | K30: =IF(C30=0,0,((D30/C30)*100)-100) -> -10.3 | L30: =IF(D30=0,0,IF(E30=0,0,((D30/E30)*100)-100)) -> -26.22 | M30: =IF(G30=0,0,((D30/G30)*100)-100) -> -4.37 | N30: =IF(H30=0,0,((D30/H30)*100)-100) -> 0 | O30: =IF(D30=0,0,IF(I30=0,0,((D30/I30)*100)-100)) -> 0 | Q30: 5500000 | R30: =IF(D30=0,0,IF(Q30=0,0,((D30/Q30)*100)-100)) -> -10.3 | S30: =IF(D30=0,0,(D30/$D$35)*100) -> 9.25 | U30: 16.4 | V30: 16.51
A31: Santa Candida | C31: 4672289 | D31: 3939719 | E31: 5840046 | G31: 4870329 | H31: 0 | I31: 0 | K31: =IF(C31=0,0,((D31/C31)*100)-100) -> -15.68 | L31: =IF(D31=0,0,IF(E31=0,0,((D31/E31)*100)-100)) -> -32.54 | M31: =IF(G31=0,0,((D31/G31)*100)-100) -> -19.11 | N31: =IF(H31=0,0,((D31/H31)*100)-100) -> 0 | O31: =IF(D31=0,0,IF(I31=0,0,((D31/I31)*100)-100)) -> 0 | Q31: 4672289 | R31: =IF(D31=0,0,IF(Q31=0,0,((D31/Q31)*100)-100)) -> -15.68 | S31: =IF(D31=0,0,(D31/$D$35)*100) -> 7.39 | U31: 16.2 | V31: 15.62
A32: Paranagu Raia | C32: 5150000 | D32: 4272908 | E32: 6330492 | G32: 0 | H32: 0 | I32: 0 | K32: =IF(C32=0,0,((D32/C32)*100)-100) -> -17.03 | L32: =IF(D32=0,0,IF(E32=0,0,((D32/E32)*100)-100)) -> -32.5 | M32: =IF(G32=0,0,((D32/G32)*100)-100) -> 0 | N32: =IF(H32=0,0,((D32/H32)*100)-100) -> 0 | O32: =IF(D32=0,0,IF(I32=0,0,((D32/I32)*100)-100)) -> 0 | Q32: 5150000 | R32: =IF(D32=0,0,IF(Q32=0,0,((D32/Q32)*100)-100)) -> -17.03 | S32: =IF(D32=0,0,(D32/$D$35)*100) -> 8.01 | U32: 16.3 | V32: 16.94
A33: Total Hiper | C33: =SUM(C26:C32) -> 34127289 | D33: =SUM(D26:D32) -> 30807508 | E33: =SUM(E26:E32) -> 44861372 | G33: =SUM(G26:G32) -> 28893112 | H33: =SUM(H26:H32) -> 17829439 | I33: =SUM(I26:I32) -> 15492247 | J33: =SUM(C33:I33) -> 172010967 | K33: =IF(D33=0,0,((D33/C33)*100)-100) -> -9.73 | L33: =IF(D33=0,0,IF(E33=0,0,((D33/E33)*100)-100)) -> -31.33 | M33: =IF(G33=0,0,IF(D33=0,0,((D33/G33)*100)-100)) -> 6.63 | N33: =IF(H33=0,0,IF(D33=0,0,((D33/H33)*100)-100)) -> 72.79 | O33: =IF(D33=0,0,IF(I33=0,0,((D33/I33)*100)-100)) -> 98.86 | Q33: =SUM(Q26:Q32) -> 34127289 | R33: =IF(D33=0,0,((D33/Q33)*100)-100) -> -9.73 | S33: =IF(D33=0,0,(D33/$D$35)*100) -> 57.77 | U33: 16.16 | V33: 16.08
A35: Total Geral | C35: =C24+C33 -> 59998366 | D35: =D24+D33 -> 53331033 | E35: =E24+E33 -> 77225245 | G35: =G24+G33 -> 56345383 | H35: =H24+H33 -> 43914486 | I35: =I24+I33 -> 38280361 | K35: =IF(D33=0,0,((D35/C35)*100)-100) -> -11.11 | L35: =IF(D35=0,0,IF(E35=0,0,((D35/E35)*100)-100)) -> -30.94 | M35: =IF(G35=0,0,IF(D35=0,0,((D35/G35)*100)-100)) -> -5.35 | N35: =IF(H35=0,0,IF(D35=0,0,((D35/H35)*100)-100)) -> 21.44 | O35: =IF(D35=0,0,IF(I35=0,0,((D35/I35)*100)-100)) -> 39.32 | Q35: =Q24+Q33 -> 59998366 | R35: =IF(D35=0,0,((D35/Q35)*100)-100) -> -11.11 | S35: =S24+S33 -> 100 | U35: 16.43 | V35: 16.38
C36: Resumo por Regiao - Outubro/2002
C37: Descricao das Aberturas | H37: Valor | I37: %
C38: Curitiba (2,3,6,7,10,11,17,21,22) | H38: =D7+D8+D11+D12+D14+D16+D19+D29+D30+D32 -> 27716833 | I38: =IF(D35=0,0,H38/$D$35) -> 0.51970000000000005
C39: Curitiba e Metrop. (Ctba. 4,5,8,14,23) | H39: =H38+D9+D10+D13+D28+D23 -> 34420908 | I39: =IF(D35=0,0,H39/$D$35) -> 0.64539999999999997
C40: Metropolitana (4,5,8,14,23) | H40: =H39-H38 -> 6704075 | I40: =IF(D35=0,0,H40/$D$35) -> 0.12570000000000001
C41: Norte (9,15,20) | H41: =D26+D18+D23 -> 4371574 | I41: =IF(D35=0,0,H41/$D$35) -> 8.2000000000000003E-2
C42: Centro-Oeste (13,18,19) | H42: =D17+D20+D28 -> 6005909 | I42: =IF(D35=0,0,H42/$D$35) -> 0.11260000000000001
C43: Ponta Grossa (18,19) | H43: =H42-D17 -> 4746737 | I43: =IF(D35=0,0,H43/$D$35) -> 8.8999999999999996E-2
C44: Super (2,3,4,5,6,7,8,10,11,13,15,17,18,20,23) | H44: =D24 -> 22523525 | I44: =IF(D35=0,0,H44/$D$35) -> 0.42230000000000001
C45: Hiper (9,14,19,21,22,24) | H45: =D33 -> 30807508 | I45: =IF(D35=0,0,H45/$D$35) -> 0.57769999999999999
C46: Curitiba, Metropolitana e Centro-Oeste | H46: =D35-H41 -> 48959459 | I46: =IF(D35=0,0,H46/$D$35) -> 0.91800000000000004
C47: Araucaria | H47: =D10+D23 -> 919300 | I47: =IF(D35=0,0,H47/$D$35) -> 1.72E-2