A2: Periodo: | B2: 41030 | C2: a | D2: 41060 | G2: Vendas Acumuladas por Filial | P2: =NOW() -> 41061.374849652777
A4: v.New | B4: Vendas 2012 | F4: Vendas de Anos Anteriores | J4: Percentuais ( % ) | P4: Meta Mensal | T4: Margem
A5: Lojas | B5: Previsao | C5: Realizada | D5: Mes Anterior | F5: Vendas 2011 | G5: Vendas 2010 | H5: Vendas 2009 | J5: % Prev | K5: % MA | L5: 2011 | M5: 2010 | N5: 2009 | P5: Previsao Mes | Q5: Final | R5: Part. | T5: Meta | U5: Coml | V5: Sell O. | W5: Dif
A6: S. Felicidade | B6: 3800000 | C6: 3910878.44 | D6: 4282924.82 | F6: 3251365.77 | G6: 3003895.11 | H6: 2629079.07 | J6: =IF(B6=0,0,((C6/B6)*100)-100) -> 2.9178536842105132 | K6: =IF(C6=0,0,IF(D6=0,0,((C6/D6)*100)-100)) -> -8.6867361823082376 | L6: =IF(F6=0,0,((C6/F6)*100)-100) -> 20.284173379853215 | M6: =IF(G6=0,0,((C6/G6)*100)-100) -> 30.193575234389584 | N6: =IF(C6=0,0,IF(H6=0,0,((C6/H6)*100)-100)) -> 48.754690744238445 | P6: 3800000 | Q6: =IF(C6=0,0,((C6/P6)*100)-100) -> 2.9178536842105132 | R6: =IF(C6=0,0,(C6/$C$43)*100) -> 2.2973761398745847 | T6: 16.59 | U6: 17.148151288486481 | V6: 18.742246578239339 | W6: =U6-T6 -> 0.55815128848648143
A7: Lapa | B7: 2500000 | C7: 2546508.07 | D7: 2861109.98 | F7: 2306031.65 | G7: 2290071.47 | H7: 2072102.99 | J7: =IF(B7=0,0,((C7/B7)*100)-100) -> 1.8603227999999916 | K7: =IF(C7=0,0,IF(D7=0,0,((C7/D7)*100)-100)) -> -10.995799259698515 | L7: =IF(F7=0,0,((C7/F7)*100)-100) -> 10.428149153980598 | M7: =IF(G7=0,0,((C7/G7)*100)-100) -> 11.197755325950581 | N7: =IF(C7=0,0,IF(H7=0,0,((C7/H7)*100)-100)) -> 22.894860066776886 | P7: 2500000 | Q7: =IF(C7=0,0,((C7/P7)*100)-100) -> 1.8603227999999916 | R7: =IF(C7=0,0,(C7/$C$43)*100) -> 1.4959009771769021 | T7: 15.3 | U7: 16.014225519418833 | V7: 17.83627972166607 | W7: =U7-T7 -> 0.71422551941883228
A8: Araucaria | B8: 1500000 | C8: 1488381.83 | D8: 1677629.92 | F8: 1432325.24 | G8: 1366997.26 | H8: 1230651.76 | J8: =IF(B8=0,0,((C8/B8)*100)-100) -> -0.77454466666667088 | K8: =IF(C8=0,0,IF(D8=0,0,((C8/D8)*100)-100)) -> -11.280681617790876 | L8: =IF(F8=0,0,((C8/F8)*100)-100) -> 3.9136774549892124 | M8: =IF(G8=0,0,((C8/G8)*100)-100) -> 8.879649839239633 | N8: =IF(C8=0,0,IF(H8=0,0,((C8/H8)*100)-100)) -> 20.942567050812173 | P8: 1500000 | Q8: =IF(C8=0,0,((C8/P8)*100)-100) -> -0.77454466666667088 | R8: =IF(C8=0,0,(C8/$C$43)*100) -> 0.87432349425436773 | T8: 16.9 | U8: 17.360735967866525 | V8: 18.799784669502444 | W8: =U8-T8 -> 0.46073596786652615
A9: Hauer | B9: 4500000 | C9: 4602095.65 | D9: 4931225.33 | F9: 3943610.71 | G9: 3976926.65 | H9: 3822184.9 | J9: =IF(B9=0,0,((C9/B9)*100)-100) -> 2.2687922222222312 | K9: =IF(C9=0,0,IF(D9=0,0,((C9/D9)*100)-100)) -> -6.6743995249553905 | L9: =IF(F9=0,0,((C9/F9)*100)-100) -> 16.697513736085796 | M9: =IF(G9=0,0,((C9/G9)*100)-100) -> 15.71990270426538 | N9: =IF(C9=0,0,IF(H9=0,0,((C9/H9)*100)-100)) -> 20.404840958897637 | P9: 4500000 | Q9: =IF(C9=0,0,((C9/P9)*100)-100) -> 2.2687922222222312 | R9: =IF(C9=0,0,(C9/$C$43)*100) -> 2.7034194240337008 | T9: 16.29 | U9: 16.491208851776037 | V9: 17.794478521975091 | W9: =U9-T9 -> 0.20120885177603753
A10: Paranagua | B10: 2350000 | C10: 2394660.87 | D10: 2687618.02 | F10: 2209427.47 | G10: 5408353.0999999996 | H10: 1886647.27 | J10: =IF(B10=0,0,((C10/B10)*100)-100) -> 1.9004625531914883 | K10: =IF(C10=0,0,IF(D10=0,0,((C10/D10)*100)-100)) -> -10.900252484540189 | L10: =IF(F10=0,0,((C10/F10)*100)-100) -> 8.3837737384517794 | M10: =IF(G10=0,0,((C10/G10)*100)-100) -> -55.722919237651105 | N10: =IF(C10=0,0,IF(H10=0,0,((C10/H10)*100)-100)) -> 26.926792733227785 | P10: 2350000 | Q10: =IF(C10=0,0,((C10/P10)*100)-100) -> 1.9004625531914883 | R10: =IF(C10=0,0,(C10/$C$43)*100) -> 1.4067010341107189 | T10: 17.82 | U10: 18.043426938362256 | V10: 19.506160068502727 | W10: =U10-T10 -> 0.22342693836225536
A11: Sitio Cercado | B11: 3350000 | C11: 3389052.17 | D11: 3907270.73 | F11: 2895053.11 | G11: 2405685.86 | H11: 2090867.03 | J11: =IF(B11=0,0,((C11/B11)*100)-100) -> 1.1657364179104519 | K11: =IF(C11=0,0,IF(D11=0,0,((C11/D11)*100)-100)) -> -13.262929441288037 | L11: =IF(F11=0,0,((C11/F11)*100)-100) -> 17.06355777355671 | M11: =IF(G11=0,0,((C11/G11)*100)-100) -> 40.876754789588375 | N11: =IF(C11=0,0,IF(H11=0,0,((C11/H11)*100)-100)) -> 62.08836436624091 | P11: 3350000 | Q11: =IF(C11=0,0,((C11/P11)*100)-100) -> 1.1657364179104519 | R11: =IF(C11=0,0,(C11/$C$43)*100) -> 1.9908385575257574 | T11: 14.65 | U11: 15.123807704618486 | V11: 16.945189232657931 | W11: =U11-T11 -> 0.4738077046184852
A12: Apucarana | B12: 2600000 | C12: 2714281.82 | D12: 3030381.03 | F12: 2089979.32 | G12: 2429214.25 | H12: 2595778.97 | J12: =IF(B12=0,0,((C12/B12)*100)-100) -> 4.3954546153846223 | K12: =IF(C12=0,0,IF(D12=0,0,((C12/D12)*100)-100)) -> -10.431005436963147 | L12: =IF(F12=0,0,((C12/F12)*100)-100) -> 29.871228582300034 | M12: =IF(G12=0,0,((C12/G12)*100)-100) -> 11.734970268678424 | N12: =IF(C12=0,0,IF(H12=0,0,((C12/H12)*100)-100)) -> 4.5652134241614561 | P12: 2600000 | Q12: =IF(C12=0,0,((C12/P12)*100)-100) -> 4.3954546153846223 | R12: =IF(C12=0,0,(C12/$C$43)*100) -> 1.5944566894192091 | T12: 16.374199999999998 | U12: 15.962696043847064 | V12: 17.532548687225116 | W12: =U12-T12 -> -0.41150395615293434
A13: Ahú | B13: 2400000 | C13: 2393409.91 | D13: 2562369 | F13: 2184038.08 | G13: 1865267.05 | H13: 1697465.6 | J13: =IF(B13=0,0,((C13/B13)*100)-100) -> -0.27458708333331572 | K13: =IF(C13=0,0,IF(D13=0,0,((C13/D13)*100)-100)) -> -6.5938625545344962 | L13: =IF(F13=0,0,((C13/F13)*100)-100) -> 9.5864551042992758 | M13: =IF(G13=0,0,((C13/G13)*100)-100) -> 28.314597633620338 | N13: =IF(C13=0,0,IF(H13=0,0,((C13/H13)*100)-100)) -> 40.999022896251915 | P13: 2400000 | Q13: =IF(C13=0,0,((C13/P13)*100)-100) -> -0.27458708333331572 | R13: =IF(C13=0,0,(C13/$C$43)*100) -> 1.4059661798573768 | T13: 16.97 | U13: 17.308191495705806 | V13: 18.714417331045478 | W13: =U13-T13 -> 0.3381914957058072
A14: P.G. Centro | B14: 2400000 | C14: 2298235.65 | D14: 2552493.51 | F14: 2214644.71 | G14: 1877311.05 | H14: 1814507.17 | J14: =IF(B14=0,0,((C14/B14)*100)-100) -> -4.2401812500000062 | K14: =IF(C14=0,0,IF(D14=0,0,((C14/D14)*100)-100)) -> -9.9611559835072683 | L14: =IF(F14=0,0,((C14/F14)*100)-100) -> 3.7744627669871136 | M14: =IF(G14=0,0,((C14/G14)*100)-100) -> 22.421675939104489 | N14: =IF(C14=0,0,IF(H14=0,0,((C14/H14)*100)-100)) -> 26.658945635359487 | P14: 2400000 | Q14: =IF(C14=0,0,((C14/P14)*100)-100) -> -4.2401812500000062 | R14: =IF(C14=0,0,(C14/$C$43)*100) -> 1.3500577497159838 | T14: 17.99 | U14: 18.131340247898429 | V14: 19.562149982313606 | W14: =U14-T14 -> 0.14134024789843025
A15: Maringa | B15: 3899999 | C15: 4150445.13 | D15: 4092424.2 | F15: 3324390.21 | G15: 3023946.33 | H15: 2951827.38 | J15: =IF(B15=0,0,((C15/B15)*100)-100) -> 6.421697287614677 | K15: =IF(C15=0,0,IF(D15=0,0,((C15/D15)*100)-100)) -> 1.4177643168076202 | L15: =IF(F15=0,0,((C15/F15)*100)-100) -> 24.848314061182379 | M15: =IF(G15=0,0,((C15/G15)*100)-100) -> 37.252605604280006 | N15: =IF(C15=0,0,IF(H15=0,0,((C15/H15)*100)-100)) -> 40.605956775155335 | P15: 3900000 | Q15: =IF(C15=0,0,((C15/P15)*100)-100) -> 6.421670000000006 | R15: =IF(C15=0,0,(C15/$C$43)*100) -> 2.4381053407327764 | T15: 17.18 | U15: 17.721498592609993 | V15: 18.788706897084072 | W15: =U15-T15 -> 0.54149859260999378
A16: Centenario | B16: 0 | C16: 0 | D16: 0 | F16: 0 | G16: 1360223.16 | H16: 1232621.36 | J16: =IF(B16=0,0,((C16/B16)*100)-100) -> 0 | K16: =IF(C16=0,0,IF(D16=0,0,((C16/D16)*100)-100)) -> 0 | L16: =IF(F16=0,0,((C16/F16)*100)-100) -> 0 | M16: =IF(G16=0,0,((C16/G16)*100)-100) -> -100 | N16: =IF(C16=0,0,IF(H16=0,0,((C16/H16)*100)-100)) -> 0 | P16: 0 | Q16: =IF(C16=0,0,((C16/P16)*100)-100) -> 0 | R16: =IF(C16=0,0,(C16/$C$43)*100) -> 0 | T16: 0 | U16: 0 | V16: 0 | W16: =U16-T16 -> 0
A17: Cristo Rei | B17: 3150000 | C17: 3247733.31 | D17: 3385221.41 | F17: 2778407.92 | G17: 2425456.6 | H17: 2094485.58 | J17: =IF(B17=0,0,((C17/B17)*100)-100) -> 3.1026447619047559 | K17: =IF(C17=0,0,IF(D17=0,0,((C17/D17)*100)-100)) -> -4.061421199625471 | L17: =IF(F17=0,0,((C17/F17)*100)-100) -> 16.891882096276206 | M17: =IF(G17=0,0,((C17/G17)*100)-100) -> 33.901934588316266 | N17: =IF(C17=0,0,IF(H17=0,0,((C17/H17)*100)-100)) -> 55.061144417141321 | P17: 3150000 | Q17: =IF(C17=0,0,((C17/P17)*100)-100) -> 3.1026447619047559 | R17: =IF(C17=0,0,(C17/$C$43)*100) -> 1.9078233009640435 | T17: 17.79 | U17: 18.189031789682261 | V17: 19.516363912897759 | W17: =U17-T17 -> 0.39903178968226172
A18: Fazenda | B18: 4100000 | C18: 3958666.07 | D18: 4465698.25 | F18: 2747625.57 | G18: 2985821.47 | H18: 0 | J18: =IF(B18=0,0,((C18/B18)*100)-100) -> -3.4471690243902486 | K18: =IF(C18=0,0,IF(D18=0,0,((C18/D18)*100)-100)) -> -11.353928358236033 | L18: =IF(F18=0,0,((C18/F18)*100)-100) -> 44.075892771663206 | M18: =IF(G18=0,0,((C18/G18)*100)-100) -> 32.582142293993201 | N18: =IF(C18=0,0,IF(H18=0,0,((C18/H18)*100)-100)) -> 0 | P18: 4100000 | Q18: =IF(C18=0,0,((C18/P18)*100)-100) -> -3.4471690243902486 | R18: =IF(C18=0,0,(C18/$C$43)*100) -> 2.325448135112349 | T18: 14.75 | U18: 15.719489433974914 | V18: 17.393786235675091 | W18: =U18-T18 -> 0.96948943397491405
A19: Campo Largo | B19: 4500000 | C19: 4424943.41 | D19: 5031435.47 | F19: 3789002.99 | G19: 3581633.49 | H19: 2876003.87 | J19: =IF(B19=0,0,((C19/B19)*100)-100) -> -1.6679242222222115 | K19: =IF(C19=0,0,IF(D19=0,0,((C19/D19)*100)-100)) -> -12.054056215491912 | L19: =IF(F19=0,0,((C19/F19)*100)-100) -> 16.783845821140403 | M19: =IF(G19=0,0,((C19/G19)*100)-100) -> 23.545399671812859 | N19: =IF(C19=0,0,IF(H19=0,0,((C19/H19)*100)-100)) -> 53.857352424216316 | P19: 4500000 | Q19: =IF(C19=0,0,((C19/P19)*100)-100) -> -1.6679242222222115 | R19: =IF(C19=0,0,(C19/$C$43)*100) -> 2.5993544842649938 | T19: 16 | U19: 16.874561498629426 | V19: 18.504546976793989 | W19: =U19-T19 -> 0.87456149862942567
A20: Brasilia | B20: 3300000 | C20: 3248556.82 | D20: 3724585.65 | F20: 2670072.92 | G20: 2481626.79 | H20: 2503404.87 | J20: =IF(B20=0,0,((C20/B20)*100)-100) -> -1.5588842424242557 | K20: =IF(C20=0,0,IF(D20=0,0,((C20/D20)*100)-100)) -> -12.780719111668176 | L20: =IF(F20=0,0,((C20/F20)*100)-100) -> 21.665471967709408 | M20: =IF(G20=0,0,((C20/G20)*100)-100) -> 30.904325867629751 | N20: =IF(C20=0,0,IF(H20=0,0,((C20/H20)*100)-100)) -> 29.765538883848194 | P20: 3300000 | Q20: =IF(C20=0,0,((C20/P20)*100)-100) -> -1.5588842424242557 | R20: =IF(C20=0,0,(C20/$C$43)*100) -> 1.9083070573001131 | T20: 16.35 | U20: 16.429666549591087 | V20: 18.249157061073046 | W20: =U20-T20 -> 7.9666549591085101E-2
A21: Cajuru | B21: 5500000 | C21: 5337281.4 | D21: 5734975.4699999997 | F21: 4480222.72 | G21: 0 | H21: 0 | J21: =IF(B21=0,0,((C21/B21)*100)-100) -> -2.9585199999999929 | K21: =IF(C21=0,0,IF(D21=0,0,((C21/D21)*100)-100)) -> -6.9345382919309912 | L21: =IF(F21=0,0,((C21/F21)*100)-100) -> 19.129823081652518 | M21: =IF(G21=0,0,((C21/G21)*100)-100) -> 0 | N21: =IF(C21=0,0,IF(H21=0,0,((C21/H21)*100)-100)) -> 0 | P21: 5500000 | Q21: =IF(C21=0,0,((C21/P21)*100)-100) -> -2.9585199999999929 | R21: =IF(C21=0,0,(C21/$C$43)*100) -> 3.1352912467809713 | T21: 15.5 | U21: 16.532271433168201 | V21: 18.11246146024828 | W21: =U21-T21 -> 1.0322714331682015
A22: Total Super | B22: =SUM(B6:B21) -> 49849999 | C22: =SUM(C6:C21) -> 50105130.549999997 | D22: =SUM(D6:D21) -> 54927362.789999999 | F22: =SUM(F6:F21) -> 42316198.390000008 | G22: =SUM(G6:G21) -> 40482429.640000008 | H22: =SUM(H6:H21) -> 31497627.82 | I22: =SUM(B22:H22) -> 269178748.19000006 | J22: =IF(C22=0,0,((C22/B22)*100)-100) -> 0.5117985057532195 | K22: =IF(C22=0,0,IF(D22=0,0,((C22/D22)*100)-100)) -> -8.779289583657075 | L22: =IF(F22=0,0,IF(C22=0,0,((C22/F22)*100)-100)) -> 18.406502607381285 | M22: =IF(G22=0,0,IF(C22=0,0,((C22/G22)*100)-100)) -> 23.770067645574215 | N22: =IF(C22=0,0,IF(H22=0,0,((C22/H22)*100)-100)) -> 59.075886083665068 | P22: =SUM(P6:P21) -> 49850000 | Q22: =IF(C22=0,0,((C22/P22)*100)-100) -> 0.51179648946839507 | R22: =IF(C22=0,0,(C22/$C$43)*100) -> 29.433369811123843 | T22: 16.290850935022085 | U22: 16.796621887057434 | V22: 18.324005976270229 | W22: =U22-T22 -> 0.50577095203534839
A23: Pinheirinho | B23: 5100000 | C23: 5370265.7199999997 | D23: 5826228.2699999996 | F23: 4797957.03 | G23: 5484807.3099999996 | H23: 4579249.77 | J23: =IF(B23=0,0,((C23/B23)*100)-100) -> 5.2993278431372488 | K23: =IF(C23=0,0,IF(D23=0,0,((C23/D23)*100)-100)) -> -7.8260330503665614 | L23: =IF(F23=0,0,((C23/F23)*100)-100) -> 11.928174563080645 | M23: =IF(G23=0,0,((C23/G23)*100)-100) -> -2.0883430087172883 | N23: =IF(C23=0,0,IF(H23=0,0,((C23/H23)*100)-100)) -> 17.273920177540347 | P23: 5100000 | Q23: =IF(C23=0,0,IF(P23=0,0,((C23/P23)*100)-100)) -> 5.2993278431372488 | R23: =IF(C23=0,0,(C23/$C$43)*100) -> 3.1546673002483829 | T23: 16.6 | U23: 16.510065051306253 | V23: 17.867126656816527 | W23: =U23-T23 -> -8.9934948693748851E-2
A24: Londrina | B24: 5299999 | C24: 5692106.3499999996 | D24: 5910666.3600000003 | F24: 4373825.98 | G24: 3776939.14 | H24: 3472147.31 | J24: =IF(B24=0,0,((C24/B24)*100)-100) -> 7.3982532826892822 | K24: =IF(C24=0,0,IF(D24=0,0,((C24/D24)*100)-100)) -> -3.6977219942423005 | L24: =IF(F24=0,0,((C24/F24)*100)-100) -> 30.140210790919468 | M24: =IF(G24=0,0,((C24/G24)*100)-100) -> 50.706859152620581 | N24: =IF(C24=0,0,IF(H24=0,0,((C24/H24)*100)-100)) -> 63.936199757607625 | P24: 5300000 | Q24: =IF(C24=0,0,IF(P24=0,0,((C24/P24)*100)-100)) -> 7.3982330188679271 | R24: =IF(C24=0,0,(C24/$C$43)*100) -> 3.3437268671839901 | T24: 16.29 | U24: 16.495782307370277 | V24: 17.846445100239563 | W24: =U24-T24 -> 0.20578230737027781
A25: São Bráz | B25: 5950000 | C25: 6267122.2400000002 | D25: 6506217.7400000002 | F25: 5483703.9100000001 | G25: 5380635.21 | H25: 5050091 | J25: =IF(B25=0,0,((C25/B25)*100)-100) -> 5.3297855462185026 | K25: =IF(C25=0,0,IF(D25=0,0,((C25/D25)*100)-100)) -> -3.6748770108022768 | L25: =IF(F25=0,0,((C25/F25)*100)-100) -> 14.28629887495147 | M25: =IF(G25=0,0,((C25/G25)*100)-100) -> 16.475508846101476 | N25: =IF(C25=0,0,IF(H25=0,0,((C25/H25)*100)-100)) -> 24.099194252143178 | P25: 5950000 | Q25: =IF(C25=0,0,IF(P25=0,0,((C25/P25)*100)-100)) -> 5.3297855462185026 | R25: =IF(C25=0,0,(C25/$C$43)*100) -> 3.6815097479361598 | T25: 15.87 | U25: 15.848330295213772 | V25: 17.171791367516072 | W25: =U25-T25 -> -2.1669704786226873E-2
A26: S.J. Pinhais | B26: 5900000 | C26: 6126602.3799999999 | D26: 6429004.9100000001 | F26: 6468278.2300000004 | G26: 6282022.7800000003 | H26: 5556268.9299999997 | J26: =IF(B26=0,0,((C26/B26)*100)-100) -> 3.8407183050847493 | K26: =IF(C26=0,0,IF(D26=0,0,((C26/D26)*100)-100)) -> -4.7037221814783265 | L26: =IF(F26=0,0,((C26/F26)*100)-100) -> -5.282330750945448 | M26: =IF(G26=0,0,((C26/G26)*100)-100) -> -2.4740502453256141 | N26: =IF(C26=0,0,IF(H26=0,0,((C26/H26)*100)-100)) -> 10.264684038610781 | P26: 5900000 | Q26: =IF(C26=0,0,IF(P26=0,0,((C26/P26)*100)-100)) -> 3.8407183050847493 | R26: =IF(C26=0,0,(C26/$C$43)*100) -> 3.5989638497459522 | T26: 16.65 | U26: 16.850753521562794 | V26: 18.199174383175816 | W26: =U26-T26 -> 0.20075352156279536
A27: P.G. Nova | B27: 7000000 | C27: 7012117.4199999999 | D27: 7419551.9500000002 | F27: 6177812.1399999997 | G27: 6001865.0800000001 | H27: 4417916.14 | J27: =IF(B27=0,0,((C27/B27)*100)-100) -> 0.1731060000000042 | K27: =IF(C27=0,0,IF(D27=0,0,((C27/D27)*100)-100)) -> -5.4913629926130625 | L27: =IF(F27=0,0,((C27/F27)*100)-100) -> 13.504866465557512 | M27: =IF(G27=0,0,((C27/G27)*100)-100) -> 16.832306733559548 | N27: =IF(C27=0,0,IF(H27=0,0,((C27/H27)*100)-100)) -> 58.720020882967702 | P27: 7000000 | Q27: =IF(C27=0,0,IF(P27=0,0,((C27/P27)*100)-100)) -> 0.1731060000000042 | R27: =IF(C27=0,0,(C27/$C$43)*100) -> 4.1191439462656714 | T27: 15.62 | U27: 16.552791104002932 | V27: 17.830242882612765 | W27: =U27-T27 -> 0.93279110400293241
A28: Nilo Pecanha | B28: 15500000 | C28: 15895449.109999999 | D28: 17058493.120000001 | F28: 14014035.619999999 | G28: 13590968.57 | H28: 12394357.560000001 | J28: =IF(B28=0,0,((C28/B28)*100)-100) -> 2.5512845806451594 | K28: =IF(C28=0,0,IF(D28=0,0,((C28/D28)*100)-100)) -> -6.8179762527582568 | L28: =IF(F28=0,0,((C28/F28)*100)-100) -> 13.425208419728563 | M28: =IF(G28=0,0,((C28/G28)*100)-100) -> 16.955969901120866 | N28: =IF(C28=0,0,IF(H28=0,0,((C28/H28)*100)-100)) -> 28.247462872129688 | P28: 15500000 | Q28: =IF(C28=0,0,IF(P28=0,0,((C28/P28)*100)-100)) -> 2.5512845806451594 | R28: =IF(C28=0,0,(C28/$C$43)*100) -> 9.337499510187973 | T28: 16.6 | U28: 17.053406172680326 | V28: 18.538246728405902 | W28: =U28-T28 -> 0.45340617268032446
A29: Champagnat | B29: 6950000 | C29: 7191455.75 | D29: 7630879.2199999997 | F29: 6442066.2699999996 | G29: 6887847.0499999998 | H29: 7036972.5300000003 | J29: =IF(B29=0,0,((C29/B29)*100)-100) -> 3.4741834532374014 | K29: =IF(C29=0,0,IF(D29=0,0,((C29/D29)*100)-100)) -> -5.7584906972226975 | L29: =IF(F29=0,0,((C29/F29)*100)-100) -> 11.632750248003902 | M29: =IF(G29=0,0,((C29/G29)*100)-100) -> 4.4078896902915403 | N29: =IF(C29=0,0,IF(H29=0,0,((C29/H29)*100)-100)) -> 2.1953079870840213 | P29: 6950000 | Q29: =IF(C29=0,0,IF(P29=0,0,((C29/P29)*100)-100)) -> 3.4741834532374014 | R29: =IF(C29=0,0,(C29/$C$43)*100) -> 4.2244930658120596 | T29: 17.1 | U29: 17.566963718020514 | V29: 18.800786461072224 | W29: =U29-T29 -> 0.46696371802051218
A30: Araucária Nova | B30: 7600000 | C30: 7642472.2800000003 | D30: 8017524.2000000002 | F30: 4743960.98 | G30: 4007702.74 | H30: 3549353.35 | J30: =IF(B30=0,0,((C30/B30)*100)-100) -> 0.55884578947369334 | K30: =IF(C30=0,0,IF(D30=0,0,((C30/D30)*100)-100)) -> -4.6779019388553849 | L30: =IF(F30=0,0,((C30/F30)*100)-100) -> 61.098970084699147 | M30: =IF(G30=0,0,((C30/G30)*100)-100) -> 90.694589289823426 | N30: =IF(C30=0,0,IF(H30=0,0,((C30/H30)*100)-100)) -> 115.32013091905884 | P30: 7600000 | Q30: =IF(C30=0,0,IF(P30=0,0,((C30/P30)*100)-100)) -> 0.55884578947369334 | R30: =IF(C30=0,0,(C30/$C$43)*100) -> 4.4894347229378262 | T30: 15.9 | U30: 16.160940166341042 | V30: 17.636023981757905 | W30: =U30-T30 -> 0.260940166341042
A31: Santa Candida | B31: 8800000 | C31: 9074055.7699999996 | D31: 9661818.3800000008 | F31: 8022996.2999999998 | G31: 7584456.5300000003 | H31: 6620332.0099999998 | J31: =IF(B31=0,0,((C31/B31)*100)-100) -> 3.1142701136363655 | K31: =IF(C31=0,0,IF(D31=0,0,((C31/D31)*100)-100)) -> -6.0833539493629019 | L31: =IF(F31=0,0,((C31/F31)*100)-100) -> 13.100585251422842 | M31: =IF(G31=0,0,((C31/G31)*100)-100) -> 19.640157921770026 | N31: =IF(C31=0,0,IF(H31=0,0,((C31/H31)*100)-100)) -> 37.063454767731486 | P31: 8800000 | Q31: =IF(C31=0,0,IF(P31=0,0,((C31/P31)*100)-100)) -> 3.1142701136363655 | R31: =IF(C31=0,0,(C31/$C$43)*100) -> 5.3303930402626634 | T31: 16.2745 | U31: 16.73195236709461 | V31: 18.141849842300452 | W31: =U31-T31 -> 0.45745236709461068
A32: Paranaguá Raia | B32: 8600000 | C32: 8493103.8499999996 | D32: 9313697.2300000004 | F32: 7674157.96 | G32: 0 | H32: 6627905.9800000004 | J32: =IF(B32=0,0,((C32/B32)*100)-100) -> -1.2429784883720885 | K32: =IF(C32=0,0,IF(D32=0,0,((C32/D32)*100)-100)) -> -8.8106082872955938 | L32: =IF(F32=0,0,((C32/F32)*100)-100) -> 10.671475545181508 | M32: =IF(G32=0,0,((C32/G32)*100)-100) -> 0 | N32: =IF(C32=0,0,IF(H32=0,0,((C32/H32)*100)-100)) -> 28.141586130345189 | P32: 8600000 | Q32: =IF(C32=0,0,IF(P32=0,0,((C32/P32)*100)-100)) -> -1.2429784883720885 | R32: =IF(C32=0,0,(C32/$C$43)*100) -> 4.9891231440236155 | T32: 18.48 | U32: 18.498726029353804 | V32: 19.729282686211356 | W32: =U32-T32 -> 1.8726029353803852E-2
A33: Novo Mundo | B33: 7100000 | C33: 6995851.0199999996 | D33: 7753911.8600000003 | F33: 5608088.2000000002 | G33: 5851144.29 | H33: 0 | J33: =IF(B33=0,0,((C33/B33)*100)-100) -> -1.4668870422535321 | K33: =IF(C33=0,0,IF(D33=0,0,((C33/D33)*100)-100)) -> -9.7764954475507864 | L33: =IF(F33=0,0,((C33/F33)*100)-100) -> 24.745738128726273 | M33: =IF(G33=0,0,((C33/G33)*100)-100) -> 19.563809628765782 | N33: =IF(C33=0,0,IF(H33=0,0,((C33/H33)*100)-100)) -> 0 | P33: 7100000 | Q33: =IF(C33=0,0,IF(P33=0,0,((C33/P33)*100)-100)) -> -1.4668870422535321 | R33: =IF(C33=0,0,(C33/$C$43)*100) -> 4.1095885382377864 | T33: 15.8 | U33: 16.658942404122264 | V33: 17.995867361966781 | W33: =U33-T33 -> 0.85894240412226353
A34: Água Verde | B34: 7400000 | C34: 7695403.9400000004 | D34: 8092860.71 | F34: 6359341.2000000002 | G34: 0 | H34: 0 | J34: =IF(B34=0,0,((C34/B34)*100)-100) -> 3.9919451351351398 | K34: =IF(C34=0,0,IF(D34=0,0,((C34/D34)*100)-100)) -> -4.9112024071893359 | L34: =IF(F34=0,0,((C34/F34)*100)-100) -> 21.00945204827191 | M34: =IF(G34=0,0,((C34/G34)*100)-100) -> 0 | N34: =IF(C34=0,0,IF(H34=0,0,((C34/H34)*100)-100)) -> 0 | P34: 7400000 | Q34: =IF(C34=0,0,IF(P34=0,0,((C34/P34)*100)-100)) -> 3.9919451351351398 | R34: =IF(C34=0,0,(C34/$C$43)*100) -> 4.5205284873167457 | T34: 15.8 | U34: 17.408488988298647 | V34: 18.590115703529918 | W34: =U34-T34 -> 1.6084889882986459
A35: Uvaranas | B35: 6300000 | C35: 6219686.9500000002 | D35: 6483511.54 | F35: 5496404.25 | G35: 5007199.86 | H35: 5100418.98 | J35: =IF(B35=0,0,((C35/B35)*100)-100) -> -1.2748103174603216 | K35: =IF(C35=0,0,IF(D35=0,0,((C35/D35)*100)-100)) -> -4.0691620331410689 | L35: =IF(F35=0,0,((C35/F35)*100)-100) -> 13.159197670003991 | M35: =IF(G35=0,0,((C35/G35)*100)-100) -> 24.21487306080887 | N35: =IF(C35=0,0,IF(H35=0,0,((C35/H35)*100)-100)) -> 21.944627968583077 | P35: 6300000 | Q35: =IF(C35=0,0,IF(P35=0,0,((C35/P35)*100)-100)) -> -1.2748103174603216 | R35: =IF(C35=0,0,(C35/$C$43)*100) -> 3.653644728579017 | T35: 16.090699999999998 | U35: 16.481748202777315 | V35: 17.695209859396542 | W35: =U35-T35 -> 0.39104820277731633
A36: Torres | B36: 7199999 | C36: 7203326.0700000003 | D36: 7928806.2699999996 | F36: 6126875.3799999999 | G36: 5755865.54 | H36: 5090387.72 | J36: =IF(B36=0,0,((C36/B36)*100)-100) -> 4.6209311973527178E-2 | K36: =IF(C36=0,0,IF(D36=0,0,((C36/D36)*100)-100)) -> -9.1499297031001845 | L36: =IF(F36=0,0,((C36/F36)*100)-100) -> 17.569325687835359 | M36: =IF(G36=0,0,((C36/G36)*100)-100) -> 25.147573721814226 | N36: =IF(C36=0,0,IF(H36=0,0,((C36/H36)*100)-100)) -> 41.508397124610383 | P36: 7200000 | Q36: =IF(C36=0,0,IF(P36=0,0,((C36/P36)*100)-100)) -> 4.6195416666662936E-2 | R36: =IF(C36=0,0,(C36/$C$43)*100) -> 4.2314660746536941 | T36: 16.2 | U36: 16.992912828115248 | V36: 18.338523238612741 | W36: =U36-T36 -> 0.79291282811524866
A37: Total Hiper | B37: =SUM(B23:B36) -> 104699998 | C37: =SUM(C23:C36) -> 106879018.84999999 | D37: =SUM(D23:D36) -> 114033171.75999999 | F37: =SUM(F23:F36) -> 91789503.450000003 | G37: =SUM(G23:G36) -> 75611454.100000009 | H37: =SUM(H23:H36) -> 69495401.280000001 | I37: =SUM(B37:H37) -> 562508547.44000006 | J37: =IF(C37=0,0,((C37/B37)*100)-100) -> 2.0812042899943464 | K37: =IF(C37=0,0,IF(D37=0,0,((C37/D37)*100)-100)) -> -6.2737471909112514 | L37: =IF(F37=0,0,IF(C37=0,0,((C37/F37)*100)-100)) -> 16.439260299757066 | M37: =IF(G37=0,0,IF(C37=0,0,((C37/G37)*100)-100)) -> 41.352947277864843 | N37: =IF(C37=0,0,IF(H37=0,0,((C37/H37)*100)-100)) -> 53.792937203685995 | P37: =SUM(P23:P36) -> 104700000 | Q37: =IF(C37=0,0,((C37/P37)*100)-100) -> 2.0812023400190895 | R37: =IF(C37=0,0,(C37/$C$43)*100) -> 62.784183023391535 | T37: 16.420616144710912 | U37: 16.901985511817784 | V37: 18.241523681988781 | W37: =U37-T37 -> 0.48136936710687195
A38: Total s/ 33,36,38 | B38: =B22+B37 -> 154549997 | C38: =C22+C37 -> 156984149.39999998 | D38: =D22+D37 -> 168960534.54999998 | E38: =E22+E37 -> 0 | F38: =F22+F37 -> 134105701.84 | G38: =G22+G37 -> 116093883.74000001 | H38: =H22+H37 -> 100993029.09999999 | I38: =SUM(B38:H38) -> 831687295.63 | J38: =IF(C38=0,0,((C38/B38)*100)-100) -> 1.5749934954705935 | K38: =IF(C38=0,0,IF(D38=0,0,((C38/D38)*100)-100)) -> -7.0882737095365087 | L38: =IF(F38=0,0,IF(C38=0,0,((C38/F38)*100)-100)) -> 17.060011055529898 | M38: =IF(G38=0,0,IF(C38=0,0,((C38/G38)*100)-100)) -> 35.221722577200069 | N38: =IF(C38=0,0,IF(H38=0,0,((C38/H38)*100)-100)) -> 55.44057921518467 | P38: =P22+P37 -> 154550000 | Q38: =IF(C38=0,0,((C38/P38)*100)-100) -> 1.5749915237786922 | R38: =IF(C38=0,0,(C38/$C$43)*100) -> 92.217552834515374 | T38: 16.378760462415279 | U38: 16.868356268394066 | V38: 18.267849818346058 | W38: =U38-T38 -> 0.48959580597878727
A39: S.J.P - Rua Joinvile | B39: 5900000 | C39: 5463664.1200000001 | D39: 6002247.2800000003 | F39: 0 | G39: 0 | H39: 0 | J39: =IF(B39=0,0,((C39/B39)*100)-100) -> -7.3955233898305011 | K39: =IF(C39=0,0,IF(D39=0,0,((C39/D39)*100)-100)) -> -8.973025183327664 | L39: =IF(F39=0,0,((C39/F39)*100)-100) -> 0 | M39: =IF(G39=0,0,((C39/G39)*100)-100) -> 0 | N39: =IF(C39=0,0,IF(H39=0,0,((C39/H39)*100)-100)) -> 0 | P39: 5900000 | Q39: =IF(P39=0,0,IF(C39=0,0,((C39/P39)*100)-100)) -> -7.3955233898305011 | R39: =IF(C39=0,0,(C39/$C$43)*100) -> 3.209532532945941 | T39: 15.25 | U39: 16.717228609580047 | V39: 17.991496640536532 | W39: =U39-T39 -> 1.4672286095800473
A40: Castro | B40: 3900000 | C40: 3437957.46 | D40: 4067997.14 | F40: 0 | G40: 0 | H40: 0 | J40: =IF(B40=0,0,((C40/B40)*100)-100) -> -11.847244615384611 | K40: =IF(C40=0,0,IF(D40=0,0,((C40/D40)*100)-100)) -> -15.487711970220317 | L40: =IF(F40=0,0,((C40/F40)*100)-100) -> 0 | M40: =IF(G40=0,0,((C40/G40)*100)-100) -> 0 | N40: =IF(C40=0,0,IF(H40=0,0,((C40/H40)*100)-100)) -> 0 | P40: 3900000 | Q40: =IF(P40=0,0,IF(C40=0,0,((C40/P40)*100)-100)) -> -11.847244615384611 | R40: =IF(C40=0,0,(C40/$C$43)*100) -> 2.0195671022973123 | T40: 15.9 | U40: 16.776407410811885 | V40: 18.110840048032472 | W40: =U40-T40 -> 0.87640741081188445
B41: 0 | C41: 0 | D41: 0 | F41: 0 | G41: 0 | H41: 0 | J41: =IF(B41=0,0,((C41/B41)*100)-100) -> 0 | K41: =IF(C41=0,0,IF(D41=0,0,((C41/D41)*100)-100)) -> 0 | L41: =IF(F41=0,0,((C41/F41)*100)-100) -> 0 | M41: =IF(G41=0,0,((C41/G41)*100)-100) -> 0 | N41: =IF(C41=0,0,IF(H41=0,0,((C41/H41)*100)-100)) -> 0 | P41: 0 | Q41: =IF(P41=0,0,IF(C41=0,0,((C41/P41)*100)-100)) -> 0 | R41: =IF(C41=0,0,(C41/$C$43)*100) -> 0 | T41: 0 | U41: 0 | W41: =U41-T41 -> 0
A42: Colombo | B42: 4400000 | C42: 4346624.67 | D42: 4905579.25 | F42: 0 | G42: 0 | H42: 0 | J42: =IF(B42=0,0,((C42/B42)*100)-100) -> -1.2130756818181823 | K42: =IF(C42=0,0,IF(D42=0,0,((C42/D42)*100)-100)) -> -11.394262563386377 | L42: =IF(F42=0,0,((C42/F42)*100)-100) -> 0 | M42: =IF(G42=0,0,((C42/G42)*100)-100) -> 0 | N42: =IF(C42=0,0,IF(H42=0,0,((C42/H42)*100)-100)) -> 0 | P42: 4400000 | Q42: =IF(P42=0,0,IF(C42=0,0,((C42/P42)*100)-100)) -> -1.2130756818181823 | R42: =IF(C42=0,0,(C42/$C$43)*100) -> 2.5533475302413748 | T42: 15.5 | U42: 15.974788575430415 | V42: 17.69660769674875 | W42: =U42-T42 -> 0.47478857543041464
A43: Total Geral | B43: =B22+B37+SUM(B39:B42) -> 168749997 | C43: =C22+C37+SUM(C39:C42) -> 170232395.64999998 | D43: =D22+D37+SUM(D39:D42) -> 183936358.21999997 | F43: =F22+F37+SUM(F39:F42) -> 134105701.84 | G43: =G22+G37+SUM(G39:G42) -> 116093883.74000001 | H43: =H22+H37+SUM(H39:H42) -> 100993029.09999999 | J43: =IF(C43=0,0,((C43/B43)*100)-100) -> 0.87845847487628248 | K43: =IF(C43=0,0,IF(D43=0,0,((C43/D43)*100)-100)) -> -7.4503826772568544 | L43: =IF(F43=0,0,IF(C43=0,0,((C43/F43)*100)-100)) -> 26.938969271494756 | M43: =IF(G43=0,0,IF(C43=0,0,((C43/G43)*100)-100)) -> 46.633388569588021 | N43: =IF(C43=0,0,IF(H43=0,0,((C43/H43)*100)-100)) -> 68.55856009768894 | P43: =P22+P37+SUM(P39:P42) -> 168750000 | Q43: =IF(C43=0,0,((C43/P43)*100)-100) -> 0.87845668148148093 | R43: =R22+R37+SUM(R39:R42) -> 100 | T43: 16.31 | U43: 16.838832919520161 | V43: 18.241223458926285 | W43: =U43-T43 -> 0.52883291952016265
A45: Água Verde | B45: 0 | C45: 0 | D45: 0 | F45: 0 | G45: 0 | H45: 0 | J45: =IF(B45=0,0,((C45/B45)*100)-100) -> 0 | K45: =IF(C45=0,0,IF(D45=0,0,((C45/D45)*100)-100)) -> 0 | L45: =IF(F45=0,0,((C45/F45)*100)-100) -> 0 | M45: =IF(G45=0,0,((C45/G45)*100)-100) -> 0 | N45: =IF(C45=0,0,IF(H45=0,0,((C45/H45)*100)-100)) -> 0 | P45: =B45 -> 0 | Q45: =IF(C45=0,0,IF(P45=0,0,((C45/P45)*100)-100)) -> 0 | R45: =IF(C45=0,0,(C45/$C$43)*100) -> 0 | T45: 14.95 | U45: 0 | W45: =U45-T45 -> -14.95
A46: Total Geral | B46: =B43+B45 -> 168749997 | C46: =C43+C45 -> 170232395.64999998 | D46: =D43+D45 -> 183936358.21999997 | F46: =F43+F45 -> 134105701.84 | G46: =G43+G45 -> 116093883.74000001 | H46: =H43+H45 -> 100993029.09999999 | J46: =IF(C46=0,0,((C46/B46)*100)-100) -> 0.87845847487628248 | K46: =IF(C46=0,0,IF(D46=0,0,((C46/D46)*100)-100)) -> -7.4503826772568544 | L46: =IF(F46=0,0,IF(C46=0,0,((C46/F46)*100)-100)) -> 26.938969271494756 | M46: =IF(G46=0,0,IF(C46=0,0,((C46/G46)*100)-100)) -> 46.633388569588021 | N46: =IF(C46=0,0,IF(H46=0,0,((C46/H46)*100)-100)) -> 68.55856009768894 | P46: =P43+P45 -> 168750000 | Q46: =IF(C46=0,0,((C46/P46)*100)-100) -> 0.87845668148148093 | R46: =R25+R40+R45 -> 5.7010768502334717 | T46: 16.305318099235286 | U46: 16.838832919520161 | W46: =U46-T46 -> 0.53351482028487496