A2: Periodo: | C2: 38961 | D2: a | E2: 38990 | H2: Vendas Acumuladas por Filial | Q2: =NOW() -> 39022.622366550902
A4: v.1 | C4: Vendas 2006 | G4: Vendas de Anos Anteriores | K4: Percentuais ( % ) | Q4: Meta Mensal | U4: Margem
A5: Lojas | C5: Previsao | D5: Realizada | E5: Mes Anterior | G5: Vendas 2005 | H5: Vendas 2004 | I5: Vendas 2003 | K5: % Prev | L5: % MA | M5: 2005 | N5: 2004 | O5: 2003 | Q5: Previsao Mes | R5: Final | S5: Part. | U5: Meta | V5: Condor
A7: Xaxim | C7: 710000 | D7: 687271 | E7: 628406 | G7: 684763 | H7: 838924 | I7: 766681 | K7: =IF(C7=0,0,((D7/C7)*100)-100) -> -3.2 | L7: =IF(D7=0,0,IF(E7=0,0,((D7/E7)*100)-100)) -> 9.37 | M7: =IF(G7=0,0,((D7/G7)*100)-100) -> 0.37 | N7: =IF(H7=0,0,((D7/H7)*100)-100) -> -18.08 | O7: =IF(D7=0,0,IF(I7=0,0,((D7/I7)*100)-100)) -> -10.36 | Q7: 710000 | R7: =IF(D7=0,0,((D7/Q7)*100)-100) -> -3.2 | S7: =IF(D7=0,0,(D7/$D$37)*100) -> 1.16 | U7: 16.45 | V7: 14.88
A8: S. Felicidade | C8: 810000 | D8: 860848 | E8: 812042 | G8: 691528 | H8: 766496 | I8: 725571 | K8: =IF(C8=0,0,((D8/C8)*100)-100) -> 6.28 | L8: =IF(D8=0,0,IF(E8=0,0,((D8/E8)*100)-100)) -> 6.01 | M8: =IF(G8=0,0,((D8/G8)*100)-100) -> 24.48 | N8: =IF(H8=0,0,((D8/H8)*100)-100) -> 12.31 | O8: =IF(D8=0,0,IF(I8=0,0,((D8/I8)*100)-100)) -> 18.64 | Q8: 810000 | R8: =IF(D8=0,0,((D8/Q8)*100)-100) -> 6.28 | S8: =IF(D8=0,0,(D8/$D$37)*100) -> 1.46 | U8: 16.5 | V8: 15.62
A9: Lapa | C9: 1250000 | D9: 1103469 | E9: 997592 | G9: 1119870 | H9: 1223910 | I9: 1003327 | K9: =IF(C9=0,0,((D9/C9)*100)-100) -> -11.72 | L9: =IF(D9=0,0,IF(E9=0,0,((D9/E9)*100)-100)) -> 10.61 | M9: =IF(G9=0,0,((D9/G9)*100)-100) -> -1.46 | N9: =IF(H9=0,0,((D9/H9)*100)-100) -> -9.84 | O9: =IF(D9=0,0,IF(I9=0,0,((D9/I9)*100)-100)) -> 9.98 | Q9: 1250000 | R9: =IF(D9=0,0,((D9/Q9)*100)-100) -> -11.72 | S9: =IF(D9=0,0,(D9/$D$37)*100) -> 1.87 | U9: 16.25 | V9: 14.6
A10: Araucaria | C10: 985000 | D10: 917650 | E10: 863811 | G10: 897389 | H10: 929713 | I10: 977421 | K10: =IF(C10=0,0,((D10/C10)*100)-100) -> -6.84 | L10: =IF(D10=0,0,IF(E10=0,0,((D10/E10)*100)-100)) -> 6.23 | M10: =IF(G10=0,0,((D10/G10)*100)-100) -> 2.26 | N10: =IF(H10=0,0,((D10/H10)*100)-100) -> -1.3 | O10: =IF(D10=0,0,IF(I10=0,0,((D10/I10)*100)-100)) -> -6.12 | Q10: 985000 | R10: =IF(D10=0,0,((D10/Q10)*100)-100) -> -6.84 | S10: =IF(D10=0,0,(D10/$D$37)*100) -> 1.55 | U10: 17.55 | V10: 17.14
A11: Pinheirinho | C11: 0 | D11: 0 | E11: 0 | G11: 0 | H11: 0 | I11: 0 | K11: =IF(C11=0,0,((D11/C11)*100)-100) -> 0 | L11: =IF(D11=0,0,IF(E11=0,0,((D11/E11)*100)-100)) -> 0 | M11: =IF(G11=0,0,((D11/G11)*100)-100) -> 0 | N11: =IF(H11=0,0,((D11/H11)*100)-100) -> 0 | O11: =IF(D11=0,0,IF(I11=0,0,((D11/I11)*100)-100)) -> 0 | Q11: 0 | R11: =IF(D11=0,0,((D11/Q11)*100)-100) -> 0 | S11: =IF(D11=0,0,(D11/$D$37)*100) -> 0 | U11: 0 | V11: 0
A12: Hauer | C12: 2990000 | D12: 3054283 | E12: 2839992 | G12: 2920132 | H12: 3135473 | I12: 2898503 | K12: =IF(C12=0,0,((D12/C12)*100)-100) -> 2.15 | L12: =IF(D12=0,0,IF(E12=0,0,((D12/E12)*100)-100)) -> 7.55 | M12: =IF(G12=0,0,((D12/G12)*100)-100) -> 4.59 | N12: =IF(H12=0,0,((D12/H12)*100)-100) -> -2.59 | O12: =IF(D12=0,0,IF(I12=0,0,((D12/I12)*100)-100)) -> 5.37 | Q12: 2990000 | R12: =IF(D12=0,0,((D12/Q12)*100)-100) -> 2.15 | S12: =IF(D12=0,0,(D12/$D$37)*100) -> 5.17 | U12: 17 | V12: 15.93
A13: Paranagua | C13: 1560000 | D13: 1565008 | E13: 1512771 | G13: 1493258 | H13: 3424238 | I13: 2949278 | K13: =IF(C13=0,0,((D13/C13)*100)-100) -> 0.32 | L13: =IF(D13=0,0,IF(E13=0,0,((D13/E13)*100)-100)) -> 3.45 | M13: =IF(G13=0,0,((D13/G13)*100)-100) -> 4.8 | N13: =IF(H13=0,0,((D13/H13)*100)-100) -> -54.3 | O13: =IF(D13=0,0,IF(I13=0,0,((D13/I13)*100)-100)) -> -46.94 | Q13: 1560000 | R13: =IF(D13=0,0,((D13/Q13)*100)-100) -> 0.32 | S13: =IF(D13=0,0,(D13/$D$37)*100) -> 2.65 | U13: 17.4 | V13: 16.94
A14: Centenario | C14: 923000 | D14: 938529 | E14: 837108 | G14: 883630 | H14: 1076238 | I14: 968755 | K14: =IF(C14=0,0,((D14/C14)*100)-100) -> 1.68 | L14: =IF(D14=0,0,IF(E14=0,0,((D14/E14)*100)-100)) -> 12.12 | M14: =IF(G14=0,0,((D14/G14)*100)-100) -> 6.21 | N14: =IF(H14=0,0,((D14/H14)*100)-100) -> -12.8 | O14: =IF(D14=0,0,IF(I14=0,0,((D14/I14)*100)-100)) -> -3.12 | Q14: 923000 | R14: =IF(D14=0,0,((D14/Q14)*100)-100) -> 1.68 | S14: =IF(D14=0,0,(D14/$D$37)*100) -> 1.59 | U14: 16.6 | V14: 15.28
A15: Sao Braz | C15: 3070000 | D15: 3097299 | E15: 2825909 | G15: 2928999 | H15: 3118069 | I15: 2929933 | K15: =IF(C15=0,0,((D15/C15)*100)-100) -> 0.89 | L15: =IF(D15=0,0,IF(E15=0,0,((D15/E15)*100)-100)) -> 9.6 | M15: =IF(G15=0,0,((D15/G15)*100)-100) -> 5.75 | N15: =IF(H15=0,0,((D15/H15)*100)-100) -> -0.67 | O15: =IF(D15=0,0,IF(I15=0,0,((D15/I15)*100)-100)) -> 5.71 | Q15: 3070000 | R15: =IF(D15=0,0,((D15/Q15)*100)-100) -> 0.89 | S15: =IF(D15=0,0,(D15/$D$37)*100) -> 5.24 | U15: 16.89 | V15: 15.14
A16: Sitio Cercado | C16: 1150000 | D16: 1231596 | E16: 1043938 | G16: 1254512 | H16: 1649743 | I16: 1198168 | K16: =IF(C16=0,0,((D16/C16)*100)-100) -> 7.1 | L16: =IF(D16=0,0,IF(E16=0,0,((D16/E16)*100)-100)) -> 17.98 | M16: =IF(G16=0,0,((D16/G16)*100)-100) -> -1.83 | N16: =IF(H16=0,0,((D16/H16)*100)-100) -> -25.35 | O16: =IF(D16=0,0,IF(I16=0,0,((D16/I16)*100)-100)) -> 2.79 | Q16: 1150000 | R16: =IF(D16=0,0,((D16/Q16)*100)-100) -> 7.1 | S16: =IF(D16=0,0,(D16/$D$37)*100) -> 2.09 | U16: 16.9 | V16: 15.86
A17: Apucarana | C17: 1750000 | D17: 1798008 | E17: 1551140 | G17: 1427764 | H17: 1629979 | I17: 1349914 | K17: =IF(C17=0,0,((D17/C17)*100)-100) -> 2.74 | L17: =IF(D17=0,0,IF(E17=0,0,((D17/E17)*100)-100)) -> 15.92 | M17: =IF(G17=0,0,((D17/G17)*100)-100) -> 25.93 | N17: =IF(H17=0,0,((D17/H17)*100)-100) -> 10.31 | O17: =IF(D17=0,0,IF(I17=0,0,((D17/I17)*100)-100)) -> 33.19 | Q17: 1750000 | R17: =IF(D17=0,0,((D17/Q17)*100)-100) -> 2.74 | S17: =IF(D17=0,0,(D17/$D$37)*100) -> 3.04 | U17: 16.5 | V17: 14.79
A18: Ahu | C18: 1185000 | D18: 1138913 | E18: 1085649 | G18: 1066777 | H18: 1246862 | I18: 1250461 | K18: =IF(C18=0,0,((D18/C18)*100)-100) -> -3.89 | L18: =IF(D18=0,0,IF(E18=0,0,((D18/E18)*100)-100)) -> 4.91 | M18: =IF(G18=0,0,((D18/G18)*100)-100) -> 6.76 | N18: =IF(H18=0,0,((D18/H18)*100)-100) -> -8.66 | O18: =IF(D18=0,0,IF(I18=0,0,((D18/I18)*100)-100)) -> -8.92 | Q18: 1185000 | R18: =IF(D18=0,0,((D18/Q18)*100)-100) -> -3.89 | S18: =IF(D18=0,0,(D18/$D$37)*100) -> 1.93 | U18: 17.15 | V18: 16.68
A19: P.G. Centro | C19: 1680000 | D19: 1599175 | E19: 1518615 | G19: 1513642 | H19: 1750608 | I19: 1621539 | K19: =IF(C19=0,0,((D19/C19)*100)-100) -> -4.81 | L19: =IF(D19=0,0,IF(E19=0,0,((D19/E19)*100)-100)) -> 5.3 | M19: =IF(G19=0,0,((D19/G19)*100)-100) -> 5.65 | N19: =IF(H19=0,0,((D19/H19)*100)-100) -> -8.65 | O19: =IF(D19=0,0,IF(I19=0,0,((D19/I19)*100)-100)) -> -1.38 | Q19: 1680000 | R19: =IF(D19=0,0,((D19/Q19)*100)-100) -> -4.81 | S19: =IF(D19=0,0,(D19/$D$37)*100) -> 2.71 | U19: 18.2 | V19: 17.92
A20: Maringa | C20: 2385000 | D20: 2434008 | E20: 2239000 | G20: 2199979 | H20: 2342033 | I20: 2148664 | K20: =IF(C20=0,0,((D20/C20)*100)-100) -> 2.05 | L20: =IF(D20=0,0,IF(E20=0,0,((D20/E20)*100)-100)) -> 8.71 | M20: =IF(G20=0,0,((D20/G20)*100)-100) -> 10.64 | N20: =IF(H20=0,0,((D20/H20)*100)-100) -> 3.93 | O20: =IF(D20=0,0,IF(I20=0,0,((D20/I20)*100)-100)) -> 13.28 | Q20: 2385000 | R20: =IF(D20=0,0,((D20/Q20)*100)-100) -> 2.05 | S20: =IF(D20=0,0,(D20/$D$37)*100) -> 4.12 | U20: 18.2 | V20: 16.63
A21: Araucaria Nova | C21: 1950000 | D21: 2040588 | E21: 1878878 | G21: 1780264 | H21: 2149964 | I21: 1771505 | K21: =IF(C21=0,0,((D21/C21)*100)-100) -> 4.65 | L21: =IF(D21=0,0,IF(E21=0,0,((D21/E21)*100)-100)) -> 8.61 | M21: =IF(G21=0,0,((D21/G21)*100)-100) -> 14.62 | N21: =IF(H21=0,0,((D21/H21)*100)-100) -> -5.09 | O21: =IF(D21=0,0,IF(I21=0,0,((D21/I21)*100)-100)) -> 15.19 | Q21: 1950000 | R21: =IF(D21=0,0,((D21/Q21)*100)-100) -> 4.65 | S21: =IF(D21=0,0,(D21/$D$37)*100) -> 3.46 | U21: 17.5 | V21: 16.23
A22: Total Super | C22: =SUM(C7:C21) -> 22398000 | D22: =SUM(D7:D21) -> 22466645 | E22: =SUM(E7:E21) -> 20634851 | G22: =SUM(G7:G21) -> 20862507 | H22: =SUM(H7:H21) -> 25282250 | I22: =SUM(I7:I21) -> 22559720 | J22: =SUM(C22:I22) -> 134203973 | K22: =IF(D22=0,0,((D22/C22)*100)-100) -> 0.31 | L22: =IF(D22=0,0,IF(E22=0,0,((D22/E22)*100)-100)) -> 8.88 | M22: =IF(G22=0,0,IF(D22=0,0,((D22/G22)*100)-100)) -> 7.69 | N22: =IF(H22=0,0,IF(D22=0,0,((D22/H22)*100)-100)) -> -11.14 | O22: =IF(D22=0,0,IF(I22=0,0,((D22/I22)*100)-100)) -> -0.41 | Q22: =SUM(Q7:Q21) -> 22398000 | R22: =IF(D22=0,0,((D22/Q22)*100)-100) -> 0.31 | S22: =IF(D22=0,0,(D22/$D$37)*100) -> 38.04 | U22: 17.04 | V22: 15.87
A24: Pinheirinho | C24: 2790000 | D24: 2789921 | E24: 2542110 | G24: 1779053 | H24: 2086456 | I24: 1783647 | K24: =IF(C24=0,0,((D24/C24)*100)-100) -> 0 | L24: =IF(D24=0,0,IF(E24=0,0,((D24/E24)*100)-100)) -> 9.75 | M24: =IF(G24=0,0,((D24/G24)*100)-100) -> 56.82 | N24: =IF(H24=0,0,((D24/H24)*100)-100) -> 33.72 | O24: =IF(D24=0,0,IF(I24=0,0,((D24/I24)*100)-100)) -> 56.42 | Q24: 2790000 | R24: =IF(D24=0,0,IF(Q24=0,0,((D24/Q24)*100)-100)) -> 0 | S24: =IF(D24=0,0,(D24/$D$37)*100) -> 4.72 | U24: 16 | V24: 14.58
A25: Londrina | C25: 2900000 | D25: 2807188 | E25: 2514108 | G25: 2675642 | H25: 2407890 | I25: 2267201 | K25: =IF(C25=0,0,((D25/C25)*100)-100) -> -3.2 | L25: =IF(D25=0,0,IF(E25=0,0,((D25/E25)*100)-100)) -> 11.66 | M25: =IF(G25=0,0,((D25/G25)*100)-100) -> 4.92 | N25: =IF(H25=0,0,((D25/H25)*100)-100) -> 16.58 | O25: =IF(D25=0,0,IF(I25=0,0,((D25/I25)*100)-100)) -> 23.82 | Q25: 2900000 | R25: =IF(D25=0,0,IF(Q25=0,0,((D25/Q25)*100)-100)) -> -3.2 | S25: =IF(D25=0,0,(D25/$D$37)*100) -> 4.75 | U25: 15.6 | V25: 14.7
A26: S.J. Pinhais | C26: 4000000 | D26: 3871009 | E26: 3592665 | G26: 3693460 | H26: 4212584 | I26: 3902807 | K26: =IF(C26=0,0,((D26/C26)*100)-100) -> -3.22 | L26: =IF(D26=0,0,IF(E26=0,0,((D26/E26)*100)-100)) -> 7.75 | M26: =IF(G26=0,0,((D26/G26)*100)-100) -> 4.81 | N26: =IF(H26=0,0,((D26/H26)*100)-100) -> -8.11 | O26: =IF(D26=0,0,IF(I26=0,0,((D26/I26)*100)-100)) -> -0.81 | Q26: 4000000 | R26: =IF(D26=0,0,IF(Q26=0,0,((D26/Q26)*100)-100)) -> -3.22 | S26: =IF(D26=0,0,(D26/$D$37)*100) -> 6.55 | U26: 16.15 | V26: 15.85
A27: P.G. Nova | C27: 3450000 | D27: 3532457 | E27: 3189798 | G27: 3221964 | H27: 3481841 | I27: 2828674 | K27: =IF(C27=0,0,((D27/C27)*100)-100) -> 2.39 | L27: =IF(D27=0,0,IF(E27=0,0,((D27/E27)*100)-100)) -> 10.74 | M27: =IF(G27=0,0,((D27/G27)*100)-100) -> 9.64 | N27: =IF(H27=0,0,((D27/H27)*100)-100) -> 1.45 | O27: =IF(D27=0,0,IF(I27=0,0,((D27/I27)*100)-100)) -> 24.88 | Q27: 3450000 | R27: =IF(D27=0,0,IF(Q27=0,0,((D27/Q27)*100)-100)) -> 2.39 | S27: =IF(D27=0,0,(D27/$D$37)*100) -> 5.98 | U27: 16.7 | V27: 15.74
A28: Nilo Pecanha | C28: 8800000 | D28: 9017588 | E28: 8524597 | G28: 8493887 | H28: 7986774 | I28: 7819661 | K28: =IF(C28=0,0,((D28/C28)*100)-100) -> 2.47 | L28: =IF(D28=0,0,IF(E28=0,0,((D28/E28)*100)-100)) -> 5.78 | M28: =IF(G28=0,0,((D28/G28)*100)-100) -> 6.17 | N28: =IF(H28=0,0,((D28/H28)*100)-100) -> 12.91 | O28: =IF(D28=0,0,IF(I28=0,0,((D28/I28)*100)-100)) -> 15.32 | Q28: 8800000 | R28: =IF(D28=0,0,IF(Q28=0,0,((D28/Q28)*100)-100)) -> 2.47 | S28: =IF(D28=0,0,(D28/$D$37)*100) -> 15.27 | U28: 16.3 | V28: 15.79
A29: Champagnat | C29: 5500000 | D29: 5445603 | E29: 5089804 | G29: 5427354 | H29: 4711048 | I29: 0 | K29: =IF(C29=0,0,((D29/C29)*100)-100) -> -0.99 | L29: =IF(D29=0,0,IF(E29=0,0,((D29/E29)*100)-100)) -> 6.99 | M29: =IF(G29=0,0,((D29/G29)*100)-100) -> 0.34 | N29: =IF(H29=0,0,((D29/H29)*100)-100) -> 15.59 | O29: =IF(D29=0,0,IF(I29=0,0,((D29/I29)*100)-100)) -> 0 | Q29: 5500000 | R29: =IF(D29=0,0,IF(Q29=0,0,((D29/Q29)*100)-100)) -> -0.99 | S29: =IF(D29=0,0,(D29/$D$37)*100) -> 9.22 | U29: 16.4 | V29: 16.19
A30: Santa Candida | C30: 4300000 | D30: 3986280 | E30: 3613792 | G30: 3944797 | H30: 0 | I30: 0 | K30: =IF(C30=0,0,((D30/C30)*100)-100) -> -7.3 | L30: =IF(D30=0,0,IF(E30=0,0,((D30/E30)*100)-100)) -> 10.31 | M30: =IF(G30=0,0,((D30/G30)*100)-100) -> 1.05 | N30: =IF(H30=0,0,((D30/H30)*100)-100) -> 0 | O30: =IF(D30=0,0,IF(I30=0,0,((D30/I30)*100)-100)) -> 0 | Q30: 4300000 | R30: =IF(D30=0,0,IF(Q30=0,0,((D30/Q30)*100)-100)) -> -7.3 | S30: =IF(D30=0,0,(D30/$D$37)*100) -> 6.75 | U30: 16.57 | V30: 15.62
A31: Paranagu Raia | C31: 4630000 | D31: 4520218 | E31: 4243163 | G31: 3971191 | H31: 0 | I31: 0 | K31: =IF(C31=0,0,((D31/C31)*100)-100) -> -2.37 | L31: =IF(D31=0,0,IF(E31=0,0,((D31/E31)*100)-100)) -> 6.53 | M31: =IF(G31=0,0,((D31/G31)*100)-100) -> 13.83 | N31: =IF(H31=0,0,((D31/H31)*100)-100) -> 0 | O31: =IF(D31=0,0,IF(I31=0,0,((D31/I31)*100)-100)) -> 0 | Q31: 4630000 | R31: =IF(D31=0,0,IF(Q31=0,0,((D31/Q31)*100)-100)) -> -2.37 | S31: =IF(D31=0,0,(D31/$D$37)*100) -> 7.65 | U31: 16.3 | V31: 16.46
A32: Total Hiper | C32: =SUM(C24:C31) -> 36370000 | D32: =SUM(D24:D31) -> 35970264 | E32: =SUM(E24:E31) -> 33310037 | G32: =SUM(G24:G31) -> 33207348 | H32: =SUM(H24:H31) -> 24886593 | I32: =SUM(I24:I31) -> 18601990 | J32: =SUM(C32:I32) -> 182346232 | K32: =IF(D32=0,0,((D32/C32)*100)-100) -> -1.1 | L32: =IF(D32=0,0,IF(E32=0,0,((D32/E32)*100)-100)) -> 7.99 | M32: =IF(G32=0,0,IF(D32=0,0,((D32/G32)*100)-100)) -> 8.32 | N32: =IF(H32=0,0,IF(D32=0,0,((D32/H32)*100)-100)) -> 44.54 | O32: =IF(D32=0,0,IF(I32=0,0,((D32/I32)*100)-100)) -> 93.37 | Q32: =SUM(Q24:Q31) -> 36370000 | R32: =IF(D32=0,0,((D32/Q32)*100)-100) -> -1.1 | S32: =IF(D32=0,0,(D32/$D$37)*100) -> 60.91 | U32: 16.09 | V32: 15.82
A34: Cristo Rei | C34: 624913 | D34: 622294 | E34: 0 | G34: 0 | H34: 0 | I34: 0 | K34: =IF(C34=0,0,((D34/C34)*100)-100) -> -0.42 | L34: =IF(D34=0,0,IF(E34=0,0,((D34/E34)*100)-100)) -> 0 | M34: =IF(G34=0,0,((D34/G34)*100)-100) -> 0 | N34: =IF(H34=0,0,((D34/H34)*100)-100) -> 0 | O34: =IF(D34=0,0,IF(I34=0,0,((D34/I34)*100)-100)) -> 0 | Q34: 465065 | R34: =IF(Q34=0,0,IF(D34=0,0,((D34/Q34)*100)-100)) -> 33.81 | S34: =IF(D34=0,0,(D34/$D$37)*100) -> 1.05 | U34: 0 | V34: 16.64
A35: Total Lojas Novas | C35: =SUM(C34) -> 624913 | D35: =SUM(D34) -> 622294 | E35: =SUM(E34) -> 0 | G35: =SUM(G34) -> 0 | H35: =SUM(H34) -> 0 | I35: =SUM(I34) -> 0 | K35: =IF(D35=0,0,((D35/C35)*100)-100) -> -0.42 | L35: =IF(D35=0,0,IF(E35=0,0,((D35/E35)*100)-100)) -> 0 | M35: =IF(G35=0,0,IF(D35=0,0,((D35/G35)*100)-100)) -> 0 | N35: =IF(H35=0,0,IF(D35=0,0,((D35/H35)*100)-100)) -> 0 | O35: =IF(D35=0,0,IF(I35=0,0,((D35/I35)*100)-100)) -> 0 | Q35: =SUM(Q34) -> 465065 | R35: =IF(D35=0,0,((D35/Q35)*100)-100) -> 33.81 | S35: =IF(D35=0,0,(D35/$D$37)*100) -> 1.05 | U35: =U34 -> 0 | V35: =V34 -> 16.64
A37: Total Geral | C37: =C22+C32+C35 -> 59392913 | D37: =D22+D32+D35 -> 59059203 | E37: =E22+E32+E35 -> 53944888 | G37: =G22+G32+G35 -> 54069855 | H37: =H22+H32+H35 -> 50168843 | I37: =I22+I32+I35 -> 41161710 | K37: =IF(D37=0,0,((D37/C37)*100)-100) -> -0.56 | L37: =IF(D37=0,0,IF(E37=0,0,((D37/E37)*100)-100)) -> 9.48 | M37: =IF(G37=0,0,IF(D37=0,0,((D37/G37)*100)-100)) -> 9.23 | N37: =IF(H37=0,0,IF(D37=0,0,((D37/H37)*100)-100)) -> 17.72 | O37: =IF(D37=0,0,IF(I37=0,0,((D37/I37)*100)-100)) -> 43.48 | Q37: =Q22+Q32+Q35 -> 59233065 | R37: =IF(D37=0,0,((D37/Q37)*100)-100) -> -0.29 | S37: =S22+S32+S35 -> 100 | U37: 16.49 | V37: 15.84
C38: Resumo por Regiao - Outubro/2002
C39: Descricao das Aberturas | H39: Valor | I39: %
C40: Curitiba (2,3,6,7,10,11,13,17,21,22) | H40: =D7+D8+D11+D12+D14+D15+D16+D18+D28+D29+D30+D24+D34 -> 32870425 | I40: =IF(D37=0,0,H40/$D$37) -> 0.55659999999999998
C41: Curitiba e Metrop. (Ctba. 4,5,8,13,14,23) | H41: =H40+D9+D10+D13+D26+D21+D31 -> 46888367 | I41: =IF(D37=0,0,H41/$D$37) -> 0.79390000000000005
C42: Metropolitana (4,5,8,14,23) | H42: =H41-H40 -> 14017942 | I42: =IF(D37=0,0,H42/$D$37) -> 0.2374
C43: Norte (9,15,20) | H43: =D25+D17+D20 -> 7039204 | I43: =IF(D37=0,0,H43/$D$37) -> 0.1192
C44: Ponta Grossa (18,19) | H44: =D19+D27 -> 5131632 | I44: =IF(D37=0,0,H44/$D$37) -> 8.6900000000000005E-2
C45: Super (2,3,4,5,6,7,8,10,11,13,15,17,18,20,23) | H45: =D22 -> 22466645 | I45: =IF(D37=0,0,H45/$D$37) -> 0.38040000000000002
C46: Hiper (6,9,14,19,21,22,24) | H46: =D32 -> 35970264 | I46: =IF(D37=0,0,H46/$D$37) -> 0.60909999999999997
C47: Curitiba, Metropolitana e Ponta Grossa | H47: =D37-H43 -> 52019999 | I47: =IF(D37=0,0,H47/$D$37) -> 0.88080000000000003
C48: Araucaria | H48: =D10+D21 -> 2958238 | I48: =IF(D37=0,0,H48/$D$37) -> 5.0099999999999999E-2