A2: Periodo: | C2: 39203 | D2: a | E2: 39233 | H2: Vendas Acumuladas por Filial | Q2: =NOW() -> 39246.4383997685
A4: v.1 | C4: Vendas 2007 | G4: Vendas de Anos Anteriores | K4: Percentuais ( % ) | Q4: Meta Mensal | U4: Margem
A5: Lojas | C5: Previsao | D5: Realizada | E5: Mes Anterior | G5: Vendas 2006 | H5: Vendas 2005 | I5: Vendas 2004 | K5: % Prev | L5: % MA | M5: 2006 | N5: 2005 | O5: 2004 | Q5: Previsao Mes | R5: Final | S5: Part. | U5: Meta | V5: Coml | W5: Dif
A7: Xaxim | C7: 720000 | D7: 774551 | E7: 816674 | G7: 644754 | H7: 720477 | I7: 713750 | K7: =IF(C7=0,0,((D7/C7)*100)-100) -> 7.58 | L7: =IF(D7=0,0,IF(E7=0,0,((D7/E7)*100)-100)) -> -5.16 | M7: =IF(G7=0,0,((D7/G7)*100)-100) -> 20.13 | N7: =IF(H7=0,0,((D7/H7)*100)-100) -> 7.51 | O7: =IF(D7=0,0,IF(I7=0,0,((D7/I7)*100)-100)) -> 8.52 | Q7: 700000 | R7: =IF(D7=0,0,((D7/Q7)*100)-100) -> 10.65 | S7: =IF(D7=0,0,(D7/$D$38)*100) -> 1.28 | U7: 17.5 | V7: 16.4 | W7: =V7-U7 -> -1.1
A8: S. Felicidade | C8: 830000 | D8: 823956 | E8: 855417 | G8: 816923 | H8: 705284 | I8: 650037 | K8: =IF(C8=0,0,((D8/C8)*100)-100) -> -0.73 | L8: =IF(D8=0,0,IF(E8=0,0,((D8/E8)*100)-100)) -> -3.68 | M8: =IF(G8=0,0,((D8/G8)*100)-100) -> 0.86 | N8: =IF(H8=0,0,((D8/H8)*100)-100) -> 16.83 | O8: =IF(D8=0,0,IF(I8=0,0,((D8/I8)*100)-100)) -> 26.76 | Q8: 830000 | R8: =IF(D8=0,0,((D8/Q8)*100)-100) -> -0.73 | S8: =IF(D8=0,0,(D8/$D$38)*100) -> 1.37 | U8: 17.7 | V8: 16.26 | W8: =V8-U8 -> -1.44
A9: Lapa | C9: 1290000 | D9: 1245869 | E9: 1430155 | G9: 982751 | H9: 1125051 | I9: 1074434 | K9: =IF(C9=0,0,((D9/C9)*100)-100) -> -3.42 | L9: =IF(D9=0,0,IF(E9=0,0,((D9/E9)*100)-100)) -> -12.89 | M9: =IF(G9=0,0,((D9/G9)*100)-100) -> 26.77 | N9: =IF(H9=0,0,((D9/H9)*100)-100) -> 10.74 | O9: =IF(D9=0,0,IF(I9=0,0,((D9/I9)*100)-100)) -> 15.96 | Q9: 1290000 | R9: =IF(D9=0,0,((D9/Q9)*100)-100) -> -3.42 | S9: =IF(D9=0,0,(D9/$D$38)*100) -> 2.06 | U9: 17.4 | V9: 14.85 | W9: =V9-U9 -> -2.55
A10: Araucaria | C10: 960000 | D10: 907534 | E10: 991943 | G10: 897934 | H10: 927768 | I10: 1024926 | K10: =IF(C10=0,0,((D10/C10)*100)-100) -> -5.47 | L10: =IF(D10=0,0,IF(E10=0,0,((D10/E10)*100)-100)) -> -8.51 | M10: =IF(G10=0,0,((D10/G10)*100)-100) -> 1.07 | N10: =IF(H10=0,0,((D10/H10)*100)-100) -> -2.18 | O10: =IF(D10=0,0,IF(I10=0,0,((D10/I10)*100)-100)) -> -11.45 | Q10: 960000 | R10: =IF(D10=0,0,((D10/Q10)*100)-100) -> -5.47 | S10: =IF(D10=0,0,(D10/$D$38)*100) -> 1.5 | U10: 19 | V10: 17.48 | W10: =V10-U10 -> -1.52
A11: Pinheirinho | C11: 0 | D11: 0 | E11: 0 | G11: 0 | H11: 0 | I11: 0 | K11: =IF(C11=0,0,((D11/C11)*100)-100) -> 0 | L11: =IF(D11=0,0,IF(E11=0,0,((D11/E11)*100)-100)) -> 0 | M11: =IF(G11=0,0,((D11/G11)*100)-100) -> 0 | N11: =IF(H11=0,0,((D11/H11)*100)-100) -> 0 | O11: =IF(D11=0,0,IF(I11=0,0,((D11/I11)*100)-100)) -> 0 | Q11: 0 | R11: =IF(D11=0,0,((D11/Q11)*100)-100) -> 0 | S11: =IF(D11=0,0,(D11/$D$38)*100) -> 0 | U11: 0 | V11: 0 | W11: =V11-U11 -> 0
A12: Hauer | C12: 3100000 | D12: 2948755 | E12: 3194207 | G12: 2847537 | H12: 2924646 | I12: 2801803 | K12: =IF(C12=0,0,((D12/C12)*100)-100) -> -4.88 | L12: =IF(D12=0,0,IF(E12=0,0,((D12/E12)*100)-100)) -> -7.68 | M12: =IF(G12=0,0,((D12/G12)*100)-100) -> 3.55 | N12: =IF(H12=0,0,((D12/H12)*100)-100) -> 0.82 | O12: =IF(D12=0,0,IF(I12=0,0,((D12/I12)*100)-100)) -> 5.24 | Q12: 3100000 | R12: =IF(D12=0,0,((D12/Q12)*100)-100) -> -4.88 | S12: =IF(D12=0,0,(D12/$D$38)*100) -> 4.89 | U12: 18.3 | V12: 16.95 | W12: =V12-U12 -> -1.35
A13: Paranagua | C13: 1520000 | D13: 1528828 | E13: 1720829 | G13: 1443145 | H13: 1666775 | I13: 3104473 | K13: =IF(C13=0,0,((D13/C13)*100)-100) -> 0.58 | L13: =IF(D13=0,0,IF(E13=0,0,((D13/E13)*100)-100)) -> -11.16 | M13: =IF(G13=0,0,((D13/G13)*100)-100) -> 5.94 | N13: =IF(H13=0,0,((D13/H13)*100)-100) -> -8.28 | O13: =IF(D13=0,0,IF(I13=0,0,((D13/I13)*100)-100)) -> -50.75 | Q13: 1520000 | R13: =IF(D13=0,0,((D13/Q13)*100)-100) -> 0.58 | S13: =IF(D13=0,0,(D13/$D$38)*100) -> 2.53 | U13: 19.4 | V13: 19.16 | W13: =V13-U13 -> -0.24
A14: Centenario | C14: 931000 | D14: 934139 | E14: 978541 | G14: 859987 | H14: 905257 | I14: 847250 | K14: =IF(C14=0,0,((D14/C14)*100)-100) -> 0.34 | L14: =IF(D14=0,0,IF(E14=0,0,((D14/E14)*100)-100)) -> -4.54 | M14: =IF(G14=0,0,((D14/G14)*100)-100) -> 8.62 | N14: =IF(H14=0,0,((D14/H14)*100)-100) -> 3.19 | O14: =IF(D14=0,0,IF(I14=0,0,((D14/I14)*100)-100)) -> 10.26 | Q14: 931000 | R14: =IF(D14=0,0,((D14/Q14)*100)-100) -> 0.34 | S14: =IF(D14=0,0,(D14/$D$38)*100) -> 1.55 | U14: 18.03 | V14: 17.41 | W14: =V14-U14 -> -0.62
A15: Sao Braz | C15: 0 | D15: 0 | E15: 0 | G15: 0 | H15: 0 | I15: 0 | K15: =IF(C15=0,0,((D15/C15)*100)-100) -> 0 | L15: =IF(D15=0,0,IF(E15=0,0,((D15/E15)*100)-100)) -> 0 | M15: =IF(G15=0,0,((D15/G15)*100)-100) -> 0 | N15: =IF(H15=0,0,((D15/H15)*100)-100) -> 0 | O15: =IF(D15=0,0,IF(I15=0,0,((D15/I15)*100)-100)) -> 0 | Q15: 0 | R15: =IF(D15=0,0,((D15/Q15)*100)-100) -> 0 | S15: =IF(D15=0,0,(D15/$D$38)*100) -> 0 | U15: 0 | V15: 0 | W15: =V15-U15 -> 0
A16: Sitio Cercado | C16: 1255352 | D16: 1263723 | E16: 1457780 | G16: 1142164 | H16: 1421495 | I16: 1374627 | K16: =IF(C16=0,0,((D16/C16)*100)-100) -> 0.67 | L16: =IF(D16=0,0,IF(E16=0,0,((D16/E16)*100)-100)) -> -13.31 | M16: =IF(G16=0,0,((D16/G16)*100)-100) -> 10.64 | N16: =IF(H16=0,0,((D16/H16)*100)-100) -> -11.1 | O16: =IF(D16=0,0,IF(I16=0,0,((D16/I16)*100)-100)) -> -8.07 | Q16: 1255352 | R16: =IF(D16=0,0,((D16/Q16)*100)-100) -> 0.67 | S16: =IF(D16=0,0,(D16/$D$38)*100) -> 2.09 | U16: 17.53 | V16: 16.12 | W16: =V16-U16 -> -1.41
A17: Apucarana | C17: 1900000 | D17: 2005186 | E17: 2124035 | G17: 1662468 | H17: 1498441 | I17: 1320974 | K17: =IF(C17=0,0,((D17/C17)*100)-100) -> 5.54 | L17: =IF(D17=0,0,IF(E17=0,0,((D17/E17)*100)-100)) -> -5.6 | M17: =IF(G17=0,0,((D17/G17)*100)-100) -> 20.62 | N17: =IF(H17=0,0,((D17/H17)*100)-100) -> 33.82 | O17: =IF(D17=0,0,IF(I17=0,0,((D17/I17)*100)-100)) -> 51.8 | Q17: 1900000 | R17: =IF(D17=0,0,((D17/Q17)*100)-100) -> 5.54 | S17: =IF(D17=0,0,(D17/$D$38)*100) -> 3.32 | U17: 16.91 | V17: 15.89 | W17: =V17-U17 -> -1.02
A18: Ahu | C18: 1250000 | D18: 1347490 | E18: 1367430 | G18: 1120831 | H18: 1031099 | I18: 1034805 | K18: =IF(C18=0,0,((D18/C18)*100)-100) -> 7.8 | L18: =IF(D18=0,0,IF(E18=0,0,((D18/E18)*100)-100)) -> -1.46 | M18: =IF(G18=0,0,((D18/G18)*100)-100) -> 20.22 | N18: =IF(H18=0,0,((D18/H18)*100)-100) -> 30.68 | O18: =IF(D18=0,0,IF(I18=0,0,((D18/I18)*100)-100)) -> 30.22 | Q18: 1250000 | R18: =IF(D18=0,0,((D18/Q18)*100)-100) -> 7.8 | S18: =IF(D18=0,0,(D18/$D$38)*100) -> 2.23 | U18: 19.1 | V18: 16.94 | W18: =V18-U18 -> -2.16
A19: P.G. Centro | C19: 1645000 | D19: 1695587 | E19: 1739280 | G19: 1537966 | H19: 1591444 | I19: 1601128 | K19: =IF(C19=0,0,((D19/C19)*100)-100) -> 3.08 | L19: =IF(D19=0,0,IF(E19=0,0,((D19/E19)*100)-100)) -> -2.51 | M19: =IF(G19=0,0,((D19/G19)*100)-100) -> 10.25 | N19: =IF(H19=0,0,((D19/H19)*100)-100) -> 6.54 | O19: =IF(D19=0,0,IF(I19=0,0,((D19/I19)*100)-100)) -> 5.9 | Q19: 1645000 | R19: =IF(D19=0,0,((D19/Q19)*100)-100) -> 3.08 | S19: =IF(D19=0,0,(D19/$D$38)*100) -> 2.81 | U19: 19.9 | V19: 18.62 | W19: =V19-U19 -> -1.28
A20: Maringa | C20: 2475463 | D20: 2314916 | E20: 2367351 | G20: 2315533 | H20: 2135621 | I20: 1999804 | K20: =IF(C20=0,0,((D20/C20)*100)-100) -> -6.49 | L20: =IF(D20=0,0,IF(E20=0,0,((D20/E20)*100)-100)) -> -2.21 | M20: =IF(G20=0,0,((D20/G20)*100)-100) -> -0.03 | N20: =IF(H20=0,0,((D20/H20)*100)-100) -> 8.4 | O20: =IF(D20=0,0,IF(I20=0,0,((D20/I20)*100)-100)) -> 15.76 | Q20: 2475463 | R20: =IF(D20=0,0,((D20/Q20)*100)-100) -> -6.49 | S20: =IF(D20=0,0,(D20/$D$38)*100) -> 3.84 | U20: 19.15 | V20: 17.97 | W20: =V20-U20 -> -1.18
A21: Araucaria Nova | C21: 2190000 | D21: 2062725 | E21: 2390563 | G21: 1904421 | H21: 1991626 | I21: 2036417 | K21: =IF(C21=0,0,((D21/C21)*100)-100) -> -5.81 | L21: =IF(D21=0,0,IF(E21=0,0,((D21/E21)*100)-100)) -> -13.71 | M21: =IF(G21=0,0,((D21/G21)*100)-100) -> 8.31 | N21: =IF(H21=0,0,((D21/H21)*100)-100) -> 3.57 | O21: =IF(D21=0,0,IF(I21=0,0,((D21/I21)*100)-100)) -> 1.29 | Q21: 2190000 | R21: =IF(D21=0,0,((D21/Q21)*100)-100) -> -5.81 | S21: =IF(D21=0,0,(D21/$D$38)*100) -> 3.42 | U21: 18.4 | V21: 17.73 | W21: =V21-U21 -> -0.67
A22: Total Super | C22: =SUM(C7:C21) -> 20066815 | D22: =SUM(D7:D21) -> 19853259 | E22: =SUM(E7:E21) -> 21434205 | G22: =SUM(G7:G21) -> 18176414 | H22: =SUM(H7:H21) -> 18644984 | I22: =SUM(I7:I21) -> 19584428 | J22: =SUM(C22:I22) -> 117760105 | K22: =IF(D22=0,0,((D22/C22)*100)-100) -> -1.06 | L22: =IF(D22=0,0,IF(E22=0,0,((D22/E22)*100)-100)) -> -7.38 | M22: =IF(G22=0,0,IF(D22=0,0,((D22/G22)*100)-100)) -> 9.23 | N22: =IF(H22=0,0,IF(D22=0,0,((D22/H22)*100)-100)) -> 6.48 | O22: =IF(D22=0,0,IF(I22=0,0,((D22/I22)*100)-100)) -> 1.37 | Q22: =SUM(Q7:Q21) -> 20046815 | R22: =IF(D22=0,0,((D22/Q22)*100)-100) -> -0.97 | S22: =IF(D22=0,0,(D22/$D$38)*100) -> 32.9 | U22: 18.42 | V22: 17.15 | W22: =V22-U22 -> -1.27
A24: Pinheirinho | C24: 3000000 | D24: 2927977 | E24: 3158817 | G24: 2161332 | H24: 1852216 | I24: 1876577 | K24: =IF(C24=0,0,((D24/C24)*100)-100) -> -2.4 | L24: =IF(D24=0,0,IF(E24=0,0,((D24/E24)*100)-100)) -> -7.31 | M24: =IF(G24=0,0,((D24/G24)*100)-100) -> 35.47 | N24: =IF(H24=0,0,((D24/H24)*100)-100) -> 58.08 | O24: =IF(D24=0,0,IF(I24=0,0,((D24/I24)*100)-100)) -> 56.03 | Q24: 3000000 | R24: =IF(D24=0,0,IF(Q24=0,0,((D24/Q24)*100)-100)) -> -2.4 | S24: =IF(D24=0,0,(D24/$D$38)*100) -> 4.85 | U24: 17.95 | V24: 16.88 | W24: =V24-U24 -> -1.07
A25: Londrina | C25: 3045517 | D25: 2510656 | E25: 2686410 | G25: 2794054 | H25: 2537580 | I25: 2260669 | K25: =IF(C25=0,0,((D25/C25)*100)-100) -> -17.56 | L25: =IF(D25=0,0,IF(E25=0,0,((D25/E25)*100)-100)) -> -6.54 | M25: =IF(G25=0,0,((D25/G25)*100)-100) -> -10.14 | N25: =IF(H25=0,0,((D25/H25)*100)-100) -> -1.06 | O25: =IF(D25=0,0,IF(I25=0,0,((D25/I25)*100)-100)) -> 11.06 | Q25: 3045517 | R25: =IF(D25=0,0,IF(Q25=0,0,((D25/Q25)*100)-100)) -> -17.56 | S25: =IF(D25=0,0,(D25/$D$38)*100) -> 4.16 | U25: 16.98 | V25: 16.28 | W25: =V25-U25 -> -0.7
A26: So Brz | C26: 3050000 | D26: 3060707 | E26: 3204714 | G26: 2889687 | H26: 3069672 | I26: 2919242 | K26: =IF(C26=0,0,((D26/C26)*100)-100) -> 0.35 | L26: =IF(D26=0,0,IF(E26=0,0,((D26/E26)*100)-100)) -> -4.49 | M26: =IF(G26=0,0,((D26/G26)*100)-100) -> 5.92 | N26: =IF(H26=0,0,((D26/H26)*100)-100) -> -0.29 | O26: =IF(D26=0,0,IF(I26=0,0,((D26/I26)*100)-100)) -> 4.85 | Q26: 3050000 | R26: =IF(D26=0,0,IF(Q26=0,0,((D26/Q26)*100)-100)) -> 0.35 | S26: =IF(D26=0,0,(D26/$D$38)*100) -> 5.07 | U26: 18.11 | V26: 16.67 | W26: =V26-U26 -> -1.44
A27: S.J. Pinhais | C27: 4135000 | D27: 3871884 | E27: 4107523 | G27: 3863756 | H27: 3726317 | I27: 4106455 | K27: =IF(C27=0,0,((D27/C27)*100)-100) -> -6.36 | L27: =IF(D27=0,0,IF(E27=0,0,((D27/E27)*100)-100)) -> -5.74 | M27: =IF(G27=0,0,((D27/G27)*100)-100) -> 0.21 | N27: =IF(H27=0,0,((D27/H27)*100)-100) -> 3.91 | O27: =IF(D27=0,0,IF(I27=0,0,((D27/I27)*100)-100)) -> -5.71 | Q27: 4135000 | R27: =IF(D27=0,0,IF(Q27=0,0,((D27/Q27)*100)-100)) -> -6.36 | S27: =IF(D27=0,0,(D27/$D$38)*100) -> 6.42 | U27: 17.6 | V27: 17.07 | W27: =V27-U27 -> -0.53
A28: P.G. Nova | C28: 3650000 | D28: 3614962 | E28: 3655195 | G28: 3380907 | H28: 3302780 | I28: 3147362 | K28: =IF(C28=0,0,((D28/C28)*100)-100) -> -0.96 | L28: =IF(D28=0,0,IF(E28=0,0,((D28/E28)*100)-100)) -> -1.1 | M28: =IF(G28=0,0,((D28/G28)*100)-100) -> 6.92 | N28: =IF(H28=0,0,((D28/H28)*100)-100) -> 9.45 | O28: =IF(D28=0,0,IF(I28=0,0,((D28/I28)*100)-100)) -> 14.86 | Q28: 3650000 | R28: =IF(D28=0,0,IF(Q28=0,0,((D28/Q28)*100)-100)) -> -0.96 | S28: =IF(D28=0,0,(D28/$D$38)*100) -> 5.99 | U28: 18.15 | V28: 17.46 | W28: =V28-U28 -> -0.69
A29: Nilo Pecanha | C29: 8940000 | D29: 9125972 | E29: 9381180 | G29: 8689542 | H29: 8752387 | I29: 8054371 | K29: =IF(C29=0,0,((D29/C29)*100)-100) -> 2.08 | L29: =IF(D29=0,0,IF(E29=0,0,((D29/E29)*100)-100)) -> -2.72 | M29: =IF(G29=0,0,((D29/G29)*100)-100) -> 5.02 | N29: =IF(H29=0,0,((D29/H29)*100)-100) -> 4.27 | O29: =IF(D29=0,0,IF(I29=0,0,((D29/I29)*100)-100)) -> 13.3 | Q29: 8940000 | R29: =IF(D29=0,0,IF(Q29=0,0,((D29/Q29)*100)-100)) -> 2.08 | S29: =IF(D29=0,0,(D29/$D$38)*100) -> 15.13 | U29: 17.5 | V29: 17.86 | W29: =V29-U29 -> 0.36
A30: Champagnat | C30: 5650000 | D30: 5435231 | E30: 5511390 | G30: 5375900 | H30: 5615394 | I30: 5072944 | K30: =IF(C30=0,0,((D30/C30)*100)-100) -> -3.8 | L30: =IF(D30=0,0,IF(E30=0,0,((D30/E30)*100)-100)) -> -1.38 | M30: =IF(G30=0,0,((D30/G30)*100)-100) -> 1.1 | N30: =IF(H30=0,0,((D30/H30)*100)-100) -> -3.21 | O30: =IF(D30=0,0,IF(I30=0,0,((D30/I30)*100)-100)) -> 7.14 | Q30: 5650000 | R30: =IF(D30=0,0,IF(Q30=0,0,((D30/Q30)*100)-100)) -> -3.8 | S30: =IF(D30=0,0,(D30/$D$38)*100) -> 9.01 | U30: 18.5 | V30: 18.35 | W30: =V30-U30 -> -0.15
A31: Santa Candida | C31: 4350000 | D31: 4034522 | E31: 4385534 | G31: 3905400 | H31: 4453803 | I31: 0 | K31: =IF(C31=0,0,((D31/C31)*100)-100) -> -7.25 | L31: =IF(D31=0,0,IF(E31=0,0,((D31/E31)*100)-100)) -> -8 | M31: =IF(G31=0,0,((D31/G31)*100)-100) -> 3.31 | N31: =IF(H31=0,0,((D31/H31)*100)-100) -> -9.41 | O31: =IF(D31=0,0,IF(I31=0,0,((D31/I31)*100)-100)) -> 0 | Q31: 4350000 | R31: =IF(D31=0,0,IF(Q31=0,0,((D31/Q31)*100)-100)) -> -7.25 | S31: =IF(D31=0,0,(D31/$D$38)*100) -> 6.69 | U31: 18.7 | V31: 17.67 | W31: =V31-U31 -> -1.03
A32: Paranagu Raia | C32: 4660000 | D32: 4566930 | E32: 4910860 | G32: 4175921 | H32: 3599612 | I32: 0 | K32: =IF(C32=0,0,((D32/C32)*100)-100) -> -2 | L32: =IF(D32=0,0,IF(E32=0,0,((D32/E32)*100)-100)) -> -7 | M32: =IF(G32=0,0,((D32/G32)*100)-100) -> 9.36 | N32: =IF(H32=0,0,((D32/H32)*100)-100) -> 26.87 | O32: =IF(D32=0,0,IF(I32=0,0,((D32/I32)*100)-100)) -> 0 | Q32: 4660000 | R32: =IF(D32=0,0,IF(Q32=0,0,((D32/Q32)*100)-100)) -> -2 | S32: =IF(D32=0,0,(D32/$D$38)*100) -> 7.57 | U32: 18.2 | V32: 18.72 | W32: =V32-U32 -> 0.52
A33: Total Hiper | C33: =SUM(C24:C32) -> 40480517 | D33: =SUM(D24:D32) -> 39148841 | E33: =SUM(E24:E32) -> 41001623 | G33: =SUM(G24:G32) -> 37236499 | H33: =SUM(H24:H32) -> 36909761 | I33: =SUM(I24:I32) -> 27437620 | J33: =SUM(C33:I33) -> 222214861 | K33: =IF(D33=0,0,((D33/C33)*100)-100) -> -3.29 | L33: =IF(D33=0,0,IF(E33=0,0,((D33/E33)*100)-100)) -> -4.52 | M33: =IF(G33=0,0,IF(D33=0,0,((D33/G33)*100)-100)) -> 5.14 | N33: =IF(H33=0,0,IF(D33=0,0,((D33/H33)*100)-100)) -> 6.07 | O33: =IF(D33=0,0,IF(I33=0,0,((D33/I33)*100)-100)) -> 42.68 | Q33: =SUM(Q24:Q32) -> 40480517 | R33: =IF(D33=0,0,((D33/Q33)*100)-100) -> -3.29 | S33: =IF(D33=0,0,(D33/$D$38)*100) -> 64.88 | U33: 17.95 | V33: 17.71 | W33: =V33-U33 -> -0.24
A35: Cristo Rei | C35: 1450000 | D35: 1334020 | E35: 1347068 | G35: 0 | H35: 0 | I35: 0 | K35: =IF(C35=0,0,((D35/C35)*100)-100) -> -8 | L35: =IF(D35=0,0,IF(E35=0,0,((D35/E35)*100)-100)) -> -0.97 | M35: =IF(G35=0,0,((D35/G35)*100)-100) -> 0 | N35: =IF(H35=0,0,((D35/H35)*100)-100) -> 0 | O35: =IF(D35=0,0,IF(I35=0,0,((D35/I35)*100)-100)) -> 0 | Q35: 1450000 | R35: =IF(Q35=0,0,IF(D35=0,0,((D35/Q35)*100)-100)) -> -8 | S35: =IF(D35=0,0,(D35/$D$38)*100) -> 2.21 | U35: 19.18 | V35: 18.04 | W35: =V35-U35 -> -1.14
A36: Total Lojas Novas | C36: =SUM(C35) -> 1450000 | D36: =SUM(D35) -> 1334020 | E36: =SUM(E35) -> 1347068 | G36: =SUM(G35) -> 0 | H36: =SUM(H35) -> 0 | I36: =SUM(I35) -> 0 | K36: =IF(D36=0,0,((D36/C36)*100)-100) -> -8 | L36: =IF(D36=0,0,IF(E36=0,0,((D36/E36)*100)-100)) -> -0.97 | M36: =IF(G36=0,0,IF(D36=0,0,((D36/G36)*100)-100)) -> 0 | N36: =IF(H36=0,0,IF(D36=0,0,((D36/H36)*100)-100)) -> 0 | O36: =IF(D36=0,0,IF(I36=0,0,((D36/I36)*100)-100)) -> 0 | Q36: =SUM(Q35) -> 1450000 | R36: =IF(D36=0,0,((D36/Q36)*100)-100) -> -8 | S36: =IF(D36=0,0,(D36/$D$38)*100) -> 2.21 | U36: =U35 -> 19.18 | V36: =V35 -> 18.04 | W36: =V36-U36 -> -1.14
A38: Total Geral | C38: =C22+C33+C36 -> 61997332 | D38: =D22+D33+D36 -> 60336120 | E38: =E22+E33+E36 -> 63782896 | G38: =G22+G33+G36 -> 55412913 | H38: =H22+H33+H36 -> 55554745 | I38: =I22+I33+I36 -> 47022048 | K38: =IF(D38=0,0,((D38/C38)*100)-100) -> -2.68 | L38: =IF(D38=0,0,IF(E38=0,0,((D38/E38)*100)-100)) -> -5.4 | M38: =IF(G38=0,0,IF(D38=0,0,((D38/G38)*100)-100)) -> 8.88 | N38: =IF(H38=0,0,IF(D38=0,0,((D38/H38)*100)-100)) -> 8.61 | O38: =IF(D38=0,0,IF(I38=0,0,((D38/I38)*100)-100)) -> 28.31 | Q38: =Q22+Q33+Q36 -> 61977332 | R38: =IF(D38=0,0,((D38/Q38)*100)-100) -> -2.65 | S38: =S22+S33+S36 -> 99.99 | U38: 18.13 | V38: 17.48 | W38: =V38-U38 -> -0.65
C39: Resumo por Regiao - Outubro/2002
C40: Descricao das Aberturas | H40: Valor | I40: % | M40: Margem Comercial | R40: Meta | S40: Real | U40: Dif
C41: Curitiba (2,3,6,7,10,11,13,17,21,22) | H41: =D7+D8+D11+D12+D14+D15+D16+D18+D29+D30+D31+D24+D35 -> 30950336 | I41: =IF(D38=0,0,H41/$D$38) -> 0.51300000000000001 | L41: 99 | M41: Empresa | R41: 18.13 | S41: 17.48 | U41: =S41-R41 -> -0.65
C42: Curitiba e Metrop. (Ctba. 4,5,8,13,14,23) | H42: =H41+D9+D10+D13+D27+D21+D32 -> 45134106 | I42: =IF(D38=0,0,H42/$D$38) -> 0.748 | L42: 207 | M42: Super | R42: 18.42 | S42: 17.15 | U42: =S42-R42 -> -1.27
C43: Metropolitana (4,5,8,14,23) | H43: =H42-H41 -> 14183770 | I43: =IF(D38=0,0,H43/$D$38) -> 0.2351 | L43: 208 | M43: Hiper | R43: 17.95 | S43: 17.71 | U43: =S43-R43 -> -0.24
C44: Norte (9,15,20) | H44: =D25+D17+D20 -> 6830758 | I44: =IF(D38=0,0,H44/$D$38) -> 0.1132 | L44: 204 | M44: Regional Gilberto | R44: 18.43 | S44: 17.4 | U44: =S44-R44 -> -1.03
C45: Ponta Grossa (18,19) | H45: =D19+D28 -> 5310549 | I45: =IF(D38=0,0,H45/$D$38) -> 8.7999999999999995E-2 | L45: 205 | M45: Regional Edison | R45: 17.99 | S45: 17.44 | U45: =S45-R45 -> -0.55
C46: Super (2,3,4,5,6,7,8,10,13,15,17,18,20,23,28) | H46: =D22+D35 -> 21187279 | I46: =IF(D38=0,0,H46/$D$38) -> 0.35120000000000001 | L46: 200 | M46: Regio - Curitiba | R46: 18.13 | S46: 17.47 | U46: =S46-R46 -> -0.66
C47: Hiper (6,9,11,14,19,21,22,24) | H47: =D33 -> 39148841 | I47: =IF(D38=0,0,H47/$D$38) -> 0.64880000000000004 | L47: 201 | M47: Regio - Metropolitana | R47: 18.17 | S47: 17.75 | U47: =S47-R47 -> -0.42
C48: Curitiba, Metropolitana e Ponta Grossa | H48: =D38-H44 -> 53505362 | I48: =IF(D38=0,0,H48/$D$38) -> 0.88680000000000003 | L48: 202 | M48: Regio - Centro Oeste | R48: 18.69 | S48: 17.83 | U48: =S48-R48 -> -0.86
C49: Araucaria | H49: =D10+D21 -> 2970259 | I49: =IF(D38=0,0,H49/$D$38) -> 4.9200000000000001E-2 | L49: 203 | M49: Regio - Norte | R49: 17.69 | S49: 16.74 | U49: =S49-R49 -> -0.95