A2: Periodo: | B2: 41122 | C2: a | D2: 41152 | G2: Vendas Acumuladas por Filial | P2: =NOW() -> 41153.35471550926
A4: v.New | B4: Vendas 2012 | F4: Vendas de Anos Anteriores | J4: Percentuais ( % ) | P4: Meta Mensal | T4: Margem
A5: Lojas | B5: Previsao | C5: Realizada | D5: Mes Anterior | F5: Vendas 2011 | G5: Vendas 2010 | H5: Vendas 2009 | J5: % Prev | K5: % MA | L5: 2011 | M5: 2010 | N5: 2009 | P5: Previsao Mes | Q5: Final | R5: Part. | T5: Meta | U5: Coml | V5: Sell O. | W5: Dif
A6: S. Felicidade | B6: 4100000 | C6: 4262904.86 | D6: 4141453.25 | F6: 3479679.04 | G6: 2954912.29 | H6: 2927116.09 | J6: =IF(B6=0,0,((C6/B6)*100)-100) -> 3.973289268292703 | K6: =IF(C6=0,0,IF(D6=0,0,((C6/D6)*100)-100)) -> 2.932584353089112 | L6: =IF(F6=0,0,((C6/F6)*100)-100) -> 22.508565042826476 | M6: =IF(G6=0,0,((C6/G6)*100)-100) -> 44.265021822356687 | N6: =IF(C6=0,0,IF(H6=0,0,((C6/H6)*100)-100)) -> 45.634977531758949 | P6: 4100000 | Q6: =IF(C6=0,0,((C6/P6)*100)-100) -> 3.973289268292703 | R6: =IF(C6=0,0,(C6/$C$44)*100) -> 2.2207724103417181 | T6: 17.3 | U6: 16.974462573391794 | V6: 16.640285026206282 | W6: =U6-T6 -> -0.32553742660820717
A7: Lapa | B7: 2700000 | C7: 2832354.26 | D7: 2709477.8 | F7: 2428673.56 | G7: 2256853.47 | H7: 2194545.64 | J7: =IF(B7=0,0,((C7/B7)*100)-100) -> 4.9020096296296174 | K7: =IF(C7=0,0,IF(D7=0,0,((C7/D7)*100)-100)) -> 4.5350605935948352 | L7: =IF(F7=0,0,((C7/F7)*100)-100) -> 16.621447470280842 | M7: =IF(G7=0,0,((C7/G7)*100)-100) -> 25.500139803050644 | N7: =IF(C7=0,0,IF(H7=0,0,((C7/H7)*100)-100)) -> 29.063356367471101 | P7: 2700000 | Q7: =IF(C7=0,0,((C7/P7)*100)-100) -> 4.9020096296296174 | R7: =IF(C7=0,0,(C7/$C$44)*100) -> 1.47552300684511 | T7: 15.35 | U7: 16.012630778750115 | V7: 15.974117492633145 | W7: =U7-T7 -> 0.66263077875011511
A8: Araucaria | B8: 1499999 | C8: 1549378.48 | D8: 1468228.04 | F8: 1563670.39 | G8: 1434345.09 | H8: 1395128.03 | J8: =IF(B8=0,0,((C8/B8)*100)-100) -> 3.2919675279783576 | K8: =IF(C8=0,0,IF(D8=0,0,((C8/D8)*100)-100)) -> 5.527100544953484 | L8: =IF(F8=0,0,((C8/F8)*100)-100) -> -0.91399761045548189 | M8: =IF(G8=0,0,((C8/G8)*100)-100) -> 8.0199242708043101 | N8: =IF(C8=0,0,IF(H8=0,0,((C8/H8)*100)-100)) -> 11.056365199687093 | P8: 1500000 | Q8: =IF(C8=0,0,((C8/P8)*100)-100) -> 3.2918986666666541 | R8: =IF(C8=0,0,(C8/$C$44)*100) -> 0.80715312552417307 | T8: 16.66 | U8: 17.344436718909375 | V8: 16.52095908805962 | W8: =U8-T8 -> 0.68443671890937452
A9: Hauer | B9: 4850000 | C9: 4816210.63 | D9: 4778904.09 | F9: 4020317.34 | G9: 3743117.98 | H9: 4025689.1 | J9: =IF(B9=0,0,((C9/B9)*100)-100) -> -0.6966880412371097 | K9: =IF(C9=0,0,IF(D9=0,0,((C9/D9)*100)-100)) -> 0.78065052776565835 | L9: =IF(F9=0,0,((C9/F9)*100)-100) -> 19.796777783715953 | M9: =IF(G9=0,0,((C9/G9)*100)-100) -> 28.668416430731895 | N9: =IF(C9=0,0,IF(H9=0,0,((C9/H9)*100)-100)) -> 19.63692452057461 | P9: 4850000 | Q9: =IF(C9=0,0,((C9/P9)*100)-100) -> -0.6966880412371097 | R9: =IF(C9=0,0,(C9/$C$44)*100) -> 2.5090186248018926 | T9: 16.4 | U9: 16.269165329258037 | V9: 15.724041892661161 | W9: =U9-T9 -> -0.13083467074196165
A10: Paranagua | B10: 2450000 | C10: 2649769.68 | D10: 2405208.26 | F10: 2346615.75 | G10: 2221148.85 | H10: 2074746.43 | J10: =IF(B10=0,0,((C10/B10)*100)-100) -> 8.1538644897959216 | K10: =IF(C10=0,0,IF(D10=0,0,((C10/D10)*100)-100)) -> 10.167993519197395 | L10: =IF(F10=0,0,((C10/F10)*100)-100) -> 12.918771639540921 | M10: =IF(G10=0,0,((C10/G10)*100)-100) -> 19.297258263443268 | N10: =IF(C10=0,0,IF(H10=0,0,((C10/H10)*100)-100)) -> 27.715350738065865 | P10: 2450000 | Q10: =IF(C10=0,0,((C10/P10)*100)-100) -> 8.1538644897959216 | R10: =IF(C10=0,0,(C10/$C$44)*100) -> 1.3804050506311332 | T10: 17.57 | U10: 17.982025894416605 | V10: 17.043654341308638 | W10: =U10-T10 -> 0.41202589441660464
A11: Sitio Cercado | B11: 3750000 | C11: 3705054.66 | D11: 3672002.62 | F11: 3044989.17 | G11: 2407630.8 | H11: 2345310.64 | J11: =IF(B11=0,0,((C11/B11)*100)-100) -> -1.1985423999999938 | K11: =IF(C11=0,0,IF(D11=0,0,((C11/D11)*100)-100)) -> 0.90010937955157999 | L11: =IF(F11=0,0,((C11/F11)*100)-100) -> 21.677104684086615 | M11: =IF(G11=0,0,((C11/G11)*100)-100) -> 53.887990633779907 | N11: =IF(C11=0,0,IF(H11=0,0,((C11/H11)*100)-100)) -> 57.977139437699407 | P11: 3750000 | Q11: =IF(C11=0,0,((C11/P11)*100)-100) -> -1.1985423999999938 | R11: =IF(C11=0,0,(C11/$C$44)*100) -> 1.9301587621488729 | T11: 15.08 | U11: 15.276842096575169 | V11: 15.372111514273854 | W11: =U11-T11 -> 0.19684209657516938
A12: Apucarana | B12: 2900000 | C12: 2910076.11 | D12: 2877746.44 | F12: 2799211.03 | G12: 2608380.29 | H12: 2689766.58 | J12: =IF(B12=0,0,((C12/B12)*100)-100) -> 0.3474520689655094 | K12: =IF(C12=0,0,IF(D12=0,0,((C12/D12)*100)-100)) -> 1.1234370600072765 | L12: =IF(F12=0,0,((C12/F12)*100)-100) -> 3.9605831361703423 | M12: =IF(G12=0,0,((C12/G12)*100)-100) -> 11.566404682501258 | N12: =IF(C12=0,0,IF(H12=0,0,((C12/H12)*100)-100)) -> 8.190656082878391 | P12: 2900000 | Q12: =IF(C12=0,0,((C12/P12)*100)-100) -> 0.3474520689655094 | R12: =IF(C12=0,0,(C12/$C$44)*100) -> 1.5160124256403298 | T12: 15.49 | U12: 15.733992263178301 | V12: 15.869986778455772 | W12: =U12-T12 -> 0.24399226317830092
A13: Ahú | B13: 2550000 | C13: 2631567.04 | D13: 2516289.11 | F13: 2242304.99 | G13: 1874908.07 | H13: 1756091.51 | J13: =IF(B13=0,0,((C13/B13)*100)-100) -> 3.1987074509803932 | K13: =IF(C13=0,0,IF(D13=0,0,((C13/D13)*100)-100)) -> 4.5812672932483451 | L13: =IF(F13=0,0,((C13/F13)*100)-100) -> 17.359906512985091 | M13: =IF(G13=0,0,((C13/G13)*100)-100) -> 40.35712374953934 | N13: =IF(C13=0,0,IF(H13=0,0,((C13/H13)*100)-100)) -> 49.853639460964075 | P13: 2550000 | Q13: =IF(C13=0,0,((C13/P13)*100)-100) -> 3.1987074509803932 | R13: =IF(C13=0,0,(C13/$C$44)*100) -> 1.3709223335555794 | T13: 16.92 | U13: 17.192156731070778 | V13: 16.519047510186173 | W13: =U13-T13 -> 0.2721567310707762
A14: P.G. Centro | B14: 2350000 | C14: 2566859.68 | D14: 2340986.56 | F14: 2325101.25 | G14: 1917936.27 | H14: 1932278.69 | J14: =IF(B14=0,0,((C14/B14)*100)-100) -> 9.2280714893617102 | K14: =IF(C14=0,0,IF(D14=0,0,((C14/D14)*100)-100)) -> 9.6486295077234558 | L14: =IF(F14=0,0,((C14/F14)*100)-100) -> 10.397759237366543 | M14: =IF(G14=0,0,((C14/G14)*100)-100) -> 33.834461559038147 | N14: =IF(C14=0,0,IF(H14=0,0,((C14/H14)*100)-100)) -> 32.841069628522376 | P14: 2350000 | Q14: =IF(C14=0,0,((C14/P14)*100)-100) -> 9.2280714893617102 | R14: =IF(C14=0,0,(C14/$C$44)*100) -> 1.3372128503385299 | T14: 17.8 | U14: 17.535216416660532 | V14: 16.600743999375922 | W14: =U14-T14 -> -0.26478358333946872
A15: Maringa | B15: 4149999 | C15: 4444890.29 | D15: 4113650.56 | F15: 3528095.76 | G15: 3130508.11 | H15: 2774162.76 | J15: =IF(B15=0,0,((C15/B15)*100)-100) -> 7.105815929112282 | K15: =IF(C15=0,0,IF(D15=0,0,((C15/D15)*100)-100)) -> 8.0522087418139847 | L15: =IF(F15=0,0,((C15/F15)*100)-100) -> 25.985534190829341 | M15: =IF(G15=0,0,((C15/G15)*100)-100) -> 41.986225041276128 | N15: =IF(C15=0,0,IF(H15=0,0,((C15/H15)*100)-100)) -> 60.224567717865284 | P15: 4150000 | Q15: =IF(C15=0,0,((C15/P15)*100)-100) -> 7.1057901204819416 | R15: =IF(C15=0,0,(C15/$C$44)*100) -> 2.3155782376592375 | T15: 17.24 | U15: 17.432238355651293 | V15: 16.46458470181949 | W15: =U15-T15 -> 0.19223835565129477
A16: Centenario | B16: 0 | C16: 0 | D16: 0 | F16: 0 | G16: 0 | H16: 0 | J16: =IF(B16=0,0,((C16/B16)*100)-100) -> 0 | K16: =IF(C16=0,0,IF(D16=0,0,((C16/D16)*100)-100)) -> 0 | L16: =IF(F16=0,0,((C16/F16)*100)-100) -> 0 | M16: =IF(G16=0,0,((C16/G16)*100)-100) -> 0 | N16: =IF(C16=0,0,IF(H16=0,0,((C16/H16)*100)-100)) -> 0 | P16: 0 | Q16: =IF(C16=0,0,((C16/P16)*100)-100) -> 0 | R16: =IF(C16=0,0,(C16/$C$44)*100) -> 0 | T16: 0 | U16: 0 | V16: 0 | W16: =U16-T16 -> 0
A17: Cristo Rei | B17: 3200000 | C17: 3486280.36 | D17: 3140736.17 | F17: 2970522.53 | G17: 2479694.32 | H17: 2125436.33 | J17: =IF(B17=0,0,((C17/B17)*100)-100) -> 8.9462612499999921 | K17: =IF(C17=0,0,IF(D17=0,0,((C17/D17)*100)-100)) -> 11.002012626867668 | L17: =IF(F17=0,0,((C17/F17)*100)-100) -> 17.362528807347587 | M17: =IF(G17=0,0,((C17/G17)*100)-100) -> 40.593150207320718 | N17: =IF(C17=0,0,IF(H17=0,0,((C17/H17)*100)-100)) -> 64.026572369730786 | P17: 3200000 | Q17: =IF(C17=0,0,((C17/P17)*100)-100) -> 8.9462612499999921 | R17: =IF(C17=0,0,(C17/$C$44)*100) -> 1.8161876683788325 | T17: 17.72 | U17: 17.805909046282213 | V17: 17.126445192147425 | W17: =U17-T17 -> 8.5909046282214518E-2
A18: Fazenda | B18: 4400000 | C18: 4342134.93 | D18: 4275922.72 | F18: 2939834.97 | G18: 2695948.09 | H18: 0 | J18: =IF(B18=0,0,((C18/B18)*100)-100) -> -1.3151152272727273 | K18: =IF(C18=0,0,IF(D18=0,0,((C18/D18)*100)-100)) -> 1.5484893983303891 | L18: =IF(F18=0,0,((C18/F18)*100)-100) -> 47.699955076049719 | M18: =IF(G18=0,0,((C18/G18)*100)-100) -> 61.061518435987381 | N18: =IF(C18=0,0,IF(H18=0,0,((C18/H18)*100)-100)) -> 0 | P18: 4400000 | Q18: =IF(C18=0,0,((C18/P18)*100)-100) -> -1.3151152272727273 | R18: =IF(C18=0,0,(C18/$C$44)*100) -> 2.2620475406352529 | T18: 16.7 | U18: 16.238645306215762 | V18: 15.965250867964162 | W18: =U18-T18 -> -0.46135469378423721
A19: Campo Largo | B19: 4900000 | C19: 4815212.23 | D19: 4767797.28 | F19: 4146796.43 | G19: 3600758.67 | H19: 3233086.91 | J19: =IF(B19=0,0,((C19/B19)*100)-100) -> -1.7303626530612064 | K19: =IF(C19=0,0,IF(D19=0,0,((C19/D19)*100)-100)) -> 0.99448334766447033 | L19: =IF(F19=0,0,((C19/F19)*100)-100) -> 16.118847676349517 | M19: =IF(G19=0,0,((C19/G19)*100)-100) -> 33.727713276602344 | N19: =IF(C19=0,0,IF(H19=0,0,((C19/H19)*100)-100)) -> 48.935440464234233 | P19: 4900000 | Q19: =IF(C19=0,0,((C19/P19)*100)-100) -> -1.7303626530612064 | R19: =IF(C19=0,0,(C19/$C$44)*100) -> 2.5084985054824847 | T19: 16 | U19: 16.493036071226292 | V19: 16.426358351810382 | W19: =U19-T19 -> 0.49303607122629245
A20: Brasilia | B20: 3500000 | C20: 3497052.12 | D20: 3439907.56 | F20: 2925240.76 | G20: 2406203.81 | H20: 2713596.46 | J20: =IF(B20=0,0,((C20/B20)*100)-100) -> -8.4225142857135893E-2 | K20: =IF(C20=0,0,IF(D20=0,0,((C20/D20)*100)-100)) -> 1.6612237103255154 | L20: =IF(F20=0,0,((C20/F20)*100)-100) -> 19.547497348560142 | M20: =IF(G20=0,0,((C20/G20)*100)-100) -> 45.334825980514097 | N20: =IF(C20=0,0,IF(H20=0,0,((C20/H20)*100)-100)) -> 28.871487398682717 | P20: 3500000 | Q20: =IF(C20=0,0,((C20/P20)*100)-100) -> -8.4225142857135893E-2 | R20: =IF(C20=0,0,(C20/$C$44)*100) -> 1.8217992473852713 | T20: 16 | U20: 15.769574518094398 | V20: 15.866135792680151 | W20: =U20-T20 -> -0.23042548190560197
A21: Cajuru | B21: 5700000 | C21: 5714067.1699999999 | D21: 5580347.46 | F21: 4811069.21 | G21: 0 | H21: 0 | J21: =IF(B21=0,0,((C21/B21)*100)-100) -> 0.24679245614034073 | K21: =IF(C21=0,0,IF(D21=0,0,((C21/D21)*100)-100)) -> 2.3962613611160322 | L21: =IF(F21=0,0,((C21/F21)*100)-100) -> 18.769174181137998 | M21: =IF(G21=0,0,((C21/G21)*100)-100) -> 0 | N21: =IF(C21=0,0,IF(H21=0,0,((C21/H21)*100)-100)) -> 0 | P21: 5700000 | Q21: =IF(C21=0,0,((C21/P21)*100)-100) -> 0.24679245614034073 | R21: =IF(C21=0,0,(C21/$C$44)*100) -> 2.9767595427816747 | T21: 16 | U21: 16.432186253071297 | V21: 16.227295206962015 | W21: =U21-T21 -> 0.43218625307129699
A22: Total Super | B22: =SUM(B6:B21) -> 52999998 | C22: =SUM(C6:C21) -> 54223812.499999993 | D22: =SUM(D6:D21) -> 52228657.920000002 | F22: =SUM(F6:F21) -> 45572122.18 | G22: =SUM(G6:G21) -> 35732346.109999999 | H22: =SUM(H6:H21) -> 32186955.170000006 | I22: =SUM(B22:H22) -> 272943891.88000005 | J22: =IF(C22=0,0,((C22/B22)*100)-100) -> 2.3090840493993738 | K22: =IF(C22=0,0,IF(D22=0,0,((C22/D22)*100)-100)) -> 3.8200380010836597 | L22: =IF(F22=0,0,IF(C22=0,0,((C22/F22)*100)-100)) -> 18.984611438167605 | M22: =IF(G22=0,0,IF(C22=0,0,((C22/G22)*100)-100)) -> 51.74993641076648 | N22: =IF(C22=0,0,IF(H22=0,0,((C22/H22)*100)-100)) -> 68.465181666327766 | P22: =SUM(P6:P21) -> 53000000 | Q22: =IF(C22=0,0,((C22/P22)*100)-100) -> 2.309080188679232 | R22: =IF(C22=0,0,(C22/$C$44)*100) -> 28.248049332150089 | T22: 16.485443378695976 | U22: 16.630381568983186 | V22: 16.255013909248824 | W22: =U22-T22 -> 0.14493819028720978
A23: Pinheirinho | B23: 5600000 | C23: 5482399.2999999998 | D23: 5579524.5499999998 | F23: 5067076.75 | G23: 4333747.36 | H23: 4921055.23 | J23: =IF(B23=0,0,((C23/B23)*100)-100) -> -2.1000125000000054 | K23: =IF(C23=0,0,IF(D23=0,0,((C23/D23)*100)-100)) -> -1.7407442001487397 | L23: =IF(F23=0,0,((C23/F23)*100)-100) -> 8.1964921885187465 | M23: =IF(G23=0,0,((C23/G23)*100)-100) -> 26.504820068699146 | N23: =IF(C23=0,0,IF(H23=0,0,((C23/H23)*100)-100)) -> 11.406985773658946 | P23: 5600000 | Q23: =IF(C23=0,0,IF(P23=0,0,((C23/P23)*100)-100)) -> -2.1000125000000054 | R23: =IF(C23=0,0,(C23/$C$44)*100) -> 2.8560715070513556 | T23: 16.1 | U23: 16.050536851629907 | V23: 15.734570376878606 | W23: =U23-T23 -> -4.9463148370094245E-2
A24: Londrina | B24: 6249999 | C24: 5727739.79 | D24: 6185419.9699999997 | F24: 4535938.19 | G24: 3649138.59 | H24: 3505373.97 | J24: =IF(B24=0,0,((C24/B24)*100)-100) -> -8.3561486969837944 | K24: =IF(C24=0,0,IF(D24=0,0,((C24/D24)*100)-100)) -> -7.3993388035056853 | L24: =IF(F24=0,0,((C24/F24)*100)-100) -> 26.274643746854039 | M24: =IF(G24=0,0,((C24/G24)*100)-100) -> 56.961421133638027 | N24: =IF(C24=0,0,IF(H24=0,0,((C24/H24)*100)-100)) -> 63.398822465723953 | P24: 6250000 | Q24: =IF(C24=0,0,IF(P24=0,0,((C24/P24)*100)-100)) -> -8.3561633599999965 | R24: =IF(C24=0,0,(C24/$C$44)*100) -> 2.9838823330550395 | T24: 15.88 | U24: 15.992618442605611 | V24: 15.788651280542895 | W24: =U24-T24 -> 0.11261844260561027
A25: São Bráz | B25: 6500000 | C25: 5750029.3700000001 | D25: 6489125.0800000001 | F25: 5621580.4299999997 | G25: 5158006.82 | H25: 5265304.38 | J25: =IF(B25=0,0,((C25/B25)*100)-100) -> -11.538009692307696 | K25: =IF(C25=0,0,IF(D25=0,0,((C25/D25)*100)-100)) -> -11.389759033586074 | L25: =IF(F25=0,0,((C25/F25)*100)-100) -> 2.2849257713101849 | M25: =IF(G25=0,0,((C25/G25)*100)-100) -> 11.477738798336816 | N25: =IF(C25=0,0,IF(H25=0,0,((C25/H25)*100)-100)) -> 9.2060202984884256 | P25: 6500000 | Q25: =IF(C25=0,0,IF(P25=0,0,((C25/P25)*100)-100)) -> -11.538009692307696 | R25: =IF(C25=0,0,(C25/$C$44)*100) -> 2.995494153146681 | T25: 15.74 | U25: 15.461650415883005 | V25: 15.158070152605148 | W25: =U25-T25 -> -0.27834958411699517
A26: S.J. Pinhais | B26: 6350000 | C26: 6425406.5800000001 | D26: 6254988.1299999999 | F26: 6779515.5999999996 | G26: 5716395.5999999996 | H26: 5679269.7000000002 | J26: =IF(B26=0,0,((C26/B26)*100)-100) -> 1.1875051968503954 | K26: =IF(C26=0,0,IF(D26=0,0,((C26/D26)*100)-100)) -> 2.7245207578035888 | L26: =IF(F26=0,0,((C26/F26)*100)-100) -> -5.2232200778474436 | M26: =IF(G26=0,0,((C26/G26)*100)-100) -> 12.40311254875364 | N26: =IF(C26=0,0,IF(H26=0,0,((C26/H26)*100)-100)) -> 13.137901867910927 | P26: 6350000 | Q26: =IF(C26=0,0,IF(P26=0,0,((C26/P26)*100)-100)) -> 1.1875051968503954 | R26: =IF(C26=0,0,(C26/$C$44)*100) -> 3.3473338314409711 | T26: 16.75 | U26: 16.148724241509399 | V26: 15.932381150579268 | W26: =U26-T26 -> -0.60127575849060122
A27: P.G. Nova | B27: 7700000 | C27: 7808201.2800000003 | D27: 7517586.4699999997 | F27: 6693806.6699999999 | G27: 5263337.1 | H27: 4754274.72 | J27: =IF(B27=0,0,((C27/B27)*100)-100) -> 1.4052114285714339 | K27: =IF(C27=0,0,IF(D27=0,0,((C27/D27)*100)-100)) -> 3.8657993647261719 | L27: =IF(F27=0,0,((C27/F27)*100)-100) -> 16.648144545232284 | M27: =IF(G27=0,0,((C27/G27)*100)-100) -> 48.350773124525887 | N27: =IF(C27=0,0,IF(H27=0,0,((C27/H27)*100)-100)) -> 64.235382678937839 | P27: 7700000 | Q27: =IF(C27=0,0,IF(P27=0,0,((C27/P27)*100)-100)) -> 1.4052114285714339 | R27: =IF(C27=0,0,(C27/$C$44)*100) -> 4.0677046630167784 | T27: 15.73 | U27: 16.235179198659182 | V27: 15.693112119671177 | W27: =U27-T27 -> 0.50517919865918159
A28: Nilo Pecanha | B28: 16950000 | C28: 17016363.289999999 | D28: 16759083.07 | F28: 14590293.23 | G28: 13033104.09 | H28: 12483871.65 | J28: =IF(B28=0,0,((C28/B28)*100)-100) -> 0.39152383480825392 | K28: =IF(C28=0,0,IF(D28=0,0,((C28/D28)*100)-100)) -> 1.5351688330762556 | L28: =IF(F28=0,0,((C28/F28)*100)-100) -> 16.627973281658285 | M28: =IF(G28=0,0,((C28/G28)*100)-100) -> 30.562628614746217 | N28: =IF(C28=0,0,IF(H28=0,0,((C28/H28)*100)-100)) -> 36.306778594603685 | P28: 16950000 | Q28: =IF(C28=0,0,IF(P28=0,0,((C28/P28)*100)-100)) -> 0.39152383480825392 | R28: =IF(C28=0,0,(C28/$C$44)*100) -> 8.864722849757344 | T28: 16.56 | U28: 16.602584828805686 | V28: 16.260380444075487 | W28: =U28-T28 -> 4.2584828805686925E-2
A29: Champagnat | B29: 7400000 | C29: 7246154.8200000003 | D29: 7294569.71 | F29: 6857590.4000000004 | G29: 6276968.7599999998 | H29: 7107216.8399999999 | J29: =IF(B29=0,0,((C29/B29)*100)-100) -> -2.0789889189189097 | K29: =IF(C29=0,0,IF(D29=0,0,((C29/D29)*100)-100)) -> -0.66371138977024202 | L29: =IF(F29=0,0,((C29/F29)*100)-100) -> 5.6661946446962048 | M29: =IF(G29=0,0,((C29/G29)*100)-100) -> 15.440351817204203 | N29: =IF(C29=0,0,IF(H29=0,0,((C29/H29)*100)-100)) -> 1.9548859015817044 | P29: 7400000 | Q29: =IF(C29=0,0,IF(P29=0,0,((C29/P29)*100)-100)) -> -2.0789889189189097 | R29: =IF(C29=0,0,(C29/$C$44)*100) -> 3.7749049612429446 | T29: 17.3 | U29: 16.958409950175476 | V29: 16.283287015112382 | W29: =U29-T29 -> -0.34159004982452501
A30: Araucária Nova | B30: 8200000 | C30: 8058447.8300000001 | D30: 8075729.8600000003 | F30: 4944687.41 | G30: 4367701.21 | H30: 3845093.08 | J30: =IF(B30=0,0,((C30/B30)*100)-100) -> -1.726245975609757 | K30: =IF(C30=0,0,IF(D30=0,0,((C30/D30)*100)-100)) -> -0.21399960498430914 | L30: =IF(F30=0,0,((C30/F30)*100)-100) -> 62.971835463305837 | M30: =IF(G30=0,0,((C30/G30)*100)-100) -> 84.500895151662633 | N30: =IF(C30=0,0,IF(H30=0,0,((C30/H30)*100)-100)) -> 109.57744487163365 | P30: 8200000 | Q30: =IF(C30=0,0,IF(P30=0,0,((C30/P30)*100)-100)) -> -1.726245975609757 | R30: =IF(C30=0,0,(C30/$C$44)*100) -> 4.1980713149300941 | T30: 15.7 | U30: 16.073865182545955 | V30: 15.68703717102801 | W30: =U30-T30 -> 0.37386518254595558
A31: Santa Candida | B31: 9700000 | C31: 9012096.1300000008 | D31: 9084818.6899999995 | F31: 8695058.6099999994 | G31: 7117284.4900000002 | H31: 6687518.0099999998 | J31: =IF(B31=0,0,((C31/B31)*100)-100) -> -7.0917924742267928 | K31: =IF(C31=0,0,IF(D31=0,0,((C31/D31)*100)-100)) -> -0.80048443982758499 | L31: =IF(F31=0,0,((C31/F31)*100)-100) -> 3.6461803677249947 | M31: =IF(G31=0,0,((C31/G31)*100)-100) -> 26.622676705733326 | N31: =IF(C31=0,0,IF(H31=0,0,((C31/H31)*100)-100)) -> 34.759953042728341 | P31: 9700000 | Q31: =IF(C31=0,0,IF(P31=0,0,((C31/P31)*100)-100)) -> -7.0917924742267928 | R31: =IF(C31=0,0,(C31/$C$44)*100) -> 4.6948771089513297 | T31: 16.7 | U31: 16.397510952870846 | V31: 16.23008694981597 | W31: =U31-T31 -> -0.30248904712915348
A32: Paranaguá Raia | B32: 9350000 | C32: 9631895.2599999998 | D32: 9266376.5700000003 | F32: 8254600.4100000001 | G32: 7921748.7999999998 | H32: 6881639.6500000004 | J32: =IF(B32=0,0,((C32/B32)*100)-100) -> 3.0149225668449304 | K32: =IF(C32=0,0,IF(D32=0,0,((C32/D32)*100)-100)) -> 3.9445697812818423 | L32: =IF(F32=0,0,((C32/F32)*100)-100) -> 16.685178949806968 | M32: =IF(G32=0,0,((C32/G32)*100)-100) -> 21.587991530355026 | N32: =IF(C32=0,0,IF(H32=0,0,((C32/H32)*100)-100)) -> 39.965120957764753 | P32: 9350000 | Q32: =IF(C32=0,0,IF(P32=0,0,((C32/P32)*100)-100)) -> 3.0149225668449304 | R32: =IF(C32=0,0,(C32/$C$44)*100) -> 5.0177632284078628 | T32: 18.591100000000001 | U32: 17.937636605903045 | V32: 17.174505191826601 | W32: =U32-T32 -> -0.65346339409695631
A33: Novo Mundo | B33: 7800000 | C33: 7356862.3300000001 | D33: 7488258.8099999996 | F33: 6101780.71 | G33: 5131600.7 | H33: 0 | J33: =IF(B33=0,0,((C33/B33)*100)-100) -> -5.6812521794871884 | K33: =IF(C33=0,0,IF(D33=0,0,((C33/D33)*100)-100)) -> -1.7547000355346825 | L33: =IF(F33=0,0,((C33/F33)*100)-100) -> 20.569103998494896 | M33: =IF(G33=0,0,((C33/G33)*100)-100) -> 43.363888971330113 | N33: =IF(C33=0,0,IF(H33=0,0,((C33/H33)*100)-100)) -> 0 | P33: 7800000 | Q33: =IF(C33=0,0,IF(P33=0,0,((C33/P33)*100)-100)) -> -5.6812521794871884 | R33: =IF(C33=0,0,(C33/$C$44)*100) -> 3.832578353425014 | T33: 15.8 | U33: 15.88871529148215 | V33: 15.527099799623409 | W33: =U33-T33 -> 8.8715291482149183E-2
A34: Água Verde | B34: 8000000 | C34: 8101562.0199999996 | D34: 7955832.6900000004 | F34: 6691362.9699999997 | G34: 0 | H34: 0 | J34: =IF(B34=0,0,((C34/B34)*100)-100) -> 1.2695252499999867 | K34: =IF(C34=0,0,IF(D34=0,0,((C34/D34)*100)-100)) -> 1.8317294452807147 | L34: =IF(F34=0,0,((C34/F34)*100)-100) -> 21.074914876423151 | M34: =IF(G34=0,0,((C34/G34)*100)-100) -> 0 | N34: =IF(C34=0,0,IF(H34=0,0,((C34/H34)*100)-100)) -> 0 | P34: 8000000 | Q34: =IF(C34=0,0,IF(P34=0,0,((C34/P34)*100)-100)) -> 1.2695252499999867 | R34: =IF(C34=0,0,(C34/$C$44)*100) -> 4.2205317748255631 | T34: 16.3 | U34: 17.075580814969804 | V34: 16.107832528818928 | W34: =U34-T34 -> 0.77558081496980336
A35: Uvaranas | B35: 6900000 | C35: 6840505.9800000004 | D35: 6568318.5999999996 | F35: 5879344.8099999996 | G35: 4931330.99 | H35: 4700870.67 | J35: =IF(B35=0,0,((C35/B35)*100)-100) -> -0.86223217391304274 | K35: =IF(C35=0,0,IF(D35=0,0,((C35/D35)*100)-100)) -> 4.1439430176240393 | L35: =IF(F35=0,0,((C35/F35)*100)-100) -> 16.348100018988362 | M35: =IF(G35=0,0,((C35/G35)*100)-100) -> 38.715206784365535 | N35: =IF(C35=0,0,IF(H35=0,0,((C35/H35)*100)-100)) -> 45.515723792503337 | P35: 6900000 | Q35: =IF(C35=0,0,IF(P35=0,0,((C35/P35)*100)-100)) -> -0.86223217391304274 | R35: =IF(C35=0,0,(C35/$C$44)*100) -> 3.5635810443964586 | T35: 16 | U35: 16.023531200830849 | V35: 15.611768612180935 | W35: =U35-T35 -> 2.3531200830849031E-2
A36: Torres | B36: 7600000 | C36: 7500102.4900000002 | D36: 7474651.5599999996 | F36: 6407423.8499999996 | G36: 5429992.6200000001 | H36: 5156231.54 | J36: =IF(B36=0,0,((C36/B36)*100)-100) -> -1.314440921052622 | K36: =IF(C36=0,0,IF(D36=0,0,((C36/D36)*100)-100)) -> 0.34049654081802316 | L36: =IF(F36=0,0,((C36/F36)*100)-100) -> 17.053322295824103 | M36: =IF(G36=0,0,((C36/G36)*100)-100) -> 38.123622164333625 | N36: =IF(C36=0,0,IF(H36=0,0,((C36/H36)*100)-100)) -> 45.457053893278044 | P36: 7600000 | Q36: =IF(C36=0,0,IF(P36=0,0,((C36/P36)*100)-100)) -> -1.314440921052622 | R36: =IF(C36=0,0,(C36/$C$44)*100) -> 3.9071997221460917 | T36: 16 | U36: 16.338337664503037 | V36: 16.123787675066822 | W36: =U36-T36 -> 0.33833766450303671
A37: Total Hiper | B37: =SUM(B23:B36) -> 114299999 | C37: =SUM(C23:C36) -> 111957766.47 | D37: =SUM(D23:D36) -> 111994283.75999999 | F37: =SUM(F23:F36) -> 97120060.039999992 | G37: =SUM(G23:G36) -> 78330357.129999995 | H37: =SUM(H23:H36) -> 70987719.439999998 | I37: =SUM(B37:H37) -> 584690185.83999991 | J37: =IF(C37=0,0,((C37/B37)*100)-100) -> -2.0491973320139749 | K37: =IF(C37=0,0,IF(D37=0,0,((C37/D37)*100)-100)) -> -3.2606387374428891E-2 | L37: =IF(F37=0,0,IF(C37=0,0,((C37/F37)*100)-100)) -> 15.277694869514008 | M37: =IF(G37=0,0,IF(C37=0,0,((C37/G37)*100)-100)) -> 42.930238763230335 | N37: =IF(C37=0,0,IF(H37=0,0,((C37/H37)*100)-100)) -> 57.71427417756189 | P37: =SUM(P23:P36) -> 114300000 | Q37: =IF(C37=0,0,((C37/P37)*100)-100) -> -2.0491981889763764 | R37: =IF(C37=0,0,(C37/$C$44)*100) -> 58.324716845793525 | T37: 16.431428570003746 | U37: 16.451636881247975 | V37: 16.023914725922275 | W37: =U37-T37 -> 2.0208311244228838E-2
A38: Total 33,36,38,39,10 | B38: =B22+B37 -> 167299997 | C38: =C22+C37 -> 166181578.97 | D38: =D22+D37 -> 164222941.68000001 | E38: =E22+E37 -> 0 | F38: =F22+F37 -> 142692182.22 | G38: =G22+G37 -> 114062703.23999999 | H38: =H22+H37 -> 103174674.61 | I38: =SUM(B38:H38) -> 857634077.72000003 | J38: =IF(C38=0,0,((C38/B38)*100)-100) -> -0.66851049017053299 | K38: =IF(C38=0,0,IF(D38=0,0,((C38/D38)*100)-100)) -> 1.1926697146958531 | L38: =IF(F38=0,0,IF(C38=0,0,((C38/F38)*100)-100)) -> 16.461586321375691 | M38: =IF(G38=0,0,IF(C38=0,0,((C38/G38)*100)-100)) -> 45.693179496488312 | N38: =IF(C38=0,0,IF(H38=0,0,((C38/H38)*100)-100)) -> 61.068188097676057 | P38: =P22+P37 -> 167300000 | Q38: =IF(C38=0,0,((C38/P38)*100)-100) -> -0.66851227136879743 | R38: =IF(C38=0,0,(C38/$C$44)*100) -> 86.57276617794362 | T38: 16.448540254426902 | U38: 16.509959942643814 | V38: 16.099320669609114 | W38: =U38-T38 -> 6.1419688216911794E-2
A39: S.J.P - Rua Joinvile | B39: 6200000 | C39: 5819593.2000000002 | D39: 5875960.1399999997 | F39: 0 | G39: 0 | H39: 0 | J39: =IF(B39=0,0,((C39/B39)*100)-100) -> -6.1355935483870923 | K39: =IF(C39=0,0,IF(D39=0,0,((C39/D39)*100)-100)) -> -0.95928050322001468 | L39: =IF(F39=0,0,((C39/F39)*100)-100) -> 0 | M39: =IF(G39=0,0,((C39/G39)*100)-100) -> 0 | N39: =IF(C39=0,0,IF(H39=0,0,((C39/H39)*100)-100)) -> 0 | P39: 6200000 | Q39: =IF(P39=0,0,IF(C39=0,0,((C39/P39)*100)-100)) -> -6.1355935483870923 | R39: =IF(C39=0,0,(C39/$C$44)*100) -> 3.0317336282218301 | T39: 16.15 | U39: 16.123393470182762 | V39: 15.816024937963016 | W39: =U39-T39 -> -2.6606529817236435E-2
A40: Castro | B40: 4000000 | C40: 3735739.8 | D40: 3791130.76 | F40: 0 | G40: 0 | H40: 0 | J40: =IF(B40=0,0,((C40/B40)*100)-100) -> -6.6065050000000127 | K40: =IF(C40=0,0,IF(D40=0,0,((C40/D40)*100)-100)) -> -1.4610669878345277 | L40: =IF(F40=0,0,((C40/F40)*100)-100) -> 0 | M40: =IF(G40=0,0,((C40/G40)*100)-100) -> 0 | N40: =IF(C40=0,0,IF(H40=0,0,((C40/H40)*100)-100)) -> 0 | P40: 4000000 | Q40: =IF(P40=0,0,IF(C40=0,0,((C40/P40)*100)-100)) -> -6.6065050000000127 | R40: =IF(C40=0,0,(C40/$C$44)*100) -> 1.9461442730991392 | T40: 16.95 | U40: 16.191266586607558 | V40: 16.167907665839039 | W40: =U40-T40 -> -0.75873341339244149
A41: Colombo | B41: 4500000 | C41: 4523466.32 | D41: 4492252.26 | F41: 0 | G41: 0 | H41: 0 | J41: =IF(B41=0,0,((C41/B41)*100)-100) -> 0.52147377777778559 | K41: =IF(C41=0,0,IF(D41=0,0,((C41/D41)*100)-100)) -> 0.69484210132047508 | L41: =IF(F41=0,0,((C41/F41)*100)-100) -> 0 | M41: =IF(G41=0,0,((C41/G41)*100)-100) -> 0 | N41: =IF(C41=0,0,IF(H41=0,0,((C41/H41)*100)-100)) -> 0 | P41: 4500000 | Q41: =IF(P41=0,0,IF(C41=0,0,((C41/P41)*100)-100)) -> 0.52147377777778559 | R41: =IF(C41=0,0,(C41/$C$44)*100) -> 2.3565126439547099 | T41: 16.4 | U41: 15.905814017423699 | V41: 16.260270298641238 | W41: =U41-T41 -> -0.49418598257629931
A42: Pinhais | B42: 6300000 | C42: 5810674.1699999999 | D42: 6284855.7599999998 | F42: 0 | G42: 0 | H42: 0 | J42: =IF(B42=0,0,((C42/B42)*100)-100) -> -7.767076666666668 | K42: =IF(C42=0,0,IF(D42=0,0,((C42/D42)*100)-100)) -> -7.5448285228426641 | L42: =IF(F42=0,0,((C42/F42)*100)-100) -> 0 | M42: =IF(G42=0,0,((C42/G42)*100)-100) -> 0 | N42: =IF(C42=0,0,IF(H42=0,0,((C42/H42)*100)-100)) -> 0 | P42: 6300000 | Q42: =IF(P42=0,0,IF(C42=0,0,((C42/P42)*100)-100)) -> -7.767076666666668 | R42: =IF(C42=0,0,(C42/$C$44)*100) -> 3.0270872341779786 | T42: 16.2 | U42: 15.582803707611777 | V42: 15.747121026405789 | W42: =U42-T42 -> -0.61719629238822193
A43: Campo Comprido | B43: 4699997 | C43: 5884901.25 | D43: 414394.18 | F43: 0 | G43: 1326363.91 | H43: 1309042.17 | J43: =IF(B43=0,0,((C43/B43)*100)-100) -> 25.210744815369026 | K43: =IF(C43=0,0,IF(D43=0,0,((C43/D43)*100)-100)) -> 1320.1215977502388 | L43: =IF(F43=0,0,((C43/F43)*100)-100) -> 0 | M43: =IF(G43=0,0,((C43/G43)*100)-100) -> 343.68677446900682 | N43: =IF(C43=0,0,IF(H43=0,0,((C43/H43)*100)-100)) -> 349.55780530737223 | P43: 4700000 | Q43: =IF(P43=0,0,IF(C43=0,0,((C43/P43)*100)-100)) -> 25.210664893617036 | R43: =IF(C43=0,0,(C43/$C$44)*100) -> 3.0657560426027173 | T43: 16 | U43: 17.083992700812097 | V43: 17.148207307641737 | W43: =U43-T43 -> 1.0839927008120966
A44: Total Geral | B44: =B22+B37+SUM(B39:B43) -> 192999994 | C44: =C22+C37+SUM(C39:C43) -> 191955953.71000001 | D44: =D22+D37+SUM(D39:D43) -> 185081534.78 | F44: =F22+F37+SUM(F39:F43) -> 142692182.22 | G44: =G22+G37+SUM(G39:G43) -> 115389067.14999999 | H44: =H22+H37+SUM(H39:H43) -> 104483716.78 | J44: =IF(C44=0,0,((C44/B44)*100)-100) -> -0.54095353495191034 | K44: =IF(C44=0,0,IF(D44=0,0,((C44/D44)*100)-100)) -> 3.7142651416692587 | L44: =IF(F44=0,0,IF(C44=0,0,((C44/F44)*100)-100)) -> 34.524506334934387 | M44: =IF(G44=0,0,IF(C44=0,0,((C44/G44)*100)-100)) -> 66.355408229851548 | N44: =IF(C44=0,0,IF(H44=0,0,((C44/H44)*100)-100)) -> 83.71853493131448 | P44: =P22+P37+SUM(P39:P43) -> 193000000 | Q44: =IF(C44=0,0,((C44/P44)*100)-100) -> -0.54095662694300017 | R44: =R22+R37+SUM(R39:R43) -> 100 | T44: 16.429300000000001 | U44: 16.467333885228307 | V44: 16.117354412950551 | W44: =U44-T44 -> 3.8033885228305309E-2
A46: Água Verde | B46: 0 | C46: 0 | D46: 0 | F46: 0 | G46: 0 | H46: 0 | J46: =IF(B46=0,0,((C46/B46)*100)-100) -> 0 | K46: =IF(C46=0,0,IF(D46=0,0,((C46/D46)*100)-100)) -> 0 | L46: =IF(F46=0,0,((C46/F46)*100)-100) -> 0 | M46: =IF(G46=0,0,((C46/G46)*100)-100) -> 0 | N46: =IF(C46=0,0,IF(H46=0,0,((C46/H46)*100)-100)) -> 0 | P46: =B46 -> 0 | Q46: =IF(C46=0,0,IF(P46=0,0,((C46/P46)*100)-100)) -> 0 | R46: =IF(C46=0,0,(C46/$C$44)*100) -> 0 | T46: 14.95 | U46: 0 | W46: =U46-T46 -> -14.95
A47: Total Geral | B47: =B44+B46 -> 192999994 | C47: =C44+C46 -> 191955953.71000001 | D47: =D44+D46 -> 185081534.78 | F47: =F44+F46 -> 142692182.22 | G47: =G44+G46 -> 115389067.14999999 | H47: =H44+H46 -> 104483716.78 | J47: =IF(C47=0,0,((C47/B47)*100)-100) -> -0.54095353495191034 | K47: =IF(C47=0,0,IF(D47=0,0,((C47/D47)*100)-100)) -> 3.7142651416692587 | L47: =IF(F47=0,0,IF(C47=0,0,((C47/F47)*100)-100)) -> 34.524506334934387 | M47: =IF(G47=0,0,IF(C47=0,0,((C47/G47)*100)-100)) -> 66.355408229851548 | N47: =IF(C47=0,0,IF(H47=0,0,((C47/H47)*100)-100)) -> 83.71853493131448 | P47: =P44+P46 -> 193000000 | Q47: =IF(C47=0,0,((C47/P47)*100)-100) -> -0.54095662694300017 | R47: =R25+R40+R46 -> 4.9416384262458202 | T47: 16.429175055932905 | U47: 16.467333885228307 | W47: =U47-T47 -> 3.8158829295401375E-2