A2: Periodo: | B2: 40391 | C2: a | D2: 40421 | G2: Vendas Acumuladas por Filial | P2: =NOW() -> 40452.43019525463
A4: v.New | B4: Vendas 2010 | F4: Vendas de Anos Anteriores | J4: Percentuais ( % ) | P4: Meta Mensal | T4: Margem
A5: Lojas | B5: Previsao | C5: Realizada | D5: Mes Anterior | F5: Vendas 2009 | G5: Vendas 2008 | H5: Vendas 2007 | J5: % Prev | K5: % MA | L5: 2009 | M5: 2008 | N5: 2007 | P5: Previsao Mes | Q5: Final | R5: Part. | T5: Meta | U5: Coml | V5: Dif
A6: S. Felicidade | B6: 3240000 | C6: 2954912.29 | D6: 3101115.42 | F6: 2927116.09 | G6: 2457600.21 | H6: 1391722.14 | J6: =IF(B6=0,0,((C6/B6)*100)-100) -> -8.7990033950617175 | K6: =IF(C6=0,0,IF(D6=0,0,((C6/D6)*100)-100)) -> -4.7145336499600461 | L6: =IF(F6=0,0,((C6/F6)*100)-100) -> 0.94961044062998212 | M6: =IF(G6=0,0,((C6/G6)*100)-100) -> 20.235678609418756 | N6: =IF(C6=0,0,IF(H6=0,0,((C6/H6)*100)-100)) -> 112.3205634998377 | P6: 3240000 | Q6: =IF(C6=0,0,((C6/P6)*100)-100) -> -8.7990033950617175 | R6: =IF(C6=0,0,(C6/$C$40)*100) -> 2.5608251741176322 | T6: 17.500299999999999 | U6: 16.90233519587818 | V6: =U6-T6 -> -0.59796480412181907
A7: Lapa | B7: 2450000 | C7: 2256853.47 | D7: 2489752.94 | F7: 2194545.64 | G7: 2155346.87 | H7: 1399037.29 | J7: =IF(B7=0,0,((C7/B7)*100)-100) -> -7.8835318367346758 | K7: =IF(C7=0,0,IF(D7=0,0,((C7/D7)*100)-100)) -> -9.3543205134241134 | L7: =IF(F7=0,0,((C7/F7)*100)-100) -> 2.8392132231982288 | M7: =IF(G7=0,0,((C7/G7)*100)-100) -> 4.7095250148761352 | N7: =IF(C7=0,0,IF(H7=0,0,((C7/H7)*100)-100)) -> 61.31474737174446 | P7: 2450000 | Q7: =IF(C7=0,0,((C7/P7)*100)-100) -> -7.8835318367346758 | R7: =IF(C7=0,0,(C7/$C$40)*100) -> 1.955864206132065 | T7: 16.305 | U7: 16.05773679227832 | V7: =U7-T7 -> -0.24726320772168009
A8: Araucaria | B8: 1500000 | C8: 1434345.09 | D8: 1506680.49 | F8: 1395128.03 | G8: 1213852.54 | H8: 972455.58 | J8: =IF(B8=0,0,((C8/B8)*100)-100) -> -4.3769939999999963 | K8: =IF(C8=0,0,IF(D8=0,0,((C8/D8)*100)-100)) -> -4.8009780759821155 | L8: =IF(F8=0,0,((C8/F8)*100)-100) -> 2.8110007939558272 | M8: =IF(G8=0,0,((C8/G8)*100)-100) -> 18.164689921891181 | N8: =IF(C8=0,0,IF(H8=0,0,((C8/H8)*100)-100)) -> 47.497234783721467 | P8: 1500000 | Q8: =IF(C8=0,0,((C8/P8)*100)-100) -> -4.3769939999999963 | R8: =IF(C8=0,0,(C8/$C$40)*100) -> 1.2430511143340979 | T8: 16.8 | U8: 16.81762162270169 | V8: =U8-T8 -> 1.7621622701689432E-2
A9: Hauer | B9: 4050000 | C9: 3743117.98 | D9: 3881089.46 | F9: 4025689.1 | G9: 3787813.32 | H9: 3151408.01 | J9: =IF(B9=0,0,((C9/B9)*100)-100) -> -7.5773338271604871 | K9: =IF(C9=0,0,IF(D9=0,0,((C9/D9)*100)-100)) -> -3.5549677847415637 | L9: =IF(F9=0,0,((C9/F9)*100)-100) -> -7.0191987751860978 | M9: =IF(G9=0,0,((C9/G9)*100)-100) -> -1.1799773701624758 | N9: =IF(C9=0,0,IF(H9=0,0,((C9/H9)*100)-100)) -> 18.776050835765943 | P9: 4050000 | Q9: =IF(C9=0,0,((C9/P9)*100)-100) -> -7.5773338271604871 | R9: =IF(C9=0,0,(C9/$C$40)*100) -> 3.2439104149776097 | T9: 16.2 | U9: 16.201140686460544 | V9: =U9-T9 -> 1.1406864605447709E-3
A10: Paranagua | B10: 2200000 | C10: 2221148.85 | D10: 5201886.79 | F10: 2074746.43 | G10: 1941362.3 | H10: 1703447.11 | J10: =IF(B10=0,0,((C10/B10)*100)-100) -> 0.96131136363636926 | K10: =IF(C10=0,0,IF(D10=0,0,((C10/D10)*100)-100)) -> -57.301092090856514 | L10: =IF(F10=0,0,((C10/F10)*100)-100) -> 7.0564006224124682 | M10: =IF(G10=0,0,((C10/G10)*100)-100) -> 14.411866862769514 | N10: =IF(C10=0,0,IF(H10=0,0,((C10/H10)*100)-100)) -> 30.39141849258823 | P10: 2200000 | Q10: =IF(C10=0,0,((C10/P10)*100)-100) -> 0.96131136363636926 | R10: =IF(C10=0,0,(C10/$C$40)*100) -> 1.9249213960737994 | T10: 17.9481 | U10: 17.46783517007426 | V10: =U10-T10 -> -0.4802648299257406
A11: Centenario | B11: 1400000 | C11: 1326363.91 | D11: 1457571.8 | F11: 1309042.17 | G11: 1328475.56 | H11: 1076890.93 | J11: =IF(B11=0,0,((C11/B11)*100)-100) -> -5.2597207142857201 | K11: =IF(C11=0,0,IF(D11=0,0,((C11/D11)*100)-100)) -> -9.0018131525321934 | L11: =IF(F11=0,0,((C11/F11)*100)-100) -> 1.3232377380172551 | M11: =IF(G11=0,0,((C11/G11)*100)-100) -> -0.15895286775166539 | N11: =IF(C11=0,0,IF(H11=0,0,((C11/H11)*100)-100)) -> 23.166039665688331 | P11: 1400000 | Q11: =IF(C11=0,0,((C11/P11)*100)-100) -> -5.2597207142857201 | R11: =IF(C11=0,0,(C11/$C$40)*100) -> 1.1494710358286446 | T11: 17 | U11: 15.066564951997224 | V11: =U11-T11 -> -1.9334350480027762
A12: Sitio Cercado | B12: 2650000 | C12: 2407630.8 | D12: 2559453.71 | F12: 2345310.64 | G12: 1960720.88 | H12: 1507701.6 | J12: =IF(B12=0,0,((C12/B12)*100)-100) -> -9.1460075471698161 | K12: =IF(C12=0,0,IF(D12=0,0,((C12/D12)*100)-100)) -> -5.9318482458508726 | L12: =IF(F12=0,0,((C12/F12)*100)-100) -> 2.6572241193601371 | M12: =IF(G12=0,0,((C12/G12)*100)-100) -> 22.793143305537697 | N12: =IF(C12=0,0,IF(H12=0,0,((C12/H12)*100)-100)) -> 59.688813754658071 | P12: 2650000 | Q12: =IF(C12=0,0,((C12/P12)*100)-100) -> -9.1460075471698161 | R12: =IF(C12=0,0,(C12/$C$40)*100) -> 2.0865328502258094 | T12: 16.627600000000001 | U12: 14.735891399960494 | V12: =U12-T12 -> -1.8917086000395074
A13: Apucarana | B13: 2800000 | C13: 2608380.29 | D13: 2803913.3 | F13: 2689766.58 | G13: 2424911.98 | H13: 2209220.77 | J13: =IF(B13=0,0,((C13/B13)*100)-100) -> -6.8435610714285673 | K13: =IF(C13=0,0,IF(D13=0,0,((C13/D13)*100)-100)) -> -6.9735754668305816 | L13: =IF(F13=0,0,((C13/F13)*100)-100) -> -3.0257751957049095 | M13: =IF(G13=0,0,((C13/G13)*100)-100) -> 7.5659781267607258 | N13: =IF(C13=0,0,IF(H13=0,0,((C13/H13)*100)-100)) -> 18.067887348352258 | P13: 2800000 | Q13: =IF(C13=0,0,((C13/P13)*100)-100) -> -6.8435610714285673 | R13: =IF(C13=0,0,(C13/$C$40)*100) -> 2.2605090286129097 | T13: 16.898399999999999 | U13: 16.24810391432608 | V13: =U13-T13 -> -0.65029608567391861
A14: Ahú | B14: 1900000 | C14: 1874908.07 | D14: 1923325.96 | F14: 1756091.51 | G14: 1670793.53 | H14: 1491365.19 | J14: =IF(B14=0,0,((C14/B14)*100)-100) -> -1.3206278947368304 | K14: =IF(C14=0,0,IF(D14=0,0,((C14/D14)*100)-100)) -> -2.5174042781599013 | L14: =IF(F14=0,0,((C14/F14)*100)-100) -> 6.7659663134525374 | M14: =IF(G14=0,0,((C14/G14)*100)-100) -> 12.216622600878765 | N14: =IF(C14=0,0,IF(H14=0,0,((C14/H14)*100)-100)) -> 25.717569551157354 | P14: 1900000 | Q14: =IF(C14=0,0,((C14/P14)*100)-100) -> -1.3206278947368304 | R14: =IF(C14=0,0,(C14/$C$40)*100) -> 1.6248576314975167 | T14: 17.698499999999999 | U14: 16.903334892574225 | V14: =U14-T14 -> -0.79516510742577395
A15: P.G. Centro | B15: 1970000 | C15: 1917935.73 | D15: 2015217.52 | F15: 1932278.69 | G15: 2159989.02 | H15: 1937043.19 | J15: =IF(B15=0,0,((C15/B15)*100)-100) -> -2.6428563451776625 | K15: =IF(C15=0,0,IF(D15=0,0,((C15/D15)*100)-100)) -> -4.8273592817910753 | L15: =IF(F15=0,0,((C15/F15)*100)-100) -> -0.74228216013705151 | M15: =IF(G15=0,0,((C15/G15)*100)-100) -> -11.206227798324647 | N15: =IF(C15=0,0,IF(H15=0,0,((C15/H15)*100)-100)) -> -0.98642405593444948 | P15: 1970000 | Q15: =IF(C15=0,0,((C15/P15)*100)-100) -> -2.6428563451776625 | R15: =IF(C15=0,0,(C15/$C$40)*100) -> 1.6621468313442485 | T15: 18.8 | U15: 18.330098579476385 | V15: =U15-T15 -> -0.46990142052361605
A16: Maringa | B16: 3000000 | C16: 3130508.11 | D16: 3174981.94 | F16: 2774162.76 | G16: 3097553.9 | H16: 2579213.99 | J16: =IF(B16=0,0,((C16/B16)*100)-100) -> 4.3502703333333272 | K16: =IF(C16=0,0,IF(D16=0,0,((C16/D16)*100)-100)) -> -1.4007585189602594 | L16: =IF(F16=0,0,((C16/F16)*100)-100) -> 12.84514935958552 | M16: =IF(G16=0,0,((C16/G16)*100)-100) -> 1.0638785010327183 | N16: =IF(C16=0,0,IF(H16=0,0,((C16/H16)*100)-100)) -> 21.374500996716421 | P16: 3000000 | Q16: =IF(C16=0,0,((C16/P16)*100)-100) -> 4.3502703333333272 | R16: =IF(C16=0,0,(C16/$C$40)*100) -> 2.7130023462954997 | T16: 18.803000000000001 | U16: 17.026283953629495 | V16: =U16-T16 -> -1.7767160463705061
A17: Araucaria Nova | B17: 4350000 | C17: 4367701.21 | D17: 4409243.07 | F17: 3845093.08 | G17: 3251399.34 | H17: 2277783.68 | J17: =IF(B17=0,0,((C17/B17)*100)-100) -> 0.40692436781608876 | K17: =IF(C17=0,0,IF(D17=0,0,((C17/D17)*100)-100)) -> -0.94215400104944536 | L17: =IF(F17=0,0,((C17/F17)*100)-100) -> 13.591559921353053 | M17: =IF(G17=0,0,((C17/G17)*100)-100) -> 34.332967232502426 | N17: =IF(C17=0,0,IF(H17=0,0,((C17/H17)*100)-100)) -> 91.752239176636806 | P17: 4350000 | Q17: =IF(C17=0,0,((C17/P17)*100)-100) -> 0.40692436781608876 | R17: =IF(C17=0,0,(C17/$C$40)*100) -> 3.7851949952775215 | T17: 16 | U17: 15.661307106673627 | V17: =U17-T17 -> -0.33869289332637287
A18: Cristo Rei | B18: 2400000 | C18: 2479694.32 | D18: 2451640.76 | F18: 2125436.33 | G18: 1800549.17 | H18: 1517851.63 | J18: =IF(B18=0,0,((C18/B18)*100)-100) -> 3.3205966666666598 | K18: =IF(C18=0,0,IF(D18=0,0,((C18/D18)*100)-100)) -> 1.1442769453710753 | L18: =IF(F18=0,0,((C18/F18)*100)-100) -> 16.667541859510777 | M18: =IF(G18=0,0,((C18/G18)*100)-100) -> 37.718778321394012 | N18: =IF(C18=0,0,IF(H18=0,0,((C18/H18)*100)-100)) -> 63.368689731551683 | P18: 2400000 | Q18: =IF(C18=0,0,((C18/P18)*100)-100) -> 3.3205966666666598 | R18: =IF(C18=0,0,(C18/$C$40)*100) -> 2.1489854911302637 | T18: 17.65 | U18: 17.514126095993962 | V18: =U18-T18 -> -0.13587390400603638
A19: Campo Largo | B19: 3800000 | C19: 3600758.67 | D19: 3812045.62 | F19: 3233086.91 | G19: 2465556.02 | H19: 0 | J19: =IF(B19=0,0,((C19/B19)*100)-100) -> -5.2431928947368505 | K19: =IF(C19=0,0,IF(D19=0,0,((C19/D19)*100)-100)) -> -5.5426133646323024 | L19: =IF(F19=0,0,((C19/F19)*100)-100) -> 11.372158257261319 | M19: =IF(G19=0,0,((C19/G19)*100)-100) -> 46.04246023174926 | N19: =IF(C19=0,0,IF(H19=0,0,((C19/H19)*100)-100)) -> 0 | P19: 3800000 | Q19: =IF(C19=0,0,((C19/P19)*100)-100) -> -5.2431928947368505 | R19: =IF(C19=0,0,(C19/$C$40)*100) -> 3.1205371067235035 | T19: 16.6 | U19: 16.419601372507422 | V19: =U19-T19 -> -0.18039862749257907
A20: Brasilia | B20: 2600000 | C20: 2406203.81 | D20: 2546087.81 | F20: 2713596.46 | G20: 2690489.24 | H20: 846819.77 | J20: =IF(B20=0,0,((C20/B20)*100)-100) -> -7.4536996153846076 | K20: =IF(C20=0,0,IF(D20=0,0,((C20/D20)*100)-100)) -> -5.4940760271736195 | L20: =IF(F20=0,0,((C20/F20)*100)-100) -> -11.327868919758245 | M20: =IF(G20=0,0,((C20/G20)*100)-100) -> -10.566309865636185 | N20: =IF(C20=0,0,IF(H20=0,0,((C20/H20)*100)-100)) -> 184.14591808597004 | P20: 2600000 | Q20: =IF(C20=0,0,((C20/P20)*100)-100) -> -7.4536996153846076 | R20: =IF(C20=0,0,(C20/$C$40)*100) -> 2.0852961732768587 | T20: 17.1 | U20: 16.064962925979241 | V20: =U20-T20 -> -1.0350370740207602
A21: Total Super | B21: =SUM(B6:B20) -> 40310000 | C21: =SUM(C6:C20) -> 38730462.600000001 | D21: =SUM(D6:D20) -> 43334006.590000004 | F21: =SUM(F6:F20) -> 37341090.419999994 | G21: =SUM(G6:G20) -> 34406413.879999995 | H21: =SUM(H6:H20) -> 24061960.879999995 | I21: =SUM(B21:H21) -> 218183934.36999997 | J21: =IF(C21=0,0,((C21/B21)*100)-100) -> -3.9184753162986823 | K21: =IF(C21=0,0,IF(D21=0,0,((C21/D21)*100)-100)) -> -10.623398001380153 | L21: =IF(F21=0,0,IF(C21=0,0,((C21/F21)*100)-100)) -> 3.7207595289072088 | M21: =IF(G21=0,0,IF(C21=0,0,((C21/G21)*100)-100)) -> 12.567565847115276 | N21: =IF(C21=0,0,IF(H21=0,0,((C21/H21)*100)-100)) -> 60.961372986822056 | P21: =SUM(P6:P20) -> 40310000 | Q21: =IF(C21=0,0,((C21/P21)*100)-100) -> -3.9184753162986823 | R21: =IF(C21=0,0,(C21/$C$40)*100) -> 33.565105795847984 | T21: 16.98 | U21: 0 | V21: =U21-T21 -> -16.98
A22: Pinheirinho | B22: 4600000 | C22: 4333747.36 | D22: 4329409.29 | F22: 4921055.23 | G22: 4062878.07 | H22: 3338493.02 | J22: =IF(B22=0,0,((C22/B22)*100)-100) -> -5.7881008695651985 | K22: =IF(C22=0,0,IF(D22=0,0,((C22/D22)*100)-100)) -> 0.10020004368772106 | L22: =IF(F22=0,0,((C22/F22)*100)-100) -> -11.934592126087566 | M22: =IF(G22=0,0,((C22/G22)*100)-100) -> 6.6669313066537654 | N22: =IF(C22=0,0,IF(H22=0,0,((C22/H22)*100)-100)) -> 29.811484823772389 | P22: 4600000 | Q22: =IF(C22=0,0,IF(P22=0,0,((C22/P22)*100)-100)) -> -5.7881008695651985 | R22: =IF(C22=0,0,(C22/$C$40)*100) -> 3.755769460674526 | T22: 15.948700000000001 | U22: 15.710478102258365 | V22: =U22-T22 -> -0.23822189774163505
A23: Londrina | B23: 3749999 | C23: 3649138.59 | D23: 3927436.69 | F23: 3505373.97 | G23: 3405702.49 | H23: 2691410.31 | J23: =IF(B23=0,0,((C23/B23)*100)-100) -> -2.6896116505631085 | K23: =IF(C23=0,0,IF(D23=0,0,((C23/D23)*100)-100)) -> -7.0859983741711261 | L23: =IF(F23=0,0,((C23/F23)*100)-100) -> 4.1012634095642539 | M23: =IF(G23=0,0,((C23/G23)*100)-100) -> 7.1478968205469897 | N23: =IF(C23=0,0,IF(H23=0,0,((C23/H23)*100)-100)) -> 35.584625519250523 | P23: 3750000 | Q23: =IF(C23=0,0,IF(P23=0,0,((C23/P23)*100)-100)) -> -2.6896376000000117 | R23: =IF(C23=0,0,(C23/$C$40)*100) -> 3.1624647529271064 | T23: 16.961099999999998 | U23: 15.263561420395384 | V23: =U23-T23 -> -1.6975385796046147
A24: São Bráz | B24: 5450000 | C24: 5158006.82 | D24: 5382611.0300000003 | F24: 5265304.38 | G24: 4713167.77 | H24: 4269413.75 | J24: =IF(B24=0,0,((C24/B24)*100)-100) -> -5.3576730275229352 | K24: =IF(C24=0,0,IF(D24=0,0,((C24/D24)*100)-100)) -> -4.1727743050383452 | L24: =IF(F24=0,0,((C24/F24)*100)-100) -> -2.0378225503460783 | M24: =IF(G24=0,0,((C24/G24)*100)-100) -> 9.4382180246471705 | N24: =IF(C24=0,0,IF(H24=0,0,((C24/H24)*100)-100)) -> 20.812999677063402 | P24: 5450000 | Q24: =IF(C24=0,0,IF(P24=0,0,((C24/P24)*100)-100)) -> -5.3576730275229352 | R24: =IF(C24=0,0,(C24/$C$40)*100) -> 4.4701000965840629 | T24: 16.25 | U24: 15.156296943399541 | V24: =U24-T24 -> -1.0937030566004591
A25: S.J. Pinhais | B25: 6000000 | C25: 5716395.5999999996 | D25: 6004669 | F25: 5679269.7000000002 | G25: 5092042.1 | H25: 4307896.16 | J25: =IF(B25=0,0,((C25/B25)*100)-100) -> -4.7267400000000066 | K25: =IF(C25=0,0,IF(D25=0,0,((C25/D25)*100)-100)) -> -4.8008208279257474 | L25: =IF(F25=0,0,((C25/F25)*100)-100) -> 0.65370904995054957 | M25: =IF(G25=0,0,((C25/G25)*100)-100) -> 12.261357776283901 | N25: =IF(C25=0,0,IF(H25=0,0,((C25/H25)*100)-100)) -> 32.695761171736308 | P25: 6000000 | Q25: =IF(C25=0,0,IF(P25=0,0,((C25/P25)*100)-100)) -> -4.7267400000000066 | R25: =IF(C25=0,0,(C25/$C$40)*100) -> 4.9540183670545641 | T25: 16.0959 | U25: 15.721223702572299 | V25: =U25-T25 -> -0.37467629742770114
A26: P.G. Nova | B26: 5400000 | C26: 5263337.1 | D26: 5746817.6699999999 | F26: 4754274.72 | G26: 4698727.28 | H26: 4060931.03 | J26: =IF(B26=0,0,((C26/B26)*100)-100) -> -2.530794444444453 | K26: =IF(C26=0,0,IF(D26=0,0,((C26/D26)*100)-100)) -> -8.4130139107058284 | L26: =IF(F26=0,0,((C26/F26)*100)-100) -> 10.707466648035862 | M26: =IF(G26=0,0,((C26/G26)*100)-100) -> 12.01622878610651 | N26: =IF(C26=0,0,IF(H26=0,0,((C26/H26)*100)-100)) -> 29.60912315715936 | P26: 5400000 | Q26: =IF(C26=0,0,IF(P26=0,0,((C26/P26)*100)-100)) -> -2.530794444444453 | R26: =IF(C26=0,0,(C26/$C$40)*100) -> 4.5613828170674022 | T26: 16.298200000000001 | U26: 15.677468767865923 | V26: =U26-T26 -> -0.62073123213407833
A27: Nilo Pecanha | B27: 13300000 | C27: 13033104.09 | D27: 13492288.15 | F27: 12483871.65 | G27: 11383871.52 | H27: 9717772.7300000004 | J27: =IF(B27=0,0,((C27/B27)*100)-100) -> -2.0067361654135425 | K27: =IF(C27=0,0,IF(D27=0,0,((C27/D27)*100)-100)) -> -3.4033075405375257 | L27: =IF(F27=0,0,((C27/F27)*100)-100) -> 4.3995361006454914 | M27: =IF(G27=0,0,((C27/G27)*100)-100) -> 14.487448906134532 | N27: =IF(C27=0,0,IF(H27=0,0,((C27/H27)*100)-100)) -> 34.116164805595304 | P27: 13300000 | Q27: =IF(C27=0,0,IF(P27=0,0,((C27/P27)*100)-100)) -> -2.0067361654135425 | R27: =IF(C27=0,0,(C27/$C$40)*100) -> 11.294921058576486 | T27: 16.500900000000001 | U27: 16.449643655074961 | V27: =U27-T27 -> -5.1256344925040054E-2
A28: Champagnat | B28: 6700000 | C28: 6276969.7000000002 | D28: 6457497.8300000001 | F28: 7107216.8399999999 | G28: 6479647.3700000001 | H28: 5598266.2199999997 | J28: =IF(B28=0,0,((C28/B28)*100)-100) -> -6.3138850746268673 | K28: =IF(C28=0,0,IF(D28=0,0,((C28/D28)*100)-100)) -> -2.7956359375191653 | L28: =IF(F28=0,0,((C28/F28)*100)-100) -> -11.681747703648227 | M28: =IF(G28=0,0,((C28/G28)*100)-100) -> -3.1279120363613231 | N28: =IF(C28=0,0,IF(H28=0,0,((C28/H28)*100)-100)) -> 12.123458466039153 | P28: 6700000 | Q28: =IF(C28=0,0,IF(P28=0,0,((C28/P28)*100)-100)) -> -6.3138850746268673 | R28: =IF(C28=0,0,(C28/$C$40)*100) -> 5.4398305084492371 | T28: 16.7 | U28: 16.352041017499257 | V28: =U28-T28 -> -0.34795898250074231
A29: Santa Candida | B29: 7550000 | C29: 7117284.4900000002 | D29: 7452795.0300000003 | F29: 6687518.0099999998 | G29: 5499671.2599999998 | H29: 4610553.24 | J29: =IF(B29=0,0,((C29/B29)*100)-100) -> -5.7313312582781322 | K29: =IF(C29=0,0,IF(D29=0,0,((C29/D29)*100)-100)) -> -4.5018082296568878 | L29: =IF(F29=0,0,((C29/F29)*100)-100) -> 6.4263973473770193 | M29: =IF(G29=0,0,((C29/G29)*100)-100) -> 29.41290767259423 | N29: =IF(C29=0,0,IF(H29=0,0,((C29/H29)*100)-100)) -> 54.369424221202564 | P29: 7550000 | Q29: =IF(C29=0,0,IF(P29=0,0,((C29/P29)*100)-100)) -> -5.7313312582781322 | R29: =IF(C29=0,0,(C29/$C$40)*100) -> 6.1680752268112062 | T29: 16.24 | U29: 16.092596714509018 | V29: =U29-T29 -> -0.14740328549098081
A30: Paranaguá Raia | B30: 9049265.8900000006 | C30: 7921748.7999999998 | D30: 1555002.65 | F30: 6881639.6500000004 | G30: 6025252.6900000004 | H30: 5154861.59 | J30: =IF(B30=0,0,((C30/B30)*100)-100) -> -12.45976307587533 | K30: =IF(C30=0,0,IF(D30=0,0,((C30/D30)*100)-100)) -> 409.43635369367382 | L30: =IF(F30=0,0,((C30/F30)*100)-100) -> 15.11426350259417 | M30: =IF(G30=0,0,((C30/G30)*100)-100) -> 31.475793756294735 | N30: =IF(C30=0,0,IF(H30=0,0,((C30/H30)*100)-100)) -> 53.675295867643257 | P30: 9000000 | Q30: =IF(C30=0,0,IF(P30=0,0,((C30/P30)*100)-100)) -> -11.980568888888882 | R30: =IF(C30=0,0,(C30/$C$40)*100) -> 6.8652507279923833 | T30: 18.104600000000001 | U30: 17.309231138457712 | V30: =U30-T30 -> -0.79536886154228981
A31: Uvaranas | B31: 4950000 | C31: 4931330.99 | D31: 5317688.54 | F31: 4700870.67 | G31: 0 | H31: 0 | J31: =IF(B31=0,0,((C31/B31)*100)-100) -> -0.37715171717171359 | K31: =IF(C31=0,0,IF(D31=0,0,((C31/D31)*100)-100)) -> -7.2655167201650386 | L31: =IF(F31=0,0,((C31/F31)*100)-100) -> 4.9025028803866348 | M31: =IF(G31=0,0,((C31/G31)*100)-100) -> 0 | N31: =IF(C31=0,0,IF(H31=0,0,((C31/H31)*100)-100)) -> 0 | P31: 4950000 | Q31: =IF(C31=0,0,IF(P31=0,0,((C31/P31)*100)-100)) -> -0.37715171717171359 | R31: =IF(C31=0,0,(C31/$C$40)*100) -> 4.273655290492032 | T31: 16.1 | U31: 15.590396417499447 | V31: =U31-T31 -> -0.50960358250055471
A32: Torres | B32: 5650000 | C32: 5429992.6200000001 | D32: 5658950.2699999996 | F32: 5156231.54 | G32: 0 | H32: 0 | J32: =IF(B32=0,0,((C32/B32)*100)-100) -> -3.8939359292035363 | K32: =IF(C32=0,0,IF(D32=0,0,((C32/D32)*100)-100)) -> -4.0459385411775202 | L32: =IF(F32=0,0,((C32/F32)*100)-100) -> 5.3093248019657295 | M32: =IF(G32=0,0,((C32/G32)*100)-100) -> 0 | N32: =IF(C32=0,0,IF(H32=0,0,((C32/H32)*100)-100)) -> 0 | P32: 5650000 | Q32: =IF(C32=0,0,IF(P32=0,0,((C32/P32)*100)-100)) -> -3.8939359292035363 | R32: =IF(C32=0,0,(C32/$C$40)*100) -> 4.7058120282037059 | T32: 15.97 | U32: 16.168700428178482 | V32: =U32-T32 -> 0.19870042817848166
A33: Total Hiper | B33: =SUM(B22:B32) -> 72399264.890000001 | C33: =SUM(C22:C32) -> 68831056.160000011 | D33: =SUM(D22:D32) -> 65325166.149999991 | F33: =SUM(F22:F32) -> 67142626.359999999 | G33: =SUM(G22:G32) -> 51360960.549999997 | H33: =SUM(H22:H32) -> 43749598.049999997 | I33: =SUM(B33:H33) -> 368808672.16000003 | J33: =IF(C33=0,0,((C33/B33)*100)-100) -> -4.9285151381320702 | K33: =IF(C33=0,0,IF(D33=0,0,((C33/D33)*100)-100)) -> 5.3668290746475549 | L33: =IF(F33=0,0,IF(C33=0,0,((C33/F33)*100)-100)) -> 2.5146913243266908 | M33: =IF(G33=0,0,IF(C33=0,0,((C33/G33)*100)-100)) -> 34.014347517883436 | N33: =IF(C33=0,0,IF(H33=0,0,((C33/H33)*100)-100)) -> 57.329573819935973 | P33: =SUM(P22:P32) -> 72350000 | Q33: =IF(C33=0,0,((C33/P33)*100)-100) -> -4.8637786316516838 | R33: =IF(C33=0,0,(C33/$C$40)*100) -> 59.651280334832727 | T33: 16.47 | U33: 0 | V33: =U33-T33 -> -16.47
A34: Total s/ 25,27,30 | B34: =B21+B33 -> 112709264.89 | C34: =C21+C33 -> 107561518.76000002 | D34: =D21+D33 -> 108659172.73999999 | E34: =E21+E33 -> 0 | F34: =F21+F33 -> 104483716.78 | G34: =G21+G33 -> 85767374.429999992 | H34: =H21+H33 -> 67811558.929999992 | I34: =SUM(B34:H34) -> 586992606.53000009 | J34: =IF(C34=0,0,((C34/B34)*100)-100) -> -4.5672785950861936 | K34: =IF(C34=0,0,IF(D34=0,0,((C34/D34)*100)-100)) -> -1.0101806891411229 | L34: =IF(F34=0,0,IF(C34=0,0,((C34/F34)*100)-100)) -> 2.9457240561997082 | M34: =IF(G34=0,0,IF(C34=0,0,((C34/G34)*100)-100)) -> 25.410763095922405 | N34: =IF(C34=0,0,IF(H34=0,0,((C34/H34)*100)-100)) -> 58.618265760609944 | P34: =P21+P33 -> 112660000 | Q34: =IF(C34=0,0,((C34/P34)*100)-100) -> -4.5255469909461965 | R34: =IF(C34=0,0,(C34/$C$40)*100) -> 93.216386130680704 | T34: 0 | U34: 0 | V34: =U34-T34 -> 0
A35: Paranaguá | B35: 0 | C35: 0 | D35: 0 | F35: 0 | G35: 0 | H35: 0 | J35: =IF(B35=0,0,((C35/B35)*100)-100) -> 0 | K35: =IF(C35=0,0,IF(D35=0,0,((C35/D35)*100)-100)) -> 0 | L35: =IF(F35=0,0,((C35/F35)*100)-100) -> 0 | M35: =IF(G35=0,0,((C35/G35)*100)-100) -> 0 | N35: =IF(C35=0,0,IF(H35=0,0,((C35/H35)*100)-100)) -> 0 | P35: 0 | Q35: =IF(P35=0,0,IF(C35=0,0,((C35/P35)*100)-100)) -> 0 | R35: =IF(C35=0,0,(C35/$C$40)*100) -> 0 | T35: 0 | U35: 0 | V35: =U35-T35 -> 0
A36: Paranaguá Raia | B36: 0 | C36: 0 | D36: 0 | F36: 0 | G36: 0 | H36: 0 | J36: =IF(B36=0,0,((C36/B36)*100)-100) -> 0 | K36: =IF(C36=0,0,IF(D36=0,0,((C36/D36)*100)-100)) -> 0 | L36: =IF(F36=0,0,((C36/F36)*100)-100) -> 0 | M36: =IF(G36=0,0,((C36/G36)*100)-100) -> 0 | N36: =IF(C36=0,0,IF(H36=0,0,((C36/H36)*100)-100)) -> 0 | P36: 0 | Q36: =IF(P36=0,0,IF(C36=0,0,((C36/P36)*100)-100)) -> 0 | R36: =IF(C36=0,0,(C36/$C$40)*100) -> 0 | T36: 0 | U36: 0 | V36: =U36-T36 -> 0
A37: Novo Mundo | B37: 5400000 | C37: 5131600.7 | D37: 5488993.1900000004 | F37: 0 | G37: 0 | H37: 0 | J37: =IF(B37=0,0,((C37/B37)*100)-100) -> -4.9703574074074055 | K37: =IF(C37=0,0,IF(D37=0,0,((C37/D37)*100)-100)) -> -6.5110754855937358 | L37: =IF(F37=0,0,((C37/F37)*100)-100) -> 0 | M37: =IF(G37=0,0,((C37/G37)*100)-100) -> 0 | N37: =IF(C37=0,0,IF(H37=0,0,((C37/H37)*100)-100)) -> 0 | P37: 5400000 | Q37: =IF(P37=0,0,IF(C37=0,0,((C37/P37)*100)-100)) -> -4.9703574074074055 | R37: =IF(C37=0,0,(C37/$C$40)*100) -> 4.447215675589363 | T37: 15.500400000000001 | U37: 15.694313277336642 | V37: =U37-T37 -> 0.19391327733664099
A38: Fazenda | B38: 2800000 | C38: 2695948.09 | D38: 2886047.51 | F38: 0 | G38: 0 | H38: 0 | J38: =IF(B38=0,0,((C38/B38)*100)-100) -> -3.7161396428571578 | K38: =IF(C38=0,0,IF(D38=0,0,((C38/D38)*100)-100)) -> -6.5868430558164874 | L38: =IF(F38=0,0,((C38/F38)*100)-100) -> 0 | M38: =IF(G38=0,0,((C38/G38)*100)-100) -> 0 | N38: =IF(C38=0,0,IF(H38=0,0,((C38/H38)*100)-100)) -> 0 | P38: 2800000 | Q38: =IF(P38=0,0,IF(C38=0,0,((C38/P38)*100)-100)) -> -3.7161396428571578 | R38: =IF(C38=0,0,(C38/$C$40)*100) -> 2.3363981937299219 | T38: 15.5 | U38: 15.830760673140412 | V38: =U38-T38 -> 0.33076067314041246
A39: Total Lojas Novas | B39: =SUM(B35:B38) -> 8200000 | C39: =SUM(C35:C38) -> 7827548.79 | D39: =SUM(D35:D38) -> 8375040.7000000002 | F39: =SUM(F35:F38) -> 0 | G39: =SUM(G35:G38) -> 0 | H39: =SUM(H35:H38) -> 0 | J39: =IF(C39=0,0,((C39/B39)*100)-100) -> -4.542087926829268 | K39: =IF(C39=0,0,IF(D39=0,0,((C39/D39)*100)-100)) -> -6.5371850670528744 | L39: =IF(F39=0,0,IF(C39=0,0,((C39/F39)*100)-100)) -> 0 | M39: =IF(G39=0,0,IF(C39=0,0,((C39/G39)*100)-100)) -> 0 | N39: =IF(C39=0,0,IF(H39=0,0,((C39/H39)*100)-100)) -> 0 | P39: =SUM(P35:P38) -> 8200000 | Q39: =IF(P39=0,0,IF(C39=0,0,((C39/P39)*100)-100)) -> -4.542087926829268 | R39: =IF(C39=0,0,(C39/$C$40)*100) -> 6.7836138693192858
A40: Total Geral | B40: =B21+B33+B39 -> 120909264.89 | C40: =C21+C33+C39 -> 115389067.55000003 | D40: =D21+D33+D39 -> 117034213.44 | F40: =F21+F33+F39 -> 104483716.78 | G40: =G21+G33+G39 -> 85767374.429999992 | H40: =H21+H33+H39 -> 67811558.929999992 | J40: =IF(C40=0,0,((C40/B40)*100)-100) -> -4.565570177787535 | K40: =IF(C40=0,0,IF(D40=0,0,((C40/D40)*100)-100)) -> -1.4056965409037332 | L40: =IF(F40=0,0,IF(C40=0,0,((C40/F40)*100)-100)) -> 10.43736871742631 | M40: =IF(G40=0,0,IF(C40=0,0,((C40/G40)*100)-100)) -> 34.53725069335789 | N40: =IF(C40=0,0,IF(H40=0,0,((C40/H40)*100)-100)) -> 70.161355041421473 | P40: =P21+P33+P39 -> 120860000 | Q40: =IF(C40=0,0,((C40/P40)*100)-100) -> -4.5266692454078878 | R40: =R21+R33+R39 -> 100 | T40: 0 | U40: 0 | V40: =U40-T40 -> 0