A2: Periodo: | C2: 38353 | D2: a | E2: 38383 | H2: Vendas Acumuladas por Filial | Q2: =NOW() -> 38754.600578240701
A4: v.1 | C4: Vendas 2005 | G4: Vendas de Anos Anteriores | K4: Percentuais ( % ) | Q4: Meta Mensal | U4: Margem
A5: Lojas | C5: Previsao | D5: Realizada | E5: Mes Anterior | G5: Vendas 2004 | H5: Vendas 2003 | I5: Vendas 2002 | K5: % Prev | L5: % MA | M5: 2004 | N5: 2003 | O5: 2002 | Q5: Previsao Mes | R5: Final | S5: Part. | U5: Meta | V5: Condor
A7: Xaxim | C7: 950000 | D7: 837675 | E7: 1001769 | G7: 894663 | H7: 648112 | I7: 489890 | K7: =IF(C7=0,0,((D7/C7)*100)-100) -> -11.82 | L7: =IF(D7=0,0,IF(E7=0,0,((D7/E7)*100)-100)) -> -16.38 | M7: =IF(G7=0,0,((D7/G7)*100)-100) -> -6.37 | N7: =IF(H7=0,0,((D7/H7)*100)-100) -> 29.25 | O7: =IF(D7=0,0,IF(I7=0,0,((D7/I7)*100)-100)) -> 70.99 | Q7: 950000 | R7: =IF(D7=0,0,((D7/Q7)*100)-100) -> -11.82 | S7: =IF(D7=0,0,(D7/$D$35)*100) -> 1.49 | U7: 17 | V7: 13.89
A8: S. Felicidade | C8: 820000 | D8: 764402 | E8: 945394 | G8: 766874 | H8: 701361 | I8: 475940 | K8: =IF(C8=0,0,((D8/C8)*100)-100) -> -6.78 | L8: =IF(D8=0,0,IF(E8=0,0,((D8/E8)*100)-100)) -> -19.14 | M8: =IF(G8=0,0,((D8/G8)*100)-100) -> -0.32 | N8: =IF(H8=0,0,((D8/H8)*100)-100) -> 8.99 | O8: =IF(D8=0,0,IF(I8=0,0,((D8/I8)*100)-100)) -> 60.61 | Q8: 820000 | R8: =IF(D8=0,0,((D8/Q8)*100)-100) -> -6.78 | S8: =IF(D8=0,0,(D8/$D$35)*100) -> 1.36 | U8: 16.75 | V8: 14.25
A9: Lapa | C9: 1200000 | D9: 1161706 | E9: 1477567 | G9: 1089890 | H9: 961646 | I9: 734229 | K9: =IF(C9=0,0,((D9/C9)*100)-100) -> -3.19 | L9: =IF(D9=0,0,IF(E9=0,0,((D9/E9)*100)-100)) -> -21.38 | M9: =IF(G9=0,0,((D9/G9)*100)-100) -> 6.59 | N9: =IF(H9=0,0,((D9/H9)*100)-100) -> 20.8 | O9: =IF(D9=0,0,IF(I9=0,0,((D9/I9)*100)-100)) -> 58.22 | Q9: 1200000 | R9: =IF(D9=0,0,((D9/Q9)*100)-100) -> -3.19 | S9: =IF(D9=0,0,(D9/$D$35)*100) -> 2.06 | U9: 16.9 | V9: 14.48
A10: Araucaria | C10: 1160000 | D10: 965307 | E10: 1217436 | G10: 994437 | H10: 1032375 | I10: 1407810 | K10: =IF(C10=0,0,((D10/C10)*100)-100) -> -16.78 | L10: =IF(D10=0,0,IF(E10=0,0,((D10/E10)*100)-100)) -> -20.71 | M10: =IF(G10=0,0,((D10/G10)*100)-100) -> -2.93 | N10: =IF(H10=0,0,((D10/H10)*100)-100) -> -6.5 | O10: =IF(D10=0,0,IF(I10=0,0,((D10/I10)*100)-100)) -> -31.43 | Q10: 1160000 | R10: =IF(D10=0,0,((D10/Q10)*100)-100) -> -16.78 | S10: =IF(D10=0,0,(D10/$D$35)*100) -> 1.71 | U10: 17.3 | V10: 15.75
A11: Pinheirinho | C11: 2380000 | D11: 2214628 | E11: 2811997 | G11: 2277973 | H11: 1857893 | I11: 1485656 | K11: =IF(C11=0,0,((D11/C11)*100)-100) -> -6.95 | L11: =IF(D11=0,0,IF(E11=0,0,((D11/E11)*100)-100)) -> -21.24 | M11: =IF(G11=0,0,((D11/G11)*100)-100) -> -2.78 | N11: =IF(H11=0,0,((D11/H11)*100)-100) -> 19.2 | O11: =IF(D11=0,0,IF(I11=0,0,((D11/I11)*100)-100)) -> 49.07 | Q11: 2380000 | R11: =IF(D11=0,0,((D11/Q11)*100)-100) -> -6.95 | S11: =IF(D11=0,0,(D11/$D$35)*100) -> 3.93 | U11: 17.24 | V11: 14.24
A12: Hauer | C12: 3190000 | D12: 3227643 | E12: 4305640 | G12: 2992755 | H12: 2685121 | I12: 2032732 | K12: =IF(C12=0,0,((D12/C12)*100)-100) -> 1.18 | L12: =IF(D12=0,0,IF(E12=0,0,((D12/E12)*100)-100)) -> -25.04 | M12: =IF(G12=0,0,((D12/G12)*100)-100) -> 7.85 | N12: =IF(H12=0,0,((D12/H12)*100)-100) -> 20.2 | O12: =IF(D12=0,0,IF(I12=0,0,((D12/I12)*100)-100)) -> 58.78 | Q12: 3190000 | R12: =IF(D12=0,0,((D12/Q12)*100)-100) -> 1.18 | S12: =IF(D12=0,0,(D12/$D$35)*100) -> 5.73 | U12: 16.6 | V12: 15.18
A13: Paranagua | C13: 3357000 | D13: 3552885 | E13: 4734317 | G13: 2943719 | H13: 2825976 | I13: 2280328 | K13: =IF(C13=0,0,((D13/C13)*100)-100) -> 5.84 | L13: =IF(D13=0,0,IF(E13=0,0,((D13/E13)*100)-100)) -> -24.95 | M13: =IF(G13=0,0,((D13/G13)*100)-100) -> 20.69 | N13: =IF(H13=0,0,((D13/H13)*100)-100) -> 25.72 | O13: =IF(D13=0,0,IF(I13=0,0,((D13/I13)*100)-100)) -> 55.81 | Q13: 3357000 | R13: =IF(D13=0,0,((D13/Q13)*100)-100) -> 5.84 | S13: =IF(D13=0,0,(D13/$D$35)*100) -> 6.31 | U13: 17.59 | V13: 16.5
A14: Centenario | C14: 1100000 | D14: 1026796 | E14: 1177519 | G14: 1100371 | H14: 866269 | I14: 632178 | K14: =IF(C14=0,0,((D14/C14)*100)-100) -> -6.65 | L14: =IF(D14=0,0,IF(E14=0,0,((D14/E14)*100)-100)) -> -12.8 | M14: =IF(G14=0,0,((D14/G14)*100)-100) -> -6.69 | N14: =IF(H14=0,0,((D14/H14)*100)-100) -> 18.53 | O14: =IF(D14=0,0,IF(I14=0,0,((D14/I14)*100)-100)) -> 62.42 | Q14: 1100000 | R14: =IF(D14=0,0,((D14/Q14)*100)-100) -> -6.65 | S14: =IF(D14=0,0,(D14/$D$35)*100) -> 1.82 | U14: 17.1 | V14: 13.68
A15: Arapongas | C15: 0 | D15: 0 | E15: 0 | G15: 0 | H15: 0 | I15: 0 | K15: =IF(C15=0,0,((D15/C15)*100)-100) -> 0 | L15: =IF(D15=0,0,IF(E15=0,0,((D15/E15)*100)-100)) -> 0 | M15: =IF(D15=0,0,IF(G15=0,0,((D15/G15)*100)-100)) -> 0 | N15: =IF(D15=0,0,IF(H15=0,0,((D15/H15)*100)-100)) -> 0 | O15: =IF(D15=0,0,IF(I15=0,0,((D15/I15)*100)-100)) -> 0 | Q15: 0 | R15: =IF(D15=0,0,((D15/Q15)*100)-100) -> 0 | S15: =IF(D15=0,0,(D15/$D$35)*100) -> 0 | U15: 0 | V15: 0
A16: Sao Braz | C16: 3260000 | D16: 3160561 | E16: 4128995 | G16: 3212288 | H16: 2781334 | I16: 2270389 | K16: =IF(C16=0,0,((D16/C16)*100)-100) -> -3.05 | L16: =IF(D16=0,0,IF(E16=0,0,((D16/E16)*100)-100)) -> -23.45 | M16: =IF(G16=0,0,((D16/G16)*100)-100) -> -1.61 | N16: =IF(H16=0,0,((D16/H16)*100)-100) -> 13.63 | O16: =IF(D16=0,0,IF(I16=0,0,((D16/I16)*100)-100)) -> 39.21 | Q16: 3260000 | R16: =IF(D16=0,0,((D16/Q16)*100)-100) -> -3.05 | S16: =IF(D16=0,0,(D16/$D$35)*100) -> 5.61 | U16: 16.65 | V16: 14.78
A17: Sitio Cercado | C17: 1650000 | D17: 1668157 | E17: 2396301 | G17: 1504207 | H17: 1099203 | I17: 635228 | K17: =IF(C17=0,0,((D17/C17)*100)-100) -> 1.1 | L17: =IF(D17=0,0,IF(E17=0,0,((D17/E17)*100)-100)) -> -30.39 | M17: =IF(G17=0,0,((D17/G17)*100)-100) -> 10.9 | N17: =IF(H17=0,0,((D17/H17)*100)-100) -> 51.76 | O17: =IF(D17=0,0,IF(I17=0,0,((D17/I17)*100)-100)) -> 162.61 | Q17: 1650000 | R17: =IF(D17=0,0,((D17/Q17)*100)-100) -> 1.1 | S17: =IF(D17=0,0,(D17/$D$35)*100) -> 2.96 | U17: 18 | V17: 15.2
A18: Apucarana | C18: 1650000 | D18: 1683121 | E18: 2332125 | G18: 1460770 | H18: 1225402 | I18: 1032293 | K18: =IF(C18=0,0,((D18/C18)*100)-100) -> 2.01 | L18: =IF(D18=0,0,IF(E18=0,0,((D18/E18)*100)-100)) -> -27.83 | M18: =IF(G18=0,0,((D18/G18)*100)-100) -> 15.22 | N18: =IF(H18=0,0,((D18/H18)*100)-100) -> 37.35 | O18: =IF(D18=0,0,IF(I18=0,0,((D18/I18)*100)-100)) -> 63.05 | Q18: 1650000 | R18: =IF(D18=0,0,((D18/Q18)*100)-100) -> 2.01 | S18: =IF(D18=0,0,(D18/$D$35)*100) -> 2.99 | U18: 18.07 | V18: 14.89
A19: Ahu | C19: 1280000 | D19: 1052068 | E19: 1363099 | G19: 1192190 | H19: 1062709 | I19: 1069721 | K19: =IF(C19=0,0,((D19/C19)*100)-100) -> -17.81 | L19: =IF(D19=0,0,IF(E19=0,0,((D19/E19)*100)-100)) -> -22.82 | M19: =IF(G19=0,0,((D19/G19)*100)-100) -> -11.75 | N19: =IF(H19=0,0,((D19/H19)*100)-100) -> -1 | O19: =IF(D19=0,0,IF(I19=0,0,((D19/I19)*100)-100)) -> -1.65 | Q19: 1280000 | R19: =IF(D19=0,0,((D19/Q19)*100)-100) -> -17.81 | S19: =IF(D19=0,0,(D19/$D$35)*100) -> 1.87 | U19: 17.91 | V19: 14.21
A20: P.G. Centro | C20: 1880000 | D20: 1711238 | E20: 2205951 | G20: 1720468 | H20: 1479223 | I20: 1098952 | K20: =IF(C20=0,0,((D20/C20)*100)-100) -> -8.98 | L20: =IF(D20=0,0,IF(E20=0,0,((D20/E20)*100)-100)) -> -22.43 | M20: =IF(G20=0,0,((D20/G20)*100)-100) -> -0.54 | N20: =IF(H20=0,0,((D20/H20)*100)-100) -> 15.68 | O20: =IF(D20=0,0,IF(I20=0,0,((D20/I20)*100)-100)) -> 55.72 | Q20: 1880000 | R20: =IF(D20=0,0,((D20/Q20)*100)-100) -> -8.98 | S20: =IF(D20=0,0,(D20/$D$35)*100) -> 3.04 | U20: 18.25 | V20: 15.74
A21: Maringa | C21: 2280000 | D21: 2315661 | E21: 2753746 | G21: 2049388 | H21: 1859960 | I21: 1517950 | K21: =IF(C21=0,0,((D21/C21)*100)-100) -> 1.56 | L21: =IF(D21=0,0,IF(E21=0,0,((D21/E21)*100)-100)) -> -15.91 | M21: =IF(G21=0,0,((D21/G21)*100)-100) -> 12.99 | N21: =IF(H21=0,0,((D21/H21)*100)-100) -> 24.5 | O21: =IF(D21=0,0,IF(I21=0,0,((D21/I21)*100)-100)) -> 52.55 | Q21: 2280000 | R21: =IF(D21=0,0,((D21/Q21)*100)-100) -> 1.56 | S21: =IF(D21=0,0,(D21/$D$35)*100) -> 4.11 | U21: 19 | V21: 15.49
A22: Araucaria Nova | C22: 2260000 | D22: 2110423 | E22: 2798594 | G22: 1885054 | H22: 1701530 | I22: 0 | K22: =IF(C22=0,0,((D22/C22)*100)-100) -> -6.62 | L22: =IF(D22=0,0,IF(E22=0,0,((D22/E22)*100)-100)) -> -24.59 | M22: =IF(G22=0,0,((D22/G22)*100)-100) -> 11.96 | N22: =IF(H22=0,0,((D22/H22)*100)-100) -> 24.03 | O22: =IF(D22=0,0,IF(I22=0,0,((D22/I22)*100)-100)) -> 0 | Q22: 2260000 | R22: =IF(D22=0,0,((D22/Q22)*100)-100) -> -6.62 | S22: =IF(D22=0,0,(D22/$D$35)*100) -> 3.75 | U22: 17.5 | V22: 16.11
A23: Sitio Cercado | C23: 0 | D23: 0 | E23: 0 | G23: 0 | H23: 0 | I23: 0 | K23: =IF(C23=0,0,((D23/C23)*100)-100) -> 0 | L23: =IF(D23=0,0,IF(E23=0,0,((D23/E23)*100)-100)) -> 0 | M23: =IF(G23=0,0,((D23/G23)*100)-100) -> 0 | N23: =IF(H23=0,0,((D23/H23)*100)-100) -> 0 | O23: =IF(D23=0,0,IF(I23=0,0,((D23/I23)*100)-100)) -> 0 | Q23: 0 | R23: =IF(Q23=0,0,IF(D23=0,0,((D23/Q23)*100)-100)) -> 0 | S23: =IF(D23=0,0,(D23/$D$35)*100) -> 0 | U23: 0 | V23: 0
A24: Total Super | C24: =SUM(C7:C23) -> 28417000 | D24: =SUM(D7:D23) -> 27452271 | E24: =SUM(E7:E23) -> 35650450 | G24: =SUM(G7:G23) -> 26085047 | H24: =SUM(H7:H23) -> 22788114 | I24: =SUM(I7:I23) -> 17163296 | J24: =SUM(C24:I24) -> 157556178 | K24: =IF(D24=0,0,((D24/C24)*100)-100) -> -3.39 | L24: =IF(D24=0,0,IF(E24=0,0,((D24/E24)*100)-100)) -> -23 | M24: =IF(G24=0,0,IF(D24=0,0,((D24/G24)*100)-100)) -> 5.24 | N24: =IF(H24=0,0,IF(D24=0,0,((D24/H24)*100)-100)) -> 20.47 | O24: =IF(D24=0,0,IF(I24=0,0,((D24/I24)*100)-100)) -> 59.95 | Q24: =SUM(Q7:Q23) -> 28417000 | R24: =IF(D24=0,0,((D24/Q24)*100)-100) -> -3.39 | S24: =IF(D24=0,0,(D24/$D$35)*100) -> 48.72 | U24: 17.45 | V24: 15.18
A26: Londrina | C26: 2700000 | D26: 2896426 | E26: 3484194 | G26: 2382375 | H26: 2140316 | I26: 1534101 | K26: =IF(C26=0,0,((D26/C26)*100)-100) -> 7.28 | L26: =IF(D26=0,0,IF(E26=0,0,((D26/E26)*100)-100)) -> -16.87 | M26: =IF(G26=0,0,((D26/G26)*100)-100) -> 21.58 | N26: =IF(H26=0,0,((D26/H26)*100)-100) -> 35.33 | O26: =IF(D26=0,0,IF(I26=0,0,((D26/I26)*100)-100)) -> 88.8 | Q26: 2700000 | R26: =IF(D26=0,0,IF(Q26=0,0,((D26/Q26)*100)-100)) -> 7.28 | S26: =IF(D26=0,0,(D26/$D$35)*100) -> 5.14 | U26: 18 | V26: 13.3
A27: S.J. Pinhais | C27: 4510000 | D27: 4579048 | E27: 5973276 | G27: 4247253 | H27: 3644723 | I27: 2747436 | K27: =IF(C27=0,0,((D27/C27)*100)-100) -> 1.53 | L27: =IF(D27=0,0,IF(E27=0,0,((D27/E27)*100)-100)) -> -23.34 | M27: =IF(G27=0,0,((D27/G27)*100)-100) -> 7.81 | N27: =IF(H27=0,0,((D27/H27)*100)-100) -> 25.64 | O27: =IF(D27=0,0,IF(I27=0,0,((D27/I27)*100)-100)) -> 66.67 | Q27: 4510000 | R27: =IF(D27=0,0,IF(Q27=0,0,((D27/Q27)*100)-100)) -> 1.53 | S27: =IF(D27=0,0,(D27/$D$35)*100) -> 8.13 | U27: 16.7 | V27: 13.95
A28: P.G. Nova | C28: 3560000 | D28: 3608479 | E28: 4889066 | G28: 3202694 | H28: 3004210 | I28: 2139962 | K28: =IF(C28=0,0,((D28/C28)*100)-100) -> 1.36 | L28: =IF(D28=0,0,IF(E28=0,0,((D28/E28)*100)-100)) -> -26.19 | M28: =IF(G28=0,0,((D28/G28)*100)-100) -> 12.67 | N28: =IF(H28=0,0,((D28/H28)*100)-100) -> 20.11 | O28: =IF(D28=0,0,IF(I28=0,0,((D28/I28)*100)-100)) -> 68.62 | Q28: 3560000 | R28: =IF(D28=0,0,IF(Q28=0,0,((D28/Q28)*100)-100)) -> 1.36 | S28: =IF(D28=0,0,(D28/$D$35)*100) -> 6.4 | U28: 16 | V28: 14.42
A29: Nilo Pecanha | C29: 8725000 | D29: 7779783 | E29: 10610322 | G29: 7997117 | H29: 6702998 | I29: 0 | K29: =IF(C29=0,0,((D29/C29)*100)-100) -> -10.83 | L29: =IF(D29=0,0,IF(E29=0,0,((D29/E29)*100)-100)) -> -26.68 | M29: =IF(G29=0,0,((D29/G29)*100)-100) -> -2.72 | N29: =IF(H29=0,0,((D29/H29)*100)-100) -> 16.06 | O29: =IF(D29=0,0,IF(I29=0,0,((D29/I29)*100)-100)) -> 0 | Q29: 8725000 | R29: =IF(D29=0,0,IF(Q29=0,0,((D29/Q29)*100)-100)) -> -10.83 | S29: =IF(D29=0,0,(D29/$D$35)*100) -> 13.81 | U29: 15.79 | V29: 14.4
A30: Champagnat | C30: 5400000 | D30: 5159047 | E30: 6737674 | G30: 0 | H30: 0 | I30: 0 | K30: =IF(C30=0,0,((D30/C30)*100)-100) -> -4.46 | L30: =IF(D30=0,0,IF(E30=0,0,((D30/E30)*100)-100)) -> -23.43 | M30: =IF(G30=0,0,((D30/G30)*100)-100) -> 0 | N30: =IF(H30=0,0,((D30/H30)*100)-100) -> 0 | O30: =IF(D30=0,0,IF(I30=0,0,((D30/I30)*100)-100)) -> 0 | Q30: 5400000 | R30: =IF(D30=0,0,IF(Q30=0,0,((D30/Q30)*100)-100)) -> -4.46 | S30: =IF(D30=0,0,(D30/$D$35)*100) -> 9.16 | U30: 16.2 | V30: 14.32
A31: Santa Candida | C31: 5300000 | D31: 4870329 | E31: 6955104 | G31: 0 | H31: 0 | I31: 0 | K31: =IF(C31=0,0,((D31/C31)*100)-100) -> -8.11 | L31: =IF(D31=0,0,IF(E31=0,0,((D31/E31)*100)-100)) -> -29.97 | M31: =IF(G31=0,0,((D31/G31)*100)-100) -> 0 | N31: =IF(H31=0,0,((D31/H31)*100)-100) -> 0 | O31: =IF(D31=0,0,IF(I31=0,0,((D31/I31)*100)-100)) -> 0 | Q31: 5300000 | R31: =IF(D31=0,0,IF(Q31=0,0,((D31/Q31)*100)-100)) -> -8.11 | S31: =IF(D31=0,0,(D31/$D$35)*100) -> 8.64 | U31: 14.6 | V31: 9.92
A32: Paranagu Raia | C32: 0 | D32: 0 | E32: 0 | G32: 0 | H32: 0 | I32: 0 | K32: =IF(C32=0,0,((D32/C32)*100)-100) -> 0 | L32: =IF(D32=0,0,IF(E32=0,0,((D32/E32)*100)-100)) -> 0 | M32: =IF(G32=0,0,((D32/G32)*100)-100) -> 0 | N32: =IF(H32=0,0,((D32/H32)*100)-100) -> 0 | O32: =IF(D32=0,0,IF(I32=0,0,((D32/I32)*100)-100)) -> 0 | Q32: 0 | R32: =IF(D32=0,0,IF(Q32=0,0,((D32/Q32)*100)-100)) -> 0 | S32: =IF(D32=0,0,(D32/$D$35)*100) -> 0 | U32: 0 | V32: 0
A33: Total Hiper | C33: =SUM(C26:C32) -> 30195000 | D33: =SUM(D26:D32) -> 28893112 | E33: =SUM(E26:E32) -> 38649636 | G33: =SUM(G26:G32) -> 17829439 | H33: =SUM(H26:H32) -> 15492247 | I33: =SUM(I26:I32) -> 6421499 | J33: =SUM(C33:I33) -> 137480933 | K33: =IF(D33=0,0,((D33/C33)*100)-100) -> -4.31 | L33: =IF(D33=0,0,IF(E33=0,0,((D33/E33)*100)-100)) -> -25.24 | M33: =IF(G33=0,0,IF(D33=0,0,((D33/G33)*100)-100)) -> 62.05 | N33: =IF(H33=0,0,IF(D33=0,0,((D33/H33)*100)-100)) -> 86.5 | O33: =IF(D33=0,0,IF(I33=0,0,((D33/I33)*100)-100)) -> 349.94 | Q33: =SUM(Q26:Q32) -> 30195000 | R33: =IF(D33=0,0,((D33/Q33)*100)-100) -> -4.31 | S33: =IF(D33=0,0,(D33/$D$35)*100) -> 51.28 | U33: 16.01 | V33: 13.45
A35: Total Geral | C35: =C24+C33 -> 58612000 | D35: =D24+D33 -> 56345383 | E35: =E24+E33 -> 74300086 | G35: =G24+G33 -> 43914486 | H35: =H24+H33 -> 38280361 | I35: =I24+I33 -> 23584795 | K35: =IF(D33=0,0,((D35/C35)*100)-100) -> -3.87 | L35: =IF(D35=0,0,IF(E35=0,0,((D35/E35)*100)-100)) -> -24.17 | M35: =IF(G35=0,0,IF(D35=0,0,((D35/G35)*100)-100)) -> 28.31 | N35: =IF(H35=0,0,IF(D35=0,0,((D35/H35)*100)-100)) -> 47.19 | O35: =IF(D35=0,0,IF(I35=0,0,((D35/I35)*100)-100)) -> 138.91 | Q35: =Q24+Q33 -> 58612000 | R35: =IF(D35=0,0,((D35/Q35)*100)-100) -> -3.87 | S35: =S24+S33 -> 100 | U35: 16.71 | V35: 14.29
C36: Resumo por Regiao - Outubro/2002
C37: Descricao das Aberturas | H37: Valor | I37: %
C38: Curitiba (2,3,6,7,10,11,17,21,22) | H38: =D7+D8+D11+D12+D14+D16+D19+D29+D30+D32 -> 25222603 | I38: =IF(D35=0,0,H38/$D$35) -> 0.4476
C39: Curitiba e Metrop. (Ctba. 4,5,8,14,23) | H39: =H38+D9+D10+D13+D28+D23 -> 34510980 | I39: =IF(D35=0,0,H39/$D$35) -> 0.61250000000000004
C40: Metropolitana (4,5,8,14,23) | H40: =H39-H38 -> 9288377 | I40: =IF(D35=0,0,H40/$D$35) -> 0.1648
C41: Norte (9,15,20) | H41: =D26+D18+D23 -> 4579547 | I41: =IF(D35=0,0,H41/$D$35) -> 8.1299999999999997E-2
C42: Centro-Oeste (13,18,19) | H42: =D17+D20+D28 -> 6987874 | I42: =IF(D35=0,0,H42/$D$35) -> 0.124
C43: Ponta Grossa (18,19) | H43: =H42-D17 -> 5319717 | I43: =IF(D35=0,0,H43/$D$35) -> 9.4399999999999998E-2
C44: Super (2,3,4,5,6,7,8,10,11,13,15,17,18,20,23) | H44: =D24 -> 27452271 | I44: =IF(D35=0,0,H44/$D$35) -> 0.48720000000000002
C45: Hiper (9,14,19,21,22,24) | H45: =D33 -> 28893112 | I45: =IF(D35=0,0,H45/$D$35) -> 0.51280000000000003
C46: Curitiba, Metropolitana e Centro-Oeste | H46: =D35-H41 -> 51765836 | I46: =IF(D35=0,0,H46/$D$35) -> 0.91869999999999996
C47: Araucaria | H47: =D10+D23 -> 965307 | I47: =IF(D35=0,0,H47/$D$35) -> 1.7100000000000001E-2