A2: Periodo: | B2: 40360 | C2: a | D2: 40390 | G2: Vendas Acumuladas por Filial | P2: =NOW() -> 40422.345781597222
A4: v.New | B4: Vendas 2010 | F4: Vendas de Anos Anteriores | J4: Percentuais ( % ) | P4: Meta Mensal | T4: Margem
A5: Lojas | B5: Previsao | C5: Realizada | D5: Mes Anterior | F5: Vendas 2009 | G5: Vendas 2008 | H5: Vendas 2007 | J5: % Prev | K5: % MA | L5: 2009 | M5: 2008 | N5: 2007 | P5: Previsao Mes | Q5: Final | R5: Part. | T5: Meta | U5: Coml | V5: Dif
A6: S. Felicidade | B6: 3100000 | C6: 3101115.42 | D6: 2902003.03 | F6: 2744208.52 | G6: 2200476.38 | H6: 1275238.03 | J6: =IF(B6=0,0,((C6/B6)*100)-100) -> 3.5981290322581572E-2 | K6: =IF(C6=0,0,IF(D6=0,0,((C6/D6)*100)-100)) -> 6.8612054481555873 | L6: =IF(F6=0,0,((C6/F6)*100)-100) -> 13.005822895703261 | M6: =IF(G6=0,0,((C6/G6)*100)-100) -> 40.929275505333976 | N6: =IF(C6=0,0,IF(H6=0,0,((C6/H6)*100)-100)) -> 143.17933962493262 | P6: 3100000 | Q6: =IF(C6=0,0,((C6/P6)*100)-100) -> 3.5981290322581572E-2 | R6: =IF(C6=0,0,(C6/$C$40)*100) -> 2.6497511529736135 | T6: 17.421299999999999 | U6: 16.658777892246267 | V6: =U6-T6 -> -0.76252210775373186
A7: Lapa | B7: 2380000 | C7: 2489752.94 | D7: 2257931.81 | F7: 2174727.3 | G7: 1825736.29 | H7: 1314490.84 | J7: =IF(B7=0,0,((C7/B7)*100)-100) -> 4.6114680672268946 | K7: =IF(C7=0,0,IF(D7=0,0,((C7/D7)*100)-100)) -> 10.266967716797424 | L7: =IF(F7=0,0,((C7/F7)*100)-100) -> 14.485753685071231 | M7: =IF(G7=0,0,((C7/G7)*100)-100) -> 36.36980070106398 | N7: =IF(C7=0,0,IF(H7=0,0,((C7/H7)*100)-100)) -> 89.408162022642898 | P7: 2380000 | Q7: =IF(C7=0,0,((C7/P7)*100)-100) -> 4.6114680672268946 | R7: =IF(C7=0,0,(C7/$C$40)*100) -> 2.1273718742736909 | T7: 16.397200000000002 | U7: 15.832055609501561 | V7: =U7-T7 -> -0.56514439049844079
A8: Araucaria | B8: 1450000 | C8: 1506680.49 | D8: 1338266.12 | F8: 1346452.29 | G8: 1127694.48 | H8: 904065.78 | J8: =IF(B8=0,0,((C8/B8)*100)-100) -> 3.9089993103448251 | K8: =IF(C8=0,0,IF(D8=0,0,((C8/D8)*100)-100)) -> 12.584520184968866 | L8: =IF(F8=0,0,((C8/F8)*100)-100) -> 11.900028035898686 | M8: =IF(G8=0,0,((C8/G8)*100)-100) -> 33.607153065074868 | N8: =IF(C8=0,0,IF(H8=0,0,((C8/H8)*100)-100)) -> 66.65606898648457 | P8: 1450000 | Q8: =IF(C8=0,0,((C8/P8)*100)-100) -> 3.9089993103448251 | R8: =IF(C8=0,0,(C8/$C$40)*100) -> 1.2873846422460307 | T8: 17 | U8: 16.769637071493506 | V8: =U8-T8 -> -0.23036292850649431
A9: Hauer | B9: 3995000 | C9: 3881089.46 | D9: 3711344.01 | F9: 3804584.01 | G9: 3645934.62 | H9: 2952585.51 | J9: =IF(B9=0,0,((C9/B9)*100)-100) -> -2.8513276595744657 | K9: =IF(C9=0,0,IF(D9=0,0,((C9/D9)*100)-100)) -> 4.5736921595689068 | L9: =IF(F9=0,0,((C9/F9)*100)-100) -> 2.0108755595595369 | M9: =IF(G9=0,0,((C9/G9)*100)-100) -> 6.4497821411838601 | N9: =IF(C9=0,0,IF(H9=0,0,((C9/H9)*100)-100)) -> 31.447148502737207 | P9: 3995000 | Q9: =IF(C9=0,0,((C9/P9)*100)-100) -> -2.8513276595744657 | R9: =IF(C9=0,0,(C9/$C$40)*100) -> 3.3162007467070471 | T9: 16.1983 | U9: 15.851304545811734 | V9: =U9-T9 -> -0.34699545418826538
A10: Paranagua | B10: 0 | C10: 0 | D10: 0 | F10: 0 | G10: 0 | H10: 0 | J10: =IF(B10=0,0,((C10/B10)*100)-100) -> 0 | K10: =IF(C10=0,0,IF(D10=0,0,((C10/D10)*100)-100)) -> 0 | L10: =IF(F10=0,0,((C10/F10)*100)-100) -> 0 | M10: =IF(G10=0,0,((C10/G10)*100)-100) -> 0 | N10: =IF(C10=0,0,IF(H10=0,0,((C10/H10)*100)-100)) -> 0 | P10: 0 | Q10: =IF(C10=0,0,((C10/P10)*100)-100) -> 0 | R10: =IF(C10=0,0,(C10/$C$40)*100) -> 0 | T10: 0 | U10: 0 | V10: =U10-T10 -> 0
A11: Centenario | B11: 1380000 | C11: 1457571.8 | D11: 1399596.88 | F11: 1274013.25 | G11: 1248093.03 | H11: 952832.93 | J11: =IF(B11=0,0,((C11/B11)*100)-100) -> 5.6211449275362213 | K11: =IF(C11=0,0,IF(D11=0,0,((C11/D11)*100)-100)) -> 4.142258448018282 | L11: =IF(F11=0,0,((C11/F11)*100)-100) -> 14.407899603869907 | M11: =IF(G11=0,0,((C11/G11)*100)-100) -> 16.783906725286329 | N11: =IF(C11=0,0,IF(H11=0,0,((C11/H11)*100)-100)) -> 52.972441873939005 | P11: 1380000 | Q11: =IF(C11=0,0,((C11/P11)*100)-100) -> 5.6211449275362213 | R11: =IF(C11=0,0,(C11/$C$40)*100) -> 1.2454236732639334 | T11: 17.2758 | U11: 14.35953961238822 | V11: =U11-T11 -> -2.9162603876117803
A12: Sitio Cercado | B12: 2455500 | C12: 2559453.71 | D12: 2330772 | F12: 2206140.2 | G12: 1876996.08 | H12: 1348127.3 | J12: =IF(B12=0,0,((C12/B12)*100)-100) -> 4.2335047851761232 | K12: =IF(C12=0,0,IF(D12=0,0,((C12/D12)*100)-100)) -> 9.8114148445236111 | L12: =IF(F12=0,0,((C12/F12)*100)-100) -> 16.015007115141628 | M12: =IF(G12=0,0,((C12/G12)*100)-100) -> 36.359033312419058 | N12: =IF(C12=0,0,IF(H12=0,0,((C12/H12)*100)-100)) -> 89.852524312800426 | P12: 2455500 | Q12: =IF(C12=0,0,((C12/P12)*100)-100) -> 4.2335047851761232 | R12: =IF(C12=0,0,(C12/$C$40)*100) -> 2.1869277664792923 | T12: 16.6495 | U12: 14.268456920051115 | V12: =U12-T12 -> -2.3810430799488849
A13: Apucarana | B13: 2650000 | C13: 2803913.3 | D13: 2392243.79 | F13: 2600487.21 | G13: 2247614.03 | H13: 2146141.48 | J13: =IF(B13=0,0,((C13/B13)*100)-100) -> 5.8080490566037639 | K13: =IF(C13=0,0,IF(D13=0,0,((C13/D13)*100)-100)) -> 17.208509923647867 | L13: =IF(F13=0,0,((C13/F13)*100)-100) -> 7.8226145169158343 | M13: =IF(G13=0,0,((C13/G13)*100)-100) -> 24.750658368154063 | N13: =IF(C13=0,0,IF(H13=0,0,((C13/H13)*100)-100)) -> 30.649042764878658 | P13: 2650000 | Q13: =IF(C13=0,0,((C13/P13)*100)-100) -> 5.8080490566037639 | R13: =IF(C13=0,0,(C13/$C$40)*100) -> 2.3958065061354761 | T13: 16.9 | U13: 15.801035288787283 | V13: =U13-T13 -> -1.0989647112127159
A14: Ahú | B14: 1900000 | C14: 1923325.96 | D14: 1832674.57 | F14: 1743325.93 | G14: 1554631.87 | H14: 1386445.16 | J14: =IF(B14=0,0,((C14/B14)*100)-100) -> 1.2276821052631561 | K14: =IF(C14=0,0,IF(D14=0,0,((C14/D14)*100)-100)) -> 4.9463986396668389 | L14: =IF(F14=0,0,((C14/F14)*100)-100) -> 10.325093369086758 | M14: =IF(G14=0,0,((C14/G14)*100)-100) -> 23.715845346718623 | N14: =IF(C14=0,0,IF(H14=0,0,((C14/H14)*100)-100)) -> 38.723551099561718 | P14: 1900000 | Q14: =IF(C14=0,0,((C14/P14)*100)-100) -> 1.2276821052631561 | R14: =IF(C14=0,0,(C14/$C$40)*100) -> 1.643387778212422 | T14: 17.5 | U14: 16.332979772185887 | V14: =U14-T14 -> -1.1670202278141133
A15: P.G. Centro | B15: 2000000 | C15: 2015217.52 | D15: 1841535.96 | F15: 1976229.65 | G15: 2001736.8 | H15: 1702055.22 | J15: =IF(B15=0,0,((C15/B15)*100)-100) -> 0.76087600000001032 | K15: =IF(C15=0,0,IF(D15=0,0,((C15/D15)*100)-100)) -> 9.4313423018902256 | L15: =IF(F15=0,0,((C15/F15)*100)-100) -> 1.9728410612602829 | M15: =IF(G15=0,0,((C15/G15)*100)-100) -> 0.67345117499964147 | N15: =IF(C15=0,0,IF(H15=0,0,((C15/H15)*100)-100)) -> 18.399068157142409 | P15: 2000000 | Q15: =IF(C15=0,0,((C15/P15)*100)-100) -> 0.76087600000001032 | R15: =IF(C15=0,0,(C15/$C$40)*100) -> 1.7219046129900661 | T15: 18.8 | U15: 17.64109464471111 | V15: =U15-T15 -> -1.1589053552888906
A16: Maringa | B16: 3100000 | C16: 3174981.94 | D16: 2958848.95 | F16: 2919876.58 | G16: 2988501.99 | H16: 2392830.86 | J16: =IF(B16=0,0,((C16/B16)*100)-100) -> 2.4187722580645072 | K16: =IF(C16=0,0,IF(D16=0,0,((C16/D16)*100)-100)) -> 7.304630741626724 | L16: =IF(F16=0,0,((C16/F16)*100)-100) -> 8.7368542132010276 | M16: =IF(G16=0,0,((C16/G16)*100)-100) -> 6.2399138640024603 | N16: =IF(C16=0,0,IF(H16=0,0,((C16/H16)*100)-100)) -> 32.687269839039118 | P16: 3100000 | Q16: =IF(C16=0,0,((C16/P16)*100)-100) -> 2.4187722580645072 | R16: =IF(C16=0,0,(C16/$C$40)*100) -> 2.7128664744072633 | T16: 18.800799999999999 | U16: 16.748222196186731 | V16: =U16-T16 -> -2.0525778038132678
A17: Araucaria Nova | B17: 4200000 | C17: 4409243.07 | D17: 3870077.46 | F17: 3569374.18 | G17: 2864919.45 | H17: 2223578.63 | J17: =IF(B17=0,0,((C17/B17)*100)-100) -> 4.9819778571428657 | K17: =IF(C17=0,0,IF(D17=0,0,((C17/D17)*100)-100)) -> 13.931649058001042 | L17: =IF(F17=0,0,((C17/F17)*100)-100) -> 23.529863994253475 | M17: =IF(G17=0,0,((C17/G17)*100)-100) -> 53.904608731669583 | N17: =IF(C17=0,0,IF(H17=0,0,((C17/H17)*100)-100)) -> 98.294902213554735 | P17: 4200000 | Q17: =IF(C17=0,0,((C17/P17)*100)-100) -> 4.9819778571428657 | R17: =IF(C17=0,0,(C17/$C$40)*100) -> 3.7674821237299887 | T17: 16.899699999999999 | U17: 15.744796759412946 | V17: =U17-T17 -> -1.1549032405870534
A18: Cristo Rei | B18: 2265000 | C18: 2451640.76 | D18: 2342828.51 | F18: 2065192.97 | G18: 1641636.82 | H18: 1275999.97 | J18: =IF(B18=0,0,((C18/B18)*100)-100) -> 8.2402101545253856 | K18: =IF(C18=0,0,IF(D18=0,0,((C18/D18)*100)-100)) -> 4.6444820666793163 | L18: =IF(F18=0,0,((C18/F18)*100)-100) -> 18.712430054417624 | M18: =IF(G18=0,0,((C18/G18)*100)-100) -> 49.341238581624879 | N18: =IF(C18=0,0,IF(H18=0,0,((C18/H18)*100)-100)) -> 92.134860316650304 | P18: 2265000 | Q18: =IF(C18=0,0,((C18/P18)*100)-100) -> 8.2402101545253856 | R18: =IF(C18=0,0,(C18/$C$40)*100) -> 2.0948068841910779 | T18: 18.296900000000001 | U18: 16.856603004104077 | V18: =U18-T18 -> -1.440296995895924
A19: Campo Largo | B19: 3600000 | C19: 3812045.62 | D19: 3505317.77 | F19: 3051237.27 | G19: 2124113.43 | H19: 0 | J19: =IF(B19=0,0,((C19/B19)*100)-100) -> 5.8901561111111249 | K19: =IF(C19=0,0,IF(D19=0,0,((C19/D19)*100)-100)) -> 8.7503578883805488 | L19: =IF(F19=0,0,((C19/F19)*100)-100) -> 24.934421111079303 | M19: =IF(G19=0,0,((C19/G19)*100)-100) -> 79.465256711832012 | N19: =IF(C19=0,0,IF(H19=0,0,((C19/H19)*100)-100)) -> 0 | P19: 3600000 | Q19: =IF(C19=0,0,((C19/P19)*100)-100) -> 5.8901561111111249 | R19: =IF(C19=0,0,(C19/$C$40)*100) -> 3.2572061689929015 | T19: 16.3 | U19: 16.330245544123368 | V19: =U19-T19 -> 3.0245544123367551E-2
A20: Brasilia | B20: 2550000 | C20: 2546087.81 | D20: 2343289.97 | F20: 2512122.98 | G20: 1176477.47 | H20: 755602.84 | J20: =IF(B20=0,0,((C20/B20)*100)-100) -> -0.15341921568627015 | K20: =IF(C20=0,0,IF(D20=0,0,((C20/D20)*100)-100)) -> 8.6544065222964974 | L20: =IF(F20=0,0,((C20/F20)*100)-100) -> 1.352036913415759 | M20: =IF(G20=0,0,((C20/G20)*100)-100) -> 116.41619792345023 | N20: =IF(C20=0,0,IF(H20=0,0,((C20/H20)*100)-100)) -> 236.96112232717394 | P20: 2550000 | Q20: =IF(C20=0,0,((C20/P20)*100)-100) -> -0.15341921568627015 | R20: =IF(C20=0,0,(C20/$C$40)*100) -> 2.175507259939252 | T20: 17.103100000000001 | U20: 15.724333953745296 | V20: =U20-T20 -> -1.3787660462547056
A21: Total Super | B21: =SUM(B6:B20) -> 37025500 | C21: =SUM(C6:C20) -> 38132119.800000004 | D21: =SUM(D6:D20) -> 35026730.829999998 | F21: =SUM(F6:F20) -> 33987972.339999996 | G21: =SUM(G6:G20) -> 28524562.739999998 | H21: =SUM(H6:H20) -> 20629994.550000001 | I21: =SUM(B21:H21) -> 193326880.26000002 | J21: =IF(C21=0,0,((C21/B21)*100)-100) -> 2.9888044725932161 | K21: =IF(C21=0,0,IF(D21=0,0,((C21/D21)*100)-100)) -> 8.8657687897617734 | L21: =IF(F21=0,0,IF(C21=0,0,((C21/F21)*100)-100)) -> 12.192982324876198 | M21: =IF(G21=0,0,IF(C21=0,0,((C21/G21)*100)-100)) -> 33.681697937221401 | N21: =IF(C21=0,0,IF(H21=0,0,((C21/H21)*100)-100)) -> 84.838244661581854 | P21: =SUM(P6:P20) -> 37025500 | Q21: =IF(C21=0,0,((C21/P21)*100)-100) -> 2.9888044725932161 | R21: =IF(C21=0,0,(C21/$C$40)*100) -> 32.582027664542053 | T21: 17.18 | U21: 0 | V21: =U21-T21 -> -17.18
A22: Pinheirinho | B22: 5200000 | C22: 4329409.29 | D22: 4651250.75 | F22: 4639532.62 | G22: 3803986.51 | H22: 3185163.66 | J22: =IF(B22=0,0,((C22/B22)*100)-100) -> -16.742129038461542 | K22: =IF(C22=0,0,IF(D22=0,0,((C22/D22)*100)-100)) -> -6.9194605343519697 | L22: =IF(F22=0,0,((C22/F22)*100)-100) -> -6.6843657626875341 | M22: =IF(G22=0,0,((C22/G22)*100)-100) -> 13.812424902631946 | N22: =IF(C22=0,0,IF(H22=0,0,((C22/H22)*100)-100)) -> 35.924233481930401 | P22: 5200000 | Q22: =IF(C22=0,0,IF(P22=0,0,((C22/P22)*100)-100)) -> -16.742129038461542 | R22: =IF(C22=0,0,(C22/$C$40)*100) -> 3.6992680710581789 | T22: 16 | U22: 15.361165587557558 | V22: =U22-T22 -> -0.6388344124424421
A23: Londrina | B23: 3800000 | C23: 3927436.69 | D23: 3563870.9 | F23: 3651179.34 | G23: 3349088.35 | H23: 2858072.66 | J23: =IF(B23=0,0,((C23/B23)*100)-100) -> 3.3535971052631481 | K23: =IF(C23=0,0,IF(D23=0,0,((C23/D23)*100)-100)) -> 10.201429855385612 | L23: =IF(F23=0,0,((C23/F23)*100)-100) -> 7.5662498134096126 | M23: =IF(G23=0,0,((C23/G23)*100)-100) -> 17.268828993418467 | N23: =IF(C23=0,0,IF(H23=0,0,((C23/H23)*100)-100)) -> 37.415564865310301 | P23: 3800000 | Q23: =IF(C23=0,0,IF(P23=0,0,((C23/P23)*100)-100)) -> 3.3535971052631481 | R23: =IF(C23=0,0,(C23/$C$40)*100) -> 3.3558021834473908 | T23: 16.23 | U23: 14.840670798948002 | V23: =U23-T23 -> -1.3893292010519982
A24: São Bráz | B24: 5350000 | C24: 5382611.0300000003 | D24: 5021487.92 | F24: 5089482.99 | G24: 4253779.78 | H24: 4125091.93 | J24: =IF(B24=0,0,((C24/B24)*100)-100) -> 0.60955196261683398 | K24: =IF(C24=0,0,IF(D24=0,0,((C24/D24)*100)-100)) -> 7.191555884495699 | L24: =IF(F24=0,0,((C24/F24)*100)-100) -> 5.7594856015031013 | M24: =IF(G24=0,0,((C24/G24)*100)-100) -> 26.537134228420257 | N24: =IF(C24=0,0,IF(H24=0,0,((C24/H24)*100)-100)) -> 30.484632132792257 | P24: 5350000 | Q24: =IF(C24=0,0,IF(P24=0,0,((C24/P24)*100)-100)) -> 0.60955196261683398 | R24: =IF(C24=0,0,(C24/$C$40)*100) -> 4.599177344631368 | T24: 16.3 | U24: 15.701860960961914 | V24: =U24-T24 -> -0.5981390390380863
A25: S.J. Pinhais | B25: 5950000 | C25: 6004669 | D25: 5696087.1600000001 | F25: 5607342.1100000003 | G25: 4769989.13 | H25: 4275668.77 | J25: =IF(B25=0,0,((C25/B25)*100)-100) -> 0.91880672268906949 | K25: =IF(C25=0,0,IF(D25=0,0,((C25/D25)*100)-100)) -> 5.4174353610136876 | L25: =IF(F25=0,0,((C25/F25)*100)-100) -> 7.0858328635133034 | M25: =IF(G25=0,0,((C25/G25)*100)-100) -> 25.884332990083763 | N25: =IF(C25=0,0,IF(H25=0,0,((C25/H25)*100)-100)) -> 40.438123788527236 | P25: 5950000 | Q25: =IF(C25=0,0,IF(P25=0,0,((C25/P25)*100)-100)) -> 0.91880672268906949 | R25: =IF(C25=0,0,(C25/$C$40)*100) -> 5.1306953953925758 | T25: 16.103300000000001 | U25: 15.565010660870731 | V25: =U25-T25 -> -0.53828933912926935
A26: P.G. Nova | B26: 5500000 | C26: 5746817.6699999999 | D26: 5115381.82 | F26: 4786404.66 | G26: 4282879.67 | H26: 3817776.18 | J26: =IF(B26=0,0,((C26/B26)*100)-100) -> 4.4875940000000014 | K26: =IF(C26=0,0,IF(D26=0,0,((C26/D26)*100)-100)) -> 12.343865467309328 | L26: =IF(F26=0,0,((C26/F26)*100)-100) -> 20.065436966209191 | M26: =IF(G26=0,0,((C26/G26)*100)-100) -> 34.1811611064945 | N26: =IF(C26=0,0,IF(H26=0,0,((C26/H26)*100)-100)) -> 50.527883224416769 | P26: 5500000 | Q26: =IF(C26=0,0,IF(P26=0,0,((C26/P26)*100)-100)) -> 4.4875940000000014 | R26: =IF(C26=0,0,(C26/$C$40)*100) -> 4.9103740701826677 | T26: 16.1952 | U26: 15.100644388462042 | V26: =U26-T26 -> -1.0945556115379578
A27: Nilo Pecanha | B27: 13200000 | C27: 13492288.15 | D27: 12296388.49 | F27: 12528963.73 | G27: 10664995.380000001 | H27: 9441253.6600000001 | J27: =IF(B27=0,0,((C27/B27)*100)-100) -> 2.2143041666666647 | K27: =IF(C27=0,0,IF(D27=0,0,((C27/D27)*100)-100)) -> 9.7256170864523455 | L27: =IF(F27=0,0,((C27/F27)*100)-100) -> 7.6887797008571965 | M27: =IF(G27=0,0,((C27/G27)*100)-100) -> 26.510023392058883 | N27: =IF(C27=0,0,IF(H27=0,0,((C27/H27)*100)-100)) -> 42.907802669926355 | P27: 13200000 | Q27: =IF(C27=0,0,IF(P27=0,0,((C27/P27)*100)-100)) -> 2.2143041666666647 | R27: =IF(C27=0,0,(C27/$C$40)*100) -> 11.528499020431404 | T27: 16.5 | U27: 15.970129277145626 | V27: =U27-T27 -> -0.52987072285437442
A28: Champagnat | B28: 6900000 | C28: 6457497.8300000001 | D28: 6127551.9400000004 | F28: 7166575.3399999999 | G28: 5833463.9199999999 | H28: 5437225.4100000001 | J28: =IF(B28=0,0,((C28/B28)*100)-100) -> -6.4130749275362291 | K28: =IF(C28=0,0,IF(D28=0,0,((C28/D28)*100)-100)) -> 5.384628204391845 | L28: =IF(F28=0,0,((C28/F28)*100)-100) -> -9.8942308754128021 | M28: =IF(G28=0,0,((C28/G28)*100)-100) -> 10.697484694479769 | N28: =IF(C28=0,0,IF(H28=0,0,((C28/H28)*100)-100)) -> 18.764578310907297 | P28: 6900000 | Q28: =IF(C28=0,0,IF(P28=0,0,((C28/P28)*100)-100)) -> -6.4130749275362291 | R28: =IF(C28=0,0,(C28/$C$40)*100) -> 5.5176154392754295 | T28: 16.8 | U28: 16.151793581013095 | V28: =U28-T28 -> -0.64820641898690567
A29: Santa Candida | B29: 7350000 | C29: 7452795.0300000003 | D29: 7045078.7599999998 | F29: 6512664.2599999998 | G29: 5150457.62 | H29: 4469035.07 | J29: =IF(B29=0,0,((C29/B29)*100)-100) -> 1.3985718367347033 | K29: =IF(C29=0,0,IF(D29=0,0,((C29/D29)*100)-100)) -> 5.7872492826467834 | L29: =IF(F29=0,0,((C29/F29)*100)-100) -> 14.435425080549152 | M29: =IF(G29=0,0,((C29/G29)*100)-100) -> 44.701608669871945 | N29: =IF(C29=0,0,IF(H29=0,0,((C29/H29)*100)-100)) -> 66.76519457252769 | P29: 7350000 | Q29: =IF(C29=0,0,IF(P29=0,0,((C29/P29)*100)-100)) -> 1.3985718367347033 | R29: =IF(C29=0,0,(C29/$C$40)*100) -> 6.368048121091384 | T29: 16.25 | U29: 15.852333993411863 | V29: =U29-T29 -> -0.39766600658813722
A30: Paranaguá Raia | B30: 0 | C30: 0 | D30: 0 | F30: 0 | G30: 0 | H30: 0 | J30: =IF(B30=0,0,((C30/B30)*100)-100) -> 0 | K30: =IF(C30=0,0,IF(D30=0,0,((C30/D30)*100)-100)) -> 0 | L30: =IF(F30=0,0,((C30/F30)*100)-100) -> 0 | M30: =IF(G30=0,0,((C30/G30)*100)-100) -> 0 | N30: =IF(C30=0,0,IF(H30=0,0,((C30/H30)*100)-100)) -> 0 | P30: 0 | Q30: =IF(C30=0,0,IF(P30=0,0,((C30/P30)*100)-100)) -> 0 | R30: =IF(C30=0,0,(C30/$C$40)*100) -> 0 | T30: 0 | U30: 0 | V30: =U30-T30 -> 0
A31: Uvaranas | B31: 4900000 | C31: 5317688.54 | D31: 4529219.72 | F31: 4816166.89 | G31: 0 | H31: 0 | J31: =IF(B31=0,0,((C31/B31)*100)-100) -> 8.524255918367345 | K31: =IF(C31=0,0,IF(D31=0,0,((C31/D31)*100)-100)) -> 17.408491279818065 | L31: =IF(F31=0,0,((C31/F31)*100)-100) -> 10.413294668864779 | M31: =IF(G31=0,0,((C31/G31)*100)-100) -> 0 | N31: =IF(C31=0,0,IF(H31=0,0,((C31/H31)*100)-100)) -> 0 | P31: 4900000 | Q31: =IF(C31=0,0,IF(P31=0,0,((C31/P31)*100)-100)) -> 8.524255918367345 | R31: =IF(C31=0,0,(C31/$C$40)*100) -> 4.5437042585211387 | T31: 15.9177 | U31: 15.130204861528052 | V31: =U31-T31 -> -0.78749513847194841
A32: Torres | B32: 5500000 | C32: 5658950.2699999996 | D32: 5311693.18 | F32: 5054366.48 | G32: 0 | H32: 0 | J32: =IF(B32=0,0,((C32/B32)*100)-100) -> 2.890004909090905 | K32: =IF(C32=0,0,IF(D32=0,0,((C32/D32)*100)-100)) -> 6.5375969249790131 | L32: =IF(F32=0,0,((C32/F32)*100)-100) -> 11.961613634316421 | M32: =IF(G32=0,0,((C32/G32)*100)-100) -> 0 | N32: =IF(C32=0,0,IF(H32=0,0,((C32/H32)*100)-100)) -> 0 | P32: 5500000 | Q32: =IF(C32=0,0,IF(P32=0,0,((C32/P32)*100)-100)) -> 2.890004909090905 | R32: =IF(C32=0,0,(C32/$C$40)*100) -> 4.835295682916839 | T32: 16.05 | U32: 15.548872989124183 | V32: =U32-T32 -> -0.5011270108758179
A33: Total Hiper | B33: =SUM(B22:B32) -> 63650000 | C33: =SUM(C22:C32) -> 63770163.5 | D33: =SUM(D22:D32) -> 59358010.639999993 | F33: =SUM(F22:F32) -> 59852678.420000002 | G33: =SUM(G22:G32) -> 42108640.359999999 | H33: =SUM(H22:H32) -> 37609287.340000004 | I33: =SUM(B33:H33) -> 326348780.25999999 | J33: =IF(C33=0,0,((C33/B33)*100)-100) -> 0.18878790259229561 | K33: =IF(C33=0,0,IF(D33=0,0,((C33/D33)*100)-100)) -> 7.4331211784694773 | L33: =IF(F33=0,0,IF(C33=0,0,((C33/F33)*100)-100)) -> 6.5452126511533919 | M33: =IF(G33=0,0,IF(C33=0,0,((C33/G33)*100)-100)) -> 51.441991369963091 | N33: =IF(C33=0,0,IF(H33=0,0,((C33/H33)*100)-100)) -> 69.559616813520819 | P33: =SUM(P22:P32) -> 63650000 | Q33: =IF(C33=0,0,((C33/P33)*100)-100) -> 0.18878790259229561 | R33: =IF(C33=0,0,(C33/$C$40)*100) -> 54.48847958694838 | T33: 16.23 | U33: 0 | V33: =U33-T33 -> -16.23
A34: Total s/ 25,27,30 | B34: =B21+B33 -> 100675500 | C34: =C21+C33 -> 101902283.30000001 | D34: =D21+D33 -> 94384741.469999999 | E34: =E21+E33 -> 0 | F34: =F21+F33 -> 93840650.75999999 | G34: =G21+G33 -> 70633203.099999994 | H34: =H21+H33 -> 58239281.890000001 | I34: =SUM(B34:H34) -> 519675660.51999998 | J34: =IF(C34=0,0,((C34/B34)*100)-100) -> 1.2185519813658914 | K34: =IF(C34=0,0,IF(D34=0,0,((C34/D34)*100)-100)) -> 7.964785105004978 | L34: =IF(F34=0,0,IF(C34=0,0,((C34/F34)*100)-100)) -> 8.5907679398109309 | M34: =IF(G34=0,0,IF(C34=0,0,((C34/G34)*100)-100)) -> 44.269661897861766 | N34: =IF(C34=0,0,IF(H34=0,0,((C34/H34)*100)-100)) -> 74.971737276000283 | P34: =P21+P33 -> 100675500 | Q34: =IF(C34=0,0,((C34/P34)*100)-100) -> 1.2185519813658914 | R34: =IF(C34=0,0,(C34/$C$40)*100) -> 87.07050725149044 | T34: 16.71 | U34: 0 | V34: =U34-T34 -> -16.71
A35: Paranaguá | B35: 5200000 | C35: 5201886.79 | D35: 5217567.84 | F35: 2012380.99 | G35: 1771493.75 | H35: 1553990.95 | J35: =IF(B35=0,0,((C35/B35)*100)-100) -> 3.6284423076921257E-2 | K35: =IF(C35=0,0,IF(D35=0,0,((C35/D35)*100)-100)) -> -0.30054328915059614 | L35: =IF(F35=0,0,((C35/F35)*100)-100) -> 158.49413286298238 | M35: =IF(G35=0,0,((C35/G35)*100)-100) -> 193.64409499045649 | N35: =IF(C35=0,0,IF(H35=0,0,((C35/H35)*100)-100)) -> 234.74369911871111 | P35: 5200000 | Q35: =IF(P35=0,0,IF(C35=0,0,((C35/P35)*100)-100)) -> 3.6284423076921257E-2 | R35: =IF(C35=0,0,(C35/$C$40)*100) -> 4.4447573381324545 | T35: 17.950299999999999 | U35: 17.352126188813116 | V35: =U35-T35 -> -0.59817381118688218
A36: Paranaguá Raia | B36: 1563854.81 | C36: 1555002.65 | D36: 0 | F36: 6909272 | G36: 5729791.1399999997 | H36: 5050580.08 | J36: =IF(B36=0,0,((C36/B36)*100)-100) -> -0.56604743249792477 | K36: =IF(C36=0,0,IF(D36=0,0,((C36/D36)*100)-100)) -> 0 | L36: =IF(F36=0,0,((C36/F36)*100)-100) -> -77.493972592192051 | M36: =IF(G36=0,0,((C36/G36)*100)-100) -> -72.861093676793246 | N36: =IF(C36=0,0,IF(H36=0,0,((C36/H36)*100)-100)) -> -69.211404920442334 | P36: 1E-3 | Q36: =IF(P36=0,0,IF(C36=0,0,((C36/P36)*100)-100)) -> 155500264899.99997 | R36: =IF(C36=0,0,(C36/$C$40)*100) -> 1.3286735598878561 | T36: 0 | U36: 0 | V36: =U36-T36 -> 0
A37: Novo Mundo | B37: 5500000 | C37: 5488993.1900000004 | D37: 5114205.54 | F37: 0 | G37: 0 | H37: 0 | J37: =IF(B37=0,0,((C37/B37)*100)-100) -> -0.20012381818180813 | K37: =IF(C37=0,0,IF(D37=0,0,((C37/D37)*100)-100)) -> 7.3283650230452082 | L37: =IF(F37=0,0,((C37/F37)*100)-100) -> 0 | M37: =IF(G37=0,0,((C37/G37)*100)-100) -> 0 | N37: =IF(C37=0,0,IF(H37=0,0,((C37/H37)*100)-100)) -> 0 | P37: 5500000 | Q37: =IF(P37=0,0,IF(C37=0,0,((C37/P37)*100)-100)) -> -0.20012381818180813 | R37: =IF(C37=0,0,(C37/$C$40)*100) -> 4.690075686981948 | T37: 15.65 | U37: 15.241824885557929 | V37: =U37-T37 -> -0.40817511444207177
A38: Fazenda | B38: 2900000 | C38: 2886047.51 | D38: 2646829.37 | F38: 0 | G38: 0 | H38: 0 | J38: =IF(B38=0,0,((C38/B38)*100)-100) -> -0.48112034482758759 | K38: =IF(C38=0,0,IF(D38=0,0,((C38/D38)*100)-100)) -> 9.0379131617388566 | L38: =IF(F38=0,0,((C38/F38)*100)-100) -> 0 | M38: =IF(G38=0,0,((C38/G38)*100)-100) -> 0 | N38: =IF(C38=0,0,IF(H38=0,0,((C38/H38)*100)-100)) -> 0 | P38: 2900000 | Q38: =IF(P38=0,0,IF(C38=0,0,((C38/P38)*100)-100)) -> -0.48112034482758759 | R38: =IF(C38=0,0,(C38/$C$40)*100) -> 2.4659861635072988 | T38: 16 | U38: 14.702463439349273 | V38: =U38-T38 -> -1.2975365606507268
A39: Total Lojas Novas | B39: =SUM(B35:B38) -> 15163854.810000001 | C39: =SUM(C35:C38) -> 15131930.139999999 | D39: =SUM(D35:D38) -> 12978602.75 | F39: =SUM(F35:F38) -> 8921652.9900000002 | G39: =SUM(G35:G38) -> 7501284.8899999997 | H39: =SUM(H35:H38) -> 6604571.0300000003 | J39: =IF(C39=0,0,((C39/B39)*100)-100) -> -0.21053136158326424 | K39: =IF(C39=0,0,IF(D39=0,0,((C39/D39)*100)-100)) -> 16.591365276204328 | L39: =IF(F39=0,0,IF(C39=0,0,((C39/F39)*100)-100)) -> 69.609041698448721 | M39: =IF(G39=0,0,IF(C39=0,0,((C39/G39)*100)-100)) -> 101.72450935935592 | N39: =IF(C39=0,0,IF(H39=0,0,((C39/H39)*100)-100)) -> 129.11298964408289 | P39: =SUM(P35:P38) -> 13600000.001 | Q39: =IF(P39=0,0,IF(C39=0,0,((C39/P39)*100)-100)) -> 11.264192197701163 | R39: =IF(C39=0,0,(C39/$C$40)*100) -> 12.929492748509558
A40: Total Geral | B40: =B21+B33+B39 -> 115839354.81 | C40: =C21+C33+C39 -> 117034213.44000001 | D40: =D21+D33+D39 -> 107363344.22 | F40: =F21+F33+F39 -> 102762303.74999999 | G40: =G21+G33+G39 -> 78134487.989999995 | H40: =H21+H33+H39 -> 64843852.920000002 | J40: =IF(C40=0,0,((C40/B40)*100)-100) -> 1.0314790098406661 | K40: =IF(C40=0,0,IF(D40=0,0,((C40/D40)*100)-100)) -> 9.0076080344361031 | L40: =IF(F40=0,0,IF(C40=0,0,((C40/F40)*100)-100)) -> 13.888273393248099 | M40: =IF(G40=0,0,IF(C40=0,0,((C40/G40)*100)-100)) -> 49.78560230020139 | N40: =IF(C40=0,0,IF(H40=0,0,((C40/H40)*100)-100)) -> 80.486211367466041 | P40: =P21+P33+P39 -> 114275500.001 | Q40: =IF(C40=0,0,((C40/P40)*100)-100) -> 2.4140900183992784 | R40: =R21+R33+R39 -> 100 | T40: 16.6 | U40: 0 | V40: =U40-T40 -> -16.6