A2: Periodo: | C2: 38596 | D2: a | E2: 38625 | H2: Vendas Acumuladas por Filial | Q2: =NOW() -> 38635.356668634297
A4: v.1 | C4: Vendas 2005 | G4: Vendas de Anos Anteriores | K4: Percentuais ( % ) | Q4: Meta Mensal | U4: Margem
A5: Lojas | C5: Previsao | D5: Realizada | E5: Mes Anterior | G5: Vendas 2004 | H5: Vendas 2003 | I5: Vendas 2002 | K5: % Prev | L5: % MA | M5: 2004 | N5: 2003 | O5: 2002 | Q5: Previsao Mes | R5: Final | S5: Part. | U5: Meta | V5: Real
A7: Xaxim | C7: 830000 | D7: 684763 | E7: 708755 | G7: 838924 | H7: 766681 | I7: 512843 | K7: =IF(C7=0,0,((D7/C7)*100)-100) -> -17.5 | L7: =IF(D7=0,0,IF(E7=0,0,((D7/E7)*100)-100)) -> -3.39 | M7: =IF(G7=0,0,((D7/G7)*100)-100) -> -18.38 | N7: =IF(H7=0,0,((D7/H7)*100)-100) -> -10.68 | O7: =IF(D7=0,0,IF(I7=0,0,((D7/I7)*100)-100)) -> 33.52 | Q7: 830000 | R7: =IF(D7=0,0,((D7/Q7)*100)-100) -> -17.5 | S7: =IF(D7=0,0,(D7/$D$35)*100) -> 1.27 | U7: 16.9 | V7: 16.06
A8: S. Felicidade | C8: 780000 | D8: 691528 | E8: 665046 | G8: 766496 | H8: 725571 | I8: 574371 | K8: =IF(C8=0,0,((D8/C8)*100)-100) -> -11.34 | L8: =IF(D8=0,0,IF(E8=0,0,((D8/E8)*100)-100)) -> 3.98 | M8: =IF(G8=0,0,((D8/G8)*100)-100) -> -9.78 | N8: =IF(H8=0,0,((D8/H8)*100)-100) -> -4.69 | O8: =IF(D8=0,0,IF(I8=0,0,((D8/I8)*100)-100)) -> 20.4 | Q8: 780000 | R8: =IF(D8=0,0,((D8/Q8)*100)-100) -> -11.34 | S8: =IF(D8=0,0,(D8/$D$35)*100) -> 1.28 | U8: 16.75 | V8: 16.25
A9: Lapa | C9: 1200000 | D9: 1119870 | E9: 1066422 | G9: 1223910 | H9: 1003327 | I9: 795637 | K9: =IF(C9=0,0,((D9/C9)*100)-100) -> -6.68 | L9: =IF(D9=0,0,IF(E9=0,0,((D9/E9)*100)-100)) -> 5.01 | M9: =IF(G9=0,0,((D9/G9)*100)-100) -> -8.5 | N9: =IF(H9=0,0,((D9/H9)*100)-100) -> 11.62 | O9: =IF(D9=0,0,IF(I9=0,0,((D9/I9)*100)-100)) -> 40.75 | Q9: 1200000 | R9: =IF(D9=0,0,((D9/Q9)*100)-100) -> -6.68 | S9: =IF(D9=0,0,(D9/$D$35)*100) -> 2.07 | U9: 16.9 | V9: 16.04
A10: Araucaria | C10: 1000000 | D10: 897389 | E10: 883727 | G10: 929713 | H10: 977421 | I10: 852788 | K10: =IF(C10=0,0,((D10/C10)*100)-100) -> -10.26 | L10: =IF(D10=0,0,IF(E10=0,0,((D10/E10)*100)-100)) -> 1.55 | M10: =IF(G10=0,0,((D10/G10)*100)-100) -> -3.48 | N10: =IF(H10=0,0,((D10/H10)*100)-100) -> -8.19 | O10: =IF(D10=0,0,IF(I10=0,0,((D10/I10)*100)-100)) -> 5.23 | Q10: 1000000 | R10: =IF(D10=0,0,((D10/Q10)*100)-100) -> -10.26 | S10: =IF(D10=0,0,(D10/$D$35)*100) -> 1.66 | U10: 17.9 | V10: 17.29
A11: Pinheirinho | C11: 2050000 | D11: 1779053 | E11: 1792022 | G11: 2086456 | H11: 1783647 | I11: 1604252 | K11: =IF(C11=0,0,((D11/C11)*100)-100) -> -13.22 | L11: =IF(D11=0,0,IF(E11=0,0,((D11/E11)*100)-100)) -> -00.72 | M11: =IF(G11=0,0,((D11/G11)*100)-100) -> -14.73 | N11: =IF(H11=0,0,((D11/H11)*100)-100) -> -00.26 | O11: =IF(D11=0,0,IF(I11=0,0,((D11/I11)*100)-100)) -> 10.9 | Q11: 2050000 | R11: =IF(D11=0,0,((D11/Q11)*100)-100) -> -13.22 | S11: =IF(D11=0,0,(D11/$D$35)*100) -> 3.29 | U11: 17.48 | V11: 16.51
A12: Hauer | C12: 3150000 | D12: 2920132 | E12: 2902375 | G12: 3135473 | H12: 2898503 | I12: 2339964 | K12: =IF(C12=0,0,((D12/C12)*100)-100) -> -7.3 | L12: =IF(D12=0,0,IF(E12=0,0,((D12/E12)*100)-100)) -> 00.61 | M12: =IF(G12=0,0,((D12/G12)*100)-100) -> -6.87 | N12: =IF(H12=0,0,((D12/H12)*100)-100) -> 0.75 | O12: =IF(D12=0,0,IF(I12=0,0,((D12/I12)*100)-100)) -> 24.79 | Q12: 3150000 | R12: =IF(D12=0,0,((D12/Q12)*100)-100) -> -7.3 | S12: =IF(D12=0,0,(D12/$D$35)*100) -> 5.4 | U12: 17.05 | V12: 17.1
A13: Paranagua | C13: 1750000 | D13: 1493258 | E13: 1559438 | G13: 3424238 | H13: 2949278 | I13: 2655929 | K13: =IF(C13=0,0,((D13/C13)*100)-100) -> -14.67 | L13: =IF(D13=0,0,IF(E13=0,0,((D13/E13)*100)-100)) -> -4.24 | M13: =IF(G13=0,0,((D13/G13)*100)-100) -> -56.39 | N13: =IF(H13=0,0,((D13/H13)*100)-100) -> -49.37 | O13: =IF(D13=0,0,IF(I13=0,0,((D13/I13)*100)-100)) -> -43.78 | Q13: 1750000 | R13: =IF(D13=0,0,((D13/Q13)*100)-100) -> -14.67 | S13: =IF(D13=0,0,(D13/$D$35)*100) -> 2.76 | U13: 18 | V13: 17.62
A14: Centenario | C14: 1050000 | D14: 883630 | E14: 908647 | G14: 1076238 | H14: 968755 | I14: 698904 | K14: =IF(C14=0,0,((D14/C14)*100)-100) -> -15.84 | L14: =IF(D14=0,0,IF(E14=0,0,((D14/E14)*100)-100)) -> -2.75 | M14: =IF(G14=0,0,((D14/G14)*100)-100) -> -17.9 | N14: =IF(H14=0,0,((D14/H14)*100)-100) -> -8.79 | O14: =IF(D14=0,0,IF(I14=0,0,((D14/I14)*100)-100)) -> 26.43 | Q14: 1050000 | R14: =IF(D14=0,0,((D14/Q14)*100)-100) -> -15.84 | S14: =IF(D14=0,0,(D14/$D$35)*100) -> 1.63 | U14: 17.1 | V14: 15.56
A15: Arapongas | C15: 0 | D15: 0 | E15: 0 | G15: 0 | H15: 0 | I15: 0 | K15: =IF(C15=0,0,((D15/C15)*100)-100) -> 0 | L15: =IF(D15=0,0,IF(E15=0,0,((D15/E15)*100)-100)) -> 0 | M15: =IF(D15=0,0,IF(G15=0,0,((D15/G15)*100)-100)) -> 0 | N15: =IF(D15=0,0,IF(H15=0,0,((D15/H15)*100)-100)) -> 0 | O15: =IF(D15=0,0,IF(I15=0,0,((D15/I15)*100)-100)) -> 0 | Q15: 0 | R15: =IF(D15=0,0,((D15/Q15)*100)-100) -> 0 | S15: =IF(D15=0,0,(D15/$D$35)*100) -> 0 | U15: 0 | V15: 0
A16: Sao Braz | C16: 3150000 | D16: 2928999 | E16: 2932454 | G16: 3118069 | H16: 2929933 | I16: 2357537 | K16: =IF(C16=0,0,((D16/C16)*100)-100) -> -7.02 | L16: =IF(D16=0,0,IF(E16=0,0,((D16/E16)*100)-100)) -> -00.12 | M16: =IF(G16=0,0,((D16/G16)*100)-100) -> -6.06 | N16: =IF(H16=0,0,((D16/H16)*100)-100) -> -00.03 | O16: =IF(D16=0,0,IF(I16=0,0,((D16/I16)*100)-100)) -> 24.24 | Q16: 3150000 | R16: =IF(D16=0,0,((D16/Q16)*100)-100) -> -7.02 | S16: =IF(D16=0,0,(D16/$D$35)*100) -> 5.42 | U16: 16.75 | V16: 16.53
A17: Sitio Cercado | C17: 1300000 | D17: 1254512 | E17: 1236262 | G17: 1649743 | H17: 1198168 | I17: 841242 | K17: =IF(C17=0,0,((D17/C17)*100)-100) -> -3.5 | L17: =IF(D17=0,0,IF(E17=0,0,((D17/E17)*100)-100)) -> 1.48 | M17: =IF(G17=0,0,((D17/G17)*100)-100) -> -23.96 | N17: =IF(H17=0,0,((D17/H17)*100)-100) -> 4.7 | O17: =IF(D17=0,0,IF(I17=0,0,((D17/I17)*100)-100)) -> 49.13 | Q17: 1300000 | R17: =IF(D17=0,0,((D17/Q17)*100)-100) -> -3.5 | S17: =IF(D17=0,0,(D17/$D$35)*100) -> 2.32 | U17: 17 | V17: 14.68
A18: Apucarana | C18: 1600000 | D18: 1427764 | E18: 1417379 | G18: 1629979 | H18: 1349914 | I18: 1045434 | K18: =IF(C18=0,0,((D18/C18)*100)-100) -> -10.76 | L18: =IF(D18=0,0,IF(E18=0,0,((D18/E18)*100)-100)) -> 00.73 | M18: =IF(G18=0,0,((D18/G18)*100)-100) -> -12.41 | N18: =IF(H18=0,0,((D18/H18)*100)-100) -> 5.77 | O18: =IF(D18=0,0,IF(I18=0,0,((D18/I18)*100)-100)) -> 36.57 | Q18: 1600000 | R18: =IF(D18=0,0,((D18/Q18)*100)-100) -> -10.76 | S18: =IF(D18=0,0,(D18/$D$35)*100) -> 2.64 | U18: 18.2 | V18: 17.19
A19: Ahu | C19: 1050000 | D19: 1066777 | E19: 1052895 | G19: 1246862 | H19: 1250461 | I19: 957904 | K19: =IF(C19=0,0,((D19/C19)*100)-100) -> 1.6 | L19: =IF(D19=0,0,IF(E19=0,0,((D19/E19)*100)-100)) -> 1.32 | M19: =IF(G19=0,0,((D19/G19)*100)-100) -> -14.44 | N19: =IF(H19=0,0,((D19/H19)*100)-100) -> -14.69 | O19: =IF(D19=0,0,IF(I19=0,0,((D19/I19)*100)-100)) -> 11.37 | Q19: 1050000 | R19: =IF(D19=0,0,((D19/Q19)*100)-100) -> 1.6 | S19: =IF(D19=0,0,(D19/$D$35)*100) -> 1.97 | U19: 17.91 | V19: 16.54
A20: P.G. Centro | C20: 1750000 | D20: 1513642 | E20: 1550259 | G20: 1750608 | H20: 1621539 | I20: 1262066 | K20: =IF(C20=0,0,((D20/C20)*100)-100) -> -13.51 | L20: =IF(D20=0,0,IF(E20=0,0,((D20/E20)*100)-100)) -> -2.36 | M20: =IF(G20=0,0,((D20/G20)*100)-100) -> -13.54 | N20: =IF(H20=0,0,((D20/H20)*100)-100) -> -6.65 | O20: =IF(D20=0,0,IF(I20=0,0,((D20/I20)*100)-100)) -> 19.93 | Q20: 1750000 | R20: =IF(D20=0,0,((D20/Q20)*100)-100) -> -13.51 | S20: =IF(D20=0,0,(D20/$D$35)*100) -> 2.8 | U20: 18.9 | V20: 17.68
A21: Maringa | C21: 2350000 | D21: 2199979 | E21: 2217443 | G21: 2342033 | H21: 2148664 | I21: 1660092 | K21: =IF(C21=0,0,((D21/C21)*100)-100) -> -6.38 | L21: =IF(D21=0,0,IF(E21=0,0,((D21/E21)*100)-100)) -> -00.79 | M21: =IF(G21=0,0,((D21/G21)*100)-100) -> -6.07 | N21: =IF(H21=0,0,((D21/H21)*100)-100) -> 2.39 | O21: =IF(D21=0,0,IF(I21=0,0,((D21/I21)*100)-100)) -> 32.52 | Q21: 2350000 | R21: =IF(D21=0,0,((D21/Q21)*100)-100) -> -6.38 | S21: =IF(D21=0,0,(D21/$D$35)*100) -> 4.07 | U21: 18.4 | V21: 17.59
A22: Araucaria Nova | C22: 2200000 | D22: 1780264 | E22: 1850146 | G22: 2149964 | H22: 1771505 | I22: 1838723 | K22: =IF(C22=0,0,((D22/C22)*100)-100) -> -19.08 | L22: =IF(D22=0,0,IF(E22=0,0,((D22/E22)*100)-100)) -> -3.78 | M22: =IF(G22=0,0,((D22/G22)*100)-100) -> -17.2 | N22: =IF(H22=0,0,((D22/H22)*100)-100) -> 00.49 | O22: =IF(D22=0,0,IF(I22=0,0,((D22/I22)*100)-100)) -> -3.18 | Q22: 2200000 | R22: =IF(D22=0,0,((D22/Q22)*100)-100) -> -19.08 | S22: =IF(D22=0,0,(D22/$D$35)*100) -> 3.29 | U22: 17.6 | V22: 17.67
A23: Sitio Cercado | C23: 0 | D23: 0 | E23: 0 | G23: 0 | H23: 0 | I23: 0 | K23: =IF(C23=0,0,((D23/C23)*100)-100) -> 0 | L23: =IF(D23=0,0,IF(E23=0,0,((D23/E23)*100)-100)) -> 0 | M23: =IF(G23=0,0,((D23/G23)*100)-100) -> 0 | N23: =IF(H23=0,0,((D23/H23)*100)-100) -> 0 | O23: =IF(D23=0,0,IF(I23=0,0,((D23/I23)*100)-100)) -> 0 | Q23: 0 | R23: =IF(Q23=0,0,IF(D23=0,0,((D23/Q23)*100)-100)) -> 0 | S23: =IF(D23=0,0,(D23/$D$35)*100) -> 0 | U23: 0 | V23: 0
A24: Total Super | C24: =SUM(C7:C23) -> 25210000 | D24: =SUM(D7:D23) -> 22641560 | E24: =SUM(E7:E23) -> 22743270 | G24: =SUM(G7:G23) -> 27368706 | H24: =SUM(H7:H23) -> 24343367 | I24: =SUM(I7:I23) -> 19997686 | J24: =SUM(C24:I24) -> 142304589 | K24: =IF(D24=0,0,((D24/C24)*100)-100) -> -10.19 | L24: =IF(D24=0,0,IF(E24=0,0,((D24/E24)*100)-100)) -> -00.45 | M24: =IF(G24=0,0,IF(D24=0,0,((D24/G24)*100)-100)) -> -17.27 | N24: =IF(H24=0,0,IF(D24=0,0,((D24/H24)*100)-100)) -> -6.99 | O24: =IF(D24=0,0,IF(I24=0,0,((D24/I24)*100)-100)) -> 13.22 | Q24: =SUM(Q7:Q23) -> 25210000 | R24: =IF(D24=0,0,((D24/Q24)*100)-100) -> -10.19 | S24: =IF(D24=0,0,(D24/$D$35)*100) -> 41.87 | U24: 17.54 | V24: 16.83
A26: Londrina | C26: 2750000 | D26: 2675642 | E26: 2599491 | G26: 2407890 | H26: 2267201 | I26: 1824304 | K26: =IF(C26=0,0,((D26/C26)*100)-100) -> -2.7 | L26: =IF(D26=0,0,IF(E26=0,0,((D26/E26)*100)-100)) -> 2.93 | M26: =IF(G26=0,0,((D26/G26)*100)-100) -> 11.12 | N26: =IF(H26=0,0,((D26/H26)*100)-100) -> 18.02 | O26: =IF(D26=0,0,IF(I26=0,0,((D26/I26)*100)-100)) -> 46.67 | Q26: 2750000 | R26: =IF(D26=0,0,IF(Q26=0,0,((D26/Q26)*100)-100)) -> -2.7 | S26: =IF(D26=0,0,(D26/$D$35)*100) -> 4.95 | U26: 18.1 | V26: 14.82
A27: S.J. Pinhais | C27: 4100000 | D27: 3693460 | E27: 3728020 | G27: 4212584 | H27: 3902807 | I27: 3208818 | K27: =IF(C27=0,0,((D27/C27)*100)-100) -> -9.92 | L27: =IF(D27=0,0,IF(E27=0,0,((D27/E27)*100)-100)) -> -00.93 | M27: =IF(G27=0,0,((D27/G27)*100)-100) -> -12.32 | N27: =IF(H27=0,0,((D27/H27)*100)-100) -> -5.36 | O27: =IF(D27=0,0,IF(I27=0,0,((D27/I27)*100)-100)) -> 15.1 | Q27: 4100000 | R27: =IF(D27=0,0,IF(Q27=0,0,((D27/Q27)*100)-100)) -> -9.92 | S27: =IF(D27=0,0,(D27/$D$35)*100) -> 6.83 | U27: 17 | V27: 15.92
A28: P.G. Nova | C28: 3500000 | D28: 3221964 | E28: 3111394 | G28: 3481841 | H28: 2828674 | I28: 2512925 | K28: =IF(C28=0,0,((D28/C28)*100)-100) -> -7.94 | L28: =IF(D28=0,0,IF(E28=0,0,((D28/E28)*100)-100)) -> 3.55 | M28: =IF(G28=0,0,((D28/G28)*100)-100) -> -7.46 | N28: =IF(H28=0,0,((D28/H28)*100)-100) -> 13.9 | O28: =IF(D28=0,0,IF(I28=0,0,((D28/I28)*100)-100)) -> 28.22 | Q28: 3500000 | R28: =IF(D28=0,0,IF(Q28=0,0,((D28/Q28)*100)-100)) -> -7.94 | S28: =IF(D28=0,0,(D28/$D$35)*100) -> 5.96 | U28: 17.1 | V28: 16.35
A29: Nilo Pecanha | C29: 8600000 | D29: 8493887 | E29: 8483332 | G29: 7986774 | H29: 7819661 | I29: 6020615 | K29: =IF(C29=0,0,((D29/C29)*100)-100) -> -1.23 | L29: =IF(D29=0,0,IF(E29=0,0,((D29/E29)*100)-100)) -> 00.12 | M29: =IF(G29=0,0,((D29/G29)*100)-100) -> 6.35 | N29: =IF(H29=0,0,((D29/H29)*100)-100) -> 8.62 | O29: =IF(D29=0,0,IF(I29=0,0,((D29/I29)*100)-100)) -> 41.08 | Q29: 8600000 | R29: =IF(D29=0,0,IF(Q29=0,0,((D29/Q29)*100)-100)) -> -1.23 | S29: =IF(D29=0,0,(D29/$D$35)*100) -> 15.71 | U29: 16.3 | V29: 16.65
A30: Champagnat | C30: 5600000 | D30: 5427354 | E30: 5484275 | G30: 4711048 | H30: 0 | I30: 0 | K30: =IF(C30=0,0,((D30/C30)*100)-100) -> -3.08 | L30: =IF(D30=0,0,IF(E30=0,0,((D30/E30)*100)-100)) -> -1.04 | M30: =IF(G30=0,0,((D30/G30)*100)-100) -> 15.2 | N30: =IF(H30=0,0,((D30/H30)*100)-100) -> 0 | O30: =IF(D30=0,0,IF(I30=0,0,((D30/I30)*100)-100)) -> 0 | Q30: 5600000 | R30: =IF(D30=0,0,IF(Q30=0,0,((D30/Q30)*100)-100)) -> -3.08 | S30: =IF(D30=0,0,(D30/$D$35)*100) -> 10.04 | U30: 16.5 | V30: 16.64
A31: Santa Candida | C31: 4600000 | D31: 3944797 | E31: 3933843 | G31: 0 | H31: 0 | I31: 0 | K31: =IF(C31=0,0,((D31/C31)*100)-100) -> -14.24 | L31: =IF(D31=0,0,IF(E31=0,0,((D31/E31)*100)-100)) -> 00.28 | M31: =IF(G31=0,0,((D31/G31)*100)-100) -> 0 | N31: =IF(H31=0,0,((D31/H31)*100)-100) -> 0 | O31: =IF(D31=0,0,IF(I31=0,0,((D31/I31)*100)-100)) -> 0 | Q31: 4600000 | R31: =IF(D31=0,0,IF(Q31=0,0,((D31/Q31)*100)-100)) -> -14.24 | S31: =IF(D31=0,0,(D31/$D$35)*100) -> 7.3 | U31: 16.5 | V31: 15.59
A32: Paranagu Raia | C32: 4200000 | D32: 3971191 | E32: 3968450 | G32: 0 | H32: 0 | I32: 0 | K32: =IF(C32=0,0,((D32/C32)*100)-100) -> -5.45 | L32: =IF(D32=0,0,IF(E32=0,0,((D32/E32)*100)-100)) -> 00.07 | M32: =IF(G32=0,0,((D32/G32)*100)-100) -> 0 | N32: =IF(H32=0,0,((D32/H32)*100)-100) -> 0 | O32: =IF(D32=0,0,IF(I32=0,0,((D32/I32)*100)-100)) -> 0 | Q32: 4200000 | R32: =IF(D32=0,0,IF(Q32=0,0,((D32/Q32)*100)-100)) -> -5.45 | S32: =IF(D32=0,0,(D32/$D$35)*100) -> 7.34 | U32: 15.5 | V32: 16.63
A33: Total Hiper | C33: =SUM(C26:C32) -> 33350000 | D33: =SUM(D26:D32) -> 31428295 | E33: =SUM(E26:E32) -> 31308805 | G33: =SUM(G26:G32) -> 22800137 | H33: =SUM(H26:H32) -> 16818343 | I33: =SUM(I26:I32) -> 13566662 | J33: =SUM(C33:I33) -> 149272242 | K33: =IF(D33=0,0,((D33/C33)*100)-100) -> -5.76 | L33: =IF(D33=0,0,IF(E33=0,0,((D33/E33)*100)-100)) -> 00.38 | M33: =IF(G33=0,0,IF(D33=0,0,((D33/G33)*100)-100)) -> 37.84 | N33: =IF(H33=0,0,IF(D33=0,0,((D33/H33)*100)-100)) -> 86.87 | O33: =IF(D33=0,0,IF(I33=0,0,((D33/I33)*100)-100)) -> 131.66 | Q33: =SUM(Q26:Q32) -> 33350000 | R33: =IF(D33=0,0,((D33/Q33)*100)-100) -> -5.76 | S33: =IF(D33=0,0,(D33/$D$35)*100) -> 58.13 | U33: 16.58 | V33: 16.24
A35: Total Geral | C35: =C24+C33 -> 58560000 | D35: =D24+D33 -> 54069855 | E35: =E24+E33 -> 54052075 | G35: =G24+G33 -> 50168843 | H35: =H24+H33 -> 41161710 | I35: =I24+I33 -> 33564348 | K35: =IF(D33=0,0,((D35/C35)*100)-100) -> -7.67 | L35: =IF(D35=0,0,IF(E35=0,0,((D35/E35)*100)-100)) -> 00.03 | M35: =IF(G35=0,0,IF(D35=0,0,((D35/G35)*100)-100)) -> 7.78 | N35: =IF(H35=0,0,IF(D35=0,0,((D35/H35)*100)-100)) -> 31.36 | O35: =IF(D35=0,0,IF(I35=0,0,((D35/I35)*100)-100)) -> 61.09 | Q35: =Q24+Q33 -> 58560000 | R35: =IF(D35=0,0,((D35/Q35)*100)-100) -> -7.67 | S35: =S24+S33 -> 100 | U35: 16.99 | V35: 16.48
C36: Resumo por Regiao - Outubro/2002
C37: Descricao das Aberturas | H37: Valor | I37: %
C38: Curitiba (2,3,6,7,10,11,17,21,22) | H38: =D7+D8+D11+D12+D14+D16+D19+D29+D30+D32 -> 28847314 | I38: =IF(D35=0,0,H38/$D$35) -> 0.53349999999999997
C39: Curitiba e Metrop. (Ctba. 4,5,8,14,23) | H39: =H38+D9+D10+D13+D28+D23 -> 35579795 | I39: =IF(D35=0,0,H39/$D$35) -> 0.65800000000000003
C40: Metropolitana (4,5,8,14,23) | H40: =H39-H38 -> 6732481 | I40: =IF(D35=0,0,H40/$D$35) -> 0.1245
C41: Norte (9,15,20) | H41: =D26+D18+D23 -> 4103406 | I41: =IF(D35=0,0,H41/$D$35) -> 7.5899999999999995E-2
C42: Centro-Oeste (13,18,19) | H42: =D17+D20+D28 -> 5990118 | I42: =IF(D35=0,0,H42/$D$35) -> 0.1108
C43: Ponta Grossa (18,19) | H43: =H42-D17 -> 4735606 | I43: =IF(D35=0,0,H43/$D$35) -> 8.7599999999999997E-2
C44: Super (2,3,4,5,6,7,8,10,11,13,15,17,18,20,23) | H44: =D24 -> 22641560 | I44: =IF(D35=0,0,H44/$D$35) -> 0.41870000000000002
C45: Hiper (9,14,19,21,22,24) | H45: =D33 -> 31428295 | I45: =IF(D35=0,0,H45/$D$35) -> 0.58130000000000004
C46: Curitiba, Metropolitana e Centro-Oeste | H46: =D35-H41 -> 49966449 | I46: =IF(D35=0,0,H46/$D$35) -> 0.92410000000000003
C47: Araucaria | H47: =D10+D23 -> 897389 | I47: =IF(D35=0,0,H47/$D$35) -> 1.66E-2