A2: Periodo: | C2: 39995 | D2: a | E2: 31/07/2009 | H2: Vendas Acumuladas por Filial | Q2: =NOW() -> 40026.314914583301
A4: v.1 | C4: Vendas 2009 | G4: Vendas de Anos Anteriores | K4: Percentuais ( % ) | Q4: Meta Mensal | U4: Margem
A5: Lojas | C5: Previsao | D5: Realizada | E5: Mes Anterior | G5: Vendas 2008 | H5: Vendas 2007 | I5: Vendas 2006 | K5: % Prev | L5: % MA | M5: 2008 | N5: 2007 | O5: 2006 | Q5: Previsao Mes | R5: Final | S5: Part. | U5: Meta | V5: Coml | W5: Dif
A7: S. Felicidade | C7: 2630000 | D7: 2744209 | E7: 2543394 | G7: 2225287 | H7: 1275238 | I7: 823282 | K7: =IF(C7=0,0,((D7/C7)*100)-100) -> 4.34 | L7: =IF(D7=0,0,IF(E7=0,0,((D7/E7)*100)-100)) -> 7.9 | M7: =IF(G7=0,0,((D7/G7)*100)-100) -> 23.32 | N7: =IF(H7=0,0,((D7/H7)*100)-100) -> 115.19 | O7: =IF(D7=0,0,IF(I7=0,0,((D7/I7)*100)-100)) -> 233.33 | Q7: 2630000 | R7: =IF(D7=0,0,((D7/Q7)*100)-100) -> 4.34 | S7: =IF(D7=0,0,(D7/$D$44)*100) -> 2.67 | U7: 16.62 | V7: 17.28 | W7: =V7-U7 -> 0.66
A8: Lapa | C8: 2100000 | D8: 2174727 | E8: 1965895 | G8: 1861717 | H8: 1314491 | I8: 995405 | K8: =IF(C8=0,0,((D8/C8)*100)-100) -> 3.56 | L8: =IF(D8=0,0,IF(E8=0,0,((D8/E8)*100)-100)) -> 10.62 | M8: =IF(G8=0,0,((D8/G8)*100)-100) -> 16.81 | N8: =IF(H8=0,0,((D8/H8)*100)-100) -> 65.44 | O8: =IF(D8=0,0,IF(I8=0,0,((D8/I8)*100)-100)) -> 118.48 | Q8: 2100000 | R8: =IF(D8=0,0,((D8/Q8)*100)-100) -> 3.56 | S8: =IF(D8=0,0,(D8/$D$44)*100) -> 2.12 | U8: 16.4 | V8: 16.07 | W8: =V8-U8 -> -0.33
A9: Araucaria | C9: 1300000 | D9: 1346452 | E9: 1257716 | G9: 1129275 | H9: 904066 | I9: 890983 | K9: =IF(C9=0,0,((D9/C9)*100)-100) -> 3.57 | L9: =IF(D9=0,0,IF(E9=0,0,((D9/E9)*100)-100)) -> 7.06 | M9: =IF(G9=0,0,((D9/G9)*100)-100) -> 19.23 | N9: =IF(H9=0,0,((D9/H9)*100)-100) -> 48.93 | O9: =IF(D9=0,0,IF(I9=0,0,((D9/I9)*100)-100)) -> 51.12 | Q9: 1300000 | R9: =IF(D9=0,0,((D9/Q9)*100)-100) -> 3.57 | S9: =IF(D9=0,0,(D9/$D$44)*100) -> 1.31 | U9: 17.24 | V9: 17.09 | W9: =V9-U9 -> -0.15
A10: Hauer | C10: 3700000 | D10: 3804584 | E10: 3567995 | G10: 3675075 | H10: 2952586 | I10: 2849509 | K10: =IF(C10=0,0,((D10/C10)*100)-100) -> 2.83 | L10: =IF(D10=0,0,IF(E10=0,0,((D10/E10)*100)-100)) -> 6.63 | M10: =IF(G10=0,0,((D10/G10)*100)-100) -> 3.52 | N10: =IF(H10=0,0,((D10/H10)*100)-100) -> 28.86 | O10: =IF(D10=0,0,IF(I10=0,0,((D10/I10)*100)-100)) -> 33.52 | Q10: 3700000 | R10: =IF(D10=0,0,((D10/Q10)*100)-100) -> 2.83 | S10: =IF(D10=0,0,(D10/$D$44)*100) -> 3.7 | U10: 15.95 | V10: 15.91 | W10: =V10-U10 -> -0.04
A11: Paranagua | C11: 1850000 | D11: 2012381 | E11: 1861893 | G11: 1806529 | H11: 1553991 | I11: 1416549 | K11: =IF(C11=0,0,((D11/C11)*100)-100) -> 8.78 | L11: =IF(D11=0,0,IF(E11=0,0,((D11/E11)*100)-100)) -> 8.08 | M11: =IF(G11=0,0,((D11/G11)*100)-100) -> 11.39 | N11: =IF(H11=0,0,((D11/H11)*100)-100) -> 29.5 | O11: =IF(D11=0,0,IF(I11=0,0,((D11/I11)*100)-100)) -> 42.06 | Q11: 1850000 | R11: =IF(D11=0,0,((D11/Q11)*100)-100) -> 8.78 | S11: =IF(D11=0,0,(D11/$D$44)*100) -> 1.96 | U11: 17.9 | V11: 17.54 | W11: =V11-U11 -> -0.36
A12: Centenario | C12: 1390000 | D12: 1274013 | E12: 1207149 | G12: 1265942 | H12: 952833 | I12: 850610 | K12: =IF(C12=0,0,((D12/C12)*100)-100) -> -8.34 | L12: =IF(D12=0,0,IF(E12=0,0,((D12/E12)*100)-100)) -> 5.54 | M12: =IF(G12=0,0,((D12/G12)*100)-100) -> 0.64 | N12: =IF(H12=0,0,((D12/H12)*100)-100) -> 33.71 | O12: =IF(D12=0,0,IF(I12=0,0,((D12/I12)*100)-100)) -> 49.78 | Q12: 1390000 | R12: =IF(D12=0,0,((D12/Q12)*100)-100) -> -8.34 | S12: =IF(D12=0,0,(D12/$D$44)*100) -> 1.24 | U12: 16.64 | V12: 16.39 | W12: =V12-U12 -> -0.25
A13: Sitio Cercado | C13: 2215000 | D13: 2206140 | E13: 2062883 | G13: 1882903 | H13: 1348127 | I13: 1121514 | K13: =IF(C13=0,0,((D13/C13)*100)-100) -> -0.4 | L13: =IF(D13=0,0,IF(E13=0,0,((D13/E13)*100)-100)) -> 6.94 | M13: =IF(G13=0,0,((D13/G13)*100)-100) -> 17.17 | N13: =IF(H13=0,0,((D13/H13)*100)-100) -> 63.64 | O13: =IF(D13=0,0,IF(I13=0,0,((D13/I13)*100)-100)) -> 96.71 | Q13: 2215000 | R13: =IF(D13=0,0,((D13/Q13)*100)-100) -> -0.4 | S13: =IF(D13=0,0,(D13/$D$44)*100) -> 2.15 | U13: 16.7 | V13: 15.64 | W13: =V13-U13 -> -1.06
A14: Apucarana | C14: 2584999 | D14: 2600487 | E14: 2470236 | G14: 2266617 | H14: 2146142 | I14: 1621949 | K14: =IF(C14=0,0,((D14/C14)*100)-100) -> 0.6 | L14: =IF(D14=0,0,IF(E14=0,0,((D14/E14)*100)-100)) -> 5.27 | M14: =IF(G14=0,0,((D14/G14)*100)-100) -> 14.73 | N14: =IF(H14=0,0,((D14/H14)*100)-100) -> 21.17 | O14: =IF(D14=0,0,IF(I14=0,0,((D14/I14)*100)-100)) -> 60.33 | Q14: 2585000 | R14: =IF(D14=0,0,((D14/Q14)*100)-100) -> 0.6 | S14: =IF(D14=0,0,(D14/$D$44)*100) -> 2.53 | U14: 17 | V14: 17.23 | W14: =V14-U14 -> 0.23
A15: Ah | C15: 1700000 | D15: 1743326 | E15: 1687080 | G15: 1572638 | H15: 1386445 | I15: 1096611 | K15: =IF(C15=0,0,((D15/C15)*100)-100) -> 2.55 | L15: =IF(D15=0,0,IF(E15=0,0,((D15/E15)*100)-100)) -> 3.33 | M15: =IF(G15=0,0,((D15/G15)*100)-100) -> 10.85 | N15: =IF(H15=0,0,((D15/H15)*100)-100) -> 25.74 | O15: =IF(D15=0,0,IF(I15=0,0,((D15/I15)*100)-100)) -> 58.97 | Q15: 1700000 | R15: =IF(D15=0,0,((D15/Q15)*100)-100) -> 2.55 | S15: =IF(D15=0,0,(D15/$D$44)*100) -> 1.7 | U15: 17.5 | V15: 17.57 | W15: =V15-U15 -> 0.07
A16: P.G. Centro | C16: 1899999 | D16: 1976230 | E16: 1803046 | G16: 2023332 | H16: 1702055 | I16: 1468717 | K16: =IF(C16=0,0,((D16/C16)*100)-100) -> 4.01 | L16: =IF(D16=0,0,IF(E16=0,0,((D16/E16)*100)-100)) -> 9.61 | M16: =IF(G16=0,0,((D16/G16)*100)-100) -> -2.33 | N16: =IF(H16=0,0,((D16/H16)*100)-100) -> 16.11 | O16: =IF(D16=0,0,IF(I16=0,0,((D16/I16)*100)-100)) -> 34.55 | Q16: 1900000 | R16: =IF(D16=0,0,((D16/Q16)*100)-100) -> 4.01 | S16: =IF(D16=0,0,(D16/$D$44)*100) -> 1.92 | U16: 18.85 | V16: 17.1 | W16: =V16-U16 -> -1.75
A17: Maringa | C17: 2999999 | D17: 2919877 | E17: 2770953 | G17: 3026626 | H17: 2392831 | I17: 2161851 | K17: =IF(C17=0,0,((D17/C17)*100)-100) -> -2.67 | L17: =IF(D17=0,0,IF(E17=0,0,((D17/E17)*100)-100)) -> 5.37 | M17: =IF(G17=0,0,((D17/G17)*100)-100) -> -3.53 | N17: =IF(H17=0,0,((D17/H17)*100)-100) -> 22.03 | O17: =IF(D17=0,0,IF(I17=0,0,((D17/I17)*100)-100)) -> 35.06 | Q17: 3000000 | R17: =IF(D17=0,0,((D17/Q17)*100)-100) -> -2.67 | S17: =IF(D17=0,0,(D17/$D$44)*100) -> 2.84 | U17: 18.2 | V17: 17.63 | W17: =V17-U17 -> -0.57
A18: Araucaria Nova | C18: 3300000 | D18: 3569374 | E18: 3379256 | G18: 2881348 | H18: 2223579 | I18: 1939781 | K18: =IF(C18=0,0,((D18/C18)*100)-100) -> 8.16 | L18: =IF(D18=0,0,IF(E18=0,0,((D18/E18)*100)-100)) -> 5.63 | M18: =IF(G18=0,0,((D18/G18)*100)-100) -> 23.88 | N18: =IF(H18=0,0,((D18/H18)*100)-100) -> 60.52 | O18: =IF(D18=0,0,IF(I18=0,0,((D18/I18)*100)-100)) -> 84.01 | Q18: 3800000 | R18: =IF(D18=0,0,((D18/Q18)*100)-100) -> -6.07 | S18: =IF(D18=0,0,(D18/$D$44)*100) -> 3.47 | U18: 16.3 | V18: 16.49 | W18: =V18-U18 -> 0.19
A19: Cristo Rei | C19: 1975000 | D19: 2065193 | E19: 2095182 | G19: 1658769 | H19: 1276000 | I19: 0 | K19: =IF(C19=0,0,((D19/C19)*100)-100) -> 4.57 | L19: =IF(D19=0,0,IF(E19=0,0,((D19/E19)*100)-100)) -> -1.43 | M19: =IF(G19=0,0,((D19/G19)*100)-100) -> 24.5 | N19: =IF(H19=0,0,((D19/H19)*100)-100) -> 61.85 | O19: =IF(D19=0,0,IF(I19=0,0,((D19/I19)*100)-100)) -> 0 | Q19: 1975000 | R19: =IF(D19=0,0,((D19/Q19)*100)-100) -> 4.57 | S19: =IF(D19=0,0,(D19/$D$44)*100) -> 2.01 | U19: 18.3 | V19: 18.08 | W19: =V19-U19 -> -0.22
A20: Campo Largo | C20: 2600000 | D20: 3051237 | E20: 2795659 | G20: 2131007 | H20: 0 | I20: 0 | K20: =IF(C20=0,0,((D20/C20)*100)-100) -> 17.36 | L20: =IF(D20=0,0,IF(E20=0,0,((D20/E20)*100)-100)) -> 9.14 | M20: =IF(G20=0,0,((D20/G20)*100)-100) -> 43.18 | N20: =IF(H20=0,0,((D20/H20)*100)-100) -> 0 | O20: =IF(D20=0,0,IF(I20=0,0,((D20/I20)*100)-100)) -> 0 | Q20: 2600000 | R20: =IF(D20=0,0,((D20/Q20)*100)-100) -> 17.36 | S20: =IF(D20=0,0,(D20/$D$44)*100) -> 2.97 | U20: 17.1 | V20: 17.11 | W20: =V20-U20 -> 0.01
A21: Brasilia | C21: 2460000 | D21: 2512123 | E21: 2373462 | G21: 1275599 | H21: 755603 | I21: 632961 | K21: =IF(C21=0,0,((D21/C21)*100)-100) -> 2.12 | L21: =IF(D21=0,0,IF(E21=0,0,((D21/E21)*100)-100)) -> 5.84 | M21: =IF(G21=0,0,((D21/G21)*100)-100) -> 96.94 | N21: =IF(H21=0,0,((D21/H21)*100)-100) -> 232.47 | O21: =IF(D21=0,0,IF(I21=0,0,((D21/I21)*100)-100)) -> 296.88 | Q21: 2460000 | R21: =IF(D21=0,0,((D21/Q21)*100)-100) -> 2.12 | S21: =IF(D21=0,0,(D21/$D$44)*100) -> 2.44 | U21: 16.7 | V21: 16.4 | W21: =V21-U21 -> -0.3
A22: Total Super | C22: =SUM(C7:C21) -> 34704997 | D22: =SUM(D7:D21) -> 36000353 | E22: =SUM(E7:E21) -> 33841799 | G22: =SUM(G7:G21) -> 30682664 | H22: =SUM(H7:H21) -> 22183987 | I22: =SUM(I7:I21) -> 17869722 | J22: =SUM(C22:I22) -> 175283522 | K22: =IF(D22=0,0,((D22/C22)*100)-100) -> 3.73 | L22: =IF(D22=0,0,IF(E22=0,0,((D22/E22)*100)-100)) -> 6.38 | M22: =IF(G22=0,0,IF(D22=0,0,((D22/G22)*100)-100)) -> 17.33 | N22: =IF(H22=0,0,IF(D22=0,0,((D22/H22)*100)-100)) -> 62.28 | O22: =IF(D22=0,0,IF(I22=0,0,((D22/I22)*100)-100)) -> 101.46 | Q22: =SUM(Q7:Q21) -> 35205000 | R22: =IF(D22=0,0,((D22/Q22)*100)-100) -> 2.26 | S22: =IF(D22=0,0,(D22/$D$44)*100) -> 35.03 | U22: 17.06 | V22: 16.86 | W22: =V22-U22 -> -0.2
A24: Pinheirinho | C24: 4380000 | D24: 4639533 | E24: 4301190 | G24: 3841933 | H24: 3185164 | I24: 2604622 | K24: =IF(C24=0,0,((D24/C24)*100)-100) -> 5.93 | L24: =IF(D24=0,0,IF(E24=0,0,((D24/E24)*100)-100)) -> 7.87 | M24: =IF(G24=0,0,((D24/G24)*100)-100) -> 20.76 | N24: =IF(H24=0,0,((D24/H24)*100)-100) -> 45.66 | O24: =IF(D24=0,0,IF(I24=0,0,((D24/I24)*100)-100)) -> 78.13 | Q24: 4380000 | R24: =IF(D24=0,0,IF(Q24=0,0,((D24/Q24)*100)-100)) -> 5.93 | S24: =IF(D24=0,0,(D24/$D$44)*100) -> 4.51 | U24: 15.65 | V24: 15.72 | W24: =V24-U24 -> 0.07
A25: Londrina | C25: 3550000 | D25: 3651179 | E25: 3301450 | G25: 3369072 | H25: 2858073 | I25: 2756436 | K25: =IF(C25=0,0,((D25/C25)*100)-100) -> 2.85 | L25: =IF(D25=0,0,IF(E25=0,0,((D25/E25)*100)-100)) -> 10.59 | M25: =IF(G25=0,0,((D25/G25)*100)-100) -> 8.37 | N25: =IF(H25=0,0,((D25/H25)*100)-100) -> 27.75 | O25: =IF(D25=0,0,IF(I25=0,0,((D25/I25)*100)-100)) -> 32.46 | Q25: 3550000 | R25: =IF(D25=0,0,IF(Q25=0,0,((D25/Q25)*100)-100)) -> 2.85 | S25: =IF(D25=0,0,(D25/$D$44)*100) -> 3.55 | U25: 16.9 | V25: 16.39 | W25: =V25-U25 -> -0.51
A26: So Brz | C26: 4900000 | D26: 5089483 | E26: 4720366 | G26: 4307842 | H26: 4125092 | I26: 2888683 | K26: =IF(C26=0,0,((D26/C26)*100)-100) -> 3.87 | L26: =IF(D26=0,0,IF(E26=0,0,((D26/E26)*100)-100)) -> 7.82 | M26: =IF(G26=0,0,((D26/G26)*100)-100) -> 18.14 | N26: =IF(H26=0,0,((D26/H26)*100)-100) -> 23.38 | O26: =IF(D26=0,0,IF(I26=0,0,((D26/I26)*100)-100)) -> 76.19 | Q26: 4900000 | R26: =IF(D26=0,0,IF(Q26=0,0,((D26/Q26)*100)-100)) -> 3.87 | S26: =IF(D26=0,0,(D26/$D$44)*100) -> 4.95 | U26: 15.5 | V26: 15.56 | W26: =V26-U26 -> 0.06
A27: S.J. Pinhais | C27: 5330000 | D27: 5607342 | E27: 5246768 | G27: 4820426 | H27: 4275669 | I27: 3838938 | K27: =IF(C27=0,0,((D27/C27)*100)-100) -> 5.2 | L27: =IF(D27=0,0,IF(E27=0,0,((D27/E27)*100)-100)) -> 6.87 | M27: =IF(G27=0,0,((D27/G27)*100)-100) -> 16.32 | N27: =IF(H27=0,0,((D27/H27)*100)-100) -> 31.15 | O27: =IF(D27=0,0,IF(I27=0,0,((D27/I27)*100)-100)) -> 46.06 | Q27: 5330000 | R27: =IF(D27=0,0,IF(Q27=0,0,((D27/Q27)*100)-100)) -> 5.2 | S27: =IF(D27=0,0,(D27/$D$44)*100) -> 5.46 | U27: 15.8 | V27: 15.73 | W27: =V27-U27 -> -0.07
A28: P.G. Nova | C28: 4500000 | D28: 4786405 | E28: 4331848 | G28: 4372940 | H28: 3817776 | I28: 3354039 | K28: =IF(C28=0,0,((D28/C28)*100)-100) -> 6.36 | L28: =IF(D28=0,0,IF(E28=0,0,((D28/E28)*100)-100)) -> 10.49 | M28: =IF(G28=0,0,((D28/G28)*100)-100) -> 9.46 | N28: =IF(H28=0,0,((D28/H28)*100)-100) -> 25.37 | O28: =IF(D28=0,0,IF(I28=0,0,((D28/I28)*100)-100)) -> 42.71 | Q28: 4500000 | R28: =IF(D28=0,0,IF(Q28=0,0,((D28/Q28)*100)-100)) -> 6.36 | S28: =IF(D28=0,0,(D28/$D$44)*100) -> 4.66 | U28: 16.42 | V28: 15.01 | W28: =V28-U28 -> -1.41
A29: Nilo Pecanha | C29: 11800000 | D29: 12528964 | E29: 11880346 | G29: 10823638 | H29: 9441254 | I29: 8813877 | K29: =IF(C29=0,0,((D29/C29)*100)-100) -> 6.18 | L29: =IF(D29=0,0,IF(E29=0,0,((D29/E29)*100)-100)) -> 5.46 | M29: =IF(G29=0,0,((D29/G29)*100)-100) -> 15.76 | N29: =IF(H29=0,0,((D29/H29)*100)-100) -> 32.7 | O29: =IF(D29=0,0,IF(I29=0,0,((D29/I29)*100)-100)) -> 42.15 | Q29: 11800000 | R29: =IF(D29=0,0,IF(Q29=0,0,((D29/Q29)*100)-100)) -> 6.18 | S29: =IF(D29=0,0,(D29/$D$44)*100) -> 12.19 | U29: 16 | V29: 16.2 | W29: =V29-U29 -> 0.2
A30: Champagnat | C30: 6700000 | D30: 7166576 | E30: 6773377 | G30: 5893625 | H30: 5437226 | I30: 5225812 | K30: =IF(C30=0,0,((D30/C30)*100)-100) -> 6.96 | L30: =IF(D30=0,0,IF(E30=0,0,((D30/E30)*100)-100)) -> 5.81 | M30: =IF(G30=0,0,((D30/G30)*100)-100) -> 21.6 | N30: =IF(H30=0,0,((D30/H30)*100)-100) -> 31.81 | O30: =IF(D30=0,0,IF(I30=0,0,((D30/I30)*100)-100)) -> 37.14 | Q30: 6700000 | R30: =IF(D30=0,0,IF(Q30=0,0,((D30/Q30)*100)-100)) -> 6.96 | S30: =IF(D30=0,0,(D30/$D$44)*100) -> 6.97 | U30: 16.5 | V30: 16.75 | W30: =V30-U30 -> 0.25
A31: Santa Candida | C31: 6100000 | D31: 6512665 | E31: 6178314 | G31: 5190184 | H31: 4469035 | I31: 3888124 | K31: =IF(C31=0,0,((D31/C31)*100)-100) -> 6.77 | L31: =IF(D31=0,0,IF(E31=0,0,((D31/E31)*100)-100)) -> 5.41 | M31: =IF(G31=0,0,((D31/G31)*100)-100) -> 25.48 | N31: =IF(H31=0,0,((D31/H31)*100)-100) -> 45.73 | O31: =IF(D31=0,0,IF(I31=0,0,((D31/I31)*100)-100)) -> 67.5 | Q31: 6100000 | R31: =IF(D31=0,0,IF(Q31=0,0,((D31/Q31)*100)-100)) -> 6.77 | S31: =IF(D31=0,0,(D31/$D$44)*100) -> 6.34 | U31: 15.6 | V31: 16.23 | W31: =V31-U31 -> 0.63
A32: Paranagu Raia | C32: 6400000 | D32: 6909272 | E32: 6213556 | G32: 5796190 | H32: 5050580 | I32: 4312512 | K32: =IF(C32=0,0,((D32/C32)*100)-100) -> 7.96 | L32: =IF(D32=0,0,IF(E32=0,0,((D32/E32)*100)-100)) -> 11.2 | M32: =IF(G32=0,0,((D32/G32)*100)-100) -> 19.2 | N32: =IF(H32=0,0,((D32/H32)*100)-100) -> 36.8 | O32: =IF(D32=0,0,IF(I32=0,0,((D32/I32)*100)-100)) -> 60.21 | Q32: 6400000 | R32: =IF(D32=0,0,IF(Q32=0,0,((D32/Q32)*100)-100)) -> 7.96 | S32: =IF(D32=0,0,(D32/$D$44)*100) -> 6.72 | U32: 18.5 | V32: 17.82 | W32: =V32-U32 -> -0.68
A33: Torres | C33: 5200000 | D33: 5054367 | E33: 4611017 | G33: 0 | H33: 0 | I33: 0 | K33: =IF(C33=0,0,((D33/C33)*100)-100) -> -2.8 | L33: =IF(D33=0,0,IF(E33=0,0,((D33/E33)*100)-100)) -> 9.62 | M33: =IF(G33=0,0,((D33/G33)*100)-100) -> 0 | N33: =IF(H33=0,0,((D33/H33)*100)-100) -> 0 | O33: =IF(D33=0,0,IF(I33=0,0,((D33/I33)*100)-100)) -> 0 | Q33: 5200000 | R33: =IF(D33=0,0,IF(Q33=0,0,((D33/Q33)*100)-100)) -> -2.8 | S33: =IF(D33=0,0,(D33/$D$44)*100) -> 4.92 | U33: 16 | V33: 15.31 | W33: =V33-U33 -> -0.69
A34: Total Hiper | C34: =SUM(C24:C33) -> 58860000 | D34: =SUM(D24:D33) -> 61945786 | E34: =SUM(E24:E33) -> 57558232 | G34: =SUM(G24:G33) -> 48415850 | H34: =SUM(H24:H33) -> 42659869 | I34: =SUM(I24:I33) -> 37683043 | J34: =SUM(C34:I34) -> 307122780 | K34: =IF(D34=0,0,((D34/C34)*100)-100) -> 5.24 | L34: =IF(D34=0,0,IF(E34=0,0,((D34/E34)*100)-100)) -> 7.62 | M34: =IF(G34=0,0,IF(D34=0,0,((D34/G34)*100)-100)) -> 27.95 | N34: =IF(H34=0,0,IF(D34=0,0,((D34/H34)*100)-100)) -> 45.21 | O34: =IF(D34=0,0,IF(I34=0,0,((D34/I34)*100)-100)) -> 64.39 | Q34: =SUM(Q24:Q33) -> 58860000 | R34: =IF(D34=0,0,((D34/Q34)*100)-100) -> 5.24 | S34: =IF(D34=0,0,(D34/$D$44)*100) -> 60.28 | U34: 16.29 | V34: 16.16 | W34: =V34-U34 -> -0.13
A36: Total s/ 27, 32 | B36: =B22+B34 -> 0 | C36: =C22+C34 -> 93564997 | D36: =D22+D34 -> 97946139 | E36: =E22+E34 -> 91400031 | F36: =F22+F34 -> 0 | G36: =G22+G34 -> 79098514 | H36: =H22+H34 -> 64843856 | I36: =I22+I34 -> 55552765 | J36: =SUM(C36:I36) -> 482406302 | K36: =IF(D36=0,0,((D36/C36)*100)-100) -> 4.68 | L36: =IF(D36=0,0,IF(E36=0,0,((D36/E36)*100)-100)) -> 7.16 | M36: =IF(G36=0,0,IF(D36=0,0,((D36/G36)*100)-100)) -> 23.83 | N36: =IF(H36=0,0,IF(D36=0,0,((D36/H36)*100)-100)) -> 51.05 | O36: =IF(D36=0,0,IF(I36=0,0,((D36/I36)*100)-100)) -> 76.31 | Q36: =Q22+Q34 -> 94065000 | R36: =IF(D36=0,0,((D36/Q36)*100)-100) -> 4.13 | S36: =IF(D36=0,0,(D36/$D$44)*100) -> 95.31 | U36: 16.58 | V36: 16.42 | W36: =V36-U36 -> -0.16
A38: Campo Largo | C38: 0 | D38: 0 | E38: 0 | G38: 0 | H38: 0 | I38: 0 | K38: =IF(C38=0,0,((D38/C38)*100)-100) -> 0 | L38: =IF(D38=0,0,IF(E38=0,0,((D38/E38)*100)-100)) -> 0 | M38: =IF(G38=0,0,((D38/G38)*100)-100) -> 0 | N38: =IF(H38=0,0,((D38/H38)*100)-100) -> 0 | O38: =IF(D38=0,0,IF(I38=0,0,((D38/I38)*100)-100)) -> 0 | Q38: 0 | R38: =IF(Q38=0,0,IF(D38=0,0,((D38/Q38)*100)-100)) -> 0 | S38: =IF(D38=0,0,(D38/$D$44)*100) -> 0 | U38: 0 | V38: 0 | W38: =V38-U38 -> 0
A39: Uvaranas | C39: 4800000 | D39: 4816167 | E39: 4204028 | G39: 0 | H39: 0 | I39: 0 | K39: =IF(C39=0,0,((D39/C39)*100)-100) -> 0.34 | L39: =IF(D39=0,0,IF(E39=0,0,((D39/E39)*100)-100)) -> 14.56 | M39: =IF(G39=0,0,((D39/G39)*100)-100) -> 0 | N39: =IF(H39=0,0,((D39/H39)*100)-100) -> 0 | O39: =IF(D39=0,0,IF(I39=0,0,((D39/I39)*100)-100)) -> 0 | Q39: 4800000 | R39: =IF(Q39=0,0,IF(D39=0,0,((D39/Q39)*100)-100)) -> 0.34 | S39: =IF(D39=0,0,(D39/$D$44)*100) -> 4.69 | U39: 15.2 | V39: 14.53 | W39: =V39-U39 -> -0.67
A40: Novo Mundo | C40: 0 | D40: 0 | E40: 0 | G40: 0 | H40: 0 | I40: 0 | K40: =IF(C40=0,0,((D40/C40)*100)-100) -> 0 | L40: =IF(D40=0,0,IF(E40=0,0,((D40/E40)*100)-100)) -> 0 | M40: =IF(G40=0,0,((D40/G40)*100)-100) -> 0 | N40: =IF(H40=0,0,((D40/H40)*100)-100) -> 0 | O40: =IF(D40=0,0,IF(I40=0,0,((D40/I40)*100)-100)) -> 0 | Q40: 0 | R40: =IF(Q40=0,0,IF(D40=0,0,((D40/Q40)*100)-100)) -> 0 | S40: =IF(D40=0,0,(D40/$D$44)*100) -> 0 | U40: 0 | V40: 0 | W40: =V40-U40 -> 0
A41: Torres | C41: 0 | D41: 0 | E41: 0 | G41: 0 | H41: 0 | I41: 0 | K41: =IF(C41=0,0,((D41/C41)*100)-100) -> 0 | L41: =IF(D41=0,0,IF(E41=0,0,((D41/E41)*100)-100)) -> 0 | M41: =IF(G41=0,0,((D41/G41)*100)-100) -> 0 | N41: =IF(H41=0,0,((D41/H41)*100)-100) -> 0 | O41: =IF(D41=0,0,IF(I41=0,0,((D41/I41)*100)-100)) -> 0 | Q41: 0 | R41: =IF(Q41=0,0,IF(D41=0,0,((D41/Q41)*100)-100)) -> 0 | S41: =IF(D41=0,0,(D41/$D$44)*100) -> 0 | U41: 0 | V41: 0 | W41: =V41-U41 -> 0
A42: Total Lojas Novas | C42: =SUM(C38:C41) -> 4800000 | D42: =SUM(D38:D41) -> 4816167 | E42: =SUM(E38:E41) -> 4204028 | G42: =SUM(G38:G41) -> 0 | H42: =SUM(H38:H41) -> 0 | I42: =SUM(I38:I41) -> 0 | K42: =IF(D42=0,0,((D42/C42)*100)-100) -> 0.34 | L42: =IF(D42=0,0,IF(E42=0,0,((D42/E42)*100)-100)) -> 14.56 | M42: =IF(G42=0,0,IF(D42=0,0,((D42/G42)*100)-100)) -> 0 | N42: =IF(H42=0,0,IF(D42=0,0,((D42/H42)*100)-100)) -> 0 | O42: =IF(D42=0,0,IF(I42=0,0,((D42/I42)*100)-100)) -> 0 | Q42: =SUM(Q38:Q41) -> 4800000 | R42: =IF(Q42=0,0,IF(D42=0,0,((D42/Q42)*100)-100)) -> 0.34 | S42: =IF(D42=0,0,(D42/$D$44)*100) -> 4.69
A44: Total Geral | C44: =C22+C34+C42 -> 98364997 | D44: =D22+D34+D42 -> 102762306 | E44: =E22+E34+E42 -> 95604059 | G44: =G22+G34+G42 -> 79098514 | H44: =H22+H34+H42 -> 64843856 | I44: =I22+I34+I42 -> 55552765 | K44: =IF(D44=0,0,((D44/C44)*100)-100) -> 4.47 | L44: =IF(D44=0,0,IF(E44=0,0,((D44/E44)*100)-100)) -> 7.49 | M44: =IF(G44=0,0,IF(D44=0,0,((D44/G44)*100)-100)) -> 29.92 | N44: =IF(H44=0,0,IF(D44=0,0,((D44/H44)*100)-100)) -> 58.48 | O44: =IF(D44=0,0,IF(I44=0,0,((D44/I44)*100)-100)) -> 84.98 | Q44: =Q22+Q34+Q42 -> 98865000 | R44: =IF(D44=0,0,((D44/Q44)*100)-100) -> 3.94 | S44: =S22+S34+S42 -> 100 | U44: 16.51 | V44: 16.33 | W44: =V44-U44 -> -0.18
C45: Resumo por Regiao - Outubro/2002
C46: Descricao das Aberturas | H46: Valor | I46: % | M46: Margem Comercial | R46: Meta | S46: Real | U46: Dif
C47: Curitiba (3,6,7,10,11,13,17,21,22,24,26,27,28,34) | H47: 54832231 | I47: =IF(D44=0,0,H47/$D$44) -> 0.53359999999999996 | L47: 99 | M47: Empresa | R47: 16.52 | S47: 16.32 | U47: =S47-R47 -> -0.2
C48: Curitiba e Metrop. (Ctba. 4,5,8,14,23,25;31) | H48: 75405562 | I48: =IF(D44=0,0,H48/$D$44) -> 0.73380000000000001 | L48: 207 | M48: Super | R48: 17.09 | S48: 16.84 | U48: =S48-R48 -> -0.25
C49: Metropolitana (4,5,8,14,23,25;31) | H49: 20573331 | I49: =IF(D44=0,0,H49/$D$44) -> 0.20019999999999999 | L49: 208 | M49: Hiper | R49: 16.2 | S49: 16.03 | U49: =S49-R49 -> -0.17
C50: Norte (9,15,20) | H50: =D25+D15+D18 -> 8963879 | I50: =IF(D44=0,0,H50/$D$44) -> 8.72E-2 | L50: 204 | M50: Regional Gilberto | R50: 16.28 | S50: 16.07 | U50: =S50-R50 -> -0.21
C51: Ponta Grossa (18,19,32) | H51: =D17+D28+D39 -> 12522449 | I51: =IF(D44=0,0,H51/$D$44) -> 0.12189999999999999 | L51: 205 | M51: Regional Edison | R51: 16.85 | S51: 16.55 | U51: =S51-R51 -> -0.3
C52: Super (3,4,5,7,8,10,13,15,17,18,20,23,26,28,34) | H52: 36000353 | I52: =IF(D44=0,0,H52/$D$44) -> 0.3503 | L52: 206 | M52: Regional Jorge | R52: 17.35 | S52: 17 | U52: =S52-R52 -> -0.35
C53: Hiper (6,9,11,14,19,21,22,24,25,26,27) | H53: 61945786 | I53: =IF(D44=0,0,H53/$D$44) -> 0.6028 | L53: 209 | M53: Regio - Curitiba | R53: 17.35 | S53: 16.21 | U53: =S53-R53 -> -1.14
C54: Curitiba, Metropolitana e Ponta Grossa | H54: =D44-H50 -> 93798427 | I54: =IF(D44=0,0,H54/$D$44) -> 0.91279999999999994 | L54: 200 | M54: Regio - Metropolitana | R54: 16 | S54: 16.84 | U54: =S54-R54 -> 0.84
C55: Araucaria | H55: =D9+D19 -> 3411645 | I55: =IF(D44=0,0,H55/$D$44) -> 3.32E-2 | L55: 201 | M55: Regio - Centro Oeste | R55: 16.17 | S55: 15.15 | U55: =S55-R55 -> -1.02