A2: Periodo: | C2: 39845 | D2: a | E2: 28/02/2009 | H2: Vendas Acumuladas por Filial | Q2: =NOW() -> 39873.309017939799
A4: v.1 | C4: Vendas 2009 | G4: Vendas de Anos Anteriores | K4: Percentuais ( % ) | Q4: Meta Mensal | U4: Margem
A5: Lojas | C5: Previsao | D5: Realizada | E5: Mes Anterior | G5: Vendas 2008 | H5: Vendas 2007 | I5: Vendas 2006 | K5: % Prev | L5: % MA | M5: 2008 | N5: 2007 | O5: 2006 | Q5: Previsao Mes | R5: Final | S5: Part. | U5: Meta | V5: Coml | W5: Dif
A7: S. Felicidade | C7: 2300000 | D7: 2407705 | E7: 2472374 | G7: 2150419 | H7: 743404 | I7: 706305 | K7: =IF(C7=0,0,((D7/C7)*100)-100) -> 4.68 | L7: =IF(D7=0,0,IF(E7=0,0,((D7/E7)*100)-100)) -> -2.62 | M7: =IF(G7=0,0,((D7/G7)*100)-100) -> 11.96 | N7: =IF(H7=0,0,((D7/H7)*100)-100) -> 223.88 | O7: =IF(D7=0,0,IF(I7=0,0,((D7/I7)*100)-100)) -> 240.89 | Q7: 2350000 | R7: =IF(D7=0,0,((D7/Q7)*100)-100) -> 2.46 | S7: =IF(D7=0,0,(D7/$D$44)*100) -> 2.8 | U7: 17.5 | V7: 0 | W7: =V7-U7 -> -17.5
A8: Lapa | C8: 1820000 | D8: 2018978 | E8: 2076477 | G8: 1618105 | H8: 1171248 | I8: 1173718 | K8: =IF(C8=0,0,((D8/C8)*100)-100) -> 10.93 | L8: =IF(D8=0,0,IF(E8=0,0,((D8/E8)*100)-100)) -> -2.77 | M8: =IF(G8=0,0,((D8/G8)*100)-100) -> 24.77 | N8: =IF(H8=0,0,((D8/H8)*100)-100) -> 72.38 | O8: =IF(D8=0,0,IF(I8=0,0,((D8/I8)*100)-100)) -> 72.02 | Q8: 1900000 | R8: =IF(D8=0,0,((D8/Q8)*100)-100) -> 6.26 | S8: =IF(D8=0,0,(D8/$D$44)*100) -> 2.34 | U8: 15.74 | V8: 0 | W8: =V8-U8 -> -15.74
A9: Araucaria | C9: 1099800 | D9: 1215689 | E9: 1258742 | G9: 1016015 | H9: 871634 | I9: 921061 | K9: =IF(C9=0,0,((D9/C9)*100)-100) -> 10.54 | L9: =IF(D9=0,0,IF(E9=0,0,((D9/E9)*100)-100)) -> -3.42 | M9: =IF(G9=0,0,((D9/G9)*100)-100) -> 19.65 | N9: =IF(H9=0,0,((D9/H9)*100)-100) -> 39.47 | O9: =IF(D9=0,0,IF(I9=0,0,((D9/I9)*100)-100)) -> 31.99 | Q9: 1150000 | R9: =IF(D9=0,0,((D9/Q9)*100)-100) -> 5.71 | S9: =IF(D9=0,0,(D9/$D$44)*100) -> 1.41 | U9: 17.4 | V9: 0 | W9: =V9-U9 -> -17.4
A10: Hauer | C10: 3520000 | D10: 3312952 | E10: 3451415 | G10: 3217301 | H10: 2699868 | I10: 2898708 | K10: =IF(C10=0,0,((D10/C10)*100)-100) -> -5.88 | L10: =IF(D10=0,0,IF(E10=0,0,((D10/E10)*100)-100)) -> -4.01 | M10: =IF(G10=0,0,((D10/G10)*100)-100) -> 2.97 | N10: =IF(H10=0,0,((D10/H10)*100)-100) -> 22.71 | O10: =IF(D10=0,0,IF(I10=0,0,((D10/I10)*100)-100)) -> 14.29 | Q10: 3350000 | R10: =IF(D10=0,0,((D10/Q10)*100)-100) -> -1.11 | S10: =IF(D10=0,0,(D10/$D$44)*100) -> 3.85 | U10: 16.3 | V10: 0 | W10: =V10-U10 -> -16.3
A11: Paranagua | C11: 1850000 | D11: 1767174 | E11: 1776573 | G11: 1725689 | H11: 1500528 | I11: 1446960 | K11: =IF(C11=0,0,((D11/C11)*100)-100) -> -4.48 | L11: =IF(D11=0,0,IF(E11=0,0,((D11/E11)*100)-100)) -> -0.53 | M11: =IF(G11=0,0,((D11/G11)*100)-100) -> 2.4 | N11: =IF(H11=0,0,((D11/H11)*100)-100) -> 17.77 | O11: =IF(D11=0,0,IF(I11=0,0,((D11/I11)*100)-100)) -> 22.13 | Q11: 1800000 | R11: =IF(D11=0,0,((D11/Q11)*100)-100) -> -1.82 | S11: =IF(D11=0,0,(D11/$D$44)*100) -> 2.05 | U11: 18.5 | V11: 0 | W11: =V11-U11 -> -18.5
A12: Centenario | C12: 1175000 | D12: 1145767 | E12: 1216248 | G12: 1055031 | H12: 863291 | I12: 853919 | K12: =IF(C12=0,0,((D12/C12)*100)-100) -> -2.49 | L12: =IF(D12=0,0,IF(E12=0,0,((D12/E12)*100)-100)) -> -5.79 | M12: =IF(G12=0,0,((D12/G12)*100)-100) -> 8.6 | N12: =IF(H12=0,0,((D12/H12)*100)-100) -> 32.72 | O12: =IF(D12=0,0,IF(I12=0,0,((D12/I12)*100)-100)) -> 34.18 | Q12: 1175000 | R12: =IF(D12=0,0,((D12/Q12)*100)-100) -> -2.49 | S12: =IF(D12=0,0,(D12/$D$44)*100) -> 1.33 | U12: 16.9 | V12: 0 | W12: =V12-U12 -> -16.9
A13: Sitio Cercado | C13: 1950000 | D13: 2019603 | E13: 2043911 | G13: 1681550 | H13: 1187345 | I13: 1216792 | K13: =IF(C13=0,0,((D13/C13)*100)-100) -> 3.57 | L13: =IF(D13=0,0,IF(E13=0,0,((D13/E13)*100)-100)) -> -1.19 | M13: =IF(G13=0,0,((D13/G13)*100)-100) -> 20.1 | N13: =IF(H13=0,0,((D13/H13)*100)-100) -> 70.09 | O13: =IF(D13=0,0,IF(I13=0,0,((D13/I13)*100)-100)) -> 65.98 | Q13: 1935000 | R13: =IF(D13=0,0,((D13/Q13)*100)-100) -> 4.37 | S13: =IF(D13=0,0,(D13/$D$44)*100) -> 2.35 | U13: 16.52 | V13: 0 | W13: =V13-U13 -> -16.52
A14: Apucarana | C14: 2390000 | D14: 2398097 | E14: 2474780 | G14: 2288876 | H14: 1872882 | I14: 1817653 | K14: =IF(C14=0,0,((D14/C14)*100)-100) -> 0.34 | L14: =IF(D14=0,0,IF(E14=0,0,((D14/E14)*100)-100)) -> -3.1 | M14: =IF(G14=0,0,((D14/G14)*100)-100) -> 4.77 | N14: =IF(H14=0,0,((D14/H14)*100)-100) -> 28.04 | O14: =IF(D14=0,0,IF(I14=0,0,((D14/I14)*100)-100)) -> 31.93 | Q14: 2550000 | R14: =IF(D14=0,0,((D14/Q14)*100)-100) -> -5.96 | S14: =IF(D14=0,0,(D14/$D$44)*100) -> 2.78 | U14: 17 | V14: 0 | W14: =V14-U14 -> -17
A15: Ah | C15: 1650000 | D15: 1487361 | E15: 1477101 | G15: 1489212 | H15: 1012666 | I15: 1047721 | K15: =IF(C15=0,0,((D15/C15)*100)-100) -> -9.86 | L15: =IF(D15=0,0,IF(E15=0,0,((D15/E15)*100)-100)) -> 0.69 | M15: =IF(G15=0,0,((D15/G15)*100)-100) -> -0.12 | N15: =IF(H15=0,0,((D15/H15)*100)-100) -> 46.88 | O15: =IF(D15=0,0,IF(I15=0,0,((D15/I15)*100)-100)) -> 41.96 | Q15: 1520000 | R15: =IF(D15=0,0,((D15/Q15)*100)-100) -> -2.15 | S15: =IF(D15=0,0,(D15/$D$44)*100) -> 1.73 | U15: 18.2 | V15: 0 | W15: =V15-U15 -> -18.2
A16: P.G. Centro | C16: 1950000 | D16: 1897226 | E16: 2079805 | G16: 1828635 | H16: 1461658 | I16: 1496126 | K16: =IF(C16=0,0,((D16/C16)*100)-100) -> -2.71 | L16: =IF(D16=0,0,IF(E16=0,0,((D16/E16)*100)-100)) -> -8.78 | M16: =IF(G16=0,0,((D16/G16)*100)-100) -> 3.75 | N16: =IF(H16=0,0,((D16/H16)*100)-100) -> 29.8 | O16: =IF(D16=0,0,IF(I16=0,0,((D16/I16)*100)-100)) -> 26.81 | Q16: 1960000 | R16: =IF(D16=0,0,((D16/Q16)*100)-100) -> -3.2 | S16: =IF(D16=0,0,(D16/$D$44)*100) -> 2.2 | U16: 18.55 | V16: 0 | W16: =V16-U16 -> -18.55
A17: Maringa | C17: 3050000 | D17: 2667295 | E17: 2771932 | G17: 2674299 | H17: 1982114 | I17: 2111535 | K17: =IF(C17=0,0,((D17/C17)*100)-100) -> -12.55 | L17: =IF(D17=0,0,IF(E17=0,0,((D17/E17)*100)-100)) -> -3.77 | M17: =IF(G17=0,0,((D17/G17)*100)-100) -> -0.26 | N17: =IF(H17=0,0,((D17/H17)*100)-100) -> 34.57 | O17: =IF(D17=0,0,IF(I17=0,0,((D17/I17)*100)-100)) -> 26.32 | Q17: 3000000 | R17: =IF(D17=0,0,((D17/Q17)*100)-100) -> -11.09 | S17: =IF(D17=0,0,(D17/$D$44)*100) -> 3.1 | U17: 17.88 | V17: 0 | W17: =V17-U17 -> -17.88
A18: Araucaria Nova | C18: 2820000 | D18: 3411624 | E18: 3412251 | G18: 2699626 | H18: 1967009 | I18: 1968842 | K18: =IF(C18=0,0,((D18/C18)*100)-100) -> 20.98 | L18: =IF(D18=0,0,IF(E18=0,0,((D18/E18)*100)-100)) -> -0.02 | M18: =IF(G18=0,0,((D18/G18)*100)-100) -> 26.37 | N18: =IF(H18=0,0,((D18/H18)*100)-100) -> 73.44 | O18: =IF(D18=0,0,IF(I18=0,0,((D18/I18)*100)-100)) -> 73.28 | Q18: 2950000 | R18: =IF(D18=0,0,((D18/Q18)*100)-100) -> 15.65 | S18: =IF(D18=0,0,(D18/$D$44)*100) -> 3.96 | U18: 15.8 | V18: 0 | W18: =V18-U18 -> -15.8
A19: Cristo Rei | C19: 1570000 | D19: 1657889 | E19: 1544135 | G19: 1406064 | H19: 1139920 | I19: 0 | K19: =IF(C19=0,0,((D19/C19)*100)-100) -> 5.6 | L19: =IF(D19=0,0,IF(E19=0,0,((D19/E19)*100)-100)) -> 7.37 | M19: =IF(G19=0,0,((D19/G19)*100)-100) -> 17.91 | N19: =IF(H19=0,0,((D19/H19)*100)-100) -> 45.44 | O19: =IF(D19=0,0,IF(I19=0,0,((D19/I19)*100)-100)) -> 0 | Q19: 1620000 | R19: =IF(D19=0,0,((D19/Q19)*100)-100) -> 2.34 | S19: =IF(D19=0,0,(D19/$D$44)*100) -> 1.93 | U19: 18.25 | V19: 0 | W19: =V19-U19 -> -18.25
A20: Campo Largo | C20: 2300000 | D20: 2533789 | E20: 2519617 | G20: 0 | H20: 0 | I20: 0 | K20: =IF(C20=0,0,((D20/C20)*100)-100) -> 10.16 | L20: =IF(D20=0,0,IF(E20=0,0,((D20/E20)*100)-100)) -> 0.56 | M20: =IF(G20=0,0,((D20/G20)*100)-100) -> 0 | N20: =IF(H20=0,0,((D20/H20)*100)-100) -> 0 | O20: =IF(D20=0,0,IF(I20=0,0,((D20/I20)*100)-100)) -> 0 | Q20: 2350000 | R20: =IF(D20=0,0,((D20/Q20)*100)-100) -> 7.82 | S20: =IF(D20=0,0,(D20/$D$44)*100) -> 2.94 | U20: 17.5 | V20: 0 | W20: =V20-U20 -> -17.5
A21: Brasilia | C21: 2300000 | D21: 2228824 | E21: 2205514 | G21: 886092 | H21: 708986 | I21: 673502 | K21: =IF(C21=0,0,((D21/C21)*100)-100) -> -3.09 | L21: =IF(D21=0,0,IF(E21=0,0,((D21/E21)*100)-100)) -> 1.06 | M21: =IF(G21=0,0,((D21/G21)*100)-100) -> 151.53 | N21: =IF(H21=0,0,((D21/H21)*100)-100) -> 214.37 | O21: =IF(D21=0,0,IF(I21=0,0,((D21/I21)*100)-100)) -> 230.93 | Q21: 2150000 | R21: =IF(D21=0,0,((D21/Q21)*100)-100) -> 3.67 | S21: =IF(D21=0,0,(D21/$D$44)*100) -> 2.59 | U21: 16.8 | V21: 0 | W21: =V21-U21 -> -16.8
A22: Total Super | C22: =SUM(C7:C21) -> 31744800 | D22: =SUM(D7:D21) -> 32169973 | E22: =SUM(E7:E21) -> 32780875 | G22: =SUM(G7:G21) -> 25736914 | H22: =SUM(H7:H21) -> 19182553 | I22: =SUM(I7:I21) -> 18332842 | J22: =SUM(C22:I22) -> 159947957 | K22: =IF(D22=0,0,((D22/C22)*100)-100) -> 1.34 | L22: =IF(D22=0,0,IF(E22=0,0,((D22/E22)*100)-100)) -> -1.86 | M22: =IF(G22=0,0,IF(D22=0,0,((D22/G22)*100)-100)) -> 25 | N22: =IF(H22=0,0,IF(D22=0,0,((D22/H22)*100)-100)) -> 67.7 | O22: =IF(D22=0,0,IF(I22=0,0,((D22/I22)*100)-100)) -> 75.48 | Q22: =SUM(Q7:Q21) -> 31760000 | R22: =IF(D22=0,0,((D22/Q22)*100)-100) -> 1.29 | S22: =IF(D22=0,0,(D22/$D$44)*100) -> 37.36 | U22: 17.17 | V22: 0 | W22: =V22-U22 -> -17.17
A24: Pinheirinho | C24: 4000000 | D24: 3991772 | E24: 4339990 | G24: 3731496 | H24: 2637182 | I24: 1776930 | K24: =IF(C24=0,0,((D24/C24)*100)-100) -> -0.21 | L24: =IF(D24=0,0,IF(E24=0,0,((D24/E24)*100)-100)) -> -8.02 | M24: =IF(G24=0,0,((D24/G24)*100)-100) -> 6.98 | N24: =IF(H24=0,0,((D24/H24)*100)-100) -> 51.37 | O24: =IF(D24=0,0,IF(I24=0,0,((D24/I24)*100)-100)) -> 124.64 | Q24: 4050000 | R24: =IF(D24=0,0,IF(Q24=0,0,((D24/Q24)*100)-100)) -> -1.44 | S24: =IF(D24=0,0,(D24/$D$44)*100) -> 4.64 | U24: 15.45 | V24: 0 | W24: =V24-U24 -> -15.45
A25: Londrina | C25: 3400000 | D25: 3120674 | E25: 3459874 | G25: 3055569 | H25: 2546916 | I25: 2735504 | K25: =IF(C25=0,0,((D25/C25)*100)-100) -> -8.22 | L25: =IF(D25=0,0,IF(E25=0,0,((D25/E25)*100)-100)) -> -9.8 | M25: =IF(G25=0,0,((D25/G25)*100)-100) -> 2.13 | N25: =IF(H25=0,0,((D25/H25)*100)-100) -> 22.53 | O25: =IF(D25=0,0,IF(I25=0,0,((D25/I25)*100)-100)) -> 14.08 | Q25: 3300000 | R25: =IF(D25=0,0,IF(Q25=0,0,((D25/Q25)*100)-100)) -> -5.43 | S25: =IF(D25=0,0,(D25/$D$44)*100) -> 3.62 | U25: 16.91 | V25: 0 | W25: =V25-U25 -> -16.91
A26: So Brz | C26: 4500000 | D26: 4498860 | E26: 4691597 | G26: 4268056 | H26: 2789700 | I26: 2919802 | K26: =IF(C26=0,0,((D26/C26)*100)-100) -> -0.03 | L26: =IF(D26=0,0,IF(E26=0,0,((D26/E26)*100)-100)) -> -4.11 | M26: =IF(G26=0,0,((D26/G26)*100)-100) -> 5.41 | N26: =IF(H26=0,0,((D26/H26)*100)-100) -> 61.27 | O26: =IF(D26=0,0,IF(I26=0,0,((D26/I26)*100)-100)) -> 54.08 | Q26: 4500000 | R26: =IF(D26=0,0,IF(Q26=0,0,((D26/Q26)*100)-100)) -> -0.03 | S26: =IF(D26=0,0,(D26/$D$44)*100) -> 5.22 | U26: 15.84 | V26: 0 | W26: =V26-U26 -> -15.84
A27: S.J. Pinhais | C27: 5100000 | D27: 4954894 | E27: 5289680 | G27: 4569884 | H27: 3498588 | I27: 3814272 | K27: =IF(C27=0,0,((D27/C27)*100)-100) -> -2.85 | L27: =IF(D27=0,0,IF(E27=0,0,((D27/E27)*100)-100)) -> -6.33 | M27: =IF(G27=0,0,((D27/G27)*100)-100) -> 8.42 | N27: =IF(H27=0,0,((D27/H27)*100)-100) -> 41.63 | O27: =IF(D27=0,0,IF(I27=0,0,((D27/I27)*100)-100)) -> 29.9 | Q27: 4850000 | R27: =IF(D27=0,0,IF(Q27=0,0,((D27/Q27)*100)-100)) -> 2.16 | S27: =IF(D27=0,0,(D27/$D$44)*100) -> 5.75 | U27: 16.2 | V27: 0 | W27: =V27-U27 -> -16.2
A28: P.G. Nova | C28: 4800000 | D28: 4893667 | E28: 5234242 | G28: 4245536 | H28: 3279872 | I28: 3321449 | K28: =IF(C28=0,0,((D28/C28)*100)-100) -> 1.95 | L28: =IF(D28=0,0,IF(E28=0,0,((D28/E28)*100)-100)) -> -6.51 | M28: =IF(G28=0,0,((D28/G28)*100)-100) -> 15.27 | N28: =IF(H28=0,0,((D28/H28)*100)-100) -> 49.2 | O28: =IF(D28=0,0,IF(I28=0,0,((D28/I28)*100)-100)) -> 47.34 | Q28: 4700000 | R28: =IF(D28=0,0,IF(Q28=0,0,((D28/Q28)*100)-100)) -> 4.12 | S28: =IF(D28=0,0,(D28/$D$44)*100) -> 5.68 | U28: 16.3 | V28: 0 | W28: =V28-U28 -> -16.3
A29: Nilo Pecanha | C29: 10600000 | D29: 10687236 | E29: 10949009 | G29: 9877156 | H29: 8256958 | I29: 8314379 | K29: =IF(C29=0,0,((D29/C29)*100)-100) -> 0.82 | L29: =IF(D29=0,0,IF(E29=0,0,((D29/E29)*100)-100)) -> -2.39 | M29: =IF(G29=0,0,((D29/G29)*100)-100) -> 8.2 | N29: =IF(H29=0,0,((D29/H29)*100)-100) -> 29.43 | O29: =IF(D29=0,0,IF(I29=0,0,((D29/I29)*100)-100)) -> 28.54 | Q29: 10600000 | R29: =IF(D29=0,0,IF(Q29=0,0,((D29/Q29)*100)-100)) -> 0.82 | S29: =IF(D29=0,0,(D29/$D$44)*100) -> 12.41 | U29: 16.3 | V29: 0 | W29: =V29-U29 -> -16.3
A30: Champagnat | C30: 6000000 | D30: 6072735 | E30: 6012636 | G30: 5649229 | H30: 4652840 | I30: 4965267 | K30: =IF(C30=0,0,((D30/C30)*100)-100) -> 1.21 | L30: =IF(D30=0,0,IF(E30=0,0,((D30/E30)*100)-100)) -> 1 | M30: =IF(G30=0,0,((D30/G30)*100)-100) -> 7.5 | N30: =IF(H30=0,0,((D30/H30)*100)-100) -> 30.52 | O30: =IF(D30=0,0,IF(I30=0,0,((D30/I30)*100)-100)) -> 22.3 | Q30: 6100000 | R30: =IF(D30=0,0,IF(Q30=0,0,((D30/Q30)*100)-100)) -> -0.45 | S30: =IF(D30=0,0,(D30/$D$44)*100) -> 7.05 | U30: 16.5 | V30: 0 | W30: =V30-U30 -> -16.5
A31: Santa Candida | C31: 5670000 | D31: 5553451 | E31: 5892671 | G31: 4859461 | H31: 3632785 | I31: 4087571 | K31: =IF(C31=0,0,((D31/C31)*100)-100) -> -2.06 | L31: =IF(D31=0,0,IF(E31=0,0,((D31/E31)*100)-100)) -> -5.76 | M31: =IF(G31=0,0,((D31/G31)*100)-100) -> 14.28 | N31: =IF(H31=0,0,((D31/H31)*100)-100) -> 52.87 | O31: =IF(D31=0,0,IF(I31=0,0,((D31/I31)*100)-100)) -> 35.86 | Q31: 5670000 | R31: =IF(D31=0,0,IF(Q31=0,0,((D31/Q31)*100)-100)) -> -2.06 | S31: =IF(D31=0,0,(D31/$D$44)*100) -> 6.45 | U31: 16.34 | V31: 0 | W31: =V31-U31 -> -16.34
A32: Paranagu Raia | C32: 6200000 | D32: 5977948 | E32: 6236806 | G32: 5440354 | H32: 4365705 | I32: 4259365 | K32: =IF(C32=0,0,((D32/C32)*100)-100) -> -3.58 | L32: =IF(D32=0,0,IF(E32=0,0,((D32/E32)*100)-100)) -> -4.15 | M32: =IF(G32=0,0,((D32/G32)*100)-100) -> 9.88 | N32: =IF(H32=0,0,((D32/H32)*100)-100) -> 36.93 | O32: =IF(D32=0,0,IF(I32=0,0,((D32/I32)*100)-100)) -> 40.35 | Q32: 6100000 | R32: =IF(D32=0,0,IF(Q32=0,0,((D32/Q32)*100)-100)) -> -2 | S32: =IF(D32=0,0,(D32/$D$44)*100) -> 6.94 | U32: 18.6 | V32: 0 | W32: =V32-U32 -> -18.6
A33: Torres | C33: 5000000 | D33: 4195715 | E33: 4524688 | G33: 0 | H33: 0 | I33: 0 | K33: =IF(C33=0,0,((D33/C33)*100)-100) -> -16.09 | L33: =IF(D33=0,0,IF(E33=0,0,((D33/E33)*100)-100)) -> -7.27 | M33: =IF(G33=0,0,((D33/G33)*100)-100) -> 0 | N33: =IF(H33=0,0,((D33/H33)*100)-100) -> 0 | O33: =IF(D33=0,0,IF(I33=0,0,((D33/I33)*100)-100)) -> 0 | Q33: 4100000 | R33: =IF(D33=0,0,IF(Q33=0,0,((D33/Q33)*100)-100)) -> 2.33 | S33: =IF(D33=0,0,(D33/$D$44)*100) -> 4.87 | U33: 21.34 | V33: 0 | W33: =V33-U33 -> -21.34
A34: Total Hiper | C34: =SUM(C24:C33) -> 55270000 | D34: =SUM(D24:D33) -> 53946952 | E34: =SUM(E24:E33) -> 56631193 | G34: =SUM(G24:G33) -> 45696741 | H34: =SUM(H24:H33) -> 35660546 | I34: =SUM(I24:I33) -> 36194539 | J34: =SUM(C34:I34) -> 283399971 | K34: =IF(D34=0,0,((D34/C34)*100)-100) -> -2.39 | L34: =IF(D34=0,0,IF(E34=0,0,((D34/E34)*100)-100)) -> -4.74 | M34: =IF(G34=0,0,IF(D34=0,0,((D34/G34)*100)-100)) -> 18.05 | N34: =IF(H34=0,0,IF(D34=0,0,((D34/H34)*100)-100)) -> 51.28 | O34: =IF(D34=0,0,IF(I34=0,0,((D34/I34)*100)-100)) -> 49.05 | Q34: =SUM(Q24:Q33) -> 53970000 | R34: =IF(D34=0,0,((D34/Q34)*100)-100) -> -0.04 | S34: =IF(D34=0,0,(D34/$D$44)*100) -> 62.64 | U34: 16.9 | V34: 0 | W34: =V34-U34 -> -16.9
A36: Total s/ 27, 32 | B36: =B22+B34 -> 0 | C36: =C22+C34 -> 87014800 | D36: =D22+D34 -> 86116925 | E36: =E22+E34 -> 89412068 | F36: =F22+F34 -> 0 | G36: =G22+G34 -> 71433655 | H36: =H22+H34 -> 54843099 | I36: =I22+I34 -> 54527381 | J36: =SUM(C36:I36) -> 443347928 | K36: =IF(D36=0,0,((D36/C36)*100)-100) -> -1.03 | L36: =IF(D36=0,0,IF(E36=0,0,((D36/E36)*100)-100)) -> -3.69 | M36: =IF(G36=0,0,IF(D36=0,0,((D36/G36)*100)-100)) -> 20.56 | N36: =IF(H36=0,0,IF(D36=0,0,((D36/H36)*100)-100)) -> 57.02 | O36: =IF(D36=0,0,IF(I36=0,0,((D36/I36)*100)-100)) -> 57.93 | Q36: =Q22+Q34 -> 85730000 | R36: =IF(D36=0,0,((D36/Q36)*100)-100) -> 0.45 | S36: =IF(D36=0,0,(D36/$D$44)*100) -> 100 | U36: 17 | V36: 0 | W36: =V36-U36 -> -17
A38: Campo Largo | C38: 0 | D38: 0 | E38: 0 | G38: 0 | H38: 0 | I38: 0 | K38: =IF(C38=0,0,((D38/C38)*100)-100) -> 0 | L38: =IF(D38=0,0,IF(E38=0,0,((D38/E38)*100)-100)) -> 0 | M38: =IF(G38=0,0,((D38/G38)*100)-100) -> 0 | N38: =IF(H38=0,0,((D38/H38)*100)-100) -> 0 | O38: =IF(D38=0,0,IF(I38=0,0,((D38/I38)*100)-100)) -> 0 | Q38: 0 | R38: =IF(Q38=0,0,IF(D38=0,0,((D38/Q38)*100)-100)) -> 0 | S38: =IF(D38=0,0,(D38/$D$44)*100) -> 0 | U38: 0 | V38: 0 | W38: =V38-U38 -> 0
A39: Uvaranas | C39: 0 | D39: 0 | E39: 0 | G39: 0 | H39: 0 | I39: 0 | K39: =IF(C39=0,0,((D39/C39)*100)-100) -> 0 | L39: =IF(D39=0,0,IF(E39=0,0,((D39/E39)*100)-100)) -> 0 | M39: =IF(G39=0,0,((D39/G39)*100)-100) -> 0 | N39: =IF(H39=0,0,((D39/H39)*100)-100) -> 0 | O39: =IF(D39=0,0,IF(I39=0,0,((D39/I39)*100)-100)) -> 0 | Q39: 0 | R39: =IF(Q39=0,0,IF(D39=0,0,((D39/Q39)*100)-100)) -> 0 | S39: =IF(D39=0,0,(D39/$D$44)*100) -> 0 | U39: 0 | V39: 0 | W39: =V39-U39 -> 0
A40: Novo Mundo | C40: 0 | D40: 0 | E40: 0 | G40: 0 | H40: 0 | I40: 0 | K40: =IF(C40=0,0,((D40/C40)*100)-100) -> 0 | L40: =IF(D40=0,0,IF(E40=0,0,((D40/E40)*100)-100)) -> 0 | M40: =IF(G40=0,0,((D40/G40)*100)-100) -> 0 | N40: =IF(H40=0,0,((D40/H40)*100)-100) -> 0 | O40: =IF(D40=0,0,IF(I40=0,0,((D40/I40)*100)-100)) -> 0 | Q40: 0 | R40: =IF(Q40=0,0,IF(D40=0,0,((D40/Q40)*100)-100)) -> 0 | S40: =IF(D40=0,0,(D40/$D$44)*100) -> 0 | U40: 0 | V40: 0 | W40: =V40-U40 -> 0
A41: Torres | C41: 0 | D41: 0 | E41: 0 | G41: 0 | H41: 0 | I41: 0 | K41: =IF(C41=0,0,((D41/C41)*100)-100) -> 0 | L41: =IF(D41=0,0,IF(E41=0,0,((D41/E41)*100)-100)) -> 0 | M41: =IF(G41=0,0,((D41/G41)*100)-100) -> 0 | N41: =IF(H41=0,0,((D41/H41)*100)-100) -> 0 | O41: =IF(D41=0,0,IF(I41=0,0,((D41/I41)*100)-100)) -> 0 | Q41: 0 | R41: =IF(Q41=0,0,IF(D41=0,0,((D41/Q41)*100)-100)) -> 0 | S41: =IF(D41=0,0,(D41/$D$44)*100) -> 0 | U41: 0 | V41: 0 | W41: =V41-U41 -> 0
A42: Total Lojas Novas | C42: =SUM(C38:C41) -> 0 | D42: =SUM(D38:D41) -> 0 | E42: =SUM(E38:E41) -> 0 | G42: =SUM(G38:G41) -> 0 | H42: =SUM(H38:H41) -> 0 | I42: =SUM(I38:I41) -> 0 | K42: =IF(D42=0,0,((D42/C42)*100)-100) -> 0 | L42: =IF(D42=0,0,IF(E42=0,0,((D42/E42)*100)-100)) -> 0 | M42: =IF(G42=0,0,IF(D42=0,0,((D42/G42)*100)-100)) -> 0 | N42: =IF(H42=0,0,IF(D42=0,0,((D42/H42)*100)-100)) -> 0 | O42: =IF(D42=0,0,IF(I42=0,0,((D42/I42)*100)-100)) -> 0 | Q42: =SUM(Q38:Q41) -> 0 | R42: =IF(Q42=0,0,IF(D42=0,0,((D42/Q42)*100)-100)) -> 0 | S42: =IF(D42=0,0,(D42/$D$44)*100) -> 0
A44: Total Geral | C44: =C22+C34+C42 -> 87014800 | D44: =D22+D34+D42 -> 86116925 | E44: =E22+E34+E42 -> 89412068 | G44: =G22+G34+G42 -> 71433655 | H44: =H22+H34+H42 -> 54843099 | I44: =I22+I34+I42 -> 54527381 | K44: =IF(D44=0,0,((D44/C44)*100)-100) -> -1.03 | L44: =IF(D44=0,0,IF(E44=0,0,((D44/E44)*100)-100)) -> -3.69 | M44: =IF(G44=0,0,IF(D44=0,0,((D44/G44)*100)-100)) -> 20.56 | N44: =IF(H44=0,0,IF(D44=0,0,((D44/H44)*100)-100)) -> 57.02 | O44: =IF(D44=0,0,IF(I44=0,0,((D44/I44)*100)-100)) -> 57.93 | Q44: =Q22+Q34+Q42 -> 85730000 | R44: =IF(D44=0,0,((D44/Q44)*100)-100) -> 0.45 | S44: =S22+S34+S42 -> 100 | U44: 17 | V44: 0 | W44: =V44-U44 -> -17
C45: Resumo por Regiao - Outubro/2002
C46: Descricao das Aberturas | H46: Valor | I46: % | M46: Margem Comercial | R46: Meta | S46: Real | U46: Dif
C47: Curitiba (3,6,7,10,11,13,17,21,22,24,26,27,28,34) | H47: 47602250 | I47: =IF(D44=0,0,H47/$D$44) -> 0.55279999999999996 | L47: 99 | M47: Empresa | R47: 0 | S47: 0 | U47: =S47-R47 -> 0
C48: Curitiba e Metrop. (Ctba. 4,5,8,14,23,25;31) | H48: 65324971 | I48: =IF(D44=0,0,H48/$D$44) -> 0.75860000000000005 | L48: 207 | M48: Super | R48: 0 | S48: 0 | U48: =S48-R48 -> 0
C49: Metropolitana (4,5,8,14,23,25;31) | H49: 17722721 | I49: =IF(D44=0,0,H49/$D$44) -> 0.20580000000000001 | L49: 208 | M49: Hiper | R49: 0 | S49: 0 | U49: =S49-R49 -> 0
C50: Norte (9,15,20) | H50: =D25+D15+D18 -> 8019659 | I50: =IF(D44=0,0,H50/$D$44) -> 9.3100000000000002E-2 | L50: 204 | M50: Regional Gilberto | R50: 0 | S50: 0 | U50: =S50-R50 -> 0
C51: Ponta Grossa (18,19,32) | H51: =D17+D28+D39 -> 7560962 | I51: =IF(D44=0,0,H51/$D$44) -> 8.7800000000000003E-2 | L51: 205 | M51: Regional Edison | R51: 0 | S51: 0 | U51: =S51-R51 -> 0
C52: Super (3,4,5,7,8,10,13,15,17,18,20,23,26,28,34) | H52: 32169973 | I52: =IF(D44=0,0,H52/$D$44) -> 0.37359999999999999 | L52: 206 | M52: Regional Jorge | R52: 0 | S52: 0 | U52: =S52-R52 -> 0
C53: Hiper (6,9,11,14,19,21,22,24,25,26,27) | H53: 53946952 | I53: =IF(D44=0,0,H53/$D$44) -> 0.62639999999999996 | L53: 209 | M53: Regio - Curitiba | R53: 0 | S53: 0 | U53: =S53-R53 -> 0
C54: Curitiba, Metropolitana e Ponta Grossa | H54: =D44-H50 -> 78097266 | I54: =IF(D44=0,0,H54/$D$44) -> 0.90690000000000004 | L54: 200 | M54: Regio - Metropolitana | R54: 0 | S54: 0 | U54: =S54-R54 -> 0
C55: Araucaria | H55: =D9+D19 -> 2873578 | I55: =IF(D44=0,0,H55/$D$44) -> 3.3399999999999999E-2 | L55: 201 | M55: Regio - Centro Oeste | R55: 0 | S55: 0 | U55: =S55-R55 -> 0