A2: Periodo: | C2: 38749 | D2: a | E2: 38776 | H2: Vendas Acumuladas por Filial | Q2: =NOW() -> 38777.368851041698
A4: v.1 | C4: Vendas 2006 | G4: Vendas de Anos Anteriores | K4: Percentuais ( % ) | Q4: Meta Mensal | U4: Margem
A5: Lojas | C5: Previsao | D5: Realizada | E5: Mes Anterior | G5: Vendas 2005 | H5: Vendas 2004 | I5: Vendas 2003 | K5: % Prev | L5: % MA | M5: 2005 | N5: 2004 | O5: 2003 | Q5: Previsao Mes | R5: Final | S5: Part. | U5: Meta | V5: Condor
A7: Xaxim | C7: 796220 | D7: 673686 | E7: 600081 | G7: 797030 | H7: 761830 | I7: 618469 | K7: =IF(C7=0,0,((D7/C7)*100)-100) -> -15.39 | L7: =IF(D7=0,0,IF(E7=0,0,((D7/E7)*100)-100)) -> 12.27 | M7: =IF(G7=0,0,((D7/G7)*100)-100) -> -15.48 | N7: =IF(H7=0,0,((D7/H7)*100)-100) -> -11.57 | O7: =IF(D7=0,0,IF(I7=0,0,((D7/I7)*100)-100)) -> 8.93 | Q7: 796220 | R7: =IF(D7=0,0,((D7/Q7)*100)-100) -> -15.39 | S7: =IF(D7=0,0,(D7/$D$35)*100) -> 1.23 | U7: 16.4 | V7: 15.35
A8: S. Felicidade | C8: 790000 | D8: 706433 | E8: 654937 | G8: 743453 | H8: 680644 | I8: 686679 | K8: =IF(C8=0,0,((D8/C8)*100)-100) -> -10.58 | L8: =IF(D8=0,0,IF(E8=0,0,((D8/E8)*100)-100)) -> 7.86 | M8: =IF(G8=0,0,((D8/G8)*100)-100) -> -4.98 | N8: =IF(H8=0,0,((D8/H8)*100)-100) -> 3.79 | O8: =IF(D8=0,0,IF(I8=0,0,((D8/I8)*100)-100)) -> 2.88 | Q8: 790000 | R8: =IF(D8=0,0,((D8/Q8)*100)-100) -> -10.58 | S8: =IF(D8=0,0,(D8/$D$35)*100) -> 1.29 | U8: 16.5 | V8: 16.01
A9: Lapa | C9: 1180000 | D9: 1174330 | E9: 980859 | G9: 1169050 | H9: 1054146 | I9: 913056 | K9: =IF(C9=0,0,((D9/C9)*100)-100) -> -0.48 | L9: =IF(D9=0,0,IF(E9=0,0,((D9/E9)*100)-100)) -> 19.72 | M9: =IF(G9=0,0,((D9/G9)*100)-100) -> 0.45 | N9: =IF(H9=0,0,((D9/H9)*100)-100) -> 11.4 | O9: =IF(D9=0,0,IF(I9=0,0,((D9/I9)*100)-100)) -> 28.62 | Q9: 1180000 | R9: =IF(D9=0,0,((D9/Q9)*100)-100) -> -0.48 | S9: =IF(D9=0,0,(D9/$D$35)*100) -> 2.15 | U9: 16.25 | V9: 14.75
A10: Araucaria | C10: 990000 | D10: 921138 | E10: 852941 | G10: 922579 | H10: 883203 | I10: 993990 | K10: =IF(C10=0,0,((D10/C10)*100)-100) -> -6.96 | L10: =IF(D10=0,0,IF(E10=0,0,((D10/E10)*100)-100)) -> 8 | M10: =IF(G10=0,0,((D10/G10)*100)-100) -> -0.16 | N10: =IF(H10=0,0,((D10/H10)*100)-100) -> 4.3 | O10: =IF(D10=0,0,IF(I10=0,0,((D10/I10)*100)-100)) -> -7.33 | Q10: 990000 | R10: =IF(D10=0,0,((D10/Q10)*100)-100) -> -6.96 | S10: =IF(D10=0,0,(D10/$D$35)*100) -> 1.69 | U10: 17.55 | V10: 16.82
A11: Pinheirinho | C11: 2125000 | D11: 1778233 | E11: 1615558 | G11: 2093962 | H11: 1899208 | I11: 1717330 | K11: =IF(C11=0,0,((D11/C11)*100)-100) -> -16.32 | L11: =IF(D11=0,0,IF(E11=0,0,((D11/E11)*100)-100)) -> 10.07 | M11: =IF(G11=0,0,((D11/G11)*100)-100) -> -15.08 | N11: =IF(H11=0,0,((D11/H11)*100)-100) -> -6.37 | O11: =IF(D11=0,0,IF(I11=0,0,((D11/I11)*100)-100)) -> 3.55 | Q11: 2125000 | R11: =IF(D11=0,0,((D11/Q11)*100)-100) -> -16.32 | S11: =IF(D11=0,0,(D11/$D$35)*100) -> 3.26 | U11: 16.8 | V11: 16.11
A12: Hauer | C12: 3190000 | D12: 2899805 | E12: 2558925 | G12: 3144365 | H12: 2730980 | I12: 2685569 | K12: =IF(C12=0,0,((D12/C12)*100)-100) -> -9.1 | L12: =IF(D12=0,0,IF(E12=0,0,((D12/E12)*100)-100)) -> 13.32 | M12: =IF(G12=0,0,((D12/G12)*100)-100) -> -7.78 | N12: =IF(H12=0,0,((D12/H12)*100)-100) -> 6.18 | O12: =IF(D12=0,0,IF(I12=0,0,((D12/I12)*100)-100)) -> 7.98 | Q12: 3190000 | R12: =IF(D12=0,0,((D12/Q12)*100)-100) -> -9.1 | S12: =IF(D12=0,0,(D12/$D$35)*100) -> 5.31 | U12: 16.96 | V12: 16.42
A13: Paranagua | C13: 1700000 | D13: 1447626 | E13: 1346775 | G13: 3385849 | H13: 2852103 | I13: 2761430 | K13: =IF(C13=0,0,((D13/C13)*100)-100) -> -14.85 | L13: =IF(D13=0,0,IF(E13=0,0,((D13/E13)*100)-100)) -> 7.49 | M13: =IF(G13=0,0,((D13/G13)*100)-100) -> -57.24 | N13: =IF(H13=0,0,((D13/H13)*100)-100) -> -49.24 | O13: =IF(D13=0,0,IF(I13=0,0,((D13/I13)*100)-100)) -> -47.58 | Q13: 1700000 | R13: =IF(D13=0,0,((D13/Q13)*100)-100) -> -14.85 | S13: =IF(D13=0,0,(D13/$D$35)*100) -> 2.65 | U13: 17.4 | V13: 16.87
A14: Centenario | C14: 977000 | D14: 854539 | E14: 805429 | G14: 966874 | H14: 875752 | I14: 830168 | K14: =IF(C14=0,0,((D14/C14)*100)-100) -> -12.53 | L14: =IF(D14=0,0,IF(E14=0,0,((D14/E14)*100)-100)) -> 6.1 | M14: =IF(G14=0,0,((D14/G14)*100)-100) -> -11.62 | N14: =IF(H14=0,0,((D14/H14)*100)-100) -> -2.42 | O14: =IF(D14=0,0,IF(I14=0,0,((D14/I14)*100)-100)) -> 2.94 | Q14: 977000 | R14: =IF(D14=0,0,((D14/Q14)*100)-100) -> -12.53 | S14: =IF(D14=0,0,(D14/$D$35)*100) -> 1.57 | U14: 16.6 | V14: 15.23
A15: Arapongas | C15: 0 | D15: 0 | E15: 0 | G15: 0 | H15: 0 | I15: 0 | K15: =IF(C15=0,0,((D15/C15)*100)-100) -> 0 | L15: =IF(D15=0,0,IF(E15=0,0,((D15/E15)*100)-100)) -> 0 | M15: =IF(D15=0,0,IF(G15=0,0,((D15/G15)*100)-100)) -> 0 | N15: =IF(D15=0,0,IF(H15=0,0,((D15/H15)*100)-100)) -> 0 | O15: =IF(D15=0,0,IF(I15=0,0,((D15/I15)*100)-100)) -> 0 | Q15: 0 | R15: =IF(D15=0,0,((D15/Q15)*100)-100) -> 0 | S15: =IF(D15=0,0,(D15/$D$35)*100) -> 0 | U15: 0 | V15: 0
A16: Sao Braz | C16: 3120000 | D16: 2921701 | E16: 2598595 | G16: 3116610 | H16: 2928963 | I16: 2761728 | K16: =IF(C16=0,0,((D16/C16)*100)-100) -> -6.36 | L16: =IF(D16=0,0,IF(E16=0,0,((D16/E16)*100)-100)) -> 12.43 | M16: =IF(G16=0,0,((D16/G16)*100)-100) -> -6.25 | N16: =IF(H16=0,0,((D16/H16)*100)-100) -> -0.25 | O16: =IF(D16=0,0,IF(I16=0,0,((D16/I16)*100)-100)) -> 5.79 | Q16: 3120000 | R16: =IF(D16=0,0,((D16/Q16)*100)-100) -> -6.36 | S16: =IF(D16=0,0,(D16/$D$35)*100) -> 5.35 | U16: 16.95 | V16: 16.23
A17: Sitio Cercado | C17: 1300000 | D17: 1217376 | E17: 1159434 | G17: 1737697 | H17: 1462777 | I17: 1115251 | K17: =IF(C17=0,0,((D17/C17)*100)-100) -> -6.36 | L17: =IF(D17=0,0,IF(E17=0,0,((D17/E17)*100)-100)) -> 5 | M17: =IF(G17=0,0,((D17/G17)*100)-100) -> -29.94 | N17: =IF(H17=0,0,((D17/H17)*100)-100) -> -16.78 | O17: =IF(D17=0,0,IF(I17=0,0,((D17/I17)*100)-100)) -> 9.16 | Q17: 1300000 | R17: =IF(D17=0,0,((D17/Q17)*100)-100) -> -6.36 | S17: =IF(D17=0,0,(D17/$D$35)*100) -> 2.23 | U17: 16.9 | V17: 16.81
A18: Apucarana | C18: 1750000 | D18: 1817990 | E18: 1632373 | G18: 1638164 | H18: 1284382 | I18: 1250362 | K18: =IF(C18=0,0,((D18/C18)*100)-100) -> 3.89 | L18: =IF(D18=0,0,IF(E18=0,0,((D18/E18)*100)-100)) -> 11.37 | M18: =IF(G18=0,0,((D18/G18)*100)-100) -> 10.98 | N18: =IF(H18=0,0,((D18/H18)*100)-100) -> 41.55 | O18: =IF(D18=0,0,IF(I18=0,0,((D18/I18)*100)-100)) -> 45.4 | Q18: 1750000 | R18: =IF(D18=0,0,((D18/Q18)*100)-100) -> 3.89 | S18: =IF(D18=0,0,(D18/$D$35)*100) -> 3.33 | U18: 15.5 | V18: 13.91
A19: Ahu | C19: 1180000 | D19: 1048586 | E19: 926736 | G19: 1068081 | H19: 1063102 | I19: 1111722 | K19: =IF(C19=0,0,((D19/C19)*100)-100) -> -11.14 | L19: =IF(D19=0,0,IF(E19=0,0,((D19/E19)*100)-100)) -> 13.15 | M19: =IF(G19=0,0,((D19/G19)*100)-100) -> -1.83 | N19: =IF(H19=0,0,((D19/H19)*100)-100) -> -1.37 | O19: =IF(D19=0,0,IF(I19=0,0,((D19/I19)*100)-100)) -> -5.68 | Q19: 1180000 | R19: =IF(D19=0,0,((D19/Q19)*100)-100) -> -11.14 | S19: =IF(D19=0,0,(D19/$D$35)*100) -> 1.92 | U19: 17.15 | V19: 16.11
A20: P.G. Centro | C20: 1720000 | D20: 1496458 | E20: 1376161 | G20: 1691495 | H20: 1559531 | I20: 1474375 | K20: =IF(C20=0,0,((D20/C20)*100)-100) -> -13 | L20: =IF(D20=0,0,IF(E20=0,0,((D20/E20)*100)-100)) -> 8.74 | M20: =IF(G20=0,0,((D20/G20)*100)-100) -> -11.53 | N20: =IF(H20=0,0,((D20/H20)*100)-100) -> -4.04 | O20: =IF(D20=0,0,IF(I20=0,0,((D20/I20)*100)-100)) -> 1.5 | Q20: 1720000 | R20: =IF(D20=0,0,((D20/Q20)*100)-100) -> -13 | S20: =IF(D20=0,0,(D20/$D$35)*100) -> 2.74 | U20: 17.98 | V20: 17.2
A21: Maringa | C21: 2250000 | D21: 2112169 | E21: 1941498 | G21: 2079356 | H21: 1868747 | I21: 1888401 | K21: =IF(C21=0,0,((D21/C21)*100)-100) -> -6.13 | L21: =IF(D21=0,0,IF(E21=0,0,((D21/E21)*100)-100)) -> 8.79 | M21: =IF(G21=0,0,((D21/G21)*100)-100) -> 1.58 | N21: =IF(H21=0,0,((D21/H21)*100)-100) -> 13.03 | O21: =IF(D21=0,0,IF(I21=0,0,((D21/I21)*100)-100)) -> 11.85 | Q21: 2250000 | R21: =IF(D21=0,0,((D21/Q21)*100)-100) -> -6.13 | S21: =IF(D21=0,0,(D21/$D$35)*100) -> 3.87 | U21: 18.2 | V21: 16.29
A22: Araucaria Nova | C22: 2190000 | D22: 1969668 | E22: 1727554 | G22: 2107318 | H22: 1813836 | I22: 1737415 | K22: =IF(C22=0,0,((D22/C22)*100)-100) -> -10.06 | L22: =IF(D22=0,0,IF(E22=0,0,((D22/E22)*100)-100)) -> 14.01 | M22: =IF(G22=0,0,((D22/G22)*100)-100) -> -6.53 | N22: =IF(H22=0,0,((D22/H22)*100)-100) -> 8.59 | O22: =IF(D22=0,0,IF(I22=0,0,((D22/I22)*100)-100)) -> 13.37 | Q22: 2190000 | R22: =IF(D22=0,0,((D22/Q22)*100)-100) -> -10.06 | S22: =IF(D22=0,0,(D22/$D$35)*100) -> 3.61 | U22: 17.5 | V22: 16.63
A23: Sitio Cercado | C23: 0 | D23: 0 | E23: 0 | G23: 0 | H23: 0 | I23: 0 | K23: =IF(C23=0,0,((D23/C23)*100)-100) -> 0 | L23: =IF(D23=0,0,IF(E23=0,0,((D23/E23)*100)-100)) -> 0 | M23: =IF(G23=0,0,((D23/G23)*100)-100) -> 0 | N23: =IF(H23=0,0,((D23/H23)*100)-100) -> 0 | O23: =IF(D23=0,0,IF(I23=0,0,((D23/I23)*100)-100)) -> 0 | Q23: 0 | R23: =IF(Q23=0,0,IF(D23=0,0,((D23/Q23)*100)-100)) -> 0 | S23: =IF(D23=0,0,(D23/$D$35)*100) -> 0 | U23: 0 | V23: 0
A24: Total Super | C24: =SUM(C7:C23) -> 25258220 | D24: =SUM(D7:D23) -> 23039738 | E24: =SUM(E7:E23) -> 20777856 | G24: =SUM(G7:G23) -> 26661883 | H24: =SUM(H7:H23) -> 23719204 | I24: =SUM(I7:I23) -> 22545945 | J24: =SUM(C24:I24) -> 142002846 | K24: =IF(D24=0,0,((D24/C24)*100)-100) -> -8.78 | L24: =IF(D24=0,0,IF(E24=0,0,((D24/E24)*100)-100)) -> 10.89 | M24: =IF(G24=0,0,IF(D24=0,0,((D24/G24)*100)-100)) -> -13.59 | N24: =IF(H24=0,0,IF(D24=0,0,((D24/H24)*100)-100)) -> -2.86 | O24: =IF(D24=0,0,IF(I24=0,0,((D24/I24)*100)-100)) -> 2.19 | Q24: =SUM(Q7:Q23) -> 25258220 | R24: =IF(D24=0,0,((D24/Q24)*100)-100) -> -8.78 | S24: =IF(D24=0,0,(D24/$D$35)*100) -> 42.2 | U24: 17.05 | V24: 16.11
A26: Londrina | C26: 2700000 | D26: 2737858 | E26: 2409226 | G26: 2538508 | H26: 2025202 | I26: 2022076 | K26: =IF(C26=0,0,((D26/C26)*100)-100) -> 1.4 | L26: =IF(D26=0,0,IF(E26=0,0,((D26/E26)*100)-100)) -> 13.64 | M26: =IF(G26=0,0,((D26/G26)*100)-100) -> 7.85 | N26: =IF(H26=0,0,((D26/H26)*100)-100) -> 35.19 | O26: =IF(D26=0,0,IF(I26=0,0,((D26/I26)*100)-100)) -> 35.4 | Q26: 2700000 | R26: =IF(D26=0,0,IF(Q26=0,0,((D26/Q26)*100)-100)) -> 1.4 | S26: =IF(D26=0,0,(D26/$D$35)*100) -> 5.01 | U26: 15.8 | V26: 13.82
A27: S.J. Pinhais | C27: 3880000 | D27: 3826980 | E27: 3561328 | G27: 4371622 | H27: 3873110 | I27: 3663832 | K27: =IF(C27=0,0,((D27/C27)*100)-100) -> -1.37 | L27: =IF(D27=0,0,IF(E27=0,0,((D27/E27)*100)-100)) -> 7.46 | M27: =IF(G27=0,0,((D27/G27)*100)-100) -> -12.46 | N27: =IF(H27=0,0,((D27/H27)*100)-100) -> -1.19 | O27: =IF(D27=0,0,IF(I27=0,0,((D27/I27)*100)-100)) -> 4.45 | Q27: 3880000 | R27: =IF(D27=0,0,IF(Q27=0,0,((D27/Q27)*100)-100)) -> -1.37 | S27: =IF(D27=0,0,(D27/$D$35)*100) -> 7.01 | U27: 16.1 | V27: 15.57
A28: P.G. Nova | C28: 3615000 | D28: 3325148 | E28: 3026361 | G28: 3596581 | H28: 2943189 | I28: 2901489 | K28: =IF(C28=0,0,((D28/C28)*100)-100) -> -8.02 | L28: =IF(D28=0,0,IF(E28=0,0,((D28/E28)*100)-100)) -> 9.87 | M28: =IF(G28=0,0,((D28/G28)*100)-100) -> -7.55 | N28: =IF(H28=0,0,((D28/H28)*100)-100) -> 12.98 | O28: =IF(D28=0,0,IF(I28=0,0,((D28/I28)*100)-100)) -> 14.6 | Q28: 3615000 | R28: =IF(D28=0,0,IF(Q28=0,0,((D28/Q28)*100)-100)) -> -8.02 | S28: =IF(D28=0,0,(D28/$D$35)*100) -> 6.09 | U28: 16.4 | V28: 15.9
A29: Nilo Pecanha | C29: 8202160 | D29: 8320688 | E29: 7149503 | G29: 7986335 | H29: 7700456 | I29: 7125976 | K29: =IF(C29=0,0,((D29/C29)*100)-100) -> 1.45 | L29: =IF(D29=0,0,IF(E29=0,0,((D29/E29)*100)-100)) -> 16.38 | M29: =IF(G29=0,0,((D29/G29)*100)-100) -> 4.19 | N29: =IF(H29=0,0,((D29/H29)*100)-100) -> 8.05 | O29: =IF(D29=0,0,IF(I29=0,0,((D29/I29)*100)-100)) -> 16.77 | Q29: 8202160 | R29: =IF(D29=0,0,IF(Q29=0,0,((D29/Q29)*100)-100)) -> 1.45 | S29: =IF(D29=0,0,(D29/$D$35)*100) -> 15.24 | U29: 16.2 | V29: 15.37
A30: Champagnat | C30: 5400000 | D30: 4972791 | E30: 4456024 | G30: 5028802 | H30: 0 | I30: 0 | K30: =IF(C30=0,0,((D30/C30)*100)-100) -> -7.91 | L30: =IF(D30=0,0,IF(E30=0,0,((D30/E30)*100)-100)) -> 11.6 | M30: =IF(G30=0,0,((D30/G30)*100)-100) -> -1.11 | N30: =IF(H30=0,0,((D30/H30)*100)-100) -> 0 | O30: =IF(D30=0,0,IF(I30=0,0,((D30/I30)*100)-100)) -> 0 | Q30: 5400000 | R30: =IF(D30=0,0,IF(Q30=0,0,((D30/Q30)*100)-100)) -> -7.91 | S30: =IF(D30=0,0,(D30/$D$35)*100) -> 9.11 | U30: 16.4 | V30: 16.49
A31: Santa Candida | C31: 4602968 | D31: 4098945 | E31: 3579021 | G31: 4721647 | H31: 0 | I31: 0 | K31: =IF(C31=0,0,((D31/C31)*100)-100) -> -10.95 | L31: =IF(D31=0,0,IF(E31=0,0,((D31/E31)*100)-100)) -> 14.53 | M31: =IF(G31=0,0,((D31/G31)*100)-100) -> -13.19 | N31: =IF(H31=0,0,((D31/H31)*100)-100) -> 0 | O31: =IF(D31=0,0,IF(I31=0,0,((D31/I31)*100)-100)) -> 0 | Q31: 4602968 | R31: =IF(D31=0,0,IF(Q31=0,0,((D31/Q31)*100)-100)) -> -10.95 | S31: =IF(D31=0,0,(D31/$D$35)*100) -> 7.51 | U31: 16.25 | V31: 15.35
A32: Paranagu Raia | C32: 4850000 | D32: 4279210 | E32: 3872331 | G32: 140751 | H32: 0 | I32: 0 | K32: =IF(C32=0,0,((D32/C32)*100)-100) -> -11.77 | L32: =IF(D32=0,0,IF(E32=0,0,((D32/E32)*100)-100)) -> 10.51 | M32: =IF(G32=0,0,((D32/G32)*100)-100) -> 2940.27 | N32: =IF(H32=0,0,((D32/H32)*100)-100) -> 0 | O32: =IF(D32=0,0,IF(I32=0,0,((D32/I32)*100)-100)) -> 0 | Q32: 4850000 | R32: =IF(D32=0,0,IF(Q32=0,0,((D32/Q32)*100)-100)) -> -11.77 | S32: =IF(D32=0,0,(D32/$D$35)*100) -> 7.84 | U32: 16.3 | V32: 15.99
A33: Total Hiper | C33: =SUM(C26:C32) -> 33250128 | D33: =SUM(D26:D32) -> 31561620 | E33: =SUM(E26:E32) -> 28053794 | G33: =SUM(G26:G32) -> 28384246 | H33: =SUM(H26:H32) -> 16541957 | I33: =SUM(I26:I32) -> 15713373 | J33: =SUM(C33:I33) -> 153505118 | K33: =IF(D33=0,0,((D33/C33)*100)-100) -> -5.08 | L33: =IF(D33=0,0,IF(E33=0,0,((D33/E33)*100)-100)) -> 12.5 | M33: =IF(G33=0,0,IF(D33=0,0,((D33/G33)*100)-100)) -> 11.19 | N33: =IF(H33=0,0,IF(D33=0,0,((D33/H33)*100)-100)) -> 90.8 | O33: =IF(D33=0,0,IF(I33=0,0,((D33/I33)*100)-100)) -> 100.86 | Q33: =SUM(Q26:Q32) -> 33250128 | R33: =IF(D33=0,0,((D33/Q33)*100)-100) -> -5.08 | S33: =IF(D33=0,0,(D33/$D$35)*100) -> 57.8 | U33: 16.23 | V33: 15.57
A35: Total Geral | C35: =C24+C33 -> 58508348 | D35: =D24+D33 -> 54601358 | E35: =E24+E33 -> 48831650 | G35: =G24+G33 -> 55046129 | H35: =H24+H33 -> 40261161 | I35: =I24+I33 -> 38259318 | K35: =IF(D33=0,0,((D35/C35)*100)-100) -> -6.68 | L35: =IF(D35=0,0,IF(E35=0,0,((D35/E35)*100)-100)) -> 11.82 | M35: =IF(G35=0,0,IF(D35=0,0,((D35/G35)*100)-100)) -> -0.81 | N35: =IF(H35=0,0,IF(D35=0,0,((D35/H35)*100)-100)) -> 35.62 | O35: =IF(D35=0,0,IF(I35=0,0,((D35/I35)*100)-100)) -> 42.71 | Q35: =Q24+Q33 -> 58508348 | R35: =IF(D35=0,0,((D35/Q35)*100)-100) -> -6.68 | S35: =S24+S33 -> 100 | U35: 16.59 | V35: 15.8
C36: Resumo por Regiao - Outubro/2002
C37: Descricao das Aberturas | H37: Valor | I37: %
C38: Curitiba (2,3,6,7,10,11,17,21,22) | H38: =D7+D8+D11+D12+D14+D16+D19+D29+D30+D32 -> 28455672 | I38: =IF(D35=0,0,H38/$D$35) -> 0.5212
C39: Curitiba e Metrop. (Ctba. 4,5,8,14,23) | H39: =H38+D9+D10+D13+D28+D23 -> 35323914 | I39: =IF(D35=0,0,H39/$D$35) -> 0.64690000000000003
C40: Metropolitana (4,5,8,14,23) | H40: =H39-H38 -> 6868242 | I40: =IF(D35=0,0,H40/$D$35) -> 0.1258
C41: Norte (9,15,20) | H41: =D26+D18+D23 -> 4555848 | I41: =IF(D35=0,0,H41/$D$35) -> 8.3400000000000002E-2
C42: Centro-Oeste (13,18,19) | H42: =D17+D20+D28 -> 6038982 | I42: =IF(D35=0,0,H42/$D$35) -> 0.1106
C43: Ponta Grossa (18,19) | H43: =H42-D17 -> 4821606 | I43: =IF(D35=0,0,H43/$D$35) -> 8.8300000000000003E-2
C44: Super (2,3,4,5,6,7,8,10,11,13,15,17,18,20,23) | H44: =D24 -> 23039738 | I44: =IF(D35=0,0,H44/$D$35) -> 0.42199999999999999
C45: Hiper (9,14,19,21,22,24) | H45: =D33 -> 31561620 | I45: =IF(D35=0,0,H45/$D$35) -> 0.57799999999999996
C46: Curitiba, Metropolitana e Centro-Oeste | H46: =D35-H41 -> 50045510 | I46: =IF(D35=0,0,H46/$D$35) -> 0.91659999999999997
C47: Araucaria | H47: =D10+D23 -> 921138 | I47: =IF(D35=0,0,H47/$D$35) -> 1.6899999999999998E-2