A2: Perodo: | C2: 37712 | E2: 37741 | H2: Vendas Acumuladas por Filial
C4: Vendas 2003 | G4: Vendas de Anos Anteriores | K4: Percentuais ( % ) | R4: %
A5: Lojas | C5: Previso | D5: Realizada | E5: Ms Anterior | G5: Vendas 2002 | H5: Vendas 2001 | I5: Vendas 2000 | K5: % Prev | L5: % MA | M5: 2002 | N5: 2001 | O5: 2000 | Q5: Previso Ms | R5: Final | S5: Part.
A7: Xaxim | C7: 700000 | D7: 705308.05 | E7: 669625.38 | G7: 536632.26 | H7: 525195.14 | I7: 506551.65 | K7: =IF(C7=0,0,((D7/C7)*100)-100) -> 00.76 | L7: =IF(E7=0,0,((D7/E7)*100)-100) -> 5.33 | M7: =IF(G7=0,0,((D7/G7)*100)-100) -> 31.43 | N7: =IF(H7=0,0,((D7/H7)*100)-100) -> 34.29 | O7: =IF(I7=0,0,((D7/I7)*100)-100) -> 39.24 | Q7: 700000 | R7: =((D7/Q7)*100)-100 -> 00.76 | S7: =D7/$D$31*100 -> 1.6
A8: S. Felicidade | C8: 740000 | D8: 756884.74 | E8: 714359.17 | G8: 507659.46 | H8: 561669.49 | I8: 538367.92 | K8: =IF(C8=0,0,((D8/C8)*100)-100) -> 2.28 | L8: =IF(E8=0,0,((D8/E8)*100)-100) -> 5.95 | M8: =IF(G8=0,0,((D8/G8)*100)-100) -> 49.09 | N8: =IF(H8=0,0,((D8/H8)*100)-100) -> 34.76 | O8: =IF(I8=0,0,((D8/I8)*100)-100) -> 40.59 | Q8: 740000 | R8: =((D8/Q8)*100)-100 -> 2.28 | S8: =D8/$D$31*100 -> 1.72
A9: Lapa | C9: 1100000 | D9: 1078852.95 | E9: 1012412.37 | G9: 751829.1 | H9: 690458.81 | I9: 697706.35 | K9: =IF(C9=0,0,((D9/C9)*100)-100) -> -1.92 | L9: =IF(E9=0,0,((D9/E9)*100)-100) -> 6.56 | M9: =IF(G9=0,0,((D9/G9)*100)-100) -> 43.5 | N9: =IF(H9=0,0,((D9/H9)*100)-100) -> 56.25 | O9: =IF(I9=0,0,((D9/I9)*100)-100) -> 54.63 | Q9: 1100000 | R9: =((D9/Q9)*100)-100 -> -1.92 | S9: =D9/$D$31*100 -> 2.45
A10: Araucria | C10: 1150000 | D10: 1164994.54 | E10: 1086755.37 | G10: 1336968.67 | H10: 1468980.3 | I10: 1434205.02 | K10: =IF(C10=0,0,((D10/C10)*100)-100) -> 1.3 | L10: =IF(E10=0,0,((D10/E10)*100)-100) -> 7.2 | M10: =IF(G10=0,0,((D10/G10)*100)-100) -> -12.86 | N10: =IF(H10=0,0,((D10/H10)*100)-100) -> -20.69 | O10: =IF(I10=0,0,((D10/I10)*100)-100) -> -18.77 | Q10: 1150000 | R10: =((D10/Q10)*100)-100 -> 1.3 | S10: =D10/$D$31*100 -> 2.65
A11: Pinheirinho | C11: 1950000 | D11: 1972111.88 | E11: 1884251.92 | G11: 1487836.24 | H11: 1717614.55 | I11: 1534232.99 | K11: =IF(C11=0,0,((D11/C11)*100)-100) -> 1.13 | L11: =IF(E11=0,0,((D11/E11)*100)-100) -> 4.66 | M11: =IF(G11=0,0,((D11/G11)*100)-100) -> 32.55 | N11: =IF(H11=0,0,((D11/H11)*100)-100) -> 14.82 | O11: =IF(I11=0,0,((D11/I11)*100)-100) -> 28.54 | Q11: 1950000 | R11: =((D11/Q11)*100)-100 -> 1.13 | S11: =D11/$D$31*100 -> 4.48
A12: Hauer | C12: 3000000 | D12: 2917301.98 | E12: 2896663.36 | G12: 2104928.96 | H12: 2184630.19 | I12: 2079370.5 | K12: =IF(C12=0,0,((D12/C12)*100)-100) -> -2.76 | L12: =IF(E12=0,0,((D12/E12)*100)-100) -> 00.71 | M12: =IF(G12=0,0,((D12/G12)*100)-100) -> 38.59 | N12: =IF(H12=0,0,((D12/H12)*100)-100) -> 33.54 | O12: =IF(I12=0,0,((D12/I12)*100)-100) -> 40.3 | Q12: 3000000 | R12: =((D12/Q12)*100)-100 -> -2.76 | S12: =D12/$D$31*100 -> 6.63
A13: Paranagu | C13: 3100000 | D13: 3265443.36 | E13: 3046003.19 | G13: 2332842.16 | H13: 2307946.77 | I13: 1692070.15 | K13: =IF(C13=0,0,((D13/C13)*100)-100) -> 5.34 | L13: =IF(E13=0,0,((D13/E13)*100)-100) -> 7.2 | M13: =IF(G13=0,0,((D13/G13)*100)-100) -> 39.98 | N13: =IF(H13=0,0,((D13/H13)*100)-100) -> 41.49 | O13: =IF(I13=0,0,((D13/I13)*100)-100) -> 92.99 | Q13: 3100000 | R13: =((D13/Q13)*100)-100 -> 5.34 | S13: =D13/$D$31*100 -> 7.42
A14: Centenrio | C14: 930000 | D14: 886935.8 | E14: 878605.69 | G14: 677267.39 | H14: 650802.48 | I14: 617659.33 | K14: =IF(C14=0,0,((D14/C14)*100)-100) -> -4.63 | L14: =IF(E14=0,0,((D14/E14)*100)-100) -> 00.95 | M14: =IF(G14=0,0,((D14/G14)*100)-100) -> 30.96 | N14: =IF(H14=0,0,((D14/H14)*100)-100) -> 36.28 | O14: =IF(I14=0,0,((D14/I14)*100)-100) -> 43.6 | Q14: 930000 | R14: =((D14/Q14)*100)-100 -> -4.63 | S14: =D14/$D$31*100 -> 2.02
A15: So Brz | C15: 3200000 | D15: 3020464.16 | E15: 3063452.78 | G15: 2135078.88 | H15: 2470480.8 | I15: 2066186.44 | K15: =IF(C15=0,0,((D15/C15)*100)-100) -> -5.61 | L15: =IF(E15=0,0,((D15/E15)*100)-100) -> -1.4 | M15: =IF(G15=0,0,((D15/G15)*100)-100) -> 41.47 | N15: =IF(H15=0,0,((D15/H15)*100)-100) -> 22.26 | O15: =IF(I15=0,0,((D15/I15)*100)-100) -> 46.19 | Q15: 3200000 | R15: =((D15/Q15)*100)-100 -> -5.61 | S15: =D15/$D$31*100 -> 6.86
A16: Arapongas | C16: 650000 | D16: 657019.32 | E16: 610257.13 | G16: 489492.97 | H16: 587257.99 | I16: 572150 | K16: =IF(C16=0,0,((D16/C16)*100)-100) -> 1.08 | L16: =IF(E16=0,0,((D16/E16)*100)-100) -> 7.66 | M16: =IF(G16=0,0,((D16/G16)*100)-100) -> 34.22 | N16: =IF(H16=0,0,((D16/H16)*100)-100) -> 11.88 | O16: =IF(I16=0,0,((D16/I16)*100)-100) -> 14.83 | Q16: 650000 | R16: =((D16/Q16)*100)-100 -> 1.08 | S16: =D16/$D$31*100 -> 1.49
A17: Guarapuava | C17: 1350000 | D17: 1486780.05 | E17: 1333407.78 | G17: 704613.23 | H17: 970804.65 | I17: 1053376.89 | K17: =IF(C17=0,0,((D17/C17)*100)-100) -> 10.13 | L17: =IF(E17=0,0,((D17/E17)*100)-100) -> 11.5 | M17: =IF(G17=0,0,((D17/G17)*100)-100) -> 111.01 | N17: =IF(H17=0,0,((D17/H17)*100)-100) -> 53.15 | O17: =IF(I17=0,0,((D17/I17)*100)-100) -> 41.14 | Q17: 1350000 | R17: =((D17/Q17)*100)-100 -> 10.13 | S17: =D17/$D$31*100 -> 3.38
A18: Apucarana | C18: 1500000 | D18: 1504751.91 | E18: 1395489.54 | G18: 1061196.97 | H18: 1250108.77 | I18: 1348018.04 | K18: =IF(C18=0,0,((D18/C18)*100)-100) -> 00.32 | L18: =IF(E18=0,0,((D18/E18)*100)-100) -> 7.83 | M18: =IF(G18=0,0,((D18/G18)*100)-100) -> 41.8 | N18: =IF(H18=0,0,((D18/H18)*100)-100) -> 20.37 | O18: =IF(I18=0,0,((D18/I18)*100)-100) -> 11.63 | Q18: 1500000 | R18: =((D18/Q18)*100)-100 -> 00.32 | S18: =D18/$D$31*100 -> 3.42
A19: Ah | C19: 1300000 | D19: 1322275.28 | E19: 1235423.99 | G19: 980790.34 | H19: 1161599.08 | I19: 972869.71 | K19: =IF(C19=0,0,((D19/C19)*100)-100) -> 1.71 | L19: =IF(E19=0,0,((D19/E19)*100)-100) -> 7.03 | M19: =IF(G19=0,0,((D19/G19)*100)-100) -> 34.82 | N19: =IF(H19=0,0,((D19/H19)*100)-100) -> 13.83 | O19: =IF(I19=0,0,((D19/I19)*100)-100) -> 35.91 | Q19: 1300000 | R19: =((D19/Q19)*100)-100 -> 1.71 | S19: =D19/$D$31*100 -> 3
A20: P.G. Centro | C20: 1700000 | D20: 1777270.31 | E20: 1566979.99 | G20: 1203378.82 | H20: 1271118.14 | I20: 1364856.57 | K20: =IF(C20=0,0,((D20/C20)*100)-100) -> 4.55 | L20: =IF(E20=0,0,((D20/E20)*100)-100) -> 13.42 | M20: =IF(G20=0,0,((D20/G20)*100)-100) -> 47.69 | N20: =IF(H20=0,0,((D20/H20)*100)-100) -> 39.82 | O20: =IF(I20=0,0,((D20/I20)*100)-100) -> 30.22 | Q20: 1700000 | R20: =((D20/Q20)*100)-100 -> 4.55 | S20: =D20/$D$31*100 -> 4.04
A21: Maring | C21: 2250000 | D21: 2180359.05 | E21: 2075741.4 | G21: 1566571.61 | H21: 1755401.72 | I21: 1790141.1 | K21: =IF(C21=0,0,((D21/C21)*100)-100) -> -3.1 | L21: =IF(E21=0,0,((D21/E21)*100)-100) -> 5.04 | M21: =IF(G21=0,0,((D21/G21)*100)-100) -> 39.18 | N21: =IF(H21=0,0,((D21/H21)*100)-100) -> 24.21 | O21: =IF(I21=0,0,((D21/I21)*100)-100) -> 21.8 | Q21: 2250000 | R21: =((D21/Q21)*100)-100 -> -3.1 | S21: =D21/$D$31*100 -> 4.95
A22: Araucria Nova | C22: 2150000 | D22: 1940418.13 | E22: 2057035.54 | G22: 0 | H22: 0 | I22: 0 | K22: =IF(C22=0,0,((D22/C22)*100)-100) -> -9.75 | L22: =IF(E22=0,0,((D22/E22)*100)-100) -> -5.67 | M22: =IF(G22=0,0,((D22/G22)*100)-100) -> 0 | N22: =IF(H22=0,0,((D22/H22)*100)-100) -> 0 | O22: =IF(I22=0,0,((D22/I22)*100)-100) -> 0 | Q22: 2150000 | R22: =((D22/Q22)*100)-100 -> -9.75 | S22: =D22/$D$31*100 -> 4.41
A23: Total Super | C23: =SUM(C7:C22) -> 26770000 | D23: =SUM(D7:D22) -> 26637171.510000002 | E23: =SUM(E7:E22) -> 25526464.600000001 | G23: =SUM(G7:G22) -> 17877087.059999999 | H23: =SUM(H7:H22) -> 19574068.879999999 | I23: =SUM(I7:I22) -> 18267762.66 | J23: =SUM(C23:I23) -> 134652554.71000001 | K23: =((D23/C23)*100)-100 -> -0.5 | L23: =IF(E23=0,0,((D23/E23)*100)-100) -> 4.35 | M23: =((D23/G23)*100)-100 -> 49 | N23: =((D23/H23)*100)-100 -> 36.08 | O23: =IF(I23=0,0,((D23/I23)*100)-100) -> 45.82 | Q23: =SUM(Q7:Q22) -> 26770000 | R23: =((D23/Q23)*100)-100 -> -0.5 | S23: =D23/$D$31*100 -> 60.53
A25: Londrina | C25: 2430000 | D25: 2256404.28 | E25: 2176502.32 | G25: 1860443.82 | H25: 1910413.82 | I25: 0 | K25: =IF(C25=0,0,((D25/C25)*100)-100) -> -7.14 | L25: =IF(E25=0,0,((D25/E25)*100)-100) -> 3.67 | M25: =IF(G25=0,0,((D25/G25)*100)-100) -> 21.28 | N25: =IF(H25=0,0,((D25/H25)*100)-100) -> 18.11 | O25: =IF(I25=0,0,((D25/I25)*100)-100) -> 0 | Q25: 2430000 | R25: =((D25/Q25)*100)-100 -> -7.14 | S25: =D25/$D$31*100 -> 5.13
A26: S.J. Pinhais | C26: 4200000 | D26: 3987873.16 | E26: 4062990.23 | G26: 2963371.41 | H26: 2651824.92 | I26: 1522582.37 | K26: =IF(C26=0,0,((D26/C26)*100)-100) -> -5.05 | L26: =IF(E26=0,0,((D26/E26)*100)-100) -> -1.85 | M26: =IF(G26=0,0,((D26/G26)*100)-100) -> 34.57 | N26: =IF(H26=0,0,((D26/H26)*100)-100) -> 50.38 | O26: =IF(I26=0,0,((D26/I26)*100)-100) -> 161.92 | Q26: 4200000 | R26: =((D26/Q26)*100)-100 -> -5.05 | S26: =D26/$D$31*100 -> 9.06
A27: P.G. Nova | C27: 3250000 | D27: 3068629.46 | E27: 3017128.55 | G27: 2397847.1 | H27: 2295342.18 | I27: 2059431.42 | K27: =IF(C27=0,0,((D27/C27)*100)-100) -> -5.58 | L27: =IF(E27=0,0,((D27/E27)*100)-100) -> 1.71 | M27: =IF(G27=0,0,((D27/G27)*100)-100) -> 27.97 | N27: =IF(H27=0,0,((D27/H27)*100)-100) -> 33.69 | O27: =IF(I27=0,0,((D27/I27)*100)-100) -> 49 | Q27: 3250000 | R27: =((D27/Q27)*100)-100 -> -5.58 | S27: =D27/$D$31*100 -> 6.97
A28: Nilo Peanha | C28: 8300000 | D28: 8054546.3200000003 | E28: 8022240.0199999996 | G28: 5723908.8499999996 | H28: 0 | I28: 0 | K28: =IF(C28=0,0,((D28/C28)*100)-100) -> -2.96 | L28: =IF(E28=0,0,((D28/E28)*100)-100) -> 00.4 | M28: =IF(G28=0,0,((D28/G28)*100)-100) -> 40.72 | N28: =IF(H28=0,0,((D28/H28)*100)-100) -> 0 | O28: =IF(I28=0,0,((D28/I28)*100)-100) -> 0 | Q28: 8300000 | R28: =((D28/Q28)*100)-100 -> -2.96 | S28: =D28/$D$31*100 -> 18.3
A29: Total Hiper | C29: =SUM(C25:C28) -> 18180000 | D29: =SUM(D25:D28) -> 17367453.219999999 | E29: =SUM(E25:E28) -> 17278861.120000001 | G29: =SUM(G25:G28) -> 12945571.18 | H29: =SUM(H25:H28) -> 6857580.9199999999 | I29: =SUM(I25:I28) -> 3582013.79 | J29: =SUM(C29:I29) -> 76211480.230000004 | K29: =((D29/C29)*100)-100 -> -4.47 | L29: =IF(E29=0,0,((D29/E29)*100)-100) -> 00.51 | M29: =((D29/G29)*100)-100 -> 34.16 | N29: =((D29/H29)*100)-100 -> 153.26 | O29: =IF(I29=0,0,((D29/I29)*100)-100) -> 384.85 | Q29: =SUM(Q25:Q28) -> 18180000 | R29: =((D29/Q29)*100)-100 -> -4.47 | S29: =D29/$D$31*100 -> 39.47
A31: Total Geral | C31: =C23+C29 -> 44950000 | D31: =D23+D29 -> 44004624.729999997 | E31: =E23+E29 -> 42805325.719999999 | G31: =G23+G29 -> 30822658.239999998 | H31: =H23+H29 -> 26431649.800000001 | I31: =I23+I29 -> 21849776.449999999 | K31: =((D31/C31)*100)-100 -> -2.1 | L31: =IF(E31=0,0,((D31/E31)*100)-100) -> 2.8 | M31: =((D31/G31)*100)-100 -> 42.77 | N31: =((D31/H31)*100)-100 -> 66.48 | O31: =IF(I31=0,0,((D31/I31)*100)-100) -> 101.4 | Q31: =Q23+Q29 -> 44950000 | R31: =((D31/Q31)*100)-100 -> -2.1 | S31: =S23+S29 -> 100
C32: Resumo por Regio - Outubro/2002
C33: Descrio das Aberturas | H33: Valor | I33: %
C34: Curitiba (2,3,6,7,10,11,17,21) | H34: =D7+D8+D11+D12+D14+D15+D19+D28 -> 19635828 | I34: =H34/$D$31 -> 0.44619999999999999
C35: Curitiba e Metrop. (Ctba. 4,5,8,14,23) | H35: =H34+D9+D10+D13+D27+D22 -> 30154166 | I35: =H35/$D$31 -> 0.68520000000000003
C36: Metropolitana (4,5,8,14,23) | H36: =H35-H34 -> 10518338 | I36: =H36/$D$31 -> 0.23899999999999999
C37: Norte (9,12,15,20) | H37: =D25+D16+D18+D22 -> 6358594 | I37: =H37/$D$31 -> 0.14449999999999999
C38: Centro-Oeste (13,18,19) | H38: =D17+D20+D27 -> 6332680 | I38: =H38/$D$31 -> 0.1439
C39: Ponta Grossa (18,19) | H39: =H38-D17 -> 4845900 | I39: =H39/$D$31 -> 0.1101
C40: Super (2,3,4,5,6,7,8,10,11,12,13,15,17,18,20,23) | H40: =D23 -> 26637172 | I40: =H40/$D$31 -> 0.60529999999999995
C41: Hiper (9,14,19,21) | H41: =D29 -> 17367453 | I41: =H41/$D$31 -> 0.3947
C42: Curitiba, Metropolitana e Centro-Oeste | H42: =D31-H37 -> 37646031 | I42: =H42/$D$31 -> 0.85550000000000004
C43: Araucria | H43: =D10+D22 -> 3105413 | I43: =H43/$D$31 -> 7.0599999999999996E-2