A2: Periodo: | C2: 40026 | D2: a | E2: 31/08/2009 | H2: Vendas Acumuladas por Filial | Q2: =NOW() -> 40057.3047002315
A4: v.1 | C4: Vendas 2009 | G4: Vendas de Anos Anteriores | K4: Percentuais ( % ) | Q4: Meta Mensal | U4: Margem
A5: Lojas | C5: Previsao | D5: Realizada | E5: Mes Anterior | G5: Vendas 2008 | H5: Vendas 2007 | I5: Vendas 2006 | K5: % Prev | L5: % MA | M5: 2008 | N5: 2007 | O5: 2006 | Q5: Previsao Mes | R5: Final | S5: Part. | U5: Meta | V5: Coml | W5: Dif
A7: S. Felicidade | C7: 2770000 | D7: 2927116 | E7: 2744209 | G7: 2450588 | H7: 1391722 | I7: 812042 | K7: =IF(C7=0,0,((D7/C7)*100)-100) -> 5.67 | L7: =IF(D7=0,0,IF(E7=0,0,((D7/E7)*100)-100)) -> 6.67 | M7: =IF(G7=0,0,((D7/G7)*100)-100) -> 19.45 | N7: =IF(H7=0,0,((D7/H7)*100)-100) -> 110.32 | O7: =IF(D7=0,0,IF(I7=0,0,((D7/I7)*100)-100)) -> 260.46 | Q7: 2770000 | R7: =IF(D7=0,0,((D7/Q7)*100)-100) -> 5.67 | S7: =IF(D7=0,0,(D7/$D$43)*100) -> 2.8 | U7: 17 | V7: 17.03 | W7: =V7-U7 -> 0.03
A8: Lapa | C8: 2200000 | D8: 2194546 | E8: 2174727 | G8: 2109909 | H8: 1399037 | I8: 997592 | K8: =IF(C8=0,0,((D8/C8)*100)-100) -> -0.25 | L8: =IF(D8=0,0,IF(E8=0,0,((D8/E8)*100)-100)) -> 0.91 | M8: =IF(G8=0,0,((D8/G8)*100)-100) -> 4.01 | N8: =IF(H8=0,0,((D8/H8)*100)-100) -> 56.86 | O8: =IF(D8=0,0,IF(I8=0,0,((D8/I8)*100)-100)) -> 119.98 | Q8: 2200000 | R8: =IF(D8=0,0,((D8/Q8)*100)-100) -> -0.25 | S8: =IF(D8=0,0,(D8/$D$43)*100) -> 2.1 | U8: 16.4 | V8: 15.95 | W8: =V8-U8 -> -0.45
A9: Araucaria | C9: 1290000 | D9: 1395128 | E9: 1346452 | G9: 1171433 | H9: 972456 | I9: 863811 | K9: =IF(C9=0,0,((D9/C9)*100)-100) -> 8.15 | L9: =IF(D9=0,0,IF(E9=0,0,((D9/E9)*100)-100)) -> 3.62 | M9: =IF(G9=0,0,((D9/G9)*100)-100) -> 19.1 | N9: =IF(H9=0,0,((D9/H9)*100)-100) -> 43.46 | O9: =IF(D9=0,0,IF(I9=0,0,((D9/I9)*100)-100)) -> 61.51 | Q9: 1290000 | R9: =IF(D9=0,0,((D9/Q9)*100)-100) -> 8.15 | S9: =IF(D9=0,0,(D9/$D$43)*100) -> 1.34 | U9: 17.45 | V9: 16.86 | W9: =V9-U9 -> -0.59
A10: Hauer | C10: 3800000 | D10: 4025689 | E10: 3804584 | G10: 3766961 | H10: 3151408 | I10: 2839992 | K10: =IF(C10=0,0,((D10/C10)*100)-100) -> 5.94 | L10: =IF(D10=0,0,IF(E10=0,0,((D10/E10)*100)-100)) -> 5.81 | M10: =IF(G10=0,0,((D10/G10)*100)-100) -> 6.87 | N10: =IF(H10=0,0,((D10/H10)*100)-100) -> 27.74 | O10: =IF(D10=0,0,IF(I10=0,0,((D10/I10)*100)-100)) -> 41.75 | Q10: 3800000 | R10: =IF(D10=0,0,((D10/Q10)*100)-100) -> 5.94 | S10: =IF(D10=0,0,(D10/$D$43)*100) -> 3.85 | U10: 15.95 | V10: 15.77 | W10: =V10-U10 -> -0.18
A11: Paranagua | C11: 1920000 | D11: 2074746 | E11: 2012381 | G11: 1865699 | H11: 1703447 | I11: 1512771 | K11: =IF(C11=0,0,((D11/C11)*100)-100) -> 8.06 | L11: =IF(D11=0,0,IF(E11=0,0,((D11/E11)*100)-100)) -> 3.1 | M11: =IF(G11=0,0,((D11/G11)*100)-100) -> 11.2 | N11: =IF(H11=0,0,((D11/H11)*100)-100) -> 21.8 | O11: =IF(D11=0,0,IF(I11=0,0,((D11/I11)*100)-100)) -> 37.15 | Q11: 1920000 | R11: =IF(D11=0,0,((D11/Q11)*100)-100) -> 8.06 | S11: =IF(D11=0,0,(D11/$D$43)*100) -> 1.99 | U11: 17.9 | V11: 17.38 | W11: =V11-U11 -> -0.52
A12: Centenario | C12: 1350000 | D12: 1309042 | E12: 1274013 | G12: 1297352 | H12: 1076891 | I12: 837108 | K12: =IF(C12=0,0,((D12/C12)*100)-100) -> -3.03 | L12: =IF(D12=0,0,IF(E12=0,0,((D12/E12)*100)-100)) -> 2.75 | M12: =IF(G12=0,0,((D12/G12)*100)-100) -> 0.9 | N12: =IF(H12=0,0,((D12/H12)*100)-100) -> 21.56 | O12: =IF(D12=0,0,IF(I12=0,0,((D12/I12)*100)-100)) -> 56.38 | Q12: 1350000 | R12: =IF(D12=0,0,((D12/Q12)*100)-100) -> -3.03 | S12: =IF(D12=0,0,(D12/$D$43)*100) -> 1.25 | U12: 16.69 | V12: 15.96 | W12: =V12-U12 -> -0.73
A13: Sitio Cercado | C13: 2210000 | D13: 2345311 | E13: 2206140 | G13: 1963917 | H13: 1507702 | I13: 1043938 | K13: =IF(C13=0,0,((D13/C13)*100)-100) -> 6.12 | L13: =IF(D13=0,0,IF(E13=0,0,((D13/E13)*100)-100)) -> 6.31 | M13: =IF(G13=0,0,((D13/G13)*100)-100) -> 19.42 | N13: =IF(H13=0,0,((D13/H13)*100)-100) -> 55.56 | O13: =IF(D13=0,0,IF(I13=0,0,((D13/I13)*100)-100)) -> 124.66 | Q13: 2210000 | R13: =IF(D13=0,0,((D13/Q13)*100)-100) -> 6.12 | S13: =IF(D13=0,0,(D13/$D$43)*100) -> 2.24 | U13: 16.84 | V13: 15.34 | W13: =V13-U13 -> -1.5
A14: Apucarana | C14: 2599999 | D14: 2689767 | E14: 2600487 | G14: 2348659 | H14: 2209221 | I14: 1551140 | K14: =IF(C14=0,0,((D14/C14)*100)-100) -> 3.45 | L14: =IF(D14=0,0,IF(E14=0,0,((D14/E14)*100)-100)) -> 3.43 | M14: =IF(G14=0,0,((D14/G14)*100)-100) -> 14.52 | N14: =IF(H14=0,0,((D14/H14)*100)-100) -> 21.75 | O14: =IF(D14=0,0,IF(I14=0,0,((D14/I14)*100)-100)) -> 73.41 | Q14: 2600000 | R14: =IF(D14=0,0,((D14/Q14)*100)-100) -> 3.45 | S14: =IF(D14=0,0,(D14/$D$43)*100) -> 2.57 | U14: 17 | V14: 16.72 | W14: =V14-U14 -> -0.28
A15: Ah | C15: 1750000 | D15: 1756092 | E15: 1743326 | G15: 1648685 | H15: 1491365 | I15: 1085649 | K15: =IF(C15=0,0,((D15/C15)*100)-100) -> 0.35 | L15: =IF(D15=0,0,IF(E15=0,0,((D15/E15)*100)-100)) -> 0.73 | M15: =IF(G15=0,0,((D15/G15)*100)-100) -> 6.51 | N15: =IF(H15=0,0,((D15/H15)*100)-100) -> 17.75 | O15: =IF(D15=0,0,IF(I15=0,0,((D15/I15)*100)-100)) -> 61.76 | Q15: 1750000 | R15: =IF(D15=0,0,((D15/Q15)*100)-100) -> 0.35 | S15: =IF(D15=0,0,(D15/$D$43)*100) -> 1.68 | U15: 17.5 | V15: 17.2 | W15: =V15-U15 -> -0.3
A16: P.G. Centro | C16: 2000000 | D16: 1932279 | E16: 1976230 | G16: 2067849 | H16: 1937043 | I16: 1518615 | K16: =IF(C16=0,0,((D16/C16)*100)-100) -> -3.39 | L16: =IF(D16=0,0,IF(E16=0,0,((D16/E16)*100)-100)) -> -2.22 | M16: =IF(G16=0,0,((D16/G16)*100)-100) -> -6.56 | N16: =IF(H16=0,0,((D16/H16)*100)-100) -> -0.25 | O16: =IF(D16=0,0,IF(I16=0,0,((D16/I16)*100)-100)) -> 27.24 | Q16: 2000000 | R16: =IF(D16=0,0,((D16/Q16)*100)-100) -> -3.39 | S16: =IF(D16=0,0,(D16/$D$43)*100) -> 1.85 | U16: 18.94 | V16: 17.58 | W16: =V16-U16 -> -1.36
A17: Maringa | C17: 2899998 | D17: 2774163 | E17: 2919877 | G17: 2980523 | H17: 2579214 | I17: 2239000 | K17: =IF(C17=0,0,((D17/C17)*100)-100) -> -4.34 | L17: =IF(D17=0,0,IF(E17=0,0,((D17/E17)*100)-100)) -> -4.99 | M17: =IF(G17=0,0,((D17/G17)*100)-100) -> -6.92 | N17: =IF(H17=0,0,((D17/H17)*100)-100) -> 7.56 | O17: =IF(D17=0,0,IF(I17=0,0,((D17/I17)*100)-100)) -> 23.9 | Q17: 2900000 | R17: =IF(D17=0,0,((D17/Q17)*100)-100) -> -4.34 | S17: =IF(D17=0,0,(D17/$D$43)*100) -> 2.66 | U17: 18.2 | V17: 17.6 | W17: =V17-U17 -> -0.6
A18: Araucaria Nova | C18: 3600000 | D18: 3845093 | E18: 3569374 | G18: 3275598 | H18: 2277784 | I18: 1878878 | K18: =IF(C18=0,0,((D18/C18)*100)-100) -> 6.81 | L18: =IF(D18=0,0,IF(E18=0,0,((D18/E18)*100)-100)) -> 7.72 | M18: =IF(G18=0,0,((D18/G18)*100)-100) -> 17.39 | N18: =IF(H18=0,0,((D18/H18)*100)-100) -> 68.81 | O18: =IF(D18=0,0,IF(I18=0,0,((D18/I18)*100)-100)) -> 104.65 | Q18: 3600000 | R18: =IF(D18=0,0,((D18/Q18)*100)-100) -> 6.81 | S18: =IF(D18=0,0,(D18/$D$43)*100) -> 3.68 | U18: 16.45 | V18: 16.34 | W18: =V18-U18 -> -0.11
A19: Cristo Rei | C19: 2050000 | D19: 2125436 | E19: 2065193 | G19: 1775110 | H19: 1517852 | I19: 0 | K19: =IF(C19=0,0,((D19/C19)*100)-100) -> 3.68 | L19: =IF(D19=0,0,IF(E19=0,0,((D19/E19)*100)-100)) -> 2.92 | M19: =IF(G19=0,0,((D19/G19)*100)-100) -> 19.74 | N19: =IF(H19=0,0,((D19/H19)*100)-100) -> 40.03 | O19: =IF(D19=0,0,IF(I19=0,0,((D19/I19)*100)-100)) -> 0 | Q19: 2050000 | R19: =IF(D19=0,0,((D19/Q19)*100)-100) -> 3.68 | S19: =IF(D19=0,0,(D19/$D$43)*100) -> 2.03 | U19: 18.05 | V19: 18.02 | W19: =V19-U19 -> -0.03
A20: Campo Largo | C20: 2800000 | D20: 3233087 | E20: 3051237 | G20: 2479371 | H20: 0 | I20: 0 | K20: =IF(C20=0,0,((D20/C20)*100)-100) -> 15.47 | L20: =IF(D20=0,0,IF(E20=0,0,((D20/E20)*100)-100)) -> 5.96 | M20: =IF(G20=0,0,((D20/G20)*100)-100) -> 30.4 | N20: =IF(H20=0,0,((D20/H20)*100)-100) -> 0 | O20: =IF(D20=0,0,IF(I20=0,0,((D20/I20)*100)-100)) -> 0 | Q20: 2800000 | R20: =IF(D20=0,0,((D20/Q20)*100)-100) -> 15.47 | S20: =IF(D20=0,0,(D20/$D$43)*100) -> 3.09 | U20: 17.1 | V20: 17.08 | W20: =V20-U20 -> -0.02
A21: Brasilia | C21: 2500000 | D21: 2713597 | E21: 2512123 | G21: 2651139 | H21: 846820 | I21: 628406 | K21: =IF(C21=0,0,((D21/C21)*100)-100) -> 8.54 | L21: =IF(D21=0,0,IF(E21=0,0,((D21/E21)*100)-100)) -> 8.02 | M21: =IF(G21=0,0,((D21/G21)*100)-100) -> 2.36 | N21: =IF(H21=0,0,((D21/H21)*100)-100) -> 220.45 | O21: =IF(D21=0,0,IF(I21=0,0,((D21/I21)*100)-100)) -> 331.82 | Q21: 2500000 | R21: =IF(D21=0,0,((D21/Q21)*100)-100) -> 8.54 | S21: =IF(D21=0,0,(D21/$D$43)*100) -> 2.6 | U21: 16.7 | V21: 16.07 | W21: =V21-U21 -> -0.63
A22: Total Super | C22: =SUM(C7:C21) -> 35739997 | D22: =SUM(D7:D21) -> 37341092 | E22: =SUM(E7:E21) -> 36000353 | G22: =SUM(G7:G21) -> 33852793 | H22: =SUM(H7:H21) -> 24061962 | I22: =SUM(I7:I21) -> 17808942 | J22: =SUM(C22:I22) -> 184805139 | K22: =IF(D22=0,0,((D22/C22)*100)-100) -> 4.48 | L22: =IF(D22=0,0,IF(E22=0,0,((D22/E22)*100)-100)) -> 3.72 | M22: =IF(G22=0,0,IF(D22=0,0,((D22/G22)*100)-100)) -> 10.3 | N22: =IF(H22=0,0,IF(D22=0,0,((D22/H22)*100)-100)) -> 55.19 | O22: =IF(D22=0,0,IF(I22=0,0,((D22/I22)*100)-100)) -> 109.68 | Q22: =SUM(Q7:Q21) -> 35740000 | R22: =IF(D22=0,0,((D22/Q22)*100)-100) -> 4.48 | S22: =IF(D22=0,0,(D22/$D$43)*100) -> 35.74 | U22: 17.12 | V22: 16.68 | W22: =V22-U22 -> -0.44
A24: Pinheirinho | C24: 4520000 | D24: 4921055 | E24: 4639533 | G24: 4050067 | H24: 3338493 | I24: 2542110 | K24: =IF(C24=0,0,((D24/C24)*100)-100) -> 8.87 | L24: =IF(D24=0,0,IF(E24=0,0,((D24/E24)*100)-100)) -> 6.07 | M24: =IF(G24=0,0,((D24/G24)*100)-100) -> 21.51 | N24: =IF(H24=0,0,((D24/H24)*100)-100) -> 47.4 | O24: =IF(D24=0,0,IF(I24=0,0,((D24/I24)*100)-100)) -> 93.58 | Q24: 4520000 | R24: =IF(D24=0,0,IF(Q24=0,0,((D24/Q24)*100)-100)) -> 8.87 | S24: =IF(D24=0,0,(D24/$D$43)*100) -> 4.71 | U24: 15.55 | V24: 15.54 | W24: =V24-U24 -> -0.01
A25: Londrina | C25: 3700000 | D25: 3505374 | E25: 3651179 | G25: 3380530 | H25: 2691410 | I25: 2514108 | K25: =IF(C25=0,0,((D25/C25)*100)-100) -> -5.26 | L25: =IF(D25=0,0,IF(E25=0,0,((D25/E25)*100)-100)) -> -3.99 | M25: =IF(G25=0,0,((D25/G25)*100)-100) -> 3.69 | N25: =IF(H25=0,0,((D25/H25)*100)-100) -> 30.24 | O25: =IF(D25=0,0,IF(I25=0,0,((D25/I25)*100)-100)) -> 39.43 | Q25: 3700000 | R25: =IF(D25=0,0,IF(Q25=0,0,((D25/Q25)*100)-100)) -> -5.26 | S25: =IF(D25=0,0,(D25/$D$43)*100) -> 3.35 | U25: 16.85 | V25: 16.31 | W25: =V25-U25 -> -0.54
A26: So Brz | C26: 5100000 | D26: 5265305 | E26: 5089483 | G26: 4691817 | H26: 4269414 | I26: 2825909 | K26: =IF(C26=0,0,((D26/C26)*100)-100) -> 3.24 | L26: =IF(D26=0,0,IF(E26=0,0,((D26/E26)*100)-100)) -> 3.45 | M26: =IF(G26=0,0,((D26/G26)*100)-100) -> 12.22 | N26: =IF(H26=0,0,((D26/H26)*100)-100) -> 23.33 | O26: =IF(D26=0,0,IF(I26=0,0,((D26/I26)*100)-100)) -> 86.32 | Q26: 5100000 | R26: =IF(D26=0,0,IF(Q26=0,0,((D26/Q26)*100)-100)) -> 3.24 | S26: =IF(D26=0,0,(D26/$D$43)*100) -> 5.04 | U26: 16 | V26: 15.88 | W26: =V26-U26 -> -0.12
A27: S.J. Pinhais | C27: 5550000 | D27: 5679270 | E27: 5607342 | G27: 5083035 | H27: 4307896 | I27: 3592665 | K27: =IF(C27=0,0,((D27/C27)*100)-100) -> 2.33 | L27: =IF(D27=0,0,IF(E27=0,0,((D27/E27)*100)-100)) -> 1.28 | M27: =IF(G27=0,0,((D27/G27)*100)-100) -> 11.73 | N27: =IF(H27=0,0,((D27/H27)*100)-100) -> 31.83 | O27: =IF(D27=0,0,IF(I27=0,0,((D27/I27)*100)-100)) -> 58.08 | Q27: 5550000 | R27: =IF(D27=0,0,IF(Q27=0,0,((D27/Q27)*100)-100)) -> 2.33 | S27: =IF(D27=0,0,(D27/$D$43)*100) -> 5.44 | U27: 15.9 | V27: 15.45 | W27: =V27-U27 -> -0.45
A28: P.G. Nova | C28: 4800000 | D28: 4754275 | E28: 4786405 | G28: 4624818 | H28: 4060931 | I28: 3189798 | K28: =IF(C28=0,0,((D28/C28)*100)-100) -> -0.95 | L28: =IF(D28=0,0,IF(E28=0,0,((D28/E28)*100)-100)) -> -0.67 | M28: =IF(G28=0,0,((D28/G28)*100)-100) -> 2.8 | N28: =IF(H28=0,0,((D28/H28)*100)-100) -> 17.07 | O28: =IF(D28=0,0,IF(I28=0,0,((D28/I28)*100)-100)) -> 49.05 | Q28: 4800000 | R28: =IF(D28=0,0,IF(Q28=0,0,((D28/Q28)*100)-100)) -> -0.95 | S28: =IF(D28=0,0,(D28/$D$43)*100) -> 4.55 | U28: 16.46 | V28: 15.29 | W28: =V28-U28 -> -1.17
A29: Nilo Pecanha | C29: 11900000 | D29: 12483872 | E29: 12528964 | G29: 11312240 | H29: 9717773 | I29: 8524597 | K29: =IF(C29=0,0,((D29/C29)*100)-100) -> 4.91 | L29: =IF(D29=0,0,IF(E29=0,0,((D29/E29)*100)-100)) -> -0.36 | M29: =IF(G29=0,0,((D29/G29)*100)-100) -> 10.36 | N29: =IF(H29=0,0,((D29/H29)*100)-100) -> 28.46 | O29: =IF(D29=0,0,IF(I29=0,0,((D29/I29)*100)-100)) -> 46.45 | Q29: 11900000 | R29: =IF(D29=0,0,IF(Q29=0,0,((D29/Q29)*100)-100)) -> 4.91 | S29: =IF(D29=0,0,(D29/$D$43)*100) -> 11.95 | U29: 16 | V29: 16.21 | W29: =V29-U29 -> 0.21
A30: Champagnat | C30: 7100000 | D30: 7107217 | E30: 7166576 | G30: 6432558 | H30: 5598266 | I30: 5089804 | K30: =IF(C30=0,0,((D30/C30)*100)-100) -> 0.1 | L30: =IF(D30=0,0,IF(E30=0,0,((D30/E30)*100)-100)) -> -0.83 | M30: =IF(G30=0,0,((D30/G30)*100)-100) -> 10.49 | N30: =IF(H30=0,0,((D30/H30)*100)-100) -> 26.95 | O30: =IF(D30=0,0,IF(I30=0,0,((D30/I30)*100)-100)) -> 39.64 | Q30: 7100000 | R30: =IF(D30=0,0,IF(Q30=0,0,((D30/Q30)*100)-100)) -> 0.1 | S30: =IF(D30=0,0,(D30/$D$43)*100) -> 6.8 | U30: 16.2 | V30: 16.68 | W30: =V30-U30 -> 0.48
A31: Santa Candida | C31: 6500000 | D31: 6687518 | E31: 6512665 | G31: 5524311 | H31: 4610553 | I31: 3613792 | K31: =IF(C31=0,0,((D31/C31)*100)-100) -> 2.88 | L31: =IF(D31=0,0,IF(E31=0,0,((D31/E31)*100)-100)) -> 2.68 | M31: =IF(G31=0,0,((D31/G31)*100)-100) -> 21.06 | N31: =IF(H31=0,0,((D31/H31)*100)-100) -> 45.05 | O31: =IF(D31=0,0,IF(I31=0,0,((D31/I31)*100)-100)) -> 85.06 | Q31: 6500000 | R31: =IF(D31=0,0,IF(Q31=0,0,((D31/Q31)*100)-100)) -> 2.88 | S31: =IF(D31=0,0,(D31/$D$43)*100) -> 6.4 | U31: 15.5 | V31: 16.01 | W31: =V31-U31 -> 0.51
A32: Paranagu Raia | C32: 6800000 | D32: 6881640 | E32: 6909272 | G32: 5976250 | H32: 5154862 | I32: 4243163 | K32: =IF(C32=0,0,((D32/C32)*100)-100) -> 1.2 | L32: =IF(D32=0,0,IF(E32=0,0,((D32/E32)*100)-100)) -> -0.4 | M32: =IF(G32=0,0,((D32/G32)*100)-100) -> 15.15 | N32: =IF(H32=0,0,((D32/H32)*100)-100) -> 33.5 | O32: =IF(D32=0,0,IF(I32=0,0,((D32/I32)*100)-100)) -> 62.18 | Q32: 6800000 | R32: =IF(D32=0,0,IF(Q32=0,0,((D32/Q32)*100)-100)) -> 1.2 | S32: =IF(D32=0,0,(D32/$D$43)*100) -> 6.59 | U32: 18.6 | V32: 17.83 | W32: =V32-U32 -> -0.77
A33: Total Hiper | C33: =SUM(C24:C32) -> 55970000 | D33: =SUM(D24:D32) -> 57285526 | E33: =SUM(E24:E32) -> 56891419 | G33: =SUM(G24:G32) -> 51075626 | H33: =SUM(H24:H32) -> 43749598 | I33: =SUM(I24:I32) -> 36135946 | J33: =SUM(C33:I33) -> 301108115 | K33: =IF(D33=0,0,((D33/C33)*100)-100) -> 2.35 | L33: =IF(D33=0,0,IF(E33=0,0,((D33/E33)*100)-100)) -> 0.69 | M33: =IF(G33=0,0,IF(D33=0,0,((D33/G33)*100)-100)) -> 12.16 | N33: =IF(H33=0,0,IF(D33=0,0,((D33/H33)*100)-100)) -> 30.94 | O33: =IF(D33=0,0,IF(I33=0,0,((D33/I33)*100)-100)) -> 58.53 | Q33: =SUM(Q24:Q32) -> 55970000 | R33: =IF(D33=0,0,((D33/Q33)*100)-100) -> 2.35 | S33: =IF(D33=0,0,(D33/$D$43)*100) -> 54.83 | U33: 16.33 | V33: 16.21 | W33: =V33-U33 -> -0.12
A35: Total s/ 26, 32 | B35: =B22+B33 -> 0 | C35: =C22+C33 -> 91709997 | D35: =D22+D33 -> 94626618 | E35: =E22+E33 -> 92891772 | F35: =F22+F33 -> 0 | G35: =G22+G33 -> 84928419 | H35: =H22+H33 -> 67811560 | I35: =I22+I33 -> 53944888 | J35: =SUM(C35:I35) -> 485913254 | K35: =IF(D35=0,0,((D35/C35)*100)-100) -> 3.18 | L35: =IF(D35=0,0,IF(E35=0,0,((D35/E35)*100)-100)) -> 1.87 | M35: =IF(G35=0,0,IF(D35=0,0,((D35/G35)*100)-100)) -> 11.42 | N35: =IF(H35=0,0,IF(D35=0,0,((D35/H35)*100)-100)) -> 39.54 | O35: =IF(D35=0,0,IF(I35=0,0,((D35/I35)*100)-100)) -> 75.41 | Q35: =Q22+Q33 -> 91710000 | R35: =IF(D35=0,0,((D35/Q35)*100)-100) -> 3.18 | S35: =IF(D35=0,0,(D35/$D$43)*100) -> 90.57 | U35: 16.64 | V35: 16.39 | W35: =V35-U35 -> -0.25
A37: Campo Largo | C37: 0 | D37: 0 | E37: 0 | G37: 0 | H37: 0 | I37: 0 | K37: =IF(C37=0,0,((D37/C37)*100)-100) -> 0 | L37: =IF(D37=0,0,IF(E37=0,0,((D37/E37)*100)-100)) -> 0 | M37: =IF(G37=0,0,((D37/G37)*100)-100) -> 0 | N37: =IF(H37=0,0,((D37/H37)*100)-100) -> 0 | O37: =IF(D37=0,0,IF(I37=0,0,((D37/I37)*100)-100)) -> 0 | Q37: 0 | R37: =IF(Q37=0,0,IF(D37=0,0,((D37/Q37)*100)-100)) -> 0 | S37: =IF(D37=0,0,(D37/$D$43)*100) -> 0 | U37: 0 | V37: 0 | W37: =V37-U37 -> 0
A38: Uvaranas | C38: 5000000 | D38: 4700871 | E38: 4816167 | G38: 0 | H38: 0 | I38: 0 | K38: =IF(C38=0,0,((D38/C38)*100)-100) -> -5.98 | L38: =IF(D38=0,0,IF(E38=0,0,((D38/E38)*100)-100)) -> -2.39 | M38: =IF(G38=0,0,((D38/G38)*100)-100) -> 0 | N38: =IF(H38=0,0,((D38/H38)*100)-100) -> 0 | O38: =IF(D38=0,0,IF(I38=0,0,((D38/I38)*100)-100)) -> 0 | Q38: 5000000 | R38: =IF(Q38=0,0,IF(D38=0,0,((D38/Q38)*100)-100)) -> -5.98 | S38: =IF(D38=0,0,(D38/$D$43)*100) -> 4.5 | U38: 15.4 | V38: 14.71 | W38: =V38-U38 -> -0.69
A39: Novo Mundo | C39: =D39 -> 0 | D39: 0 | E39: 0 | G39: 0 | H39: 0 | I39: 0 | K39: =IF(C39=0,0,((D39/C39)*100)-100) -> 0 | L39: =IF(D39=0,0,IF(E39=0,0,((D39/E39)*100)-100)) -> 0 | M39: =IF(G39=0,0,((D39/G39)*100)-100) -> 0 | N39: =IF(H39=0,0,((D39/H39)*100)-100) -> 0 | O39: =IF(D39=0,0,IF(I39=0,0,((D39/I39)*100)-100)) -> 0 | Q39: 0 | R39: =IF(Q39=0,0,IF(D39=0,0,((D39/Q39)*100)-100)) -> 0 | S39: =IF(D39=0,0,(D39/$D$43)*100) -> 0 | U39: 0 | V39: 0 | W39: =V39-U39 -> 0
A40: Torres | C40: 5200000 | D40: 5156232 | E40: 5054367 | G40: 0 | H40: 0 | I40: 0 | K40: =IF(C40=0,0,((D40/C40)*100)-100) -> -0.84 | L40: =IF(D40=0,0,IF(E40=0,0,((D40/E40)*100)-100)) -> 2.02 | M40: =IF(G40=0,0,((D40/G40)*100)-100) -> 0 | N40: =IF(H40=0,0,((D40/H40)*100)-100) -> 0 | O40: =IF(D40=0,0,IF(I40=0,0,((D40/I40)*100)-100)) -> 0 | Q40: 5200000 | R40: =IF(Q40=0,0,IF(D40=0,0,((D40/Q40)*100)-100)) -> -0.84 | S40: =IF(D40=0,0,(D40/$D$43)*100) -> 4.93 | U40: 16 | V40: 15.18 | W40: =V40-U40 -> -0.82
A41: Total Lojas Novas | C41: =SUM(C37:C40) -> 10200000 | D41: =SUM(D37:D40) -> 9857103 | E41: =SUM(E37:E40) -> 9870534 | G41: =SUM(G37:G40) -> 0 | H41: =SUM(H37:H40) -> 0 | I41: =SUM(I37:I40) -> 0 | K41: =IF(D41=0,0,((D41/C41)*100)-100) -> -3.36 | L41: =IF(D41=0,0,IF(E41=0,0,((D41/E41)*100)-100)) -> -0.14 | M41: =IF(G41=0,0,IF(D41=0,0,((D41/G41)*100)-100)) -> 0 | N41: =IF(H41=0,0,IF(D41=0,0,((D41/H41)*100)-100)) -> 0 | O41: =IF(D41=0,0,IF(I41=0,0,((D41/I41)*100)-100)) -> 0 | Q41: =SUM(Q37:Q40) -> 10200000 | R41: =IF(Q41=0,0,IF(D41=0,0,((D41/Q41)*100)-100)) -> -3.36 | S41: =IF(D41=0,0,(D41/$D$43)*100) -> 9.43
A43: Total Geral | C43: =C22+C33+C41 -> 101909997 | D43: =D22+D33+D41 -> 104483721 | E43: =E22+E33+E41 -> 102762306 | G43: =G22+G33+G41 -> 84928419 | H43: =H22+H33+H41 -> 67811560 | I43: =I22+I33+I41 -> 53944888 | K43: =IF(D43=0,0,((D43/C43)*100)-100) -> 2.53 | L43: =IF(D43=0,0,IF(E43=0,0,((D43/E43)*100)-100)) -> 1.68 | M43: =IF(G43=0,0,IF(D43=0,0,((D43/G43)*100)-100)) -> 23.03 | N43: =IF(H43=0,0,IF(D43=0,0,((D43/H43)*100)-100)) -> 54.08 | O43: =IF(D43=0,0,IF(I43=0,0,((D43/I43)*100)-100)) -> 93.69 | Q43: =Q22+Q33+Q41 -> 101910000 | R43: =IF(D43=0,0,((D43/Q43)*100)-100) -> 2.53 | S43: =S22+S33+S41 -> 100 | U43: 16.54 | V43: 16.26 | W43: =V43-U43 -> -0.28
C44: Resumo por Regiao - Outubro/2002
C45: Descricao das Aberturas | H45: Valor | I45: % | M45: Margem Comercial | R45: Meta | S45: Real | U45: Dif
C46: Curitiba (3,6,7,10,11,13,17,21,22,24,26,28;34) | H46: 61488045 | I46: =IF(D43=0,0,H46/$D$43) -> 0.58850000000000002 | L46: 99 | M46: Empresa | R46: 16.54 | S46: 16.24 | U46: =S46-R46 -> -0.3
C47: Curitiba e Metrop. (Ctba. 4,5,8,14,23,25;31,34) | H47: 84306194 | I47: =IF(D43=0,0,H47/$D$43) -> 0.80689999999999995 | L47: 207 | M47: Super | R47: 17.11 | S47: 16.67 | U47: =S47-R47 -> -0.44
C48: Metropolitana (4,5,8,14,23,25;31) | H48: 22818149 | I48: =IF(D43=0,0,H48/$D$43) -> 0.21840000000000001 | L48: 208 | M48: Hiper | R48: 16.23 | S48: 16.01 | U48: =S48-R48 -> -0.22
C49: Norte (9,15,20) | H49: =D25+D15+D18 -> 9106559 | I49: =IF(D43=0,0,H49/$D$43) -> 8.72E-2 | L49: 204 | M49: Regional Gilberto | R49: 16.32 | S49: 16.08 | U49: =S49-R49 -> -0.24
C50: Ponta Grossa (18,19,32) | H50: =D17+D28+D38 -> 12229309 | I50: =IF(D43=0,0,H50/$D$43) -> 0.11700000000000001 | L50: 205 | M50: Regional Edison | R50: 16.88 | S50: 16.36 | U50: =S50-R50 -> -0.52
C51: Super (3,4,5,7,8,10,13,15,17,18,20,23,26,28,34) | H51: 37341092 | I51: =IF(D43=0,0,H51/$D$43) -> 0.3574 | L51: 206 | M51: Regional Jorge | R51: 17.31 | S51: 16.82 | U51: =S51-R51 -> -0.49
C52: Hiper (6,9,11,14,19,21,22,24,25,26) | H52: 62441758 | I52: =IF(D43=0,0,H52/$D$43) -> 0.59760000000000002 | L52: 209 | M52: Regional Jefferson | R52: =U29 -> 16 | S52: 16.2 | U52: =S52-R52 -> 0.2
C53: Curitiba, Metropolitana e Ponta Grossa | H53: =D43-H49 -> 95377162 | I53: =IF(D43=0,0,H53/$D$43) -> 0.91279999999999994 | L53: 200 | M53: Regio - Curitiba | R53: 17.31 | S53: 16.12 | U53: =S53-R53 -> -1.19
C54: Araucaria | H54: =D9+D19 -> 3520564 | I54: =IF(D43=0,0,H54/$D$43) -> 3.3700000000000001E-2 | L54: 201 | M54: Regio - Metropolitana | R54: 16 | S54: 16.7 | U54: =S54-R54 -> 0.7
L55: 202 | M55: Regio - Centro Oeste | R55: 16.17 | S55: 15.43 | U55: =S55-R55 -> -0.74