A2: Periodo: | C2: 38231 | D2: a | E2: 38260 | H2: Vendas Acumuladas por Filial | Q2: =NOW() -> 38268.698504513901
A4: v.1 | C4: Vendas 2004 | G4: Vendas de Anos Anteriores | K4: Percentuais ( % ) | Q4: Meta Mensal | U4: Margem
A5: Lojas | C5: Previsao | D5: Realizada | E5: Mes Anterior | G5: Vendas 2003 | H5: Vendas 2002 | I5: Vendas 2001 | K5: % Prev | L5: % MA | M5: 2003 | N5: 2002 | O5: 2001 | Q5: Previsao Mes | R5: Final | S5: Part. | U5: Meta | V5: Real
A7: Xaxim | C7: 850000 | D7: 838924 | E7: 778972 | G7: 766681 | H7: 512843 | I7: 528023 | K7: =IF(C7=0,0,((D7/C7)*100)-100) -> -1.3 | L7: =IF(D7=0,0,IF(E7=0,0,((D7/E7)*100)-100)) -> 7.7 | M7: =IF(G7=0,0,((D7/G7)*100)-100) -> 9.42 | N7: =IF(H7=0,0,((D7/H7)*100)-100) -> 63.58 | O7: =IF(D7=0,0,IF(I7=0,0,((D7/I7)*100)-100)) -> 58.88 | Q7: 850000 | R7: =IF(D7=0,0,((D7/Q7)*100)-100) -> -1.3 | S7: =IF(D7=0,0,(D7/$D$32)*100) -> 1.67 | U7: 16.45 | V7: 12.55
A8: S. Felicidade | C8: 780000 | D8: 766496 | E8: 667844 | G8: 725571 | H8: 574371 | I8: 557863 | K8: =IF(C8=0,0,((D8/C8)*100)-100) -> -1.73 | L8: =IF(D8=0,0,IF(E8=0,0,((D8/E8)*100)-100)) -> 14.77 | M8: =IF(G8=0,0,((D8/G8)*100)-100) -> 5.64 | N8: =IF(H8=0,0,((D8/H8)*100)-100) -> 33.45 | O8: =IF(D8=0,0,IF(I8=0,0,((D8/I8)*100)-100)) -> 37.4 | Q8: 780000 | R8: =IF(D8=0,0,((D8/Q8)*100)-100) -> -1.73 | S8: =IF(D8=0,0,(D8/$D$32)*100) -> 1.53 | U8: 17.1 | V8: 12.25
A9: Lapa | C9: 1150000 | D9: 1223910 | E9: 1067449 | G9: 1003327 | H9: 795637 | I9: 762215 | K9: =IF(C9=0,0,((D9/C9)*100)-100) -> 6.43 | L9: =IF(D9=0,0,IF(E9=0,0,((D9/E9)*100)-100)) -> 14.66 | M9: =IF(G9=0,0,((D9/G9)*100)-100) -> 21.99 | N9: =IF(H9=0,0,((D9/H9)*100)-100) -> 53.83 | O9: =IF(D9=0,0,IF(I9=0,0,((D9/I9)*100)-100)) -> 60.57 | Q9: 1150000 | R9: =IF(D9=0,0,((D9/Q9)*100)-100) -> 6.43 | S9: =IF(D9=0,0,(D9/$D$32)*100) -> 2.44 | U9: 16.05 | V9: 14.45
A10: Araucaria | C10: 1100000 | D10: 929713 | E10: 904182 | G10: 977421 | H10: 852788 | I10: 1480031 | K10: =IF(C10=0,0,((D10/C10)*100)-100) -> -15.48 | L10: =IF(D10=0,0,IF(E10=0,0,((D10/E10)*100)-100)) -> 2.82 | M10: =IF(G10=0,0,((D10/G10)*100)-100) -> -4.88 | N10: =IF(H10=0,0,((D10/H10)*100)-100) -> 9.02 | O10: =IF(D10=0,0,IF(I10=0,0,((D10/I10)*100)-100)) -> -37.18 | Q10: 1100000 | R10: =IF(D10=0,0,((D10/Q10)*100)-100) -> -15.48 | S10: =IF(D10=0,0,(D10/$D$32)*100) -> 1.85 | U10: 17.17 | V10: 16.17
A11: Pinheirinho | C11: 2140000 | D11: 2086456 | E11: 1901812 | G11: 1783647 | H11: 1604252 | I11: 1909489 | K11: =IF(C11=0,0,((D11/C11)*100)-100) -> -2.5 | L11: =IF(D11=0,0,IF(E11=0,0,((D11/E11)*100)-100)) -> 9.71 | M11: =IF(G11=0,0,((D11/G11)*100)-100) -> 16.98 | N11: =IF(H11=0,0,((D11/H11)*100)-100) -> 30.06 | O11: =IF(D11=0,0,IF(I11=0,0,((D11/I11)*100)-100)) -> 9.27 | Q11: 2140000 | R11: =IF(D11=0,0,((D11/Q11)*100)-100) -> -2.5 | S11: =IF(D11=0,0,(D11/$D$32)*100) -> 4.16 | U11: 16.35 | V11: 12.24
A12: Hauer | C12: 3200000 | D12: 3135473 | E12: 2873587 | G12: 2898503 | H12: 2339964 | I12: 2291700 | K12: =IF(C12=0,0,((D12/C12)*100)-100) -> -2.02 | L12: =IF(D12=0,0,IF(E12=0,0,((D12/E12)*100)-100)) -> 9.11 | M12: =IF(G12=0,0,((D12/G12)*100)-100) -> 8.18 | N12: =IF(H12=0,0,((D12/H12)*100)-100) -> 34 | O12: =IF(D12=0,0,IF(I12=0,0,((D12/I12)*100)-100)) -> 36.82 | Q12: 3200000 | R12: =IF(D12=0,0,((D12/Q12)*100)-100) -> -2.02 | S12: =IF(D12=0,0,(D12/$D$32)*100) -> 6.25 | U12: 16.1 | V12: 12.82
A13: Paranagua | C13: 3280000 | D13: 3424238 | E13: 3356982 | G13: 2949278 | H13: 2655929 | I13: 2479175 | K13: =IF(C13=0,0,((D13/C13)*100)-100) -> 4.4 | L13: =IF(D13=0,0,IF(E13=0,0,((D13/E13)*100)-100)) -> 2 | M13: =IF(G13=0,0,((D13/G13)*100)-100) -> 16.1 | N13: =IF(H13=0,0,((D13/H13)*100)-100) -> 28.93 | O13: =IF(D13=0,0,IF(I13=0,0,((D13/I13)*100)-100)) -> 38.12 | Q13: 3280000 | R13: =IF(D13=0,0,((D13/Q13)*100)-100) -> 4.4 | S13: =IF(D13=0,0,(D13/$D$32)*100) -> 6.83 | U13: 17 | V13: 15.74
A14: Centenario | C14: 1030000 | D14: 1076238 | E14: 951154 | G14: 968755 | H14: 698904 | I14: 693192 | K14: =IF(C14=0,0,((D14/C14)*100)-100) -> 4.49 | L14: =IF(D14=0,0,IF(E14=0,0,((D14/E14)*100)-100)) -> 13.15 | M14: =IF(G14=0,0,((D14/G14)*100)-100) -> 11.09 | N14: =IF(H14=0,0,((D14/H14)*100)-100) -> 53.99 | O14: =IF(D14=0,0,IF(I14=0,0,((D14/I14)*100)-100)) -> 55.26 | Q14: 1030000 | R14: =IF(D14=0,0,((D14/Q14)*100)-100) -> 4.49 | S14: =IF(D14=0,0,(D14/$D$32)*100) -> 2.15 | U14: 16.85 | V14: 12.28
A15: Arapongas | C15: 0 | D15: 0 | E15: 0 | G15: 567546 | H15: 444294 | I15: 508342 | K15: =IF(C15=0,0,((D15/C15)*100)-100) -> 0 | L15: =IF(D15=0,0,IF(E15=0,0,((D15/E15)*100)-100)) -> 0 | M15: =IF(D15=0,0,IF(G15=0,0,((D15/G15)*100)-100)) -> 0 | N15: =IF(D15=0,0,IF(H15=0,0,((D15/H15)*100)-100)) -> 0 | O15: =IF(D15=0,0,IF(I15=0,0,((D15/I15)*100)-100)) -> 0 | Q15: 0 | R15: =IF(D15=0,0,((D15/Q15)*100)-100) -> 0 | S15: =IF(D15=0,0,(D15/$D$32)*100) -> 0 | U15: 0 | V15: 0
A16: Sao Braz | C16: 3200000 | D16: 3118069 | E16: 2994943 | G16: 2929933 | H16: 2357537 | I16: 2349189 | K16: =IF(C16=0,0,((D16/C16)*100)-100) -> -2.56 | L16: =IF(D16=0,0,IF(E16=0,0,((D16/E16)*100)-100)) -> 4.11 | M16: =IF(G16=0,0,((D16/G16)*100)-100) -> 6.42 | N16: =IF(H16=0,0,((D16/H16)*100)-100) -> 32.26 | O16: =IF(D16=0,0,IF(I16=0,0,((D16/I16)*100)-100)) -> 32.73 | Q16: 3200000 | R16: =IF(D16=0,0,((D16/Q16)*100)-100) -> -2.56 | S16: =IF(D16=0,0,(D16/$D$32)*100) -> 6.22 | U16: 15.9 | V16: 12.77
A17: Guarapuava | C17: 1450000 | D17: 1649743 | E17: 1504003 | G17: 1198168 | H17: 841242 | I17: 834466 | K17: =IF(C17=0,0,((D17/C17)*100)-100) -> 13.78 | L17: =IF(D17=0,0,IF(E17=0,0,((D17/E17)*100)-100)) -> 9.69 | M17: =IF(G17=0,0,((D17/G17)*100)-100) -> 37.69 | N17: =IF(H17=0,0,((D17/H17)*100)-100) -> 96.11 | O17: =IF(D17=0,0,IF(I17=0,0,((D17/I17)*100)-100)) -> 97.7 | Q17: 1450000 | R17: =IF(D17=0,0,((D17/Q17)*100)-100) -> 13.78 | S17: =IF(D17=0,0,(D17/$D$32)*100) -> 3.29 | U17: 17.07 | V17: 14.97
A18: Apucarana | C18: 1500000 | D18: 1629979 | E18: 1394466 | G18: 1349914 | H18: 1045434 | I18: 1054990 | K18: =IF(C18=0,0,((D18/C18)*100)-100) -> 8.67 | L18: =IF(D18=0,0,IF(E18=0,0,((D18/E18)*100)-100)) -> 16.89 | M18: =IF(G18=0,0,((D18/G18)*100)-100) -> 20.75 | N18: =IF(H18=0,0,((D18/H18)*100)-100) -> 55.91 | O18: =IF(D18=0,0,IF(I18=0,0,((D18/I18)*100)-100)) -> 54.5 | Q18: 1500000 | R18: =IF(D18=0,0,((D18/Q18)*100)-100) -> 8.67 | S18: =IF(D18=0,0,(D18/$D$32)*100) -> 3.25 | U18: 17.5 | V18: 15.17
A19: Ahu | C19: 1280000 | D19: 1246862 | E19: 1108567 | G19: 1250461 | H19: 957904 | I19: 1191353 | K19: =IF(C19=0,0,((D19/C19)*100)-100) -> -2.59 | L19: =IF(D19=0,0,IF(E19=0,0,((D19/E19)*100)-100)) -> 12.48 | M19: =IF(G19=0,0,((D19/G19)*100)-100) -> -00.29 | N19: =IF(H19=0,0,((D19/H19)*100)-100) -> 30.17 | O19: =IF(D19=0,0,IF(I19=0,0,((D19/I19)*100)-100)) -> 4.66 | Q19: 1280000 | R19: =IF(D19=0,0,((D19/Q19)*100)-100) -> -2.59 | S19: =IF(D19=0,0,(D19/$D$32)*100) -> 2.49 | U19: 17.1 | V19: 12.89
A20: P.G. Centro | C20: 1790000 | D20: 1750608 | E20: 1670532 | G20: 1621539 | H20: 1262066 | I20: 1078021 | K20: =IF(C20=0,0,((D20/C20)*100)-100) -> -2.2 | L20: =IF(D20=0,0,IF(E20=0,0,((D20/E20)*100)-100)) -> 4.79 | M20: =IF(G20=0,0,((D20/G20)*100)-100) -> 7.96 | N20: =IF(H20=0,0,((D20/H20)*100)-100) -> 38.71 | O20: =IF(D20=0,0,IF(I20=0,0,((D20/I20)*100)-100)) -> 62.39 | Q20: 1790000 | R20: =IF(D20=0,0,((D20/Q20)*100)-100) -> -2.2 | S20: =IF(D20=0,0,(D20/$D$32)*100) -> 3.49 | U20: 17.5 | V20: 16.07
A21: Maringa | C21: 2340000 | D21: 2342033 | E21: 2104226 | G21: 2148664 | H21: 1660092 | I21: 1504600 | K21: =IF(C21=0,0,((D21/C21)*100)-100) -> 00.09 | L21: =IF(D21=0,0,IF(E21=0,0,((D21/E21)*100)-100)) -> 11.3 | M21: =IF(G21=0,0,((D21/G21)*100)-100) -> 9 | N21: =IF(H21=0,0,((D21/H21)*100)-100) -> 41.08 | O21: =IF(D21=0,0,IF(I21=0,0,((D21/I21)*100)-100)) -> 55.66 | Q21: 2340000 | R21: =IF(D21=0,0,((D21/Q21)*100)-100) -> 00.09 | S21: =IF(D21=0,0,(D21/$D$32)*100) -> 4.67 | U21: 17.8 | V21: 15.28
A22: Araucaria Nova | C22: 2000000 | D22: 2149964 | E22: 2160030 | G22: 1771505 | H22: 1838723 | I22: 0 | K22: =IF(C22=0,0,((D22/C22)*100)-100) -> 7.5 | L22: =IF(D22=0,0,IF(E22=0,0,((D22/E22)*100)-100)) -> -00.47 | M22: =IF(G22=0,0,((D22/G22)*100)-100) -> 21.36 | N22: =IF(H22=0,0,((D22/H22)*100)-100) -> 16.93 | O22: =IF(D22=0,0,IF(I22=0,0,((D22/I22)*100)-100)) -> 0 | Q22: 2000000 | R22: =IF(D22=0,0,((D22/Q22)*100)-100) -> 7.5 | S22: =IF(D22=0,0,(D22/$D$32)*100) -> 4.29 | U22: 17.5 | V22: 15.21
A23: Total Super | C23: =SUM(C7:C22) -> 27090000 | D23: =SUM(D7:D22) -> 27368706 | E23: =SUM(E7:E22) -> 25438749 | G23: =SUM(G7:G22) -> 24910913 | H23: =SUM(H7:H22) -> 20441980 | I23: =SUM(I7:I22) -> 19222649 | J23: =SUM(C23:I23) -> 144472997 | K23: =IF(D23=0,0,((D23/C23)*100)-100) -> 1.03 | L23: =IF(D23=0,0,IF(E23=0,0,((D23/E23)*100)-100)) -> 7.59 | M23: =IF(G23=0,0,IF(D23=0,0,((D23/G23)*100)-100)) -> 9.87 | N23: =IF(H23=0,0,IF(D23=0,0,((D23/H23)*100)-100)) -> 33.88 | O23: =IF(D23=0,0,IF(I23=0,0,((D23/I23)*100)-100)) -> 42.38 | Q23: =SUM(Q7:Q22) -> 27090000 | R23: =IF(D23=0,0,((D23/Q23)*100)-100) -> 1.03 | S23: =IF(D23=0,0,(D23/$D$32)*100) -> 54.55 | U23: 16.93 | V23: 14.48
A25: Londrina | C25: 2380000 | D25: 2407890 | E25: 2115832 | G25: 2267201 | H25: 1824304 | I25: 1774415 | K25: =IF(C25=0,0,((D25/C25)*100)-100) -> 1.17 | L25: =IF(D25=0,0,IF(E25=0,0,((D25/E25)*100)-100)) -> 13.8 | M25: =IF(G25=0,0,((D25/G25)*100)-100) -> 6.21 | N25: =IF(H25=0,0,((D25/H25)*100)-100) -> 31.99 | O25: =IF(D25=0,0,IF(I25=0,0,((D25/I25)*100)-100)) -> 35.7 | Q25: 2380000 | R25: =IF(D25=0,0,((D25/Q25)*100)-100) -> 1.17 | S25: =IF(D25=0,0,(D25/$D$32)*100) -> 4.8 | U25: 17.8 | V25: 13.97
A26: S.J. Pinhais | C26: 4350000 | D26: 4212584 | E26: 4180216 | G26: 3902807 | H26: 3208818 | I26: 2908598 | K26: =IF(C26=0,0,((D26/C26)*100)-100) -> -3.16 | L26: =IF(D26=0,0,IF(E26=0,0,((D26/E26)*100)-100)) -> 00.77 | M26: =IF(G26=0,0,((D26/G26)*100)-100) -> 7.94 | N26: =IF(H26=0,0,((D26/H26)*100)-100) -> 31.28 | O26: =IF(D26=0,0,IF(I26=0,0,((D26/I26)*100)-100)) -> 44.83 | Q26: 4350000 | R26: =IF(D25=0,0,((D26/Q26)*100)-100) -> -3.16 | S26: =IF(D26=0,0,(D26/$D$32)*100) -> 8.4 | U26: 15.9 | V26: 14.24
A27: P.G. Nova | C27: 3250000 | D27: 3481841 | E27: 3170183 | G27: 2828674 | H27: 2512925 | I27: 2263255 | K27: =IF(C27=0,0,((D27/C27)*100)-100) -> 7.13 | L27: =IF(D27=0,0,IF(E27=0,0,((D27/E27)*100)-100)) -> 9.83 | M27: =IF(G27=0,0,((D27/G27)*100)-100) -> 23.09 | N27: =IF(H27=0,0,((D27/H27)*100)-100) -> 38.56 | O27: =IF(D27=0,0,IF(I27=0,0,((D27/I27)*100)-100)) -> 53.84 | Q27: 3250000 | R27: =IF(D26=0,0,((D27/Q27)*100)-100) -> 7.13 | S27: =IF(D27=0,0,(D27/$D$32)*100) -> 6.94 | U27: 16.35 | V27: 14.72
A28: Nilo Pecanha | C28: 8550000 | D28: 7986774 | E28: 8352404 | G28: 7819661 | H28: 6020615 | I28: 0 | K28: =IF(C28=0,0,((D28/C28)*100)-100) -> -6.59 | L28: =IF(D28=0,0,IF(E28=0,0,((D28/E28)*100)-100)) -> -4.38 | M28: =IF(G28=0,0,((D28/G28)*100)-100) -> 2.14 | N28: =IF(H28=0,0,((D28/H28)*100)-100) -> 32.66 | O28: =IF(D28=0,0,IF(I28=0,0,((D28/I28)*100)-100)) -> 0 | Q28: 8550000 | R28: =IF(D26=0,0,((D28/Q28)*100)-100) -> -6.59 | S28: =IF(D28=0,0,(D28/$D$32)*100) -> 15.92 | U28: 15.2 | V28: 14.44
A29: Champagnat | C29: 5250000 | D29: 4711048 | E29: 4887601 | G29: 0 | H29: 0 | I29: 0 | K29: =IF(C29=0,0,((D29/C29)*100)-100) -> -10.27 | L29: =IF(D29=0,0,IF(E29=0,0,((D29/E29)*100)-100)) -> -3.61 | M29: =IF(G29=0,0,((D29/G29)*100)-100) -> 0 | N29: =IF(H29=0,0,((D29/H29)*100)-100) -> 0 | O29: =IF(D29=0,0,IF(I29=0,0,((D29/I29)*100)-100)) -> 0 | Q29: 5250000 | R29: =IF(D27=0,0,((D29/Q29)*100)-100) -> -10.27 | S29: =IF(D29=0,0,(D29/$D$32)*100) -> 9.39 | U29: 15.35 | V29: 13.45
A30: Total Hiper | C30: =SUM(C25:C29) -> 23780000 | D30: =SUM(D25:D29) -> 22800137 | E30: =SUM(E25:E29) -> 22706236 | G30: =SUM(G25:G29) -> 16818343 | H30: =SUM(H25:H29) -> 13566662 | I30: =SUM(I25:I29) -> 6946268 | J30: =SUM(C30:I30) -> 106617646 | K30: =IF(D30=0,0,((D30/C30)*100)-100) -> -4.12 | L30: =IF(D30=0,0,IF(E30=0,0,((D30/E30)*100)-100)) -> 00.41 | M30: =IF(G30=0,0,IF(D30=0,0,((D30/G30)*100)-100)) -> 35.57 | N30: =IF(H30=0,0,IF(D30=0,0,((D30/H30)*100)-100)) -> 68.06 | O30: =IF(D30=0,0,IF(I30=0,0,((D30/I30)*100)-100)) -> 228.24 | Q30: =SUM(Q25:Q29) -> 23780000 | R30: =IF(D30=0,0,((D30/Q30)*100)-100) -> -4.12 | S30: =IF(D30=0,0,(D30/$D$32)*100) -> 45.45 | U30: 15.78 | V30: 0
A32: Total Geral | C32: =C23+C30 -> 50870000 | D32: =D23+D30 -> 50168843 | E32: =E23+E30 -> 48144985 | G32: =G23+G30 -> 41729256 | H32: =H23+H30 -> 34008642 | I32: =I23+I30 -> 26168917 | K32: =IF(D30=0,0,((D32/C32)*100)-100) -> -1.38 | L32: =IF(D32=0,0,IF(E32=0,0,((D32/E32)*100)-100)) -> 4.2 | M32: =IF(G32=0,0,IF(D32=0,0,((D32/G32)*100)-100)) -> 20.22 | N32: =IF(H32=0,0,IF(D32=0,0,((D32/H32)*100)-100)) -> 47.52 | O32: =IF(D32=0,0,IF(I32=0,0,((D32/I32)*100)-100)) -> 91.71 | Q32: =Q23+Q30 -> 50870000 | R32: =IF(D32=0,0,((D32/Q32)*100)-100) -> -1.38 | S32: =S23+S30 -> 100 | U32: 16.34 | V32: 13.71
C33: Resumo por Regiao - Outubro/2002
C34: Descricao das Aberturas | H34: Valor | I34: %
C35: Curitiba (2,3,6,7,10,11,17,21,22) | H35: =D7+D8+D11+D12+D14+D16+D19+D28+D29 -> 24966340 | I35: =IF(D32=0,0,H35/$D$32) -> 0.49759999999999999
C36: Curitiba e Metrop. (Ctba. 4,5,8,14,23) | H36: =H35+D9+D10+D13+D27+D22 -> 36176006 | I36: =IF(D32=0,0,H36/$D$32) -> 0.72109999999999996
C37: Metropolitana (4,5,8,14,23) | H37: =H36-H35 -> 11209666 | I37: =IF(D32=0,0,H37/$D$32) -> 0.22339999999999999
C38: Norte (9,15,20) | H38: =D25+D18+D22 -> 6187833 | I38: =IF(D32=0,0,H38/$D$32) -> 0.12330000000000001
C39: Centro-Oeste (13,18,19) | H39: =D17+D20+D27 -> 6882192 | I39: =IF(D32=0,0,H39/$D$32) -> 0.13719999999999999
C40: Ponta Grossa (18,19) | H40: =H39-D17 -> 5232449 | I40: =IF(D32=0,0,H40/$D$32) -> 0.1043
C41: Super (2,3,4,5,6,7,8,10,11,13,15,17,18,20,23) | H41: =D23 -> 27368706 | I41: =IF(D32=0,0,H41/$D$32) -> 0.54549999999999998
C42: Hiper (9,14,19,21,22) | H42: =D30 -> 22800137 | I42: =IF(D32=0,0,H42/$D$32) -> 0.45450000000000002
C43: Curitiba, Metropolitana e Centro-Oeste | H43: =D32-H38 -> 43981010 | I43: =IF(D32=0,0,H43/$D$32) -> 0.87670000000000003
C44: Araucaria | H44: =D10+D22 -> 3079677 | I44: =IF(D32=0,0,H44/$D$32) -> 6.1400000000000003E-2