A2: Perodo: | C2: 38139 | E2: 38168 | H2: Vendas Acumuladas por Filial | Q2: =NOW() -> 38188.614646990703
A4: v.1 | C4: Vendas 2004 | G4: Vendas de Anos Anteriores | K4: Percentuais ( % ) | Q4: Meta Mensal | U4: Margem
A5: Lojas | C5: Previso | D5: Realizada | E5: Ms Anterior | G5: Vendas 2003 | H5: Vendas 2002 | I5: Vendas 2001 | K5: % Prev | L5: % MA | M5: 2003 | N5: 2002 | O5: 2001 | Q5: Previso Ms | R5: Final | S5: Part. | U5: Meta | V5: Real
A7: Xaxim | C7: 745000 | D7: 717141 | E7: 713750 | G7: 679172 | H7: 565524 | I7: 487480 | K7: =IF(C7=0,0,((D7/C7)*100)-100) -> -3.74 | L7: =IF(D7=0,0,IF(E7=0,0,((D7/E7)*100)-100)) -> 00.48 | M7: =IF(G7=0,0,((D7/G7)*100)-100) -> 5.59 | N7: =IF(H7=0,0,((D7/H7)*100)-100) -> 26.81 | O7: =IF(D7=0,0,IF(I7=0,0,((D7/I7)*100)-100)) -> 47.11 | Q7: 745000 | R7: =IF(D7=0,0,((D7/Q7)*100)-100) -> -3.74 | S7: =IF(D7=0,0,(D7/$D$32)*100) -> 1.58 | U7: 16.45 | V7: 16.08
A8: S. Felicidade | C8: 730000 | D8: 630404 | E8: 650037 | G8: 717340 | H8: 522682 | I8: 553640 | K8: =IF(C8=0,0,((D8/C8)*100)-100) -> -13.64 | L8: =IF(D8=0,0,IF(E8=0,0,((D8/E8)*100)-100)) -> -3.02 | M8: =IF(G8=0,0,((D8/G8)*100)-100) -> -12.12 | N8: =IF(H8=0,0,((D8/H8)*100)-100) -> 20.61 | O8: =IF(D8=0,0,IF(I8=0,0,((D8/I8)*100)-100)) -> 13.87 | Q8: 730000 | R8: =IF(D8=0,0,((D8/Q8)*100)-100) -> -13.64 | S8: =IF(D8=0,0,(D8/$D$32)*100) -> 1.39 | U8: 17.5 | V8: 17.69
A9: Lapa | C9: 1110000 | D9: 1051047 | E9: 1074434 | G9: 962008 | H9: 786968 | I9: 721427 | K9: =IF(C9=0,0,((D9/C9)*100)-100) -> -5.31 | L9: =IF(D9=0,0,IF(E9=0,0,((D9/E9)*100)-100)) -> -2.18 | M9: =IF(G9=0,0,((D9/G9)*100)-100) -> 9.26 | N9: =IF(H9=0,0,((D9/H9)*100)-100) -> 33.56 | O9: =IF(D9=0,0,IF(I9=0,0,((D9/I9)*100)-100)) -> 45.69 | Q9: 1110000 | R9: =IF(D9=0,0,((D9/Q9)*100)-100) -> -5.31 | S9: =IF(D9=0,0,(D9/$D$32)*100) -> 2.32 | U9: 16.05 | V9: 15.94
A10: Araucria | C10: 1122000 | D10: 960060 | E10: 1024926 | G10: 980761 | H10: 1484185 | I10: 1476446 | K10: =IF(C10=0,0,((D10/C10)*100)-100) -> -14.43 | L10: =IF(D10=0,0,IF(E10=0,0,((D10/E10)*100)-100)) -> -6.33 | M10: =IF(G10=0,0,((D10/G10)*100)-100) -> -2.11 | N10: =IF(H10=0,0,((D10/H10)*100)-100) -> -35.31 | O10: =IF(D10=0,0,IF(I10=0,0,((D10/I10)*100)-100)) -> -34.97 | Q10: 1122000 | R10: =IF(D10=0,0,((D10/Q10)*100)-100) -> -14.43 | S10: =IF(D10=0,0,(D10/$D$32)*100) -> 2.11 | U10: 17.2 | V10: 17.3
A11: Pinheirinho | C11: 2200000 | D11: 1828470 | E11: 1876577 | G11: 1820985 | H11: 1680332 | I11: 1643582 | K11: =IF(C11=0,0,((D11/C11)*100)-100) -> -16.89 | L11: =IF(D11=0,0,IF(E11=0,0,((D11/E11)*100)-100)) -> -2.56 | M11: =IF(G11=0,0,((D11/G11)*100)-100) -> 00.41 | N11: =IF(H11=0,0,((D11/H11)*100)-100) -> 8.82 | O11: =IF(D11=0,0,IF(I11=0,0,((D11/I11)*100)-100)) -> 11.25 | Q11: 2200000 | R11: =IF(D11=0,0,((D11/Q11)*100)-100) -> -16.89 | S11: =IF(D11=0,0,(D11/$D$32)*100) -> 4.03 | U11: 16.3 | V11: 16
A12: Hauer | C12: 2990000 | D12: 2720835 | E12: 2801803 | G12: 2735855 | H12: 2457303 | I12: 2287960 | K12: =IF(C12=0,0,((D12/C12)*100)-100) -> -9 | L12: =IF(D12=0,0,IF(E12=0,0,((D12/E12)*100)-100)) -> -2.89 | M12: =IF(G12=0,0,((D12/G12)*100)-100) -> -00.55 | N12: =IF(H12=0,0,((D12/H12)*100)-100) -> 10.72 | O12: =IF(D12=0,0,IF(I12=0,0,((D12/I12)*100)-100)) -> 18.92 | Q12: 2990000 | R12: =IF(D12=0,0,((D12/Q12)*100)-100) -> -9 | S12: =IF(D12=0,0,(D12/$D$32)*100) -> 5.99 | U12: 16.1 | V12: 16.67
A13: Paranagu | C13: 3050000 | D13: 2989738 | E13: 3104473 | G13: 2737779 | H13: 2511117 | I13: 2353977 | K13: =IF(C13=0,0,((D13/C13)*100)-100) -> -1.98 | L13: =IF(D13=0,0,IF(E13=0,0,((D13/E13)*100)-100)) -> -3.7 | M13: =IF(G13=0,0,((D13/G13)*100)-100) -> 9.2 | N13: =IF(H13=0,0,((D13/H13)*100)-100) -> 19.06 | O13: =IF(D13=0,0,IF(I13=0,0,((D13/I13)*100)-100)) -> 27.01 | Q13: 3050000 | R13: =IF(D13=0,0,((D13/Q13)*100)-100) -> -1.98 | S13: =IF(D13=0,0,(D13/$D$32)*100) -> 6.59 | U13: 17 | V13: 17.39
A14: Centenrio | C14: 970000 | D14: 814210 | E14: 847250 | G14: 929659 | H14: 745967 | I14: 671376 | K14: =IF(C14=0,0,((D14/C14)*100)-100) -> -16.06 | L14: =IF(D14=0,0,IF(E14=0,0,((D14/E14)*100)-100)) -> -3.9 | M14: =IF(G14=0,0,((D14/G14)*100)-100) -> -12.42 | N14: =IF(H14=0,0,((D14/H14)*100)-100) -> 9.15 | O14: =IF(D14=0,0,IF(I14=0,0,((D14/I14)*100)-100)) -> 21.27 | Q14: 970000 | R14: =IF(D14=0,0,((D14/Q14)*100)-100) -> -16.06 | S14: =IF(D14=0,0,(D14/$D$32)*100) -> 1.79 | U14: 16.85 | V14: 16.76
A15: Arapongas | C15: 0 | D15: 0 | E15: 0 | G15: 541866 | H15: 509317 | I15: 551410 | K15: =IF(C15=0,0,((D15/C15)*100)-100) -> 0 | L15: =IF(D15=0,0,IF(E15=0,0,((D15/E15)*100)-100)) -> 0 | M15: =IF(D15=0,0,IF(G15=0,0,((D15/G15)*100)-100)) -> 0 | N15: =IF(D15=0,0,IF(H15=0,0,((D15/H15)*100)-100)) -> 0 | O15: =IF(D15=0,0,IF(I15=0,0,((D15/I15)*100)-100)) -> 0 | Q15: 0 | R15: =IF(D15=0,0,((D15/Q15)*100)-100) -> 0 | S15: =IF(D15=0,0,(D15/$D$32)*100) -> 0 | U15: 0 | V15: 0
A16: So Brz | C16: 3150000 | D16: 2816856 | E16: 2919242 | G16: 3004389 | H16: 2436629 | I16: 2602345 | K16: =IF(C16=0,0,((D16/C16)*100)-100) -> -10.58 | L16: =IF(D16=0,0,IF(E16=0,0,((D16/E16)*100)-100)) -> -3.51 | M16: =IF(G16=0,0,((D16/G16)*100)-100) -> -6.24 | N16: =IF(H16=0,0,((D16/H16)*100)-100) -> 15.6 | O16: =IF(D16=0,0,IF(I16=0,0,((D16/I16)*100)-100)) -> 8.24 | Q16: 3150000 | R16: =IF(D16=0,0,((D16/Q16)*100)-100) -> -10.58 | S16: =IF(D16=0,0,(D16/$D$32)*100) -> 6.21 | U16: 16.7 | V16: 16.55
A17: Guarapuava | C17: 1450000 | D17: 1444058 | E17: 1374627 | G17: 1288308 | H17: 856997 | I17: 891998 | K17: =IF(C17=0,0,((D17/C17)*100)-100) -> -00.41 | L17: =IF(D17=0,0,IF(E17=0,0,((D17/E17)*100)-100)) -> 5.05 | M17: =IF(G17=0,0,((D17/G17)*100)-100) -> 12.09 | N17: =IF(H17=0,0,((D17/H17)*100)-100) -> 68.5 | O17: =IF(D17=0,0,IF(I17=0,0,((D17/I17)*100)-100)) -> 61.89 | Q17: 1450000 | R17: =IF(D17=0,0,((D17/Q17)*100)-100) -> -00.41 | S17: =IF(D17=0,0,(D17/$D$32)*100) -> 3.18 | U17: 17.36 | V17: 16.25
A18: Apucarana | C18: 1400000 | D18: 1336992 | E18: 1320974 | G18: 1221294 | H18: 1123883 | I18: 1142952 | K18: =IF(C18=0,0,((D18/C18)*100)-100) -> -4.5 | L18: =IF(D18=0,0,IF(E18=0,0,((D18/E18)*100)-100)) -> 1.21 | M18: =IF(G18=0,0,((D18/G18)*100)-100) -> 9.47 | N18: =IF(H18=0,0,((D18/H18)*100)-100) -> 18.96 | O18: =IF(D18=0,0,IF(I18=0,0,((D18/I18)*100)-100)) -> 16.98 | Q18: 1400000 | R18: =IF(D18=0,0,((D18/Q18)*100)-100) -> -4.5 | S18: =IF(D18=0,0,(D18/$D$32)*100) -> 2.95 | U18: 17.24 | V18: 17.4
A19: Ah | C19: 1200000 | D19: 1013318 | E19: 1034805 | G19: 1223100 | H19: 1039700 | I19: 1151013 | K19: =IF(C19=0,0,((D19/C19)*100)-100) -> -15.56 | L19: =IF(D19=0,0,IF(E19=0,0,((D19/E19)*100)-100)) -> -2.08 | M19: =IF(G19=0,0,((D19/G19)*100)-100) -> -17.15 | N19: =IF(H19=0,0,((D19/H19)*100)-100) -> -2.54 | O19: =IF(D19=0,0,IF(I19=0,0,((D19/I19)*100)-100)) -> -11.96 | Q19: 1200000 | R19: =IF(D19=0,0,((D19/Q19)*100)-100) -> -15.56 | S19: =IF(D19=0,0,(D19/$D$32)*100) -> 2.23 | U19: 17.4 | V19: 17.83
A20: P.G. Centro | C20: 1700000 | D20: 1603418 | E20: 1601128 | G20: 1555339 | H20: 1214109 | I20: 1130061 | K20: =IF(C20=0,0,((D20/C20)*100)-100) -> -5.68 | L20: =IF(D20=0,0,IF(E20=0,0,((D20/E20)*100)-100)) -> 00.14 | M20: =IF(G20=0,0,((D20/G20)*100)-100) -> 3.09 | N20: =IF(H20=0,0,((D20/H20)*100)-100) -> 32.07 | O20: =IF(D20=0,0,IF(I20=0,0,((D20/I20)*100)-100)) -> 41.89 | Q20: 1700000 | R20: =IF(D20=0,0,((D20/Q20)*100)-100) -> -5.68 | S20: =IF(D20=0,0,(D20/$D$32)*100) -> 3.53 | U20: 17.5 | V20: 18.57
A21: Maring | C21: 2100000 | D21: 2026575 | E21: 1999804 | G21: 1818608 | H21: 1603123 | I21: 1760604 | K21: =IF(C21=0,0,((D21/C21)*100)-100) -> -3.5 | L21: =IF(D21=0,0,IF(E21=0,0,((D21/E21)*100)-100)) -> 1.34 | M21: =IF(G21=0,0,((D21/G21)*100)-100) -> 11.44 | N21: =IF(H21=0,0,((D21/H21)*100)-100) -> 26.41 | O21: =IF(D21=0,0,IF(I21=0,0,((D21/I21)*100)-100)) -> 15.11 | Q21: 2100000 | R21: =IF(D21=0,0,((D21/Q21)*100)-100) -> -3.5 | S21: =IF(D21=0,0,(D21/$D$32)*100) -> 4.46 | U21: 17.89 | V21: 17.61
A22: Araucria Nova | C22: 2050000 | D22: 1949037 | E22: 2036417 | G22: 1844683 | H22: 0 | I22: 0 | K22: =IF(C22=0,0,((D22/C22)*100)-100) -> -4.93 | L22: =IF(D22=0,0,IF(E22=0,0,((D22/E22)*100)-100)) -> -4.29 | M22: =IF(G22=0,0,((D22/G22)*100)-100) -> 5.66 | N22: =IF(H22=0,0,((D22/H22)*100)-100) -> 0 | O22: =IF(D22=0,0,IF(I22=0,0,((D22/I22)*100)-100)) -> 0 | Q22: 2050000 | R22: =IF(D22=0,0,((D22/Q22)*100)-100) -> -4.93 | S22: =IF(D22=0,0,(D22/$D$32)*100) -> 4.29 | U22: 17.4 | V22: 17.1
A23: Total Super | C23: =SUM(C7:C22) -> 25967000 | D23: =SUM(D7:D22) -> 23902159 | E23: =SUM(E7:E22) -> 24380247 | G23: =SUM(G7:G22) -> 24061146 | H23: =SUM(H7:H22) -> 19537836 | I23: =SUM(I7:I22) -> 19426271 | J23: =SUM(C23:I23) -> 137274659 | K23: =IF(D23=0,0,((D23/C23)*100)-100) -> -7.95 | L23: =IF(D23=0,0,IF(E23=0,0,((D23/E23)*100)-100)) -> -1.96 | M23: =IF(G23=0,0,IF(D23=0,0,((D23/G23)*100)-100)) -> -00.66 | N23: =IF(H23=0,0,IF(D23=0,0,((D23/H23)*100)-100)) -> 22.34 | O23: =IF(D23=0,0,IF(I23=0,0,((D23/I23)*100)-100)) -> 23.04 | Q23: =SUM(Q7:Q22) -> 25967000 | R23: =IF(D23=0,0,((D23/Q23)*100)-100) -> -7.95 | S23: =IF(D23=0,0,(D23/$D$32)*100) -> 52.66 | U23: 17.04 | V23: 16.82
A25: Londrina | C25: 2400000 | D25: 2174739 | E25: 2260669 | G25: 2015177 | H25: 1991154 | I25: 2101153 | K25: =IF(C25=0,0,((D25/C25)*100)-100) -> -9.39 | L25: =IF(D25=0,0,IF(E25=0,0,((D25/E25)*100)-100)) -> -3.8 | M25: =IF(G25=0,0,((D25/G25)*100)-100) -> 7.92 | N25: =IF(H25=0,0,((D25/H25)*100)-100) -> 9.22 | O25: =IF(D25=0,0,IF(I25=0,0,((D25/I25)*100)-100)) -> 3.5 | Q25: 2400000 | R25: =IF(D25=0,0,((D25/Q25)*100)-100) -> -9.39 | S25: =IF(D25=0,0,(D25/$D$32)*100) -> 4.79 | U25: 17.8 | V25: 15.43
A26: S.J. Pinhais | C26: 4300000 | D26: 3950795 | E26: 4106455 | G26: 3765254 | H26: 3303232 | I26: 2808605 | K26: =IF(C26=0,0,((D26/C26)*100)-100) -> -8.12 | L26: =IF(D26=0,0,IF(E26=0,0,((D26/E26)*100)-100)) -> -3.79 | M26: =IF(G26=0,0,((D26/G26)*100)-100) -> 4.93 | N26: =IF(H26=0,0,((D26/H26)*100)-100) -> 19.6 | O26: =IF(D26=0,0,IF(I26=0,0,((D26/I26)*100)-100)) -> 40.67 | Q26: 4300000 | R26: =IF(D25=0,0,((D26/Q26)*100)-100) -> -8.12 | S26: =IF(D26=0,0,(D26/$D$32)*100) -> 8.7 | U26: 16.15 | V26: 15.79
A27: P.G. Nova | C27: 3200000 | D27: 3023353 | E27: 3147362 | G27: 2746314 | H27: 2521921 | I27: 2353361 | K27: =IF(C27=0,0,((D27/C27)*100)-100) -> -5.52 | L27: =IF(D27=0,0,IF(E27=0,0,((D27/E27)*100)-100)) -> -3.94 | M27: =IF(G27=0,0,((D27/G27)*100)-100) -> 10.09 | N27: =IF(H27=0,0,((D27/H27)*100)-100) -> 19.88 | O27: =IF(D27=0,0,IF(I27=0,0,((D27/I27)*100)-100)) -> 28.47 | Q27: 3200000 | R27: =IF(D26=0,0,((D27/Q27)*100)-100) -> -5.52 | S27: =IF(D27=0,0,(D27/$D$32)*100) -> 6.66 | U27: 16.22 | V27: 16.3
A28: Nilo Peanha | C28: 8300000 | D28: 7815025 | E28: 8054371 | G28: 7956506 | H28: 6027353 | I28: 0 | K28: =IF(C28=0,0,((D28/C28)*100)-100) -> -5.84 | L28: =IF(D28=0,0,IF(E28=0,0,((D28/E28)*100)-100)) -> -2.97 | M28: =IF(G28=0,0,((D28/G28)*100)-100) -> -1.78 | N28: =IF(H28=0,0,((D28/H28)*100)-100) -> 29.66 | O28: =IF(D28=0,0,IF(I28=0,0,((D28/I28)*100)-100)) -> 0 | Q28: 8300000 | R28: =IF(D26=0,0,((D28/Q28)*100)-100) -> -5.84 | S28: =IF(D28=0,0,(D28/$D$32)*100) -> 17.22 | U28: 15.84 | V28: 14.96
A29: Champagnat | C29: 5300000 | D29: 4527364 | E29: 5072944 | G29: 0 | H29: 0 | I29: 0 | K29: =IF(C29=0,0,((D29/C29)*100)-100) -> -14.58 | L29: =IF(D29=0,0,IF(E29=0,0,((D29/E29)*100)-100)) -> -10.75 | M29: =IF(G29=0,0,((D29/G29)*100)-100) -> 0 | N29: =IF(H29=0,0,((D29/H29)*100)-100) -> 0 | O29: =IF(D29=0,0,IF(I29=0,0,((D29/I29)*100)-100)) -> 0 | Q29: 5300000 | R29: 0 | S29: =IF(D29=0,0,(D29/$D$32)*100) -> 9.97 | U29: 14.5 | V29: 13.73
A30: Total Hiper | C30: =SUM(C25:C29) -> 23500000 | D30: =SUM(D25:D29) -> 21491276 | E30: =SUM(E25:E29) -> 22641801 | G30: =SUM(G25:G29) -> 16483251 | H30: =SUM(H25:H29) -> 13843660 | I30: =SUM(I25:I29) -> 7263119 | J30: =SUM(C30:I30) -> 105223107 | K30: =IF(D30=0,0,((D30/C30)*100)-100) -> -8.55 | L30: =IF(D30=0,0,IF(E30=0,0,((D30/E30)*100)-100)) -> -5.08 | M30: =IF(G30=0,0,IF(D30=0,0,((D30/G30)*100)-100)) -> 30.38 | N30: =IF(H30=0,0,IF(D30=0,0,((D30/H30)*100)-100)) -> 55.24 | O30: =IF(D30=0,0,IF(I30=0,0,((D30/I30)*100)-100)) -> 195.9 | Q30: =SUM(Q25:Q29) -> 23500000 | R30: =IF(D30=0,0,((D30/Q30)*100)-100) -> -8.55 | S30: =IF(D30=0,0,(D30/$D$32)*100) -> 47.34 | U30: 15.85 | V30: 15.64
A32: Total Geral | C32: =C23+C30 -> 49467000 | D32: =D23+D30 -> 45393435 | E32: =E23+E30 -> 47022048 | G32: =G23+G30 -> 40544397 | H32: =H23+H30 -> 33381496 | I32: =I23+I30 -> 26689390 | K32: =IF(D30=0,0,((D32/C32)*100)-100) -> -8.23 | L32: =IF(D32=0,0,IF(E32=0,0,((D32/E32)*100)-100)) -> -3.46 | M32: =IF(G32=0,0,IF(D32=0,0,((D32/G32)*100)-100)) -> 11.96 | N32: =IF(H32=0,0,IF(D32=0,0,((D32/H32)*100)-100)) -> 35.98 | O32: =IF(D32=0,0,IF(I32=0,0,((D32/I32)*100)-100)) -> 70.08 | Q32: =Q23+Q30 -> 49467000 | R32: =IF(D32=0,0,((D32/Q32)*100)-100) -> -8.23 | S32: =S23+S30 -> 100 | U32: 16.43 | V32: 16.1
C33: Resumo por Regio - Outubro/2002
C34: Descrio das Aberturas | H34: Valor | I34: %
C35: Curitiba (2,3,6,7,10,11,17,21,22) | H35: =D7+D8+D11+D12+D14+D16+D19+D28+D29 -> 22883623 | I35: =IF(D32=0,0,H35/$D$32) -> 0.50409999999999999
C36: Curitiba e Metrop. (Ctba. 4,5,8,14,23) | H36: =H35+D9+D10+D13+D27+D22 -> 32856858 | I36: =IF(D32=0,0,H36/$D$32) -> 0.7238
C37: Metropolitana (4,5,8,14,23) | H37: =H36-H35 -> 9973235 | I37: =IF(D32=0,0,H37/$D$32) -> 0.21970000000000001
C38: Norte (9,15,20) | H38: =D25+D18+D22 -> 5460768 | I38: =IF(D32=0,0,H38/$D$32) -> 0.1203
C39: Centro-Oeste (13,18,19) | H39: =D17+D20+D27 -> 6070829 | I39: =IF(D32=0,0,H39/$D$32) -> 0.13370000000000001
C40: Ponta Grossa (18,19) | H40: =H39-D17 -> 4626771 | I40: =IF(D32=0,0,H40/$D$32) -> 0.1019
C41: Super (2,3,4,5,6,7,8,10,11,13,15,17,18,20,23) | H41: =D23 -> 23902159 | I41: =IF(D32=0,0,H41/$D$32) -> 0.52659999999999996
C42: Hiper (9,14,19,21,22) | H42: =D30 -> 21491276 | I42: =IF(D32=0,0,H42/$D$32) -> 0.47339999999999999
C43: Curitiba, Metropolitana e Centro-Oeste | H43: =D32-H38 -> 39932667 | I43: =IF(D32=0,0,H43/$D$32) -> 0.87970000000000004
C44: Araucria | H44: =D10+D22 -> 2909097 | I44: =IF(D32=0,0,H44/$D$32) -> 6.4100000000000004E-2