A2: Periodo: | C2: 38384 | D2: a | E2: 38411 | H2: Vendas Acumuladas por Filial | Q2: =NOW() -> 38419.646052083299
A4: v.1 | C4: Vendas 2005 | G4: Vendas de Anos Anteriores | K4: Percentuais ( % ) | Q4: Meta Mensal | U4: Margem
A5: Lojas | C5: Previsao | D5: Realizada | E5: Mes Anterior | G5: Vendas 2004 | H5: Vendas 2003 | I5: Vendas 2002 | K5: % Prev | L5: % MA | M5: 2004 | N5: 2003 | O5: 2002 | Q5: Previsao Mes | R5: Final | S5: Part. | U5: Meta | V5: Real
A7: Xaxim | C7: 850000 | D7: 797030 | E7: 760819 | G7: 761830 | H7: 618469 | I7: 496544 | K7: =IF(C7=0,0,((D7/C7)*100)-100) -> -6.23 | L7: =IF(D7=0,0,IF(E7=0,0,((D7/E7)*100)-100)) -> 4.76 | M7: =IF(G7=0,0,((D7/G7)*100)-100) -> 4.62 | N7: =IF(H7=0,0,((D7/H7)*100)-100) -> 28.87 | O7: =IF(D7=0,0,IF(I7=0,0,((D7/I7)*100)-100)) -> 60.52 | Q7: 850000 | R7: =IF(D7=0,0,((D7/Q7)*100)-100) -> -6.23 | S7: =IF(D7=0,0,(D7/$D$34)*100) -> 1.45 | U7: 17.32 | V7: 15.78
A8: S. Felicidade | C8: 720000 | D8: 743453 | E8: 694870 | G8: 680644 | H8: 686679 | I8: 506826 | K8: =IF(C8=0,0,((D8/C8)*100)-100) -> 3.26 | L8: =IF(D8=0,0,IF(E8=0,0,((D8/E8)*100)-100)) -> 6.99 | M8: =IF(G8=0,0,((D8/G8)*100)-100) -> 9.23 | N8: =IF(H8=0,0,((D8/H8)*100)-100) -> 8.27 | O8: =IF(D8=0,0,IF(I8=0,0,((D8/I8)*100)-100)) -> 46.69 | Q8: 720000 | R8: =IF(D8=0,0,((D8/Q8)*100)-100) -> 3.26 | S8: =IF(D8=0,0,(D8/$D$34)*100) -> 1.35 | U8: 16.75 | V8: 15.82
A9: Lapa | C9: 1160000 | D9: 1169050 | E9: 1055863 | G9: 1054146 | H9: 913056 | I9: 753219 | K9: =IF(C9=0,0,((D9/C9)*100)-100) -> 00.78 | L9: =IF(D9=0,0,IF(E9=0,0,((D9/E9)*100)-100)) -> 10.72 | M9: =IF(G9=0,0,((D9/G9)*100)-100) -> 10.9 | N9: =IF(H9=0,0,((D9/H9)*100)-100) -> 28.04 | O9: =IF(D9=0,0,IF(I9=0,0,((D9/I9)*100)-100)) -> 55.21 | Q9: 1160000 | R9: =IF(D9=0,0,((D9/Q9)*100)-100) -> 00.78 | S9: =IF(D9=0,0,(D9/$D$34)*100) -> 2.13 | U9: 16.9 | V9: 15.85
A10: Araucaria | C10: 995000 | D10: 922579 | E10: 878524 | G10: 883203 | H10: 993990 | I10: 1395946 | K10: =IF(C10=0,0,((D10/C10)*100)-100) -> -7.28 | L10: =IF(D10=0,0,IF(E10=0,0,((D10/E10)*100)-100)) -> 5.01 | M10: =IF(G10=0,0,((D10/G10)*100)-100) -> 4.46 | N10: =IF(H10=0,0,((D10/H10)*100)-100) -> -7.18 | O10: =IF(D10=0,0,IF(I10=0,0,((D10/I10)*100)-100)) -> -33.91 | Q10: 995000 | R10: =IF(D10=0,0,((D10/Q10)*100)-100) -> -7.28 | S10: =IF(D10=0,0,(D10/$D$34)*100) -> 1.68 | U10: 17.9 | V10: 17.44
A11: Pinheirinho | C11: 2100000 | D11: 2093962 | E11: 2006840 | G11: 1899208 | H11: 1717330 | I11: 1530671 | K11: =IF(C11=0,0,((D11/C11)*100)-100) -> -00.29 | L11: =IF(D11=0,0,IF(E11=0,0,((D11/E11)*100)-100)) -> 4.34 | M11: =IF(G11=0,0,((D11/G11)*100)-100) -> 10.25 | N11: =IF(H11=0,0,((D11/H11)*100)-100) -> 21.93 | O11: =IF(D11=0,0,IF(I11=0,0,((D11/I11)*100)-100)) -> 36.8 | Q11: 2100000 | R11: =IF(D11=0,0,((D11/Q11)*100)-100) -> -00.29 | S11: =IF(D11=0,0,(D11/$D$34)*100) -> 3.81 | U11: 17.24 | V11: 16.56
A12: Hauer | C12: 3050000 | D12: 3144365 | E12: 2895952 | G12: 2730980 | H12: 2685569 | I12: 2044686 | K12: =IF(C12=0,0,((D12/C12)*100)-100) -> 3.09 | L12: =IF(D12=0,0,IF(E12=0,0,((D12/E12)*100)-100)) -> 8.58 | M12: =IF(G12=0,0,((D12/G12)*100)-100) -> 15.14 | N12: =IF(H12=0,0,((D12/H12)*100)-100) -> 17.08 | O12: =IF(D12=0,0,IF(I12=0,0,((D12/I12)*100)-100)) -> 53.78 | Q12: 3050000 | R12: =IF(D12=0,0,((D12/Q12)*100)-100) -> 3.09 | S12: =IF(D12=0,0,(D12/$D$34)*100) -> 5.73 | U12: 17.05 | V12: 17.18
A13: Paranagua | C13: 3326000 | D13: 3385849 | E13: 3215502 | G13: 2852103 | H13: 2761430 | I13: 2209341 | K13: =IF(C13=0,0,((D13/C13)*100)-100) -> 1.8 | L13: =IF(D13=0,0,IF(E13=0,0,((D13/E13)*100)-100)) -> 5.3 | M13: =IF(G13=0,0,((D13/G13)*100)-100) -> 18.71 | N13: =IF(H13=0,0,((D13/H13)*100)-100) -> 22.61 | O13: =IF(D13=0,0,IF(I13=0,0,((D13/I13)*100)-100)) -> 53.25 | Q13: 3326000 | R13: =IF(D13=0,0,((D13/Q13)*100)-100) -> 1.8 | S13: =IF(D13=0,0,(D13/$D$34)*100) -> 6.17 | U13: 17.59 | V13: 17.61
A14: Centenario | C14: 995000 | D14: 966874 | E14: 936373 | G14: 875752 | H14: 830168 | I14: 641318 | K14: =IF(C14=0,0,((D14/C14)*100)-100) -> -2.83 | L14: =IF(D14=0,0,IF(E14=0,0,((D14/E14)*100)-100)) -> 3.26 | M14: =IF(G14=0,0,((D14/G14)*100)-100) -> 10.41 | N14: =IF(H14=0,0,((D14/H14)*100)-100) -> 16.47 | O14: =IF(D14=0,0,IF(I14=0,0,((D14/I14)*100)-100)) -> 50.76 | Q14: 995000 | R14: =IF(D14=0,0,((D14/Q14)*100)-100) -> -2.83 | S14: =IF(D14=0,0,(D14/$D$34)*100) -> 1.76 | U14: 17.1 | V14: 15.77
A15: Arapongas | C15: 0 | D15: 0 | E15: 0 | G15: 0 | H15: 0 | I15: 0 | K15: =IF(C15=0,0,((D15/C15)*100)-100) -> 0 | L15: =IF(D15=0,0,IF(E15=0,0,((D15/E15)*100)-100)) -> 0 | M15: =IF(D15=0,0,IF(G15=0,0,((D15/G15)*100)-100)) -> 0 | N15: =IF(D15=0,0,IF(H15=0,0,((D15/H15)*100)-100)) -> 0 | O15: =IF(D15=0,0,IF(I15=0,0,((D15/I15)*100)-100)) -> 0 | Q15: 0 | R15: =IF(D15=0,0,((D15/Q15)*100)-100) -> 0 | S15: =IF(D15=0,0,(D15/$D$34)*100) -> 0 | U15: 0 | V15: 0
A16: Sao Braz | C16: 3130000 | D16: 3116610 | E16: 2841136 | G16: 2928963 | H16: 2761728 | I16: 2297239 | K16: =IF(C16=0,0,((D16/C16)*100)-100) -> -00.43 | L16: =IF(D16=0,0,IF(E16=0,0,((D16/E16)*100)-100)) -> 9.7 | M16: =IF(G16=0,0,((D16/G16)*100)-100) -> 6.41 | N16: =IF(H16=0,0,((D16/H16)*100)-100) -> 12.85 | O16: =IF(D16=0,0,IF(I16=0,0,((D16/I16)*100)-100)) -> 35.67 | Q16: 3130000 | R16: =IF(D16=0,0,((D16/Q16)*100)-100) -> -00.43 | S16: =IF(D16=0,0,(D16/$D$34)*100) -> 5.68 | U16: 17.4 | V16: 16.62
A17: Guarapuava | C17: 1630000 | D17: 1737697 | E17: 1493705 | G17: 1462777 | H17: 1115251 | I17: 692636 | K17: =IF(C17=0,0,((D17/C17)*100)-100) -> 6.61 | L17: =IF(D17=0,0,IF(E17=0,0,((D17/E17)*100)-100)) -> 16.33 | M17: =IF(G17=0,0,((D17/G17)*100)-100) -> 18.79 | N17: =IF(H17=0,0,((D17/H17)*100)-100) -> 55.81 | O17: =IF(D17=0,0,IF(I17=0,0,((D17/I17)*100)-100)) -> 150.88 | Q17: 1630000 | R17: =IF(D17=0,0,((D17/Q17)*100)-100) -> 6.61 | S17: =IF(D17=0,0,(D17/$D$34)*100) -> 3.16 | U17: 17.9 | V17: 17.01
A18: Apucarana | C18: 1470000 | D18: 1638164 | E18: 1526503 | G18: 1284382 | H18: 1250362 | I18: 1064972 | K18: =IF(C18=0,0,((D18/C18)*100)-100) -> 11.44 | L18: =IF(D18=0,0,IF(E18=0,0,((D18/E18)*100)-100)) -> 7.31 | M18: =IF(G18=0,0,((D18/G18)*100)-100) -> 27.54 | N18: =IF(H18=0,0,((D18/H18)*100)-100) -> 31.02 | O18: =IF(D18=0,0,IF(I18=0,0,((D18/I18)*100)-100)) -> 53.82 | Q18: 1470000 | R18: =IF(D18=0,0,((D18/Q18)*100)-100) -> 11.44 | S18: =IF(D18=0,0,(D18/$D$34)*100) -> 2.98 | U18: 18.2 | V18: 16.94
A19: Ahu | C19: 1220000 | D19: 1068081 | E19: 947486 | G19: 1063102 | H19: 1111722 | I19: 1147278 | K19: =IF(C19=0,0,((D19/C19)*100)-100) -> -12.45 | L19: =IF(D19=0,0,IF(E19=0,0,((D19/E19)*100)-100)) -> 12.73 | M19: =IF(G19=0,0,((D19/G19)*100)-100) -> 00.47 | N19: =IF(H19=0,0,((D19/H19)*100)-100) -> -3.93 | O19: =IF(D19=0,0,IF(I19=0,0,((D19/I19)*100)-100)) -> -6.9 | Q19: 1220000 | R19: =IF(D19=0,0,((D19/Q19)*100)-100) -> -12.45 | S19: =IF(D19=0,0,(D19/$D$34)*100) -> 1.95 | U19: 17.91 | V19: 16.39
A20: P.G. Centro | C20: 1750000 | D20: 1691495 | E20: 1588822 | G20: 1559531 | H20: 1474375 | I20: 1088387 | K20: =IF(C20=0,0,((D20/C20)*100)-100) -> -3.34 | L20: =IF(D20=0,0,IF(E20=0,0,((D20/E20)*100)-100)) -> 6.46 | M20: =IF(G20=0,0,((D20/G20)*100)-100) -> 8.46 | N20: =IF(H20=0,0,((D20/H20)*100)-100) -> 14.73 | O20: =IF(D20=0,0,IF(I20=0,0,((D20/I20)*100)-100)) -> 55.41 | Q20: 1750000 | R20: =IF(D20=0,0,((D20/Q20)*100)-100) -> -3.34 | S20: =IF(D20=0,0,(D20/$D$34)*100) -> 3.08 | U20: 18.9 | V20: 17.45
A21: Maringa | C21: 2150000 | D21: 2079356 | E21: 2094650 | G21: 1868747 | H21: 1888401 | I21: 1558549 | K21: =IF(C21=0,0,((D21/C21)*100)-100) -> -3.29 | L21: =IF(D21=0,0,IF(E21=0,0,((D21/E21)*100)-100)) -> -00.73 | M21: =IF(G21=0,0,((D21/G21)*100)-100) -> 11.27 | N21: =IF(H21=0,0,((D21/H21)*100)-100) -> 10.11 | O21: =IF(D21=0,0,IF(I21=0,0,((D21/I21)*100)-100)) -> 33.42 | Q21: 2150000 | R21: =IF(D21=0,0,((D21/Q21)*100)-100) -> -3.29 | S21: =IF(D21=0,0,(D21/$D$34)*100) -> 3.79 | U21: 19.1 | V21: 18.32
A22: Araucaria Nova | C22: 2130000 | D22: 2107318 | E22: 1858130 | G22: 1813836 | H22: 1737415 | I22: 0 | K22: =IF(C22=0,0,((D22/C22)*100)-100) -> -1.06 | L22: =IF(D22=0,0,IF(E22=0,0,((D22/E22)*100)-100)) -> 13.41 | M22: =IF(G22=0,0,((D22/G22)*100)-100) -> 16.18 | N22: =IF(H22=0,0,((D22/H22)*100)-100) -> 21.29 | O22: =IF(D22=0,0,IF(I22=0,0,((D22/I22)*100)-100)) -> 0 | Q22: 2130000 | R22: =IF(D22=0,0,((D22/Q22)*100)-100) -> -1.06 | S22: =IF(D22=0,0,(D22/$D$34)*100) -> 3.84 | U22: 18.2 | V22: 17.28
A23: Total Super | C23: =SUM(C7:C22) -> 26676000 | D23: =SUM(D7:D22) -> 26661883 | E23: =SUM(E7:E22) -> 24795175 | G23: =SUM(G7:G22) -> 23719204 | H23: =SUM(H7:H22) -> 22545945 | I23: =SUM(I7:I22) -> 17427612 | J23: =SUM(C23:I23) -> 141825819 | K23: =IF(D23=0,0,((D23/C23)*100)-100) -> -00.05 | L23: =IF(D23=0,0,IF(E23=0,0,((D23/E23)*100)-100)) -> 7.53 | M23: =IF(G23=0,0,IF(D23=0,0,((D23/G23)*100)-100)) -> 12.41 | N23: =IF(H23=0,0,IF(D23=0,0,((D23/H23)*100)-100)) -> 18.26 | O23: =IF(D23=0,0,IF(I23=0,0,((D23/I23)*100)-100)) -> 52.99 | Q23: =SUM(Q7:Q22) -> 26676000 | R23: =IF(D23=0,0,((D23/Q23)*100)-100) -> -00.05 | S23: =IF(D23=0,0,(D23/$D$34)*100) -> 48.56 | U23: 17.24 | V23: 17
A25: Londrina | C25: 2500000 | D25: 2538508 | E25: 2637008 | G25: 2025202 | H25: 2022076 | I25: 1492342 | K25: =IF(C25=0,0,((D25/C25)*100)-100) -> 1.54 | L25: =IF(D25=0,0,IF(E25=0,0,((D25/E25)*100)-100)) -> -3.74 | M25: =IF(G25=0,0,((D25/G25)*100)-100) -> 25.35 | N25: =IF(H25=0,0,((D25/H25)*100)-100) -> 25.54 | O25: =IF(D25=0,0,IF(I25=0,0,((D25/I25)*100)-100)) -> 70.1 | Q25: 2500000 | R25: =IF(D25=0,0,IF(Q25=0,0,((D25/Q25)*100)-100)) -> 1.54 | S25: =IF(D25=0,0,(D25/$D$34)*100) -> 4.62 | U25: 18.5 | V25: 15.52
A26: S.J. Pinhais | C26: 4270000 | D26: 4371622 | E26: 4100456 | G26: 3873110 | H26: 3663832 | I26: 2795401 | K26: =IF(C26=0,0,((D26/C26)*100)-100) -> 2.38 | L26: =IF(D26=0,0,IF(E26=0,0,((D26/E26)*100)-100)) -> 6.61 | M26: =IF(G26=0,0,((D26/G26)*100)-100) -> 12.87 | N26: =IF(H26=0,0,((D26/H26)*100)-100) -> 19.32 | O26: =IF(D26=0,0,IF(I26=0,0,((D26/I26)*100)-100)) -> 56.39 | Q26: 4270000 | R26: =IF(D26=0,0,IF(Q26=0,0,((D26/Q26)*100)-100)) -> 2.38 | S26: =IF(D26=0,0,(D26/$D$34)*100) -> 7.96 | U26: 16.8 | V26: 16.21
A27: P.G. Nova | C27: 3450000 | D27: 3596581 | E27: 3262435 | G27: 2943189 | H27: 2901489 | I27: 2161033 | K27: =IF(C27=0,0,((D27/C27)*100)-100) -> 4.25 | L27: =IF(D27=0,0,IF(E27=0,0,((D27/E27)*100)-100)) -> 10.24 | M27: =IF(G27=0,0,((D27/G27)*100)-100) -> 22.2 | N27: =IF(H27=0,0,((D27/H27)*100)-100) -> 23.96 | O27: =IF(D27=0,0,IF(I27=0,0,((D27/I27)*100)-100)) -> 66.43 | Q27: 3450000 | R27: =IF(D27=0,0,IF(Q27=0,0,((D27/Q27)*100)-100)) -> 4.25 | S27: =IF(D27=0,0,(D27/$D$34)*100) -> 6.55 | U27: 16.5 | V27: 16.23
A28: Nilo Pecanha | C28: 8325000 | D28: 7986335 | E28: 6934815 | G28: 7700456 | H28: 7125976 | I28: 0 | K28: =IF(C28=0,0,((D28/C28)*100)-100) -> -4.07 | L28: =IF(D28=0,0,IF(E28=0,0,((D28/E28)*100)-100)) -> 15.16 | M28: =IF(G28=0,0,((D28/G28)*100)-100) -> 3.71 | N28: =IF(H28=0,0,((D28/H28)*100)-100) -> 12.07 | O28: =IF(D28=0,0,IF(I28=0,0,((D28/I28)*100)-100)) -> 0 | Q28: 8325000 | R28: =IF(D28=0,0,IF(Q28=0,0,((D28/Q28)*100)-100)) -> -4.07 | S28: =IF(D28=0,0,(D28/$D$34)*100) -> 14.55 | U28: 16.89 | V28: 16.49
A29: Champagnat | C29: 5250000 | D29: 5028802 | E29: 4636300 | G29: 0 | H29: 0 | I29: 0 | K29: =IF(C29=0,0,((D29/C29)*100)-100) -> -4.21 | L29: =IF(D29=0,0,IF(E29=0,0,((D29/E29)*100)-100)) -> 8.47 | M29: =IF(G29=0,0,((D29/G29)*100)-100) -> 0 | N29: =IF(H29=0,0,((D29/H29)*100)-100) -> 0 | O29: =IF(D29=0,0,IF(I29=0,0,((D29/I29)*100)-100)) -> 0 | Q29: 5250000 | R29: =IF(D29=0,0,IF(Q29=0,0,((D29/Q29)*100)-100)) -> -4.21 | S29: =IF(D29=0,0,(D29/$D$34)*100) -> 9.16 | U29: 16.5 | V29: 16.39
A30: Santa Candida | C30: 5000000 | D30: 4721647 | E30: 4296523 | G30: 0 | H30: 0 | I30: 0 | K30: =IF(C30=0,0,((D30/C30)*100)-100) -> -5.57 | L30: =IF(D30=0,0,IF(E30=0,0,((D30/E30)*100)-100)) -> 9.89 | M30: =IF(G30=0,0,((D30/G30)*100)-100) -> 0 | N30: =IF(H30=0,0,((D30/H30)*100)-100) -> 0 | O30: =IF(D30=0,0,IF(I30=0,0,((D30/I30)*100)-100)) -> 0 | Q30: 5000000 | R30: =IF(D30=0,0,IF(Q30=0,0,((D30/Q30)*100)-100)) -> -5.57 | S30: =IF(D30=0,0,(D30/$D$34)*100) -> 8.6 | U30: 14.8 | V30: 13.37
A31: Paranagu Raia | C31: 0 | D31: 0 | E31: 0 | G31: 0 | H31: 0 | I31: 0 | K31: =IF(C31=0,0,((D31/C31)*100)-100) -> 0 | L31: =IF(D31=0,0,IF(E31=0,0,((D31/E31)*100)-100)) -> 0 | M31: =IF(G31=0,0,((D31/G31)*100)-100) -> 0 | N31: =IF(H31=0,0,((D31/H31)*100)-100) -> 0 | O31: =IF(D31=0,0,IF(I31=0,0,((D31/I31)*100)-100)) -> 0 | Q31: 0 | R31: =IF(D31=0,0,IF(Q31=0,0,((D31/Q31)*100)-100)) -> 0 | S31: =IF(D31=0,0,(D31/$D$34)*100) -> 0 | U31: 0 | V31: 0
A32: Total Hiper | C32: =SUM(C25:C31) -> 28795000 | D32: =SUM(D25:D31) -> 28243495 | E32: =SUM(E25:E31) -> 25867537 | G32: =SUM(G25:G31) -> 16541957 | H32: =SUM(H25:H31) -> 15713373 | I32: =SUM(I25:I31) -> 6448776 | J32: =SUM(C32:I32) -> 121610138 | K32: =IF(D32=0,0,((D32/C32)*100)-100) -> -1.92 | L32: =IF(D32=0,0,IF(E32=0,0,((D32/E32)*100)-100)) -> 9.19 | M32: =IF(G32=0,0,IF(D32=0,0,((D32/G32)*100)-100)) -> 70.74 | N32: =IF(H32=0,0,IF(D32=0,0,((D32/H32)*100)-100)) -> 79.74 | O32: =IF(D32=0,0,IF(I32=0,0,((D32/I32)*100)-100)) -> 337.97 | Q32: =SUM(Q25:Q31) -> 28795000 | R32: =IF(D32=0,0,((D32/Q32)*100)-100) -> -1.92 | S32: =IF(D32=0,0,(D32/$D$34)*100) -> 51.44 | U32: 17.01 | V32: 15.79
A34: Total Geral | C34: =C23+C32 -> 55471000 | D34: =D23+D32 -> 54905378 | E34: =E23+E32 -> 50662712 | G34: =G23+G32 -> 40261161 | H34: =H23+H32 -> 38259318 | I34: =I23+I32 -> 23876388 | K34: =IF(D32=0,0,((D34/C34)*100)-100) -> -1.02 | L34: =IF(D34=0,0,IF(E34=0,0,((D34/E34)*100)-100)) -> 8.37 | M34: =IF(G34=0,0,IF(D34=0,0,((D34/G34)*100)-100)) -> 36.37 | N34: =IF(H34=0,0,IF(D34=0,0,((D34/H34)*100)-100)) -> 43.51 | O34: =IF(D34=0,0,IF(I34=0,0,((D34/I34)*100)-100)) -> 129.96 | Q34: =Q23+Q32 -> 55471000 | R34: =IF(D34=0,0,((D34/Q34)*100)-100) -> -1.02 | S34: =S23+S32 -> 100 | U34: 17.11 | V34: 16.37
C35: Resumo por Regiao - Outubro/2002
C36: Descricao das Aberturas | H36: Valor | I36: %
C37: Curitiba (2,3,6,7,10,11,17,21,22) | H37: =D7+D8+D11+D12+D14+D16+D19+D28+D29+D31 -> 24945512 | I37: =IF(D34=0,0,H37/$D$34) -> 0.45429999999999998
C38: Curitiba e Metrop. (Ctba. 4,5,8,14,23) | H38: =H37+D9+D10+D13+D27+D22 -> 36126889 | I38: =IF(D34=0,0,H38/$D$34) -> 0.65800000000000003
C39: Metropolitana (4,5,8,14,23) | H39: =H38-H37 -> 11181377 | I39: =IF(D34=0,0,H39/$D$34) -> 0.2036
C40: Norte (9,15,20) | H40: =D25+D18+D22 -> 6283990 | I40: =IF(D34=0,0,H40/$D$34) -> 0.1145
C41: Centro-Oeste (13,18,19) | H41: =D17+D20+D27 -> 7025773 | I41: =IF(D34=0,0,H41/$D$34) -> 0.128
C42: Ponta Grossa (18,19) | H42: =H41-D17 -> 5288076 | I42: =IF(D34=0,0,H42/$D$34) -> 9.6299999999999997E-2
C43: Super (2,3,4,5,6,7,8,10,11,13,15,17,18,20,23) | H43: =D23 -> 26661883 | I43: =IF(D34=0,0,H43/$D$34) -> 0.48559999999999998
C44: Hiper (9,14,19,21,22,24) | H44: =D32 -> 28243495 | I44: =IF(D34=0,0,H44/$D$34) -> 0.51439999999999997
C45: Curitiba, Metropolitana e Centro-Oeste | H45: =D34-H40 -> 48621388 | I45: =IF(D34=0,0,H45/$D$34) -> 0.88549999999999995
C46: Araucaria | H46: =D10+D22 -> 3029897 | I46: =IF(D34=0,0,H46/$D$34) -> 5.5199999999999999E-2