A2: Periodo: | B2: 41153 | C2: a | D2: 41182 | G2: Vendas Acumuladas por Filial | P2: =NOW() -> 41183.374906712961
A4: v.New | B4: Vendas 2012 | F4: Vendas de Anos Anteriores | J4: Percentuais ( % ) | P4: Meta Mensal | T4: Margem
A5: Lojas | B5: Previsao | C5: Realizada | D5: Mes Anterior | F5: Vendas 2011 | G5: Vendas 2010 | H5: Vendas 2009 | J5: % Prev | K5: % MA | L5: 2011 | M5: 2010 | N5: 2009 | P5: Previsao Mes | Q5: Final | R5: Part. | T5: Meta | U5: Coml | V5: Sell O. | W5: Dif
A6: S. Felicidade | B6: 4300000 | C6: 4426893.5 | D6: 4262904.86 | F6: 3638940.06 | G6: 3058635.75 | H6: 2668611.7 | J6: =IF(B6=0,0,((C6/B6)*100)-100) -> 2.9510116279069791 | K6: =IF(C6=0,0,IF(D6=0,0,((C6/D6)*100)-100)) -> 3.846875437890958 | L6: =IF(F6=0,0,((C6/F6)*100)-100) -> 21.65337782453058 | M6: =IF(G6=0,0,((C6/G6)*100)-100) -> 44.734249575157804 | N6: =IF(C6=0,0,IF(H6=0,0,((C6/H6)*100)-100)) -> 65.887509973818965 | P6: 4300000 | Q6: =IF(C6=0,0,((C6/P6)*100)-100) -> 2.9510116279069791 | R6: =IF(C6=0,0,(C6/$C$44)*100) -> 2.2525826943032587 | T6: 17.3 | U6: 16.691200210712097 | V6: 18.659292384151552 | W6: =U6-T6 -> -0.60879978928790379
A7: Lapa | B7: 2900000 | C7: 2975956.24 | D7: 2832354.26 | F7: 2640019.66 | G7: 2413350.94 | H7: 2099592.67 | J7: =IF(B7=0,0,((C7/B7)*100)-100) -> 2.619180689655181 | K7: =IF(C7=0,0,IF(D7=0,0,((C7/D7)*100)-100)) -> 5.0700571615642502 | L7: =IF(F7=0,0,((C7/F7)*100)-100) -> 12.724775693526453 | M7: =IF(G7=0,0,((C7/G7)*100)-100) -> 23.312204233338747 | N7: =IF(C7=0,0,IF(H7=0,0,((C7/H7)*100)-100)) -> 41.739694680873527 | P7: 2900000 | Q7: =IF(C7=0,0,((C7/P7)*100)-100) -> 2.619180689655181 | R7: =IF(C7=0,0,(C7/$C$44)*100) -> 1.5142870559745329 | T7: 15 | U7: 15.156146788636917 | V7: 17.93675869037644 | W7: =U7-T7 -> 0.15614678863691722
A8: Araucaria | B8: 1550000 | C8: 1469940.68 | D8: 1549378.48 | F8: 1590234.53 | G8: 1448427.38 | H8: 1261605.45 | J8: =IF(B8=0,0,((C8/B8)*100)-100) -> -5.1651174193548428 | K8: =IF(C8=0,0,IF(D8=0,0,((C8/D8)*100)-100)) -> -5.1270752127653196 | L8: =IF(F8=0,0,((C8/F8)*100)-100) -> -7.5645351506736631 | M8: =IF(G8=0,0,((C8/G8)*100)-100) -> 1.4852867528643401 | N8: =IF(C8=0,0,IF(H8=0,0,((C8/H8)*100)-100)) -> 16.513501110826681 | P8: 1550000 | Q8: =IF(C8=0,0,((C8/P8)*100)-100) -> -5.1651174193548428 | R8: =IF(C8=0,0,(C8/$C$44)*100) -> 0.74796534803025283 | T8: 17.07 | U8: 16.374055829246117 | V8: 18.671423924399456 | W8: =U8-T8 -> -0.69594417075388293
A9: Hauer | B9: 4900000 | C9: 4900201.19 | D9: 4816210.63 | F9: 4224868.15 | G9: 3836944.41 | H9: 3658402.53 | J9: =IF(B9=0,0,((C9/B9)*100)-100) -> 4.1059183673439748E-3 | K9: =IF(C9=0,0,IF(D9=0,0,((C9/D9)*100)-100)) -> 1.7439137623430838 | L9: =IF(F9=0,0,((C9/F9)*100)-100) -> 15.984712801037347 | M9: =IF(G9=0,0,((C9/G9)*100)-100) -> 27.711029047720828 | N9: =IF(C9=0,0,IF(H9=0,0,((C9/H9)*100)-100)) -> 33.943740466416102 | P9: 4900000 | Q9: =IF(C9=0,0,((C9/P9)*100)-100) -> 4.1059183673439748E-3 | R9: =IF(C9=0,0,(C9/$C$44)*100) -> 2.4934208151152126 | T9: 16.41 | U9: 16.156330748534021 | V9: 17.843581471396686 | W9: =U9-T9 -> -0.25366925146597907
A10: Paranagua | B10: 2650000 | C10: 2601530.59 | D10: 2649769.68 | F10: 2438944.48 | G10: 2242909.91 | H10: 1993215.44 | J10: =IF(B10=0,0,((C10/B10)*100)-100) -> -1.8290343396226518 | K10: =IF(C10=0,0,IF(D10=0,0,((C10/D10)*100)-100)) -> -1.8205012444704352 | L10: =IF(F10=0,0,((C10/F10)*100)-100) -> 6.6662489176465272 | M10: =IF(G10=0,0,((C10/G10)*100)-100) -> 15.989080898929188 | N10: =IF(C10=0,0,IF(H10=0,0,((C10/H10)*100)-100)) -> 30.519287468493616 | P10: 2650000 | Q10: =IF(C10=0,0,((C10/P10)*100)-100) -> -1.8290343396226518 | R10: =IF(C10=0,0,(C10/$C$44)*100) -> 1.3237641216655756 | T10: 17.22 | U10: 17.213226468346086 | V10: 19.202721467903249 | W10: =U10-T10 -> -6.7735316539128121E-3
A11: Sitio Cercado | B11: 3750000 | C11: 3873086.48 | D11: 3705054.66 | F11: 3216266.34 | G11: 2523145.66 | H11: 2201171.99 | J11: =IF(B11=0,0,((C11/B11)*100)-100) -> 3.2823061333333357 | K11: =IF(C11=0,0,IF(D11=0,0,((C11/D11)*100)-100)) -> 4.5352048868288364 | L11: =IF(F11=0,0,((C11/F11)*100)-100) -> 20.421820538656021 | M11: =IF(G11=0,0,((C11/G11)*100)-100) -> 53.502294433528647 | N11: =IF(C11=0,0,IF(H11=0,0,((C11/H11)*100)-100)) -> 75.955649880861841 | P11: 3750000 | Q11: =IF(C11=0,0,((C11/P11)*100)-100) -> 3.2823061333333357 | R11: =IF(C11=0,0,(C11/$C$44)*100) -> 1.9707832543041581 | T11: 15.25 | U11: 14.752801055451775 | V11: 17.413878525118808 | W11: =U11-T11 -> -0.49719894454822544
A12: Apucarana | B12: 2950000 | C12: 3156866.48 | D12: 2910076.11 | F12: 2332622.25 | G12: 2716420.94 | H12: 2561218.06 | J12: =IF(B12=0,0,((C12/B12)*100)-100) -> 7.0124230508474596 | K12: =IF(C12=0,0,IF(D12=0,0,((C12/D12)*100)-100)) -> 8.480546922877565 | L12: =IF(F12=0,0,((C12/F12)*100)-100) -> 35.335521214375802 | M12: =IF(G12=0,0,((C12/G12)*100)-100) -> 16.214185861783264 | N12: =IF(C12=0,0,IF(H12=0,0,((C12/H12)*100)-100)) -> 23.256450877907668 | P12: 2950000 | Q12: =IF(C12=0,0,((C12/P12)*100)-100) -> 7.0124230508474596 | R12: =IF(C12=0,0,(C12/$C$44)*100) -> 1.6063415126372576 | T12: 15.27 | U12: 15.727171292971503 | V12: 18.412712364699065 | W12: =U12-T12 -> 0.45717129297150372
A13: Ahú | B13: 2650000 | C13: 2594070.69 | D13: 2631567.04 | F13: 2300493.73 | G13: 1844426.26 | H13: 1615543.94 | J13: =IF(B13=0,0,((C13/B13)*100)-100) -> -2.1105400000000003 | K13: =IF(C13=0,0,IF(D13=0,0,((C13/D13)*100)-100)) -> -1.424867747241592 | L13: =IF(F13=0,0,((C13/F13)*100)-100) -> 12.761476207109681 | M13: =IF(G13=0,0,((C13/G13)*100)-100) -> 40.643773419274567 | N13: =IF(C13=0,0,IF(H13=0,0,((C13/H13)*100)-100)) -> 60.569491536082893 | P13: 2650000 | Q13: =IF(C13=0,0,((C13/P13)*100)-100) -> -2.1105400000000003 | R13: =IF(C13=0,0,(C13/$C$44)*100) -> 1.3199682224325735 | T13: 16.96 | U13: 16.775182668595669 | V13: 18.45738124044723 | W13: =U13-T13 -> -0.18481733140433221
A14: P.G. Centro | B14: 2550000 | C14: 2381148.64 | D14: 2566859.68 | F14: 2319079.42 | G14: 1968491.7 | H14: 1869463.58 | J14: =IF(B14=0,0,((C14/B14)*100)-100) -> -6.6216219607843101 | K14: =IF(C14=0,0,IF(D14=0,0,((C14/D14)*100)-100)) -> -7.234950996620114 | L14: =IF(F14=0,0,((C14/F14)*100)-100) -> 2.6764594375125057 | M14: =IF(G14=0,0,((C14/G14)*100)-100) -> 20.963102867032674 | N14: =IF(C14=0,0,IF(H14=0,0,((C14/H14)*100)-100)) -> 27.370688868942821 | P14: 2550000 | Q14: =IF(C14=0,0,((C14/P14)*100)-100) -> -6.6216219607843101 | R14: =IF(C14=0,0,(C14/$C$44)*100) -> 1.2116248604191044 | T14: 17.87 | U14: 17.505120033161809 | V14: 19.145212190533389 | W14: =U14-T14 -> -0.3648799668381919
A15: Maringa | B15: 4449999 | C15: 4414226.95 | D15: 4444890.29 | F15: 3705989.07 | G15: 3134841.02 | H15: 2923616.85 | J15: =IF(B15=0,0,((C15/B15)*100)-100) -> -0.80386647277897794 | K15: =IF(C15=0,0,IF(D15=0,0,((C15/D15)*100)-100)) -> -0.68985594692821905 | L15: =IF(F15=0,0,((C15/F15)*100)-100) -> 19.1106305664307 | M15: =IF(G15=0,0,((C15/G15)*100)-100) -> 40.811828154526324 | N15: =IF(C15=0,0,IF(H15=0,0,((C15/H15)*100)-100)) -> 50.985138493780426 | P15: 4450000 | Q15: =IF(C15=0,0,((C15/P15)*100)-100) -> -0.80388876404494169 | R15: =IF(C15=0,0,(C15/$C$44)*100) -> 2.2461374406899681 | T15: 16.97 | U15: 16.702922478872544 | V15: 18.779298950635056 | W15: =U15-T15 -> -0.26707752112745453
A16: Centenario | B16: 0 | C16: 0 | D16: 0 | F16: 0 | G16: 0 | H16: 0 | J16: =IF(B16=0,0,((C16/B16)*100)-100) -> 0 | K16: =IF(C16=0,0,IF(D16=0,0,((C16/D16)*100)-100)) -> 0 | L16: =IF(F16=0,0,((C16/F16)*100)-100) -> 0 | M16: =IF(G16=0,0,((C16/G16)*100)-100) -> 0 | N16: =IF(C16=0,0,IF(H16=0,0,((C16/H16)*100)-100)) -> 0 | P16: 0 | Q16: =IF(C16=0,0,((C16/P16)*100)-100) -> 0 | R16: =IF(C16=0,0,(C16/$C$44)*100) -> 0 | T16: 0 | U16: 0 | V16: 0 | W16: =U16-T16 -> 0
A17: Cristo Rei | B17: 3550000 | C17: 3450590.15 | D17: 3486280.36 | F17: 2955221.15 | G17: 2430694.64 | H17: 1995500.54 | J17: =IF(B17=0,0,((C17/B17)*100)-100) -> -2.800277464788735 | K17: =IF(C17=0,0,IF(D17=0,0,((C17/D17)*100)-100)) -> -1.0237332146173088 | L17: =IF(F17=0,0,((C17/F17)*100)-100) -> 16.762501852018758 | M17: =IF(G17=0,0,((C17/G17)*100)-100) -> 41.959014234712754 | N17: =IF(C17=0,0,IF(H17=0,0,((C17/H17)*100)-100)) -> 72.91852749887002 | P17: 3550000 | Q17: =IF(C17=0,0,((C17/P17)*100)-100) -> -2.800277464788735 | R17: =IF(C17=0,0,(C17/$C$44)*100) -> 1.7558000112320944 | T17: 17.51 | U17: 17.590898151146696 | V17: 19.338325289081347 | W17: =U17-T17 -> 8.089815114669463E-2
A18: Fazenda | B18: 4500000 | C18: 4588183.96 | D18: 4342134.93 | F18: 3271428.68 | G18: 2684592.27 | H18: 0 | J18: =IF(B18=0,0,((C18/B18)*100)-100) -> 1.9596435555555587 | K18: =IF(C18=0,0,IF(D18=0,0,((C18/D18)*100)-100)) -> 5.6665450053160953 | L18: =IF(F18=0,0,((C18/F18)*100)-100) -> 40.250160061566731 | M18: =IF(G18=0,0,((C18/G18)*100)-100) -> 70.908037368371026 | N18: =IF(C18=0,0,IF(H18=0,0,((C18/H18)*100)-100)) -> 0 | P18: 4500000 | Q18: =IF(C18=0,0,((C18/P18)*100)-100) -> 1.9596435555555587 | R18: =IF(C18=0,0,(C18/$C$44)*100) -> 2.3346538123349467 | T18: 16.05 | U18: 15.779036113451738 | V18: 17.557209205709352 | W18: =U18-T18 -> -0.27096388654826242
A19: Campo Largo | B19: 4900000 | C19: 4813984.41 | D19: 4815212.23 | F19: 4190439.87 | G19: 3605265.07 | H19: 3067593.33 | J19: =IF(B19=0,0,((C19/B19)*100)-100) -> -1.7554202040816307 | K19: =IF(C19=0,0,IF(D19=0,0,((C19/D19)*100)-100)) -> -2.5498772252461777E-2 | L19: =IF(F19=0,0,((C19/F19)*100)-100) -> 14.88016913126593 | M19: =IF(G19=0,0,((C19/G19)*100)-100) -> 33.526504058132986 | N19: =IF(C19=0,0,IF(H19=0,0,((C19/H19)*100)-100)) -> 56.930332417954503 | P19: 4900000 | Q19: =IF(C19=0,0,((C19/P19)*100)-100) -> -1.7554202040816307 | R19: =IF(C19=0,0,(C19/$C$44)*100) -> 2.4495502258212634 | T19: 16.35 | U19: 16.234426398983707 | V19: 18.307537229851558 | W19: =U19-T19 -> -0.11557360101629399
A20: Brasilia | B20: 3550000 | C20: 3603555.54 | D20: 3497052.12 | F20: 3084347.13 | G20: 2415218.27 | H20: 2384537.88 | J20: =IF(B20=0,0,((C20/B20)*100)-100) -> 1.5086067605633957 | K20: =IF(C20=0,0,IF(D20=0,0,((C20/D20)*100)-100)) -> 3.0455199506720589 | L20: =IF(F20=0,0,((C20/F20)*100)-100) -> 16.833656787522486 | M20: =IF(G20=0,0,((C20/G20)*100)-100) -> 49.202065285801268 | N20: =IF(C20=0,0,IF(H20=0,0,((C20/H20)*100)-100)) -> 51.121756975401894 | P20: 3550000 | Q20: =IF(C20=0,0,((C20/P20)*100)-100) -> 1.5086067605633957 | R20: =IF(C20=0,0,(C20/$C$44)*100) -> 1.8336349964968968 | T20: 15.88 | U20: 16.051257819658858 | V20: 18.325310104697319 | W20: =U20-T20 -> 0.171257819658857
A21: Cajuru | B21: 5800000 | C21: 5942649.9299999997 | D21: 5714067.1699999999 | F21: 5283567.02 | G21: 2093554.05 | H21: 0 | J21: =IF(B21=0,0,((C21/B21)*100)-100) -> 2.4594815517241244 | K21: =IF(C21=0,0,IF(D21=0,0,((C21/D21)*100)-100)) -> 4.0003512944353474 | L21: =IF(F21=0,0,((C21/F21)*100)-100) -> 12.47420364888265 | M21: =IF(G21=0,0,((C21/G21)*100)-100) -> 183.8546217614969 | N21: =IF(C21=0,0,IF(H21=0,0,((C21/H21)*100)-100)) -> 0 | P21: 5800000 | Q21: =IF(C21=0,0,((C21/P21)*100)-100) -> 2.4594815517241244 | R21: =IF(C21=0,0,(C21/$C$44)*100) -> 3.0238609513918666 | T21: 16.3 | U21: 16.121648685100993 | V21: 17.854342313581309 | W21: =U21-T21 -> -0.17835131489900746
A22: Total Super | B22: =SUM(B6:B21) -> 54949999 | C22: =SUM(C6:C21) -> 55192885.430000007 | D22: =SUM(D6:D21) -> 54223812.499999993 | F22: =SUM(F6:F21) -> 47192461.540000007 | G22: =SUM(G6:G21) -> 38416918.270000003 | H22: =SUM(H6:H21) -> 30300073.959999997 | I22: =SUM(B22:H22) -> 280276150.70000005 | J22: =IF(C22=0,0,((C22/B22)*100)-100) -> 0.44201352942701533 | K22: =IF(C22=0,0,IF(D22=0,0,((C22/D22)*100)-100)) -> 1.7871722501991485 | L22: =IF(F22=0,0,IF(C22=0,0,((C22/F22)*100)-100)) -> 16.952758192574663 | M22: =IF(G22=0,0,IF(C22=0,0,((C22/G22)*100)-100)) -> 43.668175156830443 | N22: =IF(C22=0,0,IF(H22=0,0,((C22/H22)*100)-100)) -> 82.154292767937562 | P22: =SUM(P6:P21) -> 54950000 | Q22: =IF(C22=0,0,((C22/P22)*100)-100) -> 0.44201170154687475 | R22: =IF(C22=0,0,(C22/$C$44)*100) -> 28.084375322848963 | T22: 16.452556860465091 | U22: 16.263411887179533 | V22: 18.305103611068809 | W22: =U22-T22 -> -0.18914497328555768
A23: Pinheirinho | B23: 5500000 | C23: 5433055.6799999997 | D23: 5482399.2999999998 | F23: 5154599.74 | G23: 4325189.32 | H23: 4570170.59 | J23: =IF(B23=0,0,((C23/B23)*100)-100) -> -1.2171694545454699 | K23: =IF(C23=0,0,IF(D23=0,0,((C23/D23)*100)-100)) -> -0.90003696009519274 | L23: =IF(F23=0,0,((C23/F23)*100)-100) -> 5.4020865643391147 | M23: =IF(G23=0,0,((C23/G23)*100)-100) -> 25.614285942979237 | N23: =IF(C23=0,0,IF(H23=0,0,((C23/H23)*100)-100)) -> 18.880807029131034 | P23: 5500000 | Q23: =IF(C23=0,0,IF(P23=0,0,((C23/P23)*100)-100)) -> -1.2171694545454699 | R23: =IF(C23=0,0,(C23/$C$44)*100) -> 2.7645587593092138 | T23: 16.14 | U23: 15.750151373379632 | V23: 17.56944605250208 | W23: =U23-T23 -> -0.38984862662036868
A24: Londrina | B24: 7000000 | C24: 6848057.3300000001 | D24: 5727739.79 | F24: 4735165.38 | G24: 4012019.25 | H24: 3325594.85 | J24: =IF(B24=0,0,((C24/B24)*100)-100) -> -2.1706095714285709 | K24: =IF(C24=0,0,IF(D24=0,0,((C24/D24)*100)-100)) -> 19.559504814725528 | L24: =IF(F24=0,0,((C24/F24)*100)-100) -> 44.621291558775511 | M24: =IF(G24=0,0,((C24/G24)*100)-100) -> 70.688546172852995 | N24: =IF(C24=0,0,IF(H24=0,0,((C24/H24)*100)-100)) -> 105.9197719168948 | P24: 7000000 | Q24: =IF(C24=0,0,IF(P24=0,0,((C24/P24)*100)-100)) -> -2.1706095714285709 | R24: =IF(C24=0,0,(C24/$C$44)*100) -> 3.4845689039401058 | T24: 15.69 | U24: 14.279678017824072 | V24: 16.366985368097087 | W24: =U24-T24 -> -1.4103219821759279
A25: São Bráz | B25: 5900000 | C25: 6080505.0499999998 | D25: 5750029.3700000001 | F25: 5943570.8600000003 | G25: 5197996.84 | H25: 4816414.85 | J25: =IF(B25=0,0,((C25/B25)*100)-100) -> 3.0594076271186452 | K25: =IF(C25=0,0,IF(D25=0,0,((C25/D25)*100)-100)) -> 5.7473737738490911 | L25: =IF(F25=0,0,((C25/F25)*100)-100) -> 2.3039043905669843 | M25: =IF(G25=0,0,((C25/G25)*100)-100) -> 16.977851991152804 | N25: =IF(C25=0,0,IF(H25=0,0,((C25/H25)*100)-100)) -> 26.245459317110104 | P25: 5900000 | Q25: =IF(C25=0,0,IF(P25=0,0,((C25/P25)*100)-100)) -> 3.0594076271186452 | R25: =IF(C25=0,0,(C25/$C$44)*100) -> 3.09400721934096 | T25: 16.21 | U25: 15.251476398329775 | V25: 16.894224865416401 | W25: =U25-T25 -> -0.9585236016702261
A26: S.J. Pinhais | B26: 6500000 | C26: 6650797.9500000002 | D26: 6425406.5800000001 | F26: 7046358.7599999998 | G26: 5711700.8099999996 | H26: 5299677.49 | J26: =IF(B26=0,0,((C26/B26)*100)-100) -> 2.3199684615384513 | K26: =IF(C26=0,0,IF(D26=0,0,((C26/D26)*100)-100)) -> 3.5078149093562985 | L26: =IF(F26=0,0,((C26/F26)*100)-100) -> -5.6136910349424198 | M26: =IF(G26=0,0,((C26/G26)*100)-100) -> 16.441637460348701 | N26: =IF(C26=0,0,IF(H26=0,0,((C26/H26)*100)-100)) -> 25.494390225621075 | P26: 6500000 | Q26: =IF(C26=0,0,IF(P26=0,0,((C26/P26)*100)-100)) -> 2.3199684615384513 | R26: =IF(C26=0,0,(C26/$C$44)*100) -> 3.3841953427335878 | T26: 16.6 | U26: 15.860376108704369 | V26: 17.558194801271927 | W26: =U26-T26 -> -0.73962389129563277
A27: P.G. Nova | B27: 7950000 | C27: 7898056.3499999996 | D27: 7808201.2800000003 | F27: 6920626.46 | G27: 5524886.4699999997 | H27: 4495373.44 | J27: =IF(B27=0,0,((C27/B27)*100)-100) -> -0.65337924528301983 | K27: =IF(C27=0,0,IF(D27=0,0,((C27/D27)*100)-100)) -> 1.1507780957203977 | L27: =IF(F27=0,0,((C27/F27)*100)-100) -> 14.123430814383227 | M27: =IF(G27=0,0,((C27/G27)*100)-100) -> 42.954183635921851 | N27: =IF(C27=0,0,IF(H27=0,0,((C27/H27)*100)-100)) -> 75.692997598882442 | P27: 7950000 | Q27: =IF(C27=0,0,IF(P27=0,0,((C27/P27)*100)-100)) -> -0.65337924528301983 | R27: =IF(C27=0,0,(C27/$C$44)*100) -> 4.0188509284539959 | T27: 15.98 | U27: 15.82190937394363 | V27: 17.626150902303959 | W27: =U27-T27 -> -0.15809062605637081
A28: Nilo Pecanha | B28: 17300000 | C28: 17023996.670000002 | D28: 17016363.289999999 | F28: 14758847.220000001 | G28: 12649114.08 | H28: 11793637.68 | J28: =IF(B28=0,0,((C28/B28)*100)-100) -> -1.5953949710982585 | K28: =IF(C28=0,0,IF(D28=0,0,((C28/D28)*100)-100)) -> 4.4859056367755556E-2 | L28: =IF(F28=0,0,((C28/F28)*100)-100) -> 15.347739672583998 | M28: =IF(G28=0,0,((C28/G28)*100)-100) -> 34.586474296388047 | N28: =IF(C28=0,0,IF(H28=0,0,((C28/H28)*100)-100)) -> 44.348988258896583 | P28: 17300000 | Q28: =IF(C28=0,0,IF(P28=0,0,((C28/P28)*100)-100)) -> -1.5953949710982585 | R28: =IF(C28=0,0,(C28/$C$44)*100) -> 8.6624989480136154 | T28: 16.6 | U28: 16.606742884777596 | V28: 18.357017657358362 | W28: =U28-T28 -> 6.7428847775943268E-3
A29: Champagnat | B29: 7600000 | C29: 7359451.1200000001 | D29: 7246154.8200000003 | F29: 6900014.4199999999 | G29: 6178735.79 | H29: 6676772 | J29: =IF(B29=0,0,((C29/B29)*100)-100) -> -3.1651168421052631 | K29: =IF(C29=0,0,IF(D29=0,0,((C29/D29)*100)-100)) -> 1.5635368387008697 | L29: =IF(F29=0,0,((C29/F29)*100)-100) -> 6.6584889832737417 | M29: =IF(G29=0,0,((C29/G29)*100)-100) -> 19.109335147667821 | N29: =IF(C29=0,0,IF(H29=0,0,((C29/H29)*100)-100)) -> 10.224688217599763 | P29: 7600000 | Q29: =IF(C29=0,0,IF(P29=0,0,((C29/P29)*100)-100)) -> -3.1651168421052631 | R29: =IF(C29=0,0,(C29/$C$44)*100) -> 3.7447867748530062 | T29: 16.9 | U29: 16.645205597887035 | V29: 18.189853988730619 | W29: =U29-T29 -> -0.25479440211296378
A30: Araucária Nova | B30: 8200000 | C30: 8309615.4299999997 | D30: 8058447.8300000001 | F30: 5375837.0199999996 | G30: 4405702.68 | H30: 3436656.75 | J30: =IF(B30=0,0,((C30/B30)*100)-100) -> 1.336773536585369 | K30: =IF(C30=0,0,IF(D30=0,0,((C30/D30)*100)-100)) -> 3.1168235533516935 | L30: =IF(F30=0,0,((C30/F30)*100)-100) -> 54.573425479331206 | M30: =IF(G30=0,0,((C30/G30)*100)-100) -> 88.61044499716445 | N30: =IF(C30=0,0,IF(H30=0,0,((C30/H30)*100)-100)) -> 141.79358121814172 | P30: 8200000 | Q30: =IF(C30=0,0,IF(P30=0,0,((C30/P30)*100)-100)) -> 1.336773536585369 | R30: =IF(C30=0,0,(C30/$C$44)*100) -> 4.2282688557864176 | T30: 15.7 | U30: 15.736439960615604 | V30: 17.682930075140675 | W30: =U30-T30 -> 3.6439960615604505E-2
A31: Santa Candida | B31: 9400000 | C31: 9365249.1300000008 | D31: 9012096.1300000008 | F31: 8794728.0199999996 | G31: 7173626.5700000003 | H31: 6324031.2599999998 | J31: =IF(B31=0,0,((C31/B31)*100)-100) -> -0.36969010638297561 | K31: =IF(C31=0,0,IF(D31=0,0,((C31/D31)*100)-100)) -> 3.9186554926373276 | L31: =IF(F31=0,0,((C31/F31)*100)-100) -> 6.4870807681895997 | M31: =IF(G31=0,0,((C31/G31)*100)-100) -> 30.55111021760365 | N31: =IF(C31=0,0,IF(H31=0,0,((C31/H31)*100)-100)) -> 48.089861434366185 | P31: 9400000 | Q31: =IF(C31=0,0,IF(P31=0,0,((C31/P31)*100)-100)) -> -0.36969010638297561 | R31: =IF(C31=0,0,(C31/$C$44)*100) -> 4.7654180336790688 | T31: 16.5 | U31: 16.112071000507385 | V31: 18.014499658056611 | W31: =U31-T31 -> -0.38792899949261539
A32: Paranaguá Raia | B32: 9750000 | C32: 9840651.6899999995 | D32: 9631895.2599999998 | F32: 8473659.9800000004 | G32: 7161890.1200000001 | H32: 6567241.9500000002 | J32: =IF(B32=0,0,((C32/B32)*100)-100) -> 0.92976092307692682 | K32: =IF(C32=0,0,IF(D32=0,0,((C32/D32)*100)-100)) -> 2.1673453081133403 | L32: =IF(F32=0,0,((C32/F32)*100)-100) -> 16.132246434556592 | M32: =IF(G32=0,0,((C32/G32)*100)-100) -> 37.402997324957568 | N32: =IF(C32=0,0,IF(H32=0,0,((C32/H32)*100)-100)) -> 49.844512581114799 | P32: 9750000 | Q32: =IF(C32=0,0,IF(P32=0,0,((C32/P32)*100)-100)) -> 0.92976092307692682 | R32: =IF(C32=0,0,(C32/$C$44)*100) -> 5.0073221091856208 | T32: 18.26 | U32: 17.789480048145066 | V32: 19.554712170693648 | W32: =U32-T32 -> -0.47051995185493567
A33: Novo Mundo | B33: 7550000 | C33: 7771209.9699999997 | D33: 7356862.3300000001 | F33: 6437843.5300000003 | G33: 5050281.64 | H33: 0 | J33: =IF(B33=0,0,((C33/B33)*100)-100) -> 2.9299333774834366 | K33: =IF(C33=0,0,IF(D33=0,0,((C33/D33)*100)-100)) -> 5.6321244222603042 | L33: =IF(F33=0,0,((C33/F33)*100)-100) -> 20.711383148512155 | M33: =IF(G33=0,0,((C33/G33)*100)-100) -> 53.87676418774933 | N33: =IF(C33=0,0,IF(H33=0,0,((C33/H33)*100)-100)) -> 0 | P33: 7550000 | Q33: =IF(C33=0,0,IF(P33=0,0,((C33/P33)*100)-100)) -> 2.9299333774834366 | R33: =IF(C33=0,0,(C33/$C$44)*100) -> 3.9543063532517659 | T33: 15.8 | U33: 15.829362103826931 | V33: 17.779951503485115 | W33: =U33-T33 -> 2.9362103826930053E-2
A34: Água Verde | B34: 8100000 | C34: 8140840.7400000002 | D34: 8101562.0199999996 | F34: 6677654.0099999998 | G34: 0 | H34: 0 | J34: =IF(B34=0,0,((C34/B34)*100)-100) -> 0.50420666666666136 | K34: =IF(C34=0,0,IF(D34=0,0,((C34/D34)*100)-100)) -> 0.48482897375883738 | L34: =IF(F34=0,0,((C34/F34)*100)-100) -> 21.911688263705059 | M34: =IF(G34=0,0,((C34/G34)*100)-100) -> 0 | N34: =IF(C34=0,0,IF(H34=0,0,((C34/H34)*100)-100)) -> 0 | P34: 8100000 | Q34: =IF(C34=0,0,IF(P34=0,0,((C34/P34)*100)-100)) -> 0.50420666666666136 | R34: =IF(C34=0,0,(C34/$C$44)*100) -> 4.1423894584324046 | T34: 17 | U34: 17.035994594337193 | V34: 18.533507838896746 | W34: =U34-T34 -> 3.599459433719332E-2
A35: Uvaranas | B35: 6950000 | C35: 6948916.2000000002 | D35: 6840505.9800000004 | F35: 6154144.4500000002 | G35: 5093201.45 | H35: 4490196.28 | J35: =IF(B35=0,0,((C35/B35)*100)-100) -> -1.5594244604315577E-2 | K35: =IF(C35=0,0,IF(D35=0,0,((C35/D35)*100)-100)) -> 1.5848275013129864 | L35: =IF(F35=0,0,((C35/F35)*100)-100) -> 12.914414935450537 | M35: =IF(G35=0,0,((C35/G35)*100)-100) -> 36.435133544541031 | N35: =IF(C35=0,0,IF(H35=0,0,((C35/H35)*100)-100)) -> 54.757515410885333 | P35: 6950000 | Q35: =IF(C35=0,0,IF(P35=0,0,((C35/P35)*100)-100)) -> -1.5594244604315577E-2 | R35: =IF(C35=0,0,(C35/$C$44)*100) -> 3.5358899816052864 | T35: 16.42 | U35: 15.800095832210495 | V35: 17.692881843934167 | W35: =U35-T35 -> -0.61990416778950674
A36: Torres | B36: 7650000 | C36: 7867048.7800000003 | D36: 7500102.4900000002 | F36: 6852060.0499999998 | G36: 5262502.43 | H36: 4747477.78 | J36: =IF(B36=0,0,((C36/B36)*100)-100) -> 2.8372389542483631 | K36: =IF(C36=0,0,IF(D36=0,0,((C36/D36)*100)-100)) -> 4.8925503416687377 | L36: =IF(F36=0,0,((C36/F36)*100)-100) -> 14.812898932489674 | M36: =IF(G36=0,0,((C36/G36)*100)-100) -> 49.492544367338184 | N36: =IF(C36=0,0,IF(H36=0,0,((C36/H36)*100)-100)) -> 65.710070579835332 | P36: 7650000 | Q36: =IF(C36=0,0,IF(P36=0,0,((C36/P36)*100)-100)) -> 2.8372389542483631 | R36: =IF(C36=0,0,(C36/$C$44)*100) -> 4.0030730210852292 | T36: 16.3 | U36: 16.193979962839382 | V36: 18.098693231949174 | W36: =U36-T36 -> -0.10602003716061859
A37: Total Hiper | B37: =SUM(B23:B36) -> 115350000 | C37: =SUM(C23:C36) -> 115537452.08999999 | D37: =SUM(D23:D36) -> 111957766.47 | F37: =SUM(F23:F36) -> 100225109.90000001 | G37: =SUM(G23:G36) -> 77746847.449999988 | H37: =SUM(H23:H36) -> 66543244.920000009 | I37: =SUM(B37:H37) -> 587360420.82999992 | J37: =IF(C37=0,0,((C37/B37)*100)-100) -> 0.16250723016904089 | K37: =IF(C37=0,0,IF(D37=0,0,((C37/D37)*100)-100)) -> 3.1973535493486196 | L37: =IF(F37=0,0,IF(C37=0,0,((C37/F37)*100)-100)) -> 15.277950012005917 | M37: =IF(G37=0,0,IF(C37=0,0,((C37/G37)*100)-100)) -> 48.607250170887795 | N37: =IF(C37=0,0,IF(H37=0,0,((C37/H37)*100)-100)) -> 73.627619496016564 | P37: =SUM(P23:P36) -> 115350000 | Q37: =IF(C37=0,0,((C37/P37)*100)-100) -> 0.16250723016904089 | R37: =IF(C37=0,0,(C37/$C$44)*100) -> 58.790134689670268 | T37: 16.493099263112267 | U37: 16.162428179006248 | V37: 17.960307828785876 | W37: =U37-T37 -> -0.33067108410601875
A38: Total 33,36,38,39,10 | B38: =B22+B37 -> 170299999 | C38: =C22+C37 -> 170730337.51999998 | D38: =D22+D37 -> 166181578.97 | E38: =E22+E37 -> 0 | F38: =F22+F37 -> 147417571.44 | G38: =G22+G37 -> 116163765.72 | H38: =H22+H37 -> 96843318.88000001 | I38: =SUM(B38:H38) -> 867636571.53000009 | J38: =IF(C38=0,0,((C38/B38)*100)-100) -> 0.25269437611680701 | K38: =IF(C38=0,0,IF(D38=0,0,((C38/D38)*100)-100)) -> 2.7372218859595563 | L38: =IF(F38=0,0,IF(C38=0,0,((C38/F38)*100)-100)) -> 15.814102655658274 | M38: =IF(G38=0,0,IF(C38=0,0,((C38/G38)*100)-100)) -> 46.973831695097346 | N38: =IF(C38=0,0,IF(H38=0,0,((C38/H38)*100)-100)) -> 76.295421815886414 | P38: =P22+P37 -> 170300000 | Q38: =IF(C38=0,0,((C38/P38)*100)-100) -> 0.25269378743392679 | R38: =IF(C38=0,0,(C38/$C$44)*100) -> 86.874510012519238 | T38: 16.480017613094642 | U38: 16.195073708303887 | V38: 18.071771757134638 | W38: =U38-T38 -> -0.28494390479075449
A39: S.J.P - Rua Joinvile | B39: 6200000 | C39: 6307140.6799999997 | D39: 5819593.2000000002 | F39: 0 | G39: 0 | H39: 0 | J39: =IF(B39=0,0,((C39/B39)*100)-100) -> 1.7280754838709669 | K39: =IF(C39=0,0,IF(D39=0,0,((C39/D39)*100)-100)) -> 8.3776900419775018 | L39: =IF(F39=0,0,((C39/F39)*100)-100) -> 0 | M39: =IF(G39=0,0,((C39/G39)*100)-100) -> 0 | N39: =IF(C39=0,0,IF(H39=0,0,((C39/H39)*100)-100)) -> 0 | P39: 6200000 | Q39: =IF(P39=0,0,IF(C39=0,0,((C39/P39)*100)-100)) -> 1.7280754838709669 | R39: =IF(C39=0,0,(C39/$C$44)*100) -> 3.2093286062346174 | T39: 16.8 | U39: 16.058867242517255 | V39: 17.693397558717528 | W39: =U39-T39 -> -0.74113275748274532
A40: Castro | B40: 4100000 | C40: 3934202.79 | D40: 3735739.8 | F40: 0 | G40: 0 | H40: 0 | J40: =IF(B40=0,0,((C40/B40)*100)-100) -> -4.0438343902439016 | K40: =IF(C40=0,0,IF(D40=0,0,((C40/D40)*100)-100)) -> 5.3125485345633479 | L40: =IF(F40=0,0,((C40/F40)*100)-100) -> 0 | M40: =IF(G40=0,0,((C40/G40)*100)-100) -> 0 | N40: =IF(C40=0,0,IF(H40=0,0,((C40/H40)*100)-100)) -> 0 | P40: 4100000 | Q40: =IF(P40=0,0,IF(C40=0,0,((C40/P40)*100)-100)) -> -4.0438343902439016 | R40: =IF(C40=0,0,(C40/$C$44)*100) -> 2.0018817079366373 | T40: 16.8 | U40: 15.99492828126432 | V40: 17.85043808328955 | W40: =U40-T40 -> -0.80507171873568062
A41: Colombo | B41: 4600000 | C41: 4719750.38 | D41: 4523466.32 | F41: 4296799.88 | G41: 0 | H41: 0 | J41: =IF(B41=0,0,((C41/B41)*100)-100) -> 2.6032691304347821 | K41: =IF(C41=0,0,IF(D41=0,0,((C41/D41)*100)-100)) -> 4.3392400012386929 | L41: =IF(F41=0,0,((C41/F41)*100)-100) -> 9.8433837230511187 | M41: =IF(G41=0,0,((C41/G41)*100)-100) -> 0 | N41: =IF(C41=0,0,IF(H41=0,0,((C41/H41)*100)-100)) -> 0 | P41: 4600000 | Q41: =IF(P41=0,0,IF(C41=0,0,((C41/P41)*100)-100)) -> 2.6032691304347821 | R41: =IF(C41=0,0,(C41/$C$44)*100) -> 2.4016001350426048 | T41: 16.5 | U41: 16.074127661810795 | V41: 18.264313224124365 | W41: =U41-T41 -> -0.42587233818920467
A42: Pinhais | B42: 5900000 | C42: 6090444.4299999997 | D42: 5810674.1699999999 | F42: 0 | G42: 0 | H42: 0 | J42: =IF(B42=0,0,((C42/B42)*100)-100) -> 3.2278716949152511 | K42: =IF(C42=0,0,IF(D42=0,0,((C42/D42)*100)-100)) -> 4.8147642048908637 | L42: =IF(F42=0,0,((C42/F42)*100)-100) -> 0 | M42: =IF(G42=0,0,((C42/G42)*100)-100) -> 0 | N42: =IF(C42=0,0,IF(H42=0,0,((C42/H42)*100)-100)) -> 0 | P42: 5900000 | Q42: =IF(P42=0,0,IF(C42=0,0,((C42/P42)*100)-100)) -> 3.2278716949152511 | R42: =IF(C42=0,0,(C42/$C$44)*100) -> 3.0990647784125991 | T42: 16 | U42: 14.77560340863335 | V42: 17.217755576829063 | W42: =U42-T42 -> -1.2243965913666504
A43: Campo Comprido | B43: 5900000 | C43: 4743362.15 | D43: 5884901.25 | F43: 0 | G43: 898852.71 | H43: 1231252.33 | J43: =IF(B43=0,0,((C43/B43)*100)-100) -> -19.604031355932193 | K43: =IF(C43=0,0,IF(D43=0,0,((C43/D43)*100)-100)) -> -19.397761347312326 | L43: =IF(F43=0,0,((C43/F43)*100)-100) -> 0 | M43: =IF(G43=0,0,((C43/G43)*100)-100) -> 427.71294976682009 | N43: =IF(C43=0,0,IF(H43=0,0,((C43/H43)*100)-100)) -> 285.24695827377644 | P43: 5900000 | Q43: =IF(P43=0,0,IF(C43=0,0,((C43/P43)*100)-100)) -> -19.604031355932193 | R43: =IF(C43=0,0,(C43/$C$44)*100) -> 2.4136147598543083 | T43: 16.3 | U43: 16.590106542887519 | V43: 18.588461597856281 | W43: =U43-T43 -> 0.2901065428875178
A44: Total Geral | B44: =B22+B37+SUM(B39:B43) -> 196999999 | C44: =C22+C37+SUM(C39:C43) -> 196525237.94999999 | D44: =D22+D37+SUM(D39:D43) -> 191955953.71000001 | F44: =F22+F37+SUM(F39:F43) -> 151714371.31999999 | G44: =G22+G37+SUM(G39:G43) -> 117062618.42999999 | H44: =H22+H37+SUM(H39:H43) -> 98074571.210000008 | J44: =IF(C44=0,0,((C44/B44)*100)-100) -> -0.24099545807612799 | K44: =IF(C44=0,0,IF(D44=0,0,((C44/D44)*100)-100)) -> 2.3803816196829644 | L44: =IF(F44=0,0,IF(C44=0,0,((C44/F44)*100)-100)) -> 29.536336103244764 | M44: =IF(G44=0,0,IF(C44=0,0,((C44/G44)*100)-100)) -> 67.880439192051995 | N44: =IF(C44=0,0,IF(H44=0,0,((C44/H44)*100)-100)) -> 100.38347914791763 | P44: =P22+P37+SUM(P39:P43) -> 197000000 | Q44: =IF(C44=0,0,((C44/P44)*100)-100) -> -0.24099596446700389 | R44: =R22+R37+SUM(R39:R43) -> 100 | T44: 16.42 | U44: 16.149335346829432 | V44: 18.045826111159784 | W44: =U44-T44 -> -0.27066465317057009
A46: Água Verde | B46: 0 | C46: 0 | D46: 0 | F46: 0 | G46: 0 | H46: 0 | J46: =IF(B46=0,0,((C46/B46)*100)-100) -> 0 | K46: =IF(C46=0,0,IF(D46=0,0,((C46/D46)*100)-100)) -> 0 | L46: =IF(F46=0,0,((C46/F46)*100)-100) -> 0 | M46: =IF(G46=0,0,((C46/G46)*100)-100) -> 0 | N46: =IF(C46=0,0,IF(H46=0,0,((C46/H46)*100)-100)) -> 0 | P46: =B46 -> 0 | Q46: =IF(C46=0,0,IF(P46=0,0,((C46/P46)*100)-100)) -> 0 | R46: =IF(C46=0,0,(C46/$C$44)*100) -> 0 | T46: 14.95 | U46: 0 | W46: =U46-T46 -> -14.95
A47: Total Geral | B47: =B44+B46 -> 196999999 | C47: =C44+C46 -> 196525237.94999999 | D47: =D44+D46 -> 191955953.71000001 | F47: =F44+F46 -> 151714371.31999999 | G47: =G44+G46 -> 117062618.42999999 | H47: =H44+H46 -> 98074571.210000008 | J47: =IF(C47=0,0,((C47/B47)*100)-100) -> -0.24099545807612799 | K47: =IF(C47=0,0,IF(D47=0,0,((C47/D47)*100)-100)) -> 2.3803816196829644 | L47: =IF(F47=0,0,IF(C47=0,0,((C47/F47)*100)-100)) -> 29.536336103244764 | M47: =IF(G47=0,0,IF(C47=0,0,((C47/G47)*100)-100)) -> 67.880439192051995 | N47: =IF(C47=0,0,IF(H47=0,0,((C47/H47)*100)-100)) -> 100.38347914791763 | P47: =P44+P46 -> 197000000 | Q47: =IF(C47=0,0,((C47/P47)*100)-100) -> -0.24099596446700389 | R47: =R25+R40+R46 -> 5.0958889272775973 | T47: 16.477446698007345 | U47: 16.149335346829432 | W47: =U47-T47 -> -0.32811135117791324