A2: Periodo: | C2: 39814 | D2: a | E2: 31/01/2009 | H2: Vendas Acumuladas por Filial | Q2: =NOW() -> 39845.309597337997
A4: v.1 | C4: Vendas 2009 | G4: Vendas de Anos Anteriores | K4: Percentuais ( % ) | Q4: Meta Mensal | U4: Margem
A5: Lojas | C5: Previsao | D5: Realizada | E5: Mes Anterior | G5: Vendas 2008 | H5: Vendas 2007 | I5: Vendas 2006 | K5: % Prev | L5: % MA | M5: 2008 | N5: 2007 | O5: 2006 | Q5: Previsao Mes | R5: Final | S5: Part. | U5: Meta | V5: Coml | W5: Dif
A7: S. Felicidade | C7: 2300000 | D7: 2472374 | E7: 2918228 | G7: 1995836 | H7: 760828 | I7: 721831 | K7: =IF(C7=0,0,((D7/C7)*100)-100) -> 7.49 | L7: =IF(D7=0,0,IF(E7=0,0,((D7/E7)*100)-100)) -> -15.28 | M7: =IF(G7=0,0,((D7/G7)*100)-100) -> 23.88 | N7: =IF(H7=0,0,((D7/H7)*100)-100) -> 224.96 | O7: =IF(D7=0,0,IF(I7=0,0,((D7/I7)*100)-100)) -> 242.51 | Q7: 2472350 | R7: =IF(D7=0,0,((D7/Q7)*100)-100) -> 0 | S7: =IF(D7=0,0,(D7/$D$44)*100) -> 2.77 | U7: 18.12 | V7: 18.12 | W7: =V7-U7 -> 0
A8: Lapa | C8: 1870000 | D8: 2076477 | E8: 2531216 | G8: 1532310 | H8: 1046389 | I8: 1054478 | K8: =IF(C8=0,0,((D8/C8)*100)-100) -> 11.04 | L8: =IF(D8=0,0,IF(E8=0,0,((D8/E8)*100)-100)) -> -17.97 | M8: =IF(G8=0,0,((D8/G8)*100)-100) -> 35.51 | N8: =IF(H8=0,0,((D8/H8)*100)-100) -> 98.44 | O8: =IF(D8=0,0,IF(I8=0,0,((D8/I8)*100)-100)) -> 96.92 | Q8: 1870000 | R8: =IF(D8=0,0,((D8/Q8)*100)-100) -> 11.04 | S8: =IF(D8=0,0,(D8/$D$44)*100) -> 2.32 | U8: 16.1 | V8: 16.49 | W8: =V8-U8 -> 0.39
A9: Araucaria | C9: 1150000 | D9: 1258742 | E9: 1482404 | G9: 1026669 | H9: 910260 | I9: 919300 | K9: =IF(C9=0,0,((D9/C9)*100)-100) -> 9.46 | L9: =IF(D9=0,0,IF(E9=0,0,((D9/E9)*100)-100)) -> -15.09 | M9: =IF(G9=0,0,((D9/G9)*100)-100) -> 22.6 | N9: =IF(H9=0,0,((D9/H9)*100)-100) -> 38.28 | O9: =IF(D9=0,0,IF(I9=0,0,((D9/I9)*100)-100)) -> 36.92 | Q9: 1150000 | R9: =IF(D9=0,0,((D9/Q9)*100)-100) -> 9.46 | S9: =IF(D9=0,0,(D9/$D$44)*100) -> 1.41 | U9: 18.2 | V9: 17.21 | W9: =V9-U9 -> -0.99
A10: Hauer | C10: 3815000 | D10: 3451415 | E10: 4035050 | G10: 3144041 | H10: 2794476 | I10: 2792165 | K10: =IF(C10=0,0,((D10/C10)*100)-100) -> -9.53 | L10: =IF(D10=0,0,IF(E10=0,0,((D10/E10)*100)-100)) -> -14.46 | M10: =IF(G10=0,0,((D10/G10)*100)-100) -> 9.78 | N10: =IF(H10=0,0,((D10/H10)*100)-100) -> 23.51 | O10: =IF(D10=0,0,IF(I10=0,0,((D10/I10)*100)-100)) -> 23.61 | Q10: 3473945 | R10: =IF(D10=0,0,((D10/Q10)*100)-100) -> -0.65 | S10: =IF(D10=0,0,(D10/$D$44)*100) -> 3.86 | U10: 16.26 | V10: 16.26 | W10: =V10-U10 -> 0
A11: Paranagua | C11: 2020000 | D11: 1776573 | E11: 2420389 | G11: 1780561 | H11: 1551521 | I11: 1458107 | K11: =IF(C11=0,0,((D11/C11)*100)-100) -> -12.05 | L11: =IF(D11=0,0,IF(E11=0,0,((D11/E11)*100)-100)) -> -26.6 | M11: =IF(G11=0,0,((D11/G11)*100)-100) -> -0.22 | N11: =IF(H11=0,0,((D11/H11)*100)-100) -> 14.51 | O11: =IF(D11=0,0,IF(I11=0,0,((D11/I11)*100)-100)) -> 21.84 | Q11: 1946000 | R11: =IF(D11=0,0,((D11/Q11)*100)-100) -> -8.71 | S11: =IF(D11=0,0,(D11/$D$44)*100) -> 1.99 | U11: 17.9 | V11: 18.79 | W11: =V11-U11 -> 0.89
A12: Centenario | C12: 1190000 | D12: 1216248 | E12: 1407684 | G12: 1056621 | H12: 943942 | I12: 866241 | K12: =IF(C12=0,0,((D12/C12)*100)-100) -> 2.21 | L12: =IF(D12=0,0,IF(E12=0,0,((D12/E12)*100)-100)) -> -13.6 | M12: =IF(G12=0,0,((D12/G12)*100)-100) -> 15.11 | N12: =IF(H12=0,0,((D12/H12)*100)-100) -> 28.85 | O12: =IF(D12=0,0,IF(I12=0,0,((D12/I12)*100)-100)) -> 40.41 | Q12: 1190000 | R12: =IF(D12=0,0,((D12/Q12)*100)-100) -> 2.21 | S12: =IF(D12=0,0,(D12/$D$44)*100) -> 1.36 | U12: 17.32 | V12: 16.69 | W12: =V12-U12 -> -0.63
A13: Sitio Cercado | C13: 1970000 | D13: 2043911 | E13: 2390993 | G13: 1637396 | H13: 1258814 | I13: 1259172 | K13: =IF(C13=0,0,((D13/C13)*100)-100) -> 3.75 | L13: =IF(D13=0,0,IF(E13=0,0,((D13/E13)*100)-100)) -> -14.52 | M13: =IF(G13=0,0,((D13/G13)*100)-100) -> 24.83 | N13: =IF(H13=0,0,((D13/H13)*100)-100) -> 62.37 | O13: =IF(D13=0,0,IF(I13=0,0,((D13/I13)*100)-100)) -> 62.32 | Q13: 1970000 | R13: =IF(D13=0,0,((D13/Q13)*100)-100) -> 3.75 | S13: =IF(D13=0,0,(D13/$D$44)*100) -> 2.29 | U13: 17.1 | V13: 16.05 | W13: =V13-U13 -> -1.05
A14: Apucarana | C14: 2400000 | D14: 2474780 | E14: 3136054 | G14: 2197387 | H14: 1887839 | I14: 1752201 | K14: =IF(C14=0,0,((D14/C14)*100)-100) -> 3.12 | L14: =IF(D14=0,0,IF(E14=0,0,((D14/E14)*100)-100)) -> -21.09 | M14: =IF(G14=0,0,((D14/G14)*100)-100) -> 12.62 | N14: =IF(H14=0,0,((D14/H14)*100)-100) -> 31.09 | O14: =IF(D14=0,0,IF(I14=0,0,((D14/I14)*100)-100)) -> 41.24 | Q14: 2400000 | R14: =IF(D14=0,0,((D14/Q14)*100)-100) -> 3.12 | S14: =IF(D14=0,0,(D14/$D$44)*100) -> 2.77 | U14: 17.4 | V14: 17.61 | W14: =V14-U14 -> 0.21
A15: Ah | C15: 1700000 | D15: 1477101 | E15: 1765243 | G15: 1416695 | H15: 1048565 | I15: 1008283 | K15: =IF(C15=0,0,((D15/C15)*100)-100) -> -13.11 | L15: =IF(D15=0,0,IF(E15=0,0,((D15/E15)*100)-100)) -> -16.32 | M15: =IF(G15=0,0,((D15/G15)*100)-100) -> 4.26 | N15: =IF(H15=0,0,((D15/H15)*100)-100) -> 40.87 | O15: =IF(D15=0,0,IF(I15=0,0,((D15/I15)*100)-100)) -> 46.5 | Q15: 1700000 | R15: =IF(D15=0,0,((D15/Q15)*100)-100) -> -13.11 | S15: =IF(D15=0,0,(D15/$D$44)*100) -> 1.65 | U15: 18.2 | V15: 17.86 | W15: =V15-U15 -> -0.34
A16: P.G. Centro | C16: 2000000 | D16: 2079805 | E16: 2493558 | G16: 1826961 | H16: 1542014 | I16: 1474547 | K16: =IF(C16=0,0,((D16/C16)*100)-100) -> 3.99 | L16: =IF(D16=0,0,IF(E16=0,0,((D16/E16)*100)-100)) -> -16.59 | M16: =IF(G16=0,0,((D16/G16)*100)-100) -> 13.84 | N16: =IF(H16=0,0,((D16/H16)*100)-100) -> 34.88 | O16: =IF(D16=0,0,IF(I16=0,0,((D16/I16)*100)-100)) -> 41.05 | Q16: 2079000 | R16: =IF(D16=0,0,((D16/Q16)*100)-100) -> 0.04 | S16: =IF(D16=0,0,(D16/$D$44)*100) -> 2.33 | U16: 18.56 | V16: 18.56 | W16: =V16-U16 -> 0
A17: Maringa | C17: 2920000 | D17: 2771932 | E17: 3246917 | G17: 2330696 | H17: 2041985 | I17: 2071793 | K17: =IF(C17=0,0,((D17/C17)*100)-100) -> -5.07 | L17: =IF(D17=0,0,IF(E17=0,0,((D17/E17)*100)-100)) -> -14.63 | M17: =IF(G17=0,0,((D17/G17)*100)-100) -> 18.93 | N17: =IF(H17=0,0,((D17/H17)*100)-100) -> 35.75 | O17: =IF(D17=0,0,IF(I17=0,0,((D17/I17)*100)-100)) -> 33.79 | Q17: 2771724 | R17: =IF(D17=0,0,((D17/Q17)*100)-100) -> 0.01 | S17: =IF(D17=0,0,(D17/$D$44)*100) -> 3.1 | U17: 17.65 | V17: 17.65 | W17: =V17-U17 -> 0
A18: Araucaria Nova | C18: 2920000 | D18: 3412251 | E18: 4167224 | G18: 2565286 | H18: 1998127 | I18: 1904973 | K18: =IF(C18=0,0,((D18/C18)*100)-100) -> 16.86 | L18: =IF(D18=0,0,IF(E18=0,0,((D18/E18)*100)-100)) -> -18.12 | M18: =IF(G18=0,0,((D18/G18)*100)-100) -> 33.02 | N18: =IF(H18=0,0,((D18/H18)*100)-100) -> 70.77 | O18: =IF(D18=0,0,IF(I18=0,0,((D18/I18)*100)-100)) -> 79.12 | Q18: 3550000 | R18: =IF(D18=0,0,((D18/Q18)*100)-100) -> -3.88 | S18: =IF(D18=0,0,(D18/$D$44)*100) -> 3.82 | U18: 16.5 | V18: 16.85 | W18: =V18-U18 -> 0.35
A19: Cristo Rei | C19: 1494310 | D19: 1544135 | E19: 1885774 | G19: 1330167 | H19: 1124970 | I19: 0 | K19: =IF(C19=0,0,((D19/C19)*100)-100) -> 3.33 | L19: =IF(D19=0,0,IF(E19=0,0,((D19/E19)*100)-100)) -> -18.12 | M19: =IF(G19=0,0,((D19/G19)*100)-100) -> 16.09 | N19: =IF(H19=0,0,((D19/H19)*100)-100) -> 37.26 | O19: =IF(D19=0,0,IF(I19=0,0,((D19/I19)*100)-100)) -> 0 | Q19: 1544135 | R19: =IF(D19=0,0,((D19/Q19)*100)-100) -> 0 | S19: =IF(D19=0,0,(D19/$D$44)*100) -> 1.73 | U19: 18.13 | V19: 18.13 | W19: =V19-U19 -> 0
A20: Campo Largo | C20: 2300000 | D20: 2519617 | E20: 2976092 | G20: 0 | H20: 0 | I20: 0 | K20: =IF(C20=0,0,((D20/C20)*100)-100) -> 9.55 | L20: =IF(D20=0,0,IF(E20=0,0,((D20/E20)*100)-100)) -> -15.34 | M20: =IF(G20=0,0,((D20/G20)*100)-100) -> 0 | N20: =IF(H20=0,0,((D20/H20)*100)-100) -> 0 | O20: =IF(D20=0,0,IF(I20=0,0,((D20/I20)*100)-100)) -> 0 | Q20: 2519617 | R20: =IF(D20=0,0,((D20/Q20)*100)-100) -> 0 | S20: =IF(D20=0,0,(D20/$D$44)*100) -> 2.82 | U20: 17.57 | V20: 17.57 | W20: =V20-U20 -> 0
A21: Brasilia | C21: 2280000 | D21: 2205514 | E21: 2642511 | G21: 863438 | H21: 760181 | I21: 651011 | K21: =IF(C21=0,0,((D21/C21)*100)-100) -> -3.27 | L21: =IF(D21=0,0,IF(E21=0,0,((D21/E21)*100)-100)) -> -16.54 | M21: =IF(G21=0,0,((D21/G21)*100)-100) -> 155.43 | N21: =IF(H21=0,0,((D21/H21)*100)-100) -> 190.13 | O21: =IF(D21=0,0,IF(I21=0,0,((D21/I21)*100)-100)) -> 238.78 | Q21: 2280000 | R21: =IF(D21=0,0,((D21/Q21)*100)-100) -> -3.27 | S21: =IF(D21=0,0,(D21/$D$44)*100) -> 2.47 | U21: 17.8 | V21: 16.49 | W21: =V21-U21 -> -1.31
A22: Total Super | C22: =SUM(C7:C21) -> 32329310 | D22: =SUM(D7:D21) -> 32780875 | E22: =SUM(E7:E21) -> 39499337 | G22: =SUM(G7:G21) -> 24704064 | H22: =SUM(H7:H21) -> 19669911 | I22: =SUM(I7:I21) -> 17934102 | J22: =SUM(C22:I22) -> 166917599 | K22: =IF(D22=0,0,((D22/C22)*100)-100) -> 1.4 | L22: =IF(D22=0,0,IF(E22=0,0,((D22/E22)*100)-100)) -> -17.01 | M22: =IF(G22=0,0,IF(D22=0,0,((D22/G22)*100)-100)) -> 32.69 | N22: =IF(H22=0,0,IF(D22=0,0,((D22/H22)*100)-100)) -> 66.65 | O22: =IF(D22=0,0,IF(I22=0,0,((D22/I22)*100)-100)) -> 82.79 | Q22: =SUM(Q7:Q21) -> 32916771 | R22: =IF(D22=0,0,((D22/Q22)*100)-100) -> -0.41 | S22: =IF(D22=0,0,(D22/$D$44)*100) -> 36.66 | U22: 17.41 | V22: 17.29 | W22: =V22-U22 -> -0.12
A24: Pinheirinho | C24: 4100000 | D24: 4339990 | E24: 5248171 | G24: 3719224 | H24: 2900422 | I24: 1763676 | K24: =IF(C24=0,0,((D24/C24)*100)-100) -> 5.85 | L24: =IF(D24=0,0,IF(E24=0,0,((D24/E24)*100)-100)) -> -17.3 | M24: =IF(G24=0,0,((D24/G24)*100)-100) -> 16.69 | N24: =IF(H24=0,0,((D24/H24)*100)-100) -> 49.63 | O24: =IF(D24=0,0,IF(I24=0,0,((D24/I24)*100)-100)) -> 146.08 | Q24: 4520000 | R24: =IF(D24=0,0,IF(Q24=0,0,((D24/Q24)*100)-100)) -> -3.98 | S24: =IF(D24=0,0,(D24/$D$44)*100) -> 4.85 | U24: 15.55 | V24: 15.54 | W24: =V24-U24 -> -0.01
A25: Londrina | C25: 3500000 | D25: 3459874 | E25: 4177137 | G25: 3160705 | H25: 2775717 | I25: 2619373 | K25: =IF(C25=0,0,((D25/C25)*100)-100) -> -1.15 | L25: =IF(D25=0,0,IF(E25=0,0,((D25/E25)*100)-100)) -> -17.17 | M25: =IF(G25=0,0,((D25/G25)*100)-100) -> 9.47 | N25: =IF(H25=0,0,((D25/H25)*100)-100) -> 24.65 | O25: =IF(D25=0,0,IF(I25=0,0,((D25/I25)*100)-100)) -> 32.09 | Q25: 3500000 | R25: =IF(D25=0,0,IF(Q25=0,0,((D25/Q25)*100)-100)) -> -1.15 | S25: =IF(D25=0,0,(D25/$D$44)*100) -> 3.87 | U25: 16.8 | V25: 16.17 | W25: =V25-U25 -> -0.63
A26: So Brz | C26: 4550000 | D26: 4691597 | E26: 5776156 | G26: 4318068 | H26: 2926994 | I26: 2825747 | K26: =IF(C26=0,0,((D26/C26)*100)-100) -> 3.11 | L26: =IF(D26=0,0,IF(E26=0,0,((D26/E26)*100)-100)) -> -18.78 | M26: =IF(G26=0,0,((D26/G26)*100)-100) -> 8.65 | N26: =IF(H26=0,0,((D26/H26)*100)-100) -> 60.29 | O26: =IF(D26=0,0,IF(I26=0,0,((D26/I26)*100)-100)) -> 66.03 | Q26: 4550000 | R26: =IF(D26=0,0,IF(Q26=0,0,((D26/Q26)*100)-100)) -> 3.11 | S26: =IF(D26=0,0,(D26/$D$44)*100) -> 5.25 | U26: 16.6 | V26: 16 | W26: =V26-U26 -> -0.6
A27: S.J. Pinhais | C27: 5200000 | D27: 5289680 | E27: 6123208 | G27: 4704464 | H27: 3806563 | I27: 3888347 | K27: =IF(C27=0,0,((D27/C27)*100)-100) -> 1.72 | L27: =IF(D27=0,0,IF(E27=0,0,((D27/E27)*100)-100)) -> -13.61 | M27: =IF(G27=0,0,((D27/G27)*100)-100) -> 12.44 | N27: =IF(H27=0,0,((D27/H27)*100)-100) -> 38.96 | O27: =IF(D27=0,0,IF(I27=0,0,((D27/I27)*100)-100)) -> 36.04 | Q27: 5289000 | R27: =IF(D27=0,0,IF(Q27=0,0,((D27/Q27)*100)-100)) -> 0.01 | S27: =IF(D27=0,0,(D27/$D$44)*100) -> 5.92 | U27: 16.18 | V27: 16.18 | W27: =V27-U27 -> 0
A28: P.G. Nova | C28: 4650000 | D28: 5234242 | E28: 6264119 | G28: 4222460 | H28: 3347319 | I28: 3272190 | K28: =IF(C28=0,0,((D28/C28)*100)-100) -> 12.56 | L28: =IF(D28=0,0,IF(E28=0,0,((D28/E28)*100)-100)) -> -16.44 | M28: =IF(G28=0,0,((D28/G28)*100)-100) -> 23.96 | N28: =IF(H28=0,0,((D28/H28)*100)-100) -> 56.37 | O28: =IF(D28=0,0,IF(I28=0,0,((D28/I28)*100)-100)) -> 59.96 | Q28: 5234000 | R28: =IF(D28=0,0,IF(Q28=0,0,((D28/Q28)*100)-100)) -> 0 | S28: =IF(D28=0,0,(D28/$D$44)*100) -> 5.85 | U28: 16.06 | V28: 16.06 | W28: =V28-U28 -> 0
A29: Nilo Pecanha | C29: 10800000 | D29: 10949009 | E29: 13959308 | G29: 9612434 | H29: 8301452 | I29: 7881610 | K29: =IF(C29=0,0,((D29/C29)*100)-100) -> 1.38 | L29: =IF(D29=0,0,IF(E29=0,0,((D29/E29)*100)-100)) -> -21.56 | M29: =IF(G29=0,0,((D29/G29)*100)-100) -> 13.9 | N29: =IF(H29=0,0,((D29/H29)*100)-100) -> 31.89 | O29: =IF(D29=0,0,IF(I29=0,0,((D29/I29)*100)-100)) -> 38.92 | Q29: 10800000 | R29: =IF(D29=0,0,IF(Q29=0,0,((D29/Q29)*100)-100)) -> 1.38 | S29: =IF(D29=0,0,(D29/$D$44)*100) -> 12.25 | U29: 16.7 | V29: 16.74 | W29: =V29-U29 -> 0.04
A30: Champagnat | C30: 5950000 | D30: 6012636 | E30: 7386695 | G30: 5444638 | H30: 4795421 | I30: 4933361 | K30: =IF(C30=0,0,((D30/C30)*100)-100) -> 1.05 | L30: =IF(D30=0,0,IF(E30=0,0,((D30/E30)*100)-100)) -> -18.6 | M30: =IF(G30=0,0,((D30/G30)*100)-100) -> 10.43 | N30: =IF(H30=0,0,((D30/H30)*100)-100) -> 25.38 | O30: =IF(D30=0,0,IF(I30=0,0,((D30/I30)*100)-100)) -> 21.88 | Q30: 6013000 | R30: =IF(D30=0,0,IF(Q30=0,0,((D30/Q30)*100)-100)) -> -0.01 | S30: =IF(D30=0,0,(D30/$D$44)*100) -> 6.72 | U30: 17.08 | V30: 17.08 | W30: =V30-U30 -> 0
A31: Santa Candida | C31: 5550000 | D31: 5892671 | E31: 7072443 | G31: 4929175 | H31: 3662302 | I31: 3939719 | K31: =IF(C31=0,0,((D31/C31)*100)-100) -> 6.17 | L31: =IF(D31=0,0,IF(E31=0,0,((D31/E31)*100)-100)) -> -16.68 | M31: =IF(G31=0,0,((D31/G31)*100)-100) -> 19.55 | N31: =IF(H31=0,0,((D31/H31)*100)-100) -> 60.9 | O31: =IF(D31=0,0,IF(I31=0,0,((D31/I31)*100)-100)) -> 49.57 | Q31: 5892000 | R31: =IF(D31=0,0,IF(Q31=0,0,((D31/Q31)*100)-100)) -> 0.01 | S31: =IF(D31=0,0,(D31/$D$44)*100) -> 6.59 | U31: 15.83 | V31: 15.83 | W31: =V31-U31 -> 0
A32: Paranagu Raia | C32: 6680000 | D32: 6236806 | E32: 8300852 | G32: 5706989 | H32: 4580925 | I32: 4272908 | K32: =IF(C32=0,0,((D32/C32)*100)-100) -> -6.63 | L32: =IF(D32=0,0,IF(E32=0,0,((D32/E32)*100)-100)) -> -24.87 | M32: =IF(G32=0,0,((D32/G32)*100)-100) -> 9.28 | N32: =IF(H32=0,0,((D32/H32)*100)-100) -> 36.15 | O32: =IF(D32=0,0,IF(I32=0,0,((D32/I32)*100)-100)) -> 45.96 | Q32: 6680000 | R32: =IF(D32=0,0,IF(Q32=0,0,((D32/Q32)*100)-100)) -> -6.63 | S32: =IF(D32=0,0,(D32/$D$44)*100) -> 6.98 | U32: 18.95 | V32: 19.02 | W32: =V32-U32 -> 0.07
A33: Torres | C33: 5500000 | D33: 4524688 | E33: 8083661 | G33: 0 | H33: 0 | I33: 0 | K33: =IF(C33=0,0,((D33/C33)*100)-100) -> -17.73 | L33: =IF(D33=0,0,IF(E33=0,0,((D33/E33)*100)-100)) -> -44.03 | M33: =IF(G33=0,0,((D33/G33)*100)-100) -> 0 | N33: =IF(H33=0,0,((D33/H33)*100)-100) -> 0 | O33: =IF(D33=0,0,IF(I33=0,0,((D33/I33)*100)-100)) -> 0 | Q33: 4524687 | R33: =IF(D33=0,0,IF(Q33=0,0,((D33/Q33)*100)-100)) -> 0 | S33: =IF(D33=0,0,(D33/$D$44)*100) -> 5.06 | U33: 19.33 | V33: 13.63 | W33: =V33-U33 -> -5.7
A34: Total Hiper | C34: =SUM(C24:C33) -> 56480000 | D34: =SUM(D24:D33) -> 56631193 | E34: =SUM(E24:E33) -> 72391750 | G34: =SUM(G24:G33) -> 45818157 | H34: =SUM(H24:H33) -> 37097115 | I34: =SUM(I24:I33) -> 35396931 | J34: =SUM(C34:I34) -> 303815146 | K34: =IF(D34=0,0,((D34/C34)*100)-100) -> 0.27 | L34: =IF(D34=0,0,IF(E34=0,0,((D34/E34)*100)-100)) -> -21.77 | M34: =IF(G34=0,0,IF(D34=0,0,((D34/G34)*100)-100)) -> 23.6 | N34: =IF(H34=0,0,IF(D34=0,0,((D34/H34)*100)-100)) -> 52.66 | O34: =IF(D34=0,0,IF(I34=0,0,((D34/I34)*100)-100)) -> 59.99 | Q34: =SUM(Q24:Q33) -> 57002687 | R34: =IF(D34=0,0,((D34/Q34)*100)-100) -> -0.65 | S34: =IF(D34=0,0,(D34/$D$44)*100) -> 63.34 | U34: 16.92 | V34: 16.38 | W34: =V34-U34 -> -0.54
A36: Total s/ 27, 32 | B36: =B22+B34 -> 0 | C36: =C22+C34 -> 88809310 | D36: =D22+D34 -> 89412068 | E36: =E22+E34 -> 111891087 | F36: =F22+F34 -> 0 | G36: =G22+G34 -> 70522221 | H36: =H22+H34 -> 56767026 | I36: =I22+I34 -> 53331033 | J36: =SUM(C36:I36) -> 470732745 | K36: =IF(D36=0,0,((D36/C36)*100)-100) -> 0.68 | L36: =IF(D36=0,0,IF(E36=0,0,((D36/E36)*100)-100)) -> -20.09 | M36: =IF(G36=0,0,IF(D36=0,0,((D36/G36)*100)-100)) -> 26.79 | N36: =IF(H36=0,0,IF(D36=0,0,((D36/H36)*100)-100)) -> 57.51 | O36: =IF(D36=0,0,IF(I36=0,0,((D36/I36)*100)-100)) -> 67.65 | Q36: =Q22+Q34 -> 89919458 | R36: =IF(D36=0,0,((D36/Q36)*100)-100) -> -0.56 | S36: =IF(D36=0,0,(D36/$D$44)*100) -> 100 | U36: 17.1 | V36: 16.72 | W36: =V36-U36 -> -0.38
A38: Campo Largo | C38: 0 | D38: 0 | E38: 0 | G38: 0 | H38: 0 | I38: 0 | K38: =IF(C38=0,0,((D38/C38)*100)-100) -> 0 | L38: =IF(D38=0,0,IF(E38=0,0,((D38/E38)*100)-100)) -> 0 | M38: =IF(G38=0,0,((D38/G38)*100)-100) -> 0 | N38: =IF(H38=0,0,((D38/H38)*100)-100) -> 0 | O38: =IF(D38=0,0,IF(I38=0,0,((D38/I38)*100)-100)) -> 0 | Q38: 0 | R38: =IF(Q38=0,0,IF(D38=0,0,((D38/Q38)*100)-100)) -> 0 | S38: =IF(D38=0,0,(D38/$D$44)*100) -> 0 | U38: 0 | V38: 0 | W38: =V38-U38 -> 0
A39: Uvaranas | C39: 0 | D39: 0 | E39: 0 | G39: 0 | H39: 0 | I39: 0 | K39: =IF(C39=0,0,((D39/C39)*100)-100) -> 0 | L39: =IF(D39=0,0,IF(E39=0,0,((D39/E39)*100)-100)) -> 0 | M39: =IF(G39=0,0,((D39/G39)*100)-100) -> 0 | N39: =IF(H39=0,0,((D39/H39)*100)-100) -> 0 | O39: =IF(D39=0,0,IF(I39=0,0,((D39/I39)*100)-100)) -> 0 | Q39: 0 | R39: =IF(Q39=0,0,IF(D39=0,0,((D39/Q39)*100)-100)) -> 0 | S39: =IF(D39=0,0,(D39/$D$44)*100) -> 0 | U39: 0 | V39: 0 | W39: =V39-U39 -> 0
A40: Novo Mundo | C40: 0 | D40: 0 | E40: 0 | G40: 0 | H40: 0 | I40: 0 | K40: =IF(C40=0,0,((D40/C40)*100)-100) -> 0 | L40: =IF(D40=0,0,IF(E40=0,0,((D40/E40)*100)-100)) -> 0 | M40: =IF(G40=0,0,((D40/G40)*100)-100) -> 0 | N40: =IF(H40=0,0,((D40/H40)*100)-100) -> 0 | O40: =IF(D40=0,0,IF(I40=0,0,((D40/I40)*100)-100)) -> 0 | Q40: 0 | R40: =IF(Q40=0,0,IF(D40=0,0,((D40/Q40)*100)-100)) -> 0 | S40: =IF(D40=0,0,(D40/$D$44)*100) -> 0 | U40: 0 | V40: 0 | W40: =V40-U40 -> 0
A41: Torres | C41: 0 | D41: 0 | E41: 0 | G41: 0 | H41: 0 | I41: 0 | K41: =IF(C41=0,0,((D41/C41)*100)-100) -> 0 | L41: =IF(D41=0,0,IF(E41=0,0,((D41/E41)*100)-100)) -> 0 | M41: =IF(G41=0,0,((D41/G41)*100)-100) -> 0 | N41: =IF(H41=0,0,((D41/H41)*100)-100) -> 0 | O41: =IF(D41=0,0,IF(I41=0,0,((D41/I41)*100)-100)) -> 0 | Q41: 0 | R41: =IF(Q41=0,0,IF(D41=0,0,((D41/Q41)*100)-100)) -> 0 | S41: =IF(D41=0,0,(D41/$D$44)*100) -> 0 | U41: 0 | V41: 0 | W41: =V41-U41 -> 0
A42: Total Lojas Novas | C42: =SUM(C38:C41) -> 0 | D42: =SUM(D38:D41) -> 0 | E42: =SUM(E38:E41) -> 0 | G42: =SUM(G38:G41) -> 0 | H42: =SUM(H38:H41) -> 0 | I42: =SUM(I38:I41) -> 0 | K42: =IF(D42=0,0,((D42/C42)*100)-100) -> 0 | L42: =IF(D42=0,0,IF(E42=0,0,((D42/E42)*100)-100)) -> 0 | M42: =IF(G42=0,0,IF(D42=0,0,((D42/G42)*100)-100)) -> 0 | N42: =IF(H42=0,0,IF(D42=0,0,((D42/H42)*100)-100)) -> 0 | O42: =IF(D42=0,0,IF(I42=0,0,((D42/I42)*100)-100)) -> 0 | Q42: =SUM(Q38:Q41) -> 0 | R42: =IF(Q42=0,0,IF(D42=0,0,((D42/Q42)*100)-100)) -> 0 | S42: =IF(D42=0,0,(D42/$D$44)*100) -> 0
A44: Total Geral | C44: =C22+C34+C42 -> 88809310 | D44: =D22+D34+D42 -> 89412068 | E44: =E22+E34+E42 -> 111891087 | G44: =G22+G34+G42 -> 70522221 | H44: =H22+H34+H42 -> 56767026 | I44: =I22+I34+I42 -> 53331033 | K44: =IF(D44=0,0,((D44/C44)*100)-100) -> 0.68 | L44: =IF(D44=0,0,IF(E44=0,0,((D44/E44)*100)-100)) -> -20.09 | M44: =IF(G44=0,0,IF(D44=0,0,((D44/G44)*100)-100)) -> 26.79 | N44: =IF(H44=0,0,IF(D44=0,0,((D44/H44)*100)-100)) -> 57.51 | O44: =IF(D44=0,0,IF(I44=0,0,((D44/I44)*100)-100)) -> 67.65 | Q44: =Q22+Q34+Q42 -> 89919458 | R44: =IF(D44=0,0,((D44/Q44)*100)-100) -> -0.56 | S44: =S22+S34+S42 -> 100 | U44: 17.1 | V44: 16.72 | W44: =V44-U44 -> -0.38
C45: Resumo por Regiao - Outubro/2002
C46: Descricao das Aberturas | H46: Valor | I46: % | M46: Margem Comercial | R46: Meta | S46: Real | U46: Dif
C47: Curitiba (3,6,7,10,11,13,17,21,22,24,26,27,28,34) | H47: 49133319 | I47: =IF(D44=0,0,H47/$D$44) -> 0.54949999999999999 | L47: 99 | M47: Empresa | R47: 17.08 | S47: 0 | U47: =S47-R47 -> -17.08
C48: Curitiba e Metrop. (Ctba. 4,5,8,14,23,25;31) | H48: 67562906 | I48: =IF(D44=0,0,H48/$D$44) -> 0.75560000000000005 | L48: 207 | M48: Super | R48: 0 | S48: 0 | U48: =S48-R48 -> 0
C49: Metropolitana (4,5,8,14,23,25;31) | H49: 18429587 | I49: =IF(D44=0,0,H49/$D$44) -> 0.20610000000000001 | L49: 208 | M49: Hiper | R49: 0 | S49: 0 | U49: =S49-R49 -> 0
C50: Norte (9,15,20) | H50: =D25+D15+D18 -> 8349226 | I50: =IF(D44=0,0,H50/$D$44) -> 9.3399999999999997E-2 | L50: 204 | M50: Regional Gilberto | R50: 0 | S50: 0 | U50: =S50-R50 -> 0
C51: Ponta Grossa (18,19,32) | H51: =D17+D28+D39 -> 8006174 | I51: =IF(D44=0,0,H51/$D$44) -> 8.9499999999999996E-2 | L51: 205 | M51: Regional Edison | R51: 0 | S51: 0 | U51: =S51-R51 -> 0
C52: Super (3,4,5,7,8,10,13,15,17,18,20,23,26,28,34) | H52: 32780875 | I52: =IF(D44=0,0,H52/$D$44) -> 0.36659999999999998 | L52: 206 | M52: Regional Jorge | R52: 0 | S52: 0 | U52: =S52-R52 -> 0
C53: Hiper (6,9,11,14,19,21,22,24,25,26,27) | H53: 56631193 | I53: =IF(D44=0,0,H53/$D$44) -> 0.63339999999999996 | L53: 209 | M53: Regio - Curitiba | R53: 0 | S53: 0 | U53: =S53-R53 -> 0
C54: Curitiba, Metropolitana e Ponta Grossa | H54: =D44-H50 -> 81062842 | I54: =IF(D44=0,0,H54/$D$44) -> 0.90659999999999996 | L54: 200 | M54: Regio - Metropolitana | R54: 0 | S54: 0 | U54: =S54-R54 -> 0
C55: Araucaria | H55: =D9+D19 -> 2802877 | I55: =IF(D44=0,0,H55/$D$44) -> 3.1300000000000001E-2 | L55: 201 | M55: Regio - Centro Oeste | R55: 0 | S55: 0 | U55: =S55-R55 -> 0