A2: Periodo: | C2: 38930 | D2: a | E2: 38960 | H2: Vendas Acumuladas por Filial | Q2: =NOW() -> 38973.367566319401
A4: v.1 | C4: Vendas 2006 | G4: Vendas de Anos Anteriores | K4: Percentuais ( % ) | Q4: Meta Mensal | U4: Margem
A5: Lojas | C5: Previsao | D5: Realizada | E5: Mes Anterior | G5: Vendas 2005 | H5: Vendas 2004 | I5: Vendas 2003 | K5: % Prev | L5: % MA | M5: 2005 | N5: 2004 | O5: 2003 | Q5: Previsao Mes | R5: Final | S5: Part. | U5: Meta | V5: Condor
A7: Xaxim | C7: 740000 | D7: 628406 | E7: 633033 | G7: 708755 | H7: 778972 | I7: 748518 | K7: =IF(C7=0,0,((D7/C7)*100)-100) -> -15.08 | L7: =IF(D7=0,0,IF(E7=0,0,((D7/E7)*100)-100)) -> -0.73 | M7: =IF(G7=0,0,((D7/G7)*100)-100) -> -11.34 | N7: =IF(H7=0,0,((D7/H7)*100)-100) -> -19.33 | O7: =IF(D7=0,0,IF(I7=0,0,((D7/I7)*100)-100)) -> -16.05 | Q7: 740000 | R7: =IF(D7=0,0,((D7/Q7)*100)-100) -> -15.08 | S7: =IF(D7=0,0,(D7/$D$36)*100) -> 1.16 | U7: 16.4 | V7: 15.86
A8: S. Felicidade | C8: 800000 | D8: 812042 | E8: 826867 | G8: 665046 | H8: 667844 | I8: 788451 | K8: =IF(C8=0,0,((D8/C8)*100)-100) -> 1.51 | L8: =IF(D8=0,0,IF(E8=0,0,((D8/E8)*100)-100)) -> -1.79 | M8: =IF(G8=0,0,((D8/G8)*100)-100) -> 22.1 | N8: =IF(H8=0,0,((D8/H8)*100)-100) -> 21.59 | O8: =IF(D8=0,0,IF(I8=0,0,((D8/I8)*100)-100)) -> 2.99 | Q8: 800000 | R8: =IF(D8=0,0,((D8/Q8)*100)-100) -> 1.51 | S8: =IF(D8=0,0,(D8/$D$36)*100) -> 1.51 | U8: 16.5 | V8: 17
A9: Lapa | C9: 1120000 | D9: 997592 | E9: 995406 | G9: 1066422 | H9: 1067449 | I9: 1083326 | K9: =IF(C9=0,0,((D9/C9)*100)-100) -> -10.93 | L9: =IF(D9=0,0,IF(E9=0,0,((D9/E9)*100)-100)) -> 0.22 | M9: =IF(G9=0,0,((D9/G9)*100)-100) -> -6.45 | N9: =IF(H9=0,0,((D9/H9)*100)-100) -> -6.54 | O9: =IF(D9=0,0,IF(I9=0,0,((D9/I9)*100)-100)) -> -7.91 | Q9: 1120000 | R9: =IF(D9=0,0,((D9/Q9)*100)-100) -> -10.93 | S9: =IF(D9=0,0,(D9/$D$36)*100) -> 1.85 | U9: 16.25 | V9: 15.14
A10: Araucaria | C10: 1000000 | D10: 863811 | E10: 890983 | G10: 883727 | H10: 904182 | I10: 1038785 | K10: =IF(C10=0,0,((D10/C10)*100)-100) -> -13.62 | L10: =IF(D10=0,0,IF(E10=0,0,((D10/E10)*100)-100)) -> -3.05 | M10: =IF(G10=0,0,((D10/G10)*100)-100) -> -2.25 | N10: =IF(H10=0,0,((D10/H10)*100)-100) -> -4.46 | O10: =IF(D10=0,0,IF(I10=0,0,((D10/I10)*100)-100)) -> -16.84 | Q10: 1000000 | R10: =IF(D10=0,0,((D10/Q10)*100)-100) -> -13.62 | S10: =IF(D10=0,0,(D10/$D$36)*100) -> 1.6 | U10: 17.55 | V10: 18.12
A11: Pinheirinho | C11: 0 | D11: 0 | E11: 0 | G11: 0 | H11: 0 | I11: 0 | K11: =IF(C11=0,0,((D11/C11)*100)-100) -> 0 | L11: =IF(D11=0,0,IF(E11=0,0,((D11/E11)*100)-100)) -> 0 | M11: =IF(G11=0,0,((D11/G11)*100)-100) -> 0 | N11: =IF(H11=0,0,((D11/H11)*100)-100) -> 0 | O11: =IF(D11=0,0,IF(I11=0,0,((D11/I11)*100)-100)) -> 0 | Q11: 0 | R11: =IF(D11=0,0,((D11/Q11)*100)-100) -> 0 | S11: =IF(D11=0,0,(D11/$D$36)*100) -> 0 | U11: 0 | V11: 0
A12: Hauer | C12: 3050000 | D12: 2839992 | E12: 2849509 | G12: 2902375 | H12: 2873587 | I12: 3104644 | K12: =IF(C12=0,0,((D12/C12)*100)-100) -> -6.89 | L12: =IF(D12=0,0,IF(E12=0,0,((D12/E12)*100)-100)) -> -0.33 | M12: =IF(G12=0,0,((D12/G12)*100)-100) -> -2.15 | N12: =IF(H12=0,0,((D12/H12)*100)-100) -> -1.17 | O12: =IF(D12=0,0,IF(I12=0,0,((D12/I12)*100)-100)) -> -8.52 | Q12: 3050000 | R12: =IF(D12=0,0,((D12/Q12)*100)-100) -> -6.89 | S12: =IF(D12=0,0,(D12/$D$36)*100) -> 5.26 | U12: 17 | V12: 16.54
A13: Paranagua | C13: 1450000 | D13: 1512771 | E13: 1416549 | G13: 1559438 | H13: 3356982 | I13: 3184960 | K13: =IF(C13=0,0,((D13/C13)*100)-100) -> 4.33 | L13: =IF(D13=0,0,IF(E13=0,0,((D13/E13)*100)-100)) -> 6.79 | M13: =IF(G13=0,0,((D13/G13)*100)-100) -> -2.99 | N13: =IF(H13=0,0,((D13/H13)*100)-100) -> -54.94 | O13: =IF(D13=0,0,IF(I13=0,0,((D13/I13)*100)-100)) -> -52.5 | Q13: 1450000 | R13: =IF(D13=0,0,((D13/Q13)*100)-100) -> 4.33 | S13: =IF(D13=0,0,(D13/$D$36)*100) -> 2.8 | U13: 17.4 | V13: 17.52
A14: Centenario | C14: 950000 | D14: 837108 | E14: 850643 | G14: 908647 | H14: 951154 | I14: 954058 | K14: =IF(C14=0,0,((D14/C14)*100)-100) -> -11.88 | L14: =IF(D14=0,0,IF(E14=0,0,((D14/E14)*100)-100)) -> -1.59 | M14: =IF(G14=0,0,((D14/G14)*100)-100) -> -7.87 | N14: =IF(H14=0,0,((D14/H14)*100)-100) -> -11.99 | O14: =IF(D14=0,0,IF(I14=0,0,((D14/I14)*100)-100)) -> -12.26 | Q14: 950000 | R14: =IF(D14=0,0,((D14/Q14)*100)-100) -> -11.88 | S14: =IF(D14=0,0,(D14/$D$36)*100) -> 1.55 | U14: 16.6 | V14: 16.74
A15: Arapongas | C15: 0 | D15: 0 | E15: 0 | G15: 0 | H15: 0 | I15: 0 | K15: =IF(C15=0,0,((D15/C15)*100)-100) -> 0 | L15: =IF(D15=0,0,IF(E15=0,0,((D15/E15)*100)-100)) -> 0 | M15: =IF(D15=0,0,IF(G15=0,0,((D15/G15)*100)-100)) -> 0 | N15: =IF(D15=0,0,IF(H15=0,0,((D15/H15)*100)-100)) -> 0 | O15: =IF(D15=0,0,IF(I15=0,0,((D15/I15)*100)-100)) -> 0 | Q15: 0 | R15: =IF(D15=0,0,((D15/Q15)*100)-100) -> 0 | S15: =IF(D15=0,0,(D15/$D$36)*100) -> 0 | U15: 0 | V15: 0
A16: Sao Braz | C16: 3080000 | D16: 2825909 | E16: 2888683 | G16: 2932454 | H16: 2994943 | I16: 3259269 | K16: =IF(C16=0,0,((D16/C16)*100)-100) -> -8.25 | L16: =IF(D16=0,0,IF(E16=0,0,((D16/E16)*100)-100)) -> -2.17 | M16: =IF(G16=0,0,((D16/G16)*100)-100) -> -3.63 | N16: =IF(H16=0,0,((D16/H16)*100)-100) -> -5.64 | O16: =IF(D16=0,0,IF(I16=0,0,((D16/I16)*100)-100)) -> -13.3 | Q16: 3080000 | R16: =IF(D16=0,0,((D16/Q16)*100)-100) -> -8.25 | S16: =IF(D16=0,0,(D16/$D$36)*100) -> 5.24 | U16: 16.95 | V16: 15.86
A17: Sitio Cercado | C17: 1300000 | D17: 1043938 | E17: 1121514 | G17: 1236262 | H17: 1504003 | I17: 1308300 | K17: =IF(C17=0,0,((D17/C17)*100)-100) -> -19.7 | L17: =IF(D17=0,0,IF(E17=0,0,((D17/E17)*100)-100)) -> -6.92 | M17: =IF(G17=0,0,((D17/G17)*100)-100) -> -15.56 | N17: =IF(H17=0,0,((D17/H17)*100)-100) -> -30.59 | O17: =IF(D17=0,0,IF(I17=0,0,((D17/I17)*100)-100)) -> -20.21 | Q17: 1300000 | R17: =IF(D17=0,0,((D17/Q17)*100)-100) -> -19.7 | S17: =IF(D17=0,0,(D17/$D$36)*100) -> 1.94 | U17: 17 | V17: 16.55
A18: Apucarana | C18: 1680000 | D18: 1551140 | E18: 1621949 | G18: 1417379 | H18: 1394466 | I18: 1407605 | K18: =IF(C18=0,0,((D18/C18)*100)-100) -> -7.67 | L18: =IF(D18=0,0,IF(E18=0,0,((D18/E18)*100)-100)) -> -4.37 | M18: =IF(G18=0,0,((D18/G18)*100)-100) -> 9.44 | N18: =IF(H18=0,0,((D18/H18)*100)-100) -> 11.24 | O18: =IF(D18=0,0,IF(I18=0,0,((D18/I18)*100)-100)) -> 10.2 | Q18: 1680000 | R18: =IF(D18=0,0,((D18/Q18)*100)-100) -> -7.67 | S18: =IF(D18=0,0,(D18/$D$36)*100) -> 2.88 | U18: 16.9 | V18: 16.09
A19: Ahu | C19: 1180000 | D19: 1085649 | E19: 1096611 | G19: 1052895 | H19: 1108567 | I19: 1321358 | K19: =IF(C19=0,0,((D19/C19)*100)-100) -> -8 | L19: =IF(D19=0,0,IF(E19=0,0,((D19/E19)*100)-100)) -> -1 | M19: =IF(G19=0,0,((D19/G19)*100)-100) -> 3.11 | N19: =IF(H19=0,0,((D19/H19)*100)-100) -> -2.07 | O19: =IF(D19=0,0,IF(I19=0,0,((D19/I19)*100)-100)) -> -17.84 | Q19: 1180000 | R19: =IF(D19=0,0,((D19/Q19)*100)-100) -> -8 | S19: =IF(D19=0,0,(D19/$D$36)*100) -> 2.01 | U19: 17.15 | V19: 17.95
A20: P.G. Centro | C20: 1660000 | D20: 1518615 | E20: 1468628 | G20: 1550259 | H20: 1670532 | I20: 1667495 | K20: =IF(C20=0,0,((D20/C20)*100)-100) -> -8.52 | L20: =IF(D20=0,0,IF(E20=0,0,((D20/E20)*100)-100)) -> 3.4 | M20: =IF(G20=0,0,((D20/G20)*100)-100) -> -2.04 | N20: =IF(H20=0,0,((D20/H20)*100)-100) -> -9.09 | O20: =IF(D20=0,0,IF(I20=0,0,((D20/I20)*100)-100)) -> -8.93 | Q20: 1660000 | R20: =IF(D20=0,0,((D20/Q20)*100)-100) -> -8.52 | S20: =IF(D20=0,0,(D20/$D$36)*100) -> 2.82 | U20: 18.2 | V20: 19.1
A21: Maringa | C21: 2360000 | D21: 2239000 | E21: 2161952 | G21: 2217443 | H21: 2104226 | I21: 2125876 | K21: =IF(C21=0,0,((D21/C21)*100)-100) -> -5.13 | L21: =IF(D21=0,0,IF(E21=0,0,((D21/E21)*100)-100)) -> 3.56 | M21: =IF(G21=0,0,((D21/G21)*100)-100) -> 0.97 | N21: =IF(H21=0,0,((D21/H21)*100)-100) -> 6.4 | O21: =IF(D21=0,0,IF(I21=0,0,((D21/I21)*100)-100)) -> 5.32 | Q21: 2360000 | R21: =IF(D21=0,0,((D21/Q21)*100)-100) -> -5.13 | S21: =IF(D21=0,0,(D21/$D$36)*100) -> 4.15 | U21: 18.2 | V21: 17.56
A22: Araucaria Nova | C22: 1980000 | D22: 1878878 | E22: 1940098 | G22: 1850146 | H22: 2160030 | I22: 1999164 | K22: =IF(C22=0,0,((D22/C22)*100)-100) -> -5.11 | L22: =IF(D22=0,0,IF(E22=0,0,((D22/E22)*100)-100)) -> -3.16 | M22: =IF(G22=0,0,((D22/G22)*100)-100) -> 1.55 | N22: =IF(H22=0,0,((D22/H22)*100)-100) -> -13.02 | O22: =IF(D22=0,0,IF(I22=0,0,((D22/I22)*100)-100)) -> -6.02 | Q22: 1980000 | R22: =IF(D22=0,0,((D22/Q22)*100)-100) -> -5.11 | S22: =IF(D22=0,0,(D22/$D$36)*100) -> 3.48 | U22: 17.5 | V22: 16.89
A23: Sitio Cercado | C23: 0 | D23: 0 | E23: 0 | G23: 0 | H23: 0 | I23: 0 | K23: =IF(C23=0,0,((D23/C23)*100)-100) -> 0 | L23: =IF(D23=0,0,IF(E23=0,0,((D23/E23)*100)-100)) -> 0 | M23: =IF(G23=0,0,((D23/G23)*100)-100) -> 0 | N23: =IF(H23=0,0,((D23/H23)*100)-100) -> 0 | O23: =IF(D23=0,0,IF(I23=0,0,((D23/I23)*100)-100)) -> 0 | Q23: 0 | R23: =IF(Q23=0,0,IF(D23=0,0,((D23/Q23)*100)-100)) -> 0 | S23: =IF(D23=0,0,(D23/$D$36)*100) -> 0 | U23: 0 | V23: 0
A24: Total Super | C24: =SUM(C7:C23) -> 22350000 | D24: =SUM(D7:D23) -> 20634851 | E24: =SUM(E7:E23) -> 20762425 | G24: =SUM(G7:G23) -> 20951248 | H24: =SUM(H7:H23) -> 23536937 | I24: =SUM(I7:I23) -> 23991809 | J24: =SUM(C24:I24) -> 132227270 | K24: =IF(D24=0,0,((D24/C24)*100)-100) -> -7.67 | L24: =IF(D24=0,0,IF(E24=0,0,((D24/E24)*100)-100)) -> -0.61 | M24: =IF(G24=0,0,IF(D24=0,0,((D24/G24)*100)-100)) -> -1.51 | N24: =IF(H24=0,0,IF(D24=0,0,((D24/H24)*100)-100)) -> -12.33 | O24: =IF(D24=0,0,IF(I24=0,0,((D24/I24)*100)-100)) -> -13.99 | Q24: =SUM(Q7:Q23) -> 22350000 | R24: =IF(D24=0,0,((D24/Q24)*100)-100) -> -7.67 | S24: =IF(D24=0,0,(D24/$D$36)*100) -> 38.25 | U24: 17.11 | V24: 16.72
A26: Pinheirinho | C26: 2800000 | D26: 2542110 | E26: 2601037 | G26: 1792022 | H26: 1901812 | I26: 1845778 | K26: =IF(C26=0,0,((D26/C26)*100)-100) -> -9.21 | L26: =IF(D26=0,0,IF(E26=0,0,((D26/E26)*100)-100)) -> -2.27 | M26: =IF(G26=0,0,((D26/G26)*100)-100) -> 41.86 | N26: =IF(H26=0,0,((D26/H26)*100)-100) -> 33.67 | O26: =IF(D26=0,0,IF(I26=0,0,((D26/I26)*100)-100)) -> 37.73 | Q26: 2800000 | R26: =IF(D26=0,0,IF(Q26=0,0,((D26/Q26)*100)-100)) -> -9.21 | S26: =IF(D26=0,0,(D26/$D$36)*100) -> 4.71 | U26: 16.3 | V26: 15.31
A27: Londrina | C27: 2800000 | D27: 2514108 | E27: 2756443 | G27: 2599491 | H27: 2115832 | I27: 2295835 | K27: =IF(C27=0,0,((D27/C27)*100)-100) -> -10.21 | L27: =IF(D27=0,0,IF(E27=0,0,((D27/E27)*100)-100)) -> -8.79 | M27: =IF(G27=0,0,((D27/G27)*100)-100) -> -3.28 | N27: =IF(H27=0,0,((D27/H27)*100)-100) -> 18.82 | O27: =IF(D27=0,0,IF(I27=0,0,((D27/I27)*100)-100)) -> 9.51 | Q27: 2800000 | R27: =IF(D27=0,0,IF(Q27=0,0,((D27/Q27)*100)-100)) -> -10.21 | S27: =IF(D27=0,0,(D27/$D$36)*100) -> 4.66 | U27: 15.7 | V27: 14.86
A28: S.J. Pinhais | C28: 3950000 | D28: 3592665 | E28: 3838941 | G28: 3728020 | H28: 4180216 | I28: 4216272 | K28: =IF(C28=0,0,((D28/C28)*100)-100) -> -9.05 | L28: =IF(D28=0,0,IF(E28=0,0,((D28/E28)*100)-100)) -> -6.42 | M28: =IF(G28=0,0,((D28/G28)*100)-100) -> -3.63 | N28: =IF(H28=0,0,((D28/H28)*100)-100) -> -14.06 | O28: =IF(D28=0,0,IF(I28=0,0,((D28/I28)*100)-100)) -> -14.79 | Q28: 3950000 | R28: =IF(D28=0,0,IF(Q28=0,0,((D28/Q28)*100)-100)) -> -9.05 | S28: =IF(D28=0,0,(D28/$D$36)*100) -> 6.66 | U28: 16.15 | V28: 16.08
A29: P.G. Nova | C29: 3580000 | D29: 3189798 | E29: 3354039 | G29: 3111394 | H29: 3170183 | I29: 3036784 | K29: =IF(C29=0,0,((D29/C29)*100)-100) -> -10.9 | L29: =IF(D29=0,0,IF(E29=0,0,((D29/E29)*100)-100)) -> -4.9 | M29: =IF(G29=0,0,((D29/G29)*100)-100) -> 2.52 | N29: =IF(H29=0,0,((D29/H29)*100)-100) -> 0.62 | O29: =IF(D29=0,0,IF(I29=0,0,((D29/I29)*100)-100)) -> 5.04 | Q29: 3580000 | R29: =IF(D29=0,0,IF(Q29=0,0,((D29/Q29)*100)-100)) -> -10.9 | S29: =IF(D29=0,0,(D29/$D$36)*100) -> 5.91 | U29: 16.55 | V29: 16.47
A30: Nilo Pecanha | C30: 8910000 | D30: 8524597 | E30: 8813869 | G30: 8483332 | H30: 8352404 | I30: 8606903 | K30: =IF(C30=0,0,((D30/C30)*100)-100) -> -4.33 | L30: =IF(D30=0,0,IF(E30=0,0,((D30/E30)*100)-100)) -> -3.28 | M30: =IF(G30=0,0,((D30/G30)*100)-100) -> 0.49 | N30: =IF(H30=0,0,((D30/H30)*100)-100) -> 2.06 | O30: =IF(D30=0,0,IF(I30=0,0,((D30/I30)*100)-100)) -> -0.96 | Q30: 8910000 | R30: =IF(D30=0,0,IF(Q30=0,0,((D30/Q30)*100)-100)) -> -4.33 | S30: =IF(D30=0,0,(D30/$D$36)*100) -> 15.8 | U30: 16.3 | V30: 16.02
A31: Champagnat | C31: 5760000 | D31: 5089804 | E31: 5225812 | G31: 5484275 | H31: 4887601 | I31: 0 | K31: =IF(C31=0,0,((D31/C31)*100)-100) -> -11.64 | L31: =IF(D31=0,0,IF(E31=0,0,((D31/E31)*100)-100)) -> -2.6 | M31: =IF(G31=0,0,((D31/G31)*100)-100) -> -7.19 | N31: =IF(H31=0,0,((D31/H31)*100)-100) -> 4.14 | O31: =IF(D31=0,0,IF(I31=0,0,((D31/I31)*100)-100)) -> 0 | Q31: 5760000 | R31: =IF(D31=0,0,IF(Q31=0,0,((D31/Q31)*100)-100)) -> -11.64 | S31: =IF(D31=0,0,(D31/$D$36)*100) -> 9.44 | U31: 16.4 | V31: 16.8
A32: Santa Candida | C32: 4300000 | D32: 3613792 | E32: 3888123 | G32: 3933843 | H32: 0 | I32: 0 | K32: =IF(C32=0,0,((D32/C32)*100)-100) -> -15.96 | L32: =IF(D32=0,0,IF(E32=0,0,((D32/E32)*100)-100)) -> -7.06 | M32: =IF(G32=0,0,((D32/G32)*100)-100) -> -8.14 | N32: =IF(H32=0,0,((D32/H32)*100)-100) -> 0 | O32: =IF(D32=0,0,IF(I32=0,0,((D32/I32)*100)-100)) -> 0 | Q32: 4300000 | R32: =IF(D32=0,0,IF(Q32=0,0,((D32/Q32)*100)-100)) -> -15.96 | S32: =IF(D32=0,0,(D32/$D$36)*100) -> 6.7 | U32: 16.55 | V32: 16.22
A33: Paranagu Raia | C33: 4400000 | D33: 4243163 | E33: 4312512 | G33: 3968450 | H33: 0 | I33: 0 | K33: =IF(C33=0,0,((D33/C33)*100)-100) -> -3.56 | L33: =IF(D33=0,0,IF(E33=0,0,((D33/E33)*100)-100)) -> -1.61 | M33: =IF(G33=0,0,((D33/G33)*100)-100) -> 6.92 | N33: =IF(H33=0,0,((D33/H33)*100)-100) -> 0 | O33: =IF(D33=0,0,IF(I33=0,0,((D33/I33)*100)-100)) -> 0 | Q33: 4400000 | R33: =IF(D33=0,0,IF(Q33=0,0,((D33/Q33)*100)-100)) -> -3.56 | S33: =IF(D33=0,0,(D33/$D$36)*100) -> 7.87 | U33: 16.3 | V33: 17.24
A34: Total Hiper | C34: =SUM(C26:C33) -> 36500000 | D34: =SUM(D26:D33) -> 33310037 | E34: =SUM(E26:E33) -> 34790776 | G34: =SUM(G26:G33) -> 33100827 | H34: =SUM(H26:H33) -> 24608048 | I34: =SUM(I26:I33) -> 20001572 | J34: =SUM(C34:I34) -> 182311260 | K34: =IF(D34=0,0,((D34/C34)*100)-100) -> -8.74 | L34: =IF(D34=0,0,IF(E34=0,0,((D34/E34)*100)-100)) -> -4.26 | M34: =IF(G34=0,0,IF(D34=0,0,((D34/G34)*100)-100)) -> 0.63 | N34: =IF(H34=0,0,IF(D34=0,0,((D34/H34)*100)-100)) -> 35.36 | O34: =IF(D34=0,0,IF(I34=0,0,((D34/I34)*100)-100)) -> 66.54 | Q34: =SUM(Q26:Q33) -> 36500000 | R34: =IF(D34=0,0,((D34/Q34)*100)-100) -> -8.74 | S34: =IF(D34=0,0,(D34/$D$36)*100) -> 61.75 | U34: 16.31 | V34: 16.3
A36: Total Geral | C36: =C24+C34 -> 58850000 | D36: =D24+D34 -> 53944888 | E36: =E24+E34 -> 55553201 | G36: =G24+G34 -> 54052075 | H36: =H24+H34 -> 48144985 | I36: =I24+I34 -> 43993381 | K36: =IF(D36=0,0,((D36/C36)*100)-100) -> -8.33 | L36: =IF(D36=0,0,IF(E36=0,0,((D36/E36)*100)-100)) -> -2.9 | M36: =IF(G36=0,0,IF(D36=0,0,((D36/G36)*100)-100)) -> -0.2 | N36: =IF(H36=0,0,IF(D36=0,0,((D36/H36)*100)-100)) -> 12.05 | O36: =IF(D36=0,0,IF(I36=0,0,((D36/I36)*100)-100)) -> 22.62 | Q36: =Q24+Q34 -> 58850000 | R36: =IF(D36=0,0,((D36/Q36)*100)-100) -> -8.33 | S36: =S24+S34 -> 100 | U36: 16.65 | V36: 16.48
C37: Resumo por Regiao - Outubro/2002
C38: Descricao das Aberturas | H38: Valor | I38: %
C39: Curitiba (2,3,6,7,10,11,13,17,21,22) | H39: =D7+D8+D11+D12+D14+D16+D17+D19+D30+D31+D33+D26 -> 30472718 | I39: =IF(D36=0,0,H39/$D$36) -> 0.56489999999999996
C40: Curitiba e Metrop. (Ctba. 4,5,8,13,14,23) | H40: =H39+D9+D10+D13+D17+D29+D22 -> 39959506 | I40: =IF(D36=0,0,H40/$D$36) -> 0.74070000000000003
C41: Metropolitana (4,5,8,14,23) | H41: =H40-H39 -> 9486788 | I41: =IF(D36=0,0,H41/$D$36) -> 0.1759
C42: Norte (9,15,20) | H42: =D27+D18+D21 -> 6304248 | I42: =IF(D36=0,0,H42/$D$36) -> 0.1169
C43: Ponta Grossa (18,19) | H43: =D20+D29 -> 4708413 | I43: =IF(D36=0,0,H43/$D$36) -> 8.7300000000000003E-2
C44: Super (2,3,4,5,6,7,8,10,11,13,15,17,18,20,23) | H44: =D24 -> 20634851 | I44: =IF(D36=0,0,H44/$D$36) -> 0.38250000000000001
C45: Hiper (6,9,14,19,21,22,24) | H45: =D34 -> 33310037 | I45: =IF(D36=0,0,H45/$D$36) -> 0.61750000000000005
C46: Curitiba, Metropolitana e Ponta Grossa | H46: =D36-H42 -> 47640640 | I46: =IF(D36=0,0,H46/$D$36) -> 0.8831
C47: Araucaria | H47: =D10+D22 -> 2742689 | I47: =IF(D36=0,0,H47/$D$36) -> 5.0799999999999998E-2