A2: Periodo: | B2: 40422 | C2: a | D2: 40451 | G2: Vendas Acumuladas por Filial | P2: =NOW() -> 40464.740908333333
A4: v.New | B4: Vendas 2010 | F4: Vendas de Anos Anteriores | J4: Percentuais ( % ) | P4: Meta Mensal | T4: Margem
A5: Lojas | B5: Previsao | C5: Realizada | D5: Mes Anterior | F5: Vendas 2009 | G5: Vendas 2008 | H5: Vendas 2007 | J5: % Prev | K5: % MA | L5: 2009 | M5: 2008 | N5: 2007 | P5: Previsao Mes | Q5: Final | R5: Part. | T5: Meta | U5: Coml | V5: Dif
A6: S. Felicidade | B6: 2950000 | C6: 3058635.75 | D6: 2954912.29 | F6: 2668611.7 | G6: 2266186.3 | H6: 1924836.86 | J6: =IF(B6=0,0,((C6/B6)*100)-100) -> 3.682567796610158 | K6: =IF(C6=0,0,IF(D6=0,0,((C6/D6)*100)-100)) -> 3.5102043587222624 | L6: =IF(F6=0,0,((C6/F6)*100)-100) -> 14.61524170039425 | M6: =IF(G6=0,0,((C6/G6)*100)-100) -> 34.96841588001837 | N6: =IF(C6=0,0,IF(H6=0,0,((C6/H6)*100)-100)) -> 58.903635604733807 | P6: 2950000 | Q6: =IF(C6=0,0,((C6/P6)*100)-100) -> 3.682567796610158 | R6: =IF(C6=0,0,(C6/$C$40)*100) -> 2.6129452325232276 | T6: 17.500699999999998 | U6: 16.396880537344142 | V6: =U6-T6 -> -1.1038194626558564
A7: Lapa | B7: 2250000 | C7: 2413350.94 | D7: 2256853.47 | F7: 2099592.67 | G7: 2060568.8 | H7: 1460926.45 | J7: =IF(B7=0,0,((C7/B7)*100)-100) -> 7.2600417777777722 | K7: =IF(C7=0,0,IF(D7=0,0,((C7/D7)*100)-100)) -> 6.9343212610076819 | L7: =IF(F7=0,0,((C7/F7)*100)-100) -> 14.943768592981414 | M7: =IF(G7=0,0,((C7/G7)*100)-100) -> 17.120619316375169 | N7: =IF(C7=0,0,IF(H7=0,0,((C7/H7)*100)-100)) -> 65.193185461184584 | P7: 2250000 | Q7: =IF(C7=0,0,((C7/P7)*100)-100) -> 7.2600417777777722 | R7: =IF(C7=0,0,(C7/$C$40)*100) -> 2.0616883959060672 | T7: 16.299600000000002 | U7: 15.117588741569429 | V7: =U7-T7 -> -1.1820112584305722
A8: Araucaria | B8: 1430000 | C8: 1448427.38 | D8: 1434345.09 | F8: 1261605.45 | G8: 1088572.09 | H8: 968068.65 | J8: =IF(B8=0,0,((C8/B8)*100)-100) -> 1.2886279720279532 | K8: =IF(C8=0,0,IF(D8=0,0,((C8/D8)*100)-100)) -> 0.98179232446773312 | L8: =IF(F8=0,0,((C8/F8)*100)-100) -> 14.808269098710696 | M8: =IF(G8=0,0,((C8/G8)*100)-100) -> 33.057552486027788 | N8: =IF(C8=0,0,IF(H8=0,0,((C8/H8)*100)-100)) -> 49.620316699647248 | P8: 1430000 | Q8: =IF(C8=0,0,((C8/P8)*100)-100) -> 1.2886279720279532 | R8: =IF(C8=0,0,(C8/$C$40)*100) -> 1.2373691170081658 | T8: 16.88 | U8: 16.466014333421398 | V8: =U8-T8 -> -0.41398566657860059
A9: Hauer | B9: 3800000 | C9: 3836419.44 | D9: 3743117.98 | F9: 3658402.53 | G9: 3556067.8 | H9: 3320099.82 | J9: =IF(B9=0,0,((C9/B9)*100)-100) -> 0.95840631578947466 | K9: =IF(C9=0,0,IF(D9=0,0,((C9/D9)*100)-100)) -> 2.4926133907219281 | L9: =IF(F9=0,0,((C9/F9)*100)-100) -> 4.8659738380401905 | M9: =IF(G9=0,0,((C9/G9)*100)-100) -> 7.8837540724054946 | N9: =IF(C9=0,0,IF(H9=0,0,((C9/H9)*100)-100)) -> 15.551328212776454 | P9: 3800000 | Q9: =IF(C9=0,0,((C9/P9)*100)-100) -> 0.95840631578947466 | R9: =IF(C9=0,0,(C9/$C$40)*100) -> 3.2773938137967003 | T9: 16.200700000000001 | U9: 15.44778534434702 | V9: =U9-T9 -> -0.75291465565298132
A10: Paranagua | B10: 2200000 | C10: 2242909.91 | D10: 2221148.85 | F10: 1993215.44 | G10: 1722129.41 | H10: 1650230.26 | J10: =IF(B10=0,0,((C10/B10)*100)-100) -> 1.9504504545454751 | K10: =IF(C10=0,0,IF(D10=0,0,((C10/D10)*100)-100)) -> 0.9797209223506087 | L10: =IF(F10=0,0,((C10/F10)*100)-100) -> 12.527219335607811 | M10: =IF(G10=0,0,((C10/G10)*100)-100) -> 30.240497431607082 | N10: =IF(C10=0,0,IF(H10=0,0,((C10/H10)*100)-100)) -> 35.914966799845274 | P10: 2200000 | Q10: =IF(C10=0,0,((C10/P10)*100)-100) -> 1.9504504545454751 | R10: =IF(C10=0,0,(C10/$C$40)*100) -> 1.9160832591175989 | T10: 17.948699999999999 | U10: 16.949286652356001 | V10: =U10-T10 -> -0.9994133476439977
A11: Centenario | B11: 0 | C11: 0 | D11: 0 | F11: 0 | G11: 0 | H11: 0 | J11: =IF(B11=0,0,((C11/B11)*100)-100) -> 0 | K11: =IF(C11=0,0,IF(D11=0,0,((C11/D11)*100)-100)) -> 0 | L11: =IF(F11=0,0,((C11/F11)*100)-100) -> 0 | M11: =IF(G11=0,0,((C11/G11)*100)-100) -> 0 | N11: =IF(C11=0,0,IF(H11=0,0,((C11/H11)*100)-100)) -> 0 | P11: 0 | Q11: =IF(C11=0,0,((C11/P11)*100)-100) -> 0 | R11: =IF(C11=0,0,(C11/$C$40)*100) -> 0 | T11: 0 | U11: 0 | V11: =U11-T11 -> 0
A12: Sitio Cercado | B12: 2450000 | C12: 2523145.66 | D12: 2407630.8 | F12: 2201171.99 | G12: 1857279.67 | H12: 1646875.62 | J12: =IF(B12=0,0,((C12/B12)*100)-100) -> 2.9855371428571402 | K12: =IF(C12=0,0,IF(D12=0,0,((C12/D12)*100)-100)) -> 4.7978643569437764 | L12: =IF(F12=0,0,((C12/F12)*100)-100) -> 14.627374483354203 | M12: =IF(G12=0,0,((C12/G12)*100)-100) -> 35.851681400249248 | N12: =IF(C12=0,0,IF(H12=0,0,((C12/H12)*100)-100)) -> 53.208027938381889 | P12: 2450000 | Q12: =IF(C12=0,0,((C12/P12)*100)-100) -> 2.9855371428571402 | R12: =IF(C12=0,0,(C12/$C$40)*100) -> 2.1554843276969717 | T12: 16.8855 | U12: 14.395638577599993 | V12: =U12-T12 -> -2.4898614224000077
A13: Apucarana | B13: 2600000 | C13: 2716420.94 | D13: 2608380.29 | F13: 2561218.06 | G13: 2118747.33 | H13: 2186936.45 | J13: =IF(B13=0,0,((C13/B13)*100)-100) -> 4.4777284615384616 | K13: =IF(C13=0,0,IF(D13=0,0,((C13/D13)*100)-100)) -> 4.1420589786775253 | L13: =IF(F13=0,0,((C13/F13)*100)-100) -> 6.0597292524167159 | M13: =IF(G13=0,0,((C13/G13)*100)-100) -> 28.208819500907623 | N13: =IF(C13=0,0,IF(H13=0,0,((C13/H13)*100)-100)) -> 24.211242626643298 | P13: 2600000 | Q13: =IF(C13=0,0,((C13/P13)*100)-100) -> 4.4777284615384616 | R13: =IF(C13=0,0,(C13/$C$40)*100) -> 2.3205964112265622 | T13: 17 | U13: 16.086345218646414 | V13: =U13-T13 -> -0.91365478135358558
A14: Ahú | B14: 1800000 | C14: 1844426.26 | D14: 1874908.07 | F14: 1615543.94 | G14: 1522760.56 | H14: 1547747.36 | J14: =IF(B14=0,0,((C14/B14)*100)-100) -> 2.4681255555555595 | K14: =IF(C14=0,0,IF(D14=0,0,((C14/D14)*100)-100)) -> -1.6257762440587271 | L14: =IF(F14=0,0,((C14/F14)*100)-100) -> 14.167508189223255 | M14: =IF(G14=0,0,((C14/G14)*100)-100) -> 21.123852853136668 | N14: =IF(C14=0,0,IF(H14=0,0,((C14/H14)*100)-100)) -> 19.168431984920332 | P14: 1800000 | Q14: =IF(C14=0,0,((C14/P14)*100)-100) -> 2.4681255555555595 | R14: =IF(C14=0,0,(C14/$C$40)*100) -> 1.5756648377655453 | T14: 17.5015 | U14: 16.663721215940612 | V14: =U14-T14 -> -0.83777878405938822
A15: P.G. Centro | B15: 1900000 | C15: 1968491.7 | D15: 1917935.73 | F15: 1869463.58 | G15: 1942155.99 | H15: 1855600.5 | J15: =IF(B15=0,0,((C15/B15)*100)-100) -> 3.6048263157894667 | K15: =IF(C15=0,0,IF(D15=0,0,((C15/D15)*100)-100)) -> 2.6359574624536606 | L15: =IF(F15=0,0,((C15/F15)*100)-100) -> 5.2971409049862359 | M15: =IF(G15=0,0,((C15/G15)*100)-100) -> 1.3560038501335896 | N15: =IF(C15=0,0,IF(H15=0,0,((C15/H15)*100)-100)) -> 6.0838095268890129 | P15: 1900000 | Q15: =IF(C15=0,0,((C15/P15)*100)-100) -> 3.6048263157894667 | R15: =IF(C15=0,0,(C15/$C$40)*100) -> 1.6816520250168867 | T15: 18.7 | U15: 17.554331064743632 | V15: =U15-T15 -> -1.1456689352563671
A16: Maringa | B16: 3100000 | C16: 3134841.02 | D16: 3130508.11 | F16: 2923616.85 | G16: 2900747.64 | H16: 2429180.47 | J16: =IF(B16=0,0,((C16/B16)*100)-100) -> 1.1239038709677516 | K16: =IF(C16=0,0,IF(D16=0,0,((C16/D16)*100)-100)) -> 0.13840916067775311 | L16: =IF(F16=0,0,((C16/F16)*100)-100) -> 7.2247555284133682 | M16: =IF(G16=0,0,((C16/G16)*100)-100) -> 8.0701049885194323 | N16: =IF(C16=0,0,IF(H16=0,0,((C16/H16)*100)-100)) -> 29.049325841154968 | P16: 3100000 | Q16: =IF(C16=0,0,((C16/P16)*100)-100) -> 1.1239038709677516 | R16: =IF(C16=0,0,(C16/$C$40)*100) -> 2.6780462164961132 | T16: 18.7973 | U16: 17.174621825000873 | V16: =U16-T16 -> -1.6226781749991268
A17: Araucaria Nova | B17: 4000000 | C17: 4405702.68 | D17: 4367701.21 | F17: 3436656.75 | G17: 3006497.12 | H17: 2495563.92 | J17: =IF(B17=0,0,((C17/B17)*100)-100) -> 10.142567 | K17: =IF(C17=0,0,IF(D17=0,0,((C17/D17)*100)-100)) -> 0.87005653942155448 | L17: =IF(F17=0,0,((C17/F17)*100)-100) -> 28.197344119397428 | M17: =IF(G17=0,0,((C17/G17)*100)-100) -> 46.539394656064047 | N17: =IF(C17=0,0,IF(H17=0,0,((C17/H17)*100)-100)) -> 76.541367852441141 | P17: 4000000 | Q17: =IF(C17=0,0,((C17/P17)*100)-100) -> 10.142567 | R17: =IF(C17=0,0,(C17/$C$40)*100) -> 3.7637236842016266 | T17: 16.3 | U17: 15.415705491955714 | V17: =U17-T17 -> -0.88429450804428633
A18: Cristo Rei | B18: 2300000 | C18: 2430636.74 | D18: 2479694.32 | F18: 1995500.54 | G18: 1621544.85 | H18: 1510629.59 | J18: =IF(B18=0,0,((C18/B18)*100)-100) -> 5.6798582608695796 | K18: =IF(C18=0,0,IF(D18=0,0,((C18/D18)*100)-100)) -> -1.9783720761194274 | L18: =IF(F18=0,0,((C18/F18)*100)-100) -> 21.805867313872042 | M18: =IF(G18=0,0,((C18/G18)*100)-100) -> 49.896362101856141 | N18: =IF(C18=0,0,IF(H18=0,0,((C18/H18)*100)-100)) -> 60.902232823335595 | P18: 2300000 | Q18: =IF(C18=0,0,((C18/P18)*100)-100) -> 5.6798582608695796 | R18: =IF(C18=0,0,(C18/$C$40)*100) -> 2.076455387595205 | T18: 17.21 | U18: 17.20803989822025 | V18: =U18-T18 -> -1.9601017797512554E-3
A19: Campo Largo | B19: 3500000 | C19: 3605265.07 | D19: 3600758.67 | F19: 3067593.33 | G19: 2142990.42 | H19: 0 | J19: =IF(B19=0,0,((C19/B19)*100)-100) -> 3.0075734285714333 | K19: =IF(C19=0,0,IF(D19=0,0,((C19/D19)*100)-100)) -> 0.12515140316249074 | L19: =IF(F19=0,0,((C19/F19)*100)-100) -> 17.527477802932893 | M19: =IF(G19=0,0,((C19/G19)*100)-100) -> 68.235239707697815 | N19: =IF(C19=0,0,IF(H19=0,0,((C19/H19)*100)-100)) -> 0 | P19: 3500000 | Q19: =IF(C19=0,0,((C19/P19)*100)-100) -> 3.0075734285714333 | R19: =IF(C19=0,0,(C19/$C$40)*100) -> 3.0799222093180005 | T19: 16.4 | U19: 15.977268489720231 | V19: =U19-T19 -> -0.42273151027976752
A20: Brasilia | B20: 2400000 | C20: 2415218.27 | D20: 2406203.81 | F20: 2384537.88 | G20: 2080150.94 | H20: 884007.26 | J20: =IF(B20=0,0,((C20/B20)*100)-100) -> 0.63409458333335067 | K20: =IF(C20=0,0,IF(D20=0,0,((C20/D20)*100)-100)) -> 0.3746341005087146 | L20: =IF(F20=0,0,((C20/F20)*100)-100) -> 1.2866388182518591 | M20: =IF(G20=0,0,((C20/G20)*100)-100) -> 16.107837347610939 | N20: =IF(C20=0,0,IF(H20=0,0,((C20/H20)*100)-100)) -> 173.21249262138411 | P20: 2400000 | Q20: =IF(C20=0,0,((C20/P20)*100)-100) -> 0.63409458333335067 | R20: =IF(C20=0,0,(C20/$C$40)*100) -> 2.0632836270548061 | T20: 17.1 | U20: 15.473311652283916 | V20: =U20-T20 -> -1.6266883477160849
A21: Total Super | B21: =SUM(B6:B20) -> 36680000 | C21: =SUM(C6:C20) -> 38043891.760000005 | D21: =SUM(D6:D20) -> 37404098.690000005 | F21: =SUM(F6:F20) -> 33736730.710000001 | G21: =SUM(G6:G20) -> 29886398.920000006 | H21: =SUM(H6:H20) -> 23880703.210000001 | I21: =SUM(B21:H21) -> 199631823.29000005 | J21: =IF(C21=0,0,((C21/B21)*100)-100) -> 3.7183526717557243 | K21: =IF(C21=0,0,IF(D21=0,0,((C21/D21)*100)-100)) -> 1.7104892041444941 | L21: =IF(F21=0,0,IF(C21=0,0,((C21/F21)*100)-100)) -> 12.76697818476913 | M21: =IF(G21=0,0,IF(C21=0,0,((C21/G21)*100)-100)) -> 27.295000852514889 | N21: =IF(C21=0,0,IF(H21=0,0,((C21/H21)*100)-100)) -> 59.30808831487505 | P21: =SUM(P6:P20) -> 36680000 | Q21: =IF(C21=0,0,((C21/P21)*100)-100) -> 3.7183526717557243 | R21: =IF(C21=0,0,(C21/$C$40)*100) -> 32.500308544723481 | T21: 17.03 | U21: 15.97 | V21: =U21-T21 -> -1.06
A22: Pinheirinho | B22: 4600000 | C22: 4324724.33 | D22: 4333747.36 | F22: 4570170.59 | G22: 3757804.72 | H22: 3582762.18 | J22: =IF(B22=0,0,((C22/B22)*100)-100) -> -5.9842536956521712 | K22: =IF(C22=0,0,IF(D22=0,0,((C22/D22)*100)-100)) -> -0.20820387647148664 | L22: =IF(F22=0,0,((C22/F22)*100)-100) -> -5.3706148417536355 | M22: =IF(G22=0,0,((C22/G22)*100)-100) -> 15.08645744635713 | N22: =IF(C22=0,0,IF(H22=0,0,((C22/H22)*100)-100)) -> 20.709221341618615 | P22: 4600000 | Q22: =IF(C22=0,0,IF(P22=0,0,((C22/P22)*100)-100)) -> -5.9842536956521712 | R22: =IF(C22=0,0,(C22/$C$40)*100) -> 3.6945451317799805 | T22: 16 | U22: 15.857451889887278 | V22: =U22-T22 -> -0.14254811011272217
A23: Londrina | B23: 3700000 | C23: 4012019.25 | D23: 3649138.59 | F23: 3325594.85 | G23: 3260159.43 | H23: 2854022.06 | J23: =IF(B23=0,0,((C23/B23)*100)-100) -> 8.4329527027027069 | K23: =IF(C23=0,0,IF(D23=0,0,((C23/D23)*100)-100)) -> 9.9442827683889163 | L23: =IF(F23=0,0,((C23/F23)*100)-100) -> 20.640650198264538 | M23: =IF(G23=0,0,((C23/G23)*100)-100) -> 23.062056814810418 | N23: =IF(C23=0,0,IF(H23=0,0,((C23/H23)*100)-100)) -> 40.574220018467543 | P23: 3700000 | Q23: =IF(C23=0,0,IF(P23=0,0,((C23/P23)*100)-100)) -> 8.4329527027027069 | R23: =IF(C23=0,0,(C23/$C$40)*100) -> 3.427406016580731 | T23: 16.904900000000001 | U23: 14.690155337614593 | V23: =U23-T23 -> -2.2147446623854083
A24: São Bráz | B24: 5100000 | C24: 5196375.56 | D24: 5158006.82 | F24: 4816414.85 | G24: 4321136.96 | H24: 4307682.02 | J24: =IF(B24=0,0,((C24/B24)*100)-100) -> 1.8897168627450895 | K24: =IF(C24=0,0,IF(D24=0,0,((C24/D24)*100)-100)) -> 0.74386757014795535 | L24: =IF(F24=0,0,((C24/F24)*100)-100) -> 7.888870079370335 | M24: =IF(G24=0,0,((C24/G24)*100)-100) -> 20.254822008696522 | N24: =IF(C24=0,0,IF(H24=0,0,((C24/H24)*100)-100)) -> 20.630435019899636 | P24: 5100000 | Q24: =IF(C24=0,0,IF(P24=0,0,((C24/P24)*100)-100)) -> 1.8897168627450895 | R24: =IF(C24=0,0,(C24/$C$40)*100) -> 4.4391833012159809 | T24: 16.25 | U24: 15.423572079151263 | V24: =U24-T24 -> -0.82642792084873662
A25: S.J. Pinhais | B25: 5800000 | C25: 5711700.8099999996 | D25: 5716395.5999999996 | F25: 5299677.49 | G25: 4886213.75 | H25: 4532662.64 | J25: =IF(B25=0,0,((C25/B25)*100)-100) -> -1.522399827586213 | K25: =IF(C25=0,0,IF(D25=0,0,((C25/D25)*100)-100)) -> -8.2128500693684714E-2 | L25: =IF(F25=0,0,((C25/F25)*100)-100) -> 7.7744979911975634 | M25: =IF(G25=0,0,((C25/G25)*100)-100) -> 16.894206889741568 | N25: =IF(C25=0,0,IF(H25=0,0,((C25/H25)*100)-100)) -> 26.012043331775516 | P25: 5800000 | Q25: =IF(C25=0,0,IF(P25=0,0,((C25/P25)*100)-100)) -> -1.522399827586213 | R25: =IF(C25=0,0,(C25/$C$40)*100) -> 4.8794176949931209 | T25: 15.9971 | U25: 15.792224768159732 | V25: =U25-T25 -> -0.20487523184026735
A26: P.G. Nova | B26: 5200000 | C26: 5524886.4699999997 | D26: 5263337.1 | F26: 4495373.44 | G26: 4414245 | H26: 4221465.56 | J26: =IF(B26=0,0,((C26/B26)*100)-100) -> 6.2478167307692161 | K26: =IF(C26=0,0,IF(D26=0,0,((C26/D26)*100)-100)) -> 4.969268831365568 | L26: =IF(F26=0,0,((C26/F26)*100)-100) -> 22.901613041518502 | M26: =IF(G26=0,0,((C26/G26)*100)-100) -> 25.160394812702961 | N26: =IF(C26=0,0,IF(H26=0,0,((C26/H26)*100)-100)) -> 30.87602851366151 | P26: 5200000 | Q26: =IF(C26=0,0,IF(P26=0,0,((C26/P26)*100)-100)) -> 6.2478167307692161 | R26: =IF(C26=0,0,(C26/$C$40)*100) -> 4.7198250926147658 | T26: 16.297699999999999 | U26: 15.425139767623133 | V26: =U26-T26 -> -0.8725602323768662
A27: Nilo Pecanha | B27: 12800000 | C27: 12648656.18 | D27: 13033104.09 | F27: 11793637.68 | G27: 10581778.789999999 | H27: 9900279.6500000004 | J27: =IF(B27=0,0,((C27/B27)*100)-100) -> -1.1823735937500004 | K27: =IF(C27=0,0,IF(D27=0,0,((C27/D27)*100)-100)) -> -2.949780093408279 | L27: =IF(F27=0,0,((C27/F27)*100)-100) -> 7.2498284515723839 | M27: =IF(G27=0,0,((C27/G27)*100)-100) -> 19.532419180348427 | N27: =IF(C27=0,0,IF(H27=0,0,((C27/H27)*100)-100)) -> 27.760594924204995 | P27: 12800000 | Q27: =IF(C27=0,0,IF(P27=0,0,((C27/P27)*100)-100)) -> -1.1823735937500004 | R27: =IF(C27=0,0,(C27/$C$40)*100) -> 10.805551417280224 | T27: 16.55 | U27: 16.346546704853196 | V27: =U27-T27 -> -0.20345329514680444
A28: Champagnat | B28: 6400000 | C28: 6177199.9900000002 | D28: 6276969.7000000002 | F28: 6676772 | G28: 6012610.0899999999 | H28: 5660107.9500000002 | J28: =IF(B28=0,0,((C28/B28)*100)-100) -> -3.4812501562499989 | K28: =IF(C28=0,0,IF(D28=0,0,((C28/D28)*100)-100)) -> -1.5894566131169938 | L28: =IF(F28=0,0,((C28/F28)*100)-100) -> -7.4822385727713936 | M28: =IF(G28=0,0,((C28/G28)*100)-100) -> 2.7374118317391236 | N28: =IF(C28=0,0,IF(H28=0,0,((C28/H28)*100)-100)) -> 9.1357275261861446 | P28: 6400000 | Q28: =IF(C28=0,0,IF(P28=0,0,((C28/P28)*100)-100)) -> -3.4812501562499989 | R28: =IF(C28=0,0,(C28/$C$40)*100) -> 5.2770864475160311 | T28: 16.9 | U28: 16.606564327861431 | V28: =U28-T28 -> -0.29343567213856758
A29: Santa Candida | B29: 7100000 | C29: 7173626.5700000003 | D29: 7117284.4900000002 | F29: 6324031.2599999998 | G29: 5193803.65 | H29: 4790225.29 | J29: =IF(B29=0,0,((C29/B29)*100)-100) -> 1.0369939436619688 | K29: =IF(C29=0,0,IF(D29=0,0,((C29/D29)*100)-100)) -> 0.79162326698001095 | L29: =IF(F29=0,0,((C29/F29)*100)-100) -> 13.434394535235114 | M29: =IF(G29=0,0,((C29/G29)*100)-100) -> 38.118940441654928 | N29: =IF(C29=0,0,IF(H29=0,0,((C29/H29)*100)-100)) -> 49.755515361157478 | P29: 7100000 | Q29: =IF(C29=0,0,IF(P29=0,0,((C29/P29)*100)-100)) -> 1.0369939436619688 | R29: =IF(C29=0,0,(C29/$C$40)*100) -> 6.1283182693406548 | T29: 15.88 | U29: 15.837765444208227 | V29: =U29-T29 -> -4.2234555791774042E-2
A30: Paranaguá Raia | B30: 7800000 | C30: 7160951.7599999998 | D30: 7921748.7999999998 | F30: 6567241.9500000002 | G30: 5559767.0199999996 | H30: 5184153.63 | J30: =IF(B30=0,0,((C30/B30)*100)-100) -> -8.1929261538461589 | K30: =IF(C30=0,0,IF(D30=0,0,((C30/D30)*100)-100)) -> -9.6039026130189882 | L30: =IF(F30=0,0,((C30/F30)*100)-100) -> 9.040474136939622 | M30: =IF(G30=0,0,((C30/G30)*100)-100) -> 28.799493472300213 | N30: =IF(C30=0,0,IF(H30=0,0,((C30/H30)*100)-100)) -> 38.131549932481448 | P30: 7800000 | Q30: =IF(C30=0,0,IF(P30=0,0,((C30/P30)*100)-100)) -> -8.1929261538461589 | R30: =IF(C30=0,0,(C30/$C$40)*100) -> 6.1174903751193046 | T30: 17.697099999999999 | U30: 17.730388537067874 | V30: =U30-T30 -> 3.3288537067875268E-2
A31: Uvaranas | B31: 4950000 | C31: 5093201.45 | D31: 4931330.99 | F31: 4490196.28 | G31: 0 | H31: 0 | J31: =IF(B31=0,0,((C31/B31)*100)-100) -> 2.8929585858585796 | K31: =IF(C31=0,0,IF(D31=0,0,((C31/D31)*100)-100)) -> 3.2824902714550888 | L31: =IF(F31=0,0,((C31/F31)*100)-100) -> 13.429372178803732 | M31: =IF(G31=0,0,((C31/G31)*100)-100) -> 0 | N31: =IF(C31=0,0,IF(H31=0,0,((C31/H31)*100)-100)) -> 0 | P31: 4950000 | Q31: =IF(C31=0,0,IF(P31=0,0,((C31/P31)*100)-100)) -> 2.8929585858585796 | R31: =IF(C31=0,0,(C31/$C$40)*100) -> 4.3510432541886992 | T31: 16.004000000000001 | U31: 15.421027966604385 | V31: =U31-T31 -> -0.58297203339561676
A32: Torres | B32: 5250000 | C32: 5262502.43 | D32: 5429992.6200000001 | F32: 4747477.78 | G32: 0 | H32: 0 | J32: =IF(B32=0,0,((C32/B32)*100)-100) -> 0.23814152380951725 | K32: =IF(C32=0,0,IF(D32=0,0,((C32/D32)*100)-100)) -> -3.0845380780646536 | L32: =IF(F32=0,0,((C32/F32)*100)-100) -> 10.848384634250976 | M32: =IF(G32=0,0,((C32/G32)*100)-100) -> 0 | N32: =IF(C32=0,0,IF(H32=0,0,((C32/H32)*100)-100)) -> 0 | P32: 5250000 | Q32: =IF(C32=0,0,IF(P32=0,0,((C32/P32)*100)-100)) -> 0.23814152380951725 | R32: =IF(C32=0,0,(C32/$C$40)*100) -> 4.4956744638881565 | T32: 16.197199999999999 | U32: 16.197544254625647 | V32: =U32-T32 -> 3.4425462564868781E-4
A33: Total Hiper | B33: =SUM(B22:B32) -> 68700000 | C33: =SUM(C22:C32) -> 68285844.799999997 | D33: =SUM(D22:D32) -> 68831056.160000011 | F33: =SUM(F22:F32) -> 63106588.170000009 | G33: =SUM(G22:G32) -> 47987519.409999996 | H33: =SUM(H22:H32) -> 45033360.980000004 | I33: =SUM(B33:H33) -> 361944369.5200001 | J33: =IF(C33=0,0,((C33/B33)*100)-100) -> -0.60284599708879227 | K33: =IF(C33=0,0,IF(D33=0,0,((C33/D33)*100)-100)) -> -0.79210081962516199 | L33: =IF(F33=0,0,IF(C33=0,0,((C33/F33)*100)-100)) -> 8.2071567806008261 | M33: =IF(G33=0,0,IF(C33=0,0,((C33/G33)*100)-100)) -> 42.299176201573118 | N33: =IF(C33=0,0,IF(H33=0,0,((C33/H33)*100)-100)) -> 51.633907205653117 | P33: =SUM(P22:P32) -> 68700000 | Q33: =IF(C33=0,0,((C33/P33)*100)-100) -> -0.60284599708879227 | R33: =IF(C33=0,0,(C33/$C$40)*100) -> 58.335541464517647 | T33: 16.4 | U33: 16.02 | V33: =U33-T33 -> -0.37999999999999901
A34: Total s/ 25,27,30 | B34: =B21+B33 -> 105380000 | C34: =C21+C33 -> 106329736.56 | D34: =D21+D33 -> 106235154.85000002 | E34: =E21+E33 -> 0 | F34: =F21+F33 -> 96843318.88000001 | G34: =G21+G33 -> 77873918.329999998 | H34: =H21+H33 -> 68914064.189999998 | I34: =SUM(B34:H34) -> 561576192.80999994 | J34: =IF(C34=0,0,((C34/B34)*100)-100) -> 0.90124934522680178 | K34: =IF(C34=0,0,IF(D34=0,0,((C34/D34)*100)-100)) -> 8.9030519260347774E-2 | L34: =IF(F34=0,0,IF(C34=0,0,((C34/F34)*100)-100)) -> 9.7956346289151242 | M34: =IF(G34=0,0,IF(C34=0,0,((C34/G34)*100)-100)) -> 36.540884085753959 | N34: =IF(C34=0,0,IF(H34=0,0,((C34/H34)*100)-100)) -> 54.293231446694051 | P34: =P21+P33 -> 105380000 | Q34: =IF(C34=0,0,((C34/P34)*100)-100) -> 0.90124934522680178 | R34: =IF(C34=0,0,(C34/$C$40)*100) -> 90.835850009241128 | T34: 16.75 | U34: 16.06 | V34: =U34-T34 -> -0.69000000000000128
A35: Centenario | B35: 829000 | C35: 898852.67 | D35: 1326363.91 | F35: 1231252.33 | G35: 1162118.83 | H35: 1118676.45 | J35: =IF(B35=0,0,((C35/B35)*100)-100) -> 8.4261363088057948 | K35: =IF(C35=0,0,IF(D35=0,0,((C35/D35)*100)-100)) -> -32.231820903510553 | L35: =IF(F35=0,0,((C35/F35)*100)-100) -> -26.996875612003919 | M35: =IF(G35=0,0,((C35/G35)*100)-100) -> -22.653979369734515 | N35: =IF(C35=0,0,IF(H35=0,0,((C35/H35)*100)-100)) -> -19.65034483384359 | P35: 1345000 | Q35: =IF(P35=0,0,IF(C35=0,0,((C35/P35)*100)-100)) -> -33.170805204460962 | R35: =IF(C35=0,0,(C35/$C$40)*100) -> 0.76787593907423402 | T35: 17 | U35: 14.458636474874128 | V35: =U35-T35 -> -2.5413635251258722
A36: Cajuru | B36: 2093550.39 | C36: 2093554.05 | D36: 0 | F36: 0 | G36: 0 | H36: 0 | J36: =IF(B36=0,0,((C36/B36)*100)-100) -> 1.7482263707790935E-4 | K36: =IF(C36=0,0,IF(D36=0,0,((C36/D36)*100)-100)) -> 0 | L36: =IF(F36=0,0,((C36/F36)*100)-100) -> 0 | M36: =IF(G36=0,0,((C36/G36)*100)-100) -> 0 | N36: =IF(C36=0,0,IF(H36=0,0,((C36/H36)*100)-100)) -> 0 | P36: 0 | Q36: =IF(P36=0,0,IF(C36=0,0,((C36/P36)*100)-100)) -> 0 | R36: =IF(C36=0,0,(C36/$C$40)*100) -> 1.7884908570682847 | T36: 0 | U36: 0 | V36: =U36-T36 -> 0
A37: Novo Mundo | B37: 5200000 | C37: 5050281.64 | D37: 5131600.7 | F37: 0 | G37: 0 | H37: 0 | J37: =IF(B37=0,0,((C37/B37)*100)-100) -> -2.8791992307692311 | K37: =IF(C37=0,0,IF(D37=0,0,((C37/D37)*100)-100)) -> -1.5846724005630648 | L37: =IF(F37=0,0,((C37/F37)*100)-100) -> 0 | M37: =IF(G37=0,0,((C37/G37)*100)-100) -> 0 | N37: =IF(C37=0,0,IF(H37=0,0,((C37/H37)*100)-100)) -> 0 | P37: 5200000 | Q37: =IF(P37=0,0,IF(C37=0,0,((C37/P37)*100)-100)) -> -2.8791992307692311 | R37: =IF(C37=0,0,(C37/$C$40)*100) -> 4.3143775240767344 | T37: 15.5038 | U37: 15.493217720823981 | V37: =U37-T37 -> -1.0582279176018616E-2
A38: Fazenda | B38: 2700000 | C38: 2684592.27 | D38: 2695948.09 | F38: 0 | G38: 0 | H38: 0 | J38: =IF(B38=0,0,((C38/B38)*100)-100) -> -0.57065666666666459 | K38: =IF(C38=0,0,IF(D38=0,0,((C38/D38)*100)-100)) -> -0.42121805097514198 | L38: =IF(F38=0,0,((C38/F38)*100)-100) -> 0 | M38: =IF(G38=0,0,((C38/G38)*100)-100) -> 0 | N38: =IF(C38=0,0,IF(H38=0,0,((C38/H38)*100)-100)) -> 0 | P38: 2700000 | Q38: =IF(P38=0,0,IF(C38=0,0,((C38/P38)*100)-100)) -> -0.57065666666666459 | R38: =IF(C38=0,0,(C38/$C$40)*100) -> 2.293405670539622 | T38: 16 | U38: 16.268009666883231 | V38: =U38-T38 -> 0.26800966688323058
A39: Total Lojas Novas | B39: =SUM(B35:B38) -> 10822550.390000001 | C39: =SUM(C35:C38) -> 10727280.629999999 | D39: =SUM(D35:D38) -> 9153912.6999999993 | F39: =SUM(F35:F38) -> 1231252.33 | G39: =SUM(G35:G38) -> 1162118.83 | H39: =SUM(H35:H38) -> 1118676.45 | J39: =IF(C39=0,0,((C39/B39)*100)-100) -> -0.88028936403040348 | K39: =IF(C39=0,0,IF(D39=0,0,((C39/D39)*100)-100)) -> 17.187928064902792 | L39: =IF(F39=0,0,IF(C39=0,0,((C39/F39)*100)-100)) -> 771.24956993989997 | M39: =IF(G39=0,0,IF(C39=0,0,((C39/G39)*100)-100)) -> 823.07949523543971 | N39: =IF(C39=0,0,IF(H39=0,0,((C39/H39)*100)-100)) -> 858.9261157683261 | P39: =SUM(P35:P38) -> 9245000 | Q39: =IF(P39=0,0,IF(C39=0,0,((C39/P39)*100)-100)) -> 16.033322120064895 | R39: =IF(C39=0,0,(C39/$C$40)*100) -> 9.1641499907588742
A40: Total Geral | B40: =B21+B33+B39 -> 116202550.39 | C40: =C21+C33+C39 -> 117057017.19 | D40: =D21+D33+D39 -> 115389067.55000003 | F40: =F21+F33+F39 -> 98074571.210000008 | G40: =G21+G33+G39 -> 79036037.159999996 | H40: =H21+H33+H39 -> 70032740.640000001 | J40: =IF(C40=0,0,((C40/B40)*100)-100) -> 0.73532534108092307 | K40: =IF(C40=0,0,IF(D40=0,0,((C40/D40)*100)-100)) -> 1.4455005794004023 | L40: =IF(F40=0,0,IF(C40=0,0,((C40/F40)*100)-100)) -> 19.355114935301884 | M40: =IF(G40=0,0,IF(C40=0,0,((C40/G40)*100)-100)) -> 48.105878528588931 | N40: =IF(C40=0,0,IF(H40=0,0,((C40/H40)*100)-100)) -> 67.146132109445887 | P40: =P21+P33+P39 -> 114625000 | Q40: =IF(C40=0,0,((C40/P40)*100)-100) -> 2.1217161962922404 | R40: =R21+R33+R39 -> 100 | T40: 16.62 | U40: 16 | V40: =U40-T40 -> -0.62000000000000099