A2: Periodo: | C2: 37987 | D2: a | E2: 38352 | H2: Vendas Acumuladas por Filial | Q2: =NOW() -> 38562.677953935199
A4: v.1 | C4: Vendas 2004 | G4: Vendas de Anos Anteriores | K4: Percentuais ( % ) | Q4: Meta Mensal | U4: Margem
A5: Lojas | C5: Previsao | D5: Realizada | E5: Mes Anterior | G5: Vendas 2003 | H5: Vendas 2002 | I5: Vendas 2001 | K5: % Prev | L5: % MA | M5: 2003 | N5: 2002 | O5: 2001 | Q5: Previsao Mes | R5: Final | S5: Part. | U5: Meta | V5: Real
A7: Xaxim | C7: 9540000 | D7: 9824356 | E7: 9734028 | G7: 8663437 | H7: 6705460 | I7: 6350353 | K7: =IF(C7=0,0,((D7/C7)*100)-100) -> 2.98 | L7: =IF(D7=0,0,IF(E7=0,0,((D7/E7)*100)-100)) -> 00.93 | M7: =IF(G7=0,0,((D7/G7)*100)-100) -> 13.4 | N7: =IF(H7=0,0,((D7/H7)*100)-100) -> 46.51 | O7: =IF(D7=0,0,IF(I7=0,0,((D7/I7)*100)-100)) -> 54.71 | Q7: 710000 | R7: =IF(D7=0,0,((D7/Q7)*100)-100) -> 1283.71 | S7: =IF(D7=0,0,(D7/$D$35)*100) -> 1.61 | U7: 16.45 | V7: 12.57
A8: S. Felicidade | C8: 9289000 | D8: 8791841 | E8: 8750884 | G8: 8990318 | H8: 6990164 | I8: 6887386 | K8: =IF(C8=0,0,((D8/C8)*100)-100) -> -5.35 | L8: =IF(D8=0,0,IF(E8=0,0,((D8/E8)*100)-100)) -> 00.47 | M8: =IF(G8=0,0,((D8/G8)*100)-100) -> -2.21 | N8: =IF(H8=0,0,((D8/H8)*100)-100) -> 25.77 | O8: =IF(D8=0,0,IF(I8=0,0,((D8/I8)*100)-100)) -> 27.65 | Q8: 739000 | R8: =IF(D8=0,0,((D8/Q8)*100)-100) -> 1089.69 | S8: =IF(D8=0,0,(D8/$D$35)*100) -> 1.44 | U8: 17.1 | V8: 15.18
A9: Lapa | C9: 14022000 | D9: 13955149 | E9: 13803569 | G9: 12529965 | H9: 10376916 | I9: 8724833 | K9: =IF(C9=0,0,((D9/C9)*100)-100) -> -00.48 | L9: =IF(D9=0,0,IF(E9=0,0,((D9/E9)*100)-100)) -> 1.1 | M9: =IF(G9=0,0,((D9/G9)*100)-100) -> 11.37 | N9: =IF(H9=0,0,((D9/H9)*100)-100) -> 34.48 | O9: =IF(D9=0,0,IF(I9=0,0,((D9/I9)*100)-100)) -> 59.95 | Q9: 1077000 | R9: =IF(D9=0,0,((D9/Q9)*100)-100) -> 1195.74 | S9: =IF(D9=0,0,(D9/$D$35)*100) -> 2.29 | U9: 16.05 | V9: 15.18
A10: Araucaria | C10: 14018000 | D10: 12008739 | E10: 11941120 | G10: 12511462 | H10: 16573164 | I10: 17770814 | K10: =IF(C10=0,0,((D10/C10)*100)-100) -> -14.33 | L10: =IF(D10=0,0,IF(E10=0,0,((D10/E10)*100)-100)) -> 00.57 | M10: =IF(G10=0,0,((D10/G10)*100)-100) -> -4.02 | N10: =IF(H10=0,0,((D10/H10)*100)-100) -> -27.54 | O10: =IF(D10=0,0,IF(I10=0,0,((D10/I10)*100)-100)) -> -32.42 | Q10: 1152000 | R10: =IF(D10=0,0,((D10/Q10)*100)-100) -> 942.43 | S10: =IF(D10=0,0,(D10/$D$35)*100) -> 1.97 | U10: 17.15 | V10: 15.72
A11: Pinheirinho | C11: 27140000 | D11: 25055518 | E11: 24736196 | G11: 22745716 | H11: 20177280 | I11: 20052382 | K11: =IF(C11=0,0,((D11/C11)*100)-100) -> -7.68 | L11: =IF(D11=0,0,IF(E11=0,0,((D11/E11)*100)-100)) -> 1.29 | M11: =IF(G11=0,0,((D11/G11)*100)-100) -> 10.15 | N11: =IF(H11=0,0,((D11/H11)*100)-100) -> 24.18 | O11: =IF(D11=0,0,IF(I11=0,0,((D11/I11)*100)-100)) -> 24.95 | Q11: 2190000 | R11: =IF(D11=0,0,((D11/Q11)*100)-100) -> 1044.09 | S11: =IF(D11=0,0,(D11/$D$35)*100) -> 4.11 | U11: 16.3 | V11: 13.51
A12: Hauer | C12: 39190000 | D12: 37392172 | E12: 36698944 | G12: 35258648 | H12: 29254446 | I12: 27253856 | K12: =IF(C12=0,0,((D12/C12)*100)-100) -> -4.59 | L12: =IF(D12=0,0,IF(E12=0,0,((D12/E12)*100)-100)) -> 1.89 | M12: =IF(G12=0,0,((D12/G12)*100)-100) -> 6.05 | N12: =IF(H12=0,0,((D12/H12)*100)-100) -> 27.82 | O12: =IF(D12=0,0,IF(I12=0,0,((D12/I12)*100)-100)) -> 37.2 | Q12: 2980000 | R12: =IF(D12=0,0,((D12/Q12)*100)-100) -> 1154.77 | S12: =IF(D12=0,0,(D12/$D$35)*100) -> 6.14 | U12: 16.1 | V12: 15.86
A13: Paranagua | C13: 41122000 | D13: 40783300 | E13: 40068736 | G13: 37010988 | H13: 32281520 | I13: 29068476 | K13: =IF(C13=0,0,((D13/C13)*100)-100) -> -00.82 | L13: =IF(D13=0,0,IF(E13=0,0,((D13/E13)*100)-100)) -> 1.78 | M13: =IF(G13=0,0,((D13/G13)*100)-100) -> 10.19 | N13: =IF(H13=0,0,((D13/H13)*100)-100) -> 26.34 | O13: =IF(D13=0,0,IF(I13=0,0,((D13/I13)*100)-100)) -> 40.3 | Q13: 3162000 | R13: =IF(D13=0,0,((D13/Q13)*100)-100) -> 1189.79 | S13: =IF(D13=0,0,(D13/$D$35)*100) -> 6.7 | U13: 17 | V13: 16.58
A14: Centenario | C14: 12250000 | D14: 11670564 | E14: 11576298 | G14: 11137943 | H14: 8921765 | I14: 8084831 | K14: =IF(C14=0,0,((D14/C14)*100)-100) -> -4.73 | L14: =IF(D14=0,0,IF(E14=0,0,((D14/E14)*100)-100)) -> 00.81 | M14: =IF(G14=0,0,((D14/G14)*100)-100) -> 4.78 | N14: =IF(H14=0,0,((D14/H14)*100)-100) -> 30.81 | O14: =IF(D14=0,0,IF(I14=0,0,((D14/I14)*100)-100)) -> 44.35 | Q14: 960000 | R14: =IF(D14=0,0,((D14/Q14)*100)-100) -> 1115.68 | S14: =IF(D14=0,0,(D14/$D$35)*100) -> 1.92 | U14: 16.85 | V14: 12.86
A15: Arapongas | C15: 0 | D15: 0 | E15: 0 | G15: 0 | H15: 0 | I15: 0 | K15: =IF(C15=0,0,((D15/C15)*100)-100) -> 0 | L15: =IF(D15=0,0,IF(E15=0,0,((D15/E15)*100)-100)) -> 0 | M15: =IF(D15=0,0,IF(G15=0,0,((D15/G15)*100)-100)) -> 0 | N15: =IF(D15=0,0,IF(H15=0,0,((D15/H15)*100)-100)) -> 0 | O15: =IF(D15=0,0,IF(I15=0,0,((D15/I15)*100)-100)) -> 0 | Q15: 0 | R15: =IF(D15=0,0,((D15/Q15)*100)-100) -> 0 | S15: =IF(D15=0,0,(D15/$D$35)*100) -> 0 | U15: 0 | V15: 0
A16: Sao Braz | C16: 40108000 | D16: 37781500 | E16: 37503704 | G16: 37039652 | H16: 30409720 | I16: 29970046 | K16: =IF(C16=0,0,((D16/C16)*100)-100) -> -5.8 | L16: =IF(D16=0,0,IF(E16=0,0,((D16/E16)*100)-100)) -> 00.74 | M16: =IF(G16=0,0,((D16/G16)*100)-100) -> 2 | N16: =IF(H16=0,0,((D16/H16)*100)-100) -> 24.24 | O16: =IF(D16=0,0,IF(I16=0,0,((D16/I16)*100)-100)) -> 26.06 | Q16: 3087000 | R16: =IF(D16=0,0,((D16/Q16)*100)-100) -> 1123.89 | S16: =IF(D16=0,0,(D16/$D$35)*100) -> 6.2 | U16: 15.22 | V16: 15.58
A17: Sitio Cercado | C17: 18860000 | D17: 20009460 | E17: 19402996 | G17: 16052983 | H17: 10819180 | I17: 10290898 | K17: =IF(C17=0,0,((D17/C17)*100)-100) -> 6.09 | L17: =IF(D17=0,0,IF(E17=0,0,((D17/E17)*100)-100)) -> 3.13 | M17: =IF(G17=0,0,((D17/G17)*100)-100) -> 24.65 | N17: =IF(H17=0,0,((D17/H17)*100)-100) -> 84.94 | O17: =IF(D17=0,0,IF(I17=0,0,((D17/I17)*100)-100)) -> 94.44 | Q17: 1280000 | R17: =IF(D17=0,0,((D17/Q17)*100)-100) -> 1463.24 | S17: =IF(D17=0,0,(D17/$D$35)*100) -> 3.29 | U17: 17.5 | V17: 15.71
A18: Apucarana | C18: 18997000 | D18: 18857824 | E18: 18513206 | G18: 16689271 | H18: 14551405 | I18: 13787506 | K18: =IF(C18=0,0,((D18/C18)*100)-100) -> -00.73 | L18: =IF(D18=0,0,IF(E18=0,0,((D18/E18)*100)-100)) -> 1.86 | M18: =IF(G18=0,0,((D18/G18)*100)-100) -> 12.99 | N18: =IF(H18=0,0,((D18/H18)*100)-100) -> 29.59 | O18: =IF(D18=0,0,IF(I18=0,0,((D18/I18)*100)-100)) -> 36.77 | Q18: 1396000 | R18: =IF(D18=0,0,((D18/Q18)*100)-100) -> 1250.85 | S18: =IF(D18=0,0,(D18/$D$35)*100) -> 3.1 | U18: 17.1 | V18: 16.94
A19: Ahu | C19: 15191000 | D19: 13787000 | E19: 13812012 | G19: 15060207 | H19: 13132530 | I19: 14242116 | K19: =IF(C19=0,0,((D19/C19)*100)-100) -> -9.24 | L19: =IF(D19=0,0,IF(E19=0,0,((D19/E19)*100)-100)) -> -00.18 | M19: =IF(G19=0,0,((D19/G19)*100)-100) -> -8.45 | N19: =IF(H19=0,0,((D19/H19)*100)-100) -> 4.98 | O19: =IF(D19=0,0,IF(I19=0,0,((D19/I19)*100)-100)) -> -3.2 | Q19: 1178000 | R19: =IF(D19=0,0,((D19/Q19)*100)-100) -> 1070.37 | S19: =IF(D19=0,0,(D19/$D$35)*100) -> 2.26 | U19: 17.3 | V19: 14.29
A20: P.G. Centro | C20: 22110000 | D20: 20778796 | E20: 20571652 | G20: 19621374 | H20: 15869584 | I20: 13984602 | K20: =IF(C20=0,0,((D20/C20)*100)-100) -> -6.02 | L20: =IF(D20=0,0,IF(E20=0,0,((D20/E20)*100)-100)) -> 1.01 | M20: =IF(G20=0,0,((D20/G20)*100)-100) -> 5.9 | N20: =IF(H20=0,0,((D20/H20)*100)-100) -> 30.93 | O20: =IF(D20=0,0,IF(I20=0,0,((D20/I20)*100)-100)) -> 48.58 | Q20: 1650000 | R20: =IF(D20=0,0,((D20/Q20)*100)-100) -> 1159.32 | S20: =IF(D20=0,0,(D20/$D$35)*100) -> 3.41 | U20: 17 | V20: 17.02
A21: Maringa | C21: 27750000 | D21: 26609270 | E21: 26091180 | G21: 24413222 | H21: 20869120 | I21: 19833850 | K21: =IF(C21=0,0,((D21/C21)*100)-100) -> -4.11 | L21: =IF(D21=0,0,IF(E21=0,0,((D21/E21)*100)-100)) -> 1.99 | M21: =IF(G21=0,0,((D21/G21)*100)-100) -> 9 | N21: =IF(H21=0,0,((D21/H21)*100)-100) -> 27.51 | O21: =IF(D21=0,0,IF(I21=0,0,((D21/I21)*100)-100)) -> 34.16 | Q21: 2100000 | R21: =IF(D21=0,0,((D21/Q21)*100)-100) -> 1167.11 | S21: =IF(D21=0,0,(D21/$D$35)*100) -> 4.37 | U21: 16.67 | V21: 16.43
A22: Araucaria Nova | C22: 25865000 | D22: 25752708 | E22: 25512976 | G22: 23362540 | H22: 7510505 | I22: 0 | K22: =IF(C22=0,0,((D22/C22)*100)-100) -> -00.43 | L22: =IF(D22=0,0,IF(E22=0,0,((D22/E22)*100)-100)) -> 00.94 | M22: =IF(G22=0,0,((D22/G22)*100)-100) -> 10.23 | N22: =IF(H22=0,0,((D22/H22)*100)-100) -> 242.89 | O22: =IF(D22=0,0,IF(I22=0,0,((D22/I22)*100)-100)) -> 0 | Q22: 1950000 | R22: =IF(D22=0,0,((D22/Q22)*100)-100) -> 1220.65 | S22: =IF(D22=0,0,(D22/$D$35)*100) -> 4.23 | U22: 16.9 | V22: 16
A23: Sitio Cercado | C23: 0 | D23: 0 | E23: 0 | G23: 0 | H23: 0 | I23: 0 | K23: =IF(C23=0,0,((D23/C23)*100)-100) -> 0 | L23: =IF(D23=0,0,IF(E23=0,0,((D23/E23)*100)-100)) -> 0 | M23: =IF(G23=0,0,((D23/G23)*100)-100) -> 0 | N23: =IF(H23=0,0,((D23/H23)*100)-100) -> 0 | O23: =IF(D23=0,0,IF(I23=0,0,((D23/I23)*100)-100)) -> 0 | Q23: 0 | R23: =IF(Q23=0,0,IF(D23=0,0,((D23/Q23)*100)-100)) -> 0 | S23: =IF(D23=0,0,(D23/$D$35)*100) -> 0 | U23: 0 | V23: 0
A24: Total Super | C24: =SUM(C7:C23) -> 335452000 | D24: =SUM(D7:D23) -> 323058197 | E24: =SUM(E7:E23) -> 318717501 | G24: =SUM(G7:G23) -> 301087726 | H24: =SUM(H7:H23) -> 244442759 | I24: =SUM(I7:I23) -> 226301949 | J24: =SUM(C24:I24) -> 1749060132 | K24: =IF(D24=0,0,((D24/C24)*100)-100) -> -3.69 | L24: =IF(D24=0,0,IF(E24=0,0,((D24/E24)*100)-100)) -> 1.36 | M24: =IF(G24=0,0,IF(D24=0,0,((D24/G24)*100)-100)) -> 7.3 | N24: =IF(H24=0,0,IF(D24=0,0,((D24/H24)*100)-100)) -> 32.16 | O24: =IF(D24=0,0,IF(I24=0,0,((D24/I24)*100)-100)) -> 42.76 | Q24: =SUM(Q7:Q23) -> 25611000 | R24: =IF(D24=0,0,((D24/Q24)*100)-100) -> 1161.4 | S24: =IF(D24=0,0,(D24/$D$35)*100) -> 53.05 | U24: 16.58 | V24: 15.52
A26: Londrina | C26: 30595000 | D26: 28984124 | E26: 28268842 | G26: 26825292 | H26: 24151348 | I26: 24292974 | K26: =IF(C26=0,0,((D26/C26)*100)-100) -> -5.27 | L26: =IF(D26=0,0,IF(E26=0,0,((D26/E26)*100)-100)) -> 2.53 | M26: =IF(G26=0,0,((D26/G26)*100)-100) -> 8.05 | N26: =IF(H26=0,0,((D26/H26)*100)-100) -> 20.01 | O26: =IF(D26=0,0,IF(I26=0,0,((D26/I26)*100)-100)) -> 19.31 | Q26: 2394000 | R26: =IF(D26=0,0,IF(Q26=0,0,((D26/Q26)*100)-100)) -> 1110.7 | S26: =IF(D26=0,0,(D26/$D$35)*100) -> 4.76 | U26: 17.47 | V26: 14.75
A27: S.J. Pinhais | C27: 54160000 | D27: 52662996 | E27: 51847168 | G27: 48776628 | H27: 40508428 | I27: 33786784 | K27: =IF(C27=0,0,((D27/C27)*100)-100) -> -2.76 | L27: =IF(D27=0,0,IF(E27=0,0,((D27/E27)*100)-100)) -> 1.57 | M27: =IF(G27=0,0,((D27/G27)*100)-100) -> 7.97 | N27: =IF(H27=0,0,((D27/H27)*100)-100) -> 30.01 | O27: =IF(D27=0,0,IF(I27=0,0,((D27/I27)*100)-100)) -> 55.87 | Q27: 4150000 | R27: =IF(D27=0,0,IF(Q27=0,0,((D27/Q27)*100)-100)) -> 1168.99 | S27: =IF(D27=0,0,(D27/$D$35)*100) -> 8.65 | U27: 15.6 | V27: 15.05
A28: P.G. Nova | C28: 42047000 | D28: 41334056 | E28: 40229872 | G28: 36077052 | H28: 32615048 | I28: 28021642 | K28: =IF(C28=0,0,((D28/C28)*100)-100) -> -1.7 | L28: =IF(D28=0,0,IF(E28=0,0,((D28/E28)*100)-100)) -> 2.74 | M28: =IF(G28=0,0,((D28/G28)*100)-100) -> 14.57 | N28: =IF(H28=0,0,((D28/H28)*100)-100) -> 26.73 | O28: =IF(D28=0,0,IF(I28=0,0,((D28/I28)*100)-100)) -> 47.51 | Q28: 3249000 | R28: =IF(D28=0,0,IF(Q28=0,0,((D28/Q28)*100)-100)) -> 1172.21 | S28: =IF(D28=0,0,(D28/$D$35)*100) -> 6.79 | U28: 15.95 | V28: 15.1
A29: Nilo Pecanha | C29: 106202000 | D29: 101352160 | E29: 100948960 | G29: 98179712 | H29: 61857576 | I29: 0 | K29: =IF(C29=0,0,((D29/C29)*100)-100) -> -4.57 | L29: =IF(D29=0,0,IF(E29=0,0,((D29/E29)*100)-100)) -> 00.4 | M29: =IF(G29=0,0,((D29/G29)*100)-100) -> 3.23 | N29: =IF(H29=0,0,((D29/H29)*100)-100) -> 63.85 | O29: =IF(D29=0,0,IF(I29=0,0,((D29/I29)*100)-100)) -> 0 | Q29: 7898000 | R29: =IF(D29=0,0,IF(Q29=0,0,((D29/Q29)*100)-100)) -> 1183.26 | S29: =IF(D29=0,0,(D29/$D$35)*100) -> 16.64 | U29: 15.1 | V29: 14.78
A30: Champagnat | C30: 54409956 | D30: 50212276 | E30: 43474600 | G30: 0 | H30: 0 | I30: 0 | K30: =IF(C30=0,0,((D30/C30)*100)-100) -> -7.71 | L30: =IF(D30=0,0,IF(E30=0,0,((D30/E30)*100)-100)) -> 15.5 | M30: =IF(G30=0,0,((D30/G30)*100)-100) -> 0 | N30: =IF(H30=0,0,((D30/H30)*100)-100) -> 0 | O30: =IF(D30=0,0,IF(I30=0,0,((D30/I30)*100)-100)) -> 0 | Q30: 0 | R30: =IF(D30=0,0,IF(Q30=0,0,((D30/Q30)*100)-100)) -> 0 | S30: =IF(D30=0,0,(D30/$D$35)*100) -> 8.25 | U30: 0 | V30: 0
A31: Santa Candida | C31: 11897636 | D31: 11325297 | E31: 4370194 | G31: 0 | H31: 0 | I31: 0 | K31: =IF(C31=0,0,((D31/C31)*100)-100) -> -4.81 | L31: =IF(D31=0,0,IF(E31=0,0,((D31/E31)*100)-100)) -> 159.15 | M31: =IF(G31=0,0,((D31/G31)*100)-100) -> 0 | N31: =IF(H31=0,0,((D31/H31)*100)-100) -> 0 | O31: =IF(D31=0,0,IF(I31=0,0,((D31/I31)*100)-100)) -> 0 | Q31: 0 | R31: =IF(D31=0,0,IF(Q31=0,0,((D31/Q31)*100)-100)) -> 0 | S31: =IF(D31=0,0,(D31/$D$35)*100) -> 1.86 | U31: 0 | V31: 0
A32: Paranagu Raia | C32: 0 | D32: 0 | E32: 0 | G32: 0 | H32: 0 | I32: 0 | K32: =IF(C32=0,0,((D32/C32)*100)-100) -> 0 | L32: =IF(D32=0,0,IF(E32=0,0,((D32/E32)*100)-100)) -> 0 | M32: =IF(G32=0,0,((D32/G32)*100)-100) -> 0 | N32: =IF(H32=0,0,((D32/H32)*100)-100) -> 0 | O32: =IF(D32=0,0,IF(I32=0,0,((D32/I32)*100)-100)) -> 0 | Q32: 0 | R32: =IF(D32=0,0,IF(Q32=0,0,((D32/Q32)*100)-100)) -> 0 | S32: =IF(D32=0,0,(D32/$D$35)*100) -> 0 | U32: 0 | V32: 0
A33: Total Hiper | C33: =SUM(C26:C32) -> 299311592 | D33: =SUM(D26:D32) -> 285870909 | E33: =SUM(E26:E32) -> 269139636 | G33: =SUM(G26:G32) -> 209858684 | H33: =SUM(H26:H32) -> 159132400 | I33: =SUM(I26:I32) -> 86101400 | J33: =SUM(C33:I33) -> 1309414621 | K33: =IF(D33=0,0,((D33/C33)*100)-100) -> -4.49 | L33: =IF(D33=0,0,IF(E33=0,0,((D33/E33)*100)-100)) -> 6.22 | M33: =IF(G33=0,0,IF(D33=0,0,((D33/G33)*100)-100)) -> 36.22 | N33: =IF(H33=0,0,IF(D33=0,0,((D33/H33)*100)-100)) -> 79.64 | O33: =IF(D33=0,0,IF(I33=0,0,((D33/I33)*100)-100)) -> 232.02 | Q33: =SUM(Q26:Q32) -> 17691000 | R33: =IF(D33=0,0,((D33/Q33)*100)-100) -> 1515.91 | S33: =IF(D33=0,0,(D33/$D$35)*100) -> 46.95 | U33: 15.69 | V33: 14.9
A35: Total Geral | C35: =C24+C33 -> 634763592 | D35: =D24+D33 -> 608929106 | E35: =E24+E33 -> 587857137 | G35: =G24+G33 -> 510946410 | H35: =H24+H33 -> 403575159 | I35: =I24+I33 -> 312403349 | K35: =IF(D33=0,0,((D35/C35)*100)-100) -> -4.07 | L35: =IF(D35=0,0,IF(E35=0,0,((D35/E35)*100)-100)) -> 3.58 | M35: =IF(G35=0,0,IF(D35=0,0,((D35/G35)*100)-100)) -> 19.18 | N35: =IF(H35=0,0,IF(D35=0,0,((D35/H35)*100)-100)) -> 50.88 | O35: =IF(D35=0,0,IF(I35=0,0,((D35/I35)*100)-100)) -> 94.92 | Q35: =Q24+Q33 -> 43302000 | R35: =IF(D35=0,0,((D35/Q35)*100)-100) -> 1306.24 | S35: =S24+S33 -> 100 | U35: 16.22 | V35: 15.27
C36: Resumo por Regiao - Outubro/2002
C37: Descricao das Aberturas | H37: Valor | I37: %
C38: Curitiba (2,3,6,7,10,11,17,21,22) | H38: =D7+D8+D11+D12+D14+D16+D19+D29+D30+D32 -> 295867387 | I38: =IF(D35=0,0,H38/$D$35) -> 0.4859
C39: Curitiba e Metrop. (Ctba. 4,5,8,14,23) | H39: =H38+D9+D10+D13+D28+D23 -> 403948631 | I39: =IF(D35=0,0,H39/$D$35) -> 0.66339999999999999
C40: Metropolitana (4,5,8,14,23) | H40: =H39-H38 -> 108081244 | I40: =IF(D35=0,0,H40/$D$35) -> 0.17749999999999999
C41: Norte (9,15,20) | H41: =D26+D18+D23 -> 47841948 | I41: =IF(D35=0,0,H41/$D$35) -> 7.8600000000000003E-2
C42: Centro-Oeste (13,18,19) | H42: =D17+D20+D28 -> 82122312 | I42: =IF(D35=0,0,H42/$D$35) -> 0.13489999999999999
C43: Ponta Grossa (18,19) | H43: =H42-D17 -> 62112852 | I43: =IF(D35=0,0,H43/$D$35) -> 0.10199999999999999
C44: Super (2,3,4,5,6,7,8,10,11,13,15,17,18,20,23) | H44: =D24 -> 323058197 | I44: =IF(D35=0,0,H44/$D$35) -> 0.53049999999999997
C45: Hiper (9,14,19,21,22,24) | H45: =D33 -> 285870909 | I45: =IF(D35=0,0,H45/$D$35) -> 0.46949999999999997
C46: Curitiba, Metropolitana e Centro-Oeste | H46: =D35-H41 -> 561087158 | I46: =IF(D35=0,0,H46/$D$35) -> 0.9214
C47: Araucaria | H47: =D10+D23 -> 12008739 | I47: =IF(D35=0,0,H47/$D$35) -> 1.9699999999999999E-2