A2: Periodo: | C2: 39934 | D2: a | E2: 31/05/2009 | H2: Vendas Acumuladas por Filial | Q2: =NOW() -> 39965.3115658565
A4: v.1 | C4: Vendas 2009 | G4: Vendas de Anos Anteriores | K4: Percentuais ( % ) | Q4: Meta Mensal | U4: Margem
A5: Lojas | C5: Previsao | D5: Realizada | E5: Mes Anterior | G5: Vendas 2008 | H5: Vendas 2007 | I5: Vendas 2006 | K5: % Prev | L5: % MA | M5: 2008 | N5: 2007 | O5: 2006 | Q5: Previsao Mes | R5: Final | S5: Part. | U5: Meta | V5: Coml | W5: Dif
A7: S. Felicidade | C7: 2600000 | D7: 2629079 | E7: 2918494 | G7: 2275548 | H7: 823956 | I7: 816923 | K7: =IF(C7=0,0,((D7/C7)*100)-100) -> 1.12 | L7: =IF(D7=0,0,IF(E7=0,0,((D7/E7)*100)-100)) -> -9.92 | M7: =IF(G7=0,0,((D7/G7)*100)-100) -> 15.54 | N7: =IF(H7=0,0,((D7/H7)*100)-100) -> 219.08 | O7: =IF(D7=0,0,IF(I7=0,0,((D7/I7)*100)-100)) -> 221.83 | Q7: 2600000 | R7: =IF(D7=0,0,((D7/Q7)*100)-100) -> 1.12 | S7: =IF(D7=0,0,(D7/$D$44)*100) -> 2.6 | U7: 16.86 | V7: 0 | W7: =V7-U7 -> -16.86
A8: Lapa | C8: 2100000 | D8: 2072103 | E8: 2372673 | G8: 1803862 | H8: 1245869 | I8: 982751 | K8: =IF(C8=0,0,((D8/C8)*100)-100) -> -1.33 | L8: =IF(D8=0,0,IF(E8=0,0,((D8/E8)*100)-100)) -> -12.67 | M8: =IF(G8=0,0,((D8/G8)*100)-100) -> 14.87 | N8: =IF(H8=0,0,((D8/H8)*100)-100) -> 66.32 | O8: =IF(D8=0,0,IF(I8=0,0,((D8/I8)*100)-100)) -> 110.85 | Q8: 2100000 | R8: =IF(D8=0,0,((D8/Q8)*100)-100) -> -1.33 | S8: =IF(D8=0,0,(D8/$D$44)*100) -> 2.05 | U8: 16.4 | V8: 0 | W8: =V8-U8 -> -16.4
A9: Araucaria | C9: 1285000 | D9: 1230652 | E9: 1431832 | G9: 1125179 | H9: 907534 | I9: 897934 | K9: =IF(C9=0,0,((D9/C9)*100)-100) -> -4.23 | L9: =IF(D9=0,0,IF(E9=0,0,((D9/E9)*100)-100)) -> -14.05 | M9: =IF(G9=0,0,((D9/G9)*100)-100) -> 9.37 | N9: =IF(H9=0,0,((D9/H9)*100)-100) -> 35.6 | O9: =IF(D9=0,0,IF(I9=0,0,((D9/I9)*100)-100)) -> 37.05 | Q9: 1285000 | R9: =IF(D9=0,0,((D9/Q9)*100)-100) -> -4.23 | S9: =IF(D9=0,0,(D9/$D$44)*100) -> 1.22 | U9: 17.3 | V9: 0 | W9: =V9-U9 -> -17.3
A10: Hauer | C10: 3895000 | D10: 3822185 | E10: 3914572 | G10: 3830363 | H10: 2948755 | I10: 2847537 | K10: =IF(C10=0,0,((D10/C10)*100)-100) -> -1.87 | L10: =IF(D10=0,0,IF(E10=0,0,((D10/E10)*100)-100)) -> -2.36 | M10: =IF(G10=0,0,((D10/G10)*100)-100) -> -0.21 | N10: =IF(H10=0,0,((D10/H10)*100)-100) -> 29.62 | O10: =IF(D10=0,0,IF(I10=0,0,((D10/I10)*100)-100)) -> 34.23 | Q10: 3895000 | R10: =IF(D10=0,0,((D10/Q10)*100)-100) -> -1.87 | S10: =IF(D10=0,0,(D10/$D$44)*100) -> 3.78 | U10: 15.9 | V10: 0 | W10: =V10-U10 -> -15.9
A11: Paranagua | C11: 1900000 | D11: 1886647 | E11: 2228805 | G11: 1805750 | H11: 1528828 | I11: 1443145 | K11: =IF(C11=0,0,((D11/C11)*100)-100) -> -0.7 | L11: =IF(D11=0,0,IF(E11=0,0,((D11/E11)*100)-100)) -> -15.35 | M11: =IF(G11=0,0,((D11/G11)*100)-100) -> 4.48 | N11: =IF(H11=0,0,((D11/H11)*100)-100) -> 23.4 | O11: =IF(D11=0,0,IF(I11=0,0,((D11/I11)*100)-100)) -> 30.73 | Q11: 1900000 | R11: =IF(D11=0,0,((D11/Q11)*100)-100) -> -0.7 | S11: =IF(D11=0,0,(D11/$D$44)*100) -> 1.87 | U11: 17.9 | V11: 0 | W11: =V11-U11 -> -17.9
A12: Centenario | C12: 1310000 | D12: 1232621 | E12: 1370763 | G12: 1186577 | H12: 934139 | I12: 859987 | K12: =IF(C12=0,0,((D12/C12)*100)-100) -> -5.91 | L12: =IF(D12=0,0,IF(E12=0,0,((D12/E12)*100)-100)) -> -10.08 | M12: =IF(G12=0,0,((D12/G12)*100)-100) -> 3.88 | N12: =IF(H12=0,0,((D12/H12)*100)-100) -> 31.95 | O12: =IF(D12=0,0,IF(I12=0,0,((D12/I12)*100)-100)) -> 43.33 | Q12: 1310000 | R12: =IF(D12=0,0,((D12/Q12)*100)-100) -> -5.91 | S12: =IF(D12=0,0,(D12/$D$44)*100) -> 1.22 | U12: 16.73 | V12: 0 | W12: =V12-U12 -> -16.73
A13: Sitio Cercado | C13: 2132000 | D13: 2090867 | E13: 2369387 | G13: 1829711 | H13: 1263723 | I13: 1142164 | K13: =IF(C13=0,0,((D13/C13)*100)-100) -> -1.93 | L13: =IF(D13=0,0,IF(E13=0,0,((D13/E13)*100)-100)) -> -11.75 | M13: =IF(G13=0,0,((D13/G13)*100)-100) -> 14.27 | N13: =IF(H13=0,0,((D13/H13)*100)-100) -> 65.45 | O13: =IF(D13=0,0,IF(I13=0,0,((D13/I13)*100)-100)) -> 83.06 | Q13: 2132000 | R13: =IF(D13=0,0,((D13/Q13)*100)-100) -> -1.93 | S13: =IF(D13=0,0,(D13/$D$44)*100) -> 2.07 | U13: 16.8 | V13: 0 | W13: =V13-U13 -> -16.8
A14: Apucarana | C14: 2695000 | D14: 2595779 | E14: 3039739 | G14: 2390702 | H14: 2005186 | I14: 1662468 | K14: =IF(C14=0,0,((D14/C14)*100)-100) -> -3.68 | L14: =IF(D14=0,0,IF(E14=0,0,((D14/E14)*100)-100)) -> -14.61 | M14: =IF(G14=0,0,((D14/G14)*100)-100) -> 8.58 | N14: =IF(H14=0,0,((D14/H14)*100)-100) -> 29.45 | O14: =IF(D14=0,0,IF(I14=0,0,((D14/I14)*100)-100)) -> 56.14 | Q14: 2695000 | R14: =IF(D14=0,0,((D14/Q14)*100)-100) -> -3.68 | S14: =IF(D14=0,0,(D14/$D$44)*100) -> 2.57 | U14: 16.35 | V14: 0 | W14: =V14-U14 -> -16.35
A15: Ah | C15: 1700000 | D15: 1697466 | E15: 1845472 | G15: 1617637 | H15: 1347490 | I15: 1120831 | K15: =IF(C15=0,0,((D15/C15)*100)-100) -> -0.15 | L15: =IF(D15=0,0,IF(E15=0,0,((D15/E15)*100)-100)) -> -8.02 | M15: =IF(G15=0,0,((D15/G15)*100)-100) -> 4.93 | N15: =IF(H15=0,0,((D15/H15)*100)-100) -> 25.97 | O15: =IF(D15=0,0,IF(I15=0,0,((D15/I15)*100)-100)) -> 51.45 | Q15: 1700000 | R15: =IF(D15=0,0,((D15/Q15)*100)-100) -> -0.15 | S15: =IF(D15=0,0,(D15/$D$44)*100) -> 1.68 | U15: 17.5 | V15: 0 | W15: =V15-U15 -> -17.5
A16: P.G. Centro | C16: 2100000 | D16: 1814507 | E16: 2184716 | G16: 2014002 | H16: 1695587 | I16: 1537966 | K16: =IF(C16=0,0,((D16/C16)*100)-100) -> -13.59 | L16: =IF(D16=0,0,IF(E16=0,0,((D16/E16)*100)-100)) -> -16.95 | M16: =IF(G16=0,0,((D16/G16)*100)-100) -> -9.91 | N16: =IF(H16=0,0,((D16/H16)*100)-100) -> 7.01 | O16: =IF(D16=0,0,IF(I16=0,0,((D16/I16)*100)-100)) -> 17.98 | Q16: 2100000 | R16: =IF(D16=0,0,((D16/Q16)*100)-100) -> -13.59 | S16: =IF(D16=0,0,(D16/$D$44)*100) -> 1.8 | U16: 19.21 | V16: 0 | W16: =V16-U16 -> -19.21
A17: Maringa | C17: 3050000 | D17: 2951828 | E17: 3215663 | G17: 2651209 | H17: 2314916 | I17: 2315533 | K17: =IF(C17=0,0,((D17/C17)*100)-100) -> -3.22 | L17: =IF(D17=0,0,IF(E17=0,0,((D17/E17)*100)-100)) -> -8.2 | M17: =IF(G17=0,0,((D17/G17)*100)-100) -> 11.34 | N17: =IF(H17=0,0,((D17/H17)*100)-100) -> 27.51 | O17: =IF(D17=0,0,IF(I17=0,0,((D17/I17)*100)-100)) -> 27.48 | Q17: 3050000 | R17: =IF(D17=0,0,((D17/Q17)*100)-100) -> -3.22 | S17: =IF(D17=0,0,(D17/$D$44)*100) -> 2.92 | U17: 18.2 | V17: 0 | W17: =V17-U17 -> -18.2
A18: Araucaria Nova | C18: 3650000 | D18: 3549353 | E18: 3825781 | G18: 2991878 | H18: 2062725 | I18: 1904421 | K18: =IF(C18=0,0,((D18/C18)*100)-100) -> -2.76 | L18: =IF(D18=0,0,IF(E18=0,0,((D18/E18)*100)-100)) -> -7.23 | M18: =IF(G18=0,0,((D18/G18)*100)-100) -> 18.63 | N18: =IF(H18=0,0,((D18/H18)*100)-100) -> 72.07 | O18: =IF(D18=0,0,IF(I18=0,0,((D18/I18)*100)-100)) -> 86.37 | Q18: 3650000 | R18: =IF(D18=0,0,((D18/Q18)*100)-100) -> -2.76 | S18: =IF(D18=0,0,(D18/$D$44)*100) -> 3.51 | U18: 16.4 | V18: 0 | W18: =V18-U18 -> -16.4
A19: Cristo Rei | C19: 1950000 | D19: 2094486 | E19: 2270552 | G19: 1685795 | H19: 1334020 | I19: 0 | K19: =IF(C19=0,0,((D19/C19)*100)-100) -> 7.41 | L19: =IF(D19=0,0,IF(E19=0,0,((D19/E19)*100)-100)) -> -7.75 | M19: =IF(G19=0,0,((D19/G19)*100)-100) -> 24.24 | N19: =IF(H19=0,0,((D19/H19)*100)-100) -> 57.01 | O19: =IF(D19=0,0,IF(I19=0,0,((D19/I19)*100)-100)) -> 0 | Q19: 1950000 | R19: =IF(D19=0,0,((D19/Q19)*100)-100) -> 7.41 | S19: =IF(D19=0,0,(D19/$D$44)*100) -> 2.07 | U19: 18.25 | V19: 0 | W19: =V19-U19 -> -18.25
A20: Campo Largo | C20: 2700000 | D20: 2876004 | E20: 3120050 | G20: 753845 | H20: 0 | I20: 0 | K20: =IF(C20=0,0,((D20/C20)*100)-100) -> 6.52 | L20: =IF(D20=0,0,IF(E20=0,0,((D20/E20)*100)-100)) -> -7.82 | M20: =IF(G20=0,0,((D20/G20)*100)-100) -> 281.51 | N20: =IF(H20=0,0,((D20/H20)*100)-100) -> 0 | O20: =IF(D20=0,0,IF(I20=0,0,((D20/I20)*100)-100)) -> 0 | Q20: 2700000 | R20: =IF(D20=0,0,((D20/Q20)*100)-100) -> 6.52 | S20: =IF(D20=0,0,(D20/$D$44)*100) -> 2.85 | U20: 17 | V20: 0 | W20: =V20-U20 -> -17
A21: Brasilia | C21: 2460000 | D21: 2503405 | E21: 2726571 | G21: 995631 | H21: 774551 | I21: 644754 | K21: =IF(C21=0,0,((D21/C21)*100)-100) -> 1.76 | L21: =IF(D21=0,0,IF(E21=0,0,((D21/E21)*100)-100)) -> -8.18 | M21: =IF(G21=0,0,((D21/G21)*100)-100) -> 151.44 | N21: =IF(H21=0,0,((D21/H21)*100)-100) -> 223.21 | O21: =IF(D21=0,0,IF(I21=0,0,((D21/I21)*100)-100)) -> 288.27 | Q21: 2460000 | R21: =IF(D21=0,0,((D21/Q21)*100)-100) -> 1.76 | S21: =IF(D21=0,0,(D21/$D$44)*100) -> 2.48 | U21: 16.7 | V21: 0 | W21: =V21-U21 -> -16.7
A22: Total Super | C22: =SUM(C7:C21) -> 35527000 | D22: =SUM(D7:D21) -> 35046982 | E22: =SUM(E7:E21) -> 38835070 | G22: =SUM(G7:G21) -> 28957689 | H22: =SUM(H7:H21) -> 21187279 | I22: =SUM(I7:I21) -> 18176414 | J22: =SUM(C22:I22) -> 177730434 | K22: =IF(D22=0,0,((D22/C22)*100)-100) -> -1.35 | L22: =IF(D22=0,0,IF(E22=0,0,((D22/E22)*100)-100)) -> -9.75 | M22: =IF(G22=0,0,IF(D22=0,0,((D22/G22)*100)-100)) -> 21.03 | N22: =IF(H22=0,0,IF(D22=0,0,((D22/H22)*100)-100)) -> 65.42 | O22: =IF(D22=0,0,IF(I22=0,0,((D22/I22)*100)-100)) -> 92.82 | Q22: =SUM(Q7:Q21) -> 35527000 | R22: =IF(D22=0,0,((D22/Q22)*100)-100) -> -1.35 | S22: =IF(D22=0,0,(D22/$D$44)*100) -> 34.7 | U22: 17.07 | V22: 0 | W22: =V22-U22 -> -17.07
A24: Pinheirinho | C24: 4470000 | D24: 4579250 | E24: 4921043 | G24: 3919425 | H24: 2927977 | I24: 2161332 | K24: =IF(C24=0,0,((D24/C24)*100)-100) -> 2.44 | L24: =IF(D24=0,0,IF(E24=0,0,((D24/E24)*100)-100)) -> -6.95 | M24: =IF(G24=0,0,((D24/G24)*100)-100) -> 16.83 | N24: =IF(H24=0,0,((D24/H24)*100)-100) -> 56.4 | O24: =IF(D24=0,0,IF(I24=0,0,((D24/I24)*100)-100)) -> 111.87 | Q24: 4470000 | R24: =IF(D24=0,0,IF(Q24=0,0,((D24/Q24)*100)-100)) -> 2.44 | S24: =IF(D24=0,0,(D24/$D$44)*100) -> 4.53 | U24: 15.5 | V24: 0 | W24: =V24-U24 -> -15.5
A25: Londrina | C25: 3550000 | D25: 3472147 | E25: 3539472 | G25: 3392289 | H25: 2510656 | I25: 2794054 | K25: =IF(C25=0,0,((D25/C25)*100)-100) -> -2.19 | L25: =IF(D25=0,0,IF(E25=0,0,((D25/E25)*100)-100)) -> -1.9 | M25: =IF(G25=0,0,((D25/G25)*100)-100) -> 2.35 | N25: =IF(H25=0,0,((D25/H25)*100)-100) -> 38.3 | O25: =IF(D25=0,0,IF(I25=0,0,((D25/I25)*100)-100)) -> 24.27 | Q25: 3550000 | R25: =IF(D25=0,0,IF(Q25=0,0,((D25/Q25)*100)-100)) -> -2.19 | S25: =IF(D25=0,0,(D25/$D$44)*100) -> 3.44 | U25: 16.96 | V25: 0 | W25: =V25-U25 -> -16.96
A26: So Brz | C26: 4950000 | D26: 5050091 | E26: 5189182 | G26: 4574869 | H26: 3060707 | I26: 2889687 | K26: =IF(C26=0,0,((D26/C26)*100)-100) -> 2.02 | L26: =IF(D26=0,0,IF(E26=0,0,((D26/E26)*100)-100)) -> -2.68 | M26: =IF(G26=0,0,((D26/G26)*100)-100) -> 10.39 | N26: =IF(H26=0,0,((D26/H26)*100)-100) -> 65 | O26: =IF(D26=0,0,IF(I26=0,0,((D26/I26)*100)-100)) -> 74.76 | Q26: 4950000 | R26: =IF(D26=0,0,IF(Q26=0,0,((D26/Q26)*100)-100)) -> 2.02 | S26: =IF(D26=0,0,(D26/$D$44)*100) -> 5 | U26: 15.5 | V26: 0 | W26: =V26-U26 -> -15.5
A27: S.J. Pinhais | C27: 5520000 | D27: 5556269 | E27: 5686817 | G27: 5015191 | H27: 3871884 | I27: 3863756 | K27: =IF(C27=0,0,((D27/C27)*100)-100) -> 0.66 | L27: =IF(D27=0,0,IF(E27=0,0,((D27/E27)*100)-100)) -> -2.3 | M27: =IF(G27=0,0,((D27/G27)*100)-100) -> 10.79 | N27: =IF(H27=0,0,((D27/H27)*100)-100) -> 43.5 | O27: =IF(D27=0,0,IF(I27=0,0,((D27/I27)*100)-100)) -> 43.8 | Q27: 5520000 | R27: =IF(D27=0,0,IF(Q27=0,0,((D27/Q27)*100)-100)) -> 0.66 | S27: =IF(D27=0,0,(D27/$D$44)*100) -> 5.5 | U27: 16 | V27: 0 | W27: =V27-U27 -> -16
A28: P.G. Nova | C28: 4975000 | D28: 4417916 | E28: 4936290 | G28: 4636630 | H28: 3614962 | I28: 3380907 | K28: =IF(C28=0,0,((D28/C28)*100)-100) -> -11.2 | L28: =IF(D28=0,0,IF(E28=0,0,((D28/E28)*100)-100)) -> -10.5 | M28: =IF(G28=0,0,((D28/G28)*100)-100) -> -4.72 | N28: =IF(H28=0,0,((D28/H28)*100)-100) -> 22.21 | O28: =IF(D28=0,0,IF(I28=0,0,((D28/I28)*100)-100)) -> 30.67 | Q28: 4975000 | R28: =IF(D28=0,0,IF(Q28=0,0,((D28/Q28)*100)-100)) -> -11.2 | S28: =IF(D28=0,0,(D28/$D$44)*100) -> 4.37 | U28: 16.2 | V28: 0 | W28: =V28-U28 -> -16.2
A29: Nilo Pecanha | C29: 11800000 | D29: 12394358 | E29: 12872895 | G29: 11028641 | H29: 9125972 | I29: 8689542 | K29: =IF(C29=0,0,((D29/C29)*100)-100) -> 5.04 | L29: =IF(D29=0,0,IF(E29=0,0,((D29/E29)*100)-100)) -> -3.72 | M29: =IF(G29=0,0,((D29/G29)*100)-100) -> 12.38 | N29: =IF(H29=0,0,((D29/H29)*100)-100) -> 35.81 | O29: =IF(D29=0,0,IF(I29=0,0,((D29/I29)*100)-100)) -> 42.64 | Q29: 11800000 | R29: =IF(D29=0,0,IF(Q29=0,0,((D29/Q29)*100)-100)) -> 5.04 | S29: =IF(D29=0,0,(D29/$D$44)*100) -> 12.27 | U29: 16 | V29: 0 | W29: =V29-U29 -> -16
A30: Champagnat | C30: 6800000 | D30: 7036973 | E30: 7250649 | G30: 6235692 | H30: 5435231 | I30: 5375900 | K30: =IF(C30=0,0,((D30/C30)*100)-100) -> 3.48 | L30: =IF(D30=0,0,IF(E30=0,0,((D30/E30)*100)-100)) -> -2.95 | M30: =IF(G30=0,0,((D30/G30)*100)-100) -> 12.85 | N30: =IF(H30=0,0,((D30/H30)*100)-100) -> 29.47 | O30: =IF(D30=0,0,IF(I30=0,0,((D30/I30)*100)-100)) -> 30.9 | Q30: 6800000 | R30: =IF(D30=0,0,IF(Q30=0,0,((D30/Q30)*100)-100)) -> 3.48 | S30: =IF(D30=0,0,(D30/$D$44)*100) -> 6.97 | U30: 16.5 | V30: 0 | W30: =V30-U30 -> -16.5
A31: Santa Candida | C31: 5950000 | D31: 6620332 | E31: 6696898 | G31: 5143629 | H31: 4034522 | I31: 3905400 | K31: =IF(C31=0,0,((D31/C31)*100)-100) -> 11.27 | L31: =IF(D31=0,0,IF(E31=0,0,((D31/E31)*100)-100)) -> -1.14 | M31: =IF(G31=0,0,((D31/G31)*100)-100) -> 28.71 | N31: =IF(H31=0,0,((D31/H31)*100)-100) -> 64.09 | O31: =IF(D31=0,0,IF(I31=0,0,((D31/I31)*100)-100)) -> 69.52 | Q31: 5950000 | R31: =IF(D31=0,0,IF(Q31=0,0,((D31/Q31)*100)-100)) -> 11.27 | S31: =IF(D31=0,0,(D31/$D$44)*100) -> 6.56 | U31: 15.6 | V31: 0 | W31: =V31-U31 -> -15.6
A32: Paranagu Raia | C32: 6600000 | D32: 6627906 | E32: 6998531 | G32: 5837413 | H32: 4566930 | I32: 4175921 | K32: =IF(C32=0,0,((D32/C32)*100)-100) -> 0.42 | L32: =IF(D32=0,0,IF(E32=0,0,((D32/E32)*100)-100)) -> -5.3 | M32: =IF(G32=0,0,((D32/G32)*100)-100) -> 13.54 | N32: =IF(H32=0,0,((D32/H32)*100)-100) -> 45.13 | O32: =IF(D32=0,0,IF(I32=0,0,((D32/I32)*100)-100)) -> 58.72 | Q32: 6600000 | R32: =IF(D32=0,0,IF(Q32=0,0,((D32/Q32)*100)-100)) -> 0.42 | S32: =IF(D32=0,0,(D32/$D$44)*100) -> 6.56 | U32: 18.1 | V32: 0 | W32: =V32-U32 -> -18.1
A33: Torres | C33: 5300000 | D33: 5090388 | E33: 5053086 | G33: 0 | H33: 0 | I33: 0 | K33: =IF(C33=0,0,((D33/C33)*100)-100) -> -3.95 | L33: =IF(D33=0,0,IF(E33=0,0,((D33/E33)*100)-100)) -> 0.74 | M33: =IF(G33=0,0,((D33/G33)*100)-100) -> 0 | N33: =IF(H33=0,0,((D33/H33)*100)-100) -> 0 | O33: =IF(D33=0,0,IF(I33=0,0,((D33/I33)*100)-100)) -> 0 | Q33: 5300000 | R33: =IF(D33=0,0,IF(Q33=0,0,((D33/Q33)*100)-100)) -> -3.95 | S33: =IF(D33=0,0,(D33/$D$44)*100) -> 5.04 | U33: 15.96 | V33: 0 | W33: =V33-U33 -> -15.96
A34: Total Hiper | C34: =SUM(C24:C33) -> 59915000 | D34: =SUM(D24:D33) -> 60845630 | E34: =SUM(E24:E33) -> 63144863 | G34: =SUM(G24:G33) -> 49783779 | H34: =SUM(H24:H33) -> 39148841 | I34: =SUM(I24:I33) -> 37236499 | J34: =SUM(C34:I34) -> 310074612 | K34: =IF(D34=0,0,((D34/C34)*100)-100) -> 1.55 | L34: =IF(D34=0,0,IF(E34=0,0,((D34/E34)*100)-100)) -> -3.64 | M34: =IF(G34=0,0,IF(D34=0,0,((D34/G34)*100)-100)) -> 22.22 | N34: =IF(H34=0,0,IF(D34=0,0,((D34/H34)*100)-100)) -> 55.42 | O34: =IF(D34=0,0,IF(I34=0,0,((D34/I34)*100)-100)) -> 63.4 | Q34: =SUM(Q24:Q33) -> 59915000 | R34: =IF(D34=0,0,((D34/Q34)*100)-100) -> 1.55 | S34: =IF(D34=0,0,(D34/$D$44)*100) -> 60.25 | U34: 16.24 | V34: 0 | W34: =V34-U34 -> -16.24
A36: Total s/ 27, 32 | B36: =B22+B34 -> 0 | C36: =C22+C34 -> 95442000 | D36: =D22+D34 -> 95892612 | E36: =E22+E34 -> 101979933 | F36: =F22+F34 -> 0 | G36: =G22+G34 -> 78741468 | H36: =H22+H34 -> 60336120 | I36: =I22+I34 -> 55412913 | J36: =SUM(C36:I36) -> 487805046 | K36: =IF(D36=0,0,((D36/C36)*100)-100) -> 0.47 | L36: =IF(D36=0,0,IF(E36=0,0,((D36/E36)*100)-100)) -> -5.97 | M36: =IF(G36=0,0,IF(D36=0,0,((D36/G36)*100)-100)) -> 21.78 | N36: =IF(H36=0,0,IF(D36=0,0,((D36/H36)*100)-100)) -> 58.93 | O36: =IF(D36=0,0,IF(I36=0,0,((D36/I36)*100)-100)) -> 73.05 | Q36: =Q22+Q34 -> 95442000 | R36: =IF(D36=0,0,((D36/Q36)*100)-100) -> 0.47 | S36: =IF(D36=0,0,(D36/$D$44)*100) -> 94.95 | U36: 16.55 | V36: 0 | W36: =V36-U36 -> -16.55
A38: Campo Largo | C38: 0 | D38: 0 | E38: 0 | G38: 0 | H38: 0 | I38: 0 | K38: =IF(C38=0,0,((D38/C38)*100)-100) -> 0 | L38: =IF(D38=0,0,IF(E38=0,0,((D38/E38)*100)-100)) -> 0 | M38: =IF(G38=0,0,((D38/G38)*100)-100) -> 0 | N38: =IF(H38=0,0,((D38/H38)*100)-100) -> 0 | O38: =IF(D38=0,0,IF(I38=0,0,((D38/I38)*100)-100)) -> 0 | Q38: 0 | R38: =IF(Q38=0,0,IF(D38=0,0,((D38/Q38)*100)-100)) -> 0 | S38: =IF(D38=0,0,(D38/$D$44)*100) -> 0 | U38: 0 | V38: 0 | W38: =V38-U38 -> 0
A39: Uvaranas | C39: 5800000 | D39: 5100419 | E39: 4100660 | G39: 0 | H39: 0 | I39: 0 | K39: =IF(C39=0,0,((D39/C39)*100)-100) -> -12.06 | L39: =IF(D39=0,0,IF(E39=0,0,((D39/E39)*100)-100)) -> 24.38 | M39: =IF(G39=0,0,((D39/G39)*100)-100) -> 0 | N39: =IF(H39=0,0,((D39/H39)*100)-100) -> 0 | O39: =IF(D39=0,0,IF(I39=0,0,((D39/I39)*100)-100)) -> 0 | Q39: 5800000 | R39: =IF(Q39=0,0,IF(D39=0,0,((D39/Q39)*100)-100)) -> -12.06 | S39: =IF(D39=0,0,(D39/$D$44)*100) -> 5.05 | U39: 13.5 | V39: 0 | W39: =V39-U39 -> -13.5
A40: Novo Mundo | C40: 0 | D40: 0 | E40: 0 | G40: 0 | H40: 0 | I40: 0 | K40: =IF(C40=0,0,((D40/C40)*100)-100) -> 0 | L40: =IF(D40=0,0,IF(E40=0,0,((D40/E40)*100)-100)) -> 0 | M40: =IF(G40=0,0,((D40/G40)*100)-100) -> 0 | N40: =IF(H40=0,0,((D40/H40)*100)-100) -> 0 | O40: =IF(D40=0,0,IF(I40=0,0,((D40/I40)*100)-100)) -> 0 | Q40: 0 | R40: =IF(Q40=0,0,IF(D40=0,0,((D40/Q40)*100)-100)) -> 0 | S40: =IF(D40=0,0,(D40/$D$44)*100) -> 0 | U40: 0 | V40: 0 | W40: =V40-U40 -> 0
A41: Torres | C41: 0 | D41: 0 | E41: 0 | G41: 0 | H41: 0 | I41: 0 | K41: =IF(C41=0,0,((D41/C41)*100)-100) -> 0 | L41: =IF(D41=0,0,IF(E41=0,0,((D41/E41)*100)-100)) -> 0 | M41: =IF(G41=0,0,((D41/G41)*100)-100) -> 0 | N41: =IF(H41=0,0,((D41/H41)*100)-100) -> 0 | O41: =IF(D41=0,0,IF(I41=0,0,((D41/I41)*100)-100)) -> 0 | Q41: 0 | R41: =IF(Q41=0,0,IF(D41=0,0,((D41/Q41)*100)-100)) -> 0 | S41: =IF(D41=0,0,(D41/$D$44)*100) -> 0 | U41: 0 | V41: 0 | W41: =V41-U41 -> 0
A42: Total Lojas Novas | C42: =SUM(C38:C41) -> 5800000 | D42: =SUM(D38:D41) -> 5100419 | E42: =SUM(E38:E41) -> 4100660 | G42: =SUM(G38:G41) -> 0 | H42: =SUM(H38:H41) -> 0 | I42: =SUM(I38:I41) -> 0 | K42: =IF(D42=0,0,((D42/C42)*100)-100) -> -12.06 | L42: =IF(D42=0,0,IF(E42=0,0,((D42/E42)*100)-100)) -> 24.38 | M42: =IF(G42=0,0,IF(D42=0,0,((D42/G42)*100)-100)) -> 0 | N42: =IF(H42=0,0,IF(D42=0,0,((D42/H42)*100)-100)) -> 0 | O42: =IF(D42=0,0,IF(I42=0,0,((D42/I42)*100)-100)) -> 0 | Q42: =SUM(Q38:Q41) -> 5800000 | R42: =IF(Q42=0,0,IF(D42=0,0,((D42/Q42)*100)-100)) -> -12.06 | S42: =IF(D42=0,0,(D42/$D$44)*100) -> 5.05
A44: Total Geral | C44: =C22+C34+C42 -> 101242000 | D44: =D22+D34+D42 -> 100993031 | E44: =E22+E34+E42 -> 106080593 | G44: =G22+G34+G42 -> 78741468 | H44: =H22+H34+H42 -> 60336120 | I44: =I22+I34+I42 -> 55412913 | K44: =IF(D44=0,0,((D44/C44)*100)-100) -> -0.25 | L44: =IF(D44=0,0,IF(E44=0,0,((D44/E44)*100)-100)) -> -4.8 | M44: =IF(G44=0,0,IF(D44=0,0,((D44/G44)*100)-100)) -> 28.26 | N44: =IF(H44=0,0,IF(D44=0,0,((D44/H44)*100)-100)) -> 67.38 | O44: =IF(D44=0,0,IF(I44=0,0,((D44/I44)*100)-100)) -> 82.26 | Q44: =Q22+Q34+Q42 -> 101242000 | R44: =IF(D44=0,0,((D44/Q44)*100)-100) -> -0.25 | S44: =S22+S34+S42 -> 100 | U44: 16.37 | V44: 0 | W44: =V44-U44 -> -16.37
C45: Resumo por Regiao - Outubro/2002
C46: Descricao das Aberturas | H46: Valor | I46: % | M46: Margem Comercial | R46: Meta | S46: Real | U46: Dif
C47: Curitiba (3,6,7,10,11,13,17,21,22,24,26,27,28,34) | H47: 54012830 | I47: =IF(D44=0,0,H47/$D$44) -> 0.53480000000000005 | L47: 99 | M47: Empresa | R47: 0 | S47: 0 | U47: =S47-R47 -> 0
C48: Curitiba e Metrop. (Ctba. 4,5,8,14,23,25;31) | H48: 74165353 | I48: =IF(D44=0,0,H48/$D$44) -> 0.73440000000000005 | L48: 207 | M48: Super | R48: 0 | S48: 0 | U48: =S48-R48 -> 0
C49: Metropolitana (4,5,8,14,23,25;31) | H49: 20152523 | I49: =IF(D44=0,0,H49/$D$44) -> 0.19950000000000001 | L49: 208 | M49: Hiper | R49: 0 | S49: 0 | U49: =S49-R49 -> 0
C50: Norte (9,15,20) | H50: =D25+D15+D18 -> 8718966 | I50: =IF(D44=0,0,H50/$D$44) -> 8.6300000000000002E-2 | L50: 204 | M50: Regional Gilberto | R50: 0 | S50: 0 | U50: =S50-R50 -> 0
C51: Ponta Grossa (18,19,32) | H51: =D17+D28+D39 -> 12470163 | I51: =IF(D44=0,0,H51/$D$44) -> 0.1235 | L51: 205 | M51: Regional Edison | R51: 0 | S51: 0 | U51: =S51-R51 -> 0
C52: Super (3,4,5,7,8,10,13,15,17,18,20,23,26,28,34) | H52: 35046982 | I52: =IF(D44=0,0,H52/$D$44) -> 0.34699999999999998 | L52: 206 | M52: Regional Jorge | R52: 0 | S52: 0 | U52: =S52-R52 -> 0
C53: Hiper (6,9,11,14,19,21,22,24,25,26,27) | H53: 60845630 | I53: =IF(D44=0,0,H53/$D$44) -> 0.60250000000000004 | L53: 209 | M53: Regio - Curitiba | R53: 0 | S53: 0 | U53: =S53-R53 -> 0
C54: Curitiba, Metropolitana e Ponta Grossa | H54: =D44-H50 -> 92274065 | I54: =IF(D44=0,0,H54/$D$44) -> 0.91369999999999996 | L54: 200 | M54: Regio - Metropolitana | R54: 0 | S54: 0 | U54: =S54-R54 -> 0
C55: Araucaria | H55: =D9+D19 -> 3325138 | I55: =IF(D44=0,0,H55/$D$44) -> 3.2899999999999999E-2 | L55: 201 | M55: Regio - Centro Oeste | R55: 0 | S55: 0 | U55: =S55-R55 -> 0