A2: Perodo: | C2: 37865 | E2: 37894 | H2: Vendas Acumuladas por Filial
C4: Vendas 2003 | G4: Vendas de Anos Anteriores | K4: Percentuais ( % ) | R4: %
A5: Lojas | C5: Previso | D5: Realizada | E5: Ms Anterior | G5: Vendas 2002 | H5: Vendas 2001 | I5: Vendas 2000 | K5: % Prev | L5: % MA | M5: 2002 | N5: 2001 | O5: 2000 | Q5: Previso Ms | R5: Final | S5: Part.
A7: Xaxim | C7: 690000 | D7: 766645.81 | E7: 748518.01 | G7: 512842.5 | H7: 528023.1 | I7: 525356.6 | K7: =IF(C7=0,0,((D7/C7)*100)-100) -> 11.11 | L7: =IF(E7=0,0,((D7/E7)*100)-100) -> 2.42 | M7: =IF(G7=0,0,((D7/G7)*100)-100) -> 49.49 | N7: =IF(H7=0,0,((D7/H7)*100)-100) -> 45.19 | O7: =IF(I7=0,0,((D7/I7)*100)-100) -> 45.93 | Q7: 690000 | R7: =((D7/Q7)*100)-100 -> 11.11 | S7: =D7/$D$31*100 -> 1.84
A8: S. Felicidade | C8: 740000 | D8: 725570.5 | E8: 788451.38 | G8: 574370.57 | H8: 557863.11 | I8: 588255.33 | K8: =IF(C8=0,0,((D8/C8)*100)-100) -> -1.95 | L8: =IF(E8=0,0,((D8/E8)*100)-100) -> -7.98 | M8: =IF(G8=0,0,((D8/G8)*100)-100) -> 26.32 | N8: =IF(H8=0,0,((D8/H8)*100)-100) -> 30.06 | O8: =IF(I8=0,0,((D8/I8)*100)-100) -> 23.34 | Q8: 740000 | R8: =((D8/Q8)*100)-100 -> -1.95 | S8: =D8/$D$31*100 -> 1.74
A9: Lapa | C9: 950000 | D9: 1003326.57 | E9: 1083326.01 | G9: 795637.08 | H9: 762215.31 | I9: 647216.16 | K9: =IF(C9=0,0,((D9/C9)*100)-100) -> 5.61 | L9: =IF(E9=0,0,((D9/E9)*100)-100) -> -7.38 | M9: =IF(G9=0,0,((D9/G9)*100)-100) -> 26.1 | N9: =IF(H9=0,0,((D9/H9)*100)-100) -> 31.63 | O9: =IF(I9=0,0,((D9/I9)*100)-100) -> 55.02 | Q9: 950000 | R9: =((D9/Q9)*100)-100 -> 5.61 | S9: =D9/$D$31*100 -> 2.4
A10: Araucria | C10: 1060000 | D10: 977420.80000000005 | E10: 1038785.32 | G10: 852788.05 | H10: 1480031.37 | I10: 1369777.41 | K10: =IF(C10=0,0,((D10/C10)*100)-100) -> -7.79 | L10: =IF(E10=0,0,((D10/E10)*100)-100) -> -5.91 | M10: =IF(G10=0,0,((D10/G10)*100)-100) -> 14.61 | N10: =IF(H10=0,0,((D10/H10)*100)-100) -> -33.96 | O10: =IF(I10=0,0,((D10/I10)*100)-100) -> -28.64 | Q10: 1060000 | R10: =((D10/Q10)*100)-100 -> -7.79 | S10: =D10/$D$31*100 -> 2.34
A11: Pinheirinho | C11: 1800000 | D11: 1783678.96 | E11: 1845777.71 | G11: 1604252.19 | H11: 1909488.94 | I11: 1557483.22 | K11: =IF(C11=0,0,((D11/C11)*100)-100) -> -00.91 | L11: =IF(E11=0,0,((D11/E11)*100)-100) -> -3.36 | M11: =IF(G11=0,0,((D11/G11)*100)-100) -> 11.18 | N11: =IF(H11=0,0,((D11/H11)*100)-100) -> -6.59 | O11: =IF(I11=0,0,((D11/I11)*100)-100) -> 14.52 | Q11: 1800000 | R11: =((D11/Q11)*100)-100 -> -00.91 | S11: =D11/$D$31*100 -> 4.27
A12: Hauer | C12: 2850000 | D12: 2898463.45 | E12: 3104644.25 | G12: 2339963.44 | H12: 2291700.1 | I12: 2052426.56 | K12: =IF(C12=0,0,((D12/C12)*100)-100) -> 1.7 | L12: =IF(E12=0,0,((D12/E12)*100)-100) -> -6.64 | M12: =IF(G12=0,0,((D12/G12)*100)-100) -> 23.87 | N12: =IF(H12=0,0,((D12/H12)*100)-100) -> 26.48 | O12: =IF(I12=0,0,((D12/I12)*100)-100) -> 41.22 | Q12: 2850000 | R12: =((D12/Q12)*100)-100 -> 1.7 | S12: =D12/$D$31*100 -> 6.95
A13: Paranagu | C13: 2900000 | D13: 2949277.7 | E13: 3184960.35 | G13: 2655929.07 | H13: 2479174.88 | I13: 1866638.09 | K13: =IF(C13=0,0,((D13/C13)*100)-100) -> 1.7 | L13: =IF(E13=0,0,((D13/E13)*100)-100) -> -7.4 | M13: =IF(G13=0,0,((D13/G13)*100)-100) -> 11.05 | N13: =IF(H13=0,0,((D13/H13)*100)-100) -> 18.96 | O13: =IF(I13=0,0,((D13/I13)*100)-100) -> 58 | Q13: 2900000 | R13: =((D13/Q13)*100)-100 -> 1.7 | S13: =D13/$D$31*100 -> 7.07
A14: Centenrio | C14: 900000 | D14: 968754.95 | E14: 954057.59 | G14: 698903.5 | H14: 693192.16 | I14: 665325.79 | K14: =IF(C14=0,0,((D14/C14)*100)-100) -> 7.64 | L14: =IF(E14=0,0,((D14/E14)*100)-100) -> 1.54 | M14: =IF(G14=0,0,((D14/G14)*100)-100) -> 38.61 | N14: =IF(H14=0,0,((D14/H14)*100)-100) -> 39.75 | O14: =IF(I14=0,0,((D14/I14)*100)-100) -> 45.61 | Q14: 900000 | R14: =((D14/Q14)*100)-100 -> 7.64 | S14: =D14/$D$31*100 -> 2.32
A15: So Brz | C15: 2950000 | D15: 2929932.44 | E15: 3259268.54 | G15: 2357537.11 | H15: 2349188.83 | I15: 2115793.64 | K15: =IF(C15=0,0,((D15/C15)*100)-100) -> -00.68 | L15: =IF(E15=0,0,((D15/E15)*100)-100) -> -10.1 | M15: =IF(G15=0,0,((D15/G15)*100)-100) -> 24.28 | N15: =IF(H15=0,0,((D15/H15)*100)-100) -> 24.72 | O15: =IF(I15=0,0,((D15/I15)*100)-100) -> 38.48 | Q15: 2950000 | R15: =((D15/Q15)*100)-100 -> -00.68 | S15: =D15/$D$31*100 -> 7.02
A16: Arapongas | C16: 550000 | D16: 567546.12 | E16: 595417.74 | G16: 444293.95 | H16: 508341.52 | I16: 524613.57 | K16: =IF(C16=0,0,((D16/C16)*100)-100) -> 3.19 | L16: =IF(E16=0,0,((D16/E16)*100)-100) -> -4.68 | M16: =IF(G16=0,0,((D16/G16)*100)-100) -> 27.74 | N16: =IF(H16=0,0,((D16/H16)*100)-100) -> 11.65 | O16: =IF(I16=0,0,((D16/I16)*100)-100) -> 8.18 | Q16: 550000 | R16: =((D16/Q16)*100)-100 -> 3.19 | S16: =D16/$D$31*100 -> 1.36
A17: Guarapuava | C17: 1300000 | D17: 1198167.57 | E17: 1308299.53 | G17: 841242.05 | H17: 834466.24 | I17: 880725.81 | K17: =IF(C17=0,0,((D17/C17)*100)-100) -> -7.83 | L17: =IF(E17=0,0,((D17/E17)*100)-100) -> -8.42 | M17: =IF(G17=0,0,((D17/G17)*100)-100) -> 42.43 | N17: =IF(H17=0,0,((D17/H17)*100)-100) -> 43.58 | O17: =IF(I17=0,0,((D17/I17)*100)-100) -> 36.04 | Q17: 1300000 | R17: =((D17/Q17)*100)-100 -> -7.83 | S17: =D17/$D$31*100 -> 2.87
A18: Apucarana | C18: 1320000 | D18: 1349913.73 | E18: 1407605.33 | G18: 1045434.26 | H18: 1054989.69 | I18: 1236656.09 | K18: =IF(C18=0,0,((D18/C18)*100)-100) -> 2.27 | L18: =IF(E18=0,0,((D18/E18)*100)-100) -> -4.1 | M18: =IF(G18=0,0,((D18/G18)*100)-100) -> 29.12 | N18: =IF(H18=0,0,((D18/H18)*100)-100) -> 27.96 | O18: =IF(I18=0,0,((D18/I18)*100)-100) -> 9.16 | Q18: 1320000 | R18: =((D18/Q18)*100)-100 -> 2.27 | S18: =D18/$D$31*100 -> 3.23
A19: Ah | C19: 1250000 | D19: 1250461.24 | E19: 1321358.24 | G19: 957903.73 | H19: 1191352.53 | I19: 1070537.52 | K19: =IF(C19=0,0,((D19/C19)*100)-100) -> 00.04 | L19: =IF(E19=0,0,((D19/E19)*100)-100) -> -5.37 | M19: =IF(G19=0,0,((D19/G19)*100)-100) -> 30.54 | N19: =IF(H19=0,0,((D19/H19)*100)-100) -> 4.96 | O19: =IF(I19=0,0,((D19/I19)*100)-100) -> 16.81 | Q19: 1250000 | R19: =((D19/Q19)*100)-100 -> 00.04 | S19: =D19/$D$31*100 -> 3
A20: P.G. Centro | C20: 1650000 | D20: 1621539.08 | E20: 1667495.19 | G20: 1262065.82 | H20: 1078020.82 | I20: 1278585.57 | K20: =IF(C20=0,0,((D20/C20)*100)-100) -> -1.72 | L20: =IF(E20=0,0,((D20/E20)*100)-100) -> -2.76 | M20: =IF(G20=0,0,((D20/G20)*100)-100) -> 28.48 | N20: =IF(H20=0,0,((D20/H20)*100)-100) -> 50.42 | O20: =IF(I20=0,0,((D20/I20)*100)-100) -> 26.82 | Q20: 1650000 | R20: =((D20/Q20)*100)-100 -> -1.72 | S20: =D20/$D$31*100 -> 3.89
A21: Maring | C21: 2050000 | D21: 2148664.18 | E21: 2125876.06 | G21: 1660091.86 | H21: 1504599.83 | I21: 1569200.63 | K21: =IF(C21=0,0,((D21/C21)*100)-100) -> 4.81 | L21: =IF(E21=0,0,((D21/E21)*100)-100) -> 1.07 | M21: =IF(G21=0,0,((D21/G21)*100)-100) -> 29.43 | N21: =IF(H21=0,0,((D21/H21)*100)-100) -> 42.81 | O21: =IF(I21=0,0,((D21/I21)*100)-100) -> 36.93 | Q21: 2050000 | R21: =((D21/Q21)*100)-100 -> 4.81 | S21: =D21/$D$31*100 -> 5.15
A22: Araucria Nova | C22: 1870000 | D22: 1771505.39 | E22: 1999164 | G22: 1838722.52 | H22: 0 | I22: 0 | K22: =IF(C22=0,0,((D22/C22)*100)-100) -> -5.27 | L22: =IF(E22=0,0,((D22/E22)*100)-100) -> -11.39 | M22: =IF(G22=0,0,((D22/G22)*100)-100) -> -3.66 | N22: =IF(H22=0,0,((D22/H22)*100)-100) -> 0 | O22: =IF(I22=0,0,((D22/I22)*100)-100) -> 0 | Q22: 1870000 | R22: =((D22/Q22)*100)-100 -> -5.27 | S22: =D22/$D$31*100 -> 4.25
A23: Total Super | C23: =SUM(C7:C22) -> 24830000 | D23: =SUM(D7:D22) -> 24910868.489999998 | E23: =SUM(E7:E22) -> 26433005.25 | G23: =SUM(G7:G22) -> 20441977.699999999 | H23: =SUM(H7:H22) -> 19222648.43 | I23: =SUM(I7:I22) -> 17948591.989999998 | J23: =SUM(C23:I23) -> 133787091.86 | K23: =((D23/C23)*100)-100 -> 00.33 | L23: =IF(E23=0,0,((D23/E23)*100)-100) -> -5.76 | M23: =((D23/G23)*100)-100 -> 21.86 | N23: =((D23/H23)*100)-100 -> 29.59 | O23: =IF(I23=0,0,((D23/I23)*100)-100) -> 38.79 | Q23: =SUM(Q7:Q22) -> 24830000 | R23: =((D23/Q23)*100)-100 -> 00.33 | S23: =D23/$D$31*100 -> 59.7
A25: Londrina | C25: 2320000 | D25: 2267200.38 | E25: 2295834.75 | G25: 1824304.22 | H25: 1774414.47 | I25: 3810855.91 | K25: =IF(C25=0,0,((D25/C25)*100)-100) -> -2.28 | L25: =IF(E25=0,0,((D25/E25)*100)-100) -> -1.25 | M25: =IF(G25=0,0,((D25/G25)*100)-100) -> 24.28 | N25: =IF(H25=0,0,((D25/H25)*100)-100) -> 27.77 | O25: =IF(I25=0,0,((D25/I25)*100)-100) -> -40.51 | Q25: 2320000 | R25: =((D25/Q25)*100)-100 -> -2.28 | S25: =D25/$D$31*100 -> 5.43
A26: S.J. Pinhais | C26: 4000000 | D26: 3902807.35 | E26: 4216272.17 | G26: 3208817.47 | H26: 2908598.18 | I26: 1762813.19 | K26: =IF(C26=0,0,((D26/C26)*100)-100) -> -2.43 | L26: =IF(E26=0,0,((D26/E26)*100)-100) -> -7.43 | M26: =IF(G26=0,0,((D26/G26)*100)-100) -> 21.63 | N26: =IF(H26=0,0,((D26/H26)*100)-100) -> 34.18 | O26: =IF(I26=0,0,((D26/I26)*100)-100) -> 121.4 | Q26: 4000000 | R26: =((D26/Q26)*100)-100 -> -2.43 | S26: =D26/$D$31*100 -> 9.35
A27: P.G. Nova | C27: 2950000 | D27: 2828673.94 | E27: 3036783.89 | G27: 2512924.78 | H27: 2263255.04 | I27: 1897972.39 | K27: =IF(C27=0,0,((D27/C27)*100)-100) -> -4.11 | L27: =IF(E27=0,0,((D27/E27)*100)-100) -> -6.85 | M27: =IF(G27=0,0,((D27/G27)*100)-100) -> 12.57 | N27: =IF(H27=0,0,((D27/H27)*100)-100) -> 24.98 | O27: =IF(I27=0,0,((D27/I27)*100)-100) -> 49.04 | Q27: 2950000 | R27: =((D27/Q27)*100)-100 -> -4.11 | S27: =D27/$D$31*100 -> 6.78
A28: Nilo Peanha | C28: 8200000 | D28: 7819661.1900000004 | E28: 8606903.0399999991 | G28: 6020614.7300000004 | H28: 0 | I28: 0 | K28: =IF(C28=0,0,((D28/C28)*100)-100) -> -4.64 | L28: =IF(E28=0,0,((D28/E28)*100)-100) -> -9.15 | M28: =IF(G28=0,0,((D28/G28)*100)-100) -> 29.88 | N28: =IF(H28=0,0,((D28/H28)*100)-100) -> 0 | O28: =IF(I28=0,0,((D28/I28)*100)-100) -> 0 | Q28: 8200000 | R28: =((D28/Q28)*100)-100 -> -4.64 | S28: =D28/$D$31*100 -> 18.74
A29: Total Hiper | C29: =SUM(C25:C28) -> 17470000 | D29: =SUM(D25:D28) -> 16818342.859999999 | E29: =SUM(E25:E28) -> 18155793.850000001 | G29: =SUM(G25:G28) -> 13566661.199999999 | H29: =SUM(H25:H28) -> 6946267.6900000004 | I29: =SUM(I25:I28) -> 7471641.4900000002 | J29: =SUM(C29:I29) -> 80428707.090000004 | K29: =((D29/C29)*100)-100 -> -3.73 | L29: =IF(E29=0,0,((D29/E29)*100)-100) -> -7.37 | M29: =((D29/G29)*100)-100 -> 23.97 | N29: =((D29/H29)*100)-100 -> 142.12 | O29: =IF(I29=0,0,((D29/I29)*100)-100) -> 125.1 | Q29: =SUM(Q25:Q28) -> 17470000 | R29: =((D29/Q29)*100)-100 -> -3.73 | S29: =D29/$D$31*100 -> 40.3
A31: Total Geral | C31: =C23+C29 -> 42300000 | D31: =D23+D29 -> 41729211.350000001 | E31: =E23+E29 -> 44588799.100000001 | G31: =G23+G29 -> 34008638.899999999 | H31: =H23+H29 -> 26168916.120000001 | I31: =I23+I29 -> 25420233.48 | K31: =((D31/C31)*100)-100 -> -1.35 | L31: =IF(E31=0,0,((D31/E31)*100)-100) -> -6.41 | M31: =((D31/G31)*100)-100 -> 22.7 | N31: =((D31/H31)*100)-100 -> 59.46 | O31: =IF(I31=0,0,((D31/I31)*100)-100) -> 64.16 | Q31: =Q23+Q29 -> 42300000 | R31: =((D31/Q31)*100)-100 -> -1.35 | S31: =S23+S29 -> 100
C32: Resumo por Regio - Outubro/2002
C33: Descrio das Aberturas | H33: Valor | I33: %
C34: Curitiba (2,3,6,7,10,11,17,21) | H34: =D7+D8+D11+D12+D14+D15+D19+D28 -> 19143169 | I34: =H34/$D$31 -> 0.4587
C35: Curitiba e Metrop. (Ctba. 4,5,8,14,23) | H35: =H34+D9+D10+D13+D27+D22 -> 28673373 | I35: =H35/$D$31 -> 0.68710000000000004
C36: Metropolitana (4,5,8,14,23) | H36: =H35-H34 -> 9530204 | I36: =H36/$D$31 -> 0.22839999999999999
C37: Norte (9,12,15,20) | H37: =D25+D16+D18+D22 -> 5956166 | I37: =H37/$D$31 -> 0.14269999999999999
C38: Centro-Oeste (13,18,19) | H38: =D17+D20+D27 -> 5648381 | I38: =H38/$D$31 -> 0.13539999999999999
C39: Ponta Grossa (18,19) | H39: =H38-D17 -> 4450213 | I39: =H39/$D$31 -> 0.1066
C40: Super (2,3,4,5,6,7,8,10,11,12,13,15,17,18,20,23) | H40: =D23 -> 24910868 | I40: =H40/$D$31 -> 0.59699999999999998
C41: Hiper (9,14,19,21) | H41: =D29 -> 16818343 | I41: =H41/$D$31 -> 0.40300000000000002
C42: Curitiba, Metropolitana e Centro-Oeste | H42: =D31-H37 -> 35773045 | I42: =H42/$D$31 -> 0.85729999999999995
C43: Araucria | H43: =D10+D22 -> 2748926 | I43: =H43/$D$31 -> 6.59E-2