A2: Periodo: | B2: 40664 | C2: a | D2: 40694 | G2: Vendas Acumuladas por Filial | P2: =NOW() -> 40695.374712962963
A4: v.New | B4: Vendas 2011 | F4: Vendas de Anos Anteriores | J4: Percentuais ( % ) | P4: Meta Mensal | T4: Margem
A5: Lojas | B5: Previsao | C5: Realizada | D5: Mes Anterior | F5: Vendas 2010 | G5: Vendas 2009 | H5: Vendas 2008 | J5: % Prev | K5: % MA | L5: 2010 | M5: 2009 | N5: 2008 | P5: Previsao Mes | Q5: Final | R5: Part. | T5: Meta | U5: Coml | V5: Dif
A6: S. Felicidade | B6: 3200000 | C6: 3251365.77 | D6: 3870929.93 | F6: 3003895.11 | G6: 2629079.07 | H6: 2275547.47 | J6: =IF(B6=0,0,((C6/B6)*100)-100) -> 1.6051803125000106 | K6: =IF(C6=0,0,IF(D6=0,0,((C6/D6)*100)-100)) -> -16.005563810347766 | L6: =IF(F6=0,0,((C6/F6)*100)-100) -> 8.2383256051840021 | M6: =IF(G6=0,0,((C6/G6)*100)-100) -> 23.669379407443998 | N6: =IF(C6=0,0,IF(H6=0,0,((C6/H6)*100)-100)) -> 42.882792508828658 | P6: 3200000 | Q6: =IF(C6=0,0,((C6/P6)*100)-100) -> 1.6051803125000106 | R6: =IF(C6=0,0,(C6/$C$40)*100) -> 2.4244760941437304 | T6: 17.37 | U6: 16.453847045944634 | V6: =U6-T6 -> -0.91615295405536656
A7: Lapa | B7: 2400000 | C7: 2306031.65 | D7: 2984627.91 | F7: 2290071.47 | G7: 2072102.99 | H7: 1803861.92 | J7: =IF(B7=0,0,((C7/B7)*100)-100) -> -3.9153479166666614 | K7: =IF(C7=0,0,IF(D7=0,0,((C7/D7)*100)-100)) -> -22.73637721226028 | L7: =IF(F7=0,0,((C7/F7)*100)-100) -> 0.69692934081221836 | M7: =IF(G7=0,0,((C7/G7)*100)-100) -> 11.289432095264715 | N7: =IF(C7=0,0,IF(H7=0,0,((C7/H7)*100)-100)) -> 27.838590328465941 | P7: 2400000 | Q7: =IF(C7=0,0,((C7/P7)*100)-100) -> -3.9153479166666614 | R7: =IF(C7=0,0,(C7/$C$40)*100) -> 1.7195600259283721 | T7: 15.9 | U7: 15.268657865125137 | V7: =U7-T7 -> -0.63134213487486335
A8: Araucaria | B8: 1500000 | C8: 1432325.24 | D8: 1761097.86 | F8: 1366997.26 | G8: 1230651.76 | H8: 1125178.54 | J8: =IF(B8=0,0,((C8/B8)*100)-100) -> -4.511650666666668 | K8: =IF(C8=0,0,IF(D8=0,0,((C8/D8)*100)-100)) -> -18.668617313520571 | L8: =IF(F8=0,0,((C8/F8)*100)-100) -> 4.7789400836107063 | M8: =IF(G8=0,0,((C8/G8)*100)-100) -> 16.387534358216826 | N8: =IF(C8=0,0,IF(H8=0,0,((C8/H8)*100)-100)) -> 27.297596699631328 | P8: 1500000 | Q8: =IF(C8=0,0,((C8/P8)*100)-100) -> -4.511650666666668 | R8: =IF(C8=0,0,(C8/$C$40)*100) -> 1.0680552571046724 | T8: 16.79 | U8: 16.872501108756559 | V8: =U8-T8 -> 8.2501108756559915E-2
A9: Hauer | B9: 4250000 | C9: 3943610.71 | D9: 4512832.39 | F9: 3976926.65 | G9: 3822184.9 | H9: 3830362.7 | J9: =IF(B9=0,0,((C9/B9)*100)-100) -> -7.2091597647058876 | K9: =IF(C9=0,0,IF(D9=0,0,((C9/D9)*100)-100)) -> -12.613401757648703 | L9: =IF(F9=0,0,((C9/F9)*100)-100) -> -0.83773081406970107 | M9: =IF(G9=0,0,((C9/G9)*100)-100) -> 3.1768690729744691 | N9: =IF(C9=0,0,IF(H9=0,0,((C9/H9)*100)-100)) -> 2.9565871137999551 | P9: 4250000 | Q9: =IF(C9=0,0,((C9/P9)*100)-100) -> -7.2091597647058876 | R9: =IF(C9=0,0,(C9/$C$40)*100) -> 2.9406688042373603 | T9: 16.48 | U9: 15.721403208685372 | V9: =U9-T9 -> -0.75859679131462876
A10: Paranagua | B10: 2320000 | C10: 2209427.47 | D10: 2814018.85 | F10: 5408353.0999999996 | G10: 1886647.27 | H10: 1805750.05 | J10: =IF(B10=0,0,((C10/B10)*100)-100) -> -4.7660573275861964 | K10: =IF(C10=0,0,IF(D10=0,0,((C10/D10)*100)-100)) -> -21.484979747026216 | L10: =IF(F10=0,0,((C10/F10)*100)-100) -> -59.147869431823892 | M10: =IF(G10=0,0,((C10/G10)*100)-100) -> 17.108667058893332 | N10: =IF(C10=0,0,IF(H10=0,0,((C10/H10)*100)-100)) -> 22.355110553645005 | P10: 2320000 | Q10: =IF(C10=0,0,((C10/P10)*100)-100) -> -4.7660573275861964 | R10: =IF(C10=0,0,(C10/$C$40)*100) -> 1.6475242903106115 | T10: 17.73 | U10: 17.160197356467194 | V10: =U10-T10 -> -0.56980264353280674
A11: Centenario | B11: 0 | C11: 0 | D11: 0 | F11: 0 | G11: 0 | H11: 0 | J11: =IF(B11=0,0,((C11/B11)*100)-100) -> 0 | K11: =IF(C11=0,0,IF(D11=0,0,((C11/D11)*100)-100)) -> 0 | L11: =IF(F11=0,0,((C11/F11)*100)-100) -> 0 | M11: =IF(G11=0,0,((C11/G11)*100)-100) -> 0 | N11: =IF(C11=0,0,IF(H11=0,0,((C11/H11)*100)-100)) -> 0 | P11: 0 | Q11: =IF(C11=0,0,((C11/P11)*100)-100) -> 0 | R11: =IF(C11=0,0,(C11/$C$40)*100) -> 0 | T11: 0 | U11: 0 | V11: =U11-T11 -> 0
A12: Sitio Cercado | B12: 3000000 | C12: 2895053.11 | D12: 3644658.3 | F12: 2405685.86 | G12: 2090867.03 | H12: 1829710.59 | J12: =IF(B12=0,0,((C12/B12)*100)-100) -> -3.4982296666666741 | K12: =IF(C12=0,0,IF(D12=0,0,((C12/D12)*100)-100)) -> -20.5672282090203 | L12: =IF(F12=0,0,((C12/F12)*100)-100) -> 20.342109422383189 | M12: =IF(G12=0,0,((C12/G12)*100)-100) -> 38.461847093164977 | N12: =IF(C12=0,0,IF(H12=0,0,((C12/H12)*100)-100)) -> 58.224646336008789 | P12: 3000000 | Q12: =IF(C12=0,0,((C12/P12)*100)-100) -> -3.4982296666666741 | R12: =IF(C12=0,0,(C12/$C$40)*100) -> 2.1587811255303522 | T12: 15.95 | U12: 14.3596157239409 | V12: =U12-T12 -> -1.5903842760590994
A13: Apucarana | B13: 2600000 | C13: 2089979.32 | D13: 2900642.85 | F13: 2429214.25 | G13: 2595778.97 | H13: 2390701.57 | J13: =IF(B13=0,0,((C13/B13)*100)-100) -> -19.61618 | K13: =IF(C13=0,0,IF(D13=0,0,((C13/D13)*100)-100)) -> -27.947719589124873 | L13: =IF(F13=0,0,((C13/F13)*100)-100) -> -13.964800758105213 | M13: =IF(G13=0,0,((C13/G13)*100)-100) -> -19.485466823086256 | N13: =IF(C13=0,0,IF(H13=0,0,((C13/H13)*100)-100)) -> -12.578828481716343 | P13: 2600000 | Q13: =IF(C13=0,0,((C13/P13)*100)-100) -> -19.61618 | R13: =IF(C13=0,0,(C13/$C$40)*100) -> 1.5584542795364329 | T13: 17.2 | U13: 15.596648042431349 | V13: =U13-T13 -> -1.6033519575686501
A14: Ahú | B14: 2050000 | C14: 2184038.08 | D14: 2516137.51 | F14: 1865267.05 | G14: 1697465.6 | H14: 1617636.65 | J14: =IF(B14=0,0,((C14/B14)*100)-100) -> 6.5384429268292763 | K14: =IF(C14=0,0,IF(D14=0,0,((C14/D14)*100)-100)) -> -13.198779028575416 | L14: =IF(F14=0,0,((C14/F14)*100)-100) -> 17.089833329763707 | M14: =IF(G14=0,0,((C14/G14)*100)-100) -> 28.664644514740075 | N14: =IF(C14=0,0,IF(H14=0,0,((C14/H14)*100)-100)) -> 35.014131881841337 | P14: 2050000 | Q14: =IF(C14=0,0,((C14/P14)*100)-100) -> 6.5384429268292763 | R14: =IF(C14=0,0,(C14/$C$40)*100) -> 1.6285919481952262 | T14: 16.98 | U14: 16.56103123897913 | V14: =U14-T14 -> -0.41896876102087077
A15: P.G. Centro | B15: 1950000 | C15: 2214644.71 | D15: 2751280.68 | F15: 1877311.05 | G15: 1814507.17 | H15: 2014002.31 | J15: =IF(B15=0,0,((C15/B15)*100)-100) -> 13.571523589743578 | K15: =IF(C15=0,0,IF(D15=0,0,((C15/D15)*100)-100)) -> -19.504951781219219 | L15: =IF(F15=0,0,((C15/F15)*100)-100) -> 17.968980686498369 | M15: =IF(G15=0,0,((C15/G15)*100)-100) -> 22.052133307359711 | N15: =IF(C15=0,0,IF(H15=0,0,((C15/H15)*100)-100)) -> 9.9623718902288658 | P15: 1950000 | Q15: =IF(C15=0,0,((C15/P15)*100)-100) -> 13.571523589743578 | R15: =IF(C15=0,0,(C15/$C$40)*100) -> 1.6514146780898398 | T15: 18.44 | U15: 18.187450008629149 | V15: =U15-T15 -> -0.25254999137085221
A16: Maringa | B16: 3299999 | C16: 3324390.21 | D16: 3925238.05 | F16: 3023946.33 | G16: 2951827.38 | H16: 2651209.37 | J16: =IF(B16=0,0,((C16/B16)*100)-100) -> 0.73912779973571219 | K16: =IF(C16=0,0,IF(D16=0,0,((C16/D16)*100)-100)) -> -15.30729684025151 | L16: =IF(F16=0,0,((C16/F16)*100)-100) -> 9.9354898272946457 | M16: =IF(G16=0,0,((C16/G16)*100)-100) -> 12.621430118992933 | N16: =IF(C16=0,0,IF(H16=0,0,((C16/H16)*100)-100)) -> 25.391462764783455 | P16: 3300000 | Q16: =IF(C16=0,0,((C16/P16)*100)-100) -> 0.73909727272727821 | R16: =IF(C16=0,0,(C16/$C$40)*100) -> 2.4789289061594739 | T16: 17.44 | U16: 16.993940587979292 | V16: =U16-T16 -> -0.44605941202070909
A17: Araucaria Nova | B17: 4500000 | C17: 4743960.98 | D17: 5570639.96 | F17: 4007702.74 | G17: 3549353.35 | H17: 2991878.25 | J17: =IF(B17=0,0,((C17/B17)*100)-100) -> 5.4213551111111258 | K17: =IF(C17=0,0,IF(D17=0,0,((C17/D17)*100)-100)) -> -14.83992837332822 | L17: =IF(F17=0,0,((C17/F17)*100)-100) -> 18.371079088565352 | M17: =IF(G17=0,0,((C17/G17)*100)-100) -> 33.65704995249348 | N17: =IF(C17=0,0,IF(H17=0,0,((C17/H17)*100)-100)) -> 58.561297739973242 | P17: 4500000 | Q17: =IF(C17=0,0,((C17/P17)*100)-100) -> 5.4213551111111258 | R17: =IF(C17=0,0,(C17/$C$40)*100) -> 3.5374734192273491 | T17: 16.47 | U17: 16.015875252835656 | V17: =U17-T17 -> -0.45412474716434303
A18: Cristo Rei | B18: 2800000 | C18: 2778407.92 | D18: 3096501.12 | F18: 2425456.6 | G18: 2094485.58 | H18: 1685794.99 | J18: =IF(B18=0,0,((C18/B18)*100)-100) -> -0.77114571428570855 | K18: =IF(C18=0,0,IF(D18=0,0,((C18/D18)*100)-100)) -> -10.27266542697069 | L18: =IF(F18=0,0,((C18/F18)*100)-100) -> 14.551953640399077 | M18: =IF(G18=0,0,((C18/G18)*100)-100) -> 32.653475704521185 | N18: =IF(C18=0,0,IF(H18=0,0,((C18/H18)*100)-100)) -> 64.812918325258494 | P18: 2800000 | Q18: =IF(C18=0,0,((C18/P18)*100)-100) -> -0.77114571428570855 | R18: =IF(C18=0,0,(C18/$C$40)*100) -> 2.0718012239575265 | T18: 17.39 | U18: 17.765465209298714 | V18: =U18-T18 -> 0.37546520929871363
A19: Campo Largo | B19: 4100000 | C19: 3789002.99 | D19: 4715271.3 | F19: 3581633.49 | G19: 2876003.87 | H19: 753844.64 | J19: =IF(B19=0,0,((C19/B19)*100)-100) -> -7.5852929268292684 | K19: =IF(C19=0,0,IF(D19=0,0,((C19/D19)*100)-100)) -> -19.644008818750251 | L19: =IF(F19=0,0,((C19/F19)*100)-100) -> 5.7898023507704011 | M19: =IF(G19=0,0,((C19/G19)*100)-100) -> 31.745406517829196 | N19: =IF(C19=0,0,IF(H19=0,0,((C19/H19)*100)-100)) -> 402.62385496300669 | P19: 4100000 | Q19: =IF(C19=0,0,((C19/P19)*100)-100) -> -7.5852929268292684 | R19: =IF(C19=0,0,(C19/$C$40)*100) -> 2.8253810305366276 | T19: 16.5 | U19: 16.373377612457357 | V19: =U19-T19 -> -0.12662238754264266
A20: Brasilia | B20: 2700000 | C20: 2670072.92 | D20: 3342625.5 | F20: 2481626.79 | G20: 2503404.87 | H20: 995630.48 | J20: =IF(B20=0,0,((C20/B20)*100)-100) -> -1.1084103703703647 | K20: =IF(C20=0,0,IF(D20=0,0,((C20/D20)*100)-100)) -> -20.120488520176721 | L20: =IF(F20=0,0,((C20/F20)*100)-100) -> 7.5936531133273206 | M20: =IF(G20=0,0,((C20/G20)*100)-100) -> 6.6576546206047738 | N20: =IF(C20=0,0,IF(H20=0,0,((C20/H20)*100)-100)) -> 168.17910596710539 | P20: 2700000 | Q20: =IF(C20=0,0,((C20/P20)*100)-100) -> -1.1084103703703647 | R20: =IF(C20=0,0,(C20/$C$40)*100) -> 1.9910180589003819 | T20: 16.65 | U20: 16.255101905606384 | V20: =U20-T20 -> -0.39489809439361423
A21: Total Super | B21: =SUM(B6:B20) -> 40669999 | C21: =SUM(C6:C20) -> 39832311.080000006 | D21: =SUM(D6:D20) -> 48406502.209999993 | F21: =SUM(F6:F20) -> 40144087.750000007 | G21: =SUM(G6:G20) -> 33814359.810000002 | H21: =SUM(H6:H20) -> 27771109.530000001 | I21: =SUM(B21:H21) -> 230638369.38000003 | J21: =IF(C21=0,0,((C21/B21)*100)-100) -> -2.0597195490464486 | K21: =IF(C21=0,0,IF(D21=0,0,((C21/D21)*100)-100)) -> -17.712891323572435 | L21: =IF(F21=0,0,IF(C21=0,0,((C21/F21)*100)-100)) -> -0.77664405264758329 | M21: =IF(G21=0,0,IF(C21=0,0,((C21/G21)*100)-100)) -> 17.797028551817505 | N21: =IF(C21=0,0,IF(H21=0,0,((C21/H21)*100)-100)) -> 43.43075143242217 | P21: =SUM(P6:P20) -> 40670000 | Q21: =IF(C21=0,0,((C21/P21)*100)-100) -> -2.0597219572166097 | R21: =IF(C21=0,0,(C21/$C$40)*100) -> 29.702129141857963 | T21: 16.877393642424234 | U21: 16.335453194346762 | V21: =U21-T21 -> -0.54194044807747233
A22: Pinheirinho | B22: 5100000 | C22: 4798064.08 | D22: 5823556.46 | F22: 5484807.3099999996 | G22: 4579249.77 | H22: 3919425.29 | J22: =IF(B22=0,0,((C22/B22)*100)-100) -> -5.9203121568627353 | K22: =IF(C22=0,0,IF(D22=0,0,((C22/D22)*100)-100)) -> -17.60938332175111 | L22: =IF(F22=0,0,((C22/F22)*100)-100) -> -12.520826916707122 | M22: =IF(G22=0,0,((C22/G22)*100)-100) -> 4.7783877488735556 | N22: =IF(C22=0,0,IF(H22=0,0,((C22/H22)*100)-100)) -> 22.417541475832039 | P22: 5100000 | Q22: =IF(C22=0,0,IF(P22=0,0,((C22/P22)*100)-100)) -> -5.9203121568627353 | R22: =IF(C22=0,0,(C22/$C$40)*100) -> 3.5778169800101365 | T22: 16.1 | U22: 15.892619798024873 | V22: =U22-T22 -> -0.20738020197512874
A23: Londrina | B23: 4499999 | C23: 4373825.98 | D23: 5047524.35 | F23: 3776939.14 | G23: 3472147.31 | H23: 3392288.67 | J23: =IF(B23=0,0,((C23/B23)*100)-100) -> -2.8038455119656618 | K23: =IF(C23=0,0,IF(D23=0,0,((C23/D23)*100)-100)) -> -13.347104903020409 | L23: =IF(F23=0,0,((C23/F23)*100)-100) -> 15.803454010646306 | M23: =IF(G23=0,0,((C23/G23)*100)-100) -> 25.968905967874974 | N23: =IF(C23=0,0,IF(H23=0,0,((C23/H23)*100)-100)) -> 28.9343686662138 | P23: 4500000 | Q23: =IF(C23=0,0,IF(P23=0,0,((C23/P23)*100)-100)) -> -2.8038671111111029 | R23: =IF(C23=0,0,(C23/$C$40)*100) -> 3.2614714180418938 | T23: 15.29 | U23: 15.917575316976832 | V23: =U23-T23 -> 0.62757531697683255
A24: São Bráz | B24: 5750000 | C24: 5483703.9100000001 | D24: 6279519.6100000003 | F24: 5380635.21 | G24: 5050091 | H24: 4574868.63 | J24: =IF(B24=0,0,((C24/B24)*100)-100) -> -4.6312363478260892 | K24: =IF(C24=0,0,IF(D24=0,0,((C24/D24)*100)-100)) -> -12.673193961090277 | L24: =IF(F24=0,0,((C24/F24)*100)-100) -> 1.9155489264250036 | M24: =IF(G24=0,0,((C24/G24)*100)-100) -> 8.5862395350895611 | N24: =IF(C24=0,0,IF(H24=0,0,((C24/H24)*100)-100)) -> 19.865822464064948 | P24: 5750000 | Q24: =IF(C24=0,0,IF(P24=0,0,((C24/P24)*100)-100)) -> -4.6312363478260892 | R24: =IF(C24=0,0,(C24/$C$40)*100) -> 4.0890843964188939 | T24: 15.96 | U24: 14.968221449797422 | V24: =U24-T24 -> -0.99177855020257866
A25: S.J. Pinhais | B25: 6350000 | C25: 6468278.2300000004 | D25: 7300277.5999999996 | F25: 6282022.7800000003 | G25: 5556268.9299999997 | H25: 5015190.26 | J25: =IF(B25=0,0,((C25/B25)*100)-100) -> 1.8626492913385846 | K25: =IF(C25=0,0,IF(D25=0,0,((C25/D25)*100)-100)) -> -11.396818252500424 | L25: =IF(F25=0,0,((C25/F25)*100)-100) -> 2.9648961253846409 | M25: =IF(G25=0,0,((C25/G25)*100)-100) -> 16.414059713268784 | N25: =IF(C25=0,0,IF(H25=0,0,((C25/H25)*100)-100)) -> 28.973735684356683 | P25: 6350000 | Q25: =IF(C25=0,0,IF(P25=0,0,((C25/P25)*100)-100)) -> 1.8626492913385846 | R25: =IF(C25=0,0,(C25/$C$40)*100) -> 4.8232610688108846 | T25: 16.21 | U25: 16.24270340176755 | V25: =U25-T25 -> 3.2703401767548712E-2
A26: P.G. Nova | B26: 6300000 | C26: 6177812.1399999997 | D26: 7324335.1799999997 | F26: 6001865.0800000001 | G26: 4417916.14 | H26: 4636630 | J26: =IF(B26=0,0,((C26/B26)*100)-100) -> -1.9394898412698467 | K26: =IF(C26=0,0,IF(D26=0,0,((C26/D26)*100)-100)) -> -15.653612400627466 | L26: =IF(F26=0,0,((C26/F26)*100)-100) -> 2.9315397406434158 | M26: =IF(G26=0,0,((C26/G26)*100)-100) -> 39.835432457982336 | N26: =IF(C26=0,0,IF(H26=0,0,((C26/H26)*100)-100)) -> 33.239273782898351 | P26: 6300000 | Q26: =IF(C26=0,0,IF(P26=0,0,((C26/P26)*100)-100)) -> -1.9394898412698467 | R26: =IF(C26=0,0,(C26/$C$40)*100) -> 4.6066665232625983 | T26: 15.42 | U26: 15.601004583153285 | V26: =U26-T26 -> 0.18100458315328538
A27: Nilo Pecanha | B27: 14700000 | C27: 14014035.619999999 | D27: 16007396.52 | F27: 13590968.57 | G27: 12394357.560000001 | H27: 11028641.369999999 | J27: =IF(B27=0,0,((C27/B27)*100)-100) -> -4.6664243537415047 | K27: =IF(C27=0,0,IF(D27=0,0,((C27/D27)*100)-100)) -> -12.452748937089495 | L27: =IF(F27=0,0,((C27/F27)*100)-100) -> 3.1128543033632923 | M27: =IF(G27=0,0,((C27/G27)*100)-100) -> 13.067866181520742 | N27: =IF(C27=0,0,IF(H27=0,0,((C27/H27)*100)-100)) -> 27.069465311664231 | P27: 14700000 | Q27: =IF(C27=0,0,IF(P27=0,0,((C27/P27)*100)-100)) -> -4.6664243537415047 | R27: =IF(C27=0,0,(C27/$C$40)*100) -> 10.449976024435021 | T27: 16.2 | U27: 16.460011134180348 | V27: =U27-T27 -> 0.26001113418034905
A28: Champagnat | B28: 6900000 | C28: 6442169.0800000001 | D28: 7298791.5800000001 | F28: 6887847.0499999998 | G28: 7036972.5300000003 | H28: 6235691.7999999998 | J28: =IF(B28=0,0,((C28/B28)*100)-100) -> -6.6352307246376796 | K28: =IF(C28=0,0,IF(D28=0,0,((C28/D28)*100)-100)) -> -11.736497618966126 | L28: =IF(F28=0,0,((C28/F28)*100)-100) -> -6.4704974829544142 | M28: =IF(G28=0,0,((C28/G28)*100)-100) -> -8.4525475616713805 | N28: =IF(C28=0,0,IF(H28=0,0,((C28/H28)*100)-100)) -> 3.3112168885575812 | P28: 6900000 | Q28: =IF(C28=0,0,IF(P28=0,0,((C28/P28)*100)-100)) -> -6.6352307246376796 | R28: =IF(C28=0,0,(C28/$C$40)*100) -> 4.8037920165752102 | T28: 16.9 | U28: 16.203862907615584 | V28: =U28-T28 -> -0.69613709238441501
A29: Santa Candida | B29: 8200000 | C29: 8022996.2999999998 | D29: 9589538.3100000005 | F29: 7584456.5300000003 | G29: 6620332.0099999998 | H29: 5143628.88 | J29: =IF(B29=0,0,((C29/B29)*100)-100) -> -2.1585817073170688 | K29: =IF(C29=0,0,IF(D29=0,0,((C29/D29)*100)-100)) -> -16.335948190189782 | L29: =IF(F29=0,0,((C29/F29)*100)-100) -> 5.7820856150387954 | M29: =IF(G29=0,0,((C29/G29)*100)-100) -> 21.187219732806128 | N29: =IF(C29=0,0,IF(H29=0,0,((C29/H29)*100)-100)) -> 55.979299579638422 | P29: 8200000 | Q29: =IF(C29=0,0,IF(P29=0,0,((C29/P29)*100)-100)) -> -2.1585817073170688 | R29: =IF(C29=0,0,(C29/$C$40)*100) -> 5.9825821235589869 | T29: 16.22 | U29: 16.013822743505443 | V29: =U29-T29 -> -0.20617725649455565
A30: Paranaguá Raia | B30: 8000000 | C30: 7674157.96 | D30: 9042654.0999999996 | F30: 0 | G30: 6627905.9800000004 | H30: 5837412.3200000003 | J30: =IF(B30=0,0,((C30/B30)*100)-100) -> -4.0730255 | K30: =IF(C30=0,0,IF(D30=0,0,((C30/D30)*100)-100)) -> -15.133788430544953 | L30: =IF(F30=0,0,((C30/F30)*100)-100) -> 0 | M30: =IF(G30=0,0,((C30/G30)*100)-100) -> 15.785558563400144 | N30: =IF(C30=0,0,IF(H30=0,0,((C30/H30)*100)-100)) -> 31.46506601404505 | P30: 8000000 | Q30: =IF(C30=0,0,IF(P30=0,0,((C30/P30)*100)-100)) -> -4.0730255 | R30: =IF(C30=0,0,(C30/$C$40)*100) -> 5.722460600519522 | T30: 18.06 | U30: 17.95776394730348 | V30: =U30-T30 -> -0.1022360526965187
A31: Novo Mundo | B31: 6100000 | C31: 5608088.2000000002 | D31: 6661630.5 | F31: 5851144.29 | G31: 0 | H31: 0 | J31: =IF(B31=0,0,((C31/B31)*100)-100) -> -8.0641278688524523 | K31: =IF(C31=0,0,IF(D31=0,0,((C31/D31)*100)-100)) -> -15.815081608023746 | L31: =IF(F31=0,0,((C31/F31)*100)-100) -> -4.1539924150460479 | M31: =IF(G31=0,0,((C31/G31)*100)-100) -> 0 | N31: =IF(C31=0,0,IF(H31=0,0,((C31/H31)*100)-100)) -> 0 | P31: 6100000 | Q31: =IF(C31=0,0,IF(P31=0,0,((C31/P31)*100)-100)) -> -8.0641278688524523 | R31: =IF(C31=0,0,(C31/$C$40)*100) -> 4.1818351845260224 | T31: 16.01 | U31: 15.539293415535086 | V31: =U31-T31 -> -0.47070658446491542
A32: Uvaranas | B32: 5600000 | C32: 5496404.25 | D32: 6448122.2400000002 | F32: 5007199.86 | G32: 5100418.98 | H32: 0 | J32: =IF(B32=0,0,((C32/B32)*100)-100) -> -1.8499241071428543 | K32: =IF(C32=0,0,IF(D32=0,0,((C32/D32)*100)-100)) -> -14.759614575793151 | L32: =IF(F32=0,0,((C32/F32)*100)-100) -> 9.7700192458465125 | M32: =IF(G32=0,0,((C32/G32)*100)-100) -> 7.7637792415241762 | N32: =IF(C32=0,0,IF(H32=0,0,((C32/H32)*100)-100)) -> 0 | P32: 5600000 | Q32: =IF(C32=0,0,IF(P32=0,0,((C32/P32)*100)-100)) -> -1.8499241071428543 | R32: =IF(C32=0,0,(C32/$C$40)*100) -> 4.0985547768361359 | T32: 15.55 | U32: 15.265507543408949 | V32: =U32-T32 -> -0.28449245659105138
A33: Torres | B33: 6300000 | C33: 6126875.3799999999 | D33: 7177908.21 | F33: 5755865.54 | G33: 5090387.72 | H33: 0 | J33: =IF(B33=0,0,((C33/B33)*100)-100) -> -2.7480098412698339 | K33: =IF(C33=0,0,IF(D33=0,0,((C33/D33)*100)-100)) -> -14.642606163948145 | L33: =IF(F33=0,0,((C33/F33)*100)-100) -> 6.4457697529883546 | M33: =IF(G33=0,0,((C33/G33)*100)-100) -> 20.36166431738917 | N33: =IF(C33=0,0,IF(H33=0,0,((C33/H33)*100)-100)) -> 0 | P33: 6300000 | Q33: =IF(C33=0,0,IF(P33=0,0,((C33/P33)*100)-100)) -> -2.7480098412698339 | R33: =IF(C33=0,0,(C33/$C$40)*100) -> 4.5686840366187971 | T33: 16.25 | U33: 15.863529089765818 | V33: =U33-T33 -> -0.38647091023418234
A34: Total Hiper | B34: =SUM(B22:B33) -> 83799999 | C34: =SUM(C22:C33) -> 80686411.129999995 | D34: =SUM(D22:D33) -> 94001254.659999982 | F34: =SUM(F22:F33) -> 71603751.359999999 | G34: =SUM(G22:G33) -> 65946047.930000007 | H34: =SUM(H22:H33) -> 49783777.219999999 | I34: =SUM(B34:H34) -> 445821241.29999995 | J34: =IF(C34=0,0,((C34/B34)*100)-100) -> -3.7154986958890106 | K34: =IF(C34=0,0,IF(D34=0,0,((C34/D34)*100)-100)) -> -14.164538099155607 | L34: =IF(F34=0,0,IF(C34=0,0,((C34/F34)*100)-100)) -> 12.684614419620814 | M34: =IF(G34=0,0,IF(C34=0,0,((C34/G34)*100)-100)) -> 22.352155531210144 | N34: =IF(C34=0,0,IF(H34=0,0,((C34/H34)*100)-100)) -> 62.073702791650078 | P34: =SUM(P22:P33) -> 83800000 | Q34: =IF(C34=0,0,((C34/P34)*100)-100) -> -3.7154998448687451 | R34: =IF(C34=0,0,(C34/$C$40)*100) -> 60.166185149614094 | T34: 16.254349653512524 | U34: 16.099265642972959 | V34: =U34-T34 -> -0.15508401053956433
A35: Total s/ 29,30,37 | B35: =B21+B34 -> 124469998 | C35: =C21+C34 -> 120518722.21000001 | D35: =D21+D34 -> 142407756.86999997 | E35: =E21+E34 -> 0 | F35: =F21+F34 -> 111747839.11000001 | G35: =G21+G34 -> 99760407.74000001 | H35: =H21+H34 -> 77554886.75 | I35: =SUM(B35:H35) -> 676459610.68000007 | J35: =IF(C35=0,0,((C35/B35)*100)-100) -> -3.1744804800270003 | K35: =IF(C35=0,0,IF(D35=0,0,((C35/D35)*100)-100)) -> -15.370675826304776 | L35: =IF(F35=0,0,IF(C35=0,0,((C35/F35)*100)-100)) -> 7.8488167376250573 | M35: =IF(G35=0,0,IF(C35=0,0,((C35/G35)*100)-100)) -> 20.808169232929814 | N35: =IF(C35=0,0,IF(H35=0,0,((C35/H35)*100)-100)) -> 55.397973306949609 | P35: =P21+P34 -> 124470000 | Q35: =IF(C35=0,0,((C35/P35)*100)-100) -> -3.1744820358319146 | R35: =IF(C35=0,0,(C35/$C$40)*100) -> 89.868314291472061 | T35: 16.457926409462946 | U35: 16.177327340334401 | V35: =U35-T35 -> -0.28059906912854515
A36: Centenário | B36: 0 | C36: 0 | D36: 0 | F36: 1360223.16 | G36: 1232621.36 | H36: 1186577.22 | J36: =IF(B36=0,0,((C36/B36)*100)-100) -> 0 | K36: =IF(C36=0,0,IF(D36=0,0,((C36/D36)*100)-100)) -> 0 | L36: =IF(F36=0,0,((C36/F36)*100)-100) -> -100 | M36: =IF(G36=0,0,((C36/G36)*100)-100) -> -100 | N36: =IF(C36=0,0,IF(H36=0,0,((C36/H36)*100)-100)) -> 0 | P36: 0 | Q36: =IF(P36=0,0,IF(C36=0,0,((C36/P36)*100)-100)) -> 0 | R36: =IF(C36=0,0,(C36/$C$40)*100) -> 0 | T36: 0 | U36: 0 | V36: =U36-T36 -> 0
A37: Cajuru | B37: 4200000 | C37: 4480222.72 | D37: 5176003.74 | F37: 0 | G37: 0 | H37: 0 | J37: =IF(B37=0,0,((C37/B37)*100)-100) -> 6.6719695238095085 | K37: =IF(C37=0,0,IF(D37=0,0,((C37/D37)*100)-100)) -> -13.442436577528454 | L37: =IF(F37=0,0,((C37/F37)*100)-100) -> 0 | M37: =IF(G37=0,0,((C37/G37)*100)-100) -> 0 | N37: =IF(C37=0,0,IF(H37=0,0,((C37/H37)*100)-100)) -> 0 | P37: 4200000 | Q37: =IF(P37=0,0,IF(C37=0,0,((C37/P37)*100)-100)) -> 6.6719695238095085 | R37: =IF(C37=0,0,(C37/$C$40)*100) -> 3.3408092627731638 | T37: 16.15 | U37: 15.790838971951823 | V37: =U37-T37 -> -0.35916102804817562
A38: Água Verde | B38: 6900000 | C38: 6359341.2000000002 | D38: 7167952.7000000002 | F38: 0 | G38: 0 | H38: 0 | J38: =IF(B38=0,0,((C38/B38)*100)-100) -> -7.8356347826086932 | K38: =IF(C38=0,0,IF(D38=0,0,((C38/D38)*100)-100)) -> -11.280926839821362 | L38: =IF(F38=0,0,((C38/F38)*100)-100) -> 0 | M38: =IF(G38=0,0,((C38/G38)*100)-100) -> 0 | N38: =IF(C38=0,0,IF(H38=0,0,((C38/H38)*100)-100)) -> 0 | P38: 6900000 | Q38: =IF(P38=0,0,IF(C38=0,0,((C38/P38)*100)-100)) -> -7.8356347826086932 | R38: =IF(C38=0,0,(C38/$C$40)*100) -> 4.7420289824553645 | T38: 15.84 | U38: 15.718447887337764 | V38: =U38-T38 -> -0.12155211266223631
A39: Fazenda | B39: 3000000 | C39: 2747625.57 | D39: 3455070.31 | F39: 2985821.47 | G39: 0 | H39: 0 | J39: =IF(B39=0,0,((C39/B39)*100)-100) -> -8.4124809999999997 | K39: =IF(C39=0,0,IF(D39=0,0,((C39/D39)*100)-100)) -> -20.4755526378854 | L39: =IF(F39=0,0,((C39/F39)*100)-100) -> -7.9775667230365315 | M39: =IF(G39=0,0,((C39/G39)*100)-100) -> 0 | N39: =IF(C39=0,0,IF(H39=0,0,((C39/H39)*100)-100)) -> 0 | P39: 3000000 | Q39: =IF(P39=0,0,IF(C39=0,0,((C39/P39)*100)-100)) -> -8.4124809999999997 | R39: =IF(C39=0,0,(C39/$C$40)*100) -> 2.048847463299412 | T39: 16 | U39: 15.769359727570158 | V39: =U39-T39 -> -0.23064027242984153
A40: Total Geral | B40: =B21+B34+SUM(B36:B39) -> 138569998 | C40: =C21+C34+SUM(C36:C39) -> 134105911.7 | D40: =D21+D34+SUM(D36:D39) -> 158206783.61999997 | F40: =F21+F34+SUM(F36:F39) -> 116093883.74000001 | G40: =G21+G34+SUM(G36:G39) -> 100993029.10000001 | H40: =H21+H34+SUM(H36:H39) -> 78741463.969999999 | J40: =IF(C40=0,0,((C40/B40)*100)-100) -> -3.2215388355565864 | K40: =IF(C40=0,0,IF(D40=0,0,((C40/D40)*100)-100)) -> -15.233779088694661 | L40: =IF(F40=0,0,IF(C40=0,0,((C40/F40)*100)-100)) -> 15.515053316968121 | M40: =IF(G40=0,0,IF(C40=0,0,((C40/G40)*100)-100)) -> 32.787295217388419 | N40: =IF(C40=0,0,IF(H40=0,0,((C40/H40)*100)-100)) -> 70.311681976212071 | P40: =P21+P34+SUM(P36:P39) -> 138570000 | Q40: =IF(C40=0,0,((C40/P40)*100)-100) -> -3.2215402323735276 | R40: =R21+R34+SUM(R36:R39) -> 100 | T40: 16.4 | U40: 16.134296670383101 | V40: =U40-T40 -> -0.26570332961689758
A42: Água Verde | B42: 0 | C42: 0 | D42: 0 | F42: 0 | G42: 0 | H42: 0 | J42: =IF(B42=0,0,((C42/B42)*100)-100) -> 0 | K42: =IF(C42=0,0,IF(D42=0,0,((C42/D42)*100)-100)) -> 0 | L42: =IF(F42=0,0,((C42/F42)*100)-100) -> 0 | M42: =IF(G42=0,0,((C42/G42)*100)-100) -> 0 | N42: =IF(C42=0,0,IF(H42=0,0,((C42/H42)*100)-100)) -> 0 | P42: =B42 -> 0 | Q42: =IF(C42=0,0,IF(P42=0,0,((C42/P42)*100)-100)) -> 0 | R42: =IF(C42=0,0,(C42/$C$40)*100) -> 0 | T42: 14.95 | U42: 0 | V42: =U42-T42 -> -14.95
A43: Total Geral | B43: =B40+B42 -> 138569998 | C43: =C40+C42 -> 134105911.7 | D43: =D40+D42 -> 158206783.61999997 | F43: =F40+F42 -> 116093883.74000001 | G43: =G40+G42 -> 100993029.10000001 | H43: =H40+H42 -> 78741463.969999999 | J43: =IF(C43=0,0,((C43/B43)*100)-100) -> -3.2215388355565864 | K43: =IF(C43=0,0,IF(D43=0,0,((C43/D43)*100)-100)) -> -15.233779088694661 | L43: =IF(F43=0,0,IF(C43=0,0,((C43/F43)*100)-100)) -> 15.515053316968121 | M43: =IF(G43=0,0,IF(C43=0,0,((C43/G43)*100)-100)) -> 32.787295217388419 | N43: =IF(C43=0,0,IF(H43=0,0,((C43/H43)*100)-100)) -> 70.311681976212071 | P43: =P40+P42 -> 138570000 | Q43: =IF(C43=0,0,((C43/P43)*100)-100) -> -3.2215402323735276 | R43: =R24+R37+R42 -> 7.4298936591920572 | T43: 16.407910082166559 | U43: 16.134296670383101 | V43: =U43-T43 -> -0.2736134117834581