A2: Periodo: | B2: 40725 | C2: a | D2: 40755 | G2: Vendas Acumuladas por Filial | P2: =NOW() -> 40756.374713888887
A4: v.New | B4: Vendas 2011 | F4: Vendas de Anos Anteriores | J4: Percentuais ( % ) | P4: Meta Mensal | T4: Margem
A5: Lojas | B5: Previsao | C5: Realizada | D5: Mes Anterior | F5: Vendas 2010 | G5: Vendas 2009 | H5: Vendas 2008 | J5: % Prev | K5: % MA | L5: 2010 | M5: 2009 | N5: 2008 | P5: Previsao Mes | Q5: Final | R5: Part. | T5: Meta | U5: Coml | V5: Dif
A6: S. Felicidade | B6: 3400000 | C6: 3629089.48 | D6: 3519091.05 | F6: 3101115.42 | G6: 2744208.52 | H6: 2225287.21 | J6: =IF(B6=0,0,((C6/B6)*100)-100) -> 6.7379258823529398 | K6: =IF(C6=0,0,IF(D6=0,0,((C6/D6)*100)-100)) -> 3.1257625459847134 | L6: =IF(F6=0,0,((C6/F6)*100)-100) -> 17.025295369367456 | M6: =IF(G6=0,0,((C6/G6)*100)-100) -> 32.245398028281045 | N6: =IF(C6=0,0,IF(H6=0,0,((C6/H6)*100)-100)) -> 63.084093760643157 | P6: 3400000 | Q6: =IF(C6=0,0,((C6/P6)*100)-100) -> 6.7379258823529398 | R6: =IF(C6=0,0,(C6/$C$40)*100) -> 2.4167423413678351 | T6: 17 | U6: 16.412546138156944 | V6: =U6-T6 -> -0.58745386184305559
A7: Lapa | B7: 2450000 | C7: 2593012.31 | D7: 2518440.59 | F7: 2489752.94 | G7: 2174727.3 | H7: 1861717.36 | J7: =IF(B7=0,0,((C7/B7)*100)-100) -> 5.8372371428571483 | K7: =IF(C7=0,0,IF(D7=0,0,((C7/D7)*100)-100)) -> 2.9610275619009343 | L7: =IF(F7=0,0,((C7/F7)*100)-100) -> 4.1473741567305922 | M7: =IF(G7=0,0,((C7/G7)*100)-100) -> 19.233906246544137 | N7: =IF(C7=0,0,IF(H7=0,0,((C7/H7)*100)-100)) -> 39.280664493562 | P7: 2450000 | Q7: =IF(C7=0,0,((C7/P7)*100)-100) -> 5.8372371428571483 | R7: =IF(C7=0,0,(C7/$C$40)*100) -> 1.7267809669066134 | T7: 16 | U7: 14.900108210438848 | V7: =U7-T7 -> -1.099891789561152
A8: Araucaria | B8: 1549999 | C8: 1571967.05 | D8: 1539852.58 | F8: 1506680.49 | G8: 1346452.29 | H8: 1129274.93 | J8: =IF(B8=0,0,((C8/B8)*100)-100) -> 1.4172944627706414 | K8: =IF(C8=0,0,IF(D8=0,0,((C8/D8)*100)-100)) -> 2.0855548392820822 | L8: =IF(F8=0,0,((C8/F8)*100)-100) -> 4.3331390054702297 | M8: =IF(G8=0,0,((C8/G8)*100)-100) -> 16.748811797854344 | N8: =IF(C8=0,0,IF(H8=0,0,((C8/H8)*100)-100)) -> 39.201447604968962 | P8: 1550000 | Q8: =IF(C8=0,0,((C8/P8)*100)-100) -> 1.4172290322580778 | R8: =IF(C8=0,0,(C8/$C$40)*100) -> 1.0468298866442083 | T8: 16.89 | U8: 16.571967014194094 | V8: =U8-T8 -> -0.31803298580590678
A9: Hauer | B9: 4000000 | C9: 4273365.01 | D9: 4105359.99 | F9: 3881089.46 | G9: 3804584.01 | H9: 3675074.4 | J9: =IF(B9=0,0,((C9/B9)*100)-100) -> 6.8341252499999996 | K9: =IF(C9=0,0,IF(D9=0,0,((C9/D9)*100)-100)) -> 4.0923334472307715 | L9: =IF(F9=0,0,((C9/F9)*100)-100) -> 10.107356556527307 | M9: =IF(G9=0,0,((C9/G9)*100)-100) -> 12.321478478799591 | N9: =IF(C9=0,0,IF(H9=0,0,((C9/H9)*100)-100)) -> 16.279687018036967 | P9: 4000000 | Q9: =IF(C9=0,0,((C9/P9)*100)-100) -> 6.8341252499999996 | R9: =IF(C9=0,0,(C9/$C$40)*100) -> 2.8457887899161918 | T9: 16.17 | U9: 15.662312723901858 | V9: =U9-T9 -> -0.50768727609814412
A10: Paranagua | B10: 2250000 | C10: 2295557.97 | D10: 2354284.49 | F10: 5201886.79 | G10: 2012380.99 | H10: 1806529.22 | J10: =IF(B10=0,0,((C10/B10)*100)-100) -> 2.0247986666666691 | K10: =IF(C10=0,0,IF(D10=0,0,((C10/D10)*100)-100)) -> -2.4944529962052258 | L10: =IF(F10=0,0,((C10/F10)*100)-100) -> -55.870666497146118 | M10: =IF(G10=0,0,((C10/G10)*100)-100) -> 14.071737976415704 | N10: =IF(C10=0,0,IF(H10=0,0,((C10/H10)*100)-100)) -> 27.07007141572835 | P10: 2250000 | Q10: =IF(C10=0,0,((C10/P10)*100)-100) -> 2.0247986666666691 | R10: =IF(C10=0,0,(C10/$C$40)*100) -> 1.5286953308088163 | T10: 17.43 | U10: 16.897389792338807 | V10: =U10-T10 -> -0.53261020766119316
A11: Sitio Cercado | B11: 3000000 | C11: 3310358.11 | D11: 3164909.72 | F11: 2559461.69 | G11: 2206140.2 | H11: 1882902.78 | J11: =IF(B11=0,0,((C11/B11)*100)-100) -> 10.345270333333318 | K11: =IF(C11=0,0,IF(D11=0,0,((C11/D11)*100)-100)) -> 4.5956568391467272 | L11: =IF(F11=0,0,((C11/F11)*100)-100) -> 29.338060535690204 | M11: =IF(G11=0,0,((C11/G11)*100)-100) -> 50.052027971749027 | N11: =IF(C11=0,0,IF(H11=0,0,((C11/H11)*100)-100)) -> 75.811419748395082 | P11: 3000000 | Q11: =IF(C11=0,0,((C11/P11)*100)-100) -> 10.345270333333318 | R11: =IF(C11=0,0,(C11/$C$40)*100) -> 2.2044875591018496 | T11: 14.91 | U11: 14.020609664493367 | V11: =U11-T11 -> -0.88939033550663282
A12: Apucarana | B12: 2999999 | C12: 3130976.14 | D12: 3054232.83 | F12: 2803913.3 | G12: 2600487.21 | H12: 2266616.6 | J12: =IF(B12=0,0,((C12/B12)*100)-100) -> 4.3659061219687203 | K12: =IF(C12=0,0,IF(D12=0,0,((C12/D12)*100)-100)) -> 2.5126869584464657 | L12: =IF(F12=0,0,((C12/F12)*100)-100) -> 11.66451330716967 | M12: =IF(G12=0,0,((C12/G12)*100)-100) -> 20.399597735379757 | N12: =IF(C12=0,0,IF(H12=0,0,((C12/H12)*100)-100)) -> 38.134351438174406 | P12: 3000000 | Q12: =IF(C12=0,0,((C12/P12)*100)-100) -> 4.3658713333333452 | R12: =IF(C12=0,0,(C12/$C$40)*100) -> 2.0850305976336596 | T12: 16.25 | U12: 15.203569015380614 | V12: =U12-T12 -> -1.046430984619386
A13: Ahú | B13: 2200000 | C13: 2311359.14 | D13: 2329633.76 | F13: 1923325.96 | G13: 1743325.93 | H13: 1572638.05 | J13: =IF(B13=0,0,((C13/B13)*100)-100) -> 5.0617790909090985 | K13: =IF(C13=0,0,IF(D13=0,0,((C13/D13)*100)-100)) -> -0.78444175705968178 | L13: =IF(F13=0,0,((C13/F13)*100)-100) -> 20.17511269904557 | M13: =IF(G13=0,0,((C13/G13)*100)-100) -> 32.583305291627283 | N13: =IF(C13=0,0,IF(H13=0,0,((C13/H13)*100)-100)) -> 46.973370000808529 | P13: 2200000 | Q13: =IF(C13=0,0,((C13/P13)*100)-100) -> 5.0617790909090985 | R13: =IF(C13=0,0,(C13/$C$40)*100) -> 1.539217903148959 | T13: 16.89 | U13: 15.842252961173312 | V13: =U13-T13 -> -1.0477470388266887
A14: P.G. Centro | B14: 2249999 | C14: 2296929.47 | D14: 2364677.51 | F14: 2015217.52 | G14: 1976229.65 | H14: 2023331.67 | J14: =IF(B14=0,0,((C14/B14)*100)-100) -> 2.085799593688705 | K14: =IF(C14=0,0,IF(D14=0,0,((C14/D14)*100)-100)) -> -2.8650012406977083 | L14: =IF(F14=0,0,((C14/F14)*100)-100) -> 13.979232872092155 | M14: =IF(G14=0,0,((C14/G14)*100)-100) -> 16.227861979502251 | N14: =IF(C14=0,0,IF(H14=0,0,((C14/H14)*100)-100)) -> 13.522142911942865 | P14: 2250000 | Q14: =IF(C14=0,0,((C14/P14)*100)-100) -> 2.0857542222222349 | R14: =IF(C14=0,0,(C14/$C$40)*100) -> 1.5296086624142926 | T14: 18.35 | U14: 17.44070828609291 | V14: =U14-T14 -> -0.90929171390709129
A15: Maringa | B15: 3349999 | C15: 3475395.94 | D15: 3442064.44 | F15: 3174981.94 | G15: 2919876.58 | H15: 3026625.48 | J15: =IF(B15=0,0,((C15/B15)*100)-100) -> 3.743193356177116 | K15: =IF(C15=0,0,IF(D15=0,0,((C15/D15)*100)-100)) -> 0.96835781493969364 | L15: =IF(F15=0,0,((C15/F15)*100)-100) -> 9.4619120888605863 | M15: =IF(G15=0,0,((C15/G15)*100)-100) -> 19.025439767046578 | N15: =IF(C15=0,0,IF(H15=0,0,((C15/H15)*100)-100)) -> 14.827419611890662 | P15: 3350000 | Q15: =IF(C15=0,0,((C15/P15)*100)-100) -> 3.7431623880597016 | R15: =IF(C15=0,0,(C15/$C$40)*100) -> 2.3143922373652432 | T15: 17.4 | U15: 16.384180735965295 | V15: =U15-T15 -> -1.0158192640347039
A16: Araucaria Nova | B16: 4900000 | C16: 5355572.68 | D16: 5129455.33 | F16: 4409243.07 | G16: 3569374.18 | H16: 2881348.21 | J16: =IF(B16=0,0,((C16/B16)*100)-100) -> 9.2974016326530489 | K16: =IF(C16=0,0,IF(D16=0,0,((C16/D16)*100)-100)) -> 4.4082136494597393 | L16: =IF(F16=0,0,((C16/F16)*100)-100) -> 21.462405110725726 | M16: =IF(G16=0,0,((C16/G16)*100)-100) -> 50.04234383742866 | N16: =IF(C16=0,0,IF(H16=0,0,((C16/H16)*100)-100)) -> 85.870373508240419 | P16: 4900000 | Q16: =IF(C16=0,0,((C16/P16)*100)-100) -> 9.2974016326530489 | R16: =IF(C16=0,0,(C16/$C$40)*100) -> 3.5664701378563999 | T16: 16.35 | U16: 15.621951419395172 | V16: =U16-T16 -> -0.72804858060482935
A17: Cristo Rei | B17: 2850000 | C17: 2903480.21 | D17: 2948454.56 | F17: 2451640.76 | G17: 2065192.97 | H17: 1658768.55 | J17: =IF(B17=0,0,((C17/B17)*100)-100) -> 1.8764985964912171 | K17: =IF(C17=0,0,IF(D17=0,0,((C17/D17)*100)-100)) -> -1.5253533362915448 | L17: =IF(F17=0,0,((C17/F17)*100)-100) -> 18.430083941009372 | M17: =IF(G17=0,0,((C17/G17)*100)-100) -> 40.591230561858822 | N17: =IF(C17=0,0,IF(H17=0,0,((C17/H17)*100)-100)) -> 75.038296331335687 | P17: 2850000 | Q17: =IF(C17=0,0,((C17/P17)*100)-100) -> 1.8764985964912171 | R17: =IF(C17=0,0,(C17/$C$40)*100) -> 1.9335328047162326 | T17: 17.5 | U17: 16.72308853105632 | V17: =U17-T17 -> -0.77691146894368046
A18: Fazenda | B18: 2900000 | C18: 3124982.45 | D18: 2852071.83 | F18: 2886047.51 | G18: 0 | H18: 0 | J18: =IF(B18=0,0,((C18/B18)*100)-100) -> 7.7580155172413754 | K18: =IF(C18=0,0,IF(D18=0,0,((C18/D18)*100)-100)) -> 9.5688550733310223 | L18: =IF(F18=0,0,((C18/F18)*100)-100) -> 8.2789676598220723 | M18: =IF(G18=0,0,((C18/G18)*100)-100) -> 0 | N18: =IF(C18=0,0,IF(H18=0,0,((C18/H18)*100)-100)) -> 0 | P18: 2900000 | Q18: =IF(C18=0,0,((C18/P18)*100)-100) -> 7.7580155172413754 | R18: =IF(C18=0,0,(C18/$C$40)*100) -> 2.0810391820227023 | T18: 16.3 | U18: 15.937776191351091 | V18: =U18-T18 -> -0.3622238086489098
A19: Campo Largo | B19: 4000000 | C19: 4327916.09 | D19: 4101813.23 | F19: 3812045.62 | G19: 3051237.27 | H19: 2131007.18 | J19: =IF(B19=0,0,((C19/B19)*100)-100) -> 8.1979022499999843 | K19: =IF(C19=0,0,IF(D19=0,0,((C19/D19)*100)-100)) -> 5.5122660960357734 | L19: =IF(F19=0,0,((C19/F19)*100)-100) -> 13.532641563717689 | M19: =IF(G19=0,0,((C19/G19)*100)-100) -> 41.84134850974732 | N19: =IF(C19=0,0,IF(H19=0,0,((C19/H19)*100)-100)) -> 103.09251562446633 | P19: 4000000 | Q19: =IF(C19=0,0,((C19/P19)*100)-100) -> 8.1979022499999843 | R19: =IF(C19=0,0,(C19/$C$40)*100) -> 2.8821163331002038 | T19: 16.58 | U19: 15.892839066110454 | V19: =U19-T19 -> -0.68716093388954391
A20: Brasilia | B20: 2850000 | C20: 3115621.17 | D20: 2917232.75 | F20: 2546087.81 | G20: 2512122.98 | H20: 1275599.43 | J20: =IF(B20=0,0,((C20/B20)*100)-100) -> 9.3200410526315807 | K20: =IF(C20=0,0,IF(D20=0,0,((C20/D20)*100)-100)) -> 6.8005687924626415 | L20: =IF(F20=0,0,((C20/F20)*100)-100) -> 22.368959851388624 | M20: =IF(G20=0,0,((C20/G20)*100)-100) -> 24.023433359142317 | N20: =IF(C20=0,0,IF(H20=0,0,((C20/H20)*100)-100)) -> 144.24761384535896 | P20: 2850000 | Q20: =IF(C20=0,0,((C20/P20)*100)-100) -> 9.3200410526315807 | R20: =IF(C20=0,0,(C20/$C$40)*100) -> 2.0748051660608251 | T20: 16.05 | U20: 15.44921184047546 | V20: =U20-T20 -> -0.60078815952454079
A21: Total Super | B21: =SUM(B6:B20) -> 44949996 | C21: =SUM(C6:C20) -> 47715583.219999999 | D21: =SUM(D6:D20) -> 46341574.659999996 | F21: =SUM(F6:F20) -> 44762490.280000001 | G21: =SUM(G6:G20) -> 34726340.079999998 | H21: =SUM(H6:H20) -> 29416721.07 | I21: =SUM(B21:H21) -> 247912705.31 | J21: =IF(C21=0,0,((C21/B21)*100)-100) -> 6.1525861314870838 | K21: =IF(C21=0,0,IF(D21=0,0,((C21/D21)*100)-100)) -> 2.9649587224449334 | L21: =IF(F21=0,0,IF(C21=0,0,((C21/F21)*100)-100)) -> 6.5972489947000241 | M21: =IF(G21=0,0,IF(C21=0,0,((C21/G21)*100)-100)) -> 37.404584272561806 | N21: =IF(C21=0,0,IF(H21=0,0,((C21/H21)*100)-100)) -> 62.205648639275751 | P21: =SUM(P6:P20) -> 44950000 | Q21: =IF(C21=0,0,((C21/P21)*100)-100) -> 6.152576685205787 | R21: =IF(C21=0,0,(C21/$C$40)*100) -> 31.775537899064034 | T21: 16.609899834251376 | U21: 15.855296794798349 | V21: =U21-T21 -> -0.75460303945302698
A22: Pinheirinho | B22: 4900000 | C22: 5319791.14 | D22: 5014354.89 | F22: 4329409.29 | G22: 4639532.62 | H22: 3841933.27 | J22: =IF(B22=0,0,((C22/B22)*100)-100) -> 8.5671661224489668 | K22: =IF(C22=0,0,IF(D22=0,0,((C22/D22)*100)-100)) -> 6.0912371920289132 | L22: =IF(F22=0,0,((C22/F22)*100)-100) -> 22.875680806791991 | M22: =IF(G22=0,0,((C22/G22)*100)-100) -> 14.662220868273579 | N22: =IF(C22=0,0,IF(H22=0,0,((C22/H22)*100)-100)) -> 38.466515843467505 | P22: 4900000 | Q22: =IF(C22=0,0,IF(P22=0,0,((C22/P22)*100)-100)) -> 8.5671661224489668 | R22: =IF(C22=0,0,(C22/$C$40)*100) -> 3.5426419122824888 | T22: 16.2 | U22: 15.049158599109965 | V22: =U22-T22 -> -1.1508414008900338
A23: Londrina | B23: 4500000 | C23: 4742358.53 | D23: 4626992.4 | F23: 3927436.69 | G23: 3651179.34 | H23: 3369072.28 | J23: =IF(B23=0,0,((C23/B23)*100)-100) -> 5.3857451111111203 | K23: =IF(C23=0,0,IF(D23=0,0,((C23/D23)*100)-100)) -> 2.4933287117566891 | L23: =IF(F23=0,0,((C23/F23)*100)-100) -> 20.749458344546866 | M23: =IF(G23=0,0,((C23/G23)*100)-100) -> 29.88566401123424 | N23: =IF(C23=0,0,IF(H23=0,0,((C23/H23)*100)-100)) -> 40.761554988069292 | P23: 4500000 | Q23: =IF(C23=0,0,IF(P23=0,0,((C23/P23)*100)-100)) -> 5.3857451111111203 | R23: =IF(C23=0,0,(C23/$C$40)*100) -> 3.158108589099303 | T23: 15.72 | U23: 15.15667707224152 | V23: =U23-T23 -> -0.56332292775848103
A24: São Bráz | B24: 5750000 | C24: 6112421.1600000001 | D24: 5864268.7400000002 | F24: 5382611.0199999996 | G24: 5089482.99 | H24: 4307841.45 | J24: =IF(B24=0,0,((C24/B24)*100)-100) -> 6.3029766956521911 | K24: =IF(C24=0,0,IF(D24=0,0,((C24/D24)*100)-100)) -> 4.2316004092268145 | L24: =IF(F24=0,0,((C24/F24)*100)-100) -> 13.558663951161762 | M24: =IF(G24=0,0,((C24/G24)*100)-100) -> 20.099058627564048 | N24: =IF(C24=0,0,IF(H24=0,0,((C24/H24)*100)-100)) -> 41.890578633064592 | P24: 5750000 | Q24: =IF(C24=0,0,IF(P24=0,0,((C24/P24)*100)-100)) -> 6.3029766956521911 | R24: =IF(C24=0,0,(C24/$C$40)*100) -> 4.0704829977476056 | T24: 15.96 | U24: 14.673445006855514 | V24: =U24-T24 -> -1.2865549931444864
A25: S.J. Pinhais | B25: 6700000 | C25: 7077042.3799999999 | D25: 6876925.8200000003 | F25: 6004699.2999999998 | G25: 5607342.1100000003 | H25: 4820425.46 | J25: =IF(B25=0,0,((C25/B25)*100)-100) -> 5.627498208955231 | K25: =IF(C25=0,0,IF(D25=0,0,((C25/D25)*100)-100)) -> 2.9099711882598172 | L25: =IF(F25=0,0,((C25/F25)*100)-100) -> 17.85839767197001 | M25: =IF(G25=0,0,((C25/G25)*100)-100) -> 26.210283609751059 | N25: =IF(C25=0,0,IF(H25=0,0,((C25/H25)*100)-100)) -> 46.813646196284111 | P25: 6700000 | Q25: =IF(C25=0,0,IF(P25=0,0,((C25/P25)*100)-100)) -> 5.627498208955231 | R25: =IF(C25=0,0,(C25/$C$40)*100) -> 4.712859262814483 | T25: 15.88 | U25: 15.340305281597027 | V25: =U25-T25 -> -0.53969471840297345
A26: P.G. Nova | B26: 6600000 | C26: 7076402.9299999997 | D26: 6696818 | F26: 5746817.6699999999 | G26: 4786404.66 | H26: 4372939.72 | J26: =IF(B26=0,0,((C26/B26)*100)-100) -> 7.2182262121212091 | K26: =IF(C26=0,0,IF(D26=0,0,((C26/D26)*100)-100)) -> 5.6681386592856313 | L26: =IF(F26=0,0,((C26/F26)*100)-100) -> 23.136026516741737 | M26: =IF(G26=0,0,((C26/G26)*100)-100) -> 47.843808300153199 | N26: =IF(C26=0,0,IF(H26=0,0,((C26/H26)*100)-100)) -> 61.822558349832462 | P26: 6600000 | Q26: =IF(C26=0,0,IF(P26=0,0,((C26/P26)*100)-100)) -> 7.2182262121212091 | R26: =IF(C26=0,0,(C26/$C$40)*100) -> 4.7124334298614228 | T26: 15.45 | U26: 15.075303710836039 | V26: =U26-T26 -> -0.37469628916396047
A27: Nilo Pecanha | B27: 14550000 | C27: 15113077.619999999 | D27: 14737056.539999999 | F27: 13492288.15 | G27: 12528963.73 | H27: 10823637.67 | J27: =IF(B27=0,0,((C27/B27)*100)-100) -> 3.8699492783505178 | K27: =IF(C27=0,0,IF(D27=0,0,((C27/D27)*100)-100)) -> 2.5515344870896399 | L27: =IF(F27=0,0,((C27/F27)*100)-100) -> 12.012710164361536 | M27: =IF(G27=0,0,((C27/G27)*100)-100) -> 20.625120685858974 | N27: =IF(C27=0,0,IF(H27=0,0,((C27/H27)*100)-100)) -> 39.630298803230346 | P27: 14550000 | Q27: =IF(C27=0,0,IF(P27=0,0,((C27/P27)*100)-100)) -> 3.8699492783505178 | R27: =IF(C27=0,0,(C27/$C$40)*100) -> 10.064346661585381 | T27: 16.21 | U27: 16.069801507444385 | V27: =U27-T27 -> -0.14019849255561567
A28: Champagnat | B28: 6700000 | C28: 7119983.0700000003 | D28: 6918136.3799999999 | F28: 6457497.8300000001 | G28: 7166575.3399999999 | H28: 5893624.6900000004 | J28: =IF(B28=0,0,((C28/B28)*100)-100) -> 6.2684040298507568 | K28: =IF(C28=0,0,IF(D28=0,0,((C28/D28)*100)-100)) -> 2.9176454309795048 | L28: =IF(F28=0,0,((C28/F28)*100)-100) -> 10.259163184263898 | M28: =IF(G28=0,0,((C28/G28)*100)-100) -> -0.65013298248531726 | N28: =IF(C28=0,0,IF(H28=0,0,((C28/H28)*100)-100)) -> 20.80821980539109 | P28: 6700000 | Q28: =IF(C28=0,0,IF(P28=0,0,((C28/P28)*100)-100)) -> 6.2684040298507568 | R28: =IF(C28=0,0,(C28/$C$40)*100) -> 4.7414550260940791 | T28: 16.91 | U28: 15.8900381978015 | V28: =U28-T28 -> -1.0199618021985
A29: Santa Candida | B29: 8300000 | C29: 9232497.3699999992 | D29: 8690768.3000000007 | F29: 7452795.0300000003 | G29: 6512664.2599999998 | H29: 5190183.5 | J29: =IF(B29=0,0,((C29/B29)*100)-100) -> 11.234908072289159 | K29: =IF(C29=0,0,IF(D29=0,0,((C29/D29)*100)-100)) -> 6.233385257779787 | L29: =IF(F29=0,0,((C29/F29)*100)-100) -> 23.879663036969362 | M29: =IF(G29=0,0,((C29/G29)*100)-100) -> 41.7622189847078 | N29: =IF(C29=0,0,IF(H29=0,0,((C29/H29)*100)-100)) -> 77.883833394329884 | P29: 8300000 | Q29: =IF(C29=0,0,IF(P29=0,0,((C29/P29)*100)-100)) -> 11.234908072289159 | R29: =IF(C29=0,0,(C29/$C$40)*100) -> 6.148254936565019 | T29: 16.17 | U29: 15.328729528790541 | V29: =U29-T29 -> -0.84127047120946052
A30: Paranaguá Raia | B30: 7800000 | C30: 8467251.9000000004 | D30: 8000746.4100000001 | F30: 1555088.03 | G30: 6909272 | H30: 5796189.6100000003 | J30: =IF(B30=0,0,((C30/B30)*100)-100) -> 8.55451153846154 | K30: =IF(C30=0,0,IF(D30=0,0,((C30/D30)*100)-100)) -> 5.8307746064407411 | L30: =IF(F30=0,0,((C30/F30)*100)-100) -> 444.48698315811748 | M30: =IF(G30=0,0,((C30/G30)*100)-100) -> 22.549118054695199 | N30: =IF(C30=0,0,IF(H30=0,0,((C30/H30)*100)-100)) -> 46.08307301389334 | P30: 7800000 | Q30: =IF(C30=0,0,IF(P30=0,0,((C30/P30)*100)-100)) -> 8.55451153846154 | R30: =IF(C30=0,0,(C30/$C$40)*100) -> 5.6386502164055896 | T30: 17.63 | U30: 17.462800874035647 | V30: =U30-T30 -> -0.16719912596435194
A31: Novo Mundo | B31: 5850000 | C31: 6496634.0999999996 | D31: 5999198.0999999996 | F31: 5488993.1900000004 | G31: 0 | H31: 0 | J31: =IF(B31=0,0,((C31/B31)*100)-100) -> 11.053574358974359 | K31: =IF(C31=0,0,IF(D31=0,0,((C31/D31)*100)-100)) -> 8.2917081867991556 | L31: =IF(F31=0,0,((C31/F31)*100)-100) -> 18.357481511103828 | M31: =IF(G31=0,0,((C31/G31)*100)-100) -> 0 | N31: =IF(C31=0,0,IF(H31=0,0,((C31/H31)*100)-100)) -> 0 | P31: 5850000 | Q31: =IF(C31=0,0,IF(P31=0,0,((C31/P31)*100)-100)) -> 11.053574358974359 | R31: =IF(C31=0,0,(C31/$C$40)*100) -> 4.3263443330265074 | T31: 15.58 | U31: 14.97317530627129 | V31: =U31-T31 -> -0.60682469372870962
A32: Uvaranas | B32: 5750000 | C32: 6486559.3600000003 | D32: 5934695.75 | F32: 5317688.54 | G32: 4816166.89 | H32: 0 | J32: =IF(B32=0,0,((C32/B32)*100)-100) -> 12.809727999999993 | K32: =IF(C32=0,0,IF(D32=0,0,((C32/D32)*100)-100)) -> 9.2989368494585563 | L32: =IF(F32=0,0,((C32/F32)*100)-100) -> 21.980806344855992 | M32: =IF(G32=0,0,((C32/G32)*100)-100) -> 34.683027149003152 | N32: =IF(C32=0,0,IF(H32=0,0,((C32/H32)*100)-100)) -> 0 | P32: 5750000 | Q32: =IF(C32=0,0,IF(P32=0,0,((C32/P32)*100)-100)) -> 12.809727999999993 | R32: =IF(C32=0,0,(C32/$C$40)*100) -> 4.3196351981676253 | T32: 15.55 | U32: 15.132896665575259 | V32: =U32-T32 -> -0.41710333442474123
A33: Torres | B33: 6250000 | C33: 7096115.5899999999 | D33: 6523131.8799999999 | F33: 5658950.2699999996 | G33: 5054366.48 | H33: 0 | J33: =IF(B33=0,0,((C33/B33)*100)-100) -> 13.537849440000002 | K33: =IF(C33=0,0,IF(D33=0,0,((C33/D33)*100)-100)) -> 8.7838743802923176 | L33: =IF(F33=0,0,((C33/F33)*100)-100) -> 25.396323548183446 | M33: =IF(G33=0,0,((C33/G33)*100)-100) -> 40.395747282654497 | N33: =IF(C33=0,0,IF(H33=0,0,((C33/H33)*100)-100)) -> 0 | P33: 6250000 | Q33: =IF(C33=0,0,IF(P33=0,0,((C33/P33)*100)-100)) -> 13.537849440000002 | R33: =IF(C33=0,0,(C33/$C$40)*100) -> 4.725560805294168 | T33: 16.25 | U33: 15.802620268478462 | V33: =U33-T33 -> -0.4473797315215382
A34: Total Hiper | B34: =SUM(B22:B33) -> 83650000 | C34: =SUM(C22:C33) -> 90340135.149999991 | D34: =SUM(D22:D33) -> 85883093.209999993 | F34: =SUM(F22:F33) -> 70814275.00999999 | G34: =SUM(G22:G33) -> 66761950.420000002 | H34: =SUM(H22:H33) -> 48415847.649999999 | I34: =SUM(B34:H34) -> 445865301.43999994 | J34: =IF(C34=0,0,((C34/B34)*100)-100) -> 7.9977706515242062 | K34: =IF(C34=0,0,IF(D34=0,0,((C34/D34)*100)-100)) -> 5.1896616358492196 | L34: =IF(F34=0,0,IF(C34=0,0,((C34/F34)*100)-100)) -> 27.573339043918295 | M34: =IF(G34=0,0,IF(C34=0,0,((C34/G34)*100)-100)) -> 35.316800335624464 | N34: =IF(C34=0,0,IF(H34=0,0,((C34/H34)*100)-100)) -> 86.592075807641038 | P34: =SUM(P22:P33) -> 83650000 | Q34: =IF(C34=0,0,((C34/P34)*100)-100) -> 7.9977706515242062 | R34: =IF(C34=0,0,(C34/$C$40)*100) -> 60.160773368943666 | T34: 16.177543335325762 | U34: 15.605779291664035 | V34: =U34-T34 -> -0.57176404366172662
A35: Total s/ 29,30,37 | B35: =B21+B34 -> 128599996 | C35: =C21+C34 -> 138055718.37 | D35: =D21+D34 -> 132224667.86999999 | E35: =E21+E34 -> 0 | F35: =F21+F34 -> 115576765.28999999 | G35: =G21+G34 -> 101488290.5 | H35: =H21+H34 -> 77832568.719999999 | I35: =SUM(B35:H35) -> 693778006.75 | J35: =IF(C35=0,0,((C35/B35)*100)-100) -> 7.3528170016428334 | K35: =IF(C35=0,0,IF(D35=0,0,((C35/D35)*100)-100)) -> 4.4099566245331374 | L35: =IF(F35=0,0,IF(C35=0,0,((C35/F35)*100)-100)) -> 19.449370315561993 | M35: =IF(G35=0,0,IF(C35=0,0,((C35/G35)*100)-100)) -> 36.031179252152242 | N35: =IF(C35=0,0,IF(H35=0,0,((C35/H35)*100)-100)) -> 77.375256451641377 | P35: =P21+P34 -> 128600000 | Q35: =IF(C35=0,0,((C35/P35)*100)-100) -> 7.352813662519452 | R35: =IF(C35=0,0,(C35/$C$40)*100) -> 91.936311268007714 | T35: 16.32866637966303 | U35: 15.692018915246619 | V35: =U35-T35 -> -0.63664746441641107
A36: Centenário | B36: 0 | C36: 0 | D36: 0 | F36: 1457571.8 | G36: 1274013.25 | H36: 1265942.05 | J36: =IF(B36=0,0,((C36/B36)*100)-100) -> 0 | K36: =IF(C36=0,0,IF(D36=0,0,((C36/D36)*100)-100)) -> 0 | L36: =IF(F36=0,0,((C36/F36)*100)-100) -> -100 | M36: =IF(G36=0,0,((C36/G36)*100)-100) -> -100 | N36: =IF(C36=0,0,IF(H36=0,0,((C36/H36)*100)-100)) -> 0 | P36: 0 | Q36: =IF(P36=0,0,IF(C36=0,0,((C36/P36)*100)-100)) -> 0 | R36: =IF(C36=0,0,(C36/$C$40)*100) -> 0 | T36: 0 | U36: 0 | V36: =U36-T36 -> 0
A37: Cajuru | B37: 4600000 | C37: 5229864.82 | D37: 4831481.59 | F37: 0 | G37: 0 | H37: 0 | J37: =IF(B37=0,0,((C37/B37)*100)-100) -> 13.69271347826087 | K37: =IF(C37=0,0,IF(D37=0,0,((C37/D37)*100)-100)) -> 8.2455706925295402 | L37: =IF(F37=0,0,((C37/F37)*100)-100) -> 0 | M37: =IF(G37=0,0,((C37/G37)*100)-100) -> 0 | N37: =IF(C37=0,0,IF(H37=0,0,((C37/H37)*100)-100)) -> 0 | P37: 4600000 | Q37: =IF(P37=0,0,IF(C37=0,0,((C37/P37)*100)-100)) -> 13.69271347826087 | R37: =IF(C37=0,0,(C37/$C$40)*100) -> 3.4827567134343771 | T37: 15.8 | U37: 15.37695163600806 | V37: =U37-T37 -> -0.42304836399194023
A38: Água Verde | B38: 6550000 | C38: 6878934.4699999997 | D38: 6586409.2400000002 | F38: 0 | G38: 0 | H38: 0 | J38: =IF(B38=0,0,((C38/B38)*100)-100) -> 5.0219003053435074 | K38: =IF(C38=0,0,IF(D38=0,0,((C38/D38)*100)-100)) -> 4.4413461013546112 | L38: =IF(F38=0,0,((C38/F38)*100)-100) -> 0 | M38: =IF(G38=0,0,((C38/G38)*100)-100) -> 0 | N38: =IF(C38=0,0,IF(H38=0,0,((C38/H38)*100)-100)) -> 0 | P38: 6550000 | Q38: =IF(P38=0,0,IF(C38=0,0,((C38/P38)*100)-100)) -> 5.0219003053435074 | R38: =IF(C38=0,0,(C38/$C$40)*100) -> 4.5809320185579185 | T38: 16.3 | U38: 15.885015236960093 | V38: =U38-T38 -> -0.41498476303990728
B39: 0 | C39: 0 | D39: 0 | F39: 0 | G39: 0 | H39: 0 | J39: =IF(B39=0,0,((C39/B39)*100)-100) -> 0 | K39: =IF(C39=0,0,IF(D39=0,0,((C39/D39)*100)-100)) -> 0 | L39: =IF(F39=0,0,((C39/F39)*100)-100) -> 0 | M39: =IF(G39=0,0,((C39/G39)*100)-100) -> 0 | N39: =IF(C39=0,0,IF(H39=0,0,((C39/H39)*100)-100)) -> 0 | P39: 0 | Q39: =IF(P39=0,0,IF(C39=0,0,((C39/P39)*100)-100)) -> 0 | R39: =IF(C39=0,0,(C39/$C$40)*100) -> 0 | T39: 0 | U39: 0 | V39: =U39-T39 -> 0
A40: Total Geral | B40: =B21+B34+SUM(B36:B39) -> 139749996 | C40: =C21+C34+SUM(C36:C39) -> 150164517.66 | D40: =D21+D34+SUM(D36:D39) -> 143642558.69999999 | F40: =F21+F34+SUM(F36:F39) -> 117034337.08999999 | G40: =G21+G34+SUM(G36:G39) -> 102762303.75 | H40: =H21+H34+SUM(H36:H39) -> 79098510.769999996 | J40: =IF(C40=0,0,((C40/B40)*100)-100) -> 7.4522518483649804 | K40: =IF(C40=0,0,IF(D40=0,0,((C40/D40)*100)-100)) -> 4.5404085105593452 | L40: =IF(F40=0,0,IF(C40=0,0,((C40/F40)*100)-100)) -> 28.30808580948576 | M40: =IF(G40=0,0,IF(C40=0,0,((C40/G40)*100)-100)) -> 46.128017940625426 | N40: =IF(C40=0,0,IF(H40=0,0,((C40/H40)*100)-100)) -> 89.84493664696592 | P40: =P21+P34+SUM(P36:P39) -> 139750000 | Q40: =IF(C40=0,0,((C40/P40)*100)-100) -> 7.4522487728085878 | R40: =R21+R34+SUM(R36:R39) -> 100 | T40: 16.3 | U40: 15.689886918723115 | V40: =U40-T40 -> -0.61011308127688579
A42: Água Verde | B42: 0 | C42: 0 | D42: 0 | F42: 0 | G42: 0 | H42: 0 | J42: =IF(B42=0,0,((C42/B42)*100)-100) -> 0 | K42: =IF(C42=0,0,IF(D42=0,0,((C42/D42)*100)-100)) -> 0 | L42: =IF(F42=0,0,((C42/F42)*100)-100) -> 0 | M42: =IF(G42=0,0,((C42/G42)*100)-100) -> 0 | N42: =IF(C42=0,0,IF(H42=0,0,((C42/H42)*100)-100)) -> 0 | P42: =B42 -> 0 | Q42: =IF(C42=0,0,IF(P42=0,0,((C42/P42)*100)-100)) -> 0 | R42: =IF(C42=0,0,(C42/$C$40)*100) -> 0 | T42: 14.95 | U42: 0 | V42: =U42-T42 -> -14.95
A43: Total Geral | B43: =B40+B42 -> 139749996 | C43: =C40+C42 -> 150164517.66 | D43: =D40+D42 -> 143642558.69999999 | F43: =F40+F42 -> 117034337.08999999 | G43: =G40+G42 -> 102762303.75 | H43: =H40+H42 -> 79098510.769999996 | J43: =IF(C43=0,0,((C43/B43)*100)-100) -> 7.4522518483649804 | K43: =IF(C43=0,0,IF(D43=0,0,((C43/D43)*100)-100)) -> 4.5404085105593452 | L43: =IF(F43=0,0,IF(C43=0,0,((C43/F43)*100)-100)) -> 28.30808580948576 | M43: =IF(G43=0,0,IF(C43=0,0,((C43/G43)*100)-100)) -> 46.128017940625426 | N43: =IF(C43=0,0,IF(H43=0,0,((C43/H43)*100)-100)) -> 89.84493664696592 | P43: =P40+P42 -> 139750000 | Q43: =IF(C43=0,0,((C43/P43)*100)-100) -> 7.4522487728085878 | R43: =R24+R37+R42 -> 7.5532397111819822 | T43: 16.30992126189399 | U43: 15.689886918723115 | V43: =U43-T43 -> -0.62003434317087525