A2: Perodo: | C2: 37803 | E2: 37833 | H2: Vendas Acumuladas por Filial
C4: Vendas 2003 | G4: Vendas de Anos Anteriores | K4: Percentuais ( % ) | R4: %
A5: Lojas | C5: Previso | D5: Realizada | E5: Ms Anterior | G5: Vendas 2002 | H5: Vendas 2001 | I5: Vendas 2000 | K5: % Prev | L5: % MA | M5: 2002 | N5: 2001 | O5: 2000 | Q5: Previso Ms | R5: Final | S5: Part.
A7: Xaxim | C7: 680000 | D7: 745682.16 | E7: 679171.64 | G7: 512340.54 | H7: 521019.66 | I7: 499954.62 | K7: =IF(C7=0,0,((D7/C7)*100)-100) -> 9.66 | L7: =IF(E7=0,0,((D7/E7)*100)-100) -> 9.79 | M7: =IF(G7=0,0,((D7/G7)*100)-100) -> 45.54 | N7: =IF(H7=0,0,((D7/H7)*100)-100) -> 43.12 | O7: =IF(I7=0,0,((D7/I7)*100)-100) -> 49.15 | Q7: 680000 | R7: =((D7/Q7)*100)-100 -> 9.66 | S7: =D7/$D$31*100 -> 1.73
A8: S. Felicidade | C8: 760000 | D8: 750766.43 | E8: 717339.56 | G8: 531085.65 | H8: 580735.72 | I8: 597725.7 | K8: =IF(C8=0,0,((D8/C8)*100)-100) -> -1.21 | L8: =IF(E8=0,0,((D8/E8)*100)-100) -> 4.66 | M8: =IF(G8=0,0,((D8/G8)*100)-100) -> 41.36 | N8: =IF(H8=0,0,((D8/H8)*100)-100) -> 29.28 | O8: =IF(I8=0,0,((D8/I8)*100)-100) -> 25.6 | Q8: 760000 | R8: =((D8/Q8)*100)-100 -> -1.21 | S8: =D8/$D$31*100 -> 1.75
A9: Lapa | C9: 1000000 | D9: 1060476.23 | E9: 962007.95 | G9: 776127.59 | H9: 649411.87 | I9: 636146.67 | K9: =IF(C9=0,0,((D9/C9)*100)-100) -> 6.05 | L9: =IF(E9=0,0,((D9/E9)*100)-100) -> 10.24 | M9: =IF(G9=0,0,((D9/G9)*100)-100) -> 36.64 | N9: =IF(H9=0,0,((D9/H9)*100)-100) -> 63.3 | O9: =IF(I9=0,0,((D9/I9)*100)-100) -> 66.7 | Q9: 1000000 | R9: =((D9/Q9)*100)-100 -> 6.05 | S9: =D9/$D$31*100 -> 2.47
A10: Araucria | C10: 1050000 | D10: 1008677.08 | E10: 980760.5 | G10: 1576999.49 | H10: 1448353.68 | I10: 1335459.32 | K10: =IF(C10=0,0,((D10/C10)*100)-100) -> -3.94 | L10: =IF(E10=0,0,((D10/E10)*100)-100) -> 2.85 | M10: =IF(G10=0,0,((D10/G10)*100)-100) -> -36.04 | N10: =IF(H10=0,0,((D10/H10)*100)-100) -> -30.36 | O10: =IF(I10=0,0,((D10/I10)*100)-100) -> -24.47 | Q10: 1050000 | R10: =((D10/Q10)*100)-100 -> -3.94 | S10: =D10/$D$31*100 -> 2.35
A11: Pinheirinho | C11: 1890000 | D11: 1866150.99 | E11: 1820985.37 | G11: 1546641.03 | H11: 1631774.15 | I11: 1551909.4 | K11: =IF(C11=0,0,((D11/C11)*100)-100) -> -1.26 | L11: =IF(E11=0,0,((D11/E11)*100)-100) -> 2.48 | M11: =IF(G11=0,0,((D11/G11)*100)-100) -> 20.66 | N11: =IF(H11=0,0,((D11/H11)*100)-100) -> 14.36 | O11: =IF(I11=0,0,((D11/I11)*100)-100) -> 20.25 | Q11: 1890000 | R11: =((D11/Q11)*100)-100 -> -1.26 | S11: =D11/$D$31*100 -> 4.34
A12: Hauer | C12: 2900000 | D12: 2918247.41 | E12: 2735855.32 | G12: 2286292.44 | H12: 2168426.32 | I12: 2067233.6 | K12: =IF(C12=0,0,((D12/C12)*100)-100) -> 00.63 | L12: =IF(E12=0,0,((D12/E12)*100)-100) -> 6.67 | M12: =IF(G12=0,0,((D12/G12)*100)-100) -> 27.64 | N12: =IF(H12=0,0,((D12/H12)*100)-100) -> 34.58 | O12: =IF(I12=0,0,((D12/I12)*100)-100) -> 41.17 | Q12: 2900000 | R12: =((D12/Q12)*100)-100 -> 00.63 | S12: =D12/$D$31*100 -> 6.79
A13: Paranagu | C13: 2980000 | D13: 3144865.27 | E13: 2737778.55 | G13: 2593278.61 | H13: 2364083.6 | I13: 1732272.68 | K13: =IF(C13=0,0,((D13/C13)*100)-100) -> 5.53 | L13: =IF(E13=0,0,((D13/E13)*100)-100) -> 14.87 | M13: =IF(G13=0,0,((D13/G13)*100)-100) -> 21.27 | N13: =IF(H13=0,0,((D13/H13)*100)-100) -> 33.03 | O13: =IF(I13=0,0,((D13/I13)*100)-100) -> 81.55 | Q13: 2980000 | R13: =((D13/Q13)*100)-100 -> 5.53 | S13: =D13/$D$31*100 -> 7.31
A14: Centenrio | C14: 950000 | D14: 936046.91 | E14: 929659.14 | G14: 674207.01 | H14: 655811.19 | I14: 617433.43 | K14: =IF(C14=0,0,((D14/C14)*100)-100) -> -1.47 | L14: =IF(E14=0,0,((D14/E14)*100)-100) -> 00.69 | M14: =IF(G14=0,0,((D14/G14)*100)-100) -> 38.84 | N14: =IF(H14=0,0,((D14/H14)*100)-100) -> 42.73 | O14: =IF(I14=0,0,((D14/I14)*100)-100) -> 51.6 | Q14: 950000 | R14: =((D14/Q14)*100)-100 -> -1.47 | S14: =D14/$D$31*100 -> 2.18
A15: So Brz | C15: 3050000 | D15: 3051671.2 | E15: 3004388.44 | G15: 2356602.95 | H15: 2904761.38 | I15: 2164579.35 | K15: =IF(C15=0,0,((D15/C15)*100)-100) -> 00.05 | L15: =IF(E15=0,0,((D15/E15)*100)-100) -> 1.57 | M15: =IF(G15=0,0,((D15/G15)*100)-100) -> 29.49 | N15: =IF(H15=0,0,((D15/H15)*100)-100) -> 5.06 | O15: =IF(I15=0,0,((D15/I15)*100)-100) -> 40.98 | Q15: 3050000 | R15: =((D15/Q15)*100)-100 -> 00.05 | S15: =D15/$D$31*100 -> 7.1
A16: Arapongas | C16: 560000 | D16: 558280.6 | E16: 541865.63 | G16: 486822.19 | H16: 519015.87 | I16: 484242.91 | K16: =IF(C16=0,0,((D16/C16)*100)-100) -> -00.31 | L16: =IF(E16=0,0,((D16/E16)*100)-100) -> 3.03 | M16: =IF(G16=0,0,((D16/G16)*100)-100) -> 14.68 | N16: =IF(H16=0,0,((D16/H16)*100)-100) -> 7.57 | O16: =IF(I16=0,0,((D16/I16)*100)-100) -> 15.29 | Q16: 560000 | R16: =((D16/Q16)*100)-100 -> -00.31 | S16: =D16/$D$31*100 -> 1.3
A17: Guarapuava | C17: 1350000 | D17: 1344526.41 | E17: 1288308.15 | G17: 837116.02 | H17: 796931.64 | I17: 848645.94 | K17: =IF(C17=0,0,((D17/C17)*100)-100) -> -00.41 | L17: =IF(E17=0,0,((D17/E17)*100)-100) -> 4.36 | M17: =IF(G17=0,0,((D17/G17)*100)-100) -> 60.61 | N17: =IF(H17=0,0,((D17/H17)*100)-100) -> 68.71 | O17: =IF(I17=0,0,((D17/I17)*100)-100) -> 58.43 | Q17: 1350000 | R17: =((D17/Q17)*100)-100 -> -00.41 | S17: =D17/$D$31*100 -> 3.13
A18: Apucarana | C18: 1280000 | D18: 1315361.42 | E18: 1221294.02 | G18: 1089987.27 | H18: 1031595.73 | I18: 1203588.02 | K18: =IF(C18=0,0,((D18/C18)*100)-100) -> 2.76 | L18: =IF(E18=0,0,((D18/E18)*100)-100) -> 7.7 | M18: =IF(G18=0,0,((D18/G18)*100)-100) -> 20.68 | N18: =IF(H18=0,0,((D18/H18)*100)-100) -> 27.51 | O18: =IF(I18=0,0,((D18/I18)*100)-100) -> 9.29 | Q18: 1280000 | R18: =((D18/Q18)*100)-100 -> 2.76 | S18: =D18/$D$31*100 -> 3.06
A19: Ah | C19: 1270000 | D19: 1293034.94 | E19: 1223099.61 | G19: 975821.03 | H19: 1092187 | I19: 1030809.19 | K19: =IF(C19=0,0,((D19/C19)*100)-100) -> 1.81 | L19: =IF(E19=0,0,((D19/E19)*100)-100) -> 5.72 | M19: =IF(G19=0,0,((D19/G19)*100)-100) -> 32.51 | N19: =IF(H19=0,0,((D19/H19)*100)-100) -> 18.39 | O19: =IF(I19=0,0,((D19/I19)*100)-100) -> 25.44 | Q19: 1270000 | R19: =((D19/Q19)*100)-100 -> 1.81 | S19: =D19/$D$31*100 -> 3.01
A20: P.G. Centro | C20: 1600000 | D20: 1670408.89 | E20: 1555339.42 | G20: 1242064.18 | H20: 1053558.58 | I20: 1226419.48 | K20: =IF(C20=0,0,((D20/C20)*100)-100) -> 4.4 | L20: =IF(E20=0,0,((D20/E20)*100)-100) -> 7.4 | M20: =IF(G20=0,0,((D20/G20)*100)-100) -> 34.49 | N20: =IF(H20=0,0,((D20/H20)*100)-100) -> 58.55 | O20: =IF(I20=0,0,((D20/I20)*100)-100) -> 36.2 | Q20: 1600000 | R20: =((D20/Q20)*100)-100 -> 4.4 | S20: =D20/$D$31*100 -> 3.88
A21: Maring | C21: 1990000 | D21: 2044842.44 | E21: 1818607.5 | G21: 1557279.37 | H21: 1589316.59 | I21: 1667575.38 | K21: =IF(C21=0,0,((D21/C21)*100)-100) -> 2.76 | L21: =IF(E21=0,0,((D21/E21)*100)-100) -> 12.44 | M21: =IF(G21=0,0,((D21/G21)*100)-100) -> 31.31 | N21: =IF(H21=0,0,((D21/H21)*100)-100) -> 28.66 | O21: =IF(I21=0,0,((D21/I21)*100)-100) -> 22.62 | Q21: 1990000 | R21: =((D21/Q21)*100)-100 -> 2.76 | S21: =D21/$D$31*100 -> 4.75
A22: Araucria Nova | C22: 1970000 | D22: 1864700.54 | E22: 1844682.46 | G22: 0 | H22: 0 | I22: 0 | K22: =IF(C22=0,0,((D22/C22)*100)-100) -> -5.35 | L22: =IF(E22=0,0,((D22/E22)*100)-100) -> 1.09 | M22: =IF(G22=0,0,((D22/G22)*100)-100) -> 0 | N22: =IF(H22=0,0,((D22/H22)*100)-100) -> 0 | O22: =IF(I22=0,0,((D22/I22)*100)-100) -> 0 | Q22: 1970000 | R22: =((D22/Q22)*100)-100 -> -5.35 | S22: =D22/$D$31*100 -> 4.34
A23: Total Super | C23: =SUM(C7:C22) -> 25280000 | D23: =SUM(D7:D22) -> 25573738.920000002 | E23: =SUM(E7:E22) -> 24061143.260000002 | G23: =SUM(G7:G22) -> 19042665.370000001 | H23: =SUM(H7:H22) -> 19006982.98 | I23: =SUM(I7:I22) -> 17663995.690000001 | J23: =SUM(C23:I23) -> 130628526.22 | K23: =((D23/C23)*100)-100 -> 1.16 | L23: =IF(E23=0,0,((D23/E23)*100)-100) -> 6.29 | M23: =((D23/G23)*100)-100 -> 34.3 | N23: =((D23/H23)*100)-100 -> 34.55 | O23: =IF(I23=0,0,((D23/I23)*100)-100) -> 44.78 | Q23: =SUM(Q7:Q22) -> 25280000 | R23: =((D23/Q23)*100)-100 -> 1.16 | S23: =D23/$D$31*100 -> 59.46
A25: Londrina | C25: 2250000 | D25: 2280900.4 | E25: 2015176.65 | G25: 2007608.11 | H25: 2097438.69 | I25: 0 | K25: =IF(C25=0,0,((D25/C25)*100)-100) -> 1.37 | L25: =IF(E25=0,0,((D25/E25)*100)-100) -> 13.19 | M25: =IF(G25=0,0,((D25/G25)*100)-100) -> 13.61 | N25: =IF(H25=0,0,((D25/H25)*100)-100) -> 8.75 | O25: =IF(I25=0,0,((D25/I25)*100)-100) -> 0 | Q25: 2250000 | R25: =((D25/Q25)*100)-100 -> 1.37 | S25: =D25/$D$31*100 -> 5.3
A26: S.J. Pinhais | C26: 4000000 | D26: 4038347.37 | E26: 3765254 | G26: 3155804.1600000001 | H26: 2762049.72 | I26: 1536510.53 | K26: =IF(C26=0,0,((D26/C26)*100)-100) -> 00.96 | L26: =IF(E26=0,0,((D26/E26)*100)-100) -> 7.25 | M26: =IF(G26=0,0,((D26/G26)*100)-100) -> 27.97 | N26: =IF(H26=0,0,((D26/H26)*100)-100) -> 46.21 | O26: =IF(I26=0,0,((D26/I26)*100)-100) -> 162.83 | Q26: 4000000 | R26: =((D26/Q26)*100)-100 -> 00.96 | S26: =D26/$D$31*100 -> 9.39
A27: P.G. Nova | C27: 3050000 | D27: 2860145.67 | E27: 2746313.95 | G27: 2447725.16 | H27: 2104835.17 | I27: 1823889.84 | K27: =IF(C27=0,0,((D27/C27)*100)-100) -> -6.22 | L27: =IF(E27=0,0,((D27/E27)*100)-100) -> 4.14 | M27: =IF(G27=0,0,((D27/G27)*100)-100) -> 16.85 | N27: =IF(H27=0,0,((D27/H27)*100)-100) -> 35.88 | O27: =IF(I27=0,0,((D27/I27)*100)-100) -> 56.82 | Q27: 3050000 | R27: =((D27/Q27)*100)-100 -> -6.22 | S27: =D27/$D$31*100 -> 6.65
A28: Nilo Peanha | C28: 8420000 | D28: 8253285.0899999999 | E28: 7956505.5800000001 | G28: 5740630.8700000001 | H28: 0 | I28: 0 | K28: =IF(C28=0,0,((D28/C28)*100)-100) -> -1.98 | L28: =IF(E28=0,0,((D28/E28)*100)-100) -> 3.73 | M28: =IF(G28=0,0,((D28/G28)*100)-100) -> 43.77 | N28: =IF(H28=0,0,((D28/H28)*100)-100) -> 0 | O28: =IF(I28=0,0,((D28/I28)*100)-100) -> 0 | Q28: 8420000 | R28: =((D28/Q28)*100)-100 -> -1.98 | S28: =D28/$D$31*100 -> 19.19
A29: Total Hiper | C29: =SUM(C25:C28) -> 17720000 | D29: =SUM(D25:D28) -> 17432678.530000001 | E29: =SUM(E25:E28) -> 16483250.18 | G29: =SUM(G25:G28) -> 13351768.300000001 | H29: =SUM(H25:H28) -> 6964323.5800000001 | I29: =SUM(I25:I28) -> 3360400.37 | J29: =SUM(C29:I29) -> 75312420.959999993 | K29: =((D29/C29)*100)-100 -> -1.62 | L29: =IF(E29=0,0,((D29/E29)*100)-100) -> 5.76 | M29: =((D29/G29)*100)-100 -> 30.56 | N29: =((D29/H29)*100)-100 -> 150.31 | O29: =IF(I29=0,0,((D29/I29)*100)-100) -> 418.77 | Q29: =SUM(Q25:Q28) -> 17720000 | R29: =((D29/Q29)*100)-100 -> -1.62 | S29: =D29/$D$31*100 -> 40.54
A31: Total Geral | C31: =C23+C29 -> 43000000 | D31: =D23+D29 -> 43006417.450000003 | E31: =E23+E29 -> 40544393.439999998 | G31: =G23+G29 -> 32394433.670000002 | H31: =H23+H29 -> 25971306.559999999 | I31: =I23+I29 -> 21024396.059999999 | K31: =((D31/C31)*100)-100 -> 00.01 | L31: =IF(E31=0,0,((D31/E31)*100)-100) -> 6.07 | M31: =((D31/G31)*100)-100 -> 32.76 | N31: =((D31/H31)*100)-100 -> 65.59 | O31: =IF(I31=0,0,((D31/I31)*100)-100) -> 104.55 | Q31: =Q23+Q29 -> 43000000 | R31: =((D31/Q31)*100)-100 -> 00.01 | S31: =S23+S29 -> 100
C32: Resumo por Regio - Outubro/2002
C33: Descrio das Aberturas | H33: Valor | I33: %
C34: Curitiba (2,3,6,7,10,11,17,21) | H34: =D7+D8+D11+D12+D14+D15+D19+D28 -> 19814885 | I34: =H34/$D$31 -> 0.4607
C35: Curitiba e Metrop. (Ctba. 4,5,8,14,23) | H35: =H34+D9+D10+D13+D27+D22 -> 29753750 | I35: =H35/$D$31 -> 0.69179999999999997
C36: Metropolitana (4,5,8,14,23) | H36: =H35-H34 -> 9938865 | I36: =H36/$D$31 -> 0.2311
C37: Norte (9,12,15,20) | H37: =D25+D16+D18+D22 -> 6019243 | I37: =H37/$D$31 -> 00.14
C38: Centro-Oeste (13,18,19) | H38: =D17+D20+D27 -> 5875081 | I38: =H38/$D$31 -> 0.1366
C39: Ponta Grossa (18,19) | H39: =H38-D17 -> 4530555 | I39: =H39/$D$31 -> 0.1053
C40: Super (2,3,4,5,6,7,8,10,11,12,13,15,17,18,20,23) | H40: =D23 -> 25573739 | I40: =H40/$D$31 -> 0.59460000000000002
C41: Hiper (9,14,19,21) | H41: =D29 -> 17432679 | I41: =H41/$D$31 -> 0.40539999999999998
C42: Curitiba, Metropolitana e Centro-Oeste | H42: =D31-H37 -> 36987174 | I42: =H42/$D$31 -> 00.86
C43: Araucria | H43: =D10+D22 -> 2873378 | I43: =H43/$D$31 -> 6.6799999999999998E-2