A2: Perodo: | C2: 38078 | E2: 38107 | H2: Vendas Acumuladas por Filial | Q2: =NOW() -> 38188.613989236102
A4: v.1 | C4: Vendas 2004 | G4: Vendas de Anos Anteriores | K4: Percentuais ( % ) | Q4: Meta Mensal | U4: Margem
A5: Lojas | C5: Previso | D5: Realizada | E5: Ms Anterior | G5: Vendas 2003 | H5: Vendas 2002 | I5: Vendas 2001 | K5: % Prev | L5: % MA | M5: 2003 | N5: 2002 | O5: 2001 | Q5: Previso Ms | R5: Final | S5: Part. | U5: Meta | V5: Real
A7: Xaxim | C7: 780000 | D7: 805540 | E7: 726814 | G7: 705281 | H7: 536632 | I7: 525195 | K7: =IF(C7=0,0,((D7/C7)*100)-100) -> 3.27 | L7: =IF(D7=0,0,IF(E7=0,0,((D7/E7)*100)-100)) -> 10.83 | M7: =IF(G7=0,0,((D7/G7)*100)-100) -> 14.22 | N7: =IF(H7=0,0,((D7/H7)*100)-100) -> 50.11 | O7: =IF(D7=0,0,IF(I7=0,0,((D7/I7)*100)-100)) -> 53.38 | Q7: 780000 | R7: =IF(D7=0,0,((D7/Q7)*100)-100) -> 3.27 | S7: =IF(D7=0,0,(D7/$D$32)*100) -> 1.6 | U7: 16.39 | V7: 14.5
A8: S. Felicidade | C8: 760000 | D8: 713656 | E8: 662420 | G8: 756536 | H8: 507659 | I8: 561670 | K8: =IF(C8=0,0,((D8/C8)*100)-100) -> -6.1 | L8: =IF(D8=0,0,IF(E8=0,0,((D8/E8)*100)-100)) -> 7.73 | M8: =IF(G8=0,0,((D8/G8)*100)-100) -> -5.67 | N8: =IF(H8=0,0,((D8/H8)*100)-100) -> 40.58 | O8: =IF(D8=0,0,IF(I8=0,0,((D8/I8)*100)-100)) -> 27.06 | Q8: 760000 | R8: =IF(D8=0,0,((D8/Q8)*100)-100) -> -6.1 | S8: =IF(D8=0,0,(D8/$D$32)*100) -> 1.41 | U8: 17.24 | V8: 16.06
A9: Lapa | C9: 1238000 | D9: 1215860 | E9: 1087978 | G9: 1078805 | H9: 751829 | I9: 690459 | K9: =IF(C9=0,0,((D9/C9)*100)-100) -> -1.79 | L9: =IF(D9=0,0,IF(E9=0,0,((D9/E9)*100)-100)) -> 11.75 | M9: =IF(G9=0,0,((D9/G9)*100)-100) -> 12.7 | N9: =IF(H9=0,0,((D9/H9)*100)-100) -> 61.72 | O9: =IF(D9=0,0,IF(I9=0,0,((D9/I9)*100)-100)) -> 76.09 | Q9: 1238000 | R9: =IF(D9=0,0,((D9/Q9)*100)-100) -> -1.79 | S9: =IF(D9=0,0,(D9/$D$32)*100) -> 2.41 | U9: 15.99 | V9: 14.6
A10: Araucria | C10: 1100000 | D10: 1104134 | E10: 955077 | G10: 1164095 | H10: 1336969 | I10: 1468980 | K10: =IF(C10=0,0,((D10/C10)*100)-100) -> 00.38 | L10: =IF(D10=0,0,IF(E10=0,0,((D10/E10)*100)-100)) -> 15.61 | M10: =IF(G10=0,0,((D10/G10)*100)-100) -> -5.15 | N10: =IF(H10=0,0,((D10/H10)*100)-100) -> -17.42 | O10: =IF(D10=0,0,IF(I10=0,0,((D10/I10)*100)-100)) -> -24.84 | Q10: 1100000 | R10: =IF(D10=0,0,((D10/Q10)*100)-100) -> 00.38 | S10: =IF(D10=0,0,(D10/$D$32)*100) -> 2.19 | U10: 17.11 | V10: 15.46
A11: Pinheirinho | C11: 2200000 | D11: 2097557 | E11: 1878353 | G11: 1971919 | H11: 1487836 | I11: 1717615 | K11: =IF(C11=0,0,((D11/C11)*100)-100) -> -4.66 | L11: =IF(D11=0,0,IF(E11=0,0,((D11/E11)*100)-100)) -> 11.67 | M11: =IF(G11=0,0,((D11/G11)*100)-100) -> 6.37 | N11: =IF(H11=0,0,((D11/H11)*100)-100) -> 40.98 | O11: =IF(D11=0,0,IF(I11=0,0,((D11/I11)*100)-100)) -> 22.12 | Q11: 2200000 | R11: =IF(D11=0,0,((D11/Q11)*100)-100) -> -4.66 | S11: =IF(D11=0,0,(D11/$D$32)*100) -> 4.15 | U11: 16.25 | V11: 13.87
A12: Hauer | C12: 3160000 | D12: 3019480 | E12: 2747488 | G12: 2916807 | H12: 2104929 | I12: 2184630 | K12: =IF(C12=0,0,((D12/C12)*100)-100) -> -4.45 | L12: =IF(D12=0,0,IF(E12=0,0,((D12/E12)*100)-100)) -> 9.9 | M12: =IF(G12=0,0,((D12/G12)*100)-100) -> 3.52 | N12: =IF(H12=0,0,((D12/H12)*100)-100) -> 43.45 | O12: =IF(D12=0,0,IF(I12=0,0,((D12/I12)*100)-100)) -> 38.21 | Q12: 3160000 | R12: =IF(D12=0,0,((D12/Q12)*100)-100) -> -4.45 | S12: =IF(D12=0,0,(D12/$D$32)*100) -> 5.98 | U12: 16.05 | V12: 15.38
A13: Paranagu | C13: 3520000 | D13: 3511810 | E13: 3201285 | G13: 3265218 | H13: 2332842 | I13: 2307947 | K13: =IF(C13=0,0,((D13/C13)*100)-100) -> -00.23 | L13: =IF(D13=0,0,IF(E13=0,0,((D13/E13)*100)-100)) -> 9.7 | M13: =IF(G13=0,0,((D13/G13)*100)-100) -> 7.55 | N13: =IF(H13=0,0,((D13/H13)*100)-100) -> 50.54 | O13: =IF(D13=0,0,IF(I13=0,0,((D13/I13)*100)-100)) -> 52.16 | Q13: 3520000 | R13: =IF(D13=0,0,((D13/Q13)*100)-100) -> -00.23 | S13: =IF(D13=0,0,(D13/$D$32)*100) -> 6.95 | U13: 16.94 | V13: 15.8
A14: Centenrio | C14: 990000 | D14: 949309 | E14: 846451 | G14: 886703 | H14: 677267 | I14: 650803 | K14: =IF(C14=0,0,((D14/C14)*100)-100) -> -4.11 | L14: =IF(D14=0,0,IF(E14=0,0,((D14/E14)*100)-100)) -> 12.15 | M14: =IF(G14=0,0,((D14/G14)*100)-100) -> 7.06 | N14: =IF(H14=0,0,((D14/H14)*100)-100) -> 40.17 | O14: =IF(D14=0,0,IF(I14=0,0,((D14/I14)*100)-100)) -> 45.87 | Q14: 990000 | R14: =IF(D14=0,0,((D14/Q14)*100)-100) -> -4.11 | S14: =IF(D14=0,0,(D14/$D$32)*100) -> 1.88 | U14: 16.8 | V14: 14.47
A15: Arapongas | C15: 0 | D15: 0 | E15: 0 | G15: 656877 | H15: 489493 | I15: 587258 | K15: =IF(C15=0,0,((D15/C15)*100)-100) -> 0 | L15: =IF(D15=0,0,IF(E15=0,0,((D15/E15)*100)-100)) -> 0 | M15: =IF(D15=0,0,IF(G15=0,0,((D15/G15)*100)-100)) -> 0 | N15: =IF(D15=0,0,IF(H15=0,0,((D15/H15)*100)-100)) -> 0 | O15: =IF(D15=0,0,IF(I15=0,0,((D15/I15)*100)-100)) -> 0 | Q15: 0 | R15: =IF(D15=0,0,((D15/Q15)*100)-100) -> 0 | S15: =IF(D15=0,0,(D15/$D$32)*100) -> 0 | U15: 0 | V15: 0
A16: So Brz | C16: 3340000 | D16: 2976538 | E16: 2909061 | G16: 3019719 | H16: 2135079 | I16: 2470481 | K16: =IF(C16=0,0,((D16/C16)*100)-100) -> -10.88 | L16: =IF(D16=0,0,IF(E16=0,0,((D16/E16)*100)-100)) -> 2.32 | M16: =IF(G16=0,0,((D16/G16)*100)-100) -> -1.43 | N16: =IF(H16=0,0,((D16/H16)*100)-100) -> 39.41 | O16: =IF(D16=0,0,IF(I16=0,0,((D16/I16)*100)-100)) -> 20.48 | Q16: 3340000 | R16: =IF(D16=0,0,((D16/Q16)*100)-100) -> -10.88 | S16: =IF(D16=0,0,(D16/$D$32)*100) -> 5.89 | U16: 15.54 | V16: 14.84
A17: Guarapuava | C17: 1680000 | D17: 1751058 | E17: 1548924 | G17: 1486376 | H17: 704613 | I17: 970805 | K17: =IF(C17=0,0,((D17/C17)*100)-100) -> 4.23 | L17: =IF(D17=0,0,IF(E17=0,0,((D17/E17)*100)-100)) -> 13.05 | M17: =IF(G17=0,0,((D17/G17)*100)-100) -> 17.81 | N17: =IF(H17=0,0,((D17/H17)*100)-100) -> 148.51 | O17: =IF(D17=0,0,IF(I17=0,0,((D17/I17)*100)-100)) -> 80.37 | Q17: 1680000 | R17: =IF(D17=0,0,((D17/Q17)*100)-100) -> 4.23 | S17: =IF(D17=0,0,(D17/$D$32)*100) -> 3.47 | U17: 16.94 | V17: 15.43
A18: Apucarana | C18: 1650000 | D18: 1641009 | E18: 1473884 | G18: 1504472 | H18: 1061197 | I18: 1250109 | K18: =IF(C18=0,0,((D18/C18)*100)-100) -> -00.54 | L18: =IF(D18=0,0,IF(E18=0,0,((D18/E18)*100)-100)) -> 11.34 | M18: =IF(G18=0,0,((D18/G18)*100)-100) -> 9.08 | N18: =IF(H18=0,0,((D18/H18)*100)-100) -> 54.64 | O18: =IF(D18=0,0,IF(I18=0,0,((D18/I18)*100)-100)) -> 31.27 | Q18: 1650000 | R18: =IF(D18=0,0,((D18/Q18)*100)-100) -> -00.54 | S18: =IF(D18=0,0,(D18/$D$32)*100) -> 3.25 | U18: 16.35 | V18: 16.24
A19: Ah | C19: 1220000 | D19: 1096104 | E19: 1068945 | G19: 1322206 | H19: 980790 | I19: 1161599 | K19: =IF(C19=0,0,((D19/C19)*100)-100) -> -10.16 | L19: =IF(D19=0,0,IF(E19=0,0,((D19/E19)*100)-100)) -> 2.54 | M19: =IF(G19=0,0,((D19/G19)*100)-100) -> -17.1 | N19: =IF(H19=0,0,((D19/H19)*100)-100) -> 11.76 | O19: =IF(D19=0,0,IF(I19=0,0,((D19/I19)*100)-100)) -> -5.64 | Q19: 1220000 | R19: =IF(D19=0,0,((D19/Q19)*100)-100) -> -10.16 | S19: =IF(D19=0,0,(D19/$D$32)*100) -> 2.17 | U19: 17.24 | V19: 15.48
A20: P.G. Centro | C20: 1900000 | D20: 1799929 | E20: 1688433 | G20: 1776703 | H20: 1203379 | I20: 1271118 | K20: =IF(C20=0,0,((D20/C20)*100)-100) -> -5.27 | L20: =IF(D20=0,0,IF(E20=0,0,((D20/E20)*100)-100)) -> 6.6 | M20: =IF(G20=0,0,((D20/G20)*100)-100) -> 1.31 | N20: =IF(H20=0,0,((D20/H20)*100)-100) -> 49.57 | O20: =IF(D20=0,0,IF(I20=0,0,((D20/I20)*100)-100)) -> 41.6 | Q20: 1900000 | R20: =IF(D20=0,0,((D20/Q20)*100)-100) -> -5.27 | S20: =IF(D20=0,0,(D20/$D$32)*100) -> 3.56 | U20: 17.44 | V20: 16.77
A21: Maring | C21: 2400000 | D21: 2332592 | E21: 2096430 | G21: 2180025 | H21: 1566572 | I21: 1755402 | K21: =IF(C21=0,0,((D21/C21)*100)-100) -> -2.81 | L21: =IF(D21=0,0,IF(E21=0,0,((D21/E21)*100)-100)) -> 11.26 | M21: =IF(G21=0,0,((D21/G21)*100)-100) -> 7 | N21: =IF(H21=0,0,((D21/H21)*100)-100) -> 48.9 | O21: =IF(D21=0,0,IF(I21=0,0,((D21/I21)*100)-100)) -> 32.88 | Q21: 2400000 | R21: =IF(D21=0,0,((D21/Q21)*100)-100) -> -2.81 | S21: =IF(D21=0,0,(D21/$D$32)*100) -> 4.62 | U21: 17.39 | V21: 15.78
A22: Araucria Nova | C22: 2200000 | D22: 2110050 | E22: 1932605 | G22: 1940028 | H22: 0 | I22: 0 | K22: =IF(C22=0,0,((D22/C22)*100)-100) -> -4.09 | L22: =IF(D22=0,0,IF(E22=0,0,((D22/E22)*100)-100)) -> 9.18 | M22: =IF(G22=0,0,((D22/G22)*100)-100) -> 8.76 | N22: =IF(H22=0,0,((D22/H22)*100)-100) -> 0 | O22: =IF(D22=0,0,IF(I22=0,0,((D22/I22)*100)-100)) -> 0 | Q22: 2200000 | R22: =IF(D22=0,0,((D22/Q22)*100)-100) -> -4.09 | S22: =IF(D22=0,0,(D22/$D$32)*100) -> 4.18 | U22: 16.95 | V22: 15.72
A23: Total Super | C23: =SUM(C7:C22) -> 28138000 | D23: =SUM(D7:D22) -> 27124626 | E23: =SUM(E7:E22) -> 24824148 | G23: =SUM(G7:G22) -> 26631770 | H23: =SUM(H7:H22) -> 17877086 | I23: =SUM(I7:I22) -> 19574071 | J23: =SUM(C23:I23) -> 144169701 | K23: =IF(D23=0,0,((D23/C23)*100)-100) -> -3.6 | L23: =IF(D23=0,0,IF(E23=0,0,((D23/E23)*100)-100)) -> 9.27 | M23: =IF(G23=0,0,IF(D23=0,0,((D23/G23)*100)-100)) -> 1.85 | N23: =IF(H23=0,0,IF(D23=0,0,((D23/H23)*100)-100)) -> 51.73 | O23: =IF(D23=0,0,IF(I23=0,0,((D23/I23)*100)-100)) -> 38.57 | Q23: =SUM(Q7:Q22) -> 28138000 | R23: =IF(D23=0,0,((D23/Q23)*100)-100) -> -3.6 | S23: =IF(D23=0,0,(D23/$D$32)*100) -> 53.71 | U23: 16.73 | V23: 15.16
A25: Londrina | C25: 2440000 | D25: 2344414 | E25: 2125125 | G25: 2255224 | H25: 1860444 | I25: 1910414 | K25: =IF(C25=0,0,((D25/C25)*100)-100) -> -3.92 | L25: =IF(D25=0,0,IF(E25=0,0,((D25/E25)*100)-100)) -> 10.32 | M25: =IF(G25=0,0,((D25/G25)*100)-100) -> 3.95 | N25: =IF(H25=0,0,((D25/H25)*100)-100) -> 26.01 | O25: =IF(D25=0,0,IF(I25=0,0,((D25/I25)*100)-100)) -> 22.72 | Q25: 2440000 | R25: =IF(D25=0,0,((D25/Q25)*100)-100) -> -3.92 | S25: =IF(D25=0,0,(D25/$D$32)*100) -> 4.64 | U25: 17.41 | V25: 14.28
A26: S.J. Pinhais | C26: 4550000 | D26: 4259322 | E26: 3967363 | G26: 3994726 | H26: 2963372 | I26: 2651825 | K26: =IF(C26=0,0,((D26/C26)*100)-100) -> -6.39 | L26: =IF(D26=0,0,IF(E26=0,0,((D26/E26)*100)-100)) -> 7.36 | M26: =IF(G26=0,0,((D26/G26)*100)-100) -> 6.62 | N26: =IF(H26=0,0,((D26/H26)*100)-100) -> 43.73 | O26: =IF(D26=0,0,IF(I26=0,0,((D26/I26)*100)-100)) -> 60.62 | Q26: 4550000 | R26: =IF(D25=0,0,((D26/Q26)*100)-100) -> -6.39 | S26: =IF(D26=0,0,(D26/$D$32)*100) -> 8.43 | U26: 15.85 | V26: 14.62
A27: P.G. Nova | C27: 3400000 | D27: 3435618 | E27: 3046593 | G27: 3068031 | H27: 2397847 | I27: 2295342 | K27: =IF(C27=0,0,((D27/C27)*100)-100) -> 1.05 | L27: =IF(D27=0,0,IF(E27=0,0,((D27/E27)*100)-100)) -> 12.77 | M27: =IF(G27=0,0,((D27/G27)*100)-100) -> 11.98 | N27: =IF(H27=0,0,((D27/H27)*100)-100) -> 43.28 | O27: =IF(D27=0,0,IF(I27=0,0,((D27/I27)*100)-100)) -> 49.68 | Q27: 3400000 | R27: =IF(D26=0,0,((D27/Q27)*100)-100) -> 1.05 | S27: =IF(D27=0,0,(D27/$D$32)*100) -> 6.8 | U27: 16.04 | V27: 15.27
A28: Nilo Peanha | C28: 8400000 | D28: 7829163 | E28: 8101747 | G28: 8042823 | H28: 5723909 | I28: 0 | K28: =IF(C28=0,0,((D28/C28)*100)-100) -> -6.8 | L28: =IF(D28=0,0,IF(E28=0,0,((D28/E28)*100)-100)) -> -3.36 | M28: =IF(G28=0,0,((D28/G28)*100)-100) -> -2.66 | N28: =IF(H28=0,0,((D28/H28)*100)-100) -> 36.78 | O28: =IF(D28=0,0,IF(I28=0,0,((D28/I28)*100)-100)) -> 0 | Q28: 8400000 | R28: =IF(D26=0,0,((D28/Q28)*100)-100) -> -6.8 | S28: =IF(D28=0,0,(D28/$D$32)*100) -> 15.5 | U28: 15.65 | V28: 14.35
A29: Champagnat | C29: 6000000 | D29: 5507896 | E29: 2359955 | G29: 0 | H29: 0 | I29: 0 | K29: =IF(C29=0,0,((D29/C29)*100)-100) -> -8.2 | L29: =IF(D29=0,0,IF(E29=0,0,((D29/E29)*100)-100)) -> 133.39 | M29: =IF(G29=0,0,((D29/G29)*100)-100) -> 0 | N29: =IF(H29=0,0,((D29/H29)*100)-100) -> 0 | O29: =IF(D29=0,0,IF(I29=0,0,((D29/I29)*100)-100)) -> 0 | Q29: 6000000 | R29: 0 | S29: =IF(D29=0,0,(D29/$D$32)*100) -> 10.91 | U29: 14.05 | V29: 11.61
A30: Total Hiper | C30: =SUM(C25:C29) -> 24790000 | D30: =SUM(D25:D29) -> 23376413 | E30: =SUM(E25:E29) -> 19600783 | G30: =SUM(G25:G29) -> 17360804 | H30: =SUM(H25:H29) -> 12945572 | I30: =SUM(I25:I29) -> 6857581 | J30: =SUM(C30:I30) -> 104931153 | K30: =IF(D30=0,0,((D30/C30)*100)-100) -> -5.7 | L30: =IF(D30=0,0,IF(E30=0,0,((D30/E30)*100)-100)) -> 19.26 | M30: =IF(G30=0,0,IF(D30=0,0,((D30/G30)*100)-100)) -> 34.65 | N30: =IF(H30=0,0,IF(D30=0,0,((D30/H30)*100)-100)) -> 80.57 | O30: =IF(D30=0,0,IF(I30=0,0,((D30/I30)*100)-100)) -> 240.88 | Q30: =SUM(Q25:Q29) -> 24790000 | R30: =IF(D30=0,0,((D30/Q30)*100)-100) -> -5.7 | S30: =IF(D30=0,0,(D30/$D$32)*100) -> 46.29 | U30: 15.53 | V30: 14.4
A32: Total Geral | C32: =C23+C30 -> 52928000 | D32: =D23+D30 -> 50501039 | E32: =E23+E30 -> 44424931 | G32: =G23+G30 -> 43992574 | H32: =H23+H30 -> 30822658 | I32: =I23+I30 -> 26431652 | K32: =IF(D30=0,0,((D32/C32)*100)-100) -> -4.59 | L32: =IF(D32=0,0,IF(E32=0,0,((D32/E32)*100)-100)) -> 13.68 | M32: =IF(G32=0,0,IF(D32=0,0,((D32/G32)*100)-100)) -> 14.79 | N32: =IF(H32=0,0,IF(D32=0,0,((D32/H32)*100)-100)) -> 63.84 | O32: =IF(D32=0,0,IF(I32=0,0,((D32/I32)*100)-100)) -> 91.06 | Q32: =Q23+Q30 -> 52928000 | R32: =IF(D32=0,0,((D32/Q32)*100)-100) -> -4.59 | S32: =S23+S30 -> 100 | U32: 16.11 | V32: 14.7
C33: Resumo por Regio - Outubro/2002
C34: Descrio das Aberturas | H34: Valor | I34: %
C35: Curitiba (2,3,6,7,10,11,17,21,22) | H35: =D7+D8+D11+D12+D14+D16+D19+D28+D29 -> 24995243 | I35: =IF(D32=0,0,H35/$D$32) -> 0.49490000000000001
C36: Curitiba e Metrop. (Ctba. 4,5,8,14,23) | H36: =H35+D9+D10+D13+D27+D22 -> 36372715 | I36: =IF(D32=0,0,H36/$D$32) -> 0.72019999999999995
C37: Metropolitana (4,5,8,14,23) | H37: =H36-H35 -> 11377472 | I37: =IF(D32=0,0,H37/$D$32) -> 0.2253
C38: Norte (9,15,20) | H38: =D25+D18+D22 -> 6095473 | I38: =IF(D32=0,0,H38/$D$32) -> 0.1207
C39: Centro-Oeste (13,18,19) | H39: =D17+D20+D27 -> 6986605 | I39: =IF(D32=0,0,H39/$D$32) -> 0.13830000000000001
C40: Ponta Grossa (18,19) | H40: =H39-D17 -> 5235547 | I40: =IF(D32=0,0,H40/$D$32) -> 0.1037
C41: Super (2,3,4,5,6,7,8,10,11,13,15,17,18,20,23) | H41: =D23 -> 27124626 | I41: =IF(D32=0,0,H41/$D$32) -> 0.53710000000000002
C42: Hiper (9,14,19,21,22) | H42: =D30 -> 23376413 | I42: =IF(D32=0,0,H42/$D$32) -> 0.46289999999999998
C43: Curitiba, Metropolitana e Centro-Oeste | H43: =D32-H38 -> 44405566 | I43: =IF(D32=0,0,H43/$D$32) -> 0.87929999999999997
C44: Araucria | H44: =D10+D22 -> 3214184 | I44: =IF(D32=0,0,H44/$D$32) -> 6.3600000000000004E-2