A2: Periodo: | C2: 38808 | D2: a | E2: 38837 | H2: Vendas Acumuladas por Filial | Q2: =NOW() -> 38849.392410532397
A4: v.1 | C4: Vendas 2006 | G4: Vendas de Anos Anteriores | K4: Percentuais ( % ) | Q4: Meta Mensal | U4: Margem
A5: Lojas | C5: Previsao | D5: Realizada | E5: Mes Anterior | G5: Vendas 2005 | H5: Vendas 2004 | I5: Vendas 2003 | K5: % Prev | L5: % MA | M5: 2005 | N5: 2004 | O5: 2003 | Q5: Previsao Mes | R5: Final | S5: Part. | U5: Meta | V5: Condor
A7: Xaxim | C7: 866081 | D7: 754244 | E7: 707279 | G7: 784915 | H7: 805540 | I7: 705281 | K7: =IF(C7=0,0,((D7/C7)*100)-100) -> -12.91 | L7: =IF(D7=0,0,IF(E7=0,0,((D7/E7)*100)-100)) -> 6.64 | M7: =IF(G7=0,0,((D7/G7)*100)-100) -> -3.91 | N7: =IF(H7=0,0,((D7/H7)*100)-100) -> -6.37 | O7: =IF(D7=0,0,IF(I7=0,0,((D7/I7)*100)-100)) -> 6.94 | Q7: 866081 | R7: =IF(D7=0,0,((D7/Q7)*100)-100) -> -12.91 | S7: =IF(D7=0,0,(D7/$D$35)*100) -> 1.18 | U7: 16.4 | V7: 14.07
A8: S. Felicidade | C8: 860000 | D8: 820021 | E8: 783784 | G8: 769116 | H8: 713656 | I8: 756536 | K8: =IF(C8=0,0,((D8/C8)*100)-100) -> -4.65 | L8: =IF(D8=0,0,IF(E8=0,0,((D8/E8)*100)-100)) -> 4.62 | M8: =IF(G8=0,0,((D8/G8)*100)-100) -> 6.62 | N8: =IF(H8=0,0,((D8/H8)*100)-100) -> 14.9 | O8: =IF(D8=0,0,IF(I8=0,0,((D8/I8)*100)-100)) -> 8.39 | Q8: 860000 | R8: =IF(D8=0,0,((D8/Q8)*100)-100) -> -4.65 | S8: =IF(D8=0,0,(D8/$D$35)*100) -> 1.28 | U8: 16.5 | V8: 14.96
A9: Lapa | C9: 1390000 | D9: 1593658 | E9: 1338989 | G9: 1166636 | H9: 1215860 | I9: 1078805 | K9: =IF(C9=0,0,((D9/C9)*100)-100) -> 14.65 | L9: =IF(D9=0,0,IF(E9=0,0,((D9/E9)*100)-100)) -> 19.02 | M9: =IF(G9=0,0,((D9/G9)*100)-100) -> 36.6 | N9: =IF(H9=0,0,((D9/H9)*100)-100) -> 31.07 | O9: =IF(D9=0,0,IF(I9=0,0,((D9/I9)*100)-100)) -> 47.72 | Q9: 1390000 | R9: =IF(D9=0,0,((D9/Q9)*100)-100) -> 14.65 | S9: =IF(D9=0,0,(D9/$D$35)*100) -> 2.49 | U9: 16.25 | V9: 14.41
A10: Araucaria | C10: 1295000 | D10: 1077809 | E10: 1014386 | G10: 986346 | H10: 1104134 | I10: 1164095 | K10: =IF(C10=0,0,((D10/C10)*100)-100) -> -16.77 | L10: =IF(D10=0,0,IF(E10=0,0,((D10/E10)*100)-100)) -> 6.25 | M10: =IF(G10=0,0,((D10/G10)*100)-100) -> 9.27 | N10: =IF(H10=0,0,((D10/H10)*100)-100) -> -2.38 | O10: =IF(D10=0,0,IF(I10=0,0,((D10/I10)*100)-100)) -> -7.41 | Q10: 1295000 | R10: =IF(D10=0,0,((D10/Q10)*100)-100) -> -16.77 | S10: =IF(D10=0,0,(D10/$D$35)*100) -> 1.69 | U10: 17.55 | V10: 15.57
A11: Pinheirinho | C11: 2500000 | D11: 2196079 | E11: 1906209 | G11: 1990911 | H11: 2097557 | I11: 1971919 | K11: =IF(C11=0,0,((D11/C11)*100)-100) -> -12.16 | L11: =IF(D11=0,0,IF(E11=0,0,((D11/E11)*100)-100)) -> 15.21 | M11: =IF(G11=0,0,((D11/G11)*100)-100) -> 10.31 | N11: =IF(H11=0,0,((D11/H11)*100)-100) -> 4.7 | O11: =IF(D11=0,0,IF(I11=0,0,((D11/I11)*100)-100)) -> 11.37 | Q11: 2500000 | R11: =IF(D11=0,0,((D11/Q11)*100)-100) -> -12.16 | S11: =IF(D11=0,0,(D11/$D$35)*100) -> 3.43 | U11: 16.8 | V11: 13.36
A12: Hauer | C12: 3650000 | D12: 3398737 | E12: 3086552 | G12: 3196391 | H12: 3019480 | I12: 2916807 | K12: =IF(C12=0,0,((D12/C12)*100)-100) -> -6.88 | L12: =IF(D12=0,0,IF(E12=0,0,((D12/E12)*100)-100)) -> 10.11 | M12: =IF(G12=0,0,((D12/G12)*100)-100) -> 6.33 | N12: =IF(H12=0,0,((D12/H12)*100)-100) -> 12.56 | O12: =IF(D12=0,0,IF(I12=0,0,((D12/I12)*100)-100)) -> 16.52 | Q12: 3650000 | R12: =IF(D12=0,0,((D12/Q12)*100)-100) -> -6.88 | S12: =IF(D12=0,0,(D12/$D$35)*100) -> 5.31 | U12: 16.96 | V12: 15.53
A13: Paranagua | C13: 2200000 | D13: 1724412 | E13: 1563844 | G13: 1763034 | H13: 3511810 | I13: 3265218 | K13: =IF(C13=0,0,((D13/C13)*100)-100) -> -21.62 | L13: =IF(D13=0,0,IF(E13=0,0,((D13/E13)*100)-100)) -> 10.27 | M13: =IF(G13=0,0,((D13/G13)*100)-100) -> -2.19 | N13: =IF(H13=0,0,((D13/H13)*100)-100) -> -50.9 | O13: =IF(D13=0,0,IF(I13=0,0,((D13/I13)*100)-100)) -> -47.19 | Q13: 2200000 | R13: =IF(D13=0,0,((D13/Q13)*100)-100) -> -21.62 | S13: =IF(D13=0,0,(D13/$D$35)*100) -> 2.7 | U13: 17.4 | V13: 15.84
A14: Centenario | C14: 1123000 | D14: 975696 | E14: 926040 | G14: 947018 | H14: 949309 | I14: 886703 | K14: =IF(C14=0,0,((D14/C14)*100)-100) -> -13.12 | L14: =IF(D14=0,0,IF(E14=0,0,((D14/E14)*100)-100)) -> 5.36 | M14: =IF(G14=0,0,((D14/G14)*100)-100) -> 3.03 | N14: =IF(H14=0,0,((D14/H14)*100)-100) -> 2.78 | O14: =IF(D14=0,0,IF(I14=0,0,((D14/I14)*100)-100)) -> 10.04 | Q14: 1123000 | R14: =IF(D14=0,0,((D14/Q14)*100)-100) -> -13.12 | S14: =IF(D14=0,0,(D14/$D$35)*100) -> 1.53 | U14: 16.6 | V14: 14.57
A15: Arapongas | C15: 0 | D15: 0 | E15: 0 | G15: 0 | H15: 0 | I15: 0 | K15: =IF(C15=0,0,((D15/C15)*100)-100) -> 0 | L15: =IF(D15=0,0,IF(E15=0,0,((D15/E15)*100)-100)) -> 0 | M15: =IF(D15=0,0,IF(G15=0,0,((D15/G15)*100)-100)) -> 0 | N15: =IF(D15=0,0,IF(H15=0,0,((D15/H15)*100)-100)) -> 0 | O15: =IF(D15=0,0,IF(I15=0,0,((D15/I15)*100)-100)) -> 0 | Q15: 0 | R15: =IF(D15=0,0,((D15/Q15)*100)-100) -> 0 | S15: =IF(D15=0,0,(D15/$D$35)*100) -> 0 | U15: 0 | V15: 0
A16: Sao Braz | C16: 3640000 | D16: 3382264 | E16: 3107877 | G16: 3245220 | H16: 2976538 | I16: 3019719 | K16: =IF(C16=0,0,((D16/C16)*100)-100) -> -7.08 | L16: =IF(D16=0,0,IF(E16=0,0,((D16/E16)*100)-100)) -> 8.83 | M16: =IF(G16=0,0,((D16/G16)*100)-100) -> 4.22 | N16: =IF(H16=0,0,((D16/H16)*100)-100) -> 13.63 | O16: =IF(D16=0,0,IF(I16=0,0,((D16/I16)*100)-100)) -> 12.01 | Q16: 3640000 | R16: =IF(D16=0,0,((D16/Q16)*100)-100) -> -7.08 | S16: =IF(D16=0,0,(D16/$D$35)*100) -> 5.29 | U16: 16.24 | V16: 14.32
A17: Sitio Cercado | C17: 1650000 | D17: 1500576 | E17: 1246945 | G17: 1790948 | H17: 1751058 | I17: 1486376 | K17: =IF(C17=0,0,((D17/C17)*100)-100) -> -9.06 | L17: =IF(D17=0,0,IF(E17=0,0,((D17/E17)*100)-100)) -> 20.34 | M17: =IF(G17=0,0,((D17/G17)*100)-100) -> -16.21 | N17: =IF(H17=0,0,((D17/H17)*100)-100) -> -14.3 | O17: =IF(D17=0,0,IF(I17=0,0,((D17/I17)*100)-100)) -> 0.96 | Q17: 1650000 | R17: =IF(D17=0,0,((D17/Q17)*100)-100) -> -9.06 | S17: =IF(D17=0,0,(D17/$D$35)*100) -> 2.35 | U17: 16.9 | V17: 13.72
A18: Apucarana | C18: 2100000 | D18: 2193534 | E18: 1957014 | G18: 1648560 | H18: 1641009 | I18: 1504472 | K18: =IF(C18=0,0,((D18/C18)*100)-100) -> 4.45 | L18: =IF(D18=0,0,IF(E18=0,0,((D18/E18)*100)-100)) -> 12.09 | M18: =IF(G18=0,0,((D18/G18)*100)-100) -> 33.06 | N18: =IF(H18=0,0,((D18/H18)*100)-100) -> 33.67 | O18: =IF(D18=0,0,IF(I18=0,0,((D18/I18)*100)-100)) -> 45.8 | Q18: 2100000 | R18: =IF(D18=0,0,((D18/Q18)*100)-100) -> 4.45 | S18: =IF(D18=0,0,(D18/$D$35)*100) -> 3.43 | U18: 15.3 | V18: 13.46
A19: Ahu | C19: 1300000 | D19: 1234746 | E19: 1142814 | G19: 1074517 | H19: 1096104 | I19: 1322206 | K19: =IF(C19=0,0,((D19/C19)*100)-100) -> -5.02 | L19: =IF(D19=0,0,IF(E19=0,0,((D19/E19)*100)-100)) -> 8.04 | M19: =IF(G19=0,0,((D19/G19)*100)-100) -> 14.91 | N19: =IF(H19=0,0,((D19/H19)*100)-100) -> 12.65 | O19: =IF(D19=0,0,IF(I19=0,0,((D19/I19)*100)-100)) -> -6.61 | Q19: 1300000 | R19: =IF(D19=0,0,((D19/Q19)*100)-100) -> -5.02 | S19: =IF(D19=0,0,(D19/$D$35)*100) -> 1.93 | U19: 17.15 | V19: 15.89
A20: P.G. Centro | C20: 1900000 | D20: 1795660 | E20: 1669633 | G20: 1613205 | H20: 1799929 | I20: 1776703 | K20: =IF(C20=0,0,((D20/C20)*100)-100) -> -5.49 | L20: =IF(D20=0,0,IF(E20=0,0,((D20/E20)*100)-100)) -> 7.55 | M20: =IF(G20=0,0,((D20/G20)*100)-100) -> 11.31 | N20: =IF(H20=0,0,((D20/H20)*100)-100) -> -0.24 | O20: =IF(D20=0,0,IF(I20=0,0,((D20/I20)*100)-100)) -> 1.07 | Q20: 1900000 | R20: =IF(D20=0,0,((D20/Q20)*100)-100) -> -5.49 | S20: =IF(D20=0,0,(D20/$D$35)*100) -> 2.81 | U20: 17.98 | V20: 15.14
A21: Maringa | C21: 2800000 | D21: 2604418 | E21: 2569506 | G21: 2280199 | H21: 2332592 | I21: 2180025 | K21: =IF(C21=0,0,((D21/C21)*100)-100) -> -6.99 | L21: =IF(D21=0,0,IF(E21=0,0,((D21/E21)*100)-100)) -> 1.36 | M21: =IF(G21=0,0,((D21/G21)*100)-100) -> 14.22 | N21: =IF(H21=0,0,((D21/H21)*100)-100) -> 11.65 | O21: =IF(D21=0,0,IF(I21=0,0,((D21/I21)*100)-100)) -> 19.47 | Q21: 2800000 | R21: =IF(D21=0,0,((D21/Q21)*100)-100) -> -6.99 | S21: =IF(D21=0,0,(D21/$D$35)*100) -> 4.07 | U21: 16.9 | V21: 14.99
A22: Araucaria Nova | C22: 2370000 | D22: 2346038 | E22: 2040588 | G22: 2105168 | H22: 2110050 | I22: 1940028 | K22: =IF(C22=0,0,((D22/C22)*100)-100) -> -1.01 | L22: =IF(D22=0,0,IF(E22=0,0,((D22/E22)*100)-100)) -> 14.97 | M22: =IF(G22=0,0,((D22/G22)*100)-100) -> 11.44 | N22: =IF(H22=0,0,((D22/H22)*100)-100) -> 11.18 | O22: =IF(D22=0,0,IF(I22=0,0,((D22/I22)*100)-100)) -> 20.93 | Q22: 2370000 | R22: =IF(D22=0,0,((D22/Q22)*100)-100) -> -1.01 | S22: =IF(D22=0,0,(D22/$D$35)*100) -> 3.67 | U22: 17 | V22: 15.77
A23: Sitio Cercado | C23: 0 | D23: 0 | E23: 0 | G23: 0 | H23: 0 | I23: 0 | K23: =IF(C23=0,0,((D23/C23)*100)-100) -> 0 | L23: =IF(D23=0,0,IF(E23=0,0,((D23/E23)*100)-100)) -> 0 | M23: =IF(G23=0,0,((D23/G23)*100)-100) -> 0 | N23: =IF(H23=0,0,((D23/H23)*100)-100) -> 0 | O23: =IF(D23=0,0,IF(I23=0,0,((D23/I23)*100)-100)) -> 0 | Q23: 0 | R23: =IF(Q23=0,0,IF(D23=0,0,((D23/Q23)*100)-100)) -> 0 | S23: =IF(D23=0,0,(D23/$D$35)*100) -> 0 | U23: 0 | V23: 0
A24: Total Super | C24: =SUM(C7:C23) -> 29644081 | D24: =SUM(D7:D23) -> 27597892 | E24: =SUM(E7:E23) -> 25061460 | G24: =SUM(G7:G23) -> 25362184 | H24: =SUM(H7:H23) -> 27124626 | I24: =SUM(I7:I23) -> 25974893 | J24: =SUM(C24:I24) -> 160765136 | K24: =IF(D24=0,0,((D24/C24)*100)-100) -> -6.9 | L24: =IF(D24=0,0,IF(E24=0,0,((D24/E24)*100)-100)) -> 10.12 | M24: =IF(G24=0,0,IF(D24=0,0,((D24/G24)*100)-100)) -> 8.82 | N24: =IF(H24=0,0,IF(D24=0,0,((D24/H24)*100)-100)) -> 1.74 | O24: =IF(D24=0,0,IF(I24=0,0,((D24/I24)*100)-100)) -> 6.25 | Q24: =SUM(Q7:Q23) -> 29644081 | R24: =IF(D24=0,0,((D24/Q24)*100)-100) -> -6.9 | S24: =IF(D24=0,0,(D24/$D$35)*100) -> 43.15 | U24: 16.79 | V24: 14.77
A26: Londrina | C26: 3620000 | D26: 3238956 | E26: 2826318 | G26: 2529405 | H26: 2344414 | I26: 2255224 | K26: =IF(C26=0,0,((D26/C26)*100)-100) -> -10.53 | L26: =IF(D26=0,0,IF(E26=0,0,((D26/E26)*100)-100)) -> 14.6 | M26: =IF(G26=0,0,((D26/G26)*100)-100) -> 28.05 | N26: =IF(H26=0,0,((D26/H26)*100)-100) -> 38.16 | O26: =IF(D26=0,0,IF(I26=0,0,((D26/I26)*100)-100)) -> 43.62 | Q26: 3620000 | R26: =IF(D26=0,0,IF(Q26=0,0,((D26/Q26)*100)-100)) -> -10.53 | S26: =IF(D26=0,0,(D26/$D$35)*100) -> 5.06 | U26: 14.5 | V26: 12.96
A27: S.J. Pinhais | C27: 4395000 | D27: 4376302 | E27: 4000323 | G27: 4601450 | H27: 4259322 | I27: 3994726 | K27: =IF(C27=0,0,((D27/C27)*100)-100) -> -0.43 | L27: =IF(D27=0,0,IF(E27=0,0,((D27/E27)*100)-100)) -> 9.4 | M27: =IF(G27=0,0,((D27/G27)*100)-100) -> -4.89 | N27: =IF(H27=0,0,((D27/H27)*100)-100) -> 2.75 | O27: =IF(D27=0,0,IF(I27=0,0,((D27/I27)*100)-100)) -> 9.55 | Q27: 4395000 | R27: =IF(D27=0,0,IF(Q27=0,0,((D27/Q27)*100)-100)) -> -0.43 | S27: =IF(D27=0,0,(D27/$D$35)*100) -> 6.84 | U27: 15.6 | V27: 14.47
A28: P.G. Nova | C28: 4035000 | D28: 3840889 | E28: 3624033 | G28: 3270489 | H28: 3435618 | I28: 3068031 | K28: =IF(C28=0,0,((D28/C28)*100)-100) -> -4.81 | L28: =IF(D28=0,0,IF(E28=0,0,((D28/E28)*100)-100)) -> 5.98 | M28: =IF(G28=0,0,((D28/G28)*100)-100) -> 17.44 | N28: =IF(H28=0,0,((D28/H28)*100)-100) -> 11.8 | O28: =IF(D28=0,0,IF(I28=0,0,((D28/I28)*100)-100)) -> 25.19 | Q28: 4035000 | R28: =IF(D28=0,0,IF(Q28=0,0,((D28/Q28)*100)-100)) -> -4.81 | S28: =IF(D28=0,0,(D28/$D$35)*100) -> 6.01 | U28: 16.4 | V28: 14.53
A29: Nilo Pecanha | C29: 10150000 | D29: 9643478 | E29: 9111719 | G29: 8723695 | H29: 7829163 | I29: 8042823 | K29: =IF(C29=0,0,((D29/C29)*100)-100) -> -4.99 | L29: =IF(D29=0,0,IF(E29=0,0,((D29/E29)*100)-100)) -> 5.84 | M29: =IF(G29=0,0,((D29/G29)*100)-100) -> 10.54 | N29: =IF(H29=0,0,((D29/H29)*100)-100) -> 23.17 | O29: =IF(D29=0,0,IF(I29=0,0,((D29/I29)*100)-100)) -> 19.9 | Q29: 10150000 | R29: =IF(D29=0,0,IF(Q29=0,0,((D29/Q29)*100)-100)) -> -4.99 | S29: =IF(D29=0,0,(D29/$D$35)*100) -> 15.08 | U29: 15.3 | V29: 14.85
A30: Champagnat | C30: 6650000 | D30: 5779597 | E30: 5563419 | G30: 5553138 | H30: 5507896 | I30: 0 | K30: =IF(C30=0,0,((D30/C30)*100)-100) -> -13.09 | L30: =IF(D30=0,0,IF(E30=0,0,((D30/E30)*100)-100)) -> 3.89 | M30: =IF(G30=0,0,((D30/G30)*100)-100) -> 4.08 | N30: =IF(H30=0,0,((D30/H30)*100)-100) -> 4.93 | O30: =IF(D30=0,0,IF(I30=0,0,((D30/I30)*100)-100)) -> 0 | Q30: 6650000 | R30: =IF(D30=0,0,IF(Q30=0,0,((D30/Q30)*100)-100)) -> -13.09 | S30: =IF(D30=0,0,(D30/$D$35)*100) -> 9.04 | U30: 16.4 | V30: 15.8
A31: Santa Candida | C31: 5780107 | D31: 4695594 | E31: 4101942 | G31: 4430277 | H31: 0 | I31: 0 | K31: =IF(C31=0,0,((D31/C31)*100)-100) -> -18.76 | L31: =IF(D31=0,0,IF(E31=0,0,((D31/E31)*100)-100)) -> 14.47 | M31: =IF(G31=0,0,((D31/G31)*100)-100) -> 5.99 | N31: =IF(H31=0,0,((D31/H31)*100)-100) -> 0 | O31: =IF(D31=0,0,IF(I31=0,0,((D31/I31)*100)-100)) -> 0 | Q31: 5780107 | R31: =IF(D31=0,0,IF(Q31=0,0,((D31/Q31)*100)-100)) -> -18.76 | S31: =IF(D31=0,0,(D31/$D$35)*100) -> 7.34 | U31: 15.65 | V31: 14.72
A32: Paranagu Raia | C32: 5465000 | D32: 4787564 | E32: 4489234 | G32: 3510124 | H32: 0 | I32: 0 | K32: =IF(C32=0,0,((D32/C32)*100)-100) -> -12.4 | L32: =IF(D32=0,0,IF(E32=0,0,((D32/E32)*100)-100)) -> 6.65 | M32: =IF(G32=0,0,((D32/G32)*100)-100) -> 36.39 | N32: =IF(H32=0,0,((D32/H32)*100)-100) -> 0 | O32: =IF(D32=0,0,IF(I32=0,0,((D32/I32)*100)-100)) -> 0 | Q32: 5465000 | R32: =IF(D32=0,0,IF(Q32=0,0,((D32/Q32)*100)-100)) -> -12.4 | S32: =IF(D32=0,0,(D32/$D$35)*100) -> 7.49 | U32: 16.3 | V32: 15.99
A33: Total Hiper | C33: =SUM(C26:C32) -> 40095107 | D33: =SUM(D26:D32) -> 36362380 | E33: =SUM(E26:E32) -> 33716988 | G33: =SUM(G26:G32) -> 32618578 | H33: =SUM(H26:H32) -> 23376413 | I33: =SUM(I26:I32) -> 17360804 | J33: =SUM(C33:I33) -> 183530270 | K33: =IF(D33=0,0,((D33/C33)*100)-100) -> -9.31 | L33: =IF(D33=0,0,IF(E33=0,0,((D33/E33)*100)-100)) -> 7.85 | M33: =IF(G33=0,0,IF(D33=0,0,((D33/G33)*100)-100)) -> 11.48 | N33: =IF(H33=0,0,IF(D33=0,0,((D33/H33)*100)-100)) -> 55.55 | O33: =IF(D33=0,0,IF(I33=0,0,((D33/I33)*100)-100)) -> 109.45 | Q33: =SUM(Q26:Q32) -> 40095107 | R33: =IF(D33=0,0,((D33/Q33)*100)-100) -> -9.31 | S33: =IF(D33=0,0,(D33/$D$35)*100) -> 56.85 | U33: 15.74 | V33: 14.89
A35: Total Geral | C35: =C24+C33 -> 69739188 | D35: =D24+D33 -> 63960272 | E35: =E24+E33 -> 58778448 | G35: =G24+G33 -> 57980762 | H35: =H24+H33 -> 50501039 | I35: =I24+I33 -> 43335697 | K35: =IF(D33=0,0,((D35/C35)*100)-100) -> -8.29 | L35: =IF(D35=0,0,IF(E35=0,0,((D35/E35)*100)-100)) -> 8.82 | M35: =IF(G35=0,0,IF(D35=0,0,((D35/G35)*100)-100)) -> 10.31 | N35: =IF(H35=0,0,IF(D35=0,0,((D35/H35)*100)-100)) -> 26.65 | O35: =IF(D35=0,0,IF(I35=0,0,((D35/I35)*100)-100)) -> 47.59 | Q35: =Q24+Q33 -> 69739188 | R35: =IF(D35=0,0,((D35/Q35)*100)-100) -> -8.29 | S35: =S24+S33 -> 100 | U35: 16.19 | V35: 14.84
C36: Resumo por Regiao - Outubro/2002
C37: Descricao das Aberturas | H37: Valor | I37: %
C38: Curitiba (2,3,6,7,10,11,17,21,22) | H38: =D7+D8+D11+D12+D14+D16+D19+D29+D30+D32 -> 32972426 | I38: =IF(D35=0,0,H38/$D$35) -> 0.51549999999999996
C39: Curitiba e Metrop. (Ctba. 4,5,8,14,23) | H39: =H38+D9+D10+D13+D28+D23 -> 41209194 | I39: =IF(D35=0,0,H39/$D$35) -> 0.64429999999999998
C40: Metropolitana (4,5,8,14,23) | H40: =H39-H38 -> 8236768 | I40: =IF(D35=0,0,H40/$D$35) -> 0.1288
C41: Norte (9,15,20) | H41: =D26+D18+D23 -> 5432490 | I41: =IF(D35=0,0,H41/$D$35) -> 8.4900000000000003E-2
C42: Centro-Oeste (13,18,19) | H42: =D17+D20+D28 -> 7137125 | I42: =IF(D35=0,0,H42/$D$35) -> 0.1116
C43: Ponta Grossa (18,19) | H43: =H42-D17 -> 5636549 | I43: =IF(D35=0,0,H43/$D$35) -> 8.8099999999999998E-2
C44: Super (2,3,4,5,6,7,8,10,11,13,15,17,18,20,23) | H44: =D24 -> 27597892 | I44: =IF(D35=0,0,H44/$D$35) -> 0.43149999999999999
C45: Hiper (9,14,19,21,22,24) | H45: =D33 -> 36362380 | I45: =IF(D35=0,0,H45/$D$35) -> 0.56850000000000001
C46: Curitiba, Metropolitana e Centro-Oeste | H46: =D35-H41 -> 58527782 | I46: =IF(D35=0,0,H46/$D$35) -> 0.91510000000000002
C47: Araucaria | H47: =D10+D23 -> 1077809 | I47: =IF(D35=0,0,H47/$D$35) -> 1.6899999999999998E-2