A2: Periodo: | C2: 38534 | D2: a | E2: 38564 | H2: Vendas Acumuladas por Filial | Q2: =NOW() -> 38568.622049305603
A4: v.1 | C4: Vendas 2005 | G4: Vendas de Anos Anteriores | K4: Percentuais ( % ) | Q4: Meta Mensal | U4: Margem
A5: Lojas | C5: Previsao | D5: Realizada | E5: Mes Anterior | G5: Vendas 2004 | H5: Vendas 2003 | I5: Vendas 2002 | K5: % Prev | L5: % MA | M5: 2004 | N5: 2003 | O5: 2002 | Q5: Previsao Mes | R5: Final | S5: Part. | U5: Meta | V5: Real
A7: Xaxim | C7: 870000 | D7: 730589 | E7: 739593 | G7: 875027 | H7: 745682 | I7: 512341 | K7: =IF(C7=0,0,((D7/C7)*100)-100) -> -16.02 | L7: =IF(D7=0,0,IF(E7=0,0,((D7/E7)*100)-100)) -> -1.22 | M7: =IF(G7=0,0,((D7/G7)*100)-100) -> -16.51 | N7: =IF(H7=0,0,((D7/H7)*100)-100) -> -2.02 | O7: =IF(D7=0,0,IF(I7=0,0,((D7/I7)*100)-100)) -> 42.6 | Q7: 870000 | R7: =IF(D7=0,0,((D7/Q7)*100)-100) -> -16.02 | S7: =IF(D7=0,0,(D7/$D$35)*100) -> 1.27 | U7: 17.43 | V7: 17.07
A8: S. Felicidade | C8: 790000 | D8: 694939 | E8: 716033 | G8: 717811 | H8: 750766 | I8: 531086 | K8: =IF(C8=0,0,((D8/C8)*100)-100) -> -12.03 | L8: =IF(D8=0,0,IF(E8=0,0,((D8/E8)*100)-100)) -> -2.95 | M8: =IF(G8=0,0,((D8/G8)*100)-100) -> -3.19 | N8: =IF(H8=0,0,((D8/H8)*100)-100) -> -7.44 | O8: =IF(D8=0,0,IF(I8=0,0,((D8/I8)*100)-100)) -> 30.85 | Q8: 790000 | R8: =IF(D8=0,0,((D8/Q8)*100)-100) -> -12.03 | S8: =IF(D8=0,0,(D8/$D$35)*100) -> 1.21 | U8: 16.75 | V8: 17.61
A9: Lapa | C9: 1290000 | D9: 1164156 | E9: 1114880 | G9: 1224191 | H9: 1060476 | I9: 776128 | K9: =IF(C9=0,0,((D9/C9)*100)-100) -> -9.76 | L9: =IF(D9=0,0,IF(E9=0,0,((D9/E9)*100)-100)) -> 4.42 | M9: =IF(G9=0,0,((D9/G9)*100)-100) -> -4.9 | N9: =IF(H9=0,0,((D9/H9)*100)-100) -> 9.78 | O9: =IF(D9=0,0,IF(I9=0,0,((D9/I9)*100)-100)) -> 50 | Q9: 1290000 | R9: =IF(D9=0,0,((D9/Q9)*100)-100) -> -9.76 | S9: =IF(D9=0,0,(D9/$D$35)*100) -> 2.02 | U9: 16.9 | V9: 16.51
A10: Araucaria | C10: 1080000 | D10: 941477 | E10: 926628 | G10: 1024263 | H10: 1008677 | I10: 1577000 | K10: =IF(C10=0,0,((D10/C10)*100)-100) -> -12.83 | L10: =IF(D10=0,0,IF(E10=0,0,((D10/E10)*100)-100)) -> 1.6 | M10: =IF(G10=0,0,((D10/G10)*100)-100) -> -8.08 | N10: =IF(H10=0,0,((D10/H10)*100)-100) -> -6.66 | O10: =IF(D10=0,0,IF(I10=0,0,((D10/I10)*100)-100)) -> -40.3 | Q10: 1080000 | R10: =IF(D10=0,0,((D10/Q10)*100)-100) -> -12.83 | S10: =IF(D10=0,0,(D10/$D$35)*100) -> 1.63 | U10: 17.9 | V10: 17.35
A11: Pinheirinho | C11: 2240000 | D11: 1843454 | E11: 1805768 | G11: 2135571 | H11: 1866151 | I11: 1546641 | K11: =IF(C11=0,0,((D11/C11)*100)-100) -> -17.7 | L11: =IF(D11=0,0,IF(E11=0,0,((D11/E11)*100)-100)) -> 2.09 | M11: =IF(G11=0,0,((D11/G11)*100)-100) -> -13.68 | N11: =IF(H11=0,0,((D11/H11)*100)-100) -> -1.22 | O11: =IF(D11=0,0,IF(I11=0,0,((D11/I11)*100)-100)) -> 19.19 | Q11: 2240000 | R11: =IF(D11=0,0,((D11/Q11)*100)-100) -> -17.7 | S11: =IF(D11=0,0,(D11/$D$35)*100) -> 3.2 | U11: 17.45 | V11: 17.76
A12: Hauer | C12: 3300000 | D12: 3065030 | E12: 2907759 | G12: 3150643 | H12: 2918248 | I12: 2286293 | K12: =IF(C12=0,0,((D12/C12)*100)-100) -> -7.12 | L12: =IF(D12=0,0,IF(E12=0,0,((D12/E12)*100)-100)) -> 5.41 | M12: =IF(G12=0,0,((D12/G12)*100)-100) -> -2.72 | N12: =IF(H12=0,0,((D12/H12)*100)-100) -> 5.03 | O12: =IF(D12=0,0,IF(I12=0,0,((D12/I12)*100)-100)) -> 34.06 | Q12: 3300000 | R12: =IF(D12=0,0,((D12/Q12)*100)-100) -> -7.12 | S12: =IF(D12=0,0,(D12/$D$35)*100) -> 5.32 | U12: 17.1 | V12: 17.7
A13: Paranagua | C13: 1800000 | D13: 1610625 | E13: 1606019 | G13: 3451663 | H13: 3144865 | I13: 2593279 | K13: =IF(C13=0,0,((D13/C13)*100)-100) -> -10.52 | L13: =IF(D13=0,0,IF(E13=0,0,((D13/E13)*100)-100)) -> 00.29 | M13: =IF(G13=0,0,((D13/G13)*100)-100) -> -53.34 | N13: =IF(H13=0,0,((D13/H13)*100)-100) -> -48.79 | O13: =IF(D13=0,0,IF(I13=0,0,((D13/I13)*100)-100)) -> -37.89 | Q13: 1800000 | R13: =IF(D13=0,0,((D13/Q13)*100)-100) -> -10.52 | S13: =IF(D13=0,0,(D13/$D$35)*100) -> 2.8 | U13: 17.59 | V13: 17.32
A14: Centenario | C14: 1020000 | D14: 954707 | E14: 934116 | G14: 996850 | H14: 936047 | I14: 674207 | K14: =IF(C14=0,0,((D14/C14)*100)-100) -> -6.4 | L14: =IF(D14=0,0,IF(E14=0,0,((D14/E14)*100)-100)) -> 2.2 | M14: =IF(G14=0,0,((D14/G14)*100)-100) -> -4.23 | N14: =IF(H14=0,0,((D14/H14)*100)-100) -> 1.99 | O14: =IF(D14=0,0,IF(I14=0,0,((D14/I14)*100)-100)) -> 41.6 | Q14: 1020000 | R14: =IF(D14=0,0,((D14/Q14)*100)-100) -> -6.4 | S14: =IF(D14=0,0,(D14/$D$35)*100) -> 1.66 | U14: 17.1 | V14: 16.76
A15: Arapongas | C15: 0 | D15: 0 | E15: 0 | G15: 0 | H15: 0 | I15: 0 | K15: =IF(C15=0,0,((D15/C15)*100)-100) -> 0 | L15: =IF(D15=0,0,IF(E15=0,0,((D15/E15)*100)-100)) -> 0 | M15: =IF(D15=0,0,IF(G15=0,0,((D15/G15)*100)-100)) -> 0 | N15: =IF(D15=0,0,IF(H15=0,0,((D15/H15)*100)-100)) -> 0 | O15: =IF(D15=0,0,IF(I15=0,0,((D15/I15)*100)-100)) -> 0 | Q15: 0 | R15: =IF(D15=0,0,((D15/Q15)*100)-100) -> 0 | S15: =IF(D15=0,0,(D15/$D$35)*100) -> 0 | U15: 0 | V15: 0
A16: Sao Braz | C16: 3350000 | D16: 3144128 | E16: 3058550 | G16: 3190832 | H16: 3051671 | I16: 2356603 | K16: =IF(C16=0,0,((D16/C16)*100)-100) -> -6.15 | L16: =IF(D16=0,0,IF(E16=0,0,((D16/E16)*100)-100)) -> 2.8 | M16: =IF(G16=0,0,((D16/G16)*100)-100) -> -1.46 | N16: =IF(H16=0,0,((D16/H16)*100)-100) -> 3.03 | O16: =IF(D16=0,0,IF(I16=0,0,((D16/I16)*100)-100)) -> 33.42 | Q16: 3350000 | R16: =IF(D16=0,0,((D16/Q16)*100)-100) -> -6.15 | S16: =IF(D16=0,0,(D16/$D$35)*100) -> 5.46 | U16: 16.9 | V16: 17.24
A17: Sitio Cercado | C17: 1500000 | D17: 1429276 | E17: 1162383 | G17: 1746727 | H17: 1344526 | I17: 837116 | K17: =IF(C17=0,0,((D17/C17)*100)-100) -> -4.71 | L17: =IF(D17=0,0,IF(E17=0,0,((D17/E17)*100)-100)) -> 22.96 | M17: =IF(G17=0,0,((D17/G17)*100)-100) -> -18.17 | N17: =IF(H17=0,0,((D17/H17)*100)-100) -> 6.3 | O17: =IF(D17=0,0,IF(I17=0,0,((D17/I17)*100)-100)) -> 70.74 | Q17: 1500000 | R17: =IF(D17=0,0,((D17/Q17)*100)-100) -> -4.71 | S17: =IF(D17=0,0,(D17/$D$35)*100) -> 2.48 | U17: 16.5 | V17: 14.38
A18: Apucarana | C18: 1630000 | D18: 1545857 | E18: 1429338 | G18: 1555017 | H18: 1315361 | I18: 1089987 | K18: =IF(C18=0,0,((D18/C18)*100)-100) -> -5.16 | L18: =IF(D18=0,0,IF(E18=0,0,((D18/E18)*100)-100)) -> 8.15 | M18: =IF(G18=0,0,((D18/G18)*100)-100) -> -00.59 | N18: =IF(H18=0,0,((D18/H18)*100)-100) -> 17.52 | O18: =IF(D18=0,0,IF(I18=0,0,((D18/I18)*100)-100)) -> 41.82 | Q18: 1630000 | R18: =IF(D18=0,0,((D18/Q18)*100)-100) -> -5.16 | S18: =IF(D18=0,0,(D18/$D$35)*100) -> 2.68 | U18: 18 | V18: 18.1
A19: Ahu | C19: 1240000 | D19: 1054408 | E19: 1045089 | G19: 1186684 | H19: 1293035 | I19: 975821 | K19: =IF(C19=0,0,((D19/C19)*100)-100) -> -14.97 | L19: =IF(D19=0,0,IF(E19=0,0,((D19/E19)*100)-100)) -> 00.89 | M19: =IF(G19=0,0,((D19/G19)*100)-100) -> -11.15 | N19: =IF(H19=0,0,((D19/H19)*100)-100) -> -18.45 | O19: =IF(D19=0,0,IF(I19=0,0,((D19/I19)*100)-100)) -> 8.05 | Q19: 1240000 | R19: =IF(D19=0,0,((D19/Q19)*100)-100) -> -14.97 | S19: =IF(D19=0,0,(D19/$D$35)*100) -> 1.83 | U19: 17.91 | V19: 16.94
A20: P.G. Centro | C20: 1920000 | D20: 1568467 | E20: 1617439 | G20: 1802233 | H20: 1670409 | I20: 1242064 | K20: =IF(C20=0,0,((D20/C20)*100)-100) -> -18.31 | L20: =IF(D20=0,0,IF(E20=0,0,((D20/E20)*100)-100)) -> -3.03 | M20: =IF(G20=0,0,((D20/G20)*100)-100) -> -12.97 | N20: =IF(H20=0,0,((D20/H20)*100)-100) -> -6.1 | O20: =IF(D20=0,0,IF(I20=0,0,((D20/I20)*100)-100)) -> 26.28 | Q20: 1920000 | R20: =IF(D20=0,0,((D20/Q20)*100)-100) -> -18.31 | S20: =IF(D20=0,0,(D20/$D$35)*100) -> 2.72 | U20: 18.95 | V20: 17.93
A21: Maringa | C21: 2470000 | D21: 2294267 | E21: 2156760 | G21: 2292168 | H21: 2044843 | I21: 1557279 | K21: =IF(C21=0,0,((D21/C21)*100)-100) -> -7.11 | L21: =IF(D21=0,0,IF(E21=0,0,((D21/E21)*100)-100)) -> 6.38 | M21: =IF(G21=0,0,((D21/G21)*100)-100) -> 00.09 | N21: =IF(H21=0,0,((D21/H21)*100)-100) -> 12.2 | O21: =IF(D21=0,0,IF(I21=0,0,((D21/I21)*100)-100)) -> 47.33 | Q21: 2470000 | R21: =IF(D21=0,0,((D21/Q21)*100)-100) -> -7.11 | S21: =IF(D21=0,0,(D21/$D$35)*100) -> 3.98 | U21: 19.2 | V21: 17.78
A22: Araucaria Nova | C22: 2340000 | D22: 2015707 | E22: 1928021 | G22: 2266852 | H22: 1864701 | I22: 0 | K22: =IF(C22=0,0,((D22/C22)*100)-100) -> -13.86 | L22: =IF(D22=0,0,IF(E22=0,0,((D22/E22)*100)-100)) -> 4.55 | M22: =IF(G22=0,0,((D22/G22)*100)-100) -> -11.08 | N22: =IF(H22=0,0,((D22/H22)*100)-100) -> 8.1 | O22: =IF(D22=0,0,IF(I22=0,0,((D22/I22)*100)-100)) -> 0 | Q22: 2340000 | R22: =IF(D22=0,0,((D22/Q22)*100)-100) -> -13.86 | S22: =IF(D22=0,0,(D22/$D$35)*100) -> 3.5 | U22: 17.9 | V22: 18
A23: Sitio Cercado | C23: 0 | D23: 0 | E23: 0 | G23: 0 | H23: 0 | I23: 0 | K23: =IF(C23=0,0,((D23/C23)*100)-100) -> 0 | L23: =IF(D23=0,0,IF(E23=0,0,((D23/E23)*100)-100)) -> 0 | M23: =IF(G23=0,0,((D23/G23)*100)-100) -> 0 | N23: =IF(H23=0,0,((D23/H23)*100)-100) -> 0 | O23: =IF(D23=0,0,IF(I23=0,0,((D23/I23)*100)-100)) -> 0 | Q23: 0 | R23: =IF(Q23=0,0,IF(D23=0,0,((D23/Q23)*100)-100)) -> 0 | S23: =IF(D23=0,0,(D23/$D$35)*100) -> 0 | U23: 0 | V23: 0
A24: Total Super | C24: =SUM(C7:C23) -> 26840000 | D24: =SUM(D7:D23) -> 24057087 | E24: =SUM(E7:E23) -> 23148376 | G24: =SUM(G7:G23) -> 27616532 | H24: =SUM(H7:H23) -> 25015458 | I24: =SUM(I7:I23) -> 18555845 | J24: =SUM(C24:I24) -> 145233298 | K24: =IF(D24=0,0,((D24/C24)*100)-100) -> -10.37 | L24: =IF(D24=0,0,IF(E24=0,0,((D24/E24)*100)-100)) -> 3.93 | M24: =IF(G24=0,0,IF(D24=0,0,((D24/G24)*100)-100)) -> -12.89 | N24: =IF(H24=0,0,IF(D24=0,0,((D24/H24)*100)-100)) -> -3.83 | O24: =IF(D24=0,0,IF(I24=0,0,((D24/I24)*100)-100)) -> 29.65 | Q24: =SUM(Q7:Q23) -> 26840000 | R24: =IF(D24=0,0,((D24/Q24)*100)-100) -> -10.37 | S24: =IF(D24=0,0,(D24/$D$35)*100) -> 41.77 | U24: 17.61 | V24: 17.33
A26: Londrina | C26: 2700000 | D26: 2708230 | E26: 2490522 | G26: 2254586 | H26: 2280901 | I26: 2007608 | K26: =IF(C26=0,0,((D26/C26)*100)-100) -> 00.3 | L26: =IF(D26=0,0,IF(E26=0,0,((D26/E26)*100)-100)) -> 8.74 | M26: =IF(G26=0,0,((D26/G26)*100)-100) -> 20.12 | N26: =IF(H26=0,0,((D26/H26)*100)-100) -> 18.74 | O26: =IF(D26=0,0,IF(I26=0,0,((D26/I26)*100)-100)) -> 34.9 | Q26: 2700000 | R26: =IF(D26=0,0,IF(Q26=0,0,((D26/Q26)*100)-100)) -> 00.3 | S26: =IF(D26=0,0,(D26/$D$35)*100) -> 4.7 | U26: 17.95 | V26: 15.14
A27: S.J. Pinhais | C27: 4450000 | D27: 4133458 | E27: 3804231 | G27: 4422237 | H27: 4038347 | I27: 3155804 | K27: =IF(C27=0,0,((D27/C27)*100)-100) -> -7.11 | L27: =IF(D27=0,0,IF(E27=0,0,((D27/E27)*100)-100)) -> 8.65 | M27: =IF(G27=0,0,((D27/G27)*100)-100) -> -6.53 | N27: =IF(H27=0,0,((D27/H27)*100)-100) -> 2.36 | O27: =IF(D27=0,0,IF(I27=0,0,((D27/I27)*100)-100)) -> 30.98 | Q27: 4450000 | R27: =IF(D27=0,0,IF(Q27=0,0,((D27/Q27)*100)-100)) -> -7.11 | S27: =IF(D27=0,0,(D27/$D$35)*100) -> 7.18 | U27: 16.8 | V27: 15.19
A28: P.G. Nova | C28: 3640000 | D28: 3501253 | E28: 3235323 | G28: 3487523 | H28: 2860146 | I28: 2447725 | K28: =IF(C28=0,0,((D28/C28)*100)-100) -> -3.81 | L28: =IF(D28=0,0,IF(E28=0,0,((D28/E28)*100)-100)) -> 8.22 | M28: =IF(G28=0,0,((D28/G28)*100)-100) -> 00.39 | N28: =IF(H28=0,0,((D28/H28)*100)-100) -> 22.42 | O28: =IF(D28=0,0,IF(I28=0,0,((D28/I28)*100)-100)) -> 43.04 | Q28: 3640000 | R28: =IF(D28=0,0,IF(Q28=0,0,((D28/Q28)*100)-100)) -> -3.81 | S28: =IF(D28=0,0,(D28/$D$35)*100) -> 6.08 | U28: 17.15 | V28: 16.41
A29: Nilo Pecanha | C29: 9300000 | D29: 9047119 | E29: 8562033 | G29: 8727528 | H29: 8253285 | I29: 5740631 | K29: =IF(C29=0,0,((D29/C29)*100)-100) -> -2.72 | L29: =IF(D29=0,0,IF(E29=0,0,((D29/E29)*100)-100)) -> 5.67 | M29: =IF(G29=0,0,((D29/G29)*100)-100) -> 3.66 | N29: =IF(H29=0,0,((D29/H29)*100)-100) -> 9.62 | O29: =IF(D29=0,0,IF(I29=0,0,((D29/I29)*100)-100)) -> 57.6 | Q29: 9300000 | R29: =IF(D29=0,0,IF(Q29=0,0,((D29/Q29)*100)-100)) -> -2.72 | S29: =IF(D29=0,0,(D29/$D$35)*100) -> 15.71 | U29: 16.5 | V29: 16.44
A30: Champagnat | C30: 5840000 | D30: 5728788 | E30: 5475749 | G30: 5000066 | H30: 0 | I30: 0 | K30: =IF(C30=0,0,((D30/C30)*100)-100) -> -1.9 | L30: =IF(D30=0,0,IF(E30=0,0,((D30/E30)*100)-100)) -> 4.62 | M30: =IF(G30=0,0,((D30/G30)*100)-100) -> 14.57 | N30: =IF(H30=0,0,((D30/H30)*100)-100) -> 0 | O30: =IF(D30=0,0,IF(I30=0,0,((D30/I30)*100)-100)) -> 0 | Q30: 5840000 | R30: =IF(D30=0,0,IF(Q30=0,0,((D30/Q30)*100)-100)) -> -1.9 | S30: =IF(D30=0,0,(D30/$D$35)*100) -> 9.95 | U30: 16.5 | V30: 16.76
A31: Santa Candida | C31: 5000000 | D31: 4411558 | E31: 4118036 | G31: 0 | H31: 0 | I31: 0 | K31: =IF(C31=0,0,((D31/C31)*100)-100) -> -11.77 | L31: =IF(D31=0,0,IF(E31=0,0,((D31/E31)*100)-100)) -> 7.13 | M31: =IF(G31=0,0,((D31/G31)*100)-100) -> 0 | N31: =IF(H31=0,0,((D31/H31)*100)-100) -> 0 | O31: =IF(D31=0,0,IF(I31=0,0,((D31/I31)*100)-100)) -> 0 | Q31: 5000000 | R31: =IF(D31=0,0,IF(Q31=0,0,((D31/Q31)*100)-100)) -> -11.77 | S31: =IF(D31=0,0,(D31/$D$35)*100) -> 7.66 | U31: 15.8 | V31: 15.48
A32: Paranagu Raia | C32: 4200000 | D32: 4008658 | E32: 3567369 | G32: 0 | H32: 0 | I32: 0 | K32: =IF(C32=0,0,((D32/C32)*100)-100) -> -4.56 | L32: =IF(D32=0,0,IF(E32=0,0,((D32/E32)*100)-100)) -> 12.37 | M32: =IF(G32=0,0,((D32/G32)*100)-100) -> 0 | N32: =IF(H32=0,0,((D32/H32)*100)-100) -> 0 | O32: =IF(D32=0,0,IF(I32=0,0,((D32/I32)*100)-100)) -> 0 | Q32: 4200000 | R32: =IF(D32=0,0,IF(Q32=0,0,((D32/Q32)*100)-100)) -> -4.56 | S32: =IF(D32=0,0,(D32/$D$35)*100) -> 6.96 | U32: 15.5 | V32: 15.68
A33: Total Hiper | C33: =SUM(C26:C32) -> 35130000 | D33: =SUM(D26:D32) -> 33539064 | E33: =SUM(E26:E32) -> 31253263 | G33: =SUM(G26:G32) -> 23891940 | H33: =SUM(H26:H32) -> 17432679 | I33: =SUM(I26:I32) -> 13351768 | J33: =SUM(C33:I33) -> 154598714 | K33: =IF(D33=0,0,((D33/C33)*100)-100) -> -4.53 | L33: =IF(D33=0,0,IF(E33=0,0,((D33/E33)*100)-100)) -> 7.31 | M33: =IF(G33=0,0,IF(D33=0,0,((D33/G33)*100)-100)) -> 40.38 | N33: =IF(H33=0,0,IF(D33=0,0,((D33/H33)*100)-100)) -> 92.39 | O33: =IF(D33=0,0,IF(I33=0,0,((D33/I33)*100)-100)) -> 151.2 | Q33: =SUM(Q26:Q32) -> 35130000 | R33: =IF(D33=0,0,((D33/Q33)*100)-100) -> -4.53 | S33: =IF(D33=0,0,(D33/$D$35)*100) -> 58.23 | U33: 16.5 | V33: 16.01
A35: Total Geral | C35: =C24+C33 -> 61970000 | D35: =D24+D33 -> 57596151 | E35: =E24+E33 -> 54401639 | G35: =G24+G33 -> 51508472 | H35: =H24+H33 -> 42448137 | I35: =I24+I33 -> 31907613 | K35: =IF(D33=0,0,((D35/C35)*100)-100) -> -7.06 | L35: =IF(D35=0,0,IF(E35=0,0,((D35/E35)*100)-100)) -> 5.87 | M35: =IF(G35=0,0,IF(D35=0,0,((D35/G35)*100)-100)) -> 11.82 | N35: =IF(H35=0,0,IF(D35=0,0,((D35/H35)*100)-100)) -> 35.69 | O35: =IF(D35=0,0,IF(I35=0,0,((D35/I35)*100)-100)) -> 80.51 | Q35: =Q24+Q33 -> 61970000 | R35: =IF(D35=0,0,((D35/Q35)*100)-100) -> -7.06 | S35: =S24+S33 -> 100 | U35: 16.98 | V35: 16.56
C36: Resumo por Regiao - Outubro/2002
C37: Descricao das Aberturas | H37: Valor | I37: %
C38: Curitiba (2,3,6,7,10,11,17,21,22) | H38: =D7+D8+D11+D12+D14+D16+D19+D29+D30+D32 -> 30271820 | I38: =IF(D35=0,0,H38/$D$35) -> 0.52559999999999996
C39: Curitiba e Metrop. (Ctba. 4,5,8,14,23) | H39: =H38+D9+D10+D13+D28+D23 -> 37489331 | I39: =IF(D35=0,0,H39/$D$35) -> 0.65090000000000003
C40: Metropolitana (4,5,8,14,23) | H40: =H39-H38 -> 7217511 | I40: =IF(D35=0,0,H40/$D$35) -> 0.12529999999999999
C41: Norte (9,15,20) | H41: =D26+D18+D23 -> 4254087 | I41: =IF(D35=0,0,H41/$D$35) -> 7.3899999999999993E-2
C42: Centro-Oeste (13,18,19) | H42: =D17+D20+D28 -> 6498996 | I42: =IF(D35=0,0,H42/$D$35) -> 0.1128
C43: Ponta Grossa (18,19) | H43: =H42-D17 -> 5069720 | I43: =IF(D35=0,0,H43/$D$35) -> 8.7999999999999995E-2
C44: Super (2,3,4,5,6,7,8,10,11,13,15,17,18,20,23) | H44: =D24 -> 24057087 | I44: =IF(D35=0,0,H44/$D$35) -> 0.41770000000000002
C45: Hiper (9,14,19,21,22,24) | H45: =D33 -> 33539064 | I45: =IF(D35=0,0,H45/$D$35) -> 0.58230000000000004
C46: Curitiba, Metropolitana e Centro-Oeste | H46: =D35-H41 -> 53342064 | I46: =IF(D35=0,0,H46/$D$35) -> 0.92610000000000003
C47: Araucaria | H47: =D10+D23 -> 941477 | I47: =IF(D35=0,0,H47/$D$35) -> 1.6299999999999999E-2