A2: Periodo: | B2: 40909 | C2: a | D2: 40939 | G2: Vendas Acumuladas por Filial | P2: =NOW() -> 40940.374803935185
A4: v.New | B4: Vendas 2012 | F4: Vendas de Anos Anteriores | J4: Percentuais ( % ) | P4: Meta Mensal | T4: Margem
A5: Lojas | B5: Previsao | C5: Realizada | D5: Mes Anterior | F5: Vendas 2011 | G5: Vendas 2010 | H5: Vendas 2009 | J5: % Prev | K5: % MA | L5: 2011 | M5: 2010 | N5: 2009 | P5: Previsao Mes | Q5: Final | R5: Part. | T5: Meta | U5: Coml | V5: Dif
A6: S. Felicidade | B6: 3505888 | C6: 3740629.24 | D6: 4714201.65 | F6: 3194619.22 | G6: 2833083.79 | H6: 2472373.56 | J6: =IF(B6=0,0,((C6/B6)*100)-100) -> 6.6956286110680026 | K6: =IF(C6=0,0,IF(D6=0,0,((C6/D6)*100)-100)) -> -20.651904230698321 | L6: =IF(F6=0,0,((C6/F6)*100)-100) -> 17.091552463645428 | M6: =IF(G6=0,0,((C6/G6)*100)-100) -> 32.033837234302212 | N6: =IF(C6=0,0,IF(H6=0,0,((C6/H6)*100)-100)) -> 51.29708958706064 | P6: 3505888 | Q6: =IF(C6=0,0,((C6/P6)*100)-100) -> 6.6956286110680026 | R6: =IF(C6=0,0,(C6/$C$43)*100) -> 2.2721075475457533 | T6: 16.381599999999999 | U6: 17.775208916454922 | V6: =U6-T6 -> 1.393608916454923
A7: Lapa | B7: 2478729 | C7: 2424485.61 | D7: 3175178.66 | F7: 2327341.94 | G7: 2275537.43 | H7: 2076477.01 | J7: =IF(B7=0,0,((C7/B7)*100)-100) -> -2.1883549996792766 | K7: =IF(C7=0,0,IF(D7=0,0,((C7/D7)*100)-100)) -> -23.64254520405477 | L7: =IF(F7=0,0,((C7/F7)*100)-100) -> 4.174017935671273 | M7: =IF(G7=0,0,((C7/G7)*100)-100) -> 6.5456264544942968 | N7: =IF(C7=0,0,IF(H7=0,0,((C7/H7)*100)-100)) -> 16.759569131950073 | P7: 2478729 | Q7: =IF(C7=0,0,((C7/P7)*100)-100) -> -2.1883549996792766 | R7: =IF(C7=0,0,(C7/$C$43)*100) -> 1.4726645438394392 | T7: 15.9163 | U7: 15.923199676157287 | V7: =U7-T7 -> 6.89967615728726E-3
A8: Araucaria | B8: 1630735 | C8: 1533223.01 | D8: 1949093.15 | F8: 1531967 | G8: 1321106.31 | H8: 1258741.47 | J8: =IF(B8=0,0,((C8/B8)*100)-100) -> -5.979634336664148 | K8: =IF(C8=0,0,IF(D8=0,0,((C8/D8)*100)-100)) -> -21.336596457691101 | L8: =IF(F8=0,0,((C8/F8)*100)-100) -> 8.1986752978366439E-2 | M8: =IF(G8=0,0,((C8/G8)*100)-100) -> 16.055990225343791 | N8: =IF(C8=0,0,IF(H8=0,0,((C8/H8)*100)-100)) -> 21.80602979577688 | P8: 1630736 | Q8: =IF(C8=0,0,((C8/P8)*100)-100) -> -5.9796919918368161 | R8: =IF(C8=0,0,(C8/$C$43)*100) -> 0.93129988287527188 | T8: 17.053000000000001 | U8: 17.054614879540583 | V8: =U8-T8 -> 1.6148795405825922E-3
A9: Hauer | B9: 4403747 | C9: 4359148.94 | D9: 5624053.6900000004 | F9: 4044783.01 | G9: 3606109.5 | H9: 3451415.24 | J9: =IF(B9=0,0,((C9/B9)*100)-100) -> -1.0127298412011356 | K9: =IF(C9=0,0,IF(D9=0,0,((C9/D9)*100)-100)) -> -22.490979277973437 | L9: =IF(F9=0,0,((C9/F9)*100)-100) -> 7.7721333684102945 | M9: =IF(G9=0,0,((C9/G9)*100)-100) -> 20.882323179592859 | N9: =IF(C9=0,0,IF(H9=0,0,((C9/H9)*100)-100)) -> 26.300332961385436 | P9: 4403747 | Q9: =IF(C9=0,0,((C9/P9)*100)-100) -> -1.0127298412011356 | R9: =IF(C9=0,0,(C9/$C$43)*100) -> 2.6478045729680679 | T9: 15.950900000000001 | U9: 16.650940141999367 | V9: =U9-T9 -> 0.70004014199936648
A10: Paranagua | B10: 2250000 | C10: 2351921.99 | D10: 3367112.11 | F10: 2119665.35 | G10: 2029156.98 | H10: 1776572.55 | J10: =IF(B10=0,0,((C10/B10)*100)-100) -> 4.5298662222222248 | K10: =IF(C10=0,0,IF(D10=0,0,((C10/D10)*100)-100)) -> -30.150172813818173 | L10: =IF(F10=0,0,((C10/F10)*100)-100) -> 10.957231527137054 | M10: =IF(G10=0,0,((C10/G10)*100)-100) -> 15.906359792823935 | N10: =IF(C10=0,0,IF(H10=0,0,((C10/H10)*100)-100)) -> 32.385361352115922 | P10: 2250000 | Q10: =IF(C10=0,0,((C10/P10)*100)-100) -> 4.5298662222222248 | R10: =IF(C10=0,0,(C10/$C$43)*100) -> 1.4285884437768621 | T10: 17.742899999999999 | U10: 17.799667033174003 | V10: =U10-T10 -> 5.6767033174004666E-2
A11: Sitio Cercado | B11: 3343218 | C11: 3328476.86 | D11: 4298145 | F11: 2991945.25 | G11: 2348602.24 | H11: 2043910.71 | J11: =IF(B11=0,0,((C11/B11)*100)-100) -> -0.44092667603489133 | K11: =IF(C11=0,0,IF(D11=0,0,((C11/D11)*100)-100)) -> -22.560154206058655 | L11: =IF(F11=0,0,((C11/F11)*100)-100) -> 11.247920061371431 | M11: =IF(G11=0,0,((C11/G11)*100)-100) -> 41.721607997785071 | N11: =IF(C11=0,0,IF(H11=0,0,((C11/H11)*100)-100)) -> 62.84844752342434 | P11: 3343218 | Q11: =IF(C11=0,0,((C11/P11)*100)-100) -> -0.44092667603489133 | R11: =IF(C11=0,0,(C11/$C$43)*100) -> 2.0217607547326417 | T11: 15.3279 | U11: 15.975967445962654 | V11: =U11-T11 -> 0.64806744596265453
A12: Apucarana | B12: 2550000 | C12: 2628723.09 | D12: 3601309.19 | F12: 2717803.88 | G12: 2573673.4 | H12: 2474780.01 | J12: =IF(B12=0,0,((C12/B12)*100)-100) -> 3.0871799999999894 | K12: =IF(C12=0,0,IF(D12=0,0,((C12/D12)*100)-100)) -> -27.006459281548118 | L12: =IF(F12=0,0,((C12/F12)*100)-100) -> -3.2776754296192934 | M12: =IF(G12=0,0,((C12/G12)*100)-100) -> 2.1389539947065543 | N12: =IF(C12=0,0,IF(H12=0,0,((C12/H12)*100)-100)) -> 6.2204753302496556 | P12: 2550000 | Q12: =IF(C12=0,0,((C12/P12)*100)-100) -> 3.0871799999999894 | R12: =IF(C12=0,0,(C12/$C$43)*100) -> 1.5967210835353449 | T12: 15.915900000000001 | U12: 15.129702467063582 | V12: =U12-T12 -> -0.78619753293641814
A13: Ahú | B13: 2294205 | C13: 2148341.56 | D13: 2823319.32 | F13: 2030398.75 | G13: 1602846.59 | H13: 1477101.43 | J13: =IF(B13=0,0,((C13/B13)*100)-100) -> -6.3579078591494635 | K13: =IF(C13=0,0,IF(D13=0,0,((C13/D13)*100)-100)) -> -23.907241211383763 | L13: =IF(F13=0,0,((C13/F13)*100)-100) -> 5.8088496163622949 | M13: =IF(G13=0,0,((C13/G13)*100)-100) -> 34.032887077483821 | N13: =IF(C13=0,0,IF(H13=0,0,((C13/H13)*100)-100)) -> 45.443062769223644 | P13: 2294205 | Q13: =IF(C13=0,0,((C13/P13)*100)-100) -> -6.3579078591494635 | R13: =IF(C13=0,0,(C13/$C$43)*100) -> 1.3049310049188989 | T13: 16.828800000000001 | U13: 17.340622033118418 | V13: =U13-T13 -> 0.5118220331184169
A14: P.G. Centro | B14: 2160105 | C14: 2208218.3 | D14: 2885479.72 | F14: 1968341.51 | G14: 1796991.47 | H14: 2079804.56 | J14: =IF(B14=0,0,((C14/B14)*100)-100) -> 2.2273593181812714 | K14: =IF(C14=0,0,IF(D14=0,0,((C14/D14)*100)-100)) -> -23.471363021743926 | L14: =IF(F14=0,0,((C14/F14)*100)-100) -> 12.18674649603868 | M14: =IF(G14=0,0,((C14/G14)*100)-100) -> 22.884183751857194 | N14: =IF(C14=0,0,IF(H14=0,0,((C14/H14)*100)-100)) -> 6.174317648385184 | P14: 2160105 | Q14: =IF(C14=0,0,((C14/P14)*100)-100) -> 2.2273593181812714 | R14: =IF(C14=0,0,(C14/$C$43)*100) -> 1.3413009267014795 | T14: 18.354900000000001 | U14: 17.636919728452575 | V14: =U14-T14 -> -0.71798027154742528
A15: Maringa | B15: 3489999 | C15: 3664036.94 | D15: 4390763.34 | F15: 3270802.63 | G15: 2729996.46 | H15: 2771932.02 | J15: =IF(B15=0,0,((C15/B15)*100)-100) -> 4.9867618873243202 | K15: =IF(C15=0,0,IF(D15=0,0,((C15/D15)*100)-100)) -> -16.551254160740086 | L15: =IF(F15=0,0,((C15/F15)*100)-100) -> 12.022563097914585 | M15: =IF(G15=0,0,((C15/G15)*100)-100) -> 34.213981361719419 | N15: =IF(C15=0,0,IF(H15=0,0,((C15/H15)*100)-100)) -> 32.183506433898742 | P15: 3490000 | Q15: =IF(C15=0,0,((C15/P15)*100)-100) -> 4.9867318051575893 | R15: =IF(C15=0,0,(C15/$C$43)*100) -> 2.2255843741039798 | T15: 16.838699999999999 | U15: 17.199141100908225 | V15: =U15-T15 -> 0.36044110090822556
A16: Centenario | B16: 0 | C16: 0 | D16: 0 | F16: 0 | G16: 1219404.04 | H16: 1216247.66 | J16: =IF(B16=0,0,((C16/B16)*100)-100) -> 0 | K16: =IF(C16=0,0,IF(D16=0,0,((C16/D16)*100)-100)) -> 0 | L16: =IF(F16=0,0,((C16/F16)*100)-100) -> 0 | M16: =IF(G16=0,0,((C16/G16)*100)-100) -> -100 | N16: =IF(C16=0,0,IF(H16=0,0,((C16/H16)*100)-100)) -> 0 | P16: 0 | Q16: =IF(C16=0,0,((C16/P16)*100)-100) -> 0 | R16: =IF(C16=0,0,(C16/$C$43)*100) -> 0 | T16: 0 | U16: 0 | V16: =U16-T16 -> 0
A17: Cristo Rei | B17: 2735076 | C17: 2715623.46 | D17: 3416004.38 | F17: 2386637.92 | G17: 1856604.72 | H17: 1544135.33 | J17: =IF(B17=0,0,((C17/B17)*100)-100) -> -0.71122484347783654 | K17: =IF(C17=0,0,IF(D17=0,0,((C17/D17)*100)-100)) -> -20.502928043669542 | L17: =IF(F17=0,0,((C17/F17)*100)-100) -> 13.784476364977905 | M17: =IF(G17=0,0,((C17/G17)*100)-100) -> 46.268262207154152 | N17: =IF(C17=0,0,IF(H17=0,0,((C17/H17)*100)-100)) -> 75.866933891085807 | P17: 2735076 | Q17: =IF(C17=0,0,((C17/P17)*100)-100) -> -0.71122484347783654 | R17: =IF(C17=0,0,(C17/$C$43)*100) -> 1.6495055146813511 | T17: 17.165199999999999 | U17: 17.749076225022741 | V17: =U17-T17 -> 0.58387622502274183
A18: Fazenda | B18: 3341496 | C18: 4024171.91 | D18: 5205743.21 | F18: 2979541.05 | G18: 0 | H18: 0 | J18: =IF(B18=0,0,((C18/B18)*100)-100) -> 20.430247709409201 | K18: =IF(C18=0,0,IF(D18=0,0,((C18/D18)*100)-100)) -> -22.697456488638437 | L18: =IF(F18=0,0,((C18/F18)*100)-100) -> 35.060126458066435 | M18: =IF(G18=0,0,((C18/G18)*100)-100) -> 0 | N18: =IF(C18=0,0,IF(H18=0,0,((C18/H18)*100)-100)) -> 0 | P18: 3341496 | Q18: =IF(C18=0,0,((C18/P18)*100)-100) -> 20.430247709409201 | R18: =IF(C18=0,0,(C18/$C$43)*100) -> 2.4443351058584488 | T18: 15.521699999999999 | U18: 15.242472466838523 | V18: =U18-T18 -> -0.27922753316147642
A19: Campo Largo | B19: 4350000 | C19: 4362075.79 | D19: 5671345.04 | F19: 3936450.53 | G19: 3369202.78 | H19: 2519617.05 | J19: =IF(B19=0,0,((C19/B19)*100)-100) -> 0.27760436781609599 | K19: =IF(C19=0,0,IF(D19=0,0,((C19/D19)*100)-100)) -> -23.085692031885259 | L19: =IF(F19=0,0,((C19/F19)*100)-100) -> 10.812412267251332 | M19: =IF(G19=0,0,((C19/G19)*100)-100) -> 29.469078438787221 | N19: =IF(C19=0,0,IF(H19=0,0,((C19/H19)*100)-100)) -> 73.124554384167254 | P19: 4350000 | Q19: =IF(C19=0,0,((C19/P19)*100)-100) -> 0.27760436781609599 | R19: =IF(C19=0,0,(C19/$C$43)*100) -> 2.6495823802696905 | T19: 16.6282 | U19: 17.203644441950424 | V19: =U19-T19 -> 0.57544444195042388
A20: Brasilia | B20: 3173514 | C20: 3121727.84 | D20: 4130470.28 | F20: 2862160.04 | G20: 2347034.85 | H20: 2205514.3 | J20: =IF(B20=0,0,((C20/B20)*100)-100) -> -1.631823902462699 | K20: =IF(C20=0,0,IF(D20=0,0,((C20/D20)*100)-100)) -> -24.42197550444547 | L20: =IF(F20=0,0,((C20/F20)*100)-100) -> 9.0689478006966908 | M20: =IF(G20=0,0,((C20/G20)*100)-100) -> 33.007306644807585 | N20: =IF(C20=0,0,IF(H20=0,0,((C20/H20)*100)-100)) -> 41.541945114570353 | P20: 3173514 | Q20: =IF(C20=0,0,((C20/P20)*100)-100) -> -1.631823902462699 | R20: =IF(C20=0,0,(C20/$C$43)*100) -> 1.896178672507971 | T20: 15.985200000000001 | U20: 16.269604771183385 | V20: =U20-T20 -> 0.28440477118338414
A21: Cajuru | B21: 4950000 | C21: 5477206.3300000001 | D21: 6719616.4299999997 | F21: 4571411.98 | G21: 0 | H21: 0 | J21: =IF(B21=0,0,((C21/B21)*100)-100) -> 10.650632929292939 | K21: =IF(C21=0,0,IF(D21=0,0,((C21/D21)*100)-100)) -> -18.489300884098228 | L21: =IF(F21=0,0,((C21/F21)*100)-100) -> 19.814323319859682 | M21: =IF(G21=0,0,((C21/G21)*100)-100) -> 0 | N21: =IF(C21=0,0,IF(H21=0,0,((C21/H21)*100)-100)) -> 0 | P21: 4950000 | Q21: =IF(C21=0,0,((C21/P21)*100)-100) -> 10.650632929292939 | R21: =IF(C21=0,0,(C21/$C$43)*100) -> 3.3269273813029314 | T21: 15.8216 | U21: 15.950461438979605 | V21: =U21-T21 -> 0.12886143897960523
A22: Total Super | B22: =SUM(B6:B21) -> 46656712 | C22: =SUM(C6:C21) -> 48088010.870000005 | D22: =SUM(D6:D21) -> 61971835.170000002 | F22: =SUM(F6:F21) -> 42933870.060000002 | G22: =SUM(G6:G21) -> 31909350.560000002 | H22: =SUM(H6:H21) -> 29368622.900000006 | I22: =SUM(B22:H22) -> 260928401.56000003 | J22: =IF(C22=0,0,((C22/B22)*100)-100) -> 3.0677233963679384 | K22: =IF(C22=0,0,IF(D22=0,0,((C22/D22)*100)-100)) -> -22.40344224422941 | L22: =IF(F22=0,0,IF(C22=0,0,((C22/F22)*100)-100)) -> 12.004836281465202 | M22: =IF(G22=0,0,IF(C22=0,0,((C22/G22)*100)-100)) -> 50.701941675618997 | N22: =IF(C22=0,0,IF(H22=0,0,((C22/H22)*100)-100)) -> 63.739413433647911 | P22: =SUM(P6:P21) -> 46656714 | Q22: =IF(C22=0,0,((C22/P22)*100)-100) -> 3.0677189782375223 | R22: =IF(C22=0,0,(C22/$C$43)*100) -> 29.209292189618136 | T22: 16.372894599688038 | U22: 16.648481850794425 | V22: =U22-T22 -> 0.27558725110638704
A23: Pinheirinho | B23: 5455858 | C23: 5326775.56 | D23: 6735513.8499999996 | F23: 5149724.14 | G23: 5259158.26 | H23: 4339989.85 | J23: =IF(B23=0,0,((C23/B23)*100)-100) -> -2.3659420754719207 | K23: =IF(C23=0,0,IF(D23=0,0,((C23/D23)*100)-100)) -> -20.915082670344447 | L23: =IF(F23=0,0,((C23/F23)*100)-100) -> 3.438075811183154 | M23: =IF(G23=0,0,((C23/G23)*100)-100) -> 1.2857057471398434 | N23: =IF(C23=0,0,IF(H23=0,0,((C23/H23)*100)-100)) -> 22.737051101628737 | P23: 5455858 | Q23: =IF(C23=0,0,IF(P23=0,0,((C23/P23)*100)-100)) -> -2.3659420754719207 | R23: =IF(C23=0,0,(C23/$C$43)*100) -> 3.2355537470904903 | T23: 15.9726 | U23: 15.824662971157736 | V23: =U23-T23 -> -0.14793702884226434
A24: Londrina | B24: 5300000 | C24: 5835951.4500000002 | D24: 6853538.5499999998 | F24: 4776234.74 | G24: 3799735.54 | H24: 3459874 | J24: =IF(B24=0,0,((C24/B24)*100)-100) -> 10.112291509433959 | K24: =IF(C24=0,0,IF(D24=0,0,((C24/D24)*100)-100)) -> -14.847616199663747 | L24: =IF(F24=0,0,((C24/F24)*100)-100) -> 22.187282821865665 | M24: =IF(G24=0,0,((C24/G24)*100)-100) -> 53.588358678246351 | N24: =IF(C24=0,0,IF(H24=0,0,((C24/H24)*100)-100)) -> 68.675259561475343 | P24: 5300000 | Q24: =IF(C24=0,0,IF(P24=0,0,((C24/P24)*100)-100)) -> 10.112291509433959 | R24: =IF(C24=0,0,(C24/$C$43)*100) -> 3.5448338998322058 | T24: 15.545 | U24: 15.289391531864096 | V24: =U24-T24 -> -0.25560846813590388
A25: São Bráz | B25: 6380000 | C25: 5783298.7000000002 | D25: 7595124.8200000003 | F25: 5819043.3499999996 | G25: 5082287.14 | H25: 4691597.2 | J25: =IF(B25=0,0,((C25/B25)*100)-100) -> -9.352684952978052 | K25: =IF(C25=0,0,IF(D25=0,0,((C25/D25)*100)-100)) -> -23.855119737189526 | L25: =IF(F25=0,0,((C25/F25)*100)-100) -> -0.61427021333325627 | M25: =IF(G25=0,0,((C25/G25)*100)-100) -> 13.793230108600298 | N25: =IF(C25=0,0,IF(H25=0,0,((C25/H25)*100)-100)) -> 23.269293024558891 | P25: 6380000 | Q25: =IF(C25=0,0,IF(P25=0,0,((C25/P25)*100)-100)) -> -9.352684952978052 | R25: =IF(C25=0,0,(C25/$C$43)*100) -> 3.5128519248760246 | T25: 15.6997 | U25: 15.640888230448827 | V25: =U25-T25 -> -5.8811769551173398E-2
A26: S.J. Pinhais | B26: 6786330 | C26: 5514001.29 | D26: 7504809.1399999997 | F26: 6590191.5700000003 | G26: 5740328.4800000004 | H26: 5289679.34 | J26: =IF(B26=0,0,((C26/B26)*100)-100) -> -18.748406134096044 | K26: =IF(C26=0,0,IF(D26=0,0,((C26/D26)*100)-100)) -> -26.527094998181383 | L26: =IF(F26=0,0,((C26/F26)*100)-100) -> -16.330182037485145 | M26: =IF(G26=0,0,((C26/G26)*100)-100) -> -3.9427567740862202 | N26: =IF(C26=0,0,IF(H26=0,0,((C26/H26)*100)-100)) -> 4.2407476064513219 | P26: 6786330 | Q26: =IF(C26=0,0,IF(P26=0,0,((C26/P26)*100)-100)) -> -18.748406134096044 | R26: =IF(C26=0,0,(C26/$C$43)*100) -> 3.3492771254138027 | T26: 16.458600000000001 | U26: 15.792032157830707 | V26: =U26-T26 -> -0.6665678421692931
A27: P.G. Nova | B27: 6748380 | C27: 7145045.4900000002 | D27: 9214516.6300000008 | F27: 6107563.2699999996 | G27: 4894746.6 | H27: 5234241.53 | J27: =IF(B27=0,0,((C27/B27)*100)-100) -> 5.8779364825335847 | K27: =IF(C27=0,0,IF(D27=0,0,((C27/D27)*100)-100)) -> -22.458813881374482 | L27: =IF(F27=0,0,((C27/F27)*100)-100) -> 16.986843592698492 | M27: =IF(G27=0,0,((C27/G27)*100)-100) -> 45.973756639414205 | N27: =IF(C27=0,0,IF(H27=0,0,((C27/H27)*100)-100)) -> 36.505842327837712 | P27: 6748380 | Q27: =IF(C27=0,0,IF(P27=0,0,((C27/P27)*100)-100)) -> 5.8779364825335847 | R27: =IF(C27=0,0,(C27/$C$43)*100) -> 4.339994889572842 | T27: 15.354200000000001 | U27: 15.631274236995797 | V27: =U27-T27 -> 0.27707423699579614
A28: Nilo Pecanha | B28: 15037281 | C28: 14681302.109999999 | D28: 19458496.09 | F28: 13548840.119999999 | G28: 11892506.789999999 | H28: 10949009.189999999 | J28: =IF(B28=0,0,((C28/B28)*100)-100) -> -2.3673088904835993 | K28: =IF(C28=0,0,IF(D28=0,0,((C28/D28)*100)-100)) -> -24.550684482009217 | L28: =IF(F28=0,0,((C28/F28)*100)-100) -> 8.3583685390775599 | M28: =IF(G28=0,0,((C28/G28)*100)-100) -> 23.450020834505665 | N28: =IF(C28=0,0,IF(H28=0,0,((C28/H28)*100)-100)) -> 34.087951295253248 | P28: 15037281 | Q28: =IF(C28=0,0,IF(P28=0,0,((C28/P28)*100)-100)) -> -2.3673088904835993 | R28: =IF(C28=0,0,(C28/$C$43)*100) -> 8.9176165804474081 | T28: 16.5063 | U28: 16.574864757687354 | V28: =U28-T28 -> 6.8564757687354927E-2
A29: Champagnat | B29: 6518018 | C29: 6597755.04 | D29: 8539598.6300000008 | F29: 6027420.25 | G29: 6057070.3300000001 | H29: 6012635.54 | J29: =IF(B29=0,0,((C29/B29)*100)-100) -> 1.2233326143008583 | K29: =IF(C29=0,0,IF(D29=0,0,((C29/D29)*100)-100)) -> -22.739284059302463 | L29: =IF(F29=0,0,((C29/F29)*100)-100) -> 9.4623365609856052 | M29: =IF(G29=0,0,((C29/G29)*100)-100) -> 8.9265053985265581 | N29: =IF(C29=0,0,IF(H29=0,0,((C29/H29)*100)-100)) -> 9.7314978782166577 | P29: 6518018 | Q29: =IF(C29=0,0,IF(P29=0,0,((C29/P29)*100)-100)) -> 1.2233326143008583 | R29: =IF(C29=0,0,(C29/$C$43)*100) -> 4.0075634502718129 | T29: 16.860600000000002 | U29: 17.0077675345158 | V29: =U29-T29 -> 0.14716753451579834
A30: Araucária Nova | B30: 6680000 | C30: 7378439.9900000002 | D30: 9208022.9100000001 | F30: 4996433.9 | G30: 3896088.59 | H30: 3412250.57 | J30: =IF(B30=0,0,((C30/B30)*100)-100) -> 10.455688473053897 | K30: =IF(C30=0,0,IF(D30=0,0,((C30/D30)*100)-100)) -> -19.869443613276147 | L30: =IF(F30=0,0,((C30/F30)*100)-100) -> 47.674123938675535 | M30: =IF(G30=0,0,((C30/G30)*100)-100) -> 89.38070373805337 | N30: =IF(C30=0,0,IF(H30=0,0,((C30/H30)*100)-100)) -> 116.23382687280204 | P30: 6680000 | Q30: =IF(C30=0,0,IF(P30=0,0,((C30/P30)*100)-100)) -> 10.455688473053897 | R30: =IF(C30=0,0,(C30/$C$43)*100) -> 4.4817617878623031 | T30: 16.474399999999999 | U30: 16.292771588971071 | V30: =U30-T30 -> -0.18162841102892813
A31: Santa Candida | B31: 9000000 | C31: 8882174.1300000008 | D31: 11375965.289999999 | F31: 8368806.9199999999 | G31: 7005264.1799999997 | H31: 5892670.6100000003 | J31: =IF(B31=0,0,((C31/B31)*100)-100) -> -1.3091763333333262 | K31: =IF(C31=0,0,IF(D31=0,0,((C31/D31)*100)-100)) -> -21.921578489626341 | L31: =IF(F31=0,0,((C31/F31)*100)-100) -> 6.1342938713658413 | M31: =IF(G31=0,0,((C31/G31)*100)-100) -> 26.79285037327459 | N31: =IF(C31=0,0,IF(H31=0,0,((C31/H31)*100)-100)) -> 50.732574716237195 | P31: 9000000 | Q31: =IF(C31=0,0,IF(P31=0,0,((C31/P31)*100)-100)) -> -1.3091763333333262 | R31: =IF(C31=0,0,(C31/$C$43)*100) -> 5.3951497420761845 | T31: 16.473600000000001 | U31: 15.865369859620168 | V31: =U31-T31 -> -0.60823014037983292
A32: Paranaguá Raia | B32: 9148000 | C32: 8918866.7799999993 | D32: 12122396.52 | F32: 8261686.5199999996 | G32: 7253944.75 | H32: 6236805.9199999999 | J32: =IF(B32=0,0,((C32/B32)*100)-100) -> -2.5047356799300502 | K32: =IF(C32=0,0,IF(D32=0,0,((C32/D32)*100)-100)) -> -26.426538141321259 | L32: =IF(F32=0,0,((C32/F32)*100)-100) -> 7.9545533276902773 | M32: =IF(G32=0,0,((C32/G32)*100)-100) -> 22.951953556028926 | N32: =IF(C32=0,0,IF(H32=0,0,((C32/H32)*100)-100)) -> 43.003756961544184 | P32: 9148000 | Q32: =IF(C32=0,0,IF(P32=0,0,((C32/P32)*100)-100)) -> -2.5047356799300502 | R32: =IF(C32=0,0,(C32/$C$43)*100) -> 5.4174373417433603 | T32: 17.613800000000001 | U32: 18.466830019183224 | V32: =U32-T32 -> 0.85303001918322252
A33: Novo Mundo | B33: 6100000 | C33: 6823563.46 | D33: 8630833.2799999993 | F33: 5940484.9299999997 | G33: 5344828.22 | H33: 0 | J33: =IF(B33=0,0,((C33/B33)*100)-100) -> 11.861696065573767 | K33: =IF(C33=0,0,IF(D33=0,0,((C33/D33)*100)-100)) -> -20.93969100513084 | L33: =IF(F33=0,0,((C33/F33)*100)-100) -> 14.865428334652805 | M33: =IF(G33=0,0,((C33/G33)*100)-100) -> 27.666656048302343 | N33: =IF(C33=0,0,IF(H33=0,0,((C33/H33)*100)-100)) -> 0 | P33: 6100000 | Q33: =IF(C33=0,0,IF(P33=0,0,((C33/P33)*100)-100)) -> 11.861696065573767 | R33: =IF(C33=0,0,(C33/$C$43)*100) -> 4.1447224634921076 | T33: 16.3049 | U33: 15.583115032684111 | V33: =U33-T33 -> -0.72178496731588915
A34: Água Verde | B34: 6700000 | C34: 6808659.7400000002 | D34: 8581150.5 | F34: 6613188.5099999998 | G34: 0 | H34: 0 | J34: =IF(B34=0,0,((C34/B34)*100)-100) -> 1.6217871641791106 | K34: =IF(C34=0,0,IF(D34=0,0,((C34/D34)*100)-100)) -> -20.65563073389751 | L34: =IF(F34=0,0,((C34/F34)*100)-100) -> 2.9557788909906719 | M34: =IF(G34=0,0,((C34/G34)*100)-100) -> 0 | N34: =IF(C34=0,0,IF(H34=0,0,((C34/H34)*100)-100)) -> 0 | P34: 6700000 | Q34: =IF(C34=0,0,IF(P34=0,0,((C34/P34)*100)-100)) -> 1.6217871641791106 | R34: =IF(C34=0,0,(C34/$C$43)*100) -> 4.1356697473510913 | T34: 16.246600000000001 | U34: 16.70787263485721 | V34: =U34-T34 -> 0.4612726348572096
A35: Uvaranas | B35: 6233000 | C35: 6313998.7999999998 | D35: 8444359.6400000006 | F35: 5604327.2000000002 | G35: 4786753.71 | H35: 0 | J35: =IF(B35=0,0,((C35/B35)*100)-100) -> 1.2995154821113317 | K35: =IF(C35=0,0,IF(D35=0,0,((C35/D35)*100)-100)) -> -25.228210673414679 | L35: =IF(F35=0,0,((C35/F35)*100)-100) -> 12.662922321880131 | M35: =IF(G35=0,0,((C35/G35)*100)-100) -> 31.905654281093149 | N35: =IF(C35=0,0,IF(H35=0,0,((C35/H35)*100)-100)) -> 0 | P35: 6233000 | Q35: =IF(C35=0,0,IF(P35=0,0,((C35/P35)*100)-100)) -> 1.2995154821113317 | R35: =IF(C35=0,0,(C35/$C$43)*100) -> 3.835206166723657 | T35: 15.6868 | U35: 15.821300176680428 | V35: =U35-T35 -> 0.13450017668042769
A36: Torres | B36: 7185000 | C36: 6873857.9100000001 | D36: 9032301.2799999993 | F36: 6407939.0599999996 | G36: 5067486.77 | H36: 4524687.94 | J36: =IF(B36=0,0,((C36/B36)*100)-100) -> -4.330439665970772 | K36: =IF(C36=0,0,IF(D36=0,0,((C36/D36)*100)-100)) -> -23.896937259825322 | L36: =IF(F36=0,0,((C36/F36)*100)-100) -> 7.270962561245085 | M36: =IF(G36=0,0,((C36/G36)*100)-100) -> 35.646292175716923 | N36: =IF(C36=0,0,IF(H36=0,0,((C36/H36)*100)-100)) -> 51.918938966650586 | P36: 7185000 | Q36: =IF(C36=0,0,IF(P36=0,0,((C36/P36)*100)-100)) -> -4.330439665970772 | R36: =IF(C36=0,0,(C36/$C$43)*100) -> 4.1752719759170986 | T36: 16.5213 | U36: 16.439654669847545 | V36: =U36-T36 -> -8.1645330152454676E-2
A37: Total Hiper | B37: =SUM(B23:B36) -> 103271867 | C37: =SUM(C23:C36) -> 102883690.44999999 | D37: =SUM(D23:D36) -> 133296627.13 | F37: =SUM(F23:F36) -> 94211884.480000019 | G37: =SUM(G23:G36) -> 76080199.359999999 | H37: =SUM(H23:H36) -> 60043441.689999998 | I37: =SUM(B37:H37) -> 569787710.11000001 | J37: =IF(C37=0,0,((C37/B37)*100)-100) -> -0.37587831156380958 | K37: =IF(C37=0,0,IF(D37=0,0,((C37/D37)*100)-100)) -> -22.815983671019097 | L37: =IF(F37=0,0,IF(C37=0,0,((C37/F37)*100)-100)) -> 9.2045775518277537 | M37: =IF(G37=0,0,IF(C37=0,0,((C37/G37)*100)-100)) -> 35.230574203900176 | N37: =IF(C37=0,0,IF(H37=0,0,((C37/H37)*100)-100)) -> 71.348756090933506 | P37: =SUM(P23:P36) -> 103271867 | Q37: =IF(C37=0,0,((C37/P37)*100)-100) -> -0.37587831156380958 | R37: =IF(C37=0,0,(C37/$C$43)*100) -> 62.492910842670376 | T37: 16.338910243444133 | U37: 16.301156720025105 | V37: =U37-T37 -> -3.7753523419027601E-2
A38: Total s/ 33,36,38 | B38: =B22+B37 -> 149928579 | C38: =C22+C37 -> 150971701.31999999 | D38: =D22+D37 -> 195268462.30000001 | E38: =E22+E37 -> 0 | F38: =F22+F37 -> 137145754.54000002 | G38: =G22+G37 -> 107989549.92 | H38: =H22+H37 -> 89412064.590000004 | I38: =SUM(B38:H38) -> 830716111.67000008 | J38: =IF(C38=0,0,((C38/B38)*100)-100) -> 0.69574615257307926 | K38: =IF(C38=0,0,IF(D38=0,0,((C38/D38)*100)-100)) -> -22.685056490046435 | L38: =IF(F38=0,0,IF(C38=0,0,((C38/F38)*100)-100)) -> 10.081206542902848 | M38: =IF(G38=0,0,IF(C38=0,0,((C38/G38)*100)-100)) -> 39.802139588359893 | N38: =IF(C38=0,0,IF(H38=0,0,((C38/H38)*100)-100)) -> 68.849362792686151 | P38: =P22+P37 -> 149928581 | Q38: =IF(C38=0,0,((C38/P38)*100)-100) -> 0.69574480932357119 | R38: =IF(C38=0,0,(C38/$C$43)*100) -> 91.702203032288509 | T38: 16.349485934432153 | U38: 16.411787881480041 | V38: =U38-T38 -> 6.2301947047888717E-2
A39: S.J.P - Rua Joinvile | B39: 7333130 | C39: 5550136.8700000001 | D39: 5942911.6900000004 | F39: 0 | G39: 0 | H39: 0 | J39: =IF(B39=0,0,((C39/B39)*100)-100) -> -24.314216848739903 | K39: =IF(C39=0,0,IF(D39=0,0,((C39/D39)*100)-100)) -> -6.6091310200842059 | L39: =IF(F39=0,0,((C39/F39)*100)-100) -> 0 | M39: =IF(G39=0,0,((C39/G39)*100)-100) -> 0 | N39: =IF(C39=0,0,IF(H39=0,0,((C39/H39)*100)-100)) -> 0 | P39: 7333130 | Q39: =IF(P39=0,0,IF(C39=0,0,((C39/P39)*100)-100)) -> -24.314216848739903 | R39: =IF(C39=0,0,(C39/$C$43)*100) -> 3.3712263534139941 | T39: 15.620699999999999 | U39: 16.140651715135089 | V39: =U39-T39 -> 0.51995171513508964
A40: Castro | B40: 4050000 | C40: 3707324.18 | D40: 4827637.19 | F40: 0 | G40: 0 | H40: 0 | J40: =IF(B40=0,0,((C40/B40)*100)-100) -> -8.4611313580246872 | K40: =IF(C40=0,0,IF(D40=0,0,((C40/D40)*100)-100)) -> -23.206238702457256 | L40: =IF(F40=0,0,((C40/F40)*100)-100) -> 0 | M40: =IF(G40=0,0,((C40/G40)*100)-100) -> 0 | N40: =IF(C40=0,0,IF(H40=0,0,((C40/H40)*100)-100)) -> 0 | P40: 4050000 | Q40: =IF(P40=0,0,IF(C40=0,0,((C40/P40)*100)-100)) -> -8.4611313580246872 | R40: =IF(C40=0,0,(C40/$C$43)*100) -> 2.251877614734378 | T40: 16.784700000000001 | U40: 15.822115046329721 | V40: =U40-T40 -> -0.96258495367028019
B41: 0 | C41: 0 | D41: 0 | F41: 0 | G41: 0 | H41: 0 | J41: =IF(B41=0,0,((C41/B41)*100)-100) -> 0 | K41: =IF(C41=0,0,IF(D41=0,0,((C41/D41)*100)-100)) -> 0 | L41: =IF(F41=0,0,((C41/F41)*100)-100) -> 0 | M41: =IF(G41=0,0,((C41/G41)*100)-100) -> 0 | N41: =IF(C41=0,0,IF(H41=0,0,((C41/H41)*100)-100)) -> 0 | P41: 0 | Q41: =IF(P41=0,0,IF(C41=0,0,((C41/P41)*100)-100)) -> 0 | R41: =IF(C41=0,0,(C41/$C$43)*100) -> 0 | T41: 0 | U41: 0 | V41: =U41-T41 -> 0
A42: Colombo | B42: 4000000 | C42: 4403416.05 | D42: 5710064.5 | F42: 0 | G42: 0 | H42: 0 | J42: =IF(B42=0,0,((C42/B42)*100)-100) -> 10.08540124999999 | K42: =IF(C42=0,0,IF(D42=0,0,((C42/D42)*100)-100)) -> -22.883252019307321 | L42: =IF(F42=0,0,((C42/F42)*100)-100) -> 0 | M42: =IF(G42=0,0,((C42/G42)*100)-100) -> 0 | N42: =IF(C42=0,0,IF(H42=0,0,((C42/H42)*100)-100)) -> 0 | P42: 4000000 | Q42: =IF(P42=0,0,IF(C42=0,0,((C42/P42)*100)-100)) -> 10.08540124999999 | R42: =IF(C42=0,0,(C42/$C$43)*100) -> 2.6746929995631179 | T42: 15.9533 | U42: 14.009510600298603 | V42: =U42-T42 -> -1.943789399701398
A43: Total Geral | B43: =B22+B37+SUM(B39:B42) -> 165311709 | C43: =C22+C37+SUM(C39:C42) -> 164632578.41999999 | D43: =D22+D37+SUM(D39:D42) -> 211749075.68000001 | F43: =F22+F37+SUM(F39:F42) -> 137145754.54000002 | G43: =G22+G37+SUM(G39:G42) -> 107989549.92 | H43: =H22+H37+SUM(H39:H42) -> 89412064.590000004 | J43: =IF(C43=0,0,((C43/B43)*100)-100) -> -0.41081819558228005 | K43: =IF(C43=0,0,IF(D43=0,0,((C43/D43)*100)-100)) -> -22.251099377266485 | L43: =IF(F43=0,0,IF(C43=0,0,((C43/F43)*100)-100)) -> 20.042052320316728 | M43: =IF(G43=0,0,IF(C43=0,0,((C43/G43)*100)-100)) -> 52.452323897971439 | N43: =IF(C43=0,0,IF(H43=0,0,((C43/H43)*100)-100)) -> 84.127924094946792 | P43: =P22+P37+SUM(P39:P42) -> 165311711 | Q43: =IF(C43=0,0,((C43/P43)*100)-100) -> -0.41081940044767862 | R43: =R22+R37+SUM(R39:R42) -> 100 | T43: 16.31 | U43: 16.325115014741808 | V43: =U43-T43 -> 1.5115014741809318E-2
A45: Água Verde | B45: 0 | C45: 0 | D45: 0 | F45: 0 | G45: 0 | H45: 0 | J45: =IF(B45=0,0,((C45/B45)*100)-100) -> 0 | K45: =IF(C45=0,0,IF(D45=0,0,((C45/D45)*100)-100)) -> 0 | L45: =IF(F45=0,0,((C45/F45)*100)-100) -> 0 | M45: =IF(G45=0,0,((C45/G45)*100)-100) -> 0 | N45: =IF(C45=0,0,IF(H45=0,0,((C45/H45)*100)-100)) -> 0 | P45: =B45 -> 0 | Q45: =IF(C45=0,0,IF(P45=0,0,((C45/P45)*100)-100)) -> 0 | R45: =IF(C45=0,0,(C45/$C$43)*100) -> 0 | T45: 14.95 | U45: 0 | V45: =U45-T45 -> -14.95
A46: Total Geral | B46: =B43+B45 -> 165311709 | C46: =C43+C45 -> 164632578.41999999 | D46: =D43+D45 -> 211749075.68000001 | F46: =F43+F45 -> 137145754.54000002 | G46: =G43+G45 -> 107989549.92 | H46: =H43+H45 -> 89412064.590000004 | J46: =IF(C46=0,0,((C46/B46)*100)-100) -> -0.41081819558228005 | K46: =IF(C46=0,0,IF(D46=0,0,((C46/D46)*100)-100)) -> -22.251099377266485 | L46: =IF(F46=0,0,IF(C46=0,0,((C46/F46)*100)-100)) -> 20.042052320316728 | M46: =IF(G46=0,0,IF(C46=0,0,((C46/G46)*100)-100)) -> 52.452323897971439 | N46: =IF(C46=0,0,IF(H46=0,0,((C46/H46)*100)-100)) -> 84.127924094946792 | P46: =P43+P45 -> 165311711 | Q46: =IF(C46=0,0,((C46/P46)*100)-100) -> -0.41081940044767862 | R46: =R25+R40+R45 -> 5.7647295396104026 | T46: 16.31823340669051 | U46: 16.325115014741808 | V46: =U46-T46 -> 6.8816080512981159E-3