A2: Perodo: | C2: 37773 | E2: 37802 | H2: Vendas Acumuladas por Filial
C4: Vendas 2003 | G4: Vendas de Anos Anteriores | K4: Percentuais ( % ) | R4: %
A5: Lojas | C5: Previso | D5: Realizada | E5: Ms Anterior | G5: Vendas 2002 | H5: Vendas 2001 | I5: Vendas 2000 | K5: % Prev | L5: % MA | M5: 2002 | N5: 2001 | O5: 2000 | Q5: Previso Ms | R5: Final | S5: Part.
A7: Xaxim | C7: 660000 | D7: 679171.64 | E7: 717556.58 | G7: 565523.56 | H7: 487480.31 | I7: 505343.69 | K7: =IF(C7=0,0,((D7/C7)*100)-100) -> 2.9 | L7: =IF(E7=0,0,((D7/E7)*100)-100) -> -5.35 | M7: =IF(G7=0,0,((D7/G7)*100)-100) -> 20.1 | N7: =IF(H7=0,0,((D7/H7)*100)-100) -> 39.32 | O7: =IF(I7=0,0,((D7/I7)*100)-100) -> 34.4 | Q7: 660000 | R7: =((D7/Q7)*100)-100 -> 2.9 | S7: =D7/$D$31*100 -> 1.68
A8: S. Felicidade | C8: 700000 | D8: 717339.56 | E8: 786952.19 | G8: 522682.43 | H8: 553640.23 | I8: 522069.82 | K8: =IF(C8=0,0,((D8/C8)*100)-100) -> 2.48 | L8: =IF(E8=0,0,((D8/E8)*100)-100) -> -8.85 | M8: =IF(G8=0,0,((D8/G8)*100)-100) -> 37.24 | N8: =IF(H8=0,0,((D8/H8)*100)-100) -> 29.57 | O8: =IF(I8=0,0,((D8/I8)*100)-100) -> 37.4 | Q8: 700000 | R8: =((D8/Q8)*100)-100 -> 2.48 | S8: =D8/$D$31*100 -> 1.77
A9: Lapa | C9: 990000 | D9: 962007.95 | E9: 1056313.18 | G9: 786967.84 | H9: 721427.37 | I9: 607990.77 | K9: =IF(C9=0,0,((D9/C9)*100)-100) -> -2.83 | L9: =IF(E9=0,0,((D9/E9)*100)-100) -> -8.93 | M9: =IF(G9=0,0,((D9/G9)*100)-100) -> 22.24 | N9: =IF(H9=0,0,((D9/H9)*100)-100) -> 33.35 | O9: =IF(I9=0,0,((D9/I9)*100)-100) -> 58.23 | Q9: 990000 | R9: =((D9/Q9)*100)-100 -> -2.83 | S9: =D9/$D$31*100 -> 2.37
A10: Araucria | C10: 1050000 | D10: 980760.5 | E10: 1099845.3 | G10: 1484184.47 | H10: 1476445.72 | I10: 1212779.59 | K10: =IF(C10=0,0,((D10/C10)*100)-100) -> -6.59 | L10: =IF(E10=0,0,((D10/E10)*100)-100) -> -10.83 | M10: =IF(G10=0,0,((D10/G10)*100)-100) -> -33.92 | N10: =IF(H10=0,0,((D10/H10)*100)-100) -> -33.57 | O10: =IF(I10=0,0,((D10/I10)*100)-100) -> -19.13 | Q10: 1050000 | R10: =((D10/Q10)*100)-100 -> -6.59 | S10: =D10/$D$31*100 -> 2.42
A11: Pinheirinho | C11: 1890000 | D11: 1820985.37 | E11: 1964984.93 | G11: 1680331.8 | H11: 1643582.06 | I11: 1459296.77 | K11: =IF(C11=0,0,((D11/C11)*100)-100) -> -3.65 | L11: =IF(E11=0,0,((D11/E11)*100)-100) -> -7.33 | M11: =IF(G11=0,0,((D11/G11)*100)-100) -> 8.37 | N11: =IF(H11=0,0,((D11/H11)*100)-100) -> 10.79 | O11: =IF(I11=0,0,((D11/I11)*100)-100) -> 24.79 | Q11: 1890000 | R11: =((D11/Q11)*100)-100 -> -3.65 | S11: =D11/$D$31*100 -> 4.49
A12: Hauer | C12: 2830000 | D12: 2735855.32 | E12: 2926180.06 | G12: 2457303.08 | H12: 2287959.61 | I12: 1943706.63 | K12: =IF(C12=0,0,((D12/C12)*100)-100) -> -3.33 | L12: =IF(E12=0,0,((D12/E12)*100)-100) -> -6.5 | M12: =IF(G12=0,0,((D12/G12)*100)-100) -> 11.34 | N12: =IF(H12=0,0,((D12/H12)*100)-100) -> 19.58 | O12: =IF(I12=0,0,((D12/I12)*100)-100) -> 40.75 | Q12: 2830000 | R12: =((D12/Q12)*100)-100 -> -3.33 | S12: =D12/$D$31*100 -> 6.75
A13: Paranagu | C13: 2950000 | D13: 2737778.55 | E13: 3030034.38 | G13: 2511117.12 | H13: 2353977.11 | I13: 1554446.95 | K13: =IF(C13=0,0,((D13/C13)*100)-100) -> -7.19 | L13: =IF(E13=0,0,((D13/E13)*100)-100) -> -9.65 | M13: =IF(G13=0,0,((D13/G13)*100)-100) -> 9.03 | N13: =IF(H13=0,0,((D13/H13)*100)-100) -> 16.3 | O13: =IF(I13=0,0,((D13/I13)*100)-100) -> 76.13 | Q13: 2950000 | R13: =((D13/Q13)*100)-100 -> -7.19 | S13: =D13/$D$31*100 -> 6.75
A14: Centenrio | C14: 855000 | D14: 929659.14 | E14: 954234.52 | G14: 745966.98 | H14: 671375.51 | I14: 578237.17 | K14: =IF(C14=0,0,((D14/C14)*100)-100) -> 8.73 | L14: =IF(E14=0,0,((D14/E14)*100)-100) -> -2.58 | M14: =IF(G14=0,0,((D14/G14)*100)-100) -> 24.62 | N14: =IF(H14=0,0,((D14/H14)*100)-100) -> 38.47 | O14: =IF(I14=0,0,((D14/I14)*100)-100) -> 60.77 | Q14: 855000 | R14: =((D14/Q14)*100)-100 -> 8.73 | S14: =D14/$D$31*100 -> 2.29
A15: So Brz | C15: 2950000 | D15: 3004388.44 | E15: 3163212.71 | G15: 2436628.5 | H15: 2602344.89 | I15: 1937770.21 | K15: =IF(C15=0,0,((D15/C15)*100)-100) -> 1.84 | L15: =IF(E15=0,0,((D15/E15)*100)-100) -> -5.02 | M15: =IF(G15=0,0,((D15/G15)*100)-100) -> 23.3 | N15: =IF(H15=0,0,((D15/H15)*100)-100) -> 15.45 | O15: =IF(I15=0,0,((D15/I15)*100)-100) -> 55.04 | Q15: 2950000 | R15: =((D15/Q15)*100)-100 -> 1.84 | S15: =D15/$D$31*100 -> 7.41
A16: Arapongas | C16: 580000 | D16: 541865.63 | E16: 599042.69 | G16: 509316.99 | H16: 551410.33 | I16: 443372.52 | K16: =IF(C16=0,0,((D16/C16)*100)-100) -> -6.57 | L16: =IF(E16=0,0,((D16/E16)*100)-100) -> -9.54 | M16: =IF(G16=0,0,((D16/G16)*100)-100) -> 6.39 | N16: =IF(H16=0,0,((D16/H16)*100)-100) -> -1.73 | O16: =IF(I16=0,0,((D16/I16)*100)-100) -> 22.21 | Q16: 580000 | R16: =((D16/Q16)*100)-100 -> -6.57 | S16: =D16/$D$31*100 -> 1.34
A17: Guarapuava | C17: 1300000 | D17: 1288308.15 | E17: 1380337.33 | G17: 856996.56 | H17: 891997.93 | I17: 841539.42 | K17: =IF(C17=0,0,((D17/C17)*100)-100) -> -00.9 | L17: =IF(E17=0,0,((D17/E17)*100)-100) -> -6.67 | M17: =IF(G17=0,0,((D17/G17)*100)-100) -> 50.33 | N17: =IF(H17=0,0,((D17/H17)*100)-100) -> 44.43 | O17: =IF(I17=0,0,((D17/I17)*100)-100) -> 53.09 | Q17: 1300000 | R17: =((D17/Q17)*100)-100 -> -00.9 | S17: =D17/$D$31*100 -> 3.18
A18: Apucarana | C18: 1280000 | D18: 1221294.02 | E18: 1321561.18 | G18: 1123883.33 | H18: 1142951.94 | I18: 1134669.97 | K18: =IF(C18=0,0,((D18/C18)*100)-100) -> -4.59 | L18: =IF(E18=0,0,((D18/E18)*100)-100) -> -7.59 | M18: =IF(G18=0,0,((D18/G18)*100)-100) -> 8.67 | N18: =IF(H18=0,0,((D18/H18)*100)-100) -> 6.85 | O18: =IF(I18=0,0,((D18/I18)*100)-100) -> 7.63 | Q18: 1280000 | R18: =((D18/Q18)*100)-100 -> -4.59 | S18: =D18/$D$31*100 -> 3.01
A19: Ah | C19: 1230000 | D19: 1223099.61 | E19: 1330140.46 | G19: 1039700.32 | H19: 1151013.25 | I19: 936883 | K19: =IF(C19=0,0,((D19/C19)*100)-100) -> -00.56 | L19: =IF(E19=0,0,((D19/E19)*100)-100) -> -8.05 | M19: =IF(G19=0,0,((D19/G19)*100)-100) -> 17.64 | N19: =IF(H19=0,0,((D19/H19)*100)-100) -> 6.26 | O19: =IF(I19=0,0,((D19/I19)*100)-100) -> 30.55 | Q19: 1230000 | R19: =((D19/Q19)*100)-100 -> -00.56 | S19: =D19/$D$31*100 -> 3.02
A20: P.G. Centro | C20: 1500000 | D20: 1555339.42 | E20: 1645181.05 | G20: 1214108.54 | H20: 1130061.41 | I20: 1231142.92 | K20: =IF(C20=0,0,((D20/C20)*100)-100) -> 3.69 | L20: =IF(E20=0,0,((D20/E20)*100)-100) -> -5.46 | M20: =IF(G20=0,0,((D20/G20)*100)-100) -> 28.11 | N20: =IF(H20=0,0,((D20/H20)*100)-100) -> 37.63 | O20: =IF(I20=0,0,((D20/I20)*100)-100) -> 26.33 | Q20: 1500000 | R20: =((D20/Q20)*100)-100 -> 3.69 | S20: =D20/$D$31*100 -> 3.84
A21: Maring | C21: 1950000 | D21: 1818607.5 | E21: 2035445.8 | G21: 1603122.92 | H21: 1760603.64 | I21: 1514388.65 | K21: =IF(C21=0,0,((D21/C21)*100)-100) -> -6.74 | L21: =IF(E21=0,0,((D21/E21)*100)-100) -> -10.65 | M21: =IF(G21=0,0,((D21/G21)*100)-100) -> 13.44 | N21: =IF(H21=0,0,((D21/H21)*100)-100) -> 3.29 | O21: =IF(I21=0,0,((D21/I21)*100)-100) -> 20.09 | Q21: 1950000 | R21: =((D21/Q21)*100)-100 -> -6.74 | S21: =D21/$D$31*100 -> 4.49
A22: Araucria Nova | C22: 1940000 | D22: 1844682.46 | E22: 2025172.83 | G22: 0 | H22: 0 | I22: 0 | K22: =IF(C22=0,0,((D22/C22)*100)-100) -> -4.91 | L22: =IF(E22=0,0,((D22/E22)*100)-100) -> -8.91 | M22: =IF(G22=0,0,((D22/G22)*100)-100) -> 0 | N22: =IF(H22=0,0,((D22/H22)*100)-100) -> 0 | O22: =IF(I22=0,0,((D22/I22)*100)-100) -> 0 | Q22: 1940000 | R22: =((D22/Q22)*100)-100 -> -4.91 | S22: =D22/$D$31*100 -> 4.55
A23: Total Super | C23: =SUM(C7:C22) -> 24655000 | D23: =SUM(D7:D22) -> 24061143.260000002 | E23: =SUM(E7:E22) -> 26036195.190000001 | G23: =SUM(G7:G22) -> 19537834.440000001 | H23: =SUM(H7:H22) -> 19426271.309999999 | I23: =SUM(I7:I22) -> 16423638.08 | J23: =SUM(C23:I23) -> 130140082.28 | K23: =((D23/C23)*100)-100 -> -2.41 | L23: =IF(E23=0,0,((D23/E23)*100)-100) -> -7.59 | M23: =((D23/G23)*100)-100 -> 23.15 | N23: =((D23/H23)*100)-100 -> 23.86 | O23: =IF(I23=0,0,((D23/I23)*100)-100) -> 46.5 | Q23: =SUM(Q7:Q22) -> 24655000 | R23: =((D23/Q23)*100)-100 -> -2.41 | S23: =D23/$D$31*100 -> 59.35
A25: Londrina | C25: 2270000 | D25: 2015176.65 | E25: 2230622.25 | G25: 1991153.97 | H25: 2101152.88 | I25: 0 | K25: =IF(C25=0,0,((D25/C25)*100)-100) -> -11.23 | L25: =IF(E25=0,0,((D25/E25)*100)-100) -> -9.66 | M25: =IF(G25=0,0,((D25/G25)*100)-100) -> 1.21 | N25: =IF(H25=0,0,((D25/H25)*100)-100) -> -4.09 | O25: =IF(I25=0,0,((D25/I25)*100)-100) -> 0 | Q25: 2270000 | R25: =((D25/Q25)*100)-100 -> -11.23 | S25: =D25/$D$31*100 -> 4.97
A26: S.J. Pinhais | C26: 3850000 | D26: 3765254 | E26: 4095350.95 | G26: 3303231.63 | H26: 2808605.21 | I26: 1422555.78 | K26: =IF(C26=0,0,((D26/C26)*100)-100) -> -2.2 | L26: =IF(E26=0,0,((D26/E26)*100)-100) -> -8.06 | M26: =IF(G26=0,0,((D26/G26)*100)-100) -> 13.99 | N26: =IF(H26=0,0,((D26/H26)*100)-100) -> 34.06 | O26: =IF(I26=0,0,((D26/I26)*100)-100) -> 164.68 | Q26: 3850000 | R26: =((D26/Q26)*100)-100 -> -2.2 | S26: =D26/$D$31*100 -> 9.29
A27: P.G. Nova | C27: 3000000 | D27: 2746313.95 | E27: 3081479.97 | G27: 2521921.31 | H27: 2353360.93 | I27: 1759611.11 | K27: =IF(C27=0,0,((D27/C27)*100)-100) -> -8.46 | L27: =IF(E27=0,0,((D27/E27)*100)-100) -> -10.88 | M27: =IF(G27=0,0,((D27/G27)*100)-100) -> 8.9 | N27: =IF(H27=0,0,((D27/H27)*100)-100) -> 16.7 | O27: =IF(I27=0,0,((D27/I27)*100)-100) -> 56.08 | Q27: 3000000 | R27: =((D27/Q27)*100)-100 -> -8.46 | S27: =D27/$D$31*100 -> 6.77
A28: Nilo Peanha | C28: 8000000 | D28: 7956505.5800000001 | E28: 8453239.6799999997 | G28: 6027352.5700000003 | H28: 0 | I28: 0 | K28: =IF(C28=0,0,((D28/C28)*100)-100) -> -00.54 | L28: =IF(E28=0,0,((D28/E28)*100)-100) -> -5.88 | M28: =IF(G28=0,0,((D28/G28)*100)-100) -> 32.01 | N28: =IF(H28=0,0,((D28/H28)*100)-100) -> 0 | O28: =IF(I28=0,0,((D28/I28)*100)-100) -> 0 | Q28: 8000000 | R28: =((D28/Q28)*100)-100 -> -00.54 | S28: =D28/$D$31*100 -> 19.62
A29: Total Hiper | C29: =SUM(C25:C28) -> 17120000 | D29: =SUM(D25:D28) -> 16483250.18 | E29: =SUM(E25:E28) -> 17860692.850000001 | G29: =SUM(G25:G28) -> 13843659.48 | H29: =SUM(H25:H28) -> 7263119.0199999996 | I29: =SUM(I25:I28) -> 3182166.89 | J29: =SUM(C29:I29) -> 75752888.420000002 | K29: =((D29/C29)*100)-100 -> -3.72 | L29: =IF(E29=0,0,((D29/E29)*100)-100) -> -7.71 | M29: =((D29/G29)*100)-100 -> 19.07 | N29: =((D29/H29)*100)-100 -> 126.94 | O29: =IF(I29=0,0,((D29/I29)*100)-100) -> 417.99 | Q29: =SUM(Q25:Q28) -> 17120000 | R29: =((D29/Q29)*100)-100 -> -3.72 | S29: =D29/$D$31*100 -> 40.65
A31: Total Geral | C31: =C23+C29 -> 41775000 | D31: =D23+D29 -> 40544393.439999998 | E31: =E23+E29 -> 43896888.039999999 | G31: =G23+G29 -> 33381493.920000002 | H31: =H23+H29 -> 26689390.329999998 | I31: =I23+I29 -> 19605804.969999999 | K31: =((D31/C31)*100)-100 -> -2.95 | L31: =IF(E31=0,0,((D31/E31)*100)-100) -> -7.64 | M31: =((D31/G31)*100)-100 -> 21.46 | N31: =((D31/H31)*100)-100 -> 51.91 | O31: =IF(I31=0,0,((D31/I31)*100)-100) -> 106.8 | Q31: =Q23+Q29 -> 41775000 | R31: =((D31/Q31)*100)-100 -> -2.95 | S31: =S23+S29 -> 100
C32: Resumo por Regio - Outubro/2002
C33: Descrio das Aberturas | H33: Valor | I33: %
C34: Curitiba (2,3,6,7,10,11,17,21) | H34: =D7+D8+D11+D12+D14+D15+D19+D28 -> 19067005 | I34: =H34/$D$31 -> 0.4703
C35: Curitiba e Metrop. (Ctba. 4,5,8,14,23) | H35: =H34+D9+D10+D13+D27+D22 -> 28338548 | I35: =H35/$D$31 -> 0.69899999999999995
C36: Metropolitana (4,5,8,14,23) | H36: =H35-H34 -> 9271543 | I36: =H36/$D$31 -> 0.22869999999999999
C37: Norte (9,12,15,20) | H37: =D25+D16+D18+D22 -> 5623019 | I37: =H37/$D$31 -> 0.13869999999999999
C38: Centro-Oeste (13,18,19) | H38: =D17+D20+D27 -> 5589962 | I38: =H38/$D$31 -> 0.13789999999999999
C39: Ponta Grossa (18,19) | H39: =H38-D17 -> 4301654 | I39: =H39/$D$31 -> 0.1061
C40: Super (2,3,4,5,6,7,8,10,11,12,13,15,17,18,20,23) | H40: =D23 -> 24061143 | I40: =H40/$D$31 -> 0.59350000000000003
C41: Hiper (9,14,19,21) | H41: =D29 -> 16483250 | I41: =H41/$D$31 -> 0.40649999999999997
C42: Curitiba, Metropolitana e Centro-Oeste | H42: =D31-H37 -> 34921374 | I42: =H42/$D$31 -> 0.86129999999999995
C43: Araucria | H43: =D10+D22 -> 2825443 | I43: =H43/$D$31 -> 6.9699999999999998E-2