A2: Periodo: | C2: 38200 | D2: a | E2: 38230 | H2: Vendas Acumuladas por Filial | Q2: =NOW() -> 38244.623538888904
A4: v.1 | C4: Vendas 2004 | G4: Vendas de Anos Anteriores | K4: Percentuais ( % ) | Q4: Meta Mensal | U4: Margem
A5: Lojas | C5: Previsao | D5: Realizada | E5: Mes Anterior | G5: Vendas 2003 | H5: Vendas 2002 | I5: Vendas 2001 | K5: % Prev | L5: % MA | M5: 2003 | N5: 2002 | O5: 2001 | Q5: Previsao Mes | R5: Final | S5: Part. | U5: Meta | V5: Real
A7: Xaxim | C7: 760000 | D7: 778972 | E7: 875027 | G7: 748518 | H7: 566867 | I7: 556105 | K7: =IF(C7=0,0,((D7/C7)*100)-100) -> 2.5 | L7: =IF(D7=0,0,IF(E7=0,0,((D7/E7)*100)-100)) -> -10.98 | M7: =IF(G7=0,0,((D7/G7)*100)-100) -> 4.07 | N7: =IF(H7=0,0,((D7/H7)*100)-100) -> 37.42 | O7: =IF(D7=0,0,IF(I7=0,0,((D7/I7)*100)-100)) -> 40.08 | Q7: 760000 | R7: =IF(D7=0,0,((D7/Q7)*100)-100) -> 2.5 | S7: =IF(D7=0,0,(D7/$D$32)*100) -> 1.62 | U7: 16.45 | V7: 14.56
A8: S. Felicidade | C8: 730000 | D8: 667844 | E8: 717811 | G8: 788451 | H8: 586520 | I8: 571311 | K8: =IF(C8=0,0,((D8/C8)*100)-100) -> -8.51 | L8: =IF(D8=0,0,IF(E8=0,0,((D8/E8)*100)-100)) -> -6.96 | M8: =IF(G8=0,0,((D8/G8)*100)-100) -> -15.3 | N8: =IF(H8=0,0,((D8/H8)*100)-100) -> 13.87 | O8: =IF(D8=0,0,IF(I8=0,0,((D8/I8)*100)-100)) -> 16.9 | Q8: 730000 | R8: =IF(D8=0,0,((D8/Q8)*100)-100) -> -8.51 | S8: =IF(D8=0,0,(D8/$D$32)*100) -> 1.39 | U8: 17.27 | V8: 14.62
A9: Lapa | C9: 1147000 | D9: 1067449 | E9: 1224191 | G9: 1083326 | H9: 892002 | I9: 731322 | K9: =IF(C9=0,0,((D9/C9)*100)-100) -> -6.94 | L9: =IF(D9=0,0,IF(E9=0,0,((D9/E9)*100)-100)) -> -12.8 | M9: =IF(G9=0,0,((D9/G9)*100)-100) -> -1.47 | N9: =IF(H9=0,0,((D9/H9)*100)-100) -> 19.67 | O9: =IF(D9=0,0,IF(I9=0,0,((D9/I9)*100)-100)) -> 45.96 | Q9: 1147000 | R9: =IF(D9=0,0,((D9/Q9)*100)-100) -> -6.94 | S9: =IF(D9=0,0,(D9/$D$32)*100) -> 2.22 | U9: 16.05 | V9: 15.3
A10: Araucaria | C10: 1100000 | D10: 904182 | E10: 1024263 | G10: 1038785 | H10: 1984356 | I10: 1490355 | K10: =IF(C10=0,0,((D10/C10)*100)-100) -> -17.8 | L10: =IF(D10=0,0,IF(E10=0,0,((D10/E10)*100)-100)) -> -11.72 | M10: =IF(G10=0,0,((D10/G10)*100)-100) -> -12.96 | N10: =IF(H10=0,0,((D10/H10)*100)-100) -> -54.43 | O10: =IF(D10=0,0,IF(I10=0,0,((D10/I10)*100)-100)) -> -39.33 | Q10: 1100000 | R10: =IF(D10=0,0,((D10/Q10)*100)-100) -> -17.8 | S10: =IF(D10=0,0,(D10/$D$32)*100) -> 1.88 | U10: 17.21 | V10: 16.38
A11: Pinheirinho | C11: 2250000 | D11: 1901812 | E11: 2135571 | G11: 1845778 | H11: 1739399 | I11: 1700888 | K11: =IF(C11=0,0,((D11/C11)*100)-100) -> -15.48 | L11: =IF(D11=0,0,IF(E11=0,0,((D11/E11)*100)-100)) -> -10.95 | M11: =IF(G11=0,0,((D11/G11)*100)-100) -> 3.04 | N11: =IF(H11=0,0,((D11/H11)*100)-100) -> 9.34 | O11: =IF(D11=0,0,IF(I11=0,0,((D11/I11)*100)-100)) -> 11.81 | Q11: 2250000 | R11: =IF(D11=0,0,((D11/Q11)*100)-100) -> -15.48 | S11: =IF(D11=0,0,(D11/$D$32)*100) -> 3.95 | U11: 16.3 | V11: 15.86
A12: Hauer | C12: 3250000 | D12: 2873587 | E12: 3150643 | G12: 3104644 | H12: 2614496 | I12: 2294778 | K12: =IF(C12=0,0,((D12/C12)*100)-100) -> -11.58 | L12: =IF(D12=0,0,IF(E12=0,0,((D12/E12)*100)-100)) -> -8.79 | M12: =IF(G12=0,0,((D12/G12)*100)-100) -> -7.44 | N12: =IF(H12=0,0,((D12/H12)*100)-100) -> 9.91 | O12: =IF(D12=0,0,IF(I12=0,0,((D12/I12)*100)-100)) -> 25.22 | Q12: 3250000 | R12: =IF(D12=0,0,((D12/Q12)*100)-100) -> -11.58 | S12: =IF(D12=0,0,(D12/$D$32)*100) -> 5.97 | U12: 16.1 | V12: 15.98
A13: Paranagua | C13: 3400000 | D13: 3356982 | E13: 3451663 | G13: 3184960 | H13: 2865772 | I13: 2554490 | K13: =IF(C13=0,0,((D13/C13)*100)-100) -> -1.27 | L13: =IF(D13=0,0,IF(E13=0,0,((D13/E13)*100)-100)) -> -2.74 | M13: =IF(G13=0,0,((D13/G13)*100)-100) -> 5.4 | N13: =IF(H13=0,0,((D13/H13)*100)-100) -> 17.14 | O13: =IF(D13=0,0,IF(I13=0,0,((D13/I13)*100)-100)) -> 31.41 | Q13: 3400000 | R13: =IF(D13=0,0,((D13/Q13)*100)-100) -> -1.27 | S13: =IF(D13=0,0,(D13/$D$32)*100) -> 6.97 | U13: 17 | V13: 16.79
A14: Centenario | C14: 1040000 | D14: 951154 | E14: 996850 | G14: 954058 | H14: 757982 | I14: 698903 | K14: =IF(C14=0,0,((D14/C14)*100)-100) -> -8.54 | L14: =IF(D14=0,0,IF(E14=0,0,((D14/E14)*100)-100)) -> -4.58 | M14: =IF(G14=0,0,((D14/G14)*100)-100) -> -00.3 | N14: =IF(H14=0,0,((D14/H14)*100)-100) -> 25.49 | O14: =IF(D14=0,0,IF(I14=0,0,((D14/I14)*100)-100)) -> 36.09 | Q14: 1040000 | R14: =IF(D14=0,0,((D14/Q14)*100)-100) -> -8.54 | S14: =IF(D14=0,0,(D14/$D$32)*100) -> 1.98 | U14: 16.85 | V14: 14.64
A15: Arapongas | C15: 0 | D15: 0 | E15: 0 | G15: 595418 | H15: 529457 | I15: 510516 | K15: =IF(C15=0,0,((D15/C15)*100)-100) -> 0 | L15: =IF(D15=0,0,IF(E15=0,0,((D15/E15)*100)-100)) -> 0 | M15: =IF(D15=0,0,IF(G15=0,0,((D15/G15)*100)-100)) -> 0 | N15: =IF(D15=0,0,IF(H15=0,0,((D15/H15)*100)-100)) -> 0 | O15: =IF(D15=0,0,IF(I15=0,0,((D15/I15)*100)-100)) -> 0 | Q15: 0 | R15: =IF(D15=0,0,((D15/Q15)*100)-100) -> 0 | S15: =IF(D15=0,0,(D15/$D$32)*100) -> 0 | U15: 0 | V15: 0
A16: Sao Braz | C16: 3300000 | D16: 2994943 | E16: 3190832 | G16: 3259269 | H16: 2627404 | I16: 2487531 | K16: =IF(C16=0,0,((D16/C16)*100)-100) -> -9.24 | L16: =IF(D16=0,0,IF(E16=0,0,((D16/E16)*100)-100)) -> -6.14 | M16: =IF(G16=0,0,((D16/G16)*100)-100) -> -8.11 | N16: =IF(H16=0,0,((D16/H16)*100)-100) -> 13.99 | O16: =IF(D16=0,0,IF(I16=0,0,((D16/I16)*100)-100)) -> 20.4 | Q16: 3300000 | R16: =IF(D16=0,0,((D16/Q16)*100)-100) -> -9.24 | S16: =IF(D16=0,0,(D16/$D$32)*100) -> 6.22 | U16: 15.85 | V16: 15.44
A17: Guarapuava | C17: 1480000 | D17: 1504003 | E17: 1746727 | G17: 1308300 | H17: 942177 | I17: 856948 | K17: =IF(C17=0,0,((D17/C17)*100)-100) -> 1.62 | L17: =IF(D17=0,0,IF(E17=0,0,((D17/E17)*100)-100)) -> -13.9 | M17: =IF(G17=0,0,((D17/G17)*100)-100) -> 14.96 | N17: =IF(H17=0,0,((D17/H17)*100)-100) -> 59.63 | O17: =IF(D17=0,0,IF(I17=0,0,((D17/I17)*100)-100)) -> 75.51 | Q17: 1480000 | R17: =IF(D17=0,0,((D17/Q17)*100)-100) -> 1.62 | S17: =IF(D17=0,0,(D17/$D$32)*100) -> 3.12 | U17: 17.18 | V17: 16.66
A18: Apucarana | C18: 1500000 | D18: 1394466 | E18: 1555017 | G18: 1407605 | H18: 1269379 | I18: 1055719 | K18: =IF(C18=0,0,((D18/C18)*100)-100) -> -7.04 | L18: =IF(D18=0,0,IF(E18=0,0,((D18/E18)*100)-100)) -> -10.32 | M18: =IF(G18=0,0,((D18/G18)*100)-100) -> -00.93 | N18: =IF(H18=0,0,((D18/H18)*100)-100) -> 9.85 | O18: =IF(D18=0,0,IF(I18=0,0,((D18/I18)*100)-100)) -> 32.09 | Q18: 1500000 | R18: =IF(D18=0,0,((D18/Q18)*100)-100) -> -7.04 | S18: =IF(D18=0,0,(D18/$D$32)*100) -> 2.9 | U18: 17.26 | V18: 17.1
A19: Ahu | C19: 1200000 | D19: 1108567 | E19: 1186684 | G19: 1321358 | H19: 1045983 | I19: 1187038 | K19: =IF(C19=0,0,((D19/C19)*100)-100) -> -7.62 | L19: =IF(D19=0,0,IF(E19=0,0,((D19/E19)*100)-100)) -> -6.58 | M19: =IF(G19=0,0,((D19/G19)*100)-100) -> -16.1 | N19: =IF(H19=0,0,((D19/H19)*100)-100) -> 5.98 | O19: =IF(D19=0,0,IF(I19=0,0,((D19/I19)*100)-100)) -> -6.61 | Q19: 1200000 | R19: =IF(D19=0,0,((D19/Q19)*100)-100) -> -7.62 | S19: =IF(D19=0,0,(D19/$D$32)*100) -> 2.3 | U19: 17.3 | V19: 16.07
A20: P.G. Centro | C20: 1800000 | D20: 1670532 | E20: 1802233 | G20: 1667495 | H20: 1394463 | I20: 1119821 | K20: =IF(C20=0,0,((D20/C20)*100)-100) -> -7.19 | L20: =IF(D20=0,0,IF(E20=0,0,((D20/E20)*100)-100)) -> -7.31 | M20: =IF(G20=0,0,((D20/G20)*100)-100) -> 00.18 | N20: =IF(H20=0,0,((D20/H20)*100)-100) -> 19.8 | O20: =IF(D20=0,0,IF(I20=0,0,((D20/I20)*100)-100)) -> 49.18 | Q20: 1800000 | R20: =IF(D20=0,0,((D20/Q20)*100)-100) -> -7.19 | S20: =IF(D20=0,0,(D20/$D$32)*100) -> 3.47 | U20: 17.47 | V20: 17.53
A21: Maringa | C21: 2200000 | D21: 2104226 | E21: 2292168 | G21: 2125876 | H21: 1885013 | I21: 1734877 | K21: =IF(C21=0,0,((D21/C21)*100)-100) -> -4.35 | L21: =IF(D21=0,0,IF(E21=0,0,((D21/E21)*100)-100)) -> -8.2 | M21: =IF(G21=0,0,((D21/G21)*100)-100) -> -1.02 | N21: =IF(H21=0,0,((D21/H21)*100)-100) -> 11.63 | O21: =IF(D21=0,0,IF(I21=0,0,((D21/I21)*100)-100)) -> 21.29 | Q21: 2200000 | R21: =IF(D21=0,0,((D21/Q21)*100)-100) -> -4.35 | S21: =IF(D21=0,0,(D21/$D$32)*100) -> 4.37 | U21: 17.9 | V21: 17.45
A22: Araucaria Nova | C22: 2100000 | D22: 2160030 | E22: 2266852 | G22: 1999164 | H22: 0 | I22: 0 | K22: =IF(C22=0,0,((D22/C22)*100)-100) -> 2.86 | L22: =IF(D22=0,0,IF(E22=0,0,((D22/E22)*100)-100)) -> -4.71 | M22: =IF(G22=0,0,((D22/G22)*100)-100) -> 8.05 | N22: =IF(H22=0,0,((D22/H22)*100)-100) -> 0 | O22: =IF(D22=0,0,IF(I22=0,0,((D22/I22)*100)-100)) -> 0 | Q22: 2100000 | R22: =IF(D22=0,0,((D22/Q22)*100)-100) -> 2.86 | S22: =IF(D22=0,0,(D22/$D$32)*100) -> 4.49 | U22: 16.8 | V22: 16.17
A23: Total Super | C23: =SUM(C7:C22) -> 27257000 | D23: =SUM(D7:D22) -> 25438749 | E23: =SUM(E7:E22) -> 27616532 | G23: =SUM(G7:G22) -> 26433005 | H23: =SUM(H7:H22) -> 21701270 | I23: =SUM(I7:I22) -> 19550602 | J23: =SUM(C23:I23) -> 147997158 | K23: =IF(D23=0,0,((D23/C23)*100)-100) -> -6.67 | L23: =IF(D23=0,0,IF(E23=0,0,((D23/E23)*100)-100)) -> -7.89 | M23: =IF(G23=0,0,IF(D23=0,0,((D23/G23)*100)-100)) -> -3.76 | N23: =IF(H23=0,0,IF(D23=0,0,((D23/H23)*100)-100)) -> 17.22 | O23: =IF(D23=0,0,IF(I23=0,0,((D23/I23)*100)-100)) -> 30.12 | Q23: =SUM(Q7:Q22) -> 27257000 | R23: =IF(D23=0,0,((D23/Q23)*100)-100) -> -6.67 | S23: =IF(D23=0,0,(D23/$D$32)*100) -> 52.84 | U23: 16.88 | V23: 15.86
A25: Londrina | C25: 2450000 | D25: 2115832 | E25: 2254586 | G25: 2295835 | H25: 2084844 | I25: 1849518 | K25: =IF(C25=0,0,((D25/C25)*100)-100) -> -13.64 | L25: =IF(D25=0,0,IF(E25=0,0,((D25/E25)*100)-100)) -> -6.15 | M25: =IF(G25=0,0,((D25/G25)*100)-100) -> -7.84 | N25: =IF(H25=0,0,((D25/H25)*100)-100) -> 1.49 | O25: =IF(D25=0,0,IF(I25=0,0,((D25/I25)*100)-100)) -> 14.4 | Q25: 2450000 | R25: =IF(D25=0,0,((D25/Q25)*100)-100) -> -13.64 | S25: =IF(D25=0,0,(D25/$D$32)*100) -> 4.39 | U25: 17.65 | V25: 15.67
A26: S.J. Pinhais | C26: 4520000 | D26: 4180216 | E26: 4422237 | G26: 4216272 | H26: 3475763 | I26: 2873633 | K26: =IF(C26=0,0,((D26/C26)*100)-100) -> -7.52 | L26: =IF(D26=0,0,IF(E26=0,0,((D26/E26)*100)-100)) -> -5.47 | M26: =IF(G26=0,0,((D26/G26)*100)-100) -> -00.86 | N26: =IF(H26=0,0,((D26/H26)*100)-100) -> 20.27 | O26: =IF(D26=0,0,IF(I26=0,0,((D26/I26)*100)-100)) -> 45.47 | Q26: 4520000 | R26: =IF(D25=0,0,((D26/Q26)*100)-100) -> -7.52 | S26: =IF(D26=0,0,(D26/$D$32)*100) -> 8.68 | U26: 15.6 | V26: 15.48
A27: P.G. Nova | C27: 3300000 | D27: 3170183 | E27: 3487523 | G27: 3036784 | H27: 2907396 | I27: 2212335 | K27: =IF(C27=0,0,((D27/C27)*100)-100) -> -3.93 | L27: =IF(D27=0,0,IF(E27=0,0,((D27/E27)*100)-100)) -> -9.1 | M27: =IF(G27=0,0,((D27/G27)*100)-100) -> 4.39 | N27: =IF(H27=0,0,((D27/H27)*100)-100) -> 9.04 | O27: =IF(D27=0,0,IF(I27=0,0,((D27/I27)*100)-100)) -> 43.3 | Q27: 3300000 | R27: =IF(D26=0,0,((D27/Q27)*100)-100) -> -3.93 | S27: =IF(D27=0,0,(D27/$D$32)*100) -> 6.58 | U27: 16.2 | V27: 15.65
A28: Nilo Pecanha | C28: 8600000 | D28: 8352404 | E28: 8727528 | G28: 8606903 | H28: 6611969 | I28: 0 | K28: =IF(C28=0,0,((D28/C28)*100)-100) -> -2.88 | L28: =IF(D28=0,0,IF(E28=0,0,((D28/E28)*100)-100)) -> -4.3 | M28: =IF(G28=0,0,((D28/G28)*100)-100) -> -2.96 | N28: =IF(H28=0,0,((D28/H28)*100)-100) -> 26.32 | O28: =IF(D28=0,0,IF(I28=0,0,((D28/I28)*100)-100)) -> 0 | Q28: 8600000 | R28: =IF(D26=0,0,((D28/Q28)*100)-100) -> -2.88 | S28: =IF(D28=0,0,(D28/$D$32)*100) -> 17.35 | U28: 15.4 | V28: 15.31
A29: Champagnat | C29: 5300000 | D29: 4887601 | E29: 5000066 | G29: 0 | H29: 0 | I29: 0 | K29: =IF(C29=0,0,((D29/C29)*100)-100) -> -7.78 | L29: =IF(D29=0,0,IF(E29=0,0,((D29/E29)*100)-100)) -> -2.25 | M29: =IF(G29=0,0,((D29/G29)*100)-100) -> 0 | N29: =IF(H29=0,0,((D29/H29)*100)-100) -> 0 | O29: =IF(D29=0,0,IF(I29=0,0,((D29/I29)*100)-100)) -> 0 | Q29: 5300000 | R29: 0 | S29: =IF(D29=0,0,(D29/$D$32)*100) -> 10.15 | U29: 14.5 | V29: 14.43
A30: Total Hiper | C30: =SUM(C25:C29) -> 24170000 | D30: =SUM(D25:D29) -> 22706236 | E30: =SUM(E25:E29) -> 23891940 | G30: =SUM(G25:G29) -> 18155794 | H30: =SUM(H25:H29) -> 15079972 | I30: =SUM(I25:I29) -> 6935486 | J30: =SUM(C30:I30) -> 110939428 | K30: =IF(D30=0,0,((D30/C30)*100)-100) -> -6.06 | L30: =IF(D30=0,0,IF(E30=0,0,((D30/E30)*100)-100)) -> -4.96 | M30: =IF(G30=0,0,IF(D30=0,0,((D30/G30)*100)-100)) -> 25.06 | N30: =IF(H30=0,0,IF(D30=0,0,((D30/H30)*100)-100)) -> 50.57 | O30: =IF(D30=0,0,IF(I30=0,0,((D30/I30)*100)-100)) -> 227.39 | Q30: =SUM(Q25:Q29) -> 24170000 | R30: =IF(D30=0,0,((D30/Q30)*100)-100) -> -6.06 | S30: =IF(D30=0,0,(D30/$D$32)*100) -> 47.16 | U30: 15.58 | V30: 15.68
A32: Total Geral | C32: =C23+C30 -> 51427000 | D32: =D23+D30 -> 48144985 | E32: =E23+E30 -> 51508472 | G32: =G23+G30 -> 44588799 | H32: =H23+H30 -> 36781242 | I32: =I23+I30 -> 26486088 | K32: =IF(D30=0,0,((D32/C32)*100)-100) -> -6.38 | L32: =IF(D32=0,0,IF(E32=0,0,((D32/E32)*100)-100)) -> -6.53 | M32: =IF(G32=0,0,IF(D32=0,0,((D32/G32)*100)-100)) -> 7.98 | N32: =IF(H32=0,0,IF(D32=0,0,((D32/H32)*100)-100)) -> 30.9 | O32: =IF(D32=0,0,IF(I32=0,0,((D32/I32)*100)-100)) -> 81.77 | Q32: =Q23+Q30 -> 51427000 | R32: =IF(D32=0,0,((D32/Q32)*100)-100) -> -6.38 | S32: =S23+S30 -> 100 | U32: 16.21 | V32: 15.75
C33: Resumo por Regiao - Outubro/2002
C34: Descricao das Aberturas | H34: Valor | I34: %
C35: Curitiba (2,3,6,7,10,11,17,21,22) | H35: =D7+D8+D11+D12+D14+D16+D19+D28+D29 -> 24516884 | I35: =IF(D32=0,0,H35/$D$32) -> 0.50919999999999999
C36: Curitiba e Metrop. (Ctba. 4,5,8,14,23) | H36: =H35+D9+D10+D13+D27+D22 -> 35175710 | I36: =IF(D32=0,0,H36/$D$32) -> 0.73060000000000003
C37: Metropolitana (4,5,8,14,23) | H37: =H36-H35 -> 10658826 | I37: =IF(D32=0,0,H37/$D$32) -> 0.22140000000000001
C38: Norte (9,15,20) | H38: =D25+D18+D22 -> 5670328 | I38: =IF(D32=0,0,H38/$D$32) -> 0.1178
C39: Centro-Oeste (13,18,19) | H39: =D17+D20+D27 -> 6344718 | I39: =IF(D32=0,0,H39/$D$32) -> 0.1318
C40: Ponta Grossa (18,19) | H40: =H39-D17 -> 4840715 | I40: =IF(D32=0,0,H40/$D$32) -> 0.10050000000000001
C41: Super (2,3,4,5,6,7,8,10,11,13,15,17,18,20,23) | H41: =D23 -> 25438749 | I41: =IF(D32=0,0,H41/$D$32) -> 0.52839999999999998
C42: Hiper (9,14,19,21,22) | H42: =D30 -> 22706236 | I42: =IF(D32=0,0,H42/$D$32) -> 0.47160000000000002
C43: Curitiba, Metropolitana e Centro-Oeste | H43: =D32-H38 -> 42474657 | I43: =IF(D32=0,0,H43/$D$32) -> 0.88219999999999998
C44: Araucaria | H44: =D10+D22 -> 3064212 | I44: =IF(D32=0,0,H44/$D$32) -> 6.3600000000000004E-2