A2: Periodo: | B2: 40330 | C2: a | D2: 40359 | G2: Vendas Acumuladas por Filial | P2: =NOW() -> 40381.377879976855
A4: v.New | B4: Vendas 2010 | F4: Vendas de Anos Anteriores | J4: Percentuais ( % ) | P4: Meta Mensal | T4: Margem
A5: Lojas | B5: Previsao | C5: Realizada | D5: Mes Anterior | F5: Vendas 2009 | G5: Vendas 2008 | H5: Vendas 2007 | J5: % Prev | K5: % MA | L5: 2009 | M5: 2008 | N5: 2007 | P5: Previsao Mes | Q5: Final | R5: Part. | T5: Meta | U5: Coml | V5: Dif
A6: S. Felicidade | B6: 2850000 | C6: 2902003.03 | D6: 3003895.11 | F6: 2543393.38 | G6: 2177469.89 | H6: 1039475.22 | J6: =IF(B6=0,0,((C6/B6)*100)-100) -> 1.8246677192982332 | K6: =IF(C6=0,0,IF(D6=0,0,((C6/D6)*100)-100)) -> -3.3919985974476958 | L6: =IF(F6=0,0,((C6/F6)*100)-100) -> 14.099653353662504 | M6: =IF(G6=0,0,((C6/G6)*100)-100) -> 33.274083068951171 | N6: =IF(C6=0,0,IF(H6=0,0,((C6/H6)*100)-100)) -> 179.17962585005154 | P6: 2850000 | Q6: =IF(C6=0,0,((C6/P6)*100)-100) -> 1.8246677192982332 | R6: =IF(C6=0,0,(C6/$C$40)*100) -> 2.702973767334834 | T6: 17.500699999999998 | U6: 17.285547079528722 | V6: =U6-T6 -> -0.21515292047127588
A7: Lapa | B7: 2270000 | C7: 2257931.81 | D7: 2290071.47 | F7: 1965895.25 | G7: 1753389.54 | H7: 1354391.25 | J7: =IF(B7=0,0,((C7/B7)*100)-100) -> -0.53163832599119587 | K7: =IF(C7=0,0,IF(D7=0,0,((C7/D7)*100)-100)) -> -1.4034348019714855 | L7: =IF(F7=0,0,((C7/F7)*100)-100) -> 14.855143477252923 | M7: =IF(G7=0,0,((C7/G7)*100)-100) -> 28.775252645798247 | N7: =IF(C7=0,0,IF(H7=0,0,((C7/H7)*100)-100)) -> 66.711931282781109 | P7: 2270000 | Q7: =IF(C7=0,0,((C7/P7)*100)-100) -> -0.53163832599119587 | R7: =IF(C7=0,0,(C7/$C$40)*100) -> 2.103075147671662 | T7: 16.396799999999999 | U7: 16.001197573809815 | V7: =U7-T7 -> -0.39560242619018382
A8: Araucaria | B8: 1430000 | C8: 1338266.12 | D8: 1366997.26 | F8: 1257715.97 | G8: 1071973.73 | H8: 936029.7 | J8: =IF(B8=0,0,((C8/B8)*100)-100) -> -6.4149566433566463 | K8: =IF(C8=0,0,IF(D8=0,0,((C8/D8)*100)-100)) -> -2.1017701235187474 | L8: =IF(F8=0,0,((C8/F8)*100)-100) -> 6.4044785882777688 | M8: =IF(G8=0,0,((C8/G8)*100)-100) -> 24.841316773686245 | N8: =IF(C8=0,0,IF(H8=0,0,((C8/H8)*100)-100)) -> 42.972612941662021 | P8: 1430000 | Q8: =IF(C8=0,0,((C8/P8)*100)-100) -> -6.4149566433566463 | R8: =IF(C8=0,0,(C8/$C$40)*100) -> 1.2464832664468211 | T8: 16.8 | U8: 16.839126137333583 | V8: =U8-T8 -> 3.9126137333582278E-2
A9: Hauer | B9: 3700000 | C9: 3711344.01 | D9: 3976926.65 | F9: 3567994.83 | G9: 3769303.03 | H9: 2979641.44 | J9: =IF(B9=0,0,((C9/B9)*100)-100) -> 0.30659486486486287 | K9: =IF(C9=0,0,IF(D9=0,0,((C9/D9)*100)-100)) -> -6.6780874623372739 | L9: =IF(F9=0,0,((C9/F9)*100)-100) -> 4.0176397901338703 | M9: =IF(G9=0,0,((C9/G9)*100)-100) -> -1.5376588069121055 | N9: =IF(C9=0,0,IF(H9=0,0,((C9/H9)*100)-100)) -> 24.55673223554038 | P9: 3700000 | Q9: =IF(C9=0,0,((C9/P9)*100)-100) -> 0.30659486486486287 | R9: =IF(C9=0,0,(C9/$C$40)*100) -> 3.4568073833421429 | T9: 16.197900000000001 | U9: 16.494128767114745 | V9: =U9-T9 -> 0.29622876711474433
A10: Paranagua | B10: 0 | C10: 0 | D10: 0 | F10: 0 | G10: 0 | H10: 0 | J10: =IF(B10=0,0,((C10/B10)*100)-100) -> 0 | K10: =IF(C10=0,0,IF(D10=0,0,((C10/D10)*100)-100)) -> 0 | L10: =IF(F10=0,0,((C10/F10)*100)-100) -> 0 | M10: =IF(G10=0,0,((C10/G10)*100)-100) -> 0 | N10: =IF(C10=0,0,IF(H10=0,0,((C10/H10)*100)-100)) -> 0 | P10: 0 | Q10: =IF(C10=0,0,((C10/P10)*100)-100) -> 0 | R10: =IF(C10=0,0,(C10/$C$40)*100) -> 0 | T10: 0 | U10: 0 | V10: =U10-T10 -> 0
A11: Centenario | B11: 1310000 | C11: 1399596.88 | D11: 1360223.16 | F11: 1207149.07 | G11: 1183798.62 | H11: 963324.62 | J11: =IF(B11=0,0,((C11/B11)*100)-100) -> 6.839456488549601 | K11: =IF(C11=0,0,IF(D11=0,0,((C11/D11)*100)-100)) -> 2.894651492333054 | L11: =IF(F11=0,0,((C11/F11)*100)-100) -> 15.942340079009455 | M11: =IF(G11=0,0,((C11/G11)*100)-100) -> 18.229304913364388 | N11: =IF(C11=0,0,IF(H11=0,0,((C11/H11)*100)-100)) -> 45.288187485543546 | P11: 1310000 | Q11: =IF(C11=0,0,((C11/P11)*100)-100) -> 6.839456488549601 | R11: =IF(C11=0,0,(C11/$C$40)*100) -> 1.3036077538084718 | T11: 17.29 | U11: 15.090778138916686 | V11: =U11-T11 -> -2.1992218610833127
A12: Sitio Cercado | B12: 2400000 | C12: 2330772 | D12: 2405685.86 | F12: 2062882.93 | G12: 1846019.21 | H12: 1349409.11 | J12: =IF(B12=0,0,((C12/B12)*100)-100) -> -2.8845000000000027 | K12: =IF(C12=0,0,IF(D12=0,0,((C12/D12)*100)-100)) -> -3.114033350971269 | L12: =IF(F12=0,0,((C12/F12)*100)-100) -> 12.986149921750538 | M12: =IF(G12=0,0,((C12/G12)*100)-100) -> 26.259357831926366 | N12: =IF(C12=0,0,IF(H12=0,0,((C12/H12)*100)-100)) -> 72.725379036458406 | P12: 2400000 | Q12: =IF(C12=0,0,((C12/P12)*100)-100) -> -2.8845000000000027 | R12: =IF(C12=0,0,(C12/$C$40)*100) -> 2.1709197090805747 | T12: 16.7121 | U12: 15.043622456422161 | V12: =U12-T12 -> -1.6684775435778381
A13: Apucarana | B13: 2600000 | C13: 2392243.79 | D13: 2429214.25 | F13: 2470235.67 | G13: 2287883.27 | H13: 2225160.18 | J13: =IF(B13=0,0,((C13/B13)*100)-100) -> -7.9906234615384619 | K13: =IF(C13=0,0,IF(D13=0,0,((C13/D13)*100)-100)) -> -1.5219102226162136 | L13: =IF(F13=0,0,((C13/F13)*100)-100) -> -3.157264747942051 | M13: =IF(G13=0,0,((C13/G13)*100)-100) -> 4.5614442558513844 | N13: =IF(C13=0,0,IF(H13=0,0,((C13/H13)*100)-100)) -> 7.5088351617005742 | P13: 2600000 | Q13: =IF(C13=0,0,((C13/P13)*100)-100) -> -7.9906234615384619 | R13: =IF(C13=0,0,(C13/$C$40)*100) -> 2.2281755541239607 | T13: 17 | U13: 16.506746580372564 | V13: =U13-T13 -> -0.49325341962743607
A14: Ahú | B14: 1960000 | C14: 1832674.57 | D14: 1865267.05 | F14: 1687080.17 | G14: 1594110.85 | H14: 1388334.45 | J14: =IF(B14=0,0,((C14/B14)*100)-100) -> -6.4961954081632598 | K14: =IF(C14=0,0,IF(D14=0,0,((C14/D14)*100)-100)) -> -1.7473358573508335 | L14: =IF(F14=0,0,((C14/F14)*100)-100) -> 8.6299633288914777 | M14: =IF(G14=0,0,((C14/G14)*100)-100) -> 14.96531561779409 | N14: =IF(C14=0,0,IF(H14=0,0,((C14/H14)*100)-100)) -> 32.005265013772458 | P14: 1960000 | Q14: =IF(C14=0,0,((C14/P14)*100)-100) -> -6.4961954081632598 | R14: =IF(C14=0,0,(C14/$C$40)*100) -> 1.706983499176997 | T14: 17 | U14: 16.59933765545729 | V14: =U14-T14 -> -0.40066234454270955
A15: P.G. Centro | B15: 1900000 | C15: 1841535.96 | D15: 1877311.05 | F15: 1803046.03 | G15: 1958232.77 | H15: 1681250.58 | J15: =IF(B15=0,0,((C15/B15)*100)-100) -> -3.0770547368421148 | K15: =IF(C15=0,0,IF(D15=0,0,((C15/D15)*100)-100)) -> -1.905655964684172 | L15: =IF(F15=0,0,((C15/F15)*100)-100) -> 2.1347169933315371 | M15: =IF(G15=0,0,((C15/G15)*100)-100) -> -5.95929206107607 | N15: =IF(C15=0,0,IF(H15=0,0,((C15/H15)*100)-100)) -> 9.5336996106790934 | P15: 1900000 | Q15: =IF(C15=0,0,((C15/P15)*100)-100) -> -3.0770547368421148 | R15: =IF(C15=0,0,(C15/$C$40)*100) -> 1.7152371448363961 | T15: 18.551500000000001 | U15: 18.908399703473616 | V15: =U15-T15 -> 0.35689970347361566
A16: Maringa | B16: 3000000 | C16: 2958848.95 | D16: 3023946.33 | F16: 2770952.47 | G16: 2446064.18 | H16: 2337244.79 | J16: =IF(B16=0,0,((C16/B16)*100)-100) -> -1.3717016666666524 | K16: =IF(C16=0,0,IF(D16=0,0,((C16/D16)*100)-100)) -> -2.1527293442406972 | L16: =IF(F16=0,0,((C16/F16)*100)-100) -> 6.7809347881019306 | M16: =IF(G16=0,0,((C16/G16)*100)-100) -> 20.963667846196898 | N16: =IF(C16=0,0,IF(H16=0,0,((C16/H16)*100)-100)) -> 26.595595063878605 | P16: 3000000 | Q16: =IF(C16=0,0,((C16/P16)*100)-100) -> -1.3717016666666524 | R16: =IF(C16=0,0,(C16/$C$40)*100) -> 2.7559210003155026 | T16: 18.8004 | U16: 17.717310983380884 | V16: =U16-T16 -> -1.0830890166191161
A17: Araucaria Nova | B17: 3800000 | C17: 3870077.46 | D17: 4007702.74 | F17: 3379256.06 | G17: 2922719.21 | H17: 2202561.17 | J17: =IF(B17=0,0,((C17/B17)*100)-100) -> 1.8441436842105361 | K17: =IF(C17=0,0,IF(D17=0,0,((C17/D17)*100)-100)) -> -3.4340191608123121 | L17: =IF(F17=0,0,((C17/F17)*100)-100) -> 14.524540055126806 | M17: =IF(G17=0,0,((C17/G17)*100)-100) -> 32.413590972360282 | N17: =IF(C17=0,0,IF(H17=0,0,((C17/H17)*100)-100)) -> 75.708058087667098 | P17: 3800000 | Q17: =IF(C17=0,0,((C17/P17)*100)-100) -> 1.8441436842105361 | R17: =IF(C17=0,0,(C17/$C$40)*100) -> 3.6046543521127288 | T17: 16.9984 | U17: 16.150588882528467 | V17: =U17-T17 -> -0.84781111747153304
A18: Cristo Rei | B18: 2380000 | C18: 2342828.51 | D18: 2425456.6 | F18: 2095182.25 | G18: 1699428.81 | H18: 1329695.63 | J18: =IF(B18=0,0,((C18/B18)*100)-100) -> -1.5618273109243859 | K18: =IF(C18=0,0,IF(D18=0,0,((C18/D18)*100)-100)) -> -3.4067024740826213 | L18: =IF(F18=0,0,((C18/F18)*100)-100) -> 11.819795628757348 | M18: =IF(G18=0,0,((C18/G18)*100)-100) -> 37.859761833742226 | N18: =IF(C18=0,0,IF(H18=0,0,((C18/H18)*100)-100)) -> 76.192841214346174 | P18: 2380000 | Q18: =IF(C18=0,0,((C18/P18)*100)-100) -> -1.5618273109243859 | R18: =IF(C18=0,0,(C18/$C$40)*100) -> 2.1821493425160745 | T18: 18.295100000000001 | U18: 17.538207694083425 | V18: =U18-T18 -> -0.75689230591657619
A19: Campo Largo | B19: 3400000 | C19: 3505317.77 | D19: 3581633.49 | F19: 2795659.36 | G19: 2555403.42 | H19: 0 | J19: =IF(B19=0,0,((C19/B19)*100)-100) -> 3.0975814705882243 | K19: =IF(C19=0,0,IF(D19=0,0,((C19/D19)*100)-100)) -> -2.13075179839241 | L19: =IF(F19=0,0,((C19/F19)*100)-100) -> 25.38429467315359 | M19: =IF(G19=0,0,((C19/G19)*100)-100) -> 37.172774465489312 | N19: =IF(C19=0,0,IF(H19=0,0,((C19/H19)*100)-100)) -> 0 | P19: 3400000 | Q19: =IF(C19=0,0,((C19/P19)*100)-100) -> 3.0975814705882243 | R19: =IF(C19=0,0,(C19/$C$40)*100) -> 3.2649111253624845 | T19: 16.35 | U19: 16.245197364802682 | V19: =U19-T19 -> -0.10480263519731992
A20: Brasilia | B20: 2500000 | C20: 2343289.97 | D20: 2481626.79 | F20: 2373461.91 | G20: 1005313.51 | H20: 787925.37 | J20: =IF(B20=0,0,((C20/B20)*100)-100) -> -6.2684011999999996 | K20: =IF(C20=0,0,IF(D20=0,0,((C20/D20)*100)-100)) -> -5.5744409496804224 | L20: =IF(F20=0,0,((C20/F20)*100)-100) -> -1.2712207376439437 | M20: =IF(G20=0,0,((C20/G20)*100)-100) -> 133.09046846490708 | N20: =IF(C20=0,0,IF(H20=0,0,((C20/H20)*100)-100)) -> 197.39998979852629 | P20: 2500000 | Q20: =IF(C20=0,0,((C20/P20)*100)-100) -> -6.2684011999999996 | R20: =IF(C20=0,0,(C20/$C$40)*100) -> 2.182579154015849 | T20: 17.104399999999998 | U20: 16.15915720409113 | V20: =U20-T20 -> -0.94524279590886806
A21: Total Super | B21: =SUM(B6:B20) -> 35500000 | C21: =SUM(C6:C20) -> 35026730.829999998 | D21: =SUM(D6:D20) -> 36095957.810000002 | F21: =SUM(F6:F20) -> 31979905.349999998 | G21: =SUM(G6:G20) -> 28271110.040000003 | H21: =SUM(H6:H20) -> 20574443.509999998 | I21: =SUM(B21:H21) -> 187448147.53999999 | J21: =IF(C21=0,0,((C21/B21)*100)-100) -> -1.3331525915493074 | K21: =IF(C21=0,0,IF(D21=0,0,((C21/D21)*100)-100)) -> -2.9621792712307098 | L21: =IF(F21=0,0,IF(C21=0,0,((C21/F21)*100)-100)) -> 9.5273123752381679 | M21: =IF(G21=0,0,IF(C21=0,0,((C21/G21)*100)-100)) -> 23.89584554848274 | N21: =IF(C21=0,0,IF(H21=0,0,((C21/H21)*100)-100)) -> 70.24387956337975 | P21: =SUM(P6:P20) -> 35500000 | Q21: =IF(C21=0,0,((C21/P21)*100)-100) -> -1.3331525915493074 | R21: =IF(C21=0,0,(C21/$C$40)*100) -> 32.624478200144495 | T21: 17.25 | U21: 0 | V21: =U21-T21 -> -17.25
A22: Pinheirinho | B22: 5000000 | C22: 4651250.75 | D22: 5484807.3099999996 | F22: 4301190.09 | G22: 3859537.08 | H22: 3064537.47 | J22: =IF(B22=0,0,((C22/B22)*100)-100) -> -6.9749850000000038 | K22: =IF(C22=0,0,IF(D22=0,0,((C22/D22)*100)-100)) -> -15.197554132489657 | L22: =IF(F22=0,0,((C22/F22)*100)-100) -> 8.1386930750600754 | M22: =IF(G22=0,0,((C22/G22)*100)-100) -> 20.513176932607678 | N22: =IF(C22=0,0,IF(H22=0,0,((C22/H22)*100)-100)) -> 51.776599096371967 | P22: 5000000 | Q22: =IF(C22=0,0,IF(P22=0,0,((C22/P22)*100)-100)) -> -6.9749850000000038 | R22: =IF(C22=0,0,(C22/$C$40)*100) -> 4.332252114342718 | T22: 16.1 | U22: 16.168431899742234 | V22: =U22-T22 -> 6.8431899742233071E-2
A23: Londrina | B23: 3600000 | C23: 3563870.9 | D23: 3776939.14 | F23: 3301450.02 | G23: 3308205.18 | H23: 2643314.19 | J23: =IF(B23=0,0,((C23/B23)*100)-100) -> -1.0035861111111046 | K23: =IF(C23=0,0,IF(D23=0,0,((C23/D23)*100)-100)) -> -5.6412939711811276 | L23: =IF(F23=0,0,((C23/F23)*100)-100) -> 7.9486552396755599 | M23: =IF(G23=0,0,((C23/G23)*100)-100) -> 7.7282304479070945 | N23: =IF(C23=0,0,IF(H23=0,0,((C23/H23)*100)-100)) -> 34.825852843471495 | P23: 3600000 | Q23: =IF(C23=0,0,IF(P23=0,0,((C23/P23)*100)-100)) -> -1.0035861111111046 | R23: =IF(C23=0,0,(C23/$C$40)*100) -> 3.3194484820603325 | T23: 16.975300000000001 | U23: 16.161532955641015 | V23: =U23-T23 -> -0.81376704435898617
A24: São Bráz | B24: 5100000 | C24: 5021487.92 | D24: 5380635.21 | F24: 4720365.28 | G24: 4345935.36 | H24: 4516720.75 | J24: =IF(B24=0,0,((C24/B24)*100)-100) -> -1.5394525490196003 | K24: =IF(C24=0,0,IF(D24=0,0,((C24/D24)*100)-100)) -> -6.6748120989975064 | L24: =IF(F24=0,0,((C24/F24)*100)-100) -> 6.3792232621455014 | M24: =IF(G24=0,0,((C24/G24)*100)-100) -> 15.544468659561446 | N24: =IF(C24=0,0,IF(H24=0,0,((C24/H24)*100)-100)) -> 11.175523082758659 | P24: 5100000 | Q24: =IF(C24=0,0,IF(P24=0,0,((C24/P24)*100)-100)) -> -1.5394525490196003 | R24: =IF(C24=0,0,(C24/$C$40)*100) -> 4.6770971568381716 | T24: 16.222799999999999 | U24: 15.330532548607625 | V24: =U24-T24 -> -0.89226745139237451
A25: S.J. Pinhais | B25: 5800000 | C25: 5696087.1600000001 | D25: 6282022.7800000003 | F25: 5246767.7 | G25: 4921624.4 | H25: 3991419.4 | J25: =IF(B25=0,0,((C25/B25)*100)-100) -> -1.7916006896551693 | K25: =IF(C25=0,0,IF(D25=0,0,((C25/D25)*100)-100)) -> -9.3271807588064917 | L25: =IF(F25=0,0,((C25/F25)*100)-100) -> 8.5637383945929173 | M25: =IF(G25=0,0,((C25/G25)*100)-100) -> 15.735917596637393 | N25: =IF(C25=0,0,IF(H25=0,0,((C25/H25)*100)-100)) -> 42.708309730618652 | P25: 5800000 | Q25: =IF(C25=0,0,IF(P25=0,0,((C25/P25)*100)-100)) -> -1.7916006896551693 | R25: =IF(C25=0,0,(C25/$C$40)*100) -> 5.3054300807993222 | T25: 16 | U25: 16.301269519197454 | V25: =U25-T25 -> 0.30126951919745437
A26: P.G. Nova | B26: 5300000 | C26: 5115381.82 | D26: 6001865.0800000001 | F26: 4331847.83 | G26: 4481075.37 | H26: 3698978.53 | J26: =IF(B26=0,0,((C26/B26)*100)-100) -> -3.4833618867924514 | K26: =IF(C26=0,0,IF(D26=0,0,((C26/D26)*100)-100)) -> -14.770129754399605 | L26: =IF(F26=0,0,((C26/F26)*100)-100) -> 18.087754250591942 | M26: =IF(G26=0,0,((C26/G26)*100)-100) -> 14.155228324133276 | N26: =IF(C26=0,0,IF(H26=0,0,((C26/H26)*100)-100)) -> 38.291741314865135 | P26: 5300000 | Q26: =IF(C26=0,0,IF(P26=0,0,((C26/P26)*100)-100)) -> -3.4833618867924514 | R26: =IF(C26=0,0,(C26/$C$40)*100) -> 4.7645514930291171 | T26: 16.2973 | U26: 16.256544071621228 | V26: =U26-T26 -> -4.0755928378771955E-2
A27: Nilo Pecanha | B27: 12700000 | C27: 12296388.49 | D27: 13590968.57 | F27: 11880345.5 | G27: 11156486.279999999 | H27: 9101567.4000000004 | J27: =IF(B27=0,0,((C27/B27)*100)-100) -> -3.1780433858267685 | K27: =IF(C27=0,0,IF(D27=0,0,((C27/D27)*100)-100)) -> -9.5252966948771416 | L27: =IF(F27=0,0,((C27/F27)*100)-100) -> 3.5019435251272739 | M27: =IF(G27=0,0,((C27/G27)*100)-100) -> 10.217394450109978 | N27: =IF(C27=0,0,IF(H27=0,0,((C27/H27)*100)-100)) -> 35.101878056739992 | P27: 12700000 | Q27: =IF(C27=0,0,IF(P27=0,0,((C27/P27)*100)-100)) -> -3.1780433858267685 | R27: =IF(C27=0,0,(C27/$C$40)*100) -> 11.453060240749643 | T27: 16.459900000000001 | U27: 16.95842646559063 | V27: =U27-T27 -> 0.49852646559062919
A28: Champagnat | B28: 6800000 | C28: 6127551.9400000004 | D28: 6887847.0499999998 | F28: 6773376.3799999999 | G28: 6219087.1699999999 | H28: 5139377.48 | J28: =IF(B28=0,0,((C28/B28)*100)-100) -> -9.8889420588235311 | K28: =IF(C28=0,0,IF(D28=0,0,((C28/D28)*100)-100)) -> -11.038211279677 | L28: =IF(F28=0,0,((C28/F28)*100)-100) -> -9.5347490493359999 | M28: =IF(G28=0,0,((C28/G28)*100)-100) -> -1.4718434956427728 | N28: =IF(C28=0,0,IF(H28=0,0,((C28/H28)*100)-100)) -> 19.227512745376302 | P28: 6800000 | Q28: =IF(C28=0,0,IF(P28=0,0,((C28/P28)*100)-100)) -> -9.8889420588235311 | R28: =IF(C28=0,0,(C28/$C$40)*100) -> 5.7073035350351358 | T28: 16.7 | U28: 17.307405475864478 | V28: =U28-T28 -> 0.60740547586447846
A29: Santa Candida | B29: 7100000 | C29: 7045078.7599999998 | D29: 7584456.5300000003 | F29: 6178313.9900000002 | G29: 5227884.14 | H29: 4107366.57 | J29: =IF(B29=0,0,((C29/B29)*100)-100) -> -0.77353859154929694 | K29: =IF(C29=0,0,IF(D29=0,0,((C29/D29)*100)-100)) -> -7.1116205606362826 | L29: =IF(F29=0,0,((C29/F29)*100)-100) -> 14.029147294924059 | M29: =IF(G29=0,0,((C29/G29)*100)-100) -> 34.759657470144305 | N29: =IF(C29=0,0,IF(H29=0,0,((C29/H29)*100)-100)) -> 71.523009693288714 | P29: 7100000 | Q29: =IF(C29=0,0,IF(P29=0,0,((C29/P29)*100)-100)) -> -0.77353859154929694 | R29: =IF(C29=0,0,(C29/$C$40)*100) -> 6.5619032372574129 | T29: 15.9999 | U29: 16.398536898684725 | V29: =U29-T29 -> 0.39863689868472463
A30: Paranaguá Raia | B30: 0 | C30: 0 | D30: 0 | F30: 0 | G30: 0 | H30: 0 | J30: =IF(B30=0,0,((C30/B30)*100)-100) -> 0 | K30: =IF(C30=0,0,IF(D30=0,0,((C30/D30)*100)-100)) -> 0 | L30: =IF(F30=0,0,((C30/F30)*100)-100) -> 0 | M30: =IF(G30=0,0,((C30/G30)*100)-100) -> 0 | N30: =IF(C30=0,0,IF(H30=0,0,((C30/H30)*100)-100)) -> 0 | P30: 0 | Q30: =IF(C30=0,0,IF(P30=0,0,((C30/P30)*100)-100)) -> 0 | R30: =IF(C30=0,0,(C30/$C$40)*100) -> 0 | T30: 0 | U30: 0 | V30: =U30-T30 -> 0
A31: Uvaranas | B31: 4800000 | C31: 4529219.72 | D31: 5007199.86 | F31: 4204028.03 | G31: 0 | H31: 0 | J31: =IF(B31=0,0,((C31/B31)*100)-100) -> -5.6412558333333322 | K31: =IF(C31=0,0,IF(D31=0,0,((C31/D31)*100)-100)) -> -9.5458570331562669 | L31: =IF(F31=0,0,((C31/F31)*100)-100) -> 7.7352407662229439 | M31: =IF(G31=0,0,((C31/G31)*100)-100) -> 0 | N31: =IF(C31=0,0,IF(H31=0,0,((C31/H31)*100)-100)) -> 0 | P31: 4800000 | Q31: =IF(C31=0,0,IF(P31=0,0,((C31/P31)*100)-100)) -> -5.6412558333333322 | R31: =IF(C31=0,0,(C31/$C$40)*100) -> 4.2185903884654534 | T31: 15.9497 | U31: 15.817148301208936 | V31: =U31-T31 -> -0.13255169879106354
A32: Torres | B32: 5200000 | C32: 5311693.18 | D32: 5755865.54 | F32: 4611016.87 | G32: 0 | H32: 0 | J32: =IF(B32=0,0,((C32/B32)*100)-100) -> 2.1479457692307591 | K32: =IF(C32=0,0,IF(D32=0,0,((C32/D32)*100)-100)) -> -7.7168647688736769 | L32: =IF(F32=0,0,((C32/F32)*100)-100) -> 15.195700422583784 | M32: =IF(G32=0,0,((C32/G32)*100)-100) -> 0 | N32: =IF(C32=0,0,IF(H32=0,0,((C32/H32)*100)-100)) -> 0 | P32: 5200000 | Q32: =IF(C32=0,0,IF(P32=0,0,((C32/P32)*100)-100)) -> 2.1479457692307591 | R32: =IF(C32=0,0,(C32/$C$40)*100) -> 4.9473991506036938 | T32: 16.03 | U32: 16.146845288981847 | V32: =U32-T32 -> 0.1168452889818461
A33: Total Hiper | B33: =SUM(B22:B32) -> 61400000 | C33: =SUM(C22:C32) -> 59358010.639999993 | D33: =SUM(D22:D32) -> 65752607.07 | F33: =SUM(F22:F32) -> 55548701.690000005 | G33: =SUM(G22:G32) -> 43519834.980000004 | H33: =SUM(H22:H32) -> 36263281.789999999 | I33: =SUM(B33:H33) -> 321842436.17000002 | J33: =IF(C33=0,0,((C33/B33)*100)-100) -> -3.3257155700325853 | K33: =IF(C33=0,0,IF(D33=0,0,((C33/D33)*100)-100)) -> -9.7252363289448596 | L33: =IF(F33=0,0,IF(C33=0,0,((C33/F33)*100)-100)) -> 6.8576021294945093 | M33: =IF(G33=0,0,IF(C33=0,0,((C33/G33)*100)-100)) -> 36.393004861527146 | N33: =IF(C33=0,0,IF(H33=0,0,((C33/H33)*100)-100)) -> 63.686262549928983 | P33: =SUM(P22:P32) -> 61400000 | Q33: =IF(C33=0,0,((C33/P33)*100)-100) -> -3.3257155700325853 | R33: =IF(C33=0,0,(C33/$C$40)*100) -> 55.287035879180991 | T33: 16.23 | U33: 0 | V33: =U33-T33 -> -16.23
A34: Total s/ 25,27,30 | B34: =B21+B33 -> 96900000 | C34: =C21+C33 -> 94384741.469999999 | D34: =D21+D33 -> 101848564.88 | E34: =E21+E33 -> 0 | F34: =F21+F33 -> 87528607.040000007 | G34: =G21+G33 -> 71790945.020000011 | H34: =H21+H33 -> 56837725.299999997 | I34: =SUM(B34:H34) -> 509290583.7100001 | J34: =IF(C34=0,0,((C34/B34)*100)-100) -> -2.5957260371517066 | K34: =IF(C34=0,0,IF(D34=0,0,((C34/D34)*100)-100)) -> -7.3283540310990389 | L34: =IF(F34=0,0,IF(C34=0,0,((C34/F34)*100)-100)) -> 7.8330212965308306 | M34: =IF(G34=0,0,IF(C34=0,0,((C34/G34)*100)-100)) -> 31.47165209164703 | N34: =IF(C34=0,0,IF(H34=0,0,((C34/H34)*100)-100)) -> 66.060026103824384 | P34: =P21+P33 -> 96900000 | Q34: =IF(C34=0,0,((C34/P34)*100)-100) -> -2.5957260371517066 | R34: =IF(C34=0,0,(C34/$C$40)*100) -> 87.911514079325499 | T34: 0 | U34: 0 | V34: =U34-T34 -> 0
A35: Paranaguá | B35: 5200000 | C35: 5217567.84 | D35: 5408353.0999999996 | F35: 1861892.88 | G35: 1732271.6 | H35: 1544474.58 | J35: =IF(B35=0,0,((C35/B35)*100)-100) -> 0.33784307692307891 | K35: =IF(C35=0,0,IF(D35=0,0,((C35/D35)*100)-100)) -> -3.5276036248446871 | L35: =IF(F35=0,0,((C35/F35)*100)-100) -> 180.22921705356111 | M35: =IF(G35=0,0,((C35/G35)*100)-100) -> 201.19802460537943 | N35: =IF(C35=0,0,IF(H35=0,0,((C35/H35)*100)-100)) -> 237.82154187348294 | P35: 5200000 | Q35: =IF(P35=0,0,IF(C35=0,0,((C35/P35)*100)-100)) -> 0.33784307692307891 | R35: =IF(C35=0,0,(C35/$C$40)*100) -> 4.859729247357083 | T35: 17.9514 | U35: 17.49877851133029 | V35: =U35-T35 -> -0.45262148866970975
A36: Paranaguá Raia | B36: 0 | C36: 0 | D36: 0 | F36: 6213555.8300000001 | G36: 5593712.9199999999 | H36: 4693325.16 | J36: =IF(B36=0,0,((C36/B36)*100)-100) -> 0 | K36: =IF(C36=0,0,IF(D36=0,0,((C36/D36)*100)-100)) -> 0 | L36: =IF(F36=0,0,((C36/F36)*100)-100) -> -100 | M36: =IF(G36=0,0,((C36/G36)*100)-100) -> -100 | N36: =IF(C36=0,0,IF(H36=0,0,((C36/H36)*100)-100)) -> 0 | P36: 1E-3 | Q36: =IF(P36=0,0,IF(C36=0,0,((C36/P36)*100)-100)) -> 0 | R36: =IF(C36=0,0,(C36/$C$40)*100) -> 0 | T36: 0 | U36: 0 | V36: =U36-T36 -> 0
A37: Novo Mundo | B37: 5300000 | C37: 5114205.54 | D37: 5851144.29 | F37: 0 | G37: 0 | H37: 0 | J37: =IF(B37=0,0,((C37/B37)*100)-100) -> -3.5055558490566057 | K37: =IF(C37=0,0,IF(D37=0,0,((C37/D37)*100)-100)) -> -12.594779986189678 | L37: =IF(F37=0,0,((C37/F37)*100)-100) -> 0 | M37: =IF(G37=0,0,((C37/G37)*100)-100) -> 0 | N37: =IF(C37=0,0,IF(H37=0,0,((C37/H37)*100)-100)) -> 0 | P37: 5300000 | Q37: =IF(P37=0,0,IF(C37=0,0,((C37/P37)*100)-100)) -> -3.5055558490566057 | R37: =IF(C37=0,0,(C37/$C$40)*100) -> 4.7634558863222418 | T37: 15.65 | U37: 15.785238267916778 | V37: =U37-T37 -> 0.13523826791677784
A38: Fazenda | B38: 2900000 | C38: 2646829.37 | D38: 2985821.47 | F38: 0 | G38: 0 | H38: 0 | J38: =IF(B38=0,0,((C38/B38)*100)-100) -> -8.7300217241379272 | K38: =IF(C38=0,0,IF(D38=0,0,((C38/D38)*100)-100)) -> -11.353394816335083 | L38: =IF(F38=0,0,((C38/F38)*100)-100) -> 0 | M38: =IF(G38=0,0,((C38/G38)*100)-100) -> 0 | N38: =IF(C38=0,0,IF(H38=0,0,((C38/H38)*100)-100)) -> 0 | P38: 2900000 | Q38: =IF(P38=0,0,IF(C38=0,0,((C38/P38)*100)-100)) -> -8.7300217241379272 | R38: =IF(C38=0,0,(C38/$C$40)*100) -> 2.4653007869951766 | T38: 17 | U38: 15.754432254920914 | V38: =U38-T38 -> -1.2455677450790859
A39: Total Lojas Novas | B39: =SUM(B35:B38) -> 13400000 | C39: =SUM(C35:C38) -> 12978602.75 | D39: =SUM(D35:D38) -> 14245318.860000001 | F39: =SUM(F35:F38) -> 8075448.71 | G39: =SUM(G35:G38) -> 7325984.5199999996 | H39: =SUM(H35:H38) -> 6237799.7400000002 | J39: =IF(C39=0,0,((C39/B39)*100)-100) -> -3.144755597014921 | K39: =IF(C39=0,0,IF(D39=0,0,((C39/D39)*100)-100)) -> -8.892156942564938 | L39: =IF(F39=0,0,IF(C39=0,0,((C39/F39)*100)-100)) -> 60.71679997085883 | M39: =IF(G39=0,0,IF(C39=0,0,((C39/G39)*100)-100)) -> 77.15847903538841 | N39: =IF(C39=0,0,IF(H39=0,0,((C39/H39)*100)-100)) -> 108.06379317974066 | P39: =SUM(P35:P38) -> 13400000.001 | Q39: =IF(P39=0,0,IF(C39=0,0,((C39/P39)*100)-100)) -> -3.1447556042429312 | R39: =IF(C39=0,0,(C39/$C$40)*100) -> 12.088485920674501
A40: Total Geral | B40: =B21+B33+B39 -> 110300000 | C40: =C21+C33+C39 -> 107363344.22 | D40: =D21+D33+D39 -> 116093883.73999999 | F40: =F21+F33+F39 -> 95604055.75 | G40: =G21+G33+G39 -> 79116929.540000007 | H40: =H21+H33+H39 -> 63075525.039999999 | J40: =IF(C40=0,0,((C40/B40)*100)-100) -> -2.6624259111514164 | K40: =IF(C40=0,0,IF(D40=0,0,((C40/D40)*100)-100)) -> -7.5202407213394764 | L40: =IF(F40=0,0,IF(C40=0,0,((C40/F40)*100)-100)) -> 12.299989135136656 | M40: =IF(G40=0,0,IF(C40=0,0,((C40/G40)*100)-100)) -> 35.702111854226018 | N40: =IF(C40=0,0,IF(H40=0,0,((C40/H40)*100)-100)) -> 70.21395248301846 | P40: =P21+P33+P39 -> 110300000.001 | Q40: =IF(C40=0,0,((C40/P40)*100)-100) -> -2.662425912033882 | R40: =R21+R33+R39 -> 100 | T40: 0 | U40: 0 | V40: =U40-T40 -> 0