A2: Perodo: | C2: 37681 | E2: 37711 | H2: Vendas Acumuladas por Filial
C4: Vendas 2003 | G4: Vendas de Anos Anteriores | K4: Percentuais ( % ) | R4: %
A5: Lojas | C5: Previso | D5: Realizada | E5: Ms Anterior | G5: Vendas 2002 | H5: Vendas 2001 | I5: Vendas 2000 | K5: % Prev | L5: % MA | M5: 2002 | N5: 2001 | O5: 2000 | Q5: Previso Ms | R5: Final | S5: Part.
A7: Xaxim | C7: 635000 | D7: 669625.38 | E7: 618469.45 | G7: 621375.5 | H7: 529564.63 | I7: 445218.2 | K7: =IF(C7=0,0,((D7/C7)*100)-100) -> 5.45 | L7: =IF(E7=0,0,((D7/E7)*100)-100) -> 8.27 | M7: =IF(G7=0,0,((D7/G7)*100)-100) -> 7.77 | N7: =IF(H7=0,0,((D7/H7)*100)-100) -> 26.45 | O7: =IF(I7=0,0,((D7/I7)*100)-100) -> 50.4 | Q7: 635000 | R7: =((D7/Q7)*100)-100 -> 5.45 | S7: =D7/$D$31*100 -> 1.56
A8: S. Felicidade | C8: 690000 | D8: 714359.17 | E8: 686678.61 | G8: 597985.48 | H8: 578265.09 | I8: 528362.04 | K8: =IF(C8=0,0,((D8/C8)*100)-100) -> 3.53 | L8: =IF(E8=0,0,((D8/E8)*100)-100) -> 4.03 | M8: =IF(G8=0,0,((D8/G8)*100)-100) -> 19.46 | N8: =IF(H8=0,0,((D8/H8)*100)-100) -> 23.53 | O8: =IF(I8=0,0,((D8/I8)*100)-100) -> 35.2 | Q8: 690000 | R8: =((D8/Q8)*100)-100 -> 3.53 | S8: =D8/$D$31*100 -> 1.67
A9: Lapa | C9: 950000 | D9: 1012412.37 | E9: 913056.33 | G9: 981302.43 | H9: 706449.99 | I9: 633309.4 | K9: =IF(C9=0,0,((D9/C9)*100)-100) -> 6.57 | L9: =IF(E9=0,0,((D9/E9)*100)-100) -> 10.88 | M9: =IF(G9=0,0,((D9/G9)*100)-100) -> 3.17 | N9: =IF(H9=0,0,((D9/H9)*100)-100) -> 43.31 | O9: =IF(I9=0,0,((D9/I9)*100)-100) -> 59.86 | Q9: 950000 | R9: =((D9/Q9)*100)-100 -> 6.57 | S9: =D9/$D$31*100 -> 2.37
A10: Araucria | C10: 1050000 | D10: 1086755.37 | E10: 993989.84 | G10: 1697511.97 | H10: 1438396.69 | I10: 1290150.74 | K10: =IF(C10=0,0,((D10/C10)*100)-100) -> 3.5 | L10: =IF(E10=0,0,((D10/E10)*100)-100) -> 9.33 | M10: =IF(G10=0,0,((D10/G10)*100)-100) -> -35.98 | N10: =IF(H10=0,0,((D10/H10)*100)-100) -> -24.45 | O10: =IF(I10=0,0,((D10/I10)*100)-100) -> -15.77 | Q10: 1050000 | R10: =((D10/Q10)*100)-100 -> 3.5 | S10: =D10/$D$31*100 -> 2.54
A11: Pinheirinho | C11: 1770000 | D11: 1884251.92 | E11: 1717330.43 | G11: 1932771.51 | H11: 1593903.79 | I11: 1374948.42 | K11: =IF(C11=0,0,((D11/C11)*100)-100) -> 6.45 | L11: =IF(E11=0,0,((D11/E11)*100)-100) -> 9.72 | M11: =IF(G11=0,0,((D11/G11)*100)-100) -> -2.51 | N11: =IF(H11=0,0,((D11/H11)*100)-100) -> 18.22 | O11: =IF(I11=0,0,((D11/I11)*100)-100) -> 37.04 | Q11: 1770000 | R11: =((D11/Q11)*100)-100 -> 6.45 | S11: =D11/$D$31*100 -> 4.4
A12: Hauer | C12: 2680000 | D12: 2896663.36 | E12: 2685568.53 | G12: 2623208.89 | H12: 2179786.31 | I12: 1858501.17 | K12: =IF(C12=0,0,((D12/C12)*100)-100) -> 8.08 | L12: =IF(E12=0,0,((D12/E12)*100)-100) -> 7.86 | M12: =IF(G12=0,0,((D12/G12)*100)-100) -> 10.42 | N12: =IF(H12=0,0,((D12/H12)*100)-100) -> 32.89 | O12: =IF(I12=0,0,((D12/I12)*100)-100) -> 55.86 | Q12: 2680000 | R12: =((D12/Q12)*100)-100 -> 8.08 | S12: =D12/$D$31*100 -> 6.77
A13: Paranagu | C13: 2750000 | D13: 3046003.19 | E13: 2761429.56 | G13: 2816003.51 | H13: 2218845.77 | I13: 1509004.18 | K13: =IF(C13=0,0,((D13/C13)*100)-100) -> 10.76 | L13: =IF(E13=0,0,((D13/E13)*100)-100) -> 10.31 | M13: =IF(G13=0,0,((D13/G13)*100)-100) -> 8.17 | N13: =IF(H13=0,0,((D13/H13)*100)-100) -> 37.28 | O13: =IF(I13=0,0,((D13/I13)*100)-100) -> 101.86 | Q13: 2750000 | R13: =((D13/Q13)*100)-100 -> 10.76 | S13: =D13/$D$31*100 -> 7.12
A14: Centenrio | C14: 840000 | D14: 878605.69 | E14: 830168.17 | G14: 792517.95 | H14: 658357.96 | I14: 581810.63 | K14: =IF(C14=0,0,((D14/C14)*100)-100) -> 4.6 | L14: =IF(E14=0,0,((D14/E14)*100)-100) -> 5.83 | M14: =IF(G14=0,0,((D14/G14)*100)-100) -> 10.86 | N14: =IF(H14=0,0,((D14/H14)*100)-100) -> 33.45 | O14: =IF(I14=0,0,((D14/I14)*100)-100) -> 51.01 | Q14: 840000 | R14: =((D14/Q14)*100)-100 -> 4.6 | S14: =D14/$D$31*100 -> 2.05
A15: So Brz | C15: 2800000 | D15: 3063452.78 | E15: 2761728.07 | G15: 2766546.57 | H15: 2438048.24 | I15: 1801768.67 | K15: =IF(C15=0,0,((D15/C15)*100)-100) -> 9.41 | L15: =IF(E15=0,0,((D15/E15)*100)-100) -> 10.93 | M15: =IF(G15=0,0,((D15/G15)*100)-100) -> 10.73 | N15: =IF(H15=0,0,((D15/H15)*100)-100) -> 25.65 | O15: =IF(I15=0,0,((D15/I15)*100)-100) -> 70.02 | Q15: 2800000 | R15: =((D15/Q15)*100)-100 -> 9.41 | S15: =D15/$D$31*100 -> 7.16
A16: Arapongas | C16: 580000 | D16: 610257.13 | E16: 555475.45 | G16: 597253.81 | H16: 588531.75 | I16: 482808.18 | K16: =IF(C16=0,0,((D16/C16)*100)-100) -> 5.22 | L16: =IF(E16=0,0,((D16/E16)*100)-100) -> 9.86 | M16: =IF(G16=0,0,((D16/G16)*100)-100) -> 2.18 | N16: =IF(H16=0,0,((D16/H16)*100)-100) -> 3.69 | O16: =IF(I16=0,0,((D16/I16)*100)-100) -> 26.4 | Q16: 580000 | R16: =((D16/Q16)*100)-100 -> 5.22 | S16: =D16/$D$31*100 -> 1.43
A17: Guarapuava | C17: 1150000 | D17: 1333407.78 | E17: 1115250.68 | G17: 954190.51 | H17: 913141.29 | I17: 861114.78 | K17: =IF(C17=0,0,((D17/C17)*100)-100) -> 15.95 | L17: =IF(E17=0,0,((D17/E17)*100)-100) -> 19.56 | M17: =IF(G17=0,0,((D17/G17)*100)-100) -> 39.74 | N17: =IF(H17=0,0,((D17/H17)*100)-100) -> 46.02 | O17: =IF(I17=0,0,((D17/I17)*100)-100) -> 54.85 | Q17: 1150000 | R17: =((D17/Q17)*100)-100 -> 15.95 | S17: =D17/$D$31*100 -> 3.12
A18: Apucarana | C18: 1280000 | D18: 1395489.54 | E18: 1250362.16 | G18: 1437346.52 | H18: 1257486.7 | I18: 1224028.42 | K18: =IF(C18=0,0,((D18/C18)*100)-100) -> 9.02 | L18: =IF(E18=0,0,((D18/E18)*100)-100) -> 11.61 | M18: =IF(G18=0,0,((D18/G18)*100)-100) -> -2.91 | N18: =IF(H18=0,0,((D18/H18)*100)-100) -> 10.97 | O18: =IF(I18=0,0,((D18/I18)*100)-100) -> 14.01 | Q18: 1280000 | R18: =((D18/Q18)*100)-100 -> 9.02 | S18: =D18/$D$31*100 -> 3.26
A19: Ah | C19: 1100000 | D19: 1235423.99 | E19: 1111721.66 | G19: 1321169.35 | H19: 1178507.89 | I19: 835506.86 | K19: =IF(C19=0,0,((D19/C19)*100)-100) -> 12.31 | L19: =IF(E19=0,0,((D19/E19)*100)-100) -> 11.13 | M19: =IF(G19=0,0,((D19/G19)*100)-100) -> -6.49 | N19: =IF(H19=0,0,((D19/H19)*100)-100) -> 4.83 | O19: =IF(I19=0,0,((D19/I19)*100)-100) -> 47.87 | Q19: 1100000 | R19: =((D19/Q19)*100)-100 -> 12.31 | S19: =D19/$D$31*100 -> 2.89
A20: P.G. Centro | C20: 1500000 | D20: 1566979.99 | E20: 1474374.74 | G20: 1393625.1 | H20: 1280803.86 | I20: 1267918.2 | K20: =IF(C20=0,0,((D20/C20)*100)-100) -> 4.47 | L20: =IF(E20=0,0,((D20/E20)*100)-100) -> 6.28 | M20: =IF(G20=0,0,((D20/G20)*100)-100) -> 12.44 | N20: =IF(H20=0,0,((D20/H20)*100)-100) -> 22.34 | O20: =IF(I20=0,0,((D20/I20)*100)-100) -> 23.59 | Q20: 1500000 | R20: =((D20/Q20)*100)-100 -> 4.47 | S20: =D20/$D$31*100 -> 3.66
A21: Maring | C21: 1900000 | D21: 2075741.4 | E21: 1888400.63 | G21: 1974459.66 | H21: 1806805.26 | I21: 1593882.09 | K21: =IF(C21=0,0,((D21/C21)*100)-100) -> 9.25 | L21: =IF(E21=0,0,((D21/E21)*100)-100) -> 9.92 | M21: =IF(G21=0,0,((D21/G21)*100)-100) -> 5.13 | N21: =IF(H21=0,0,((D21/H21)*100)-100) -> 14.88 | O21: =IF(I21=0,0,((D21/I21)*100)-100) -> 30.23 | Q21: 1900000 | R21: =((D21/Q21)*100)-100 -> 9.25 | S21: =D21/$D$31*100 -> 4.85
A22: Araucria Nova | C22: 1900000 | D22: 2057035.54 | E22: 1737414.79 | G22: 0 | H22: 0 | I22: 0 | K22: =IF(C22=0,0,((D22/C22)*100)-100) -> 8.27 | L22: =IF(E22=0,0,((D22/E22)*100)-100) -> 18.4 | M22: =IF(G22=0,0,((D22/G22)*100)-100) -> 0 | N22: =IF(H22=0,0,((D22/H22)*100)-100) -> 0 | O22: =IF(I22=0,0,((D22/I22)*100)-100) -> 0 | Q22: 1900000 | R22: =((D22/Q22)*100)-100 -> 8.27 | S22: =D22/$D$31*100 -> 4.81
A23: Total Super | C23: =SUM(C7:C22) -> 23575000 | D23: =SUM(D7:D22) -> 25526464.600000001 | E23: =SUM(E7:E22) -> 23101419.100000001 | G23: =SUM(G7:G22) -> 22507268.760000002 | H23: =SUM(H7:H22) -> 19366895.219999999 | I23: =SUM(I7:I22) -> 16288331.98 | J23: =SUM(C23:I23) -> 130365379.66 | K23: =((D23/C23)*100)-100 -> 8.28 | L23: =IF(E23=0,0,((D23/E23)*100)-100) -> 10.5 | M23: =((D23/G23)*100)-100 -> 13.41 | N23: =((D23/H23)*100)-100 -> 31.8 | O23: =IF(I23=0,0,((D23/I23)*100)-100) -> 56.72 | Q23: =SUM(Q7:Q22) -> 23575000 | R23: =((D23/Q23)*100)-100 -> 8.28 | S23: =D23/$D$31*100 -> 59.63
A25: Londrina | C25: 2130000 | D25: 2176502.32 | E25: 2022076.13 | G25: 2143931.76 | H25: 2096262.5 | I25: 0 | K25: =IF(C25=0,0,((D25/C25)*100)-100) -> 2.18 | L25: =IF(E25=0,0,((D25/E25)*100)-100) -> 7.64 | M25: =IF(G25=0,0,((D25/G25)*100)-100) -> 1.52 | N25: =IF(H25=0,0,((D25/H25)*100)-100) -> 3.83 | O25: =IF(I25=0,0,((D25/I25)*100)-100) -> 0 | Q25: 2130000 | R25: =((D25/Q25)*100)-100 -> 2.18 | S25: =D25/$D$31*100 -> 5.08
A26: S.J. Pinhais | C26: 3650000 | D26: 4062990.23 | E26: 3663832.12 | G26: 3619456.78 | H26: 2667880.53 | I26: 1375260.31 | K26: =IF(C26=0,0,((D26/C26)*100)-100) -> 11.31 | L26: =IF(E26=0,0,((D26/E26)*100)-100) -> 10.89 | M26: =IF(G26=0,0,((D26/G26)*100)-100) -> 12.25 | N26: =IF(H26=0,0,((D26/H26)*100)-100) -> 52.29 | O26: =IF(I26=0,0,((D26/I26)*100)-100) -> 195.43 | Q26: 3650000 | R26: =((D26/Q26)*100)-100 -> 11.31 | S26: =D26/$D$31*100 -> 9.49
A27: P.G. Nova | C27: 2950000 | D27: 3017128.55 | E27: 2901488.38 | G27: 2910297.04 | H27: 2447400.3 | I27: 1854294.21 | K27: =IF(C27=0,0,((D27/C27)*100)-100) -> 2.28 | L27: =IF(E27=0,0,((D27/E27)*100)-100) -> 3.99 | M27: =IF(G27=0,0,((D27/G27)*100)-100) -> 3.67 | N27: =IF(H27=0,0,((D27/H27)*100)-100) -> 23.28 | O27: =IF(I27=0,0,((D27/I27)*100)-100) -> 62.71 | Q27: 2950000 | R27: =((D27/Q27)*100)-100 -> 2.28 | S27: =D27/$D$31*100 -> 7.05
A28: Nilo Peanha | C28: 6800000 | D28: 8022240.0199999996 | E28: 7125975.3600000003 | G28: 3752767.59 | H28: 0 | I28: 0 | K28: =IF(C28=0,0,((D28/C28)*100)-100) -> 17.97 | L28: =IF(E28=0,0,((D28/E28)*100)-100) -> 12.58 | M28: =IF(G28=0,0,((D28/G28)*100)-100) -> 113.77 | N28: =IF(H28=0,0,((D28/H28)*100)-100) -> 0 | O28: =IF(I28=0,0,((D28/I28)*100)-100) -> 0 | Q28: 6800000 | R28: =((D28/Q28)*100)-100 -> 17.97 | S28: =D28/$D$31*100 -> 18.74
A29: Total Hiper | C29: =SUM(C25:C28) -> 15530000 | D29: =SUM(D25:D28) -> 17278861.120000001 | E29: =SUM(E25:E28) -> 15713371.99 | G29: =SUM(G25:G28) -> 12426453.17 | H29: =SUM(H25:H28) -> 7211543.3300000001 | I29: =SUM(I25:I28) -> 3229554.52 | J29: =SUM(C29:I29) -> 71389784.129999995 | K29: =((D29/C29)*100)-100 -> 11.26 | L29: =IF(E29=0,0,((D29/E29)*100)-100) -> 9.96 | M29: =((D29/G29)*100)-100 -> 39.05 | N29: =((D29/H29)*100)-100 -> 139.6 | O29: =IF(I29=0,0,((D29/I29)*100)-100) -> 435.02 | Q29: =SUM(Q25:Q28) -> 15530000 | R29: =((D29/Q29)*100)-100 -> 11.26 | S29: =D29/$D$31*100 -> 40.37
A31: Total Geral | C31: =C23+C29 -> 39105000 | D31: =D23+D29 -> 42805325.719999999 | E31: =E23+E29 -> 38814791.090000004 | G31: =G23+G29 -> 34933721.93 | H31: =H23+H29 -> 26578438.550000001 | I31: =I23+I29 -> 19517886.5 | K31: =((D31/C31)*100)-100 -> 9.46 | L31: =IF(E31=0,0,((D31/E31)*100)-100) -> 10.28 | M31: =((D31/G31)*100)-100 -> 22.53 | N31: =((D31/H31)*100)-100 -> 61.05 | O31: =IF(I31=0,0,((D31/I31)*100)-100) -> 119.31 | Q31: =Q23+Q29 -> 39105000 | R31: =((D31/Q31)*100)-100 -> 9.46 | S31: =S23+S29 -> 100
C32: Resumo por Regio - Outubro/2002
C33: Descrio das Aberturas | H33: Valor | I33: %
C34: Curitiba (2,3,6,7,10,11,17,21) | H34: =D7+D8+D11+D12+D14+D15+D19+D28 -> 19364622 | I34: =H34/$D$31 -> 0.45240000000000002
C35: Curitiba e Metrop. (Ctba. 4,5,8,14,23) | H35: =H34+D9+D10+D13+D27+D22 -> 29583957 | I35: =H35/$D$31 -> 0.69110000000000005
C36: Metropolitana (4,5,8,14,23) | H36: =H35-H34 -> 10219335 | I36: =H36/$D$31 -> 0.2387
C37: Norte (9,12,15,20) | H37: =D25+D16+D18+D22 -> 6239285 | I37: =H37/$D$31 -> 0.14580000000000001
C38: Centro-Oeste (13,18,19) | H38: =D17+D20+D27 -> 5917516 | I38: =H38/$D$31 -> 0.13819999999999999
C39: Ponta Grossa (18,19) | H39: =H38-D17 -> 4584108 | I39: =H39/$D$31 -> 0.1071
C40: Super (2,3,4,5,6,7,8,10,11,12,13,15,17,18,20,23) | H40: =D23 -> 25526465 | I40: =H40/$D$31 -> 0.59630000000000005
C41: Hiper (9,14,19,21) | H41: =D29 -> 17278861 | I41: =H41/$D$31 -> 0.4037
C42: Curitiba, Metropolitana e Centro-Oeste | H42: =D31-H37 -> 36566041 | I42: =H42/$D$31 -> 0.85419999999999996
C43: Araucria | H43: =D10+D22 -> 3143791 | I43: =H43/$D$31 -> 7.3400000000000007E-2