A2: Periodo: | B2: 40634 | C2: a | D2: 40663 | G2: Vendas Acumuladas por Filial | P2: =NOW() -> 40664.308194675927
A4: v.New | B4: Vendas 2011 | F4: Vendas de Anos Anteriores | J4: Percentuais ( % ) | P4: Meta Mensal | T4: Margem
A5: Lojas | B5: Previsao | C5: Realizada | D5: Mes Anterior | F5: Vendas 2010 | G5: Vendas 2009 | H5: Vendas 2008 | J5: % Prev | K5: % MA | L5: 2010 | M5: 2009 | N5: 2008 | P5: Previsao Mes | Q5: Final | R5: Part. | T5: Meta | U5: Coml | V5: Dif
A6: S. Felicidade | B6: 3800000 | C6: 3870929.93 | D6: 3320029.65 | F6: 3036597.06 | G6: 2918493.73 | H6: 2136880.31 | J6: =IF(B6=0,0,((C6/B6)*100)-100) -> 1.8665771052631612 | K6: =IF(C6=0,0,IF(D6=0,0,((C6/D6)*100)-100)) -> 16.593233738138451 | L6: =IF(F6=0,0,((C6/F6)*100)-100) -> 27.475916412828255 | M6: =IF(G6=0,0,((C6/G6)*100)-100) -> 32.63451246133053 | N6: =IF(C6=0,0,IF(H6=0,0,((C6/H6)*100)-100)) -> 81.148654507467484 | P6: 3800000 | Q6: =IF(C6=0,0,((C6/P6)*100)-100) -> 1.8665771052631612 | R6: =IF(C6=0,0,(C6/$C$40)*100) -> 2.446734179163383 | T6: 16 | U6: 15.88399379784175 | V6: =U6-T6 -> -0.11600620215824975
A7: Lapa | B7: 2800000 | C7: 2984537.05 | D7: 2454796.82 | F7: 2368144.91 | G7: 2372672.49 | H7: 1638560.88 | J7: =IF(B7=0,0,((C7/B7)*100)-100) -> 6.5906089285714131 | K7: =IF(C7=0,0,IF(D7=0,0,((C7/D7)*100)-100)) -> 21.579799423074036 | L7: =IF(F7=0,0,((C7/F7)*100)-100) -> 26.02848066421744 | M7: =IF(G7=0,0,((C7/G7)*100)-100) -> 25.787990655212582 | N7: =IF(C7=0,0,IF(H7=0,0,((C7/H7)*100)-100)) -> 82.143799869065589 | P7: 2800000 | Q7: =IF(C7=0,0,((C7/P7)*100)-100) -> 6.5906089285714131 | R7: =IF(C7=0,0,(C7/$C$40)*100) -> 1.8864637028483886 | T7: 15.9 | U7: 14.486727514406297 | V7: =U7-T7 -> -1.4132724855937031
A8: Araucaria | B8: 1700000 | C8: 1761097.86 | D8: 1489200.15 | F8: 1438419.1 | G8: 1431832.16 | H8: 1055680.22 | J8: =IF(B8=0,0,((C8/B8)*100)-100) -> 3.5939917647058905 | K8: =IF(C8=0,0,IF(D8=0,0,((C8/D8)*100)-100)) -> 18.25796955499905 | L8: =IF(F8=0,0,((C8/F8)*100)-100) -> 22.432875091828251 | M8: =IF(G8=0,0,((C8/G8)*100)-100) -> 22.996110102737191 | N8: =IF(C8=0,0,IF(H8=0,0,((C8/H8)*100)-100)) -> 66.8211477903792 | P8: 1700000 | Q8: =IF(C8=0,0,((C8/P8)*100)-100) -> 3.5939917647058905 | R8: =IF(C8=0,0,(C8/$C$40)*100) -> 1.1131532744932664 | T8: 16.29 | U8: 15.807957429463912 | V8: =U8-T8 -> -0.48204257053608757
A9: Hauer | B9: 4700000 | C9: 4514862.05 | D9: 3936564.16 | F9: 3747964.55 | G9: 3914572.14 | H9: 3315398.85 | J9: =IF(B9=0,0,((C9/B9)*100)-100) -> -3.9391053191489362 | K9: =IF(C9=0,0,IF(D9=0,0,((C9/D9)*100)-100)) -> 14.69042206592664 | L9: =IF(F9=0,0,((C9/F9)*100)-100) -> 20.461706341379355 | M9: =IF(G9=0,0,((C9/G9)*100)-100) -> 15.334751501092512 | N9: =IF(C9=0,0,IF(H9=0,0,((C9/H9)*100)-100)) -> 36.178549075626307 | P9: 4700000 | Q9: =IF(C9=0,0,((C9/P9)*100)-100) -> -3.9391053191489362 | R9: =IF(C9=0,0,(C9/$C$40)*100) -> 2.8537502594222 | T9: 15.68 | U9: 15.317095679590034 | V9: =U9-T9 -> -0.36290432040996556
A10: Paranagua | B10: 2600000 | C10: 2814018.85 | D10: 2391168.89 | F10: 5049479.83 | G10: 2228804.76 | H10: 1697861.06 | J10: =IF(B10=0,0,((C10/B10)*100)-100) -> 8.2314942307692291 | K10: =IF(C10=0,0,IF(D10=0,0,((C10/D10)*100)-100)) -> 17.683818226658161 | L10: =IF(F10=0,0,((C10/F10)*100)-100) -> -44.271114159495518 | M10: =IF(G10=0,0,((C10/G10)*100)-100) -> 26.256857509582858 | N10: =IF(C10=0,0,IF(H10=0,0,((C10/H10)*100)-100)) -> 65.739053465305318 | P10: 2600000 | Q10: =IF(C10=0,0,((C10/P10)*100)-100) -> 8.2314942307692291 | R10: =IF(C10=0,0,(C10/$C$40)*100) -> 1.7786827004396426 | T10: 17.05 | U10: 15.553055374877816 | V10: =U10-T10 -> -1.4969446251221843
A11: Centenario | B11: 0 | C11: 0 | D11: 0 | F11: 0 | G11: 0 | H11: 0 | J11: =IF(B11=0,0,((C11/B11)*100)-100) -> 0 | K11: =IF(C11=0,0,IF(D11=0,0,((C11/D11)*100)-100)) -> 0 | L11: =IF(F11=0,0,((C11/F11)*100)-100) -> 0 | M11: =IF(G11=0,0,((C11/G11)*100)-100) -> 0 | N11: =IF(C11=0,0,IF(H11=0,0,((C11/H11)*100)-100)) -> 0 | P11: 0 | Q11: =IF(C11=0,0,((C11/P11)*100)-100) -> 0 | R11: =IF(C11=0,0,(C11/$C$40)*100) -> 0 | T11: 0 | U11: 0 | V11: =U11-T11 -> 0
A12: Sitio Cercado | B12: 3200000 | C12: 3644313.41 | D12: 3064982.36 | F12: 2415356.33 | G12: 2369386.75 | H12: 1652262.29 | J12: =IF(B12=0,0,((C12/B12)*100)-100) -> 13.884794062500006 | K12: =IF(C12=0,0,IF(D12=0,0,((C12/D12)*100)-100)) -> 18.9016112314591 | L12: =IF(F12=0,0,((C12/F12)*100)-100) -> 50.880984504675553 | M12: =IF(G12=0,0,((C12/G12)*100)-100) -> 53.808297020315479 | N12: =IF(C12=0,0,IF(H12=0,0,((C12/H12)*100)-100)) -> 120.56506597387755 | P12: 3200000 | Q12: =IF(C12=0,0,((C12/P12)*100)-100) -> 13.884794062500006 | R12: =IF(C12=0,0,(C12/$C$40)*100) -> 2.3034945971833851 | T12: 14.8 | U12: 13.475694177466476 | V12: =U12-T12 -> -1.3243058225335247
A13: Apucarana | B13: 3299999 | C13: 2900642.85 | D13: 2383089.69 | F13: 2666000.32 | G13: 3039739.3 | H13: 2198263.22 | J13: =IF(B13=0,0,((C13/B13)*100)-100) -> -12.101705182334896 | K13: =IF(C13=0,0,IF(D13=0,0,((C13/D13)*100)-100)) -> 21.717737363044876 | L13: =IF(F13=0,0,((C13/F13)*100)-100) -> 8.8012941423803142 | M13: =IF(G13=0,0,((C13/G13)*100)-100) -> -4.5759335348264756 | N13: =IF(C13=0,0,IF(H13=0,0,((C13/H13)*100)-100)) -> 31.951570840547475 | P13: 3300000 | Q13: =IF(C13=0,0,((C13/P13)*100)-100) -> -12.101731818181818 | R13: =IF(C13=0,0,(C13/$C$40)*100) -> 1.8334359265038118 | T13: 15.9 | U13: 14.632547747131294 | V13: =U13-T13 -> -1.267452252868706
A14: Ahú | B14: 2300000 | C14: 2516078.95 | D14: 2188513.62 | F14: 1889153.86 | G14: 1845472.36 | H14: 1562176.62 | J14: =IF(B14=0,0,((C14/B14)*100)-100) -> 9.3947369565217542 | K14: =IF(C14=0,0,IF(D14=0,0,((C14/D14)*100)-100)) -> 14.967479617513192 | L14: =IF(F14=0,0,((C14/F14)*100)-100) -> 33.185496601107957 | M14: =IF(G14=0,0,((C14/G14)*100)-100) -> 36.337937350630369 | N14: =IF(C14=0,0,IF(H14=0,0,((C14/H14)*100)-100)) -> 61.062386786969057 | P14: 2300000 | Q14: =IF(C14=0,0,((C14/P14)*100)-100) -> 9.3947369565217542 | R14: =IF(C14=0,0,(C14/$C$40)*100) -> 1.5903610955929952 | T14: 16.68 | U14: 16.035752375735267 | V14: =U14-T14 -> -0.64424762426473237
A15: P.G. Centro | B15: 2400000 | C15: 2751280.68 | D15: 2256065.06 | F15: 2012127.68 | G15: 2184716.3 | H15: 1893872.87 | J15: =IF(B15=0,0,((C15/B15)*100)-100) -> 14.636695000000003 | K15: =IF(C15=0,0,IF(D15=0,0,((C15/D15)*100)-100)) -> 21.950413965455411 | L15: =IF(F15=0,0,((C15/F15)*100)-100) -> 36.734895471444446 | M15: =IF(G15=0,0,((C15/G15)*100)-100) -> 25.933087055742689 | N15: =IF(C15=0,0,IF(H15=0,0,((C15/H15)*100)-100)) -> 45.272722556081618 | P15: 2400000 | Q15: =IF(C15=0,0,((C15/P15)*100)-100) -> 14.636695000000003 | R15: =IF(C15=0,0,(C15/$C$40)*100) -> 1.7390272099882402 | T15: 17.29 | U15: 16.333529082172742 | V15: =U15-T15 -> -0.95647091782725724
A16: Maringa | B16: 3800000 | C16: 3925238.05 | D16: 3464363.73 | F16: 3128775.61 | G16: 3215662.85 | H16: 2567639.94 | J16: =IF(B16=0,0,((C16/B16)*100)-100) -> 3.2957381578947178 | K16: =IF(C16=0,0,IF(D16=0,0,((C16/D16)*100)-100)) -> 13.303289028487768 | L16: =IF(F16=0,0,((C16/F16)*100)-100) -> 25.456042211988475 | M16: =IF(G16=0,0,((C16/G16)*100)-100) -> 22.066218789074838 | N16: =IF(C16=0,0,IF(H16=0,0,((C16/H16)*100)-100)) -> 52.873383407488205 | P16: 3800000 | Q16: =IF(C16=0,0,((C16/P16)*100)-100) -> 3.2957381578947178 | R16: =IF(C16=0,0,(C16/$C$40)*100) -> 2.4810612106036309 | T16: 16.5 | U16: 16.47883801595167 | V16: =U16-T16 -> -2.116198404833014E-2
A17: Araucaria Nova | B17: 5500000 | C17: 5570583.75 | D17: 4743041.02 | F17: 3936109 | G17: 3825781.22 | H17: 2677500.77 | J17: =IF(B17=0,0,((C17/B17)*100)-100) -> 1.2833409090908958 | K17: =IF(C17=0,0,IF(D17=0,0,((C17/D17)*100)-100)) -> 17.447513662869412 | L17: =IF(F17=0,0,((C17/F17)*100)-100) -> 41.525139420681711 | M17: =IF(G17=0,0,((C17/G17)*100)-100) -> 45.606437735611024 | N17: =IF(C17=0,0,IF(H17=0,0,((C17/H17)*100)-100)) -> 108.05162084043025 | P17: 5500000 | Q17: =IF(C17=0,0,((C17/P17)*100)-100) -> 1.2833409090908958 | R17: =IF(C17=0,0,(C17/$C$40)*100) -> 3.5210499558221473 | T17: 15.3 | U17: 15.225386387916707 | V17: =U17-T17 -> -7.4613612083293646E-2
A18: Cristo Rei | B18: 3000000 | C18: 3096501.12 | D18: 2643155.13 | F18: 2381905.78 | G18: 2270551.61 | H18: 1569833.62 | J18: =IF(B18=0,0,((C18/B18)*100)-100) -> 3.2167040000000071 | K18: =IF(C18=0,0,IF(D18=0,0,((C18/D18)*100)-100)) -> 17.151698167636511 | L18: =IF(F18=0,0,((C18/F18)*100)-100) -> 30.000991055154174 | M18: =IF(G18=0,0,((C18/G18)*100)-100) -> 36.37660145500945 | N18: =IF(C18=0,0,IF(H18=0,0,((C18/H18)*100)-100)) -> 97.250274204217874 | P18: 3000000 | Q18: =IF(C18=0,0,((C18/P18)*100)-100) -> 3.2167040000000071 | R18: =IF(C18=0,0,(C18/$C$40)*100) -> 1.9572338593382124 | T18: 17.17 | U18: 16.647420427866663 | V18: =U18-T18 -> -0.52257957213333839
A19: Campo Largo | B19: 4700000 | C19: 4715271.3 | D19: 3940395.67 | F19: 3619820.69 | G19: 3120050.05 | H19: 0 | J19: =IF(B19=0,0,((C19/B19)*100)-100) -> 0.324921276595731 | K19: =IF(C19=0,0,IF(D19=0,0,((C19/D19)*100)-100)) -> 19.664919335372218 | L19: =IF(F19=0,0,((C19/F19)*100)-100) -> 30.262565574760544 | M19: =IF(G19=0,0,((C19/G19)*100)-100) -> 51.128066038556028 | N19: =IF(C19=0,0,IF(H19=0,0,((C19/H19)*100)-100)) -> 0 | P19: 4700000 | Q19: =IF(C19=0,0,((C19/P19)*100)-100) -> 0.324921276595731 | R19: =IF(C19=0,0,(C19/$C$40)*100) -> 2.980424771919898 | T19: 15.5 | U19: 15.316561954770238 | V19: =U19-T19 -> -0.18343804522976193
A20: Brasilia | B20: 3100000 | C20: 3342625.5 | D20: 2814956.05 | F20: 2487508.78 | G20: 2726570.95 | H20: 896128.02 | J20: =IF(B20=0,0,((C20/B20)*100)-100) -> 7.8266290322580545 | K20: =IF(C20=0,0,IF(D20=0,0,((C20/D20)*100)-100)) -> 18.745210959865616 | L20: =IF(F20=0,0,((C20/F20)*100)-100) -> 34.376430221082472 | M20: =IF(G20=0,0,((C20/G20)*100)-100) -> 22.59448080747724 | N20: =IF(C20=0,0,IF(H20=0,0,((C20/H20)*100)-100)) -> 273.00758657228459 | P20: 3100000 | Q20: =IF(C20=0,0,((C20/P20)*100)-100) -> 7.8266290322580545 | R20: =IF(C20=0,0,(C20/$C$40)*100) -> 2.1128039532849647 | T20: 15 | U20: 15.424149370008694 | V20: =U20-T20 -> 0.42414937000869379
A21: Total Super | B21: =SUM(B6:B20) -> 46899999 | C21: =SUM(C6:C20) -> 48407981.349999994 | D21: =SUM(D6:D20) -> 41090322 | F21: =SUM(F6:F20) -> 40177363.5 | G21: =SUM(G6:G20) -> 37464306.670000002 | H21: =SUM(H6:H20) -> 24862058.670000002 | I21: =SUM(B21:H21) -> 238902031.19 | J21: =IF(C21=0,0,((C21/B21)*100)-100) -> 3.2153142476612828 | K21: =IF(C21=0,0,IF(D21=0,0,((C21/D21)*100)-100)) -> 17.80871746393224 | L21: =IF(F21=0,0,IF(C21=0,0,((C21/F21)*100)-100)) -> 20.485709197916862 | M21: =IF(G21=0,0,IF(C21=0,0,((C21/G21)*100)-100)) -> 29.210936095511073 | N21: =IF(C21=0,0,IF(H21=0,0,((C21/H21)*100)-100)) -> 94.706246946524459 | P21: =SUM(P6:P20) -> 46900000 | Q21: =IF(C21=0,0,((C21/P21)*100)-100) -> 3.2153120469083092 | R21: =IF(C21=0,0,(C21/$C$40)*100) -> 30.597676696604164 | T21: 15.958187634502934 | U21: 15.434368551705784 | V21: =U21-T21 -> -0.52381908279715006
A22: Pinheirinho | B22: 5700000 | C22: 5825748.0800000001 | D22: 4916183.26 | F22: 5198764.64 | G22: 4921042.46 | H22: 3587864.72 | J22: =IF(B22=0,0,((C22/B22)*100)-100) -> 2.2061066666666704 | K22: =IF(C22=0,0,IF(D22=0,0,((C22/D22)*100)-100)) -> 18.501442519455651 | L22: =IF(F22=0,0,((C22/F22)*100)-100) -> 12.060238987853083 | M22: =IF(G22=0,0,((C22/G22)*100)-100) -> 18.384430277807454 | N22: =IF(C22=0,0,IF(H22=0,0,((C22/H22)*100)-100)) -> 62.373682807081963 | P22: 5700000 | Q22: =IF(C22=0,0,IF(P22=0,0,((C22/P22)*100)-100)) -> 2.2061066666666704 | R22: =IF(C22=0,0,(C22/$C$40)*100) -> 3.682334013866134 | T22: 15.26 | U22: 15.216632058693483 | V22: =U22-T22 -> -4.336794130651711E-2
A23: Londrina | B23: 5000000 | C23: 5047524.35 | D23: 4440297.76 | F23: 3599518.79 | G23: 3539471.43 | H23: 3240059.11 | J23: =IF(B23=0,0,((C23/B23)*100)-100) -> 0.95048699999999542 | K23: =IF(C23=0,0,IF(D23=0,0,((C23/D23)*100)-100)) -> 13.675357438191256 | L23: =IF(F23=0,0,((C23/F23)*100)-100) -> 40.227753888180132 | M23: =IF(G23=0,0,((C23/G23)*100)-100) -> 42.606726733771097 | N23: =IF(C23=0,0,IF(H23=0,0,((C23/H23)*100)-100)) -> 55.78494646660937 | P23: 5000000 | Q23: =IF(C23=0,0,IF(P23=0,0,((C23/P23)*100)-100)) -> 0.95048699999999542 | R23: =IF(C23=0,0,(C23/$C$40)*100) -> 3.1904350041553031 | T23: 15.75 | U23: 15.243389167602531 | V23: =U23-T23 -> -0.50661083239746851
A24: São Bráz | B24: 6050000 | C24: 6280404.1500000004 | D24: 5505828.0700000003 | F24: 5138331.96 | G24: 5189181.51 | H24: 4227149.12 | J24: =IF(B24=0,0,((C24/B24)*100)-100) -> 3.8083330578512431 | K24: =IF(C24=0,0,IF(D24=0,0,((C24/D24)*100)-100)) -> 14.068293999598154 | L24: =IF(F24=0,0,((C24/F24)*100)-100) -> 22.226516287593071 | M24: =IF(G24=0,0,((C24/G24)*100)-100) -> 21.028800744339378 | N24: =IF(C24=0,0,IF(H24=0,0,((C24/H24)*100)-100)) -> 48.573044662308973 | P24: 6050000 | Q24: =IF(C24=0,0,IF(P24=0,0,((C24/P24)*100)-100)) -> 3.8083330578512431 | R24: =IF(C24=0,0,(C24/$C$40)*100) -> 3.9697126454481069 | T24: 15.83 | U24: 14.773468041861603 | V24: =U24-T24 -> -1.0565319581383967
A25: S.J. Pinhais | B25: 6800440 | C25: 7300277.5999999996 | D25: 6539051.54 | F25: 5681714.29 | G25: 5686816.6500000004 | H25: 4574067.04 | J25: =IF(B25=0,0,((C25/B25)*100)-100) -> 7.3500773479363062 | K25: =IF(C25=0,0,IF(D25=0,0,((C25/D25)*100)-100)) -> 11.641230465053027 | L25: =IF(F25=0,0,((C25/F25)*100)-100) -> 28.487235143955104 | M25: =IF(G25=0,0,((C25/G25)*100)-100) -> 28.371953050394183 | N25: =IF(C25=0,0,IF(H25=0,0,((C25/H25)*100)-100)) -> 59.601456125575282 | P25: 6800440 | Q25: =IF(C25=0,0,IF(P25=0,0,((C25/P25)*100)-100)) -> 7.3500773479363062 | R25: =IF(C25=0,0,(C25/$C$40)*100) -> 4.6143534097246839 | T25: 15.37 | U25: 15.622756318198094 | V25: =U25-T25 -> 0.25275631819809519
A26: P.G. Nova | B26: 6900000 | C26: 7324335.1799999997 | D26: 6292834.6699999999 | F26: 4860655.67 | G26: 4936289.52 | H26: 4171736.18 | J26: =IF(B26=0,0,((C26/B26)*100)-100) -> 6.1497852173912975 | K26: =IF(C26=0,0,IF(D26=0,0,((C26/D26)*100)-100)) -> 16.391667095871739 | L26: =IF(F26=0,0,((C26/F26)*100)-100) -> 50.686155886454713 | M26: =IF(G26=0,0,((C26/G26)*100)-100) -> 48.37734193516269 | N26: =IF(C26=0,0,IF(H26=0,0,((C26/H26)*100)-100)) -> 75.570430726518254 | P26: 6900000 | Q26: =IF(C26=0,0,IF(P26=0,0,((C26/P26)*100)-100)) -> 6.1497852173912975 | R26: =IF(C26=0,0,(C26/$C$40)*100) -> 4.629559704934981 | T26: 14.7 | U26: 15.174689752524406 | V26: =U26-T26 -> 0.47468975252440693
A27: Nilo Pecanha | B27: 15500000 | C27: 16009606.050000001 | D27: 14521926.4 | F27: 12850878.390000001 | G27: 12872895 | H27: 10281856.939999999 | J27: =IF(B27=0,0,((C27/B27)*100)-100) -> 3.2877809677419378 | K27: =IF(C27=0,0,IF(D27=0,0,((C27/D27)*100)-100)) -> 10.244368474419474 | L27: =IF(F27=0,0,((C27/F27)*100)-100) -> 24.579857999885718 | M27: =IF(G27=0,0,((C27/G27)*100)-100) -> 24.366788123417464 | N27: =IF(C27=0,0,IF(H27=0,0,((C27/H27)*100)-100)) -> 55.707341032115153 | P27: 15500000 | Q27: =IF(C27=0,0,IF(P27=0,0,((C27/P27)*100)-100)) -> 3.2877809677419378 | R27: =IF(C27=0,0,(C27/$C$40)*100) -> 10.119338511889799 | T27: 16 | U27: 15.916940941841601 | V27: =U27-T27 -> -8.3059058158399424E-2
A28: Champagnat | B28: 7000000 | C28: 7299238.9000000004 | D28: 6472752.7199999997 | F28: 6573792.5800000001 | G28: 7250648.7000000002 | H28: 5761613.5599999996 | J28: =IF(B28=0,0,((C28/B28)*100)-100) -> 4.2748414285714347 | K28: =IF(C28=0,0,IF(D28=0,0,((C28/D28)*100)-100)) -> 12.76869696329139 | L28: =IF(F28=0,0,((C28/F28)*100)-100) -> 11.035430631125891 | M28: =IF(G28=0,0,((C28/G28)*100)-100) -> 0.67014969295091475 | N28: =IF(C28=0,0,IF(H28=0,0,((C28/H28)*100)-100)) -> 26.687408379398519 | P28: 7000000 | Q28: =IF(C28=0,0,IF(P28=0,0,((C28/P28)*100)-100)) -> 4.2748414285714347 | R28: =IF(C28=0,0,(C28/$C$40)*100) -> 4.6136968690903002 | T28: 16.58 | U28: 15.736912378631695 | V28: =U28-T28 -> -0.84308762136830318
A29: Santa Candida | B29: 9300000 | C29: 9585338.3900000006 | D29: 8419071.3100000005 | F29: 7083805.8899999997 | G29: 6696898.25 | H29: 4587015.04 | J29: =IF(B29=0,0,((C29/B29)*100)-100) -> 3.0681547311828012 | K29: =IF(C29=0,0,IF(D29=0,0,((C29/D29)*100)-100)) -> 13.852680860592457 | L29: =IF(F29=0,0,((C29/F29)*100)-100) -> 35.313397047360382 | M29: =IF(G29=0,0,((C29/G29)*100)-100) -> 43.131014272166965 | N29: =IF(C29=0,0,IF(H29=0,0,((C29/H29)*100)-100)) -> 108.96679662946997 | P29: 9300000 | Q29: =IF(C29=0,0,IF(P29=0,0,((C29/P29)*100)-100)) -> 3.0681547311828012 | R29: =IF(C29=0,0,(C29/$C$40)*100) -> 6.0586927383777036 | T29: 15.33 | U29: 15.025179930032706 | V29: =U29-T29 -> -0.30482006996729361
A30: Paranaguá Raia | B30: 9100000 | C30: 9042654.0999999996 | D30: 8017513.1500000004 | F30: 0 | G30: 6998530.2599999998 | H30: 5322920.93 | J30: =IF(B30=0,0,((C30/B30)*100)-100) -> -0.63017472527474183 | K30: =IF(C30=0,0,IF(D30=0,0,((C30/D30)*100)-100)) -> 12.78627088999535 | L30: =IF(F30=0,0,((C30/F30)*100)-100) -> 0 | M30: =IF(G30=0,0,((C30/G30)*100)-100) -> 29.207901717352854 | N30: =IF(C30=0,0,IF(H30=0,0,((C30/H30)*100)-100)) -> 69.881428240565668 | P30: 9100000 | Q30: =IF(C30=0,0,IF(P30=0,0,((C30/P30)*100)-100)) -> -0.63017472527474183 | R30: =IF(C30=0,0,(C30/$C$40)*100) -> 5.7156733025187823 | T30: 17.28 | U30: 16.95149535798345 | V30: =U30-T30 -> -0.32850464201655072
A31: Novo Mundo | B31: 6500000 | C31: 6661630.5 | D31: 5759257.3899999997 | F31: 5219702.45 | G31: 0 | H31: 0 | J31: =IF(B31=0,0,((C31/B31)*100)-100) -> 2.4866230769230668 | K31: =IF(C31=0,0,IF(D31=0,0,((C31/D31)*100)-100)) -> 15.66821985707432 | L31: =IF(F31=0,0,((C31/F31)*100)-100) -> 27.624717382118206 | M31: =IF(G31=0,0,((C31/G31)*100)-100) -> 0 | N31: =IF(C31=0,0,IF(H31=0,0,((C31/H31)*100)-100)) -> 0 | P31: 6500000 | Q31: =IF(C31=0,0,IF(P31=0,0,((C31/P31)*100)-100)) -> 2.4866230769230668 | R31: =IF(C31=0,0,(C31/$C$40)*100) -> 4.2106778805234679 | T31: 15.5 | U31: 15.108752129077107 | V31: =U31-T31 -> -0.39124787092289282
A32: Uvaranas | B32: 6100000 | C32: 6446355.8099999996 | D32: 5753717.1200000001 | F32: 4740013.09 | G32: 4100660.08 | H32: 0 | J32: =IF(B32=0,0,((C32/B32)*100)-100) -> 5.6779640983606612 | K32: =IF(C32=0,0,IF(D32=0,0,((C32/D32)*100)-100)) -> 12.038108157809461 | L32: =IF(F32=0,0,((C32/F32)*100)-100) -> 35.998692147071665 | M32: =IF(G32=0,0,((C32/G32)*100)-100) -> 57.202881590712082 | N32: =IF(C32=0,0,IF(H32=0,0,((C32/H32)*100)-100)) -> 0 | P32: 6100000 | Q32: =IF(C32=0,0,IF(P32=0,0,((C32/P32)*100)-100)) -> 5.6779640983606612 | R32: =IF(C32=0,0,(C32/$C$40)*100) -> 4.0746072330416618 | T32: 14.55 | U32: 14.738795964785567 | V32: =U32-T32 -> 0.18879596478556593
A33: Torres | B33: 6800000 | C33: 7177908.21 | D33: 6370556.29 | F33: 5196340.78 | G33: 5053086.07 | H33: 0 | J33: =IF(B33=0,0,((C33/B33)*100)-100) -> 5.5574736764705932 | K33: =IF(C33=0,0,IF(D33=0,0,((C33/D33)*100)-100)) -> 12.673177713966936 | L33: =IF(F33=0,0,((C33/F33)*100)-100) -> 38.133900640750511 | M33: =IF(G33=0,0,((C33/G33)*100)-100) -> 42.049989067374014 | N33: =IF(C33=0,0,IF(H33=0,0,((C33/H33)*100)-100)) -> 0 | P33: 6800000 | Q33: =IF(C33=0,0,IF(P33=0,0,((C33/P33)*100)-100)) -> 5.5574736764705932 | R33: =IF(C33=0,0,(C33/$C$40)*100) -> 4.5370062672006197 | T33: 15.2 | U33: 15.281588283224925 | V33: =U33-T33 -> 8.1588283224926172E-2
A34: Total Hiper | B34: =SUM(B22:B33) -> 90750440 | C34: =SUM(C22:C33) -> 94001021.319999993 | D34: =SUM(D22:D33) -> 83008989.680000007 | F34: =SUM(F22:F33) -> 66143518.530000001 | G34: =SUM(G22:G33) -> 67245519.930000007 | H34: =SUM(H22:H33) -> 45754282.640000001 | I34: =SUM(B34:H34) -> 446903772.09999996 | J34: =IF(C34=0,0,((C34/B34)*100)-100) -> 3.5818904238921476 | K34: =IF(C34=0,0,IF(D34=0,0,((C34/D34)*100)-100)) -> 13.241977383864452 | L34: =IF(F34=0,0,IF(C34=0,0,((C34/F34)*100)-100)) -> 42.116753703335206 | M34: =IF(G34=0,0,IF(C34=0,0,((C34/G34)*100)-100)) -> 39.787782766571553 | N34: =IF(C34=0,0,IF(H34=0,0,((C34/H34)*100)-100)) -> 105.44748140761143 | P34: =SUM(P22:P33) -> 90750440 | Q34: =IF(C34=0,0,((C34/P34)*100)-100) -> 3.5818904238921476 | R34: =IF(C34=0,0,(C34/$C$40)*100) -> 59.416087580771539 | T34: 15.693568679116046 | U34: 15.488317143318461 | V34: =U34-T34 -> -0.20525153579758459
A35: Total s/ 29,30,37 | B35: =B21+B34 -> 137650439 | C35: =C21+C34 -> 142409002.66999999 | D35: =D21+D34 -> 124099311.68000001 | E35: =E21+E34 -> 0 | F35: =F21+F34 -> 106320882.03 | G35: =G21+G34 -> 104709826.60000001 | H35: =H21+H34 -> 70616341.310000002 | I35: =SUM(B35:H35) -> 685805803.28999996 | J35: =IF(C35=0,0,((C35/B35)*100)-100) -> 3.456991277739391 | K35: =IF(C35=0,0,IF(D35=0,0,((C35/D35)*100)-100)) -> 14.754063291835976 | L35: =IF(F35=0,0,IF(C35=0,0,((C35/F35)*100)-100)) -> 33.942646026786349 | M35: =IF(G35=0,0,IF(C35=0,0,((C35/G35)*100)-100)) -> 36.00347483528347 | N35: =IF(C35=0,0,IF(H35=0,0,((C35/H35)*100)-100)) -> 101.66579013890856 | P35: =P21+P34 -> 137650440 | Q35: =IF(C35=0,0,((C35/P35)*100)-100) -> 3.4569905261472229 | R35: =IF(C35=0,0,(C35/$C$40)*100) -> 90.013764277375699 | T35: 15.783729152509277 | U35: 15.469978819422629 | V35: =U35-T35 -> -0.31375033308664868
A36: Centenário | B36: 0 | C36: 0 | D36: 0 | F36: 1379071.84 | G36: 1370762.56 | H36: 1095033.57 | J36: =IF(B36=0,0,((C36/B36)*100)-100) -> 0 | K36: =IF(C36=0,0,IF(D36=0,0,((C36/D36)*100)-100)) -> 0 | L36: =IF(F36=0,0,((C36/F36)*100)-100) -> -100 | M36: =IF(G36=0,0,((C36/G36)*100)-100) -> -100 | N36: =IF(C36=0,0,IF(H36=0,0,((C36/H36)*100)-100)) -> 0 | P36: 0 | Q36: =IF(P36=0,0,IF(C36=0,0,((C36/P36)*100)-100)) -> 0 | R36: =IF(C36=0,0,(C36/$C$40)*100) -> 0 | T36: 0 | U36: 0 | V36: =U36-T36 -> 0
A37: Cajuru | B37: 4900000 | C37: 5176003.74 | D37: 4459876.85 | F37: 0 | G37: 0 | H37: 0 | J37: =IF(B37=0,0,((C37/B37)*100)-100) -> 5.6327293877550915 | K37: =IF(C37=0,0,IF(D37=0,0,((C37/D37)*100)-100)) -> 16.057100096833409 | L37: =IF(F37=0,0,((C37/F37)*100)-100) -> 0 | M37: =IF(G37=0,0,((C37/G37)*100)-100) -> 0 | N37: =IF(C37=0,0,IF(H37=0,0,((C37/H37)*100)-100)) -> 0 | P37: 4900000 | Q37: =IF(P37=0,0,IF(C37=0,0,((C37/P37)*100)-100)) -> 5.6327293877550915 | R37: =IF(C37=0,0,(C37/$C$40)*100) -> 3.2716441504110358 | T37: 15.18 | U37: 15.200183182247857 | V37: =U37-T37 -> 2.018318224785709E-2
A38: Água Verde | B38: 7200000 | C38: 7167952.7000000002 | D38: 6441083.0300000003 | F38: 0 | G38: 0 | H38: 0 | J38: =IF(B38=0,0,((C38/B38)*100)-100) -> -0.44510138888888662 | K38: =IF(C38=0,0,IF(D38=0,0,((C38/D38)*100)-100)) -> 11.284898310028453 | L38: =IF(F38=0,0,((C38/F38)*100)-100) -> 0 | M38: =IF(G38=0,0,((C38/G38)*100)-100) -> 0 | N38: =IF(C38=0,0,IF(H38=0,0,((C38/H38)*100)-100)) -> 0 | P38: 7200000 | Q38: =IF(P38=0,0,IF(C38=0,0,((C38/P38)*100)-100)) -> -0.44510138888888662 | R38: =IF(C38=0,0,(C38/$C$40)*100) -> 4.5307135966980567 | T38: 16 | U38: 15.613780347629802 | V38: =U38-T38 -> -0.38621965237019751
A39: Fazenda | B39: 3450000 | C39: 3455070.31 | D39: 2867652.9 | F39: 3155559.4 | G39: 0 | H39: 0 | J39: =IF(B39=0,0,((C39/B39)*100)-100) -> 0.14696550724637802 | K39: =IF(C39=0,0,IF(D39=0,0,((C39/D39)*100)-100)) -> 20.484257700783814 | L39: =IF(F39=0,0,((C39/F39)*100)-100) -> 9.4915313589089862 | M39: =IF(G39=0,0,((C39/G39)*100)-100) -> 0 | N39: =IF(C39=0,0,IF(H39=0,0,((C39/H39)*100)-100)) -> 0 | P39: 3450000 | Q39: =IF(P39=0,0,IF(C39=0,0,((C39/P39)*100)-100)) -> 0.14696550724637802 | R39: =IF(C39=0,0,(C39/$C$40)*100) -> 2.183877975515208 | T39: 15 | U39: 14.943651320369222 | V39: =U39-T39 -> -5.6348679630778165E-2
A40: Total Geral | B40: =B21+B34+SUM(B36:B39) -> 153200439 | C40: =C21+C34+SUM(C36:C39) -> 158208029.41999999 | D40: =D21+D34+SUM(D36:D39) -> 137867924.46000001 | F40: =F21+F34+SUM(F36:F39) -> 110855513.27 | G40: =G21+G34+SUM(G36:G39) -> 106080589.16000001 | H40: =H21+H34+SUM(H36:H39) -> 71711374.879999995 | J40: =IF(C40=0,0,((C40/B40)*100)-100) -> 3.2686527876072233 | K40: =IF(C40=0,0,IF(D40=0,0,((C40/D40)*100)-100)) -> 14.753326446066367 | L40: =IF(F40=0,0,IF(C40=0,0,((C40/F40)*100)-100)) -> 42.715526502202977 | M40: =IF(G40=0,0,IF(C40=0,0,((C40/G40)*100)-100)) -> 49.13947091807421 | N40: =IF(C40=0,0,IF(H40=0,0,((C40/H40)*100)-100)) -> 120.61776068962743 | P40: =P21+P34+SUM(P36:P39) -> 153200440 | Q40: =IF(C40=0,0,((C40/P40)*100)-100) -> 3.2686521135317719 | R40: =R21+R34+SUM(R36:R39) -> 100 | T40: 15.75 | U40: 15.45617295130077 | V40: =U40-T40 -> -0.29382704869922982
A42: Água Verde | B42: 0 | C42: 0 | D42: 0 | F42: 0 | G42: 0 | H42: 0 | J42: =IF(B42=0,0,((C42/B42)*100)-100) -> 0 | K42: =IF(C42=0,0,IF(D42=0,0,((C42/D42)*100)-100)) -> 0 | L42: =IF(F42=0,0,((C42/F42)*100)-100) -> 0 | M42: =IF(G42=0,0,((C42/G42)*100)-100) -> 0 | N42: =IF(C42=0,0,IF(H42=0,0,((C42/H42)*100)-100)) -> 0 | P42: =B42 -> 0 | Q42: =IF(C42=0,0,IF(P42=0,0,((C42/P42)*100)-100)) -> 0 | R42: =IF(C42=0,0,(C42/$C$40)*100) -> 0 | T42: 14.95 | U42: 0 | V42: =U42-T42 -> -14.95
A43: Total Geral | B43: =B40+B42 -> 153200439 | C43: =C40+C42 -> 158208029.41999999 | D43: =D40+D42 -> 137867924.46000001 | F43: =F40+F42 -> 110855513.27 | G43: =G40+G42 -> 106080589.16000001 | H43: =H40+H42 -> 71711374.879999995 | J43: =IF(C43=0,0,((C43/B43)*100)-100) -> 3.2686527876072233 | K43: =IF(C43=0,0,IF(D43=0,0,((C43/D43)*100)-100)) -> 14.753326446066367 | L43: =IF(F43=0,0,IF(C43=0,0,((C43/F43)*100)-100)) -> 42.715526502202977 | M43: =IF(G43=0,0,IF(C43=0,0,((C43/G43)*100)-100)) -> 49.13947091807421 | N43: =IF(C43=0,0,IF(H43=0,0,((C43/H43)*100)-100)) -> 120.61776068962743 | P43: =P40+P42 -> 153200440 | Q43: =IF(C43=0,0,((C43/P43)*100)-100) -> 3.2686521135317719 | R43: =R24+R37+R42 -> 7.2413567958591427 | T43: 15.756934266356771 | U43: 15.45617295130077 | V43: =U43-T43 -> -0.30076131505600046