A2: Periodo: | C2: 38412 | D2: a | E2: 38442 | H2: Vendas Acumuladas por Filial | Q2: =NOW() -> 38492.703359722203
A4: v.1 | C4: Vendas 2005 | G4: Vendas de Anos Anteriores | K4: Percentuais ( % ) | Q4: Meta Mensal | U4: Margem
A5: Lojas | C5: Previsao | D5: Realizada | E5: Mes Anterior | G5: Vendas 2004 | H5: Vendas 2003 | I5: Vendas 2002 | K5: % Prev | L5: % MA | M5: 2004 | N5: 2003 | O5: 2002 | Q5: Previsao Mes | R5: Final | S5: Part. | U5: Meta | V5: Real
A7: Xaxim | C7: 900000 | D7: 858818 | E7: 797030 | G7: 726814 | H7: 669625 | I7: 621376 | K7: =IF(C7=0,0,((D7/C7)*100)-100) -> -4.58 | L7: =IF(D7=0,0,IF(E7=0,0,((D7/E7)*100)-100)) -> 7.75 | M7: =IF(G7=0,0,((D7/G7)*100)-100) -> 18.16 | N7: =IF(H7=0,0,((D7/H7)*100)-100) -> 28.25 | O7: =IF(D7=0,0,IF(I7=0,0,((D7/I7)*100)-100)) -> 38.21 | Q7: 900000 | R7: =IF(D7=0,0,((D7/Q7)*100)-100) -> -4.58 | S7: =IF(D7=0,0,(D7/$D$34)*100) -> 1.32 | U7: 17.65 | V7: 17.77
A8: S. Felicidade | C8: 820000 | D8: 793065 | E8: 743453 | G8: 662420 | H8: 714359 | I8: 597986 | K8: =IF(C8=0,0,((D8/C8)*100)-100) -> -3.28 | L8: =IF(D8=0,0,IF(E8=0,0,((D8/E8)*100)-100)) -> 6.67 | M8: =IF(G8=0,0,((D8/G8)*100)-100) -> 19.72 | N8: =IF(H8=0,0,((D8/H8)*100)-100) -> 11.02 | O8: =IF(D8=0,0,IF(I8=0,0,((D8/I8)*100)-100)) -> 32.62 | Q8: 820000 | R8: =IF(D8=0,0,((D8/Q8)*100)-100) -> -3.28 | S8: =IF(D8=0,0,(D8/$D$34)*100) -> 1.22 | U8: 16.75 | V8: 17.57
A9: Lapa | C9: 1390000 | D9: 1308588 | E9: 1169050 | G9: 1087978 | H9: 1012412 | I9: 981302 | K9: =IF(C9=0,0,((D9/C9)*100)-100) -> -5.86 | L9: =IF(D9=0,0,IF(E9=0,0,((D9/E9)*100)-100)) -> 11.94 | M9: =IF(G9=0,0,((D9/G9)*100)-100) -> 20.28 | N9: =IF(H9=0,0,((D9/H9)*100)-100) -> 29.25 | O9: =IF(D9=0,0,IF(I9=0,0,((D9/I9)*100)-100)) -> 33.35 | Q9: 1390000 | R9: =IF(D9=0,0,((D9/Q9)*100)-100) -> -5.86 | S9: =IF(D9=0,0,(D9/$D$34)*100) -> 2.01 | U9: 16.9 | V9: 16.27
A10: Araucaria | C10: 1230000 | D10: 1118579 | E10: 922579 | G10: 955077 | H10: 1086755 | I10: 1697512 | K10: =IF(C10=0,0,((D10/C10)*100)-100) -> -9.06 | L10: =IF(D10=0,0,IF(E10=0,0,((D10/E10)*100)-100)) -> 21.24 | M10: =IF(G10=0,0,((D10/G10)*100)-100) -> 17.12 | N10: =IF(H10=0,0,((D10/H10)*100)-100) -> 2.93 | O10: =IF(D10=0,0,IF(I10=0,0,((D10/I10)*100)-100)) -> -34.1 | Q10: 1230000 | R10: =IF(D10=0,0,((D10/Q10)*100)-100) -> -9.06 | S10: =IF(D10=0,0,(D10/$D$34)*100) -> 1.72 | U10: 17.3 | V10: 18.04
A11: Pinheirinho | C11: 2420000 | D11: 2360409 | E11: 2093962 | G11: 1878353 | H11: 1884252 | I11: 1932772 | K11: =IF(C11=0,0,((D11/C11)*100)-100) -> -2.46 | L11: =IF(D11=0,0,IF(E11=0,0,((D11/E11)*100)-100)) -> 12.72 | M11: =IF(G11=0,0,((D11/G11)*100)-100) -> 25.66 | N11: =IF(H11=0,0,((D11/H11)*100)-100) -> 25.27 | O11: =IF(D11=0,0,IF(I11=0,0,((D11/I11)*100)-100)) -> 22.13 | Q11: 2420000 | R11: =IF(D11=0,0,((D11/Q11)*100)-100) -> -2.46 | S11: =IF(D11=0,0,(D11/$D$34)*100) -> 3.62 | U11: 17.24 | V11: 17.46
A12: Hauer | C12: 3490000 | D12: 3467208 | E12: 3144365 | G12: 2747488 | H12: 2896663 | I12: 2623209 | K12: =IF(C12=0,0,((D12/C12)*100)-100) -> -00.65 | L12: =IF(D12=0,0,IF(E12=0,0,((D12/E12)*100)-100)) -> 10.27 | M12: =IF(G12=0,0,((D12/G12)*100)-100) -> 26.2 | N12: =IF(H12=0,0,((D12/H12)*100)-100) -> 19.7 | O12: =IF(D12=0,0,IF(I12=0,0,((D12/I12)*100)-100)) -> 32.17 | Q12: 3490000 | R12: =IF(D12=0,0,((D12/Q12)*100)-100) -> -00.65 | S12: =IF(D12=0,0,(D12/$D$34)*100) -> 5.32 | U12: 16.5 | V12: 17.8
A13: Paranagua | C13: 1900000 | D13: 2140908 | E13: 3385849 | G13: 3201285 | H13: 3046003 | I13: 2816004 | K13: =IF(C13=0,0,((D13/C13)*100)-100) -> 12.68 | L13: =IF(D13=0,0,IF(E13=0,0,((D13/E13)*100)-100)) -> -36.77 | M13: =IF(G13=0,0,((D13/G13)*100)-100) -> -33.12 | N13: =IF(H13=0,0,((D13/H13)*100)-100) -> -29.71 | O13: =IF(D13=0,0,IF(I13=0,0,((D13/I13)*100)-100)) -> -23.97 | Q13: 1900000 | R13: =IF(D13=0,0,((D13/Q13)*100)-100) -> 12.68 | S13: =IF(D13=0,0,(D13/$D$34)*100) -> 3.28 | U13: 17.59 | V13: 16.57
A14: Centenario | C14: 1240000 | D14: 1047816 | E14: 966874 | G14: 846451 | H14: 878606 | I14: 792518 | K14: =IF(C14=0,0,((D14/C14)*100)-100) -> -15.5 | L14: =IF(D14=0,0,IF(E14=0,0,((D14/E14)*100)-100)) -> 8.37 | M14: =IF(G14=0,0,((D14/G14)*100)-100) -> 23.79 | N14: =IF(H14=0,0,((D14/H14)*100)-100) -> 19.26 | O14: =IF(D14=0,0,IF(I14=0,0,((D14/I14)*100)-100)) -> 32.21 | Q14: 1240000 | R14: =IF(D14=0,0,((D14/Q14)*100)-100) -> -15.5 | S14: =IF(D14=0,0,(D14/$D$34)*100) -> 1.61 | U14: 17.1 | V14: 17.33
A15: Arapongas | C15: 0 | D15: 0 | E15: 0 | G15: 0 | H15: 0 | I15: 0 | K15: =IF(C15=0,0,((D15/C15)*100)-100) -> 0 | L15: =IF(D15=0,0,IF(E15=0,0,((D15/E15)*100)-100)) -> 0 | M15: =IF(D15=0,0,IF(G15=0,0,((D15/G15)*100)-100)) -> 0 | N15: =IF(D15=0,0,IF(H15=0,0,((D15/H15)*100)-100)) -> 0 | O15: =IF(D15=0,0,IF(I15=0,0,((D15/I15)*100)-100)) -> 0 | Q15: 0 | R15: =IF(D15=0,0,((D15/Q15)*100)-100) -> 0 | S15: =IF(D15=0,0,(D15/$D$34)*100) -> 0 | U15: 0 | V15: 0
A16: Sao Braz | C16: 3620000 | D16: 3450181 | E16: 3116610 | G16: 2909061 | H16: 3063453 | I16: 2766547 | K16: =IF(C16=0,0,((D16/C16)*100)-100) -> -4.69 | L16: =IF(D16=0,0,IF(E16=0,0,((D16/E16)*100)-100)) -> 10.7 | M16: =IF(G16=0,0,((D16/G16)*100)-100) -> 18.6 | N16: =IF(H16=0,0,((D16/H16)*100)-100) -> 12.62 | O16: =IF(D16=0,0,IF(I16=0,0,((D16/I16)*100)-100)) -> 24.71 | Q16: 3620000 | R16: =IF(D16=0,0,((D16/Q16)*100)-100) -> -4.69 | S16: =IF(D16=0,0,(D16/$D$34)*100) -> 5.29 | U16: 16.7 | V16: 17.95
A17: Guarapuava | C17: 1910000 | D17: 2117345 | E17: 1737697 | G17: 1548924 | H17: 1333408 | I17: 954191 | K17: =IF(C17=0,0,((D17/C17)*100)-100) -> 10.86 | L17: =IF(D17=0,0,IF(E17=0,0,((D17/E17)*100)-100)) -> 21.85 | M17: =IF(G17=0,0,((D17/G17)*100)-100) -> 36.7 | N17: =IF(H17=0,0,((D17/H17)*100)-100) -> 58.79 | O17: =IF(D17=0,0,IF(I17=0,0,((D17/I17)*100)-100)) -> 121.9 | Q17: 1910000 | R17: =IF(D17=0,0,((D17/Q17)*100)-100) -> 10.86 | S17: =IF(D17=0,0,(D17/$D$34)*100) -> 3.25 | U17: 17.86 | V17: 16.87
A18: Apucarana | C18: 1900000 | D18: 1987495 | E18: 1638164 | G18: 1473884 | H18: 1395490 | I18: 1437347 | K18: =IF(C18=0,0,((D18/C18)*100)-100) -> 4.6 | L18: =IF(D18=0,0,IF(E18=0,0,((D18/E18)*100)-100)) -> 21.32 | M18: =IF(G18=0,0,((D18/G18)*100)-100) -> 34.85 | N18: =IF(H18=0,0,((D18/H18)*100)-100) -> 42.42 | O18: =IF(D18=0,0,IF(I18=0,0,((D18/I18)*100)-100)) -> 38.28 | Q18: 1900000 | R18: =IF(D18=0,0,((D18/Q18)*100)-100) -> 4.6 | S18: =IF(D18=0,0,(D18/$D$34)*100) -> 3.05 | U18: 18.2 | V18: 17.81
A19: Ahu | C19: 1380000 | D19: 1155295 | E19: 1068081 | G19: 1068945 | H19: 1235424 | I19: 1321169 | K19: =IF(C19=0,0,((D19/C19)*100)-100) -> -16.28 | L19: =IF(D19=0,0,IF(E19=0,0,((D19/E19)*100)-100)) -> 8.17 | M19: =IF(G19=0,0,((D19/G19)*100)-100) -> 8.08 | N19: =IF(H19=0,0,((D19/H19)*100)-100) -> -6.49 | O19: =IF(D19=0,0,IF(I19=0,0,((D19/I19)*100)-100)) -> -12.56 | Q19: 1380000 | R19: =IF(D19=0,0,((D19/Q19)*100)-100) -> -16.28 | S19: =IF(D19=0,0,(D19/$D$34)*100) -> 1.77 | U19: 17.91 | V19: 17.93
A20: P.G. Centro | C20: 2100000 | D20: 1891893 | E20: 1691495 | G20: 1688433 | H20: 1566980 | I20: 1393625 | K20: =IF(C20=0,0,((D20/C20)*100)-100) -> -9.91 | L20: =IF(D20=0,0,IF(E20=0,0,((D20/E20)*100)-100)) -> 11.85 | M20: =IF(G20=0,0,((D20/G20)*100)-100) -> 12.05 | N20: =IF(H20=0,0,((D20/H20)*100)-100) -> 20.73 | O20: =IF(D20=0,0,IF(I20=0,0,((D20/I20)*100)-100)) -> 35.75 | Q20: 2100000 | R20: =IF(D20=0,0,((D20/Q20)*100)-100) -> -9.91 | S20: =IF(D20=0,0,(D20/$D$34)*100) -> 2.9 | U20: 18.9 | V20: 18.12
A21: Maringa | C21: 2570000 | D21: 2681869 | E21: 2079356 | G21: 2096430 | H21: 2075741 | I21: 1974460 | K21: =IF(C21=0,0,((D21/C21)*100)-100) -> 4.35 | L21: =IF(D21=0,0,IF(E21=0,0,((D21/E21)*100)-100)) -> 28.98 | M21: =IF(G21=0,0,((D21/G21)*100)-100) -> 27.93 | N21: =IF(H21=0,0,((D21/H21)*100)-100) -> 29.2 | O21: =IF(D21=0,0,IF(I21=0,0,((D21/I21)*100)-100)) -> 35.83 | Q21: 2570000 | R21: =IF(D21=0,0,((D21/Q21)*100)-100) -> 4.35 | S21: =IF(D21=0,0,(D21/$D$34)*100) -> 4.11 | U21: 17.2 | V21: 18.16
A22: Araucaria Nova | C22: 2370000 | D22: 2366594 | E22: 2107318 | G22: 1932605 | H22: 2057036 | I22: 0 | K22: =IF(C22=0,0,((D22/C22)*100)-100) -> -00.14 | L22: =IF(D22=0,0,IF(E22=0,0,((D22/E22)*100)-100)) -> 12.3 | M22: =IF(G22=0,0,((D22/G22)*100)-100) -> 22.46 | N22: =IF(H22=0,0,((D22/H22)*100)-100) -> 15.05 | O22: =IF(D22=0,0,IF(I22=0,0,((D22/I22)*100)-100)) -> 0 | Q22: 2370000 | R22: =IF(D22=0,0,((D22/Q22)*100)-100) -> -00.14 | S22: =IF(D22=0,0,(D22/$D$34)*100) -> 3.63 | U22: 17.4 | V22: 17.72
A23: Total Super | C23: =SUM(C7:C22) -> 29240000 | D23: =SUM(D7:D22) -> 28746063 | E23: =SUM(E7:E22) -> 26661883 | G23: =SUM(G7:G22) -> 24824148 | H23: =SUM(H7:H22) -> 24916207 | I23: =SUM(I7:I22) -> 21910018 | J23: =SUM(C23:I23) -> 156298319 | K23: =IF(D23=0,0,((D23/C23)*100)-100) -> -1.69 | L23: =IF(D23=0,0,IF(E23=0,0,((D23/E23)*100)-100)) -> 7.82 | M23: =IF(G23=0,0,IF(D23=0,0,((D23/G23)*100)-100)) -> 15.8 | N23: =IF(H23=0,0,IF(D23=0,0,((D23/H23)*100)-100)) -> 15.37 | O23: =IF(D23=0,0,IF(I23=0,0,((D23/I23)*100)-100)) -> 31.2 | Q23: =SUM(Q7:Q22) -> 29240000 | R23: =IF(D23=0,0,((D23/Q23)*100)-100) -> -1.69 | S23: =IF(D23=0,0,(D23/$D$34)*100) -> 44.1 | U23: 16.92 | V23: 17.6
A25: Londrina | C25: 2950000 | D25: 2967264 | E25: 2538508 | G25: 2125125 | H25: 2176502 | I25: 2143932 | K25: =IF(C25=0,0,((D25/C25)*100)-100) -> 00.59 | L25: =IF(D25=0,0,IF(E25=0,0,((D25/E25)*100)-100)) -> 16.89 | M25: =IF(G25=0,0,((D25/G25)*100)-100) -> 39.63 | N25: =IF(H25=0,0,((D25/H25)*100)-100) -> 36.33 | O25: =IF(D25=0,0,IF(I25=0,0,((D25/I25)*100)-100)) -> 38.4 | Q25: 2950000 | R25: =IF(D25=0,0,IF(Q25=0,0,((D25/Q25)*100)-100)) -> 00.59 | S25: =IF(D25=0,0,(D25/$D$34)*100) -> 4.55 | U25: 18 | V25: 15.51
A26: S.J. Pinhais | C26: 4600000 | D26: 4961922 | E26: 4371622 | G26: 3967363 | H26: 4062990 | I26: 3619457 | K26: =IF(C26=0,0,((D26/C26)*100)-100) -> 7.87 | L26: =IF(D26=0,0,IF(E26=0,0,((D26/E26)*100)-100)) -> 13.5 | M26: =IF(G26=0,0,((D26/G26)*100)-100) -> 25.07 | N26: =IF(H26=0,0,((D26/H26)*100)-100) -> 22.12 | O26: =IF(D26=0,0,IF(I26=0,0,((D26/I26)*100)-100)) -> 37.09 | Q26: 4600000 | R26: =IF(D26=0,0,IF(Q26=0,0,((D26/Q26)*100)-100)) -> 7.87 | S26: =IF(D26=0,0,(D26/$D$34)*100) -> 7.61 | U26: 16.7 | V26: 16.94
A27: P.G. Nova | C27: 3805000 | D27: 3807048 | E27: 3596581 | G27: 3046593 | H27: 3017129 | I27: 2910297 | K27: =IF(C27=0,0,((D27/C27)*100)-100) -> 00.05 | L27: =IF(D27=0,0,IF(E27=0,0,((D27/E27)*100)-100)) -> 5.85 | M27: =IF(G27=0,0,((D27/G27)*100)-100) -> 24.96 | N27: =IF(H27=0,0,((D27/H27)*100)-100) -> 26.18 | O27: =IF(D27=0,0,IF(I27=0,0,((D27/I27)*100)-100)) -> 30.81 | Q27: 3805000 | R27: =IF(D27=0,0,IF(Q27=0,0,((D27/Q27)*100)-100)) -> 00.05 | S27: =IF(D27=0,0,(D27/$D$34)*100) -> 5.84 | U27: 16.2 | V27: 15.07
A28: Nilo Pecanha | C28: 9925000 | D28: 9128123 | E28: 7986335 | G28: 8101747 | H28: 8022240 | I28: 3752768 | K28: =IF(C28=0,0,((D28/C28)*100)-100) -> -8.03 | L28: =IF(D28=0,0,IF(E28=0,0,((D28/E28)*100)-100)) -> 14.3 | M28: =IF(G28=0,0,((D28/G28)*100)-100) -> 12.67 | N28: =IF(H28=0,0,((D28/H28)*100)-100) -> 13.79 | O28: =IF(D28=0,0,IF(I28=0,0,((D28/I28)*100)-100)) -> 143.24 | Q28: 9925000 | R28: =IF(D28=0,0,IF(Q28=0,0,((D28/Q28)*100)-100)) -> -8.03 | S28: =IF(D28=0,0,(D28/$D$34)*100) -> 14 | U28: 14.99 | V28: 17.21
A29: Champagnat | C29: 6500000 | D29: 5821017 | E29: 5028802 | G29: 2359955 | H29: 0 | I29: 0 | K29: =IF(C29=0,0,((D29/C29)*100)-100) -> -10.45 | L29: =IF(D29=0,0,IF(E29=0,0,((D29/E29)*100)-100)) -> 15.75 | M29: =IF(G29=0,0,((D29/G29)*100)-100) -> 146.66 | N29: =IF(H29=0,0,((D29/H29)*100)-100) -> 0 | O29: =IF(D29=0,0,IF(I29=0,0,((D29/I29)*100)-100)) -> 0 | Q29: 6500000 | R29: =IF(D29=0,0,IF(Q29=0,0,((D29/Q29)*100)-100)) -> -10.45 | S29: =IF(D29=0,0,(D29/$D$34)*100) -> 8.93 | U29: 16.2 | V29: 17.31
A30: Santa Candida | C30: 6500000 | D30: 4983764 | E30: 4721647 | G30: 0 | H30: 0 | I30: 0 | K30: =IF(C30=0,0,((D30/C30)*100)-100) -> -23.33 | L30: =IF(D30=0,0,IF(E30=0,0,((D30/E30)*100)-100)) -> 5.55 | M30: =IF(G30=0,0,((D30/G30)*100)-100) -> 0 | N30: =IF(H30=0,0,((D30/H30)*100)-100) -> 0 | O30: =IF(D30=0,0,IF(I30=0,0,((D30/I30)*100)-100)) -> 0 | Q30: 6500000 | R30: =IF(D30=0,0,IF(Q30=0,0,((D30/Q30)*100)-100)) -> -23.33 | S30: =IF(D30=0,0,(D30/$D$34)*100) -> 7.65 | U30: 15.2 | V30: 15.09
A31: Paranagu Raia | C31: 4700000 | D31: 4771309 | E31: 0 | G31: 0 | H31: 0 | I31: 0 | K31: =IF(C31=0,0,((D31/C31)*100)-100) -> 1.52 | L31: =IF(D31=0,0,IF(E31=0,0,((D31/E31)*100)-100)) -> 0 | M31: =IF(G31=0,0,((D31/G31)*100)-100) -> 0 | N31: =IF(H31=0,0,((D31/H31)*100)-100) -> 0 | O31: =IF(D31=0,0,IF(I31=0,0,((D31/I31)*100)-100)) -> 0 | Q31: 4700000 | R31: =IF(D31=0,0,IF(Q31=0,0,((D31/Q31)*100)-100)) -> 1.52 | S31: =IF(D31=0,0,(D31/$D$34)*100) -> 7.32 | U31: 13 | V31: 13.93
A32: Total Hiper | C32: =SUM(C25:C31) -> 38980000 | D32: =SUM(D25:D31) -> 36440447 | E32: =SUM(E25:E31) -> 28243495 | G32: =SUM(G25:G31) -> 19600783 | H32: =SUM(H25:H31) -> 17278861 | I32: =SUM(I25:I31) -> 12426454 | J32: =SUM(C32:I32) -> 152970040 | K32: =IF(D32=0,0,((D32/C32)*100)-100) -> -6.52 | L32: =IF(D32=0,0,IF(E32=0,0,((D32/E32)*100)-100)) -> 29.02 | M32: =IF(G32=0,0,IF(D32=0,0,((D32/G32)*100)-100)) -> 85.91 | N32: =IF(H32=0,0,IF(D32=0,0,((D32/H32)*100)-100)) -> 110.9 | O32: =IF(D32=0,0,IF(I32=0,0,((D32/I32)*100)-100)) -> 193.25 | Q32: =SUM(Q25:Q31) -> 38980000 | R32: =IF(D32=0,0,((D32/Q32)*100)-100) -> -6.52 | S32: =IF(D32=0,0,(D32/$D$34)*100) -> 55.9 | U32: 16.32 | V32: 16.1
A34: Total Geral | C34: =C23+C32 -> 68220000 | D34: =D23+D32 -> 65186510 | E34: =E23+E32 -> 54905378 | G34: =G23+G32 -> 44424931 | H34: =H23+H32 -> 42195068 | I34: =I23+I32 -> 34336472 | K34: =IF(D32=0,0,((D34/C34)*100)-100) -> -4.45 | L34: =IF(D34=0,0,IF(E34=0,0,((D34/E34)*100)-100)) -> 18.73 | M34: =IF(G34=0,0,IF(D34=0,0,((D34/G34)*100)-100)) -> 46.73 | N34: =IF(H34=0,0,IF(D34=0,0,((D34/H34)*100)-100)) -> 54.49 | O34: =IF(D34=0,0,IF(I34=0,0,((D34/I34)*100)-100)) -> 89.85 | Q34: =Q23+Q32 -> 68220000 | R34: =IF(D34=0,0,((D34/Q34)*100)-100) -> -4.45 | S34: =S23+S32 -> 100 | U34: 16.59 | V34: 16.76
C35: Resumo por Regiao - Outubro/2002
C36: Descricao das Aberturas | H36: Valor | I36: %
C37: Curitiba (2,3,6,7,10,11,17,21,22) | H37: =D7+D8+D11+D12+D14+D16+D19+D28+D29+D31 -> 32853241 | I37: =IF(D34=0,0,H37/$D$34) -> 0.504
C38: Curitiba e Metrop. (Ctba. 4,5,8,14,23) | H38: =H37+D9+D10+D13+D27+D22 -> 43594958 | I38: =IF(D34=0,0,H38/$D$34) -> 0.66879999999999995
C39: Metropolitana (4,5,8,14,23) | H39: =H38-H37 -> 10741717 | I39: =IF(D34=0,0,H39/$D$34) -> 0.1648
C40: Norte (9,15,20) | H40: =D25+D18+D22 -> 7321353 | I40: =IF(D34=0,0,H40/$D$34) -> 0.1123
C41: Centro-Oeste (13,18,19) | H41: =D17+D20+D27 -> 7816286 | I41: =IF(D34=0,0,H41/$D$34) -> 0.11990000000000001
C42: Ponta Grossa (18,19) | H42: =H41-D17 -> 5698941 | I42: =IF(D34=0,0,H42/$D$34) -> 8.7400000000000005E-2
C43: Super (2,3,4,5,6,7,8,10,11,13,15,17,18,20,23) | H43: =D23 -> 28746063 | I43: =IF(D34=0,0,H43/$D$34) -> 0.441
C44: Hiper (9,14,19,21,22,24) | H44: =D32 -> 36440447 | I44: =IF(D34=0,0,H44/$D$34) -> 0.55900000000000005
C45: Curitiba, Metropolitana e Centro-Oeste | H45: =D34-H40 -> 57865157 | I45: =IF(D34=0,0,H45/$D$34) -> 0.88770000000000004
C46: Araucaria | H46: =D10+D22 -> 3485173 | I46: =IF(D34=0,0,H46/$D$34) -> 5.3499999999999999E-2