A2: Periodo: | B2: 40787 | C2: a | D2: 40816 | G2: Vendas Acumuladas por Filial | P2: =NOW() -> 40817.369163194446
A4: v.New | B4: Vendas 2011 | F4: Vendas de Anos Anteriores | J4: Percentuais ( % ) | P4: Meta Mensal | T4: Margem
A5: Lojas | B5: Previsao | C5: Realizada | D5: Mes Anterior | F5: Vendas 2010 | G5: Vendas 2009 | H5: Vendas 2008 | J5: % Prev | K5: % MA | L5: 2010 | M5: 2009 | N5: 2008 | P5: Previsao Mes | Q5: Final | R5: Part. | T5: Meta | U5: Coml | V5: Dif
A6: S. Felicidade | B6: 3550000 | C6: 3638940.06 | D6: 3479679.04 | F6: 3058635.75 | G6: 2668611.7 | H6: 2252814.25 | J6: =IF(B6=0,0,((C6/B6)*100)-100) -> 2.5053538028169129 | K6: =IF(C6=0,0,IF(D6=0,0,((C6/D6)*100)-100)) -> 4.5768882178282695 | L6: =IF(F6=0,0,((C6/F6)*100)-100) -> 18.972651777839204 | M6: =IF(G6=0,0,((C6/G6)*100)-100) -> 36.360792392538769 | N6: =IF(C6=0,0,IF(H6=0,0,((C6/H6)*100)-100)) -> 61.528632908816149 | P6: 3550000 | Q6: =IF(C6=0,0,((C6/P6)*100)-100) -> 2.5053538028169129 | R6: =IF(C6=0,0,(C6/$C$40)*100) -> 2.3985467087522316 | T6: 17.1 | U6: 16.541278781052522 | V6: =U6-T6 -> -0.55872121894747906
A7: Lapa | B7: 2550000 | C7: 2640019.66 | D7: 2428673.56 | F7: 2413350.94 | G7: 2099592.67 | H7: 2092891.6 | J7: =IF(B7=0,0,((C7/B7)*100)-100) -> 3.5301827450980454 | K7: =IF(C7=0,0,IF(D7=0,0,((C7/D7)*100)-100)) -> 8.7021205105885144 | L7: =IF(F7=0,0,((C7/F7)*100)-100) -> 9.3922817540991446 | M7: =IF(G7=0,0,((C7/G7)*100)-100) -> 25.739611198013961 | N7: =IF(C7=0,0,IF(H7=0,0,((C7/H7)*100)-100)) -> 26.142207269597733 | P7: 2550000 | Q7: =IF(C7=0,0,((C7/P7)*100)-100) -> 3.5301827450980454 | R7: =IF(C7=0,0,(C7/$C$40)*100) -> 1.740124971042855 | T7: 15.65 | U7: 14.776003221127526 | V7: =U7-T7 -> -0.87399677887247407
A8: Araucaria | B8: 1569999 | C8: 1590234.53 | D8: 1563670.39 | F8: 1448427.38 | G8: 1261605.45 | H8: 1125403.11 | J8: =IF(B8=0,0,((C8/B8)*100)-100) -> 1.2888880820943314 | K8: =IF(C8=0,0,IF(D8=0,0,((C8/D8)*100)-100)) -> 1.6988324502327004 | L8: =IF(F8=0,0,((C8/F8)*100)-100) -> 9.7904218021617453 | M8: =IF(G8=0,0,((C8/G8)*100)-100) -> 26.048482907235382 | N8: =IF(C8=0,0,IF(H8=0,0,((C8/H8)*100)-100)) -> 41.303548556925506 | P8: 1570000 | Q8: =IF(C8=0,0,((C8/P8)*100)-100) -> 1.2888235668789889 | R8: =IF(C8=0,0,(C8/$C$40)*100) -> 1.0481765940589998 | T8: 16.74 | U8: 16.332141901106876 | V8: =U8-T8 -> -0.40785809889312219
A9: Hauer | B9: 4100000 | C9: 4224868.15 | D9: 4020317.34 | F9: 3836944.41 | G9: 3658402.53 | H9: 3542101.18 | J9: =IF(B9=0,0,((C9/B9)*100)-100) -> 3.0455646341463591 | K9: =IF(C9=0,0,IF(D9=0,0,((C9/D9)*100)-100)) -> 5.0879269644918281 | L9: =IF(F9=0,0,((C9/F9)*100)-100) -> 10.110225704312455 | M9: =IF(G9=0,0,((C9/G9)*100)-100) -> 15.48396097353455 | N9: =IF(C9=0,0,IF(H9=0,0,((C9/H9)*100)-100)) -> 19.275761343440806 | P9: 4100000 | Q9: =IF(C9=0,0,((C9/P9)*100)-100) -> 3.0455646341463591 | R9: =IF(C9=0,0,(C9/$C$40)*100) -> 2.7847514465777241 | T9: 15.8 | U9: 15.854190384615908 | V9: =U9-T9 -> 5.4190384615907305E-2
A10: Paranagua | B10: 2400000 | C10: 2438944.48 | D10: 2346615.75 | F10: 2242909.91 | G10: 1993215.44 | H10: 1768607.98 | J10: =IF(B10=0,0,((C10/B10)*100)-100) -> 1.6226866666666666 | K10: =IF(C10=0,0,IF(D10=0,0,((C10/D10)*100)-100)) -> 3.9345482957744622 | L10: =IF(F10=0,0,((C10/F10)*100)-100) -> 8.7401892125038501 | M10: =IF(G10=0,0,((C10/G10)*100)-100) -> 22.362311221109138 | N10: =IF(C10=0,0,IF(H10=0,0,((C10/H10)*100)-100)) -> 37.901926689259881 | P10: 2400000 | Q10: =IF(C10=0,0,((C10/P10)*100)-100) -> 1.6226866666666666 | R10: =IF(C10=0,0,(C10/$C$40)*100) -> 1.6075896164482091 | T10: 17.29 | U10: 16.449543779692764 | V10: =U10-T10 -> -0.84045622030723521
A11: Sitio Cercado | B11: 3100000 | C11: 3216266.34 | D11: 3044989.17 | F11: 2523145.66 | G11: 2201171.99 | H11: 1847320.94 | J11: =IF(B11=0,0,((C11/B11)*100)-100) -> 3.7505270967741922 | K11: =IF(C11=0,0,IF(D11=0,0,((C11/D11)*100)-100)) -> 5.6248860156044458 | L11: =IF(F11=0,0,((C11/F11)*100)-100) -> 27.470498076595391 | M11: =IF(G11=0,0,((C11/G11)*100)-100) -> 46.116085186055784 | N11: =IF(C11=0,0,IF(H11=0,0,((C11/H11)*100)-100)) -> 74.104362179752059 | P11: 3100000 | Q11: =IF(C11=0,0,((C11/P11)*100)-100) -> 3.7505270967741922 | R11: =IF(C11=0,0,(C11/$C$40)*100) -> 2.119948368777909 | T11: 15.17 | U11: 14.699669120064229 | V11: =U11-T11 -> -0.47033087993577105
A12: Apucarana | B12: 2800000 | C12: 2332622.25 | D12: 2799211.03 | F12: 2716420.94 | G12: 2561218.06 | H12: 2183367.29 | J12: =IF(B12=0,0,((C12/B12)*100)-100) -> -16.692062500000006 | K12: =IF(C12=0,0,IF(D12=0,0,((C12/D12)*100)-100)) -> -16.668581789633762 | L12: =IF(F12=0,0,((C12/F12)*100)-100) -> -14.128837116091447 | M12: =IF(G12=0,0,((C12/G12)*100)-100) -> -8.9252771394248214 | N12: =IF(C12=0,0,IF(H12=0,0,((C12/H12)*100)-100)) -> 6.835998720123726 | P12: 2800000 | Q12: =IF(C12=0,0,((C12/P12)*100)-100) -> -16.692062500000006 | R12: =IF(C12=0,0,(C12/$C$40)*100) -> 1.537509090078204 | T12: 16.3 | U12: 13.625836759466733 | V12: =U12-T12 -> -2.674163240533268
A13: Ahú | B13: 2320000 | C13: 2300493.73 | D13: 2242304.99 | F13: 1844426.26 | G13: 1615543.94 | H13: 1529690.17 | J13: =IF(B13=0,0,((C13/B13)*100)-100) -> -0.84078749999999047 | K13: =IF(C13=0,0,IF(D13=0,0,((C13/D13)*100)-100)) -> 2.5950412749159426 | L13: =IF(F13=0,0,((C13/F13)*100)-100) -> 24.726793360662725 | M13: =IF(G13=0,0,((C13/G13)*100)-100) -> 42.397472024190193 | N13: =IF(C13=0,0,IF(H13=0,0,((C13/H13)*100)-100)) -> 50.38952168987268 | P13: 2320000 | Q13: =IF(C13=0,0,((C13/P13)*100)-100) -> -0.84078749999999047 | R13: =IF(C13=0,0,(C13/$C$40)*100) -> 1.5163321114436397 | T13: 16.98 | U13: 15.657286316533453 | V13: =U13-T13 -> -1.3227136834665476
A14: P.G. Centro | B14: 2350000 | C14: 2319079.42 | D14: 2325101.25 | F14: 1968491.7 | G14: 1869463.58 | H14: 2011341.89 | J14: =IF(B14=0,0,((C14/B14)*100)-100) -> -1.315769361702138 | K14: =IF(C14=0,0,IF(D14=0,0,((C14/D14)*100)-100)) -> -0.25899216216927812 | L14: =IF(F14=0,0,((C14/F14)*100)-100) -> 17.809966889878169 | M14: =IF(G14=0,0,((C14/G14)*100)-100) -> 24.050526836152628 | N14: =IF(C14=0,0,IF(H14=0,0,((C14/H14)*100)-100)) -> 15.300110415340669 | P14: 2350000 | Q14: =IF(C14=0,0,((C14/P14)*100)-100) -> -1.315769361702138 | R14: =IF(C14=0,0,(C14/$C$40)*100) -> 1.5285825593335092 | T14: 17.85 | U14: 17.491224599802624 | V14: =U14-T14 -> -0.35877540019737708
A15: Maringa | B15: 3549999 | C15: 3705989.07 | D15: 3528095.76 | F15: 3134841.02 | G15: 2923616.85 | H15: 2992728.64 | J15: =IF(B15=0,0,((C15/B15)*100)-100) -> 4.394087716644421 | K15: =IF(C15=0,0,IF(D15=0,0,((C15/D15)*100)-100)) -> 5.0421905214953711 | L15: =IF(F15=0,0,((C15/F15)*100)-100) -> 18.219362524482975 | M15: =IF(G15=0,0,((C15/G15)*100)-100) -> 26.760422454125603 | N15: =IF(C15=0,0,IF(H15=0,0,((C15/H15)*100)-100)) -> 23.833114050727971 | P15: 3550000 | Q15: =IF(C15=0,0,((C15/P15)*100)-100) -> 4.3940583098591475 | R15: =IF(C15=0,0,(C15/$C$40)*100) -> 2.4427409465272265 | T15: 17.33 | U15: 16.304319537564098 | V15: =U15-T15 -> -1.0256804624359006
A16: Araucaria Nova | B16: 4950000 | C16: 5375837.0199999996 | D16: 4944687.41 | F16: 4405702.68 | G16: 3436656.75 | H16: 2981025.99 | J16: =IF(B16=0,0,((C16/B16)*100)-100) -> 8.6027680808080618 | K16: =IF(C16=0,0,IF(D16=0,0,((C16/D16)*100)-100)) -> 8.7194512868104397 | L16: =IF(F16=0,0,((C16/F16)*100)-100) -> 22.019968446894822 | M16: =IF(G16=0,0,((C16/G16)*100)-100) -> 56.426358844245925 | N16: =IF(C16=0,0,IF(H16=0,0,((C16/H16)*100)-100)) -> 80.335127504205332 | P16: 4950000 | Q16: =IF(C16=0,0,((C16/P16)*100)-100) -> 8.6027680808080618 | R16: =IF(C16=0,0,(C16/$C$40)*100) -> 3.5433933998652902 | T16: 16 | U16: 15.875735942604896 | V16: =U16-T16 -> -0.12426405739510393
A17: Cristo Rei | B17: 3000000 | C17: 2955221.15 | D17: 2970522.53 | F17: 2430694.64 | G17: 1995500.54 | H17: 1634264.52 | J17: =IF(B17=0,0,((C17/B17)*100)-100) -> -1.4926283333333288 | K17: =IF(C17=0,0,IF(D17=0,0,((C17/D17)*100)-100)) -> -0.51510735385669193 | L17: =IF(F17=0,0,((C17/F17)*100)-100) -> 21.579284430396399 | M17: =IF(G17=0,0,((C17/G17)*100)-100) -> 48.094229531002782 | N17: =IF(C17=0,0,IF(H17=0,0,((C17/H17)*100)-100)) -> 80.828814052696941 | P17: 3000000 | Q17: =IF(C17=0,0,((C17/P17)*100)-100) -> -1.4926283333333288 | R17: =IF(C17=0,0,(C17/$C$40)*100) -> 1.9478847813084024 | T17: 17.44 | U17: 17.265704801821684 | V17: =U17-T17 -> -0.17429519817831718
A18: Fazenda | B18: 3000000 | C18: 3271428.68 | D18: 2939834.97 | F18: 2684592.27 | G18: 0 | H18: 0 | J18: =IF(B18=0,0,((C18/B18)*100)-100) -> 9.0476226666666832 | K18: =IF(C18=0,0,IF(D18=0,0,((C18/D18)*100)-100)) -> 11.279330757807799 | L18: =IF(F18=0,0,((C18/F18)*100)-100) -> 21.859424112846753 | M18: =IF(G18=0,0,((C18/G18)*100)-100) -> 0 | N18: =IF(C18=0,0,IF(H18=0,0,((C18/H18)*100)-100)) -> 0 | P18: 3000000 | Q18: =IF(C18=0,0,((C18/P18)*100)-100) -> 9.0476226666666832 | R18: =IF(C18=0,0,(C18/$C$40)*100) -> 2.156307706077373 | T18: 15.55 | U18: 15.025386095227358 | V18: =U18-T18 -> -0.52461390477264302
A19: Campo Largo | B19: 4150000 | C19: 4190439.87 | D19: 4146796.43 | F19: 3605265.07 | G19: 3067593.33 | H19: 2126873.8 | J19: =IF(B19=0,0,((C19/B19)*100)-100) -> 0.97445469879518498 | K19: =IF(C19=0,0,IF(D19=0,0,((C19/D19)*100)-100)) -> 1.0524615986514618 | L19: =IF(F19=0,0,((C19/F19)*100)-100) -> 16.231117231000169 | M19: =IF(G19=0,0,((C19/G19)*100)-100) -> 36.603500503764621 | N19: =IF(C19=0,0,IF(H19=0,0,((C19/H19)*100)-100)) -> 97.023437403761363 | P19: 4150000 | Q19: =IF(C19=0,0,((C19/P19)*100)-100) -> 0.97445469879518498 | R19: =IF(C19=0,0,(C19/$C$40)*100) -> 2.76205861945762 | T19: 16.2 | U19: 15.085582411662191 | V19: =U19-T19 -> -1.1144175883378082
A20: Brasilia | B20: 3000000 | C20: 3084347.13 | D20: 2925240.76 | F20: 2415218.27 | G20: 2384537.88 | H20: 2055901.84 | J20: =IF(B20=0,0,((C20/B20)*100)-100) -> 2.8115710000000007 | K20: =IF(C20=0,0,IF(D20=0,0,((C20/D20)*100)-100)) -> 5.439086319855619 | L20: =IF(F20=0,0,((C20/F20)*100)-100) -> 27.704695195105472 | M20: =IF(G20=0,0,((C20/G20)*100)-100) -> 29.347793376215947 | N20: =IF(C20=0,0,IF(H20=0,0,((C20/H20)*100)-100)) -> 50.024046381514012 | P20: 3000000 | Q20: =IF(C20=0,0,((C20/P20)*100)-100) -> 2.8115710000000007 | R20: =IF(C20=0,0,(C20/$C$40)*100) -> 2.0329960195362191 | T20: 16.56 | U20: 15.520634021501984 | V20: =U20-T20 -> -1.0393659784980152
A21: Total Super | B21: =SUM(B6:B20) -> 46389998 | C21: =SUM(C6:C20) -> 47284731.540000007 | D21: =SUM(D6:D20) -> 45705740.379999995 | F21: =SUM(F6:F20) -> 40729066.900000006 | G21: =SUM(G6:G20) -> 33736730.710000001 | H21: =SUM(H6:H20) -> 30144333.199999999 | I21: =SUM(B21:H21) -> 243990600.73000002 | J21: =IF(C21=0,0,((C21/B21)*100)-100) -> 1.9287207988239317 | K21: =IF(C21=0,0,IF(D21=0,0,((C21/D21)*100)-100)) -> 3.4546889446975086 | L21: =IF(F21=0,0,IF(C21=0,0,((C21/F21)*100)-100)) -> 16.095788926605636 | M21: =IF(G21=0,0,IF(C21=0,0,((C21/G21)*100)-100)) -> 40.158013372600465 | N21: =IF(C21=0,0,IF(H21=0,0,((C21/H21)*100)-100)) -> 56.861096333688351 | P21: =SUM(P6:P20) -> 46390000 | Q21: =IF(C21=0,0,((C21/P21)*100)-100) -> 1.9287164043975054 | R21: =IF(C21=0,0,(C21/$C$40)*100) -> 31.16694293928542 | T21: 16.464322027562925 | U21: 15.754635222361671 | V21: =U21-T21 -> -0.7096868052012546
A22: Pinheirinho | B22: 5100000 | C22: 5154599.74 | D22: 5067076.75 | F22: 4325189.32 | G22: 4570170.59 | H22: 3746516.24 | J22: =IF(B22=0,0,((C22/B22)*100)-100) -> 1.0705831372549 | K22: =IF(C22=0,0,IF(D22=0,0,((C22/D22)*100)-100)) -> 1.7272876318678243 | L22: =IF(F22=0,0,((C22/F22)*100)-100) -> 19.176280126392257 | M22: =IF(G22=0,0,((C22/G22)*100)-100) -> 12.787906676367641 | N22: =IF(C22=0,0,IF(H22=0,0,((C22/H22)*100)-100)) -> 37.583808791924525 | P22: 5100000 | Q22: =IF(C22=0,0,IF(P22=0,0,((C22/P22)*100)-100)) -> 1.0705831372549 | R22: =IF(C22=0,0,(C22/$C$40)*100) -> 3.3975685329953218 | T22: 16.13 | U22: 15.309300426884359 | V22: =U22-T22 -> -0.82069957311563968
A23: Londrina | B23: 4650000 | C23: 4735165.38 | D23: 4535938.19 | F23: 4012019.25 | G23: 3325594.85 | H23: 3284291.31 | J23: =IF(B23=0,0,((C23/B23)*100)-100) -> 1.8315135483870932 | K23: =IF(C23=0,0,IF(D23=0,0,((C23/D23)*100)-100)) -> 4.3921936687589636 | L23: =IF(F23=0,0,((C23/F23)*100)-100) -> 18.024493028043167 | M23: =IF(G23=0,0,((C23/G23)*100)-100) -> 42.385515782236666 | N23: =IF(C23=0,0,IF(H23=0,0,((C23/H23)*100)-100)) -> 44.176168708980924 | P23: 4650000 | Q23: =IF(C23=0,0,IF(P23=0,0,((C23/P23)*100)-100)) -> 1.8315135483870932 | R23: =IF(C23=0,0,(C23/$C$40)*100) -> 3.1211053631909809 | T23: 15.72 | U23: 15.09026723793119 | V23: =U23-T23 -> -0.62973276206881046
A24: São Bráz | B24: 5700000 | C24: 5943570.8600000003 | D24: 5621580.4299999997 | F24: 5197996.84 | G24: 4816414.85 | H24: 4300794.64 | J24: =IF(B24=0,0,((C24/B24)*100)-100) -> 4.2731729824561455 | K24: =IF(C24=0,0,IF(D24=0,0,((C24/D24)*100)-100)) -> 5.7277563491162482 | L24: =IF(F24=0,0,((C24/F24)*100)-100) -> 14.343487365413637 | M24: =IF(G24=0,0,((C24/G24)*100)-100) -> 23.402386320605274 | N24: =IF(C24=0,0,IF(H24=0,0,((C24/H24)*100)-100)) -> 38.197039326667323 | P24: 5700000 | Q24: =IF(C24=0,0,IF(P24=0,0,((C24/P24)*100)-100)) -> 4.2731729824561455 | R24: =IF(C24=0,0,(C24/$C$40)*100) -> 3.917605700954764 | T24: 15.8 | U24: 14.519142117201914 | V24: =U24-T24 -> -1.2808578827980863
A25: S.J. Pinhais | B25: 6750000 | C25: 7046358.7599999998 | D25: 6779515.5999999996 | F25: 5711700.8099999996 | G25: 5299677.49 | H25: 4868389.52 | J25: =IF(B25=0,0,((C25/B25)*100)-100) -> 4.3905001481481492 | K25: =IF(C25=0,0,IF(D25=0,0,((C25/D25)*100)-100)) -> 3.93602103371515 | L25: =IF(F25=0,0,((C25/F25)*100)-100) -> 23.367084418415132 | M25: =IF(G25=0,0,((C25/G25)*100)-100) -> 32.9582559183238 | N25: =IF(C25=0,0,IF(H25=0,0,((C25/H25)*100)-100)) -> 44.736955230320206 | P25: 6750000 | Q25: =IF(C25=0,0,IF(P25=0,0,((C25/P25)*100)-100)) -> 4.3905001481481492 | R25: =IF(C25=0,0,(C25/$C$40)*100) -> 4.6444899706552061 | T25: 15.95 | U25: 15.29357185327305 | V25: =U25-T25 -> -0.65642814672694882
A26: P.G. Nova | B26: 6750000 | C26: 6920626.46 | D26: 6693806.6699999999 | F26: 5524886.4699999997 | G26: 4495373.44 | H26: 4453009.65 | J26: =IF(B26=0,0,((C26/B26)*100)-100) -> 2.5277994074074144 | K26: =IF(C26=0,0,IF(D26=0,0,((C26/D26)*100)-100)) -> 3.3885022556231092 | L26: =IF(F26=0,0,((C26/F26)*100)-100) -> 25.262781372591718 | M26: =IF(G26=0,0,((C26/G26)*100)-100) -> 53.94997884758601 | N26: =IF(C26=0,0,IF(H26=0,0,((C26/H26)*100)-100)) -> 55.414584830284383 | P26: 6750000 | Q26: =IF(C26=0,0,IF(P26=0,0,((C26/P26)*100)-100)) -> 2.5277994074074144 | R26: =IF(C26=0,0,(C26/$C$40)*100) -> 4.5616156200541003 | T26: 15.4 | U26: 15.386478321790539 | V26: =U26-T26 -> -1.352167820946093E-2
A27: Nilo Pecanha | B27: 14600000 | C27: 14758847.220000001 | D27: 14590293.23 | F27: 12649114.08 | G27: 11793637.68 | H27: 10558539.300000001 | J27: =IF(B27=0,0,((C27/B27)*100)-100) -> 1.0879946575342387 | K27: =IF(C27=0,0,IF(D27=0,0,((C27/D27)*100)-100)) -> 1.155247446661491 | L27: =IF(F27=0,0,((C27/F27)*100)-100) -> 16.678900408810307 | M27: =IF(G27=0,0,((C27/G27)*100)-100) -> 25.142450704827837 | N27: =IF(C27=0,0,IF(H27=0,0,((C27/H27)*100)-100)) -> 39.781145863613915 | P27: 14600000 | Q27: =IF(C27=0,0,IF(P27=0,0,((C27/P27)*100)-100)) -> 1.0879946575342387 | R27: =IF(C27=0,0,(C27/$C$40)*100) -> 9.7280482340530838 | T27: 16.2 | U27: 16.077289199013741 | V27: =U27-T27 -> -0.12271080098625831
A28: Champagnat | B28: 7000000 | C28: 6900014.4199999999 | D28: 6857590.4000000004 | F28: 6178735.79 | G28: 6676772 | H28: 6013506.5099999998 | J28: =IF(B28=0,0,((C28/B28)*100)-100) -> -1.4283654285714249 | K28: =IF(C28=0,0,IF(D28=0,0,((C28/D28)*100)-100)) -> 0.61864324821732453 | L28: =IF(F28=0,0,((C28/F28)*100)-100) -> 11.673563241971863 | M28: =IF(G28=0,0,((C28/G28)*100)-100) -> 3.3435681194445408 | N28: =IF(C28=0,0,IF(H28=0,0,((C28/H28)*100)-100)) -> 14.741946458789144 | P28: 7000000 | Q28: =IF(C28=0,0,IF(P28=0,0,((C28/P28)*100)-100)) -> -1.4283654285714249 | R28: =IF(C28=0,0,(C28/$C$40)*100) -> 4.5480295373246511 | T28: 16.84 | U28: 15.942701899454869 | V28: =U28-T28 -> -0.89729810054513059
A29: Santa Candida | B29: 8600000 | C29: 8794728.0199999996 | D29: 8695058.6099999994 | F29: 7173626.5700000003 | G29: 6324031.2599999998 | H29: 5158348.52 | J29: =IF(B29=0,0,((C29/B29)*100)-100) -> 2.2642793023255763 | K29: =IF(C29=0,0,IF(D29=0,0,((C29/D29)*100)-100)) -> 1.146276459659191 | L29: =IF(F29=0,0,((C29/F29)*100)-100) -> 22.598074128634195 | M29: =IF(G29=0,0,((C29/G29)*100)-100) -> 39.068383099674918 | N29: =IF(C29=0,0,IF(H29=0,0,((C29/H29)*100)-100)) -> 70.495033166157612 | P29: 8600000 | Q29: =IF(C29=0,0,IF(P29=0,0,((C29/P29)*100)-100)) -> 2.2642793023255763 | R29: =IF(C29=0,0,(C29/$C$40)*100) -> 5.7968984371625041 | T29: 15.9 | U29: 14.717410783557124 | V29: =U29-T29 -> -1.1825892164428762
A30: Paranaguá Raia | B30: 8500000 | C30: 8473659.9800000004 | D30: 8254600.4100000001 | F30: 7161890.1200000001 | G30: 6567241.9500000002 | H30: 5556647.4500000002 | J30: =IF(B30=0,0,((C30/B30)*100)-100) -> -0.3098825882352827 | K30: =IF(C30=0,0,IF(D30=0,0,((C30/D30)*100)-100)) -> 2.6537876955815136 | L30: =IF(F30=0,0,((C30/F30)*100)-100) -> 18.31597299066074 | M30: =IF(G30=0,0,((C30/G30)*100)-100) -> 29.029203499956338 | N30: =IF(C30=0,0,IF(H30=0,0,((C30/H30)*100)-100)) -> 52.495907941757224 | P30: 8500000 | Q30: =IF(C30=0,0,IF(P30=0,0,((C30/P30)*100)-100)) -> -0.3098825882352827 | R30: =IF(C30=0,0,(C30/$C$40)*100) -> 5.5852717882125553 | T30: 17.79 | U30: 17.135750117743097 | V30: =U30-T30 -> -0.65424988225690228
A31: Novo Mundo | B31: 6150000 | C31: 6437843.5300000003 | D31: 6101780.71 | F31: 5050281.64 | G31: 0 | H31: 0 | J31: =IF(B31=0,0,((C31/B31)*100)-100) -> 4.6803826016260217 | K31: =IF(C31=0,0,IF(D31=0,0,((C31/D31)*100)-100)) -> 5.5076187751099894 | L31: =IF(F31=0,0,((C31/F31)*100)-100) -> 27.474940783698571 | M31: =IF(G31=0,0,((C31/G31)*100)-100) -> 0 | N31: =IF(C31=0,0,IF(H31=0,0,((C31/H31)*100)-100)) -> 0 | P31: 6150000 | Q31: =IF(C31=0,0,IF(P31=0,0,((C31/P31)*100)-100)) -> 4.6803826016260217 | R31: =IF(C31=0,0,(C31/$C$40)*100) -> 4.2433972958442601 | T31: 15.85 | U31: 15.330769308088479 | V31: =U31-T31 -> -0.51923069191152038
A32: Uvaranas | B32: 5950000 | C32: 6154144.4500000002 | D32: 5879344.8099999996 | F32: 5093201.45 | G32: 4490196.28 | H32: 0 | J32: =IF(B32=0,0,((C32/B32)*100)-100) -> 3.4309991596638696 | K32: =IF(C32=0,0,IF(D32=0,0,((C32/D32)*100)-100)) -> 4.6739840727252755 | L32: =IF(F32=0,0,((C32/F32)*100)-100) -> 20.8305720952781 | M32: =IF(G32=0,0,((C32/G32)*100)-100) -> 37.057359327730751 | N32: =IF(C32=0,0,IF(H32=0,0,((C32/H32)*100)-100)) -> 0 | P32: 5950000 | Q32: =IF(C32=0,0,IF(P32=0,0,((C32/P32)*100)-100)) -> 3.4309991596638696 | R32: =IF(C32=0,0,(C32/$C$40)*100) -> 4.0564017742389833 | T32: 15.5 | U32: 15.618397614960111 | V32: =U32-T32 -> 0.11839761496011114
A33: Torres | B33: 6350000 | C33: 6852060.0499999998 | D33: 6407423.8499999996 | F33: 5262502.43 | G33: 4747477.78 | H33: 0 | J33: =IF(B33=0,0,((C33/B33)*100)-100) -> 7.9064574803149554 | K33: =IF(C33=0,0,IF(D33=0,0,((C33/D33)*100)-100)) -> 6.9393910939729722 | L33: =IF(F33=0,0,((C33/F33)*100)-100) -> 30.205356503749869 | M33: =IF(G33=0,0,((C33/G33)*100)-100) -> 44.330534391674377 | N33: =IF(C33=0,0,IF(H33=0,0,((C33/H33)*100)-100)) -> 0 | P33: 6350000 | Q33: =IF(C33=0,0,IF(P33=0,0,((C33/P33)*100)-100)) -> 7.9064574803149554 | R33: =IF(C33=0,0,(C33/$C$40)*100) -> 4.5164212133519319 | T33: 16.1 | U33: 15.891904070513801 | V33: =U33-T33 -> -0.20809592948620015
A34: Total Hiper | B34: =SUM(B22:B33) -> 86100000 | C34: =SUM(C22:C33) -> 88171618.870000005 | D34: =SUM(D22:D33) -> 85484009.659999996 | F34: =SUM(F22:F33) -> 73341144.769999981 | G34: =SUM(G22:G33) -> 63106588.170000009 | H34: =SUM(H22:H33) -> 47940043.140000001 | I34: =SUM(B34:H34) -> 444143404.60999995 | J34: =IF(C34=0,0,((C34/B34)*100)-100) -> 2.4060614053426264 | K34: =IF(C34=0,0,IF(D34=0,0,((C34/D34)*100)-100)) -> 3.1439905786937032 | L34: =IF(F34=0,0,IF(C34=0,0,((C34/F34)*100)-100)) -> 20.221219816664757 | M34: =IF(G34=0,0,IF(C34=0,0,((C34/G34)*100)-100)) -> 39.718564141795184 | N34: =IF(C34=0,0,IF(H34=0,0,((C34/H34)*100)-100)) -> 83.920608107320959 | P34: =SUM(P22:P33) -> 86100000 | Q34: =IF(C34=0,0,((C34/P34)*100)-100) -> 2.4060614053426264 | R34: =IF(C34=0,0,(C34/$C$40)*100) -> 58.116853468038343 | T34: 16.159419279907084 | U34: 15.61210263168212 | V34: =U34-T34 -> -0.54731664822496384
A35: Total s/ 29,37,38 | B35: =B21+B34 -> 132489998 | C35: =C21+C34 -> 135456350.41000003 | D35: =D21+D34 -> 131189750.03999999 | E35: =E21+E34 -> 0 | F35: =F21+F34 -> 114070211.66999999 | G35: =G21+G34 -> 96843318.88000001 | H35: =H21+H34 -> 78084376.340000004 | I35: =SUM(B35:H35) -> 688134005.34000003 | J35: =IF(C35=0,0,((C35/B35)*100)-100) -> 2.2389255451570165 | K35: =IF(C35=0,0,IF(D35=0,0,((C35/D35)*100)-100)) -> 3.25223606928067 | L35: =IF(F35=0,0,IF(C35=0,0,((C35/F35)*100)-100)) -> 18.7482239463789 | M35: =IF(G35=0,0,IF(C35=0,0,((C35/G35)*100)-100)) -> 39.871652455288086 | N35: =IF(C35=0,0,IF(H35=0,0,((C35/H35)*100)-100)) -> 73.474332202113374 | P35: =P21+P34 -> 132490000 | Q35: =IF(C35=0,0,((C35/P35)*100)-100) -> 2.2389240018114691 | R35: =IF(C35=0,0,(C35/$C$40)*100) -> 89.283796407323763 | T35: 16.266177813135752 | U35: 15.661857517780732 | V35: =U35-T35 -> -0.60432029535501997
A36: Centenário | B36: 0 | C36: 0 | D36: 0 | F36: 898852.71 | G36: 1231252.33 | H36: 1178554.06 | J36: =IF(B36=0,0,((C36/B36)*100)-100) -> 0 | K36: =IF(C36=0,0,IF(D36=0,0,((C36/D36)*100)-100)) -> 0 | L36: =IF(F36=0,0,((C36/F36)*100)-100) -> -100 | M36: =IF(G36=0,0,((C36/G36)*100)-100) -> -100 | N36: =IF(C36=0,0,IF(H36=0,0,((C36/H36)*100)-100)) -> 0 | P36: 0 | Q36: =IF(P36=0,0,IF(C36=0,0,((C36/P36)*100)-100)) -> 0 | R36: =IF(C36=0,0,(C36/$C$40)*100) -> 0 | T36: 0 | U36: 0 | V36: =U36-T36 -> 0
A37: Cajuru | B37: 4900000 | C37: 5283567.02 | D37: 4811069.21 | F37: 2093554.05 | G37: 0 | H37: 0 | J37: =IF(B37=0,0,((C37/B37)*100)-100) -> 7.8278983673469185 | K37: =IF(C37=0,0,IF(D37=0,0,((C37/D37)*100)-100)) -> 9.8210561805657193 | L37: =IF(F37=0,0,((C37/F37)*100)-100) -> 152.37308871963441 | M37: =IF(G37=0,0,((C37/G37)*100)-100) -> 0 | N37: =IF(C37=0,0,IF(H37=0,0,((C37/H37)*100)-100)) -> 0 | P37: 4900000 | Q37: =IF(P37=0,0,IF(C37=0,0,((C37/P37)*100)-100)) -> 7.8278983673469185 | R37: =IF(C37=0,0,(C37/$C$40)*100) -> 3.4825751667623881 | T37: 15.8 | U37: 15.917050863868859 | V37: =U37-T37 -> 0.1170508638688581
A38: Água Verde | B38: 6600000 | C38: 6677654.0099999998 | D38: 6691362.9699999997 | F38: 0 | G38: 0 | H38: 0 | J38: =IF(B38=0,0,((C38/B38)*100)-100) -> 1.1765759090909 | K38: =IF(C38=0,0,IF(D38=0,0,((C38/D38)*100)-100)) -> -0.20487545006095331 | L38: =IF(F38=0,0,((C38/F38)*100)-100) -> 0 | M38: =IF(G38=0,0,((C38/G38)*100)-100) -> 0 | N38: =IF(C38=0,0,IF(H38=0,0,((C38/H38)*100)-100)) -> 0 | P38: 6600000 | Q38: =IF(P38=0,0,IF(C38=0,0,((C38/P38)*100)-100)) -> 1.1765759090909 | R38: =IF(C38=0,0,(C38/$C$40)*100) -> 4.4014643780287059 | T38: 16.1 | U38: 16.217286765356086 | V38: =U38-T38 -> 0.11728676535608429
A39: Colombo | B39: 4296795.72 | C39: 4296799.88 | D39: 0 | F39: 0 | G39: 0 | H39: 0 | J39: =IF(B39=0,0,((C39/B39)*100)-100) -> 9.6816331776494735E-5 | K39: =IF(C39=0,0,IF(D39=0,0,((C39/D39)*100)-100)) -> 0 | L39: =IF(F39=0,0,((C39/F39)*100)-100) -> 0 | M39: =IF(G39=0,0,((C39/G39)*100)-100) -> 0 | N39: =IF(C39=0,0,IF(H39=0,0,((C39/H39)*100)-100)) -> 0 | P39: 0 | Q39: =IF(P39=0,0,IF(C39=0,0,((C39/P39)*100)-100)) -> 0 | R39: =IF(C39=0,0,(C39/$C$40)*100) -> 2.8321640478851369 | T39: 0 | U39: 13.542933321344256 | V39: =U39-T39 -> 13.542933321344256
A40: Total Geral | B40: =B21+B34+SUM(B36:B39) -> 148286793.72 | C40: =C21+C34+SUM(C36:C39) -> 151714371.32000002 | D40: =D21+D34+SUM(D36:D39) -> 142692182.22 | F40: =F21+F34+SUM(F36:F39) -> 117062618.42999999 | G40: =G21+G34+SUM(G36:G39) -> 98074571.210000008 | H40: =H21+H34+SUM(H36:H39) -> 79262930.400000006 | J40: =IF(C40=0,0,((C40/B40)*100)-100) -> 2.3114516903454501 | K40: =IF(C40=0,0,IF(D40=0,0,((C40/D40)*100)-100)) -> 6.3228335004995557 | L40: =IF(F40=0,0,IF(C40=0,0,((C40/F40)*100)-100)) -> 29.6010403275925 | M40: =IF(G40=0,0,IF(C40=0,0,((C40/G40)*100)-100)) -> 54.692872421685109 | N40: =IF(C40=0,0,IF(H40=0,0,((C40/H40)*100)-100)) -> 91.406462711350883 | P40: =P21+P34+SUM(P36:P39) -> 143990000 | Q40: =IF(C40=0,0,((C40/P40)*100)-100) -> 5.3645192860615367 | R40: =R21+R34+SUM(R36:R39) -> 100 | T40: 16.24 | U40: 15.635180429062595 | V40: =U40-T40 -> -0.60481957093740313
A42: Água Verde | B42: 0 | C42: 0 | D42: 0 | F42: 0 | G42: 0 | H42: 0 | J42: =IF(B42=0,0,((C42/B42)*100)-100) -> 0 | K42: =IF(C42=0,0,IF(D42=0,0,((C42/D42)*100)-100)) -> 0 | L42: =IF(F42=0,0,((C42/F42)*100)-100) -> 0 | M42: =IF(G42=0,0,((C42/G42)*100)-100) -> 0 | N42: =IF(C42=0,0,IF(H42=0,0,((C42/H42)*100)-100)) -> 0 | P42: =B42 -> 0 | Q42: =IF(C42=0,0,IF(P42=0,0,((C42/P42)*100)-100)) -> 0 | R42: =IF(C42=0,0,(C42/$C$40)*100) -> 0 | T42: 14.95 | U42: 0 | V42: =U42-T42 -> -14.95
A43: Total Geral | B43: =B40+B42 -> 148286793.72 | C43: =C40+C42 -> 151714371.32000002 | D43: =D40+D42 -> 142692182.22 | F43: =F40+F42 -> 117062618.42999999 | G43: =G40+G42 -> 98074571.210000008 | H43: =H40+H42 -> 79262930.400000006 | J43: =IF(C43=0,0,((C43/B43)*100)-100) -> 2.3114516903454501 | K43: =IF(C43=0,0,IF(D43=0,0,((C43/D43)*100)-100)) -> 6.3228335004995557 | L43: =IF(F43=0,0,IF(C43=0,0,((C43/F43)*100)-100)) -> 29.6010403275925 | M43: =IF(G43=0,0,IF(C43=0,0,((C43/G43)*100)-100)) -> 54.692872421685109 | N43: =IF(C43=0,0,IF(H43=0,0,((C43/H43)*100)-100)) -> 91.406462711350883 | P43: =P40+P42 -> 143990000 | Q43: =IF(C43=0,0,((C43/P43)*100)-100) -> 5.3645192860615367 | R43: =R24+R37+R42 -> 7.4001808677171521 | T43: 15.772044207430719 | U43: 15.635180429062595 | V43: =U43-T43 -> -0.13686377836812369