A2: Periodo: | B2: 41000 | C2: a | D2: 41029 | G2: Vendas Acumuladas por Filial | P2: =NOW() -> 41030.32779988426
A4: v.New | B4: Vendas 2012 | F4: Vendas de Anos Anteriores | J4: Percentuais ( % ) | P4: Meta Mensal | T4: Margem
A5: Lojas | B5: Previsao | C5: Realizada | D5: Mes Anterior | F5: Vendas 2011 | G5: Vendas 2010 | H5: Vendas 2009 | J5: % Prev | K5: % MA | L5: 2011 | M5: 2010 | N5: 2009 | P5: Previsao Mes | Q5: Final | R5: Part. | T5: Meta | U5: Coml | V5: Sell O. | W5: Dif
A6: S. Felicidade | B6: 4250000 | C6: 4282924.82 | D6: 4079524.62 | F6: 3870929.93 | G6: 3036597.06 | H6: 2918493.73 | J6: =IF(B6=0,0,((C6/B6)*100)-100) -> 0.77470164705883349 | K6: =IF(C6=0,0,IF(D6=0,0,((C6/D6)*100)-100)) -> 4.9858799479435447 | L6: =IF(F6=0,0,((C6/F6)*100)-100) -> 10.643305289693018 | M6: =IF(G6=0,0,((C6/G6)*100)-100) -> 41.043567367479454 | N6: =IF(C6=0,0,IF(H6=0,0,((C6/H6)*100)-100)) -> 46.751208542085863 | P6: 4250000 | Q6: =IF(C6=0,0,((C6/P6)*100)-100) -> 0.77470164705883349 | R6: =IF(C6=0,0,(C6/$C$43)*100) -> 2.328466710441595 | T6: 16.2 | U6: 16.048679322837142 | V6: 18.374148250867499 | W6: =U6-T6 -> -0.15132067716285746
A7: Lapa | B7: 3050000 | C7: 2861109.98 | D7: 2784116.18 | F7: 2984627.91 | G7: 2368144.91 | H7: 2372672.49 | J7: =IF(B7=0,0,((C7/B7)*100)-100) -> -6.1931154098360679 | K7: =IF(C7=0,0,IF(D7=0,0,((C7/D7)*100)-100)) -> 2.7654664899796018 | L7: =IF(F7=0,0,((C7/F7)*100)-100) -> -4.1384699776529317 | M7: =IF(G7=0,0,((C7/G7)*100)-100) -> 20.816507803992451 | N7: =IF(C7=0,0,IF(H7=0,0,((C7/H7)*100)-100)) -> 20.585963383425067 | P7: 3050000 | Q7: =IF(C7=0,0,((C7/P7)*100)-100) -> -6.1931154098360679 | R7: =IF(C7=0,0,(C7/$C$43)*100) -> 1.5554789363176862 | T7: 15.4 | U7: 14.567162846357974 | V7: 17.469091614576801 | W7: =U7-T7 -> -0.83283715364202671
A8: Araucaria | B8: 1700000 | C8: 1677629.92 | D8: 1592588.28 | F8: 1761097.86 | G8: 1438419.1 | H8: 1431832.16 | J8: =IF(B8=0,0,((C8/B8)*100)-100) -> -1.3158870588235345 | K8: =IF(C8=0,0,IF(D8=0,0,((C8/D8)*100)-100)) -> 5.3398383667623079 | L8: =IF(F8=0,0,((C8/F8)*100)-100) -> -4.7395401411708207 | M8: =IF(G8=0,0,((C8/G8)*100)-100) -> 16.630119830861517 | N8: =IF(C8=0,0,IF(H8=0,0,((C8/H8)*100)-100)) -> 17.166660092339313 | P8: 1700000 | Q8: =IF(C8=0,0,((C8/P8)*100)-100) -> -1.3158870588235345 | R8: =IF(C8=0,0,(C8/$C$43)*100) -> 0.91206490548689945 | T8: 16.09 | U8: 15.80476461697822 | V8: 18.193705468724591 | W8: =U8-T8 -> -0.28523538302177975
A9: Hauer | B9: 4979999 | C9: 4933737.02 | D9: 4761341.86 | F9: 4512832.39 | G9: 3747964.55 | H9: 3914572.14 | J9: =IF(B9=0,0,((C9/B9)*100)-100) -> -0.92895560822402956 | K9: =IF(C9=0,0,IF(D9=0,0,((C9/D9)*100)-100)) -> 3.6207263638910092 | L9: =IF(F9=0,0,((C9/F9)*100)-100) -> 9.3268394131518022 | M9: =IF(G9=0,0,((C9/G9)*100)-100) -> 31.637771760674724 | N9: =IF(C9=0,0,IF(H9=0,0,((C9/H9)*100)-100)) -> 26.035153869970557 | P9: 4980000 | Q9: =IF(C9=0,0,((C9/P9)*100)-100) -> -0.92897550200804346 | R9: =IF(C9=0,0,(C9/$C$43)*100) -> 2.682289064589118 | T9: 16.2 | U9: 15.540069867769324 | V9: 17.723847530892517 | W9: =U9-T9 -> -0.65993013223067543
A10: Paranagua | B10: 2719999 | C10: 2687618.02 | D10: 2552125.97 | F10: 2814018.85 | G10: 5049479.83 | H10: 2228804.76 | J10: =IF(B10=0,0,((C10/B10)*100)-100) -> -1.1904776435579549 | K10: =IF(C10=0,0,IF(D10=0,0,((C10/D10)*100)-100)) -> 5.3089875497015555 | L10: =IF(F10=0,0,((C10/F10)*100)-100) -> -4.4918259875906728 | M10: =IF(G10=0,0,((C10/G10)*100)-100) -> -46.774358736274024 | N10: =IF(C10=0,0,IF(H10=0,0,((C10/H10)*100)-100)) -> 20.585619172852105 | P10: 2720000 | Q10: =IF(C10=0,0,((C10/P10)*100)-100) -> -1.1905139705882419 | R10: =IF(C10=0,0,(C10/$C$43)*100) -> 1.4611578192383383 | T10: 15.95 | U10: 16.251556461881439 | V10: 18.655131762362569 | W10: =U10-T10 -> 0.30155646188143947
A11: Sitio Cercado | B11: 3820000 | C11: 3907270.73 | D11: 3614365.34 | F11: 3644658.3 | G11: 2415356.33 | H11: 2369386.75 | J11: =IF(B11=0,0,((C11/B11)*100)-100) -> 2.2845740837696269 | K11: =IF(C11=0,0,IF(D11=0,0,((C11/D11)*100)-100)) -> 8.1039231634508724 | L11: =IF(F11=0,0,((C11/F11)*100)-100) -> 7.2054060596023533 | M11: =IF(G11=0,0,((C11/G11)*100)-100) -> 61.767880021247208 | N11: =IF(C11=0,0,IF(H11=0,0,((C11/H11)*100)-100)) -> 64.906414286312696 | P11: 3820000 | Q11: =IF(C11=0,0,((C11/P11)*100)-100) -> 2.2845740837696269 | R11: =IF(C11=0,0,(C11/$C$43)*100) -> 2.1242375726520057 | T11: 14.49 | U11: 14.01414101653509 | V11: 16.61855651860602 | W11: =U11-T11 -> -0.47585898346491007
A12: Apucarana | B12: 3319998 | C12: 3030381.03 | D12: 3168391.12 | F12: 2900642.85 | G12: 2666000.32 | H12: 3039739.3 | J12: =IF(B12=0,0,((C12/B12)*100)-100) -> -8.7234079659084074 | K12: =IF(C12=0,0,IF(D12=0,0,((C12/D12)*100)-100)) -> -4.3558413331243173 | L12: =IF(F12=0,0,((C12/F12)*100)-100) -> 4.4727388620077591 | M12: =IF(G12=0,0,((C12/G12)*100)-100) -> 13.667691907853936 | N12: =IF(C12=0,0,IF(H12=0,0,((C12/H12)*100)-100)) -> -0.30786423033055144 | P12: 3320000 | Q12: =IF(C12=0,0,((C12/P12)*100)-100) -> -8.7234629518072353 | R12: =IF(C12=0,0,(C12/$C$43)*100) -> 1.6475053018345325 | T12: 16.009 | U12: 14.761913619819616 | V12: 17.039309650773522 | W12: =U12-T12 -> -1.2470863801803844
A13: Ahú | B13: 2650000 | C13: 2562369 | D13: 2455149.67 | F13: 2516137.51 | G13: 1889153.86 | H13: 1845472.36 | J13: =IF(B13=0,0,((C13/B13)*100)-100) -> -3.3068301886792426 | K13: =IF(C13=0,0,IF(D13=0,0,((C13/D13)*100)-100)) -> 4.3671199076022162 | L13: =IF(F13=0,0,((C13/F13)*100)-100) -> 1.8373991809374672 | M13: =IF(G13=0,0,((C13/G13)*100)-100) -> 35.635802580950184 | N13: =IF(C13=0,0,IF(H13=0,0,((C13/H13)*100)-100)) -> 38.846240969981267 | P13: 2650000 | Q13: =IF(C13=0,0,((C13/P13)*100)-100) -> -3.3068301886792426 | R13: =IF(C13=0,0,(C13/$C$43)*100) -> 1.3930645918663402 | T13: 17.1 | U13: 15.962792634472242 | V13: 18.015574716209883 | W13: =U13-T13 -> -1.1372073655277593
A14: P.G. Centro | B14: 2700000 | C14: 2552493.51 | D14: 2580404.79 | F14: 2751280.68 | G14: 2012127.68 | H14: 2184716.3 | J14: =IF(B14=0,0,((C14/B14)*100)-100) -> -5.4632033333333396 | K14: =IF(C14=0,0,IF(D14=0,0,((C14/D14)*100)-100)) -> -1.0816628502693248 | L14: =IF(F14=0,0,((C14/F14)*100)-100) -> -7.2252595471284451 | M14: =IF(G14=0,0,((C14/G14)*100)-100) -> 26.855444382137804 | N14: =IF(C14=0,0,IF(H14=0,0,((C14/H14)*100)-100)) -> 16.834094660254053 | P14: 2700000 | Q14: =IF(C14=0,0,((C14/P14)*100)-100) -> -5.4632033333333396 | R14: =IF(C14=0,0,(C14/$C$43)*100) -> 1.3876956557582583 | T14: 17.71 | U14: 15.951184925833564 | V14: 18.127680826111096 | W14: =U14-T14 -> -1.7588150741664368
A15: Maringa | B15: 4599999 | C15: 4090249.2 | D15: 4355016.23 | F15: 3925238.05 | G15: 3128775.61 | H15: 3215662.85 | J15: =IF(B15=0,0,((C15/B15)*100)-100) -> -11.081519800330383 | K15: =IF(C15=0,0,IF(D15=0,0,((C15/D15)*100)-100)) -> -6.0795876758420349 | L15: =IF(F15=0,0,((C15/F15)*100)-100) -> 4.2038507702736752 | M15: =IF(G15=0,0,((C15/G15)*100)-100) -> 30.730027008872014 | N15: =IF(C15=0,0,IF(H15=0,0,((C15/H15)*100)-100)) -> 27.197700467883323 | P15: 4600000 | Q15: =IF(C15=0,0,((C15/P15)*100)-100) -> -11.081539130434777 | R15: =IF(C15=0,0,(C15/$C$43)*100) -> 2.2237161519006921 | T15: 17.118500000000001 | U15: 16.884332866564709 | V15: 18.434634236955535 | W15: =U15-T15 -> -0.23416713343529239
A16: Centenario | B16: 0 | C16: 0 | D16: 0 | F16: 0 | G16: 1379071.84 | H16: 1370762.56 | J16: =IF(B16=0,0,((C16/B16)*100)-100) -> 0 | K16: =IF(C16=0,0,IF(D16=0,0,((C16/D16)*100)-100)) -> 0 | L16: =IF(F16=0,0,((C16/F16)*100)-100) -> 0 | M16: =IF(G16=0,0,((C16/G16)*100)-100) -> -100 | N16: =IF(C16=0,0,IF(H16=0,0,((C16/H16)*100)-100)) -> 0 | P16: 0 | Q16: =IF(C16=0,0,((C16/P16)*100)-100) -> 0 | R16: =IF(C16=0,0,(C16/$C$43)*100) -> 0 | T16: 0 | U16: 0 | V16: 0 | W16: =U16-T16 -> 0
A17: Cristo Rei | B17: 3499999 | C17: 3385221.41 | D17: 3311662.98 | F17: 3096501.12 | G17: 2381905.78 | H17: 2270551.61 | J17: =IF(B17=0,0,((C17/B17)*100)-100) -> -3.279360651245895 | K17: =IF(C17=0,0,IF(D17=0,0,((C17/D17)*100)-100)) -> 2.2211931118667252 | L17: =IF(F17=0,0,((C17/F17)*100)-100) -> 9.324081562095472 | M17: =IF(G17=0,0,((C17/G17)*100)-100) -> 42.122389492669186 | N17: =IF(C17=0,0,IF(H17=0,0,((C17/H17)*100)-100)) -> 49.092467006288416 | P17: 3500000 | Q17: =IF(C17=0,0,((C17/P17)*100)-100) -> -3.2793882857142762 | R17: =IF(C17=0,0,(C17/$C$43)*100) -> 1.8404188006875071 | T17: 16.63 | U17: 17.216413623001394 | V17: 19.13580838719793 | W17: =U17-T17 -> 0.58641362300139477
A18: Fazenda | B18: 4499999 | C18: 4465698.25 | D18: 4223796.59 | F18: 3455070.31 | G18: 3155559.4 | H18: 0 | J18: =IF(B18=0,0,((C18/B18)*100)-100) -> -0.76223905827535532 | K18: =IF(C18=0,0,IF(D18=0,0,((C18/D18)*100)-100)) -> 5.7271143353046909 | L18: =IF(F18=0,0,((C18/F18)*100)-100) -> 29.250575222013367 | M18: =IF(G18=0,0,((C18/G18)*100)-100) -> 41.518434100781008 | N18: =IF(C18=0,0,IF(H18=0,0,((C18/H18)*100)-100)) -> 0 | P18: 4500000 | Q18: =IF(C18=0,0,((C18/P18)*100)-100) -> -0.76226111111110129 | R18: =IF(C18=0,0,(C18/$C$43)*100) -> 2.4278338170788358 | T18: 14.55 | U18: 14.697633231264561 | V18: 17.066819982742899 | W18: =U18-T18 -> 0.14763323126456029
A19: Campo Largo | B19: 5100000 | C19: 5031435.47 | D19: 4650896.96 | F19: 4715271.3 | G19: 3619820.69 | H19: 3120050.05 | J19: =IF(B19=0,0,((C19/B19)*100)-100) -> -1.3444025490196054 | K19: =IF(C19=0,0,IF(D19=0,0,((C19/D19)*100)-100)) -> 8.182045598361313 | L19: =IF(F19=0,0,((C19/F19)*100)-100) -> 6.705110902102291 | M19: =IF(G19=0,0,((C19/G19)*100)-100) -> 38.996815060471931 | N19: =IF(C19=0,0,IF(H19=0,0,((C19/H19)*100)-100)) -> 61.261370470643584 | P19: 5100000 | Q19: =IF(C19=0,0,((C19/P19)*100)-100) -> -1.3444025490196054 | R19: =IF(C19=0,0,(C19/$C$43)*100) -> 2.7354040731515945 | T19: 15 | U19: 15.559499364899935 | V19: 17.923907429145665 | W19: =U19-T19 -> 0.5594993648999349
A20: Brasilia | B20: 3850000 | C20: 3724585.65 | D20: 3500924.2 | F20: 3342625.5 | G20: 2487508.78 | H20: 2726570.95 | J20: =IF(B20=0,0,((C20/B20)*100)-100) -> -3.2575155844155859 | K20: =IF(C20=0,0,IF(D20=0,0,((C20/D20)*100)-100)) -> 6.3886401767853158 | L20: =IF(F20=0,0,((C20/F20)*100)-100) -> 11.426950162379839 | M20: =IF(G20=0,0,((C20/G20)*100)-100) -> 49.731557932430718 | N20: =IF(C20=0,0,IF(H20=0,0,((C20/H20)*100)-100)) -> 36.603291031175985 | P20: 3850000 | Q20: =IF(C20=0,0,((C20/P20)*100)-100) -> -3.2575155844155859 | R20: =IF(C20=0,0,(C20/$C$43)*100) -> 2.0249184986192379 | T20: 15.5 | U20: 15.016366988365537 | V20: 17.548734294779877 | W20: =U20-T20 -> -0.48363301163446337
A21: Cajuru | B21: 5999999 | C21: 5734975.4699999997 | D21: 5600963.7400000002 | F21: 5176003.74 | G21: 0 | H21: 0 | J21: =IF(B21=0,0,((C21/B21)*100)-100) -> -4.4170595695099308 | K21: =IF(C21=0,0,IF(D21=0,0,((C21/D21)*100)-100)) -> 2.3926548397901257 | L21: =IF(F21=0,0,((C21/F21)*100)-100) -> 10.799291462644874 | M21: =IF(G21=0,0,((C21/G21)*100)-100) -> 0 | N21: =IF(C21=0,0,IF(H21=0,0,((C21/H21)*100)-100)) -> 0 | P21: 6000000 | Q21: =IF(C21=0,0,((C21/P21)*100)-100) -> -4.4170754999999957 | R21: =IF(C21=0,0,(C21/$C$43)*100) -> 3.1178925683533572 | T21: 15 | U21: 15.270597486967109 | V21: 17.544611304152625 | W21: =U21-T21 -> 0.27059748696710884
A22: Total Super | B22: =SUM(B6:B21) -> 56739992 | C22: =SUM(C6:C21) -> 54927699.479999997 | D22: =SUM(D6:D21) -> 53231268.530000001 | F22: =SUM(F6:F21) -> 51466936.300000004 | G22: =SUM(G6:G21) -> 40775885.740000002 | H22: =SUM(H6:H21) -> 35009288.010000005 | I22: =SUM(B22:H22) -> 292151070.06 | J22: =IF(C22=0,0,((C22/B22)*100)-100) -> -3.1940302705717727 | K22: =IF(C22=0,0,IF(D22=0,0,((C22/D22)*100)-100)) -> 3.1869068629163451 | L22: =IF(F22=0,0,IF(C22=0,0,((C22/F22)*100)-100)) -> 6.724245561902606 | M22: =IF(G22=0,0,IF(C22=0,0,((C22/G22)*100)-100)) -> 34.706330673566356 | N22: =IF(C22=0,0,IF(H22=0,0,((C22/H22)*100)-100)) -> 56.894648826650013 | P22: =SUM(P6:P21) -> 56740000 | Q22: =IF(C22=0,0,((C22/P22)*100)-100) -> -3.1940439196334154 | R22: =IF(C22=0,0,(C22/$C$43)*100) -> 29.862144467975998 | T22: 15.817179750985865 | U22: 15.532352111536133 | V22: 17.81145648155589 | W22: =U22-T22 -> -0.28482763944973222
A23: Pinheirinho | B23: 5950000 | C23: 5826223.1900000004 | D23: 5576278.9900000002 | F23: 5823556.46 | G23: 5198764.64 | H23: 4921042.46 | J23: =IF(B23=0,0,((C23/B23)*100)-100) -> -2.0802825210083853 | K23: =IF(C23=0,0,IF(D23=0,0,((C23/D23)*100)-100)) -> 4.4822757334815435 | L23: =IF(F23=0,0,((C23/F23)*100)-100) -> 4.5792120645131718E-2 | M23: =IF(G23=0,0,((C23/G23)*100)-100) -> 12.069377889744231 | N23: =IF(C23=0,0,IF(H23=0,0,((C23/H23)*100)-100)) -> 18.394084939474411 | P23: 5950000 | Q23: =IF(C23=0,0,IF(P23=0,0,((C23/P23)*100)-100)) -> -2.0802825210083853 | R23: =IF(C23=0,0,(C23/$C$43)*100) -> 3.1675005552672379 | T23: 15.85 | U23: 14.919715940370622 | V23: 17.31939584861664 | W23: =U23-T23 -> -0.93028405962937732
A24: Londrina | B24: 5999999 | C24: 5910666.3600000003 | D24: 5623677.2300000004 | F24: 5047524.35 | G24: 3599518.79 | H24: 3539471.43 | J24: =IF(B24=0,0,((C24/B24)*100)-100) -> -1.4888775814795849 | K24: =IF(C24=0,0,IF(D24=0,0,((C24/D24)*100)-100)) -> 5.1032290485846517 | L24: =IF(F24=0,0,((C24/F24)*100)-100) -> 17.100304033203926 | M24: =IF(G24=0,0,((C24/G24)*100)-100) -> 64.207126141991893 | N24: =IF(C24=0,0,IF(H24=0,0,((C24/H24)*100)-100)) -> 66.992910577046246 | P24: 6000000 | Q24: =IF(C24=0,0,IF(P24=0,0,((C24/P24)*100)-100)) -> -1.4888940000000019 | R24: =IF(C24=0,0,(C24/$C$43)*100) -> 3.2134091617762732 | T24: 15.4 | U24: 15.29270110925361 | V24: 17.06523829742946 | W24: =U24-T24 -> -0.10729889074639054
A25: São Bráz | B25: 6649999 | C25: 6506217.7400000002 | D25: 6187540.1200000001 | F25: 6279519.6100000003 | G25: 5138331.96 | H25: 5189181.51 | J25: =IF(B25=0,0,((C25/B25)*100)-100) -> -2.16212453565781 | K25: =IF(C25=0,0,IF(D25=0,0,((C25/D25)*100)-100)) -> 5.1503119789064016 | L25: =IF(F25=0,0,((C25/F25)*100)-100) -> 3.6101189912519374 | M25: =IF(G25=0,0,((C25/G25)*100)-100) -> 26.621202963305635 | N25: =IF(C25=0,0,IF(H25=0,0,((C25/H25)*100)-100)) -> 25.380423241352389 | P25: 6650000 | Q25: =IF(C25=0,0,IF(P25=0,0,((C25/P25)*100)-100)) -> -2.1621392481202975 | R25: =IF(C25=0,0,(C25/$C$43)*100) -> 3.5371882662359106 | T25: 15.7 | U25: 14.947255054516512 | V25: 16.906125016959546 | W25: =U25-T25 -> -0.75274494548348692
A26: S.J. Pinhais | B26: 6479999 | C26: 6429004.9100000001 | D26: 6093119.2999999998 | F26: 7300277.5999999996 | G26: 5681714.29 | H26: 5686816.6500000004 | J26: =IF(B26=0,0,((C26/B26)*100)-100) -> -0.7869459547756037 | K26: =IF(C26=0,0,IF(D26=0,0,((C26/D26)*100)-100)) -> 5.5125395296297626 | L26: =IF(F26=0,0,((C26/F26)*100)-100) -> -11.934788479824377 | M26: =IF(G26=0,0,((C26/G26)*100)-100) -> 13.152555405949499 | N26: =IF(C26=0,0,IF(H26=0,0,((C26/H26)*100)-100)) -> 13.05103198641018 | P26: 6480000 | Q26: =IF(C26=0,0,IF(P26=0,0,((C26/P26)*100)-100)) -> -0.78696126543209743 | R26: =IF(C26=0,0,(C26/$C$43)*100) -> 3.4952105262965043 | T26: 16.3 | U26: 15.647797195413871 | V26: 17.493668475048654 | W26: =U26-T26 -> -0.65220280458613011
A27: P.G. Nova | B27: 7850000 | C27: 7419381.25 | D27: 7380254.5800000001 | F27: 7324335.1799999997 | G27: 4860655.67 | H27: 4936289.52 | J27: =IF(B27=0,0,((C27/B27)*100)-100) -> -5.4855891719745244 | K27: =IF(C27=0,0,IF(D27=0,0,((C27/D27)*100)-100)) -> 0.53015339207986756 | L27: =IF(F27=0,0,((C27/F27)*100)-100) -> 1.2976750471433292 | M27: =IF(G27=0,0,((C27/G27)*100)-100) -> 52.641572530892716 | N27: =IF(C27=0,0,IF(H27=0,0,((C27/H27)*100)-100)) -> 50.302797677069833 | P27: 7850000 | Q27: =IF(C27=0,0,IF(P27=0,0,((C27/P27)*100)-100)) -> -5.4855891719745244 | R27: =IF(C27=0,0,(C27/$C$43)*100) -> 4.0336412565606388 | T27: 15.59 | U27: 15.549754098429705 | V27: 17.396879203370226 | W27: =U27-T27 -> -4.0245901570294507E-2
A28: Nilo Pecanha | B28: 16849999 | C28: 17064353.890000001 | D28: 15891886.289999999 | F28: 16007396.52 | G28: 12850878.390000001 | H28: 12872895 | J28: =IF(B28=0,0,((C28/B28)*100)-100) -> 1.2721359211950158 | K28: =IF(C28=0,0,IF(D28=0,0,((C28/D28)*100)-100)) -> 7.3777749135908408 | L28: =IF(F28=0,0,((C28/F28)*100)-100) -> 6.6029311429838913 | M28: =IF(G28=0,0,((C28/G28)*100)-100) -> 32.787451348685579 | N28: =IF(C28=0,0,IF(H28=0,0,((C28/H28)*100)-100)) -> 32.560343963032409 | P28: 16850000 | Q28: =IF(C28=0,0,IF(P28=0,0,((C28/P28)*100)-100)) -> 1.2721299109792312 | R28: =IF(C28=0,0,(C28/$C$43)*100) -> 9.2772536614498726 | T28: 16.2 | U28: 15.977040323206754 | V28: 17.737184069850535 | W28: =U28-T28 -> -0.22295967679324491
A29: Champagnat | B29: 7849999 | C29: 7630879.2199999997 | D29: 7312881.21 | F29: 7298791.5800000001 | G29: 6573792.5800000001 | H29: 7250648.7000000002 | J29: =IF(B29=0,0,((C29/B29)*100)-100) -> -2.7913351326541544 | K29: =IF(C29=0,0,IF(D29=0,0,((C29/D29)*100)-100)) -> 4.348464044037172 | L29: =IF(F29=0,0,((C29/F29)*100)-100) -> 4.5498989299814951 | M29: =IF(G29=0,0,((C29/G29)*100)-100) -> 16.080316303499799 | N29: =IF(C29=0,0,IF(H29=0,0,((C29/H29)*100)-100)) -> 5.2440896771070982 | P29: 7850000 | Q29: =IF(C29=0,0,IF(P29=0,0,((C29/P29)*100)-100)) -> -2.7913475159235759 | R29: =IF(C29=0,0,(C29/$C$43)*100) -> 4.1486248257728047 | T29: 16.46 | U29: 16.552126610647626 | V29: 18.25397471040041 | W29: =U29-T29 -> 9.2126610647625284E-2
A30: Araucária Nova | B30: 7999999 | C30: 8017524.2000000002 | D30: 7707886.2300000004 | F30: 5570639.96 | G30: 3936109 | H30: 3825781.22 | J30: =IF(B30=0,0,((C30/B30)*100)-100) -> 0.21906502738313804 | K30: =IF(C30=0,0,IF(D30=0,0,((C30/D30)*100)-100)) -> 4.0171580218043772 | L30: =IF(F30=0,0,((C30/F30)*100)-100) -> 43.92465242000668 | M30: =IF(G30=0,0,((C30/G30)*100)-100) -> 103.6916203286037 | N30: =IF(C30=0,0,IF(H30=0,0,((C30/H30)*100)-100)) -> 109.565674014156 | P30: 8000000 | Q30: =IF(C30=0,0,IF(P30=0,0,((C30/P30)*100)-100)) -> 0.21905250000000365 | R30: =IF(C30=0,0,(C30/$C$43)*100) -> 4.3588293011082735 | T30: 15.5 | U30: 15.348231814504532 | V30: 17.47084570446323 | W30: =U30-T30 -> -0.15176818549546844
A31: Santa Candida | B31: 9599999 | C31: 9661818.3800000008 | D31: 9077205.4800000004 | F31: 9589538.3100000005 | G31: 7083805.8899999997 | H31: 6696898.25 | J31: =IF(B31=0,0,((C31/B31)*100)-100) -> 0.64395194207833129 | K31: =IF(C31=0,0,IF(D31=0,0,((C31/D31)*100)-100)) -> 6.440450216623276 | L31: =IF(F31=0,0,((C31/F31)*100)-100) -> 0.75373878974576769 | M31: =IF(G31=0,0,((C31/G31)*100)-100) -> 36.393042525901308 | N31: =IF(C31=0,0,IF(H31=0,0,((C31/H31)*100)-100)) -> 44.273035356330837 | P31: 9600000 | Q31: =IF(C31=0,0,IF(P31=0,0,((C31/P31)*100)-100)) -> 0.6439414583333587 | R31: =IF(C31=0,0,(C31/$C$43)*100) -> 5.2527708063207941 | T31: 15.95 | U31: 15.501139444933344 | V31: 17.661581096704488 | W31: =U31-T31 -> -0.44886055506665556
A32: Paranaguá Raia | B32: 9449999 | C32: 9309624.0299999993 | D32: 8999315.4600000009 | F32: 9042654.0999999996 | G32: 0 | H32: 6998530.2599999998 | J32: =IF(B32=0,0,((C32/B32)*100)-100) -> -1.4854495751798567 | K32: =IF(C32=0,0,IF(D32=0,0,((C32/D32)*100)-100)) -> 3.4481352651682471 | L32: =IF(F32=0,0,((C32/F32)*100)-100) -> 2.9523403974945666 | M32: =IF(G32=0,0,((C32/G32)*100)-100) -> 0 | N32: =IF(C32=0,0,IF(H32=0,0,((C32/H32)*100)-100)) -> 33.022558796509372 | P32: 9450000 | Q32: =IF(C32=0,0,IF(P32=0,0,((C32/P32)*100)-100)) -> -1.4854600000000033 | R32: =IF(C32=0,0,(C32/$C$43)*100) -> 5.0612958554294964 | T32: 17.062999999999999 | U32: 17.324470460919354 | V32: 19.170621866670594 | W32: =U32-T32 -> 0.26147046091935522
A33: Novo Mundo | B33: 7680000 | C33: 7753899.96 | D33: 7344709.4299999997 | F33: 6661630.5 | G33: 5219702.45 | H33: 0 | J33: =IF(B33=0,0,((C33/B33)*100)-100) -> 0.96223906249998947 | K33: =IF(C33=0,0,IF(D33=0,0,((C33/D33)*100)-100)) -> 5.5712282956849464 | L33: =IF(F33=0,0,((C33/F33)*100)-100) -> 16.396428171751637 | M33: =IF(G33=0,0,((C33/G33)*100)-100) -> 48.550612497078248 | N33: =IF(C33=0,0,IF(H33=0,0,((C33/H33)*100)-100)) -> 0 | P33: 7680000 | Q33: =IF(C33=0,0,IF(P33=0,0,((C33/P33)*100)-100)) -> 0.96223906249998947 | R33: =IF(C33=0,0,(C33/$C$43)*100) -> 4.2155066202993527 | T33: 15.8 | U33: 15.329724862738622 | V33: 17.372510965436806 | W33: =U33-T33 -> -0.47027513726137826
A34: Água Verde | B34: 8199999 | C34: 8092860.71 | D34: 7840053.4299999997 | F34: 7167952.7000000002 | G34: 0 | H34: 0 | J34: =IF(B34=0,0,((C34/B34)*100)-100) -> -1.3065646715322714 | K34: =IF(C34=0,0,IF(D34=0,0,((C34/D34)*100)-100)) -> 3.224560677515683 | L34: =IF(F34=0,0,((C34/F34)*100)-100) -> 12.903377696674795 | M34: =IF(G34=0,0,((C34/G34)*100)-100) -> 0 | N34: =IF(C34=0,0,IF(H34=0,0,((C34/H34)*100)-100)) -> 0 | P34: 8200000 | Q34: =IF(C34=0,0,IF(P34=0,0,((C34/P34)*100)-100)) -> -1.3065767073170775 | R34: =IF(C34=0,0,(C34/$C$43)*100) -> 4.3997869557457534 | T34: 16.27 | U34: 16.088240940452316 | V34: 17.738695169016445 | W34: =U34-T34 -> -0.18175905954768368
A35: Uvaranas | B35: 7150000 | C35: 6483242.8600000003 | D35: 6690612.7400000002 | F35: 6448122.2400000002 | G35: 4740013.09 | H35: 4100660.08 | J35: =IF(B35=0,0,((C35/B35)*100)-100) -> -9.3252746853146817 | K35: =IF(C35=0,0,IF(D35=0,0,((C35/D35)*100)-100)) -> -3.0994153758180261 | L35: =IF(F35=0,0,((C35/F35)*100)-100) -> 0.54466430214574757 | M35: =IF(G35=0,0,((C35/G35)*100)-100) -> 36.776897803883514 | N35: =IF(C35=0,0,IF(H35=0,0,((C35/H35)*100)-100)) -> 58.102420915610253 | P35: 7150000 | Q35: =IF(C35=0,0,IF(P35=0,0,((C35/P35)*100)-100)) -> -9.3252746853146817 | R35: =IF(C35=0,0,(C35/$C$43)*100) -> 3.5246976796613856 | T35: 15.71 | U35: 15.504160984029525 | V35: 17.375427418432384 | W35: =U35-T35 -> -0.20583901597047571
A36: Torres | B36: 7550000 | C36: 7928727.75 | D36: 7126513.0800000001 | F36: 7177908.21 | G36: 5196340.78 | H36: 5053086.07 | J36: =IF(B36=0,0,((C36/B36)*100)-100) -> 5.0162615894039817 | K36: =IF(C36=0,0,IF(D36=0,0,((C36/D36)*100)-100)) -> 11.256762753321141 | L36: =IF(F36=0,0,((C36/F36)*100)-100) -> 10.46014407030151 | M36: =IF(G36=0,0,((C36/G36)*100)-100) -> 52.582905657700138 | N36: =IF(C36=0,0,IF(H36=0,0,((C36/H36)*100)-100)) -> 56.908622575668886 | P36: 7550000 | Q36: =IF(C36=0,0,IF(P36=0,0,((C36/P36)*100)-100)) -> 5.0162615894039817 | R36: =IF(C36=0,0,(C36/$C$43)*100) -> 4.3105539783977544 | T36: 16 | U36: 15.451904626186716 | V36: 17.505443590240567 | W36: =U36-T36 -> -0.54809537381328433
A37: Total Hiper | B37: =SUM(B23:B36) -> 115259991 | C37: =SUM(C23:C36) -> 114034424.44999999 | D37: =SUM(D23:D36) -> 108851933.57000002 | F37: =SUM(F23:F36) -> 106739847.31999998 | G37: =SUM(G23:G36) -> 70079627.530000001 | H37: =SUM(H23:H36) -> 71071301.150000006 | I37: =SUM(B37:H37) -> 586037125.01999998 | J37: =IF(C37=0,0,((C37/B37)*100)-100) -> -1.0633061302252003 | K37: =IF(C37=0,0,IF(D37=0,0,((C37/D37)*100)-100)) -> 4.7610462304440659 | L37: =IF(F37=0,0,IF(C37=0,0,((C37/F37)*100)-100)) -> 6.8339774818407619 | M37: =IF(G37=0,0,IF(C37=0,0,((C37/G37)*100)-100)) -> 62.721219374608722 | N37: =IF(C37=0,0,IF(H37=0,0,((C37/H37)*100)-100)) -> 60.45073412870812 | P37: =SUM(P23:P36) -> 115260000 | Q37: =IF(C37=0,0,((C37/P37)*100)-100) -> -1.0633138556307529 | R37: =IF(C37=0,0,(C37/$C$43)*100) -> 61.996269450322053 | T37: 16.029401782245493 | U37: 15.746865688679327 | V37: 17.662830066574692 | W37: =U37-T37 -> -0.28253609356616671
A38: Total s/ 33,36,38 | B38: =B22+B37 -> 171999983 | C38: =C22+C37 -> 168962123.92999998 | D38: =D22+D37 -> 162083202.10000002 | E38: =E22+E37 -> 0 | F38: =F22+F37 -> 158206783.61999997 | G38: =G22+G37 -> 110855513.27000001 | H38: =H22+H37 -> 106080589.16000001 | I38: =SUM(B38:H38) -> 878188195.07999992 | J38: =IF(C38=0,0,((C38/B38)*100)-100) -> -1.766197308286948 | K38: =IF(C38=0,0,IF(D38=0,0,((C38/D38)*100)-100)) -> 4.2440683185391777 | L38: =IF(F38=0,0,IF(C38=0,0,((C38/F38)*100)-100)) -> 6.7982801141027238 | M38: =IF(G38=0,0,IF(C38=0,0,((C38/G38)*100)-100)) -> 52.416527555535595 | N38: =IF(C38=0,0,IF(H38=0,0,((C38/H38)*100)-100)) -> 59.277135683283717 | P38: =P22+P37 -> 172000000 | Q38: =IF(C38=0,0,((C38/P38)*100)-100) -> -1.7662070174418716 | R38: =IF(C38=0,0,(C38/$C$43)*100) -> 91.858413918298041 | T38: 15.959393191861535 | U38: 15.677129720489305 | V38: 17.711146854189526 | W38: =U38-T38 -> -0.28226347137223051
A39: S.J.P - Rua Joinvile | B39: 6499999 | C39: 6002247.2800000003 | D39: 5380022.9299999997 | F39: 0 | G39: 0 | H39: 0 | J39: =IF(B39=0,0,((C39/B39)*100)-100) -> -7.6577199473415192 | K39: =IF(C39=0,0,IF(D39=0,0,((C39/D39)*100)-100)) -> 11.565459071379848 | L39: =IF(F39=0,0,((C39/F39)*100)-100) -> 0 | M39: =IF(G39=0,0,((C39/G39)*100)-100) -> 0 | N39: =IF(C39=0,0,IF(H39=0,0,((C39/H39)*100)-100)) -> 0 | P39: 6500000 | Q39: =IF(P39=0,0,IF(C39=0,0,((C39/P39)*100)-100)) -> -7.6577341538461496 | R39: =IF(C39=0,0,(C39/$C$43)*100) -> 3.2631982971203803 | T39: 15 | U39: 15.386332767016556 | V39: 17.296914573302953 | W39: =U39-T39 -> 0.38633276701655639
A40: Castro | B40: 4350000 | C40: 4067608.14 | D40: 3933230.65 | F40: 0 | G40: 0 | H40: 0 | J40: =IF(B40=0,0,((C40/B40)*100)-100) -> -6.4917668965517237 | K40: =IF(C40=0,0,IF(D40=0,0,((C40/D40)*100)-100)) -> 3.4164660544379757 | L40: =IF(F40=0,0,((C40/F40)*100)-100) -> 0 | M40: =IF(G40=0,0,((C40/G40)*100)-100) -> 0 | N40: =IF(C40=0,0,IF(H40=0,0,((C40/H40)*100)-100)) -> 0 | P40: 4350000 | Q40: =IF(P40=0,0,IF(C40=0,0,((C40/P40)*100)-100)) -> -6.4917668965517237 | R40: =IF(C40=0,0,(C40/$C$43)*100) -> 2.2114070508273023 | T40: 16.5 | U40: 15.779885817614675 | V40: 17.867023112506601 | W40: =U40-T40 -> -0.72011418238532521
B41: 0 | C41: 0 | D41: 0 | F41: 0 | G41: 0 | H41: 0 | J41: =IF(B41=0,0,((C41/B41)*100)-100) -> 0 | K41: =IF(C41=0,0,IF(D41=0,0,((C41/D41)*100)-100)) -> 0 | L41: =IF(F41=0,0,((C41/F41)*100)-100) -> 0 | M41: =IF(G41=0,0,((C41/G41)*100)-100) -> 0 | N41: =IF(C41=0,0,IF(H41=0,0,((C41/H41)*100)-100)) -> 0 | P41: 0 | Q41: =IF(P41=0,0,IF(C41=0,0,((C41/P41)*100)-100)) -> 0 | R41: =IF(C41=0,0,(C41/$C$43)*100) -> 0 | T41: 0 | U41: 0 | W41: =U41-T41 -> 0
A42: Colombo | B42: 4950000 | C42: 4905579.25 | D42: 4473919.48 | F42: 0 | G42: 0 | H42: 0 | J42: =IF(B42=0,0,((C42/B42)*100)-100) -> -0.89738888888888368 | K42: =IF(C42=0,0,IF(D42=0,0,((C42/D42)*100)-100)) -> 9.6483580433146017 | L42: =IF(F42=0,0,((C42/F42)*100)-100) -> 0 | M42: =IF(G42=0,0,((C42/G42)*100)-100) -> 0 | N42: =IF(C42=0,0,IF(H42=0,0,((C42/H42)*100)-100)) -> 0 | P42: 4950000 | Q42: =IF(P42=0,0,IF(C42=0,0,((C42/P42)*100)-100)) -> -0.89738888888888368 | R42: =IF(C42=0,0,(C42/$C$43)*100) -> 2.6669807337542863 | T42: 14.64 | U42: 14.561528692049974 | V42: 16.995217981648139 | W42: =U42-T42 -> -7.847130795002677E-2
A43: Total Geral | B43: =B22+B37+SUM(B39:B42) -> 187799982 | C43: =C22+C37+SUM(C39:C42) -> 183937558.59999996 | D43: =D22+D37+SUM(D39:D42) -> 175870375.16000003 | F43: =F22+F37+SUM(F39:F42) -> 158206783.61999997 | G43: =G22+G37+SUM(G39:G42) -> 110855513.27000001 | H43: =H22+H37+SUM(H39:H42) -> 106080589.16000001 | J43: =IF(C43=0,0,((C43/B43)*100)-100) -> -2.0566686742281064 | K43: =IF(C43=0,0,IF(D43=0,0,((C43/D43)*100)-100)) -> 4.5870053058457074 | L43: =IF(F43=0,0,IF(C43=0,0,((C43/F43)*100)-100)) -> 16.264014975364944 | M43: =IF(G43=0,0,IF(C43=0,0,((C43/G43)*100)-100)) -> 65.92549452366984 | N43: =IF(C43=0,0,IF(H43=0,0,((C43/H43)*100)-100)) -> 73.394171409219155 | P43: =P22+P37+SUM(P39:P42) -> 187800000 | Q43: =IF(C43=0,0,((C43/P43)*100)-100) -> -2.0566780617678546 | R43: =R22+R37+SUM(R39:R42) -> 100 | T43: 15.9 | U43: 15.640159930338449 | V43: 17.68198300692244 | W43: =U43-T43 -> -0.25984006966155171
A45: Água Verde | B45: 0 | C45: 0 | D45: 0 | F45: 0 | G45: 0 | H45: 0 | J45: =IF(B45=0,0,((C45/B45)*100)-100) -> 0 | K45: =IF(C45=0,0,IF(D45=0,0,((C45/D45)*100)-100)) -> 0 | L45: =IF(F45=0,0,((C45/F45)*100)-100) -> 0 | M45: =IF(G45=0,0,((C45/G45)*100)-100) -> 0 | N45: =IF(C45=0,0,IF(H45=0,0,((C45/H45)*100)-100)) -> 0 | P45: =B45 -> 0 | Q45: =IF(C45=0,0,IF(P45=0,0,((C45/P45)*100)-100)) -> 0 | R45: =IF(C45=0,0,(C45/$C$43)*100) -> 0 | T45: 14.95 | U45: 0 | W45: =U45-T45 -> -14.95
A46: Total Geral | B46: =B43+B45 -> 187799982 | C46: =C43+C45 -> 183937558.59999996 | D46: =D43+D45 -> 175870375.16000003 | F46: =F43+F45 -> 158206783.61999997 | G46: =G43+G45 -> 110855513.27000001 | H46: =H43+H45 -> 106080589.16000001 | J46: =IF(C46=0,0,((C46/B46)*100)-100) -> -2.0566686742281064 | K46: =IF(C46=0,0,IF(D46=0,0,((C46/D46)*100)-100)) -> 4.5870053058457074 | L46: =IF(F46=0,0,IF(C46=0,0,((C46/F46)*100)-100)) -> 16.264014975364944 | M46: =IF(G46=0,0,IF(C46=0,0,((C46/G46)*100)-100)) -> 65.92549452366984 | N46: =IF(C46=0,0,IF(H46=0,0,((C46/H46)*100)-100)) -> 73.394171409219155 | P46: =P43+P45 -> 187800000 | Q46: =IF(C46=0,0,((C46/P46)*100)-100) -> -2.0566780617678546 | R46: =R25+R40+R45 -> 5.7485953170632129 | T46: 15.903933061561743 | U46: 15.640159930338449 | W46: =U46-T46 -> -0.26377313122329404