A2: Periodo: | B2: 40603 | C2: a | D2: 40633 | G2: Vendas Acumuladas por Filial | P2: =NOW() -> 40637.339772222222
A4: v.New | B4: Vendas 2010 | F4: Vendas de Anos Anteriores | J4: Percentuais ( % ) | P4: Meta Mensal | T4: Margem
A5: Lojas | B5: Previsao | C5: Realizada | D5: Mes Anterior | F5: Vendas 2009 | G5: Vendas 2008 | H5: Vendas 2007 | J5: % Prev | K5: % MA | L5: 2009 | M5: 2008 | N5: 2007 | P5: Previsao Mes | Q5: Final | R5: Part. | T5: Meta | U5: Coml | V5: Dif
A6: S. Felicidade | B6: 3353443 | C6: 3320029.65 | D6: 3071982.1 | F6: 3161277.72 | G6: 2661203.01 | H6: 2517156.68 | J6: =IF(B6=0,0,((C6/B6)*100)-100) -> -0.99638938249435682 | K6: =IF(C6=0,0,IF(D6=0,0,((C6/D6)*100)-100)) -> 8.0745115669782024 | L6: =IF(F6=0,0,((C6/F6)*100)-100) -> 5.0217647439086761 | M6: =IF(G6=0,0,((C6/G6)*100)-100) -> 24.756722336639797 | N6: =IF(C6=0,0,IF(H6=0,0,((C6/H6)*100)-100)) -> 31.896026829764111 | P6: 3353443 | Q6: =IF(C6=0,0,((C6/P6)*100)-100) -> -0.99638938249435682 | R6: =IF(C6=0,0,(C6/$C$41)*100) -> 2.4080600944470216 | T6: 17 | U6: 17.736666598745586 | V6: =U6-T6 -> 0.73666659874558604
A7: Lapa | B7: 2450000 | C7: 2454796.82 | D7: 2280257.61 | F7: 2746699.78 | G7: 2129043.18 | H7: 1971410.83 | J7: =IF(B7=0,0,((C7/B7)*100)-100) -> 0.19578857142856521 | K7: =IF(C7=0,0,IF(D7=0,0,((C7/D7)*100)-100)) -> 7.6543636663929391 | L7: =IF(F7=0,0,((C7/F7)*100)-100) -> -10.627406829296788 | M7: =IF(G7=0,0,((C7/G7)*100)-100) -> 15.300471266158141 | N7: =IF(C7=0,0,IF(H7=0,0,((C7/H7)*100)-100)) -> 24.519799863329325 | P7: 2450000 | Q7: =IF(C7=0,0,((C7/P7)*100)-100) -> 0.19578857142856521 | R7: =IF(C7=0,0,(C7/$C$41)*100) -> 1.7804956236512675 | T7: 15.86 | U7: 15.837840705692297 | V7: =U7-T7 -> -2.2159294307702027E-2
A8: Araucaria | B8: 1537942 | C8: 1489200.15 | D8: 1415296.14 | F8: 1549398.3 | G8: 1275162.2 | H8: 1275546.08 | J8: =IF(B8=0,0,((C8/B8)*100)-100) -> -3.1692905194084062 | K8: =IF(C8=0,0,IF(D8=0,0,((C8/D8)*100)-100)) -> 5.2218053813105172 | L8: =IF(F8=0,0,((C8/F8)*100)-100) -> -3.8852598457091432 | M8: =IF(G8=0,0,((C8/G8)*100)-100) -> 16.785154861083555 | N8: =IF(C8=0,0,IF(H8=0,0,((C8/H8)*100)-100)) -> 16.750007965215957 | P8: 1537942 | Q8: =IF(C8=0,0,((C8/P8)*100)-100) -> -3.1692905194084062 | R8: =IF(C8=0,0,(C8/$C$41)*100) -> 1.0801359722373318 | T8: 17.13 | U8: 17.132372032060296 | V8: =U8-T8 -> 2.3720320602969025E-3
A9: Hauer | B9: 4015413 | C9: 3937712.09 | D9: 3685694.09 | F9: 4025785.53 | G9: 3676353.33 | H9: 3856916.16 | J9: =IF(B9=0,0,((C9/B9)*100)-100) -> -1.9350664551815839 | K9: =IF(C9=0,0,IF(D9=0,0,((C9/D9)*100)-100)) -> 6.8377351414967933 | L9: =IF(F9=0,0,((C9/F9)*100)-100) -> -2.1877330360417773 | M9: =IF(G9=0,0,((C9/G9)*100)-100) -> 7.1091850140530397 | N9: =IF(C9=0,0,IF(H9=0,0,((C9/H9)*100)-100)) -> 2.0948324165801893 | P9: 4015413 | Q9: =IF(C9=0,0,((C9/P9)*100)-100) -> -1.9350664551815839 | R9: =IF(C9=0,0,(C9/$C$41)*100) -> 2.8560730918022315 | T9: 15.77 | U9: 16.645164629087954 | V9: =U9-T9 -> 0.87516462908795489
A10: Paranagua | B10: 2350000 | C10: 2391168.89 | D10: 2127985.23 | F10: 3439850.11 | G10: 1884362.02 | H10: 2133728.87 | J10: =IF(B10=0,0,((C10/B10)*100)-100) -> 1.7518676595744722 | K10: =IF(C10=0,0,IF(D10=0,0,((C10/D10)*100)-100)) -> 12.367739037361659 | L10: =IF(F10=0,0,((C10/F10)*100)-100) -> -30.486247553385397 | M10: =IF(G10=0,0,((C10/G10)*100)-100) -> 26.895408876899367 | N10: =IF(C10=0,0,IF(H10=0,0,((C10/H10)*100)-100)) -> 12.065263943305027 | P10: 2350000 | Q10: =IF(C10=0,0,((C10/P10)*100)-100) -> 1.7518676595744722 | R10: =IF(C10=0,0,(C10/$C$41)*100) -> 1.7343454698039158 | T10: 17.23 | U10: 17.650164811235896 | V10: =U10-T10 -> 0.420164811235896
A11: Centenario | B11: 0 | C11: 0 | D11: 0 | F11: 0 | G11: 0 | H11: 0 | J11: =IF(B11=0,0,((C11/B11)*100)-100) -> 0 | K11: =IF(C11=0,0,IF(D11=0,0,((C11/D11)*100)-100)) -> 0 | L11: =IF(F11=0,0,((C11/F11)*100)-100) -> 0 | M11: =IF(G11=0,0,((C11/G11)*100)-100) -> 0 | N11: =IF(C11=0,0,IF(H11=0,0,((C11/H11)*100)-100)) -> 0 | P11: 0 | Q11: =IF(C11=0,0,((C11/P11)*100)-100) -> 0 | R11: =IF(C11=0,0,(C11/$C$41)*100) -> 0 | T11: 0 | U11: 0 | V11: =U11-T11 -> 0
A12: Sitio Cercado | B12: 2850000 | C12: 3064982.36 | D12: 2824644.12 | F12: 2712080.43 | G12: 2161212.65 | H12: 2189338.33 | J12: =IF(B12=0,0,((C12/B12)*100)-100) -> 7.5432407017543852 | K12: =IF(C12=0,0,IF(D12=0,0,((C12/D12)*100)-100)) -> 8.5086201938954247 | L12: =IF(F12=0,0,((C12/F12)*100)-100) -> 13.012222133839884 | M12: =IF(G12=0,0,((C12/G12)*100)-100) -> 41.817713310164095 | N12: =IF(C12=0,0,IF(H12=0,0,((C12/H12)*100)-100)) -> 39.995829698920943 | P12: 2850000 | Q12: =IF(C12=0,0,((C12/P12)*100)-100) -> 7.5432407017543852 | R12: =IF(C12=0,0,(C12/$C$41)*100) -> 2.2230710232663302 | T12: 15.01 | U12: 16.06379228884045 | V12: =U12-T12 -> 1.0537922888404498
A13: Apucarana | B13: 2949999 | C13: 2383089.69 | D13: 2542866.67 | F13: 3270355.32 | G13: 2748567.37 | H13: 2787558.98 | J13: =IF(B13=0,0,((C13/B13)*100)-100) -> -19.217271260091948 | K13: =IF(C13=0,0,IF(D13=0,0,((C13/D13)*100)-100)) -> -6.2833408406741285 | L13: =IF(F13=0,0,((C13/F13)*100)-100) -> -27.130557483276775 | M13: =IF(G13=0,0,((C13/G13)*100)-100) -> -13.297024624140846 | N13: =IF(C13=0,0,IF(H13=0,0,((C13/H13)*100)-100)) -> -14.5098020491032 | P13: 2950000 | Q13: =IF(C13=0,0,((C13/P13)*100)-100) -> -19.21729864406781 | R13: =IF(C13=0,0,(C13/$C$41)*100) -> 1.7284855224040316 | T13: 16.54 | U13: 16.365702123447985 | V13: =U13-T13 -> -0.17429787655201423
A14: Ahú | B14: 2052982 | C14: 2188513.62 | D14: 2019505.84 | F14: 1971048 | G14: 1684490 | H14: 1813541.08 | J14: =IF(B14=0,0,((C14/B14)*100)-100) -> 6.6016954849092713 | K14: =IF(C14=0,0,IF(D14=0,0,((C14/D14)*100)-100)) -> 8.3687690648124118 | L14: =IF(F14=0,0,((C14/F14)*100)-100) -> 11.032994630267766 | M14: =IF(G14=0,0,((C14/G14)*100)-100) -> 29.921437348989912 | N14: =IF(C14=0,0,IF(H14=0,0,((C14/H14)*100)-100)) -> 20.676263920087209 | P14: 2052982 | Q14: =IF(C14=0,0,((C14/P14)*100)-100) -> 6.6016954849092713 | R14: =IF(C14=0,0,(C14/$C$41)*100) -> 1.5873570028134518 | T14: 16.75 | U14: 17.177851513667981 | V14: =U14-T14 -> 0.42785151366798146
A15: P.G. Centro | B15: 2100000 | C15: 2256065.06 | D15: 2006352.32 | F15: 2230608.11 | G15: 2077948.09 | H15: 2250502.86 | J15: =IF(B15=0,0,((C15/B15)*100)-100) -> 7.4316695238095321 | K15: =IF(C15=0,0,IF(D15=0,0,((C15/D15)*100)-100)) -> 12.446106175409909 | L15: =IF(F15=0,0,((C15/F15)*100)-100) -> 1.1412560496787592 | M15: =IF(G15=0,0,((C15/G15)*100)-100) -> 8.5717718771309563 | N15: =IF(C15=0,0,IF(H15=0,0,((C15/H15)*100)-100)) -> 0.24715365169542736 | P15: 2100000 | Q15: =IF(C15=0,0,((C15/P15)*100)-100) -> 7.4316695238095321 | R15: =IF(C15=0,0,(C15/$C$41)*100) -> 1.6363529287945444 | T15: 18.22 | U15: 18.702621102602421 | V15: =U15-T15 -> 0.48262110260242252
A16: Maringa | B16: 3472000 | C16: 3464363.73 | D16: 3291429.84 | F16: 3489969.41 | G16: 3198032.55 | H16: 3229909.56 | J16: =IF(B16=0,0,((C16/B16)*100)-100) -> -0.21993865207373631 | K16: =IF(C16=0,0,IF(D16=0,0,((C16/D16)*100)-100)) -> 5.2540658135371388 | L16: =IF(F16=0,0,((C16/F16)*100)-100) -> -0.73369353687257899 | M16: =IF(G16=0,0,((C16/G16)*100)-100) -> 8.3279696449618683 | N16: =IF(C16=0,0,IF(H16=0,0,((C16/H16)*100)-100)) -> 7.2588462817516159 | P16: 3472000 | Q16: =IF(C16=0,0,((C16/P16)*100)-100) -> -0.21993865207373631 | R16: =IF(C16=0,0,(C16/$C$41)*100) -> 2.5127474541869339 | T16: 16.94 | U16: 17.894241145400745 | V16: =U16-T16 -> 0.95424114540074356
A17: Araucaria Nova | B17: 4700000 | C17: 4743041.02 | D17: 4555252.62 | F17: 4306784.2 | G17: 3593682.9 | H17: 3304751.14 | J17: =IF(B17=0,0,((C17/B17)*100)-100) -> 0.91576638297871682 | K17: =IF(C17=0,0,IF(D17=0,0,((C17/D17)*100)-100)) -> 4.122458525692025 | L17: =IF(F17=0,0,((C17/F17)*100)-100) -> 10.12952587687117 | M17: =IF(G17=0,0,((C17/G17)*100)-100) -> 31.982736150704881 | N17: =IF(C17=0,0,IF(H17=0,0,((C17/H17)*100)-100)) -> 43.521881650670963 | P17: 4700000 | Q17: =IF(C17=0,0,((C17/P17)*100)-100) -> 0.91576638297871682 | R17: =IF(C17=0,0,(C17/$C$41)*100) -> 3.4401884954814479 | T17: 16.08 | U17: 16.402012268491831 | V17: =U17-T17 -> 0.32201226849183229
A18: Cristo Rei | B18: 2602317 | C18: 2643155.13 | D18: 2446720.74 | F18: 2608320.01 | G18: 2051510.35 | H18: 1747920.84 | J18: =IF(B18=0,0,((C18/B18)*100)-100) -> 1.5692988210121968 | K18: =IF(C18=0,0,IF(D18=0,0,((C18/D18)*100)-100)) -> 8.0284761063495864 | L18: =IF(F18=0,0,((C18/F18)*100)-100) -> 1.3355385791024901 | M18: =IF(G18=0,0,((C18/G18)*100)-100) -> 28.839473317792425 | N18: =IF(C18=0,0,IF(H18=0,0,((C18/H18)*100)-100)) -> 51.217095735296567 | P18: 2602317 | Q18: =IF(C18=0,0,((C18/P18)*100)-100) -> 1.5692988210121968 | R18: =IF(C18=0,0,(C18/$C$41)*100) -> 1.9171143221524936 | T18: 17.26 | U18: 18.52427367742127 | V18: =U18-T18 -> 1.2642736774212686
A19: Campo Largo | B19: 3900000 | C19: 3940395.67 | D19: 3721124.66 | F19: 3825441.48 | G19: 2797756.79 | H19: 0 | J19: =IF(B19=0,0,((C19/B19)*100)-100) -> 1.0357864102564065 | K19: =IF(C19=0,0,IF(D19=0,0,((C19/D19)*100)-100)) -> 5.8926004913793832 | L19: =IF(F19=0,0,((C19/F19)*100)-100) -> 3.0049914657170405 | M19: =IF(G19=0,0,((C19/G19)*100)-100) -> 40.841251251149686 | N19: =IF(C19=0,0,IF(H19=0,0,((C19/H19)*100)-100)) -> 0 | P19: 3900000 | Q19: =IF(C19=0,0,((C19/P19)*100)-100) -> 1.0357864102564065 | R19: =IF(C19=0,0,(C19/$C$41)*100) -> 2.8580195268011646 | T19: 16.5 | U19: 17.285710802742813 | V19: =U19-T19 -> 0.78571080274281258
A20: Brasilia | B20: 2700000 | C20: 2814956.05 | D20: 2661205.62 | F20: 2702264.88 | G20: 2463818.6 | H20: 1082040.1 | J20: =IF(B20=0,0,((C20/B20)*100)-100) -> 4.2576314814814822 | K20: =IF(C20=0,0,IF(D20=0,0,((C20/D20)*100)-100)) -> 5.7774727681508438 | L20: =IF(F20=0,0,((C20/F20)*100)-100) -> 4.1702488469597938 | M20: =IF(G20=0,0,((C20/G20)*100)-100) -> 14.251757414283659 | N20: =IF(C20=0,0,IF(H20=0,0,((C20/H20)*100)-100)) -> 160.15265515575618 | P20: 2700000 | Q20: =IF(C20=0,0,((C20/P20)*100)-100) -> 4.2576314814814822 | R20: =IF(C20=0,0,(C20/$C$41)*100) -> 2.0417237332887117 | T20: 16.15 | U20: 16.660132935290413 | V20: =U20-T20 -> 0.51013293529041448
A21: Total Super | B21: =SUM(B6:B20) -> 41034096 | C21: =SUM(C6:C20) -> 41091469.93 | D21: =SUM(D6:D20) -> 38650317.600000001 | F21: =SUM(F6:F20) -> 42039883.280000001 | G21: =SUM(G6:G20) -> 34403143.039999999 | H21: =SUM(H6:H20) -> 30160321.510000002 | I21: =SUM(B21:H21) -> 227379231.35999998 | J21: =IF(C21=0,0,((C21/B21)*100)-100) -> 0.13982013884259459 | K21: =IF(C21=0,0,IF(D21=0,0,((C21/D21)*100)-100)) -> 6.3159955249630286 | L21: =IF(F21=0,0,IF(C21=0,0,((C21/F21)*100)-100)) -> -2.2559847364067309 | M21: =IF(G21=0,0,IF(C21=0,0,((C21/G21)*100)-100)) -> 19.44103444915946 | N21: =IF(C21=0,0,IF(H21=0,0,((C21/H21)*100)-100)) -> 36.243474448293426 | P21: =SUM(P6:P20) -> 41034097 | Q21: =IF(C21=0,0,((C21/P21)*100)-100) -> 0.13981769843746861 | R21: =IF(C21=0,0,(C21/$C$41)*100) -> 29.804170261130881 | T21: 16.510846098571296 | U21: 17.103586685929002 | V21: =U21-T21 -> 0.59274058735770652
A22: Pinheirinho | B22: 4890000 | C22: 4917121.2 | D22: 4585412.42 | F22: 5723971.3499999996 | G22: 4494942.1 | H22: 4597596.78 | J22: =IF(B22=0,0,((C22/B22)*100)-100) -> 0.55462576687116893 | K22: =IF(C22=0,0,IF(D22=0,0,((C22/D22)*100)-100)) -> 7.2340009930884435 | L22: =IF(F22=0,0,((C22/F22)*100)-100) -> -14.095985124034556 | M22: =IF(G22=0,0,((C22/G22)*100)-100) -> 9.3923145305920883 | N22: =IF(C22=0,0,IF(H22=0,0,((C22/H22)*100)-100)) -> 6.9498138982079212 | P22: 4890000 | Q22: =IF(C22=0,0,IF(P22=0,0,((C22/P22)*100)-100)) -> 0.55462576687116893 | R22: =IF(C22=0,0,(C22/$C$41)*100) -> 3.5664510831339875 | T22: 15.84 | U22: 16.744107507457819 | V22: =U22-T22 -> 0.90410750745781954
A23: Londrina | B23: 4300000 | C23: 4439917.09 | D23: 4163796.81 | F23: 3997406.1 | G23: 3346099.27 | H23: 3968847.68 | J23: =IF(B23=0,0,((C23/B23)*100)-100) -> 3.2538858139534881 | K23: =IF(C23=0,0,IF(D23=0,0,((C23/D23)*100)-100)) -> 6.6314542375567953 | L23: =IF(F23=0,0,((C23/F23)*100)-100) -> 11.069953337990853 | M23: =IF(G23=0,0,((C23/G23)*100)-100) -> 32.689341580711698 | N23: =IF(C23=0,0,IF(H23=0,0,((C23/H23)*100)-100)) -> 11.86917332136062 | P23: 4300000 | Q23: =IF(C23=0,0,IF(P23=0,0,((C23/P23)*100)-100)) -> 3.2538858139534881 | R23: =IF(C23=0,0,(C23/$C$41)*100) -> 3.2203288205821736 | T23: 15.93 | U23: 15.965587771820308 | V23: =U23-T23 -> 3.5587771820308589E-2
A24: São Bráz | B24: 5540832 | C24: 5506418.5 | D24: 5090289.93 | F24: 5334827.78 | G24: 4874129.15 | H24: 4963635.14 | J24: =IF(B24=0,0,((C24/B24)*100)-100) -> -0.62108903500413248 | K24: =IF(C24=0,0,IF(D24=0,0,((C24/D24)*100)-100)) -> 8.1749482980825121 | L24: =IF(F24=0,0,((C24/F24)*100)-100) -> 3.2164247296470307 | M24: =IF(G24=0,0,((C24/G24)*100)-100) -> 12.972355277044727 | N24: =IF(C24=0,0,IF(H24=0,0,((C24/H24)*100)-100)) -> 10.935198593182662 | P24: 5540832 | Q24: =IF(C24=0,0,IF(P24=0,0,((C24/P24)*100)-100)) -> -0.62108903500413248 | R24: =IF(C24=0,0,(C24/$C$41)*100) -> 3.9938759743229491 | T24: 15.41 | U24: 16.013063663795261 | V24: =U24-T24 -> 0.60306366379526111
A25: S.J. Pinhais | B25: 6202340 | C25: 6539051.54 | D25: 6051322.9199999999 | F25: 6293264.6699999999 | G25: 5428196.1399999997 | H25: 5543145.1500000004 | J25: =IF(B25=0,0,((C25/B25)*100)-100) -> 5.428782362785654 | K25: =IF(C25=0,0,IF(D25=0,0,((C25/D25)*100)-100)) -> 8.0598676760089489 | L25: =IF(F25=0,0,((C25/F25)*100)-100) -> 3.9055543170092051 | M25: =IF(G25=0,0,((C25/G25)*100)-100) -> 20.464540546244891 | N25: =IF(C25=0,0,IF(H25=0,0,((C25/H25)*100)-100)) -> 17.96644978708521 | P25: 6202340 | Q25: =IF(C25=0,0,IF(P25=0,0,((C25/P25)*100)-100)) -> 5.428782362785654 | R25: =IF(C25=0,0,(C25/$C$41)*100) -> 4.7428579648396649 | T25: 15.37 | U25: 16.896976162998708 | V25: =U25-T25 -> 1.5269761629987091
A26: P.G. Nova | B26: 5950000 | C26: 6292834.6699999999 | D26: 5873708.3300000001 | F26: 5350964.02 | G26: 5382449.3600000003 | H26: 4979333.35 | J26: =IF(B26=0,0,((C26/B26)*100)-100) -> 5.761927226890748 | K26: =IF(C26=0,0,IF(D26=0,0,((C26/D26)*100)-100)) -> 7.1356341931265064 | L26: =IF(F26=0,0,((C26/F26)*100)-100) -> 17.601887182937929 | M26: =IF(G26=0,0,((C26/G26)*100)-100) -> 16.913959595525114 | N26: =IF(C26=0,0,IF(H26=0,0,((C26/H26)*100)-100)) -> 26.379059759073982 | P26: 5950000 | Q26: =IF(C26=0,0,IF(P26=0,0,((C26/P26)*100)-100)) -> 5.761927226890748 | R26: =IF(C26=0,0,(C26/$C$41)*100) -> 4.5642737105614986 | T26: 15.04 | U26: 16.017332773816541 | V26: =U26-T26 -> 0.97733277381654204
A27: Nilo Pecanha | B27: 13640000 | C27: 14522615.050000001 | D27: 13352611.300000001 | F27: 14039862.640000001 | G27: 12109675.869999999 | H27: 11932840.369999999 | J27: =IF(B27=0,0,((C27/B27)*100)-100) -> 6.4707848240469303 | K27: =IF(C27=0,0,IF(D27=0,0,((C27/D27)*100)-100)) -> 8.7623590900155932 | L27: =IF(F27=0,0,((C27/F27)*100)-100) -> 3.4384411185379093 | M27: =IF(G27=0,0,((C27/G27)*100)-100) -> 19.925712346915205 | N27: =IF(C27=0,0,IF(H27=0,0,((C27/H27)*100)-100)) -> 21.702919000834669 | P27: 13640000 | Q27: =IF(C27=0,0,IF(P27=0,0,((C27/P27)*100)-100)) -> 6.4707848240469303 | R27: =IF(C27=0,0,(C27/$C$41)*100) -> 10.533438991703205 | T27: 16.27 | U27: 16.996650475838372 | V27: =U27-T27 -> 0.7266504758383725
A28: Champagnat | B28: 7000000 | C28: 6473701.2699999996 | D28: 5928589.2300000004 | F28: 7244937.2300000004 | G28: 6845734.5099999998 | H28: 6759607.7400000002 | J28: =IF(B28=0,0,((C28/B28)*100)-100) -> -7.5185532857142903 | K28: =IF(C28=0,0,IF(D28=0,0,((C28/D28)*100)-100)) -> 9.1946333073913848 | L28: =IF(F28=0,0,((C28/F28)*100)-100) -> -10.645171041737242 | M28: =IF(G28=0,0,((C28/G28)*100)-100) -> -5.4345262653196329 | N28: =IF(C28=0,0,IF(H28=0,0,((C28/H28)*100)-100)) -> -4.2296310821136558 | P28: 7000000 | Q28: =IF(C28=0,0,IF(P28=0,0,((C28/P28)*100)-100)) -> -7.5185532857142903 | R28: =IF(C28=0,0,(C28/$C$41)*100) -> 4.6954585756961551 | T28: 16.79 | U28: 17.126192942171397 | V28: =U28-T28 -> 0.33619294217139739
A29: Santa Candida | B29: 7900000 | C29: 8418758.7400000002 | D29: 7694802.1500000004 | F29: 7717844.2300000004 | G29: 6132548.9900000002 | H29: 5710837.54 | J29: =IF(B29=0,0,((C29/B29)*100)-100) -> 6.5665663291139253 | K29: =IF(C29=0,0,IF(D29=0,0,((C29/D29)*100)-100)) -> 9.4083847237059786 | L29: =IF(F29=0,0,((C29/F29)*100)-100) -> 9.0817395261163512 | M29: =IF(G29=0,0,((C29/G29)*100)-100) -> 37.279926401370659 | N29: =IF(C29=0,0,IF(H29=0,0,((C29/H29)*100)-100)) -> 47.417234005224401 | P29: 7900000 | Q29: =IF(C29=0,0,IF(P29=0,0,((C29/P29)*100)-100)) -> 6.5665663291139253 | R29: =IF(C29=0,0,(C29/$C$41)*100) -> 6.1062337098619262 | T29: 15.89 | U29: 16.306249084885881 | V29: =U29-T29 -> 0.41624908488588019
A30: Paranaguá Raia | B30: 7890000 | C30: 8017513.1500000004 | D30: 7437288.8600000003 | F30: 5276472.67 | G30: 6376053.5999999996 | H30: 6615835.3399999999 | J30: =IF(B30=0,0,((C30/B30)*100)-100) -> 1.616136248415728 | K30: =IF(C30=0,0,IF(D30=0,0,((C30/D30)*100)-100)) -> 7.8015564666396529 | L30: =IF(F30=0,0,((C30/F30)*100)-100) -> 51.94834980543925 | M30: =IF(G30=0,0,((C30/G30)*100)-100) -> 25.744130350472602 | N30: =IF(C30=0,0,IF(H30=0,0,((C30/H30)*100)-100)) -> 21.186709432221164 | P30: 7890000 | Q30: =IF(C30=0,0,IF(P30=0,0,((C30/P30)*100)-100)) -> 1.616136248415728 | R30: =IF(C30=0,0,(C30/$C$41)*100) -> 5.8152051362611301 | T30: 17.71 | U30: 18.384308356263812 | V30: =U30-T30 -> 0.67430835626381125
A31: Novo Mundo | B31: 5750000 | C31: 5759257.3899999997 | D31: 5342595.14 | F31: 5779756.5199999996 | G31: 0 | H31: 0 | J31: =IF(B31=0,0,((C31/B31)*100)-100) -> 0.16099808695651063 | K31: =IF(C31=0,0,IF(D31=0,0,((C31/D31)*100)-100)) -> 7.7988737510811887 | L31: =IF(F31=0,0,((C31/F31)*100)-100) -> -0.35467116874328042 | M31: =IF(G31=0,0,((C31/G31)*100)-100) -> 0 | N31: =IF(C31=0,0,IF(H31=0,0,((C31/H31)*100)-100)) -> 0 | P31: 5750000 | Q31: =IF(C31=0,0,IF(P31=0,0,((C31/P31)*100)-100)) -> 0.16099808695651063 | R31: =IF(C31=0,0,(C31/$C$41)*100) -> 4.1772632646543109 | T31: 16.01 | U31: 16.390917892280555 | V31: =U31-T31 -> 0.38091789228055362
A32: Uvaranas | B32: 5500000 | C32: 5753717.1200000001 | D32: 5311315.86 | F32: 4991975.82 | G32: 0 | H32: 0 | J32: =IF(B32=0,0,((C32/B32)*100)-100) -> 4.6130385454545433 | K32: =IF(C32=0,0,IF(D32=0,0,((C32/D32)*100)-100)) -> 8.3294097293622542 | L32: =IF(F32=0,0,((C32/F32)*100)-100) -> 15.259314697561962 | M32: =IF(G32=0,0,((C32/G32)*100)-100) -> 0 | N32: =IF(C32=0,0,IF(H32=0,0,((C32/H32)*100)-100)) -> 0 | P32: 5500000 | Q32: =IF(C32=0,0,IF(P32=0,0,((C32/P32)*100)-100)) -> 4.6130385454545433 | R32: =IF(C32=0,0,(C32/$C$41)*100) -> 4.1732448357527918 | T32: 15.38 | U32: 15.611940790026187 | V32: =U32-T32 -> 0.23194079002618651
A33: Torres | B33: 5900000 | C33: 6370556.29 | D33: 5830916.4500000002 | F33: 5595286.8799999999 | G33: 4864526.13 | H33: 0 | J33: =IF(B33=0,0,((C33/B33)*100)-100) -> 7.975530338983063 | K33: =IF(C33=0,0,IF(D33=0,0,((C33/D33)*100)-100)) -> 9.254803162202748 | L33: =IF(F33=0,0,((C33/F33)*100)-100) -> 13.855758008961999 | M33: =IF(G33=0,0,((C33/G33)*100)-100) -> 30.959442292069696 | N33: =IF(C33=0,0,IF(H33=0,0,((C33/H33)*100)-100)) -> 0 | P33: 5900000 | Q33: =IF(C33=0,0,IF(P33=0,0,((C33/P33)*100)-100)) -> 7.975530338983063 | R33: =IF(C33=0,0,(C33/$C$41)*100) -> 4.6206461985595428 | T33: 16.25 | U33: 16.445529594402185 | V33: =U33-T33 -> 0.19552959440218487
A34: Total Hiper | B34: =SUM(B22:B33) -> 80463172 | C34: =SUM(C22:C33) -> 83011462.010000005 | D34: =SUM(D22:D33) -> 76662649.400000006 | F34: =SUM(F22:F33) -> 77346569.909999996 | G34: =SUM(G22:G33) -> 59854355.120000005 | H34: =SUM(H22:H33) -> 55071679.090000004 | I34: =SUM(B34:H34) -> 432409887.52999997 | J34: =IF(C34=0,0,((C34/B34)*100)-100) -> 3.1670265373082742 | K34: =IF(C34=0,0,IF(D34=0,0,((C34/D34)*100)-100)) -> 8.2814938691643931 | L34: =IF(F34=0,0,IF(C34=0,0,((C34/F34)*100)-100)) -> 7.3240379070353754 | M34: =IF(G34=0,0,IF(C34=0,0,((C34/G34)*100)-100)) -> 38.689092620867939 | N34: =IF(C34=0,0,IF(H34=0,0,((C34/H34)*100)-100)) -> 50.733486579081529 | P34: =SUM(P22:P33) -> 80463172 | Q34: =IF(C34=0,0,((C34/P34)*100)-100) -> 3.1670265373082742 | R34: =IF(C34=0,0,(C34/$C$41)*100) -> 60.209278265929335 | T34: 16.074397202735184 | U34: 16.673020465936013 | V34: =U34-T34 -> 0.59862326320082815
A35: Total s/ 29,30,37 | B35: =B21+B34 -> 121497268 | C35: =C21+C34 -> 124102931.94 | D35: =D21+D34 -> 115312967 | E35: =E21+E34 -> 0 | F35: =F21+F34 -> 119386453.19 | G35: =G21+G34 -> 94257498.159999996 | H35: =H21+H34 -> 85232000.600000009 | I35: =SUM(B35:H35) -> 659789118.88999999 | J35: =IF(C35=0,0,((C35/B35)*100)-100) -> 2.1446275977168483 | K35: =IF(C35=0,0,IF(D35=0,0,((C35/D35)*100)-100)) -> 7.6227029523921601 | L35: =IF(F35=0,0,IF(C35=0,0,((C35/F35)*100)-100)) -> 3.9505979313196207 | M35: =IF(G35=0,0,IF(C35=0,0,((C35/G35)*100)-100)) -> 31.6637236958465 | N35: =IF(C35=0,0,IF(H35=0,0,((C35/H35)*100)-100)) -> 45.606029503430392 | P35: =P21+P34 -> 121497269 | Q35: =IF(C35=0,0,((C35/P35)*100)-100) -> 2.1446267570014186 | R35: =IF(C35=0,0,(C35/$C$41)*100) -> 90.01344852706022 | T35: 16.221802047186774 | U35: 16.815584373211546 | V35: =U35-T35 -> 0.59378232602477254
A36: Centenario | B36: 0 | C36: 0 | D36: 0 | F36: 1404634.28 | G36: 1231800.4 | H36: 1261617.35 | J36: =IF(B36=0,0,((C36/B36)*100)-100) -> 0 | K36: =IF(C36=0,0,IF(D36=0,0,((C36/D36)*100)-100)) -> 0 | L36: =IF(F36=0,0,((C36/F36)*100)-100) -> -100 | M36: =IF(G36=0,0,((C36/G36)*100)-100) -> -100 | N36: =IF(C36=0,0,IF(H36=0,0,((C36/H36)*100)-100)) -> 0 | P36: 0 | Q36: =IF(P36=0,0,IF(C36=0,0,((C36/P36)*100)-100)) -> 0 | R36: =IF(C36=0,0,(C36/$C$41)*100) -> 0 | T36: 0 | U36: 0 | V36: =U36-T36 -> 0
A37: Cajuru | B37: 4200000 | C37: 4459876.85 | D37: 4032632.03 | F37: 0 | G37: 0 | H37: 0 | J37: =IF(B37=0,0,((C37/B37)*100)-100) -> 6.1875440476190278 | K37: =IF(C37=0,0,IF(D37=0,0,((C37/D37)*100)-100)) -> 10.594688948101222 | L37: =IF(F37=0,0,((C37/F37)*100)-100) -> 0 | M37: =IF(G37=0,0,((C37/G37)*100)-100) -> 0 | N37: =IF(C37=0,0,IF(H37=0,0,((C37/H37)*100)-100)) -> 0 | P37: 4200000 | Q37: =IF(P37=0,0,IF(C37=0,0,((C37/P37)*100)-100)) -> 6.1875440476190278 | R37: =IF(C37=0,0,(C37/$C$41)*100) -> 3.2348058905537442 | T37: 16.27 | U37: 16.718521947528664 | V37: =U37-T37 -> 0.44852194752866481
A38: Água Verde | B38: 6500000 | C38: 6441083.0300000003 | D38: 5870207.71 | F38: 0 | G38: 0 | H38: 0 | J38: =IF(B38=0,0,((C38/B38)*100)-100) -> -0.90641492307690896 | K38: =IF(C38=0,0,IF(D38=0,0,((C38/D38)*100)-100)) -> 9.724959459739452 | L38: =IF(F38=0,0,((C38/F38)*100)-100) -> 0 | M38: =IF(G38=0,0,((C38/G38)*100)-100) -> 0 | N38: =IF(C38=0,0,IF(H38=0,0,((C38/H38)*100)-100)) -> 0 | P38: 6500000 | Q38: =IF(P38=0,0,IF(C38=0,0,((C38/P38)*100)-100)) -> -0.90641492307690896 | R38: =IF(C38=0,0,(C38/$C$41)*100) -> 4.6718001477977493 | T38: 15.1 | U38: 16.456998381528393 | V38: =U38-T38 -> 1.3569983815283937
A39: Fazenda | B39: 2900000 | C39: 2867652.9 | D39: 2665615.13 | F39: 1745185.89 | G39: 0 | H39: 0 | J39: =IF(B39=0,0,((C39/B39)*100)-100) -> -1.1154172413793191 | K39: =IF(C39=0,0,IF(D39=0,0,((C39/D39)*100)-100)) -> 7.5794051334034975 | L39: =IF(F39=0,0,((C39/F39)*100)-100) -> 64.317905412356964 | M39: =IF(G39=0,0,((C39/G39)*100)-100) -> 0 | N39: =IF(C39=0,0,IF(H39=0,0,((C39/H39)*100)-100)) -> 0 | P39: 2900000 | Q39: =IF(P39=0,0,IF(C39=0,0,((C39/P39)*100)-100)) -> -1.1154172413793191 | R39: =IF(C39=0,0,(C39/$C$41)*100) -> 2.0799454345882951 | T39: 16 | U39: 16.668900200578669 | V39: =U39-T39 -> 0.66890020057866906
A40: Total Lojas Novas | B40: =SUM(B36:B39) -> 13600000 | C40: =SUM(C36:C39) -> 13768612.779999999 | D40: =SUM(D36:D39) -> 12568454.870000001 | F40: =SUM(F36:F39) -> 3149820.17 | G40: =SUM(G36:G39) -> 1231800.4 | H40: =SUM(H36:H39) -> 1261617.35 | J40: =IF(C40=0,0,((C40/B40)*100)-100) -> 1.2397998529411751 | K40: =IF(C40=0,0,IF(D40=0,0,((C40/D40)*100)-100)) -> 9.5489694032692114 | L40: =IF(F40=0,0,IF(C40=0,0,((C40/F40)*100)-100)) -> 337.12377332322438 | M40: =IF(G40=0,0,IF(C40=0,0,((C40/G40)*100)-100)) -> 1017.7632983395688 | N40: =IF(C40=0,0,IF(H40=0,0,((C40/H40)*100)-100)) -> 991.34618194653058 | P40: =SUM(P36:P39) -> 13600000 | Q40: =IF(P40=0,0,IF(C40=0,0,((C40/P40)*100)-100)) -> 1.2397998529411751 | R40: =IF(C40=0,0,(C40/$C$41)*100) -> 9.9865514729397891 | T40: 8.436323529411764 | U40: 8.887109468118835 | V40: =U40-T40 -> 0.45078593870707095
A41: Total sem 29 | B41: =B21+B34+B40 -> 135097268 | C41: =C21+C34+C40 -> 137871544.72 | D41: =D21+D34+D40 -> 127881421.87 | F41: =F21+F34+F40 -> 122536273.36 | G41: =G21+G34+G40 -> 95489298.560000002 | H41: =H21+H34+H40 -> 86493617.950000003 | J41: =IF(C41=0,0,((C41/B41)*100)-100) -> 2.0535402092661172 | K41: =IF(C41=0,0,IF(D41=0,0,((C41/D41)*100)-100)) -> 7.8120204670195363 | L41: =IF(F41=0,0,IF(C41=0,0,((C41/F41)*100)-100)) -> 12.514883095021517 | M41: =IF(G41=0,0,IF(C41=0,0,((C41/G41)*100)-100)) -> 44.384288919422119 | N41: =IF(C41=0,0,IF(H41=0,0,((C41/H41)*100)-100)) -> 59.40082978110641 | P41: =P21+P34+P40 -> 135097269 | Q41: =IF(C41=0,0,((C41/P41)*100)-100) -> 2.0535394538582494 | R41: =R21+R34+R40 -> 100 | T41: 15.438051869191019 | U41: 16.023803145795348 | V41: =U41-T41 -> 0.58575127660432891
A43: Água Verde | B43: 0 | C43: 0 | D43: 0 | F43: 0 | G43: 0 | H43: 0 | J43: =IF(B43=0,0,((C43/B43)*100)-100) -> 0 | K43: =IF(C43=0,0,IF(D43=0,0,((C43/D43)*100)-100)) -> 0 | L43: =IF(F43=0,0,((C43/F43)*100)-100) -> 0 | M43: =IF(G43=0,0,((C43/G43)*100)-100) -> 0 | N43: =IF(C43=0,0,IF(H43=0,0,((C43/H43)*100)-100)) -> 0 | P43: =C43 -> 0 | Q43: =IF(C43=0,0,IF(P43=0,0,((C43/P43)*100)-100)) -> 0 | R43: =IF(C43=0,0,(C43/$C$41)*100) -> 0 | T43: 14.9 | U43: 0 | V43: =U43-T43 -> -14.9
A44: Total Geral | B44: =B41+B43 -> 135097268 | C44: =C41+C43 -> 137871544.72 | D44: =D41+D43 -> 127881421.87 | F44: =F41+F43 -> 122536273.36 | G44: =G41+G43 -> 95489298.560000002 | H44: =H41+H43 -> 86493617.950000003 | I44: =SUM(B44:H44) -> 705369424.46000004 | J44: =IF(C44=0,0,((C44/B44)*100)-100) -> 2.0535402092661172 | K44: =IF(C44=0,0,IF(D44=0,0,((C44/D44)*100)-100)) -> 7.8120204670195363 | L44: =IF(F44=0,0,IF(C44=0,0,((C44/F44)*100)-100)) -> 12.514883095021517 | M44: =IF(G44=0,0,IF(C44=0,0,((C44/G44)*100)-100)) -> 44.384288919422119 | N44: =IF(C44=0,0,IF(H44=0,0,((C44/H44)*100)-100)) -> 59.40082978110641 | P44: =P41+P43 -> 135097269 | Q44: =IF(C44=0,0,((C44/P44)*100)-100) -> 2.0535394538582494 | R44: =IF(C44=0,0,(C44/$C$41)*100) -> 100 | T44: 15.438051869191019 | U44: 16.023803145795348 | V44: =U44-T44 -> 0.58575127660432891
B46: =B38-P38 -> 0