A2: Periodo: | B2: 40695 | C2: a | D2: 40724 | G2: Vendas Acumuladas por Filial | P2: =NOW() -> 40736.716854282407
A4: v.New | B4: Vendas 2011 | F4: Vendas de Anos Anteriores | J4: Percentuais ( % ) | P4: Meta Mensal | T4: Margem
A5: Lojas | B5: Previsao | C5: Realizada | D5: Mes Anterior | F5: Vendas 2010 | G5: Vendas 2009 | H5: Vendas 2008 | J5: % Prev | K5: % MA | L5: 2010 | M5: 2009 | N5: 2008 | P5: Previsao Mes | Q5: Final | R5: Part. | T5: Meta | U5: Coml | V5: Dif
A6: S. Felicidade | B6: 3250000 | C6: 3363652.95 | D6: 3251365.77 | F6: 2902003.03 | G6: 2543393.38 | H6: 2115454.71 | J6: =IF(B6=0,0,((C6/B6)*100)-100) -> 3.4970138461538625 | K6: =IF(C6=0,0,IF(D6=0,0,((C6/D6)*100)-100)) -> 3.4535388493063977 | L6: =IF(F6=0,0,((C6/F6)*100)-100) -> 15.90797512020518 | M6: =IF(G6=0,0,((C6/G6)*100)-100) -> 32.25059782140346 | N6: =IF(C6=0,0,IF(H6=0,0,((C6/H6)*100)-100)) -> 59.003779854024884 | P6: 3250000 | Q6: =IF(C6=0,0,((C6/P6)*100)-100) -> 3.4970138461538625 | R6: =IF(C6=0,0,(C6/$C$42)*100) -> 2.4504036953153014 | T6: 17.54 | U6: 16.482148968430291 | V6: =U6-T6 -> -1.0578510315697081
A7: Lapa | B7: 2300000 | C7: 2395775.95 | D7: 2306031.65 | F7: 2257931.81 | G7: 1965895.25 | H7: 1695690.02 | J7: =IF(B7=0,0,((C7/B7)*100)-100) -> 4.1641717391304383 | K7: =IF(C7=0,0,IF(D7=0,0,((C7/D7)*100)-100)) -> 3.8917202198851157 | L7: =IF(F7=0,0,((C7/F7)*100)-100) -> 6.1048849832183549 | M7: =IF(G7=0,0,((C7/G7)*100)-100) -> 21.866917883849624 | N7: =IF(C7=0,0,IF(H7=0,0,((C7/H7)*100)-100)) -> 41.286197461963013 | P7: 2300000 | Q7: =IF(C7=0,0,((C7/P7)*100)-100) -> 4.1641717391304383 | R7: =IF(C7=0,0,(C7/$C$42)*100) -> 1.7453103302549473 | T7: 15.99 | U7: 15.451387263487637 | V7: =U7-T7 -> -0.53861273651236274
A8: Araucaria | B8: 1450000 | C8: 1459348.85 | D8: 1432325.24 | F8: 1338266.12 | G8: 1257715.97 | H8: 1056588.32 | J8: =IF(B8=0,0,((C8/B8)*100)-100) -> 0.64474827586207084 | K8: =IF(C8=0,0,IF(D8=0,0,((C8/D8)*100)-100)) -> 1.8866950916818439 | L8: =IF(F8=0,0,((C8/F8)*100)-100) -> 9.0477318517186944 | M8: =IF(G8=0,0,((C8/G8)*100)-100) -> 16.031670489164583 | N8: =IF(C8=0,0,IF(H8=0,0,((C8/H8)*100)-100)) -> 38.118964820659784 | P8: 1450000 | Q8: =IF(C8=0,0,((C8/P8)*100)-100) -> 0.64474827586207084 | R8: =IF(C8=0,0,(C8/$C$42)*100) -> 1.0631280539195149 | T8: 16.8 | U8: 16.579105811472012 | V8: =U8-T8 -> -0.22089418852798914
A9: Hauer | B9: 3950000 | C9: 3936150.08 | D9: 3943610.71 | F9: 3711344.01 | G9: 3567994.83 | H9: 3666692.99 | J9: =IF(B9=0,0,((C9/B9)*100)-100) -> -0.3506308860759475 | K9: =IF(C9=0,0,IF(D9=0,0,((C9/D9)*100)-100)) -> -0.1891827198126208 | L9: =IF(F9=0,0,((C9/F9)*100)-100) -> 6.057268455693503 | M9: =IF(G9=0,0,((C9/G9)*100)-100) -> 10.318267473498551 | N9: =IF(C9=0,0,IF(H9=0,0,((C9/H9)*100)-100)) -> 7.3487769697348 | P9: 3950000 | Q9: =IF(C9=0,0,((C9/P9)*100)-100) -> -0.3506308860759475 | R9: =IF(C9=0,0,(C9/$C$42)*100) -> 2.867464879617744 | T9: 16.31 | U9: 16.2017160687125 | V9: =U9-T9 -> -0.1082839312874988
A10: Paranagua | B10: 2300000 | C10: 2237488.54 | D10: 2209427.47 | F10: 5217567.84 | G10: 1861892.88 | H10: 1712172.35 | J10: =IF(B10=0,0,((C10/B10)*100)-100) -> -2.7178895652173907 | K10: =IF(C10=0,0,IF(D10=0,0,((C10/D10)*100)-100)) -> 1.2700607003858693 | L10: =IF(F10=0,0,((C10/F10)*100)-100) -> -57.11625399776306 | M10: =IF(G10=0,0,((C10/G10)*100)-100) -> 20.172785665306378 | N10: =IF(C10=0,0,IF(H10=0,0,((C10/H10)*100)-100)) -> 30.681268156211019 | P10: 2300000 | Q10: =IF(C10=0,0,((C10/P10)*100)-100) -> -2.7178895652173907 | R10: =IF(C10=0,0,(C10/$C$42)*100) -> 1.6299987745886919 | T10: 17.61 | U10: 17.480336681411561 | V10: =U10-T10 -> -0.12966331858843816
B11: 0 | C11: 0 | D11: 0 | F11: 0 | G11: 0 | H11: 0 | J11: =IF(B11=0,0,((C11/B11)*100)-100) -> 0 | K11: =IF(C11=0,0,IF(D11=0,0,((C11/D11)*100)-100)) -> 0 | L11: =IF(F11=0,0,((C11/F11)*100)-100) -> 0 | M11: =IF(G11=0,0,((C11/G11)*100)-100) -> 0 | N11: =IF(C11=0,0,IF(H11=0,0,((C11/H11)*100)-100)) -> 0 | P11: 0 | Q11: =IF(C11=0,0,((C11/P11)*100)-100) -> 0 | R11: =IF(C11=0,0,(C11/$C$42)*100) -> 0 | T11: 0 | U11: 0 | V11: =U11-T11 -> 0
A12: Sitio Cercado | B12: 2950000 | C12: 3022873.03 | D12: 2895053.11 | F12: 2330779.42 | G12: 2062882.93 | H12: 1803454.62 | J12: =IF(B12=0,0,((C12/B12)*100)-100) -> 2.4702722033898254 | K12: =IF(C12=0,0,IF(D12=0,0,((C12/D12)*100)-100)) -> 4.4151148577719965 | L12: =IF(F12=0,0,((C12/F12)*100)-100) -> 29.693655438231048 | M12: =IF(G12=0,0,((C12/G12)*100)-100) -> 46.536334468577905 | N12: =IF(C12=0,0,IF(H12=0,0,((C12/H12)*100)-100)) -> 67.615696922831347 | P12: 2950000 | Q12: =IF(C12=0,0,((C12/P12)*100)-100) -> 2.4702722033898254 | R12: =IF(C12=0,0,(C12/$C$42)*100) -> 2.2021472944112626 | T12: 15.23 | U12: 14.53687652901518 | V12: =U12-T12 -> -0.69312347098482086
A13: Apucarana | B13: 2599999 | C13: 2912544.82 | D13: 2089979.32 | F13: 2392243.79 | G13: 2470235.67 | H13: 2183934.04 | J13: =IF(B13=0,0,((C13/B13)*100)-100) -> 12.020997700383717 | K13: =IF(C13=0,0,IF(D13=0,0,((C13/D13)*100)-100)) -> 39.357590389937428 | L13: =IF(F13=0,0,((C13/F13)*100)-100) -> 21.749498616108838 | M13: =IF(G13=0,0,((C13/G13)*100)-100) -> 17.905544615506258 | N13: =IF(C13=0,0,IF(H13=0,0,((C13/H13)*100)-100)) -> 33.3623070411046 | P13: 2600000 | Q13: =IF(C13=0,0,((C13/P13)*100)-100) -> 12.020954615384611 | R13: =IF(C13=0,0,(C13/$C$42)*100) -> 2.1217737667316241 | T13: 16.5 | U13: 15.395015964080514 | V13: =U13-T13 -> -1.104984035919486
A14: Ahú | B14: 2050000 | C14: 2222277.7 | D14: 2184038.08 | F14: 1832674.57 | G14: 1687080.17 | H14: 1557917.17 | J14: =IF(B14=0,0,((C14/B14)*100)-100) -> 8.4037902439024492 | K14: =IF(C14=0,0,IF(D14=0,0,((C14/D14)*100)-100)) -> 1.7508678236965523 | L14: =IF(F14=0,0,((C14/F14)*100)-100) -> 21.258718616911906 | M14: =IF(G14=0,0,((C14/G14)*100)-100) -> 31.723301566635115 | N14: =IF(C14=0,0,IF(H14=0,0,((C14/H14)*100)-100)) -> 42.644149688651311 | P14: 2050000 | Q14: =IF(C14=0,0,((C14/P14)*100)-100) -> 8.4037902439024492 | R14: =IF(C14=0,0,(C14/$C$42)*100) -> 1.6189177566897288 | T14: 16.9 | U14: 16.345944073506207 | V14: =U14-T14 -> -0.55405592649379187
A15: P.G. Centro | B15: 2100000 | C15: 2234490.75 | D15: 2214644.71 | F15: 1841535.96 | G15: 1803046.03 | H15: 1938598.49 | J15: =IF(B15=0,0,((C15/B15)*100)-100) -> 6.4043214285714356 | K15: =IF(C15=0,0,IF(D15=0,0,((C15/D15)*100)-100)) -> 0.89612748764564287 | L15: =IF(F15=0,0,((C15/F15)*100)-100) -> 21.338426103826947 | M15: =IF(G15=0,0,((C15/G15)*100)-100) -> 23.928658105306383 | N15: =IF(C15=0,0,IF(H15=0,0,((C15/H15)*100)-100)) -> 15.263204914597878 | P15: 2100000 | Q15: =IF(C15=0,0,((C15/P15)*100)-100) -> 6.4043214285714356 | R15: =IF(C15=0,0,(C15/$C$42)*100) -> 1.6278149001512952 | T15: 18.48 | U15: 17.90172055981883 | V15: =U15-T15 -> -0.57827944018116995
A16: Maringa | B16: 3349999 | C16: 3299002.5 | D16: 3324390.21 | F16: 2958848.95 | G16: 2770952.47 | H16: 2366129.86 | J16: =IF(B16=0,0,((C16/B16)*100)-100) -> -1.5222840365026968 | K16: =IF(C16=0,0,IF(D16=0,0,((C16/D16)*100)-100)) -> -0.76368020588051877 | L16: =IF(F16=0,0,((C16/F16)*100)-100) -> 11.496144471991371 | M16: =IF(G16=0,0,((C16/G16)*100)-100) -> 19.056625319885029 | N16: =IF(C16=0,0,IF(H16=0,0,((C16/H16)*100)-100)) -> 39.426096418900698 | P16: 3350000 | Q16: =IF(C16=0,0,((C16/P16)*100)-100) -> -1.5223134328358157 | R16: =IF(C16=0,0,(C16/$C$42)*100) -> 2.4033061784374685 | T16: 17.34 | U16: 17.045451769133248 | V16: =U16-T16 -> -0.29454823086675219
A17: Araucaria Nova | B17: 4500000 | C17: 4919128.9 | D17: 4743960.98 | F17: 3870077.46 | G17: 3379256.06 | H17: 2826701.97 | J17: =IF(B17=0,0,((C17/B17)*100)-100) -> 9.3139755555555581 | K17: =IF(C17=0,0,IF(D17=0,0,((C17/D17)*100)-100)) -> 3.6924401515629626 | L17: =IF(F17=0,0,((C17/F17)*100)-100) -> 27.106729796565901 | M17: =IF(G17=0,0,((C17/G17)*100)-100) -> 45.568397678629907 | N17: =IF(C17=0,0,IF(H17=0,0,((C17/H17)*100)-100)) -> 74.023613108388645 | P17: 4500000 | Q17: =IF(C17=0,0,((C17/P17)*100)-100) -> 9.3139755555555581 | R17: =IF(C17=0,0,(C17/$C$42)*100) -> 3.5835598420735693 | T17: 16.41 | U17: 16.212988238628999 | V17: =U17-T17 -> -0.19701176137100163
A18: Cristo Rei | B18: 2750000 | C18: 2830017.66 | D18: 2778407.92 | F18: 2342828.51 | G18: 2095182.25 | H18: 1674126.26 | J18: =IF(B18=0,0,((C18/B18)*100)-100) -> 2.9097330909090999 | K18: =IF(C18=0,0,IF(D18=0,0,((C18/D18)*100)-100)) -> 1.8575292572589746 | L18: =IF(F18=0,0,((C18/F18)*100)-100) -> 20.794912983195715 | M18: =IF(G18=0,0,((C18/G18)*100)-100) -> 35.072624827744704 | N18: =IF(C18=0,0,IF(H18=0,0,((C18/H18)*100)-100)) -> 69.044457853495487 | P18: 2750000 | Q18: =IF(C18=0,0,((C18/P18)*100)-100) -> 2.9097330909090999 | R18: =IF(C18=0,0,(C18/$C$42)*100) -> 2.0616531595126548 | T18: 17.56 | U18: 17.590523799063501 | V18: =U18-T18 -> 3.0523799063502111E-2
A19: Fazenda | B19: 2700000 | C19: 2729530.87 | D19: 2747625.57 | F19: 2646829.37 | G19: 0 | H19: 0 | J19: =IF(B19=0,0,((C19/B19)*100)-100) -> 1.0937359259259267 | K19: =IF(C19=0,0,IF(D19=0,0,((C19/D19)*100)-100)) -> -0.65855770879289821 | L19: =IF(F19=0,0,((C19/F19)*100)-100) -> 3.1245497324974991 | M19: =IF(G19=0,0,((C19/G19)*100)-100) -> 0 | N19: =IF(C19=0,0,IF(H19=0,0,((C19/H19)*100)-100)) -> 0 | P19: 2700000 | Q19: =IF(C19=0,0,((C19/P19)*100)-100) -> 1.0937359259259267 | R19: =IF(C19=0,0,(C19/$C$42)*100) -> 1.9884490551634315 | T19: 16.5 | U19: 16.170596744340905 | V19: =U19-T19 -> -0.3294032556590949
A20: Campo Largo | B20: 3950000 | C20: 3900959.22 | D20: 3789002.99 | F20: 3505317.77 | G20: 2795659.36 | H20: 2403275.11 | J20: =IF(B20=0,0,((C20/B20)*100)-100) -> -1.2415387341772117 | K20: =IF(C20=0,0,IF(D20=0,0,((C20/D20)*100)-100)) -> 2.9547675284362924 | L20: =IF(F20=0,0,((C20/F20)*100)-100) -> 11.286892543268621 | M20: =IF(G20=0,0,((C20/G20)*100)-100) -> 39.536285279047746 | N20: =IF(C20=0,0,IF(H20=0,0,((C20/H20)*100)-100)) -> 62.318462991113819 | P20: 3950000 | Q20: =IF(C20=0,0,((C20/P20)*100)-100) -> -1.2415387341772117 | R20: =IF(C20=0,0,(C20/$C$42)*100) -> 2.8418285209722054 | T20: 16.4 | U20: 16.258834154128891 | V20: =U20-T20 -> -0.14116584587110736
A21: Brasilia | B21: 2700000 | C21: 2789844.91 | D21: 2670072.92 | F21: 2343289.97 | G21: 2373461.91 | H21: 979543.58 | J21: =IF(B21=0,0,((C21/B21)*100)-100) -> 3.3275892592592697 | K21: =IF(C21=0,0,IF(D21=0,0,((C21/D21)*100)-100)) -> 4.4857198132251881 | L21: =IF(F21=0,0,((C21/F21)*100)-100) -> 19.056751222299638 | M21: =IF(G21=0,0,((C21/G21)*100)-100) -> 17.543277111196602 | N21: =IF(C21=0,0,IF(H21=0,0,((C21/H21)*100)-100)) -> 184.81069826418548 | P21: 2700000 | Q21: =IF(C21=0,0,((C21/P21)*100)-100) -> 3.3275892592592697 | R21: =IF(C21=0,0,(C21/$C$42)*100) -> 2.0323875198898222 | T21: 16 | U21: 16.31541446510014 | V21: =U21-T21 -> 0.31541446510014026
A22: Total Super | B22: =SUM(B6:B21) -> 42899998 | C22: =SUM(C6:C21) -> 44253086.730000004 | D22: =SUM(D6:D21) -> 42579936.650000006 | F22: =SUM(F6:F21) -> 41491538.579999998 | G22: =SUM(G6:G21) -> 32634649.159999996 | H22: =SUM(H6:H21) -> 27980279.489999995 | I22: =SUM(B22:H22) -> 231839488.61000001 | J22: =IF(C22=0,0,((C22/B22)*100)-100) -> 3.154053130725103 | K22: =IF(C22=0,0,IF(D22=0,0,((C22/D22)*100)-100)) -> 3.9294329950582352 | L22: =IF(F22=0,0,IF(C22=0,0,((C22/F22)*100)-100)) -> 6.6556899177779343 | M22: =IF(G22=0,0,IF(C22=0,0,((C22/G22)*100)-100)) -> 35.601539679613381 | N22: =IF(C22=0,0,IF(H22=0,0,((C22/H22)*100)-100)) -> 58.158129713521362 | P22: =SUM(P6:P21) -> 42900000 | Q22: =IF(C22=0,0,((C22/P22)*100)-100) -> 3.1540483216783315 | R22: =IF(C22=0,0,(C22/$C$42)*100) -> 32.238143727729266 | T22: 16.715734256211388 | U22: 16.349020429111203 | V22: =U22-T22 -> -0.36671382710018463
A23: Pinheirinho | B23: 4800000 | C23: 4793900.25 | D23: 4798064.08 | F23: 4651250.75 | G23: 4301190.09 | H23: 3743869.27 | J23: =IF(B23=0,0,((C23/B23)*100)-100) -> -0.12707812499999704 | K23: =IF(C23=0,0,IF(D23=0,0,((C23/D23)*100)-100)) -> -8.6781458741995721E-2 | L23: =IF(F23=0,0,((C23/F23)*100)-100) -> 3.0669062509691685 | M23: =IF(G23=0,0,((C23/G23)*100)-100) -> 11.455205412695449 | N23: =IF(C23=0,0,IF(H23=0,0,((C23/H23)*100)-100)) -> 28.046678563645457 | P23: 4800000 | Q23: =IF(C23=0,0,IF(P23=0,0,((C23/P23)*100)-100)) -> -0.12707812499999704 | R23: =IF(C23=0,0,(C23/$C$42)*100) -> 3.492331421282016 | T23: 15.99 | U23: 15.684292554898279 | V23: =U23-T23 -> -0.30570744510172077
A24: Londrina | B24: 4350000 | C24: 4431883.02 | D24: 4373825.98 | F24: 3563870.9 | G24: 3301450.02 | H24: 3195012.98 | J24: =IF(B24=0,0,((C24/B24)*100)-100) -> 1.8823682758620635 | K24: =IF(C24=0,0,IF(D24=0,0,((C24/D24)*100)-100)) -> 1.3273742546108025 | L24: =IF(F24=0,0,((C24/F24)*100)-100) -> 24.355880006764536 | M24: =IF(G24=0,0,((C24/G24)*100)-100) -> 34.240500178766894 | N24: =IF(C24=0,0,IF(H24=0,0,((C24/H24)*100)-100)) -> 38.712520034895107 | P24: 4350000 | Q24: =IF(C24=0,0,IF(P24=0,0,((C24/P24)*100)-100)) -> 1.8823682758620635 | R24: =IF(C24=0,0,(C24/$C$42)*100) -> 3.2286037503997362 | T24: 15.61 | U24: 15.850404147174446 | V24: =U24-T24 -> 0.24040414717444669
A25: São Bráz | B25: 5500000 | C25: 5612214.5700000003 | D25: 5483703.9100000001 | F25: 5021487.92 | G25: 4720365.28 | H25: 4213582.32 | J25: =IF(B25=0,0,((C25/B25)*100)-100) -> 2.040264909090908 | K25: =IF(C25=0,0,IF(D25=0,0,((C25/D25)*100)-100)) -> 2.3435010735289694 | L25: =IF(F25=0,0,((C25/F25)*100)-100) -> 11.76397632357542 | M25: =IF(G25=0,0,((C25/G25)*100)-100) -> 18.893649899907743 | N25: =IF(C25=0,0,IF(H25=0,0,((C25/H25)*100)-100)) -> 33.193424117082401 | P25: 5500000 | Q25: =IF(C25=0,0,IF(P25=0,0,((C25/P25)*100)-100)) -> 2.040264909090908 | R25: =IF(C25=0,0,(C25/$C$42)*100) -> 4.088469151144257 | T25: 15.5 | U25: 15.060302122411546 | V25: =U25-T25 -> -0.43969787758845413
A26: S.J. Pinhais | B26: 6300000 | C26: 6549676.96 | D26: 6468278.2300000004 | F26: 5696099.1200000001 | G26: 5246767.7 | H26: 4775664.57 | J26: =IF(B26=0,0,((C26/B26)*100)-100) -> 3.9631263492063482 | K26: =IF(C26=0,0,IF(D26=0,0,((C26/D26)*100)-100)) -> 1.2584296331359184 | L26: =IF(F26=0,0,((C26/F26)*100)-100) -> 14.985305241668613 | M26: =IF(G26=0,0,((C26/G26)*100)-100) -> 24.832608083639769 | N26: =IF(C26=0,0,IF(H26=0,0,((C26/H26)*100)-100)) -> 37.146921941379134 | P26: 6300000 | Q26: =IF(C26=0,0,IF(P26=0,0,((C26/P26)*100)-100)) -> 3.9631263492063482 | R26: =IF(C26=0,0,(C26/$C$42)*100) -> 4.7714056308649466 | T26: 16.1 | U26: 16.025772055787009 | V26: =U26-T26 -> -7.4227944212992725E-2
A27: P.G. Nova | B27: 6200000 | C27: 6385175 | D27: 6177812.1399999997 | F27: 5115381.82 | G27: 4331847.83 | H27: 4319370.45 | J27: =IF(B27=0,0,((C27/B27)*100)-100) -> 2.9866935483870947 | K27: =IF(C27=0,0,IF(D27=0,0,((C27/D27)*100)-100)) -> 3.3565743875144847 | L27: =IF(F27=0,0,((C27/F27)*100)-100) -> 24.823038136379026 | M27: =IF(G27=0,0,((C27/G27)*100)-100) -> 47.400722522609954 | N27: =IF(C27=0,0,IF(H27=0,0,((C27/H27)*100)-100)) -> 47.82651948734798 | P27: 6200000 | Q27: =IF(C27=0,0,IF(P27=0,0,((C27/P27)*100)-100)) -> 2.9866935483870947 | R27: =IF(C27=0,0,(C27/$C$42)*100) -> 4.6515668078167458 | T27: 15.45 | U27: 15.486268739697815 | V27: =U27-T27 -> 3.6268739697815633E-2
A28: Nilo Pecanha | B28: 13950000 | C28: 14111384.380000001 | D28: 14014035.619999999 | F28: 12296388.49 | G28: 11880345.5 | H28: 10859056.199999999 | J28: =IF(B28=0,0,((C28/B28)*100)-100) -> 1.1568772759856785 | K28: =IF(C28=0,0,IF(D28=0,0,((C28/D28)*100)-100)) -> 0.69465186645503252 | L28: =IF(F28=0,0,((C28/F28)*100)-100) -> 14.760398075223804 | M28: =IF(G28=0,0,((C28/G28)*100)-100) -> 18.779242405029393 | N28: =IF(C28=0,0,IF(H28=0,0,((C28/H28)*100)-100)) -> 29.950376166208628 | P28: 13950000 | Q28: =IF(C28=0,0,IF(P28=0,0,((C28/P28)*100)-100)) -> 1.1568772759856785 | R28: =IF(C28=0,0,(C28/$C$42)*100) -> 10.280070192962869 | T28: 16.4 | U28: 16.675028095294504 | V28: =U28-T28 -> 0.27502809529450545
A29: Champagnat | B29: 6300000 | C29: 6628147.0700000003 | D29: 6442083.4800000004 | F29: 6127551.9400000004 | G29: 6773376.3799999999 | H29: 6104223.0899999999 | J29: =IF(B29=0,0,((C29/B29)*100)-100) -> 5.2086836507936596 | K29: =IF(C29=0,0,IF(D29=0,0,((C29/D29)*100)-100)) -> 2.8882517678892299 | L29: =IF(F29=0,0,((C29/F29)*100)-100) -> 8.1695779146671725 | M29: =IF(G29=0,0,((C29/G29)*100)-100) -> -2.144119887222331 | N29: =IF(C29=0,0,IF(H29=0,0,((C29/H29)*100)-100)) -> 8.5829756264691213 | P29: 6300000 | Q29: =IF(C29=0,0,IF(P29=0,0,((C29/P29)*100)-100)) -> 5.2086836507936596 | R29: =IF(C29=0,0,(C29/$C$42)*100) -> 4.8285706982408181 | T29: 16.94 | U29: 16.393159031095546 | V29: =U29-T29 -> -0.54684096890445488
A30: Santa Candida | B30: 8200000 | C30: 8277587.8600000003 | D30: 8022996.2999999998 | F30: 7045078.7599999998 | G30: 6178313.9900000002 | H30: 5067298.85 | J30: =IF(B30=0,0,((C30/B30)*100)-100) -> 0.94619341463415196 | K30: =IF(C30=0,0,IF(D30=0,0,((C30/D30)*100)-100)) -> 3.1732728083147919 | L30: =IF(F30=0,0,((C30/F30)*100)-100) -> 17.494610663515147 | M30: =IF(G30=0,0,((C30/G30)*100)-100) -> 33.978102657097253 | N30: =IF(C30=0,0,IF(H30=0,0,((C30/H30)*100)-100)) -> 63.353062549290939 | P30: 8200000 | Q30: =IF(C30=0,0,IF(P30=0,0,((C30/P30)*100)-100)) -> 0.94619341463415196 | R30: =IF(C30=0,0,(C30/$C$42)*100) -> 6.0301797426637247 | T30: 16.01 | U30: 15.897489126741807 | V30: =U30-T30 -> -0.11251087325819498
A31: Paranaguá Raia | B31: 7900000 | C31: 7644967.3200000003 | D31: 7674157.96 | F31: 0 | G31: 6213555.8300000001 | H31: 5478911.6299999999 | J31: =IF(B31=0,0,((C31/B31)*100)-100) -> -3.228261772151896 | K31: =IF(C31=0,0,IF(D31=0,0,((C31/D31)*100)-100)) -> -0.38037580347121036 | L31: =IF(F31=0,0,((C31/F31)*100)-100) -> 0 | M31: =IF(G31=0,0,((C31/G31)*100)-100) -> 23.036913631465666 | N31: =IF(C31=0,0,IF(H31=0,0,((C31/H31)*100)-100)) -> 39.534415524055476 | P31: 7900000 | Q31: =IF(C31=0,0,IF(P31=0,0,((C31/P31)*100)-100)) -> -3.228261772151896 | R31: =IF(C31=0,0,(C31/$C$42)*100) -> 5.569318966599309 | T31: 17.95 | U31: 18.079581404933986 | V31: =U31-T31 -> 0.12958140493398673
A32: Novo Mundo | B32: 5600000 | C32: 5748403.5599999996 | D32: 5608088.2000000002 | F32: 5114205.54 | G32: 0 | H32: 0 | J32: =IF(B32=0,0,((C32/B32)*100)-100) -> 2.6500635714285607 | K32: =IF(C32=0,0,IF(D32=0,0,((C32/D32)*100)-100)) -> 2.5020177107770678 | L32: =IF(F32=0,0,((C32/F32)*100)-100) -> 12.400714344382791 | M32: =IF(G32=0,0,((C32/G32)*100)-100) -> 0 | N32: =IF(C32=0,0,IF(H32=0,0,((C32/H32)*100)-100)) -> 0 | P32: 5600000 | Q32: =IF(C32=0,0,IF(P32=0,0,((C32/P32)*100)-100)) -> 2.6500635714285607 | R32: =IF(C32=0,0,(C32/$C$42)*100) -> 4.1876821226719105 | T32: 16 | U32: 15.629455041253228 | V32: =U32-T32 -> -0.37054495874677151
A33: Uvaranas | B33: 5500000 | C33: 5657899.8200000003 | D33: 5496404.25 | F33: 4529219.72 | G33: 4204028.03 | H33: 0 | J33: =IF(B33=0,0,((C33/B33)*100)-100) -> 2.8709058181818108 | K33: =IF(C33=0,0,IF(D33=0,0,((C33/D33)*100)-100)) -> 2.9382040085570509 | L33: =IF(F33=0,0,((C33/F33)*100)-100) -> 24.919967892394496 | M33: =IF(G33=0,0,((C33/G33)*100)-100) -> 34.582828173959626 | N33: =IF(C33=0,0,IF(H33=0,0,((C33/H33)*100)-100)) -> 0 | P33: 5500000 | Q33: =IF(C33=0,0,IF(P33=0,0,((C33/P33)*100)-100)) -> 2.8709058181818108 | R33: =IF(C33=0,0,(C33/$C$42)*100) -> 4.1217506183721424 | T33: 15.6 | U33: 15.471794267294042 | V33: =U33-T33 -> -0.12820573270595759
A34: Torres | B34: 6100000 | C34: 6236762.5199999996 | D34: 6126875.3799999999 | F34: 5311693.18 | G34: 4611016.87 | H34: 0 | J34: =IF(B34=0,0,((C34/B34)*100)-100) -> 2.2420085245901618 | K34: =IF(C34=0,0,IF(D34=0,0,((C34/D34)*100)-100)) -> 1.7935266050735237 | L34: =IF(F34=0,0,((C34/F34)*100)-100) -> 17.415714888863349 | M34: =IF(G34=0,0,((C34/G34)*100)-100) -> 35.257855172410132 | N34: =IF(C34=0,0,IF(H34=0,0,((C34/H34)*100)-100)) -> 0 | P34: 6100000 | Q34: =IF(C34=0,0,IF(P34=0,0,((C34/P34)*100)-100)) -> 2.2420085245901618 | R34: =IF(C34=0,0,(C34/$C$42)*100) -> 4.5434490873417746 | T34: 16 | U34: 16.262328519765415 | V34: =U34-T34 -> 0.26232851976541482
A35: Total Hiper | B35: =SUM(B23:B34) -> 80700000 | C35: =SUM(C23:C34) -> 82078002.329999998 | D35: =SUM(D23:D34) -> 80686325.529999986 | F35: =SUM(F23:F34) -> 64472228.139999993 | G35: =SUM(G23:G34) -> 61762257.520000003 | H35: =SUM(H23:H34) -> 47756989.359999999 | I35: =SUM(B35:H35) -> 417455802.87999994 | J35: =IF(C35=0,0,((C35/B35)*100)-100) -> 1.7075617472118978 | K35: =IF(C35=0,0,IF(D35=0,0,((C35/D35)*100)-100)) -> 1.7247988315970133 | L35: =IF(F35=0,0,IF(C35=0,0,((C35/F35)*100)-100)) -> 27.307531782164347 | M35: =IF(G35=0,0,IF(C35=0,0,((C35/G35)*100)-100)) -> 32.8934621656621 | N35: =IF(C35=0,0,IF(H35=0,0,((C35/H35)*100)-100)) -> 71.865947644401501 | P35: =SUM(P23:P34) -> 80700000 | Q35: =IF(C35=0,0,((C35/P35)*100)-100) -> 1.7075617472118978 | R35: =IF(C35=0,0,(C35/$C$42)*100) -> 59.79339819036025 | T35: 16.217032218091699 | U35: 16.160055999744991 | V35: =U35-T35 -> -5.6976218346708407E-2
A36: Total s/ 29,30,37 | B36: =B22+B35 -> 123599998 | C36: =C22+C35 -> 126331089.06 | D36: =D22+D35 -> 123266262.17999999 | E36: =E22+E35 -> 0 | F36: =F22+F35 -> 105963766.72 | G36: =G22+G35 -> 94396906.680000007 | H36: =H22+H35 -> 75737268.849999994 | I36: =SUM(B36:H36) -> 649295291.49000013 | J36: =IF(C36=0,0,((C36/B36)*100)-100) -> 2.2096206344598812 | K36: =IF(C36=0,0,IF(D36=0,0,((C36/D36)*100)-100)) -> 2.4863468931382045 | L36: =IF(F36=0,0,IF(C36=0,0,((C36/F36)*100)-100)) -> 19.221025233860246 | M36: =IF(G36=0,0,IF(C36=0,0,((C36/G36)*100)-100)) -> 33.829691568448339 | N36: =IF(C36=0,0,IF(H36=0,0,((C36/H36)*100)-100)) -> 66.801748964836094 | P36: =P22+P35 -> 123600000 | Q36: =IF(C36=0,0,((C36/P36)*100)-100) -> 2.209618980582519 | R36: =IF(C36=0,0,(C36/$C$42)*100) -> 92.031541918089516 | T36: 16.390125395956723 | U36: 16.226249201623087 | V36: =U36-T36 -> -0.16387619433363554
A37: Centenario | B37: 0 | C37: 0 | D37: 0 | F37: 1399596.88 | G37: 1207149.07 | H37: 1159818.33 | J37: =IF(B37=0,0,((C37/B37)*100)-100) -> 0 | K37: =IF(C37=0,0,IF(D37=0,0,((C37/D37)*100)-100)) -> 0 | L37: =IF(F37=0,0,((C37/F37)*100)-100) -> -100 | M37: =IF(G37=0,0,((C37/G37)*100)-100) -> -100 | N37: =IF(C37=0,0,IF(H37=0,0,((C37/H37)*100)-100)) -> 0 | P37: 0 | Q37: =IF(P37=0,0,IF(C37=0,0,((C37/P37)*100)-100)) -> 0 | R37: =IF(C37=0,0,(C37/$C$42)*100) -> 0 | T37: 0 | U37: 0 | V37: =U37-T37 -> 0
A38: Cajuru | B38: 4300000 | C38: 4626530.75 | D38: 4480222.72 | F38: 0 | G38: 0 | H38: 0 | J38: =IF(B38=0,0,((C38/B38)*100)-100) -> 7.5937383720930285 | K38: =IF(C38=0,0,IF(D38=0,0,((C38/D38)*100)-100)) -> 3.2656418920173707 | L38: =IF(F38=0,0,((C38/F38)*100)-100) -> 0 | M38: =IF(G38=0,0,((C38/G38)*100)-100) -> 0 | N38: =IF(C38=0,0,IF(H38=0,0,((C38/H38)*100)-100)) -> 0 | P38: 4300000 | Q38: =IF(P38=0,0,IF(C38=0,0,((C38/P38)*100)-100)) -> 7.5937383720930285 | R38: =IF(C38=0,0,(C38/$C$42)*100) -> 3.3704036102445918 | T38: 16.15 | U38: 16.090812970388235 | V38: =U38-T38 -> -5.9187029611763364E-2
A39: Água Verde | B39: 6500000 | C39: 6311718.9699999997 | D39: 6359341.2000000002 | F39: 0 | G39: 0 | H39: 0 | J39: =IF(B39=0,0,((C39/B39)*100)-100) -> -2.8966312307692306 | K39: =IF(C39=0,0,IF(D39=0,0,((C39/D39)*100)-100)) -> -0.74885477130870015 | L39: =IF(F39=0,0,((C39/F39)*100)-100) -> 0 | M39: =IF(G39=0,0,((C39/G39)*100)-100) -> 0 | N39: =IF(C39=0,0,IF(H39=0,0,((C39/H39)*100)-100)) -> 0 | P39: 6500000 | Q39: =IF(P39=0,0,IF(C39=0,0,((C39/P39)*100)-100)) -> -2.8966312307692306 | R39: =IF(C39=0,0,(C39/$C$42)*100) -> 4.5980544716658978 | T39: 15.65 | U39: 16.398321834661786 | V39: =U39-T39 -> 0.7483218346617857
B40: 0 | C40: 0 | D40: 0 | F40: 0 | G40: 0 | H40: 0 | J40: =IF(B40=0,0,((C40/B40)*100)-100) -> 0 | K40: =IF(C40=0,0,IF(D40=0,0,((C40/D40)*100)-100)) -> 0 | L40: =IF(F40=0,0,((C40/F40)*100)-100) -> 0 | M40: =IF(G40=0,0,((C40/G40)*100)-100) -> 0 | N40: =IF(C40=0,0,IF(H40=0,0,((C40/H40)*100)-100)) -> 0 | P40: 0 | Q40: =IF(P40=0,0,IF(C40=0,0,((C40/P40)*100)-100)) -> 0 | R40: =IF(C40=0,0,(C40/$C$42)*100) -> 0 | T40: 0 | U40: 0 | V40: =U40-T40 -> 0
A41: Total Lojas Novas | B41: =SUM(B37:B40) -> 10800000 | C41: =SUM(C37:C40) -> 10938249.719999999 | D41: =SUM(D37:D40) -> 10839563.92 | F41: =SUM(F37:F40) -> 1399596.88 | G41: =SUM(G37:G40) -> 1207149.07 | H41: =SUM(H37:H40) -> 1159818.33 | J41: =IF(C41=0,0,((C41/B41)*100)-100) -> 1.2800899999999729 | K41: =IF(C41=0,0,IF(D41=0,0,((C41/D41)*100)-100)) -> 0.91042223403393052 | L41: =IF(F41=0,0,IF(C41=0,0,((C41/F41)*100)-100)) -> 681.52858700285174 | M41: =IF(G41=0,0,IF(C41=0,0,((C41/G41)*100)-100)) -> 806.12253215752366 | N41: =IF(C41=0,0,IF(H41=0,0,((C41/H41)*100)-100)) -> 843.10026295238833 | P41: =SUM(P37:P40) -> 10800000 | Q41: =IF(P41=0,0,IF(C41=0,0,((C41/P41)*100)-100)) -> 1.2800899999999729 | R41: =IF(C41=0,0,(C41/$C$42)*100) -> 7.9684580819104882 | T41: 15.849074074074073 | U41: 16.268255393240374 | V41: =U41-T41 -> 0.41918131916630053
A42: Total sem 29 | B42: =B22+B35+B41 -> 134399998 | C42: =C22+C35+C41 -> 137269338.78 | D42: =D22+D35+D41 -> 134105826.09999999 | F42: =F22+F35+F41 -> 107363363.59999999 | G42: =G22+G35+G41 -> 95604055.75 | H42: =H22+H35+H41 -> 76897087.179999992 | J42: =IF(C42=0,0,((C42/B42)*100)-100) -> 2.1349262073649697 | K42: =IF(C42=0,0,IF(D42=0,0,((C42/D42)*100)-100)) -> 2.3589673707695908 | L42: =IF(F42=0,0,IF(C42=0,0,((C42/F42)*100)-100)) -> 27.854916404649614 | M42: =IF(G42=0,0,IF(C42=0,0,((C42/G42)*100)-100)) -> 43.581083148765885 | N42: =IF(C42=0,0,IF(H42=0,0,((C42/H42)*100)-100)) -> 78.51045314457906 | P42: =P22+P35+P41 -> 134400000 | Q42: =IF(C42=0,0,((C42/P42)*100)-100) -> 2.1349246875000034 | R42: =R22+R35+R41 -> 100 | T42: 16.346648056944169 | U42: 16.229596447393916 | V42: =U42-T42 -> -0.11705160955025207
A44: Água Verde | B44: 0 | C44: 0 | D44: 0 | F44: 0 | G44: 0 | H44: 0 | J44: =IF(B44=0,0,((C44/B44)*100)-100) -> 0 | K44: =IF(C44=0,0,IF(D44=0,0,((C44/D44)*100)-100)) -> 0 | L44: =IF(F44=0,0,((C44/F44)*100)-100) -> 0 | M44: =IF(G44=0,0,((C44/G44)*100)-100) -> 0 | N44: =IF(C44=0,0,IF(H44=0,0,((C44/H44)*100)-100)) -> 0 | P44: =C44 -> 0 | Q44: =IF(C44=0,0,IF(P44=0,0,((C44/P44)*100)-100)) -> 0 | R44: =IF(C44=0,0,(C44/$C$42)*100) -> 0 | T44: 14.9 | U44: 0 | V44: =U44-T44 -> -14.9
A45: Total Geral | B45: =B42+B44 -> 134399998 | C45: =C42+C44 -> 137269338.78 | D45: =D42+D44 -> 134105826.09999999 | F45: =F42+F44 -> 107363363.59999999 | G45: =G42+G44 -> 95604055.75 | H45: =H42+H44 -> 76897087.179999992 | I45: =SUM(B45:H45) -> 685639669.40999997 | J45: =IF(C45=0,0,((C45/B45)*100)-100) -> 2.1349262073649697 | K45: =IF(C45=0,0,IF(D45=0,0,((C45/D45)*100)-100)) -> 2.3589673707695908 | L45: =IF(F45=0,0,IF(C45=0,0,((C45/F45)*100)-100)) -> 27.854916404649614 | M45: =IF(G45=0,0,IF(C45=0,0,((C45/G45)*100)-100)) -> 43.581083148765885 | N45: =IF(C45=0,0,IF(H45=0,0,((C45/H45)*100)-100)) -> 78.51045314457906 | P45: =P42+P44 -> 134400000 | Q45: =IF(C45=0,0,((C45/P45)*100)-100) -> 2.1349246875000034 | R45: =IF(C45=0,0,(C45/$C$42)*100) -> 100 | T45: 16.346648056944169 | U45: 16.229596447393916 | V45: =U45-T45 -> -0.11705160955025207
B47: =B39-P39 -> 0