A2: Periodo: | B2: 40299 | C2: a | D2: 40329 | G2: Vendas Acumuladas por Filial | P2: =NOW() -> 40330.298579513888
A4: v.New | B4: Vendas 2010 | F4: Vendas de Anos Anteriores | J4: Percentuais ( % ) | P4: Meta Mensal | T4: Margem
A5: Lojas | B5: Previsao | C5: Realizada | D5: Mes Anterior | F5: Vendas 2009 | G5: Vendas 2008 | H5: Vendas 2007 | J5: % Prev | K5: % MA | L5: 2009 | M5: 2008 | N5: 2007 | P5: Previsao Mes | Q5: Final | R5: Part. | T5: Meta | U5: Coml | V5: Dif
A6: S. Felicidade | B6: 2900000 | C6: 3004564.54 | D6: 3219909.31 | F6: 2629079.07 | G6: 2236226.36 | H6: 823955.53 | J6: =IF(B6=0,0,((C6/B6)*100)-100) -> 3.6056737931034633 | K6: =IF(C6=0,0,IF(D6=0,0,((C6/D6)*100)-100)) -> -6.6879141387991439 | L6: =IF(F6=0,0,((C6/F6)*100)-100) -> 14.282015108811493 | M6: =IF(G6=0,0,((C6/G6)*100)-100) -> 34.358694349707974 | N6: =IF(C6=0,0,IF(H6=0,0,((C6/H6)*100)-100)) -> 264.65129859617542 | P6: 2900000 | Q6: =IF(C6=0,0,((C6/P6)*100)-100) -> 3.6056737931034633 | R6: =IF(C6=0,0,(C6/$C$40)*100) -> 2.5867296754411004 | T6: 17.496500000000001 | U6: 17.324704660862437 | V6: =U6-T6 -> -0.17179533913756373
A7: Lapa | B7: 2200000 | C7: 2290247.92 | D7: 2503511.37 | F7: 2072102.99 | G7: 1775771.5 | H7: 1245869.32 | J7: =IF(B7=0,0,((C7/B7)*100)-100) -> 4.1021781818181751 | K7: =IF(C7=0,0,IF(D7=0,0,((C7/D7)*100)-100)) -> -8.5185732549718836 | L7: =IF(F7=0,0,((C7/F7)*100)-100) -> 10.527706926382081 | M7: =IF(G7=0,0,((C7/G7)*100)-100) -> 28.971994426084677 | N7: =IF(C7=0,0,IF(H7=0,0,((C7/H7)*100)-100)) -> 83.827298997939835 | P7: 2200000 | Q7: =IF(C7=0,0,((C7/P7)*100)-100) -> 4.1021781818181751 | R7: =IF(C7=0,0,(C7/$C$40)*100) -> 1.9717507079349526 | T7: 17.452400000000001 | U7: 16.291678522733907 | V7: =U7-T7 -> -1.1607214772660939
A8: Araucaria | B8: 1350000 | C8: 1367227.97 | D8: 1509774.69 | F8: 1230651.76 | G8: 1123100.55 | H8: 907533.72 | J8: =IF(B8=0,0,((C8/B8)*100)-100) -> 1.2761459259259311 | K8: =IF(C8=0,0,IF(D8=0,0,((C8/D8)*100)-100)) -> -9.4415889300674394 | L8: =IF(F8=0,0,((C8/F8)*100)-100) -> 11.097876299303394 | M8: =IF(G8=0,0,((C8/G8)*100)-100) -> 21.736915719612099 | N8: =IF(C8=0,0,IF(H8=0,0,((C8/H8)*100)-100)) -> 50.653131654435953 | P8: 1350000 | Q8: =IF(C8=0,0,((C8/P8)*100)-100) -> 1.2761459259259311 | R8: =IF(C8=0,0,(C8/$C$40)*100) -> 1.1770920930498947 | T8: 17.463200000000001 | U8: 16.959666894468228 | V8: =U8-T8 -> -0.50353310553177266
A9: Hauer | B9: 3900000 | C9: 3978038.82 | D9: 3951526.67 | F9: 3822184.9 | G9: 3755891.17 | H9: 2948754.8 | J9: =IF(B9=0,0,((C9/B9)*100)-100) -> 2.0009953846153792 | K9: =IF(C9=0,0,IF(D9=0,0,((C9/D9)*100)-100)) -> 0.67093435560691717 | L9: =IF(F9=0,0,((C9/F9)*100)-100) -> 4.0776133043694358 | M9: =IF(G9=0,0,((C9/G9)*100)-100) -> 5.9146455513512564 | N9: =IF(C9=0,0,IF(H9=0,0,((C9/H9)*100)-100)) -> 34.905717491328886 | P9: 3900000 | Q9: =IF(C9=0,0,((C9/P9)*100)-100) -> 2.0009953846153792 | R9: =IF(C9=0,0,(C9/$C$40)*100) -> 3.4248261033363243 | T9: 16.203499999999998 | U9: 16.326669280718583 | V9: =U9-T9 -> 0.12316928071858513
A10: Paranagua | B10: 0 | C10: 0 | D10: 0 | F10: 0 | G10: 0 | H10: 0 | J10: =IF(B10=0,0,((C10/B10)*100)-100) -> 0 | K10: =IF(C10=0,0,IF(D10=0,0,((C10/D10)*100)-100)) -> 0 | L10: =IF(F10=0,0,((C10/F10)*100)-100) -> 0 | M10: =IF(G10=0,0,((C10/G10)*100)-100) -> 0 | N10: =IF(C10=0,0,IF(H10=0,0,((C10/H10)*100)-100)) -> 0 | P10: 0 | Q10: =IF(C10=0,0,((C10/P10)*100)-100) -> 0 | R10: =IF(C10=0,0,(C10/$C$40)*100) -> 0 | T10: 0 | U10: 0 | V10: =U10-T10 -> 0
A11: Centenario | B11: 1300000 | C11: 1360171.7 | D11: 1448692.43 | F11: 1232621.36 | G11: 1181038.12 | H11: 934139.22 | J11: =IF(B11=0,0,((C11/B11)*100)-100) -> 4.6285923076923012 | K11: =IF(C11=0,0,IF(D11=0,0,((C11/D11)*100)-100)) -> -6.1103881104700832 | L11: =IF(F11=0,0,((C11/F11)*100)-100) -> 10.347893046409638 | M11: =IF(G11=0,0,((C11/G11)*100)-100) -> 15.167468091546425 | N11: =IF(C11=0,0,IF(H11=0,0,((C11/H11)*100)-100)) -> 45.606957815131665 | P11: 1300000 | Q11: =IF(C11=0,0,((C11/P11)*100)-100) -> 4.6285923076923012 | R11: =IF(C11=0,0,(C11/$C$40)*100) -> 1.1710171152073736 | T11: 17.269400000000001 | U11: 15.99719565551908 | V11: =U11-T11 -> -1.2722043444809206
A12: Sitio Cercado | B12: 2350000 | C12: 2406618.35 | D12: 2564249.98 | F12: 2090867.03 | G12: 1794280.97 | H12: 1263722.89 | J12: =IF(B12=0,0,((C12/B12)*100)-100) -> 2.4092914893617063 | K12: =IF(C12=0,0,IF(D12=0,0,((C12/D12)*100)-100)) -> -6.1472801493401903 | L12: =IF(F12=0,0,((C12/F12)*100)-100) -> 15.101453869115716 | M12: =IF(G12=0,0,((C12/G12)*100)-100) -> 34.127173516196848 | N12: =IF(C12=0,0,IF(H12=0,0,((C12/H12)*100)-100)) -> 90.438771746866138 | P12: 2350000 | Q12: =IF(C12=0,0,((C12/P12)*100)-100) -> 2.4092914893617063 | R12: =IF(C12=0,0,(C12/$C$40)*100) -> 2.0719378866816078 | T12: 16.653300000000002 | U12: 15.852528648757289 | V12: =U12-T12 -> -0.80077135124271237
A13: Apucarana | B13: 2740000 | C13: 2430009.86 | D13: 2666000.32 | F13: 2595778.97 | G13: 2340971.91 | H13: 2005186.29 | J13: =IF(B13=0,0,((C13/B13)*100)-100) -> -11.31350875912409 | K13: =IF(C13=0,0,IF(D13=0,0,((C13/D13)*100)-100)) -> -8.8518541513153366 | L13: =IF(F13=0,0,((C13/F13)*100)-100) -> -6.3861026657443176 | M13: =IF(G13=0,0,((C13/G13)*100)-100) -> 3.8034608454571242 | N13: =IF(C13=0,0,IF(H13=0,0,((C13/H13)*100)-100)) -> 21.18623950894856 | P13: 2740000 | Q13: =IF(C13=0,0,((C13/P13)*100)-100) -> -11.31350875912409 | R13: =IF(C13=0,0,(C13/$C$40)*100) -> 2.0920764166631858 | T13: 17 | U13: 17.185709283500604 | V13: =U13-T13 -> 0.18570928350060356
A14: Ahú | B14: 1800000 | C14: 1865267.89 | D14: 1981983.6 | F14: 1697465.6 | G14: 1599242.64 | H14: 1347489.91 | J14: =IF(B14=0,0,((C14/B14)*100)-100) -> 3.6259938888888854 | K14: =IF(C14=0,0,IF(D14=0,0,((C14/D14)*100)-100)) -> -5.8888332880251966 | L14: =IF(F14=0,0,((C14/F14)*100)-100) -> 9.8854604181669288 | M14: =IF(G14=0,0,((C14/G14)*100)-100) -> 16.6344520428745 | N14: =IF(C14=0,0,IF(H14=0,0,((C14/H14)*100)-100)) -> 38.425369730597822 | P14: 1800000 | Q14: =IF(C14=0,0,((C14/P14)*100)-100) -> 3.6259938888888854 | R14: =IF(C14=0,0,(C14/$C$40)*100) -> 1.6058712467232956 | T14: 17.715299999999999 | U14: 17.301270794941953 | V14: =U14-T14 -> -0.4140292050580463
A15: P.G. Centro | B15: 1950000 | C15: 1872302.35 | D15: 2071591.73 | F15: 1814507.17 | G15: 2021329.7 | H15: 1695586.81 | J15: =IF(B15=0,0,((C15/B15)*100)-100) -> -3.9844948717948654 | K15: =IF(C15=0,0,IF(D15=0,0,((C15/D15)*100)-100)) -> -9.6201088812031514 | L15: =IF(F15=0,0,((C15/F15)*100)-100) -> 3.1851723132072323 | M15: =IF(G15=0,0,((C15/G15)*100)-100) -> -7.3727383513931386 | N15: =IF(C15=0,0,IF(H15=0,0,((C15/H15)*100)-100)) -> 10.42208744239997 | P15: 1950000 | Q15: =IF(C15=0,0,((C15/P15)*100)-100) -> -3.9844948717948654 | R15: =IF(C15=0,0,(C15/$C$40)*100) -> 1.6119274476104644 | T15: 18.595700000000001 | U15: 18.353775991361651 | V15: =U15-T15 -> -0.24192400863834962
A16: Maringa | B16: 3100000 | C16: 3024039.24 | D16: 3128775.61 | F16: 2951827.38 | G16: 2622206.42 | H16: 2314916.03 | J16: =IF(B16=0,0,((C16/B16)*100)-100) -> -2.4503470967741805 | K16: =IF(C16=0,0,IF(D16=0,0,((C16/D16)*100)-100)) -> -3.3475193831493613 | L16: =IF(F16=0,0,((C16/F16)*100)-100) -> 2.4463442709851364 | M16: =IF(G16=0,0,((C16/G16)*100)-100) -> 15.324225314039168 | N16: =IF(C16=0,0,IF(H16=0,0,((C16/H16)*100)-100)) -> 30.632783254777507 | P16: 3100000 | Q16: =IF(C16=0,0,((C16/P16)*100)-100) -> -2.4503470967741805 | R16: =IF(C16=0,0,(C16/$C$40)*100) -> 2.6034960932496234 | T16: 18.803699999999999 | U16: 17.250702236258018 | V16: =U16-T16 -> -1.5529977637419812
A17: Araucaria Nova | B17: 4100000 | C17: 4009247.61 | D17: 4190170.92 | F17: 3549353.35 | G17: 2923104.39 | H17: 2062725.26 | J17: =IF(B17=0,0,((C17/B17)*100)-100) -> -2.2134729268292688 | K17: =IF(C17=0,0,IF(D17=0,0,((C17/D17)*100)-100)) -> -4.3178026255788211 | L17: =IF(F17=0,0,((C17/F17)*100)-100) -> 12.957128092079074 | M17: =IF(G17=0,0,((C17/G17)*100)-100) -> 37.157182060131618 | N17: =IF(C17=0,0,IF(H17=0,0,((C17/H17)*100)-100)) -> 94.366534785151146 | P17: 4100000 | Q17: =IF(C17=0,0,((C17/P17)*100)-100) -> -2.2134729268292688 | R17: =IF(C17=0,0,(C17/$C$40)*100) -> 3.4516947900138324 | T17: 17.197099999999999 | U17: 16.441831483688283 | V17: =U17-T17 -> -0.7552685163117161
A18: Cristo Rei | B18: 2311000 | C18: 2426039.45 | D18: 2488834.44 | F18: 2094485.58 | G18: 1679393.39 | H18: 1334020.13 | J18: =IF(B18=0,0,((C18/B18)*100)-100) -> 4.97790783210732 | K18: =IF(C18=0,0,IF(D18=0,0,((C18/D18)*100)-100)) -> -2.5230681876934966 | L18: =IF(F18=0,0,((C18/F18)*100)-100) -> 15.829847346096315 | M18: =IF(G18=0,0,((C18/G18)*100)-100) -> 44.459271094308662 | N18: =IF(C18=0,0,IF(H18=0,0,((C18/H18)*100)-100)) -> 81.859283487723701 | P18: 2311000 | Q18: =IF(C18=0,0,((C18/P18)*100)-100) -> 4.97790783210732 | R18: =IF(C18=0,0,(C18/$C$40)*100) -> 2.088658158465055 | T18: 18.302 | U18: 17.832255196839441 | V18: =U18-T18 -> -0.46974480316055889
A19: Campo Largo | B19: 3500000 | C19: 3582270.41 | D19: 3858492.91 | F19: 2876003.87 | G19: 540799.88 | H19: 0 | J19: =IF(B19=0,0,((C19/B19)*100)-100) -> 2.3505831428571469 | K19: =IF(C19=0,0,IF(D19=0,0,((C19/D19)*100)-100)) -> -7.1588183895354121 | L19: =IF(F19=0,0,((C19/F19)*100)-100) -> 24.557217998458398 | M19: =IF(G19=0,0,((C19/G19)*100)-100) -> 562.40221983777076 | N19: =IF(C19=0,0,IF(H19=0,0,((C19/H19)*100)-100)) -> 0 | P19: 3500000 | Q19: =IF(C19=0,0,((C19/P19)*100)-100) -> 2.3505831428571469 | R19: =IF(C19=0,0,(C19/$C$40)*100) -> 3.0840958986361322 | T19: 17.600300000000001 | U19: 16.531527763701121 | V19: =U19-T19 -> -1.0687722362988801
A20: Brasilia | B20: 2700000 | C20: 2482025.22 | D20: 2654950.07 | F20: 2503404.87 | G20: 982357.96 | H20: 774550.92 | J20: =IF(B20=0,0,((C20/B20)*100)-100) -> -8.0731399999999951 | K20: =IF(C20=0,0,IF(D20=0,0,((C20/D20)*100)-100)) -> -6.5132995137644798 | L20: =IF(F20=0,0,((C20/F20)*100)-100) -> -0.85402286526668547 | M20: =IF(G20=0,0,((C20/G20)*100)-100) -> 152.65995910492754 | N20: =IF(C20=0,0,IF(H20=0,0,((C20/H20)*100)-100)) -> 220.44700431057527 | P20: 2700000 | Q20: =IF(C20=0,0,((C20/P20)*100)-100) -> -8.0731399999999951 | R20: =IF(C20=0,0,(C20/$C$40)*100) -> 2.1368581723883442 | T20: 16.84 | U20: 16.62186293578435 | V20: =U20-T20 -> -0.21813706421565016
A21: Total Super | B21: =SUM(B6:B20) -> 36201000 | C21: =SUM(C6:C20) -> 36098071.329999998 | D21: =SUM(D6:D20) -> 38238464.050000004 | F21: =SUM(F6:F20) -> 33160333.900000006 | G21: =SUM(G6:G20) -> 26575714.960000005 | H21: =SUM(H6:H20) -> 19658450.830000002 | I21: =SUM(B21:H21) -> 189932035.07000002 | J21: =IF(C21=0,0,((C21/B21)*100)-100) -> -0.28432548824618209 | K21: =IF(C21=0,0,IF(D21=0,0,((C21/D21)*100)-100)) -> -5.5974861260150561 | L21: =IF(F21=0,0,IF(C21=0,0,((C21/F21)*100)-100)) -> 8.859191342461088 | M21: =IF(G21=0,0,IF(C21=0,0,((C21/G21)*100)-100)) -> 35.831044938329626 | N21: =IF(C21=0,0,IF(H21=0,0,((C21/H21)*100)-100)) -> 83.626225902359124 | P21: =SUM(P6:P20) -> 36201000 | Q21: =IF(C21=0,0,((C21/P21)*100)-100) -> -0.28432548824618209 | R21: =IF(C21=0,0,(C21/$C$40)*100) -> 31.078031805401185 | T21: 17.37 | U21: 16.79 | V21: =U21-T21 -> -0.58000000000000185
A22: Pinheirinho | B22: 5050000 | C22: 5488027.1799999997 | D22: 5497921.7699999996 | F22: 4579249.77 | G22: 3840358.9 | H22: 2927977.02 | J22: =IF(B22=0,0,((C22/B22)*100)-100) -> 8.6738055445544546 | K22: =IF(C22=0,0,IF(D22=0,0,((C22/D22)*100)-100)) -> -0.17996963969169144 | L22: =IF(F22=0,0,((C22/F22)*100)-100) -> 19.845552342518317 | M22: =IF(G22=0,0,((C22/G22)*100)-100) -> 42.904018163510699 | N22: =IF(C22=0,0,IF(H22=0,0,((C22/H22)*100)-100)) -> 87.434093318123075 | P22: 5050000 | Q22: =IF(C22=0,0,IF(P22=0,0,((C22/P22)*100)-100)) -> 8.6738055445544546 | R22: =IF(C22=0,0,(C22/$C$40)*100) -> 4.7248253705787713 | T22: 16.3 | U22: 16.206538472355014 | V22: =U22-T22 -> -9.346152764498683E-2
A23: Londrina | B23: 3600000 | C23: 3781000.31 | D23: 3599518.79 | F23: 3472147.31 | G23: 3325179.67 | H23: 2510655.65 | J23: =IF(B23=0,0,((C23/B23)*100)-100) -> 5.0277863888888987 | K23: =IF(C23=0,0,IF(D23=0,0,((C23/D23)*100)-100)) -> 5.0418272715837134 | L23: =IF(F23=0,0,((C23/F23)*100)-100) -> 8.8951583105499026 | M23: =IF(G23=0,0,((C23/G23)*100)-100) -> 13.708150693703729 | N23: =IF(C23=0,0,IF(H23=0,0,((C23/H23)*100)-100)) -> 50.598124039829997 | P23: 3600000 | Q23: =IF(C23=0,0,IF(P23=0,0,((C23/P23)*100)-100)) -> 5.0277863888888987 | R23: =IF(C23=0,0,(C23/$C$40)*100) -> 3.255189087976456 | T23: 16.858499999999999 | U23: 15.783438430873867 | V23: =U23-T23 -> -1.0750615691261327
A24: São Bráz | B24: 5350000 | C24: 5384324.4900000002 | D24: 5473689.9400000004 | F24: 5050091 | G24: 4496056.82 | H24: 3060707.01 | J24: =IF(B24=0,0,((C24/B24)*100)-100) -> 0.64157925233645585 | K24: =IF(C24=0,0,IF(D24=0,0,((C24/D24)*100)-100)) -> -1.632636319915477 | L24: =IF(F24=0,0,((C24/F24)*100)-100) -> 6.6183656888559028 | M24: =IF(G24=0,0,((C24/G24)*100)-100) -> 19.756593512090006 | N24: =IF(C24=0,0,IF(H24=0,0,((C24/H24)*100)-100)) -> 75.917671061236291 | P24: 5350000 | Q24: =IF(C24=0,0,IF(P24=0,0,((C24/P24)*100)-100)) -> 0.64157925233645585 | R24: =IF(C24=0,0,(C24/$C$40)*100) -> 4.6355442710800512 | T24: 16.35 | U24: 16.021125665849311 | V24: =U24-T24 -> -0.32887433415069012
A25: S.J. Pinhais | B25: 5900000 | C25: 6287730.6299999999 | D25: 6076096.3600000003 | F25: 5556268.9299999997 | G25: 4917452.74 | H25: 3871883.93 | J25: =IF(B25=0,0,((C25/B25)*100)-100) -> 6.5717055932203294 | K25: =IF(C25=0,0,IF(D25=0,0,((C25/D25)*100)-100)) -> 3.48306309612245 | L25: =IF(F25=0,0,((C25/F25)*100)-100) -> 13.164620165352574 | M25: =IF(G25=0,0,((C25/G25)*100)-100) -> 27.865603645842057 | N25: =IF(C25=0,0,IF(H25=0,0,((C25/H25)*100)-100)) -> 62.394605408535568 | P25: 5900000 | Q25: =IF(C25=0,0,IF(P25=0,0,((C25/P25)*100)-100)) -> 6.5717055932203294 | R25: =IF(C25=0,0,(C25/$C$40)*100) -> 5.413316703724715 | T25: 16.248899999999999 | U25: 16.174654334707085 | V25: =U25-T25 -> -7.4245665292913543E-2
A26: P.G. Nova | B26: 5399999 | C26: 6006783.7199999997 | D26: 5300955.09 | F26: 4417916.14 | G26: 4576964.85 | H26: 3614961.63 | J26: =IF(B26=0,0,((C26/B26)*100)-100) -> 11.236756154954833 | K26: =IF(C26=0,0,IF(D26=0,0,((C26/D26)*100)-100)) -> 13.315121860426842 | L26: =IF(F26=0,0,((C26/F26)*100)-100) -> 35.964186047225411 | M26: =IF(G26=0,0,((C26/G26)*100)-100) -> 31.23945489771458 | N26: =IF(C26=0,0,IF(H26=0,0,((C26/H26)*100)-100)) -> 66.164522194389122 | P26: 5400000 | Q26: =IF(C26=0,0,IF(P26=0,0,((C26/P26)*100)-100)) -> 11.236735555555555 | R26: =IF(C26=0,0,(C26/$C$40)*100) -> 5.1714401523491604 | T26: 16.198 | U26: 14.811237878230116 | V26: =U26-T26 -> -1.386762121769884
A27: Nilo Pecanha | B27: 13000000 | C27: 13609655.539999999 | D27: 13544150.26 | F27: 12394357.560000001 | G27: 10884226.52 | H27: 9125971.6099999994 | J27: =IF(B27=0,0,((C27/B27)*100)-100) -> 4.6896579999999801 | K27: =IF(C27=0,0,IF(D27=0,0,((C27/D27)*100)-100)) -> 0.48364259656403874 | L27: =IF(F27=0,0,((C27/F27)*100)-100) -> 9.8052518988325659 | M27: =IF(G27=0,0,((C27/G27)*100)-100) -> 25.040171802672106 | N27: =IF(C27=0,0,IF(H27=0,0,((C27/H27)*100)-100)) -> 49.131030882091466 | P27: 13000000 | Q27: =IF(C27=0,0,IF(P27=0,0,((C27/P27)*100)-100)) -> 4.6896579999999801 | R27: =IF(C27=0,0,(C27/$C$40)*100) -> 11.717005705542064 | T27: 16.2607 | U27: 16.566973733267609 | V27: =U27-T27 -> 0.30627373326760932
A28: Champagnat | B28: 6800000 | C28: 6890688.2999999998 | D28: 6942778.3200000003 | F28: 7036972.5300000003 | G28: 6168761.1500000004 | H28: 5435230.9000000004 | J28: =IF(B28=0,0,((C28/B28)*100)-100) -> 1.3336514705882365 | K28: =IF(C28=0,0,IF(D28=0,0,((C28/D28)*100)-100)) -> -0.75027629572940668 | L28: =IF(F28=0,0,((C28/F28)*100)-100) -> -2.0787949558757362 | M28: =IF(G28=0,0,((C28/G28)*100)-100) -> 11.702951896589468 | N28: =IF(C28=0,0,IF(H28=0,0,((C28/H28)*100)-100)) -> 26.778207343500341 | P28: 6800000 | Q28: =IF(C28=0,0,IF(P28=0,0,((C28/P28)*100)-100)) -> 1.3336514705882365 | R28: =IF(C28=0,0,(C28/$C$40)*100) -> 5.9324230425167652 | T28: 16.75 | U28: 17.204178951179667 | V28: =U28-T28 -> 0.45417895117966722
A29: Santa Candida | B29: 7300000 | C29: 7587972.4000000004 | D29: 7541666.5599999996 | F29: 6620332.0099999998 | G29: 5016742.18 | H29: 4034522.07 | J29: =IF(B29=0,0,((C29/B29)*100)-100) -> 3.9448273972602692 | K29: =IF(C29=0,0,IF(D29=0,0,((C29/D29)*100)-100)) -> 0.61400009708198411 | L29: =IF(F29=0,0,((C29/F29)*100)-100) -> 14.616191280714943 | M29: =IF(G29=0,0,((C29/G29)*100)-100) -> 51.252987053044052 | N29: =IF(C29=0,0,IF(H29=0,0,((C29/H29)*100)-100)) -> 88.076115791330892 | P29: 7300000 | Q29: =IF(C29=0,0,IF(P29=0,0,((C29/P29)*100)-100)) -> 3.9448273972602692 | R29: =IF(C29=0,0,(C29/$C$40)*100) -> 6.5327381463098897 | T29: 16.001100000000001 | U29: 16.168270115215496 | V29: =U29-T29 -> 0.16717011521549452
A30: Paranaguá Raia | B30: 0 | C30: 0 | D30: 0 | F30: 0 | G30: 0 | H30: 0 | J30: =IF(B30=0,0,((C30/B30)*100)-100) -> 0 | K30: =IF(C30=0,0,IF(D30=0,0,((C30/D30)*100)-100)) -> 0 | L30: =IF(F30=0,0,((C30/F30)*100)-100) -> 0 | M30: =IF(G30=0,0,((C30/G30)*100)-100) -> 0 | N30: =IF(C30=0,0,IF(H30=0,0,((C30/H30)*100)-100)) -> 0 | P30: 0 | Q30: =IF(C30=0,0,IF(P30=0,0,((C30/P30)*100)-100)) -> 0 | R30: =IF(C30=0,0,(C30/$C$40)*100) -> 0 | T30: 0 | U30: 0 | V30: =U30-T30 -> 0
A31: Uvaranas | B31: 5000000 | C31: 5015346.53 | D31: 5082778.71 | F31: 5100418.98 | G31: 0 | H31: 0 | J31: =IF(B31=0,0,((C31/B31)*100)-100) -> 0.30693060000000116 | K31: =IF(C31=0,0,IF(D31=0,0,((C31/D31)*100)-100)) -> -1.3266794375157787 | L31: =IF(F31=0,0,((C31/F31)*100)-100) -> -1.6679502278850009 | M31: =IF(G31=0,0,((C31/G31)*100)-100) -> 0 | N31: =IF(C31=0,0,IF(H31=0,0,((C31/H31)*100)-100)) -> 0 | P31: 5000000 | Q31: =IF(C31=0,0,IF(P31=0,0,((C31/P31)*100)-100)) -> 0.30693060000000116 | R31: =IF(C31=0,0,(C31/$C$40)*100) -> 4.3178788570045326 | T31: 16.05 | U31: 15.147505713827513 | V31: =U31-T31 -> -0.90249428617248739
A32: Torres | B32: 5350000 | C32: 5757549.9900000002 | D32: 5578345.8700000001 | F32: 5090387.72 | G32: 0 | H32: 0 | J32: =IF(B32=0,0,((C32/B32)*100)-100) -> 7.6177568224299108 | K32: =IF(C32=0,0,IF(D32=0,0,((C32/D32)*100)-100)) -> 3.2124956784008134 | L32: =IF(F32=0,0,((C32/F32)*100)-100) -> 13.106315406560043 | M32: =IF(G32=0,0,((C32/G32)*100)-100) -> 0 | N32: =IF(C32=0,0,IF(H32=0,0,((C32/H32)*100)-100)) -> 0 | P32: 5350000 | Q32: =IF(C32=0,0,IF(P32=0,0,((C32/P32)*100)-100)) -> 7.6177568224299108 | R32: =IF(C32=0,0,(C32/$C$40)*100) -> 4.9568665338001399 | T32: 15.995100000000001 | U32: 16.090622273520196 | V32: =U32-T32 -> 9.5522273520195711E-2
A33: Total Hiper | B33: =SUM(B22:B32) -> 62749999 | C33: =SUM(C22:C32) -> 65809079.089999996 | D33: =SUM(D22:D32) -> 64637901.670000002 | F33: =SUM(F22:F32) -> 59318141.950000003 | G33: =SUM(G22:G32) -> 43225742.829999998 | H33: =SUM(H22:H32) -> 34581909.82 | I33: =SUM(B33:H33) -> 330322774.35999995 | J33: =IF(C33=0,0,((C33/B33)*100)-100) -> 4.8750281095621943 | K33: =IF(C33=0,0,IF(D33=0,0,((C33/D33)*100)-100)) -> 1.8119050738671518 | L33: =IF(F33=0,0,IF(C33=0,0,((C33/F33)*100)-100)) -> 10.942583376045874 | M33: =IF(G33=0,0,IF(C33=0,0,((C33/G33)*100)-100)) -> 52.245108542880757 | N33: =IF(C33=0,0,IF(H33=0,0,((C33/H33)*100)-100)) -> 90.299146092678114 | P33: =SUM(P22:P32) -> 62750000 | Q33: =IF(C33=0,0,((C33/P33)*100)-100) -> 4.875026438247005 | R33: =IF(C33=0,0,(C33/$C$40)*100) -> 56.657227870882544 | T33: 16.22 | U33: 16.09 | V33: =U33-T33 -> -0.12999999999999901
A34: Total s/ 25,27,30 | B34: =B21+B33 -> 98950999 | C34: =C21+C33 -> 101907150.41999999 | D34: =D21+D33 -> 102876365.72 | E34: =E21+E33 -> 0 | F34: =F21+F33 -> 92478475.850000009 | G34: =G21+G33 -> 69801457.790000007 | H34: =H21+H33 -> 54240360.650000006 | I34: =SUM(B34:H34) -> 520254809.43000007 | J34: =IF(C34=0,0,((C34/B34)*100)-100) -> 2.9874902223068887 | K34: =IF(C34=0,0,IF(D34=0,0,((C34/D34)*100)-100)) -> -0.94211658160431 | L34: =IF(F34=0,0,IF(C34=0,0,((C34/F34)*100)-100)) -> 10.195534131956578 | M34: =IF(G34=0,0,IF(C34=0,0,((C34/G34)*100)-100)) -> 45.995733680220553 | N34: =IF(C34=0,0,IF(H34=0,0,((C34/H34)*100)-100)) -> 87.880665244064829 | P34: =P21+P33 -> 98951000 | Q34: =IF(C34=0,0,((C34/P34)*100)-100) -> 2.9874891815140785 | R34: =IF(C34=0,0,(C34/$C$40)*100) -> 87.735259676283732 | T34: 16.76 | U34: 16.48 | V34: =U34-T34 -> -0.28000000000000114
A35: Paranaguá | B35: 5000000 | C35: 5408967.0999999996 | D35: 5288471.88 | F35: 1886647.27 | G35: 1815878.55 | H35: 1528827.98 | J35: =IF(B35=0,0,((C35/B35)*100)-100) -> 8.1793419999999912 | K35: =IF(C35=0,0,IF(D35=0,0,((C35/D35)*100)-100)) -> 2.2784506136014357 | L35: =IF(F35=0,0,((C35/F35)*100)-100) -> 186.69731676976375 | M35: =IF(G35=0,0,((C35/G35)*100)-100) -> 197.87053214544545 | N35: =IF(C35=0,0,IF(H35=0,0,((C35/H35)*100)-100)) -> 253.79828017014705 | P35: 5000000 | Q35: =IF(P35=0,0,IF(C35=0,0,((C35/P35)*100)-100)) -> 8.1793419999999912 | R35: =IF(C35=0,0,(C35/$C$40)*100) -> 4.6567599147178207 | T35: 17.9497 | U35: 17.609764389212128 | V35: =U35-T35 -> -0.33993561078787238
A36: Paranaguá Raia | B36: 0 | C36: 0 | D36: 0 | F36: 6627905.9800000004 | G36: 5796426.8300000001 | H36: 4566930.09 | J36: =IF(B36=0,0,((C36/B36)*100)-100) -> 0 | K36: =IF(C36=0,0,IF(D36=0,0,((C36/D36)*100)-100)) -> 0 | L36: =IF(F36=0,0,((C36/F36)*100)-100) -> -100 | M36: =IF(G36=0,0,((C36/G36)*100)-100) -> -100 | N36: =IF(C36=0,0,IF(H36=0,0,((C36/H36)*100)-100)) -> 0 | P36: 1E-3 | Q36: =IF(P36=0,0,IF(C36=0,0,((C36/P36)*100)-100)) -> 0 | R36: =IF(C36=0,0,(C36/$C$40)*100) -> 0 | T36: 18.200700000000001 | U36: 0 | V36: =U36-T36 -> -18.200700000000001
A37: Novo Mundo | B37: 5400000 | C37: 5852527.5599999996 | D37: 5639048.2999999998 | F37: 0 | G37: 0 | H37: 0 | J37: =IF(B37=0,0,((C37/B37)*100)-100) -> 8.3801399999999973 | K37: =IF(C37=0,0,IF(D37=0,0,((C37/D37)*100)-100)) -> 3.7857320711368772 | L37: =IF(F37=0,0,((C37/F37)*100)-100) -> 0 | M37: =IF(G37=0,0,((C37/G37)*100)-100) -> 0 | N37: =IF(C37=0,0,IF(H37=0,0,((C37/H37)*100)-100)) -> 0 | P37: 5400000 | Q37: =IF(P37=0,0,IF(C37=0,0,((C37/P37)*100)-100)) -> 8.3801399999999973 | R37: =IF(C37=0,0,(C37/$C$40)*100) -> 5.0386358869125489 | T37: 15.5 | U37: 15.849201354294864 | V37: =U37-T37 -> 0.34920135429486443
A38: Fazenda | B38: 3200000 | C38: 2984371.16 | D38: 3384910.63 | F38: 0 | G38: 0 | H38: 0 | J38: =IF(B38=0,0,((C38/B38)*100)-100) -> -6.7384012499999955 | K38: =IF(C38=0,0,IF(D38=0,0,((C38/D38)*100)-100)) -> -11.833088485411494 | L38: =IF(F38=0,0,((C38/F38)*100)-100) -> 0 | M38: =IF(G38=0,0,((C38/G38)*100)-100) -> 0 | N38: =IF(C38=0,0,IF(H38=0,0,((C38/H38)*100)-100)) -> 0 | P38: 3200000 | Q38: =IF(P38=0,0,IF(C38=0,0,((C38/P38)*100)-100)) -> -6.7384012499999955 | R38: =IF(C38=0,0,(C38/$C$40)*100) -> 2.5693445220859128 | T38: 16 | U38: 14.797608873823858 | V38: =U38-T38 -> -1.202391126176142
A39: Total Lojas Novas | B39: =SUM(B35:B38) -> 13600000 | C39: =SUM(C35:C38) -> 14245865.82 | D39: =SUM(D35:D38) -> 14312430.809999999 | F39: =SUM(F35:F38) -> 8514553.25 | G39: =SUM(G35:G38) -> 7612305.3799999999 | H39: =SUM(H35:H38) -> 6095758.0700000003 | J39: =IF(C39=0,0,((C39/B39)*100)-100) -> 4.7490133823529419 | K39: =IF(C39=0,0,IF(D39=0,0,((C39/D39)*100)-100)) -> -0.46508514789458388 | L39: =IF(F39=0,0,IF(C39=0,0,((C39/F39)*100)-100)) -> 67.311958733712771 | M39: =IF(G39=0,0,IF(C39=0,0,((C39/G39)*100)-100)) -> 87.142594902045289 | N39: =IF(C39=0,0,IF(H39=0,0,((C39/H39)*100)-100)) -> 133.70129943493637 | P39: =SUM(P35:P38) -> 13600000.001 | Q39: =IF(P39=0,0,IF(C39=0,0,((C39/P39)*100)-100)) -> 4.749013374650815 | R39: =IF(C39=0,0,(C39/$C$40)*100) -> 12.264740323716284
A40: Total Geral | B40: =B21+B33+B39 -> 112550999 | C40: =C21+C33+C39 -> 116153016.23999998 | D40: =D21+D33+D39 -> 117188796.53 | F40: =F21+F33+F39 -> 100993029.10000001 | G40: =G21+G33+G39 -> 77413763.170000002 | H40: =H21+H33+H39 -> 60336118.720000006 | J40: =IF(C40=0,0,((C40/B40)*100)-100) -> 3.200342308823025 | K40: =IF(C40=0,0,IF(D40=0,0,((C40/D40)*100)-100)) -> -0.88385606872826372 | L40: =IF(F40=0,0,IF(C40=0,0,((C40/F40)*100)-100)) -> 15.010924293585703 | M40: =IF(G40=0,0,IF(C40=0,0,((C40/G40)*100)-100)) -> 50.041816188329335 | N40: =IF(C40=0,0,IF(H40=0,0,((C40/H40)*100)-100)) -> 92.509923913117035 | P40: =P21+P33+P39 -> 112551000.001 | Q40: =IF(C40=0,0,((C40/P40)*100)-100) -> 3.2003413909854004 | R40: =R21+R33+R39 -> 100 | T40: 16.67 | U40: 16.36 | V40: =U40-T40 -> -0.31000000000000227