A2: Periodo: | C2: 38504 | D2: a | E2: 38533 | H2: Vendas Acumuladas por Filial | Q2: =NOW() -> 38540.3678552083
A4: v.1 | C4: Vendas 2005 | G4: Vendas de Anos Anteriores | K4: Percentuais ( % ) | Q4: Meta Mensal | U4: Margem
A5: Lojas | C5: Previsao | D5: Realizada | E5: Mes Anterior | G5: Vendas 2004 | H5: Vendas 2003 | I5: Vendas 2002 | K5: % Prev | L5: % MA | M5: 2004 | N5: 2003 | O5: 2002 | Q5: Previsao Mes | R5: Final | S5: Part. | U5: Meta | V5: Real
A7: Xaxim | C7: 770000 | D7: 739593 | E7: 720477 | G7: 717141 | H7: 679172 | I7: 565524 | K7: =IF(C7=0,0,((D7/C7)*100)-100) -> -3.95 | L7: =IF(D7=0,0,IF(E7=0,0,((D7/E7)*100)-100)) -> 2.65 | M7: =IF(G7=0,0,((D7/G7)*100)-100) -> 3.13 | N7: =IF(H7=0,0,((D7/H7)*100)-100) -> 8.9 | O7: =IF(D7=0,0,IF(I7=0,0,((D7/I7)*100)-100)) -> 30.78 | Q7: 770000 | R7: =IF(D7=0,0,((D7/Q7)*100)-100) -> -3.95 | S7: =IF(D7=0,0,(D7/$D$35)*100) -> 1.36 | U7: 17.42 | V7: 16.9
A8: S. Felicidade | C8: 740000 | D8: 716033 | E8: 705284 | G8: 630404 | H8: 717340 | I8: 522682 | K8: =IF(C8=0,0,((D8/C8)*100)-100) -> -3.24 | L8: =IF(D8=0,0,IF(E8=0,0,((D8/E8)*100)-100)) -> 1.52 | M8: =IF(G8=0,0,((D8/G8)*100)-100) -> 13.58 | N8: =IF(H8=0,0,((D8/H8)*100)-100) -> -00.18 | O8: =IF(D8=0,0,IF(I8=0,0,((D8/I8)*100)-100)) -> 36.99 | Q8: 740000 | R8: =IF(D8=0,0,((D8/Q8)*100)-100) -> -3.24 | S8: =IF(D8=0,0,(D8/$D$35)*100) -> 1.32 | U8: 16.75 | V8: 17.1
A9: Lapa | C9: 1160000 | D9: 1114880 | E9: 1125051 | G9: 1051047 | H9: 962008 | I9: 786968 | K9: =IF(C9=0,0,((D9/C9)*100)-100) -> -3.89 | L9: =IF(D9=0,0,IF(E9=0,0,((D9/E9)*100)-100)) -> -00.9 | M9: =IF(G9=0,0,((D9/G9)*100)-100) -> 6.07 | N9: =IF(H9=0,0,((D9/H9)*100)-100) -> 15.89 | O9: =IF(D9=0,0,IF(I9=0,0,((D9/I9)*100)-100)) -> 41.67 | Q9: 1160000 | R9: =IF(D9=0,0,((D9/Q9)*100)-100) -> -3.89 | S9: =IF(D9=0,0,(D9/$D$35)*100) -> 2.05 | U9: 16.9 | V9: 16.34
A10: Araucaria | C10: 1050000 | D10: 926628 | E10: 927768 | G10: 960060 | H10: 980761 | I10: 1484185 | K10: =IF(C10=0,0,((D10/C10)*100)-100) -> -11.75 | L10: =IF(D10=0,0,IF(E10=0,0,((D10/E10)*100)-100)) -> -00.12 | M10: =IF(G10=0,0,((D10/G10)*100)-100) -> -3.48 | N10: =IF(H10=0,0,((D10/H10)*100)-100) -> -5.52 | O10: =IF(D10=0,0,IF(I10=0,0,((D10/I10)*100)-100)) -> -37.57 | Q10: 1050000 | R10: =IF(D10=0,0,((D10/Q10)*100)-100) -> -11.75 | S10: =IF(D10=0,0,(D10/$D$35)*100) -> 1.7 | U10: 18.1 | V10: 17.49
A11: Pinheirinho | C11: 2100000 | D11: 1805768 | E11: 1852216 | G11: 1828470 | H11: 1820985 | I11: 1680332 | K11: =IF(C11=0,0,((D11/C11)*100)-100) -> -14.01 | L11: =IF(D11=0,0,IF(E11=0,0,((D11/E11)*100)-100)) -> -2.51 | M11: =IF(G11=0,0,((D11/G11)*100)-100) -> -1.24 | N11: =IF(H11=0,0,((D11/H11)*100)-100) -> -00.84 | O11: =IF(D11=0,0,IF(I11=0,0,((D11/I11)*100)-100)) -> 7.46 | Q11: 2100000 | R11: =IF(D11=0,0,((D11/Q11)*100)-100) -> -14.01 | S11: =IF(D11=0,0,(D11/$D$35)*100) -> 3.32 | U11: 17.45 | V11: 17.63
A12: Hauer | C12: 3100000 | D12: 2907759 | E12: 2924646 | G12: 2720835 | H12: 2735855 | I12: 2457303 | K12: =IF(C12=0,0,((D12/C12)*100)-100) -> -6.2 | L12: =IF(D12=0,0,IF(E12=0,0,((D12/E12)*100)-100)) -> -00.58 | M12: =IF(G12=0,0,((D12/G12)*100)-100) -> 6.87 | N12: =IF(H12=0,0,((D12/H12)*100)-100) -> 6.28 | O12: =IF(D12=0,0,IF(I12=0,0,((D12/I12)*100)-100)) -> 18.33 | Q12: 3100000 | R12: =IF(D12=0,0,((D12/Q12)*100)-100) -> -6.2 | S12: =IF(D12=0,0,(D12/$D$35)*100) -> 5.34 | U12: 16.9 | V12: 16.82
A13: Paranagua | C13: 1800000 | D13: 1606019 | E13: 1666775 | G13: 2989738 | H13: 2737779 | I13: 2511117 | K13: =IF(C13=0,0,((D13/C13)*100)-100) -> -10.78 | L13: =IF(D13=0,0,IF(E13=0,0,((D13/E13)*100)-100)) -> -3.65 | M13: =IF(G13=0,0,((D13/G13)*100)-100) -> -46.28 | N13: =IF(H13=0,0,((D13/H13)*100)-100) -> -41.34 | O13: =IF(D13=0,0,IF(I13=0,0,((D13/I13)*100)-100)) -> -36.04 | Q13: 1800000 | R13: =IF(D13=0,0,((D13/Q13)*100)-100) -> -10.78 | S13: =IF(D13=0,0,(D13/$D$35)*100) -> 2.95 | U13: 17.59 | V13: 17.5
A14: Centenario | C14: 990000 | D14: 934116 | E14: 905257 | G14: 814210 | H14: 929659 | I14: 745967 | K14: =IF(C14=0,0,((D14/C14)*100)-100) -> -5.64 | L14: =IF(D14=0,0,IF(E14=0,0,((D14/E14)*100)-100)) -> 3.19 | M14: =IF(G14=0,0,((D14/G14)*100)-100) -> 14.73 | N14: =IF(H14=0,0,((D14/H14)*100)-100) -> 00.48 | O14: =IF(D14=0,0,IF(I14=0,0,((D14/I14)*100)-100)) -> 25.22 | Q14: 990000 | R14: =IF(D14=0,0,((D14/Q14)*100)-100) -> -5.64 | S14: =IF(D14=0,0,(D14/$D$35)*100) -> 1.72 | U14: 17.1 | V14: 16.63
A15: Arapongas | C15: 0 | D15: 0 | E15: 0 | G15: 0 | H15: 0 | I15: 0 | K15: =IF(C15=0,0,((D15/C15)*100)-100) -> 0 | L15: =IF(D15=0,0,IF(E15=0,0,((D15/E15)*100)-100)) -> 0 | M15: =IF(D15=0,0,IF(G15=0,0,((D15/G15)*100)-100)) -> 0 | N15: =IF(D15=0,0,IF(H15=0,0,((D15/H15)*100)-100)) -> 0 | O15: =IF(D15=0,0,IF(I15=0,0,((D15/I15)*100)-100)) -> 0 | Q15: 0 | R15: =IF(D15=0,0,((D15/Q15)*100)-100) -> 0 | S15: =IF(D15=0,0,(D15/$D$35)*100) -> 0 | U15: 0 | V15: 0
A16: Sao Braz | C16: 3200000 | D16: 3058550 | E16: 3069672 | G16: 2816856 | H16: 3004389 | I16: 2436629 | K16: =IF(C16=0,0,((D16/C16)*100)-100) -> -4.42 | L16: =IF(D16=0,0,IF(E16=0,0,((D16/E16)*100)-100)) -> -00.36 | M16: =IF(G16=0,0,((D16/G16)*100)-100) -> 8.58 | N16: =IF(H16=0,0,((D16/H16)*100)-100) -> 1.8 | O16: =IF(D16=0,0,IF(I16=0,0,((D16/I16)*100)-100)) -> 25.52 | Q16: 3200000 | R16: =IF(D16=0,0,((D16/Q16)*100)-100) -> -4.42 | S16: =IF(D16=0,0,(D16/$D$35)*100) -> 5.62 | U16: 16.92 | V16: 16.75
A17: Sitio Cercado | C17: 1650000 | D17: 1162383 | E17: 1421495 | G17: 1444058 | H17: 1288308 | I17: 856997 | K17: =IF(C17=0,0,((D17/C17)*100)-100) -> -29.55 | L17: =IF(D17=0,0,IF(E17=0,0,((D17/E17)*100)-100)) -> -18.23 | M17: =IF(G17=0,0,((D17/G17)*100)-100) -> -19.51 | N17: =IF(H17=0,0,((D17/H17)*100)-100) -> -9.77 | O17: =IF(D17=0,0,IF(I17=0,0,((D17/I17)*100)-100)) -> 35.63 | Q17: 1650000 | R17: =IF(D17=0,0,((D17/Q17)*100)-100) -> -29.55 | S17: =IF(D17=0,0,(D17/$D$35)*100) -> 2.14 | U17: 17.76 | V17: 14.82
A18: Apucarana | C18: 1550000 | D18: 1429338 | E18: 1498441 | G18: 1336992 | H18: 1221294 | I18: 1123883 | K18: =IF(C18=0,0,((D18/C18)*100)-100) -> -7.78 | L18: =IF(D18=0,0,IF(E18=0,0,((D18/E18)*100)-100)) -> -4.61 | M18: =IF(G18=0,0,((D18/G18)*100)-100) -> 6.91 | N18: =IF(H18=0,0,((D18/H18)*100)-100) -> 17.03 | O18: =IF(D18=0,0,IF(I18=0,0,((D18/I18)*100)-100)) -> 27.18 | Q18: 1550000 | R18: =IF(D18=0,0,((D18/Q18)*100)-100) -> -7.78 | S18: =IF(D18=0,0,(D18/$D$35)*100) -> 2.63 | U18: 18.2 | V18: 18.06
A19: Ahu | C19: 1200000 | D19: 1045089 | E19: 1031099 | G19: 1013318 | H19: 1223100 | I19: 1039700 | K19: =IF(C19=0,0,((D19/C19)*100)-100) -> -12.91 | L19: =IF(D19=0,0,IF(E19=0,0,((D19/E19)*100)-100)) -> 1.36 | M19: =IF(G19=0,0,((D19/G19)*100)-100) -> 3.14 | N19: =IF(H19=0,0,((D19/H19)*100)-100) -> -14.55 | O19: =IF(D19=0,0,IF(I19=0,0,((D19/I19)*100)-100)) -> 00.52 | Q19: 1200000 | R19: =IF(D19=0,0,((D19/Q19)*100)-100) -> -12.91 | S19: =IF(D19=0,0,(D19/$D$35)*100) -> 1.92 | U19: 17.91 | V19: 16.8
A20: P.G. Centro | C20: 1750000 | D20: 1617439 | E20: 1591444 | G20: 1603418 | H20: 1555339 | I20: 1214109 | K20: =IF(C20=0,0,((D20/C20)*100)-100) -> -7.57 | L20: =IF(D20=0,0,IF(E20=0,0,((D20/E20)*100)-100)) -> 1.63 | M20: =IF(G20=0,0,((D20/G20)*100)-100) -> 00.87 | N20: =IF(H20=0,0,((D20/H20)*100)-100) -> 3.99 | O20: =IF(D20=0,0,IF(I20=0,0,((D20/I20)*100)-100)) -> 33.22 | Q20: 1750000 | R20: =IF(D20=0,0,((D20/Q20)*100)-100) -> -7.57 | S20: =IF(D20=0,0,(D20/$D$35)*100) -> 2.97 | U20: 18.9 | V20: 18.19
A21: Maringa | C21: 2250000 | D21: 2156760 | E21: 2135621 | G21: 2026575 | H21: 1818608 | I21: 1603123 | K21: =IF(C21=0,0,((D21/C21)*100)-100) -> -4.14 | L21: =IF(D21=0,0,IF(E21=0,0,((D21/E21)*100)-100)) -> 00.99 | M21: =IF(G21=0,0,((D21/G21)*100)-100) -> 6.42 | N21: =IF(H21=0,0,((D21/H21)*100)-100) -> 18.59 | O21: =IF(D21=0,0,IF(I21=0,0,((D21/I21)*100)-100)) -> 34.53 | Q21: 2250000 | R21: =IF(D21=0,0,((D21/Q21)*100)-100) -> -4.14 | S21: =IF(D21=0,0,(D21/$D$35)*100) -> 3.96 | U21: 19.2 | V21: 18.37
A22: Araucaria Nova | C22: 2200000 | D22: 1928021 | E22: 1991626 | G22: 1949037 | H22: 1844683 | I22: 0 | K22: =IF(C22=0,0,((D22/C22)*100)-100) -> -12.36 | L22: =IF(D22=0,0,IF(E22=0,0,((D22/E22)*100)-100)) -> -3.19 | M22: =IF(G22=0,0,((D22/G22)*100)-100) -> -1.08 | N22: =IF(H22=0,0,((D22/H22)*100)-100) -> 4.52 | O22: =IF(D22=0,0,IF(I22=0,0,((D22/I22)*100)-100)) -> 0 | Q22: 2200000 | R22: =IF(D22=0,0,((D22/Q22)*100)-100) -> -12.36 | S22: =IF(D22=0,0,(D22/$D$35)*100) -> 3.54 | U22: 17.9 | V22: 17.72
A23: Sitio Cercado | C23: 0 | D23: 0 | E23: 0 | G23: 0 | H23: 0 | I23: 0 | K23: =IF(C23=0,0,((D23/C23)*100)-100) -> 0 | L23: =IF(D23=0,0,IF(E23=0,0,((D23/E23)*100)-100)) -> 0 | M23: =IF(G23=0,0,((D23/G23)*100)-100) -> 0 | N23: =IF(H23=0,0,((D23/H23)*100)-100) -> 0 | O23: =IF(D23=0,0,IF(I23=0,0,((D23/I23)*100)-100)) -> 0 | Q23: 0 | R23: =IF(Q23=0,0,IF(D23=0,0,((D23/Q23)*100)-100)) -> 0 | S23: =IF(D23=0,0,(D23/$D$35)*100) -> 0 | U23: 0 | V23: 0
A24: Total Super | C24: =SUM(C7:C23) -> 25510000 | D24: =SUM(D7:D23) -> 23148376 | E24: =SUM(E7:E23) -> 23566872 | G24: =SUM(G7:G23) -> 23902159 | H24: =SUM(H7:H23) -> 23519280 | I24: =SUM(I7:I23) -> 19028519 | J24: =SUM(C24:I24) -> 138675206 | K24: =IF(D24=0,0,((D24/C24)*100)-100) -> -9.26 | L24: =IF(D24=0,0,IF(E24=0,0,((D24/E24)*100)-100)) -> -1.78 | M24: =IF(G24=0,0,IF(D24=0,0,((D24/G24)*100)-100)) -> -3.15 | N24: =IF(H24=0,0,IF(D24=0,0,((D24/H24)*100)-100)) -> -1.58 | O24: =IF(D24=0,0,IF(I24=0,0,((D24/I24)*100)-100)) -> 21.65 | Q24: =SUM(Q7:Q23) -> 25510000 | R24: =IF(D24=0,0,((D24/Q24)*100)-100) -> -9.26 | S24: =IF(D24=0,0,(D24/$D$35)*100) -> 42.55 | U24: 17.67 | V24: 16.94
A26: Londrina | C26: 2600000 | D26: 2490522 | E26: 2537580 | G26: 2174739 | H26: 2015177 | I26: 1991154 | K26: =IF(C26=0,0,((D26/C26)*100)-100) -> -4.21 | L26: =IF(D26=0,0,IF(E26=0,0,((D26/E26)*100)-100)) -> -1.85 | M26: =IF(G26=0,0,((D26/G26)*100)-100) -> 14.52 | N26: =IF(H26=0,0,((D26/H26)*100)-100) -> 23.59 | O26: =IF(D26=0,0,IF(I26=0,0,((D26/I26)*100)-100)) -> 25.08 | Q26: 2600000 | R26: =IF(D26=0,0,IF(Q26=0,0,((D26/Q26)*100)-100)) -> -4.21 | S26: =IF(D26=0,0,(D26/$D$35)*100) -> 4.58 | U26: 17.95 | V26: 14.87
A27: S.J. Pinhais | C27: 4200000 | D27: 3804231 | E27: 3726317 | G27: 3950795 | H27: 3765254 | I27: 3303232 | K27: =IF(C27=0,0,((D27/C27)*100)-100) -> -9.42 | L27: =IF(D27=0,0,IF(E27=0,0,((D27/E27)*100)-100)) -> 2.09 | M27: =IF(G27=0,0,((D27/G27)*100)-100) -> -3.71 | N27: =IF(H27=0,0,((D27/H27)*100)-100) -> 1.04 | O27: =IF(D27=0,0,IF(I27=0,0,((D27/I27)*100)-100)) -> 15.17 | Q27: 4200000 | R27: =IF(D27=0,0,IF(Q27=0,0,((D27/Q27)*100)-100)) -> -9.42 | S27: =IF(D27=0,0,(D27/$D$35)*100) -> 6.99 | U27: 16.8 | V27: 14.64
A28: P.G. Nova | C28: 3400000 | D28: 3235323 | E28: 3302780 | G28: 3023353 | H28: 2746314 | I28: 2521921 | K28: =IF(C28=0,0,((D28/C28)*100)-100) -> -4.84 | L28: =IF(D28=0,0,IF(E28=0,0,((D28/E28)*100)-100)) -> -2.04 | M28: =IF(G28=0,0,((D28/G28)*100)-100) -> 7.01 | N28: =IF(H28=0,0,((D28/H28)*100)-100) -> 17.81 | O28: =IF(D28=0,0,IF(I28=0,0,((D28/I28)*100)-100)) -> 28.29 | Q28: 3400000 | R28: =IF(D28=0,0,IF(Q28=0,0,((D28/Q28)*100)-100)) -> -4.84 | S28: =IF(D28=0,0,(D28/$D$35)*100) -> 5.95 | U28: 17.15 | V28: 16.03
A29: Nilo Pecanha | C29: 8700000 | D29: 8562033 | E29: 8752387 | G29: 7815025 | H29: 7956506 | I29: 6027353 | K29: =IF(C29=0,0,((D29/C29)*100)-100) -> -1.59 | L29: =IF(D29=0,0,IF(E29=0,0,((D29/E29)*100)-100)) -> -2.17 | M29: =IF(G29=0,0,((D29/G29)*100)-100) -> 9.56 | N29: =IF(H29=0,0,((D29/H29)*100)-100) -> 7.61 | O29: =IF(D29=0,0,IF(I29=0,0,((D29/I29)*100)-100)) -> 42.05 | Q29: 8700000 | R29: =IF(D29=0,0,IF(Q29=0,0,((D29/Q29)*100)-100)) -> -1.59 | S29: =IF(D29=0,0,(D29/$D$35)*100) -> 15.74 | U29: 16.5 | V29: 16.2
A30: Champagnat | C30: 5600000 | D30: 5475749 | E30: 5615394 | G30: 4527364 | H30: 0 | I30: 0 | K30: =IF(C30=0,0,((D30/C30)*100)-100) -> -2.22 | L30: =IF(D30=0,0,IF(E30=0,0,((D30/E30)*100)-100)) -> -2.49 | M30: =IF(G30=0,0,((D30/G30)*100)-100) -> 20.95 | N30: =IF(H30=0,0,((D30/H30)*100)-100) -> 0 | O30: =IF(D30=0,0,IF(I30=0,0,((D30/I30)*100)-100)) -> 0 | Q30: 5600000 | R30: =IF(D30=0,0,IF(Q30=0,0,((D30/Q30)*100)-100)) -> -2.22 | S30: =IF(D30=0,0,(D30/$D$35)*100) -> 10.07 | U30: 16.5 | V30: 16.51
A31: Santa Candida | C31: 5000000 | D31: 4118036 | E31: 4453803 | G31: 0 | H31: 0 | I31: 0 | K31: =IF(C31=0,0,((D31/C31)*100)-100) -> -17.64 | L31: =IF(D31=0,0,IF(E31=0,0,((D31/E31)*100)-100)) -> -7.54 | M31: =IF(G31=0,0,((D31/G31)*100)-100) -> 0 | N31: =IF(H31=0,0,((D31/H31)*100)-100) -> 0 | O31: =IF(D31=0,0,IF(I31=0,0,((D31/I31)*100)-100)) -> 0 | Q31: 5000000 | R31: =IF(D31=0,0,IF(Q31=0,0,((D31/Q31)*100)-100)) -> -17.64 | S31: =IF(D31=0,0,(D31/$D$35)*100) -> 7.57 | U31: 15.6 | V31: 14.81
A32: Paranagu Raia | C32: 4000000 | D32: 3567369 | E32: 3599612 | G32: 0 | H32: 0 | I32: 0 | K32: =IF(C32=0,0,((D32/C32)*100)-100) -> -10.82 | L32: =IF(D32=0,0,IF(E32=0,0,((D32/E32)*100)-100)) -> -00.9 | M32: =IF(G32=0,0,((D32/G32)*100)-100) -> 0 | N32: =IF(H32=0,0,((D32/H32)*100)-100) -> 0 | O32: =IF(D32=0,0,IF(I32=0,0,((D32/I32)*100)-100)) -> 0 | Q32: 4000000 | R32: =IF(D32=0,0,IF(Q32=0,0,((D32/Q32)*100)-100)) -> -10.82 | S32: =IF(D32=0,0,(D32/$D$35)*100) -> 6.56 | U32: 15.5 | V32: 15.11
A33: Total Hiper | C33: =SUM(C26:C32) -> 33500000 | D33: =SUM(D26:D32) -> 31253263 | E33: =SUM(E26:E32) -> 31987873 | G33: =SUM(G26:G32) -> 21491276 | H33: =SUM(H26:H32) -> 16483251 | I33: =SUM(I26:I32) -> 13843660 | J33: =SUM(C33:I33) -> 148559323 | K33: =IF(D33=0,0,((D33/C33)*100)-100) -> -6.71 | L33: =IF(D33=0,0,IF(E33=0,0,((D33/E33)*100)-100)) -> -2.3 | M33: =IF(G33=0,0,IF(D33=0,0,((D33/G33)*100)-100)) -> 45.42 | N33: =IF(H33=0,0,IF(D33=0,0,((D33/H33)*100)-100)) -> 89.61 | O33: =IF(D33=0,0,IF(I33=0,0,((D33/I33)*100)-100)) -> 125.76 | Q33: =SUM(Q26:Q32) -> 33500000 | R33: =IF(D33=0,0,((D33/Q33)*100)-100) -> -6.71 | S33: =IF(D33=0,0,(D33/$D$35)*100) -> 57.45 | U33: 16.46 | V33: 15.7
A35: Total Geral | C35: =C24+C33 -> 59010000 | D35: =D24+D33 -> 54401639 | E35: =E24+E33 -> 55554745 | G35: =G24+G33 -> 45393435 | H35: =H24+H33 -> 40002531 | I35: =I24+I33 -> 32872179 | K35: =IF(D33=0,0,((D35/C35)*100)-100) -> -7.81 | L35: =IF(D35=0,0,IF(E35=0,0,((D35/E35)*100)-100)) -> -2.08 | M35: =IF(G35=0,0,IF(D35=0,0,((D35/G35)*100)-100)) -> 19.84 | N35: =IF(H35=0,0,IF(D35=0,0,((D35/H35)*100)-100)) -> 36 | O35: =IF(D35=0,0,IF(I35=0,0,((D35/I35)*100)-100)) -> 65.49 | Q35: =Q24+Q33 -> 59010000 | R35: =IF(D35=0,0,((D35/Q35)*100)-100) -> -7.81 | S35: =S24+S33 -> 100 | U35: 16.99 | V35: 16.31
C36: Resumo por Regiao - Outubro/2002
C37: Descricao das Aberturas | H37: Valor | I37: %
C38: Curitiba (2,3,6,7,10,11,17,21,22) | H38: =D7+D8+D11+D12+D14+D16+D19+D29+D30+D32 -> 28812059 | I38: =IF(D35=0,0,H38/$D$35) -> 0.52959999999999996
C39: Curitiba e Metrop. (Ctba. 4,5,8,14,23) | H39: =H38+D9+D10+D13+D28+D23 -> 35694909 | I39: =IF(D35=0,0,H39/$D$35) -> 0.65610000000000002
C40: Metropolitana (4,5,8,14,23) | H40: =H39-H38 -> 6882850 | I40: =IF(D35=0,0,H40/$D$35) -> 0.1265
C41: Norte (9,15,20) | H41: =D26+D18+D23 -> 3919860 | I41: =IF(D35=0,0,H41/$D$35) -> 7.2099999999999997E-2
C42: Centro-Oeste (13,18,19) | H42: =D17+D20+D28 -> 6015145 | I42: =IF(D35=0,0,H42/$D$35) -> 0.1106
C43: Ponta Grossa (18,19) | H43: =H42-D17 -> 4852762 | I43: =IF(D35=0,0,H43/$D$35) -> 8.9200000000000002E-2
C44: Super (2,3,4,5,6,7,8,10,11,13,15,17,18,20,23) | H44: =D24 -> 23148376 | I44: =IF(D35=0,0,H44/$D$35) -> 0.42549999999999999
C45: Hiper (9,14,19,21,22,24) | H45: =D33 -> 31253263 | I45: =IF(D35=0,0,H45/$D$35) -> 0.57450000000000001
C46: Curitiba, Metropolitana e Centro-Oeste | H46: =D35-H41 -> 50481779 | I46: =IF(D35=0,0,H46/$D$35) -> 0.92789999999999995
C47: Araucaria | H47: =D10+D23 -> 926628 | I47: =IF(D35=0,0,H47/$D$35) -> 1.7000000000000001E-2