A2: Periodo: | B2: 40544 | C2: a | D2: 40574 | G2: Vendas Acumuladas por Filial | P2: =NOW() -> 40616.837822685186
A4: v.New | B4: Vendas 2010 | F4: Vendas de Anos Anteriores | J4: Percentuais ( % ) | P4: Meta Mensal | T4: Margem
A5: Lojas | B5: Previsao | C5: Realizada | D5: Mes Anterior | F5: Vendas 2009 | G5: Vendas 2008 | H5: Vendas 2007 | J5: % Prev | K5: % MA | L5: 2009 | M5: 2008 | N5: 2007 | P5: Previsao Mes | Q5: Final | R5: Part. | T5: Meta | U5: Coml | V5: Dif
A6: S. Felicidade | B6: 3181312 | C6: 3194619.22 | D6: 3976363.59 | F6: 2833083.79 | G6: 2507964.74 | H6: 1995836.05 | J6: =IF(B6=0,0,((C6/B6)*100)-100) -> 0.41829345879939694 | K6: =IF(C6=0,0,IF(D6=0,0,((C6/D6)*100)-100)) -> -19.659780910527843 | L6: =IF(F6=0,0,((C6/F6)*100)-100) -> 12.761197931247921 | M6: =IF(G6=0,0,((C6/G6)*100)-100) -> 27.378952704095823 | N6: =IF(C6=0,0,IF(H6=0,0,((C6/H6)*100)-100)) -> 60.06421068504099 | P6: 3181312 | Q6: =IF(C6=0,0,((C6/P6)*100)-100) -> 0.41829345879939694 | R6: =IF(C6=0,0,(C6/$C$41)*100) -> 2.3293606358542118 | T6: 16.96 | U6: 17.081746531281432 | V6: =U6-T6 -> 0.1217465312814312
A7: Lapa | B7: 2438551 | C7: 2327341.94 | D7: 3013929.55 | F7: 2275537.43 | G7: 2091331.36 | H7: 1532309.65 | J7: =IF(B7=0,0,((C7/B7)*100)-100) -> -4.5604565990213075 | K7: =IF(C7=0,0,IF(D7=0,0,((C7/D7)*100)-100)) -> -22.780479722891982 | L7: =IF(F7=0,0,((C7/F7)*100)-100) -> 2.2765835146029616 | M7: =IF(G7=0,0,((C7/G7)*100)-100) -> 11.285183424973823 | N7: =IF(C7=0,0,IF(H7=0,0,((C7/H7)*100)-100)) -> 51.884571111328569 | P7: 2438551 | Q7: =IF(C7=0,0,((C7/P7)*100)-100) -> -4.5604565990213075 | R7: =IF(C7=0,0,(C7/$C$41)*100) -> 1.6969843126432369 | T7: 16.42 | U7: 15.848048774474455 | V7: =U7-T7 -> -0.571951225525547
A8: Araucaria | B8: 1443063 | C8: 1531967 | D8: 1935272.53 | F8: 1321106.31 | G8: 1272844.17 | H8: 1026668.49 | J8: =IF(B8=0,0,((C8/B8)*100)-100) -> 6.1607843870988432 | K8: =IF(C8=0,0,IF(D8=0,0,((C8/D8)*100)-100)) -> -20.839727932272154 | L8: =IF(F8=0,0,((C8/F8)*100)-100) -> 15.960917634251558 | M8: =IF(G8=0,0,((C8/G8)*100)-100) -> 20.357781110000303 | N8: =IF(C8=0,0,IF(H8=0,0,((C8/H8)*100)-100)) -> 49.217299929016036 | P8: 1443063 | Q8: =IF(C8=0,0,((C8/P8)*100)-100) -> 6.1607843870988432 | R8: =IF(C8=0,0,(C8/$C$41)*100) -> 1.1170356713836049 | T8: 16.94 | U8: 17.061833264032451 | V8: =U8-T8 -> 0.12183326403244976
A9: Hauer | B9: 3809071 | C9: 4044783.01 | D9: 5079197.72 | F9: 3606109.5 | G9: 3459075.57 | H9: 3144041.2 | J9: =IF(B9=0,0,((C9/B9)*100)-100) -> 6.1881758045465602 | K9: =IF(C9=0,0,IF(D9=0,0,((C9/D9)*100)-100)) -> -20.365710630378842 | L9: =IF(F9=0,0,((C9/F9)*100)-100) -> 12.164730716025105 | M9: =IF(G9=0,0,((C9/G9)*100)-100) -> 16.932484652250594 | N9: =IF(C9=0,0,IF(H9=0,0,((C9/H9)*100)-100)) -> 28.649173236025007 | P9: 3809071 | Q9: =IF(C9=0,0,((C9/P9)*100)-100) -> 6.1881758045465602 | R9: =IF(C9=0,0,(C9/$C$41)*100) -> 2.9492586362345592 | T9: 15.94 | U9: 15.859572437236874 | V9: =U9-T9 -> -8.0427562763125238E-2
A10: Paranagua | B10: 2230000 | C10: 2119665.35 | D10: 3111706.01 | F10: 2029156.98 | G10: 1821008.25 | H10: 1780561.27 | J10: =IF(B10=0,0,((C10/B10)*100)-100) -> -4.9477421524663612 | K10: =IF(C10=0,0,IF(D10=0,0,((C10/D10)*100)-100)) -> -31.880925023505029 | L10: =IF(F10=0,0,((C10/F10)*100)-100) -> 4.4603927094886586 | M10: =IF(G10=0,0,((C10/G10)*100)-100) -> 16.400645082195538 | N10: =IF(C10=0,0,IF(H10=0,0,((C10/H10)*100)-100)) -> 19.044785805096168 | P10: 2230000 | Q10: =IF(C10=0,0,((C10/P10)*100)-100) -> -4.9477421524663612 | R10: =IF(C10=0,0,(C10/$C$41)*100) -> 1.5455566649580665 | T10: 16.82 | U10: 17.399903017709846 | V10: =U10-T10 -> 0.57990301770984587
A11: Centenario | B11: 0 | C11: 0 | D11: 0 | F11: 0 | G11: 0 | H11: 0 | J11: =IF(B11=0,0,((C11/B11)*100)-100) -> 0 | K11: =IF(C11=0,0,IF(D11=0,0,((C11/D11)*100)-100)) -> 0 | L11: =IF(F11=0,0,((C11/F11)*100)-100) -> 0 | M11: =IF(G11=0,0,((C11/G11)*100)-100) -> 0 | N11: =IF(C11=0,0,IF(H11=0,0,((C11/H11)*100)-100)) -> 0 | P11: 0 | Q11: =IF(C11=0,0,((C11/P11)*100)-100) -> 0 | R11: =IF(C11=0,0,(C11/$C$41)*100) -> 0 | T11: 0 | U11: 0 | V11: =U11-T11 -> 0
A12: Sitio Cercado | B12: 2554943 | C12: 2991945.25 | D12: 3574335.19 | F12: 2348602.24 | G12: 2075561.55 | H12: 1637395.78 | J12: =IF(B12=0,0,((C12/B12)*100)-100) -> 17.104187842938188 | K12: =IF(C12=0,0,IF(D12=0,0,((C12/D12)*100)-100)) -> -16.293657674561857 | L12: =IF(F12=0,0,((C12/F12)*100)-100) -> 27.392591177976541 | M12: =IF(G12=0,0,((C12/G12)*100)-100) -> 44.151121415792261 | N12: =IF(C12=0,0,IF(H12=0,0,((C12/H12)*100)-100)) -> 82.725843473225524 | P12: 2554943 | Q12: =IF(C12=0,0,((C12/P12)*100)-100) -> 17.104187842938188 | R12: =IF(C12=0,0,(C12/$C$41)*100) -> 2.1815806548553187 | T12: 15.53 | U12: 14.626614176846985 | V12: =U12-T12 -> -0.9033858231530143
A13: Apucarana | B13: 2699999 | C13: 2717803.88 | D13: 3904456.77 | F13: 2573673.4 | G13: 2475145.58 | H13: 2197387.15 | J13: =IF(B13=0,0,((C13/B13)*100)-100) -> 0.65944024423711767 | K13: =IF(C13=0,0,IF(D13=0,0,((C13/D13)*100)-100)) -> -30.392266066759404 | L13: =IF(F13=0,0,((C13/F13)*100)-100) -> 5.6001853226598257 | M13: =IF(G13=0,0,((C13/G13)*100)-100) -> 9.8037990961323658 | N13: =IF(C13=0,0,IF(H13=0,0,((C13/H13)*100)-100)) -> 23.683433754493379 | P13: 2700000 | Q13: =IF(C13=0,0,((C13/P13)*100)-100) -> 0.65940296296295742 | R13: =IF(C13=0,0,(C13/$C$41)*100) -> 1.9816901289549753 | T13: 16.43 | U13: 15.629042567265744 | V13: =U13-T13 -> -0.8009574327342559
A14: Ahú | B14: 1811455 | C14: 2030398.75 | D14: 2379038.47 | F14: 1602846.59 | G14: 1491047.69 | H14: 1416694.44 | J14: =IF(B14=0,0,((C14/B14)*100)-100) -> 12.086623736167894 | K14: =IF(C14=0,0,IF(D14=0,0,((C14/D14)*100)-100)) -> -14.654648270567904 | L14: =IF(F14=0,0,((C14/F14)*100)-100) -> 26.674552802960378 | M14: =IF(G14=0,0,((C14/G14)*100)-100) -> 36.172623023211287 | N14: =IF(C14=0,0,IF(H14=0,0,((C14/H14)*100)-100)) -> 43.319454970120432 | P14: 1811455 | Q14: =IF(C14=0,0,((C14/P14)*100)-100) -> 12.086623736167894 | R14: =IF(C14=0,0,(C14/$C$41)*100) -> 1.4804678109141272 | T14: 16.92 | U14: 16.283064402989808 | V14: =U14-T14 -> -0.63693559701019353
A15: P.G. Centro | B15: 1920000 | C15: 1968341.51 | D15: 2710700.74 | F15: 1796991.47 | G15: 2122993.12 | H15: 1826961.35 | J15: =IF(B15=0,0,((C15/B15)*100)-100) -> 2.5177869791666723 | K15: =IF(C15=0,0,IF(D15=0,0,((C15/D15)*100)-100)) -> -27.386248103507 | L15: =IF(F15=0,0,((C15/F15)*100)-100) -> 9.5353841607272614 | M15: =IF(G15=0,0,((C15/G15)*100)-100) -> -7.2846025049765615 | N15: =IF(C15=0,0,IF(H15=0,0,((C15/H15)*100)-100)) -> 7.7385413763679196 | P15: 1920000 | Q15: =IF(C15=0,0,((C15/P15)*100)-100) -> 2.5177869791666723 | R15: =IF(C15=0,0,(C15/$C$41)*100) -> 1.4352186960522446 | T15: 18.04 | U15: 18.151770974946313 | V15: =U15-T15 -> 0.11177097494631383
A16: Maringa | B16: 2980000 | C16: 3270802.63 | D16: 3777025.84 | F16: 2729996.46 | G16: 2766952.05 | H16: 2330695.91 | J16: =IF(B16=0,0,((C16/B16)*100)-100) -> 9.7584775167785125 | K16: =IF(C16=0,0,IF(D16=0,0,((C16/D16)*100)-100)) -> -13.402693850778633 | L16: =IF(F16=0,0,((C16/F16)*100)-100) -> 19.809775504251022 | M16: =IF(G16=0,0,((C16/G16)*100)-100) -> 18.209588416973105 | N16: =IF(C16=0,0,IF(H16=0,0,((C16/H16)*100)-100)) -> 40.33588062545661 | P16: 2980000 | Q16: =IF(C16=0,0,((C16/P16)*100)-100) -> 9.7584775167785125 | R16: =IF(C16=0,0,(C16/$C$41)*100) -> 2.3849098653987397 | T16: 16.77 | U16: 16.160807960460762 | V16: =U16-T16 -> -0.60919203953923784
A17: Araucaria Nova | B17: 4430000 | C17: 4996433.9 | D17: 6091853.96 | F17: 3896088.59 | G17: 3425620.02 | H17: 2565286.04 | J17: =IF(B17=0,0,((C17/B17)*100)-100) -> 12.786318284424382 | K17: =IF(C17=0,0,IF(D17=0,0,((C17/D17)*100)-100)) -> -17.981718983952788 | L17: =IF(F17=0,0,((C17/F17)*100)-100) -> 28.242307241786818 | M17: =IF(G17=0,0,((C17/G17)*100)-100) -> 45.85487797330191 | N17: =IF(C17=0,0,IF(H17=0,0,((C17/H17)*100)-100)) -> 94.771024442950619 | P17: 4430000 | Q17: =IF(C17=0,0,((C17/P17)*100)-100) -> 12.786318284424382 | R17: =IF(C17=0,0,(C17/$C$41)*100) -> 3.6431560836560481 | T17: 16.45 | U17: 16.583780359828236 | V17: =U17-T17 -> 0.13378035982823633
A18: Cristo Rei | B18: 2151511 | C18: 2386637.92 | D18: 2848600.21 | F18: 1856604.72 | G18: 1546403.28 | H18: 1330166.74 | J18: =IF(B18=0,0,((C18/B18)*100)-100) -> 10.928455397160405 | K18: =IF(C18=0,0,IF(D18=0,0,((C18/D18)*100)-100)) -> -16.217168291228916 | L18: =IF(F18=0,0,((C18/F18)*100)-100) -> 28.548521626078809 | M18: =IF(G18=0,0,((C18/G18)*100)-100) -> 54.334768353569444 | N18: =IF(C18=0,0,IF(H18=0,0,((C18/H18)*100)-100)) -> 79.4239660510531 | P18: 2151511 | Q18: =IF(C18=0,0,((C18/P18)*100)-100) -> 10.928455397160405 | R18: =IF(C18=0,0,(C18/$C$41)*100) -> 1.7402200512914252 | T18: 17.68 | U18: 17.743758517002025 | V18: =U18-T18 -> 6.3758517002025172E-2
A19: Campo Largo | B19: 3750000 | C19: 3936450.53 | D19: 4967965.97 | F19: 3369202.78 | G19: 2530521.15 | H19: 0 | J19: =IF(B19=0,0,((C19/B19)*100)-100) -> 4.9720141333333174 | K19: =IF(C19=0,0,IF(D19=0,0,((C19/D19)*100)-100)) -> -20.763335462219359 | L19: =IF(F19=0,0,((C19/F19)*100)-100) -> 16.836260297755075 | M19: =IF(G19=0,0,((C19/G19)*100)-100) -> 55.558886753426265 | N19: =IF(C19=0,0,IF(H19=0,0,((C19/H19)*100)-100)) -> 0 | P19: 3750000 | Q19: =IF(C19=0,0,((C19/P19)*100)-100) -> 4.9720141333333174 | R19: =IF(C19=0,0,(C19/$C$41)*100) -> 2.870267871727588 | T19: 17 | U19: 16.987777179051712 | V19: =U19-T19 -> -1.2222820948288415E-2
A20: Brasilia | B20: 2550032 | C20: 2862160.04 | D20: 3571971.82 | F20: 2347034.85 | G20: 2237424.58 | H20: 863438 | J20: =IF(B20=0,0,((C20/B20)*100)-100) -> 12.240161692088563 | K20: =IF(C20=0,0,IF(D20=0,0,((C20/D20)*100)-100)) -> -19.871707162572179 | L20: =IF(F20=0,0,((C20/F20)*100)-100) -> 21.947913981762994 | M20: =IF(G20=0,0,((C20/G20)*100)-100) -> 27.922079053945126 | N20: =IF(C20=0,0,IF(H20=0,0,((C20/H20)*100)-100)) -> 231.48414130487652 | P20: 2550032 | Q20: =IF(C20=0,0,((C20/P20)*100)-100) -> 12.240161692088563 | R20: =IF(C20=0,0,(C20/$C$41)*100) -> 2.0869476051956251 | T20: 16.54 | U20: 15.555392409154031 | V20: =U20-T20 -> -0.98460759084596816
A21: Total Super | B21: =SUM(B6:B20) -> 37949937 | C21: =SUM(C6:C20) -> 40379350.93 | D21: =SUM(D6:D20) -> 50942418.369999997 | F21: =SUM(F6:F20) -> 34586035.109999999 | G21: =SUM(G6:G20) -> 31823893.109999999 | H21: =SUM(H6:H20) -> 23647442.069999997 | I21: =SUM(B21:H21) -> 219329076.59000003 | J21: =IF(C21=0,0,((C21/B21)*100)-100) -> 6.4016283610694842 | K21: =IF(C21=0,0,IF(D21=0,0,((C21/D21)*100)-100)) -> -20.735308173395623 | L21: =IF(F21=0,0,IF(C21=0,0,((C21/F21)*100)-100)) -> 16.750447981604452 | M21: =IF(G21=0,0,IF(C21=0,0,((C21/G21)*100)-100)) -> 26.8837561464522 | N21: =IF(C21=0,0,IF(H21=0,0,((C21/H21)*100)-100)) -> 70.75568177932746 | P21: =SUM(P6:P20) -> 37949938 | Q21: =IF(C21=0,0,((C21/P21)*100)-100) -> 6.4016255573329204 | R21: =IF(C21=0,0,(C21/$C$41)*100) -> 29.442654689119774 | T21: 16.674782585805083 | U21: 16.422030667346341 | V21: =U21-T21 -> -0.2527519184587419
A22: Pinheirinho | B22: 4700000 | C22: 5149724.14 | D22: 6066071.3300000001 | F22: 5259158.26 | G22: 4362684.22 | H22: 3719224.08 | J22: =IF(B22=0,0,((C22/B22)*100)-100) -> 9.56859872340425 | K22: =IF(C22=0,0,IF(D22=0,0,((C22/D22)*100)-100)) -> -15.106106409731254 | L22: =IF(F22=0,0,((C22/F22)*100)-100) -> -2.0808295660606433 | M22: =IF(G22=0,0,((C22/G22)*100)-100) -> 18.040267878934401 | N22: =IF(C22=0,0,IF(H22=0,0,((C22/H22)*100)-100)) -> 38.462325184773476 | P22: 4700000 | Q22: =IF(C22=0,0,IF(P22=0,0,((C22/P22)*100)-100)) -> 9.56859872340425 | R22: =IF(C22=0,0,(C22/$C$41)*100) -> 3.7549278556034551 | T22: 15.94 | U22: 15.813736444142815 | V22: =U22-T22 -> -0.12626355585718407
A23: Londrina | B23: 4000000 | C23: 4776234.74 | D23: 5389383.0899999999 | F23: 3799735.54 | G23: 3486043.03 | H23: 3160704.96 | J23: =IF(B23=0,0,((C23/B23)*100)-100) -> 19.405868500000011 | K23: =IF(C23=0,0,IF(D23=0,0,((C23/D23)*100)-100)) -> -11.376967266210798 | L23: =IF(F23=0,0,((C23/F23)*100)-100) -> 25.699135893020596 | M23: =IF(G23=0,0,((C23/G23)*100)-100) -> 37.01020609605041 | N23: =IF(C23=0,0,IF(H23=0,0,((C23/H23)*100)-100)) -> 51.112957408084071 | P23: 4000000 | Q23: =IF(C23=0,0,IF(P23=0,0,((C23/P23)*100)-100)) -> 19.405868500000011 | R23: =IF(C23=0,0,(C23/$C$41)*100) -> 3.4825975882519655 | T23: 15.81 | U23: 15.174119394307658 | V23: =U23-T23 -> -0.63588060569234273
A24: São Bráz | B24: 5424978 | C24: 5819043.3499999996 | D24: 7126930.04 | F24: 5082287.14 | G24: 4716256.74 | H24: 4318068.23 | J24: =IF(B24=0,0,((C24/B24)*100)-100) -> 7.2639068766730475 | K24: =IF(C24=0,0,IF(D24=0,0,((C24/D24)*100)-100)) -> -18.351333360359462 | L24: =IF(F24=0,0,((C24/F24)*100)-100) -> 14.496548300102546 | M24: =IF(G24=0,0,((C24/G24)*100)-100) -> 23.382667034365042 | N24: =IF(C24=0,0,IF(H24=0,0,((C24/H24)*100)-100)) -> 34.760338189468541 | P24: 5424978 | Q24: =IF(C24=0,0,IF(P24=0,0,((C24/P24)*100)-100)) -> 7.2639068766730475 | R24: =IF(C24=0,0,(C24/$C$41)*100) -> 4.2429628022519754 | T24: 15.93 | U24: 15.792212654679744 | V24: =U24-T24 -> -0.13778734532025538
A25: S.J. Pinhais | B25: 6202520 | C25: 6590191.5700000003 | D25: 7772724.2300000004 | F25: 5740328.4800000004 | G25: 5242901.86 | H25: 4704463.8 | J25: =IF(B25=0,0,((C25/B25)*100)-100) -> 6.2502268432830448 | K25: =IF(C25=0,0,IF(D25=0,0,((C25/D25)*100)-100)) -> -15.213876435186478 | L25: =IF(F25=0,0,((C25/F25)*100)-100) -> 14.805129932216005 | M25: =IF(G25=0,0,((C25/G25)*100)-100) -> 25.697404719301758 | N25: =IF(C25=0,0,IF(H25=0,0,((C25/H25)*100)-100)) -> 40.08379807280059 | P25: 6202520 | Q25: =IF(C25=0,0,IF(P25=0,0,((C25/P25)*100)-100)) -> 6.2502268432830448 | R25: =IF(C25=0,0,(C25/$C$41)*100) -> 4.8052465000496261 | T25: 15.86 | U25: 16.05979392189353 | V25: =U25-T25 -> 0.19979392189353007
A26: P.G. Nova | B26: 5438912 | C26: 6107563.2699999996 | D26: 7834412.6500000004 | F26: 4894746.6 | G26: 5238033.27 | H26: 4222460.05 | J26: =IF(B26=0,0,((C26/B26)*100)-100) -> 12.293842408187516 | K26: =IF(C26=0,0,IF(D26=0,0,((C26/D26)*100)-100)) -> -22.041848663664666 | L26: =IF(F26=0,0,((C26/F26)*100)-100) -> 24.777925582501041 | M26: =IF(G26=0,0,((C26/G26)*100)-100) -> 16.600314568066878 | N26: =IF(C26=0,0,IF(H26=0,0,((C26/H26)*100)-100)) -> 44.644666797972434 | P26: 5438912 | Q26: =IF(C26=0,0,IF(P26=0,0,((C26/P26)*100)-100)) -> 12.293842408187516 | R26: =IF(C26=0,0,(C26/$C$41)*100) -> 4.453337466030467 | T26: 15.15 | U26: 15.059777740133015 | V26: =U26-T26 -> -9.022225986698551E-2
A27: Nilo Pecanha | B27: 12985000 | C27: 13548840.119999999 | D27: 17064447.16 | F27: 11892506.789999999 | G27: 10850906.539999999 | H27: 9612433.5999999996 | J27: =IF(B27=0,0,((C27/B27)*100)-100) -> 4.3422419715055725 | K27: =IF(C27=0,0,IF(D27=0,0,((C27/D27)*100)-100)) -> -20.601939266106299 | L27: =IF(F27=0,0,((C27/F27)*100)-100) -> 13.927537391803327 | M27: =IF(G27=0,0,((C27/G27)*100)-100) -> 24.863669869927762 | N27: =IF(C27=0,0,IF(H27=0,0,((C27/H27)*100)-100)) -> 40.951195959366629 | P27: 12985000 | Q27: =IF(C27=0,0,IF(P27=0,0,((C27/P27)*100)-100)) -> 4.3422419715055725 | R27: =IF(C27=0,0,(C27/$C$41)*100) -> 9.8791538720568539 | T27: 16.39 | U27: 16.319033680500766 | V27: =U27-T27 -> -7.0966319499234487E-2
A28: Champagnat | B28: 6450000 | C28: 6027420.25 | D28: 7577672.4800000004 | F28: 6057070.3300000001 | G28: 5968114.9400000004 | H28: 5444638.1600000001 | J28: =IF(B28=0,0,((C28/B28)*100)-100) -> -6.5516240310077478 | K28: =IF(C28=0,0,IF(D28=0,0,((C28/D28)*100)-100)) -> -20.458158281340772 | L28: =IF(F28=0,0,((C28/F28)*100)-100) -> -0.4895118990635865 | M28: =IF(G28=0,0,((C28/G28)*100)-100) -> 0.99370254420736615 | N28: =IF(C28=0,0,IF(H28=0,0,((C28/H28)*100)-100)) -> 10.703779991873688 | P28: 6450000 | Q28: =IF(C28=0,0,IF(P28=0,0,((C28/P28)*100)-100)) -> -6.5516240310077478 | R28: =IF(C28=0,0,(C28/$C$41)*100) -> 4.3949010818574337 | T28: 16.81 | U28: 16.140868194813528 | V28: =U28-T28 -> -0.66913180518647053
A29: Santa Candida | B29: 7400000 | C29: 8368806.9199999999 | D29: 10285120.699999999 | F29: 7005264.1799999997 | G29: 5853229.6399999997 | H29: 4929174.54 | J29: =IF(B29=0,0,((C29/B29)*100)-100) -> 13.09198540540541 | K29: =IF(C29=0,0,IF(D29=0,0,((C29/D29)*100)-100)) -> -18.631903658651268 | L29: =IF(F29=0,0,((C29/F29)*100)-100) -> 19.464544162273128 | M29: =IF(G29=0,0,((C29/G29)*100)-100) -> 42.977594161161278 | N29: =IF(C29=0,0,IF(H29=0,0,((C29/H29)*100)-100)) -> 69.781103348797217 | P29: 7400000 | Q29: =IF(C29=0,0,IF(P29=0,0,((C29/P29)*100)-100)) -> 13.09198540540541 | R29: =IF(C29=0,0,(C29/$C$41)*100) -> 6.1021261271045395 | T29: 15.99 | U29: 16.088558159733477 | V29: =U29-T29 -> 9.8558159733476813E-2
A30: Paranaguá Raia | B30: 7710000 | C30: 8261686.5199999996 | D30: 11051614.77 | F30: 7253944.75 | G30: 6248763.1399999997 | H30: 5706989.1399999997 | J30: =IF(B30=0,0,((C30/B30)*100)-100) -> 7.1554671854733982 | K30: =IF(C30=0,0,IF(D30=0,0,((C30/D30)*100)-100)) -> -25.244530397253428 | L30: =IF(F30=0,0,((C30/F30)*100)-100) -> 13.892327619396312 | M30: =IF(G30=0,0,((C30/G30)*100)-100) -> 32.213148984872561 | N30: =IF(C30=0,0,IF(H30=0,0,((C30/H30)*100)-100)) -> 44.764363788503715 | P30: 7710000 | Q30: =IF(C30=0,0,IF(P30=0,0,((C30/P30)*100)-100)) -> 7.1554671854733982 | R30: =IF(C30=0,0,(C30/$C$41)*100) -> 6.0240191522592061 | T30: 17.68 | U30: 17.269276378934798 | V30: =U30-T30 -> -0.41072362106520188
A31: Novo Mundo | B31: 5462711 | C31: 5940484.9299999997 | D31: 7077384.29 | F31: 5344828.22 | G31: 5.9999999999999995E-4 | H31: 0 | J31: =IF(B31=0,0,((C31/B31)*100)-100) -> 8.746095665686866 | K31: =IF(C31=0,0,IF(D31=0,0,((C31/D31)*100)-100)) -> -16.063835358020398 | L31: =IF(F31=0,0,((C31/F31)*100)-100) -> 11.144543575247042 | M31: =IF(G31=0,0,((C31/G31)*100)-100) -> 990080821566.66675 | N31: =IF(C31=0,0,IF(H31=0,0,((C31/H31)*100)-100)) -> 0 | P31: 5462711 | Q31: =IF(C31=0,0,IF(P31=0,0,((C31/P31)*100)-100)) -> 8.746095665686866 | R31: =IF(C31=0,0,(C31/$C$41)*100) -> 4.3315120835675565 | T31: 15.68 | U31: 15.53806173867358 | V31: =U31-T31 -> -0.14193826132641973
A32: Uvaranas | B32: 5150000 | C32: 5604327.2000000002 | D32: 7298283.8099999996 | F32: 4786753.71 | G32: 0 | H32: 0 | J32: =IF(B32=0,0,((C32/B32)*100)-100) -> 8.8218873786407812 | K32: =IF(C32=0,0,IF(D32=0,0,((C32/D32)*100)-100)) -> -23.21034169264513 | L32: =IF(F32=0,0,((C32/F32)*100)-100) -> 17.079915523792437 | M32: =IF(G32=0,0,((C32/G32)*100)-100) -> 0 | N32: =IF(C32=0,0,IF(H32=0,0,((C32/H32)*100)-100)) -> 0 | P32: 5150000 | Q32: =IF(C32=0,0,IF(P32=0,0,((C32/P32)*100)-100)) -> 8.8218873786407812 | R32: =IF(C32=0,0,(C32/$C$41)*100) -> 4.0864022505089208 | T32: 15.51 | U32: 15.236534576353785 | V32: =U32-T32 -> -0.27346542364621484
A33: Torres | B33: 5520000 | C33: 6407939.0599999996 | D33: 7618618.4000000004 | F33: 5067486.77 | G33: 4499468.83 | H33: 0 | J33: =IF(B33=0,0,((C33/B33)*100)-100) -> 16.085852536231869 | K33: =IF(C33=0,0,IF(D33=0,0,((C33/D33)*100)-100)) -> -15.891061560453011 | L33: =IF(F33=0,0,((C33/F33)*100)-100) -> 26.452013608315752 | M33: =IF(G33=0,0,((C33/G33)*100)-100) -> 42.415456181746663 | N33: =IF(C33=0,0,IF(H33=0,0,((C33/H33)*100)-100)) -> 0 | P33: 5520000 | Q33: =IF(C33=0,0,IF(P33=0,0,((C33/P33)*100)-100)) -> 16.085852536231869 | R33: =IF(C33=0,0,(C33/$C$41)*100) -> 4.6723568523814984 | T33: 16.25 | U33: 16.337576548363742 | V33: =U33-T33 -> 8.757654836374229E-2
A34: Total Hiper | B34: =SUM(B22:B33) -> 76444121 | C34: =SUM(C22:C33) -> 82602262.070000008 | D34: =SUM(D22:D33) -> 102162662.95000002 | F34: =SUM(F22:F33) -> 72184110.769999996 | G34: =SUM(G22:G33) -> 56466402.210599996 | H34: =SUM(H22:H33) -> 45818156.559999995 | I34: =SUM(B34:H34) -> 435677715.56060004 | J34: =IF(C34=0,0,((C34/B34)*100)-100) -> 8.0557418797450993 | K34: =IF(C34=0,0,IF(D34=0,0,((C34/D34)*100)-100)) -> -19.146330288564599 | L34: =IF(F34=0,0,IF(C34=0,0,((C34/F34)*100)-100)) -> 14.432748687859203 | M34: =IF(G34=0,0,IF(C34=0,0,((C34/G34)*100)-100)) -> 46.285682877266311 | N34: =IF(C34=0,0,IF(H34=0,0,((C34/H34)*100)-100)) -> 80.282814219795881 | P34: =SUM(P22:P33) -> 76444121 | Q34: =IF(C34=0,0,((C34/P34)*100)-100) -> 8.0557418797450993 | R34: =IF(C34=0,0,(C34/$C$41)*100) -> 60.229543631923512 | T34: 16.174803579990147 | U34: 16.000945225688053 | V34: =U34-T34 -> -0.1738583543020944
A35: Total s/ 29,30,37 | B35: =B21+B34 -> 114394058 | C35: =C21+C34 -> 122981613 | D35: =D21+D34 -> 153105081.32000002 | E35: =E21+E34 -> 0 | F35: =F21+F34 -> 106770145.88 | G35: =G21+G34 -> 88290295.320600003 | H35: =H21+H34 -> 69465598.629999995 | I35: =SUM(B35:H35) -> 655006792.15060008 | J35: =IF(C35=0,0,((C35/B35)*100)-100) -> 7.5069939384438982 | K35: =IF(C35=0,0,IF(D35=0,0,((C35/D35)*100)-100)) -> -19.675028457768775 | L35: =IF(F35=0,0,IF(C35=0,0,((C35/F35)*100)-100)) -> 15.183520624033079 | M35: =IF(G35=0,0,IF(C35=0,0,((C35/G35)*100)-100)) -> 39.292333946136182 | N35: =IF(C35=0,0,IF(H35=0,0,((C35/H35)*100)-100)) -> 77.039592871064855 | P35: =P21+P34 -> 114394059 | Q35: =IF(C35=0,0,((C35/P35)*100)-100) -> 7.5069929986486557 | R35: =IF(C35=0,0,(C35/$C$41)*100) -> 89.672198321043268 | T35: 16.340670340062591 | U35: 16.139202940849376 | V35: =U35-T35 -> -0.20146739921321455
A36: Centenario | B36: 0 | C36: 0 | D36: 0 | F36: 1219404.04 | G36: 1244948.55 | H36: 1056621.39 | J36: =IF(B36=0,0,((C36/B36)*100)-100) -> 0 | K36: =IF(C36=0,0,IF(D36=0,0,((C36/D36)*100)-100)) -> 0 | L36: =IF(F36=0,0,((C36/F36)*100)-100) -> -100 | M36: =IF(G36=0,0,((C36/G36)*100)-100) -> -100 | N36: =IF(C36=0,0,IF(H36=0,0,((C36/H36)*100)-100)) -> 0 | P36: 0 | Q36: =IF(P36=0,0,IF(C36=0,0,((C36/P36)*100)-100)) -> 0 | R36: =IF(C36=0,0,(C36/$C$41)*100) -> 0 | T36: 0 | U36: 0 | V36: =U36-T36 -> 0
A37: Cajuru | B37: 3700003 | C37: 4571411.98 | D37: 5559588.2400000002 | F37: 0 | G37: 0 | H37: 0 | J37: =IF(B37=0,0,((C37/B37)*100)-100) -> 23.551574958182471 | K37: =IF(C37=0,0,IF(D37=0,0,((C37/D37)*100)-100)) -> -17.774270635553393 | L37: =IF(F37=0,0,((C37/F37)*100)-100) -> 0 | M37: =IF(G37=0,0,((C37/G37)*100)-100) -> 0 | N37: =IF(C37=0,0,IF(H37=0,0,((C37/H37)*100)-100)) -> 0 | P37: 3700003 | Q37: =IF(P37=0,0,IF(C37=0,0,((C37/P37)*100)-100)) -> 23.551574958182471 | R37: =IF(C37=0,0,(C37/$C$41)*100) -> 3.3332508143128123 | T37: 16.18 | U37: 15.530652041560252 | V37: =U37-T37 -> -0.64934795843974769
A38: Água Verde | B38: 6500000 | C38: 6613188.5099999998 | D38: 5427705.3300000001 | F38: 0 | G38: 0 | H38: 0 | J38: =IF(B38=0,0,((C38/B38)*100)-100) -> 1.7413616923076916 | K38: =IF(C38=0,0,IF(D38=0,0,((C38/D38)*100)-100)) -> 21.841332716564409 | L38: =IF(F38=0,0,((C38/F38)*100)-100) -> 0 | M38: =IF(G38=0,0,((C38/G38)*100)-100) -> 0 | N38: =IF(C38=0,0,IF(H38=0,0,((C38/H38)*100)-100)) -> 0 | P38: 6500000 | Q38: =IF(P38=0,0,IF(C38=0,0,((C38/P38)*100)-100)) -> 1.7413616923076916 | R38: =IF(C38=0,0,(C38/$C$41)*100) -> 4.8220147478726316 | T38: 15.35 | U38: 16.092187824236088 | V38: =U38-T38 -> 0.74218782423608864
A39: Fazenda | B39: 2800000 | C39: 2979541.05 | D39: 3732139.27 | F39: 0 | G39: 0 | H39: 0 | J39: =IF(B39=0,0,((C39/B39)*100)-100) -> 6.4121803571428586 | K39: =IF(C39=0,0,IF(D39=0,0,((C39/D39)*100)-100)) -> -20.165330539768419 | L39: =IF(F39=0,0,((C39/F39)*100)-100) -> 0 | M39: =IF(G39=0,0,((C39/G39)*100)-100) -> 0 | N39: =IF(C39=0,0,IF(H39=0,0,((C39/H39)*100)-100)) -> 0 | P39: 2800000 | Q39: =IF(P39=0,0,IF(C39=0,0,((C39/P39)*100)-100)) -> 6.4121803571428586 | R39: =IF(C39=0,0,(C39/$C$41)*100) -> 2.1725361167712891 | T39: 15.5 | U39: 15.794492020843279 | V39: =U39-T39 -> 0.29449202084327908
A40: Total Lojas Novas | B40: =SUM(B36:B39) -> 13000003 | C40: =SUM(C36:C39) -> 14164141.539999999 | D40: =SUM(D36:D39) -> 14719432.84 | F40: =SUM(F36:F39) -> 1219404.04 | G40: =SUM(G36:G39) -> 1244948.55 | H40: =SUM(H36:H39) -> 1056621.39 | J40: =IF(C40=0,0,((C40/B40)*100)-100) -> 8.9549097796361963 | K40: =IF(C40=0,0,IF(D40=0,0,((C40/D40)*100)-100)) -> -3.7725047291971663 | L40: =IF(F40=0,0,IF(C40=0,0,((C40/F40)*100)-100)) -> 1061.5626220165711 | M40: =IF(G40=0,0,IF(C40=0,0,((C40/G40)*100)-100)) -> 1037.7290684020636 | N40: =IF(C40=0,0,IF(H40=0,0,((C40/H40)*100)-100)) -> 1240.5124743878223 | P40: =SUM(P36:P39) -> 13000003 | Q40: =IF(P40=0,0,IF(C40=0,0,((C40/P40)*100)-100)) -> 8.9549097796361963 | R40: =IF(C40=0,0,(C40/$C$41)*100) -> 10.327801678956734 | T40: 7.9435403622599168 | U40: 8.3349453834955103 | V40: =U40-T40 -> 0.39140502123559351
A41: Total sem 29 | B41: =B21+B34+B40 -> 127394061 | C41: =C21+C34+C40 -> 137145754.53999999 | D41: =D21+D34+D40 -> 167824514.16000003 | F41: =F21+F34+F40 -> 107989549.92 | G41: =G21+G34+G40 -> 89535243.8706 | H41: =H21+H34+H40 -> 70522220.019999996 | J41: =IF(C41=0,0,((C41/B41)*100)-100) -> 7.6547473747618398 | K41: =IF(C41=0,0,IF(D41=0,0,((C41/D41)*100)-100)) -> -18.280261244046642 | L41: =IF(F41=0,0,IF(C41=0,0,((C41/F41)*100)-100)) -> 26.999098192000304 | M41: =IF(G41=0,0,IF(C41=0,0,((C41/G41)*100)-100)) -> 53.175161658361759 | N41: =IF(C41=0,0,IF(H41=0,0,((C41/H41)*100)-100)) -> 94.471692044160932 | P41: =P21+P34+P40 -> 127394062 | Q41: =IF(C41=0,0,((C41/P41)*100)-100) -> 7.6547465297087172 | R41: =R21+R34+R40 -> 100 | T41: 15.483780198984313 | U41: 15.333194697810876 | V41: =U41-T41 -> -0.1505855011734365
A43: Água Verde | B43: 0 | C43: 0 | D43: 0 | F43: 0 | G43: 0 | H43: 0 | J43: =IF(B43=0,0,((C43/B43)*100)-100) -> 0 | K43: =IF(C43=0,0,IF(D43=0,0,((C43/D43)*100)-100)) -> 0 | L43: =IF(F43=0,0,((C43/F43)*100)-100) -> 0 | M43: =IF(G43=0,0,((C43/G43)*100)-100) -> 0 | N43: =IF(C43=0,0,IF(H43=0,0,((C43/H43)*100)-100)) -> 0 | P43: =C43 -> 0 | Q43: =IF(C43=0,0,IF(P43=0,0,((C43/P43)*100)-100)) -> 0 | R43: =IF(C43=0,0,(C43/$C$41)*100) -> 0 | T43: 14.9 | U43: 0 | V43: =U43-T43 -> -14.9
A44: Total Geral | B44: =B41+B43 -> 127394061 | C44: =C41+C43 -> 137145754.53999999 | D44: =D41+D43 -> 167824514.16000003 | F44: =F41+F43 -> 107989549.92 | G44: =G41+G43 -> 89535243.8706 | H44: =H41+H43 -> 70522220.019999996 | I44: =SUM(B44:H44) -> 700411343.51059997 | J44: =IF(C44=0,0,((C44/B44)*100)-100) -> 7.6547473747618398 | K44: =IF(C44=0,0,IF(D44=0,0,((C44/D44)*100)-100)) -> -18.280261244046642 | L44: =IF(F44=0,0,IF(C44=0,0,((C44/F44)*100)-100)) -> 26.999098192000304 | M44: =IF(G44=0,0,IF(C44=0,0,((C44/G44)*100)-100)) -> 53.175161658361759 | N44: =IF(C44=0,0,IF(H44=0,0,((C44/H44)*100)-100)) -> 94.471692044160932 | P44: =P41+P43 -> 127394062 | Q44: =IF(C44=0,0,((C44/P44)*100)-100) -> 7.6547465297087172 | R44: =IF(C44=0,0,(C44/$C$41)*100) -> 100 | T44: 15.483780198984313 | U44: 15.333194697810876 | V44: =U44-T44 -> -0.1505855011734365