A2: Periodo: | B2: 41061 | C2: a | D2: 41090 | G2: Vendas Acumuladas por Filial | P2: =NOW() -> 41091.355324884258
A4: v.New | B4: Vendas 2012 | F4: Vendas de Anos Anteriores | J4: Percentuais ( % ) | P4: Meta Mensal | T4: Margem
A5: Lojas | B5: Previsao | C5: Realizada | D5: Mes Anterior | F5: Vendas 2011 | G5: Vendas 2010 | H5: Vendas 2009 | J5: % Prev | K5: % MA | L5: 2011 | M5: 2010 | N5: 2009 | P5: Previsao Mes | Q5: Final | R5: Part. | T5: Meta | U5: Coml | V5: Sell O. | W5: Dif
A6: S. Felicidade | B6: 4100000 | C6: 4097524.15 | D6: 3763581.15 | F6: 3363652.95 | G6: 2902003.03 | H6: 2543393.38 | J6: =IF(B6=0,0,((C6/B6)*100)-100) -> -6.0386585365861833E-2 | K6: =IF(C6=0,0,IF(D6=0,0,((C6/D6)*100)-100)) -> 8.873011812167249 | L6: =IF(F6=0,0,((C6/F6)*100)-100) -> 21.81768484765945 | M6: =IF(G6=0,0,((C6/G6)*100)-100) -> 41.196411845235048 | N6: =IF(C6=0,0,IF(H6=0,0,((C6/H6)*100)-100)) -> 61.10461646322284 | P6: 4100000 | Q6: =IF(C6=0,0,((C6/P6)*100)-100) -> -6.0386585365861833E-2 | R6: =IF(C6=0,0,(C6/$C$43)*100) -> 2.1938606257357964 | T6: 17.2 | U6: 17.010746843310244 | V6: 18.671639587529949 | W6: =U6-T6 -> -0.18925315668975529
A7: Lapa | B7: 2600000 | C7: 2709819.46 | D7: 2428913.89 | F7: 2395775.95 | G7: 2257931.81 | H7: 1965895.25 | J7: =IF(B7=0,0,((C7/B7)*100)-100) -> 4.223825384615381 | K7: =IF(C7=0,0,IF(D7=0,0,((C7/D7)*100)-100)) -> 11.565069109963375 | L7: =IF(F7=0,0,((C7/F7)*100)-100) -> 13.108216984981411 | M7: =IF(G7=0,0,((C7/G7)*100)-100) -> 20.013343538483568 | N7: =IF(C7=0,0,IF(H7=0,0,((C7/H7)*100)-100)) -> 37.84149791297375 | P7: 2600000 | Q7: =IF(C7=0,0,((C7/P7)*100)-100) -> 4.223825384615381 | R7: =IF(C7=0,0,(C7/$C$43)*100) -> 1.450867889612472 | T7: 15.6 | U7: 16.322375218310668 | V7: 17.929338133840105 | W7: =U7-T7 -> 0.72237521831066864
A8: Araucaria | B8: 1549999 | C8: 1523149.37 | D8: 1421590.63 | F8: 1459348.85 | G8: 1338266.12 | H8: 1257715.97 | J8: =IF(B8=0,0,((C8/B8)*100)-100) -> -1.7322353111195525 | K8: =IF(C8=0,0,IF(D8=0,0,((C8/D8)*100)-100)) -> 7.1440214824713735 | L8: =IF(F8=0,0,((C8/F8)*100)-100) -> 4.3718484445990953 | M8: =IF(G8=0,0,((C8/G8)*100)-100) -> 13.815133420548676 | N8: =IF(C8=0,0,IF(H8=0,0,((C8/H8)*100)-100)) -> 21.104399270687509 | P8: 1550000 | Q8: =IF(C8=0,0,((C8/P8)*100)-100) -> -1.7322987096774227 | R8: =IF(C8=0,0,(C8/$C$43)*100) -> 0.81551134480983711 | T8: 16.6 | U8: 17.516267626463975 | V8: 18.938299577276521 | W8: =U8-T8 -> 0.91626762646397353
A9: Hauer | B9: 4600000 | C9: 4941512.24 | D9: 4419116.03 | F9: 3936150.08 | G9: 3711344.01 | H9: 3567994.83 | J9: =IF(B9=0,0,((C9/B9)*100)-100) -> 7.4241791304347799 | K9: =IF(C9=0,0,IF(D9=0,0,((C9/D9)*100)-100)) -> 11.821282954636516 | L9: =IF(F9=0,0,((C9/F9)*100)-100) -> 25.541763895344147 | M9: =IF(G9=0,0,((C9/G9)*100)-100) -> 33.146165558498041 | N9: =IF(C9=0,0,IF(H9=0,0,((C9/H9)*100)-100)) -> 38.495498885013802 | P9: 4600000 | Q9: =IF(C9=0,0,((C9/P9)*100)-100) -> 7.4241791304347799 | R9: =IF(C9=0,0,(C9/$C$43)*100) -> 2.6457413643132517 | T9: 16.56 | U9: 16.790531920244721 | V9: 18.047740227797149 | W9: =U9-T9 -> 0.23053192024472224
A10: Paranagua | B10: 2450000 | C10: 2409707.83 | D10: 2261533.84 | F10: 2237488.54 | G10: 5217567.84 | H10: 1861892.88 | J10: =IF(B10=0,0,((C10/B10)*100)-100) -> -1.6445783673469379 | K10: =IF(C10=0,0,IF(D10=0,0,((C10/D10)*100)-100)) -> 6.5519245115518601 | L10: =IF(F10=0,0,((C10/F10)*100)-100) -> 7.6969909307334348 | M10: =IF(G10=0,0,((C10/G10)*100)-100) -> -53.815495957212121 | N10: =IF(C10=0,0,IF(H10=0,0,((C10/H10)*100)-100)) -> 29.422474079174748 | P10: 2450000 | Q10: =IF(C10=0,0,((C10/P10)*100)-100) -> -1.6445783673469379 | R10: =IF(C10=0,0,(C10/$C$43)*100) -> 1.2901847394271608 | T10: 17.9 | U10: 18.227742572426301 | V10: 19.53929104342911 | W10: =U10-T10 -> 0.32774257242630256
A11: Sitio Cercado | B11: 3500000 | C11: 3640763.89 | D11: 3253517.12 | F11: 3022873.03 | G11: 2330779.42 | H11: 2062882.93 | J11: =IF(B11=0,0,((C11/B11)*100)-100) -> 4.0218254285714323 | K11: =IF(C11=0,0,IF(D11=0,0,((C11/D11)*100)-100)) -> 11.902404558424465 | L11: =IF(F11=0,0,((C11/F11)*100)-100) -> 20.440516484412186 | M11: =IF(G11=0,0,((C11/G11)*100)-100) -> 56.203708457319408 | N11: =IF(C11=0,0,IF(H11=0,0,((C11/H11)*100)-100)) -> 76.489118071280956 | P11: 3500000 | Q11: =IF(C11=0,0,((C11/P11)*100)-100) -> 4.0218254285714323 | R11: =IF(C11=0,0,(C11/$C$43)*100) -> 1.9493060329788887 | T11: 15.13 | U11: 15.209401563252706 | V11: 16.91490071606923 | W11: =U11-T11 -> 7.9401563252705643E-2
A12: Apucarana | B12: 2799999 | C12: 2838702.05 | D12: 2616622.38 | F12: 2912544.82 | G12: 2392243.79 | H12: 2470235.67 | J12: =IF(B12=0,0,((C12/B12)*100)-100) -> 1.3822522793758054 | K12: =IF(C12=0,0,IF(D12=0,0,((C12/D12)*100)-100)) -> 8.4872647921019393 | L12: =IF(F12=0,0,((C12/F12)*100)-100) -> -2.535335061384572 | M12: =IF(G12=0,0,((C12/G12)*100)-100) -> 18.662740890634709 | N12: =IF(C12=0,0,IF(H12=0,0,((C12/H12)*100)-100)) -> 14.916244003552919 | P12: 2800000 | Q12: =IF(C12=0,0,((C12/P12)*100)-100) -> 1.3822160714285587 | R12: =IF(C12=0,0,(C12/$C$43)*100) -> 1.5198730813314396 | T12: 15.54 | U12: 16.07666574235926 | V12: 17.491688830111638 | W12: =U12-T12 -> 0.53666574235926134
A13: Ahú | B13: 2500000 | C13: 2490417.6 | D13: 2293805.53 | F13: 2222277.7 | G13: 1832674.57 | H13: 1687080.17 | J13: =IF(B13=0,0,((C13/B13)*100)-100) -> -0.38329600000000141 | K13: =IF(C13=0,0,IF(D13=0,0,((C13/D13)*100)-100)) -> 8.5714358705901503 | L13: =IF(F13=0,0,((C13/F13)*100)-100) -> 12.065994272452983 | M13: =IF(G13=0,0,((C13/G13)*100)-100) -> 35.889788660078381 | N13: =IF(C13=0,0,IF(H13=0,0,((C13/H13)*100)-100)) -> 47.617027589151263 | P13: 2500000 | Q13: =IF(C13=0,0,((C13/P13)*100)-100) -> -0.38329600000000141 | R13: =IF(C13=0,0,(C13/$C$43)*100) -> 1.3333976602137758 | T13: 17.01 | U13: 17.239115640686123 | V13: 18.500850672594023 | W13: =U13-T13 -> 0.22911564068612122
A14: P.G. Centro | B14: 2400000 | C14: 2357109.65 | D14: 2232184.02 | F14: 2234490.75 | G14: 1841535.96 | H14: 1803046.03 | J14: =IF(B14=0,0,((C14/B14)*100)-100) -> -1.7870979166666672 | K14: =IF(C14=0,0,IF(D14=0,0,((C14/D14)*100)-100)) -> 5.5965650179683735 | L14: =IF(F14=0,0,((C14/F14)*100)-100) -> 5.4875546027657549 | M14: =IF(G14=0,0,((C14/G14)*100)-100) -> 27.996938490411011 | N14: =IF(C14=0,0,IF(H14=0,0,((C14/H14)*100)-100)) -> 30.729310887309936 | P14: 2400000 | Q14: =IF(C14=0,0,((C14/P14)*100)-100) -> -1.7870979166666672 | R14: =IF(C14=0,0,(C14/$C$43)*100) -> 1.2620230808589339 | T14: 18.12 | U14: 18.487175172355684 | V14: 19.874050326848394 | W14: =U14-T14 -> 0.36717517235568309
A15: Maringa | B15: 4299999 | C15: 4300910.71 | D15: 3982344.66 | F15: 3299002.5 | G15: 2958848.95 | H15: 2770952.47 | J15: =IF(B15=0,0,((C15/B15)*100)-100) -> 2.1202563070360725E-2 | K15: =IF(C15=0,0,IF(D15=0,0,((C15/D15)*100)-100)) -> 7.999459544518686 | L15: =IF(F15=0,0,((C15/F15)*100)-100) -> 30.370034881755913 | M15: =IF(G15=0,0,((C15/G15)*100)-100) -> 45.35756243994814 | N15: =IF(C15=0,0,IF(H15=0,0,((C15/H15)*100)-100)) -> 55.214163958575568 | P15: 4300000 | Q15: =IF(C15=0,0,((C15/P15)*100)-100) -> 2.1179302325592175E-2 | R15: =IF(C15=0,0,(C15/$C$43)*100) -> 2.3027560829566771 | T15: 17.15 | U15: 17.8302206604052 | V15: 18.847363525014917 | W15: =U15-T15 -> 0.68022066040520102
A16: Centenario | B16: 0 | C16: 0 | D16: 0 | F16: 0 | G16: 1399596.88 | H16: 1207149.07 | J16: =IF(B16=0,0,((C16/B16)*100)-100) -> 0 | K16: =IF(C16=0,0,IF(D16=0,0,((C16/D16)*100)-100)) -> 0 | L16: =IF(F16=0,0,((C16/F16)*100)-100) -> 0 | M16: =IF(G16=0,0,((C16/G16)*100)-100) -> -100 | N16: =IF(C16=0,0,IF(H16=0,0,((C16/H16)*100)-100)) -> 0 | P16: 0 | Q16: =IF(C16=0,0,((C16/P16)*100)-100) -> 0 | R16: =IF(C16=0,0,(C16/$C$43)*100) -> 0 | T16: 0 | U16: 0 | V16: 0 | W16: =U16-T16 -> 0
A17: Cristo Rei | B17: 3300000 | C17: 3233019.68 | D17: 3121552.5 | F17: 2830017.66 | G17: 2342828.51 | H17: 2095182.25 | J17: =IF(B17=0,0,((C17/B17)*100)-100) -> -2.0297066666666694 | K17: =IF(C17=0,0,IF(D17=0,0,((C17/D17)*100)-100)) -> 3.5708891649267542 | L17: =IF(F17=0,0,((C17/F17)*100)-100) -> 14.240265200323861 | M17: =IF(G17=0,0,((C17/G17)*100)-100) -> 37.996428940503222 | N17: =IF(C17=0,0,IF(H17=0,0,((C17/H17)*100)-100)) -> 54.307324816254066 | P17: 3300000 | Q17: =IF(C17=0,0,((C17/P17)*100)-100) -> -2.0297066666666694 | R17: =IF(C17=0,0,(C17/$C$43)*100) -> 1.730995186002978 | T17: 17.72 | U17: 18.184161192609878 | V17: 19.478329754553179 | W17: =U17-T17 -> 0.46416119260987898
A18: Fazenda | B18: 4150000 | C18: 4338862.02 | D18: 3826667.98 | F18: 2729530.87 | G18: 2646829.37 | H18: 0 | J18: =IF(B18=0,0,((C18/B18)*100)-100) -> 4.5508920481927646 | K18: =IF(C18=0,0,IF(D18=0,0,((C18/D18)*100)-100)) -> 13.38485707871628 | L18: =IF(F18=0,0,((C18/F18)*100)-100) -> 58.959990806039116 | M18: =IF(G18=0,0,((C18/G18)*100)-100) -> 63.926774773547237 | N18: =IF(C18=0,0,IF(H18=0,0,((C18/H18)*100)-100)) -> 0 | P18: 4150000 | Q18: =IF(C18=0,0,((C18/P18)*100)-100) -> 4.5508920481927646 | R18: =IF(C18=0,0,(C18/$C$43)*100) -> 2.3230756421968817 | T18: 16 | U18: 16.311491278996701 | V18: 17.830396948184124 | W18: =U18-T18 -> 0.31149127899670148
A19: Campo Largo | B19: 4550000 | C19: 4732273.93 | D19: 4256205.89 | F19: 3900959.22 | G19: 3505317.77 | H19: 2795659.36 | J19: =IF(B19=0,0,((C19/B19)*100)-100) -> 4.0060204395604444 | K19: =IF(C19=0,0,IF(D19=0,0,((C19/D19)*100)-100)) -> 11.185268107412909 | L19: =IF(F19=0,0,((C19/F19)*100)-100) -> 21.310520390418205 | M19: =IF(G19=0,0,((C19/G19)*100)-100) -> 35.002708470564698 | N19: =IF(C19=0,0,IF(H19=0,0,((C19/H19)*100)-100)) -> 69.272193805471346 | P19: 4550000 | Q19: =IF(C19=0,0,((C19/P19)*100)-100) -> 4.0060204395604444 | R19: =IF(C19=0,0,(C19/$C$43)*100) -> 2.5337128141692578 | T19: 16.1 | U19: 16.771056826797007 | V19: 18.265405168546529 | W19: =U19-T19 -> 0.67105682679700607
A20: Brasilia | B20: 3350000 | C20: 3454338.07 | D20: 3122059.56 | F20: 2789844.91 | G20: 2343289.97 | H20: 2373461.91 | J20: =IF(B20=0,0,((C20/B20)*100)-100) -> 3.1145692537313465 | K20: =IF(C20=0,0,IF(D20=0,0,((C20/D20)*100)-100)) -> 10.642926683948332 | L20: =IF(F20=0,0,((C20/F20)*100)-100) -> 23.818283146069192 | M20: =IF(G20=0,0,((C20/G20)*100)-100) -> 47.414025332938195 | N20: =IF(C20=0,0,IF(H20=0,0,((C20/H20)*100)-100)) -> 45.540067672710165 | P20: 3350000 | Q20: =IF(C20=0,0,((C20/P20)*100)-100) -> 3.1145692537313465 | R20: =IF(C20=0,0,(C20/$C$43)*100) -> 1.8494915471707916 | T20: 16.4 | U20: 16.537363987653936 | V20: 18.258841104107681 | W20: =U20-T20 -> 0.13736398765393787
A21: Cajuru | B21: 5450000 | C21: 5715977.6699999999 | D21: 5138310.27 | F21: 4626530.75 | G21: 0 | H21: 0 | J21: =IF(B21=0,0,((C21/B21)*100)-100) -> 4.8803242201834678 | K21: =IF(C21=0,0,IF(D21=0,0,((C21/D21)*100)-100)) -> 11.242361197468128 | L21: =IF(F21=0,0,((C21/F21)*100)-100) -> 23.547815390614232 | M21: =IF(G21=0,0,((C21/G21)*100)-100) -> 0 | N21: =IF(C21=0,0,IF(H21=0,0,((C21/H21)*100)-100)) -> 0 | P21: 5450000 | Q21: =IF(C21=0,0,((C21/P21)*100)-100) -> 4.8803242201834678 | R21: =IF(C21=0,0,(C21/$C$43)*100) -> 3.0603988869224943 | T21: 16.1 | U21: 16.778775834510913 | V21: 18.246743198001333 | W21: =U21-T21 -> 0.67877583451091184
A22: Total Super | B22: =SUM(B6:B21) -> 51599997 | C22: =SUM(C6:C21) -> 52784088.320000008 | D22: =SUM(D6:D21) -> 48138005.450000003 | F22: =SUM(F6:F21) -> 43960488.579999998 | G22: =SUM(G6:G21) -> 39021057.999999993 | H22: =SUM(H6:H21) -> 30462542.169999998 | I22: =SUM(B22:H22) -> 265966179.52000001 | J22: =IF(C22=0,0,((C22/B22)*100)-100) -> 2.2947507535707956 | K22: =IF(C22=0,0,IF(D22=0,0,((C22/D22)*100)-100)) -> 9.6515898956922825 | L22: =IF(F22=0,0,IF(C22=0,0,((C22/F22)*100)-100)) -> 20.071659858699434 | M22: =IF(G22=0,0,IF(C22=0,0,((C22/G22)*100)-100)) -> 35.270776922552983 | N22: =IF(C22=0,0,IF(H22=0,0,((C22/H22)*100)-100)) -> 73.275388591772327 | P22: =SUM(P6:P21) -> 51600000 | Q22: =IF(C22=0,0,((C22/P22)*100)-100) -> 2.2947448062015781 | R22: =IF(C22=0,0,(C22/$C$43)*100) -> 28.261195978700641 | T22: 16.548100782060125 | U22: 16.930737016469127 | V22: 18.36856803648967 | W22: =U22-T22 -> 0.38263623440900218
A23: Pinheirinho | B23: 5450000 | C23: 5712381.7300000004 | D23: 5189408.25 | F23: 4793900.25 | G23: 4651250.75 | H23: 4301190.09 | J23: =IF(B23=0,0,((C23/B23)*100)-100) -> 4.8143436697247779 | K23: =IF(C23=0,0,IF(D23=0,0,((C23/D23)*100)-100)) -> 10.077709341908133 | L23: =IF(F23=0,0,((C23/F23)*100)-100) -> 19.159378211926722 | M23: =IF(G23=0,0,((C23/G23)*100)-100) -> 22.813884630924292 | N23: =IF(C23=0,0,IF(H23=0,0,((C23/H23)*100)-100)) -> 32.809329754593591 | P23: 5450000 | Q23: =IF(C23=0,0,IF(P23=0,0,((C23/P23)*100)-100)) -> 4.8143436697247779 | R23: =IF(C23=0,0,(C23/$C$43)*100) -> 3.05847358010557 | T23: 16.25 | U23: 16.611384792731627 | V23: 17.878298499144591 | W23: =U23-T23 -> 0.36138479273162716
A24: Londrina | B24: 5800000 | C24: 6396956.5800000001 | D24: 5477513.21 | F24: 4431883.02 | G24: 3563870.9 | H24: 3301450.02 | J24: =IF(B24=0,0,((C24/B24)*100)-100) -> 10.292354827586209 | K24: =IF(C24=0,0,IF(D24=0,0,((C24/D24)*100)-100)) -> 16.785780969389947 | L24: =IF(F24=0,0,((C24/F24)*100)-100) -> 44.339472660539684 | M24: =IF(G24=0,0,((C24/G24)*100)-100) -> 79.494621424137449 | N24: =IF(C24=0,0,IF(H24=0,0,((C24/H24)*100)-100)) -> 93.762030054902965 | P24: 5800000 | Q24: =IF(C24=0,0,IF(P24=0,0,((C24/P24)*100)-100)) -> 10.292354827586209 | R24: =IF(C24=0,0,(C24/$C$43)*100) -> 3.4250026727489868 | T24: 16.17 | U24: 16.440388594915241 | V24: 17.78663734340995 | W24: =U24-T24 -> 0.27038859491523937
A25: São Bráz | B25: 6400000 | C25: 6702303.5499999998 | D25: 6038557.5499999998 | F25: 5612214.5700000003 | G25: 5021487.92 | H25: 4720365.28 | J25: =IF(B25=0,0,((C25/B25)*100)-100) -> 4.72349296874998 | K25: =IF(C25=0,0,IF(D25=0,0,((C25/D25)*100)-100)) -> 10.991797204946735 | L25: =IF(F25=0,0,((C25/F25)*100)-100) -> 19.423508606157938 | M25: =IF(G25=0,0,((C25/G25)*100)-100) -> 33.472461883369419 | N25: =IF(C25=0,0,IF(H25=0,0,((C25/H25)*100)-100)) -> 41.986968220391617 | P25: 6400000 | Q25: =IF(C25=0,0,IF(P25=0,0,((C25/P25)*100)-100)) -> 4.72349296874998 | R25: =IF(C25=0,0,(C25/$C$43)*100) -> 3.5884888829939539 | T25: 15.67 | U25: 16.213323999626965 | V25: 17.433915484177078 | W25: =U25-T25 -> 0.5433239996269652
A26: S.J. Pinhais | B26: 6300000 | C26: 6402768.1500000004 | D26: 5897153.1799999997 | F26: 6549676.96 | G26: 5696099.1200000001 | H26: 5246767.7 | J26: =IF(B26=0,0,((C26/B26)*100)-100) -> 1.6312404761904702 | K26: =IF(C26=0,0,IF(D26=0,0,((C26/D26)*100)-100)) -> 8.5738822541489412 | L26: =IF(F26=0,0,((C26/F26)*100)-100) -> -2.2429932177906835 | M26: =IF(G26=0,0,((C26/G26)*100)-100) -> 12.406192643642072 | N26: =IF(C26=0,0,IF(H26=0,0,((C26/H26)*100)-100)) -> 22.032621150732481 | P26: 6300000 | Q26: =IF(C26=0,0,IF(P26=0,0,((C26/P26)*100)-100)) -> 1.6312404761904702 | R26: =IF(C26=0,0,(C26/$C$43)*100) -> 3.4281142528471071 | T26: 16.65 | U26: 16.746276061862396 | V26: 18.056337092262194 | W26: =U26-T26 -> 9.6276061862397455E-2
A27: P.G. Nova | B27: 7200000 | C27: 7710728.2599999998 | D27: 6731400.5099999998 | F27: 6385175 | G27: 5115381.82 | H27: 4331847.83 | J27: =IF(B27=0,0,((C27/B27)*100)-100) -> 7.0934480555555695 | K27: =IF(C27=0,0,IF(D27=0,0,((C27/D27)*100)-100)) -> 14.548647767208848 | L27: =IF(F27=0,0,((C27/F27)*100)-100) -> 20.7598579522096 | M27: =IF(G27=0,0,((C27/G27)*100)-100) -> 50.736123545123746 | N27: =IF(C27=0,0,IF(H27=0,0,((C27/H27)*100)-100)) -> 78.000903138834389 | P27: 7200000 | Q27: =IF(C27=0,0,IF(P27=0,0,((C27/P27)*100)-100)) -> 7.0934480555555695 | R27: =IF(C27=0,0,(C27/$C$43)*100) -> 4.1284108417914487 | T27: 15.67 | U27: 16.5570993679396 | V27: 17.782336702395995 | W27: =U27-T27 -> 0.88709936793959976
A28: Nilo Pecanha | B28: 15950000 | C28: 16900508.969999999 | D28: 15265785.810000001 | F28: 14111384.380000001 | G28: 12296388.49 | H28: 11880345.5 | J28: =IF(B28=0,0,((C28/B28)*100)-100) -> 5.9593038871473425 | K28: =IF(C28=0,0,IF(D28=0,0,((C28/D28)*100)-100)) -> 10.708411478753717 | L28: =IF(F28=0,0,((C28/F28)*100)-100) -> 19.765067089753515 | M28: =IF(G28=0,0,((C28/G28)*100)-100) -> 37.442867747259982 | N28: =IF(C28=0,0,IF(H28=0,0,((C28/H28)*100)-100)) -> 42.256039355084397 | P28: 15950000 | Q28: =IF(C28=0,0,IF(P28=0,0,((C28/P28)*100)-100)) -> 5.9593038871473425 | R28: =IF(C28=0,0,(C28/$C$43)*100) -> 9.0487230402724155 | T28: 16.7 | U28: 17.116140733600641 | V28: 18.528216029224119 | W28: =U28-T28 -> 0.41614073360064197
A29: Champagnat | B29: 7250000 | C29: 7540207.7300000004 | D29: 6916397.4699999997 | F29: 6628147.0700000003 | G29: 6127551.9400000004 | H29: 6773376.3799999999 | J29: =IF(B29=0,0,((C29/B29)*100)-100) -> 4.0028652413793111 | K29: =IF(C29=0,0,IF(D29=0,0,((C29/D29)*100)-100)) -> 9.019294549016152 | L29: =IF(F29=0,0,((C29/F29)*100)-100) -> 13.760416755508118 | M29: =IF(G29=0,0,((C29/G29)*100)-100) -> 23.054162638399433 | N29: =IF(C29=0,0,IF(H29=0,0,((C29/H29)*100)-100)) -> 11.321257036066257 | P29: 7250000 | Q29: =IF(C29=0,0,IF(P29=0,0,((C29/P29)*100)-100)) -> 4.0028652413793111 | R29: =IF(C29=0,0,(C29/$C$43)*100) -> 4.0371122275669054 | T29: 17.08 | U29: 17.707069192376217 | V29: 18.807634626002535 | W29: =U29-T29 -> 0.62706919237621861
A30: Araucária Nova | B30: 7700000 | C30: 8301939.0499999998 | D30: 7367045.6799999997 | F30: 4919128.9 | G30: 3870077.46 | H30: 3379256.06 | J30: =IF(B30=0,0,((C30/B30)*100)-100) -> 7.8173902597402645 | K30: =IF(C30=0,0,IF(D30=0,0,((C30/D30)*100)-100)) -> 12.690207317948918 | L30: =IF(F30=0,0,((C30/F30)*100)-100) -> 68.76847951676973 | M30: =IF(G30=0,0,((C30/G30)*100)-100) -> 114.51609524115312 | N30: =IF(C30=0,0,IF(H30=0,0,((C30/H30)*100)-100)) -> 145.67357141914837 | P30: 7700000 | Q30: =IF(C30=0,0,IF(P30=0,0,((C30/P30)*100)-100)) -> 7.8173902597402645 | R30: =IF(C30=0,0,(C30/$C$43)*100) -> 4.4449517641167402 | T30: 15.9 | U30: 16.553443378989876 | V30: 17.8027465800294 | W30: =U30-T30 -> 0.65344337898987526
A31: Santa Candida | B31: 9300000 | C31: 9407850.8399999999 | D31: 8732176.2200000007 | F31: 8277587.8600000003 | G31: 7045078.7599999998 | H31: 6178313.9900000002 | J31: =IF(B31=0,0,((C31/B31)*100)-100) -> 1.1596864516129131 | K31: =IF(C31=0,0,IF(D31=0,0,((C31/D31)*100)-100)) -> 7.737757495691028 | L31: =IF(F31=0,0,((C31/F31)*100)-100) -> 13.654496927321034 | M31: =IF(G31=0,0,((C31/G31)*100)-100) -> 33.53790866633264 | N31: =IF(C31=0,0,IF(H31=0,0,((C31/H31)*100)-100)) -> 52.272138567693588 | P31: 9300000 | Q31: =IF(C31=0,0,IF(P31=0,0,((C31/P31)*100)-100)) -> 1.1596864516129131 | R31: =IF(C31=0,0,(C31/$C$43)*100) -> 5.0370694046236286 | T31: 16.3 | U31: 16.902731740164366 | V31: 18.232012500742414 | W31: =U31-T31 -> 0.6027317401643657
A32: Paranaguá Raia | B32: 8600000 | C32: 9033921.2100000009 | D32: 8098606.5300000003 | F32: 7644967.3200000003 | G32: 0 | H32: 6213555.8300000001 | J32: =IF(B32=0,0,((C32/B32)*100)-100) -> 5.0455954651162926 | K32: =IF(C32=0,0,IF(D32=0,0,((C32/D32)*100)-100)) -> 11.549081641826604 | L32: =IF(F32=0,0,((C32/F32)*100)-100) -> 18.168212261239589 | M32: =IF(G32=0,0,((C32/G32)*100)-100) -> 0 | N32: =IF(C32=0,0,IF(H32=0,0,((C32/H32)*100)-100)) -> 45.390521259708407 | P32: 8600000 | Q32: =IF(C32=0,0,IF(P32=0,0,((C32/P32)*100)-100)) -> 5.0455954651162926 | R32: =IF(C32=0,0,(C32/$C$43)*100) -> 4.8368632650080876 | T32: 18.999300000000002 | U32: 18.689140526608597 | V32: 19.807510346882911 | W32: =U32-T32 -> -0.31015947339140482
A33: Novo Mundo | B33: 7100000 | C33: 7839108.2000000002 | D33: 6746211.4500000002 | F33: 5748403.5599999996 | G33: 5114205.54 | H33: 0 | J33: =IF(B33=0,0,((C33/B33)*100)-100) -> 10.409974647887339 | K33: =IF(C33=0,0,IF(D33=0,0,((C33/D33)*100)-100)) -> 16.200155570279378 | L33: =IF(F33=0,0,((C33/F33)*100)-100) -> 36.370178575284314 | M33: =IF(G33=0,0,((C33/G33)*100)-100) -> 53.281054871330042 | N33: =IF(C33=0,0,IF(H33=0,0,((C33/H33)*100)-100)) -> 0 | P33: 7100000 | Q33: =IF(C33=0,0,IF(P33=0,0,((C33/P33)*100)-100)) -> 10.409974647887339 | R33: =IF(C33=0,0,(C33/$C$43)*100) -> 4.1971469090334983 | T33: 16 | U33: 16.654936080611822 | V33: 17.938428183705895 | W33: =U33-T33 -> 0.65493608061182229
A34: Água Verde | B34: 7700000 | C34: 8143044.7999999998 | D34: 7375716.5599999996 | F34: 6311718.9699999997 | G34: 0 | H34: 0 | J34: =IF(B34=0,0,((C34/B34)*100)-100) -> 5.7538285714285706 | K34: =IF(C34=0,0,IF(D34=0,0,((C34/D34)*100)-100)) -> 10.403439906589924 | L34: =IF(F34=0,0,((C34/F34)*100)-100) -> 29.014692173469825 | M34: =IF(G34=0,0,((C34/G34)*100)-100) -> 0 | N34: =IF(C34=0,0,IF(H34=0,0,((C34/H34)*100)-100)) -> 0 | P34: 7700000 | Q34: =IF(C34=0,0,IF(P34=0,0,((C34/P34)*100)-100)) -> 5.7538285714285706 | R34: =IF(C34=0,0,(C34/$C$43)*100) -> 4.3598779912798378 | T34: 16 | U34: 17.753568665126345 | V34: 18.916787776975021 | W34: =U34-T34 -> 1.7535686651263447
A35: Uvaranas | B35: 6300000 | C35: 6786993.7400000002 | D35: 5975043.5700000003 | F35: 5657899.8200000003 | G35: 4529219.72 | H35: 4204028.03 | J35: =IF(B35=0,0,((C35/B35)*100)-100) -> 7.7300593650793843 | K35: =IF(C35=0,0,IF(D35=0,0,((C35/D35)*100)-100)) -> 13.589025092247155 | L35: =IF(F35=0,0,((C35/F35)*100)-100) -> 19.956060657150346 | M35: =IF(G35=0,0,((C35/G35)*100)-100) -> 49.849072457893499 | N35: =IF(C35=0,0,IF(H35=0,0,((C35/H35)*100)-100)) -> 61.440258998463435 | P35: 6300000 | Q35: =IF(C35=0,0,IF(P35=0,0,((C35/P35)*100)-100)) -> 7.7300593650793843 | R35: =IF(C35=0,0,(C35/$C$43)*100) -> 3.633832965524153 | T35: 16.21 | U35: 16.653493480310768 | V35: 17.817845003640741 | W35: =U35-T35 -> 0.4434934803107673
A36: Torres | B36: 7250000 | C36: 7739015.0300000003 | D36: 6924746.5199999996 | F36: 6236762.5199999996 | G36: 5311693.18 | H36: 4611016.87 | J36: =IF(B36=0,0,((C36/B36)*100)-100) -> 6.7450348965517435 | K36: =IF(C36=0,0,IF(D36=0,0,((C36/D36)*100)-100)) -> 11.758820451380231 | L36: =IF(F36=0,0,((C36/F36)*100)-100) -> 24.087056468521766 | M36: =IF(G36=0,0,((C36/G36)*100)-100) -> 45.697704437062413 | N36: =IF(C36=0,0,IF(H36=0,0,((C36/H36)*100)-100)) -> 67.837491125899959 | P36: 7250000 | Q36: =IF(C36=0,0,IF(P36=0,0,((C36/P36)*100)-100)) -> 6.7450348965517435 | R36: =IF(C36=0,0,(C36/$C$43)*100) -> 4.1435558973568307 | T36: 16.5 | U36: 16.917319386573148 | V36: 18.247283648187977 | W36: =U36-T36 -> 0.41731938657314771
A37: Total Hiper | B37: =SUM(B23:B36) -> 108300000 | C37: =SUM(C23:C36) -> 114617727.83999999 | D37: =SUM(D23:D36) -> 102735762.51000001 | F37: =SUM(F23:F36) -> 93308850.200000003 | G37: =SUM(G23:G36) -> 68342305.599999994 | H37: =SUM(H23:H36) -> 65141513.580000006 | I37: =SUM(B37:H37) -> 552446159.73000002 | J37: =IF(C37=0,0,((C37/B37)*100)-100) -> 5.8335437119113323 | K37: =IF(C37=0,0,IF(D37=0,0,((C37/D37)*100)-100)) -> 11.565559100068427 | L37: =IF(F37=0,0,IF(C37=0,0,((C37/F37)*100)-100)) -> 22.836930895971946 | M37: =IF(G37=0,0,IF(C37=0,0,((C37/G37)*100)-100)) -> 67.711239522478138 | N37: =IF(C37=0,0,IF(H37=0,0,((C37/H37)*100)-100)) -> 75.951895405743784 | P37: =SUM(P23:P36) -> 108300000 | Q37: =IF(C37=0,0,((C37/P37)*100)-100) -> 5.8335437119113323 | R37: =IF(C37=0,0,(C37/$C$43)*100) -> 61.36762369526916 | T37: 16.495960110803328 | U37: 17.019711887179913 | V37: 18.282498691172798 | W37: =U37-T37 -> 0.5237517763765851
A38: Total s/ 33,36,38 | B38: =B22+B37 -> 159899997 | C38: =C22+C37 -> 167401816.16 | D38: =D22+D37 -> 150873767.96000001 | E38: =E22+E37 -> 0 | F38: =F22+F37 -> 137269338.78 | G38: =G22+G37 -> 107363363.59999999 | H38: =H22+H37 -> 95604055.75 | I38: =SUM(B38:H38) -> 818412339.25 | J38: =IF(C38=0,0,((C38/B38)*100)-100) -> 4.6915692937755153 | K38: =IF(C38=0,0,IF(D38=0,0,((C38/D38)*100)-100)) -> 10.954885281569915 | L38: =IF(F38=0,0,IF(C38=0,0,((C38/F38)*100)-100)) -> 21.951353192057681 | M38: =IF(G38=0,0,IF(C38=0,0,((C38/G38)*100)-100)) -> 55.920800678044344 | N38: =IF(C38=0,0,IF(H38=0,0,((C38/H38)*100)-100)) -> 75.09907382773352 | P38: =P22+P37 -> 159900000 | Q38: =IF(C38=0,0,((C38/P38)*100)-100) -> 4.6915673295809768 | R38: =IF(C38=0,0,(C38/$C$43)*100) -> 89.628819673969801 | T38: 16.512785992797738 | U38: 16.991656890277312 | V38: 18.309637536073428 | W38: =U38-T38 -> 0.4788708974795739
A39: S.J.P - Rua Joinvile | B39: 5900000 | C39: 5939798.3300000001 | D39: 5264902.94 | F39: 0 | G39: 0 | H39: 0 | J39: =IF(B39=0,0,((C39/B39)*100)-100) -> 0.67454796610168444 | K39: =IF(C39=0,0,IF(D39=0,0,((C39/D39)*100)-100)) -> 12.818762239138252 | L39: =IF(F39=0,0,((C39/F39)*100)-100) -> 0 | M39: =IF(G39=0,0,((C39/G39)*100)-100) -> 0 | N39: =IF(C39=0,0,IF(H39=0,0,((C39/H39)*100)-100)) -> 0 | P39: 5900000 | Q39: =IF(P39=0,0,IF(C39=0,0,((C39/P39)*100)-100)) -> 0.67454796610168444 | R39: =IF(C39=0,0,(C39/$C$43)*100) -> 3.1802349916591068 | T39: 15.7 | U39: 16.754225222996752 | V39: 18.017720401291808 | W39: =U39-T39 -> 1.0542252229967524
A40: Castro | B40: 3900000 | C40: 3766155.87 | D40: 3342256.13 | F40: 0 | G40: 0 | H40: 0 | J40: =IF(B40=0,0,((C40/B40)*100)-100) -> -3.431900769230765 | K40: =IF(C40=0,0,IF(D40=0,0,((C40/D40)*100)-100)) -> 12.683041739233801 | L40: =IF(F40=0,0,((C40/F40)*100)-100) -> 0 | M40: =IF(G40=0,0,((C40/G40)*100)-100) -> 0 | N40: =IF(C40=0,0,IF(H40=0,0,((C40/H40)*100)-100)) -> 0 | P40: 3900000 | Q40: =IF(P40=0,0,IF(C40=0,0,((C40/P40)*100)-100)) -> -3.431900769230765 | R40: =IF(C40=0,0,(C40/$C$43)*100) -> 2.016442312750431 | T40: 16.5 | U40: 16.825547106206201 | V40: 18.054844015258457 | W40: =U40-T40 -> 0.32554710620620142
A41: Colombo | B41: 4500000 | C41: 4623034.27 | D41: 4218829.75 | F41: 0 | G41: 0 | H41: 0 | J41: =IF(B41=0,0,((C41/B41)*100)-100) -> 2.7340948888888761 | K41: =IF(C41=0,0,IF(D41=0,0,((C41/D41)*100)-100)) -> 9.580963062090845 | L41: =IF(F41=0,0,((C41/F41)*100)-100) -> 0 | M41: =IF(G41=0,0,((C41/G41)*100)-100) -> 0 | N41: =IF(C41=0,0,IF(H41=0,0,((C41/H41)*100)-100)) -> 0 | P41: 4500000 | Q41: =IF(P41=0,0,IF(C41=0,0,((C41/P41)*100)-100)) -> 2.7340948888888761 | R41: =IF(C41=0,0,(C41/$C$43)*100) -> 2.4752246686283055 | T41: 15 | U41: 16.341911521239926 | V41: 17.899234545367108 | W41: =U41-T41 -> 1.3419115212399255
A42: Pinhais | B42: 5079337.59 | C42: 5041504.51 | D42: 0 | F42: 0 | G42: 0 | H42: 0 | J42: =IF(B42=0,0,((C42/B42)*100)-100) -> -0.74484279356592253 | K42: =IF(C42=0,0,IF(D42=0,0,((C42/D42)*100)-100)) -> 0 | L42: =IF(F42=0,0,((C42/F42)*100)-100) -> 0 | M42: =IF(G42=0,0,((C42/G42)*100)-100) -> 0 | N42: =IF(C42=0,0,IF(H42=0,0,((C42/H42)*100)-100)) -> 0 | P42: 4000000 | Q42: =IF(P42=0,0,IF(C42=0,0,((C42/P42)*100)-100)) -> 26.037612750000008 | R42: =IF(C42=0,0,(C42/$C$43)*100) -> 2.6992783529923647 | T42: 16 | U42: 15.869331331809125 | V42: 17.272100651160578 | W42: =U42-T42 -> -0.13066866819087508
A43: Total Geral | B43: =B22+B37+SUM(B39:B42) -> 179279334.59 | C43: =C22+C37+SUM(C39:C42) -> 186772309.13999999 | D43: =D22+D37+SUM(D39:D42) -> 163699756.78 | F43: =F22+F37+SUM(F39:F42) -> 137269338.78 | G43: =G22+G37+SUM(G39:G42) -> 107363363.59999999 | H43: =H22+H37+SUM(H39:H42) -> 95604055.75 | J43: =IF(C43=0,0,((C43/B43)*100)-100) -> 4.1794970776391551 | K43: =IF(C43=0,0,IF(D43=0,0,((C43/D43)*100)-100)) -> 14.094432889724899 | L43: =IF(F43=0,0,IF(C43=0,0,((C43/F43)*100)-100)) -> 36.062656671886373 | M43: =IF(G43=0,0,IF(C43=0,0,((C43/G43)*100)-100)) -> 73.962795945785729 | N43: =IF(C43=0,0,IF(H43=0,0,((C43/H43)*100)-100)) -> 95.360236210481048 | P43: =P22+P37+SUM(P39:P42) -> 178200000 | Q43: =IF(C43=0,0,((C43/P43)*100)-100) -> 4.8104989562289546 | R43: =R22+R37+SUM(R39:R42) -> 100 | T43: 16.43 | U43: 16.934379148834033 | V43: 18.257051716237079 | W43: =U43-T43 -> 0.50437914883403323
A45: Água Verde | B45: 0 | C45: 0 | D45: 0 | F45: 0 | G45: 0 | H45: 0 | J45: =IF(B45=0,0,((C45/B45)*100)-100) -> 0 | K45: =IF(C45=0,0,IF(D45=0,0,((C45/D45)*100)-100)) -> 0 | L45: =IF(F45=0,0,((C45/F45)*100)-100) -> 0 | M45: =IF(G45=0,0,((C45/G45)*100)-100) -> 0 | N45: =IF(C45=0,0,IF(H45=0,0,((C45/H45)*100)-100)) -> 0 | P45: =B45 -> 0 | Q45: =IF(C45=0,0,IF(P45=0,0,((C45/P45)*100)-100)) -> 0 | R45: =IF(C45=0,0,(C45/$C$43)*100) -> 0 | T45: 14.95 | U45: 0 | W45: =U45-T45 -> -14.95
A46: Total Geral | B46: =B43+B45 -> 179279334.59 | C46: =C43+C45 -> 186772309.13999999 | D46: =D43+D45 -> 163699756.78 | F46: =F43+F45 -> 137269338.78 | G46: =G43+G45 -> 107363363.59999999 | H46: =H43+H45 -> 95604055.75 | J46: =IF(C46=0,0,((C46/B46)*100)-100) -> 4.1794970776391551 | K46: =IF(C46=0,0,IF(D46=0,0,((C46/D46)*100)-100)) -> 14.094432889724899 | L46: =IF(F46=0,0,IF(C46=0,0,((C46/F46)*100)-100)) -> 36.062656671886373 | M46: =IF(G46=0,0,IF(C46=0,0,((C46/G46)*100)-100)) -> 73.962795945785729 | N46: =IF(C46=0,0,IF(H46=0,0,((C46/H46)*100)-100)) -> 95.360236210481048 | P46: =P43+P45 -> 178200000 | Q46: =IF(C46=0,0,((C46/P46)*100)-100) -> 4.8104989562289546 | R46: =R25+R40+R45 -> 5.6049311957443848 | T46: 16.433259521448118 | U46: 16.934379148834033 | W46: =U46-T46 -> 0.50111962738591487