A2: Periodo: | C2: 38565 | D2: a | E2: 38595 | H2: Vendas Acumuladas por Filial | Q2: =NOW() -> 38622.338097916698
A4: v.1 | C4: Vendas 2005 | G4: Vendas de Anos Anteriores | K4: Percentuais ( % ) | Q4: Meta Mensal | U4: Margem
A5: Lojas | C5: Previsao | D5: Realizada | E5: Mes Anterior | G5: Vendas 2004 | H5: Vendas 2003 | I5: Vendas 2002 | K5: % Prev | L5: % MA | M5: 2004 | N5: 2003 | O5: 2002 | Q5: Previsao Mes | R5: Final | S5: Part. | U5: Meta | V5: Real
A7: Xaxim | C7: 840000 | D7: 708755 | E7: 730589 | G7: 778972 | H7: 748518 | I7: 566867 | K7: =IF(C7=0,0,((D7/C7)*100)-100) -> -15.62 | L7: =IF(D7=0,0,IF(E7=0,0,((D7/E7)*100)-100)) -> -2.99 | M7: =IF(G7=0,0,((D7/G7)*100)-100) -> -9.01 | N7: =IF(H7=0,0,((D7/H7)*100)-100) -> -5.31 | O7: =IF(D7=0,0,IF(I7=0,0,((D7/I7)*100)-100)) -> 25.03 | Q7: 840000 | R7: =IF(D7=0,0,((D7/Q7)*100)-100) -> -15.62 | S7: =IF(D7=0,0,(D7/$D$35)*100) -> 1.31 | U7: 17.45 | V7: 16.2
A8: S. Felicidade | C8: 740000 | D8: 665046 | E8: 694939 | G8: 667844 | H8: 788451 | I8: 586520 | K8: =IF(C8=0,0,((D8/C8)*100)-100) -> -10.13 | L8: =IF(D8=0,0,IF(E8=0,0,((D8/E8)*100)-100)) -> -4.3 | M8: =IF(G8=0,0,((D8/G8)*100)-100) -> -00.42 | N8: =IF(H8=0,0,((D8/H8)*100)-100) -> -15.65 | O8: =IF(D8=0,0,IF(I8=0,0,((D8/I8)*100)-100)) -> 13.39 | Q8: 740000 | R8: =IF(D8=0,0,((D8/Q8)*100)-100) -> -10.13 | S8: =IF(D8=0,0,(D8/$D$35)*100) -> 1.23 | U8: 16.75 | V8: 16.64
A9: Lapa | C9: 1175000 | D9: 1066422 | E9: 1164156 | G9: 1067449 | H9: 1083326 | I9: 892002 | K9: =IF(C9=0,0,((D9/C9)*100)-100) -> -9.24 | L9: =IF(D9=0,0,IF(E9=0,0,((D9/E9)*100)-100)) -> -8.4 | M9: =IF(G9=0,0,((D9/G9)*100)-100) -> -00.1 | N9: =IF(H9=0,0,((D9/H9)*100)-100) -> -1.56 | O9: =IF(D9=0,0,IF(I9=0,0,((D9/I9)*100)-100)) -> 19.55 | Q9: 1175000 | R9: =IF(D9=0,0,((D9/Q9)*100)-100) -> -9.24 | S9: =IF(D9=0,0,(D9/$D$35)*100) -> 1.97 | U9: 16.9 | V9: 16.19
A10: Araucaria | C10: 1050000 | D10: 883727 | E10: 941477 | G10: 904182 | H10: 1038785 | I10: 1984356 | K10: =IF(C10=0,0,((D10/C10)*100)-100) -> -15.84 | L10: =IF(D10=0,0,IF(E10=0,0,((D10/E10)*100)-100)) -> -6.13 | M10: =IF(G10=0,0,((D10/G10)*100)-100) -> -2.26 | N10: =IF(H10=0,0,((D10/H10)*100)-100) -> -14.93 | O10: =IF(D10=0,0,IF(I10=0,0,((D10/I10)*100)-100)) -> -55.47 | Q10: 1050000 | R10: =IF(D10=0,0,((D10/Q10)*100)-100) -> -15.84 | S10: =IF(D10=0,0,(D10/$D$35)*100) -> 1.63 | U10: 17.8 | V10: 17.3
A11: Pinheirinho | C11: 2140000 | D11: 1792022 | E11: 1843454 | G11: 1901812 | H11: 1845778 | I11: 1739399 | K11: =IF(C11=0,0,((D11/C11)*100)-100) -> -16.26 | L11: =IF(D11=0,0,IF(E11=0,0,((D11/E11)*100)-100)) -> -2.79 | M11: =IF(G11=0,0,((D11/G11)*100)-100) -> -5.77 | N11: =IF(H11=0,0,((D11/H11)*100)-100) -> -2.91 | O11: =IF(D11=0,0,IF(I11=0,0,((D11/I11)*100)-100)) -> 3.03 | Q11: 2140000 | R11: =IF(D11=0,0,((D11/Q11)*100)-100) -> -16.26 | S11: =IF(D11=0,0,(D11/$D$35)*100) -> 3.32 | U11: 17.45 | V11: 16.39
A12: Hauer | C12: 3160000 | D12: 2902375 | E12: 3065030 | G12: 2873587 | H12: 3104644 | I12: 2614496 | K12: =IF(C12=0,0,((D12/C12)*100)-100) -> -8.15 | L12: =IF(D12=0,0,IF(E12=0,0,((D12/E12)*100)-100)) -> -5.31 | M12: =IF(G12=0,0,((D12/G12)*100)-100) -> 1 | N12: =IF(H12=0,0,((D12/H12)*100)-100) -> -6.52 | O12: =IF(D12=0,0,IF(I12=0,0,((D12/I12)*100)-100)) -> 11.01 | Q12: 3160000 | R12: =IF(D12=0,0,((D12/Q12)*100)-100) -> -8.15 | S12: =IF(D12=0,0,(D12/$D$35)*100) -> 5.37 | U12: 16.9 | V12: 17.46
A13: Paranagua | C13: 1800000 | D13: 1559438 | E13: 1610625 | G13: 3356982 | H13: 3184960 | I13: 2865772 | K13: =IF(C13=0,0,((D13/C13)*100)-100) -> -13.36 | L13: =IF(D13=0,0,IF(E13=0,0,((D13/E13)*100)-100)) -> -3.18 | M13: =IF(G13=0,0,((D13/G13)*100)-100) -> -53.55 | N13: =IF(H13=0,0,((D13/H13)*100)-100) -> -51.04 | O13: =IF(D13=0,0,IF(I13=0,0,((D13/I13)*100)-100)) -> -45.58 | Q13: 1800000 | R13: =IF(D13=0,0,((D13/Q13)*100)-100) -> -13.36 | S13: =IF(D13=0,0,(D13/$D$35)*100) -> 2.89 | U13: 18 | V13: 17.27
A14: Centenario | C14: 1030000 | D14: 908647 | E14: 954707 | G14: 951154 | H14: 954058 | I14: 757982 | K14: =IF(C14=0,0,((D14/C14)*100)-100) -> -11.78 | L14: =IF(D14=0,0,IF(E14=0,0,((D14/E14)*100)-100)) -> -4.82 | M14: =IF(G14=0,0,((D14/G14)*100)-100) -> -4.47 | N14: =IF(H14=0,0,((D14/H14)*100)-100) -> -4.76 | O14: =IF(D14=0,0,IF(I14=0,0,((D14/I14)*100)-100)) -> 19.88 | Q14: 1030000 | R14: =IF(D14=0,0,((D14/Q14)*100)-100) -> -11.78 | S14: =IF(D14=0,0,(D14/$D$35)*100) -> 1.68 | U14: 17.1 | V14: 15.83
A15: Arapongas | C15: 0 | D15: 0 | E15: 0 | G15: 0 | H15: 0 | I15: 0 | K15: =IF(C15=0,0,((D15/C15)*100)-100) -> 0 | L15: =IF(D15=0,0,IF(E15=0,0,((D15/E15)*100)-100)) -> 0 | M15: =IF(D15=0,0,IF(G15=0,0,((D15/G15)*100)-100)) -> 0 | N15: =IF(D15=0,0,IF(H15=0,0,((D15/H15)*100)-100)) -> 0 | O15: =IF(D15=0,0,IF(I15=0,0,((D15/I15)*100)-100)) -> 0 | Q15: 0 | R15: =IF(D15=0,0,((D15/Q15)*100)-100) -> 0 | S15: =IF(D15=0,0,(D15/$D$35)*100) -> 0 | U15: 0 | V15: 0
A16: Sao Braz | C16: 3350000 | D16: 2932454 | E16: 3144128 | G16: 2994943 | H16: 3259269 | I16: 2627404 | K16: =IF(C16=0,0,((D16/C16)*100)-100) -> -12.46 | L16: =IF(D16=0,0,IF(E16=0,0,((D16/E16)*100)-100)) -> -6.73 | M16: =IF(G16=0,0,((D16/G16)*100)-100) -> -2.09 | N16: =IF(H16=0,0,((D16/H16)*100)-100) -> -10.03 | O16: =IF(D16=0,0,IF(I16=0,0,((D16/I16)*100)-100)) -> 11.61 | Q16: 3350000 | R16: =IF(D16=0,0,((D16/Q16)*100)-100) -> -12.46 | S16: =IF(D16=0,0,(D16/$D$35)*100) -> 5.43 | U16: 16.9 | V16: 16.56
A17: Sitio Cercado | C17: 1440000 | D17: 1236262 | E17: 1429276 | G17: 1504003 | H17: 1308300 | I17: 942177 | K17: =IF(C17=0,0,((D17/C17)*100)-100) -> -14.15 | L17: =IF(D17=0,0,IF(E17=0,0,((D17/E17)*100)-100)) -> -13.5 | M17: =IF(G17=0,0,((D17/G17)*100)-100) -> -17.8 | N17: =IF(H17=0,0,((D17/H17)*100)-100) -> -5.51 | O17: =IF(D17=0,0,IF(I17=0,0,((D17/I17)*100)-100)) -> 31.21 | Q17: 1440000 | R17: =IF(D17=0,0,((D17/Q17)*100)-100) -> -14.15 | S17: =IF(D17=0,0,(D17/$D$35)*100) -> 2.29 | U17: 17 | V17: 14.47
A18: Apucarana | C18: 1630000 | D18: 1417379 | E18: 1545857 | G18: 1394466 | H18: 1407605 | I18: 1269379 | K18: =IF(C18=0,0,((D18/C18)*100)-100) -> -13.04 | L18: =IF(D18=0,0,IF(E18=0,0,((D18/E18)*100)-100)) -> -8.31 | M18: =IF(G18=0,0,((D18/G18)*100)-100) -> 1.64 | N18: =IF(H18=0,0,((D18/H18)*100)-100) -> 00.69 | O18: =IF(D18=0,0,IF(I18=0,0,((D18/I18)*100)-100)) -> 11.66 | Q18: 1630000 | R18: =IF(D18=0,0,((D18/Q18)*100)-100) -> -13.04 | S18: =IF(D18=0,0,(D18/$D$35)*100) -> 2.62 | U18: 18 | V18: 16.66
A19: Ahu | C19: 1190000 | D19: 1052895 | E19: 1054408 | G19: 1108567 | H19: 1321358 | I19: 1045983 | K19: =IF(C19=0,0,((D19/C19)*100)-100) -> -11.52 | L19: =IF(D19=0,0,IF(E19=0,0,((D19/E19)*100)-100)) -> -00.14 | M19: =IF(G19=0,0,((D19/G19)*100)-100) -> -5.02 | N19: =IF(H19=0,0,((D19/H19)*100)-100) -> -20.32 | O19: =IF(D19=0,0,IF(I19=0,0,((D19/I19)*100)-100)) -> 00.66 | Q19: 1190000 | R19: =IF(D19=0,0,((D19/Q19)*100)-100) -> -11.52 | S19: =IF(D19=0,0,(D19/$D$35)*100) -> 1.95 | U19: 17.91 | V19: 16.21
A20: P.G. Centro | C20: 1800000 | D20: 1550259 | E20: 1568467 | G20: 1670532 | H20: 1667495 | I20: 1394463 | K20: =IF(C20=0,0,((D20/C20)*100)-100) -> -13.87 | L20: =IF(D20=0,0,IF(E20=0,0,((D20/E20)*100)-100)) -> -1.16 | M20: =IF(G20=0,0,((D20/G20)*100)-100) -> -7.2 | N20: =IF(H20=0,0,((D20/H20)*100)-100) -> -7.03 | O20: =IF(D20=0,0,IF(I20=0,0,((D20/I20)*100)-100)) -> 11.17 | Q20: 1800000 | R20: =IF(D20=0,0,((D20/Q20)*100)-100) -> -13.87 | S20: =IF(D20=0,0,(D20/$D$35)*100) -> 2.87 | U20: 18.9 | V20: 17.47
A21: Maringa | C21: 2350000 | D21: 2217443 | E21: 2294267 | G21: 2104226 | H21: 2125876 | I21: 1885013 | K21: =IF(C21=0,0,((D21/C21)*100)-100) -> -5.64 | L21: =IF(D21=0,0,IF(E21=0,0,((D21/E21)*100)-100)) -> -3.35 | M21: =IF(G21=0,0,((D21/G21)*100)-100) -> 5.38 | N21: =IF(H21=0,0,((D21/H21)*100)-100) -> 4.31 | O21: =IF(D21=0,0,IF(I21=0,0,((D21/I21)*100)-100)) -> 17.64 | Q21: 2350000 | R21: =IF(D21=0,0,((D21/Q21)*100)-100) -> -5.64 | S21: =IF(D21=0,0,(D21/$D$35)*100) -> 4.1 | U21: 19 | V21: 17.26
A22: Araucaria Nova | C22: 2330000 | D22: 1850146 | E22: 2015707 | G22: 2160030 | H22: 1999164 | I22: 0 | K22: =IF(C22=0,0,((D22/C22)*100)-100) -> -20.59 | L22: =IF(D22=0,0,IF(E22=0,0,((D22/E22)*100)-100)) -> -8.21 | M22: =IF(G22=0,0,((D22/G22)*100)-100) -> -14.35 | N22: =IF(H22=0,0,((D22/H22)*100)-100) -> -7.45 | O22: =IF(D22=0,0,IF(I22=0,0,((D22/I22)*100)-100)) -> 0 | Q22: 2330000 | R22: =IF(D22=0,0,((D22/Q22)*100)-100) -> -20.59 | S22: =IF(D22=0,0,(D22/$D$35)*100) -> 3.42 | U22: 17.5 | V22: 17.36
A23: Sitio Cercado | C23: 0 | D23: 0 | E23: 0 | G23: 0 | H23: 0 | I23: 0 | K23: =IF(C23=0,0,((D23/C23)*100)-100) -> 0 | L23: =IF(D23=0,0,IF(E23=0,0,((D23/E23)*100)-100)) -> 0 | M23: =IF(G23=0,0,((D23/G23)*100)-100) -> 0 | N23: =IF(H23=0,0,((D23/H23)*100)-100) -> 0 | O23: =IF(D23=0,0,IF(I23=0,0,((D23/I23)*100)-100)) -> 0 | Q23: 0 | R23: =IF(Q23=0,0,IF(D23=0,0,((D23/Q23)*100)-100)) -> 0 | S23: =IF(D23=0,0,(D23/$D$35)*100) -> 0 | U23: 0 | V23: 0
A24: Total Super | C24: =SUM(C7:C23) -> 26025000 | D24: =SUM(D7:D23) -> 22743270 | E24: =SUM(E7:E23) -> 24057087 | G24: =SUM(G7:G23) -> 25438749 | H24: =SUM(H7:H23) -> 25837587 | I24: =SUM(I7:I23) -> 21171813 | J24: =SUM(C24:I24) -> 145273506 | K24: =IF(D24=0,0,((D24/C24)*100)-100) -> -12.61 | L24: =IF(D24=0,0,IF(E24=0,0,((D24/E24)*100)-100)) -> -5.46 | M24: =IF(G24=0,0,IF(D24=0,0,((D24/G24)*100)-100)) -> -10.6 | N24: =IF(H24=0,0,IF(D24=0,0,((D24/H24)*100)-100)) -> -11.98 | O24: =IF(D24=0,0,IF(I24=0,0,((D24/I24)*100)-100)) -> 7.42 | Q24: =SUM(Q7:Q23) -> 26025000 | R24: =IF(D24=0,0,((D24/Q24)*100)-100) -> -12.61 | S24: =IF(D24=0,0,(D24/$D$35)*100) -> 42.08 | U24: 17.58 | V24: 16.75
A26: Londrina | C26: 2800000 | D26: 2599491 | E26: 2708230 | G26: 2115832 | H26: 2295835 | I26: 2084844 | K26: =IF(C26=0,0,((D26/C26)*100)-100) -> -7.16 | L26: =IF(D26=0,0,IF(E26=0,0,((D26/E26)*100)-100)) -> -4.02 | M26: =IF(G26=0,0,((D26/G26)*100)-100) -> 22.86 | N26: =IF(H26=0,0,((D26/H26)*100)-100) -> 13.23 | O26: =IF(D26=0,0,IF(I26=0,0,((D26/I26)*100)-100)) -> 24.69 | Q26: 2800000 | R26: =IF(D26=0,0,IF(Q26=0,0,((D26/Q26)*100)-100)) -> -7.16 | S26: =IF(D26=0,0,(D26/$D$35)*100) -> 4.81 | U26: 17.9 | V26: 13.49
A27: S.J. Pinhais | C27: 4370000 | D27: 3728020 | E27: 4133458 | G27: 4180216 | H27: 4216272 | I27: 3475763 | K27: =IF(C27=0,0,((D27/C27)*100)-100) -> -14.69 | L27: =IF(D27=0,0,IF(E27=0,0,((D27/E27)*100)-100)) -> -9.81 | M27: =IF(G27=0,0,((D27/G27)*100)-100) -> -10.82 | N27: =IF(H27=0,0,((D27/H27)*100)-100) -> -11.58 | O27: =IF(D27=0,0,IF(I27=0,0,((D27/I27)*100)-100)) -> 7.26 | Q27: 4370000 | R27: =IF(D27=0,0,IF(Q27=0,0,((D27/Q27)*100)-100)) -> -14.69 | S27: =IF(D27=0,0,(D27/$D$35)*100) -> 6.9 | U27: 16.8 | V27: 14.89
A28: P.G. Nova | C28: 3500000 | D28: 3111394 | E28: 3501253 | G28: 3170183 | H28: 3036784 | I28: 2907396 | K28: =IF(C28=0,0,((D28/C28)*100)-100) -> -11.1 | L28: =IF(D28=0,0,IF(E28=0,0,((D28/E28)*100)-100)) -> -11.13 | M28: =IF(G28=0,0,((D28/G28)*100)-100) -> -1.85 | N28: =IF(H28=0,0,((D28/H28)*100)-100) -> 2.46 | O28: =IF(D28=0,0,IF(I28=0,0,((D28/I28)*100)-100)) -> 7.02 | Q28: 3500000 | R28: =IF(D28=0,0,IF(Q28=0,0,((D28/Q28)*100)-100)) -> -11.1 | S28: =IF(D28=0,0,(D28/$D$35)*100) -> 5.76 | U28: 17.15 | V28: 15.83
A29: Nilo Pecanha | C29: 8850000 | D29: 8483332 | E29: 9047119 | G29: 8352404 | H29: 8606903 | I29: 6611969 | K29: =IF(C29=0,0,((D29/C29)*100)-100) -> -4.14 | L29: =IF(D29=0,0,IF(E29=0,0,((D29/E29)*100)-100)) -> -6.23 | M29: =IF(G29=0,0,((D29/G29)*100)-100) -> 1.57 | N29: =IF(H29=0,0,((D29/H29)*100)-100) -> -1.44 | O29: =IF(D29=0,0,IF(I29=0,0,((D29/I29)*100)-100)) -> 28.3 | Q29: 8850000 | R29: =IF(D29=0,0,IF(Q29=0,0,((D29/Q29)*100)-100)) -> -4.14 | S29: =IF(D29=0,0,(D29/$D$35)*100) -> 15.69 | U29: 16.2 | V29: 16.37
A30: Champagnat | C30: 5800000 | D30: 5484275 | E30: 5728788 | G30: 4887601 | H30: 0 | I30: 0 | K30: =IF(C30=0,0,((D30/C30)*100)-100) -> -5.44 | L30: =IF(D30=0,0,IF(E30=0,0,((D30/E30)*100)-100)) -> -4.27 | M30: =IF(G30=0,0,((D30/G30)*100)-100) -> 12.21 | N30: =IF(H30=0,0,((D30/H30)*100)-100) -> 0 | O30: =IF(D30=0,0,IF(I30=0,0,((D30/I30)*100)-100)) -> 0 | Q30: 5800000 | R30: =IF(D30=0,0,IF(Q30=0,0,((D30/Q30)*100)-100)) -> -5.44 | S30: =IF(D30=0,0,(D30/$D$35)*100) -> 10.15 | U30: 16.5 | V30: 16.96
A31: Santa Candida | C31: 4600000 | D31: 3933843 | E31: 4411558 | G31: 0 | H31: 0 | I31: 0 | K31: =IF(C31=0,0,((D31/C31)*100)-100) -> -14.48 | L31: =IF(D31=0,0,IF(E31=0,0,((D31/E31)*100)-100)) -> -10.83 | M31: =IF(G31=0,0,((D31/G31)*100)-100) -> 0 | N31: =IF(H31=0,0,((D31/H31)*100)-100) -> 0 | O31: =IF(D31=0,0,IF(I31=0,0,((D31/I31)*100)-100)) -> 0 | Q31: 4600000 | R31: =IF(D31=0,0,IF(Q31=0,0,((D31/Q31)*100)-100)) -> -14.48 | S31: =IF(D31=0,0,(D31/$D$35)*100) -> 7.28 | U31: 16.4 | V31: 15.55
A32: Paranagu Raia | C32: 4200000 | D32: 3968450 | E32: 4008658 | G32: 0 | H32: 0 | I32: 0 | K32: =IF(C32=0,0,((D32/C32)*100)-100) -> -5.51 | L32: =IF(D32=0,0,IF(E32=0,0,((D32/E32)*100)-100)) -> -1 | M32: =IF(G32=0,0,((D32/G32)*100)-100) -> 0 | N32: =IF(H32=0,0,((D32/H32)*100)-100) -> 0 | O32: =IF(D32=0,0,IF(I32=0,0,((D32/I32)*100)-100)) -> 0 | Q32: 4200000 | R32: =IF(D32=0,0,IF(Q32=0,0,((D32/Q32)*100)-100)) -> -5.51 | S32: =IF(D32=0,0,(D32/$D$35)*100) -> 7.34 | U32: 15.5 | V32: 15.89
A33: Total Hiper | C33: =SUM(C26:C32) -> 34120000 | D33: =SUM(D26:D32) -> 31308805 | E33: =SUM(E26:E32) -> 33539064 | G33: =SUM(G26:G32) -> 22706236 | H33: =SUM(H26:H32) -> 18155794 | I33: =SUM(I26:I32) -> 15079972 | J33: =SUM(C33:I33) -> 154909871 | K33: =IF(D33=0,0,((D33/C33)*100)-100) -> -8.24 | L33: =IF(D33=0,0,IF(E33=0,0,((D33/E33)*100)-100)) -> -6.65 | M33: =IF(G33=0,0,IF(D33=0,0,((D33/G33)*100)-100)) -> 37.89 | N33: =IF(H33=0,0,IF(D33=0,0,((D33/H33)*100)-100)) -> 72.45 | O33: =IF(D33=0,0,IF(I33=0,0,((D33/I33)*100)-100)) -> 107.62 | Q33: =SUM(Q26:Q32) -> 34120000 | R33: =IF(D33=0,0,((D33/Q33)*100)-100) -> -8.24 | S33: =IF(D33=0,0,(D33/$D$35)*100) -> 57.92 | U33: 16.51 | V33: 15.83
A35: Total Geral | C35: =C24+C33 -> 60145000 | D35: =D24+D33 -> 54052075 | E35: =E24+E33 -> 57596151 | G35: =G24+G33 -> 48144985 | H35: =H24+H33 -> 43993381 | I35: =I24+I33 -> 36251785 | K35: =IF(D33=0,0,((D35/C35)*100)-100) -> -10.13 | L35: =IF(D35=0,0,IF(E35=0,0,((D35/E35)*100)-100)) -> -6.15 | M35: =IF(G35=0,0,IF(D35=0,0,((D35/G35)*100)-100)) -> 12.27 | N35: =IF(H35=0,0,IF(D35=0,0,((D35/H35)*100)-100)) -> 22.86 | O35: =IF(D35=0,0,IF(I35=0,0,((D35/I35)*100)-100)) -> 49.1 | Q35: =Q24+Q33 -> 60145000 | R35: =IF(D35=0,0,((D35/Q35)*100)-100) -> -10.13 | S35: =S24+S33 -> 100 | U35: 16.97 | V35: 16.22
C36: Resumo por Regiao - Outubro/2002
C37: Descricao das Aberturas | H37: Valor | I37: %
C38: Curitiba (2,3,6,7,10,11,17,21,22) | H38: =D7+D8+D11+D12+D14+D16+D19+D29+D30+D32 -> 28898251 | I38: =IF(D35=0,0,H38/$D$35) -> 0.53459999999999996
C39: Curitiba e Metrop. (Ctba. 4,5,8,14,23) | H39: =H38+D9+D10+D13+D28+D23 -> 35519232 | I39: =IF(D35=0,0,H39/$D$35) -> 0.65710000000000002
C40: Metropolitana (4,5,8,14,23) | H40: =H39-H38 -> 6620981 | I40: =IF(D35=0,0,H40/$D$35) -> 0.1225
C41: Norte (9,15,20) | H41: =D26+D18+D23 -> 4016870 | I41: =IF(D35=0,0,H41/$D$35) -> 7.4300000000000005E-2
C42: Centro-Oeste (13,18,19) | H42: =D17+D20+D28 -> 5897915 | I42: =IF(D35=0,0,H42/$D$35) -> 0.1091
C43: Ponta Grossa (18,19) | H43: =H42-D17 -> 4661653 | I43: =IF(D35=0,0,H43/$D$35) -> 8.6199999999999999E-2
C44: Super (2,3,4,5,6,7,8,10,11,13,15,17,18,20,23) | H44: =D24 -> 22743270 | I44: =IF(D35=0,0,H44/$D$35) -> 0.42080000000000001
C45: Hiper (9,14,19,21,22,24) | H45: =D33 -> 31308805 | I45: =IF(D35=0,0,H45/$D$35) -> 0.57920000000000005
C46: Curitiba, Metropolitana e Centro-Oeste | H46: =D35-H41 -> 50035205 | I46: =IF(D35=0,0,H46/$D$35) -> 0.92569999999999997
C47: Araucaria | H47: =D10+D23 -> 883727 | I47: =IF(D35=0,0,H47/$D$35) -> 1.6299999999999999E-2