A2: Perodo: | C2: 37622 | E2: 37652 | H2: Vendas Acumuladas por Filial
C4: Vendas 2003 | G4: Vendas de Anos Anteriores | K4: Percentuais ( % ) | R4: %
A5: Lojas | C5: Previso | D5: Realizada | E5: Ms Anterior | G5: Vendas 2002 | H5: Vendas 2001 | I5: Vendas 2000 | K5: % Prev | L5: % MA | M5: 2002 | N5: 2001 | O5: 2000 | Q5: Previso Ms | R5: Final | S5: Part.
A7: Xaxim | C7: 540000 | D7: 648112.45 | E7: 715470.68 | G7: 489890.03 | H7: 499937.87 | I7: 419277.82 | K7: =IF(C7=0,0,((D7/C7)*100)-100) -> 20.02 | L7: =IF(E7=0,0,((D7/E7)*100)-100) -> -9.41 | M7: =IF(G7=0,0,((D7/G7)*100)-100) -> 32.3 | N7: =IF(H7=0,0,((D7/H7)*100)-100) -> 29.64 | O7: =IF(I7=0,0,((D7/I7)*100)-100) -> 54.58 | Q7: 540000 | R7: =((D7/Q7)*100)-100 -> 20.02 | S7: =D7/$D$31*100 -> 1.67
A8: S. Felicidade | C8: 540000 | D8: 701361.08 | E8: 840170.37 | G8: 475939.95 | H8: 551283.47 | I8: 484957.71 | K8: =IF(C8=0,0,((D8/C8)*100)-100) -> 29.88 | L8: =IF(E8=0,0,((D8/E8)*100)-100) -> -16.52 | M8: =IF(G8=0,0,((D8/G8)*100)-100) -> 47.36 | N8: =IF(H8=0,0,((D8/H8)*100)-100) -> 27.22 | O8: =IF(I8=0,0,((D8/I8)*100)-100) -> 44.62 | Q8: 540000 | R8: =((D8/Q8)*100)-100 -> 29.88 | S8: =D8/$D$31*100 -> 1.81
A9: Lapa | C9: 810000 | D9: 961645.85 | E9: 1175125.12 | G9: 734229.07 | H9: 596830.87 | I9: 574355.77 | K9: =IF(C9=0,0,((D9/C9)*100)-100) -> 18.72 | L9: =IF(E9=0,0,((D9/E9)*100)-100) -> -18.17 | M9: =IF(G9=0,0,((D9/G9)*100)-100) -> 30.97 | N9: =IF(H9=0,0,((D9/H9)*100)-100) -> 61.13 | O9: =IF(I9=0,0,((D9/I9)*100)-100) -> 67.43 | Q9: 810000 | R9: =((D9/Q9)*100)-100 -> 18.72 | S9: =D9/$D$31*100 -> 2.48
A10: Araucria | C10: 920000 | D10: 1032374.48 | E10: 1273977.36 | G10: 1407810.07 | H10: 1272837.87 | I10: 1243374.64 | K10: =IF(C10=0,0,((D10/C10)*100)-100) -> 12.21 | L10: =IF(E10=0,0,((D10/E10)*100)-100) -> -18.96 | M10: =IF(G10=0,0,((D10/G10)*100)-100) -> -26.67 | N10: =IF(H10=0,0,((D10/H10)*100)-100) -> -18.89 | O10: =IF(I10=0,0,((D10/I10)*100)-100) -> -16.97 | Q10: 920000 | R10: =((D10/Q10)*100)-100 -> 12.21 | S10: =D10/$D$31*100 -> 2.66
A11: Pinheirinho | C11: 1620000 | D11: 1857893 | E11: 2222677.44 | G11: 1485656.22 | H11: 1492975.18 | I11: 1297940.4 | K11: =IF(C11=0,0,((D11/C11)*100)-100) -> 14.68 | L11: =IF(E11=0,0,((D11/E11)*100)-100) -> -16.41 | M11: =IF(G11=0,0,((D11/G11)*100)-100) -> 25.06 | N11: =IF(H11=0,0,((D11/H11)*100)-100) -> 24.44 | O11: =IF(I11=0,0,((D11/I11)*100)-100) -> 43.14 | Q11: 1620000 | R11: =((D11/Q11)*100)-100 -> 14.68 | S11: =D11/$D$31*100 -> 4.78
A12: Hauer | C12: 2230000 | D12: 2685121.28 | E12: 3293202.72 | G12: 2032731.5 | H12: 2009768.05 | I12: 1668826.37 | K12: =IF(C12=0,0,((D12/C12)*100)-100) -> 20.41 | L12: =IF(E12=0,0,((D12/E12)*100)-100) -> -18.46 | M12: =IF(G12=0,0,((D12/G12)*100)-100) -> 32.09 | N12: =IF(H12=0,0,((D12/H12)*100)-100) -> 33.6 | O12: =IF(I12=0,0,((D12/I12)*100)-100) -> 60.9 | Q12: 2230000 | R12: =((D12/Q12)*100)-100 -> 20.41 | S12: =D12/$D$31*100 -> 6.91
A13: Paranagu | C13: 2500000 | D13: 2825976.18 | E13: 3619739.3 | G13: 2280327.95 | H13: 1988095.36 | I13: 1368957.97 | K13: =IF(C13=0,0,((D13/C13)*100)-100) -> 13.04 | L13: =IF(E13=0,0,((D13/E13)*100)-100) -> -21.93 | M13: =IF(G13=0,0,((D13/G13)*100)-100) -> 23.93 | N13: =IF(H13=0,0,((D13/H13)*100)-100) -> 42.14 | O13: =IF(I13=0,0,((D13/I13)*100)-100) -> 106.43 | Q13: 2500000 | R13: =((D13/Q13)*100)-100 -> 13.04 | S13: =D13/$D$31*100 -> 7.28
A14: Centenrio | C14: 690000 | D14: 866268.99 | E14: 961206.45 | G14: 632178.46 | H14: 606003.24 | I14: 535168.85 | K14: =IF(C14=0,0,((D14/C14)*100)-100) -> 25.55 | L14: =IF(E14=0,0,((D14/E14)*100)-100) -> -9.88 | M14: =IF(G14=0,0,((D14/G14)*100)-100) -> 37.03 | N14: =IF(H14=0,0,((D14/H14)*100)-100) -> 42.95 | O14: =IF(I14=0,0,((D14/I14)*100)-100) -> 61.87 | Q14: 690000 | R14: =((D14/Q14)*100)-100 -> 25.55 | S14: =D14/$D$31*100 -> 2.23
A15: So Brz | C15: 2460000 | D15: 2781333.7 | E15: 3421456.85 | G15: 2270389.23 | H15: 2231761.01 | I15: 1676774.13 | K15: =IF(C15=0,0,((D15/C15)*100)-100) -> 13.06 | L15: =IF(E15=0,0,((D15/E15)*100)-100) -> -18.71 | M15: =IF(G15=0,0,((D15/G15)*100)-100) -> 22.5 | N15: =IF(H15=0,0,((D15/H15)*100)-100) -> 24.63 | O15: =IF(I15=0,0,((D15/I15)*100)-100) -> 65.87 | Q15: 2460000 | R15: =((D15/Q15)*100)-100 -> 13.06 | S15: =D15/$D$31*100 -> 7.16
A16: Arapongas | C16: 490000 | D16: 559275.97 | E16: 726386.27 | G16: 432083.78 | H16: 516153.62 | I16: 461279 | K16: =IF(C16=0,0,((D16/C16)*100)-100) -> 14.14 | L16: =IF(E16=0,0,((D16/E16)*100)-100) -> -23.01 | M16: =IF(G16=0,0,((D16/G16)*100)-100) -> 29.44 | N16: =IF(H16=0,0,((D16/H16)*100)-100) -> 8.35 | O16: =IF(I16=0,0,((D16/I16)*100)-100) -> 21.24 | Q16: 490000 | R16: =((D16/Q16)*100)-100 -> 14.14 | S16: =D16/$D$31*100 -> 1.44
A17: Guarapuava | C17: 910000 | D17: 1099203.27 | E17: 1425756.33 | G17: 635228.31 | H17: 801092.05 | I17: 787806.44 | K17: =IF(C17=0,0,((D17/C17)*100)-100) -> 20.79 | L17: =IF(E17=0,0,((D17/E17)*100)-100) -> -22.9 | M17: =IF(G17=0,0,((D17/G17)*100)-100) -> 73.04 | N17: =IF(H17=0,0,((D17/H17)*100)-100) -> 37.21 | O17: =IF(I17=0,0,((D17/I17)*100)-100) -> 39.53 | Q17: 910000 | R17: =((D17/Q17)*100)-100 -> 20.79 | S17: =D17/$D$31*100 -> 2.83
A18: Apucarana | C18: 1180000 | D18: 1225401.95 | E18: 1772893.53 | G18: 1032293.43 | H18: 1066130.55 | I18: 1021824.19 | K18: =IF(C18=0,0,((D18/C18)*100)-100) -> 3.85 | L18: =IF(E18=0,0,((D18/E18)*100)-100) -> -30.88 | M18: =IF(G18=0,0,((D18/G18)*100)-100) -> 18.71 | N18: =IF(H18=0,0,((D18/H18)*100)-100) -> 14.94 | O18: =IF(I18=0,0,((D18/I18)*100)-100) -> 19.92 | Q18: 1180000 | R18: =((D18/Q18)*100)-100 -> 3.85 | S18: =D18/$D$31*100 -> 3.16
A19: Ah | C19: 980000 | D19: 1062414.06 | E19: 1333595.35 | G19: 1069721.22 | H19: 1044577.22 | I19: 818597.11 | K19: =IF(C19=0,0,((D19/C19)*100)-100) -> 8.41 | L19: =IF(E19=0,0,((D19/E19)*100)-100) -> -20.33 | M19: =IF(G19=0,0,((D19/G19)*100)-100) -> -00.68 | N19: =IF(H19=0,0,((D19/H19)*100)-100) -> 1.71 | O19: =IF(I19=0,0,((D19/I19)*100)-100) -> 29.78 | Q19: 980000 | R19: =((D19/Q19)*100)-100 -> 8.41 | S19: =D19/$D$31*100 -> 2.74
A20: P.G. Centro | C20: 1280000 | D20: 1479222.83 | E20: 1866162.24 | G20: 1098951.54 | H20: 1164673.82 | I20: 1183216.5 | K20: =IF(C20=0,0,((D20/C20)*100)-100) -> 15.56 | L20: =IF(E20=0,0,((D20/E20)*100)-100) -> -20.73 | M20: =IF(G20=0,0,((D20/G20)*100)-100) -> 34.6 | N20: =IF(H20=0,0,((D20/H20)*100)-100) -> 27.01 | O20: =IF(I20=0,0,((D20/I20)*100)-100) -> 25.02 | Q20: 1280000 | R20: =((D20/Q20)*100)-100 -> 15.56 | S20: =D20/$D$31*100 -> 3.81
A21: Maring | C21: 1690000 | D21: 1859959.59 | E21: 2144144.69 | G21: 1517949.73 | H21: 1439605.15 | I21: 1438824.12 | K21: =IF(C21=0,0,((D21/C21)*100)-100) -> 10.06 | L21: =IF(E21=0,0,((D21/E21)*100)-100) -> -13.25 | M21: =IF(G21=0,0,((D21/G21)*100)-100) -> 22.53 | N21: =IF(H21=0,0,((D21/H21)*100)-100) -> 29.2 | O21: =IF(I21=0,0,((D21/I21)*100)-100) -> 29.27 | Q21: 1690000 | R21: =((D21/Q21)*100)-100 -> 10.06 | S21: =D21/$D$31*100 -> 4.79
A22: Araucria Nova | C22: 1690000 | D22: 1701529.98 | E22: 2213291.93 | G22: 0 | H22: 0 | I22: 0 | K22: =IF(C22=0,0,((D22/C22)*100)-100) -> 00.68 | L22: =IF(E22=0,0,((D22/E22)*100)-100) -> -23.12 | M22: =IF(G22=0,0,((D22/G22)*100)-100) -> 0 | N22: =IF(H22=0,0,((D22/H22)*100)-100) -> 0 | O22: =IF(I22=0,0,((D22/I22)*100)-100) -> 0 | Q22: 1690000 | R22: =((D22/Q22)*100)-100 -> 00.68 | S22: =D22/$D$31*100 -> 4.38
A23: Total Super | C23: =SUM(C7:C22) -> 20530000 | D23: =SUM(D7:D22) -> 23347094.66 | E23: =SUM(E7:E22) -> 29005256.629999999 | G23: =SUM(G7:G22) -> 17595380.489999998 | H23: =SUM(H7:H22) -> 17281725.329999998 | I23: =SUM(I7:I22) -> 14981181.02 | J23: =SUM(C23:I23) -> 122740638.13 | K23: =((D23/C23)*100)-100 -> 13.72 | L23: =IF(E23=0,0,((D23/E23)*100)-100) -> -19.51 | M23: =((D23/G23)*100)-100 -> 32.69 | N23: =((D23/H23)*100)-100 -> 35.1 | O23: =IF(I23=0,0,((D23/I23)*100)-100) -> 55.84 | Q23: =SUM(Q7:Q22) -> 20530000 | R23: =((D23/Q23)*100)-100 -> 13.72 | S23: =D23/$D$31*100 -> 60.11
A25: Londrina | C25: 2030000 | D25: 2140316.17 | E25: 2811074.04 | G25: 1534100.93 | H25: 1948084.22 | I25: 0 | K25: =IF(C25=0,0,((D25/C25)*100)-100) -> 5.43 | L25: =IF(E25=0,0,((D25/E25)*100)-100) -> -23.86 | M25: =IF(G25=0,0,((D25/G25)*100)-100) -> 39.52 | N25: =IF(H25=0,0,((D25/H25)*100)-100) -> 9.87 | O25: =IF(I25=0,0,((D25/I25)*100)-100) -> 0 | Q25: 2030000 | R25: =((D25/Q25)*100)-100 -> 5.43 | S25: =D25/$D$31*100 -> 5.51
A26: S.J. Pinhais | C26: 3150000 | D26: 3644722.91 | E26: 4671974.19 | G26: 2747436.37 | H26: 2239877.91 | I26: 1300045.1 | K26: =IF(C26=0,0,((D26/C26)*100)-100) -> 15.71 | L26: =IF(E26=0,0,((D26/E26)*100)-100) -> -21.99 | M26: =IF(G26=0,0,((D26/G26)*100)-100) -> 32.66 | N26: =IF(H26=0,0,((D26/H26)*100)-100) -> 62.72 | O26: =IF(I26=0,0,((D26/I26)*100)-100) -> 180.35 | Q26: 3150000 | R26: =((D26/Q26)*100)-100 -> 15.71 | S26: =D26/$D$31*100 -> 9.38
A27: P.G. Nova | C27: 2540000 | D27: 3004210.35 | E27: 3882893.37 | G27: 2139961.74 | H27: 2196761.8 | I27: 1688287.86 | K27: =IF(C27=0,0,((D27/C27)*100)-100) -> 18.28 | L27: =IF(E27=0,0,((D27/E27)*100)-100) -> -22.63 | M27: =IF(G27=0,0,((D27/G27)*100)-100) -> 40.39 | N27: =IF(H27=0,0,((D27/H27)*100)-100) -> 36.76 | O27: =IF(I27=0,0,((D27/I27)*100)-100) -> 77.94 | Q27: 2540000 | R27: =((D27/Q27)*100)-100 -> 18.28 | S27: =D27/$D$31*100 -> 7.73
A28: Nilo Peanha | C28: 5800000 | D28: 6702998.1900000004 | E28: 8652524.8499999996 | G28: 0 | H28: 0 | I28: 0 | K28: =IF(C28=0,0,((D28/C28)*100)-100) -> 15.57 | L28: =IF(E28=0,0,((D28/E28)*100)-100) -> -22.53 | M28: =IF(G28=0,0,((D28/G28)*100)-100) -> 0 | N28: =IF(H28=0,0,((D28/H28)*100)-100) -> 0 | O28: =IF(I28=0,0,((D28/I28)*100)-100) -> 0 | Q28: 5800000 | R28: =((D28/Q28)*100)-100 -> 15.57 | S28: =D28/$D$31*100 -> 17.26
A29: Total Hiper | C29: =SUM(C25:C28) -> 13520000 | D29: =SUM(D25:D28) -> 15492247.619999999 | E29: =SUM(E25:E28) -> 20018466.449999999 | G29: =SUM(G25:G28) -> 6421499.04 | H29: =SUM(H25:H28) -> 6384723.9299999997 | I29: =SUM(I25:I28) -> 2988332.96 | J29: =SUM(C29:I29) -> 64825270 | K29: =((D29/C29)*100)-100 -> 14.59 | L29: =IF(E29=0,0,((D29/E29)*100)-100) -> -22.61 | M29: =((D29/G29)*100)-100 -> 141.26 | N29: =((D29/H29)*100)-100 -> 142.65 | O29: =IF(I29=0,0,((D29/I29)*100)-100) -> 418.42 | Q29: =SUM(Q25:Q28) -> 13520000 | R29: =((D29/Q29)*100)-100 -> 14.59 | S29: =D29/$D$31*100 -> 39.89
A31: Total Geral | C31: =C23+C29 -> 34050000 | D31: =D23+D29 -> 38839342.280000001 | E31: =E23+E29 -> 49023723.079999998 | G31: =G23+G29 -> 24016879.530000001 | H31: =H23+H29 -> 23666449.260000002 | I31: =I23+I29 -> 17969513.98 | K31: =((D31/C31)*100)-100 -> 14.07 | L31: =IF(E31=0,0,((D31/E31)*100)-100) -> -20.77 | M31: =((D31/G31)*100)-100 -> 61.72 | N31: =((D31/H31)*100)-100 -> 64.11 | O31: =IF(I31=0,0,((D31/I31)*100)-100) -> 116.14 | Q31: =Q23+Q29 -> 34050000 | R31: =((D31/Q31)*100)-100 -> 14.07 | S31: =S23+S29 -> 100
C32: Resumo por Regio - Outubro/2002
C33: Descrio das Aberturas | H33: Valor | I33: %
C34: Curitiba (2,3,6,7,10,11,17,21) | H34: =D7+D8+D11+D12+D14+D15+D19+D28 -> 17305503 | I34: =H34/$D$31 -> 0.4456
C35: Curitiba e Metrop. (Ctba. 4,5,8,14,23) | H35: =H34+D9+D10+D13+D27+D22 -> 26831240 | I35: =H35/$D$31 -> 0.69079999999999997
C36: Metropolitana (4,5,8,14,23) | H36: =H35-H34 -> 9525737 | I36: =H36/$D$31 -> 0.24529999999999999
C37: Norte (9,12,15,20) | H37: =D25+D16+D18+D22 -> 5626524 | I37: =H37/$D$31 -> 0.1449
C38: Centro-Oeste (13,18,19) | H38: =D17+D20+D27 -> 5582636 | I38: =H38/$D$31 -> 0.14369999999999999
C39: Ponta Grossa (18,19) | H39: =H38-D17 -> 4483433 | I39: =H39/$D$31 -> 0.1154
C40: Super (2,3,4,5,6,7,8,10,11,12,13,15,17,18,20,23) | H40: =D23 -> 23347095 | I40: =H40/$D$31 -> 0.60109999999999997
C41: Hiper (9,14,19,21) | H41: =D29 -> 15492248 | I41: =H41/$D$31 -> 0.39889999999999998
C42: Curitiba, Metropolitana e Centro-Oeste | H42: =D31-H37 -> 33212818 | I42: =H42/$D$31 -> 0.85509999999999997
C43: Araucria | H43: =D10+D22 -> 2733904 | I43: =H43/$D$31 -> 7.0400000000000004E-2