A2: Periodo: | C2: 39873 | D2: a | E2: 31/03/2009 | H2: Vendas Acumuladas por Filial | Q2: =NOW() -> 39904.310281481499
A4: v.1 | C4: Vendas 2009 | G4: Vendas de Anos Anteriores | K4: Percentuais ( % ) | Q4: Meta Mensal | U4: Margem
A5: Lojas | C5: Previsao | D5: Realizada | E5: Mes Anterior | G5: Vendas 2008 | H5: Vendas 2007 | I5: Vendas 2006 | K5: % Prev | L5: % MA | M5: 2008 | N5: 2007 | O5: 2006 | Q5: Previsao Mes | R5: Final | S5: Part. | U5: Meta | V5: Coml | W5: Dif
A7: S. Felicidade | C7: 2450000 | D7: 2608841 | E7: 2407705 | G7: 2484352 | H7: 832774 | I7: 783784 | K7: =IF(C7=0,0,((D7/C7)*100)-100) -> 6.48 | L7: =IF(D7=0,0,IF(E7=0,0,((D7/E7)*100)-100)) -> 8.35 | M7: =IF(G7=0,0,((D7/G7)*100)-100) -> 5.01 | N7: =IF(H7=0,0,((D7/H7)*100)-100) -> 213.27 | O7: =IF(D7=0,0,IF(I7=0,0,((D7/I7)*100)-100)) -> 232.85 | Q7: 2450000 | R7: =IF(D7=0,0,((D7/Q7)*100)-100) -> 6.48 | S7: =IF(D7=0,0,(D7/$D$44)*100) -> 2.79 | U7: 17 | V7: 0 | W7: =V7-U7 -> -17
A8: Lapa | C8: 2100000 | D8: 2076523 | E8: 2018978 | G8: 1929067 | H8: 1392057 | I8: 1338989 | K8: =IF(C8=0,0,((D8/C8)*100)-100) -> -1.12 | L8: =IF(D8=0,0,IF(E8=0,0,((D8/E8)*100)-100)) -> 2.85 | M8: =IF(G8=0,0,((D8/G8)*100)-100) -> 7.64 | N8: =IF(H8=0,0,((D8/H8)*100)-100) -> 49.17 | O8: =IF(D8=0,0,IF(I8=0,0,((D8/I8)*100)-100)) -> 55.08 | Q8: 2100000 | R8: =IF(D8=0,0,((D8/Q8)*100)-100) -> -1.12 | S8: =IF(D8=0,0,(D8/$D$44)*100) -> 2.22 | U8: 14.95 | V8: 0 | W8: =V8-U8 -> -14.95
A9: Araucaria | C9: 1290000 | D9: 1246259 | E9: 1215689 | G9: 1262792 | H9: 977958 | I9: 1014386 | K9: =IF(C9=0,0,((D9/C9)*100)-100) -> -3.39 | L9: =IF(D9=0,0,IF(E9=0,0,((D9/E9)*100)-100)) -> 2.51 | M9: =IF(G9=0,0,((D9/G9)*100)-100) -> -1.31 | N9: =IF(H9=0,0,((D9/H9)*100)-100) -> 27.43 | O9: =IF(D9=0,0,IF(I9=0,0,((D9/I9)*100)-100)) -> 22.86 | Q9: 1290000 | R9: =IF(D9=0,0,((D9/Q9)*100)-100) -> -3.39 | S9: =IF(D9=0,0,(D9/$D$44)*100) -> 1.33 | U9: 16.5 | V9: 0 | W9: =V9-U9 -> -16.5
A10: Hauer | C10: 3845000 | D10: 3609513 | E10: 3312952 | G10: 3788650 | H10: 3111741 | I10: 3045391 | K10: =IF(C10=0,0,((D10/C10)*100)-100) -> -6.12 | L10: =IF(D10=0,0,IF(E10=0,0,((D10/E10)*100)-100)) -> 8.95 | M10: =IF(G10=0,0,((D10/G10)*100)-100) -> -4.73 | N10: =IF(H10=0,0,((D10/H10)*100)-100) -> 16 | O10: =IF(D10=0,0,IF(I10=0,0,((D10/I10)*100)-100)) -> 18.52 | Q10: 3845000 | R10: =IF(D10=0,0,((D10/Q10)*100)-100) -> -6.12 | S10: =IF(D10=0,0,(D10/$D$44)*100) -> 3.86 | U10: 15.4 | V10: 0 | W10: =V10-U10 -> -15.4
A11: Paranagua | C11: 2050000 | D11: 1873033 | E11: 1767174 | G11: 2100999 | H11: 1660177 | I11: 1563844 | K11: =IF(C11=0,0,((D11/C11)*100)-100) -> -8.63 | L11: =IF(D11=0,0,IF(E11=0,0,((D11/E11)*100)-100)) -> 5.99 | M11: =IF(G11=0,0,((D11/G11)*100)-100) -> -10.85 | N11: =IF(H11=0,0,((D11/H11)*100)-100) -> 12.82 | O11: =IF(D11=0,0,IF(I11=0,0,((D11/I11)*100)-100)) -> 19.77 | Q11: 2050000 | R11: =IF(D11=0,0,((D11/Q11)*100)-100) -> -8.63 | S11: =IF(D11=0,0,(D11/$D$44)*100) -> 2 | U11: 16.68 | V11: 0 | W11: =V11-U11 -> -16.68
A12: Centenario | C12: 1225000 | D12: 1214438 | E12: 1145767 | G12: 1241700 | H12: 1006642 | I12: 926040 | K12: =IF(C12=0,0,((D12/C12)*100)-100) -> -0.86 | L12: =IF(D12=0,0,IF(E12=0,0,((D12/E12)*100)-100)) -> 5.99 | M12: =IF(G12=0,0,((D12/G12)*100)-100) -> -2.2 | N12: =IF(H12=0,0,((D12/H12)*100)-100) -> 20.64 | O12: =IF(D12=0,0,IF(I12=0,0,((D12/I12)*100)-100)) -> 31.14 | Q12: 1225000 | R12: =IF(D12=0,0,((D12/Q12)*100)-100) -> -0.86 | S12: =IF(D12=0,0,(D12/$D$44)*100) -> 1.3 | U12: 16.6 | V12: 0 | W12: =V12-U12 -> -16.6
A13: Sitio Cercado | C13: 2020000 | D13: 2115152 | E13: 2019603 | G13: 2164558 | H13: 1297562 | I13: 1246945 | K13: =IF(C13=0,0,((D13/C13)*100)-100) -> 4.71 | L13: =IF(D13=0,0,IF(E13=0,0,((D13/E13)*100)-100)) -> 4.73 | M13: =IF(G13=0,0,((D13/G13)*100)-100) -> -2.28 | N13: =IF(H13=0,0,((D13/H13)*100)-100) -> 63.01 | O13: =IF(D13=0,0,IF(I13=0,0,((D13/I13)*100)-100)) -> 69.63 | Q13: 2020000 | R13: =IF(D13=0,0,((D13/Q13)*100)-100) -> 4.71 | S13: =IF(D13=0,0,(D13/$D$44)*100) -> 2.26 | U13: 16.9 | V13: 0 | W13: =V13-U13 -> -16.9
A14: Apucarana | C14: 2870000 | D14: 2655041 | E14: 2398097 | G14: 2735773 | H14: 2158421 | I14: 1957014 | K14: =IF(C14=0,0,((D14/C14)*100)-100) -> -7.49 | L14: =IF(D14=0,0,IF(E14=0,0,((D14/E14)*100)-100)) -> 10.71 | M14: =IF(G14=0,0,((D14/G14)*100)-100) -> -2.95 | N14: =IF(H14=0,0,((D14/H14)*100)-100) -> 23.01 | O14: =IF(D14=0,0,IF(I14=0,0,((D14/I14)*100)-100)) -> 35.67 | Q14: 2870000 | R14: =IF(D14=0,0,((D14/Q14)*100)-100) -> -7.49 | S14: =IF(D14=0,0,(D14/$D$44)*100) -> 2.84 | U14: 16 | V14: 0 | W14: =V14-U14 -> -16
A15: Ah | C15: 1750000 | D15: 1661996 | E15: 1487361 | G15: 1790309 | H15: 1308949 | I15: 1142814 | K15: =IF(C15=0,0,((D15/C15)*100)-100) -> -5.03 | L15: =IF(D15=0,0,IF(E15=0,0,((D15/E15)*100)-100)) -> 11.74 | M15: =IF(G15=0,0,((D15/G15)*100)-100) -> -7.17 | N15: =IF(H15=0,0,((D15/H15)*100)-100) -> 26.97 | O15: =IF(D15=0,0,IF(I15=0,0,((D15/I15)*100)-100)) -> 45.43 | Q15: 1750000 | R15: =IF(D15=0,0,((D15/Q15)*100)-100) -> -5.03 | S15: =IF(D15=0,0,(D15/$D$44)*100) -> 1.78 | U15: 16.9 | V15: 0 | W15: =V15-U15 -> -16.9
A16: P.G. Centro | C16: 2230000 | D16: 2077089 | E16: 1897226 | G16: 2213356 | H16: 1784329 | I16: 1669633 | K16: =IF(C16=0,0,((D16/C16)*100)-100) -> -6.86 | L16: =IF(D16=0,0,IF(E16=0,0,((D16/E16)*100)-100)) -> 9.48 | M16: =IF(G16=0,0,((D16/G16)*100)-100) -> -6.16 | N16: =IF(H16=0,0,((D16/H16)*100)-100) -> 16.41 | O16: =IF(D16=0,0,IF(I16=0,0,((D16/I16)*100)-100)) -> 24.4 | Q16: 2230000 | R16: =IF(D16=0,0,((D16/Q16)*100)-100) -> -6.86 | S16: =IF(D16=0,0,(D16/$D$44)*100) -> 2.22 | U16: 17.5 | V16: 0 | W16: =V16-U16 -> -17.5
A17: Maringa | C17: 3430000 | D17: 3087919 | E17: 2667295 | G17: 3200946 | H17: 2599592 | I17: 2569506 | K17: =IF(C17=0,0,((D17/C17)*100)-100) -> -9.97 | L17: =IF(D17=0,0,IF(E17=0,0,((D17/E17)*100)-100)) -> 15.77 | M17: =IF(G17=0,0,((D17/G17)*100)-100) -> -3.53 | N17: =IF(H17=0,0,((D17/H17)*100)-100) -> 18.78 | O17: =IF(D17=0,0,IF(I17=0,0,((D17/I17)*100)-100)) -> 20.18 | Q17: 3430000 | R17: =IF(D17=0,0,((D17/Q17)*100)-100) -> -9.97 | S17: =IF(D17=0,0,(D17/$D$44)*100) -> 3.3 | U17: 16.27 | V17: 0 | W17: =V17-U17 -> -16.27
A18: Araucaria Nova | C18: 2950000 | D18: 3489730 | E18: 3411624 | G18: 3271531 | H18: 2259876 | I18: 2040588 | K18: =IF(C18=0,0,((D18/C18)*100)-100) -> 18.3 | L18: =IF(D18=0,0,IF(E18=0,0,((D18/E18)*100)-100)) -> 2.29 | M18: =IF(G18=0,0,((D18/G18)*100)-100) -> 6.67 | N18: =IF(H18=0,0,((D18/H18)*100)-100) -> 54.42 | O18: =IF(D18=0,0,IF(I18=0,0,((D18/I18)*100)-100)) -> 71.02 | Q18: 3100000 | R18: =IF(D18=0,0,((D18/Q18)*100)-100) -> 12.57 | S18: =IF(D18=0,0,(D18/$D$44)*100) -> 3.73 | U18: 16.08 | V18: 0 | W18: =V18-U18 -> -16.08
A19: Cristo Rei | C19: 1990000 | D19: 2042787 | E19: 1657889 | G19: 1730600 | H19: 1384282 | I19: 0 | K19: =IF(C19=0,0,((D19/C19)*100)-100) -> 2.65 | L19: =IF(D19=0,0,IF(E19=0,0,((D19/E19)*100)-100)) -> 23.22 | M19: =IF(G19=0,0,((D19/G19)*100)-100) -> 18.04 | N19: =IF(H19=0,0,((D19/H19)*100)-100) -> 47.57 | O19: =IF(D19=0,0,IF(I19=0,0,((D19/I19)*100)-100)) -> 0 | Q19: 1990189 | R19: =IF(D19=0,0,((D19/Q19)*100)-100) -> 2.64 | S19: =IF(D19=0,0,(D19/$D$44)*100) -> 2.18 | U19: 17.25 | V19: 0 | W19: =V19-U19 -> -17.25
A20: Campo Largo | C20: 2500000 | D20: 2732976 | E20: 2533789 | G20: 0 | H20: 0 | I20: 0 | K20: =IF(C20=0,0,((D20/C20)*100)-100) -> 9.32 | L20: =IF(D20=0,0,IF(E20=0,0,((D20/E20)*100)-100)) -> 7.86 | M20: =IF(G20=0,0,((D20/G20)*100)-100) -> 0 | N20: =IF(H20=0,0,((D20/H20)*100)-100) -> 0 | O20: =IF(D20=0,0,IF(I20=0,0,((D20/I20)*100)-100)) -> 0 | Q20: 2500000 | R20: =IF(D20=0,0,((D20/Q20)*100)-100) -> 9.32 | S20: =IF(D20=0,0,(D20/$D$44)*100) -> 2.92 | U20: 17 | V20: 0 | W20: =V20-U20 -> -17
A21: Brasilia | C21: 2370000 | D21: 2407395 | E21: 2228824 | G21: 1061132 | H21: 788213 | I21: 707279 | K21: =IF(C21=0,0,((D21/C21)*100)-100) -> 1.58 | L21: =IF(D21=0,0,IF(E21=0,0,((D21/E21)*100)-100)) -> 8.01 | M21: =IF(G21=0,0,((D21/G21)*100)-100) -> 126.87 | N21: =IF(H21=0,0,((D21/H21)*100)-100) -> 205.42 | O21: =IF(D21=0,0,IF(I21=0,0,((D21/I21)*100)-100)) -> 240.37 | Q21: 2370000 | R21: =IF(D21=0,0,((D21/Q21)*100)-100) -> 1.58 | S21: =IF(D21=0,0,(D21/$D$44)*100) -> 2.57 | U21: 16.5 | V21: 0 | W21: =V21-U21 -> -16.5
A22: Total Super | C22: =SUM(C7:C21) -> 35070000 | D22: =SUM(D7:D21) -> 34898692 | E22: =SUM(E7:E21) -> 32169973 | G22: =SUM(G7:G21) -> 30975765 | H22: =SUM(H7:H21) -> 22562573 | I22: =SUM(I7:I21) -> 20006213 | J22: =SUM(C22:I22) -> 175683216 | K22: =IF(D22=0,0,((D22/C22)*100)-100) -> -0.49 | L22: =IF(D22=0,0,IF(E22=0,0,((D22/E22)*100)-100)) -> 8.48 | M22: =IF(G22=0,0,IF(D22=0,0,((D22/G22)*100)-100)) -> 12.66 | N22: =IF(H22=0,0,IF(D22=0,0,((D22/H22)*100)-100)) -> 54.68 | O22: =IF(D22=0,0,IF(I22=0,0,((D22/I22)*100)-100)) -> 74.44 | Q22: =SUM(Q7:Q21) -> 35220189 | R22: =IF(D22=0,0,((D22/Q22)*100)-100) -> -0.91 | S22: =IF(D22=0,0,(D22/$D$44)*100) -> 37.3 | U22: 16.42 | V22: 0 | W22: =V22-U22 -> -16.42
A24: Pinheirinho | C24: 4500000 | D24: 4394929 | E24: 3991772 | G24: 4535907 | H24: 2998738 | I24: 1906209 | K24: =IF(C24=0,0,((D24/C24)*100)-100) -> -2.33 | L24: =IF(D24=0,0,IF(E24=0,0,((D24/E24)*100)-100)) -> 10.1 | M24: =IF(G24=0,0,((D24/G24)*100)-100) -> -3.11 | N24: =IF(H24=0,0,((D24/H24)*100)-100) -> 46.56 | O24: =IF(D24=0,0,IF(I24=0,0,((D24/I24)*100)-100)) -> 130.56 | Q24: 4500000 | R24: =IF(D24=0,0,IF(Q24=0,0,((D24/Q24)*100)-100)) -> -2.33 | S24: =IF(D24=0,0,(D24/$D$44)*100) -> 4.7 | U24: 15 | V24: 0 | W24: =V24-U24 -> -15
A25: Londrina | C25: 3900000 | D25: 3281941 | E25: 3120674 | G25: 3916232 | H25: 2746775 | I25: 2826318 | K25: =IF(C25=0,0,((D25/C25)*100)-100) -> -15.85 | L25: =IF(D25=0,0,IF(E25=0,0,((D25/E25)*100)-100)) -> 5.17 | M25: =IF(G25=0,0,((D25/G25)*100)-100) -> -16.2 | N25: =IF(H25=0,0,((D25/H25)*100)-100) -> 19.48 | O25: =IF(D25=0,0,IF(I25=0,0,((D25/I25)*100)-100)) -> 16.12 | Q25: 3900000 | R25: =IF(D25=0,0,IF(Q25=0,0,((D25/Q25)*100)-100)) -> -15.85 | S25: =IF(D25=0,0,(D25/$D$44)*100) -> 3.51 | U25: 15.7 | V25: 0 | W25: =V25-U25 -> -15.7
A26: So Brz | C26: 5100000 | D26: 4756070 | E26: 4498860 | G26: 4876531 | H26: 3170705 | I26: 3107877 | K26: =IF(C26=0,0,((D26/C26)*100)-100) -> -6.74 | L26: =IF(D26=0,0,IF(E26=0,0,((D26/E26)*100)-100)) -> 5.72 | M26: =IF(G26=0,0,((D26/G26)*100)-100) -> -2.47 | N26: =IF(H26=0,0,((D26/H26)*100)-100) -> 50 | O26: =IF(D26=0,0,IF(I26=0,0,((D26/I26)*100)-100)) -> 53.03 | Q26: 5100000 | R26: =IF(D26=0,0,IF(Q26=0,0,((D26/Q26)*100)-100)) -> -6.74 | S26: =IF(D26=0,0,(D26/$D$44)*100) -> 5.08 | U26: 15.1 | V26: 0 | W26: =V26-U26 -> -15.1
A27: S.J. Pinhais | C27: 5380000 | D27: 5297493 | E27: 4954894 | G27: 5481522 | H27: 4025375 | I27: 4000323 | K27: =IF(C27=0,0,((D27/C27)*100)-100) -> -1.53 | L27: =IF(D27=0,0,IF(E27=0,0,((D27/E27)*100)-100)) -> 6.91 | M27: =IF(G27=0,0,((D27/G27)*100)-100) -> -3.36 | N27: =IF(H27=0,0,((D27/H27)*100)-100) -> 31.6 | O27: =IF(D27=0,0,IF(I27=0,0,((D27/I27)*100)-100)) -> 32.43 | Q27: 5380000 | R27: =IF(D27=0,0,IF(Q27=0,0,((D27/Q27)*100)-100)) -> -1.53 | S27: =IF(D27=0,0,(D27/$D$44)*100) -> 5.66 | U27: 16 | V27: 0 | W27: =V27-U27 -> -16
A28: P.G. Nova | C28: 5100000 | D28: 5267289 | E28: 4893667 | G28: 4892145 | H28: 3915224 | I28: 3624033 | K28: =IF(C28=0,0,((D28/C28)*100)-100) -> 3.28 | L28: =IF(D28=0,0,IF(E28=0,0,((D28/E28)*100)-100)) -> 7.63 | M28: =IF(G28=0,0,((D28/G28)*100)-100) -> 7.67 | N28: =IF(H28=0,0,((D28/H28)*100)-100) -> 34.53 | O28: =IF(D28=0,0,IF(I28=0,0,((D28/I28)*100)-100)) -> 45.34 | Q28: 5100000 | R28: =IF(D28=0,0,IF(Q28=0,0,((D28/Q28)*100)-100)) -> 3.28 | S28: =IF(D28=0,0,(D28/$D$44)*100) -> 5.63 | U28: 15.9 | V28: 0 | W28: =V28-U28 -> -15.9
A29: Nilo Pecanha | C29: 11200000 | D29: 11899225 | E29: 10687236 | G29: 11815796 | H29: 9648905 | I29: 9111719 | K29: =IF(C29=0,0,((D29/C29)*100)-100) -> 6.24 | L29: =IF(D29=0,0,IF(E29=0,0,((D29/E29)*100)-100)) -> 11.34 | M29: =IF(G29=0,0,((D29/G29)*100)-100) -> 0.71 | N29: =IF(H29=0,0,((D29/H29)*100)-100) -> 23.32 | O29: =IF(D29=0,0,IF(I29=0,0,((D29/I29)*100)-100)) -> 30.59 | Q29: 11200000 | R29: =IF(D29=0,0,IF(Q29=0,0,((D29/Q29)*100)-100)) -> 6.24 | S29: =IF(D29=0,0,(D29/$D$44)*100) -> 12.72 | U29: 15.8 | V29: 0 | W29: =V29-U29 -> -15.8
A30: Champagnat | C30: 6850000 | D30: 6786149 | E30: 6072735 | G30: 6669663 | H30: 5662879 | I30: 5563419 | K30: =IF(C30=0,0,((D30/C30)*100)-100) -> -0.93 | L30: =IF(D30=0,0,IF(E30=0,0,((D30/E30)*100)-100)) -> 11.75 | M30: =IF(G30=0,0,((D30/G30)*100)-100) -> 1.75 | N30: =IF(H30=0,0,((D30/H30)*100)-100) -> 19.84 | O30: =IF(D30=0,0,IF(I30=0,0,((D30/I30)*100)-100)) -> 21.98 | Q30: 6850000 | R30: =IF(D30=0,0,IF(Q30=0,0,((D30/Q30)*100)-100)) -> -0.93 | S30: =IF(D30=0,0,(D30/$D$44)*100) -> 7.25 | U30: 16.6 | V30: 0 | W30: =V30-U30 -> -16.6
A31: Santa Candida | C31: 6000000 | D31: 5987048 | E31: 5553451 | G31: 5619988 | H31: 4127924 | I31: 4101942 | K31: =IF(C31=0,0,((D31/C31)*100)-100) -> -0.22 | L31: =IF(D31=0,0,IF(E31=0,0,((D31/E31)*100)-100)) -> 7.81 | M31: =IF(G31=0,0,((D31/G31)*100)-100) -> 6.53 | N31: =IF(H31=0,0,((D31/H31)*100)-100) -> 45.04 | O31: =IF(D31=0,0,IF(I31=0,0,((D31/I31)*100)-100)) -> 45.96 | Q31: 6000000 | R31: =IF(D31=0,0,IF(Q31=0,0,((D31/Q31)*100)-100)) -> -0.22 | S31: =IF(D31=0,0,(D31/$D$44)*100) -> 6.4 | U31: 16.01 | V31: 0 | W31: =V31-U31 -> -16.01
A32: Paranagu Raia | C32: 6450000 | D32: 6260880 | E32: 5977948 | G32: 6539688 | H32: 4895482 | I32: 4489234 | K32: =IF(C32=0,0,((D32/C32)*100)-100) -> -2.93 | L32: =IF(D32=0,0,IF(E32=0,0,((D32/E32)*100)-100)) -> 4.73 | M32: =IF(G32=0,0,((D32/G32)*100)-100) -> -4.26 | N32: =IF(H32=0,0,((D32/H32)*100)-100) -> 27.89 | O32: =IF(D32=0,0,IF(I32=0,0,((D32/I32)*100)-100)) -> 39.46 | Q32: 6330000 | R32: =IF(D32=0,0,IF(Q32=0,0,((D32/Q32)*100)-100)) -> -1.09 | S32: =IF(D32=0,0,(D32/$D$44)*100) -> 6.69 | U32: 18.1 | V32: 0 | W32: =V32-U32 -> -18.1
A33: Torres | C33: 5800000 | D33: 4734724 | E33: 4195715 | G33: 0 | H33: 0 | I33: 0 | K33: =IF(C33=0,0,((D33/C33)*100)-100) -> -18.37 | L33: =IF(D33=0,0,IF(E33=0,0,((D33/E33)*100)-100)) -> 12.85 | M33: =IF(G33=0,0,((D33/G33)*100)-100) -> 0 | N33: =IF(H33=0,0,((D33/H33)*100)-100) -> 0 | O33: =IF(D33=0,0,IF(I33=0,0,((D33/I33)*100)-100)) -> 0 | Q33: 5800000 | R33: =IF(D33=0,0,IF(Q33=0,0,((D33/Q33)*100)-100)) -> -18.37 | S33: =IF(D33=0,0,(D33/$D$44)*100) -> 5.06 | U33: 16.1 | V33: 0 | W33: =V33-U33 -> -16.1
A34: Total Hiper | C34: =SUM(C24:C33) -> 60280000 | D34: =SUM(D24:D33) -> 58665748 | E34: =SUM(E24:E33) -> 53946952 | G34: =SUM(G24:G33) -> 54347472 | H34: =SUM(H24:H33) -> 41192007 | I34: =SUM(I24:I33) -> 38731074 | J34: =SUM(C34:I34) -> 307163253 | K34: =IF(D34=0,0,((D34/C34)*100)-100) -> -2.68 | L34: =IF(D34=0,0,IF(E34=0,0,((D34/E34)*100)-100)) -> 8.75 | M34: =IF(G34=0,0,IF(D34=0,0,((D34/G34)*100)-100)) -> 7.95 | N34: =IF(H34=0,0,IF(D34=0,0,((D34/H34)*100)-100)) -> 42.42 | O34: =IF(D34=0,0,IF(I34=0,0,((D34/I34)*100)-100)) -> 51.47 | Q34: =SUM(Q24:Q33) -> 60160000 | R34: =IF(D34=0,0,((D34/Q34)*100)-100) -> -2.48 | S34: =IF(D34=0,0,(D34/$D$44)*100) -> 62.7 | U34: 16.08 | V34: 0 | W34: =V34-U34 -> -16.08
A36: Total s/ 27, 32 | B36: =B22+B34 -> 0 | C36: =C22+C34 -> 95350000 | D36: =D22+D34 -> 93564440 | E36: =E22+E34 -> 86116925 | F36: =F22+F34 -> 0 | G36: =G22+G34 -> 85323237 | H36: =H22+H34 -> 63754580 | I36: =I22+I34 -> 58737287 | J36: =SUM(C36:I36) -> 482846469 | K36: =IF(D36=0,0,((D36/C36)*100)-100) -> -1.87 | L36: =IF(D36=0,0,IF(E36=0,0,((D36/E36)*100)-100)) -> 8.65 | M36: =IF(G36=0,0,IF(D36=0,0,((D36/G36)*100)-100)) -> 9.66 | N36: =IF(H36=0,0,IF(D36=0,0,((D36/H36)*100)-100)) -> 46.76 | O36: =IF(D36=0,0,IF(I36=0,0,((D36/I36)*100)-100)) -> 59.29 | Q36: =Q22+Q34 -> 95380189 | R36: =IF(D36=0,0,((D36/Q36)*100)-100) -> -1.9 | S36: =IF(D36=0,0,(D36/$D$44)*100) -> 100 | U36: 16.21 | V36: 0 | W36: =V36-U36 -> -16.21
A38: Campo Largo | C38: 0 | D38: 0 | E38: 0 | G38: 0 | H38: 0 | I38: 0 | K38: =IF(C38=0,0,((D38/C38)*100)-100) -> 0 | L38: =IF(D38=0,0,IF(E38=0,0,((D38/E38)*100)-100)) -> 0 | M38: =IF(G38=0,0,((D38/G38)*100)-100) -> 0 | N38: =IF(H38=0,0,((D38/H38)*100)-100) -> 0 | O38: =IF(D38=0,0,IF(I38=0,0,((D38/I38)*100)-100)) -> 0 | Q38: 0 | R38: =IF(Q38=0,0,IF(D38=0,0,((D38/Q38)*100)-100)) -> 0 | S38: =IF(D38=0,0,(D38/$D$44)*100) -> 0 | U38: 0 | V38: 0 | W38: =V38-U38 -> 0
A39: Uvaranas | C39: 0 | D39: 0 | E39: 0 | G39: 0 | H39: 0 | I39: 0 | K39: =IF(C39=0,0,((D39/C39)*100)-100) -> 0 | L39: =IF(D39=0,0,IF(E39=0,0,((D39/E39)*100)-100)) -> 0 | M39: =IF(G39=0,0,((D39/G39)*100)-100) -> 0 | N39: =IF(H39=0,0,((D39/H39)*100)-100) -> 0 | O39: =IF(D39=0,0,IF(I39=0,0,((D39/I39)*100)-100)) -> 0 | Q39: 0 | R39: =IF(Q39=0,0,IF(D39=0,0,((D39/Q39)*100)-100)) -> 0 | S39: =IF(D39=0,0,(D39/$D$44)*100) -> 0 | U39: 0 | V39: 0 | W39: =V39-U39 -> 0
A40: Novo Mundo | C40: 0 | D40: 0 | E40: 0 | G40: 0 | H40: 0 | I40: 0 | K40: =IF(C40=0,0,((D40/C40)*100)-100) -> 0 | L40: =IF(D40=0,0,IF(E40=0,0,((D40/E40)*100)-100)) -> 0 | M40: =IF(G40=0,0,((D40/G40)*100)-100) -> 0 | N40: =IF(H40=0,0,((D40/H40)*100)-100) -> 0 | O40: =IF(D40=0,0,IF(I40=0,0,((D40/I40)*100)-100)) -> 0 | Q40: 0 | R40: =IF(Q40=0,0,IF(D40=0,0,((D40/Q40)*100)-100)) -> 0 | S40: =IF(D40=0,0,(D40/$D$44)*100) -> 0 | U40: 0 | V40: 0 | W40: =V40-U40 -> 0
A41: Torres | C41: 0 | D41: 0 | E41: 0 | G41: 0 | H41: 0 | I41: 0 | K41: =IF(C41=0,0,((D41/C41)*100)-100) -> 0 | L41: =IF(D41=0,0,IF(E41=0,0,((D41/E41)*100)-100)) -> 0 | M41: =IF(G41=0,0,((D41/G41)*100)-100) -> 0 | N41: =IF(H41=0,0,((D41/H41)*100)-100) -> 0 | O41: =IF(D41=0,0,IF(I41=0,0,((D41/I41)*100)-100)) -> 0 | Q41: 0 | R41: =IF(Q41=0,0,IF(D41=0,0,((D41/Q41)*100)-100)) -> 0 | S41: =IF(D41=0,0,(D41/$D$44)*100) -> 0 | U41: 0 | V41: 0 | W41: =V41-U41 -> 0
A42: Total Lojas Novas | C42: =SUM(C38:C41) -> 0 | D42: =SUM(D38:D41) -> 0 | E42: =SUM(E38:E41) -> 0 | G42: =SUM(G38:G41) -> 0 | H42: =SUM(H38:H41) -> 0 | I42: =SUM(I38:I41) -> 0 | K42: =IF(D42=0,0,((D42/C42)*100)-100) -> 0 | L42: =IF(D42=0,0,IF(E42=0,0,((D42/E42)*100)-100)) -> 0 | M42: =IF(G42=0,0,IF(D42=0,0,((D42/G42)*100)-100)) -> 0 | N42: =IF(H42=0,0,IF(D42=0,0,((D42/H42)*100)-100)) -> 0 | O42: =IF(D42=0,0,IF(I42=0,0,((D42/I42)*100)-100)) -> 0 | Q42: =SUM(Q38:Q41) -> 0 | R42: =IF(Q42=0,0,IF(D42=0,0,((D42/Q42)*100)-100)) -> 0 | S42: =IF(D42=0,0,(D42/$D$44)*100) -> 0
A44: Total Geral | C44: =C22+C34+C42 -> 95350000 | D44: =D22+D34+D42 -> 93564440 | E44: =E22+E34+E42 -> 86116925 | G44: =G22+G34+G42 -> 85323237 | H44: =H22+H34+H42 -> 63754580 | I44: =I22+I34+I42 -> 58737287 | K44: =IF(D44=0,0,((D44/C44)*100)-100) -> -1.87 | L44: =IF(D44=0,0,IF(E44=0,0,((D44/E44)*100)-100)) -> 8.65 | M44: =IF(G44=0,0,IF(D44=0,0,((D44/G44)*100)-100)) -> 9.66 | N44: =IF(H44=0,0,IF(D44=0,0,((D44/H44)*100)-100)) -> 46.76 | O44: =IF(D44=0,0,IF(I44=0,0,((D44/I44)*100)-100)) -> 59.29 | Q44: =Q22+Q34+Q42 -> 95380189 | R44: =IF(D44=0,0,((D44/Q44)*100)-100) -> -1.9 | S44: =S22+S34+S42 -> 100 | U44: 16.21 | V44: 0 | W44: =V44-U44 -> -16.21
C45: Resumo por Regiao - Outubro/2002
C46: Descricao das Aberturas | H46: Valor | I46: % | M46: Margem Comercial | R46: Meta | S46: Real | U46: Dif
C47: Curitiba (3,6,7,10,11,13,17,21,22,24,26,27,28,34) | H47: 52029428 | I47: =IF(D44=0,0,H47/$D$44) -> 0.55610000000000004 | L47: 99 | M47: Empresa | R47: 0 | S47: 0 | U47: =S47-R47 -> 0
C48: Curitiba e Metrop. (Ctba. 4,5,8,14,23,25;31) | H48: 71374628 | I48: =IF(D44=0,0,H48/$D$44) -> 0.76280000000000003 | L48: 207 | M48: Super | R48: 0 | S48: 0 | U48: =S48-R48 -> 0
C49: Metropolitana (4,5,8,14,23,25;31) | H49: 19345200 | I49: =IF(D44=0,0,H49/$D$44) -> 0.20680000000000001 | L49: 208 | M49: Hiper | R49: 0 | S49: 0 | U49: =S49-R49 -> 0
C50: Norte (9,15,20) | H50: =D25+D15+D18 -> 8433667 | I50: =IF(D44=0,0,H50/$D$44) -> 9.01E-2 | L50: 204 | M50: Regional Gilberto | R50: 0 | S50: 0 | U50: =S50-R50 -> 0
C51: Ponta Grossa (18,19,32) | H51: =D17+D28+D39 -> 8355208 | I51: =IF(D44=0,0,H51/$D$44) -> 8.9300000000000004E-2 | L51: 205 | M51: Regional Edison | R51: 0 | S51: 0 | U51: =S51-R51 -> 0
C52: Super (3,4,5,7,8,10,13,15,17,18,20,23,26,28,34) | H52: 34898692 | I52: =IF(D44=0,0,H52/$D$44) -> 0.373 | L52: 206 | M52: Regional Jorge | R52: 0 | S52: 0 | U52: =S52-R52 -> 0
C53: Hiper (6,9,11,14,19,21,22,24,25,26,27) | H53: 58665748 | I53: =IF(D44=0,0,H53/$D$44) -> 0.627 | L53: 209 | M53: Regio - Curitiba | R53: 0 | S53: 0 | U53: =S53-R53 -> 0
C54: Curitiba, Metropolitana e Ponta Grossa | H54: =D44-H50 -> 85130773 | I54: =IF(D44=0,0,H54/$D$44) -> 0.90990000000000004 | L54: 200 | M54: Regio - Metropolitana | R54: 0 | S54: 0 | U54: =S54-R54 -> 0
C55: Araucaria | H55: =D9+D19 -> 3289046 | I55: =IF(D44=0,0,H55/$D$44) -> 3.5200000000000002E-2 | L55: 201 | M55: Regio - Centro Oeste | R55: 0 | S55: 0 | U55: =S55-R55 -> 0