A2: Perodo: | C2: 37742 | E2: 37772 | H2: Vendas Acumuladas por Filial
C4: Vendas 2003 | G4: Vendas de Anos Anteriores | K4: Percentuais ( % ) | R4: %
A5: Lojas | C5: Previso | D5: Realizada | E5: Ms Anterior | G5: Vendas 2002 | H5: Vendas 2001 | I5: Vendas 2000 | K5: % Prev | L5: % MA | M5: 2002 | N5: 2001 | O5: 2000 | Q5: Previso Ms | R5: Final | S5: Part.
A7: Xaxim | C7: 650000 | D7: 718099.64 | E7: 705281.37 | G7: 565081.36 | H7: 480843.64 | I7: 517283.78 | K7: =IF(C7=0,0,((D7/C7)*100)-100) -> 10.48 | L7: =IF(E7=0,0,((D7/E7)*100)-100) -> 1.82 | M7: =IF(G7=0,0,((D7/G7)*100)-100) -> 27.08 | N7: =IF(H7=0,0,((D7/H7)*100)-100) -> 49.34 | O7: =IF(I7=0,0,((D7/I7)*100)-100) -> 38.82 | Q7: 650000 | R7: =((D7/Q7)*100)-100 -> 10.48 | S7: =D7/$D$31*100 -> 1.64
A8: S. Felicidade | C8: 700000 | D8: 787255.3 | E8: 756536.24 | G8: 515654.05 | H8: 544149.64 | I8: 522929.25 | K8: =IF(C8=0,0,((D8/C8)*100)-100) -> 12.47 | L8: =IF(E8=0,0,((D8/E8)*100)-100) -> 4.06 | M8: =IF(G8=0,0,((D8/G8)*100)-100) -> 52.67 | N8: =IF(H8=0,0,((D8/H8)*100)-100) -> 44.68 | O8: =IF(I8=0,0,((D8/I8)*100)-100) -> 50.55 | Q8: 700000 | R8: =((D8/Q8)*100)-100 -> 12.47 | S8: =D8/$D$31*100 -> 1.79
A9: Lapa | C9: 990000 | D9: 1057143.08 | E9: 1078804.95 | G9: 830517.29 | H9: 663682.19 | I9: 605353.75 | K9: =IF(C9=0,0,((D9/C9)*100)-100) -> 6.78 | L9: =IF(E9=0,0,((D9/E9)*100)-100) -> -2.01 | M9: =IF(G9=0,0,((D9/G9)*100)-100) -> 27.29 | N9: =IF(H9=0,0,((D9/H9)*100)-100) -> 59.28 | O9: =IF(I9=0,0,((D9/I9)*100)-100) -> 74.63 | Q9: 990000 | R9: =((D9/Q9)*100)-100 -> 6.78 | S9: =D9/$D$31*100 -> 2.41
A10: Araucria | C10: 1080000 | D10: 1100612.74 | E10: 1164094.79 | G10: 1479227.4 | H10: 1349044.34 | I10: 1275407.32 | K10: =IF(C10=0,0,((D10/C10)*100)-100) -> 1.91 | L10: =IF(E10=0,0,((D10/E10)*100)-100) -> -5.45 | M10: =IF(G10=0,0,((D10/G10)*100)-100) -> -25.6 | N10: =IF(H10=0,0,((D10/H10)*100)-100) -> -18.42 | O10: =IF(I10=0,0,((D10/I10)*100)-100) -> -13.71 | Q10: 1080000 | R10: =((D10/Q10)*100)-100 -> 1.91 | S10: =D10/$D$31*100 -> 2.51
A11: Pinheirinho | C11: 1890000 | D11: 1966136.43 | E11: 1971918.67 | G11: 1631158.78 | H11: 1548717.86 | I11: 1490253.01 | K11: =IF(C11=0,0,((D11/C11)*100)-100) -> 4.03 | L11: =IF(E11=0,0,((D11/E11)*100)-100) -> -00.29 | M11: =IF(G11=0,0,((D11/G11)*100)-100) -> 20.54 | N11: =IF(H11=0,0,((D11/H11)*100)-100) -> 26.95 | O11: =IF(I11=0,0,((D11/I11)*100)-100) -> 31.93 | Q11: 1890000 | R11: =((D11/Q11)*100)-100 -> 4.03 | S11: =D11/$D$31*100 -> 4.48
A12: Hauer | C12: 2900000 | D12: 2927510.07 | E12: 2916806.65 | G12: 2385160.97 | H12: 2147705.37 | I12: 1894894.75 | K12: =IF(C12=0,0,((D12/C12)*100)-100) -> 00.95 | L12: =IF(E12=0,0,((D12/E12)*100)-100) -> 00.37 | M12: =IF(G12=0,0,((D12/G12)*100)-100) -> 22.74 | N12: =IF(H12=0,0,((D12/H12)*100)-100) -> 36.31 | O12: =IF(I12=0,0,((D12/I12)*100)-100) -> 54.49 | Q12: 2900000 | R12: =((D12/Q12)*100)-100 -> 00.95 | S12: =D12/$D$31*100 -> 6.67
A13: Paranagu | C13: 3050000 | D13: 3031569.73 | E13: 3265218.02 | G13: 2563013.42 | H13: 2234197.51 | I13: 1530169.39 | K13: =IF(C13=0,0,((D13/C13)*100)-100) -> -00.6 | L13: =IF(E13=0,0,((D13/E13)*100)-100) -> -7.16 | M13: =IF(G13=0,0,((D13/G13)*100)-100) -> 18.28 | N13: =IF(H13=0,0,((D13/H13)*100)-100) -> 35.69 | O13: =IF(I13=0,0,((D13/I13)*100)-100) -> 98.12 | Q13: 3050000 | R13: =((D13/Q13)*100)-100 -> -00.6 | S13: =D13/$D$31*100 -> 6.9
A14: Centenrio | C14: 880000 | D14: 955807.08 | E14: 886703.02 | G14: 727275.1 | H14: 613721.51 | I14: 571647.48 | K14: =IF(C14=0,0,((D14/C14)*100)-100) -> 8.61 | L14: =IF(E14=0,0,((D14/E14)*100)-100) -> 7.79 | M14: =IF(G14=0,0,((D14/G14)*100)-100) -> 31.42 | N14: =IF(H14=0,0,((D14/H14)*100)-100) -> 55.74 | O14: =IF(I14=0,0,((D14/I14)*100)-100) -> 67.2 | Q14: 880000 | R14: =((D14/Q14)*100)-100 -> 8.61 | S14: =D14/$D$31*100 -> 2.18
A15: So Brz | C15: 3000000 | D15: 3165256.6 | E15: 3019718.51 | G15: 2408074.13 | H15: 2372515.34 | I15: 1924220.7 | K15: =IF(C15=0,0,((D15/C15)*100)-100) -> 5.51 | L15: =IF(E15=0,0,((D15/E15)*100)-100) -> 4.82 | M15: =IF(G15=0,0,((D15/G15)*100)-100) -> 31.44 | N15: =IF(H15=0,0,((D15/H15)*100)-100) -> 33.41 | O15: =IF(I15=0,0,((D15/I15)*100)-100) -> 64.5 | Q15: 3000000 | R15: =((D15/Q15)*100)-100 -> 5.51 | S15: =D15/$D$31*100 -> 7.21
A16: Arapongas | C16: 610000 | D16: 599218.86 | E16: 656877.08 | G16: 494240.97 | H16: 513570.69 | I16: 442751.81 | K16: =IF(C16=0,0,((D16/C16)*100)-100) -> -1.77 | L16: =IF(E16=0,0,((D16/E16)*100)-100) -> -8.78 | M16: =IF(G16=0,0,((D16/G16)*100)-100) -> 21.24 | N16: =IF(H16=0,0,((D16/H16)*100)-100) -> 16.68 | O16: =IF(I16=0,0,((D16/I16)*100)-100) -> 35.34 | Q16: 610000 | R16: =((D16/Q16)*100)-100 -> -1.77 | S16: =D16/$D$31*100 -> 1.36
A17: Guarapuava | C17: 1300000 | D17: 1380896.32 | E17: 1486376.04 | G17: 795624.47 | H17: 772040.86 | I17: 825351.76 | K17: =IF(C17=0,0,((D17/C17)*100)-100) -> 6.22 | L17: =IF(E17=0,0,((D17/E17)*100)-100) -> -7.1 | M17: =IF(G17=0,0,((D17/G17)*100)-100) -> 73.56 | N17: =IF(H17=0,0,((D17/H17)*100)-100) -> 78.86 | O17: =IF(I17=0,0,((D17/I17)*100)-100) -> 67.31 | Q17: 1300000 | R17: =((D17/Q17)*100)-100 -> 6.22 | S17: =D17/$D$31*100 -> 3.14
A18: Apucarana | C18: 1400000 | D18: 1322216.68 | E18: 1504471.69 | G18: 1124216.09 | H18: 1089392.92 | I18: 1189189.03 | K18: =IF(C18=0,0,((D18/C18)*100)-100) -> -5.56 | L18: =IF(E18=0,0,((D18/E18)*100)-100) -> -12.11 | M18: =IF(G18=0,0,((D18/G18)*100)-100) -> 17.61 | N18: =IF(H18=0,0,((D18/H18)*100)-100) -> 21.37 | O18: =IF(I18=0,0,((D18/I18)*100)-100) -> 11.19 | Q18: 1400000 | R18: =((D18/Q18)*100)-100 -> -5.56 | S18: =D18/$D$31*100 -> 3.01
A19: Ah | C19: 1200000 | D19: 1331419.32 | E19: 1322205.88 | G19: 1031373.5 | H19: 1083019.18 | I19: 933820.78 | K19: =IF(C19=0,0,((D19/C19)*100)-100) -> 10.95 | L19: =IF(E19=0,0,((D19/E19)*100)-100) -> 00.7 | M19: =IF(G19=0,0,((D19/G19)*100)-100) -> 29.09 | N19: =IF(H19=0,0,((D19/H19)*100)-100) -> 22.94 | O19: =IF(I19=0,0,((D19/I19)*100)-100) -> 42.58 | Q19: 1200000 | R19: =((D19/Q19)*100)-100 -> 10.95 | S19: =D19/$D$31*100 -> 3.03
A20: P.G. Centro | C20: 1500000 | D20: 1646304.58 | E20: 1776702.73 | G20: 1244339.79 | H20: 1065207.47 | I20: 1220515.31 | K20: =IF(C20=0,0,((D20/C20)*100)-100) -> 9.75 | L20: =IF(E20=0,0,((D20/E20)*100)-100) -> -7.34 | M20: =IF(G20=0,0,((D20/G20)*100)-100) -> 32.3 | N20: =IF(H20=0,0,((D20/H20)*100)-100) -> 54.55 | O20: =IF(I20=0,0,((D20/I20)*100)-100) -> 34.89 | Q20: 1500000 | R20: =((D20/Q20)*100)-100 -> 9.75 | S20: =D20/$D$31*100 -> 3.75
A21: Maring | C21: 1950000 | D21: 2036770.59 | E21: 2180025.02 | G21: 1584197.38 | H21: 1623200.88 | I21: 1560454.19 | K21: =IF(C21=0,0,((D21/C21)*100)-100) -> 4.45 | L21: =IF(E21=0,0,((D21/E21)*100)-100) -> -6.57 | M21: =IF(G21=0,0,((D21/G21)*100)-100) -> 28.57 | N21: =IF(H21=0,0,((D21/H21)*100)-100) -> 25.48 | O21: =IF(I21=0,0,((D21/I21)*100)-100) -> 30.52 | Q21: 1950000 | R21: =((D21/Q21)*100)-100 -> 4.45 | S21: =D21/$D$31*100 -> 4.64
A22: Araucria Nova | C22: 2100000 | D22: 2027813.63 | E22: 1940027.55 | G22: 0 | H22: 0 | I22: 0 | K22: =IF(C22=0,0,((D22/C22)*100)-100) -> -3.44 | L22: =IF(E22=0,0,((D22/E22)*100)-100) -> 4.52 | M22: =IF(G22=0,0,((D22/G22)*100)-100) -> 0 | N22: =IF(H22=0,0,((D22/H22)*100)-100) -> 0 | O22: =IF(I22=0,0,((D22/I22)*100)-100) -> 0 | Q22: 2100000 | R22: =((D22/Q22)*100)-100 -> -3.44 | S22: =D22/$D$31*100 -> 4.62
A23: Total Super | C23: =SUM(C7:C22) -> 25200000 | D23: =SUM(D7:D22) -> 26054030.649999999 | E23: =SUM(E7:E22) -> 26631768.210000001 | G23: =SUM(G7:G22) -> 19379154.699999999 | H23: =SUM(H7:H22) -> 18101009.399999999 | I23: =SUM(I7:I22) -> 16504242.310000001 | J23: =SUM(C23:I23) -> 131870205.27 | K23: =((D23/C23)*100)-100 -> 3.39 | L23: =IF(E23=0,0,((D23/E23)*100)-100) -> -2.17 | M23: =((D23/G23)*100)-100 -> 34.44 | N23: =((D23/H23)*100)-100 -> 43.94 | O23: =IF(I23=0,0,((D23/I23)*100)-100) -> 57.86 | Q23: =SUM(Q7:Q22) -> 25200000 | R23: =((D23/Q23)*100)-100 -> 3.39 | S23: =D23/$D$31*100 -> 59.33
A25: Londrina | C25: 2360000 | D25: 2215390.65 | E25: 2255223.82 | G25: 2111240.92 | H25: 2065685.02 | I25: 0 | K25: =IF(C25=0,0,((D25/C25)*100)-100) -> -6.13 | L25: =IF(E25=0,0,((D25/E25)*100)-100) -> -1.77 | M25: =IF(G25=0,0,((D25/G25)*100)-100) -> 4.93 | N25: =IF(H25=0,0,((D25/H25)*100)-100) -> 7.25 | O25: =IF(I25=0,0,((D25/I25)*100)-100) -> 0 | Q25: 2360000 | R25: =((D25/Q25)*100)-100 -> -6.13 | S25: =D25/$D$31*100 -> 5.05
A26: S.J. Pinhais | C26: 4000000 | D26: 4099304.68 | E26: 3994725.86 | G26: 3326193.72 | H26: 2658379.18 | I26: 1385105.7 | K26: =IF(C26=0,0,((D26/C26)*100)-100) -> 2.48 | L26: =IF(E26=0,0,((D26/E26)*100)-100) -> 2.62 | M26: =IF(G26=0,0,((D26/G26)*100)-100) -> 23.24 | N26: =IF(H26=0,0,((D26/H26)*100)-100) -> 54.2 | O26: =IF(I26=0,0,((D26/I26)*100)-100) -> 195.96 | Q26: 4000000 | R26: =((D26/Q26)*100)-100 -> 2.48 | S26: =D26/$D$31*100 -> 9.34
A27: P.G. Nova | C27: 3100000 | D27: 3083241.93 | E27: 3068031.2 | G27: 2720900.97 | H27: 2131908.97 | I27: 1758703.8 | K27: =IF(C27=0,0,((D27/C27)*100)-100) -> -00.54 | L27: =IF(E27=0,0,((D27/E27)*100)-100) -> 0.5 | M27: =IF(G27=0,0,((D27/G27)*100)-100) -> 13.32 | N27: =IF(H27=0,0,((D27/H27)*100)-100) -> 44.62 | O27: =IF(I27=0,0,((D27/I27)*100)-100) -> 75.31 | Q27: 3100000 | R27: =((D27/Q27)*100)-100 -> -00.54 | S27: =D27/$D$31*100 -> 7.02
A28: Nilo Peanha | C28: 7800000 | D28: 8458513.6799999997 | E28: 8042822.5599999996 | G28: 6043685.9100000001 | H28: 0 | I28: 0 | K28: =IF(C28=0,0,((D28/C28)*100)-100) -> 8.44 | L28: =IF(E28=0,0,((D28/E28)*100)-100) -> 5.17 | M28: =IF(G28=0,0,((D28/G28)*100)-100) -> 39.96 | N28: =IF(H28=0,0,((D28/H28)*100)-100) -> 0 | O28: =IF(I28=0,0,((D28/I28)*100)-100) -> 0 | Q28: 7800000 | R28: =((D28/Q28)*100)-100 -> 8.44 | S28: =D28/$D$31*100 -> 19.26
A29: Total Hiper | C29: =SUM(C25:C28) -> 17260000 | D29: =SUM(D25:D28) -> 17856450.940000001 | E29: =SUM(E25:E28) -> 17360803.440000001 | G29: =SUM(G25:G28) -> 14202021.52 | H29: =SUM(H25:H28) -> 6855973.1699999999 | I29: =SUM(I25:I28) -> 3143809.5 | J29: =SUM(C29:I29) -> 76679058.569999993 | K29: =((D29/C29)*100)-100 -> 3.46 | L29: =IF(E29=0,0,((D29/E29)*100)-100) -> 2.85 | M29: =((D29/G29)*100)-100 -> 25.73 | N29: =((D29/H29)*100)-100 -> 160.45 | O29: =IF(I29=0,0,((D29/I29)*100)-100) -> 467.99 | Q29: =SUM(Q25:Q28) -> 17260000 | R29: =((D29/Q29)*100)-100 -> 3.46 | S29: =D29/$D$31*100 -> 40.67
A31: Total Geral | C31: =C23+C29 -> 42460000 | D31: =D23+D29 -> 43910481.590000004 | E31: =E23+E29 -> 43992571.649999999 | G31: =G23+G29 -> 33581176.219999999 | H31: =H23+H29 -> 24956982.57 | I31: =I23+I29 -> 19648051.809999999 | K31: =((D31/C31)*100)-100 -> 3.42 | L31: =IF(E31=0,0,((D31/E31)*100)-100) -> -00.19 | M31: =((D31/G31)*100)-100 -> 30.76 | N31: =((D31/H31)*100)-100 -> 75.94 | O31: =IF(I31=0,0,((D31/I31)*100)-100) -> 123.49 | Q31: =Q23+Q29 -> 42460000 | R31: =((D31/Q31)*100)-100 -> 3.42 | S31: =S23+S29 -> 100
C32: Resumo por Regio - Outubro/2002
C33: Descrio das Aberturas | H33: Valor | I33: %
C34: Curitiba (2,3,6,7,10,11,17,21) | H34: =D7+D8+D11+D12+D14+D15+D19+D28 -> 20309998 | I34: =H34/$D$31 -> 0.46250000000000002
C35: Curitiba e Metrop. (Ctba. 4,5,8,14,23) | H35: =H34+D9+D10+D13+D27+D22 -> 30610379 | I35: =H35/$D$31 -> 0.69710000000000005
C36: Metropolitana (4,5,8,14,23) | H36: =H35-H34 -> 10300381 | I36: =H36/$D$31 -> 0.2346
C37: Norte (9,12,15,20) | H37: =D25+D16+D18+D22 -> 6164640 | I37: =H37/$D$31 -> 0.1404
C38: Centro-Oeste (13,18,19) | H38: =D17+D20+D27 -> 6110443 | I38: =H38/$D$31 -> 0.13919999999999999
C39: Ponta Grossa (18,19) | H39: =H38-D17 -> 4729547 | I39: =H39/$D$31 -> 0.1077
C40: Super (2,3,4,5,6,7,8,10,11,12,13,15,17,18,20,23) | H40: =D23 -> 26054031 | I40: =H40/$D$31 -> 0.59330000000000005
C41: Hiper (9,14,19,21) | H41: =D29 -> 17856451 | I41: =H41/$D$31 -> 0.40670000000000001
C42: Curitiba, Metropolitana e Centro-Oeste | H42: =D31-H37 -> 37745842 | I42: =H42/$D$31 -> 0.85960000000000003
C43: Araucria | H43: =D10+D22 -> 3128426 | I43: =H43/$D$31 -> 7.1199999999999999E-2