A2: Periodo: | C2: 38899 | D2: a | E2: 38929 | H2: Vendas Acumuladas por Filial | Q2: =NOW() -> 38965.382548032401
A4: v.1 | C4: Vendas 2006 | G4: Vendas de Anos Anteriores | K4: Percentuais ( % ) | Q4: Meta Mensal | U4: Margem
A5: Lojas | C5: Previsao | D5: Realizada | E5: Mes Anterior | G5: Vendas 2005 | H5: Vendas 2004 | I5: Vendas 2003 | K5: % Prev | L5: % MA | M5: 2005 | N5: 2004 | O5: 2003 | Q5: Previsao Mes | R5: Final | S5: Part. | U5: Meta | V5: Condor
A7: Xaxim | C7: 730000 | D7: 633033 | E7: 644824 | G7: 730589 | H7: 875027 | I7: 745682 | K7: =IF(C7=0,0,((D7/C7)*100)-100) -> -13.28 | L7: =IF(D7=0,0,IF(E7=0,0,((D7/E7)*100)-100)) -> -1.83 | M7: =IF(G7=0,0,((D7/G7)*100)-100) -> -13.35 | N7: =IF(H7=0,0,((D7/H7)*100)-100) -> -27.66 | O7: =IF(D7=0,0,IF(I7=0,0,((D7/I7)*100)-100)) -> -15.11 | Q7: 730000 | R7: =IF(D7=0,0,((D7/Q7)*100)-100) -> -13.28 | S7: =IF(D7=0,0,(D7/$D$36)*100) -> 1.14 | U7: 16.5 | V7: 15.87
A8: S. Felicidade | C8: 820000 | D8: 826867 | E8: 841856 | G8: 694939 | H8: 717811 | I8: 750766 | K8: =IF(C8=0,0,((D8/C8)*100)-100) -> 0.84 | L8: =IF(D8=0,0,IF(E8=0,0,((D8/E8)*100)-100)) -> -1.78 | M8: =IF(G8=0,0,((D8/G8)*100)-100) -> 18.98 | N8: =IF(H8=0,0,((D8/H8)*100)-100) -> 15.19 | O8: =IF(D8=0,0,IF(I8=0,0,((D8/I8)*100)-100)) -> 10.14 | Q8: 820000 | R8: =IF(D8=0,0,((D8/Q8)*100)-100) -> 0.84 | S8: =IF(D8=0,0,(D8/$D$36)*100) -> 1.49 | U8: 16.5 | V8: 17.39
A9: Lapa | C9: 1260000 | D9: 995406 | E9: 1006998 | G9: 1164156 | H9: 1224191 | I9: 1060476 | K9: =IF(C9=0,0,((D9/C9)*100)-100) -> -21 | L9: =IF(D9=0,0,IF(E9=0,0,((D9/E9)*100)-100)) -> -1.15 | M9: =IF(G9=0,0,((D9/G9)*100)-100) -> -14.5 | N9: =IF(H9=0,0,((D9/H9)*100)-100) -> -18.69 | O9: =IF(D9=0,0,IF(I9=0,0,((D9/I9)*100)-100)) -> -6.14 | Q9: 1100000 | R9: =IF(D9=0,0,((D9/Q9)*100)-100) -> -9.51 | S9: =IF(D9=0,0,(D9/$D$36)*100) -> 1.79 | U9: 16.25 | V9: 15.75
A10: Araucaria | C10: 1000000 | D10: 890983 | E10: 877033 | G10: 941477 | H10: 1024263 | I10: 1008677 | K10: =IF(C10=0,0,((D10/C10)*100)-100) -> -10.9 | L10: =IF(D10=0,0,IF(E10=0,0,((D10/E10)*100)-100)) -> 1.59 | M10: =IF(G10=0,0,((D10/G10)*100)-100) -> -5.36 | N10: =IF(H10=0,0,((D10/H10)*100)-100) -> -13.01 | O10: =IF(D10=0,0,IF(I10=0,0,((D10/I10)*100)-100)) -> -11.67 | Q10: 1000000 | R10: =IF(D10=0,0,((D10/Q10)*100)-100) -> -10.9 | S10: =IF(D10=0,0,(D10/$D$36)*100) -> 1.6 | U10: 17.55 | V10: 18.61
A11: Pinheirinho | C11: 0 | D11: 0 | E11: 0 | G11: 0 | H11: 0 | I11: 0 | K11: =IF(C11=0,0,((D11/C11)*100)-100) -> 0 | L11: =IF(D11=0,0,IF(E11=0,0,((D11/E11)*100)-100)) -> 0 | M11: =IF(G11=0,0,((D11/G11)*100)-100) -> 0 | N11: =IF(H11=0,0,((D11/H11)*100)-100) -> 0 | O11: =IF(D11=0,0,IF(I11=0,0,((D11/I11)*100)-100)) -> 0 | Q11: 0 | R11: =IF(D11=0,0,((D11/Q11)*100)-100) -> 0 | S11: =IF(D11=0,0,(D11/$D$36)*100) -> 0 | U11: 0 | V11: 0
A12: Hauer | C12: 3165000 | D12: 2849509 | E12: 2908178 | G12: 3065030 | H12: 3150643 | I12: 2918248 | K12: =IF(C12=0,0,((D12/C12)*100)-100) -> -9.97 | L12: =IF(D12=0,0,IF(E12=0,0,((D12/E12)*100)-100)) -> -2.02 | M12: =IF(G12=0,0,((D12/G12)*100)-100) -> -7.03 | N12: =IF(H12=0,0,((D12/H12)*100)-100) -> -9.56 | O12: =IF(D12=0,0,IF(I12=0,0,((D12/I12)*100)-100)) -> -2.36 | Q12: 3165000 | R12: =IF(D12=0,0,((D12/Q12)*100)-100) -> -9.97 | S12: =IF(D12=0,0,(D12/$D$36)*100) -> 5.13 | U12: 16.97 | V12: 17.34
A13: Paranagua | C13: 1480000 | D13: 1416549 | E13: 1413914 | G13: 1610625 | H13: 3451663 | I13: 3144865 | K13: =IF(C13=0,0,((D13/C13)*100)-100) -> -4.29 | L13: =IF(D13=0,0,IF(E13=0,0,((D13/E13)*100)-100)) -> 0.19 | M13: =IF(G13=0,0,((D13/G13)*100)-100) -> -12.05 | N13: =IF(H13=0,0,((D13/H13)*100)-100) -> -58.96 | O13: =IF(D13=0,0,IF(I13=0,0,((D13/I13)*100)-100)) -> -54.96 | Q13: 1480000 | R13: =IF(D13=0,0,((D13/Q13)*100)-100) -> -4.29 | S13: =IF(D13=0,0,(D13/$D$36)*100) -> 2.55 | U13: 17.4 | V13: 17.89
A14: Centenario | C14: 950000 | D14: 850643 | E14: 882018 | G14: 954707 | H14: 996850 | I14: 936047 | K14: =IF(C14=0,0,((D14/C14)*100)-100) -> -10.46 | L14: =IF(D14=0,0,IF(E14=0,0,((D14/E14)*100)-100)) -> -3.56 | M14: =IF(G14=0,0,((D14/G14)*100)-100) -> -10.9 | N14: =IF(H14=0,0,((D14/H14)*100)-100) -> -14.67 | O14: =IF(D14=0,0,IF(I14=0,0,((D14/I14)*100)-100)) -> -9.12 | Q14: 950000 | R14: =IF(D14=0,0,((D14/Q14)*100)-100) -> -10.46 | S14: =IF(D14=0,0,(D14/$D$36)*100) -> 1.53 | U14: 16.6 | V14: 16.92
A15: Arapongas | C15: 0 | D15: 0 | E15: 0 | G15: 0 | H15: 0 | I15: 0 | K15: =IF(C15=0,0,((D15/C15)*100)-100) -> 0 | L15: =IF(D15=0,0,IF(E15=0,0,((D15/E15)*100)-100)) -> 0 | M15: =IF(D15=0,0,IF(G15=0,0,((D15/G15)*100)-100)) -> 0 | N15: =IF(D15=0,0,IF(H15=0,0,((D15/H15)*100)-100)) -> 0 | O15: =IF(D15=0,0,IF(I15=0,0,((D15/I15)*100)-100)) -> 0 | Q15: 0 | R15: =IF(D15=0,0,((D15/Q15)*100)-100) -> 0 | S15: =IF(D15=0,0,(D15/$D$36)*100) -> 0 | U15: 0 | V15: 0
A16: Sao Braz | C16: 3200000 | D16: 2888683 | E16: 2921765 | G16: 3144128 | H16: 3190832 | I16: 3051671 | K16: =IF(C16=0,0,((D16/C16)*100)-100) -> -9.73 | L16: =IF(D16=0,0,IF(E16=0,0,((D16/E16)*100)-100)) -> -1.13 | M16: =IF(G16=0,0,((D16/G16)*100)-100) -> -8.12 | N16: =IF(H16=0,0,((D16/H16)*100)-100) -> -9.47 | O16: =IF(D16=0,0,IF(I16=0,0,((D16/I16)*100)-100)) -> -5.34 | Q16: 3200000 | R16: =IF(D16=0,0,((D16/Q16)*100)-100) -> -9.73 | S16: =IF(D16=0,0,(D16/$D$36)*100) -> 5.2 | U16: 16.95 | V16: 16.49
A17: Sitio Cercado | C17: 1350000 | D17: 1121514 | E17: 1142549 | G17: 1429276 | H17: 1746727 | I17: 1344526 | K17: =IF(C17=0,0,((D17/C17)*100)-100) -> -16.92 | L17: =IF(D17=0,0,IF(E17=0,0,((D17/E17)*100)-100)) -> -1.84 | M17: =IF(G17=0,0,((D17/G17)*100)-100) -> -21.53 | N17: =IF(H17=0,0,((D17/H17)*100)-100) -> -35.79 | O17: =IF(D17=0,0,IF(I17=0,0,((D17/I17)*100)-100)) -> -16.59 | Q17: 1350000 | R17: =IF(D17=0,0,((D17/Q17)*100)-100) -> -16.92 | S17: =IF(D17=0,0,(D17/$D$36)*100) -> 2.02 | U17: 17 | V17: 16.73
A18: Apucarana | C18: 1800000 | D18: 1621949 | E18: 1597831 | G18: 1545857 | H18: 1555017 | I18: 1315361 | K18: =IF(C18=0,0,((D18/C18)*100)-100) -> -9.89 | L18: =IF(D18=0,0,IF(E18=0,0,((D18/E18)*100)-100)) -> 1.51 | M18: =IF(G18=0,0,((D18/G18)*100)-100) -> 4.92 | N18: =IF(H18=0,0,((D18/H18)*100)-100) -> 4.3 | O18: =IF(D18=0,0,IF(I18=0,0,((D18/I18)*100)-100)) -> 23.31 | Q18: 1800000 | R18: =IF(D18=0,0,((D18/Q18)*100)-100) -> -9.89 | S18: =IF(D18=0,0,(D18/$D$36)*100) -> 2.92 | U18: 16 | V18: 16.31
A19: Ahu | C19: 1180000 | D19: 1096611 | E19: 1126688 | G19: 1054408 | H19: 1186684 | I19: 1293035 | K19: =IF(C19=0,0,((D19/C19)*100)-100) -> -7.07 | L19: =IF(D19=0,0,IF(E19=0,0,((D19/E19)*100)-100)) -> -2.67 | M19: =IF(G19=0,0,((D19/G19)*100)-100) -> 4 | N19: =IF(H19=0,0,((D19/H19)*100)-100) -> -7.59 | O19: =IF(D19=0,0,IF(I19=0,0,((D19/I19)*100)-100)) -> -15.19 | Q19: 1180000 | R19: =IF(D19=0,0,((D19/Q19)*100)-100) -> -7.07 | S19: =IF(D19=0,0,(D19/$D$36)*100) -> 1.97 | U19: 17.15 | V19: 17.95
A20: P.G. Centro | C20: 1680000 | D20: 1468628 | E20: 1545040 | G20: 1568467 | H20: 1802233 | I20: 1670409 | K20: =IF(C20=0,0,((D20/C20)*100)-100) -> -12.58 | L20: =IF(D20=0,0,IF(E20=0,0,((D20/E20)*100)-100)) -> -4.95 | M20: =IF(G20=0,0,((D20/G20)*100)-100) -> -6.37 | N20: =IF(H20=0,0,((D20/H20)*100)-100) -> -18.51 | O20: =IF(D20=0,0,IF(I20=0,0,((D20/I20)*100)-100)) -> -12.08 | Q20: 1680000 | R20: =IF(D20=0,0,((D20/Q20)*100)-100) -> -12.58 | S20: =IF(D20=0,0,(D20/$D$36)*100) -> 2.64 | U20: 17.98 | V20: 19.23
A21: Maringa | C21: 2460000 | D21: 2161952 | E21: 2233127 | G21: 2294267 | H21: 2292168 | I21: 2044843 | K21: =IF(C21=0,0,((D21/C21)*100)-100) -> -12.12 | L21: =IF(D21=0,0,IF(E21=0,0,((D21/E21)*100)-100)) -> -3.19 | M21: =IF(G21=0,0,((D21/G21)*100)-100) -> -5.77 | N21: =IF(H21=0,0,((D21/H21)*100)-100) -> -5.68 | O21: =IF(D21=0,0,IF(I21=0,0,((D21/I21)*100)-100)) -> 5.73 | Q21: 2460000 | R21: =IF(D21=0,0,((D21/Q21)*100)-100) -> -12.12 | S21: =IF(D21=0,0,(D21/$D$36)*100) -> 3.89 | U21: 18.2 | V21: 17.94
A22: Araucaria Nova | C22: 2100000 | D22: 1940098 | E22: 1873018 | G22: 2015707 | H22: 2266852 | I22: 1864701 | K22: =IF(C22=0,0,((D22/C22)*100)-100) -> -7.61 | L22: =IF(D22=0,0,IF(E22=0,0,((D22/E22)*100)-100)) -> 3.58 | M22: =IF(G22=0,0,((D22/G22)*100)-100) -> -3.75 | N22: =IF(H22=0,0,((D22/H22)*100)-100) -> -14.41 | O22: =IF(D22=0,0,IF(I22=0,0,((D22/I22)*100)-100)) -> 4.04 | Q22: 2100000 | R22: =IF(D22=0,0,((D22/Q22)*100)-100) -> -7.61 | S22: =IF(D22=0,0,(D22/$D$36)*100) -> 3.49 | U22: 17.6 | V22: 17.62
A23: Sitio Cercado | C23: 0 | D23: 0 | E23: 0 | G23: 0 | H23: 0 | I23: 0 | K23: =IF(C23=0,0,((D23/C23)*100)-100) -> 0 | L23: =IF(D23=0,0,IF(E23=0,0,((D23/E23)*100)-100)) -> 0 | M23: =IF(G23=0,0,((D23/G23)*100)-100) -> 0 | N23: =IF(H23=0,0,((D23/H23)*100)-100) -> 0 | O23: =IF(D23=0,0,IF(I23=0,0,((D23/I23)*100)-100)) -> 0 | Q23: 0 | R23: =IF(Q23=0,0,IF(D23=0,0,((D23/Q23)*100)-100)) -> 0 | S23: =IF(D23=0,0,(D23/$D$36)*100) -> 0 | U23: 0 | V23: 0
A24: Total Super | C24: =SUM(C7:C23) -> 23175000 | D24: =SUM(D7:D23) -> 20762425 | E24: =SUM(E7:E23) -> 21014839 | G24: =SUM(G7:G23) -> 22213633 | H24: =SUM(H7:H23) -> 25480961 | I24: =SUM(I7:I23) -> 23149307 | J24: =SUM(C24:I24) -> 135796165 | K24: =IF(D24=0,0,((D24/C24)*100)-100) -> -10.41 | L24: =IF(D24=0,0,IF(E24=0,0,((D24/E24)*100)-100)) -> -1.2 | M24: =IF(G24=0,0,IF(D24=0,0,((D24/G24)*100)-100)) -> -6.53 | N24: =IF(H24=0,0,IF(D24=0,0,((D24/H24)*100)-100)) -> -18.52 | O24: =IF(D24=0,0,IF(I24=0,0,((D24/I24)*100)-100)) -> -10.31 | Q24: =SUM(Q7:Q23) -> 23015000 | R24: =IF(D24=0,0,((D24/Q24)*100)-100) -> -9.79 | S24: =IF(D24=0,0,(D24/$D$36)*100) -> 37.37 | U24: 17.02 | V24: 17.13
A26: Pinheirinho | C26: 2900000 | D26: 2601037 | E26: 2566516 | G26: 1843454 | H26: 2135571 | I26: 1866151 | K26: =IF(C26=0,0,((D26/C26)*100)-100) -> -10.31 | L26: =IF(D26=0,0,IF(E26=0,0,((D26/E26)*100)-100)) -> 1.35 | M26: =IF(G26=0,0,((D26/G26)*100)-100) -> 41.1 | N26: =IF(H26=0,0,((D26/H26)*100)-100) -> 21.8 | O26: =IF(D26=0,0,IF(I26=0,0,((D26/I26)*100)-100)) -> 39.38 | Q26: 2900000 | R26: =IF(D26=0,0,IF(Q26=0,0,((D26/Q26)*100)-100)) -> -10.31 | S26: =IF(D26=0,0,(D26/$D$36)*100) -> 4.68 | U26: 16.1 | V26: 15.68
A27: Londrina | C27: 2900000 | D27: 2756443 | E27: 2674747 | G27: 2708230 | H27: 2254586 | I27: 2280901 | K27: =IF(C27=0,0,((D27/C27)*100)-100) -> -4.95 | L27: =IF(D27=0,0,IF(E27=0,0,((D27/E27)*100)-100)) -> 3.05 | M27: =IF(G27=0,0,((D27/G27)*100)-100) -> 1.78 | N27: =IF(H27=0,0,((D27/H27)*100)-100) -> 22.26 | O27: =IF(D27=0,0,IF(I27=0,0,((D27/I27)*100)-100)) -> 20.85 | Q27: 2900000 | R27: =IF(D27=0,0,IF(Q27=0,0,((D27/Q27)*100)-100)) -> -4.95 | S27: =IF(D27=0,0,(D27/$D$36)*100) -> 4.96 | U27: 15.61 | V27: 15.56
A28: S.J. Pinhais | C28: 4200000 | D28: 3838941 | E28: 3844127 | G28: 4133458 | H28: 4422237 | I28: 4038347 | K28: =IF(C28=0,0,((D28/C28)*100)-100) -> -8.6 | L28: =IF(D28=0,0,IF(E28=0,0,((D28/E28)*100)-100)) -> -0.13 | M28: =IF(G28=0,0,((D28/G28)*100)-100) -> -7.13 | N28: =IF(H28=0,0,((D28/H28)*100)-100) -> -13.19 | O28: =IF(D28=0,0,IF(I28=0,0,((D28/I28)*100)-100)) -> -4.94 | Q28: 4200000 | R28: =IF(D28=0,0,IF(Q28=0,0,((D28/Q28)*100)-100)) -> -8.6 | S28: =IF(D28=0,0,(D28/$D$36)*100) -> 6.91 | U28: 16.2 | V28: 16.36
A29: P.G. Nova | C29: 3700000 | D29: 3354039 | E29: 3436033 | G29: 3501253 | H29: 3487523 | I29: 2860146 | K29: =IF(C29=0,0,((D29/C29)*100)-100) -> -9.35 | L29: =IF(D29=0,0,IF(E29=0,0,((D29/E29)*100)-100)) -> -2.39 | M29: =IF(G29=0,0,((D29/G29)*100)-100) -> -4.2 | N29: =IF(H29=0,0,((D29/H29)*100)-100) -> -3.83 | O29: =IF(D29=0,0,IF(I29=0,0,((D29/I29)*100)-100)) -> 17.27 | Q29: 3700000 | R29: =IF(D29=0,0,IF(Q29=0,0,((D29/Q29)*100)-100)) -> -9.35 | S29: =IF(D29=0,0,(D29/$D$36)*100) -> 6.04 | U29: 16.4 | V29: 17.03
A30: Nilo Pecanha | C30: 9100000 | D30: 8813869 | E30: 8779151 | G30: 9047119 | H30: 8727528 | I30: 8253285 | K30: =IF(C30=0,0,((D30/C30)*100)-100) -> -3.14 | L30: =IF(D30=0,0,IF(E30=0,0,((D30/E30)*100)-100)) -> 0.4 | M30: =IF(G30=0,0,((D30/G30)*100)-100) -> -2.58 | N30: =IF(H30=0,0,((D30/H30)*100)-100) -> 0.99 | O30: =IF(D30=0,0,IF(I30=0,0,((D30/I30)*100)-100)) -> 6.79 | Q30: 9100000 | R30: =IF(D30=0,0,IF(Q30=0,0,((D30/Q30)*100)-100)) -> -3.14 | S30: =IF(D30=0,0,(D30/$D$36)*100) -> 15.87 | U30: 16.3 | V30: 16.17
A31: Champagnat | C31: 5800000 | D31: 5225812 | E31: 5275736 | G31: 5728788 | H31: 5000066 | I31: 0 | K31: =IF(C31=0,0,((D31/C31)*100)-100) -> -9.9 | L31: =IF(D31=0,0,IF(E31=0,0,((D31/E31)*100)-100)) -> -0.95 | M31: =IF(G31=0,0,((D31/G31)*100)-100) -> -8.78 | N31: =IF(H31=0,0,((D31/H31)*100)-100) -> 4.51 | O31: =IF(D31=0,0,IF(I31=0,0,((D31/I31)*100)-100)) -> 0 | Q31: 5800000 | R31: =IF(D31=0,0,IF(Q31=0,0,((D31/Q31)*100)-100)) -> -9.9 | S31: =IF(D31=0,0,(D31/$D$36)*100) -> 9.41 | U31: 16.4 | V31: 17.1
A32: Santa Candida | C32: 4500000 | D32: 3888123 | E32: 3908014 | G32: 4411558 | H32: 0 | I32: 0 | K32: =IF(C32=0,0,((D32/C32)*100)-100) -> -13.6 | L32: =IF(D32=0,0,IF(E32=0,0,((D32/E32)*100)-100)) -> -0.51 | M32: =IF(G32=0,0,((D32/G32)*100)-100) -> -11.87 | N32: =IF(H32=0,0,((D32/H32)*100)-100) -> 0 | O32: =IF(D32=0,0,IF(I32=0,0,((D32/I32)*100)-100)) -> 0 | Q32: 4500000 | R32: =IF(D32=0,0,IF(Q32=0,0,((D32/Q32)*100)-100)) -> -13.6 | S32: =IF(D32=0,0,(D32/$D$36)*100) -> 7 | U32: 16.38 | V32: 16.49
A33: Paranagu Raia | C33: 4700000 | D33: 4312512 | E33: 4119756 | G33: 4008658 | H33: 0 | I33: 0 | K33: =IF(C33=0,0,((D33/C33)*100)-100) -> -8.24 | L33: =IF(D33=0,0,IF(E33=0,0,((D33/E33)*100)-100)) -> 4.68 | M33: =IF(G33=0,0,((D33/G33)*100)-100) -> 7.58 | N33: =IF(H33=0,0,((D33/H33)*100)-100) -> 0 | O33: =IF(D33=0,0,IF(I33=0,0,((D33/I33)*100)-100)) -> 0 | Q33: 4700000 | R33: =IF(D33=0,0,IF(Q33=0,0,((D33/Q33)*100)-100)) -> -8.24 | S33: =IF(D33=0,0,(D33/$D$36)*100) -> 7.76 | U33: 16.3 | V33: 17.2
A34: Total Hiper | C34: =SUM(C26:C33) -> 37800000 | D34: =SUM(D26:D33) -> 34790776 | E34: =SUM(E26:E33) -> 34604080 | G34: =SUM(G26:G33) -> 35382518 | H34: =SUM(H26:H33) -> 26027511 | I34: =SUM(I26:I33) -> 19298830 | J34: =SUM(C34:I34) -> 187903715 | K34: =IF(D34=0,0,((D34/C34)*100)-100) -> -7.96 | L34: =IF(D34=0,0,IF(E34=0,0,((D34/E34)*100)-100)) -> 0.54 | M34: =IF(G34=0,0,IF(D34=0,0,((D34/G34)*100)-100)) -> -1.67 | N34: =IF(H34=0,0,IF(D34=0,0,((D34/H34)*100)-100)) -> 33.67 | O34: =IF(D34=0,0,IF(I34=0,0,((D34/I34)*100)-100)) -> 80.27 | Q34: =SUM(Q26:Q33) -> 37800000 | R34: =IF(D34=0,0,((D34/Q34)*100)-100) -> -7.96 | S34: =IF(D34=0,0,(D34/$D$36)*100) -> 62.63 | U34: 16.27 | V34: 16.56
A36: Total Geral | C36: =C24+C34 -> 60975000 | D36: =D24+D34 -> 55553201 | E36: =E24+E34 -> 55618919 | G36: =G24+G34 -> 57596151 | H36: =H24+H34 -> 51508472 | I36: =I24+I34 -> 42448137 | K36: =IF(D36=0,0,((D36/C36)*100)-100) -> -8.89 | L36: =IF(D36=0,0,IF(E36=0,0,((D36/E36)*100)-100)) -> -0.12 | M36: =IF(G36=0,0,IF(D36=0,0,((D36/G36)*100)-100)) -> -3.55 | N36: =IF(H36=0,0,IF(D36=0,0,((D36/H36)*100)-100)) -> 7.85 | O36: =IF(D36=0,0,IF(I36=0,0,((D36/I36)*100)-100)) -> 30.87 | Q36: =Q24+Q34 -> 60815000 | R36: =IF(D36=0,0,((D36/Q36)*100)-100) -> -8.65 | S36: =S24+S34 -> 100 | U36: 16.59 | V36: 16.8
C37: Resumo por Regiao - Outubro/2002
C38: Descricao das Aberturas | H38: Valor | I38: %
C39: Curitiba (2,3,6,7,10,11,13,17,21,22) | H39: =D7+D8+D11+D12+D14+D16+D17+D19+D30+D31+D33+D26 -> 31220090 | I39: =IF(D36=0,0,H39/$D$36) -> 0.56200000000000006
C40: Curitiba e Metrop. (Ctba. 4,5,8,13,14,23) | H40: =H39+D9+D10+D13+D17+D29+D22 -> 40938679 | I40: =IF(D36=0,0,H40/$D$36) -> 0.7369
C41: Metropolitana (4,5,8,14,23) | H41: =H40-H39 -> 9718589 | I41: =IF(D36=0,0,H41/$D$36) -> 0.1749
C42: Norte (9,15,20) | H42: =D27+D18+D21 -> 6540344 | I42: =IF(D36=0,0,H42/$D$36) -> 0.1177
C43: Ponta Grossa (18,19) | H43: =D20+D29 -> 4822667 | I43: =IF(D36=0,0,H43/$D$36) -> 8.6800000000000002E-2
C44: Super (2,3,4,5,6,7,8,10,11,13,15,17,18,20,23) | H44: =D24 -> 20762425 | I44: =IF(D36=0,0,H44/$D$36) -> 0.37369999999999998
C45: Hiper (6,9,14,19,21,22,24) | H45: =D34 -> 34790776 | I45: =IF(D36=0,0,H45/$D$36) -> 0.62629999999999997
C46: Curitiba, Metropolitana e Ponta Grossa | H46: =D36-H42 -> 49012857 | I46: =IF(D36=0,0,H46/$D$36) -> 0.88229999999999997
C47: Araucaria | H47: =D10+D22 -> 2831081 | I47: =IF(D36=0,0,H47/$D$36) -> 5.0999999999999997E-2