A2: Periodo: | C2: 38108 | D2: a | E2: 38138 | H2: Vendas Acumuladas por Filial | Q2: =NOW() -> 38483.427385995397
A4: v.1 | C4: Vendas 2004 | G4: Vendas de Anos Anteriores | K4: Percentuais ( % ) | Q4: Meta Mensal | U4: Margem
A5: Lojas | C5: Previsao | D5: Realizada | E5: Mes Anterior | G5: Vendas 2003 | H5: Vendas 2002 | I5: Vendas 2001 | K5: % Prev | L5: % MA | M5: 2003 | N5: 2002 | O5: 2001 | Q5: Previsao Mes | R5: Final | S5: Part. | U5: Meta | V5: Real
A7: Xaxim | C7: 740000 | D7: 713750 | E7: 805540 | G7: 717557 | H7: 565081 | I7: 480844 | K7: =IF(C7=0,0,((D7/C7)*100)-100) -> -3.55 | L7: =IF(D7=0,0,IF(E7=0,0,((D7/E7)*100)-100)) -> -11.39 | M7: =IF(G7=0,0,((D7/G7)*100)-100) -> -00.53 | N7: =IF(H7=0,0,((D7/H7)*100)-100) -> 26.31 | O7: =IF(D7=0,0,IF(I7=0,0,((D7/I7)*100)-100)) -> 48.44 | Q7: 740000 | R7: =IF(D7=0,0,((D7/Q7)*100)-100) -> -3.55 | S7: =IF(D7=0,0,(D7/$D$34)*100) -> 1.52 | U7: 16.45 | V7: 16.43
A8: S. Felicidade | C8: 720000 | D8: 650037 | E8: 713656 | G8: 786952 | H8: 515654 | I8: 544150 | K8: =IF(C8=0,0,((D8/C8)*100)-100) -> -9.72 | L8: =IF(D8=0,0,IF(E8=0,0,((D8/E8)*100)-100)) -> -8.91 | M8: =IF(G8=0,0,((D8/G8)*100)-100) -> -17.4 | N8: =IF(H8=0,0,((D8/H8)*100)-100) -> 26.06 | O8: =IF(D8=0,0,IF(I8=0,0,((D8/I8)*100)-100)) -> 19.46 | Q8: 720000 | R8: =IF(D8=0,0,((D8/Q8)*100)-100) -> -9.72 | S8: =IF(D8=0,0,(D8/$D$34)*100) -> 1.38 | U8: 17.29 | V8: 17.96
A9: Lapa | C9: 1187000 | D9: 1074434 | E9: 1215860 | G9: 1056313 | H9: 830517 | I9: 663682 | K9: =IF(C9=0,0,((D9/C9)*100)-100) -> -9.48 | L9: =IF(D9=0,0,IF(E9=0,0,((D9/E9)*100)-100)) -> -11.63 | M9: =IF(G9=0,0,((D9/G9)*100)-100) -> 1.72 | N9: =IF(H9=0,0,((D9/H9)*100)-100) -> 29.37 | O9: =IF(D9=0,0,IF(I9=0,0,((D9/I9)*100)-100)) -> 61.89 | Q9: 1187000 | R9: =IF(D9=0,0,((D9/Q9)*100)-100) -> -9.48 | S9: =IF(D9=0,0,(D9/$D$34)*100) -> 2.28 | U9: 16.05 | V9: 16.14
A10: Araucaria | C10: 1100000 | D10: 1024926 | E10: 1104134 | G10: 1099845 | H10: 1479227 | I10: 1349044 | K10: =IF(C10=0,0,((D10/C10)*100)-100) -> -6.82 | L10: =IF(D10=0,0,IF(E10=0,0,((D10/E10)*100)-100)) -> -7.17 | M10: =IF(G10=0,0,((D10/G10)*100)-100) -> -6.81 | N10: =IF(H10=0,0,((D10/H10)*100)-100) -> -30.71 | O10: =IF(D10=0,0,IF(I10=0,0,((D10/I10)*100)-100)) -> -24.03 | Q10: 1100000 | R10: =IF(D10=0,0,((D10/Q10)*100)-100) -> -6.82 | S10: =IF(D10=0,0,(D10/$D$34)*100) -> 2.18 | U10: 17.3 | V10: 17.23
A11: Pinheirinho | C11: 2200000 | D11: 1876577 | E11: 2097557 | G11: 1964985 | H11: 1631159 | I11: 1548718 | K11: =IF(C11=0,0,((D11/C11)*100)-100) -> -14.7 | L11: =IF(D11=0,0,IF(E11=0,0,((D11/E11)*100)-100)) -> -10.54 | M11: =IF(G11=0,0,((D11/G11)*100)-100) -> -4.5 | N11: =IF(H11=0,0,((D11/H11)*100)-100) -> 15.05 | O11: =IF(D11=0,0,IF(I11=0,0,((D11/I11)*100)-100)) -> 21.17 | Q11: 2200000 | R11: =IF(D11=0,0,((D11/Q11)*100)-100) -> -14.7 | S11: =IF(D11=0,0,(D11/$D$34)*100) -> 3.99 | U11: 16 | V11: 16.03
A12: Hauer | C12: 3100000 | D12: 2801803 | E12: 3019480 | G12: 2926180 | H12: 2385161 | I12: 2147705 | K12: =IF(C12=0,0,((D12/C12)*100)-100) -> -9.62 | L12: =IF(D12=0,0,IF(E12=0,0,((D12/E12)*100)-100)) -> -7.21 | M12: =IF(G12=0,0,((D12/G12)*100)-100) -> -4.25 | N12: =IF(H12=0,0,((D12/H12)*100)-100) -> 17.47 | O12: =IF(D12=0,0,IF(I12=0,0,((D12/I12)*100)-100)) -> 30.46 | Q12: 3100000 | R12: =IF(D12=0,0,((D12/Q12)*100)-100) -> -9.62 | S12: =IF(D12=0,0,(D12/$D$34)*100) -> 5.96 | U12: 16.1 | V12: 17.04
A13: Paranagua | C13: 3334000 | D13: 3104473 | E13: 3511810 | G13: 3030035 | H13: 2563014 | I13: 2234198 | K13: =IF(C13=0,0,((D13/C13)*100)-100) -> -6.88 | L13: =IF(D13=0,0,IF(E13=0,0,((D13/E13)*100)-100)) -> -11.6 | M13: =IF(G13=0,0,((D13/G13)*100)-100) -> 2.46 | N13: =IF(H13=0,0,((D13/H13)*100)-100) -> 21.13 | O13: =IF(D13=0,0,IF(I13=0,0,((D13/I13)*100)-100)) -> 38.95 | Q13: 3334000 | R13: =IF(D13=0,0,((D13/Q13)*100)-100) -> -6.88 | S13: =IF(D13=0,0,(D13/$D$34)*100) -> 6.6 | U13: 17 | V13: 18.29
A14: Centenario | C14: 970000 | D14: 847250 | E14: 949309 | G14: 954235 | H14: 727275 | I14: 613722 | K14: =IF(C14=0,0,((D14/C14)*100)-100) -> -12.65 | L14: =IF(D14=0,0,IF(E14=0,0,((D14/E14)*100)-100)) -> -10.75 | M14: =IF(G14=0,0,((D14/G14)*100)-100) -> -11.21 | N14: =IF(H14=0,0,((D14/H14)*100)-100) -> 16.5 | O14: =IF(D14=0,0,IF(I14=0,0,((D14/I14)*100)-100)) -> 38.05 | Q14: 970000 | R14: =IF(D14=0,0,((D14/Q14)*100)-100) -> -12.65 | S14: =IF(D14=0,0,(D14/$D$34)*100) -> 1.8 | U14: 16.85 | V14: 16.68
A15: Arapongas | C15: 0 | D15: 0 | E15: 0 | G15: 0 | H15: 0 | I15: 0 | K15: =IF(C15=0,0,((D15/C15)*100)-100) -> 0 | L15: =IF(D15=0,0,IF(E15=0,0,((D15/E15)*100)-100)) -> 0 | M15: =IF(D15=0,0,IF(G15=0,0,((D15/G15)*100)-100)) -> 0 | N15: =IF(D15=0,0,IF(H15=0,0,((D15/H15)*100)-100)) -> 0 | O15: =IF(D15=0,0,IF(I15=0,0,((D15/I15)*100)-100)) -> 0 | Q15: 0 | R15: =IF(D15=0,0,((D15/Q15)*100)-100) -> 0 | S15: =IF(D15=0,0,(D15/$D$34)*100) -> 0 | U15: 0 | V15: 0
A16: Sao Braz | C16: 3317000 | D16: 2919242 | E16: 2976538 | G16: 3163213 | H16: 2408074 | I16: 2372515 | K16: =IF(C16=0,0,((D16/C16)*100)-100) -> -11.99 | L16: =IF(D16=0,0,IF(E16=0,0,((D16/E16)*100)-100)) -> -1.92 | M16: =IF(G16=0,0,((D16/G16)*100)-100) -> -7.71 | N16: =IF(H16=0,0,((D16/H16)*100)-100) -> 21.23 | O16: =IF(D16=0,0,IF(I16=0,0,((D16/I16)*100)-100)) -> 23.04 | Q16: 3317000 | R16: =IF(D16=0,0,((D16/Q16)*100)-100) -> -11.99 | S16: =IF(D16=0,0,(D16/$D$34)*100) -> 6.21 | U16: 16.65 | V16: 16.59
A17: Guarapuava | C17: 1550000 | D17: 1374627 | E17: 1751058 | G17: 1380337 | H17: 795625 | I17: 772041 | K17: =IF(C17=0,0,((D17/C17)*100)-100) -> -11.31 | L17: =IF(D17=0,0,IF(E17=0,0,((D17/E17)*100)-100)) -> -21.5 | M17: =IF(G17=0,0,((D17/G17)*100)-100) -> -00.41 | N17: =IF(H17=0,0,((D17/H17)*100)-100) -> 72.77 | O17: =IF(D17=0,0,IF(I17=0,0,((D17/I17)*100)-100)) -> 78.05 | Q17: 1550000 | R17: =IF(D17=0,0,((D17/Q17)*100)-100) -> -11.31 | S17: =IF(D17=0,0,(D17/$D$34)*100) -> 2.92 | U17: 17.02 | V17: 17.14
A18: Apucarana | C18: 1480000 | D18: 1320974 | E18: 1641009 | G18: 1321561 | H18: 1124216 | I18: 1089393 | K18: =IF(C18=0,0,((D18/C18)*100)-100) -> -10.75 | L18: =IF(D18=0,0,IF(E18=0,0,((D18/E18)*100)-100)) -> -19.5 | M18: =IF(G18=0,0,((D18/G18)*100)-100) -> -00.04 | N18: =IF(H18=0,0,((D18/H18)*100)-100) -> 17.5 | O18: =IF(D18=0,0,IF(I18=0,0,((D18/I18)*100)-100)) -> 21.26 | Q18: 1480000 | R18: =IF(D18=0,0,((D18/Q18)*100)-100) -> -10.75 | S18: =IF(D18=0,0,(D18/$D$34)*100) -> 2.81 | U18: 17 | V18: 19.04
A19: Ahu | C19: 1200000 | D19: 1034805 | E19: 1096104 | G19: 1330141 | H19: 1031374 | I19: 1083019 | K19: =IF(C19=0,0,((D19/C19)*100)-100) -> -13.77 | L19: =IF(D19=0,0,IF(E19=0,0,((D19/E19)*100)-100)) -> -5.59 | M19: =IF(G19=0,0,((D19/G19)*100)-100) -> -22.2 | N19: =IF(H19=0,0,((D19/H19)*100)-100) -> 00.33 | O19: =IF(D19=0,0,IF(I19=0,0,((D19/I19)*100)-100)) -> -4.45 | Q19: 1200000 | R19: =IF(D19=0,0,((D19/Q19)*100)-100) -> -13.77 | S19: =IF(D19=0,0,(D19/$D$34)*100) -> 2.2 | U19: 18.1 | V19: 17.01
A20: P.G. Centro | C20: 1750000 | D20: 1601128 | E20: 1799929 | G20: 1645181 | H20: 1244340 | I20: 1065208 | K20: =IF(C20=0,0,((D20/C20)*100)-100) -> -8.51 | L20: =IF(D20=0,0,IF(E20=0,0,((D20/E20)*100)-100)) -> -11.04 | M20: =IF(G20=0,0,((D20/G20)*100)-100) -> -2.68 | N20: =IF(H20=0,0,((D20/H20)*100)-100) -> 28.67 | O20: =IF(D20=0,0,IF(I20=0,0,((D20/I20)*100)-100)) -> 50.31 | Q20: 1750000 | R20: =IF(D20=0,0,((D20/Q20)*100)-100) -> -8.51 | S20: =IF(D20=0,0,(D20/$D$34)*100) -> 3.41 | U20: 17.5 | V20: 18.66
A21: Maringa | C21: 2260000 | D21: 1999804 | E21: 2332592 | G21: 2035446 | H21: 1584197 | I21: 1623201 | K21: =IF(C21=0,0,((D21/C21)*100)-100) -> -11.51 | L21: =IF(D21=0,0,IF(E21=0,0,((D21/E21)*100)-100)) -> -14.27 | M21: =IF(G21=0,0,((D21/G21)*100)-100) -> -1.75 | N21: =IF(H21=0,0,((D21/H21)*100)-100) -> 26.23 | O21: =IF(D21=0,0,IF(I21=0,0,((D21/I21)*100)-100)) -> 23.2 | Q21: 2260000 | R21: =IF(D21=0,0,((D21/Q21)*100)-100) -> -11.51 | S21: =IF(D21=0,0,(D21/$D$34)*100) -> 4.25 | U21: 17.74 | V21: 18.48
A22: Araucaria Nova | C22: 2100000 | D22: 2036417 | E22: 2110050 | G22: 2025173 | H22: 0 | I22: 0 | K22: =IF(C22=0,0,((D22/C22)*100)-100) -> -3.03 | L22: =IF(D22=0,0,IF(E22=0,0,((D22/E22)*100)-100)) -> -3.49 | M22: =IF(G22=0,0,((D22/G22)*100)-100) -> 00.56 | N22: =IF(H22=0,0,((D22/H22)*100)-100) -> 0 | O22: =IF(D22=0,0,IF(I22=0,0,((D22/I22)*100)-100)) -> 0 | Q22: 2100000 | R22: =IF(D22=0,0,((D22/Q22)*100)-100) -> -3.03 | S22: =IF(D22=0,0,(D22/$D$34)*100) -> 4.33 | U22: 17 | V22: 17.59
A23: Total Super | C23: =SUM(C7:C22) -> 27008000 | D23: =SUM(D7:D22) -> 24380247 | E23: =SUM(E7:E22) -> 27124626 | G23: =SUM(G7:G22) -> 25437154 | H23: =SUM(H7:H22) -> 18884914 | I23: =SUM(I7:I22) -> 17587440 | J23: =SUM(C23:I23) -> 140422381 | K23: =IF(D23=0,0,((D23/C23)*100)-100) -> -9.73 | L23: =IF(D23=0,0,IF(E23=0,0,((D23/E23)*100)-100)) -> -10.12 | M23: =IF(G23=0,0,IF(D23=0,0,((D23/G23)*100)-100)) -> -4.15 | N23: =IF(H23=0,0,IF(D23=0,0,((D23/H23)*100)-100)) -> 29.1 | O23: =IF(D23=0,0,IF(I23=0,0,((D23/I23)*100)-100)) -> 38.62 | Q23: =SUM(Q7:Q22) -> 27008000 | R23: =IF(D23=0,0,((D23/Q23)*100)-100) -> -9.73 | S23: =IF(D23=0,0,(D23/$D$34)*100) -> 51.85 | U23: 16.11 | V23: 17.41
A25: Londrina | C25: 2464000 | D25: 2260669 | E25: 2344414 | G25: 2230622 | H25: 2111241 | I25: 2065685 | K25: =IF(C25=0,0,((D25/C25)*100)-100) -> -8.25 | L25: =IF(D25=0,0,IF(E25=0,0,((D25/E25)*100)-100)) -> -3.57 | M25: =IF(G25=0,0,((D25/G25)*100)-100) -> 1.35 | N25: =IF(H25=0,0,((D25/H25)*100)-100) -> 7.08 | O25: =IF(D25=0,0,IF(I25=0,0,((D25/I25)*100)-100)) -> 9.44 | Q25: 2464000 | R25: =IF(D25=0,0,IF(Q25=0,0,((D25/Q25)*100)-100)) -> -8.25 | S25: =IF(D25=0,0,(D25/$D$34)*100) -> 4.81 | U25: 17.8 | V25: 16.52
A26: S.J. Pinhais | C26: 4500000 | D26: 4106455 | E26: 4259322 | G26: 4095351 | H26: 3326194 | I26: 2658379 | K26: =IF(C26=0,0,((D26/C26)*100)-100) -> -8.75 | L26: =IF(D26=0,0,IF(E26=0,0,((D26/E26)*100)-100)) -> -3.59 | M26: =IF(G26=0,0,((D26/G26)*100)-100) -> 00.27 | N26: =IF(H26=0,0,((D26/H26)*100)-100) -> 23.46 | O26: =IF(D26=0,0,IF(I26=0,0,((D26/I26)*100)-100)) -> 54.47 | Q26: 4500000 | R26: =IF(D26=0,0,IF(Q26=0,0,((D26/Q26)*100)-100)) -> -8.75 | S26: =IF(D26=0,0,(D26/$D$34)*100) -> 8.73 | U26: 16.2 | V26: 16.18
A27: P.G. Nova | C27: 3400000 | D27: 3147362 | E27: 3435618 | G27: 3081480 | H27: 2720901 | I27: 2131909 | K27: =IF(C27=0,0,((D27/C27)*100)-100) -> -7.43 | L27: =IF(D27=0,0,IF(E27=0,0,((D27/E27)*100)-100)) -> -8.39 | M27: =IF(G27=0,0,((D27/G27)*100)-100) -> 2.14 | N27: =IF(H27=0,0,((D27/H27)*100)-100) -> 15.67 | O27: =IF(D27=0,0,IF(I27=0,0,((D27/I27)*100)-100)) -> 47.63 | Q27: 3400000 | R27: =IF(D27=0,0,IF(Q27=0,0,((D27/Q27)*100)-100)) -> -7.43 | S27: =IF(D27=0,0,(D27/$D$34)*100) -> 6.69 | U27: 16.12 | V27: 16.91
A28: Nilo Pecanha | C28: 8350000 | D28: 8054371 | E28: 7829163 | G28: 8453240 | H28: 6043686 | I28: 0 | K28: =IF(C28=0,0,((D28/C28)*100)-100) -> -3.54 | L28: =IF(D28=0,0,IF(E28=0,0,((D28/E28)*100)-100)) -> 2.88 | M28: =IF(G28=0,0,((D28/G28)*100)-100) -> -4.72 | N28: =IF(H28=0,0,((D28/H28)*100)-100) -> 33.27 | O28: =IF(D28=0,0,IF(I28=0,0,((D28/I28)*100)-100)) -> 0 | Q28: 8350000 | R28: =IF(D28=0,0,IF(Q28=0,0,((D28/Q28)*100)-100)) -> -3.54 | S28: =IF(D28=0,0,(D28/$D$34)*100) -> 17.13 | U28: 15.9 | V28: 15.61
A29: Champagnat | C29: 5700000 | D29: 5072944 | E29: 5507896 | G29: 0 | H29: 0 | I29: 0 | K29: =IF(C29=0,0,((D29/C29)*100)-100) -> -11 | L29: =IF(D29=0,0,IF(E29=0,0,((D29/E29)*100)-100)) -> -7.9 | M29: =IF(G29=0,0,((D29/G29)*100)-100) -> 0 | N29: =IF(H29=0,0,((D29/H29)*100)-100) -> 0 | O29: =IF(D29=0,0,IF(I29=0,0,((D29/I29)*100)-100)) -> 0 | Q29: 5700000 | R29: =IF(D29=0,0,IF(Q29=0,0,((D29/Q29)*100)-100)) -> -11 | S29: =IF(D29=0,0,(D29/$D$34)*100) -> 10.79 | U29: 14.03 | V29: 12.68
A30: Santa Candida | C30: 0 | D30: 0 | E30: 0 | G30: 0 | H30: 0 | I30: 0 | K30: =IF(C30=0,0,((D30/C30)*100)-100) -> 0 | L30: =IF(D30=0,0,IF(E30=0,0,((D30/E30)*100)-100)) -> 0 | M30: =IF(G30=0,0,((D30/G30)*100)-100) -> 0 | N30: =IF(H30=0,0,((D30/H30)*100)-100) -> 0 | O30: =IF(D30=0,0,IF(I30=0,0,((D30/I30)*100)-100)) -> 0 | Q30: 0 | R30: =IF(D30=0,0,IF(Q30=0,0,((D30/Q30)*100)-100)) -> 0 | S30: =IF(D30=0,0,(D30/$D$34)*100) -> 0 | U30: 0 | V30: 0
A31: Paranagu Raia | C31: 0 | D31: 0 | E31: 0 | G31: 0 | H31: 0 | I31: 0 | K31: =IF(C31=0,0,((D31/C31)*100)-100) -> 0 | L31: =IF(D31=0,0,IF(E31=0,0,((D31/E31)*100)-100)) -> 0 | M31: =IF(G31=0,0,((D31/G31)*100)-100) -> 0 | N31: =IF(H31=0,0,((D31/H31)*100)-100) -> 0 | O31: =IF(D31=0,0,IF(I31=0,0,((D31/I31)*100)-100)) -> 0 | Q31: 0 | R31: =IF(D31=0,0,IF(Q31=0,0,((D31/Q31)*100)-100)) -> 0 | S31: =IF(D31=0,0,(D31/$D$34)*100) -> 0 | U31: 0 | V31: 0
A32: Total Hiper | C32: =SUM(C25:C31) -> 24414000 | D32: =SUM(D25:D31) -> 22641801 | E32: =SUM(E25:E31) -> 23376413 | G32: =SUM(G25:G31) -> 17860693 | H32: =SUM(H25:H31) -> 14202022 | I32: =SUM(I25:I31) -> 6855973 | J32: =SUM(C32:I32) -> 109350902 | K32: =IF(D32=0,0,((D32/C32)*100)-100) -> -7.26 | L32: =IF(D32=0,0,IF(E32=0,0,((D32/E32)*100)-100)) -> -3.14 | M32: =IF(G32=0,0,IF(D32=0,0,((D32/G32)*100)-100)) -> 26.77 | N32: =IF(H32=0,0,IF(D32=0,0,((D32/H32)*100)-100)) -> 59.43 | O32: =IF(D32=0,0,IF(I32=0,0,((D32/I32)*100)-100)) -> 230.25 | Q32: =SUM(Q25:Q31) -> 24414000 | R32: =IF(D32=0,0,((D32/Q32)*100)-100) -> -7.26 | S32: =IF(D32=0,0,(D32/$D$34)*100) -> 48.15 | U32: 16.56 | V32: 15.32
A34: Total Geral | C34: =C23+C32 -> 51422000 | D34: =D23+D32 -> 47022048 | E34: =E23+E32 -> 50501039 | G34: =G23+G32 -> 43297847 | H34: =H23+H32 -> 33086936 | I34: =I23+I32 -> 24443413 | K34: =IF(D32=0,0,((D34/C34)*100)-100) -> -8.56 | L34: =IF(D34=0,0,IF(E34=0,0,((D34/E34)*100)-100)) -> -6.89 | M34: =IF(G34=0,0,IF(D34=0,0,((D34/G34)*100)-100)) -> 8.6 | N34: =IF(H34=0,0,IF(D34=0,0,((D34/H34)*100)-100)) -> 42.12 | O34: =IF(D34=0,0,IF(I34=0,0,((D34/I34)*100)-100)) -> 92.37 | Q34: =Q23+Q32 -> 51422000 | R34: =IF(D34=0,0,((D34/Q34)*100)-100) -> -8.56 | S34: =S23+S32 -> 100 | U34: 16.34 | V34: 16.41
C35: Resumo por Regiao - Outubro/2002
C36: Descricao das Aberturas | H36: Valor | I36: %
C37: Curitiba (2,3,6,7,10,11,17,21,22) | H37: =D7+D8+D11+D12+D14+D16+D19+D28+D29+D31 -> 23970779 | I37: =IF(D34=0,0,H37/$D$34) -> 0.50980000000000003
C38: Curitiba e Metrop. (Ctba. 4,5,8,14,23) | H38: =H37+D9+D10+D13+D27+D22 -> 34358391 | I38: =IF(D34=0,0,H38/$D$34) -> 0.73070000000000002
C39: Metropolitana (4,5,8,14,23) | H39: =H38-H37 -> 10387612 | I39: =IF(D34=0,0,H39/$D$34) -> 0.22090000000000001
C40: Norte (9,15,20) | H40: =D25+D18+D22 -> 5618060 | I40: =IF(D34=0,0,H40/$D$34) -> 0.1195
C41: Centro-Oeste (13,18,19) | H41: =D17+D20+D27 -> 6123117 | I41: =IF(D34=0,0,H41/$D$34) -> 0.13020000000000001
C42: Ponta Grossa (18,19) | H42: =H41-D17 -> 4748490 | I42: =IF(D34=0,0,H42/$D$34) -> 0.10100000000000001
C43: Super (2,3,4,5,6,7,8,10,11,13,15,17,18,20,23) | H43: =D23 -> 24380247 | I43: =IF(D34=0,0,H43/$D$34) -> 0.51849999999999996
C44: Hiper (9,14,19,21,22,24) | H44: =D32 -> 22641801 | I44: =IF(D34=0,0,H44/$D$34) -> 0.48149999999999998
C45: Curitiba, Metropolitana e Centro-Oeste | H45: =D34-H40 -> 41403988 | I45: =IF(D34=0,0,H45/$D$34) -> 0.88049999999999995
C46: Araucaria | H46: =D10+D22 -> 3061343 | I46: =IF(D34=0,0,H46/$D$34) -> 6.5100000000000005E-2