A2: Periodo: | C2: 39052 | D2: a | E2: 39082 | H2: Vendas Acumuladas por Filial | Q2: =NOW() -> 39097.426178819398
A4: v.1 | C4: Vendas 2006 | G4: Vendas de Anos Anteriores | K4: Percentuais ( % ) | Q4: Meta Mensal | U4: Margem
A5: Lojas | C5: Previsao | D5: Realizada | E5: Mes Anterior | G5: Vendas 2005 | H5: Vendas 2004 | I5: Vendas 2003 | K5: % Prev | L5: % MA | M5: 2005 | N5: 2004 | O5: 2003 | Q5: Previsao Mes | R5: Final | S5: Part. | U5: Meta | V5: Condor
A7: Xaxim | C7: 990000 | D7: 922447 | E7: 685769 | G7: 981107 | H7: 1001769 | I7: 911440 | K7: =IF(C7=0,0,((D7/C7)*100)-100) -> -6.82 | L7: =IF(D7=0,0,IF(E7=0,0,((D7/E7)*100)-100)) -> 34.51 | M7: =IF(G7=0,0,((D7/G7)*100)-100) -> -5.98 | N7: =IF(H7=0,0,((D7/H7)*100)-100) -> -7.92 | O7: =IF(D7=0,0,IF(I7=0,0,((D7/I7)*100)-100)) -> 1.21 | Q7: 990000 | R7: =IF(D7=0,0,((D7/Q7)*100)-100) -> -6.82 | S7: =IF(D7=0,0,(D7/$D$37)*100) -> 1.24 | U7: 16.28 | V7: 14.85
A8: S. Felicidade | C8: 950000 | D8: 942108 | E8: 755195 | G8: 995390 | H8: 945394 | I8: 904437 | K8: =IF(C8=0,0,((D8/C8)*100)-100) -> -0.83 | L8: =IF(D8=0,0,IF(E8=0,0,((D8/E8)*100)-100)) -> 24.75 | M8: =IF(G8=0,0,((D8/G8)*100)-100) -> -5.35 | N8: =IF(H8=0,0,((D8/H8)*100)-100) -> -0.35 | O8: =IF(D8=0,0,IF(I8=0,0,((D8/I8)*100)-100)) -> 4.17 | Q8: 950000 | R8: =IF(D8=0,0,((D8/Q8)*100)-100) -> -0.83 | S8: =IF(D8=0,0,(D8/$D$37)*100) -> 1.26 | U8: 16.5 | V8: 14.49
A9: Lapa | C9: 1600000 | D9: 1405810 | E9: 1045624 | G9: 1603316 | H9: 1477567 | I9: 1325987 | K9: =IF(C9=0,0,((D9/C9)*100)-100) -> -12.14 | L9: =IF(D9=0,0,IF(E9=0,0,((D9/E9)*100)-100)) -> 34.45 | M9: =IF(G9=0,0,((D9/G9)*100)-100) -> -12.32 | N9: =IF(H9=0,0,((D9/H9)*100)-100) -> -4.86 | O9: =IF(D9=0,0,IF(I9=0,0,((D9/I9)*100)-100)) -> 6.02 | Q9: 1600000 | R9: =IF(D9=0,0,((D9/Q9)*100)-100) -> -12.14 | S9: =IF(D9=0,0,(D9/$D$37)*100) -> 1.89 | U9: 16.25 | V9: 14.8
A10: Araucaria | C10: 1200000 | D10: 1127622 | E10: 951590 | G10: 1188414 | H10: 1217436 | I10: 1149818 | K10: =IF(C10=0,0,((D10/C10)*100)-100) -> -6.03 | L10: =IF(D10=0,0,IF(E10=0,0,((D10/E10)*100)-100)) -> 18.5 | M10: =IF(G10=0,0,((D10/G10)*100)-100) -> -5.12 | N10: =IF(H10=0,0,((D10/H10)*100)-100) -> -7.38 | O10: =IF(D10=0,0,IF(I10=0,0,((D10/I10)*100)-100)) -> -1.93 | Q10: 1200000 | R10: =IF(D10=0,0,((D10/Q10)*100)-100) -> -6.03 | S10: =IF(D10=0,0,(D10/$D$37)*100) -> 1.51 | U10: 17.55 | V10: 15.97
A11: Pinheirinho | C11: 0 | D11: 0 | E11: 0 | G11: 0 | H11: 0 | I11: 0 | K11: =IF(C11=0,0,((D11/C11)*100)-100) -> 0 | L11: =IF(D11=0,0,IF(E11=0,0,((D11/E11)*100)-100)) -> 0 | M11: =IF(G11=0,0,((D11/G11)*100)-100) -> 0 | N11: =IF(H11=0,0,((D11/H11)*100)-100) -> 0 | O11: =IF(D11=0,0,IF(I11=0,0,((D11/I11)*100)-100)) -> 0 | Q11: 0 | R11: =IF(D11=0,0,((D11/Q11)*100)-100) -> 0 | S11: =IF(D11=0,0,(D11/$D$37)*100) -> 0 | U11: 0 | V11: 0
A12: Hauer | C12: 4120000 | D12: 3740747 | E12: 2858825 | G12: 4067771 | H12: 4305640 | I12: 3612408 | K12: =IF(C12=0,0,((D12/C12)*100)-100) -> -9.21 | L12: =IF(D12=0,0,IF(E12=0,0,((D12/E12)*100)-100)) -> 30.85 | M12: =IF(G12=0,0,((D12/G12)*100)-100) -> -8.04 | N12: =IF(H12=0,0,((D12/H12)*100)-100) -> -13.12 | O12: =IF(D12=0,0,IF(I12=0,0,((D12/I12)*100)-100)) -> 3.55 | Q12: 4120000 | R12: =IF(D12=0,0,((D12/Q12)*100)-100) -> -9.21 | S12: =IF(D12=0,0,(D12/$D$37)*100) -> 5.02 | U12: 16.96 | V12: 16.19
A13: Paranagua | C13: 2235000 | D13: 2096973 | E13: 1511416 | G13: 2137266 | H13: 4734317 | I13: 4019754 | K13: =IF(C13=0,0,((D13/C13)*100)-100) -> -6.18 | L13: =IF(D13=0,0,IF(E13=0,0,((D13/E13)*100)-100)) -> 38.74 | M13: =IF(G13=0,0,((D13/G13)*100)-100) -> -1.89 | N13: =IF(H13=0,0,((D13/H13)*100)-100) -> -55.71 | O13: =IF(D13=0,0,IF(I13=0,0,((D13/I13)*100)-100)) -> -47.83 | Q13: 2235000 | R13: =IF(D13=0,0,((D13/Q13)*100)-100) -> -6.18 | S13: =IF(D13=0,0,(D13/$D$37)*100) -> 2.81 | U13: 17.4 | V13: 16.44
A14: Centenario | C14: 1220000 | D14: 1156486 | E14: 893567 | G14: 1212315 | H14: 1177519 | I14: 1083253 | K14: =IF(C14=0,0,((D14/C14)*100)-100) -> -5.21 | L14: =IF(D14=0,0,IF(E14=0,0,((D14/E14)*100)-100)) -> 29.42 | M14: =IF(G14=0,0,((D14/G14)*100)-100) -> -4.61 | N14: =IF(H14=0,0,((D14/H14)*100)-100) -> -1.79 | O14: =IF(D14=0,0,IF(I14=0,0,((D14/I14)*100)-100)) -> 6.76 | Q14: 1220000 | R14: =IF(D14=0,0,((D14/Q14)*100)-100) -> -5.21 | S14: =IF(D14=0,0,(D14/$D$37)*100) -> 1.55 | U14: 17.1 | V14: 14.77
A15: Sao Braz | C15: 4158000 | D15: 3799285 | E15: 3059997 | G15: 3979406 | H15: 4128995 | I15: 3851197 | K15: =IF(C15=0,0,((D15/C15)*100)-100) -> -8.63 | L15: =IF(D15=0,0,IF(E15=0,0,((D15/E15)*100)-100)) -> 24.16 | M15: =IF(G15=0,0,((D15/G15)*100)-100) -> -4.53 | N15: =IF(H15=0,0,((D15/H15)*100)-100) -> -7.99 | O15: =IF(D15=0,0,IF(I15=0,0,((D15/I15)*100)-100)) -> -1.35 | Q15: 4158000 | R15: =IF(D15=0,0,((D15/Q15)*100)-100) -> -8.63 | S15: =IF(D15=0,0,(D15/$D$37)*100) -> 5.1 | U15: 15.95 | V15: 14.59
A16: Sitio Cercado | C16: 1480000 | D16: 1654068 | E16: 1148940 | G16: 1801665 | H16: 2396301 | I16: 1789837 | K16: =IF(C16=0,0,((D16/C16)*100)-100) -> 11.76 | L16: =IF(D16=0,0,IF(E16=0,0,((D16/E16)*100)-100)) -> 43.96 | M16: =IF(G16=0,0,((D16/G16)*100)-100) -> -8.19 | N16: =IF(H16=0,0,((D16/H16)*100)-100) -> -30.97 | O16: =IF(D16=0,0,IF(I16=0,0,((D16/I16)*100)-100)) -> -7.59 | Q16: 1480000 | R16: =IF(D16=0,0,((D16/Q16)*100)-100) -> 11.76 | S16: =IF(D16=0,0,(D16/$D$37)*100) -> 2.22 | U16: 16.9 | V16: 14.71
A17: Apucarana | C17: 2700000 | D17: 2437091 | E17: 1652922 | G17: 2534044 | H17: 2332125 | I17: 1987508 | K17: =IF(C17=0,0,((D17/C17)*100)-100) -> -9.74 | L17: =IF(D17=0,0,IF(E17=0,0,((D17/E17)*100)-100)) -> 47.44 | M17: =IF(G17=0,0,((D17/G17)*100)-100) -> -3.83 | N17: =IF(H17=0,0,((D17/H17)*100)-100) -> 4.5 | O17: =IF(D17=0,0,IF(I17=0,0,((D17/I17)*100)-100)) -> 22.62 | Q17: 2700000 | R17: =IF(D17=0,0,((D17/Q17)*100)-100) -> -9.74 | S17: =IF(D17=0,0,(D17/$D$37)*100) -> 3.27 | U17: 15 | V17: 14.38
A18: Ahu | C18: 1560000 | D18: 1304102 | E18: 1060950 | G18: 1476110 | H18: 1363099 | I18: 1388111 | K18: =IF(C18=0,0,((D18/C18)*100)-100) -> -16.4 | L18: =IF(D18=0,0,IF(E18=0,0,((D18/E18)*100)-100)) -> 22.92 | M18: =IF(G18=0,0,((D18/G18)*100)-100) -> -11.65 | N18: =IF(H18=0,0,((D18/H18)*100)-100) -> -4.33 | O18: =IF(D18=0,0,IF(I18=0,0,((D18/I18)*100)-100)) -> -6.05 | Q18: 1560000 | R18: =IF(D18=0,0,((D18/Q18)*100)-100) -> -16.4 | S18: =IF(D18=0,0,(D18/$D$37)*100) -> 1.75 | U18: 17.46 | V18: 16.4
A19: P.G. Centro | C19: 2200000 | D19: 1909438 | E19: 1525109 | G19: 2042921 | H19: 2205951 | I19: 1998807 | K19: =IF(C19=0,0,((D19/C19)*100)-100) -> -13.21 | L19: =IF(D19=0,0,IF(E19=0,0,((D19/E19)*100)-100)) -> 25.2 | M19: =IF(G19=0,0,((D19/G19)*100)-100) -> -6.53 | N19: =IF(H19=0,0,((D19/H19)*100)-100) -> -13.44 | O19: =IF(D19=0,0,IF(I19=0,0,((D19/I19)*100)-100)) -> -4.47 | Q19: 2200000 | R19: =IF(D19=0,0,((D19/Q19)*100)-100) -> -13.21 | S19: =IF(D19=0,0,(D19/$D$37)*100) -> 2.56 | U19: 17.98 | V19: 17.52
A20: Maringa | C20: 3245000 | D20: 2493320 | E20: 2182257 | G20: 2937386 | H20: 2753746 | I20: 2235655 | K20: =IF(C20=0,0,((D20/C20)*100)-100) -> -23.16 | L20: =IF(D20=0,0,IF(E20=0,0,((D20/E20)*100)-100)) -> 14.25 | M20: =IF(G20=0,0,((D20/G20)*100)-100) -> -15.12 | N20: =IF(H20=0,0,((D20/H20)*100)-100) -> -9.46 | O20: =IF(D20=0,0,IF(I20=0,0,((D20/I20)*100)-100)) -> 11.53 | Q20: 3245000 | R20: =IF(D20=0,0,((D20/Q20)*100)-100) -> -23.16 | S20: =IF(D20=0,0,(D20/$D$37)*100) -> 3.35 | U20: 15.29 | V20: 15.9
A21: Araucaria Nova | C21: 2750000 | D21: 2697552 | E21: 2117706 | G21: 2709318 | H21: 2798594 | I21: 2558861 | K21: =IF(C21=0,0,((D21/C21)*100)-100) -> -1.91 | L21: =IF(D21=0,0,IF(E21=0,0,((D21/E21)*100)-100)) -> 27.38 | M21: =IF(G21=0,0,((D21/G21)*100)-100) -> -0.43 | N21: =IF(H21=0,0,((D21/H21)*100)-100) -> -3.61 | O21: =IF(D21=0,0,IF(I21=0,0,((D21/I21)*100)-100)) -> 5.42 | Q21: 2750000 | R21: =IF(D21=0,0,((D21/Q21)*100)-100) -> -1.91 | S21: =IF(D21=0,0,(D21/$D$37)*100) -> 3.62 | U21: 16.5 | V21: 15.71
A22: Total Super | C22: =SUM(C7:C21) -> 30408000 | D22: =SUM(D7:D21) -> 27687049 | E22: =SUM(E7:E21) -> 21449867 | G22: =SUM(G7:G21) -> 29666429 | H22: =SUM(H7:H21) -> 32838453 | I22: =SUM(I7:I21) -> 28817073 | J22: =SUM(C22:I22) -> 170866871 | K22: =IF(D22=0,0,((D22/C22)*100)-100) -> -8.95 | L22: =IF(D22=0,0,IF(E22=0,0,((D22/E22)*100)-100)) -> 29.08 | M22: =IF(G22=0,0,IF(D22=0,0,((D22/G22)*100)-100)) -> -6.67 | N22: =IF(H22=0,0,IF(D22=0,0,((D22/H22)*100)-100)) -> -15.69 | O22: =IF(D22=0,0,IF(I22=0,0,((D22/I22)*100)-100)) -> -3.92 | Q22: =SUM(Q7:Q21) -> 30408000 | R22: =IF(D22=0,0,((D22/Q22)*100)-100) -> -8.95 | S22: =IF(D22=0,0,(D22/$D$37)*100) -> 37.15 | U22: 16.62 | V22: 15.55
A24: Pinheirinho | C24: 3600000 | D24: 3808732 | E24: 2761205 | G24: 2697444 | H24: 2811997 | I24: 2492674 | K24: =IF(C24=0,0,((D24/C24)*100)-100) -> 5.8 | L24: =IF(D24=0,0,IF(E24=0,0,((D24/E24)*100)-100)) -> 37.94 | M24: =IF(G24=0,0,((D24/G24)*100)-100) -> 41.2 | N24: =IF(H24=0,0,((D24/H24)*100)-100) -> 35.45 | O24: =IF(D24=0,0,IF(I24=0,0,((D24/I24)*100)-100)) -> 52.8 | Q24: 3600000 | R24: =IF(D24=0,0,IF(Q24=0,0,((D24/Q24)*100)-100)) -> 5.8 | S24: =IF(D24=0,0,(D24/$D$37)*100) -> 5.11 | U24: 17.58 | V24: 14.7
A25: Londrina | C25: 3200000 | D25: 3290867 | E25: 2418021 | G25: 3736165 | H25: 3484194 | I25: 2768913 | K25: =IF(C25=0,0,((D25/C25)*100)-100) -> 2.84 | L25: =IF(D25=0,0,IF(E25=0,0,((D25/E25)*100)-100)) -> 36.1 | M25: =IF(G25=0,0,((D25/G25)*100)-100) -> -11.92 | N25: =IF(H25=0,0,((D25/H25)*100)-100) -> -5.55 | O25: =IF(D25=0,0,IF(I25=0,0,((D25/I25)*100)-100)) -> 18.85 | Q25: 3200000 | R25: =IF(D25=0,0,IF(Q25=0,0,((D25/Q25)*100)-100)) -> 2.84 | S25: =IF(D25=0,0,(D25/$D$37)*100) -> 4.42 | U25: 14.35 | V25: 13.97
A26: S.J. Pinhais | C26: 5200000 | D26: 5010440 | E26: 3761323 | G26: 5568251 | H26: 5973276 | I26: 5157448 | K26: =IF(C26=0,0,((D26/C26)*100)-100) -> -3.65 | L26: =IF(D26=0,0,IF(E26=0,0,((D26/E26)*100)-100)) -> 33.21 | M26: =IF(G26=0,0,((D26/G26)*100)-100) -> -10.02 | N26: =IF(H26=0,0,((D26/H26)*100)-100) -> -16.12 | O26: =IF(D26=0,0,IF(I26=0,0,((D26/I26)*100)-100)) -> -2.85 | Q26: 5200000 | R26: =IF(D26=0,0,IF(Q26=0,0,((D26/Q26)*100)-100)) -> -3.65 | S26: =IF(D26=0,0,(D26/$D$37)*100) -> 6.72 | U26: 15.9 | V26: 15.35
A27: P.G. Nova | C27: 5100000 | D27: 4378304 | E27: 3312323 | G27: 5062487 | H27: 4889066 | I27: 3784885 | K27: =IF(C27=0,0,((D27/C27)*100)-100) -> -14.15 | L27: =IF(D27=0,0,IF(E27=0,0,((D27/E27)*100)-100)) -> 32.18 | M27: =IF(G27=0,0,((D27/G27)*100)-100) -> -13.51 | N27: =IF(H27=0,0,((D27/H27)*100)-100) -> -10.45 | O27: =IF(D27=0,0,IF(I27=0,0,((D27/I27)*100)-100)) -> 15.68 | Q27: 5100000 | R27: =IF(D27=0,0,IF(Q27=0,0,((D27/Q27)*100)-100)) -> -14.15 | S27: =IF(D27=0,0,(D27/$D$37)*100) -> 5.87 | U27: 16.4 | V27: 15.5
A28: Nilo Pecanha | C28: 12300000 | D28: 11483309 | E28: 8854454 | G28: 11637386 | H28: 10610322 | I28: 10207124 | K28: =IF(C28=0,0,((D28/C28)*100)-100) -> -6.64 | L28: =IF(D28=0,0,IF(E28=0,0,((D28/E28)*100)-100)) -> 29.69 | M28: =IF(G28=0,0,((D28/G28)*100)-100) -> -1.32 | N28: =IF(H28=0,0,((D28/H28)*100)-100) -> 8.23 | O28: =IF(D28=0,0,IF(I28=0,0,((D28/I28)*100)-100)) -> 12.5 | Q28: 12300000 | R28: =IF(D28=0,0,IF(Q28=0,0,((D28/Q28)*100)-100)) -> -6.64 | S28: =IF(D28=0,0,(D28/$D$37)*100) -> 15.41 | U28: 15.5 | V28: 15.62
A29: Champagnat | C29: 6500000 | D29: 6062519 | E29: 5096445 | G29: 6686545 | H29: 6737674 | I29: 0 | K29: =IF(C29=0,0,((D29/C29)*100)-100) -> -6.73 | L29: =IF(D29=0,0,IF(E29=0,0,((D29/E29)*100)-100)) -> 18.96 | M29: =IF(G29=0,0,((D29/G29)*100)-100) -> -9.33 | N29: =IF(H29=0,0,((D29/H29)*100)-100) -> -10.02 | O29: =IF(D29=0,0,IF(I29=0,0,((D29/I29)*100)-100)) -> 0 | Q29: 6500000 | R29: =IF(D29=0,0,IF(Q29=0,0,((D29/Q29)*100)-100)) -> -6.73 | S29: =IF(D29=0,0,(D29/$D$37)*100) -> 8.13 | U29: 16.5 | V29: 15.96
A30: Santa Candida | C30: 5650000 | D30: 5055288 | E30: 3667978 | G30: 5840046 | H30: 6955104 | I30: 0 | K30: =IF(C30=0,0,((D30/C30)*100)-100) -> -10.53 | L30: =IF(D30=0,0,IF(E30=0,0,((D30/E30)*100)-100)) -> 37.82 | M30: =IF(G30=0,0,((D30/G30)*100)-100) -> -13.44 | N30: =IF(H30=0,0,((D30/H30)*100)-100) -> -27.32 | O30: =IF(D30=0,0,IF(I30=0,0,((D30/I30)*100)-100)) -> 0 | Q30: 5650000 | R30: =IF(D30=0,0,IF(Q30=0,0,((D30/Q30)*100)-100)) -> -10.53 | S30: =IF(D30=0,0,(D30/$D$37)*100) -> 6.78 | U30: 16.47 | V30: 15.54
A31: Paranagu Raia | C31: 7250000 | D31: 6346041 | E31: 4577830 | G31: 6330492 | H31: 0 | I31: 0 | K31: =IF(C31=0,0,((D31/C31)*100)-100) -> -12.47 | L31: =IF(D31=0,0,IF(E31=0,0,((D31/E31)*100)-100)) -> 38.63 | M31: =IF(G31=0,0,((D31/G31)*100)-100) -> 0.25 | N31: =IF(H31=0,0,((D31/H31)*100)-100) -> 0 | O31: =IF(D31=0,0,IF(I31=0,0,((D31/I31)*100)-100)) -> 0 | Q31: 7250000 | R31: =IF(D31=0,0,IF(Q31=0,0,((D31/Q31)*100)-100)) -> -12.47 | S31: =IF(D31=0,0,(D31/$D$37)*100) -> 8.52 | U31: 16.3 | V31: 16.65
A32: Total Hiper | C32: =SUM(C24:C31) -> 48800000 | D32: =SUM(D24:D31) -> 45435500 | E32: =SUM(E24:E31) -> 34449579 | G32: =SUM(G24:G31) -> 47558816 | H32: =SUM(H24:H31) -> 41461633 | I32: =SUM(I24:I31) -> 24411044 | J32: =SUM(C32:I32) -> 242116572 | K32: =IF(D32=0,0,((D32/C32)*100)-100) -> -6.89 | L32: =IF(D32=0,0,IF(E32=0,0,((D32/E32)*100)-100)) -> 31.89 | M32: =IF(G32=0,0,IF(D32=0,0,((D32/G32)*100)-100)) -> -4.46 | N32: =IF(H32=0,0,IF(D32=0,0,((D32/H32)*100)-100)) -> 9.58 | O32: =IF(D32=0,0,IF(I32=0,0,((D32/I32)*100)-100)) -> 86.13 | Q32: =SUM(Q24:Q31) -> 48800000 | R32: =IF(D32=0,0,((D32/Q32)*100)-100) -> -6.89 | S32: =IF(D32=0,0,(D32/$D$37)*100) -> 60.96 | U32: 16.08 | V32: 15.56
A34: Cristo Rei | C34: 1500000 | D34: 1404831 | E34: 1178261 | G34: 0 | H34: 0 | I34: 0 | K34: =IF(C34=0,0,((D34/C34)*100)-100) -> -6.34 | L34: =IF(D34=0,0,IF(E34=0,0,((D34/E34)*100)-100)) -> 19.23 | M34: =IF(G34=0,0,((D34/G34)*100)-100) -> 0 | N34: =IF(H34=0,0,((D34/H34)*100)-100) -> 0 | O34: =IF(D34=0,0,IF(I34=0,0,((D34/I34)*100)-100)) -> 0 | Q34: 1500000 | R34: =IF(Q34=0,0,IF(D34=0,0,((D34/Q34)*100)-100)) -> -6.34 | S34: =IF(D34=0,0,(D34/$D$37)*100) -> 1.88 | U34: 17.2 | V34: 16.01
A35: Total Lojas Novas | C35: =SUM(C34) -> 1500000 | D35: =SUM(D34) -> 1404831 | E35: =SUM(E34) -> 1178261 | G35: =SUM(G34) -> 0 | H35: =SUM(H34) -> 0 | I35: =SUM(I34) -> 0 | K35: =IF(D35=0,0,((D35/C35)*100)-100) -> -6.34 | L35: =IF(D35=0,0,IF(E35=0,0,((D35/E35)*100)-100)) -> 19.23 | M35: =IF(G35=0,0,IF(D35=0,0,((D35/G35)*100)-100)) -> 0 | N35: =IF(H35=0,0,IF(D35=0,0,((D35/H35)*100)-100)) -> 0 | O35: =IF(D35=0,0,IF(I35=0,0,((D35/I35)*100)-100)) -> 0 | Q35: =SUM(Q34) -> 1500000 | R35: =IF(D35=0,0,((D35/Q35)*100)-100) -> -6.34 | S35: =IF(D35=0,0,(D35/$D$37)*100) -> 1.88 | U35: =U34 -> 17.2 | V35: =V34 -> 16.01
A37: Total Geral | C37: =C22+C32+C35 -> 80708000 | D37: =D22+D32+D35 -> 74527380 | E37: =E22+E32+E35 -> 57077707 | G37: =G22+G32+G35 -> 77225245 | H37: =H22+H32+H35 -> 74300086 | I37: =I22+I32+I35 -> 53228117 | K37: =IF(D37=0,0,((D37/C37)*100)-100) -> -7.66 | L37: =IF(D37=0,0,IF(E37=0,0,((D37/E37)*100)-100)) -> 30.57 | M37: =IF(G37=0,0,IF(D37=0,0,((D37/G37)*100)-100)) -> -3.49 | N37: =IF(H37=0,0,IF(D37=0,0,((D37/H37)*100)-100)) -> 0.31 | O37: =IF(D37=0,0,IF(I37=0,0,((D37/I37)*100)-100)) -> 40.02 | Q37: =Q22+Q32+Q35 -> 80708000 | R37: =IF(D37=0,0,((D37/Q37)*100)-100) -> -7.66 | S37: =S22+S32+S35 -> 99.99 | U37: 16.29 | V37: 15.56
C38: Resumo por Regiao - Outubro/2002
C39: Descricao das Aberturas | H39: Valor | I39: %
C40: Curitiba (2,3,6,7,10,11,13,17,21,22) | H40: =D7+D8+D11+D12+D14+D15+D16+D18+D28+D29+D30+D24+D34 -> 41333922 | I40: =IF(D37=0,0,H40/$D$37) -> 0.55459999999999998
C41: Curitiba e Metrop. (Ctba. 4,5,8,13,14,23) | H41: =H40+D9+D10+D13+D26+D21+D31 -> 60018360 | I41: =IF(D37=0,0,H41/$D$37) -> 0.80530000000000002
C42: Metropolitana (4,5,8,14,23) | H42: =H41-H40 -> 18684438 | I42: =IF(D37=0,0,H42/$D$37) -> 0.25069999999999998
C43: Norte (9,15,20) | H43: =D25+D17+D20 -> 8221278 | I43: =IF(D37=0,0,H43/$D$37) -> 0.1103
C44: Ponta Grossa (18,19) | H44: =D19+D27 -> 6287742 | I44: =IF(D37=0,0,H44/$D$37) -> 8.4400000000000003E-2
C45: Super (2,3,4,5,6,7,8,10,11,13,15,17,18,20,23) | H45: =D22 -> 27687049 | I45: =IF(D37=0,0,H45/$D$37) -> 0.3715
C46: Hiper (6,9,14,19,21,22,24) | H46: =D32 -> 45435500 | I46: =IF(D37=0,0,H46/$D$37) -> 0.60960000000000003
C47: Curitiba, Metropolitana e Ponta Grossa | H47: =D37-H43 -> 66306102 | I47: =IF(D37=0,0,H47/$D$37) -> 0.88970000000000005
C48: Araucaria | H48: =D10+D21 -> 3825174 | I48: =IF(D37=0,0,H48/$D$37) -> 5.1299999999999998E-2