A2: Periodo: | C2: 38991 | D2: a | E2: 39021 | H2: Vendas Acumuladas por Filial | Q2: =NOW() -> 39084.619170138903
A4: v.1 | C4: Vendas 2006 | G4: Vendas de Anos Anteriores | K4: Percentuais ( % ) | Q4: Meta Mensal | U4: Margem
A5: Lojas | C5: Previsao | D5: Realizada | E5: Mes Anterior | G5: Vendas 2005 | H5: Vendas 2004 | I5: Vendas 2003 | K5: % Prev | L5: % MA | M5: 2005 | N5: 2004 | O5: 2003 | Q5: Previsao Mes | R5: Final | S5: Part. | U5: Meta | V5: Condor
A7: Xaxim | C7: 840000 | D7: 697681 | E7: 687271 | G7: 754298 | H7: 909085 | I7: 767208 | K7: =IF(C7=0,0,((D7/C7)*100)-100) -> -16.94 | L7: =IF(D7=0,0,IF(E7=0,0,((D7/E7)*100)-100)) -> 1.51 | M7: =IF(G7=0,0,((D7/G7)*100)-100) -> -7.51 | N7: =IF(H7=0,0,((D7/H7)*100)-100) -> -23.25 | O7: =IF(D7=0,0,IF(I7=0,0,((D7/I7)*100)-100)) -> -9.06 | Q7: 840000 | R7: =IF(D7=0,0,((D7/Q7)*100)-100) -> -16.94 | S7: =IF(D7=0,0,(D7/$D$37)*100) -> 1.17 | U7: 16.4 | V7: 14.71
A8: S. Felicidade | C8: 870000 | D8: 839141 | E8: 860848 | G8: 721653 | H8: 814043 | I8: 754045 | K8: =IF(C8=0,0,((D8/C8)*100)-100) -> -3.55 | L8: =IF(D8=0,0,IF(E8=0,0,((D8/E8)*100)-100)) -> -2.52 | M8: =IF(G8=0,0,((D8/G8)*100)-100) -> 16.28 | N8: =IF(H8=0,0,((D8/H8)*100)-100) -> 3.08 | O8: =IF(D8=0,0,IF(I8=0,0,((D8/I8)*100)-100)) -> 11.29 | Q8: 870000 | R8: =IF(D8=0,0,((D8/Q8)*100)-100) -> -3.55 | S8: =IF(D8=0,0,(D8/$D$37)*100) -> 1.4 | U8: 16.5 | V8: 15.77
A9: Lapa | C9: 1300000 | D9: 1101152 | E9: 1103469 | G9: 1219423 | H9: 1271523 | I9: 1073490 | K9: =IF(C9=0,0,((D9/C9)*100)-100) -> -15.3 | L9: =IF(D9=0,0,IF(E9=0,0,((D9/E9)*100)-100)) -> -0.21 | M9: =IF(G9=0,0,((D9/G9)*100)-100) -> -9.7 | N9: =IF(H9=0,0,((D9/H9)*100)-100) -> -13.4 | O9: =IF(D9=0,0,IF(I9=0,0,((D9/I9)*100)-100)) -> 2.58 | Q9: 1300000 | R9: =IF(D9=0,0,((D9/Q9)*100)-100) -> -15.3 | S9: =IF(D9=0,0,(D9/$D$37)*100) -> 1.84 | U9: 16.25 | V9: 14.64
A10: Araucaria | C10: 1050000 | D10: 870513 | E10: 917650 | G10: 919908 | H10: 1046115 | I10: 1018623 | K10: =IF(C10=0,0,((D10/C10)*100)-100) -> -17.09 | L10: =IF(D10=0,0,IF(E10=0,0,((D10/E10)*100)-100)) -> -5.14 | M10: =IF(G10=0,0,((D10/G10)*100)-100) -> -5.37 | N10: =IF(H10=0,0,((D10/H10)*100)-100) -> -16.79 | O10: =IF(D10=0,0,IF(I10=0,0,((D10/I10)*100)-100)) -> -14.54 | Q10: 1050000 | R10: =IF(D10=0,0,((D10/Q10)*100)-100) -> -17.09 | S10: =IF(D10=0,0,(D10/$D$37)*100) -> 1.46 | U10: 17.55 | V10: 16.85
A11: Pinheirinho | C11: 0 | D11: 0 | E11: 0 | G11: 0 | H11: 0 | I11: 0 | K11: =IF(C11=0,0,((D11/C11)*100)-100) -> 0 | L11: =IF(D11=0,0,IF(E11=0,0,((D11/E11)*100)-100)) -> 0 | M11: =IF(G11=0,0,((D11/G11)*100)-100) -> 0 | N11: =IF(H11=0,0,((D11/H11)*100)-100) -> 0 | O11: =IF(D11=0,0,IF(I11=0,0,((D11/I11)*100)-100)) -> 0 | Q11: 0 | R11: =IF(D11=0,0,((D11/Q11)*100)-100) -> 0 | S11: =IF(D11=0,0,(D11/$D$37)*100) -> 0 | U11: 0 | V11: 0
A12: Hauer | C12: 3330000 | D12: 2984393 | E12: 3054283 | G12: 3216533 | H12: 3569413 | I12: 3066144 | K12: =IF(C12=0,0,((D12/C12)*100)-100) -> -10.38 | L12: =IF(D12=0,0,IF(E12=0,0,((D12/E12)*100)-100)) -> -2.29 | M12: =IF(G12=0,0,((D12/G12)*100)-100) -> -7.22 | N12: =IF(H12=0,0,((D12/H12)*100)-100) -> -16.39 | O12: =IF(D12=0,0,IF(I12=0,0,((D12/I12)*100)-100)) -> -2.67 | Q12: 3330000 | R12: =IF(D12=0,0,((D12/Q12)*100)-100) -> -10.38 | S12: =IF(D12=0,0,(D12/$D$37)*100) -> 4.99 | U12: 16.96 | V12: 16.06
A13: Paranagua | C13: 1690000 | D13: 1597490 | E13: 1565008 | G13: 1533391 | H13: 3715346 | I13: 3136877 | K13: =IF(C13=0,0,((D13/C13)*100)-100) -> -5.47 | L13: =IF(D13=0,0,IF(E13=0,0,((D13/E13)*100)-100)) -> 2.08 | M13: =IF(G13=0,0,((D13/G13)*100)-100) -> 4.18 | N13: =IF(H13=0,0,((D13/H13)*100)-100) -> -57 | O13: =IF(D13=0,0,IF(I13=0,0,((D13/I13)*100)-100)) -> -49.07 | Q13: 1690000 | R13: =IF(D13=0,0,((D13/Q13)*100)-100) -> -5.47 | S13: =IF(D13=0,0,(D13/$D$37)*100) -> 2.67 | U13: 17.4 | V13: 17.31
A14: Centenario | C14: 1100000 | D14: 926367 | E14: 938529 | G14: 963591 | H14: 1070819 | I14: 974981 | K14: =IF(C14=0,0,((D14/C14)*100)-100) -> -15.78 | L14: =IF(D14=0,0,IF(E14=0,0,((D14/E14)*100)-100)) -> -1.3 | M14: =IF(G14=0,0,((D14/G14)*100)-100) -> -3.86 | N14: =IF(H14=0,0,((D14/H14)*100)-100) -> -13.49 | O14: =IF(D14=0,0,IF(I14=0,0,((D14/I14)*100)-100)) -> -4.99 | Q14: 1100000 | R14: =IF(D14=0,0,((D14/Q14)*100)-100) -> -15.78 | S14: =IF(D14=0,0,(D14/$D$37)*100) -> 1.55 | U14: 16.6 | V14: 14.7
A15: Sao Braz | C15: 3350000 | D15: 2958470 | E15: 3097299 | G15: 3101849 | H15: 3391369 | I15: 3130319 | K15: =IF(C15=0,0,((D15/C15)*100)-100) -> -11.69 | L15: =IF(D15=0,0,IF(E15=0,0,((D15/E15)*100)-100)) -> -4.48 | M15: =IF(G15=0,0,((D15/G15)*100)-100) -> -4.62 | N15: =IF(H15=0,0,((D15/H15)*100)-100) -> -12.76 | O15: =IF(D15=0,0,IF(I15=0,0,((D15/I15)*100)-100)) -> -5.49 | Q15: 3350000 | R15: =IF(D15=0,0,((D15/Q15)*100)-100) -> -11.69 | S15: =IF(D15=0,0,(D15/$D$37)*100) -> 4.95 | U15: 16.55 | V15: 15.34
A16: Sitio Cercado | C16: 1400000 | D16: 1219593 | E16: 1231596 | G16: 1399709 | H16: 1928661 | I16: 1396245 | K16: =IF(C16=0,0,((D16/C16)*100)-100) -> -12.89 | L16: =IF(D16=0,0,IF(E16=0,0,((D16/E16)*100)-100)) -> -0.97 | M16: =IF(G16=0,0,((D16/G16)*100)-100) -> -12.87 | N16: =IF(H16=0,0,((D16/H16)*100)-100) -> -36.76 | O16: =IF(D16=0,0,IF(I16=0,0,((D16/I16)*100)-100)) -> -12.65 | Q16: 1400000 | R16: =IF(D16=0,0,((D16/Q16)*100)-100) -> -12.89 | S16: =IF(D16=0,0,(D16/$D$37)*100) -> 2.04 | U16: 16.9 | V16: 15.94
A17: Apucarana | C17: 1950000 | D17: 1708661 | E17: 1798008 | G17: 1770813 | H17: 1777628 | I17: 1403236 | K17: =IF(C17=0,0,((D17/C17)*100)-100) -> -12.38 | L17: =IF(D17=0,0,IF(E17=0,0,((D17/E17)*100)-100)) -> -4.97 | M17: =IF(G17=0,0,((D17/G17)*100)-100) -> -3.51 | N17: =IF(H17=0,0,((D17/H17)*100)-100) -> -3.88 | O17: =IF(D17=0,0,IF(I17=0,0,((D17/I17)*100)-100)) -> 21.77 | Q17: 1950000 | R17: =IF(D17=0,0,((D17/Q17)*100)-100) -> -12.38 | S17: =IF(D17=0,0,(D17/$D$37)*100) -> 2.86 | U17: 15.5 | V17: 14.96
A18: Ahu | C18: 1350000 | D18: 1115148 | E18: 1138913 | G18: 1173008 | H18: 1320549 | I18: 1312830 | K18: =IF(C18=0,0,((D18/C18)*100)-100) -> -17.4 | L18: =IF(D18=0,0,IF(E18=0,0,((D18/E18)*100)-100)) -> -2.09 | M18: =IF(G18=0,0,((D18/G18)*100)-100) -> -4.93 | N18: =IF(H18=0,0,((D18/H18)*100)-100) -> -15.55 | O18: =IF(D18=0,0,IF(I18=0,0,((D18/I18)*100)-100)) -> -15.06 | Q18: 1350000 | R18: =IF(D18=0,0,((D18/Q18)*100)-100) -> -17.4 | S18: =IF(D18=0,0,(D18/$D$37)*100) -> 1.87 | U18: 17.15 | V18: 17.09
A19: P.G. Centro | C19: 1880000 | D19: 1565581 | E19: 1599175 | G19: 1564418 | H19: 1750739 | I19: 1685034 | K19: =IF(C19=0,0,((D19/C19)*100)-100) -> -16.72 | L19: =IF(D19=0,0,IF(E19=0,0,((D19/E19)*100)-100)) -> -2.1 | M19: =IF(G19=0,0,((D19/G19)*100)-100) -> 0.07 | N19: =IF(H19=0,0,((D19/H19)*100)-100) -> -10.58 | O19: =IF(D19=0,0,IF(I19=0,0,((D19/I19)*100)-100)) -> -7.09 | Q19: 1880000 | R19: =IF(D19=0,0,((D19/Q19)*100)-100) -> -16.72 | S19: =IF(D19=0,0,(D19/$D$37)*100) -> 2.62 | U19: 17.65 | V19: 17.74
A20: Maringa | C20: 2740000 | D20: 2290307 | E20: 2434008 | G20: 2419642 | H20: 2528510 | I20: 2074675 | K20: =IF(C20=0,0,((D20/C20)*100)-100) -> -16.41 | L20: =IF(D20=0,0,IF(E20=0,0,((D20/E20)*100)-100)) -> -5.9 | M20: =IF(G20=0,0,((D20/G20)*100)-100) -> -5.35 | N20: =IF(H20=0,0,((D20/H20)*100)-100) -> -9.42 | O20: =IF(D20=0,0,IF(I20=0,0,((D20/I20)*100)-100)) -> 10.39 | Q20: 2740000 | R20: =IF(D20=0,0,((D20/Q20)*100)-100) -> -16.41 | S20: =IF(D20=0,0,(D20/$D$37)*100) -> 3.83 | U20: 16.5 | V20: 16.74
A21: Araucaria Nova | C21: 2370000 | D21: 2053774 | E21: 2040588 | G21: 2041811 | H21: 2420547 | I21: 1944220 | K21: =IF(C21=0,0,((D21/C21)*100)-100) -> -13.34 | L21: =IF(D21=0,0,IF(E21=0,0,((D21/E21)*100)-100)) -> 0.65 | M21: =IF(G21=0,0,((D21/G21)*100)-100) -> 0.59 | N21: =IF(H21=0,0,((D21/H21)*100)-100) -> -15.15 | O21: =IF(D21=0,0,IF(I21=0,0,((D21/I21)*100)-100)) -> 5.63 | Q21: 2370000 | R21: =IF(D21=0,0,((D21/Q21)*100)-100) -> -13.34 | S21: =IF(D21=0,0,(D21/$D$37)*100) -> 3.44 | U21: 16.8 | V21: 16.82
A22: Total Super | C22: =SUM(C7:C21) -> 25220000 | D22: =SUM(D7:D21) -> 21928271 | E22: =SUM(E7:E21) -> 22466645 | G22: =SUM(G7:G21) -> 22800047 | H22: =SUM(H7:H21) -> 27514347 | I22: =SUM(I7:I21) -> 23737927 | J22: =SUM(C22:I22) -> 143667237 | K22: =IF(D22=0,0,((D22/C22)*100)-100) -> -13.05 | L22: =IF(D22=0,0,IF(E22=0,0,((D22/E22)*100)-100)) -> -2.4 | M22: =IF(G22=0,0,IF(D22=0,0,((D22/G22)*100)-100)) -> -3.82 | N22: =IF(H22=0,0,IF(D22=0,0,((D22/H22)*100)-100)) -> -20.3 | O22: =IF(D22=0,0,IF(I22=0,0,((D22/I22)*100)-100)) -> -7.62 | Q22: =SUM(Q7:Q21) -> 25220000 | R22: =IF(D22=0,0,((D22/Q22)*100)-100) -> -13.05 | S22: =IF(D22=0,0,(D22/$D$37)*100) -> 36.69 | U22: 16.65 | V22: 15.97
A24: Pinheirinho | C24: 2950000 | D24: 2841105 | E24: 2789921 | G24: 1955750 | H24: 2240021 | I24: 1786581 | K24: =IF(C24=0,0,((D24/C24)*100)-100) -> -3.69 | L24: =IF(D24=0,0,IF(E24=0,0,((D24/E24)*100)-100)) -> 1.83 | M24: =IF(G24=0,0,((D24/G24)*100)-100) -> 45.27 | N24: =IF(H24=0,0,((D24/H24)*100)-100) -> 26.83 | O24: =IF(D24=0,0,IF(I24=0,0,((D24/I24)*100)-100)) -> 59.02 | Q24: 2950000 | R24: =IF(D24=0,0,IF(Q24=0,0,((D24/Q24)*100)-100)) -> -3.69 | S24: =IF(D24=0,0,(D24/$D$37)*100) -> 4.75 | U24: 16 | V24: 14.76
A25: Londrina | C25: 3700000 | D25: 2865115 | E25: 2807188 | G25: 3096380 | H25: 2806010 | I25: 2263517 | K25: =IF(C25=0,0,((D25/C25)*100)-100) -> -22.56 | L25: =IF(D25=0,0,IF(E25=0,0,((D25/E25)*100)-100)) -> 2.06 | M25: =IF(G25=0,0,((D25/G25)*100)-100) -> -7.47 | N25: =IF(H25=0,0,((D25/H25)*100)-100) -> 2.11 | O25: =IF(D25=0,0,IF(I25=0,0,((D25/I25)*100)-100)) -> 26.58 | Q25: 3700000 | R25: =IF(D25=0,0,IF(Q25=0,0,((D25/Q25)*100)-100)) -> -22.56 | S25: =IF(D25=0,0,(D25/$D$37)*100) -> 4.79 | U25: 14.5 | V25: 14.19
A26: S.J. Pinhais | C26: 4400000 | D26: 3965134 | E26: 3871009 | G26: 4422822 | H26: 4911701 | I26: 4232057 | K26: =IF(C26=0,0,((D26/C26)*100)-100) -> -9.88 | L26: =IF(D26=0,0,IF(E26=0,0,((D26/E26)*100)-100)) -> 2.43 | M26: =IF(G26=0,0,((D26/G26)*100)-100) -> -10.35 | N26: =IF(H26=0,0,((D26/H26)*100)-100) -> -19.27 | O26: =IF(D26=0,0,IF(I26=0,0,((D26/I26)*100)-100)) -> -6.31 | Q26: 4400000 | R26: =IF(D26=0,0,IF(Q26=0,0,((D26/Q26)*100)-100)) -> -9.88 | S26: =IF(D26=0,0,(D26/$D$37)*100) -> 6.63 | U26: 15.85 | V26: 15.81
A27: P.G. Nova | C27: 4135000 | D27: 3509309 | E27: 3532457 | G27: 3773369 | H27: 3990298 | I27: 3144267 | K27: =IF(C27=0,0,((D27/C27)*100)-100) -> -15.13 | L27: =IF(D27=0,0,IF(E27=0,0,((D27/E27)*100)-100)) -> -0.66 | M27: =IF(G27=0,0,((D27/G27)*100)-100) -> -7 | N27: =IF(H27=0,0,((D27/H27)*100)-100) -> -12.05 | O27: =IF(D27=0,0,IF(I27=0,0,((D27/I27)*100)-100)) -> 11.61 | Q27: 4135000 | R27: =IF(D27=0,0,IF(Q27=0,0,((D27/Q27)*100)-100)) -> -15.13 | S27: =IF(D27=0,0,(D27/$D$37)*100) -> 5.87 | U27: 16 | V27: 15.49
A28: Nilo Pecanha | C28: 10200000 | D28: 8881439 | E28: 9017588 | G28: 9475278 | H28: 9741202 | I28: 8773218 | K28: =IF(C28=0,0,((D28/C28)*100)-100) -> -12.93 | L28: =IF(D28=0,0,IF(E28=0,0,((D28/E28)*100)-100)) -> -1.51 | M28: =IF(G28=0,0,((D28/G28)*100)-100) -> -6.27 | N28: =IF(H28=0,0,((D28/H28)*100)-100) -> -8.83 | O28: =IF(D28=0,0,IF(I28=0,0,((D28/I28)*100)-100)) -> 1.23 | Q28: 10200000 | R28: =IF(D28=0,0,IF(Q28=0,0,((D28/Q28)*100)-100)) -> -12.93 | S28: =IF(D28=0,0,(D28/$D$37)*100) -> 14.86 | U28: 15.2 | V28: 15.97
A29: Champagnat | C29: 6200000 | D29: 5352479 | E29: 5445603 | G29: 6161013 | H29: 6029680 | I29: 0 | K29: =IF(C29=0,0,((D29/C29)*100)-100) -> -13.67 | L29: =IF(D29=0,0,IF(E29=0,0,((D29/E29)*100)-100)) -> -1.71 | M29: =IF(G29=0,0,((D29/G29)*100)-100) -> -13.12 | N29: =IF(H29=0,0,((D29/H29)*100)-100) -> -11.23 | O29: =IF(D29=0,0,IF(I29=0,0,((D29/I29)*100)-100)) -> 0 | Q29: 6200000 | R29: =IF(D29=0,0,IF(Q29=0,0,((D29/Q29)*100)-100)) -> -13.67 | S29: =IF(D29=0,0,(D29/$D$37)*100) -> 8.96 | U29: 16.4 | V29: 16.64
A30: Santa Candida | C30: 4700000 | D30: 4043377 | E30: 3986280 | G30: 4775401 | H30: 0 | I30: 0 | K30: =IF(C30=0,0,((D30/C30)*100)-100) -> -13.97 | L30: =IF(D30=0,0,IF(E30=0,0,((D30/E30)*100)-100)) -> 1.43 | M30: =IF(G30=0,0,((D30/G30)*100)-100) -> -15.33 | N30: =IF(H30=0,0,((D30/H30)*100)-100) -> 0 | O30: =IF(D30=0,0,IF(I30=0,0,((D30/I30)*100)-100)) -> 0 | Q30: 4700000 | R30: =IF(D30=0,0,IF(Q30=0,0,((D30/Q30)*100)-100)) -> -13.97 | S30: =IF(D30=0,0,(D30/$D$37)*100) -> 6.77 | U30: 16.25 | V30: 15.91
A31: Paranagu Raia | C31: 5250000 | D31: 4883265 | E31: 4520218 | G31: 4657320 | H31: 0 | I31: 0 | K31: =IF(C31=0,0,((D31/C31)*100)-100) -> -6.99 | L31: =IF(D31=0,0,IF(E31=0,0,((D31/E31)*100)-100)) -> 8.03 | M31: =IF(G31=0,0,((D31/G31)*100)-100) -> 4.85 | N31: =IF(H31=0,0,((D31/H31)*100)-100) -> 0 | O31: =IF(D31=0,0,IF(I31=0,0,((D31/I31)*100)-100)) -> 0 | Q31: 5250000 | R31: =IF(D31=0,0,IF(Q31=0,0,((D31/Q31)*100)-100)) -> -6.99 | S31: =IF(D31=0,0,(D31/$D$37)*100) -> 8.17 | U31: 16.3 | V31: 16.57
A32: Total Hiper | C32: =SUM(C24:C31) -> 41535000 | D32: =SUM(D24:D31) -> 36341223 | E32: =SUM(E24:E31) -> 35970264 | G32: =SUM(G24:G31) -> 38317333 | H32: =SUM(H24:H31) -> 29718912 | I32: =SUM(I24:I31) -> 20199640 | J32: =SUM(C32:I32) -> 202082372 | K32: =IF(D32=0,0,((D32/C32)*100)-100) -> -12.5 | L32: =IF(D32=0,0,IF(E32=0,0,((D32/E32)*100)-100)) -> 1.03 | M32: =IF(G32=0,0,IF(D32=0,0,((D32/G32)*100)-100)) -> -5.16 | N32: =IF(H32=0,0,IF(D32=0,0,((D32/H32)*100)-100)) -> 22.28 | O32: =IF(D32=0,0,IF(I32=0,0,((D32/I32)*100)-100)) -> 79.91 | Q32: =SUM(Q24:Q31) -> 41535000 | R32: =IF(D32=0,0,((D32/Q32)*100)-100) -> -12.5 | S32: =IF(D32=0,0,(D32/$D$37)*100) -> 60.81 | U32: 15.84 | V32: 15.96
A34: Cristo Rei | C34: 1800000 | D34: 1493982 | E34: 622294 | G34: 0 | H34: 0 | I34: 0 | K34: =IF(C34=0,0,((D34/C34)*100)-100) -> -17 | L34: =IF(D34=0,0,IF(E34=0,0,((D34/E34)*100)-100)) -> 140.08 | M34: =IF(G34=0,0,((D34/G34)*100)-100) -> 0 | N34: =IF(H34=0,0,((D34/H34)*100)-100) -> 0 | O34: =IF(D34=0,0,IF(I34=0,0,((D34/I34)*100)-100)) -> 0 | Q34: 1800000 | R34: =IF(Q34=0,0,IF(D34=0,0,((D34/Q34)*100)-100)) -> -17 | S34: =IF(D34=0,0,(D34/$D$37)*100) -> 2.5 | U34: 15.88 | V34: 17.06
A35: Total Lojas Novas | C35: =SUM(C34) -> 1800000 | D35: =SUM(D34) -> 1493982 | E35: =SUM(E34) -> 622294 | G35: =SUM(G34) -> 0 | H35: =SUM(H34) -> 0 | I35: =SUM(I34) -> 0 | K35: =IF(D35=0,0,((D35/C35)*100)-100) -> -17 | L35: =IF(D35=0,0,IF(E35=0,0,((D35/E35)*100)-100)) -> 140.08 | M35: =IF(G35=0,0,IF(D35=0,0,((D35/G35)*100)-100)) -> 0 | N35: =IF(H35=0,0,IF(D35=0,0,((D35/H35)*100)-100)) -> 0 | O35: =IF(D35=0,0,IF(I35=0,0,((D35/I35)*100)-100)) -> 0 | Q35: =SUM(Q34) -> 1800000 | R35: =IF(D35=0,0,((D35/Q35)*100)-100) -> -17 | S35: =IF(D35=0,0,(D35/$D$37)*100) -> 2.5 | U35: =U34 -> 15.88 | V35: =V34 -> 17.06
A37: Total Geral | C37: =C22+C32+C35 -> 68555000 | D37: =D22+D32+D35 -> 59763476 | E37: =E22+E32+E35 -> 59059203 | G37: =G22+G32+G35 -> 61117380 | H37: =H22+H32+H35 -> 57233259 | I37: =I22+I32+I35 -> 43937567 | K37: =IF(D37=0,0,((D37/C37)*100)-100) -> -12.82 | L37: =IF(D37=0,0,IF(E37=0,0,((D37/E37)*100)-100)) -> 1.19 | M37: =IF(G37=0,0,IF(D37=0,0,((D37/G37)*100)-100)) -> -2.22 | N37: =IF(H37=0,0,IF(D37=0,0,((D37/H37)*100)-100)) -> 4.42 | O37: =IF(D37=0,0,IF(I37=0,0,((D37/I37)*100)-100)) -> 36.02 | Q37: =Q22+Q32+Q35 -> 68555000 | R37: =IF(D37=0,0,((D37/Q37)*100)-100) -> -12.82 | S37: =S22+S32+S35 -> 100 | U37: 16.16 | V37: 15.98
C38: Resumo por Regiao - Outubro/2002
C39: Descricao das Aberturas | H39: Valor | I39: %
C40: Curitiba (2,3,6,7,10,11,13,17,21,22) | H40: =D7+D8+D11+D12+D14+D15+D16+D18+D28+D29+D30+D24+D34 -> 33353175 | I40: =IF(D37=0,0,H40/$D$37) -> 0.55810000000000004
C41: Curitiba e Metrop. (Ctba. 4,5,8,13,14,23) | H41: =H40+D9+D10+D13+D26+D21+D31 -> 47824503 | I41: =IF(D37=0,0,H41/$D$37) -> 0.80020000000000002
C42: Metropolitana (4,5,8,14,23) | H42: =H41-H40 -> 14471328 | I42: =IF(D37=0,0,H42/$D$37) -> 0.24210000000000001
C43: Norte (9,15,20) | H43: =D25+D17+D20 -> 6864083 | I43: =IF(D37=0,0,H43/$D$37) -> 0.1149
C44: Ponta Grossa (18,19) | H44: =D19+D27 -> 5074890 | I44: =IF(D37=0,0,H44/$D$37) -> 8.4900000000000003E-2
C45: Super (2,3,4,5,6,7,8,10,11,13,15,17,18,20,23) | H45: =D22 -> 21928271 | I45: =IF(D37=0,0,H45/$D$37) -> 0.3669
C46: Hiper (6,9,14,19,21,22,24) | H46: =D32 -> 36341223 | I46: =IF(D37=0,0,H46/$D$37) -> 0.60809999999999997
C47: Curitiba, Metropolitana e Ponta Grossa | H47: =D37-H43 -> 52899393 | I47: =IF(D37=0,0,H47/$D$37) -> 0.8851
C48: Araucaria | H48: =D10+D21 -> 2924287 | I48: =IF(D37=0,0,H48/$D$37) -> 4.8899999999999999E-2