A2: Periodo: | C2: 38261 | D2: a | E2: 38291 | H2: Vendas Acumuladas por Filial | Q2: =NOW() -> 38294.411230324098
A4: v.1 | C4: Vendas 2004 | G4: Vendas de Anos Anteriores | K4: Percentuais ( % ) | Q4: Meta Mensal | U4: Margem
A5: Lojas | C5: Previsao | D5: Realizada | E5: Mes Anterior | G5: Vendas 2003 | H5: Vendas 2002 | I5: Vendas 2001 | K5: % Prev | L5: % MA | M5: 2003 | N5: 2002 | O5: 2001 | Q5: Previsao Mes | R5: Final | S5: Part. | U5: Meta | V5: Real
A7: Xaxim | C7: 950000 | D7: 909634 | E7: 838924 | G7: 767208 | H7: 576549 | I7: 570886 | K7: =IF(C7=0,0,((D7/C7)*100)-100) -> -4.25 | L7: =IF(D7=0,0,IF(E7=0,0,((D7/E7)*100)-100)) -> 8.43 | M7: =IF(G7=0,0,((D7/G7)*100)-100) -> 18.56 | N7: =IF(H7=0,0,((D7/H7)*100)-100) -> 57.77 | O7: =IF(D7=0,0,IF(I7=0,0,((D7/I7)*100)-100)) -> 59.34 | Q7: 950000 | R7: =IF(D7=0,0,((D7/Q7)*100)-100) -> -4.25 | S7: =IF(D7=0,0,(D7/$D$32)*100) -> 1.59 | U7: 16.45 | V7: 12.4
A8: S. Felicidade | C8: 900000 | D8: 814343 | E8: 766496 | G8: 754045 | H8: 677918 | I8: 564843 | K8: =IF(C8=0,0,((D8/C8)*100)-100) -> -9.52 | L8: =IF(D8=0,0,IF(E8=0,0,((D8/E8)*100)-100)) -> 6.24 | M8: =IF(G8=0,0,((D8/G8)*100)-100) -> 8 | N8: =IF(H8=0,0,((D8/H8)*100)-100) -> 20.12 | O8: =IF(D8=0,0,IF(I8=0,0,((D8/I8)*100)-100)) -> 44.17 | Q8: 900000 | R8: =IF(D8=0,0,((D8/Q8)*100)-100) -> -9.52 | S8: =IF(D8=0,0,(D8/$D$32)*100) -> 1.42 | U8: 17.1 | V8: 12.49
A9: Lapa | C9: 1300000 | D9: 1271835 | E9: 1223910 | G9: 1073490 | H9: 950161 | I9: 806651 | K9: =IF(C9=0,0,((D9/C9)*100)-100) -> -2.17 | L9: =IF(D9=0,0,IF(E9=0,0,((D9/E9)*100)-100)) -> 3.92 | M9: =IF(G9=0,0,((D9/G9)*100)-100) -> 18.48 | N9: =IF(H9=0,0,((D9/H9)*100)-100) -> 33.85 | O9: =IF(D9=0,0,IF(I9=0,0,((D9/I9)*100)-100)) -> 57.67 | Q9: 1300000 | R9: =IF(D9=0,0,((D9/Q9)*100)-100) -> -2.17 | S9: =IF(D9=0,0,(D9/$D$32)*100) -> 2.22 | U9: 16.05 | V9: 13.07
A10: Araucaria | C10: 1200000 | D10: 1046289 | E10: 929713 | G10: 1018623 | H10: 1005277 | I10: 1559502 | K10: =IF(C10=0,0,((D10/C10)*100)-100) -> -12.81 | L10: =IF(D10=0,0,IF(E10=0,0,((D10/E10)*100)-100)) -> 12.54 | M10: =IF(G10=0,0,((D10/G10)*100)-100) -> 2.72 | N10: =IF(H10=0,0,((D10/H10)*100)-100) -> 4.08 | O10: =IF(D10=0,0,IF(I10=0,0,((D10/I10)*100)-100)) -> -32.91 | Q10: 1200000 | R10: =IF(D10=0,0,((D10/Q10)*100)-100) -> -12.81 | S10: =IF(D10=0,0,(D10/$D$32)*100) -> 1.83 | U10: 17.15 | V10: 14.98
A11: Pinheirinho | C11: 2480000 | D11: 2241193 | E11: 2086456 | G11: 1786581 | H11: 1687899 | I11: 1537183 | K11: =IF(C11=0,0,((D11/C11)*100)-100) -> -9.63 | L11: =IF(D11=0,0,IF(E11=0,0,((D11/E11)*100)-100)) -> 7.42 | M11: =IF(G11=0,0,((D11/G11)*100)-100) -> 25.45 | N11: =IF(H11=0,0,((D11/H11)*100)-100) -> 32.78 | O11: =IF(D11=0,0,IF(I11=0,0,((D11/I11)*100)-100)) -> 45.8 | Q11: 2480000 | R11: =IF(D11=0,0,((D11/Q11)*100)-100) -> -9.63 | S11: =IF(D11=0,0,(D11/$D$32)*100) -> 3.91 | U11: 16.3 | V11: 12.67
A12: Hauer | C12: 3680000 | D12: 3569997 | E12: 3135473 | G12: 3066144 | H12: 2578053 | I12: 2408460 | K12: =IF(C12=0,0,((D12/C12)*100)-100) -> -2.99 | L12: =IF(D12=0,0,IF(E12=0,0,((D12/E12)*100)-100)) -> 13.86 | M12: =IF(G12=0,0,((D12/G12)*100)-100) -> 16.43 | N12: =IF(H12=0,0,((D12/H12)*100)-100) -> 38.48 | O12: =IF(D12=0,0,IF(I12=0,0,((D12/I12)*100)-100)) -> 48.23 | Q12: 3680000 | R12: =IF(D12=0,0,((D12/Q12)*100)-100) -> -2.99 | S12: =IF(D12=0,0,(D12/$D$32)*100) -> 6.23 | U12: 15.69 | V12: 13.47
A13: Paranagua | C13: 3760000 | D13: 3716058 | E13: 3424238 | G13: 3136877 | H13: 3047459 | I13: 2744627 | K13: =IF(C13=0,0,((D13/C13)*100)-100) -> -1.17 | L13: =IF(D13=0,0,IF(E13=0,0,((D13/E13)*100)-100)) -> 8.52 | M13: =IF(G13=0,0,((D13/G13)*100)-100) -> 18.46 | N13: =IF(H13=0,0,((D13/H13)*100)-100) -> 21.94 | O13: =IF(D13=0,0,IF(I13=0,0,((D13/I13)*100)-100)) -> 35.39 | Q13: 3760000 | R13: =IF(D13=0,0,((D13/Q13)*100)-100) -> -1.17 | S13: =IF(D13=0,0,(D13/$D$32)*100) -> 6.49 | U13: 17 | V13: 14.98
A14: Centenario | C14: 1150000 | D14: 1070972 | E14: 1076238 | G14: 974981 | H14: 796004 | I14: 740913 | K14: =IF(C14=0,0,((D14/C14)*100)-100) -> -6.87 | L14: =IF(D14=0,0,IF(E14=0,0,((D14/E14)*100)-100)) -> -00.49 | M14: =IF(G14=0,0,((D14/G14)*100)-100) -> 9.85 | N14: =IF(H14=0,0,((D14/H14)*100)-100) -> 34.54 | O14: =IF(D14=0,0,IF(I14=0,0,((D14/I14)*100)-100)) -> 44.55 | Q14: 1150000 | R14: =IF(D14=0,0,((D14/Q14)*100)-100) -> -6.87 | S14: =IF(D14=0,0,(D14/$D$32)*100) -> 1.87 | U14: 16.85 | V14: 12.29
A15: Arapongas | C15: 0 | D15: 0 | E15: 0 | G15: 471751 | H15: 535712 | I15: 525431 | K15: =IF(C15=0,0,((D15/C15)*100)-100) -> 0 | L15: =IF(D15=0,0,IF(E15=0,0,((D15/E15)*100)-100)) -> 0 | M15: =IF(D15=0,0,IF(G15=0,0,((D15/G15)*100)-100)) -> 0 | N15: =IF(D15=0,0,IF(H15=0,0,((D15/H15)*100)-100)) -> 0 | O15: =IF(D15=0,0,IF(I15=0,0,((D15/I15)*100)-100)) -> 0 | Q15: 0 | R15: =IF(D15=0,0,((D15/Q15)*100)-100) -> 0 | S15: =IF(D15=0,0,(D15/$D$32)*100) -> 0 | U15: 0 | V15: 0
A16: Sao Braz | C16: 3750000 | D16: 3392115 | E16: 3118069 | G16: 3130319 | H16: 2636563 | I16: 2416193 | K16: =IF(C16=0,0,((D16/C16)*100)-100) -> -9.54 | L16: =IF(D16=0,0,IF(E16=0,0,((D16/E16)*100)-100)) -> 8.79 | M16: =IF(G16=0,0,((D16/G16)*100)-100) -> 8.36 | N16: =IF(H16=0,0,((D16/H16)*100)-100) -> 28.66 | O16: =IF(D16=0,0,IF(I16=0,0,((D16/I16)*100)-100)) -> 40.39 | Q16: 3750000 | R16: =IF(D16=0,0,((D16/Q16)*100)-100) -> -9.54 | S16: =IF(D16=0,0,(D16/$D$32)*100) -> 5.92 | U16: 14.73 | V16: 12.3
A17: Guarapuava | C17: 1830000 | D17: 1928841 | E17: 1649743 | G17: 1396245 | H17: 1071902 | I17: 850680 | K17: =IF(C17=0,0,((D17/C17)*100)-100) -> 5.4 | L17: =IF(D17=0,0,IF(E17=0,0,((D17/E17)*100)-100)) -> 16.92 | M17: =IF(G17=0,0,((D17/G17)*100)-100) -> 38.14 | N17: =IF(H17=0,0,((D17/H17)*100)-100) -> 79.95 | O17: =IF(D17=0,0,IF(I17=0,0,((D17/I17)*100)-100)) -> 126.74 | Q17: 1830000 | R17: =IF(D17=0,0,((D17/Q17)*100)-100) -> 5.4 | S17: =IF(D17=0,0,(D17/$D$32)*100) -> 3.37 | U17: 16.27 | V17: 14.32
A18: Apucarana | C18: 1700000 | D18: 1778090 | E18: 1629979 | G18: 1403236 | H18: 1269616 | I18: 1125888 | K18: =IF(C18=0,0,((D18/C18)*100)-100) -> 4.59 | L18: =IF(D18=0,0,IF(E18=0,0,((D18/E18)*100)-100)) -> 9.09 | M18: =IF(G18=0,0,((D18/G18)*100)-100) -> 26.71 | N18: =IF(H18=0,0,((D18/H18)*100)-100) -> 40.05 | O18: =IF(D18=0,0,IF(I18=0,0,((D18/I18)*100)-100)) -> 57.93 | Q18: 1700000 | R18: =IF(D18=0,0,((D18/Q18)*100)-100) -> 4.59 | S18: =IF(D18=0,0,(D18/$D$32)*100) -> 3.1 | U18: 16.5 | V18: 13.45
A19: Ahu | C19: 1350000 | D19: 1321156 | E19: 1246862 | G19: 1312830 | H19: 1112569 | I19: 1313085 | K19: =IF(C19=0,0,((D19/C19)*100)-100) -> -2.14 | L19: =IF(D19=0,0,IF(E19=0,0,((D19/E19)*100)-100)) -> 5.96 | M19: =IF(G19=0,0,((D19/G19)*100)-100) -> 00.63 | N19: =IF(H19=0,0,((D19/H19)*100)-100) -> 18.75 | O19: =IF(D19=0,0,IF(I19=0,0,((D19/I19)*100)-100)) -> 00.61 | Q19: 1350000 | R19: =IF(D19=0,0,((D19/Q19)*100)-100) -> -2.14 | S19: =IF(D19=0,0,(D19/$D$32)*100) -> 2.31 | U19: 17.1 | V19: 13.56
A20: P.G. Centro | C20: 2100000 | D20: 1750825 | E20: 1750608 | G20: 1685034 | H20: 1427395 | I20: 1172555 | K20: =IF(C20=0,0,((D20/C20)*100)-100) -> -16.63 | L20: =IF(D20=0,0,IF(E20=0,0,((D20/E20)*100)-100)) -> 00.01 | M20: =IF(G20=0,0,((D20/G20)*100)-100) -> 3.9 | N20: =IF(H20=0,0,((D20/H20)*100)-100) -> 22.66 | O20: =IF(D20=0,0,IF(I20=0,0,((D20/I20)*100)-100)) -> 49.32 | Q20: 2100000 | R20: =IF(D20=0,0,((D20/Q20)*100)-100) -> -16.63 | S20: =IF(D20=0,0,(D20/$D$32)*100) -> 3.06 | U20: 17.4 | V20: 14.73
A21: Maringa | C21: 2520000 | D21: 2531569 | E21: 2342033 | G21: 2074675 | H21: 1917078 | I21: 1666613 | K21: =IF(C21=0,0,((D21/C21)*100)-100) -> 00.46 | L21: =IF(D21=0,0,IF(E21=0,0,((D21/E21)*100)-100)) -> 8.09 | M21: =IF(G21=0,0,((D21/G21)*100)-100) -> 22.02 | N21: =IF(H21=0,0,((D21/H21)*100)-100) -> 32.05 | O21: =IF(D21=0,0,IF(I21=0,0,((D21/I21)*100)-100)) -> 51.9 | Q21: 2520000 | R21: =IF(D21=0,0,((D21/Q21)*100)-100) -> 00.46 | S21: =IF(D21=0,0,(D21/$D$32)*100) -> 4.42 | U21: 17.13 | V21: 14.45
A22: Araucaria Nova | C22: 2450000 | D22: 2421221 | E22: 2149964 | G22: 1944220 | H22: 1780481 | I22: 0 | K22: =IF(C22=0,0,((D22/C22)*100)-100) -> -1.17 | L22: =IF(D22=0,0,IF(E22=0,0,((D22/E22)*100)-100)) -> 12.62 | M22: =IF(G22=0,0,((D22/G22)*100)-100) -> 24.53 | N22: =IF(H22=0,0,((D22/H22)*100)-100) -> 35.99 | O22: =IF(D22=0,0,IF(I22=0,0,((D22/I22)*100)-100)) -> 0 | Q22: 2450000 | R22: =IF(D22=0,0,((D22/Q22)*100)-100) -> -1.17 | S22: =IF(D22=0,0,(D22/$D$32)*100) -> 4.23 | U22: 16.25 | V22: 14.74
A23: Total Super | C23: =SUM(C7:C22) -> 31120000 | D23: =SUM(D7:D22) -> 29764138 | E23: =SUM(E7:E22) -> 27368706 | G23: =SUM(G7:G22) -> 25996259 | H23: =SUM(H7:H22) -> 23070636 | I23: =SUM(I7:I22) -> 20003510 | J23: =SUM(C23:I23) -> 157323249 | K23: =IF(D23=0,0,((D23/C23)*100)-100) -> -4.36 | L23: =IF(D23=0,0,IF(E23=0,0,((D23/E23)*100)-100)) -> 8.75 | M23: =IF(G23=0,0,IF(D23=0,0,((D23/G23)*100)-100)) -> 14.49 | N23: =IF(H23=0,0,IF(D23=0,0,((D23/H23)*100)-100)) -> 29.01 | O23: =IF(D23=0,0,IF(I23=0,0,((D23/I23)*100)-100)) -> 48.79 | Q23: =SUM(Q7:Q22) -> 31120000 | R23: =IF(D23=0,0,((D23/Q23)*100)-100) -> -4.36 | S23: =IF(D23=0,0,(D23/$D$32)*100) -> 51.97 | U23: 16.49 | V23: 13.29
A25: Londrina | C25: 2750000 | D25: 2808146 | E25: 2407890 | G25: 2263517 | H25: 2171010 | I25: 1924035 | K25: =IF(C25=0,0,((D25/C25)*100)-100) -> 2.11 | L25: =IF(D25=0,0,IF(E25=0,0,((D25/E25)*100)-100)) -> 16.62 | M25: =IF(G25=0,0,((D25/G25)*100)-100) -> 24.06 | N25: =IF(H25=0,0,((D25/H25)*100)-100) -> 29.35 | O25: =IF(D25=0,0,IF(I25=0,0,((D25/I25)*100)-100)) -> 45.95 | Q25: 2750000 | R25: =IF(D25=0,0,((D25/Q25)*100)-100) -> 2.11 | S25: =IF(D25=0,0,(D25/$D$32)*100) -> 4.9 | U25: 17.49 | V25: 12.65
A26: S.J. Pinhais | C26: 5000000 | D26: 4920835 | E26: 4212584 | G26: 4232057 | H26: 3645421 | I26: 3044574 | K26: =IF(C26=0,0,((D26/C26)*100)-100) -> -1.58 | L26: =IF(D26=0,0,IF(E26=0,0,((D26/E26)*100)-100)) -> 16.81 | M26: =IF(G26=0,0,((D26/G26)*100)-100) -> 16.28 | N26: =IF(H26=0,0,((D26/H26)*100)-100) -> 34.99 | O26: =IF(D26=0,0,IF(I26=0,0,((D26/I26)*100)-100)) -> 61.63 | Q26: 5000000 | R26: =IF(D25=0,0,((D26/Q26)*100)-100) -> -1.58 | S26: =IF(D26=0,0,(D26/$D$32)*100) -> 8.59 | U26: 15.3 | V26: 12.9
A27: P.G. Nova | C27: 3800000 | D27: 3993179 | E27: 3481841 | G27: 3144267 | H27: 3093350 | I27: 2415181 | K27: =IF(C27=0,0,((D27/C27)*100)-100) -> 5.08 | L27: =IF(D27=0,0,IF(E27=0,0,((D27/E27)*100)-100)) -> 14.69 | M27: =IF(G27=0,0,((D27/G27)*100)-100) -> 27 | N27: =IF(H27=0,0,((D27/H27)*100)-100) -> 29.09 | O27: =IF(D27=0,0,IF(I27=0,0,((D27/I27)*100)-100)) -> 65.34 | Q27: 3800000 | R27: =IF(D26=0,0,((D27/Q27)*100)-100) -> 5.08 | S27: =IF(D27=0,0,(D27/$D$32)*100) -> 6.97 | U27: 15.56 | V27: 13.57
A28: Nilo Pecanha | C28: 10500000 | D28: 9745598 | E28: 7986774 | G28: 8773218 | H28: 6720514 | I28: 0 | K28: =IF(C28=0,0,((D28/C28)*100)-100) -> -7.18 | L28: =IF(D28=0,0,IF(E28=0,0,((D28/E28)*100)-100)) -> 22.02 | M28: =IF(G28=0,0,((D28/G28)*100)-100) -> 11.08 | N28: =IF(H28=0,0,((D28/H28)*100)-100) -> 45.01 | O28: =IF(D28=0,0,IF(I28=0,0,((D28/I28)*100)-100)) -> 0 | Q28: 10500000 | R28: =IF(D26=0,0,((D28/Q28)*100)-100) -> -7.18 | S28: =IF(D28=0,0,(D28/$D$32)*100) -> 17.02 | U28: 15.1 | V28: 13.42
A29: Champagnat | C29: 6200000 | D29: 6036503 | E29: 4711048 | G29: 0 | H29: 0 | I29: 0 | K29: =IF(C29=0,0,((D29/C29)*100)-100) -> -2.64 | L29: =IF(D29=0,0,IF(E29=0,0,((D29/E29)*100)-100)) -> 28.14 | M29: =IF(G29=0,0,((D29/G29)*100)-100) -> 0 | N29: =IF(H29=0,0,((D29/H29)*100)-100) -> 0 | O29: =IF(D29=0,0,IF(I29=0,0,((D29/I29)*100)-100)) -> 0 | Q29: 6200000 | R29: =IF(D27=0,0,((D29/Q29)*100)-100) -> -2.64 | S29: =IF(D29=0,0,(D29/$D$32)*100) -> 10.54 | U29: 14.5 | V29: 12.21
A30: Total Hiper | C30: =SUM(C25:C29) -> 28250000 | D30: =SUM(D25:D29) -> 27504261 | E30: =SUM(E25:E29) -> 22800137 | G30: =SUM(G25:G29) -> 18413059 | H30: =SUM(H25:H29) -> 15630295 | I30: =SUM(I25:I29) -> 7383790 | J30: =SUM(C30:I30) -> 119981542 | K30: =IF(D30=0,0,((D30/C30)*100)-100) -> -2.64 | L30: =IF(D30=0,0,IF(E30=0,0,((D30/E30)*100)-100)) -> 20.63 | M30: =IF(G30=0,0,IF(D30=0,0,((D30/G30)*100)-100)) -> 49.37 | N30: =IF(H30=0,0,IF(D30=0,0,((D30/H30)*100)-100)) -> 75.97 | O30: =IF(D30=0,0,IF(I30=0,0,((D30/I30)*100)-100)) -> 272.5 | Q30: =SUM(Q25:Q29) -> 28250000 | R30: =IF(D30=0,0,((D30/Q30)*100)-100) -> -2.64 | S30: =IF(D30=0,0,(D30/$D$32)*100) -> 48.03 | U30: 15.3 | V30: 0
A32: Total Geral | C32: =C23+C30 -> 59370000 | D32: =D23+D30 -> 57268399 | E32: =E23+E30 -> 50168843 | G32: =G23+G30 -> 44409318 | H32: =H23+H30 -> 38700931 | I32: =I23+I30 -> 27387300 | K32: =IF(D30=0,0,((D32/C32)*100)-100) -> -3.54 | L32: =IF(D32=0,0,IF(E32=0,0,((D32/E32)*100)-100)) -> 14.15 | M32: =IF(G32=0,0,IF(D32=0,0,((D32/G32)*100)-100)) -> 28.96 | N32: =IF(H32=0,0,IF(D32=0,0,((D32/H32)*100)-100)) -> 47.98 | O32: =IF(D32=0,0,IF(I32=0,0,((D32/I32)*100)-100)) -> 109.11 | Q32: =Q23+Q30 -> 59370000 | R32: =IF(D32=0,0,((D32/Q32)*100)-100) -> -3.54 | S32: =S23+S30 -> 100 | U32: 15.86 | V32: 13.52
C33: Resumo por Regiao - Outubro/2002
C34: Descricao das Aberturas | H34: Valor | I34: %
C35: Curitiba (2,3,6,7,10,11,17,21,22) | H35: =D7+D8+D11+D12+D14+D16+D19+D28+D29 -> 29101511 | I35: =IF(D32=0,0,H35/$D$32) -> 0.50819999999999999
C36: Curitiba e Metrop. (Ctba. 4,5,8,14,23) | H36: =H35+D9+D10+D13+D27+D22 -> 41550093 | I36: =IF(D32=0,0,H36/$D$32) -> 0.72550000000000003
C37: Metropolitana (4,5,8,14,23) | H37: =H36-H35 -> 12448582 | I37: =IF(D32=0,0,H37/$D$32) -> 0.21740000000000001
C38: Norte (9,15,20) | H38: =D25+D18+D22 -> 7007457 | I38: =IF(D32=0,0,H38/$D$32) -> 0.12239999999999999
C39: Centro-Oeste (13,18,19) | H39: =D17+D20+D27 -> 7672845 | I39: =IF(D32=0,0,H39/$D$32) -> 0.13400000000000001
C40: Ponta Grossa (18,19) | H40: =H39-D17 -> 5744004 | I40: =IF(D32=0,0,H40/$D$32) -> 0.1003
C41: Super (2,3,4,5,6,7,8,10,11,13,15,17,18,20,23) | H41: =D23 -> 29764138 | I41: =IF(D32=0,0,H41/$D$32) -> 0.51970000000000005
C42: Hiper (9,14,19,21,22) | H42: =D30 -> 27504261 | I42: =IF(D32=0,0,H42/$D$32) -> 0.4803
C43: Curitiba, Metropolitana e Centro-Oeste | H43: =D32-H38 -> 50260942 | I43: =IF(D32=0,0,H43/$D$32) -> 0.87760000000000005
C44: Araucaria | H44: =D10+D22 -> 3467510 | I44: =IF(D32=0,0,H44/$D$32) -> 6.0499999999999998E-2