A2: Periodo: | B2: 40817 | C2: a | D2: 40847 | G2: Vendas Acumuladas por Filial | P2: =NOW() -> 40848.374795254633
A4: v.New | B4: Vendas 2011 | F4: Vendas de Anos Anteriores | J4: Percentuais ( % ) | P4: Meta Mensal | T4: Margem
A5: Lojas | B5: Previsao | C5: Realizada | D5: Mes Anterior | F5: Vendas 2010 | G5: Vendas 2009 | H5: Vendas 2008 | J5: % Prev | K5: % MA | L5: 2010 | M5: 2009 | N5: 2008 | P5: Previsao Mes | Q5: Final | R5: Part. | T5: Meta | U5: Coml | V5: Dif
A6: S. Felicidade | B6: 3900000 | C6: 3824682.45 | D6: 3638940.06 | F6: 3371168.01 | G6: 2887926.91 | H6: 2399249.45 | J6: =IF(B6=0,0,((C6/B6)*100)-100) -> -1.9312192307692158 | K6: =IF(C6=0,0,IF(D6=0,0,((C6/D6)*100)-100)) -> 5.1042992447641495 | L6: =IF(F6=0,0,((C6/F6)*100)-100) -> 13.452739188753753 | M6: =IF(G6=0,0,((C6/G6)*100)-100) -> 32.436954576527 | N6: =IF(C6=0,0,IF(H6=0,0,((C6/H6)*100)-100)) -> 59.41162141352163 | P6: 3900000 | Q6: =IF(C6=0,0,((C6/P6)*100)-100) -> -1.9312192307692158 | R6: =IF(C6=0,0,(C6/$C$42)*100) -> 2.3703774592906579 | T6: 17 | U6: 17.149846257170971 | V6: =U6-T6 -> 0.14984625717097089
A7: Lapa | B7: 2750000 | C7: 2640872.72 | D7: 2640019.66 | F7: 2554116.3 | G7: 2329148.66 | H7: 1926360.26 | J7: =IF(B7=0,0,((C7/B7)*100)-100) -> -3.9682647272727252 | K7: =IF(C7=0,0,IF(D7=0,0,((C7/D7)*100)-100)) -> 3.231263815663965E-2 | L7: =IF(F7=0,0,((C7/F7)*100)-100) -> 3.3967294284915823 | M7: =IF(G7=0,0,((C7/G7)*100)-100) -> 13.383605149531348 | N7: =IF(C7=0,0,IF(H7=0,0,((C7/H7)*100)-100)) -> 37.091320602720486 | P7: 2750000 | Q7: =IF(C7=0,0,((C7/P7)*100)-100) -> -3.9682647272727252 | R7: =IF(C7=0,0,(C7/$C$42)*100) -> 1.6367019354361325 | T7: 15.9 | U7: 15.235273057764024 | V7: =U7-T7 -> -0.66472694223597628
A8: Araucaria | B8: 1699999 | C8: 1515193.54 | D8: 1590234.53 | F8: 1542711.24 | G8: 1344868.41 | H8: 1182224.54 | J8: =IF(B8=0,0,((C8/B8)*100)-100) -> -10.870915806421053 | K8: =IF(C8=0,0,IF(D8=0,0,((C8/D8)*100)-100)) -> -4.7188630723544946 | L8: =IF(F8=0,0,((C8/F8)*100)-100) -> -1.7837233103973489 | M8: =IF(G8=0,0,((C8/G8)*100)-100) -> 12.664817519209933 | N8: =IF(C8=0,0,IF(H8=0,0,((C8/H8)*100)-100)) -> 28.164615835161044 | P8: 1700000 | Q8: =IF(C8=0,0,((C8/P8)*100)-100) -> -10.870968235294114 | R8: =IF(C8=0,0,(C8/$C$42)*100) -> 0.93905328367295382 | T8: 16.84 | U8: 16.155808056045434 | V8: =U8-T8 -> -0.68419194395456628
A9: Hauer | B9: 4600000 | C9: 4487089.51 | D9: 4224868.15 | F9: 4348085.95 | G9: 3853251.52 | H9: 3880592.13 | J9: =IF(B9=0,0,((C9/B9)*100)-100) -> -2.4545758695652182 | K9: =IF(C9=0,0,IF(D9=0,0,((C9/D9)*100)-100)) -> 6.2066164123961869 | L9: =IF(F9=0,0,((C9/F9)*100)-100) -> 3.1968908066318136 | M9: =IF(G9=0,0,((C9/G9)*100)-100) -> 16.449432037076051 | N9: =IF(C9=0,0,IF(H9=0,0,((C9/H9)*100)-100)) -> 15.62899062004746 | P9: 4600000 | Q9: =IF(C9=0,0,((C9/P9)*100)-100) -> -2.4545758695652182 | R9: =IF(C9=0,0,(C9/$C$42)*100) -> 2.7809095189911943 | T9: 15.6 | U9: 16.506688318771694 | V9: =U9-T9 -> 0.90668831877169431
A10: Paranagua | B10: 2500000 | C10: 2351588.47 | D10: 2438944.48 | F10: 2282985.31 | G10: 2104447.28 | H10: 1903588.56 | J10: =IF(B10=0,0,((C10/B10)*100)-100) -> -5.9364611999999823 | K10: =IF(C10=0,0,IF(D10=0,0,((C10/D10)*100)-100)) -> -3.5817137584042058 | L10: =IF(F10=0,0,((C10/F10)*100)-100) -> 3.0049759715711843 | M10: =IF(G10=0,0,((C10/G10)*100)-100) -> 11.74375772435603 | N10: =IF(C10=0,0,IF(H10=0,0,((C10/H10)*100)-100)) -> 23.534492663687786 | P10: 2500000 | Q10: =IF(C10=0,0,((C10/P10)*100)-100) -> -5.9364611999999823 | R10: =IF(C10=0,0,(C10/$C$42)*100) -> 1.4574157137714285 | T10: 17.39 | U10: 17.628349317429677 | V10: =U10-T10 -> 0.23834931742967669
A11: Sitio Cercado | B11: 3450000 | C11: 3423679.26 | D11: 3216266.34 | F11: 2924421.74 | G11: 2336130.01 | H11: 2003761.41 | J11: =IF(B11=0,0,((C11/B11)*100)-100) -> -0.76292000000000826 | K11: =IF(C11=0,0,IF(D11=0,0,((C11/D11)*100)-100)) -> 6.4488726390737838 | L11: =IF(F11=0,0,((C11/F11)*100)-100) -> 17.072008225462014 | M11: =IF(G11=0,0,((C11/G11)*100)-100) -> 46.553455729974559 | N11: =IF(C11=0,0,IF(H11=0,0,((C11/H11)*100)-100)) -> 70.862620814720657 | P11: 3450000 | Q11: =IF(C11=0,0,((C11/P11)*100)-100) -> -0.76292000000000826 | R11: =IF(C11=0,0,(C11/$C$42)*100) -> 2.1218525333377465 | T11: 15.08 | U11: 15.005532673641866 | V11: =U11-T11 -> -7.446732635813369E-2
A12: Apucarana | B12: 3000000 | C12: 2602655.4 | D12: 2332622.25 | F12: 3047037.02 | G12: 2810675.47 | H12: 2540968.52 | J12: =IF(B12=0,0,((C12/B12)*100)-100) -> -13.244820000000004 | K12: =IF(C12=0,0,IF(D12=0,0,((C12/D12)*100)-100)) -> 11.576377186661915 | L12: =IF(F12=0,0,((C12/F12)*100)-100) -> -14.584057137579507 | M12: =IF(G12=0,0,((C12/G12)*100)-100) -> -7.4010703910971358 | N12: =IF(C12=0,0,IF(H12=0,0,((C12/H12)*100)-100)) -> 2.4276916268132283 | P12: 3000000 | Q12: =IF(C12=0,0,((C12/P12)*100)-100) -> -13.244820000000004 | R12: =IF(C12=0,0,(C12/$C$42)*100) -> 1.6130164464924692 | T12: 17.1 | U12: 16.214805847904415 | V12: =U12-T12 -> -0.88519415209558616
A13: Ahú | B13: 2450000 | C13: 2394387.76 | D13: 2300493.73 | F13: 1956771.47 | G13: 1749001.79 | H13: 1645024.18 | J13: =IF(B13=0,0,((C13/B13)*100)-100) -> -2.2698873469387877 | K13: =IF(C13=0,0,IF(D13=0,0,((C13/D13)*100)-100)) -> 4.0814729801502097 | L13: =IF(F13=0,0,((C13/F13)*100)-100) -> 22.364200250732381 | M13: =IF(G13=0,0,((C13/G13)*100)-100) -> 36.900246397117741 | N13: =IF(C13=0,0,IF(H13=0,0,((C13/H13)*100)-100)) -> 45.553347428607395 | P13: 2450000 | Q13: =IF(C13=0,0,((C13/P13)*100)-100) -> -2.2698873469387877 | R13: =IF(C13=0,0,(C13/$C$42)*100) -> 1.483940915174657 | T13: 16.99 | U13: 16.43959372729169 | V13: =U13-T13 -> -0.55040627270830811
A14: P.G. Centro | B14: 2450000 | C14: 2257331.83 | D14: 2319079.42 | F14: 2053022.82 | G14: 1987869.51 | H14: 2060524.4 | J14: =IF(B14=0,0,((C14/B14)*100)-100) -> -7.8640069387755034 | K14: =IF(C14=0,0,IF(D14=0,0,((C14/D14)*100)-100)) -> -2.6625905722538761 | L14: =IF(F14=0,0,((C14/F14)*100)-100) -> 9.9516190472739083 | M14: =IF(G14=0,0,((C14/G14)*100)-100) -> 13.555332412136039 | N14: =IF(C14=0,0,IF(H14=0,0,((C14/H14)*100)-100)) -> 9.5513273223069035 | P14: 2450000 | Q14: =IF(C14=0,0,((C14/P14)*100)-100) -> -7.8640069387755034 | R14: =IF(C14=0,0,(C14/$C$42)*100) -> 1.3989994092114317 | T14: 17.48 | U14: 17.341097360949366 | V14: =U14-T14 -> -0.13890263905063449
A15: Maringa | B15: 3899999 | C15: 3871629.24 | D15: 3705989.07 | F15: 3471446.99 | G15: 3117597.72 | H15: 3255575.44 | J15: =IF(B15=0,0,((C15/B15)*100)-100) -> -0.72742993011023316 | K15: =IF(C15=0,0,IF(D15=0,0,((C15/D15)*100)-100)) -> 4.4695266734826191 | L15: =IF(F15=0,0,((C15/F15)*100)-100) -> 11.527822580980839 | M15: =IF(G15=0,0,((C15/G15)*100)-100) -> 24.186299443406071 | N15: =IF(C15=0,0,IF(H15=0,0,((C15/H15)*100)-100)) -> 18.923038687132987 | P15: 3900000 | Q15: =IF(C15=0,0,((C15/P15)*100)-100) -> -0.72745538461538217 | R15: =IF(C15=0,0,(C15/$C$42)*100) -> 2.3994731069050248 | T15: 17.32 | U15: 16.256010836409533 | V15: =U15-T15 -> -1.0639891635904668
A16: Araucaria Nova | B16: 0 | C16: 0 | D16: 0 | F16: 0 | G16: 0 | H16: 0 | J16: =IF(B16=0,0,((C16/B16)*100)-100) -> 0 | K16: =IF(C16=0,0,IF(D16=0,0,((C16/D16)*100)-100)) -> 0 | L16: =IF(F16=0,0,((C16/F16)*100)-100) -> 0 | M16: =IF(G16=0,0,((C16/G16)*100)-100) -> 0 | N16: =IF(C16=0,0,IF(H16=0,0,((C16/H16)*100)-100)) -> 0 | P16: 0 | Q16: =IF(C16=0,0,((C16/P16)*100)-100) -> 0 | R16: =IF(C16=0,0,(C16/$C$42)*100) -> 0 | T16: 0 | U16: 0 | V16: =U16-T16 -> 0
A17: Cristo Rei | B17: 3200000 | C17: 3083382.2 | D17: 2955221.15 | F17: 2700737.22 | G17: 2206011.95 | H17: 1840760.77 | J17: =IF(B17=0,0,((C17/B17)*100)-100) -> -3.6443062499999996 | K17: =IF(C17=0,0,IF(D17=0,0,((C17/D17)*100)-100)) -> 4.3367668101590482 | L17: =IF(F17=0,0,((C17/F17)*100)-100) -> 14.168167756802347 | M17: =IF(G17=0,0,((C17/G17)*100)-100) -> 39.771781381329333 | N17: =IF(C17=0,0,IF(H17=0,0,((C17/H17)*100)-100)) -> 67.505862263677017 | P17: 3200000 | Q17: =IF(C17=0,0,((C17/P17)*100)-100) -> -3.6443062499999996 | R17: =IF(C17=0,0,(C17/$C$42)*100) -> 1.9109507157275343 | T17: 17.38 | U17: 17.929177900812942 | V17: =U17-T17 -> 0.54917790081294271
A18: Fazenda | B18: 3200000 | C18: 3655219.22 | D18: 3271428.68 | F18: 3061194.43 | G18: 0 | H18: 0 | J18: =IF(B18=0,0,((C18/B18)*100)-100) -> 14.225600624999998 | K18: =IF(C18=0,0,IF(D18=0,0,((C18/D18)*100)-100)) -> 11.731588169606681 | L18: =IF(F18=0,0,((C18/F18)*100)-100) -> 19.405000354714488 | M18: =IF(G18=0,0,((C18/G18)*100)-100) -> 0 | N18: =IF(C18=0,0,IF(H18=0,0,((C18/H18)*100)-100)) -> 0 | P18: 3200000 | Q18: =IF(C18=0,0,((C18/P18)*100)-100) -> 14.225600624999998 | R18: =IF(C18=0,0,(C18/$C$42)*100) -> 2.265351270627443 | T18: 15.5 | U18: 15.294414270452428 | V18: =U18-T18 -> -0.20558572954757182
A19: Campo Largo | B19: 4600000 | C19: 4620453.2 | D19: 4190439.87 | F19: 4080096.65 | G19: 3485494.24 | H19: 2389023.39 | J19: =IF(B19=0,0,((C19/B19)*100)-100) -> 0.44463478260870204 | K19: =IF(C19=0,0,IF(D19=0,0,((C19/D19)*100)-100)) -> 10.261770681367636 | L19: =IF(F19=0,0,((C19/F19)*100)-100) -> 13.243719361402867 | M19: =IF(G19=0,0,((C19/G19)*100)-100) -> 32.562353624776051 | N19: =IF(C19=0,0,IF(H19=0,0,((C19/H19)*100)-100)) -> 93.403430847112787 | P19: 4600000 | Q19: =IF(C19=0,0,((C19/P19)*100)-100) -> 0.44463478260870204 | R19: =IF(C19=0,0,(C19/$C$42)*100) -> 2.863562729760059 | T19: 15.9 | U19: 16.863154679285575 | V19: =U19-T19 -> 0.96315467928557474
A20: Brasilia | B20: 3400000 | C20: 3311588.72 | D20: 3084347.13 | F20: 2855170.26 | G20: 2517461.14 | H20: 2305238.93 | J20: =IF(B20=0,0,((C20/B20)*100)-100) -> -2.6003317647058708 | K20: =IF(C20=0,0,IF(D20=0,0,((C20/D20)*100)-100)) -> 7.3675750627978118 | L20: =IF(F20=0,0,((C20/F20)*100)-100) -> 15.985682759248149 | M20: =IF(G20=0,0,((C20/G20)*100)-100) -> 31.544780071560524 | N20: =IF(C20=0,0,IF(H20=0,0,((C20/H20)*100)-100)) -> 43.654901750249365 | P20: 3400000 | Q20: =IF(C20=0,0,((C20/P20)*100)-100) -> -2.6003317647058708 | R20: =IF(C20=0,0,(C20/$C$42)*100) -> 2.0523835269851491 | T20: 16 | U20: 15.906337547858296 | V20: =U20-T20 -> -9.3662452141703767E-2
A21: Cajuru | B21: 5400000 | C21: 5547241.3200000003 | D21: 5283567.02 | F21: 4968660.87 | G21: 0 | H21: 0 | J21: =IF(B21=0,0,((C21/B21)*100)-100) -> 2.7266911111111227 | K21: =IF(C21=0,0,IF(D21=0,0,((C21/D21)*100)-100)) -> 4.9904600244855146 | L21: =IF(F21=0,0,((C21/F21)*100)-100) -> 11.644595297163036 | M21: =IF(G21=0,0,((C21/G21)*100)-100) -> 0 | N21: =IF(C21=0,0,IF(H21=0,0,((C21/H21)*100)-100)) -> 0 | P21: 5400000 | Q21: =IF(C21=0,0,((C21/P21)*100)-100) -> 2.7266911111111227 | R21: =IF(C21=0,0,(C21/$C$42)*100) -> 3.4379470604608642 | T21: 15.5 | U21: 16.171099619657433 | V21: =U21-T21 -> 0.67109961965743281
A22: Total Super | B22: =SUM(B6:B21) -> 50499998 | C22: =SUM(C6:C21) -> 49586994.840000004 | D22: =SUM(D6:D21) -> 47192461.540000007 | F22: =SUM(F6:F21) -> 45217626.279999994 | G22: =SUM(G6:G21) -> 32729884.609999999 | H22: =SUM(H6:H21) -> 29332891.98 | I22: =SUM(B22:H22) -> 254559857.24999997 | J22: =IF(C22=0,0,((C22/B22)*100)-100) -> -1.8079271211060188 | K22: =IF(C22=0,0,IF(D22=0,0,((C22/D22)*100)-100)) -> 5.0739741515080965 | L22: =IF(F22=0,0,IF(C22=0,0,((C22/F22)*100)-100)) -> 9.6629764086767267 | M22: =IF(G22=0,0,IF(C22=0,0,((C22/G22)*100)-100)) -> 51.503726428811262 | N22: =IF(C22=0,0,IF(H22=0,0,((C22/H22)*100)-100)) -> 69.049116854246165 | P22: =SUM(P6:P21) -> 50500000 | Q22: =IF(C22=0,0,((C22/P22)*100)-100) -> -1.8079310099009831 | R22: =IF(C22=0,0,(C22/$C$42)*100) -> 30.731935625844748 | T22: 16.349891060193706 | U22: 16.381932955225647 | V22: =U22-T22 -> 3.2041895031941436E-2
A23: Pinheirinho | B23: 5400000 | C23: 5409641.5999999996 | D23: 5154599.74 | F23: 5087765.33 | G23: 4875585.94 | H23: 4401581.48 | J23: =IF(B23=0,0,((C23/B23)*100)-100) -> 0.17854814814815256 | K23: =IF(C23=0,0,IF(D23=0,0,((C23/D23)*100)-100)) -> 4.9478499372290514 | L23: =IF(F23=0,0,((C23/F23)*100)-100) -> 6.3264763432003548 | M23: =IF(G23=0,0,((C23/G23)*100)-100) -> 10.953671344781981 | N23: =IF(C23=0,0,IF(H23=0,0,((C23/H23)*100)-100)) -> 22.90222558824469 | P23: 5400000 | Q23: =IF(C23=0,0,IF(P23=0,0,((C23/P23)*100)-100)) -> 0.17854814814815256 | R23: =IF(C23=0,0,(C23/$C$42)*100) -> 3.3526685363071249 | T23: 16 | U23: 15.996429597110465 | V23: =U23-T23 -> -3.5704028895349182E-3
A24: Londrina | B24: 5200000 | C24: 5347701.71 | D24: 4735165.38 | F24: 4610006.23 | G24: 3692713.23 | H24: 3762990.04 | J24: =IF(B24=0,0,((C24/B24)*100)-100) -> 2.8404174999999867 | K24: =IF(C24=0,0,IF(D24=0,0,((C24/D24)*100)-100)) -> 12.935901512271997 | L24: =IF(F24=0,0,((C24/F24)*100)-100) -> 16.00204952434521 | M24: =IF(G24=0,0,((C24/G24)*100)-100) -> 44.817682200575319 | N24: =IF(C24=0,0,IF(H24=0,0,((C24/H24)*100)-100)) -> 42.113097647210367 | P24: 5200000 | Q24: =IF(C24=0,0,IF(P24=0,0,((C24/P24)*100)-100)) -> 2.8404174999999867 | R24: =IF(C24=0,0,(C24/$C$42)*100) -> 3.3142807953622677 | T24: 15.53 | U24: 15.76735157877757 | V24: =U24-T24 -> 0.23735157877757018
A25: São Bráz | B25: 6250000 | C25: 6115995.4400000004 | D25: 5943570.8600000003 | F25: 5928632.3600000003 | G25: 5134753.17 | H25: 4793944.44 | J25: =IF(B25=0,0,((C25/B25)*100)-100) -> -2.1440729600000026 | K25: =IF(C25=0,0,IF(D25=0,0,((C25/D25)*100)-100)) -> 2.9010267406822834 | L25: =IF(F25=0,0,((C25/F25)*100)-100) -> 3.1603086280762369 | M25: =IF(G25=0,0,((C25/G25)*100)-100) -> 19.10982353996971 | N25: =IF(C25=0,0,IF(H25=0,0,((C25/H25)*100)-100)) -> 27.577520276809892 | P25: 6250000 | Q25: =IF(C25=0,0,IF(P25=0,0,((C25/P25)*100)-100)) -> -2.1440729600000026 | R25: =IF(C25=0,0,(C25/$C$42)*100) -> 3.790436963492342 | T25: 15.96 | U25: 15.537905796738134 | V25: =U25-T25 -> -0.42209420326186731
A26: S.J. Pinhais | B26: 7450000 | C26: 7611964.1399999997 | D26: 7046358.7599999998 | F26: 6619431.1900000004 | G26: 5791519.9699999997 | H26: 5335658.98 | J26: =IF(B26=0,0,((C26/B26)*100)-100) -> 2.1740153020134159 | K26: =IF(C26=0,0,IF(D26=0,0,((C26/D26)*100)-100)) -> 8.0269171534490482 | L26: =IF(F26=0,0,((C26/F26)*100)-100) -> 14.994233212959784 | M26: =IF(G26=0,0,((C26/G26)*100)-100) -> 31.432925716044792 | N26: =IF(C26=0,0,IF(H26=0,0,((C26/H26)*100)-100)) -> 42.662118559908407 | P26: 7450000 | Q26: =IF(C26=0,0,IF(P26=0,0,((C26/P26)*100)-100)) -> 2.1740153020134159 | R26: =IF(C26=0,0,(C26/$C$42)*100) -> 4.7175754992116525 | T26: 15.85 | U26: 16.007867845788354 | V26: =U26-T26 -> 0.15786784578835444
A27: P.G. Nova | B27: 7300000 | C27: 7119367.8099999996 | D27: 6920626.46 | F27: 6224828.1900000004 | G27: 5079642.86 | H27: 5226438.2 | J27: =IF(B27=0,0,((C27/B27)*100)-100) -> -2.4744135616438427 | K27: =IF(C27=0,0,IF(D27=0,0,((C27/D27)*100)-100)) -> 2.8717248524926049 | L27: =IF(F27=0,0,((C27/F27)*100)-100) -> 14.370511003613728 | M27: =IF(G27=0,0,((C27/G27)*100)-100) -> 40.154888960047856 | N27: =IF(C27=0,0,IF(H27=0,0,((C27/H27)*100)-100)) -> 36.218348664296826 | P27: 7300000 | Q27: =IF(C27=0,0,IF(P27=0,0,((C27/P27)*100)-100)) -> -2.4744135616438427 | R27: =IF(C27=0,0,(C27/$C$42)*100) -> 4.4122849940714675 | T27: 15.45 | U27: 15.131266830839579 | V27: =U27-T27 -> -0.31873316916042072
A28: Nilo Pecanha | B28: 15500000 | C28: 15375515.710000001 | D28: 14758847.220000001 | F28: 13824439.5 | G28: 12838827.710000001 | H28: 12114686.25 | J28: =IF(B28=0,0,((C28/B28)*100)-100) -> -0.80312445161290213 | K28: =IF(C28=0,0,IF(D28=0,0,((C28/D28)*100)-100)) -> 4.1782971312579207 | L28: =IF(F28=0,0,((C28/F28)*100)-100) -> 11.219812636888477 | M28: =IF(G28=0,0,((C28/G28)*100)-100) -> 19.757940968583966 | N28: =IF(C28=0,0,IF(H28=0,0,((C28/H28)*100)-100)) -> 26.916334378861876 | P28: 15500000 | Q28: =IF(C28=0,0,IF(P28=0,0,((C28/P28)*100)-100)) -> -0.80312445161290213 | R28: =IF(C28=0,0,(C28/$C$42)*100) -> 9.5290985174346687 | T28: 16.25 | U28: 16.831236680515868 | V28: =U28-T28 -> 0.58123668051586819
A29: Champagnat | B29: 7300000 | C29: 7167336.5300000003 | D29: 6900014.4199999999 | F29: 6772006.5599999996 | G29: 6970671.5700000003 | H29: 6748001.7400000002 | J29: =IF(B29=0,0,((C29/B29)*100)-100) -> -1.8173078082191694 | K29: =IF(C29=0,0,IF(D29=0,0,((C29/D29)*100)-100)) -> 3.8742253816913035 | L29: =IF(F29=0,0,((C29/F29)*100)-100) -> 5.8377080189951869 | M29: =IF(G29=0,0,((C29/G29)*100)-100) -> 2.821320127122263 | N29: =IF(C29=0,0,IF(H29=0,0,((C29/H29)*100)-100)) -> 6.2142069038648486 | P29: 7300000 | Q29: =IF(C29=0,0,IF(P29=0,0,((C29/P29)*100)-100)) -> -1.8173078082191694 | R29: =IF(C29=0,0,(C29/$C$42)*100) -> 4.4420139909556466 | T29: 16.95 | U29: 16.854593543133099 | V29: =U29-T29 -> -9.5406456866900413E-2
A30: Araucária Nova | B30: 6200000 | C30: 7160605.2300000004 | D30: 5375837.0199999996 | F30: 4906171.55 | G30: 3838777.88 | H30: 3250245.58 | J30: =IF(B30=0,0,((C30/B30)*100)-100) -> 15.4936327419355 | K30: =IF(C30=0,0,IF(D30=0,0,((C30/D30)*100)-100)) -> 33.199819923112216 | L30: =IF(F30=0,0,((C30/F30)*100)-100) -> 45.950975358780511 | M30: =IF(G30=0,0,((C30/G30)*100)-100) -> 86.533460748190009 | N30: =IF(C30=0,0,IF(H30=0,0,((C30/H30)*100)-100)) -> 120.3096674928791 | P30: 6200000 | Q30: =IF(C30=0,0,IF(P30=0,0,((C30/P30)*100)-100)) -> 15.4936327419355 | R30: =IF(C30=0,0,(C30/$C$42)*100) -> 4.4378422140825835 | T30: 15.95 | U30: 16.309509636240623 | V30: =U30-T30 -> 0.35950963624062382
A31: Santa Candida | B31: 9500000 | C31: 8931576 | D31: 8794728.0199999996 | F31: 8484005.8800000008 | G31: 6911522.2199999997 | H31: 6110074.7599999998 | J31: =IF(B31=0,0,((C31/B31)*100)-100) -> -5.9834105263157937 | K31: =IF(C31=0,0,IF(D31=0,0,((C31/D31)*100)-100)) -> 1.5560228774419897 | L31: =IF(F31=0,0,((C31/F31)*100)-100) -> 5.2754574469955315 | M31: =IF(G31=0,0,((C31/G31)*100)-100) -> 29.227335392983804 | N31: =IF(C31=0,0,IF(H31=0,0,((C31/H31)*100)-100)) -> 46.177851349236192 | P31: 9500000 | Q31: =IF(C31=0,0,IF(P31=0,0,((C31/P31)*100)-100)) -> -5.9834105263157937 | R31: =IF(C31=0,0,(C31/$C$42)*100) -> 5.535415476477378 | T31: 15.8 | U31: 15.709898342688906 | V31: =U31-T31 -> -9.0101657311095096E-2
A32: Paranaguá Raia | B32: 8900000 | C32: 8898200.1999999993 | D32: 8473659.9800000004 | F32: 7914228.8600000003 | G32: 7161697.7599999998 | H32: 6627632.7000000002 | J32: =IF(B32=0,0,((C32/B32)*100)-100) -> -2.0222471910130935E-2 | K32: =IF(C32=0,0,IF(D32=0,0,((C32/D32)*100)-100)) -> 5.0101163015984014 | L32: =IF(F32=0,0,((C32/F32)*100)-100) -> 12.432940181616118 | M32: =IF(G32=0,0,((C32/G32)*100)-100) -> 24.247077972193011 | N32: =IF(C32=0,0,IF(H32=0,0,((C32/H32)*100)-100)) -> 34.259102801517628 | P32: 8900000 | Q32: =IF(C32=0,0,IF(P32=0,0,((C32/P32)*100)-100)) -> -2.0222471910130935E-2 | R32: =IF(C32=0,0,(C32/$C$42)*100) -> 5.5147305581763062 | T32: 17.67 | U32: 18.153285087921489 | V32: =U32-T32 -> 0.48328508792148739
A33: Novo Mundo | B33: 7100000 | C33: 6866128.8399999999 | D33: 6437843.5300000003 | F33: 6305417.6500000004 | G33: 2339476.32 | H33: 0 | J33: =IF(B33=0,0,((C33/B33)*100)-100) -> -3.2939600000000127 | K33: =IF(C33=0,0,IF(D33=0,0,((C33/D33)*100)-100)) -> 6.6526206796454943 | L33: =IF(F33=0,0,((C33/F33)*100)-100) -> 8.8925305368154284 | M33: =IF(G33=0,0,((C33/G33)*100)-100) -> 193.48999095660861 | N33: =IF(C33=0,0,IF(H33=0,0,((C33/H33)*100)-100)) -> 0 | P33: 7100000 | Q33: =IF(C33=0,0,IF(P33=0,0,((C33/P33)*100)-100)) -> -3.2939600000000127 | R33: =IF(C33=0,0,(C33/$C$42)*100) -> 4.2553381222332618 | T33: 15.5 | U33: 16.135129063497157 | V33: =U33-T33 -> 0.63512906349715692
A34: Uvaranas | B34: 6900000 | C34: 6420968.4199999999 | D34: 6154144.4500000002 | F34: 5980623.21 | G34: 4866585.34 | H34: 0 | J34: =IF(B34=0,0,((C34/B34)*100)-100) -> -6.9424866666666674 | K34: =IF(C34=0,0,IF(D34=0,0,((C34/D34)*100)-100)) -> 4.3356793485729668 | L34: =IF(F34=0,0,((C34/F34)*100)-100) -> 7.3628649479825725 | M34: =IF(G34=0,0,((C34/G34)*100)-100) -> 31.939912102722928 | N34: =IF(C34=0,0,IF(H34=0,0,((C34/H34)*100)-100)) -> 0 | P34: 6900000 | Q34: =IF(C34=0,0,IF(P34=0,0,((C34/P34)*100)-100)) -> -6.9424866666666674 | R34: =IF(C34=0,0,(C34/$C$42)*100) -> 3.9794464007293335 | T34: 15.1 | U34: 15.463737944999892 | V34: =U34-T34 -> 0.36373794499989209
A35: Torres | B35: 7300000 | C35: 7305001.4299999997 | D35: 6852060.0499999998 | F35: 6122263.2300000004 | G35: 5053258.6 | H35: 0 | J35: =IF(B35=0,0,((C35/B35)*100)-100) -> 6.8512739726031668E-2 | K35: =IF(C35=0,0,IF(D35=0,0,((C35/D35)*100)-100)) -> 6.6102949579374979 | L35: =IF(F35=0,0,((C35/F35)*100)-100) -> 19.318643376919937 | M35: =IF(G35=0,0,((C35/G35)*100)-100) -> 44.560213680732659 | N35: =IF(C35=0,0,IF(H35=0,0,((C35/H35)*100)-100)) -> 0 | P35: 7300000 | Q35: =IF(C35=0,0,IF(P35=0,0,((C35/P35)*100)-100)) -> 6.8512739726031668E-2 | R35: =IF(C35=0,0,(C35/$C$42)*100) -> 4.5273329109343496 | T35: 15.45 | U35: 16.610601265823437 | V35: =U35-T35 -> 1.1606012658234377
A36: Total Hiper | B36: =SUM(B23:B35) -> 100300000 | C36: =SUM(C23:C35) -> 99730003.060000002 | D36: =SUM(D23:D35) -> 93547455.890000001 | F36: =SUM(F23:F35) -> 88779819.74000001 | G36: =SUM(G23:G35) -> 74555032.569999993 | H36: =SUM(H23:H35) -> 58371254.170000002 | I36: =SUM(B36:H36) -> 515283565.43000001 | J36: =IF(C36=0,0,((C36/B36)*100)-100) -> -0.56829206380857045 | K36: =IF(C36=0,0,IF(D36=0,0,((C36/D36)*100)-100)) -> 6.6089955212356557 | L36: =IF(F36=0,0,IF(C36=0,0,((C36/F36)*100)-100)) -> 12.334090508483371 | M36: =IF(G36=0,0,IF(C36=0,0,((C36/G36)*100)-100)) -> 33.766963305076871 | N36: =IF(C36=0,0,IF(H36=0,0,((C36/H36)*100)-100)) -> 70.854651794095588 | P36: =SUM(P23:P35) -> 100300000 | Q36: =IF(C36=0,0,((C36/P36)*100)-100) -> -0.56829206380857045 | R36: =IF(C36=0,0,(C36/$C$42)*100) -> 61.808464979468383 | T36: 16.018559322033898 | U36: 16.29501457071348 | V36: =U36-T36 -> 0.27645524867958216
A37: Total s/ 29,37,38 | B37: =B22+B36 -> 150799998 | C37: =C22+C36 -> 149316997.90000001 | D37: =D22+D36 -> 140739917.43000001 | E37: =E22+E36 -> 0 | F37: =F22+F36 -> 133997446.02000001 | G37: =G22+G36 -> 107284917.17999999 | H37: =H22+H36 -> 87704146.150000006 | I37: =SUM(B37:H37) -> 769843422.67999995 | J37: =IF(C37=0,0,((C37/B37)*100)-100) -> -0.9834218300188553 | K37: =IF(C37=0,0,IF(D37=0,0,((C37/D37)*100)-100)) -> 6.09427703712133 | L37: =IF(F37=0,0,IF(C37=0,0,((C37/F37)*100)-100)) -> 11.432719305495894 | M37: =IF(G37=0,0,IF(C37=0,0,((C37/G37)*100)-100)) -> 39.177996147845846 | N37: =IF(C37=0,0,IF(H37=0,0,((C37/H37)*100)-100)) -> 70.250785686487177 | P37: =P22+P36 -> 150800000 | Q37: =IF(C37=0,0,((C37/P37)*100)-100) -> -0.98342314323606672 | R37: =IF(C37=0,0,(C37/$C$42)*100) -> 92.540400605313138 | T37: 16.129515902513472 | U37: 16.323879479229738 | V37: =U37-T37 -> 0.19436357671626681
A38: Centenário | B38: 0 | C38: 0 | D38: 0 | F38: 0 | G38: 1319094.16 | H38: 1278311.62 | J38: =IF(B38=0,0,((C38/B38)*100)-100) -> 0 | K38: =IF(C38=0,0,IF(D38=0,0,((C38/D38)*100)-100)) -> 0 | L38: =IF(F38=0,0,((C38/F38)*100)-100) -> 0 | M38: =IF(G38=0,0,((C38/G38)*100)-100) -> -100 | N38: =IF(C38=0,0,IF(H38=0,0,((C38/H38)*100)-100)) -> 0 | P38: 0 | Q38: =IF(P38=0,0,IF(C38=0,0,((C38/P38)*100)-100)) -> 0 | R38: =IF(C38=0,0,(C38/$C$42)*100) -> 0 | T38: 0 | U38: 0 | V38: =U38-T38 -> 0
A39: Cajuru | B39: 0 | C39: 0 | D39: 0 | F39: 0 | G39: 0 | H39: 0 | J39: =IF(B39=0,0,((C39/B39)*100)-100) -> 0 | K39: =IF(C39=0,0,IF(D39=0,0,((C39/D39)*100)-100)) -> 0 | L39: =IF(F39=0,0,((C39/F39)*100)-100) -> 0 | M39: =IF(G39=0,0,((C39/G39)*100)-100) -> 0 | N39: =IF(C39=0,0,IF(H39=0,0,((C39/H39)*100)-100)) -> 0 | P39: 0 | Q39: =IF(P39=0,0,IF(C39=0,0,((C39/P39)*100)-100)) -> 0 | R39: =IF(C39=0,0,(C39/$C$42)*100) -> 0 | T39: 0 | U39: 0 | V39: =U39-T39 -> 0
A40: Água Verde | B40: 7200000 | C40: 7201190.0899999999 | D40: 6677654.0099999998 | F40: 0 | G40: 0 | H40: 0 | J40: =IF(B40=0,0,((C40/B40)*100)-100) -> 1.6529027777778538E-2 | K40: =IF(C40=0,0,IF(D40=0,0,((C40/D40)*100)-100)) -> 7.8401198866546338 | L40: =IF(F40=0,0,((C40/F40)*100)-100) -> 0 | M40: =IF(G40=0,0,((C40/G40)*100)-100) -> 0 | N40: =IF(C40=0,0,IF(H40=0,0,((C40/H40)*100)-100)) -> 0 | P40: 7200000 | Q40: =IF(P40=0,0,IF(C40=0,0,((C40/P40)*100)-100)) -> 1.6529027777778538E-2 | R40: =IF(C40=0,0,(C40/$C$42)*100) -> 4.4629950048279863 | T40: 15.7 | U40: 17.002678650300705 | V40: =U40-T40 -> 1.302678650300706
A41: Colombo | B41: 5000000 | C41: 4835120.32 | D41: 4296799.88 | F41: 0 | G41: 0 | H41: 0 | J41: =IF(B41=0,0,((C41/B41)*100)-100) -> -3.297593599999999 | K41: =IF(C41=0,0,IF(D41=0,0,((C41/D41)*100)-100)) -> 12.528403812932524 | L41: =IF(F41=0,0,((C41/F41)*100)-100) -> 0 | M41: =IF(G41=0,0,((C41/G41)*100)-100) -> 0 | N41: =IF(C41=0,0,IF(H41=0,0,((C41/H41)*100)-100)) -> 0 | P41: 5000000 | Q41: =IF(P41=0,0,IF(C41=0,0,((C41/P41)*100)-100)) -> -3.297593599999999 | R41: =IF(C41=0,0,(C41/$C$42)*100) -> 2.9966043898588843 | T41: 15 | U41: 15.123230066795937 | V41: =U41-T41 -> 0.12323006679593718
A42: Total Geral | B42: =B22+B36+SUM(B38:B41) -> 162999998 | C42: =C22+C36+SUM(C38:C41) -> 161353308.31 | D42: =D22+D36+SUM(D38:D41) -> 151714371.31999999 | F42: =F22+F36+SUM(F38:F41) -> 133997446.02000001 | G42: =G22+G36+SUM(G38:G41) -> 108604011.33999999 | H42: =H22+H36+SUM(H38:H41) -> 88982457.770000011 | J42: =IF(C42=0,0,((C42/B42)*100)-100) -> -1.01023908601519 | K42: =IF(C42=0,0,IF(D42=0,0,((C42/D42)*100)-100)) -> 6.3533447135797729 | L42: =IF(F42=0,0,IF(C42=0,0,((C42/F42)*100)-100)) -> 20.415211709271659 | M42: =IF(G42=0,0,IF(C42=0,0,((C42/G42)*100)-100)) -> 48.570302624330338 | N42: =IF(C42=0,0,IF(H42=0,0,((C42/H42)*100)-100)) -> 81.331593163073393 | P42: =P22+P36+SUM(P38:P41) -> 163000000 | Q42: =IF(C42=0,0,((C42/P42)*100)-100) -> -1.0102403006135035 | R42: =R22+R36+SUM(R38:R41) -> 100 | T42: 16.07 | U42: 16.318195539327643 | V42: =U42-T42 -> 0.24819553932764293
A44: Água Verde | B44: 0 | C44: 0 | D44: 0 | F44: 0 | G44: 0 | H44: 0 | J44: =IF(B44=0,0,((C44/B44)*100)-100) -> 0 | K44: =IF(C44=0,0,IF(D44=0,0,((C44/D44)*100)-100)) -> 0 | L44: =IF(F44=0,0,((C44/F44)*100)-100) -> 0 | M44: =IF(G44=0,0,((C44/G44)*100)-100) -> 0 | N44: =IF(C44=0,0,IF(H44=0,0,((C44/H44)*100)-100)) -> 0 | P44: =B44 -> 0 | Q44: =IF(C44=0,0,IF(P44=0,0,((C44/P44)*100)-100)) -> 0 | R44: =IF(C44=0,0,(C44/$C$42)*100) -> 0 | T44: 14.95 | U44: 0 | V44: =U44-T44 -> -14.95
A45: Total Geral | B45: =B42+B44 -> 162999998 | C45: =C42+C44 -> 161353308.31 | D45: =D42+D44 -> 151714371.31999999 | F45: =F42+F44 -> 133997446.02000001 | G45: =G42+G44 -> 108604011.33999999 | H45: =H42+H44 -> 88982457.770000011 | J45: =IF(C45=0,0,((C45/B45)*100)-100) -> -1.01023908601519 | K45: =IF(C45=0,0,IF(D45=0,0,((C45/D45)*100)-100)) -> 6.3533447135797729 | L45: =IF(F45=0,0,IF(C45=0,0,((C45/F45)*100)-100)) -> 20.415211709271659 | M45: =IF(G45=0,0,IF(C45=0,0,((C45/G45)*100)-100)) -> 48.570302624330338 | N45: =IF(C45=0,0,IF(H45=0,0,((C45/H45)*100)-100)) -> 81.331593163073393 | P45: =P42+P44 -> 163000000 | Q45: =IF(C45=0,0,((C45/P45)*100)-100) -> -1.0102403006135035 | R45: =R25+R39+R44 -> 3.790436963492342 | T45: 16.075895693201172 | U45: 16.318195539327643 | V45: =U45-T45 -> 0.24229984612647115