A2: Periodo: | C2: 38626 | D2: a | E2: 38656 | H2: Vendas Acumuladas por Filial | Q2: =NOW() -> 38678.382226273097
A4: v.1 | C4: Vendas 2005 | G4: Vendas de Anos Anteriores | K4: Percentuais ( % ) | Q4: Meta Mensal | U4: Margem
A5: Lojas | C5: Previsao | D5: Realizada | E5: Mes Anterior | G5: Vendas 2004 | H5: Vendas 2003 | I5: Vendas 2002 | K5: % Prev | L5: % MA | M5: 2004 | N5: 2003 | O5: 2002 | Q5: Previsao Mes | R5: Final | S5: Part. | U5: Meta | V5: Real
A7: Xaxim | C7: 920000 | D7: 754298 | E7: 684763 | G7: 909085 | H7: 767208 | I7: 576549 | K7: =IF(C7=0,0,((D7/C7)*100)-100) -> -18.01 | L7: =IF(D7=0,0,IF(E7=0,0,((D7/E7)*100)-100)) -> 10.15 | M7: =IF(G7=0,0,((D7/G7)*100)-100) -> -17.03 | N7: =IF(H7=0,0,((D7/H7)*100)-100) -> -1.68 | O7: =IF(D7=0,0,IF(I7=0,0,((D7/I7)*100)-100)) -> 30.83 | Q7: 920000 | R7: =IF(D7=0,0,((D7/Q7)*100)-100) -> -18.01 | S7: =IF(D7=0,0,(D7/$D$35)*100) -> 1.23 | U7: 17 | V7: 14.55
A8: S. Felicidade | C8: 850000 | D8: 721653 | E8: 691528 | G8: 814043 | H8: 754045 | I8: 677918 | K8: =IF(C8=0,0,((D8/C8)*100)-100) -> -15.1 | L8: =IF(D8=0,0,IF(E8=0,0,((D8/E8)*100)-100)) -> 4.36 | M8: =IF(G8=0,0,((D8/G8)*100)-100) -> -11.35 | N8: =IF(H8=0,0,((D8/H8)*100)-100) -> -4.3 | O8: =IF(D8=0,0,IF(I8=0,0,((D8/I8)*100)-100)) -> 6.45 | Q8: 850000 | R8: =IF(D8=0,0,((D8/Q8)*100)-100) -> -15.1 | S8: =IF(D8=0,0,(D8/$D$35)*100) -> 1.18 | U8: 16.75 | V8: 14.66
A9: Lapa | C9: 1370000 | D9: 1219423 | E9: 1119870 | G9: 1271523 | H9: 1073490 | I9: 950161 | K9: =IF(C9=0,0,((D9/C9)*100)-100) -> -10.99 | L9: =IF(D9=0,0,IF(E9=0,0,((D9/E9)*100)-100)) -> 8.89 | M9: =IF(G9=0,0,((D9/G9)*100)-100) -> -4.1 | N9: =IF(H9=0,0,((D9/H9)*100)-100) -> 13.59 | O9: =IF(D9=0,0,IF(I9=0,0,((D9/I9)*100)-100)) -> 28.34 | Q9: 1370000 | R9: =IF(D9=0,0,((D9/Q9)*100)-100) -> -10.99 | S9: =IF(D9=0,0,(D9/$D$35)*100) -> 2 | U9: 16.9 | V9: 14.35
A10: Araucaria | C10: 1200000 | D10: 919908 | E10: 897389 | G10: 1046115 | H10: 1018623 | I10: 1005277 | K10: =IF(C10=0,0,((D10/C10)*100)-100) -> -23.34 | L10: =IF(D10=0,0,IF(E10=0,0,((D10/E10)*100)-100)) -> 2.51 | M10: =IF(G10=0,0,((D10/G10)*100)-100) -> -12.06 | N10: =IF(H10=0,0,((D10/H10)*100)-100) -> -9.69 | O10: =IF(D10=0,0,IF(I10=0,0,((D10/I10)*100)-100)) -> -8.49 | Q10: 1200000 | R10: =IF(D10=0,0,((D10/Q10)*100)-100) -> -23.34 | S10: =IF(D10=0,0,(D10/$D$35)*100) -> 1.51 | U10: 17.2 | V10: 15.73
A11: Pinheirinho | C11: 2390000 | D11: 1955750 | E11: 1779053 | G11: 2240021 | H11: 1786581 | I11: 1687899 | K11: =IF(C11=0,0,((D11/C11)*100)-100) -> -18.17 | L11: =IF(D11=0,0,IF(E11=0,0,((D11/E11)*100)-100)) -> 9.93 | M11: =IF(G11=0,0,((D11/G11)*100)-100) -> -12.69 | N11: =IF(H11=0,0,((D11/H11)*100)-100) -> 9.47 | O11: =IF(D11=0,0,IF(I11=0,0,((D11/I11)*100)-100)) -> 15.87 | Q11: 2390000 | R11: =IF(D11=0,0,((D11/Q11)*100)-100) -> -18.17 | S11: =IF(D11=0,0,(D11/$D$35)*100) -> 3.2 | U11: 17.24 | V11: 14.94
A12: Hauer | C12: 3890000 | D12: 3216533 | E12: 2920132 | G12: 3569413 | H12: 3066144 | I12: 2578053 | K12: =IF(C12=0,0,((D12/C12)*100)-100) -> -17.31 | L12: =IF(D12=0,0,IF(E12=0,0,((D12/E12)*100)-100)) -> 10.15 | M12: =IF(G12=0,0,((D12/G12)*100)-100) -> -9.89 | N12: =IF(H12=0,0,((D12/H12)*100)-100) -> 4.9 | O12: =IF(D12=0,0,IF(I12=0,0,((D12/I12)*100)-100)) -> 24.77 | Q12: 3890000 | R12: =IF(D12=0,0,((D12/Q12)*100)-100) -> -17.31 | S12: =IF(D12=0,0,(D12/$D$35)*100) -> 5.26 | U12: 16.46 | V12: 15.66
A13: Paranagua | C13: 1850000 | D13: 1533391 | E13: 1493258 | G13: 3715346 | H13: 3136877 | I13: 3047459 | K13: =IF(C13=0,0,((D13/C13)*100)-100) -> -17.11 | L13: =IF(D13=0,0,IF(E13=0,0,((D13/E13)*100)-100)) -> 2.69 | M13: =IF(G13=0,0,((D13/G13)*100)-100) -> -58.73 | N13: =IF(H13=0,0,((D13/H13)*100)-100) -> -51.12 | O13: =IF(D13=0,0,IF(I13=0,0,((D13/I13)*100)-100)) -> -49.68 | Q13: 1850000 | R13: =IF(D13=0,0,((D13/Q13)*100)-100) -> -17.11 | S13: =IF(D13=0,0,(D13/$D$35)*100) -> 2.51 | U13: 17.59 | V13: 15.81
A14: Centenario | C14: 1160000 | D14: 963591 | E14: 883630 | G14: 1070819 | H14: 974981 | I14: 796004 | K14: =IF(C14=0,0,((D14/C14)*100)-100) -> -16.93 | L14: =IF(D14=0,0,IF(E14=0,0,((D14/E14)*100)-100)) -> 9.05 | M14: =IF(G14=0,0,((D14/G14)*100)-100) -> -10.01 | N14: =IF(H14=0,0,((D14/H14)*100)-100) -> -1.17 | O14: =IF(D14=0,0,IF(I14=0,0,((D14/I14)*100)-100)) -> 21.05 | Q14: 1160000 | R14: =IF(D14=0,0,((D14/Q14)*100)-100) -> -16.93 | S14: =IF(D14=0,0,(D14/$D$35)*100) -> 1.58 | U14: 17.1 | V14: 14.28
A15: Arapongas | C15: 0 | D15: 0 | E15: 0 | G15: 0 | H15: 0 | I15: 0 | K15: =IF(C15=0,0,((D15/C15)*100)-100) -> 0 | L15: =IF(D15=0,0,IF(E15=0,0,((D15/E15)*100)-100)) -> 0 | M15: =IF(D15=0,0,IF(G15=0,0,((D15/G15)*100)-100)) -> 0 | N15: =IF(D15=0,0,IF(H15=0,0,((D15/H15)*100)-100)) -> 0 | O15: =IF(D15=0,0,IF(I15=0,0,((D15/I15)*100)-100)) -> 0 | Q15: 0 | R15: =IF(D15=0,0,((D15/Q15)*100)-100) -> 0 | S15: =IF(D15=0,0,(D15/$D$35)*100) -> 0 | U15: 0 | V15: 0
A16: Sao Braz | C16: 3740000 | D16: 3101849 | E16: 2928999 | G16: 3391369 | H16: 3130319 | I16: 2636563 | K16: =IF(C16=0,0,((D16/C16)*100)-100) -> -17.06 | L16: =IF(D16=0,0,IF(E16=0,0,((D16/E16)*100)-100)) -> 5.9 | M16: =IF(G16=0,0,((D16/G16)*100)-100) -> -8.54 | N16: =IF(H16=0,0,((D16/H16)*100)-100) -> -0.91 | O16: =IF(D16=0,0,IF(I16=0,0,((D16/I16)*100)-100)) -> 17.65 | Q16: 3740000 | R16: =IF(D16=0,0,((D16/Q16)*100)-100) -> -17.06 | S16: =IF(D16=0,0,(D16/$D$35)*100) -> 5.08 | U16: 16.3 | V16: 15.14
A17: Sitio Cercado | C17: 1600000 | D17: 1399709 | E17: 1254512 | G17: 1928661 | H17: 1396245 | I17: 1071902 | K17: =IF(C17=0,0,((D17/C17)*100)-100) -> -12.52 | L17: =IF(D17=0,0,IF(E17=0,0,((D17/E17)*100)-100)) -> 11.57 | M17: =IF(G17=0,0,((D17/G17)*100)-100) -> -27.43 | N17: =IF(H17=0,0,((D17/H17)*100)-100) -> 0.25 | O17: =IF(D17=0,0,IF(I17=0,0,((D17/I17)*100)-100)) -> 30.58 | Q17: 1600000 | R17: =IF(D17=0,0,((D17/Q17)*100)-100) -> -12.52 | S17: =IF(D17=0,0,(D17/$D$35)*100) -> 2.29 | U17: 16 | V17: 13.75
A18: Apucarana | C18: 1940000 | D18: 1770813 | E18: 1427764 | G18: 1777628 | H18: 1403236 | I18: 1269616 | K18: =IF(C18=0,0,((D18/C18)*100)-100) -> -8.72 | L18: =IF(D18=0,0,IF(E18=0,0,((D18/E18)*100)-100)) -> 24.03 | M18: =IF(G18=0,0,((D18/G18)*100)-100) -> -0.38 | N18: =IF(H18=0,0,((D18/H18)*100)-100) -> 26.19 | O18: =IF(D18=0,0,IF(I18=0,0,((D18/I18)*100)-100)) -> 39.48 | Q18: 1940000 | R18: =IF(D18=0,0,((D18/Q18)*100)-100) -> -8.72 | S18: =IF(D18=0,0,(D18/$D$35)*100) -> 2.9 | U18: 18 | V18: 15.48
A19: Ahu | C19: 1320000 | D19: 1173008 | E19: 1066777 | G19: 1320549 | H19: 1312830 | I19: 1112569 | K19: =IF(C19=0,0,((D19/C19)*100)-100) -> -11.14 | L19: =IF(D19=0,0,IF(E19=0,0,((D19/E19)*100)-100)) -> 9.96 | M19: =IF(G19=0,0,((D19/G19)*100)-100) -> -11.17 | N19: =IF(H19=0,0,((D19/H19)*100)-100) -> -10.65 | O19: =IF(D19=0,0,IF(I19=0,0,((D19/I19)*100)-100)) -> 5.43 | Q19: 1320000 | R19: =IF(D19=0,0,((D19/Q19)*100)-100) -> -11.14 | S19: =IF(D19=0,0,(D19/$D$35)*100) -> 1.92 | U19: 17.91 | V19: 14.54
A20: P.G. Centro | C20: 2050000 | D20: 1564418 | E20: 1513642 | G20: 1750739 | H20: 1685034 | I20: 1427395 | K20: =IF(C20=0,0,((D20/C20)*100)-100) -> -23.69 | L20: =IF(D20=0,0,IF(E20=0,0,((D20/E20)*100)-100)) -> 3.35 | M20: =IF(G20=0,0,((D20/G20)*100)-100) -> -10.64 | N20: =IF(H20=0,0,((D20/H20)*100)-100) -> -7.16 | O20: =IF(D20=0,0,IF(I20=0,0,((D20/I20)*100)-100)) -> 9.6 | Q20: 2050000 | R20: =IF(D20=0,0,((D20/Q20)*100)-100) -> -23.69 | S20: =IF(D20=0,0,(D20/$D$35)*100) -> 2.56 | U20: 18 | V20: 16.04
A21: Maringa | C21: 2800000 | D21: 2419642 | E21: 2199979 | G21: 2528510 | H21: 2074675 | I21: 1917078 | K21: =IF(C21=0,0,((D21/C21)*100)-100) -> -13.58 | L21: =IF(D21=0,0,IF(E21=0,0,((D21/E21)*100)-100)) -> 9.98 | M21: =IF(G21=0,0,((D21/G21)*100)-100) -> -4.31 | N21: =IF(H21=0,0,((D21/H21)*100)-100) -> 16.63 | O21: =IF(D21=0,0,IF(I21=0,0,((D21/I21)*100)-100)) -> 26.22 | Q21: 2800000 | R21: =IF(D21=0,0,((D21/Q21)*100)-100) -> -13.58 | S21: =IF(D21=0,0,(D21/$D$35)*100) -> 3.96 | U21: 17.8 | V21: 16.33
A22: Araucaria Nova | C22: 2490000 | D22: 2041811 | E22: 1780264 | G22: 2420547 | H22: 1944220 | I22: 1780481 | K22: =IF(C22=0,0,((D22/C22)*100)-100) -> -18 | L22: =IF(D22=0,0,IF(E22=0,0,((D22/E22)*100)-100)) -> 14.69 | M22: =IF(G22=0,0,((D22/G22)*100)-100) -> -15.65 | N22: =IF(H22=0,0,((D22/H22)*100)-100) -> 5.02 | O22: =IF(D22=0,0,IF(I22=0,0,((D22/I22)*100)-100)) -> 14.68 | Q22: 2490000 | R22: =IF(D22=0,0,((D22/Q22)*100)-100) -> -18 | S22: =IF(D22=0,0,(D22/$D$35)*100) -> 3.34 | U22: 17.5 | V22: 16.35
A23: Sitio Cercado | C23: 0 | D23: 0 | E23: 0 | G23: 0 | H23: 0 | I23: 0 | K23: =IF(C23=0,0,((D23/C23)*100)-100) -> 0 | L23: =IF(D23=0,0,IF(E23=0,0,((D23/E23)*100)-100)) -> 0 | M23: =IF(G23=0,0,((D23/G23)*100)-100) -> 0 | N23: =IF(H23=0,0,((D23/H23)*100)-100) -> 0 | O23: =IF(D23=0,0,IF(I23=0,0,((D23/I23)*100)-100)) -> 0 | Q23: 0 | R23: =IF(Q23=0,0,IF(D23=0,0,((D23/Q23)*100)-100)) -> 0 | S23: =IF(D23=0,0,(D23/$D$35)*100) -> 0 | U23: 0 | V23: 0
A24: Total Super | C24: =SUM(C7:C23) -> 29570000 | D24: =SUM(D7:D23) -> 24755797 | E24: =SUM(E7:E23) -> 22641560 | G24: =SUM(G7:G23) -> 29754368 | H24: =SUM(H7:H23) -> 25524508 | I24: =SUM(I7:I23) -> 22534924 | J24: =SUM(C24:I24) -> 154781157 | K24: =IF(D24=0,0,((D24/C24)*100)-100) -> -16.28 | L24: =IF(D24=0,0,IF(E24=0,0,((D24/E24)*100)-100)) -> 9.34 | M24: =IF(G24=0,0,IF(D24=0,0,((D24/G24)*100)-100)) -> -16.8 | N24: =IF(H24=0,0,IF(D24=0,0,((D24/H24)*100)-100)) -> -3.01 | O24: =IF(D24=0,0,IF(I24=0,0,((D24/I24)*100)-100)) -> 9.86 | Q24: =SUM(Q7:Q23) -> 29570000 | R24: =IF(D24=0,0,((D24/Q24)*100)-100) -> -16.28 | S24: =IF(D24=0,0,(D24/$D$35)*100) -> 40.51 | U24: 17.14 | V24: 15.34
A26: Londrina | C26: 3200000 | D26: 3096380 | E26: 2675642 | G26: 2806010 | H26: 2263517 | I26: 2171010 | K26: =IF(C26=0,0,((D26/C26)*100)-100) -> -3.24 | L26: =IF(D26=0,0,IF(E26=0,0,((D26/E26)*100)-100)) -> 15.72 | M26: =IF(G26=0,0,((D26/G26)*100)-100) -> 10.35 | N26: =IF(H26=0,0,((D26/H26)*100)-100) -> 36.8 | O26: =IF(D26=0,0,IF(I26=0,0,((D26/I26)*100)-100)) -> 42.62 | Q26: 3200000 | R26: =IF(D26=0,0,IF(Q26=0,0,((D26/Q26)*100)-100)) -> -3.24 | S26: =IF(D26=0,0,(D26/$D$35)*100) -> 5.07 | U26: 16.8 | V26: 13.49
A27: S.J. Pinhais | C27: 4900000 | D27: 4422822 | E27: 3693460 | G27: 4911701 | H27: 4232057 | I27: 3645421 | K27: =IF(C27=0,0,((D27/C27)*100)-100) -> -9.74 | L27: =IF(D27=0,0,IF(E27=0,0,((D27/E27)*100)-100)) -> 19.75 | M27: =IF(G27=0,0,((D27/G27)*100)-100) -> -9.95 | N27: =IF(H27=0,0,((D27/H27)*100)-100) -> 4.51 | O27: =IF(D27=0,0,IF(I27=0,0,((D27/I27)*100)-100)) -> 21.33 | Q27: 4900000 | R27: =IF(D27=0,0,IF(Q27=0,0,((D27/Q27)*100)-100)) -> -9.74 | S27: =IF(D27=0,0,(D27/$D$35)*100) -> 7.24 | U27: 16.8 | V27: 14.38
A28: P.G. Nova | C28: 4350000 | D28: 3773369 | E28: 3221964 | G28: 3990298 | H28: 3144267 | I28: 3093350 | K28: =IF(C28=0,0,((D28/C28)*100)-100) -> -13.26 | L28: =IF(D28=0,0,IF(E28=0,0,((D28/E28)*100)-100)) -> 17.11 | M28: =IF(G28=0,0,((D28/G28)*100)-100) -> -5.44 | N28: =IF(H28=0,0,((D28/H28)*100)-100) -> 20.01 | O28: =IF(D28=0,0,IF(I28=0,0,((D28/I28)*100)-100)) -> 21.98 | Q28: 4350000 | R28: =IF(D28=0,0,IF(Q28=0,0,((D28/Q28)*100)-100)) -> -13.26 | S28: =IF(D28=0,0,(D28/$D$35)*100) -> 6.17 | U28: 16.95 | V28: 14.18
A29: Nilo Pecanha | C29: 10700000 | D29: 9475278 | E29: 8493887 | G29: 9741202 | H29: 8773218 | I29: 6720514 | K29: =IF(C29=0,0,((D29/C29)*100)-100) -> -11.45 | L29: =IF(D29=0,0,IF(E29=0,0,((D29/E29)*100)-100)) -> 11.55 | M29: =IF(G29=0,0,((D29/G29)*100)-100) -> -2.73 | N29: =IF(H29=0,0,((D29/H29)*100)-100) -> 8 | O29: =IF(D29=0,0,IF(I29=0,0,((D29/I29)*100)-100)) -> 40.99 | Q29: 10700000 | R29: =IF(D29=0,0,IF(Q29=0,0,((D29/Q29)*100)-100)) -> -11.45 | S29: =IF(D29=0,0,(D29/$D$35)*100) -> 15.5 | U29: 15 | V29: 15.28
A30: Champagnat | C30: 6900000 | D30: 6161013 | E30: 5427354 | G30: 6029680 | H30: 0 | I30: 0 | K30: =IF(C30=0,0,((D30/C30)*100)-100) -> -10.71 | L30: =IF(D30=0,0,IF(E30=0,0,((D30/E30)*100)-100)) -> 13.52 | M30: =IF(G30=0,0,((D30/G30)*100)-100) -> 2.18 | N30: =IF(H30=0,0,((D30/H30)*100)-100) -> 0 | O30: =IF(D30=0,0,IF(I30=0,0,((D30/I30)*100)-100)) -> 0 | Q30: 6900000 | R30: =IF(D30=0,0,IF(Q30=0,0,((D30/Q30)*100)-100)) -> -10.71 | S30: =IF(D30=0,0,(D30/$D$35)*100) -> 10.08 | U30: 16.3 | V30: 15.47
A31: Santa Candida | C31: 5800000 | D31: 4775401 | E31: 3944797 | G31: 0 | H31: 0 | I31: 0 | K31: =IF(C31=0,0,((D31/C31)*100)-100) -> -17.67 | L31: =IF(D31=0,0,IF(E31=0,0,((D31/E31)*100)-100)) -> 21.06 | M31: =IF(G31=0,0,((D31/G31)*100)-100) -> 0 | N31: =IF(H31=0,0,((D31/H31)*100)-100) -> 0 | O31: =IF(D31=0,0,IF(I31=0,0,((D31/I31)*100)-100)) -> 0 | Q31: 5800000 | R31: =IF(D31=0,0,IF(Q31=0,0,((D31/Q31)*100)-100)) -> -17.67 | S31: =IF(D31=0,0,(D31/$D$35)*100) -> 7.81 | U31: 15.97 | V31: 13.59
A32: Paranagu Raia | C32: 5300000 | D32: 4657320 | E32: 3971191 | G32: 0 | H32: 0 | I32: 0 | K32: =IF(C32=0,0,((D32/C32)*100)-100) -> -12.13 | L32: =IF(D32=0,0,IF(E32=0,0,((D32/E32)*100)-100)) -> 17.28 | M32: =IF(G32=0,0,((D32/G32)*100)-100) -> 0 | N32: =IF(H32=0,0,((D32/H32)*100)-100) -> 0 | O32: =IF(D32=0,0,IF(I32=0,0,((D32/I32)*100)-100)) -> 0 | Q32: 5300000 | R32: =IF(D32=0,0,IF(Q32=0,0,((D32/Q32)*100)-100)) -> -12.13 | S32: =IF(D32=0,0,(D32/$D$35)*100) -> 7.62 | U32: 15.5 | V32: 14.93
A33: Total Hiper | C33: =SUM(C26:C32) -> 41150000 | D33: =SUM(D26:D32) -> 36361583 | E33: =SUM(E26:E32) -> 31428295 | G33: =SUM(G26:G32) -> 27478891 | H33: =SUM(H26:H32) -> 18413059 | I33: =SUM(I26:I32) -> 15630295 | J33: =SUM(C33:I33) -> 170462123 | K33: =IF(D33=0,0,((D33/C33)*100)-100) -> -11.64 | L33: =IF(D33=0,0,IF(E33=0,0,((D33/E33)*100)-100)) -> 15.7 | M33: =IF(G33=0,0,IF(D33=0,0,((D33/G33)*100)-100)) -> 32.33 | N33: =IF(H33=0,0,IF(D33=0,0,((D33/H33)*100)-100)) -> 97.48 | O33: =IF(D33=0,0,IF(I33=0,0,((D33/I33)*100)-100)) -> 132.64 | Q33: =SUM(Q26:Q32) -> 41150000 | R33: =IF(D33=0,0,((D33/Q33)*100)-100) -> -11.64 | S33: =IF(D33=0,0,(D33/$D$35)*100) -> 59.49 | U33: 15.98 | V33: 14.67
A35: Total Geral | C35: =C24+C33 -> 70720000 | D35: =D24+D33 -> 61117380 | E35: =E24+E33 -> 54069855 | G35: =G24+G33 -> 57233259 | H35: =H24+H33 -> 43937567 | I35: =I24+I33 -> 38165219 | K35: =IF(D33=0,0,((D35/C35)*100)-100) -> -13.58 | L35: =IF(D35=0,0,IF(E35=0,0,((D35/E35)*100)-100)) -> 13.03 | M35: =IF(G35=0,0,IF(D35=0,0,((D35/G35)*100)-100)) -> 6.79 | N35: =IF(H35=0,0,IF(D35=0,0,((D35/H35)*100)-100)) -> 39.1 | O35: =IF(D35=0,0,IF(I35=0,0,((D35/I35)*100)-100)) -> 60.14 | Q35: =Q24+Q33 -> 70720000 | R35: =IF(D35=0,0,((D35/Q35)*100)-100) -> -13.58 | S35: =S24+S33 -> 100 | U35: 16.46 | V35: 14.94
C36: Resumo por Regiao - Outubro/2002
C37: Descricao das Aberturas | H37: Valor | I37: %
C38: Curitiba (2,3,6,7,10,11,17,21,22) | H38: =D7+D8+D11+D12+D14+D16+D19+D29+D30+D32 -> 32180293 | I38: =IF(D35=0,0,H38/$D$35) -> 0.52649999999999997
C39: Curitiba e Metrop. (Ctba. 4,5,8,14,23) | H39: =H38+D9+D10+D13+D28+D23 -> 39626384 | I39: =IF(D35=0,0,H39/$D$35) -> 0.64839999999999998
C40: Metropolitana (4,5,8,14,23) | H40: =H39-H38 -> 7446091 | I40: =IF(D35=0,0,H40/$D$35) -> 0.12180000000000001
C41: Norte (9,15,20) | H41: =D26+D18+D23 -> 4867193 | I41: =IF(D35=0,0,H41/$D$35) -> 7.9600000000000004E-2
C42: Centro-Oeste (13,18,19) | H42: =D17+D20+D28 -> 6737496 | I42: =IF(D35=0,0,H42/$D$35) -> 0.11020000000000001
C43: Ponta Grossa (18,19) | H43: =H42-D17 -> 5337787 | I43: =IF(D35=0,0,H43/$D$35) -> 8.7300000000000003E-2
C44: Super (2,3,4,5,6,7,8,10,11,13,15,17,18,20,23) | H44: =D24 -> 24755797 | I44: =IF(D35=0,0,H44/$D$35) -> 0.40510000000000002
C45: Hiper (9,14,19,21,22,24) | H45: =D33 -> 36361583 | I45: =IF(D35=0,0,H45/$D$35) -> 0.59489999999999998
C46: Curitiba, Metropolitana e Centro-Oeste | H46: =D35-H41 -> 56250187 | I46: =IF(D35=0,0,H46/$D$35) -> 0.9204
C47: Araucaria | H47: =D10+D23 -> 919908 | I47: =IF(D35=0,0,H47/$D$35) -> 1.5100000000000001E-2