A2: Periodo: | B2: 40452 | C2: a | D2: 40482 | G2: Vendas Acumuladas por Filial | P2: =NOW() -> 40491.514521759258
A4: v.New | B4: Vendas 2010 | F4: Vendas de Anos Anteriores | J4: Percentuais ( % ) | P4: Meta Mensal | T4: Margem
A5: Lojas | B5: Previsao | C5: Realizada | D5: Mes Anterior | F5: Vendas 2009 | G5: Vendas 2008 | H5: Vendas 2007 | J5: % Prev | K5: % MA | L5: 2009 | M5: 2008 | N5: 2007 | P5: Previsao Mes | Q5: Final | R5: Part. | T5: Meta | U5: Coml | V5: Dif
A6: S. Felicidade | B6: 3400000 | C6: 3371187.09 | D6: 3058635.75 | F6: 2887926.91 | G6: 2360481.7 | H6: 2006222.66 | J6: =IF(B6=0,0,((C6/B6)*100)-100) -> -0.84743852941177522 | K6: =IF(C6=0,0,IF(D6=0,0,((C6/D6)*100)-100)) -> 10.218651894067477 | L6: =IF(F6=0,0,((C6/F6)*100)-100) -> 16.733809236190098 | M6: =IF(G6=0,0,((C6/G6)*100)-100) -> 42.81776003601297 | N6: =IF(C6=0,0,IF(H6=0,0,((C6/H6)*100)-100)) -> 68.036537380152993 | P6: 3400000 | Q6: =IF(C6=0,0,((C6/P6)*100)-100) -> -0.84743852941177522 | R6: =IF(C6=0,0,(C6/$C$40)*100) -> 2.5159894961430616 | T6: 16.5 | U6: 16.640174114454148 | V6: =U6-T6 -> 0.14017411445414751
A7: Lapa | B7: 2700000 | C7: 2554116.3 | D7: 2413350.94 | F7: 2329148.66 | G7: 1895596.49 | H7: 1469222.7 | J7: =IF(B7=0,0,((C7/B7)*100)-100) -> -5.4031000000000091 | K7: =IF(C7=0,0,IF(D7=0,0,((C7/D7)*100)-100)) -> 5.8327762310441216 | L7: =IF(F7=0,0,((C7/F7)*100)-100) -> 9.6587926680472123 | M7: =IF(G7=0,0,((C7/G7)*100)-100) -> 34.739450799468386 | N7: =IF(C7=0,0,IF(H7=0,0,((C7/H7)*100)-100)) -> 73.841331201866126 | P7: 2700000 | Q7: =IF(C7=0,0,((C7/P7)*100)-100) -> -5.4031000000000091 | R7: =IF(C7=0,0,(C7/$C$40)*100) -> 1.9061919766451705 | T7: 16.203399999999998 | U7: 15.727910028999069 | V7: =U7-T7 -> -0.47548997100092905
A8: Araucaria | B8: 1550001 | C8: 1542711.24 | D8: 1448427.38 | F8: 1344868.41 | G8: 1153732.96 | H8: 1007327.76 | J8: =IF(B8=0,0,((C8/B8)*100)-100) -> -0.47030679335045988 | K8: =IF(C8=0,0,IF(D8=0,0,((C8/D8)*100)-100)) -> 6.5093950378099237 | L8: =IF(F8=0,0,((C8/F8)*100)-100) -> 14.7109433554172 | M8: =IF(G8=0,0,((C8/G8)*100)-100) -> 33.714758396084989 | N8: =IF(C8=0,0,IF(H8=0,0,((C8/H8)*100)-100)) -> 53.148885721167858 | P8: 1550000 | Q8: =IF(C8=0,0,((C8/P8)*100)-100) -> -0.47024258064516289 | R8: =IF(C8=0,0,(C8/$C$40)*100) -> 1.151358608050981 | T8: 16.62 | U8: 16.287905363287557 | V8: =U8-T8 -> -0.33209463671244421
A9: Hauer | B9: 4250000 | C9: 4347064.63 | D9: 3836419.44 | F9: 3853251.52 | G9: 3815753.27 | H9: 3244184.85 | J9: =IF(B9=0,0,((C9/B9)*100)-100) -> 2.2838736470588259 | K9: =IF(C9=0,0,IF(D9=0,0,((C9/D9)*100)-100)) -> 13.310462997758137 | L9: =IF(F9=0,0,((C9/F9)*100)-100) -> 12.815491214027986 | M9: =IF(G9=0,0,((C9/G9)*100)-100) -> 13.924153958728041 | N9: =IF(C9=0,0,IF(H9=0,0,((C9/H9)*100)-100)) -> 33.995589986187127 | P9: 4250000 | Q9: =IF(C9=0,0,((C9/P9)*100)-100) -> 2.2838736470588259 | R9: =IF(C9=0,0,(C9/$C$40)*100) -> 3.2443079117673719 | T9: 16.2 | U9: 15.204461761130982 | V9: =U9-T9 -> -0.99553823886901682
A10: Paranagua | B10: 2400000 | C10: 2282985.31 | D10: 2242909.91 | F10: 2104447.28 | G10: 1865409.17 | H10: 1758746.58 | J10: =IF(B10=0,0,((C10/B10)*100)-100) -> -4.875612083333337 | K10: =IF(C10=0,0,IF(D10=0,0,((C10/D10)*100)-100)) -> 1.7867592372446097 | L10: =IF(F10=0,0,((C10/F10)*100)-100) -> 8.4838442709764763 | M10: =IF(G10=0,0,((C10/G10)*100)-100) -> 22.385230367448017 | N10: =IF(C10=0,0,IF(H10=0,0,((C10/H10)*100)-100)) -> 29.807519511992439 | P10: 2400000 | Q10: =IF(C10=0,0,((C10/P10)*100)-100) -> -4.875612083333337 | R10: =IF(C10=0,0,(C10/$C$40)*100) -> 1.7038410822251078 | T10: 17.949200000000001 | U10: 17.084315662986022 | V10: =U10-T10 -> -0.86488433701397938
A11: Centenario | B11: 0 | C11: 0 | D11: 0 | F11: 0 | G11: 0 | H11: 0 | J11: =IF(B11=0,0,((C11/B11)*100)-100) -> 0 | K11: =IF(C11=0,0,IF(D11=0,0,((C11/D11)*100)-100)) -> 0 | L11: =IF(F11=0,0,((C11/F11)*100)-100) -> 0 | M11: =IF(G11=0,0,((C11/G11)*100)-100) -> 0 | N11: =IF(C11=0,0,IF(H11=0,0,((C11/H11)*100)-100)) -> 0 | P11: 0 | Q11: =IF(C11=0,0,((C11/P11)*100)-100) -> 0 | R11: =IF(C11=0,0,(C11/$C$40)*100) -> 0 | T11: 0 | U11: 0 | V11: =U11-T11 -> 0
A12: Sitio Cercado | B12: 2750000 | C12: 2924421.74 | D12: 2523145.66 | F12: 2336130.01 | G12: 1976409.53 | H12: 1638746.57 | J12: =IF(B12=0,0,((C12/B12)*100)-100) -> 6.3426087272727187 | K12: =IF(C12=0,0,IF(D12=0,0,((C12/D12)*100)-100)) -> 15.903801606126848 | L12: =IF(F12=0,0,((C12/F12)*100)-100) -> 25.182319797347262 | M12: =IF(G12=0,0,((C12/G12)*100)-100) -> 47.966385286555493 | N12: =IF(C12=0,0,IF(H12=0,0,((C12/H12)*100)-100)) -> 78.454789382106839 | P12: 2750000 | Q12: =IF(C12=0,0,((C12/P12)*100)-100) -> 6.3426087272727187 | R12: =IF(C12=0,0,(C12/$C$40)*100) -> 2.182558898008955 | T12: 16.784199999999998 | U12: 13.648024091080652 | V12: =U12-T12 -> -3.1361759089193466
A13: Apucarana | B13: 2999999 | C13: 3047037.02 | D13: 2716420.94 | F13: 2810675.47 | G13: 2496442.32 | H13: 2377022.26 | J13: =IF(B13=0,0,((C13/B13)*100)-100) -> 1.5679345226448334 | K13: =IF(C13=0,0,IF(D13=0,0,((C13/D13)*100)-100)) -> 12.171017942454824 | L13: =IF(F13=0,0,((C13/F13)*100)-100) -> 8.4094215971508106 | M13: =IF(G13=0,0,((C13/G13)*100)-100) -> 22.055174100717863 | N13: =IF(C13=0,0,IF(H13=0,0,((C13/H13)*100)-100)) -> 28.187147056839109 | P13: 3000000 | Q13: =IF(C13=0,0,((C13/P13)*100)-100) -> 1.5679006666666737 | R13: =IF(C13=0,0,(C13/$C$40)*100) -> 2.2740693209877758 | T13: 16.69 | U13: 15.713118372286791 | V13: =U13-T13 -> -0.97688162771320997
A14: Ahú | B14: 2000000 | C14: 1956771.47 | D14: 1844426.26 | F14: 1749001.79 | G14: 1616174.35 | H14: 1510694.54 | J14: =IF(B14=0,0,((C14/B14)*100)-100) -> -2.1614264999999904 | K14: =IF(C14=0,0,IF(D14=0,0,((C14/D14)*100)-100)) -> 6.0910654134798534 | L14: =IF(F14=0,0,((C14/F14)*100)-100) -> 11.879329180103355 | M14: =IF(G14=0,0,((C14/G14)*100)-100) -> 21.074280754424791 | N14: =IF(C14=0,0,IF(H14=0,0,((C14/H14)*100)-100)) -> 29.527936865383765 | P14: 2000000 | Q14: =IF(C14=0,0,((C14/P14)*100)-100) -> -2.1614264999999904 | R14: =IF(C14=0,0,(C14/$C$40)*100) -> 1.4603806710924543 | T14: 17.201000000000001 | U14: 15.966436422951322 | V14: =U14-T14 -> -1.2345635770486787
A15: P.G. Centro | B15: 2100000 | C15: 2053022.82 | D15: 1968491.7 | F15: 1987869.51 | G15: 2020799.37 | H15: 1900573.24 | J15: =IF(B15=0,0,((C15/B15)*100)-100) -> -2.2370085714285608 | K15: =IF(C15=0,0,IF(D15=0,0,((C15/D15)*100)-100)) -> 4.2942075905120731 | L15: =IF(F15=0,0,((C15/F15)*100)-100) -> 3.2775446110645277 | M15: =IF(G15=0,0,((C15/G15)*100)-100) -> 1.5945892738476175 | N15: =IF(C15=0,0,IF(H15=0,0,((C15/H15)*100)-100)) -> 8.0212420543183072 | P15: 2100000 | Q15: =IF(C15=0,0,((C15/P15)*100)-100) -> -2.2370085714285608 | R15: =IF(C15=0,0,(C15/$C$40)*100) -> 1.5322151255811813 | T15: 18.2 | U15: 17.437609539089294 | V15: =U15-T15 -> -0.76239046091070506
A16: Maringa | B16: 3400000 | C16: 3471446.99 | D16: 3134841.02 | F16: 3117597.72 | G16: 3206422 | H16: 2509523.09 | J16: =IF(B16=0,0,((C16/B16)*100)-100) -> 2.1013820588235319 | K16: =IF(C16=0,0,IF(D16=0,0,((C16/D16)*100)-100)) -> 10.737577052631522 | L16: =IF(F16=0,0,((C16/F16)*100)-100) -> 11.350061867507407 | M16: =IF(G16=0,0,((C16/G16)*100)-100) -> 8.2654432261255693 | N16: =IF(C16=0,0,IF(H16=0,0,((C16/H16)*100)-100)) -> 38.330944386728106 | P16: 3400000 | Q16: =IF(C16=0,0,((C16/P16)*100)-100) -> 2.1013820588235319 | R16: =IF(C16=0,0,(C16/$C$40)*100) -> 2.5908156177880497 | T16: 17.804099999999998 | U16: 16.552803564487096 | V16: =U16-T16 -> -1.2512964355129021
A17: Araucaria Nova | B17: 4600000 | C17: 4906171.55 | D17: 4405702.68 | F17: 3838777.88 | G17: 3200220.89 | H17: 2441178.5 | J17: =IF(B17=0,0,((C17/B17)*100)-100) -> 6.6559032608695503 | K17: =IF(C17=0,0,IF(D17=0,0,((C17/D17)*100)-100)) -> 11.359569774690286 | L17: =IF(F17=0,0,((C17/F17)*100)-100) -> 27.805559565222879 | M17: =IF(G17=0,0,((C17/G17)*100)-100) -> 53.307278423521552 | N17: =IF(C17=0,0,IF(H17=0,0,((C17/H17)*100)-100)) -> 100.9755349721456 | P17: 4600000 | Q17: =IF(C17=0,0,((C17/P17)*100)-100) -> 6.6559032608695503 | R17: =IF(C17=0,0,(C17/$C$40)*100) -> 3.6615814419471815 | T17: 16.4 | U17: 15.490850528860941 | V17: =U17-T17 -> -0.90914947113905775
A18: Cristo Rei | B18: 2650000 | C18: 2700737.22 | D18: 2430636.74 | F18: 2206011.95 | G18: 1819322.74 | H18: 1539865.06 | J18: =IF(B18=0,0,((C18/B18)*100)-100) -> 1.9146120754716947 | K18: =IF(C18=0,0,IF(D18=0,0,((C18/D18)*100)-100)) -> 11.112334293112028 | L18: =IF(F18=0,0,((C18/F18)*100)-100) -> 22.42622801748648 | M18: =IF(G18=0,0,((C18/G18)*100)-100) -> 48.447395320304764 | N18: =IF(C18=0,0,IF(H18=0,0,((C18/H18)*100)-100)) -> 75.387914834563503 | P18: 2650000 | Q18: =IF(C18=0,0,((C18/P18)*100)-100) -> 1.9146120754716947 | R18: =IF(C18=0,0,(C18/$C$40)*100) -> 2.0156183255206441 | T18: 16.6 | U18: 17.06284001595683 | V18: =U18-T18 -> 0.46284001595682867
A19: Campo Largo | B19: 4000000 | C19: 4080096.65 | D19: 3605265.07 | F19: 3485494.24 | G19: 2355833.96 | H19: 0 | J19: =IF(B19=0,0,((C19/B19)*100)-100) -> 2.002416249999996 | K19: =IF(C19=0,0,IF(D19=0,0,((C19/D19)*100)-100)) -> 13.170503992928317 | L19: =IF(F19=0,0,((C19/F19)*100)-100) -> 17.059342780609498 | M19: =IF(G19=0,0,((C19/G19)*100)-100) -> 73.191180672172663 | N19: =IF(C19=0,0,IF(H19=0,0,((C19/H19)*100)-100)) -> 0 | P19: 4000000 | Q19: =IF(C19=0,0,((C19/P19)*100)-100) -> 2.002416249999996 | R19: =IF(C19=0,0,(C19/$C$40)*100) -> 3.0450639613266 | T19: 16 | U19: 16.041723087613626 | V19: =U19-T19 -> 4.1723087613625864E-2
A20: Brasilia | B20: 2700000 | C20: 2855170.26 | D20: 2415218.27 | F20: 2517461.14 | G20: 2259458.98 | H20: 882288.61 | J20: =IF(B20=0,0,((C20/B20)*100)-100) -> 5.7470466666666482 | K20: =IF(C20=0,0,IF(D20=0,0,((C20/D20)*100)-100)) -> 18.215827342180546 | L20: =IF(F20=0,0,((C20/F20)*100)-100) -> 13.414670623277217 | M20: =IF(G20=0,0,((C20/G20)*100)-100) -> 26.365217747834464 | N20: =IF(C20=0,0,IF(H20=0,0,((C20/H20)*100)-100)) -> 223.60955674130258 | P20: 2700000 | Q20: =IF(C20=0,0,((C20/P20)*100)-100) -> 5.7470466666666482 | R20: =IF(C20=0,0,(C20/$C$40)*100) -> 2.1308750277220754 | T20: 16.6 | U20: 15.466634655265709 | V20: =U20-T20 -> -1.1333653447342922
A21: Total Super | B21: =SUM(B6:B20) -> 41500000 | C21: =SUM(C6:C20) -> 42092940.289999999 | D21: =SUM(D6:D20) -> 38043891.760000005 | F21: =SUM(F6:F20) -> 36568662.489999995 | G21: =SUM(G6:G20) -> 32042057.73 | H21: =SUM(H6:H20) -> 24285596.419999998 | I21: =SUM(B21:H21) -> 214533148.68999997 | J21: =IF(C21=0,0,((C21/B21)*100)-100) -> 1.4287717831325182 | K21: =IF(C21=0,0,IF(D21=0,0,((C21/D21)*100)-100)) -> 10.643097597752174 | L21: =IF(F21=0,0,IF(C21=0,0,((C21/F21)*100)-100)) -> 15.106589696876839 | M21: =IF(G21=0,0,IF(C21=0,0,((C21/G21)*100)-100)) -> 31.367781197740186 | N21: =IF(C21=0,0,IF(H21=0,0,((C21/H21)*100)-100)) -> 73.324712978162893 | P21: =SUM(P6:P20) -> 41500000 | Q21: =IF(C21=0,0,((C21/P21)*100)-100) -> 1.4287717831325182 | R21: =IF(C21=0,0,(C21/$C$40)*100) -> 31.414867464806605 | T21: 16.61 | U21: 15.77 | V21: =U21-T21 -> -0.84
A22: Pinheirinho | B22: 4800000 | C22: 5086599.91 | D22: 4324724.33 | F22: 4875585.94 | G22: 4334356.88 | H22: 3674217.8 | J22: =IF(B22=0,0,((C22/B22)*100)-100) -> 5.970831458333322 | K22: =IF(C22=0,0,IF(D22=0,0,((C22/D22)*100)-100)) -> 17.616743215630578 | L22: =IF(F22=0,0,((C22/F22)*100)-100) -> 4.3279715012058517 | M22: =IF(G22=0,0,((C22/G22)*100)-100) -> 17.355355150173992 | N22: =IF(C22=0,0,IF(H22=0,0,((C22/H22)*100)-100)) -> 38.440348038159328 | P22: 4800000 | Q22: =IF(C22=0,0,IF(P22=0,0,((C22/P22)*100)-100)) -> 5.970831458333322 | R22: =IF(C22=0,0,(C22/$C$40)*100) -> 3.7962390110607127 | T22: 16.1 | U22: 15.059246949894275 | V22: =U22-T22 -> -1.0407530501057263
A23: Londrina | B23: 4300000 | C23: 4610006.23 | D23: 4012019.25 | F23: 3692713.23 | G23: 3712056.31 | H23: 3148522.64 | J23: =IF(B23=0,0,((C23/B23)*100)-100) -> 7.2094472093023398 | K23: =IF(C23=0,0,IF(D23=0,0,((C23/D23)*100)-100)) -> 14.904888105908285 | L23: =IF(F23=0,0,((C23/F23)*100)-100) -> 24.84062375999882 | M23: =IF(G23=0,0,((C23/G23)*100)-100) -> 24.190094249944181 | N23: =IF(C23=0,0,IF(H23=0,0,((C23/H23)*100)-100)) -> 46.418074668823095 | P23: 4300000 | Q23: =IF(C23=0,0,IF(P23=0,0,((C23/P23)*100)-100)) -> 7.2094472093023398 | R23: =IF(C23=0,0,(C23/$C$40)*100) -> 3.4405468881390608 | T23: 16.582799999999999 | U23: 15.013140763152503 | V23: =U23-T23 -> -1.569659236847496
A24: São Bráz | B24: 5600000 | C24: 5926588.6699999999 | D24: 5196375.56 | F24: 5134753.17 | G24: 4729055.66 | H24: 4221695.37 | J24: =IF(B24=0,0,((C24/B24)*100)-100) -> 5.8319405357142813 | K24: =IF(C24=0,0,IF(D24=0,0,((C24/D24)*100)-100)) -> 14.052354406808902 | L24: =IF(F24=0,0,((C24/F24)*100)-100) -> 15.421101536609982 | M24: =IF(G24=0,0,((C24/G24)*100)-100) -> 25.322878310127564 | N24: =IF(C24=0,0,IF(H24=0,0,((C24/H24)*100)-100)) -> 40.384091000862526 | P24: 5600000 | Q24: =IF(C24=0,0,IF(P24=0,0,((C24/P24)*100)-100)) -> 5.8319405357142813 | R24: =IF(C24=0,0,(C24/$C$40)*100) -> 4.4231407049201996 | T24: 15.6 | U24: 15.024098164720447 | V24: =U24-T24 -> -0.57590183527955219
A25: S.J. Pinhais | B25: 6400000 | C25: 6619431.1900000004 | D25: 5711700.8099999996 | F25: 5791519.9699999997 | G25: 5266109.85 | H25: 4594350.86 | J25: =IF(B25=0,0,((C25/B25)*100)-100) -> 3.4286123437500038 | K25: =IF(C25=0,0,IF(D25=0,0,((C25/D25)*100)-100)) -> 15.892470740252264 | L25: =IF(F25=0,0,((C25/F25)*100)-100) -> 14.295232068413299 | M25: =IF(G25=0,0,((C25/G25)*100)-100) -> 25.698691796184249 | N25: =IF(C25=0,0,IF(H25=0,0,((C25/H25)*100)-100)) -> 44.077616005147689 | P25: 6400000 | Q25: =IF(C25=0,0,IF(P25=0,0,((C25/P25)*100)-100)) -> 3.4286123437500038 | R25: =IF(C25=0,0,(C25/$C$40)*100) -> 4.940223992279754 | T25: 15.9991 | U25: 15.240483851906314 | V25: =U25-T25 -> -0.7586161480936866
A26: P.G. Nova | B26: 5800000 | C26: 6224828.1900000004 | D26: 5524886.4699999997 | F26: 5079642.86 | G26: 5126476.44 | H26: 4342598.42 | J26: =IF(B26=0,0,((C26/B26)*100)-100) -> 7.3246239655172474 | K26: =IF(C26=0,0,IF(D26=0,0,((C26/D26)*100)-100)) -> 12.668888741889404 | L26: =IF(F26=0,0,((C26/F26)*100)-100) -> 22.544603263702669 | M26: =IF(G26=0,0,((C26/G26)*100)-100) -> 21.425081395673004 | N26: =IF(C26=0,0,IF(H26=0,0,((C26/H26)*100)-100)) -> 43.343399226861976 | P26: 5800000 | Q26: =IF(C26=0,0,IF(P26=0,0,((C26/P26)*100)-100)) -> 7.3246239655172474 | R26: =IF(C26=0,0,(C26/$C$40)*100) -> 4.6457232788392133 | T26: 15.8 | U26: 15.047686612536049 | V26: =U26-T26 -> -0.7523133874639516
A27: Nilo Pecanha | B27: 13900000 | C27: 13822877.880000001 | D27: 12648656.18 | F27: 12838827.710000001 | G27: 12005345.289999999 | H27: 10188606.460000001 | J27: =IF(B27=0,0,((C27/B27)*100)-100) -> -0.55483539568345464 | K27: =IF(C27=0,0,IF(D27=0,0,((C27/D27)*100)-100)) -> 9.2833711604611011 | L27: =IF(F27=0,0,((C27/F27)*100)-100) -> 7.6646419145693301 | M27: =IF(G27=0,0,((C27/G27)*100)-100) -> 15.139361226985599 | N27: =IF(C27=0,0,IF(H27=0,0,((C27/H27)*100)-100)) -> 35.669955790990485 | P27: 13900000 | Q27: =IF(C27=0,0,IF(P27=0,0,((C27/P27)*100)-100)) -> -0.55483539568345464 | R27: =IF(C27=0,0,(C27/$C$40)*100) -> 10.316311324195381 | T27: 16.3 | U27: 16.020695697559038 | V27: =U27-T27 -> -0.27930430244096272
A28: Champagnat | B28: 7000000 | C28: 6770840.8300000001 | D28: 6177199.9900000002 | F28: 6970671.5700000003 | G28: 6691910.8200000003 | H28: 5886943.5899999999 | J28: =IF(B28=0,0,((C28/B28)*100)-100) -> -3.2737024285714256 | K28: =IF(C28=0,0,IF(D28=0,0,((C28/D28)*100)-100)) -> 9.6101929832451418 | L28: =IF(F28=0,0,((C28/F28)*100)-100) -> -2.866735837333394 | M28: =IF(G28=0,0,((C28/G28)*100)-100) -> 1.1794838891771064 | N28: =IF(C28=0,0,IF(H28=0,0,((C28/H28)*100)-100)) -> 15.014535581782269 | P28: 7000000 | Q28: =IF(C28=0,0,IF(P28=0,0,((C28/P28)*100)-100)) -> -3.2737024285714256 | R28: =IF(C28=0,0,(C28/$C$40)*100) -> 5.0532242659770539 | T28: 16.45 | U28: 16.606200633430042 | V28: =U28-T28 -> 0.15620063343004276
A29: Santa Candida | B29: 7900000 | C29: 8484005.8800000008 | D29: 7173626.5700000003 | F29: 6911522.2199999997 | G29: 6032952.8600000003 | H29: 4802168.49 | J29: =IF(B29=0,0,((C29/B29)*100)-100) -> 7.3924794936709048 | K29: =IF(C29=0,0,IF(D29=0,0,((C29/D29)*100)-100)) -> 18.266622847082488 | L29: =IF(F29=0,0,((C29/F29)*100)-100) -> 22.751625618010408 | M29: =IF(G29=0,0,((C29/G29)*100)-100) -> 40.627750239042967 | N29: =IF(C29=0,0,IF(H29=0,0,((C29/H29)*100)-100)) -> 76.670308375623023 | P29: 7900000 | Q29: =IF(C29=0,0,IF(P29=0,0,((C29/P29)*100)-100)) -> 7.3924794936709048 | R29: =IF(C29=0,0,(C29/$C$40)*100) -> 6.3317962217564059 | T29: 16.09 | U29: 15.618755908971622 | V29: =U29-T29 -> -0.47124409102837816
A30: Paranaguá Raia | B30: 8200000 | C30: 7914228.8600000003 | D30: 7160951.7599999998 | F30: 7161697.7599999998 | G30: 6534520.7999999998 | H30: 5467509.7300000004 | J30: =IF(B30=0,0,((C30/B30)*100)-100) -> -3.4850139024390216 | K30: =IF(C30=0,0,IF(D30=0,0,((C30/D30)*100)-100)) -> 10.51923159443264 | L30: =IF(F30=0,0,((C30/F30)*100)-100) -> 10.507719331623974 | M30: =IF(G30=0,0,((C30/G30)*100)-100) -> 21.11414290700553 | N30: =IF(C30=0,0,IF(H30=0,0,((C30/H30)*100)-100)) -> 44.750155936165129 | P30: 8200000 | Q30: =IF(C30=0,0,IF(P30=0,0,((C30/P30)*100)-100)) -> -3.4850139024390216 | R30: =IF(C30=0,0,(C30/$C$40)*100) -> 5.906559366253469 | T30: 17.554099999999998 | U30: 17.384006074850859 | V30: =U30-T30 -> -0.17009392514913912
A31: Uvaranas | B31: 5500000 | C31: 5980623.21 | D31: 5093201.45 | F31: 4866585.34 | G31: 0 | H31: 0 | J31: =IF(B31=0,0,((C31/B31)*100)-100) -> 8.7386038181818151 | K31: =IF(C31=0,0,IF(D31=0,0,((C31/D31)*100)-100)) -> 17.423653250550288 | L31: =IF(F31=0,0,((C31/F31)*100)-100) -> 22.891571649702129 | M31: =IF(G31=0,0,((C31/G31)*100)-100) -> 0 | N31: =IF(C31=0,0,IF(H31=0,0,((C31/H31)*100)-100)) -> 0 | P31: 5500000 | Q31: =IF(C31=0,0,IF(P31=0,0,((C31/P31)*100)-100)) -> 8.7386038181818151 | R31: =IF(C31=0,0,(C31/$C$40)*100) -> 4.463467845313029 | T31: 15.48 | U31: 13.93966849484905 | V31: =U31-T31 -> -1.5403315051509505
A32: Torres | B32: 5700000 | C32: 6122263.2300000004 | D32: 5262502.43 | F32: 5053258.6 | G32: 0 | H32: 0 | J32: =IF(B32=0,0,((C32/B32)*100)-100) -> 7.4081268421052755 | K32: =IF(C32=0,0,IF(D32=0,0,((C32/D32)*100)-100)) -> 16.337489843211344 | L32: =IF(F32=0,0,((C32/F32)*100)-100) -> 21.154758040682921 | M32: =IF(G32=0,0,((C32/G32)*100)-100) -> 0 | N32: =IF(C32=0,0,IF(H32=0,0,((C32/H32)*100)-100)) -> 0 | P32: 5700000 | Q32: =IF(C32=0,0,IF(P32=0,0,((C32/P32)*100)-100)) -> 7.4081268421052755 | R32: =IF(C32=0,0,(C32/$C$40)*100) -> 4.5691768412956559 | T32: 15.595800000000001 | U32: 15.742187653372101 | V32: =U32-T32 -> 0.14638765337210025
A33: Total Hiper | B33: =SUM(B22:B32) -> 75100000 | C33: =SUM(C22:C32) -> 77562294.079999998 | D33: =SUM(D22:D32) -> 68285844.799999997 | F33: =SUM(F22:F32) -> 68376778.36999999 | G33: =SUM(G22:G32) -> 54432784.909999996 | H33: =SUM(H22:H32) -> 46326613.359999999 | I33: =SUM(B33:H33) -> 390084315.51999998 | J33: =IF(C33=0,0,((C33/B33)*100)-100) -> 3.2786871904127821 | K33: =IF(C33=0,0,IF(D33=0,0,((C33/D33)*100)-100)) -> 13.584732395373393 | L33: =IF(F33=0,0,IF(C33=0,0,((C33/F33)*100)-100)) -> 13.433677235121252 | M33: =IF(G33=0,0,IF(C33=0,0,((C33/G33)*100)-100)) -> 42.49187177955838 | N33: =IF(C33=0,0,IF(H33=0,0,((C33/H33)*100)-100)) -> 67.424917244155722 | P33: =SUM(P22:P32) -> 75100000 | Q33: =IF(C33=0,0,((C33/P33)*100)-100) -> 3.2786871904127821 | R33: =IF(C33=0,0,(C33/$C$40)*100) -> 57.886409740029933 | T33: 16.15 | U33: 15.58 | V33: =U33-T33 -> -0.56999999999999851
A34: Total s/ 25,27,30 | B34: =B21+B33 -> 116600000 | C34: =C21+C33 -> 119655234.37 | D34: =D21+D33 -> 106329736.56 | E34: =E21+E33 -> 0 | F34: =F21+F33 -> 104945440.85999998 | G34: =G21+G33 -> 86474842.640000001 | H34: =H21+H33 -> 70612209.780000001 | I34: =SUM(B34:H34) -> 604617464.20999992 | J34: =IF(C34=0,0,((C34/B34)*100)-100) -> 2.6202696140651796 | K34: =IF(C34=0,0,IF(D34=0,0,((C34/D34)*100)-100)) -> 12.532240030972574 | L34: =IF(F34=0,0,IF(C34=0,0,((C34/F34)*100)-100)) -> 14.016610335291531 | M34: =IF(G34=0,0,IF(C34=0,0,((C34/G34)*100)-100)) -> 38.369993765853962 | N34: =IF(C34=0,0,IF(H34=0,0,((C34/H34)*100)-100)) -> 69.454028903498227 | P34: =P21+P33 -> 116600000 | Q34: =IF(C34=0,0,((C34/P34)*100)-100) -> 2.6202696140651796 | R34: =IF(C34=0,0,(C34/$C$40)*100) -> 89.301277204836538 | T34: 16.5 | U34: 15.81 | V34: =U34-T34 -> -0.6899999999999995
A35: Centenario | B35: 0 | C35: 0 | D35: 898852.67 | F35: 1319094.16 | G35: 1250001.27 | H35: 1084937.71 | J35: =IF(B35=0,0,((C35/B35)*100)-100) -> 0 | K35: =IF(C35=0,0,IF(D35=0,0,((C35/D35)*100)-100)) -> 0 | L35: =IF(F35=0,0,((C35/F35)*100)-100) -> -100 | M35: =IF(G35=0,0,((C35/G35)*100)-100) -> -100 | N35: =IF(C35=0,0,IF(H35=0,0,((C35/H35)*100)-100)) -> 0 | P35: 0.45 | Q35: =IF(P35=0,0,IF(C35=0,0,((C35/P35)*100)-100)) -> 0 | R35: =IF(C35=0,0,(C35/$C$40)*100) -> 0 | T35: 0 | U35: 0 | V35: =U35-T35 -> 0
A36: Cajuru | B36: 4000000 | C36: 4968660.87 | D36: 2093554.05 | F36: 0 | G36: 0 | H36: 0 | J36: =IF(B36=0,0,((C36/B36)*100)-100) -> 24.216521749999998 | K36: =IF(C36=0,0,IF(D36=0,0,((C36/D36)*100)-100)) -> 137.33138726463739 | L36: =IF(F36=0,0,((C36/F36)*100)-100) -> 0 | M36: =IF(G36=0,0,((C36/G36)*100)-100) -> 0 | N36: =IF(C36=0,0,IF(H36=0,0,((C36/H36)*100)-100)) -> 0 | P36: 4000000 | Q36: =IF(P36=0,0,IF(C36=0,0,((C36/P36)*100)-100)) -> 24.216521749999998 | R36: =IF(C36=0,0,(C36/$C$40)*100) -> 3.7082185666583833 | T36: 16.5 | U36: 0 | V36: =U36-T36 -> -16.5
A37: Novo Mundo | B37: 5700000 | C37: 6305417.6500000004 | D37: 5050281.64 | F37: 2339476.32 | G37: 0 | H37: 0 | J37: =IF(B37=0,0,((C37/B37)*100)-100) -> 10.62136228070176 | K37: =IF(C37=0,0,IF(D37=0,0,((C37/D37)*100)-100)) -> 24.852792368229217 | L37: =IF(F37=0,0,((C37/F37)*100)-100) -> 169.52261051310836 | M37: =IF(G37=0,0,((C37/G37)*100)-100) -> 0 | N37: =IF(C37=0,0,IF(H37=0,0,((C37/H37)*100)-100)) -> 0 | P37: 5700000 | Q37: =IF(P37=0,0,IF(C37=0,0,((C37/P37)*100)-100)) -> 10.62136228070176 | R37: =IF(C37=0,0,(C37/$C$40)*100) -> 4.7058689276705392 | T37: 15.495799999999999 | U37: 14.921493577828265 | V37: =U37-T37 -> -0.574306422171734
A38: Fazenda | B38: 3100000 | C38: 3061194.43 | D38: 2684592.27 | F38: 0 | G38: 0 | H38: 0 | J38: =IF(B38=0,0,((C38/B38)*100)-100) -> -1.2517925806451586 | K38: =IF(C38=0,0,IF(D38=0,0,((C38/D38)*100)-100)) -> 14.028281471584521 | L38: =IF(F38=0,0,((C38/F38)*100)-100) -> 0 | M38: =IF(G38=0,0,((C38/G38)*100)-100) -> 0 | N38: =IF(C38=0,0,IF(H38=0,0,((C38/H38)*100)-100)) -> 0 | P38: 3100000 | Q38: =IF(P38=0,0,IF(C38=0,0,((C38/P38)*100)-100)) -> -1.2517925806451586 | R38: =IF(C38=0,0,(C38/$C$40)*100) -> 2.2846353008345339 | T38: 15 | U38: 15.157133279508809 | V38: =U38-T38 -> 0.15713327950880895
A39: Total Lojas Novas | B39: =SUM(B35:B38) -> 12800000 | C39: =SUM(C35:C38) -> 14335272.949999999 | D39: =SUM(D35:D38) -> 10727280.629999999 | F39: =SUM(F35:F38) -> 3658570.48 | G39: =SUM(G35:G38) -> 1250001.27 | H39: =SUM(H35:H38) -> 1084937.71 | J39: =IF(C39=0,0,((C39/B39)*100)-100) -> 11.99431992187499 | K39: =IF(C39=0,0,IF(D39=0,0,((C39/D39)*100)-100)) -> 33.633801934013547 | L39: =IF(F39=0,0,IF(C39=0,0,((C39/F39)*100)-100)) -> 291.82716387084611 | M39: =IF(G39=0,0,IF(C39=0,0,((C39/G39)*100)-100)) -> 1046.8206708301982 | N39: =IF(C39=0,0,IF(H39=0,0,((C39/H39)*100)-100)) -> 1221.2991693320348 | P39: =SUM(P35:P38) -> 12800000.449999999 | Q39: =IF(P39=0,0,IF(C39=0,0,((C39/P39)*100)-100)) -> 11.994315984574826 | R39: =IF(C39=0,0,(C39/$C$40)*100) -> 10.698722795163455
A40: Total Geral | B40: =B21+B33+B39 -> 129400000 | C40: =C21+C33+C39 -> 133990507.32000001 | D40: =D21+D33+D39 -> 117057017.19 | F40: =F21+F33+F39 -> 108604011.33999999 | G40: =G21+G33+G39 -> 87724843.909999996 | H40: =H21+H33+H39 -> 71697147.489999995 | J40: =IF(C40=0,0,((C40/B40)*100)-100) -> 3.547532704791351 | K40: =IF(C40=0,0,IF(D40=0,0,((C40/D40)*100)-100)) -> 14.466018814160094 | L40: =IF(F40=0,0,IF(C40=0,0,((C40/F40)*100)-100)) -> 23.375283902289823 | M40: =IF(G40=0,0,IF(C40=0,0,((C40/G40)*100)-100)) -> 52.739522064542598 | N40: =IF(C40=0,0,IF(H40=0,0,((C40/H40)*100)-100)) -> 86.884014233186093 | P40: =P21+P33+P39 -> 129400000.45 | Q40: =IF(C40=0,0,((C40/P40)*100)-100) -> 3.5475323446955969 | R40: =R21+R33+R39 -> 100 | T40: 16.32 | U40: 15.65 | V40: =U40-T40 -> -0.67