A2: Periodo: | B2: 40848 | C2: a | D2: 40877 | G2: Vendas Acumuladas por Filial | P2: =NOW() -> 40878.374791666669
A4: v.New | B4: Vendas 2011 | F4: Vendas de Anos Anteriores | J4: Percentuais ( % ) | P4: Meta Mensal | T4: Margem
A5: Lojas | B5: Previsao | C5: Realizada | D5: Mes Anterior | F5: Vendas 2010 | G5: Vendas 2009 | H5: Vendas 2008 | J5: % Prev | K5: % MA | L5: 2010 | M5: 2009 | N5: 2008 | P5: Previsao Mes | Q5: Final | R5: Part. | T5: Meta | U5: Coml | V5: Dif
A6: S. Felicidade | B6: 3550000 | C6: 3754289.37 | D6: 3825003.66 | F6: 3177102.5 | G6: 2821335.32 | H6: 2455551.94 | J6: =IF(B6=0,0,((C6/B6)*100)-100) -> 5.7546301408450802 | K6: =IF(C6=0,0,IF(D6=0,0,((C6/D6)*100)-100)) -> -1.8487378388547739 | L6: =IF(F6=0,0,((C6/F6)*100)-100) -> 18.167083687101695 | M6: =IF(G6=0,0,((C6/G6)*100)-100) -> 33.067818751866781 | N6: =IF(C6=0,0,IF(H6=0,0,((C6/H6)*100)-100)) -> 52.889837467661152 | P6: 3550000 | Q6: =IF(C6=0,0,((C6/P6)*100)-100) -> 5.7546301408450802 | R6: =IF(C6=0,0,(C6/$C$42)*100) -> 2.3711392799204614 | T6: 17.29 | U6: 17.392662611939258 | V6: =U6-T6 -> 0.10266261193925885
A7: Lapa | B7: 2450000 | C7: 2449734.78 | D7: 2640872.72 | F7: 2309851.44 | G7: 2141055.29 | H7: 1995099.62 | J7: =IF(B7=0,0,((C7/B7)*100)-100) -> -1.0825306122455913E-2 | K7: =IF(C7=0,0,IF(D7=0,0,((C7/D7)*100)-100)) -> -7.2376808830075134 | L7: =IF(F7=0,0,((C7/F7)*100)-100) -> 6.0559453122232014 | M7: =IF(G7=0,0,((C7/G7)*100)-100) -> 14.417165751940942 | N7: =IF(C7=0,0,IF(H7=0,0,((C7/H7)*100)-100)) -> 22.787591929870629 | P7: 2450000 | Q7: =IF(C7=0,0,((C7/P7)*100)-100) -> -1.0825306122455913E-2 | R7: =IF(C7=0,0,(C7/$C$42)*100) -> 1.547206885186186 | T7: 15.65 | U7: 15.508906796841087 | V7: =U7-T7 -> -0.14109320315891338
A8: Araucaria | B8: 1399999 | C8: 1475172.24 | D8: 1515193.54 | F8: 1475206.07 | G8: 1248864.46 | H8: 1128739.76 | J8: =IF(B8=0,0,((C8/B8)*100)-100) -> 5.369520978229275 | K8: =IF(C8=0,0,IF(D8=0,0,((C8/D8)*100)-100)) -> -2.6413325389441695 | L8: =IF(F8=0,0,((C8/F8)*100)-100) -> -2.2932389371277395E-3 | M8: =IF(G8=0,0,((C8/G8)*100)-100) -> 18.121084172737213 | N8: =IF(C8=0,0,IF(H8=0,0,((C8/H8)*100)-100)) -> 30.69197101730515 | P8: 1400000 | Q8: =IF(C8=0,0,((C8/P8)*100)-100) -> 5.3694457142857033 | R8: =IF(C8=0,0,(C8/$C$42)*100) -> 0.93169132642331554 | T8: 16.51 | U8: 17.295443784923716 | V8: =U8-T8 -> 0.78544378492371436
A9: Hauer | B9: 4200000 | C9: 4445187 | D9: 4487089.51 | F9: 3913639.31 | G9: 3703759.01 | H9: 3646519.81 | J9: =IF(B9=0,0,((C9/B9)*100)-100) -> 5.837785714285701 | K9: =IF(C9=0,0,IF(D9=0,0,((C9/D9)*100)-100)) -> -0.93384609124946394 | L9: =IF(F9=0,0,((C9/F9)*100)-100) -> 13.581928427635305 | M9: =IF(G9=0,0,((C9/G9)*100)-100) -> 20.01825680337663 | N9: =IF(C9=0,0,IF(H9=0,0,((C9/H9)*100)-100)) -> 21.902176091564954 | P9: 4200000 | Q9: =IF(C9=0,0,((C9/P9)*100)-100) -> 5.837785714285701 | R9: =IF(C9=0,0,(C9/$C$42)*100) -> 2.8074973619552921 | T9: 16.52 | U9: 16.826699963353626 | V9: =U9-T9 -> 0.30669996335362626
A10: Paranagua | B10: 2300000 | C10: 2378942.47 | D10: 2351588.47 | F10: 2161215.14 | G10: 1923429.34 | H10: 1777194.22 | J10: =IF(B10=0,0,((C10/B10)*100)-100) -> 3.4322813043478249 | K10: =IF(C10=0,0,IF(D10=0,0,((C10/D10)*100)-100)) -> 1.1632137318652553 | L10: =IF(F10=0,0,((C10/F10)*100)-100) -> 10.074301533904674 | M10: =IF(G10=0,0,((C10/G10)*100)-100) -> 23.682342809640204 | N10: =IF(C10=0,0,IF(H10=0,0,((C10/H10)*100)-100)) -> 33.85945347042599 | P10: 2300000 | Q10: =IF(C10=0,0,((C10/P10)*100)-100) -> 3.4322813043478249 | R10: =IF(C10=0,0,(C10/$C$42)*100) -> 1.5024957799904495 | T10: 17.29 | U10: 17.636951573696525 | V10: =U10-T10 -> 0.34695157369652563
A11: Sitio Cercado | B11: 3300000 | C11: 3326482.49 | D11: 3423679.26 | F11: 2671753.96 | G11: 2263674.1 | H11: 1935105.94 | J11: =IF(B11=0,0,((C11/B11)*100)-100) -> 0.80249969696970425 | K11: =IF(C11=0,0,IF(D11=0,0,((C11/D11)*100)-100)) -> -2.838956649227697 | L11: =IF(F11=0,0,((C11/F11)*100)-100) -> 24.505569741908431 | M11: =IF(G11=0,0,((C11/G11)*100)-100) -> 46.950591960211938 | N11: =IF(C11=0,0,IF(H11=0,0,((C11/H11)*100)-100)) -> 71.901828279231097 | P11: 3300000 | Q11: =IF(C11=0,0,((C11/P11)*100)-100) -> 0.80249969696970425 | R11: =IF(C11=0,0,(C11/$C$42)*100) -> 2.100944418146069 | T11: 15.73 | U11: 15.099987245085423 | V11: =U11-T11 -> -0.63001275491457776
A12: Apucarana | B12: 2599999 | C12: 2452458.81 | D12: 2602655.4 | F12: 2869706.01 | G12: 2500115.56 | H12: 2411666.31 | J12: =IF(B12=0,0,((C12/B12)*100)-100) -> -5.6746248748557093 | K12: =IF(C12=0,0,IF(D12=0,0,((C12/D12)*100)-100)) -> -5.7708980604962079 | L12: =IF(F12=0,0,((C12/F12)*100)-100) -> -14.539719349160777 | M12: =IF(G12=0,0,((C12/G12)*100)-100) -> -1.9061818886483906 | N12: =IF(C12=0,0,IF(H12=0,0,((C12/H12)*100)-100)) -> 1.6914653503618382 | P12: 2600000 | Q12: =IF(C12=0,0,((C12/P12)*100)-100) -> -5.6746611538461451 | R12: =IF(C12=0,0,(C12/$C$42)*100) -> 1.5489273318263135 | T12: 17 | U12: 16.139606825853274 | V12: =U12-T12 -> -0.86039317414672567
A13: Ahú | B13: 2300000 | C13: 2271852.55 | D13: 2394387.76 | F13: 1894952.57 | G13: 1678603.53 | H13: 1619228.6 | J13: =IF(B13=0,0,((C13/B13)*100)-100) -> -1.2238021739130431 | K13: =IF(C13=0,0,IF(D13=0,0,((C13/D13)*100)-100)) -> -5.1176009185746949 | L13: =IF(F13=0,0,((C13/F13)*100)-100) -> 19.889678821882057 | M13: =IF(G13=0,0,((C13/G13)*100)-100) -> 35.341818922542103 | N13: =IF(C13=0,0,IF(H13=0,0,((C13/H13)*100)-100)) -> 40.304620978162063 | P13: 2300000 | Q13: =IF(C13=0,0,((C13/P13)*100)-100) -> -1.2238021739130431 | R13: =IF(C13=0,0,(C13/$C$42)*100) -> 1.4348597799994471 | T13: 16.84 | U13: 16.845020575829185 | V13: =U13-T13 -> 5.0205758291852476E-3
A14: P.G. Centro | B14: 2300000 | C14: 2251113.16 | D14: 2256984.65 | F14: 1996459.63 | G14: 1828416.66 | H14: 1979642.14 | J14: =IF(B14=0,0,((C14/B14)*100)-100) -> -2.1255147826086898 | K14: =IF(C14=0,0,IF(D14=0,0,((C14/D14)*100)-100)) -> -0.26014753799941559 | L14: =IF(F14=0,0,((C14/F14)*100)-100) -> 12.755255662244494 | M14: =IF(G14=0,0,((C14/G14)*100)-100) -> 23.118171544116223 | N14: =IF(C14=0,0,IF(H14=0,0,((C14/H14)*100)-100)) -> 13.713136051953327 | P14: 2300000 | Q14: =IF(C14=0,0,((C14/P14)*100)-100) -> -2.1255147826086898 | R14: =IF(C14=0,0,(C14/$C$42)*100) -> 1.421761167339606 | T14: 17.51 | U14: 17.762960667867979 | V14: =U14-T14 -> 0.25296066786797766
A15: Maringa | B15: 3599999 | C15: 3646849.57 | D15: 3870569.87 | F15: 3341001.24 | G15: 2812854.25 | H15: 3048882.6 | J15: =IF(B15=0,0,((C15/B15)*100)-100) -> 1.3014050837236226 | K15: =IF(C15=0,0,IF(D15=0,0,((C15/D15)*100)-100)) -> -5.7800351760605224 | L15: =IF(F15=0,0,((C15/F15)*100)-100) -> 9.1543913943593651 | M15: =IF(G15=0,0,((C15/G15)*100)-100) -> 29.649432422600626 | N15: =IF(C15=0,0,IF(H15=0,0,((C15/H15)*100)-100)) -> 19.612659733110078 | P15: 3600000 | Q15: =IF(C15=0,0,((C15/P15)*100)-100) -> 1.3013769444444279 | R15: =IF(C15=0,0,(C15/$C$42)*100) -> 2.3032823022344817 | T15: 17.15 | U15: 17.477284411267888 | V15: =U15-T15 -> 0.32728441126788965
A16: Araucaria Nova | B16: 0 | C16: 0 | D16: 0 | F16: 0 | G16: 0 | H16: 0 | J16: =IF(B16=0,0,((C16/B16)*100)-100) -> 0 | K16: =IF(C16=0,0,IF(D16=0,0,((C16/D16)*100)-100)) -> 0 | L16: =IF(F16=0,0,((C16/F16)*100)-100) -> 0 | M16: =IF(G16=0,0,((C16/G16)*100)-100) -> 0 | N16: =IF(C16=0,0,IF(H16=0,0,((C16/H16)*100)-100)) -> 0 | P16: 0 | Q16: =IF(C16=0,0,((C16/P16)*100)-100) -> 0 | R16: =IF(C16=0,0,(C16/$C$42)*100) -> 0 | T16: 0 | U16: 0 | V16: =U16-T16 -> 0
A17: Cristo Rei | B17: 2900000 | C17: 2986193.57 | D17: 3083382.2 | F17: 2528048.88 | G17: 2141745.25 | H17: 1804282.37 | J17: =IF(B17=0,0,((C17/B17)*100)-100) -> 2.9721920689655121 | K17: =IF(C17=0,0,IF(D17=0,0,((C17/D17)*100)-100)) -> -3.1520137205177008 | L17: =IF(F17=0,0,((C17/F17)*100)-100) -> 18.122461698604496 | M17: =IF(G17=0,0,((C17/G17)*100)-100) -> 39.428046823029007 | N17: =IF(C17=0,0,IF(H17=0,0,((C17/H17)*100)-100)) -> 65.505888637597195 | P17: 2900000 | Q17: =IF(C17=0,0,((C17/P17)*100)-100) -> 2.9721920689655121 | R17: =IF(C17=0,0,(C17/$C$42)*100) -> 1.8860242707591051 | T17: 17.37 | U17: 18.343720521104732 | V17: =U17-T17 -> 0.97372052110473106
A18: Fazenda | B18: 3250000 | C18: 3742037.33 | D18: 3655219.22 | F18: 2703629.19 | G18: 0 | H18: 0 | J18: =IF(B18=0,0,((C18/B18)*100)-100) -> 15.139610153846149 | K18: =IF(C18=0,0,IF(D18=0,0,((C18/D18)*100)-100)) -> 2.375182028069986 | L18: =IF(F18=0,0,((C18/F18)*100)-100) -> 38.407934928384179 | M18: =IF(G18=0,0,((C18/G18)*100)-100) -> 0 | N18: =IF(C18=0,0,IF(H18=0,0,((C18/H18)*100)-100)) -> 0 | P18: 3250000 | Q18: =IF(C18=0,0,((C18/P18)*100)-100) -> 15.139610153846149 | R18: =IF(C18=0,0,(C18/$C$42)*100) -> 2.3634011195284303 | T18: 15.4 | U18: 15.295971430087254 | V18: =U18-T18 -> -0.10402856991274589
A19: Campo Largo | B19: 4300000 | C19: 4441398.93 | D19: 4620453.2 | F19: 3796154.38 | G19: 3430550.61 | H19: 2440885.65 | J19: =IF(B19=0,0,((C19/B19)*100)-100) -> 3.2883472093023158 | K19: =IF(C19=0,0,IF(D19=0,0,((C19/D19)*100)-100)) -> -3.875253405878027 | L19: =IF(F19=0,0,((C19/F19)*100)-100) -> 16.997321115270353 | M19: =IF(G19=0,0,((C19/G19)*100)-100) -> 29.466066381687909 | N19: =IF(C19=0,0,IF(H19=0,0,((C19/H19)*100)-100)) -> 81.958500595880025 | P19: 4300000 | Q19: =IF(C19=0,0,((C19/P19)*100)-100) -> 3.2883472093023158 | R19: =IF(C19=0,0,(C19/$C$42)*100) -> 2.8051048874582905 | T19: 15.8 | U19: 17.272474420576316 | V19: =U19-T19 -> 1.4724744205763152
A20: Brasilia | B20: 3100000 | C20: 3241968.17 | D20: 3311588.72 | F20: 2649750.67 | G20: 2300495.86 | H20: 2251018.87 | J20: =IF(B20=0,0,((C20/B20)*100)-100) -> 4.5796183870967724 | K20: =IF(C20=0,0,IF(D20=0,0,((C20/D20)*100)-100)) -> -2.1023308111763441 | L20: =IF(F20=0,0,((C20/F20)*100)-100) -> 22.349933022188836 | M20: =IF(G20=0,0,((C20/G20)*100)-100) -> 40.924755674196263 | N20: =IF(C20=0,0,IF(H20=0,0,((C20/H20)*100)-100)) -> 44.022256463802989 | P20: 3100000 | Q20: =IF(C20=0,0,((C20/P20)*100)-100) -> 4.5796183870967724 | R20: =IF(C20=0,0,(C20/$C$42)*100) -> 2.0475667468698222 | T20: 16.2 | U20: 16.063010692668215 | V20: =U20-T20 -> -0.13698930733178472
A21: Cajuru | B21: 5000000 | C21: 5177635.98 | D21: 5547241.3200000003 | F21: 4118205.6 | G21: 0 | H21: 0 | J21: =IF(B21=0,0,((C21/B21)*100)-100) -> 3.5527196000000032 | K21: =IF(C21=0,0,IF(D21=0,0,((C21/D21)*100)-100)) -> -6.6628675170021268 | L21: =IF(F21=0,0,((C21/F21)*100)-100) -> 25.725533955856903 | M21: =IF(G21=0,0,((C21/G21)*100)-100) -> 0 | N21: =IF(C21=0,0,IF(H21=0,0,((C21/H21)*100)-100)) -> 0 | P21: 5000000 | Q21: =IF(C21=0,0,((C21/P21)*100)-100) -> 3.5527196000000032 | R21: =IF(C21=0,0,(C21/$C$42)*100) -> 3.2700985031709138 | T21: 15.6 | U21: 16.441609435045681 | V21: =U21-T21 -> 0.84160943504568131
A22: Total Super | B22: =SUM(B6:B21) -> 46549997 | C22: =SUM(C6:C21) -> 48041316.420000002 | D22: =SUM(D6:D21) -> 49585909.5 | F22: =SUM(F6:F21) -> 41606676.590000004 | G22: =SUM(G6:G21) -> 30794899.239999998 | H22: =SUM(H6:H21) -> 28493817.830000006 | I22: =SUM(B22:H22) -> 245072616.58000004 | J22: =IF(C22=0,0,((C22/B22)*100)-100) -> 3.2036939121607304 | K22: =IF(C22=0,0,IF(D22=0,0,((C22/D22)*100)-100)) -> -3.1149838645190044 | L22: =IF(F22=0,0,IF(C22=0,0,((C22/F22)*100)-100)) -> 15.465402087766208 | M22: =IF(G22=0,0,IF(C22=0,0,((C22/G22)*100)-100)) -> 56.004135768037685 | N22: =IF(C22=0,0,IF(H22=0,0,((C22/H22)*100)-100)) -> 68.602595505538801 | P22: =SUM(P6:P21) -> 46550000 | Q22: =IF(C22=0,0,((C22/P22)*100)-100) -> 3.2036872610096765 | R22: =IF(C22=0,0,(C22/$C$42)*100) -> 30.342001160808184 | T22: 16.443050454761575 | U22: 16.720971627779555 | V22: =U22-T22 -> 0.27792117301797958
A23: Pinheirinho | B23: 4850000 | C23: 5157781.24 | D23: 5409641.5999999996 | F23: 4650589.63 | G23: 4453879.35 | H23: 4202729.14 | J23: =IF(B23=0,0,((C23/B23)*100)-100) -> 6.3460049484536114 | K23: =IF(C23=0,0,IF(D23=0,0,((C23/D23)*100)-100)) -> -4.6557679532780725 | L23: =IF(F23=0,0,((C23/F23)*100)-100) -> 10.905963551980832 | M23: =IF(G23=0,0,((C23/G23)*100)-100) -> 15.804242429692223 | N23: =IF(C23=0,0,IF(H23=0,0,((C23/H23)*100)-100)) -> 22.724569397303611 | P23: 4850000 | Q23: =IF(C23=0,0,IF(P23=0,0,((C23/P23)*100)-100)) -> 6.3460049484536114 | R23: =IF(C23=0,0,(C23/$C$42)*100) -> 3.2575586189832944 | T23: 16.1 | U23: 16.246765931080862 | V23: =U23-T23 -> 0.14676593108086067
A24: Londrina | B24: 4750000 | C24: 5064017.53 | D24: 5347701.71 | F24: 4030619.44 | G24: 3459344.3 | H24: 3461090.66 | J24: =IF(B24=0,0,((C24/B24)*100)-100) -> 6.6108953684210547 | K24: =IF(C24=0,0,IF(D24=0,0,((C24/D24)*100)-100)) -> -5.3047869044288944 | L24: =IF(F24=0,0,((C24/F24)*100)-100) -> 25.638691654799345 | M24: =IF(G24=0,0,((C24/G24)*100)-100) -> 46.386629685862744 | N24: =IF(C24=0,0,IF(H24=0,0,((C24/H24)*100)-100)) -> 46.312767490464978 | P24: 4750000 | Q24: =IF(C24=0,0,IF(P24=0,0,((C24/P24)*100)-100)) -> 6.6108953684210547 | R24: =IF(C24=0,0,(C24/$C$42)*100) -> 3.1983392051606274 | T24: 15.76 | U24: 16.322698673596417 | V24: =U24-T24 -> 0.56269867359641701
A25: São Bráz | B25: 5600000 | C25: 5785467 | D25: 6115995.4400000004 | F25: 5345600.76 | G25: 4964297.43 | H25: 4737025.52 | J25: =IF(B25=0,0,((C25/B25)*100)-100) -> 3.311910714285716 | K25: =IF(C25=0,0,IF(D25=0,0,((C25/D25)*100)-100)) -> -5.4043277703948149 | L25: =IF(F25=0,0,((C25/F25)*100)-100) -> 8.2285651276359033 | M25: =IF(G25=0,0,((C25/G25)*100)-100) -> 16.541506257009274 | N25: =IF(C25=0,0,IF(H25=0,0,((C25/H25)*100)-100)) -> 22.1329075719229 | P25: 5600000 | Q25: =IF(C25=0,0,IF(P25=0,0,((C25/P25)*100)-100)) -> 3.311910714285716 | R25: =IF(C25=0,0,(C25/$C$42)*100) -> 3.653993260616347 | T25: 16.63 | U25: 15.882767067896161 | V25: =U25-T25 -> -0.74723293210383801
A26: S.J. Pinhais | B26: 6850000 | C26: 7113613.25 | D26: 7611964.1399999997 | F26: 6093984.3700000001 | G26: 5596975.4500000002 | H26: 5396112.0999999996 | J26: =IF(B26=0,0,((C26/B26)*100)-100) -> 3.8483686131386889 | K26: =IF(C26=0,0,IF(D26=0,0,((C26/D26)*100)-100)) -> -6.546942166755926 | L26: =IF(F26=0,0,((C26/F26)*100)-100) -> 16.731727849836943 | M26: =IF(G26=0,0,((C26/G26)*100)-100) -> 27.097453143197185 | N26: =IF(C26=0,0,IF(H26=0,0,((C26/H26)*100)-100)) -> 31.828492777234942 | P26: 6850000 | Q26: =IF(C26=0,0,IF(P26=0,0,((C26/P26)*100)-100)) -> 3.8483686131386889 | R26: =IF(C26=0,0,(C26/$C$42)*100) -> 4.4928257086474002 | T26: 15.85 | U26: 16.343273788464675 | V26: =U26-T26 -> 0.49327378846467518
A27: P.G. Nova | B27: 6900000 | C27: 6662588.4900000002 | D27: 7119367.8099999996 | F27: 5924551.9500000002 | G27: 4734948.79 | H27: 4937815.52 | J27: =IF(B27=0,0,((C27/B27)*100)-100) -> -3.4407465217391291 | K27: =IF(C27=0,0,IF(D27=0,0,((C27/D27)*100)-100)) -> -6.4160095698159978 | L27: =IF(F27=0,0,((C27/F27)*100)-100) -> 12.457254932164119 | M27: =IF(G27=0,0,((C27/G27)*100)-100) -> 40.71088802630959 | N27: =IF(C27=0,0,IF(H27=0,0,((C27/H27)*100)-100)) -> 34.929878668290172 | P27: 6900000 | Q27: =IF(C27=0,0,IF(P27=0,0,((C27/P27)*100)-100)) -> -3.4407465217391291 | R27: =IF(C27=0,0,(C27/$C$42)*100) -> 4.2079668660663083 | T27: 15.45 | U27: 15.695600269618332 | V27: =U27-T27 -> 0.24560026961833259
A28: Nilo Pecanha | B28: 14500000 | C28: 14839731.07 | D28: 15376076.26 | F28: 12965034.85 | G28: 12223726.800000001 | H28: 12068286.189999999 | J28: =IF(B28=0,0,((C28/B28)*100)-100) -> 2.3429728965517143 | K28: =IF(C28=0,0,IF(D28=0,0,((C28/D28)*100)-100)) -> -3.4881798251435043 | L28: =IF(F28=0,0,((C28/F28)*100)-100) -> 14.459631167131022 | M28: =IF(G28=0,0,((C28/G28)*100)-100) -> 21.401036793459753 | N28: =IF(C28=0,0,IF(H28=0,0,((C28/H28)*100)-100)) -> 22.964693050587996 | P28: 14500000 | Q28: =IF(C28=0,0,IF(P28=0,0,((C28/P28)*100)-100)) -> 2.3429728965517143 | R28: =IF(C28=0,0,(C28/$C$42)*100) -> 9.3724979019220065 | T28: 16.34 | U28: 16.98461781895351 | V28: =U28-T28 -> 0.64461781895350967
A29: Champagnat | B29: 6800000 | C29: 6911740.0499999998 | D29: 7167369.2000000002 | F29: 6323508.0099999998 | G29: 6326707.2699999996 | H29: 6622546.9400000004 | J29: =IF(B29=0,0,((C29/B29)*100)-100) -> 1.6432360294117672 | K29: =IF(C29=0,0,IF(D29=0,0,((C29/D29)*100)-100)) -> -3.5665687488234994 | L29: =IF(F29=0,0,((C29/F29)*100)-100) -> 9.3023056042590468 | M29: =IF(G29=0,0,((C29/G29)*100)-100) -> 9.2470341211155755 | N29: =IF(C29=0,0,IF(H29=0,0,((C29/H29)*100)-100)) -> 4.3667959264022755 | P29: 6800000 | Q29: =IF(C29=0,0,IF(P29=0,0,((C29/P29)*100)-100)) -> 1.6432360294117672 | R29: =IF(C29=0,0,(C29/$C$42)*100) -> 4.3653263534010467 | T29: 16.93 | U29: 17.429782099516313 | V29: =U29-T29 -> 0.49978209951631314
A30: Araucária Nova | B30: 6700000 | C30: 7187477.5 | D30: 7160605.2300000004 | F30: 4673891.19 | G30: 3809254.16 | H30: 3323590.65 | J30: =IF(B30=0,0,((C30/B30)*100)-100) -> 7.2757835820895593 | K30: =IF(C30=0,0,IF(D30=0,0,((C30/D30)*100)-100)) -> 0.37527931141094939 | L30: =IF(F30=0,0,((C30/F30)*100)-100) -> 53.779307386914155 | M30: =IF(G30=0,0,((C30/G30)*100)-100) -> 88.684640039875916 | N30: =IF(C30=0,0,IF(H30=0,0,((C30/H30)*100)-100)) -> 116.25640028804392 | P30: 6700000 | Q30: =IF(C30=0,0,IF(P30=0,0,((C30/P30)*100)-100)) -> 7.2757835820895593 | R30: =IF(C30=0,0,(C30/$C$42)*100) -> 4.5394769939629125 | T30: 16.15 | U30: 16.622405236051172 | V30: =U30-T30 -> 0.47240523605117346
A31: Santa Candida | B31: 8500000 | C31: 8409612.4800000004 | D31: 8931576 | F31: 7561406.0999999996 | G31: 6588961.3099999996 | H31: 5796068.3099999996 | J31: =IF(B31=0,0,((C31/B31)*100)-100) -> -1.0633825882352852 | K31: =IF(C31=0,0,IF(D31=0,0,((C31/D31)*100)-100)) -> -5.844024839513196 | L31: =IF(F31=0,0,((C31/F31)*100)-100) -> 11.21757473123948 | M31: =IF(G31=0,0,((C31/G31)*100)-100) -> 27.63183883379034 | N31: =IF(C31=0,0,IF(H31=0,0,((C31/H31)*100)-100)) -> 45.091673013770958 | P31: 8500000 | Q31: =IF(C31=0,0,IF(P31=0,0,((C31/P31)*100)-100)) -> -1.0633825882352852 | R31: =IF(C31=0,0,(C31/$C$42)*100) -> 5.3113546972638721 | T31: 16.14 | U31: 16.393037369779016 | V31: =U31-T31 -> 0.25303736977901536
A32: Paranaguá Raia | B32: 7900000 | C32: 8612681.0099999998 | D32: 8898200.1999999993 | F32: 7338451.3499999996 | G32: 6732047.3600000003 | H32: 6122888.3499999996 | J32: =IF(B32=0,0,((C32/B32)*100)-100) -> 9.0212786075949367 | K32: =IF(C32=0,0,IF(D32=0,0,((C32/D32)*100)-100)) -> -3.2087296709732271 | L32: =IF(F32=0,0,((C32/F32)*100)-100) -> 17.363740648086477 | M32: =IF(G32=0,0,((C32/G32)*100)-100) -> 27.935538023309434 | N32: =IF(C32=0,0,IF(H32=0,0,((C32/H32)*100)-100)) -> 40.663695264017036 | P32: 7900000 | Q32: =IF(C32=0,0,IF(P32=0,0,((C32/P32)*100)-100)) -> 9.0212786075949367 | R32: =IF(C32=0,0,(C32/$C$42)*100) -> 5.4396090006871338 | T32: 17.59 | U32: 18.384061023061157 | V32: =U32-T32 -> 0.79406102306115756
A33: Novo Mundo | B33: 6200000 | C33: 6392344.8200000003 | D33: 6866128.8399999999 | F33: 5457017.9000000004 | G33: 5919006.4199999999 | H33: 0 | J33: =IF(B33=0,0,((C33/B33)*100)-100) -> 3.1023358064516344 | K33: =IF(C33=0,0,IF(D33=0,0,((C33/D33)*100)-100)) -> -6.9003077431328705 | L33: =IF(F33=0,0,((C33/F33)*100)-100) -> 17.139891001640279 | M33: =IF(G33=0,0,((C33/G33)*100)-100) -> 7.9969232403704638 | N33: =IF(C33=0,0,IF(H33=0,0,((C33/H33)*100)-100)) -> 0 | P33: 6200000 | Q33: =IF(C33=0,0,IF(P33=0,0,((C33/P33)*100)-100)) -> 3.1023358064516344 | R33: =IF(C33=0,0,(C33/$C$42)*100) -> 4.0372859946856172 | T33: 15.2 | U33: 16.48700685861937 | V33: =U33-T33 -> 1.287006858619371
A34: Uvaranas | B34: 6100000 | C34: 6022328.5099999998 | D34: 6420968.4199999999 | F34: 5320517.85 | G34: 4591080.24 | H34: 0 | J34: =IF(B34=0,0,((C34/B34)*100)-100) -> -1.2733031147540999 | K34: =IF(C34=0,0,IF(D34=0,0,((C34/D34)*100)-100)) -> -6.2084078899737136 | L34: =IF(F34=0,0,((C34/F34)*100)-100) -> 13.190645718818516 | M34: =IF(G34=0,0,((C34/G34)*100)-100) -> 31.174542704137082 | N34: =IF(C34=0,0,IF(H34=0,0,((C34/H34)*100)-100)) -> 0 | P34: 6100000 | Q34: =IF(C34=0,0,IF(P34=0,0,((C34/P34)*100)-100)) -> -1.2733031147540999 | R34: =IF(C34=0,0,(C34/$C$42)*100) -> 3.8035905811506114 | T34: 15.4 | U34: 16.259723083422429 | V34: =U34-T34 -> 0.85972308342242876
A35: Torres | B35: 6750000 | C35: 6979976.5599999996 | D35: 7305001.4299999997 | F35: 5576626.3099999996 | G35: 4957340.01 | H35: 0 | J35: =IF(B35=0,0,((C35/B35)*100)-100) -> 3.4070601481481333 | K35: =IF(C35=0,0,IF(D35=0,0,((C35/D35)*100)-100)) -> -4.4493471098471815 | L35: =IF(F35=0,0,((C35/F35)*100)-100) -> 25.164860831422644 | M35: =IF(G35=0,0,((C35/G35)*100)-100) -> 40.800843716991693 | N35: =IF(C35=0,0,IF(H35=0,0,((C35/H35)*100)-100)) -> 0 | P35: 6750000 | Q35: =IF(C35=0,0,IF(P35=0,0,((C35/P35)*100)-100)) -> 3.4070601481481333 | R35: =IF(C35=0,0,(C35/$C$42)*100) -> 4.4084232628930504 | T35: 16.15 | U35: 16.609942568345819 | V35: =U35-T35 -> 0.45994256834582004
A36: Total Hiper | B36: =SUM(B23:B35) -> 92400000 | C36: =SUM(C23:C35) -> 95139359.510000005 | D36: =SUM(D23:D35) -> 99730596.280000001 | F36: =SUM(F23:F35) -> 81261799.709999993 | G36: =SUM(G23:G35) -> 74357568.890000001 | H36: =SUM(H23:H35) -> 56668153.380000003 | I36: =SUM(B36:H36) -> 499557477.76999992 | J36: =IF(C36=0,0,((C36/B36)*100)-100) -> 2.9646747943723 | K36: =IF(C36=0,0,IF(D36=0,0,((C36/D36)*100)-100)) -> -4.6036391451123109 | L36: =IF(F36=0,0,IF(C36=0,0,((C36/F36)*100)-100)) -> 17.077593468917797 | M36: =IF(G36=0,0,IF(C36=0,0,((C36/G36)*100)-100)) -> 27.948453574031333 | N36: =IF(C36=0,0,IF(H36=0,0,((C36/H36)*100)-100)) -> 67.888582625982878 | P36: =SUM(P23:P35) -> 92400000 | Q36: =IF(C36=0,0,((C36/P36)*100)-100) -> 2.9646747943723 | R36: =IF(C36=0,0,(C36/$C$42)*100) -> 60.088248445440229 | T36: 16.178062770562772 | U36: 16.676721529360648 | V36: =U36-T36 -> 0.4986587587978768
A37: Total s/ 29,37,38 | B37: =B22+B36 -> 138949997 | C37: =C22+C36 -> 143180675.93000001 | D37: =D22+D36 -> 149316505.78 | E37: =E22+E36 -> 0 | F37: =F22+F36 -> 122868476.3 | G37: =G22+G36 -> 105152468.13 | H37: =H22+H36 -> 85161971.210000008 | I37: =SUM(B37:H37) -> 744630094.35000002 | J37: =IF(C37=0,0,((C37/B37)*100)-100) -> 3.044749205716073 | K37: =IF(C37=0,0,IF(D37=0,0,((C37/D37)*100)-100)) -> -4.1092776836342608 | L37: =IF(F37=0,0,IF(C37=0,0,((C37/F37)*100)-100)) -> 16.531660716948295 | M37: =IF(G37=0,0,IF(C37=0,0,((C37/G37)*100)-100)) -> 36.164826633442146 | N37: =IF(C37=0,0,IF(H37=0,0,((C37/H37)*100)-100)) -> 68.127479784295133 | P37: =P22+P36 -> 138950000 | Q37: =IF(C37=0,0,((C37/P37)*100)-100) -> 3.0447469809284087 | R37: =IF(C37=0,0,(C37/$C$42)*100) -> 90.43024960624841 | T37: 16.26683697834121 | U37: 16.69156873528387 | V37: =U37-T37 -> 0.42473175694265919
A38: Centenário | B38: 0 | C38: 0 | D38: 0 | F38: 0 | G38: 1236381.2 | H38: 1238365.81 | J38: =IF(B38=0,0,((C38/B38)*100)-100) -> 0 | K38: =IF(C38=0,0,IF(D38=0,0,((C38/D38)*100)-100)) -> 0 | L38: =IF(F38=0,0,((C38/F38)*100)-100) -> 0 | M38: =IF(G38=0,0,((C38/G38)*100)-100) -> -100 | N38: =IF(C38=0,0,IF(H38=0,0,((C38/H38)*100)-100)) -> 0 | P38: 0 | Q38: =IF(P38=0,0,IF(C38=0,0,((C38/P38)*100)-100)) -> 0 | R38: =IF(C38=0,0,(C38/$C$42)*100) -> 0 | T38: 0 | U38: 0 | V38: =U38-T38 -> 0
A39: Castro | B39: 4126371.82 | C39: 4141609.44 | D39: 0 | F39: 0 | G39: 0 | H39: 0 | J39: =IF(B39=0,0,((C39/B39)*100)-100) -> 0.36927404181430745 | K39: =IF(C39=0,0,IF(D39=0,0,((C39/D39)*100)-100)) -> 0 | L39: =IF(F39=0,0,((C39/F39)*100)-100) -> 0 | M39: =IF(G39=0,0,((C39/G39)*100)-100) -> 0 | N39: =IF(C39=0,0,IF(H39=0,0,((C39/H39)*100)-100)) -> 0 | P39: 4000000 | Q39: =IF(P39=0,0,IF(C39=0,0,((C39/P39)*100)-100)) -> 3.5402359999999931 | R39: =IF(C39=0,0,(C39/$C$42)*100) -> 2.6157634261616289 | T39: 16 | U39: 16.381659056195314 | V39: =U39-T39 -> 0.38165905619531415
A40: Água Verde | B40: 6600000 | C40: 7009138.9500000002 | D40: 7201190.0899999999 | F40: 0 | G40: 0 | H40: 0 | J40: =IF(B40=0,0,((C40/B40)*100)-100) -> 6.1990750000000077 | K40: =IF(C40=0,0,IF(D40=0,0,((C40/D40)*100)-100)) -> -2.6669361258313842 | L40: =IF(F40=0,0,((C40/F40)*100)-100) -> 0 | M40: =IF(G40=0,0,((C40/G40)*100)-100) -> 0 | N40: =IF(C40=0,0,IF(H40=0,0,((C40/H40)*100)-100)) -> 0 | P40: 6600000 | Q40: =IF(P40=0,0,IF(C40=0,0,((C40/P40)*100)-100)) -> 6.1990750000000077 | R40: =IF(C40=0,0,(C40/$C$42)*100) -> 4.4268416855585793 | T40: 16.1 | U40: 16.967313497187838 | V40: =U40-T40 -> 0.8673134971878369
A41: Colombo | B41: 4500000 | C41: 4001297.92 | D41: 4836222.99 | F41: 0 | G41: 0 | H41: 0 | J41: =IF(B41=0,0,((C41/B41)*100)-100) -> -11.082268444444438 | K41: =IF(C41=0,0,IF(D41=0,0,((C41/D41)*100)-100)) -> -17.263990343836483 | L41: =IF(F41=0,0,((C41/F41)*100)-100) -> 0 | M41: =IF(G41=0,0,((C41/G41)*100)-100) -> 0 | N41: =IF(C41=0,0,IF(H41=0,0,((C41/H41)*100)-100)) -> 0 | P41: 4500000 | Q41: =IF(P41=0,0,IF(C41=0,0,((C41/P41)*100)-100)) -> -11.082268444444438 | R41: =IF(C41=0,0,(C41/$C$42)*100) -> 2.5271452820313738 | T41: 15 | U41: 14.966499567720264 | V41: =U41-T41 -> -3.3500432279735648E-2
A42: Total Geral | B42: =B22+B36+SUM(B38:B41) -> 154176368.81999999 | C42: =C22+C36+SUM(C38:C41) -> 158332722.24000001 | D42: =D22+D36+SUM(D38:D41) -> 161353918.86000001 | F42: =F22+F36+SUM(F38:F41) -> 122868476.3 | G42: =G22+G36+SUM(G38:G41) -> 106388849.33 | H42: =H22+H36+SUM(H38:H41) -> 86400337.020000011 | J42: =IF(C42=0,0,((C42/B42)*100)-100) -> 2.6958433719842958 | K42: =IF(C42=0,0,IF(D42=0,0,((C42/D42)*100)-100)) -> -1.8724036213966286 | L42: =IF(F42=0,0,IF(C42=0,0,((C42/F42)*100)-100)) -> 28.863584059925387 | M42: =IF(G42=0,0,IF(C42=0,0,((C42/G42)*100)-100)) -> 48.824546216191322 | N42: =IF(C42=0,0,IF(H42=0,0,((C42/H42)*100)-100)) -> 83.254750734767413 | P42: =P22+P36+SUM(P38:P41) -> 154050000 | Q42: =IF(C42=0,0,((C42/P42)*100)-100) -> 2.7800858422590125 | R42: =R22+R36+SUM(R38:R41) -> 100 | T42: 16.21 | U42: 16.652074011229985 | V42: =U42-T42 -> 0.44207401122998391
A44: Água Verde | B44: 0 | C44: 0 | D44: 0 | F44: 0 | G44: 0 | H44: 0 | J44: =IF(B44=0,0,((C44/B44)*100)-100) -> 0 | K44: =IF(C44=0,0,IF(D44=0,0,((C44/D44)*100)-100)) -> 0 | L44: =IF(F44=0,0,((C44/F44)*100)-100) -> 0 | M44: =IF(G44=0,0,((C44/G44)*100)-100) -> 0 | N44: =IF(C44=0,0,IF(H44=0,0,((C44/H44)*100)-100)) -> 0 | P44: =B44 -> 0 | Q44: =IF(C44=0,0,IF(P44=0,0,((C44/P44)*100)-100)) -> 0 | R44: =IF(C44=0,0,(C44/$C$42)*100) -> 0 | T44: 14.95 | U44: 0 | V44: =U44-T44 -> -14.95
A45: Total Geral | B45: =B42+B44 -> 154176368.81999999 | C45: =C42+C44 -> 158332722.24000001 | D45: =D42+D44 -> 161353918.86000001 | F45: =F42+F44 -> 122868476.3 | G45: =G42+G44 -> 106388849.33 | H45: =H42+H44 -> 86400337.020000011 | J45: =IF(C45=0,0,((C45/B45)*100)-100) -> 2.6958433719842958 | K45: =IF(C45=0,0,IF(D45=0,0,((C45/D45)*100)-100)) -> -1.8724036213966286 | L45: =IF(F45=0,0,IF(C45=0,0,((C45/F45)*100)-100)) -> 28.863584059925387 | M45: =IF(G45=0,0,IF(C45=0,0,((C45/G45)*100)-100)) -> 48.824546216191322 | N45: =IF(C45=0,0,IF(H45=0,0,((C45/H45)*100)-100)) -> 83.254750734767413 | P45: =P42+P44 -> 154050000 | Q45: =IF(C45=0,0,((C45/P45)*100)-100) -> 2.7800858422590125 | R45: =R25+R39+R44 -> 6.2697566867779759 | T45: 16.215577767166149 | U45: 16.652074011229985 | V45: =U45-T45 -> 0.4364962440638358