A2: Periodo: | B2: 40878 | C2: a | D2: 40908 | G2: Vendas Acumuladas por Filial | P2: =NOW() -> 40909.333422453703
A4: v.New | B4: Vendas 2011 | F4: Vendas de Anos Anteriores | J4: Percentuais ( % ) | P4: Meta Mensal | T4: Margem
A5: Lojas | B5: Previsao | C5: Realizada | D5: Mes Anterior | F5: Vendas 2010 | G5: Vendas 2009 | H5: Vendas 2008 | J5: % Prev | K5: % MA | L5: 2010 | M5: 2009 | N5: 2008 | P5: Previsao Mes | Q5: Final | R5: Part. | T5: Meta | U5: Coml | V5: Dif
A6: S. Felicidade | B6: 4450000 | C6: 4713996.11 | D6: 3933863.03 | F6: 3976363.59 | G6: 3470654 | H6: 2918228.15 | J6: =IF(B6=0,0,((C6/B6)*100)-100) -> 5.9324968539326051 | K6: =IF(C6=0,0,IF(D6=0,0,((C6/D6)*100)-100)) -> 19.83122122073479 | L6: =IF(F6=0,0,((C6/F6)*100)-100) -> 18.550429388676719 | M6: =IF(G6=0,0,((C6/G6)*100)-100) -> 35.8244328014259 | N6: =IF(C6=0,0,IF(H6=0,0,((C6/H6)*100)-100)) -> 61.536242805416038 | P6: 4450000 | Q6: =IF(C6=0,0,((C6/P6)*100)-100) -> 5.9324968539326051 | R6: =IF(C6=0,0,(C6/$C$42)*100) -> 2.2261040213086036 | T6: 16.9 | U6: 16.399190876718816 | V6: =U6-T6 -> -0.50080912328118288
A7: Lapa | B7: 3250000 | C7: 3175178.66 | D7: 2568723.93 | F7: 3013929.55 | G7: 2775609.1 | H7: 2531215.77 | J7: =IF(B7=0,0,((C7/B7)*100)-100) -> -2.3021950769230699 | K7: =IF(C7=0,0,IF(D7=0,0,((C7/D7)*100)-100)) -> 23.609182867697271 | L7: =IF(F7=0,0,((C7/F7)*100)-100) -> 5.3501287048995749 | M7: =IF(G7=0,0,((C7/G7)*100)-100) -> 14.395743262262698 | N7: =IF(C7=0,0,IF(H7=0,0,((C7/H7)*100)-100)) -> 25.440853270284421 | P7: 3250000 | Q7: =IF(C7=0,0,((C7/P7)*100)-100) -> -2.3021950769230699 | R7: =IF(C7=0,0,(C7/$C$42)*100) -> 1.4994238048701454 | T7: 15.41 | U7: 14.771992074297954 | V7: =U7-T7 -> -0.63800792570204656
A8: Araucaria | B8: 1800000 | C8: 1949093.15 | D8: 1558885.34 | F8: 1935272.53 | G8: 1613967.61 | H8: 1482403.68 | J8: =IF(B8=0,0,((C8/B8)*100)-100) -> 8.2829527777777798 | K8: =IF(C8=0,0,IF(D8=0,0,((C8/D8)*100)-100)) -> 25.031206592782482 | L8: =IF(F8=0,0,((C8/F8)*100)-100) -> 0.71414334600201812 | M8: =IF(G8=0,0,((C8/G8)*100)-100) -> 20.764080885117636 | N8: =IF(C8=0,0,IF(H8=0,0,((C8/H8)*100)-100)) -> 31.481942219679325 | P8: 1800000 | Q8: =IF(C8=0,0,((C8/P8)*100)-100) -> 8.2829527777777798 | R8: =IF(C8=0,0,(C8/$C$42)*100) -> 0.92042589723733437 | T8: 16.62 | U8: 16.238650266663758 | V8: =U8-T8 -> -0.38134973333624345
A9: Hauer | B9: 5350000 | C9: 5624053.6900000004 | D9: 4642534.9 | F9: 5079197.72 | G9: 4450850.21 | H9: 4035049.65 | J9: =IF(B9=0,0,((C9/B9)*100)-100) -> 5.1224988785046861 | K9: =IF(C9=0,0,IF(D9=0,0,((C9/D9)*100)-100)) -> 21.141872083718738 | L9: =IF(F9=0,0,((C9/F9)*100)-100) -> 10.727205358723467 | M9: =IF(G9=0,0,((C9/G9)*100)-100) -> 26.359087020365052 | N9: =IF(C9=0,0,IF(H9=0,0,((C9/H9)*100)-100)) -> 39.380036872656575 | P9: 5350000 | Q9: =IF(C9=0,0,((C9/P9)*100)-100) -> 5.1224988785046861 | R9: =IF(C9=0,0,(C9/$C$42)*100) -> 2.6558631452422841 | T9: 16.45 | U9: 15.989475733472236 | V9: =U9-T9 -> -0.4605242665277629
A10: Paranagua | B10: 3350000 | C10: 3367112.11 | D10: 2518017.04 | F10: 3111706.01 | G10: 2814642.97 | H10: 2420388.95 | J10: =IF(B10=0,0,((C10/B10)*100)-100) -> 0.51080925373135244 | K10: =IF(C10=0,0,IF(D10=0,0,((C10/D10)*100)-100)) -> 33.720783319242344 | L10: =IF(F10=0,0,((C10/F10)*100)-100) -> 8.20791228924611 | M10: =IF(G10=0,0,((C10/G10)*100)-100) -> 19.628391447459492 | N10: =IF(C10=0,0,IF(H10=0,0,((C10/H10)*100)-100)) -> 39.114505129433809 | P10: 3350000 | Q10: =IF(C10=0,0,((C10/P10)*100)-100) -> 0.51080925373135244 | R10: =IF(C10=0,0,(C10/$C$42)*100) -> 1.5900610932553141 | T10: 16.1 | U10: 16.514247278805339 | V10: =U10-T10 -> 0.41424727880533752
A11: Sitio Cercado | B11: 4150000 | C11: 4298117.66 | D11: 3471035.82 | F11: 3574335.19 | G11: 2872142.89 | H11: 2390993.3 | J11: =IF(B11=0,0,((C11/B11)*100)-100) -> 3.5691002409638628 | K11: =IF(C11=0,0,IF(D11=0,0,((C11/D11)*100)-100)) -> 23.828098668252878 | L11: =IF(F11=0,0,((C11/F11)*100)-100) -> 20.24942909733096 | M11: =IF(G11=0,0,((C11/G11)*100)-100) -> 49.648461953785329 | N11: =IF(C11=0,0,IF(H11=0,0,((C11/H11)*100)-100)) -> 79.762848352607278 | P11: 4150000 | Q11: =IF(C11=0,0,((C11/P11)*100)-100) -> 3.5691002409638628 | R11: =IF(C11=0,0,(C11/$C$42)*100) -> 2.029712537667649 | T11: 15.43 | U11: 14.410222311131427 | V11: =U11-T11 -> -1.0197776888685723
A12: Apucarana | B12: 3550000 | C12: 3601309.19 | D12: 2559826.33 | F12: 3904456.77 | G12: 3563739.74 | H12: 3136053.5 | J12: =IF(B12=0,0,((C12/B12)*100)-100) -> 1.4453292957746555 | K12: =IF(C12=0,0,IF(D12=0,0,((C12/D12)*100)-100)) -> 40.685684329217764 | L12: =IF(F12=0,0,((C12/F12)*100)-100) -> -7.7641423085854768 | M12: =IF(G12=0,0,((C12/G12)*100)-100) -> 1.0542141890529848 | N12: =IF(C12=0,0,IF(H12=0,0,((C12/H12)*100)-100)) -> 14.83570640615666 | P12: 3550000 | Q12: =IF(C12=0,0,((C12/P12)*100)-100) -> 1.4453292957746555 | R12: =IF(C12=0,0,(C12/$C$42)*100) -> 1.7006566579102735 | T12: 16.28 | U12: 14.192480374060857 | V12: =U12-T12 -> -2.0875196259391444
A13: Ahú | B13: 2900000 | C13: 2823319.32 | D13: 2382888.3 | F13: 2379038.47 | G13: 1992791.01 | H13: 1765242.55 | J13: =IF(B13=0,0,((C13/B13)*100)-100) -> -2.6441613793103471 | K13: =IF(C13=0,0,IF(D13=0,0,((C13/D13)*100)-100)) -> 18.483074510878254 | L13: =IF(F13=0,0,((C13/F13)*100)-100) -> 18.674807305659073 | M13: =IF(G13=0,0,((C13/G13)*100)-100) -> 41.676638735940486 | N13: =IF(C13=0,0,IF(H13=0,0,((C13/H13)*100)-100)) -> 59.939455345669046 | P13: 2900000 | Q13: =IF(C13=0,0,((C13/P13)*100)-100) -> -2.6441613793103471 | R13: =IF(C13=0,0,(C13/$C$42)*100) -> 1.3332642507611812 | T13: 16.12 | U13: 15.683916688531003 | V13: =U13-T13 -> -0.43608331146899815
A14: P.G. Centro | B14: 3100000 | C14: 2885479.72 | D14: 2377310.48 | F14: 2710700.74 | G14: 2343619.24 | H14: 2493558.36 | J14: =IF(B14=0,0,((C14/B14)*100)-100) -> -6.9200090322580508 | K14: =IF(C14=0,0,IF(D14=0,0,((C14/D14)*100)-100)) -> 21.375804476325698 | L14: =IF(F14=0,0,((C14/F14)*100)-100) -> 6.4477416271336665 | M14: =IF(G14=0,0,((C14/G14)*100)-100) -> 23.120670403781119 | N14: =IF(C14=0,0,IF(H14=0,0,((C14/H14)*100)-100)) -> 15.717352610909032 | P14: 3100000 | Q14: =IF(C14=0,0,((C14/P14)*100)-100) -> -6.9200090322580508 | R14: =IF(C14=0,0,(C14/$C$42)*100) -> 1.3626184362923508 | T14: 16.8 | U14: 16.514861175319574 | V14: =U14-T14 -> -0.28513882468042695
A15: Maringa | B15: 4250000 | C15: 4390763.34 | D15: 3815011.37 | F15: 3777025.84 | G15: 3215739.63 | H15: 3246917.14 | J15: =IF(B15=0,0,((C15/B15)*100)-100) -> 3.3120785882352948 | K15: =IF(C15=0,0,IF(D15=0,0,((C15/D15)*100)-100)) -> 15.091749778979022 | L15: =IF(F15=0,0,((C15/F15)*100)-100) -> 16.249226931420722 | M15: =IF(G15=0,0,((C15/G15)*100)-100) -> 36.539765192370396 | N15: =IF(C15=0,0,IF(H15=0,0,((C15/H15)*100)-100)) -> 35.22868464700025 | P15: 4250000 | Q15: =IF(C15=0,0,((C15/P15)*100)-100) -> 3.3120785882352948 | R15: =IF(C15=0,0,(C15/$C$42)*100) -> 2.0734628751716122 | T15: 15.86 | U15: 16.057361907371671 | V15: =U15-T15 -> 0.19736190737167192
A16: Araucaria Nova | B16: 0 | C16: 0 | D16: 0 | F16: 0 | G16: 0 | H16: 0 | J16: =IF(B16=0,0,((C16/B16)*100)-100) -> 0 | K16: =IF(C16=0,0,IF(D16=0,0,((C16/D16)*100)-100)) -> 0 | L16: =IF(F16=0,0,((C16/F16)*100)-100) -> 0 | M16: =IF(G16=0,0,((C16/G16)*100)-100) -> 0 | N16: =IF(C16=0,0,IF(H16=0,0,((C16/H16)*100)-100)) -> 0 | P16: 0 | Q16: =IF(C16=0,0,((C16/P16)*100)-100) -> 0 | R16: =IF(C16=0,0,(C16/$C$42)*100) -> 0 | T16: 0 | U16: 0 | V16: =U16-T16 -> 0
A17: Cristo Rei | B17: 3400000 | C17: 3415934.36 | D17: 3119352.5 | F17: 2848600.21 | G17: 2341252.18 | H17: 1885774.08 | J17: =IF(B17=0,0,((C17/B17)*100)-100) -> 0.46865764705881929 | K17: =IF(C17=0,0,IF(D17=0,0,((C17/D17)*100)-100)) -> 9.5078020198102138 | L17: =IF(F17=0,0,((C17/F17)*100)-100) -> 19.916243353783926 | M17: =IF(G17=0,0,((C17/G17)*100)-100) -> 45.902025812529075 | N17: =IF(C17=0,0,IF(H17=0,0,((C17/H17)*100)-100)) -> 81.142290385070936 | P17: 3400000 | Q17: =IF(C17=0,0,((C17/P17)*100)-100) -> 0.46865764705881929 | R17: =IF(C17=0,0,(C17/$C$42)*100) -> 1.6131165656227562 | T17: 17.25 | U17: 16.803184707565634 | V17: =U17-T17 -> -0.44681529243436557
A18: Fazenda | B18: 4650000 | C18: 5205743.21 | D18: 3875919.64 | F18: 3732139.27 | G18: 0 | H18: 0 | J18: =IF(B18=0,0,((C18/B18)*100)-100) -> 11.951466881720421 | K18: =IF(C18=0,0,IF(D18=0,0,((C18/D18)*100)-100)) -> 34.309884969648124 | L18: =IF(F18=0,0,((C18/F18)*100)-100) -> 39.484162658270805 | M18: =IF(G18=0,0,((C18/G18)*100)-100) -> 0 | N18: =IF(C18=0,0,IF(H18=0,0,((C18/H18)*100)-100)) -> 0 | P18: 4650000 | Q18: =IF(C18=0,0,((C18/P18)*100)-100) -> 11.951466881720421 | R18: =IF(C18=0,0,(C18/$C$42)*100) -> 2.458323177038209 | T18: 14.95 | U18: 14.318342644488604 | V18: =U18-T18 -> -0.63165735551139512
A19: Campo Largo | B19: 5550000 | C19: 5671345.04 | D19: 4623838.37 | F19: 4967965.97 | G19: 4029721.84 | H19: 2976092.29 | J19: =IF(B19=0,0,((C19/B19)*100)-100) -> 2.1863971171171244 | K19: =IF(C19=0,0,IF(D19=0,0,((C19/D19)*100)-100)) -> 22.654482838248512 | L19: =IF(F19=0,0,((C19/F19)*100)-100) -> 14.158290822591923 | M19: =IF(G19=0,0,((C19/G19)*100)-100) -> 40.737878820936203 | N19: =IF(C19=0,0,IF(H19=0,0,((C19/H19)*100)-100)) -> 90.56348013992536 | P19: 5550000 | Q19: =IF(C19=0,0,((C19/P19)*100)-100) -> 2.1863971171171244 | R19: =IF(C19=0,0,(C19/$C$42)*100) -> 2.6781956762736074 | T19: 15.8 | U19: 16.089308154666604 | V19: =U19-T19 -> 0.2893081546666032
A20: Brasilia | B20: 4200000 | C20: 4130394.71 | D20: 3372310.72 | F20: 3571971.82 | G20: 2885510.95 | H20: 2642510.38 | J20: =IF(B20=0,0,((C20/B20)*100)-100) -> -1.6572688095238135 | K20: =IF(C20=0,0,IF(D20=0,0,((C20/D20)*100)-100)) -> 22.479660177932814 | L20: =IF(F20=0,0,((C20/F20)*100)-100) -> 15.633462920208601 | M20: =IF(G20=0,0,((C20/G20)*100)-100) -> 43.142576187416637 | N20: =IF(C20=0,0,IF(H20=0,0,((C20/H20)*100)-100)) -> 56.305713735739431 | P20: 4200000 | Q20: =IF(C20=0,0,((C20/P20)*100)-100) -> -1.6572688095238135 | R20: =IF(C20=0,0,(C20/$C$42)*100) -> 1.9505082437420138 | T20: 14.9 | U20: 15.366461913757391 | V20: =U20-T20 -> 0.46646191375739043
A21: Cajuru | B21: 6600000 | C21: 6719575.6299999999 | D21: 5388543.0800000001 | F21: 5559588.2400000002 | G21: 0 | H21: 0 | J21: =IF(B21=0,0,((C21/B21)*100)-100) -> 1.8117519696969566 | K21: =IF(C21=0,0,IF(D21=0,0,((C21/D21)*100)-100)) -> 24.701158183929749 | L21: =IF(F21=0,0,((C21/F21)*100)-100) -> 20.864627737251269 | M21: =IF(G21=0,0,((C21/G21)*100)-100) -> 0 | N21: =IF(C21=0,0,IF(H21=0,0,((C21/H21)*100)-100)) -> 0 | P21: 6600000 | Q21: =IF(C21=0,0,((C21/P21)*100)-100) -> 1.8117519696969566 | R21: =IF(C21=0,0,(C21/$C$42)*100) -> 3.1732046404744052 | T21: 15.8 | U21: 15.167454921554324 | V21: =U21-T21 -> -0.63254507844567698
A22: Total Super | B22: =SUM(B6:B21) -> 60550000 | C22: =SUM(C6:C21) -> 61971415.900000006 | D22: =SUM(D6:D21) -> 50208060.849999994 | F22: =SUM(F6:F21) -> 54142291.920000002 | G22: =SUM(G6:G21) -> 38370241.370000005 | H22: =SUM(H6:H21) -> 33924427.800000004 | I22: =SUM(B22:H22) -> 299166437.84000003 | J22: =IF(C22=0,0,((C22/B22)*100)-100) -> 2.3475076796036376 | K22: =IF(C22=0,0,IF(D22=0,0,((C22/D22)*100)-100)) -> 23.429216047884907 | L22: =IF(F22=0,0,IF(C22=0,0,((C22/F22)*100)-100)) -> 14.460274403544318 | M22: =IF(G22=0,0,IF(C22=0,0,((C22/G22)*100)-100)) -> 61.509059331726576 | N22: =IF(C22=0,0,IF(H22=0,0,((C22/H22)*100)-100)) -> 82.674903952248826 | P22: =SUM(P6:P21) -> 60550000 | Q22: =IF(C22=0,0,((C22/P22)*100)-100) -> 2.3475076796036376 | R22: =IF(C22=0,0,(C22/$C$42)*100) -> 29.264941022867742 | T22: 15.985549132947977 | U22: 15.57895841879578 | V22: =U22-T22 -> -0.4065907141521965
A23: Pinheirinho | B23: 6500000 | C23: 6735513.8499999996 | D23: 5406687.4800000004 | F23: 6066071.3300000001 | G23: 6490891.9199999999 | H23: 5248171 | J23: =IF(B23=0,0,((C23/B23)*100)-100) -> 3.6232899999999972 | K23: =IF(C23=0,0,IF(D23=0,0,((C23/D23)*100)-100)) -> 24.577458470005723 | L23: =IF(F23=0,0,((C23/F23)*100)-100) -> 11.035849787806569 | M23: =IF(G23=0,0,((C23/G23)*100)-100) -> 3.7686951657022831 | N23: =IF(C23=0,0,IF(H23=0,0,((C23/H23)*100)-100)) -> 28.340213190461952 | P23: 6500000 | Q23: =IF(C23=0,0,IF(P23=0,0,((C23/P23)*100)-100)) -> 3.6232899999999972 | R23: =IF(C23=0,0,(C23/$C$42)*100) -> 3.1807311922166166 | T23: 15.9 | U23: 15.481118786505057 | V23: =U23-T23 -> -0.41888121349494334
A24: Londrina | B24: 6600000 | C24: 6853538.5499999998 | D24: 5292461.7 | F24: 5389383.0899999999 | G24: 4486826.61 | H24: 4177137.22 | J24: =IF(B24=0,0,((C24/B24)*100)-100) -> 3.8414931818181941 | K24: =IF(C24=0,0,IF(D24=0,0,((C24/D24)*100)-100)) -> 29.496233293478525 | L24: =IF(F24=0,0,((C24/F24)*100)-100) -> 27.167403681448079 | M24: =IF(G24=0,0,((C24/G24)*100)-100) -> 52.74801425856748 | N24: =IF(C24=0,0,IF(H24=0,0,((C24/H24)*100)-100)) -> 64.072621727279511 | P24: 6600000 | Q24: =IF(C24=0,0,IF(P24=0,0,((C24/P24)*100)-100)) -> 3.8414931818181941 | R24: =IF(C24=0,0,(C24/$C$42)*100) -> 3.2364663377604139 | T24: 15.66 | U24: 15.56776360439382 | V24: =U24-T24 -> -9.2236395606180466E-2
A25: São Bráz | B25: 7650000 | C25: 7595124.8200000003 | D25: 6037251.6799999997 | F25: 7126930.04 | G25: 6287955.8600000003 | H25: 5776156.25 | J25: =IF(B25=0,0,((C25/B25)*100)-100) -> -0.71732261437908562 | K25: =IF(C25=0,0,IF(D25=0,0,((C25/D25)*100)-100)) -> 25.804343144428941 | L25: =IF(F25=0,0,((C25/F25)*100)-100) -> 6.5693752762023792 | M25: =IF(G25=0,0,((C25/G25)*100)-100) -> 20.788456361714978 | N25: =IF(C25=0,0,IF(H25=0,0,((C25/H25)*100)-100)) -> 31.490986241932092 | P25: 7650000 | Q25: =IF(C25=0,0,IF(P25=0,0,((C25/P25)*100)-100)) -> -0.71732261437908562 | R25: =IF(C25=0,0,(C25/$C$42)*100) -> 3.5866677675605434 | T25: 15.14 | U25: 15.657785463491566 | V25: =U25-T25 -> 0.51778546349156507
A26: S.J. Pinhais | B26: 7700000 | C26: 7504809.1399999997 | D26: 7459280.7000000002 | F26: 7772724.2300000004 | G26: 7024457.2599999998 | H26: 6123208.0999999996 | J26: =IF(B26=0,0,((C26/B26)*100)-100) -> -2.5349462337662345 | K26: =IF(C26=0,0,IF(D26=0,0,((C26/D26)*100)-100)) -> 0.61035965572389728 | L26: =IF(F26=0,0,((C26/F26)*100)-100) -> -3.4468621563330686 | M26: =IF(G26=0,0,((C26/G26)*100)-100) -> 6.8382774956196499 | N26: =IF(C26=0,0,IF(H26=0,0,((C26/H26)*100)-100)) -> 22.563352697420157 | P26: 7700000 | Q26: =IF(C26=0,0,IF(P26=0,0,((C26/P26)*100)-100)) -> -2.5349462337662345 | R26: =IF(C26=0,0,(C26/$C$42)*100) -> 3.5440177326976121 | T26: 15.75 | U26: 15.757994746286114 | V26: =U26-T26 -> 7.9947462861138519E-3
A27: P.G. Nova | B27: 8950000 | C27: 9214486.8699999992 | D27: 6968794.9299999997 | F27: 7834412.6500000004 | G27: 6153431.1500000004 | H27: 6264118.9400000004 | J27: =IF(B27=0,0,((C27/B27)*100)-100) -> 2.9551605586592018 | K27: =IF(C27=0,0,IF(D27=0,0,((C27/D27)*100)-100)) -> 32.224968054842719 | L27: =IF(F27=0,0,((C27/F27)*100)-100) -> 17.615541606683152 | M27: =IF(G27=0,0,((C27/G27)*100)-100) -> 49.745510193934621 | N27: =IF(C27=0,0,IF(H27=0,0,((C27/H27)*100)-100)) -> 47.099487705448951 | P27: 8950000 | Q27: =IF(C27=0,0,IF(P27=0,0,((C27/P27)*100)-100)) -> 2.9551605586592018 | R27: =IF(C27=0,0,(C27/$C$42)*100) -> 4.3513837934843629 | T27: 14.89 | U27: 15.045393949321459 | V27: =U27-T27 -> 0.15539394932145889
A28: Nilo Pecanha | B28: 18700000 | C28: 19469345.609999999 | D28: 15514523.82 | F28: 17064447.16 | G28: 15406385.18 | H28: 13959307.710000001 | J28: =IF(B28=0,0,((C28/B28)*100)-100) -> 4.1141476470588145 | K28: =IF(C28=0,0,IF(D28=0,0,((C28/D28)*100)-100)) -> 25.491093609342869 | L28: =IF(F28=0,0,((C28/F28)*100)-100) -> 14.093034643613962 | M28: =IF(G28=0,0,((C28/G28)*100)-100) -> 26.371925552493551 | N28: =IF(C28=0,0,IF(H28=0,0,((C28/H28)*100)-100)) -> 39.472142992111173 | P28: 18700000 | Q28: =IF(C28=0,0,IF(P28=0,0,((C28/P28)*100)-100)) -> 4.1141476470588145 | R28: =IF(C28=0,0,(C28/$C$42)*100) -> 9.1940654050874908 | T28: 15.62 | U28: 15.761475013437803 | V28: =U28-T28 -> 0.14147501343780355
A29: Champagnat | B29: 8500000 | C29: 8539970.6500000004 | D29: 7230010.3200000003 | F29: 7577672.4800000004 | G29: 7478729.2999999998 | H29: 7386694.6600000001 | J29: =IF(B29=0,0,((C29/B29)*100)-100) -> 0.47024294117647969 | K29: =IF(C29=0,0,IF(D29=0,0,((C29/D29)*100)-100)) -> 18.118374276400743 | L29: =IF(F29=0,0,((C29/F29)*100)-100) -> 12.699125919467022 | M29: =IF(G29=0,0,((C29/G29)*100)-100) -> 14.19012919748279 | N29: =IF(C29=0,0,IF(H29=0,0,((C29/H29)*100)-100)) -> 15.612882934570905 | P29: 8500000 | Q29: =IF(C29=0,0,IF(P29=0,0,((C29/P29)*100)-100)) -> 0.47024294117647969 | R29: =IF(C29=0,0,(C29/$C$42)*100) -> 4.0328550474392415 | T29: 16.2 | U29: 16.681701125050115 | V29: =U29-T29 -> 0.48170112505011531
A30: Araucária Nova | B30: 8700000 | C30: 9208021.0199999996 | D30: 7503056.25 | F30: 6091853.96 | G30: 4741181.51 | H30: 4167223.6 | J30: =IF(B30=0,0,((C30/B30)*100)-100) -> 5.8393220689655152 | K30: =IF(C30=0,0,IF(D30=0,0,((C30/D30)*100)-100)) -> 22.723603731479415 | L30: =IF(F30=0,0,((C30/F30)*100)-100) -> 51.153016478418664 | M30: =IF(G30=0,0,((C30/G30)*100)-100) -> 94.213636423297373 | N30: =IF(C30=0,0,IF(H30=0,0,((C30/H30)*100)-100)) -> 120.96296968561995 | P30: 8700000 | Q30: =IF(C30=0,0,IF(P30=0,0,((C30/P30)*100)-100)) -> 5.8393220689655152 | R30: =IF(C30=0,0,(C30/$C$42)*100) -> 4.3483304064322086 | T30: 15.6 | U30: 15.982053329413448 | V30: =U30-T30 -> 0.38205332941344849
A31: Santa Candida | B31: 11900000 | C31: 11375965.289999999 | D31: 8797687.9600000009 | F31: 10285120.699999999 | G31: 8640009.5399999991 | H31: 7072442.8499999996 | J31: =IF(B31=0,0,((C31/B31)*100)-100) -> -4.4036530252100903 | K31: =IF(C31=0,0,IF(D31=0,0,((C31/D31)*100)-100)) -> 29.306305721713699 | L31: =IF(F31=0,0,((C31/F31)*100)-100) -> 10.606045585833513 | M31: =IF(G31=0,0,((C31/G31)*100)-100) -> 31.666119549215239 | N31: =IF(C31=0,0,IF(H31=0,0,((C31/H31)*100)-100)) -> 60.849165292300654 | P31: 11900000 | Q31: =IF(C31=0,0,IF(P31=0,0,((C31/P31)*100)-100)) -> -4.4036530252100903 | R31: =IF(C31=0,0,(C31/$C$42)*100) -> 5.3721050012355853 | T31: 16.25 | U31: 15.307309714901566 | V31: =U31-T31 -> -0.94269028509843444
A32: Paranaguá Raia | B32: 12500000 | C32: 12120388.75 | D32: 9020531.2599999998 | F32: 11051614.77 | G32: 9502619.0099999998 | H32: 8300851.4199999999 | J32: =IF(B32=0,0,((C32/B32)*100)-100) -> -3.0368899999999996 | K32: =IF(C32=0,0,IF(D32=0,0,((C32/D32)*100)-100)) -> 34.364467021424645 | L32: =IF(F32=0,0,((C32/F32)*100)-100) -> 9.6707494989892666 | M32: =IF(G32=0,0,((C32/G32)*100)-100) -> 27.547876403812595 | N32: =IF(C32=0,0,IF(H32=0,0,((C32/H32)*100)-100)) -> 46.013801919128923 | P32: 12500000 | Q32: =IF(C32=0,0,IF(P32=0,0,((C32/P32)*100)-100)) -> -3.0368899999999996 | R32: =IF(C32=0,0,(C32/$C$42)*100) -> 5.7236462454778234 | T32: 16.82 | U32: 17.49412864335725 | V32: =U32-T32 -> 0.67412864335724976
A33: Novo Mundo | B33: 7950000 | C33: 8630762.4199999999 | D33: 6666527.2999999998 | F33: 7077384.29 | G33: 6667827.6600000001 | H33: 0 | J33: =IF(B33=0,0,((C33/B33)*100)-100) -> 8.5630493081761045 | K33: =IF(C33=0,0,IF(D33=0,0,((C33/D33)*100)-100)) -> 29.464142747904134 | L33: =IF(F33=0,0,((C33/F33)*100)-100) -> 21.948477945373796 | M33: =IF(G33=0,0,((C33/G33)*100)-100) -> 29.438894645936301 | N33: =IF(C33=0,0,IF(H33=0,0,((C33/H33)*100)-100)) -> 0 | P33: 7950000 | Q33: =IF(C33=0,0,IF(P33=0,0,((C33/P33)*100)-100)) -> 8.5630493081761045 | R33: =IF(C33=0,0,(C33/$C$42)*100) -> 4.0757299076602704 | T33: 15 | U33: 15.569717420167384 | V33: =U33-T33 -> 0.56971742016738425
A34: Uvaranas | B34: 8400000 | C34: 8444359.6400000006 | D34: 6298875.5999999996 | F34: 7298283.8099999996 | G34: 5949869.7199999997 | H34: 0 | J34: =IF(B34=0,0,((C34/B34)*100)-100) -> 0.52809095238094983 | K34: =IF(C34=0,0,IF(D34=0,0,((C34/D34)*100)-100)) -> 34.061381367811123 | L34: =IF(F34=0,0,((C34/F34)*100)-100) -> 15.703360678159228 | M34: =IF(G34=0,0,((C34/G34)*100)-100) -> 41.925118320069714 | N34: =IF(C34=0,0,IF(H34=0,0,((C34/H34)*100)-100)) -> 0 | P34: 8400000 | Q34: =IF(C34=0,0,IF(P34=0,0,((C34/P34)*100)-100)) -> 0.52809095238094983 | R34: =IF(C34=0,0,(C34/$C$42)*100) -> 3.987704383570243 | T34: 14.48 | U34: 15.357863417574668 | V34: =U34-T34 -> 0.87786341757466779
A35: Torres | B35: 8950000 | C35: 9032301.2799999993 | D35: 7292675.4699999997 | F35: 7618618.4000000004 | G35: 6528879.3300000001 | H35: 8083660.9100000001 | J35: =IF(B35=0,0,((C35/B35)*100)-100) -> 0.91956737430167834 | K35: =IF(C35=0,0,IF(D35=0,0,((C35/D35)*100)-100)) -> 23.854425130479569 | L35: =IF(F35=0,0,((C35/F35)*100)-100) -> 18.555633131592458 | M35: =IF(G35=0,0,((C35/G35)*100)-100) -> 38.343823242326636 | N35: =IF(C35=0,0,IF(H35=0,0,((C35/H35)*100)-100)) -> 11.735281582957938 | P35: 8950000 | Q35: =IF(C35=0,0,IF(P35=0,0,((C35/P35)*100)-100)) -> 0.91956737430167834 | R35: =IF(C35=0,0,(C35/$C$42)*100) -> 4.2653497652289847 | T35: 15.85 | U35: 15.950640211594006 | V35: =U35-T35 -> 0.1006402115940066
A36: Total Hiper | B36: =SUM(B23:B35) -> 123000000 | C36: =SUM(C23:C35) -> 124724587.88999999 | D36: =SUM(D23:D35) -> 99488364.469999999 | F36: =SUM(F23:F35) -> 108254516.91000001 | G36: =SUM(G23:G35) -> 95359064.049999982 | H36: =SUM(H23:H35) -> 76558972.659999996 | I36: =SUM(B36:H36) -> 627385505.98000002 | J36: =IF(C36=0,0,((C36/B36)*100)-100) -> 1.4021039756097338 | K36: =IF(C36=0,0,IF(D36=0,0,((C36/D36)*100)-100)) -> 25.36600491367993 | L36: =IF(F36=0,0,IF(C36=0,0,((C36/F36)*100)-100)) -> 15.214211332810024 | M36: =IF(G36=0,0,IF(C36=0,0,((C36/G36)*100)-100)) -> 30.794685468601784 | N36: =IF(C36=0,0,IF(H36=0,0,((C36/H36)*100)-100)) -> 62.913089813658416 | P36: =SUM(P23:P35) -> 123000000 | Q36: =IF(C36=0,0,((C36/P36)*100)-100) -> 1.4021039756097338 | R36: =IF(C36=0,0,(C36/$C$42)*100) -> 58.899052985851398 | T36: 15.682487804878049 | U36: 15.855611037208774 | V36: =U36-T36 -> 0.17312323233072568
A37: Total s/ 29,37,38 | B37: =B22+B36 -> 183550000 | C37: =C22+C36 -> 186696003.78999999 | D37: =D22+D36 -> 149696425.31999999 | E37: =E22+E36 -> 0 | F37: =F22+F36 -> 162396808.83000001 | G37: =G22+G36 -> 133729305.41999999 | H37: =H22+H36 -> 110483400.46000001 | I37: =SUM(B37:H37) -> 926551943.81999993 | J37: =IF(C37=0,0,((C37/B37)*100)-100) -> 1.713976458730599 | K37: =IF(C37=0,0,IF(D37=0,0,((C37/D37)*100)-100)) -> 24.716407483283248 | L37: =IF(F37=0,0,IF(C37=0,0,((C37/F37)*100)-100)) -> 14.962852493879254 | M37: =IF(G37=0,0,IF(C37=0,0,((C37/G37)*100)-100)) -> 39.607398096960821 | N37: =IF(C37=0,0,IF(H37=0,0,((C37/H37)*100)-100)) -> 68.981044222649899 | P37: =P22+P36 -> 183550000 | Q37: =IF(C37=0,0,((C37/P37)*100)-100) -> 1.713976458730599 | R37: =IF(C37=0,0,(C37/$C$42)*100) -> 88.163994008719143 | T37: 15.782462544265869 | U37: 15.763779642173773 | V37: =U37-T37 -> -1.8682902092095333E-2
A38: S.J.P - Av. Joinvile | B38: 6449999.5099999998 | C38: 5945071.5099999998 | D38: 0 | F38: 0 | G38: 0 | H38: 0 | J38: =IF(B38=0,0,((C38/B38)*100)-100) -> -7.8283416799825432 | K38: =IF(C38=0,0,IF(D38=0,0,((C38/D38)*100)-100)) -> 0 | L38: =IF(F38=0,0,((C38/F38)*100)-100) -> 0 | M38: =IF(G38=0,0,((C38/G38)*100)-100) -> 0 | N38: =IF(C38=0,0,IF(H38=0,0,((C38/H38)*100)-100)) -> 0 | P38: 6450000 | Q38: =IF(P38=0,0,IF(C38=0,0,((C38/P38)*100)-100)) -> -7.8283486821705424 | R38: =IF(C38=0,0,(C38/$C$42)*100) -> 2.8074583191325999 | T38: 15 | U38: 14.922557809569561 | V38: =U38-T38 -> -7.7442190430438984E-2
A39: Castro | B39: 5900000 | C39: 4827630.39 | D39: 4284796.49 | F39: 0 | G39: 0 | H39: 0 | J39: =IF(B39=0,0,((C39/B39)*100)-100) -> -18.175756101694915 | K39: =IF(C39=0,0,IF(D39=0,0,((C39/D39)*100)-100)) -> 12.668837394421956 | L39: =IF(F39=0,0,((C39/F39)*100)-100) -> 0 | M39: =IF(G39=0,0,((C39/G39)*100)-100) -> 0 | N39: =IF(C39=0,0,IF(H39=0,0,((C39/H39)*100)-100)) -> 0 | P39: 5900000 | Q39: =IF(P39=0,0,IF(C39=0,0,((C39/P39)*100)-100)) -> -18.175756101694915 | R39: =IF(C39=0,0,(C39/$C$42)*100) -> 2.2797658661136704 | T39: 16.36 | U39: 15.648835949928635 | V39: =U39-T39 -> -0.71116405007136407
A40: Água Verde | B40: 8200000 | C40: 8581150.5 | D40: 7305907.79 | F40: 5427705.3300000001 | G40: 0 | H40: 0 | J40: =IF(B40=0,0,((C40/B40)*100)-100) -> 4.6481768292683086 | K40: =IF(C40=0,0,IF(D40=0,0,((C40/D40)*100)-100)) -> 17.454952165499478 | L40: =IF(F40=0,0,((C40/F40)*100)-100) -> 58.099048829535462 | M40: =IF(G40=0,0,((C40/G40)*100)-100) -> 0 | N40: =IF(C40=0,0,IF(H40=0,0,((C40/H40)*100)-100)) -> 0 | P40: 8200000 | Q40: =IF(P40=0,0,IF(C40=0,0,((C40/P40)*100)-100)) -> 4.6481768292683086 | R40: =IF(C40=0,0,(C40/$C$42)*100) -> 4.0523015271440972 | T40: 16.15 | U40: 15.828542571302066 | V40: =U40-T40 -> -0.32145742869793281
A41: Colombo | B41: 5900000 | C41: 5710064.5 | D41: 4152118.02 | F41: 0 | G41: 0 | H41: 0 | J41: =IF(B41=0,0,((C41/B41)*100)-100) -> -3.2192457627118642 | K41: =IF(C41=0,0,IF(D41=0,0,((C41/D41)*100)-100)) -> 37.521729211348372 | L41: =IF(F41=0,0,((C41/F41)*100)-100) -> 0 | M41: =IF(G41=0,0,((C41/G41)*100)-100) -> 0 | N41: =IF(C41=0,0,IF(H41=0,0,((C41/H41)*100)-100)) -> 0 | P41: 5900000 | Q41: =IF(P41=0,0,IF(C41=0,0,((C41/P41)*100)-100)) -> -3.2192457627118642 | R41: =IF(C41=0,0,(C41/$C$42)*100) -> 2.6964802788904936 | T41: 14 | U41: 14.013403351223092 | V41: =U41-T41 -> 1.3403351223091775E-2
A42: Total Geral | B42: =B22+B36+SUM(B38:B41) -> 209999999.50999999 | C42: =C22+C36+SUM(C38:C41) -> 211759920.69 | D42: =D22+D36+SUM(D38:D41) -> 165439247.62 | F42: =F22+F36+SUM(F38:F41) -> 167824514.16000003 | G42: =G22+G36+SUM(G38:G41) -> 133729305.41999999 | H42: =H22+H36+SUM(H38:H41) -> 110483400.46000001 | J42: =IF(C42=0,0,((C42/B42)*100)-100) -> 0.83805770671736468 | K42: =IF(C42=0,0,IF(D42=0,0,((C42/D42)*100)-100)) -> 27.998599931011952 | L42: =IF(F42=0,0,IF(C42=0,0,((C42/F42)*100)-100)) -> 26.179373585501907 | M42: =IF(G42=0,0,IF(C42=0,0,((C42/G42)*100)-100)) -> 58.349675132859915 | N42: =IF(C42=0,0,IF(H42=0,0,((C42/H42)*100)-100)) -> 91.666729851120635 | P42: =P22+P36+SUM(P38:P41) -> 210000000 | Q42: =IF(C42=0,0,((C42/P42)*100)-100) -> 0.83805747142858422 | R42: =R22+R36+SUM(R38:R41) -> 100 | T42: 15.73 | U42: 15.692968080465139 | V42: =U42-T42 -> -3.7031919534861402E-2
A44: Água Verde | B44: 0 | C44: 0 | D44: 0 | F44: 0 | G44: 0 | H44: 0 | J44: =IF(B44=0,0,((C44/B44)*100)-100) -> 0 | K44: =IF(C44=0,0,IF(D44=0,0,((C44/D44)*100)-100)) -> 0 | L44: =IF(F44=0,0,((C44/F44)*100)-100) -> 0 | M44: =IF(G44=0,0,((C44/G44)*100)-100) -> 0 | N44: =IF(C44=0,0,IF(H44=0,0,((C44/H44)*100)-100)) -> 0 | P44: =B44 -> 0 | Q44: =IF(C44=0,0,IF(P44=0,0,((C44/P44)*100)-100)) -> 0 | R44: =IF(C44=0,0,(C44/$C$42)*100) -> 0 | T44: 14.95 | U44: 0 | V44: =U44-T44 -> -14.95
A45: Total Geral | B45: =B42+B44 -> 209999999.50999999 | C45: =C42+C44 -> 211759920.69 | D45: =D42+D44 -> 165439247.62 | F45: =F42+F44 -> 167824514.16000003 | G45: =G42+G44 -> 133729305.41999999 | H45: =H42+H44 -> 110483400.46000001 | J45: =IF(C45=0,0,((C45/B45)*100)-100) -> 0.83805770671736468 | K45: =IF(C45=0,0,IF(D45=0,0,((C45/D45)*100)-100)) -> 27.998599931011952 | L45: =IF(F45=0,0,IF(C45=0,0,((C45/F45)*100)-100)) -> 26.179373585501907 | M45: =IF(G45=0,0,IF(C45=0,0,((C45/G45)*100)-100)) -> 58.349675132859915 | N45: =IF(C45=0,0,IF(H45=0,0,((C45/H45)*100)-100)) -> 91.666729851120635 | P45: =P42+P44 -> 210000000 | Q45: =IF(C45=0,0,((C45/P45)*100)-100) -> 0.83805747142858422 | R45: =R25+R39+R44 -> 5.8664336336742142 | T45: 15.738928573152739 | U45: 15.692968080465139 | V45: =U45-T45 -> -4.5960492687600052E-2