A2: Periodo: | C2: 38687 | D2: a | E2: 38717 | H2: Vendas Acumuladas por Filial | Q2: =NOW() -> 38726.602474305597
A4: v.1 | C4: Vendas 2005 | G4: Vendas de Anos Anteriores | K4: Percentuais ( % ) | Q4: Meta Mensal | U4: Margem
A5: Lojas | C5: Previsao | D5: Realizada | E5: Mes Anterior | G5: Vendas 2004 | H5: Vendas 2003 | I5: Vendas 2002 | K5: % Prev | L5: % MA | M5: 2004 | N5: 2003 | O5: 2002 | Q5: Previsao Mes | R5: Final | S5: Part. | U5: Meta | V5: Real
A7: Xaxim | C7: 1080000 | D7: 981107 | E7: 697819 | G7: 1001769 | H7: 911440 | I7: 715471 | K7: =IF(C7=0,0,((D7/C7)*100)-100) -> -9.16 | L7: =IF(D7=0,0,IF(E7=0,0,((D7/E7)*100)-100)) -> 40.6 | M7: =IF(G7=0,0,((D7/G7)*100)-100) -> -2.06 | N7: =IF(H7=0,0,((D7/H7)*100)-100) -> 7.64 | O7: =IF(D7=0,0,IF(I7=0,0,((D7/I7)*100)-100)) -> 37.13 | Q7: 1080000 | R7: =IF(D7=0,0,((D7/Q7)*100)-100) -> -9.16 | S7: =IF(D7=0,0,(D7/$D$35)*100) -> 1.27 | U7: 16.9 | V7: 15.08
A8: S. Felicidade | C8: 1080000 | D8: 995390 | E8: 713436 | G8: 945394 | H8: 904437 | I8: 840170 | K8: =IF(C8=0,0,((D8/C8)*100)-100) -> -7.83 | L8: =IF(D8=0,0,IF(E8=0,0,((D8/E8)*100)-100)) -> 39.52 | M8: =IF(G8=0,0,((D8/G8)*100)-100) -> 5.29 | N8: =IF(H8=0,0,((D8/H8)*100)-100) -> 10.06 | O8: =IF(D8=0,0,IF(I8=0,0,((D8/I8)*100)-100)) -> 18.47 | Q8: 1080000 | R8: =IF(D8=0,0,((D8/Q8)*100)-100) -> -7.83 | S8: =IF(D8=0,0,(D8/$D$35)*100) -> 1.29 | U8: 16.75 | V8: 14.67
A9: Lapa | C9: 1600000 | D9: 1603316 | E9: 1145940 | G9: 1477567 | H9: 1325987 | I9: 1175125 | K9: =IF(C9=0,0,((D9/C9)*100)-100) -> 0.21 | L9: =IF(D9=0,0,IF(E9=0,0,((D9/E9)*100)-100)) -> 39.91 | M9: =IF(G9=0,0,((D9/G9)*100)-100) -> 8.51 | N9: =IF(H9=0,0,((D9/H9)*100)-100) -> 20.91 | O9: =IF(D9=0,0,IF(I9=0,0,((D9/I9)*100)-100)) -> 36.44 | Q9: 1600000 | R9: =IF(D9=0,0,((D9/Q9)*100)-100) -> 0.21 | S9: =IF(D9=0,0,(D9/$D$35)*100) -> 2.08 | U9: 16.9 | V9: 14.76
A10: Araucaria | C10: 1300000 | D10: 1188414 | E10: 905743 | G10: 1217436 | H10: 1149818 | I10: 1273977 | K10: =IF(C10=0,0,((D10/C10)*100)-100) -> -8.58 | L10: =IF(D10=0,0,IF(E10=0,0,((D10/E10)*100)-100)) -> 31.21 | M10: =IF(G10=0,0,((D10/G10)*100)-100) -> -2.38 | N10: =IF(H10=0,0,((D10/H10)*100)-100) -> 3.36 | O10: =IF(D10=0,0,IF(I10=0,0,((D10/I10)*100)-100)) -> -6.72 | Q10: 1300000 | R10: =IF(D10=0,0,((D10/Q10)*100)-100) -> -8.58 | S10: =IF(D10=0,0,(D10/$D$35)*100) -> 1.54 | U10: 17.48 | V10: 16.15
A11: Pinheirinho | C11: 2980000 | D11: 2697444 | E11: 1815919 | G11: 2811997 | H11: 2492674 | I11: 2222678 | K11: =IF(C11=0,0,((D11/C11)*100)-100) -> -9.48 | L11: =IF(D11=0,0,IF(E11=0,0,((D11/E11)*100)-100)) -> 48.54 | M11: =IF(G11=0,0,((D11/G11)*100)-100) -> -4.07 | N11: =IF(H11=0,0,((D11/H11)*100)-100) -> 8.21 | O11: =IF(D11=0,0,IF(I11=0,0,((D11/I11)*100)-100)) -> 21.36 | Q11: 2980000 | R11: =IF(D11=0,0,((D11/Q11)*100)-100) -> -9.48 | S11: =IF(D11=0,0,(D11/$D$35)*100) -> 3.49 | U11: 17.45 | V11: 14.75
A12: Hauer | C12: 4540000 | D12: 4067771 | E12: 2936690 | G12: 4305640 | H12: 3612408 | I12: 3293203 | K12: =IF(C12=0,0,((D12/C12)*100)-100) -> -10.4 | L12: =IF(D12=0,0,IF(E12=0,0,((D12/E12)*100)-100)) -> 38.52 | M12: =IF(G12=0,0,((D12/G12)*100)-100) -> -5.52 | N12: =IF(H12=0,0,((D12/H12)*100)-100) -> 12.61 | O12: =IF(D12=0,0,IF(I12=0,0,((D12/I12)*100)-100)) -> 23.52 | Q12: 4540000 | R12: =IF(D12=0,0,((D12/Q12)*100)-100) -> -10.4 | S12: =IF(D12=0,0,(D12/$D$35)*100) -> 5.27 | U12: 16.26 | V12: 15.73
A13: Paranagua | C13: 2100000 | D13: 2137266 | E13: 1477946 | G13: 4734317 | H13: 4019754 | I13: 3619739 | K13: =IF(C13=0,0,((D13/C13)*100)-100) -> 1.77 | L13: =IF(D13=0,0,IF(E13=0,0,((D13/E13)*100)-100)) -> 44.61 | M13: =IF(G13=0,0,((D13/G13)*100)-100) -> -54.86 | N13: =IF(H13=0,0,((D13/H13)*100)-100) -> -46.83 | O13: =IF(D13=0,0,IF(I13=0,0,((D13/I13)*100)-100)) -> -40.96 | Q13: 2100000 | R13: =IF(D13=0,0,((D13/Q13)*100)-100) -> 1.77 | S13: =IF(D13=0,0,(D13/$D$35)*100) -> 2.77 | U13: 17.59 | V13: 15.56
A14: Centenario | C14: 1300000 | D14: 1212315 | E14: 914666 | G14: 1177519 | H14: 1083253 | I14: 961206 | K14: =IF(C14=0,0,((D14/C14)*100)-100) -> -6.75 | L14: =IF(D14=0,0,IF(E14=0,0,((D14/E14)*100)-100)) -> 32.54 | M14: =IF(G14=0,0,((D14/G14)*100)-100) -> 2.96 | N14: =IF(H14=0,0,((D14/H14)*100)-100) -> 11.91 | O14: =IF(D14=0,0,IF(I14=0,0,((D14/I14)*100)-100)) -> 26.12 | Q14: 1300000 | R14: =IF(D14=0,0,((D14/Q14)*100)-100) -> -6.75 | S14: =IF(D14=0,0,(D14/$D$35)*100) -> 1.57 | U14: 17.1 | V14: 14.21
A15: Arapongas | C15: 0 | D15: 0 | E15: 0 | G15: 0 | H15: 0 | I15: 0 | K15: =IF(C15=0,0,((D15/C15)*100)-100) -> 0 | L15: =IF(D15=0,0,IF(E15=0,0,((D15/E15)*100)-100)) -> 0 | M15: =IF(D15=0,0,IF(G15=0,0,((D15/G15)*100)-100)) -> 0 | N15: =IF(D15=0,0,IF(H15=0,0,((D15/H15)*100)-100)) -> 0 | O15: =IF(D15=0,0,IF(I15=0,0,((D15/I15)*100)-100)) -> 0 | Q15: 0 | R15: =IF(D15=0,0,((D15/Q15)*100)-100) -> 0 | S15: =IF(D15=0,0,(D15/$D$35)*100) -> 0 | U15: 0 | V15: 0
A16: Sao Braz | C16: 4400000 | D16: 3979406 | E16: 2933655 | G16: 4128995 | H16: 3851197 | I16: 3421457 | K16: =IF(C16=0,0,((D16/C16)*100)-100) -> -9.56 | L16: =IF(D16=0,0,IF(E16=0,0,((D16/E16)*100)-100)) -> 35.65 | M16: =IF(G16=0,0,((D16/G16)*100)-100) -> -3.62 | N16: =IF(H16=0,0,((D16/H16)*100)-100) -> 3.33 | O16: =IF(D16=0,0,IF(I16=0,0,((D16/I16)*100)-100)) -> 16.31 | Q16: 4400000 | R16: =IF(D16=0,0,((D16/Q16)*100)-100) -> -9.56 | S16: =IF(D16=0,0,(D16/$D$35)*100) -> 5.15 | U16: 16.15 | V16: 15.49
A17: Sitio Cercado | C17: 1940000 | D17: 1801665 | E17: 1306201 | G17: 2396301 | H17: 1789837 | I17: 1425756 | K17: =IF(C17=0,0,((D17/C17)*100)-100) -> -7.13 | L17: =IF(D17=0,0,IF(E17=0,0,((D17/E17)*100)-100)) -> 37.93 | M17: =IF(G17=0,0,((D17/G17)*100)-100) -> -24.81 | N17: =IF(H17=0,0,((D17/H17)*100)-100) -> 0.66 | O17: =IF(D17=0,0,IF(I17=0,0,((D17/I17)*100)-100)) -> 26.37 | Q17: 1940000 | R17: =IF(D17=0,0,((D17/Q17)*100)-100) -> -7.13 | S17: =IF(D17=0,0,(D17/$D$35)*100) -> 2.33 | U17: 16 | V17: 15.09
A18: Apucarana | C18: 2600000 | D18: 2534044 | E18: 1793560 | G18: 2332125 | H18: 1987508 | I18: 1772894 | K18: =IF(C18=0,0,((D18/C18)*100)-100) -> -2.54 | L18: =IF(D18=0,0,IF(E18=0,0,((D18/E18)*100)-100)) -> 41.29 | M18: =IF(G18=0,0,((D18/G18)*100)-100) -> 8.66 | N18: =IF(H18=0,0,((D18/H18)*100)-100) -> 27.5 | O18: =IF(D18=0,0,IF(I18=0,0,((D18/I18)*100)-100)) -> 42.93 | Q18: 2600000 | R18: =IF(D18=0,0,((D18/Q18)*100)-100) -> -2.54 | S18: =IF(D18=0,0,(D18/$D$35)*100) -> 3.28 | U18: 17.45 | V18: 12.64
A19: Ahu | C19: 1540000 | D19: 1476110 | E19: 1149965 | G19: 1363099 | H19: 1388111 | I19: 1333595 | K19: =IF(C19=0,0,((D19/C19)*100)-100) -> -4.15 | L19: =IF(D19=0,0,IF(E19=0,0,((D19/E19)*100)-100)) -> 28.36 | M19: =IF(G19=0,0,((D19/G19)*100)-100) -> 8.29 | N19: =IF(H19=0,0,((D19/H19)*100)-100) -> 6.34 | O19: =IF(D19=0,0,IF(I19=0,0,((D19/I19)*100)-100)) -> 10.69 | Q19: 1540000 | R19: =IF(D19=0,0,((D19/Q19)*100)-100) -> -4.15 | S19: =IF(D19=0,0,(D19/$D$35)*100) -> 1.91 | U19: 17.91 | V19: 14.94
A20: P.G. Centro | C20: 2480000 | D20: 2042921 | E20: 1521294 | G20: 2205951 | H20: 1998807 | I20: 1866162 | K20: =IF(C20=0,0,((D20/C20)*100)-100) -> -17.62 | L20: =IF(D20=0,0,IF(E20=0,0,((D20/E20)*100)-100)) -> 34.29 | M20: =IF(G20=0,0,((D20/G20)*100)-100) -> -7.39 | N20: =IF(H20=0,0,((D20/H20)*100)-100) -> 2.21 | O20: =IF(D20=0,0,IF(I20=0,0,((D20/I20)*100)-100)) -> 9.47 | Q20: 2480000 | R20: =IF(D20=0,0,((D20/Q20)*100)-100) -> -17.62 | S20: =IF(D20=0,0,(D20/$D$35)*100) -> 2.65 | U20: 18 | V20: 16.31
A21: Maringa | C21: 3100000 | D21: 2937386 | E21: 2195786 | G21: 2753746 | H21: 2235655 | I21: 2144145 | K21: =IF(C21=0,0,((D21/C21)*100)-100) -> -5.25 | L21: =IF(D21=0,0,IF(E21=0,0,((D21/E21)*100)-100)) -> 33.77 | M21: =IF(G21=0,0,((D21/G21)*100)-100) -> 6.67 | N21: =IF(H21=0,0,((D21/H21)*100)-100) -> 31.39 | O21: =IF(D21=0,0,IF(I21=0,0,((D21/I21)*100)-100)) -> 37 | Q21: 3100000 | R21: =IF(D21=0,0,((D21/Q21)*100)-100) -> -5.25 | S21: =IF(D21=0,0,(D21/$D$35)*100) -> 3.8 | U21: 17.21 | V21: 15
A22: Araucaria Nova | C22: 2940000 | D22: 2709318 | E22: 1919627 | G22: 2798594 | H22: 2558861 | I22: 2213292 | K22: =IF(C22=0,0,((D22/C22)*100)-100) -> -7.85 | L22: =IF(D22=0,0,IF(E22=0,0,((D22/E22)*100)-100)) -> 41.14 | M22: =IF(G22=0,0,((D22/G22)*100)-100) -> -3.19 | N22: =IF(H22=0,0,((D22/H22)*100)-100) -> 5.88 | O22: =IF(D22=0,0,IF(I22=0,0,((D22/I22)*100)-100)) -> 22.41 | Q22: 2940000 | R22: =IF(D22=0,0,((D22/Q22)*100)-100) -> -7.85 | S22: =IF(D22=0,0,(D22/$D$35)*100) -> 3.51 | U22: 17.5 | V22: 16.35
A23: Sitio Cercado | C23: 0 | D23: 0 | E23: 0 | G23: 0 | H23: 0 | I23: 0 | K23: =IF(C23=0,0,((D23/C23)*100)-100) -> 0 | L23: =IF(D23=0,0,IF(E23=0,0,((D23/E23)*100)-100)) -> 0 | M23: =IF(G23=0,0,((D23/G23)*100)-100) -> 0 | N23: =IF(H23=0,0,((D23/H23)*100)-100) -> 0 | O23: =IF(D23=0,0,IF(I23=0,0,((D23/I23)*100)-100)) -> 0 | Q23: 0 | R23: =IF(Q23=0,0,IF(D23=0,0,((D23/Q23)*100)-100)) -> 0 | S23: =IF(D23=0,0,(D23/$D$35)*100) -> 0 | U23: 0 | V23: 0
A24: Total Super | C24: =SUM(C7:C23) -> 34980000 | D24: =SUM(D7:D23) -> 32363873 | E24: =SUM(E7:E23) -> 23428247 | G24: =SUM(G7:G23) -> 35650450 | H24: =SUM(H7:H23) -> 31309747 | I24: =SUM(I7:I23) -> 28278870 | J24: =SUM(C24:I24) -> 186011187 | K24: =IF(D24=0,0,((D24/C24)*100)-100) -> -7.48 | L24: =IF(D24=0,0,IF(E24=0,0,((D24/E24)*100)-100)) -> 38.14 | M24: =IF(G24=0,0,IF(D24=0,0,((D24/G24)*100)-100)) -> -9.22 | N24: =IF(H24=0,0,IF(D24=0,0,((D24/H24)*100)-100)) -> 3.37 | O24: =IF(D24=0,0,IF(I24=0,0,((D24/I24)*100)-100)) -> 14.45 | Q24: =SUM(Q7:Q23) -> 34980000 | R24: =IF(D24=0,0,((D24/Q24)*100)-100) -> -7.48 | S24: =IF(D24=0,0,(D24/$D$35)*100) -> 41.91 | U24: 17.03 | V24: 15.18
A26: Londrina | C26: 4200000 | D26: 3736165 | E26: 2668430 | G26: 3484194 | H26: 2768913 | I26: 2811074 | K26: =IF(C26=0,0,((D26/C26)*100)-100) -> -11.04 | L26: =IF(D26=0,0,IF(E26=0,0,((D26/E26)*100)-100)) -> 40.01 | M26: =IF(G26=0,0,((D26/G26)*100)-100) -> 7.23 | N26: =IF(H26=0,0,((D26/H26)*100)-100) -> 34.93 | O26: =IF(D26=0,0,IF(I26=0,0,((D26/I26)*100)-100)) -> 32.91 | Q26: 4200000 | R26: =IF(D26=0,0,IF(Q26=0,0,((D26/Q26)*100)-100)) -> -11.04 | S26: =IF(D26=0,0,(D26/$D$35)*100) -> 4.84 | U26: 17 | V26: 13.53
A27: S.J. Pinhais | C27: 6240000 | D27: 5568251 | E27: 3980852 | G27: 5973276 | H27: 5157448 | I27: 4671974 | K27: =IF(C27=0,0,((D27/C27)*100)-100) -> -10.77 | L27: =IF(D27=0,0,IF(E27=0,0,((D27/E27)*100)-100)) -> 39.88 | M27: =IF(G27=0,0,((D27/G27)*100)-100) -> -6.78 | N27: =IF(H27=0,0,((D27/H27)*100)-100) -> 7.97 | O27: =IF(D27=0,0,IF(I27=0,0,((D27/I27)*100)-100)) -> 19.18 | Q27: 6240000 | R27: =IF(D27=0,0,IF(Q27=0,0,((D27/Q27)*100)-100)) -> -10.77 | S27: =IF(D27=0,0,(D27/$D$35)*100) -> 7.21 | U27: 16.6 | V27: 14.51
A28: P.G. Nova | C28: 5300000 | D28: 5062487 | E28: 3457516 | G28: 4889066 | H28: 3784885 | I28: 3882893 | K28: =IF(C28=0,0,((D28/C28)*100)-100) -> -4.48 | L28: =IF(D28=0,0,IF(E28=0,0,((D28/E28)*100)-100)) -> 46.42 | M28: =IF(G28=0,0,((D28/G28)*100)-100) -> 3.55 | N28: =IF(H28=0,0,((D28/H28)*100)-100) -> 33.76 | O28: =IF(D28=0,0,IF(I28=0,0,((D28/I28)*100)-100)) -> 30.38 | Q28: 5300000 | R28: =IF(D28=0,0,IF(Q28=0,0,((D28/Q28)*100)-100)) -> -4.48 | S28: =IF(D28=0,0,(D28/$D$35)*100) -> 6.56 | U28: 16.85 | V28: 14.57
A29: Nilo Pecanha | C29: 12700000 | D29: 11637386 | E29: 8525811 | G29: 10610322 | H29: 10207124 | I29: 8652525 | K29: =IF(C29=0,0,((D29/C29)*100)-100) -> -8.37 | L29: =IF(D29=0,0,IF(E29=0,0,((D29/E29)*100)-100)) -> 36.5 | M29: =IF(G29=0,0,((D29/G29)*100)-100) -> 9.68 | N29: =IF(H29=0,0,((D29/H29)*100)-100) -> 14.01 | O29: =IF(D29=0,0,IF(I29=0,0,((D29/I29)*100)-100)) -> 34.5 | Q29: 12700000 | R29: =IF(D29=0,0,IF(Q29=0,0,((D29/Q29)*100)-100)) -> -8.37 | S29: =IF(D29=0,0,(D29/$D$35)*100) -> 15.07 | U29: 15 | V29: 14.85
A30: Champagnat | C30: 8400000 | D30: 6686545 | E30: 5369429 | G30: 6737674 | H30: 0 | I30: 0 | K30: =IF(C30=0,0,((D30/C30)*100)-100) -> -20.4 | L30: =IF(D30=0,0,IF(E30=0,0,((D30/E30)*100)-100)) -> 24.53 | M30: =IF(G30=0,0,((D30/G30)*100)-100) -> -0.76 | N30: =IF(H30=0,0,((D30/H30)*100)-100) -> 0 | O30: =IF(D30=0,0,IF(I30=0,0,((D30/I30)*100)-100)) -> 0 | Q30: 8400000 | R30: =IF(D30=0,0,IF(Q30=0,0,((D30/Q30)*100)-100)) -> -20.4 | S30: =IF(D30=0,0,(D30/$D$35)*100) -> 8.66 | U30: 15.75 | V30: 15.39
A31: Santa Candida | C31: 7800000 | D31: 5840046 | E31: 4153152 | G31: 6955104 | H31: 0 | I31: 0 | K31: =IF(C31=0,0,((D31/C31)*100)-100) -> -25.13 | L31: =IF(D31=0,0,IF(E31=0,0,((D31/E31)*100)-100)) -> 40.62 | M31: =IF(G31=0,0,((D31/G31)*100)-100) -> -16.03 | N31: =IF(H31=0,0,((D31/H31)*100)-100) -> 0 | O31: =IF(D31=0,0,IF(I31=0,0,((D31/I31)*100)-100)) -> 0 | Q31: 7800000 | R31: =IF(D31=0,0,IF(Q31=0,0,((D31/Q31)*100)-100)) -> -25.13 | S31: =IF(D31=0,0,(D31/$D$35)*100) -> 7.56 | U31: 15.46 | V31: 14.5
A32: Paranagu Raia | C32: 6500000 | D32: 6330492 | E32: 4257889 | G32: 0 | H32: 0 | I32: 0 | K32: =IF(C32=0,0,((D32/C32)*100)-100) -> -2.61 | L32: =IF(D32=0,0,IF(E32=0,0,((D32/E32)*100)-100)) -> 48.68 | M32: =IF(G32=0,0,((D32/G32)*100)-100) -> 0 | N32: =IF(H32=0,0,((D32/H32)*100)-100) -> 0 | O32: =IF(D32=0,0,IF(I32=0,0,((D32/I32)*100)-100)) -> 0 | Q32: 6500000 | R32: =IF(D32=0,0,IF(Q32=0,0,((D32/Q32)*100)-100)) -> -2.61 | S32: =IF(D32=0,0,(D32/$D$35)*100) -> 8.2 | U32: 15.5 | V32: 15.73
A33: Total Hiper | C33: =SUM(C26:C32) -> 51140000 | D33: =SUM(D26:D32) -> 44861372 | E33: =SUM(E26:E32) -> 32413079 | G33: =SUM(G26:G32) -> 38649636 | H33: =SUM(H26:H32) -> 21918370 | I33: =SUM(I26:I32) -> 20018466 | J33: =SUM(C33:I33) -> 209000923 | K33: =IF(D33=0,0,((D33/C33)*100)-100) -> -12.28 | L33: =IF(D33=0,0,IF(E33=0,0,((D33/E33)*100)-100)) -> 38.41 | M33: =IF(G33=0,0,IF(D33=0,0,((D33/G33)*100)-100)) -> 16.07 | N33: =IF(H33=0,0,IF(D33=0,0,((D33/H33)*100)-100)) -> 104.67 | O33: =IF(D33=0,0,IF(I33=0,0,((D33/I33)*100)-100)) -> 124.1 | Q33: =SUM(Q26:Q32) -> 51140000 | R33: =IF(D33=0,0,((D33/Q33)*100)-100) -> -12.28 | S33: =IF(D33=0,0,(D33/$D$35)*100) -> 58.09 | U33: 15.81 | V33: 14.82
A35: Total Geral | C35: =C24+C33 -> 86120000 | D35: =D24+D33 -> 77225245 | E35: =E24+E33 -> 55841326 | G35: =G24+G33 -> 74300086 | H35: =H24+H33 -> 53228117 | I35: =I24+I33 -> 48297336 | K35: =IF(D33=0,0,((D35/C35)*100)-100) -> -10.33 | L35: =IF(D35=0,0,IF(E35=0,0,((D35/E35)*100)-100)) -> 38.29 | M35: =IF(G35=0,0,IF(D35=0,0,((D35/G35)*100)-100)) -> 3.94 | N35: =IF(H35=0,0,IF(D35=0,0,((D35/H35)*100)-100)) -> 45.08 | O35: =IF(D35=0,0,IF(I35=0,0,((D35/I35)*100)-100)) -> 59.9 | Q35: =Q24+Q33 -> 86120000 | R35: =IF(D35=0,0,((D35/Q35)*100)-100) -> -10.33 | S35: =S24+S33 -> 100 | U35: 16.3 | V35: 14.97
C36: Resumo por Regiao - Outubro/2002
C37: Descricao das Aberturas | H37: Valor | I37: %
C38: Curitiba (2,3,6,7,10,11,17,21,22) | H38: =D7+D8+D11+D12+D14+D16+D19+D29+D30+D32 -> 40063966 | I38: =IF(D35=0,0,H38/$D$35) -> 0.51880000000000004
C39: Curitiba e Metrop. (Ctba. 4,5,8,14,23) | H39: =H38+D9+D10+D13+D28+D23 -> 50055449 | I39: =IF(D35=0,0,H39/$D$35) -> 0.6482
C40: Metropolitana (4,5,8,14,23) | H40: =H39-H38 -> 9991483 | I40: =IF(D35=0,0,H40/$D$35) -> 0.12939999999999999
C41: Norte (9,15,20) | H41: =D26+D18+D23 -> 6270209 | I41: =IF(D35=0,0,H41/$D$35) -> 8.1199999999999994E-2
C42: Centro-Oeste (13,18,19) | H42: =D17+D20+D28 -> 8907073 | I42: =IF(D35=0,0,H42/$D$35) -> 0.1153
C43: Ponta Grossa (18,19) | H43: =H42-D17 -> 7105408 | I43: =IF(D35=0,0,H43/$D$35) -> 9.1999999999999998E-2
C44: Super (2,3,4,5,6,7,8,10,11,13,15,17,18,20,23) | H44: =D24 -> 32363873 | I44: =IF(D35=0,0,H44/$D$35) -> 0.41909999999999997
C45: Hiper (9,14,19,21,22,24) | H45: =D33 -> 44861372 | I45: =IF(D35=0,0,H45/$D$35) -> 0.58089999999999997
C46: Curitiba, Metropolitana e Centro-Oeste | H46: =D35-H41 -> 70955036 | I46: =IF(D35=0,0,H46/$D$35) -> 0.91879999999999995
C47: Araucaria | H47: =D10+D23 -> 1188414 | I47: =IF(D35=0,0,H47/$D$35) -> 1.54E-2