A2: Periodo: | C2: 39783 | D2: a | E2: 31/12/2008 | H2: Vendas Acumuladas por Filial | Q2: =NOW() -> 39814.327160648201
A4: v.1 | C4: Vendas 2008 | G4: Vendas de Anos Anteriores | K4: Percentuais ( % ) | Q4: Meta Mensal | U4: Margem
A5: Lojas | C5: Previsao | D5: Realizada | E5: Mes Anterior | G5: Vendas 2007 | H5: Vendas 2006 | I5: Vendas 2005 | K5: % Prev | L5: % MA | M5: 2007 | N5: 2006 | O5: 2005 | Q5: Previsao Mes | R5: Final | S5: Part. | U5: Meta | V5: Coml | W5: Dif
A7: S. Felicidade | C7: 2800000 | D7: 2918228 | E7: 2455552 | G7: 2607526 | H7: 942108 | I7: 995390 | K7: =IF(C7=0,0,((D7/C7)*100)-100) -> 4.22 | L7: =IF(D7=0,0,IF(E7=0,0,((D7/E7)*100)-100)) -> 18.84 | M7: =IF(G7=0,0,((D7/G7)*100)-100) -> 11.92 | N7: =IF(H7=0,0,((D7/H7)*100)-100) -> 209.76 | O7: =IF(D7=0,0,IF(I7=0,0,((D7/I7)*100)-100)) -> 193.17 | Q7: 0 | R7: =IF(D7=0,0,((D7/Q7)*100)-100) -> ###### | S7: =IF(D7=0,0,(D7/$D$44)*100) -> 2.61 | U7: 0 | V7: 0 | W7: =V7-U7 -> 0
A8: Lapa | C8: 2250000 | D8: 2531216 | E8: 1995100 | G8: 2017250 | H8: 1405810 | I8: 1603316 | K8: =IF(C8=0,0,((D8/C8)*100)-100) -> 12.5 | L8: =IF(D8=0,0,IF(E8=0,0,((D8/E8)*100)-100)) -> 26.87 | M8: =IF(G8=0,0,((D8/G8)*100)-100) -> 25.48 | N8: =IF(H8=0,0,((D8/H8)*100)-100) -> 80.05 | O8: =IF(D8=0,0,IF(I8=0,0,((D8/I8)*100)-100)) -> 57.87 | Q8: 0 | R8: =IF(D8=0,0,((D8/Q8)*100)-100) -> ###### | S8: =IF(D8=0,0,(D8/$D$44)*100) -> 2.26 | U8: 0 | V8: 0 | W8: =V8-U8 -> 0
A9: Araucaria | C9: 1550000 | D9: 1482404 | E9: 1128740 | G9: 1278446 | H9: 1127622 | I9: 1188414 | K9: =IF(C9=0,0,((D9/C9)*100)-100) -> -4.36 | L9: =IF(D9=0,0,IF(E9=0,0,((D9/E9)*100)-100)) -> 31.33 | M9: =IF(G9=0,0,((D9/G9)*100)-100) -> 15.95 | N9: =IF(H9=0,0,((D9/H9)*100)-100) -> 31.46 | O9: =IF(D9=0,0,IF(I9=0,0,((D9/I9)*100)-100)) -> 24.74 | Q9: 0 | R9: =IF(D9=0,0,((D9/Q9)*100)-100) -> ###### | S9: =IF(D9=0,0,(D9/$D$44)*100) -> 1.32 | U9: 0 | V9: 0 | W9: =V9-U9 -> 0
A10: Hauer | C10: 4650000 | D10: 4035050 | E10: 3646520 | G10: 4217488 | H10: 3740747 | I10: 4067771 | K10: =IF(C10=0,0,((D10/C10)*100)-100) -> -13.22 | L10: =IF(D10=0,0,IF(E10=0,0,((D10/E10)*100)-100)) -> 10.65 | M10: =IF(G10=0,0,((D10/G10)*100)-100) -> -4.33 | N10: =IF(H10=0,0,((D10/H10)*100)-100) -> 7.87 | O10: =IF(D10=0,0,IF(I10=0,0,((D10/I10)*100)-100)) -> -0.8 | Q10: 0 | R10: =IF(D10=0,0,((D10/Q10)*100)-100) -> ###### | S10: =IF(D10=0,0,(D10/$D$44)*100) -> 3.61 | U10: 0 | V10: 0 | W10: =V10-U10 -> 0
A11: Paranagua | C11: 2550000 | D11: 2420389 | E11: 1777194 | G11: 2411778 | H11: 2096973 | I11: 2137266 | K11: =IF(C11=0,0,((D11/C11)*100)-100) -> -5.08 | L11: =IF(D11=0,0,IF(E11=0,0,((D11/E11)*100)-100)) -> 36.19 | M11: =IF(G11=0,0,((D11/G11)*100)-100) -> 0.36 | N11: =IF(H11=0,0,((D11/H11)*100)-100) -> 15.42 | O11: =IF(D11=0,0,IF(I11=0,0,((D11/I11)*100)-100)) -> 13.25 | Q11: 2550000 | R11: =IF(D11=0,0,((D11/Q11)*100)-100) -> -5.08 | S11: =IF(D11=0,0,(D11/$D$44)*100) -> 2.16 | U11: 18.9 | V11: 0 | W11: =V11-U11 -> -18.9
A12: Centenario | C12: 1460000 | D12: 1407684 | E12: 1238366 | G12: 1299733 | H12: 1156486 | I12: 1212315 | K12: =IF(C12=0,0,((D12/C12)*100)-100) -> -3.58 | L12: =IF(D12=0,0,IF(E12=0,0,((D12/E12)*100)-100)) -> 13.67 | M12: =IF(G12=0,0,((D12/G12)*100)-100) -> 8.31 | N12: =IF(H12=0,0,((D12/H12)*100)-100) -> 21.72 | O12: =IF(D12=0,0,IF(I12=0,0,((D12/I12)*100)-100)) -> 16.12 | Q12: 0 | R12: =IF(D12=0,0,((D12/Q12)*100)-100) -> ###### | S12: =IF(D12=0,0,(D12/$D$44)*100) -> 1.26 | U12: 0 | V12: 0 | W12: =V12-U12 -> 0
A13: Sitio Cercado | C13: 2300000 | D13: 2390993 | E13: 1935106 | G13: 2254251 | H13: 1654068 | I13: 1801665 | K13: =IF(C13=0,0,((D13/C13)*100)-100) -> 3.96 | L13: =IF(D13=0,0,IF(E13=0,0,((D13/E13)*100)-100)) -> 23.56 | M13: =IF(G13=0,0,((D13/G13)*100)-100) -> 6.07 | N13: =IF(H13=0,0,((D13/H13)*100)-100) -> 44.55 | O13: =IF(D13=0,0,IF(I13=0,0,((D13/I13)*100)-100)) -> 32.71 | Q13: 0 | R13: =IF(D13=0,0,((D13/Q13)*100)-100) -> ###### | S13: =IF(D13=0,0,(D13/$D$44)*100) -> 2.14 | U13: 0 | V13: 0 | W13: =V13-U13 -> 0
A14: Apucarana | C14: 3400000 | D14: 3136054 | E14: 2411666 | G14: 3265544 | H14: 2437091 | I14: 2534044 | K14: =IF(C14=0,0,((D14/C14)*100)-100) -> -7.76 | L14: =IF(D14=0,0,IF(E14=0,0,((D14/E14)*100)-100)) -> 30.04 | M14: =IF(G14=0,0,((D14/G14)*100)-100) -> -3.97 | N14: =IF(H14=0,0,((D14/H14)*100)-100) -> 28.68 | O14: =IF(D14=0,0,IF(I14=0,0,((D14/I14)*100)-100)) -> 23.76 | Q14: 0 | R14: =IF(D14=0,0,((D14/Q14)*100)-100) -> ###### | S14: =IF(D14=0,0,(D14/$D$44)*100) -> 2.8 | U14: 0 | V14: 0 | W14: =V14-U14 -> 0
A15: Ah | C15: 2100000 | D15: 1765243 | E15: 1619229 | G15: 1807683 | H15: 1304102 | I15: 1476110 | K15: =IF(C15=0,0,((D15/C15)*100)-100) -> -15.94 | L15: =IF(D15=0,0,IF(E15=0,0,((D15/E15)*100)-100)) -> 9.02 | M15: =IF(G15=0,0,((D15/G15)*100)-100) -> -2.35 | N15: =IF(H15=0,0,((D15/H15)*100)-100) -> 35.36 | O15: =IF(D15=0,0,IF(I15=0,0,((D15/I15)*100)-100)) -> 19.59 | Q15: 0 | R15: =IF(D15=0,0,((D15/Q15)*100)-100) -> ###### | S15: =IF(D15=0,0,(D15/$D$44)*100) -> 1.58 | U15: 0 | V15: 0 | W15: =V15-U15 -> 0
A16: P.G. Centro | C16: 2450000 | D16: 2493558 | E16: 1979642 | G16: 2292692 | H16: 1909438 | I16: 2042921 | K16: =IF(C16=0,0,((D16/C16)*100)-100) -> 1.78 | L16: =IF(D16=0,0,IF(E16=0,0,((D16/E16)*100)-100)) -> 25.96 | M16: =IF(G16=0,0,((D16/G16)*100)-100) -> 8.76 | N16: =IF(H16=0,0,((D16/H16)*100)-100) -> 30.59 | O16: =IF(D16=0,0,IF(I16=0,0,((D16/I16)*100)-100)) -> 22.06 | Q16: 0 | R16: =IF(D16=0,0,((D16/Q16)*100)-100) -> ###### | S16: =IF(D16=0,0,(D16/$D$44)*100) -> 2.23 | U16: 0 | V16: 0 | W16: =V16-U16 -> 0
A17: Maringa | C17: 3320000 | D17: 3246917 | E17: 3048883 | G17: 2857016 | H17: 2493320 | I17: 2937386 | K17: =IF(C17=0,0,((D17/C17)*100)-100) -> -2.2 | L17: =IF(D17=0,0,IF(E17=0,0,((D17/E17)*100)-100)) -> 6.5 | M17: =IF(G17=0,0,((D17/G17)*100)-100) -> 13.65 | N17: =IF(H17=0,0,((D17/H17)*100)-100) -> 30.22 | O17: =IF(D17=0,0,IF(I17=0,0,((D17/I17)*100)-100)) -> 10.54 | Q17: 0 | R17: =IF(D17=0,0,((D17/Q17)*100)-100) -> ###### | S17: =IF(D17=0,0,(D17/$D$44)*100) -> 2.9 | U17: 0 | V17: 0 | W17: =V17-U17 -> 0
A18: Araucaria Nova | C18: 3550000 | D18: 4167224 | E18: 3323591 | G18: 3517293 | H18: 2697552 | I18: 2709318 | K18: =IF(C18=0,0,((D18/C18)*100)-100) -> 17.39 | L18: =IF(D18=0,0,IF(E18=0,0,((D18/E18)*100)-100)) -> 25.38 | M18: =IF(G18=0,0,((D18/G18)*100)-100) -> 18.48 | N18: =IF(H18=0,0,((D18/H18)*100)-100) -> 54.48 | O18: =IF(D18=0,0,IF(I18=0,0,((D18/I18)*100)-100)) -> 53.81 | Q18: 0 | R18: =IF(D18=0,0,((D18/Q18)*100)-100) -> ###### | S18: =IF(D18=0,0,(D18/$D$44)*100) -> 3.72 | U18: 0 | V18: 0 | W18: =V18-U18 -> 0
A19: Cristo Rei | C19: 1850000 | D19: 1885774 | E19: 1804282 | G19: 1676192 | H19: 1404831 | I19: 0 | K19: =IF(C19=0,0,((D19/C19)*100)-100) -> 1.93 | L19: =IF(D19=0,0,IF(E19=0,0,((D19/E19)*100)-100)) -> 4.52 | M19: =IF(G19=0,0,((D19/G19)*100)-100) -> 12.5 | N19: =IF(H19=0,0,((D19/H19)*100)-100) -> 34.23 | O19: =IF(D19=0,0,IF(I19=0,0,((D19/I19)*100)-100)) -> 0 | Q19: 0 | R19: =IF(D19=0,0,((D19/Q19)*100)-100) -> ###### | S19: =IF(D19=0,0,(D19/$D$44)*100) -> 1.69 | U19: 0 | V19: 0 | W19: =V19-U19 -> 0
A20: Campo Largo | C20: 2700000 | D20: 2976092 | E20: 2440886 | G20: 0 | H20: 0 | I20: 0 | K20: =IF(C20=0,0,((D20/C20)*100)-100) -> 10.23 | L20: =IF(D20=0,0,IF(E20=0,0,((D20/E20)*100)-100)) -> 21.93 | M20: =IF(G20=0,0,((D20/G20)*100)-100) -> 0 | N20: =IF(H20=0,0,((D20/H20)*100)-100) -> 0 | O20: =IF(D20=0,0,IF(I20=0,0,((D20/I20)*100)-100)) -> 0 | Q20: 0 | R20: =IF(D20=0,0,((D20/Q20)*100)-100) -> ###### | S20: =IF(D20=0,0,(D20/$D$44)*100) -> 2.66 | U20: 0 | V20: 0 | W20: =V20-U20 -> 0
A21: Brasilia | C21: 2600000 | D21: 2642511 | E21: 2251019 | G21: 1054122 | H21: 922447 | I21: 981107 | K21: =IF(C21=0,0,((D21/C21)*100)-100) -> 1.64 | L21: =IF(D21=0,0,IF(E21=0,0,((D21/E21)*100)-100)) -> 17.39 | M21: =IF(G21=0,0,((D21/G21)*100)-100) -> 150.68 | N21: =IF(H21=0,0,((D21/H21)*100)-100) -> 186.47 | O21: =IF(D21=0,0,IF(I21=0,0,((D21/I21)*100)-100)) -> 169.34 | Q21: 0 | R21: =IF(D21=0,0,((D21/Q21)*100)-100) -> ###### | S21: =IF(D21=0,0,(D21/$D$44)*100) -> 2.36 | U21: 0 | V21: 0 | W21: =V21-U21 -> 0
A22: Total Super | C22: =SUM(C7:C21) -> 39530000 | D22: =SUM(D7:D21) -> 39499337 | E22: =SUM(E7:E21) -> 33055776 | G22: =SUM(G7:G21) -> 32557014 | H22: =SUM(H7:H21) -> 25292595 | I22: =SUM(I7:I21) -> 25687023 | J22: =SUM(C22:I22) -> 195621745 | K22: =IF(D22=0,0,((D22/C22)*100)-100) -> -0.08 | L22: =IF(D22=0,0,IF(E22=0,0,((D22/E22)*100)-100)) -> 19.49 | M22: =IF(G22=0,0,IF(D22=0,0,((D22/G22)*100)-100)) -> 21.32 | N22: =IF(H22=0,0,IF(D22=0,0,((D22/H22)*100)-100)) -> 56.17 | O22: =IF(D22=0,0,IF(I22=0,0,((D22/I22)*100)-100)) -> 53.77 | Q22: =SUM(Q7:Q21) -> 2550000 | R22: =IF(D22=0,0,((D22/Q22)*100)-100) -> 1448.99 | S22: =IF(D22=0,0,(D22/$D$44)*100) -> 35.3 | U22: 18.9 | V22: 0 | W22: =V22-U22 -> -18.9
A24: Pinheirinho | C24: 5100000 | D24: 5248171 | E24: 4202729 | G24: 4959218 | H24: 3808732 | I24: 2697444 | K24: =IF(C24=0,0,((D24/C24)*100)-100) -> 2.91 | L24: =IF(D24=0,0,IF(E24=0,0,((D24/E24)*100)-100)) -> 24.88 | M24: =IF(G24=0,0,((D24/G24)*100)-100) -> 5.83 | N24: =IF(H24=0,0,((D24/H24)*100)-100) -> 37.79 | O24: =IF(D24=0,0,IF(I24=0,0,((D24/I24)*100)-100)) -> 94.56 | Q24: 0 | R24: =IF(D24=0,0,IF(Q24=0,0,((D24/Q24)*100)-100)) -> 0 | S24: =IF(D24=0,0,(D24/$D$44)*100) -> 4.69 | U24: 0 | V24: 0 | W24: =V24-U24 -> 0
A25: Londrina | C25: 4530000 | D25: 4177137 | E25: 3461091 | G25: 4065656 | H25: 3290867 | I25: 3736165 | K25: =IF(C25=0,0,((D25/C25)*100)-100) -> -7.79 | L25: =IF(D25=0,0,IF(E25=0,0,((D25/E25)*100)-100)) -> 20.69 | M25: =IF(G25=0,0,((D25/G25)*100)-100) -> 2.74 | N25: =IF(H25=0,0,((D25/H25)*100)-100) -> 26.93 | O25: =IF(D25=0,0,IF(I25=0,0,((D25/I25)*100)-100)) -> 11.8 | Q25: 0 | R25: =IF(D25=0,0,IF(Q25=0,0,((D25/Q25)*100)-100)) -> 0 | S25: =IF(D25=0,0,(D25/$D$44)*100) -> 3.73 | U25: 0 | V25: 0 | W25: =V25-U25 -> 0
A26: So Brz | C26: 5700000 | D26: 5776156 | E26: 4737026 | G26: 5600128 | H26: 3799285 | I26: 3979406 | K26: =IF(C26=0,0,((D26/C26)*100)-100) -> 1.34 | L26: =IF(D26=0,0,IF(E26=0,0,((D26/E26)*100)-100)) -> 21.94 | M26: =IF(G26=0,0,((D26/G26)*100)-100) -> 3.14 | N26: =IF(H26=0,0,((D26/H26)*100)-100) -> 52.03 | O26: =IF(D26=0,0,IF(I26=0,0,((D26/I26)*100)-100)) -> 45.15 | Q26: 0 | R26: =IF(D26=0,0,IF(Q26=0,0,((D26/Q26)*100)-100)) -> 0 | S26: =IF(D26=0,0,(D26/$D$44)*100) -> 5.16 | U26: 0 | V26: 0 | W26: =V26-U26 -> 0
A27: S.J. Pinhais | C27: 6300000 | D27: 6123208 | E27: 5396112 | G27: 6178320 | H27: 5010440 | I27: 5568251 | K27: =IF(C27=0,0,((D27/C27)*100)-100) -> -2.81 | L27: =IF(D27=0,0,IF(E27=0,0,((D27/E27)*100)-100)) -> 13.47 | M27: =IF(G27=0,0,((D27/G27)*100)-100) -> -0.89 | N27: =IF(H27=0,0,((D27/H27)*100)-100) -> 22.21 | O27: =IF(D27=0,0,IF(I27=0,0,((D27/I27)*100)-100)) -> 9.97 | Q27: 0 | R27: =IF(D27=0,0,IF(Q27=0,0,((D27/Q27)*100)-100)) -> 0 | S27: =IF(D27=0,0,(D27/$D$44)*100) -> 5.47 | U27: 0 | V27: 0 | W27: =V27-U27 -> 0
A28: P.G. Nova | C28: 5980000 | D28: 6264119 | E28: 4937816 | G28: 5649542 | H28: 4378304 | I28: 5062487 | K28: =IF(C28=0,0,((D28/C28)*100)-100) -> 4.75 | L28: =IF(D28=0,0,IF(E28=0,0,((D28/E28)*100)-100)) -> 26.86 | M28: =IF(G28=0,0,((D28/G28)*100)-100) -> 10.88 | N28: =IF(H28=0,0,((D28/H28)*100)-100) -> 43.07 | O28: =IF(D28=0,0,IF(I28=0,0,((D28/I28)*100)-100)) -> 23.74 | Q28: 0 | R28: =IF(D28=0,0,IF(Q28=0,0,((D28/Q28)*100)-100)) -> 0 | S28: =IF(D28=0,0,(D28/$D$44)*100) -> 5.6 | U28: 0 | V28: 0 | W28: =V28-U28 -> 0
A29: Nilo Pecanha | C29: 13200000 | D29: 13959308 | E29: 12068286 | G29: 13064868 | H29: 11483309 | I29: 11637386 | K29: =IF(C29=0,0,((D29/C29)*100)-100) -> 5.75 | L29: =IF(D29=0,0,IF(E29=0,0,((D29/E29)*100)-100)) -> 15.67 | M29: =IF(G29=0,0,((D29/G29)*100)-100) -> 6.85 | N29: =IF(H29=0,0,((D29/H29)*100)-100) -> 21.56 | O29: =IF(D29=0,0,IF(I29=0,0,((D29/I29)*100)-100)) -> 19.95 | Q29: 0 | R29: =IF(D29=0,0,IF(Q29=0,0,((D29/Q29)*100)-100)) -> 0 | S29: =IF(D29=0,0,(D29/$D$44)*100) -> 12.48 | U29: 0 | V29: 0 | W29: =V29-U29 -> 0
A30: Champagnat | C30: 7100000 | D30: 7386695 | E30: 6622547 | G30: 6827320 | H30: 6062519 | I30: 6686545 | K30: =IF(C30=0,0,((D30/C30)*100)-100) -> 4.04 | L30: =IF(D30=0,0,IF(E30=0,0,((D30/E30)*100)-100)) -> 11.54 | M30: =IF(G30=0,0,((D30/G30)*100)-100) -> 8.19 | N30: =IF(H30=0,0,((D30/H30)*100)-100) -> 21.84 | O30: =IF(D30=0,0,IF(I30=0,0,((D30/I30)*100)-100)) -> 10.47 | Q30: 0 | R30: =IF(D30=0,0,IF(Q30=0,0,((D30/Q30)*100)-100)) -> 0 | S30: =IF(D30=0,0,(D30/$D$44)*100) -> 6.6 | U30: 0 | V30: 0 | W30: =V30-U30 -> 0
A31: Santa Candida | C31: 6800000 | D31: 7072443 | E31: 5796069 | G31: 6642183 | H31: 5055288 | I31: 5840046 | K31: =IF(C31=0,0,((D31/C31)*100)-100) -> 4.01 | L31: =IF(D31=0,0,IF(E31=0,0,((D31/E31)*100)-100)) -> 22.02 | M31: =IF(G31=0,0,((D31/G31)*100)-100) -> 6.48 | N31: =IF(H31=0,0,((D31/H31)*100)-100) -> 39.9 | O31: =IF(D31=0,0,IF(I31=0,0,((D31/I31)*100)-100)) -> 21.1 | Q31: 0 | R31: =IF(D31=0,0,IF(Q31=0,0,((D31/Q31)*100)-100)) -> 0 | S31: =IF(D31=0,0,(D31/$D$44)*100) -> 6.32 | U31: 0 | V31: 0 | W31: =V31-U31 -> 0
A32: Paranagu Raia | C32: 7800000 | D32: 8300852 | E32: 6122889 | G32: 7828703 | H32: 6346041 | I32: 6330492 | K32: =IF(C32=0,0,((D32/C32)*100)-100) -> 6.42 | L32: =IF(D32=0,0,IF(E32=0,0,((D32/E32)*100)-100)) -> 35.57 | M32: =IF(G32=0,0,((D32/G32)*100)-100) -> 6.03 | N32: =IF(H32=0,0,((D32/H32)*100)-100) -> 30.8 | O32: =IF(D32=0,0,IF(I32=0,0,((D32/I32)*100)-100)) -> 31.12 | Q32: 0 | R32: =IF(D32=0,0,IF(Q32=0,0,((D32/Q32)*100)-100)) -> 0 | S32: =IF(D32=0,0,(D32/$D$44)*100) -> 7.42 | U32: 0 | V32: 0 | W32: =V32-U32 -> 0
A33: Torres | C33: 7000000 | D33: 8083661 | E33: 0 | G33: 0 | H33: 0 | I33: 0 | K33: =IF(C33=0,0,((D33/C33)*100)-100) -> 15.48 | L33: =IF(D33=0,0,IF(E33=0,0,((D33/E33)*100)-100)) -> 0 | M33: =IF(G33=0,0,((D33/G33)*100)-100) -> 0 | N33: =IF(H33=0,0,((D33/H33)*100)-100) -> 0 | O33: =IF(D33=0,0,IF(I33=0,0,((D33/I33)*100)-100)) -> 0 | Q33: 0 | R33: =IF(D33=0,0,IF(Q33=0,0,((D33/Q33)*100)-100)) -> 0 | S33: =IF(D33=0,0,(D33/$D$44)*100) -> 7.22 | U33: 0 | V33: 0 | W33: =V33-U33 -> 0
A34: Total Hiper | C34: =SUM(C24:C33) -> 69510000 | D34: =SUM(D24:D33) -> 72391750 | E34: =SUM(E24:E33) -> 53344565 | G34: =SUM(G24:G33) -> 60815938 | H34: =SUM(H24:H33) -> 49234785 | I34: =SUM(I24:I33) -> 51538222 | J34: =SUM(C34:I34) -> 356835260 | K34: =IF(D34=0,0,((D34/C34)*100)-100) -> 4.15 | L34: =IF(D34=0,0,IF(E34=0,0,((D34/E34)*100)-100)) -> 35.71 | M34: =IF(G34=0,0,IF(D34=0,0,((D34/G34)*100)-100)) -> 19.03 | N34: =IF(H34=0,0,IF(D34=0,0,((D34/H34)*100)-100)) -> 47.03 | O34: =IF(D34=0,0,IF(I34=0,0,((D34/I34)*100)-100)) -> 40.46 | Q34: =SUM(Q24:Q33) -> 0 | R34: =IF(D34=0,0,((D34/Q34)*100)-100) -> ###### | S34: =IF(D34=0,0,(D34/$D$44)*100) -> 64.7 | U34: ##### | V34: 0 | W34: =V34-U34 -> #####
A36: Total s/ 27, 32 | B36: =B22+B34 -> 0 | C36: =C22+C34 -> 109040000 | D36: =D22+D34 -> 111891087 | E36: =E22+E34 -> 86400341 | F36: =F22+F34 -> 0 | G36: =G22+G34 -> 93372952 | H36: =H22+H34 -> 74527380 | I36: =I22+I34 -> 77225245 | J36: =SUM(C36:I36) -> 552457005 | K36: =IF(D36=0,0,((D36/C36)*100)-100) -> 2.61 | L36: =IF(D36=0,0,IF(E36=0,0,((D36/E36)*100)-100)) -> 29.5 | M36: =IF(G36=0,0,IF(D36=0,0,((D36/G36)*100)-100)) -> 19.83 | N36: =IF(H36=0,0,IF(D36=0,0,((D36/H36)*100)-100)) -> 50.13 | O36: =IF(D36=0,0,IF(I36=0,0,((D36/I36)*100)-100)) -> 44.89 | Q36: =Q22+Q34 -> 2550000 | R36: =IF(D36=0,0,((D36/Q36)*100)-100) -> 4287.89 | S36: =IF(D36=0,0,(D36/$D$44)*100) -> 100 | U36: 18.9 | V36: 0 | W36: =V36-U36 -> -18.9
A38: Campo Largo | C38: 0 | D38: 0 | E38: 0 | G38: 0 | H38: 0 | I38: 0 | K38: =IF(C38=0,0,((D38/C38)*100)-100) -> 0 | L38: =IF(D38=0,0,IF(E38=0,0,((D38/E38)*100)-100)) -> 0 | M38: =IF(G38=0,0,((D38/G38)*100)-100) -> 0 | N38: =IF(H38=0,0,((D38/H38)*100)-100) -> 0 | O38: =IF(D38=0,0,IF(I38=0,0,((D38/I38)*100)-100)) -> 0 | Q38: 0 | R38: =IF(Q38=0,0,IF(D38=0,0,((D38/Q38)*100)-100)) -> 0 | S38: =IF(D38=0,0,(D38/$D$44)*100) -> 0 | U38: 0 | V38: 0 | W38: =V38-U38 -> 0
A39: Uvaranas | C39: 0 | D39: 0 | E39: 0 | G39: 0 | H39: 0 | I39: 0 | K39: =IF(C39=0,0,((D39/C39)*100)-100) -> 0 | L39: =IF(D39=0,0,IF(E39=0,0,((D39/E39)*100)-100)) -> 0 | M39: =IF(G39=0,0,((D39/G39)*100)-100) -> 0 | N39: =IF(H39=0,0,((D39/H39)*100)-100) -> 0 | O39: =IF(D39=0,0,IF(I39=0,0,((D39/I39)*100)-100)) -> 0 | Q39: 0 | R39: =IF(Q39=0,0,IF(D39=0,0,((D39/Q39)*100)-100)) -> 0 | S39: =IF(D39=0,0,(D39/$D$44)*100) -> 0 | U39: 0 | V39: 0 | W39: =V39-U39 -> 0
A40: Novo Mundo | C40: 0 | D40: 0 | E40: 0 | G40: 0 | H40: 0 | I40: 0 | K40: =IF(C40=0,0,((D40/C40)*100)-100) -> 0 | L40: =IF(D40=0,0,IF(E40=0,0,((D40/E40)*100)-100)) -> 0 | M40: =IF(G40=0,0,((D40/G40)*100)-100) -> 0 | N40: =IF(H40=0,0,((D40/H40)*100)-100) -> 0 | O40: =IF(D40=0,0,IF(I40=0,0,((D40/I40)*100)-100)) -> 0 | Q40: 0 | R40: =IF(Q40=0,0,IF(D40=0,0,((D40/Q40)*100)-100)) -> 0 | S40: =IF(D40=0,0,(D40/$D$44)*100) -> 0 | U40: 0 | V40: 0 | W40: =V40-U40 -> 0
A41: Torres | C41: 0 | D41: 0 | E41: 0 | G41: 0 | H41: 0 | I41: 0 | K41: =IF(C41=0,0,((D41/C41)*100)-100) -> 0 | L41: =IF(D41=0,0,IF(E41=0,0,((D41/E41)*100)-100)) -> 0 | M41: =IF(G41=0,0,((D41/G41)*100)-100) -> 0 | N41: =IF(H41=0,0,((D41/H41)*100)-100) -> 0 | O41: =IF(D41=0,0,IF(I41=0,0,((D41/I41)*100)-100)) -> 0 | Q41: 0 | R41: =IF(Q41=0,0,IF(D41=0,0,((D41/Q41)*100)-100)) -> 0 | S41: =IF(D41=0,0,(D41/$D$44)*100) -> 0 | U41: 0 | V41: 0 | W41: =V41-U41 -> 0
A42: Total Lojas Novas | C42: =SUM(C38:C41) -> 0 | D42: =SUM(D38:D41) -> 0 | E42: =SUM(E38:E41) -> 0 | G42: =SUM(G38:G41) -> 0 | H42: =SUM(H38:H41) -> 0 | I42: =SUM(I38:I41) -> 0 | K42: =IF(D42=0,0,((D42/C42)*100)-100) -> 0 | L42: =IF(D42=0,0,IF(E42=0,0,((D42/E42)*100)-100)) -> 0 | M42: =IF(G42=0,0,IF(D42=0,0,((D42/G42)*100)-100)) -> 0 | N42: =IF(H42=0,0,IF(D42=0,0,((D42/H42)*100)-100)) -> 0 | O42: =IF(D42=0,0,IF(I42=0,0,((D42/I42)*100)-100)) -> 0 | Q42: =SUM(Q38:Q41) -> 0 | R42: =IF(Q42=0,0,IF(D42=0,0,((D42/Q42)*100)-100)) -> 0 | S42: =IF(D42=0,0,(D42/$D$44)*100) -> 0
A44: Total Geral | C44: =C22+C34+C42 -> 109040000 | D44: =D22+D34+D42 -> 111891087 | E44: =E22+E34+E42 -> 86400341 | G44: =G22+G34+G42 -> 93372952 | H44: =H22+H34+H42 -> 74527380 | I44: =I22+I34+I42 -> 77225245 | K44: =IF(D44=0,0,((D44/C44)*100)-100) -> 2.61 | L44: =IF(D44=0,0,IF(E44=0,0,((D44/E44)*100)-100)) -> 29.5 | M44: =IF(G44=0,0,IF(D44=0,0,((D44/G44)*100)-100)) -> 19.83 | N44: =IF(H44=0,0,IF(D44=0,0,((D44/H44)*100)-100)) -> 50.13 | O44: =IF(D44=0,0,IF(I44=0,0,((D44/I44)*100)-100)) -> 44.89 | Q44: =Q22+Q34+Q42 -> 2550000 | R44: =IF(D44=0,0,((D44/Q44)*100)-100) -> 4287.89 | S44: =S22+S34+S42 -> 100 | U44: 18.9 | V44: 0 | W44: =V44-U44 -> -18.9
C45: Resumo por Regiao - Outubro/2002
C46: Descricao das Aberturas | H46: Valor | I46: % | M46: Margem Comercial | R46: Meta | S46: Real | U46: Dif
C47: Curitiba (3,6,7,10,11,13,17,21,22,24,26,27,28,34) | H47: 60035259 | I47: =IF(D44=0,0,H47/$D$44) -> 0.53659999999999997 | L47: 99 | M47: Empresa | R47: 0 | S47: 0 | U47: =S47-R47 -> 0
C48: Curitiba e Metrop. (Ctba. 4,5,8,14,23,25;31) | H48: 84525298 | I48: =IF(D44=0,0,H48/$D$44) -> 0.75539999999999996 | L48: 207 | M48: Super | R48: 0 | S48: 0 | U48: =S48-R48 -> 0
C49: Metropolitana (4,5,8,14,23,25;31) | H49: 24490039 | I49: =IF(D44=0,0,H49/$D$44) -> 0.21890000000000001 | L49: 208 | M49: Hiper | R49: 0 | S49: 0 | U49: =S49-R49 -> 0
C50: Norte (9,15,20) | H50: =D25+D15+D18 -> 10109604 | I50: =IF(D44=0,0,H50/$D$44) -> 9.0399999999999994E-2 | L50: 204 | M50: Regional Gilberto | R50: 0 | S50: 0 | U50: =S50-R50 -> 0
C51: Ponta Grossa (18,19,32) | H51: =D17+D28+D39 -> 9511036 | I51: =IF(D44=0,0,H51/$D$44) -> 8.5000000000000006E-2 | L51: 205 | M51: Regional Edison | R51: 0 | S51: 0 | U51: =S51-R51 -> 0
C52: Super (3,4,5,7,8,10,13,15,17,18,20,23,26,28,34) | H52: 39499337 | I52: =IF(D44=0,0,H52/$D$44) -> 0.35299999999999998 | L52: 206 | M52: Regional Jorge | R52: 0 | S52: 0 | U52: =S52-R52 -> 0
C53: Hiper (6,9,11,14,19,21,22,24,25,26,27) | H53: 72391750 | I53: =IF(D44=0,0,H53/$D$44) -> 0.64700000000000002 | L53: 209 | M53: Regio - Curitiba | R53: 0 | S53: 0 | U53: =S53-R53 -> 0
C54: Curitiba, Metropolitana e Ponta Grossa | H54: =D44-H50 -> 101781483 | I54: =IF(D44=0,0,H54/$D$44) -> 0.90959999999999996 | L54: 200 | M54: Regio - Metropolitana | R54: 0 | S54: 0 | U54: =S54-R54 -> 0
C55: Araucaria | H55: =D9+D19 -> 3368178 | I55: =IF(D44=0,0,H55/$D$44) -> 3.0099999999999998E-2 | L55: 201 | M55: Regio - Centro Oeste | R55: 0 | S55: 0 | U55: =S55-R55 -> 0