A2: Periodo: | B2: 40513 | C2: a | D2: 40543 | G2: Vendas Acumuladas por Filial | P2: =NOW() -> 40546.655334953706
A4: v.New | B4: Vendas 2010 | F4: Vendas de Anos Anteriores | J4: Percentuais ( % ) | P4: Meta Mensal | T4: Margem
A5: Lojas | B5: Previsao | C5: Realizada | D5: Mes Anterior | F5: Vendas 2009 | G5: Vendas 2008 | H5: Vendas 2007 | J5: % Prev | K5: % MA | L5: 2009 | M5: 2008 | N5: 2007 | P5: Previsao Mes | Q5: Final | R5: Part. | T5: Meta | U5: Coml | V5: Dif
A6: S. Felicidade | B6: 4100000 | C6: 3976363.59 | D6: 3177102.5 | F6: 3470654 | G6: 2843774.29 | H6: 2607525.47 | J6: =IF(B6=0,0,((C6/B6)*100)-100) -> -3.0155221951219602 | K6: =IF(C6=0,0,IF(D6=0,0,((C6/D6)*100)-100)) -> 25.156918607441852 | L6: =IF(F6=0,0,((C6/F6)*100)-100) -> 14.571017162759532 | M6: =IF(G6=0,0,((C6/G6)*100)-100) -> 39.826975860309915 | N6: =IF(C6=0,0,IF(H6=0,0,((C6/H6)*100)-100)) -> 52.495675909926945 | P6: 4100000 | Q6: =IF(C6=0,0,((C6/P6)*100)-100) -> -3.0155221951219602 | R6: =IF(C6=0,0,(C6/$C$41)*100) -> 2.4485578653545303 | T6: 16.05 | U6: 16.152152977539963 | V6: =U6-T6 -> 0.10215297753996211
A7: Lapa | B7: 3000000 | C7: 3013929.55 | D7: 2309851.44 | F7: 2775609.1 | G7: 2435494.97 | H7: 2017249.84 | J7: =IF(B7=0,0,((C7/B7)*100)-100) -> 0.46431833333333827 | K7: =IF(C7=0,0,IF(D7=0,0,((C7/D7)*100)-100)) -> 30.481532180268687 | L7: =IF(F7=0,0,((C7/F7)*100)-100) -> 8.5862396833905592 | M7: =IF(G7=0,0,((C7/G7)*100)-100) -> 23.750185778457976 | N7: =IF(C7=0,0,IF(H7=0,0,((C7/H7)*100)-100)) -> 49.407846774200237 | P7: 3000000 | Q7: =IF(C7=0,0,((C7/P7)*100)-100) -> 0.46431833333333827 | R7: =IF(C7=0,0,(C7/$C$41)*100) -> 1.855912000561533 | T7: 16.304200000000002 | U7: 14.289039038752582 | V7: =U7-T7 -> -2.0151609612474193
A8: Araucaria | B8: 1850000 | C8: 1935272.53 | D8: 1475206.07 | F8: 1613967.61 | G8: 1405412.46 | H8: 1278446.37 | J8: =IF(B8=0,0,((C8/B8)*100)-100) -> 4.6093259459459404 | K8: =IF(C8=0,0,IF(D8=0,0,((C8/D8)*100)-100)) -> 31.18658940984426 | L8: =IF(F8=0,0,((C8/F8)*100)-100) -> 19.907767541877732 | M8: =IF(G8=0,0,((C8/G8)*100)-100) -> 37.701392657355541 | N8: =IF(C8=0,0,IF(H8=0,0,((C8/H8)*100)-100)) -> 51.376903670976816 | P8: 1850000 | Q8: =IF(C8=0,0,((C8/P8)*100)-100) -> 4.6093259459459404 | R8: =IF(C8=0,0,(C8/$C$41)*100) -> 1.1916985626900534 | T8: 16.74 | U8: 15.492096092533284 | V8: =U8-T8 -> -1.2479039074667142
A9: Hauer | B9: 4900000 | C9: 5079197.72 | D9: 3913639.31 | F9: 4450850.21 | G9: 3984192.6 | H9: 4217488.08 | J9: =IF(B9=0,0,((C9/B9)*100)-100) -> 3.6570963265306204 | K9: =IF(C9=0,0,IF(D9=0,0,((C9/D9)*100)-100)) -> 29.781957857531836 | L9: =IF(F9=0,0,((C9/F9)*100)-100) -> 14.117471502146998 | M9: =IF(G9=0,0,((C9/G9)*100)-100) -> 27.483739616403071 | N9: =IF(C9=0,0,IF(H9=0,0,((C9/H9)*100)-100)) -> 20.431821587981801 | P9: 4900000 | Q9: =IF(C9=0,0,((C9/P9)*100)-100) -> 3.6570963265306204 | R9: =IF(C9=0,0,(C9/$C$41)*100) -> 3.1276590395992425 | T9: 15.899800000000001 | U9: 15.084613205409928 | V9: =U9-T9 -> -0.81518679459007259
A10: Paranagua | B10: 3120000 | C10: 3111706.01 | D10: 2161215.14 | F10: 2814642.97 | G10: 2324006.17 | H10: 2411777.62 | J10: =IF(B10=0,0,((C10/B10)*100)-100) -> -0.26583301282052219 | K10: =IF(C10=0,0,IF(D10=0,0,((C10/D10)*100)-100)) -> 43.979465644498475 | L10: =IF(F10=0,0,((C10/F10)*100)-100) -> 10.554199703701656 | M10: =IF(G10=0,0,((C10/G10)*100)-100) -> 33.894051150475207 | N10: =IF(C10=0,0,IF(H10=0,0,((C10/H10)*100)-100)) -> 29.021265650520462 | P10: 3120000 | Q10: =IF(C10=0,0,((C10/P10)*100)-100) -> -0.26583301282052219 | R10: =IF(C10=0,0,(C10/$C$41)*100) -> 1.9161206094477043 | T10: 17.9514 | U10: 16.110410121938223 | V10: =U10-T10 -> -1.8409898780617766
A11: Centenario | B11: 0 | C11: 0 | D11: 0 | F11: 0 | G11: 0 | H11: 0 | J11: =IF(B11=0,0,((C11/B11)*100)-100) -> 0 | K11: =IF(C11=0,0,IF(D11=0,0,((C11/D11)*100)-100)) -> 0 | L11: =IF(F11=0,0,((C11/F11)*100)-100) -> 0 | M11: =IF(G11=0,0,((C11/G11)*100)-100) -> 0 | N11: =IF(C11=0,0,IF(H11=0,0,((C11/H11)*100)-100)) -> 0 | P11: 0 | Q11: =IF(C11=0,0,((C11/P11)*100)-100) -> 0 | R11: =IF(C11=0,0,(C11/$C$41)*100) -> 0 | T11: 0 | U11: 0 | V11: =U11-T11 -> 0
A12: Sitio Cercado | B12: 3400000 | C12: 3574335.19 | D12: 2671753.96 | F12: 2872142.89 | G12: 2323672.62 | H12: 2254250.54 | J12: =IF(B12=0,0,((C12/B12)*100)-100) -> 5.1275055882352945 | K12: =IF(C12=0,0,IF(D12=0,0,((C12/D12)*100)-100)) -> 33.78234835665782 | L12: =IF(F12=0,0,((C12/F12)*100)-100) -> 24.448376243564951 | M12: =IF(G12=0,0,((C12/G12)*100)-100) -> 53.822666723163422 | N12: =IF(C12=0,0,IF(H12=0,0,((C12/H12)*100)-100)) -> 58.559801875438382 | P12: 3400000 | Q12: =IF(C12=0,0,((C12/P12)*100)-100) -> 5.1275055882352945 | R12: =IF(C12=0,0,(C12/$C$41)*100) -> 2.2009975558819503 | T12: 16.957699999999999 | U12: 13.937887565603493 | V12: =U12-T12 -> -3.0198124343965063
A13: Apucarana | B13: 3799999 | C13: 3904456.77 | D13: 2869706.01 | F13: 3563739.74 | G13: 2971145.79 | H13: 3265543.69 | J13: =IF(B13=0,0,((C13/B13)*100)-100) -> 2.7488894076024764 | K13: =IF(C13=0,0,IF(D13=0,0,((C13/D13)*100)-100)) -> 36.05772704222062 | L13: =IF(F13=0,0,((C13/F13)*100)-100) -> 9.5606597242704225 | M13: =IF(G13=0,0,((C13/G13)*100)-100) -> 31.412493561953426 | N13: =IF(C13=0,0,IF(H13=0,0,((C13/H13)*100)-100)) -> 19.565289601132235 | P13: 3800000 | Q13: =IF(C13=0,0,((C13/P13)*100)-100) -> 2.7488623684210438 | R13: =IF(C13=0,0,(C13/$C$41)*100) -> 2.4042792158551691 | T13: 16 | U13: 14.945581789601938 | V13: =U13-T13 -> -1.0544182103980617
A14: Ahú | B14: 2250000 | C14: 2379038.47 | D14: 1894952.57 | F14: 1992791.01 | G14: 1726365.82 | H14: 1807682.6 | J14: =IF(B14=0,0,((C14/B14)*100)-100) -> 5.7350431111111249 | K14: =IF(C14=0,0,IF(D14=0,0,((C14/D14)*100)-100)) -> 25.546069472335134 | L14: =IF(F14=0,0,((C14/F14)*100)-100) -> 19.382236173375759 | M14: =IF(G14=0,0,((C14/G14)*100)-100) -> 37.806161500579293 | N14: =IF(C14=0,0,IF(H14=0,0,((C14/H14)*100)-100)) -> 31.6070902048844 | P14: 2250000 | Q14: =IF(C14=0,0,((C14/P14)*100)-100) -> 5.7350431111111249 | R14: =IF(C14=0,0,(C14/$C$41)*100) -> 1.464959937856062 | T14: 17.518699999999999 | U14: 15.620024421042675 | V14: =U14-T14 -> -1.8986755789573238
A15: P.G. Centro | B15: 2450000 | C15: 2710700.74 | D15: 1996459.63 | F15: 2343619.24 | G15: 2368548.14 | H15: 2292691.42 | J15: =IF(B15=0,0,((C15/B15)*100)-100) -> 10.640846530612265 | K15: =IF(C15=0,0,IF(D15=0,0,((C15/D15)*100)-100)) -> 35.77538454909805 | L15: =IF(F15=0,0,((C15/F15)*100)-100) -> 15.663017854384904 | M15: =IF(G15=0,0,((C15/G15)*100)-100) -> 14.445667969408476 | N15: =IF(C15=0,0,IF(H15=0,0,((C15/H15)*100)-100)) -> 18.232253863452769 | P15: 2450000 | Q15: =IF(C15=0,0,((C15/P15)*100)-100) -> 10.640846530612265 | R15: =IF(C15=0,0,(C15/$C$41)*100) -> 1.6691903210866454 | T15: 18.548100000000002 | U15: 17.054131545336134 | V15: =U15-T15 -> -1.4939684546638681
A16: Maringa | B16: 3749999 | C16: 3777025.84 | D16: 3341001.24 | F16: 3215739.63 | G16: 3110224.35 | H16: 2857015.68 | J16: =IF(B16=0,0,((C16/B16)*100)-100) -> 0.7207159255242459 | K16: =IF(C16=0,0,IF(D16=0,0,((C16/D16)*100)-100)) -> 13.050716497189924 | L16: =IF(F16=0,0,((C16/F16)*100)-100) -> 17.45434253332256 | M16: =IF(G16=0,0,((C16/G16)*100)-100) -> 21.439015806046257 | N16: =IF(C16=0,0,IF(H16=0,0,((C16/H16)*100)-100)) -> 32.201788966030449 | P16: 3750000 | Q16: =IF(C16=0,0,((C16/P16)*100)-100) -> 0.72068906666666521 | R16: =IF(C16=0,0,(C16/$C$41)*100) -> 2.3258100319189627 | T16: 17.497299999999999 | U16: 16.177517069885866 | V16: =U16-T16 -> -1.3197829301141333
A17: Araucaria Nova | B17: 5580000 | C17: 6091853.96 | D17: 4673891.19 | F17: 4741181.51 | G17: 4090667.88 | H17: 3517293.33 | J17: =IF(B17=0,0,((C17/B17)*100)-100) -> 9.1730100358422959 | K17: =IF(C17=0,0,IF(D17=0,0,((C17/D17)*100)-100)) -> 30.337949951290994 | L17: =IF(F17=0,0,((C17/F17)*100)-100) -> 28.488098317923289 | M17: =IF(G17=0,0,((C17/G17)*100)-100) -> 48.920766454401075 | N17: =IF(C17=0,0,IF(H17=0,0,((C17/H17)*100)-100)) -> 73.197211277229457 | P17: 5580000 | Q17: =IF(C17=0,0,((C17/P17)*100)-100) -> 9.1730100358422959 | R17: =IF(C17=0,0,(C17/$C$41)*100) -> 3.7512306384309144 | T17: 15.6 | U17: 15.260111389800946 | V17: =U17-T17 -> -0.33988861019905414
A18: Cristo Rei | B18: 2950000 | C18: 2848600.21 | D18: 2528048.88 | F18: 2341252.18 | G18: 1869775.15 | H18: 1676192.06 | J18: =IF(B18=0,0,((C18/B18)*100)-100) -> -3.4372810169491572 | K18: =IF(C18=0,0,IF(D18=0,0,((C18/D18)*100)-100)) -> 12.679791618586123 | L18: =IF(F18=0,0,((C18/F18)*100)-100) -> 21.669943730709079 | M18: =IF(G18=0,0,((C18/G18)*100)-100) -> 52.349880679503116 | N18: =IF(C18=0,0,IF(H18=0,0,((C18/H18)*100)-100)) -> 69.944738313579649 | P18: 2950000 | Q18: =IF(C18=0,0,((C18/P18)*100)-100) -> -3.4372810169491572 | R18: =IF(C18=0,0,(C18/$C$41)*100) -> 1.7541058033493528 | T18: 16.66 | U18: 16.84274817911356 | V18: =U18-T18 -> 0.18274817911355967
A19: Campo Largo | B19: 4700000 | C19: 4967965.97 | D19: 3796154.38 | F19: 4029721.84 | G19: 2903887.48 | H19: 0 | J19: =IF(B19=0,0,((C19/B19)*100)-100) -> 5.7014036170212705 | K19: =IF(C19=0,0,IF(D19=0,0,((C19/D19)*100)-100)) -> 30.868386074435676 | L19: =IF(F19=0,0,((C19/F19)*100)-100) -> 23.283099113362127 | M19: =IF(G19=0,0,((C19/G19)*100)-100) -> 71.079837087902575 | N19: =IF(C19=0,0,IF(H19=0,0,((C19/H19)*100)-100)) -> 0 | P19: 4700000 | Q19: =IF(C19=0,0,((C19/P19)*100)-100) -> 5.7014036170212705 | R19: =IF(C19=0,0,(C19/$C$41)*100) -> 3.0591649569593682 | T19: 15.5 | U19: 15.60557831276771 | V19: =U19-T19 -> 0.1055783127677099
A20: Brasilia | B20: 3100000 | C20: 3571971.82 | D20: 2649750.67 | F20: 2885510.95 | G20: 2586439.57 | H20: 1054121.47 | J20: =IF(B20=0,0,((C20/B20)*100)-100) -> 15.224897419354846 | K20: =IF(C20=0,0,IF(D20=0,0,((C20/D20)*100)-100)) -> 34.80407271677376 | L20: =IF(F20=0,0,((C20/F20)*100)-100) -> 23.789924276669268 | M20: =IF(G20=0,0,((C20/G20)*100)-100) -> 38.103818911183765 | N20: =IF(C20=0,0,IF(H20=0,0,((C20/H20)*100)-100)) -> 238.85770489049992 | P20: 3100000 | Q20: =IF(C20=0,0,((C20/P20)*100)-100) -> 15.224897419354846 | R20: =IF(C20=0,0,(C20/$C$41)*100) -> 2.1995422442457624 | T20: 15.7 | U20: 14.910178938645716 | V20: =U20-T20 -> -0.78982106135428332
A21: Total Super | B21: =SUM(B6:B20) -> 48949998 | C21: =SUM(C6:C20) -> 50942418.369999997 | D21: =SUM(D6:D20) -> 39458732.990000002 | F21: =SUM(F6:F20) -> 43111422.88000001 | G21: =SUM(G6:G20) -> 36943607.289999999 | H21: =SUM(H6:H20) -> 31257278.169999998 | I21: =SUM(B21:H21) -> 250663457.69999999 | J21: =IF(C21=0,0,((C21/B21)*100)-100) -> 4.0703175718209508 | K21: =IF(C21=0,0,IF(D21=0,0,((C21/D21)*100)-100)) -> 29.103026148635593 | L21: =IF(F21=0,0,IF(C21=0,0,((C21/F21)*100)-100)) -> 18.164548898785938 | M21: =IF(G21=0,0,IF(C21=0,0,((C21/G21)*100)-100)) -> 37.892377347214904 | N21: =IF(C21=0,0,IF(H21=0,0,((C21/H21)*100)-100)) -> 62.977781024111493 | P21: =SUM(P6:P20) -> 48950000 | Q21: =IF(C21=0,0,((C21/P21)*100)-100) -> 4.0703133197139891 | R21: =IF(C21=0,0,(C21/$C$41)*100) -> 31.369228783237247 | T21: 16.470887894677748 | U21: 15.476603373511969 | V21: =U21-T21 -> -0.99428452116577937
A22: Pinheirinho | B22: 5800000 | C22: 6066071.3300000001 | D22: 4650589.63 | F22: 6490891.9199999999 | G22: 5172977.18 | H22: 4959217.74 | J22: =IF(B22=0,0,((C22/B22)*100)-100) -> 4.5874367241379304 | K22: =IF(C22=0,0,IF(D22=0,0,((C22/D22)*100)-100)) -> 30.436607239413632 | L22: =IF(F22=0,0,((C22/F22)*100)-100) -> -6.5448723416734964 | M22: =IF(G22=0,0,((C22/G22)*100)-100) -> 17.264606413748012 | N22: =IF(C22=0,0,IF(H22=0,0,((C22/H22)*100)-100)) -> 22.319116603256873 | P22: 5800000 | Q22: =IF(C22=0,0,IF(P22=0,0,((C22/P22)*100)-100)) -> 4.5874367241379304 | R22: =IF(C22=0,0,(C22/$C$41)*100) -> 3.7353542579020336 | T22: 15.9 | U22: 15.682916804738595 | V22: =U22-T22 -> -0.21708319526140585
A23: Londrina | B23: 5550000 | C23: 5389383.0899999999 | D23: 4030619.44 | F23: 4486826.61 | G23: 4052754.96 | H23: 4065655.43 | J23: =IF(B23=0,0,((C23/B23)*100)-100) -> -2.8939983783783845 | K23: =IF(C23=0,0,IF(D23=0,0,((C23/D23)*100)-100)) -> 33.71103797385544 | L23: =IF(F23=0,0,((C23/F23)*100)-100) -> 20.115697762610878 | M23: =IF(G23=0,0,((C23/G23)*100)-100) -> 32.98072899033599 | N23: =IF(C23=0,0,IF(H23=0,0,((C23/H23)*100)-100)) -> 32.558776384057694 | P23: 5550000 | Q23: =IF(C23=0,0,IF(P23=0,0,((C23/P23)*100)-100)) -> -2.8939983783783845 | R23: =IF(C23=0,0,(C23/$C$41)*100) -> 3.318664416809078 | T23: 16.4939 | U23: 15.288575449922229 | V23: =U23-T23 -> -1.205324550077771
A24: São Bráz | B24: 6799999 | C24: 7126266.5599999996 | D24: 5345600.76 | F24: 6287955.8600000003 | G24: 5703643.79 | H24: 5600128 | J24: =IF(B24=0,0,((C24/B24)*100)-100) -> 4.7980530585371923 | K24: =IF(C24=0,0,IF(D24=0,0,((C24/D24)*100)-100)) -> 33.310864015965137 | L24: =IF(F24=0,0,((C24/F24)*100)-100) -> 13.332006754894749 | M24: =IF(G24=0,0,((C24/G24)*100)-100) -> 24.942349529159486 | N24: =IF(C24=0,0,IF(H24=0,0,((C24/H24)*100)-100)) -> 27.251851386254017 | P24: 6800000 | Q24: =IF(C24=0,0,IF(P24=0,0,((C24/P24)*100)-100)) -> 4.7980376470588197 | R24: =IF(C24=0,0,(C24/$C$41)*100) -> 4.3881993286486587 | T24: 15.908899999999999 | U24: 15.291210493254409 | V24: =U24-T24 -> -0.61768950674558987
A25: S.J. Pinhais | B25: 7500000 | C25: 7772724.2300000004 | D25: 6093984.3700000001 | F25: 7024457.2599999998 | G25: 6104422.7599999998 | H25: 6178319.6900000004 | J25: =IF(B25=0,0,((C25/B25)*100)-100) -> 3.6363230666666766 | K25: =IF(C25=0,0,IF(D25=0,0,((C25/D25)*100)-100)) -> 27.547492052395924 | L25: =IF(F25=0,0,((C25/F25)*100)-100) -> 10.652310097477908 | M25: =IF(G25=0,0,((C25/G25)*100)-100) -> 27.329389454016123 | N25: =IF(C25=0,0,IF(H25=0,0,((C25/H25)*100)-100)) -> 25.806442851778044 | P25: 7500000 | Q25: =IF(C25=0,0,IF(P25=0,0,((C25/P25)*100)-100)) -> 3.6363230666666766 | R25: =IF(C25=0,0,(C25/$C$41)*100) -> 4.7862738448920954 | T25: 15.32 | U25: 15.633419043865912 | V25: =U25-T25 -> 0.31341904386591146
A26: P.G. Nova | B26: 7500000 | C26: 7834412.6500000004 | D26: 5924551.9500000002 | F26: 6153431.1500000004 | G26: 6110992.6200000001 | H26: 5649542.0499999998 | J26: =IF(B26=0,0,((C26/B26)*100)-100) -> 4.4588353333333259 | K26: =IF(C26=0,0,IF(D26=0,0,((C26/D26)*100)-100)) -> 32.236373587710716 | L26: =IF(F26=0,0,((C26/F26)*100)-100) -> 27.317791635647055 | M26: =IF(G26=0,0,((C26/G26)*100)-100) -> 28.201965493455305 | N26: =IF(C26=0,0,IF(H26=0,0,((C26/H26)*100)-100)) -> 38.67341070591732 | P26: 7500000 | Q26: =IF(C26=0,0,IF(P26=0,0,((C26/P26)*100)-100)) -> 4.4588353333333259 | R26: =IF(C26=0,0,(C26/$C$41)*100) -> 4.8242602268145527 | T26: 15.27 | U26: 14.711169700768826 | V26: =U26-T26 -> -0.55883029923117356
A27: Nilo Pecanha | B27: 16500000 | C27: 17064447.16 | D27: 12965034.85 | F27: 15406385.18 | G27: 13997513.16 | H27: 13064867.76 | J27: =IF(B27=0,0,((C27/B27)*100)-100) -> 3.4208918787878844 | K27: =IF(C27=0,0,IF(D27=0,0,((C27/D27)*100)-100)) -> 31.618984117115588 | L27: =IF(F27=0,0,((C27/F27)*100)-100) -> 10.76217399881989 | M27: =IF(G27=0,0,((C27/G27)*100)-100) -> 21.910563433254879 | N27: =IF(C27=0,0,IF(H27=0,0,((C27/H27)*100)-100)) -> 30.613240588973269 | P27: 16500000 | Q27: =IF(C27=0,0,IF(P27=0,0,((C27/P27)*100)-100)) -> 3.4208918787878844 | R27: =IF(C27=0,0,(C27/$C$41)*100) -> 10.50791391829055 | T27: 15.301 | U27: 15.812307335246834 | V27: =U27-T27 -> 0.51130733524683336
A28: Champagnat | B28: 7500000 | C28: 7577672.4800000004 | D28: 6323508.0099999998 | F28: 7478729.2999999998 | G28: 7392448.1699999999 | H28: 6827319.4100000001 | J28: =IF(B28=0,0,((C28/B28)*100)-100) -> 1.0356330666666764 | K28: =IF(C28=0,0,IF(D28=0,0,((C28/D28)*100)-100)) -> 19.833365720683261 | L28: =IF(F28=0,0,((C28/F28)*100)-100) -> 1.3229945359835398 | M28: =IF(G28=0,0,((C28/G28)*100)-100) -> 2.5055882130046854 | N28: =IF(C28=0,0,IF(H28=0,0,((C28/H28)*100)-100)) -> 10.990449178354766 | P28: 7500000 | Q28: =IF(C28=0,0,IF(P28=0,0,((C28/P28)*100)-100)) -> 1.0356330666666764 | R28: =IF(C28=0,0,(C28/$C$41)*100) -> 4.6661652366615121 | T28: 16.4 | U28: 16.359393379324306 | V28: =U28-T28 -> -4.060662067569254E-2
A29: Santa Candida | B29: 9800000 | C29: 10285120.699999999 | D29: 7561406.0999999996 | F29: 8640009.5399999991 | G29: 7079067.3099999996 | H29: 6642182.5300000003 | J29: =IF(B29=0,0,((C29/B29)*100)-100) -> 4.9502112244897916 | K29: =IF(C29=0,0,IF(D29=0,0,((C29/D29)*100)-100)) -> 36.02127122890542 | L29: =IF(F29=0,0,((C29/F29)*100)-100) -> 19.040617401910879 | M29: =IF(G29=0,0,((C29/G29)*100)-100) -> 45.289206184988245 | N29: =IF(C29=0,0,IF(H29=0,0,((C29/H29)*100)-100)) -> 54.845499254896254 | P29: 9800000 | Q29: =IF(C29=0,0,IF(P29=0,0,((C29/P29)*100)-100)) -> 4.9502112244897916 | R29: =IF(C29=0,0,(C29/$C$41)*100) -> 6.333352726958676 | T29: 16.16 | U29: 15.291916214459206 | V29: =U29-T29 -> -0.86808378554079368
A30: Paranaguá Raia | B30: 9800000 | C30: 11051614.77 | D30: 7338451.3499999996 | F30: 9502619.0099999998 | G30: 8225730.3399999999 | H30: 7828702.9699999997 | J30: =IF(B30=0,0,((C30/B30)*100)-100) -> 12.771579285714282 | K30: =IF(C30=0,0,IF(D30=0,0,((C30/D30)*100)-100)) -> 50.598733205473934 | L30: =IF(F30=0,0,((C30/F30)*100)-100) -> 16.300724656749125 | M30: =IF(G30=0,0,((C30/G30)*100)-100) -> 34.354207021087433 | N30: =IF(C30=0,0,IF(H30=0,0,((C30/H30)*100)-100)) -> 41.167889653629288 | P30: 9800000 | Q30: =IF(C30=0,0,IF(P30=0,0,((C30/P30)*100)-100)) -> 12.771579285714282 | R30: =IF(C30=0,0,(C30/$C$41)*100) -> 6.8053430370414887 | T30: 17.797000000000001 | U30: 16.636856950452682 | V30: =U30-T30 -> -1.1601430495473188
A31: Novo Mundo | B31: 7350000 | C31: 7077384.29 | D31: 5457017.9000000004 | F31: 6667827.6600000001 | G31: 0 | H31: 0 | J31: =IF(B31=0,0,((C31/B31)*100)-100) -> -3.7090572789115583 | K31: =IF(C31=0,0,IF(D31=0,0,((C31/D31)*100)-100)) -> 29.693257740642565 | L31: =IF(F31=0,0,((C31/F31)*100)-100) -> 6.1422797781189189 | M31: =IF(G31=0,0,((C31/G31)*100)-100) -> 0 | N31: =IF(C31=0,0,IF(H31=0,0,((C31/H31)*100)-100)) -> 0 | P31: 7350000 | Q31: =IF(C31=0,0,IF(P31=0,0,((C31/P31)*100)-100)) -> -3.7090572789115583 | R31: =IF(C31=0,0,(C31/$C$41)*100) -> 4.3580986942434219 | T31: 15.1 | U31: 15.363130154403414 | V31: =U31-T31 -> 0.26313015440341481
A32: Uvaranas | B32: 6700000 | C32: 7298283.8099999996 | D32: 5320517.85 | F32: 5949869.7199999997 | G32: 0 | H32: 0 | J32: =IF(B32=0,0,((C32/B32)*100)-100) -> 8.929609104477592 | K32: =IF(C32=0,0,IF(D32=0,0,((C32/D32)*100)-100)) -> 37.172433506636935 | L32: =IF(F32=0,0,((C32/F32)*100)-100) -> 22.662917903351996 | M32: =IF(G32=0,0,((C32/G32)*100)-100) -> 0 | N32: =IF(C32=0,0,IF(H32=0,0,((C32/H32)*100)-100)) -> 0 | P32: 6700000 | Q32: =IF(C32=0,0,IF(P32=0,0,((C32/P32)*100)-100)) -> 8.929609104477592 | R32: =IF(C32=0,0,(C32/$C$41)*100) -> 4.4941237947923991 | T32: 15.45 | U32: 14.773700339285655 | V32: =U32-T32 -> -0.67629966071434389
A33: Torres | B33: 7350000 | C33: 7618618.4000000004 | D33: 5576626.3099999996 | F33: 6528879.3300000001 | G33: 7855805.2000000002 | H33: 0 | J33: =IF(B33=0,0,((C33/B33)*100)-100) -> 3.6546721088435419 | K33: =IF(C33=0,0,IF(D33=0,0,((C33/D33)*100)-100)) -> 36.616979092508018 | L33: =IF(F33=0,0,((C33/F33)*100)-100) -> 16.691058525047069 | M33: =IF(G33=0,0,((C33/G33)*100)-100) -> -3.0192551108573724 | N33: =IF(C33=0,0,IF(H33=0,0,((C33/H33)*100)-100)) -> 0 | P33: 7350000 | Q33: =IF(C33=0,0,IF(P33=0,0,((C33/P33)*100)-100)) -> 3.6546721088435419 | R33: =IF(C33=0,0,(C33/$C$41)*100) -> 4.6913788400458492 | T33: 15.6959 | U33: 15.817281779069022 | V33: =U33-T33 -> 0.12138177906902214
A34: Total Hiper | B34: =SUM(B22:B33) -> 98149999 | C34: =SUM(C22:C33) -> 102161999.47000001 | D34: =SUM(D22:D33) -> 76587908.519999996 | F34: =SUM(F22:F33) -> 90617882.539999992 | G34: =SUM(G22:G33) -> 71695355.49000001 | H34: =SUM(H22:H33) -> 60815935.579999998 | I34: =SUM(B34:H34) -> 500029080.59999996 | J34: =IF(C34=0,0,((C34/B34)*100)-100) -> 4.0876215087888284 | K34: =IF(C34=0,0,IF(D34=0,0,((C34/D34)*100)-100)) -> 33.391812681921806 | L34: =IF(F34=0,0,IF(C34=0,0,((C34/F34)*100)-100)) -> 12.73933643826237 | M34: =IF(G34=0,0,IF(C34=0,0,((C34/G34)*100)-100)) -> 42.494585279306506 | N34: =IF(C34=0,0,IF(H34=0,0,((C34/H34)*100)-100)) -> 67.985575648362015 | P34: =SUM(P22:P33) -> 98150000 | Q34: =IF(C34=0,0,((C34/P34)*100)-100) -> 4.0876204482934497 | R34: =IF(C34=0,0,(C34/$C$41)*100) -> 62.909128323100326 | T34: 15.888707386447351 | U34: 15.615038617841959 | V34: =U34-T34 -> -0.27366876860539158
A35: Total s/ 25,27,30 | B35: =B21+B34 -> 147099997 | C35: =C21+C34 -> 153104417.84 | D35: =D21+D34 -> 116046641.50999999 | E35: =E21+E34 -> 0 | F35: =F21+F34 -> 133729305.42 | G35: =G21+G34 -> 108638962.78 | H35: =H21+H34 -> 92073213.75 | I35: =SUM(B35:H35) -> 750692538.29999995 | J35: =IF(C35=0,0,((C35/B35)*100)-100) -> 4.0818633327368588 | K35: =IF(C35=0,0,IF(D35=0,0,((C35/D35)*100)-100)) -> 31.933519012531406 | L35: =IF(F35=0,0,IF(C35=0,0,((C35/F35)*100)-100)) -> 14.488307076111042 | M35: =IF(G35=0,0,IF(C35=0,0,((C35/G35)*100)-100)) -> 40.929565159826723 | N35: =IF(C35=0,0,IF(H35=0,0,((C35/H35)*100)-100)) -> 66.285515194151685 | P35: =P21+P34 -> 147100000 | Q35: =IF(C35=0,0,((C35/P35)*100)-100) -> 4.0818612100611773 | R35: =IF(C35=0,0,(C35/$C$41)*100) -> 94.278357106337566 | T35: 16.082437741951825 | U35: 15.568977072177212 | V35: =U35-T35 -> -0.51346066977461291
A36: Centenario | B36: 0 | C36: 0 | D36: 0 | F36: 1449006.26 | G36: 1345448.57 | H36: 1299733.07 | J36: =IF(B36=0,0,((C36/B36)*100)-100) -> 0 | K36: =IF(C36=0,0,IF(D36=0,0,((C36/D36)*100)-100)) -> 0 | L36: =IF(F36=0,0,((C36/F36)*100)-100) -> -100 | M36: =IF(G36=0,0,((C36/G36)*100)-100) -> -100 | N36: =IF(C36=0,0,IF(H36=0,0,((C36/H36)*100)-100)) -> 0 | P36: 0.45 | Q36: =IF(P36=0,0,IF(C36=0,0,((C36/P36)*100)-100)) -> 0 | R36: =IF(C36=0,0,(C36/$C$41)*100) -> 0 | T36: 0 | U36: 0 | V36: =U36-T36 -> 0
A37: Cajuru | B37: 5300000 | C37: 5559588.2400000002 | D37: 4118205.6 | F37: 0 | G37: 0 | H37: 0 | J37: =IF(B37=0,0,((C37/B37)*100)-100) -> 4.8978913207547095 | K37: =IF(C37=0,0,IF(D37=0,0,((C37/D37)*100)-100)) -> 35.000259336250735 | L37: =IF(F37=0,0,((C37/F37)*100)-100) -> 0 | M37: =IF(G37=0,0,((C37/G37)*100)-100) -> 0 | N37: =IF(C37=0,0,IF(H37=0,0,((C37/H37)*100)-100)) -> 0 | P37: 5300000 | Q37: =IF(P37=0,0,IF(C37=0,0,((C37/P37)*100)-100)) -> 4.8978913207547095 | R37: =IF(C37=0,0,(C37/$C$41)*100) -> 3.4234730313443364 | T37: 15.5 | U37: 14.985431726864723 | V37: =U37-T37 -> -0.51456827313527675
B38: 0 | C38: 0 | D38: 0 | F38: 0 | G38: 0 | H38: 0 | J38: =IF(B38=0,0,((C38/B38)*100)-100) -> 0 | K38: =IF(C38=0,0,IF(D38=0,0,((C38/D38)*100)-100)) -> 0 | L38: =IF(F38=0,0,((C38/F38)*100)-100) -> 0 | M38: =IF(G38=0,0,((C38/G38)*100)-100) -> 0 | N38: =IF(C38=0,0,IF(H38=0,0,((C38/H38)*100)-100)) -> 0 | P38: 0 | Q38: =IF(P38=0,0,IF(C38=0,0,((C38/P38)*100)-100)) -> 0 | R38: =IF(C38=0,0,(C38/$C$41)*100) -> 0 | T38: 0 | U38: 0 | V38: =U38-T38 -> 0
A39: Fazenda | B39: 3600000 | C39: 3732139.27 | D39: 2703629.19 | F39: 0 | G39: 0 | H39: 0 | J39: =IF(B39=0,0,((C39/B39)*100)-100) -> 3.6705352777777875 | K39: =IF(C39=0,0,IF(D39=0,0,((C39/D39)*100)-100)) -> 38.041832208506378 | L39: =IF(F39=0,0,((C39/F39)*100)-100) -> 0 | M39: =IF(G39=0,0,((C39/G39)*100)-100) -> 0 | N39: =IF(C39=0,0,IF(H39=0,0,((C39/H39)*100)-100)) -> 0 | P39: 3600000 | Q39: =IF(P39=0,0,IF(C39=0,0,((C39/P39)*100)-100)) -> 3.6705352777777875 | R39: =IF(C39=0,0,(C39/$C$41)*100) -> 2.2981698623181024 | T39: 15.5 | U39: 15.197428846217734 | V39: =U39-T39 -> -0.30257115378226551
A40: Total Lojas Novas | B40: =SUM(B36:B39) -> 8900000 | C40: =SUM(C36:C39) -> 9291727.5099999998 | D40: =SUM(D36:D39) -> 6821834.79 | F40: =SUM(F36:F39) -> 1449006.26 | G40: =SUM(G36:G39) -> 1345448.57 | H40: =SUM(H36:H39) -> 1299733.07 | J40: =IF(C40=0,0,((C40/B40)*100)-100) -> 4.4014326966292003 | K40: =IF(C40=0,0,IF(D40=0,0,((C40/D40)*100)-100)) -> 36.20569533024414 | L40: =IF(F40=0,0,IF(C40=0,0,((C40/F40)*100)-100)) -> 541.24826555269681 | M40: =IF(G40=0,0,IF(C40=0,0,((C40/G40)*100)-100)) -> 590.60443611010703 | N40: =IF(C40=0,0,IF(H40=0,0,((C40/H40)*100)-100)) -> 614.89505995257923 | P40: =SUM(P36:P39) -> 8900000.4499999993 | Q40: =IF(P40=0,0,IF(C40=0,0,((C40/P40)*100)-100)) -> 4.4014274179053672 | R40: =IF(C40=0,0,(C40/$C$41)*100) -> 5.7216428936624393 | T40: 15.5 | U40: 15.070583037362448 | V40: =U40-T40 -> -0.42941696263755169
A41: Total sem 29 | B41: =B21+B34+B40 -> 155999997 | C41: =C21+C34+C40 -> 162396145.34999999 | D41: =D21+D34+D40 -> 122868476.3 | F41: =F21+F34+F40 -> 135178311.68000001 | G41: =G21+G34+G40 -> 109984411.34999999 | H41: =H21+H34+H40 -> 93372946.819999993 | J41: =IF(C41=0,0,((C41/B41)*100)-100) -> 4.100095175001826 | K41: =IF(C41=0,0,IF(D41=0,0,((C41/D41)*100)-100)) -> 32.170716395544645 | L41: =IF(F41=0,0,IF(C41=0,0,((C41/F41)*100)-100)) -> 20.134763729281687 | M41: =IF(G41=0,0,IF(C41=0,0,((C41/G41)*100)-100)) -> 47.653784165113876 | N41: =IF(C41=0,0,IF(H41=0,0,((C41/H41)*100)-100)) -> 73.922052243954226 | P41: =P21+P34+P40 -> 156000000.44999999 | Q41: =IF(C41=0,0,((C41/P41)*100)-100) -> 4.1000928727882098 | R41: =R21+R34+R40 -> 100 | T41: 16.049208921419403 | U41: 15.540460745301798 | V41: =U41-T41 -> -0.5087481761176047
A43: Água Verde | B43: 5433342.7699999996 | C43: 5427705.3300000001 | D43: 0 | F43: 0 | G43: 0 | H43: 0 | J43: =IF(B43=0,0,((C43/B43)*100)-100) -> -0.1037563842120619 | K43: =IF(C43=0,0,IF(D43=0,0,((C43/D43)*100)-100)) -> 0 | L43: =IF(F43=0,0,((C43/F43)*100)-100) -> 0 | M43: =IF(G43=0,0,((C43/G43)*100)-100) -> 0 | N43: =IF(C43=0,0,IF(H43=0,0,((C43/H43)*100)-100)) -> 0 | P43: =C43 -> 5427705.3300000001 | Q43: =IF(C43=0,0,IF(P43=0,0,((C43/P43)*100)-100)) -> 0 | R43: =IF(C43=0,0,(C43/$C$41)*100) -> 3.3422624153437148 | T43: 14.9 | U43: 14.895626927853137 | V43: =U43-T43 -> -4.3730721468637768E-3
A44: Total Hiper | B44: =B41+B43 -> 161433339.77000001 | C44: =C41+C43 -> 167823850.68000001 | D44: =D41+D43 -> 122868476.3 | F44: =F41+F43 -> 135178311.68000001 | G44: =G41+G43 -> 109984411.34999999 | H44: =H41+H43 -> 93372946.819999993 | I44: =SUM(B44:H44) -> 790661336.60000014 | J44: =IF(C44=0,0,((C44/B44)*100)-100) -> 3.958606641666961 | K44: =IF(C44=0,0,IF(D44=0,0,((C44/D44)*100)-100)) -> 36.588208573723477 | L44: =IF(F44=0,0,IF(C44=0,0,((C44/F44)*100)-100)) -> 24.149982785167452 | M44: =IF(G44=0,0,IF(C44=0,0,((C44/G44)*100)-100)) -> 52.588761098097194 | N44: =IF(C44=0,0,IF(H44=0,0,((C44/H44)*100)-100)) -> 79.734983628098377 | P44: =P41+P43 -> 161427705.78 | Q44: =IF(C44=0,0,((C44/P44)*100)-100) -> 3.9622349020538792 | R44: =IF(C44=0,0,(C44/$C$41)*100) -> 103.34226241534373 | T44: 16.010530133051958 | U44: 15.519605736113595 | V44: =U44-T44 -> -0.49092439693836276