A2: Perodo: | C2: 37895 | E2: 37925 | H2: Vendas Acumuladas por Filial
C4: Vendas 2003 | G4: Vendas de Anos Anteriores | K4: Percentuais ( % ) | R4: %
A5: Lojas | C5: Previso | D5: Realizada | E5: Ms Anterior | G5: Vendas 2002 | H5: Vendas 2001 | I5: Vendas 2000 | K5: % Prev | L5: % MA | M5: 2002 | N5: 2001 | O5: 2000 | Q5: Previso Ms | R5: Final | S5: Part.
A7: Xaxim | C7: 780000 | D7: 767207.89 | E7: 766681.35 | G7: 576548.96 | H7: 570885.97 | I7: 543251.76 | K7: =IF(C7=0,0,((D7/C7)*100)-100) -> -1.64 | L7: =IF(E7=0,0,((D7/E7)*100)-100) -> 00.07 | M7: =IF(G7=0,0,((D7/G7)*100)-100) -> 33.07 | N7: =IF(H7=0,0,((D7/H7)*100)-100) -> 34.39 | O7: =IF(I7=0,0,((D7/I7)*100)-100) -> 41.23 | Q7: 780000 | R7: =((D7/Q7)*100)-100 -> -1.64 | S7: =D7/$D$31*100 -> 1.73
A8: S. Felicidade | C8: 830000 | D8: 754044.63 | E8: 725570.5 | G8: 677917.87 | H8: 564842.62 | I8: 632651.75 | K8: =IF(C8=0,0,((D8/C8)*100)-100) -> -9.15 | L8: =IF(E8=0,0,((D8/E8)*100)-100) -> 3.92 | M8: =IF(G8=0,0,((D8/G8)*100)-100) -> 11.23 | N8: =IF(H8=0,0,((D8/H8)*100)-100) -> 33.5 | O8: =IF(I8=0,0,((D8/I8)*100)-100) -> 19.19 | Q8: 830000 | R8: =((D8/Q8)*100)-100 -> -9.15 | S8: =D8/$D$31*100 -> 1.7
A9: Lapa | C9: 1250000 | D9: 1073489.46 | E9: 1003326.57 | G9: 950161.38 | H9: 806651.09 | I9: 643758.86 | K9: =IF(C9=0,0,((D9/C9)*100)-100) -> -14.12 | L9: =IF(E9=0,0,((D9/E9)*100)-100) -> 6.99 | M9: =IF(G9=0,0,((D9/G9)*100)-100) -> 12.98 | N9: =IF(H9=0,0,((D9/H9)*100)-100) -> 33.08 | O9: =IF(I9=0,0,((D9/I9)*100)-100) -> 66.75 | Q9: 1250000 | R9: =((D9/Q9)*100)-100 -> -14.12 | S9: =D9/$D$31*100 -> 2.42
A10: Araucria | C10: 1260000 | D10: 1018622.79 | E10: 977420.80000000005 | G10: 1005276.57 | H10: 1559502.06 | I10: 1348995.82 | K10: =IF(C10=0,0,((D10/C10)*100)-100) -> -19.16 | L10: =IF(E10=0,0,((D10/E10)*100)-100) -> 4.22 | M10: =IF(G10=0,0,((D10/G10)*100)-100) -> 1.33 | N10: =IF(H10=0,0,((D10/H10)*100)-100) -> -34.68 | O10: =IF(I10=0,0,((D10/I10)*100)-100) -> -24.49 | Q10: 1260000 | R10: =((D10/Q10)*100)-100 -> -19.16 | S10: =D10/$D$31*100 -> 2.29
A11: Pinheirinho | C11: 2050000 | D11: 1786580.83 | E11: 1783647.28 | G11: 1687899.35 | H11: 1537182.98 | I11: 1671039.49 | K11: =IF(C11=0,0,((D11/C11)*100)-100) -> -12.85 | L11: =IF(E11=0,0,((D11/E11)*100)-100) -> 00.16 | M11: =IF(G11=0,0,((D11/G11)*100)-100) -> 5.85 | N11: =IF(H11=0,0,((D11/H11)*100)-100) -> 16.22 | O11: =IF(I11=0,0,((D11/I11)*100)-100) -> 6.91 | Q11: 2050000 | R11: =((D11/Q11)*100)-100 -> -12.85 | S11: =D11/$D$31*100 -> 4.02
A12: Hauer | C12: 3100000 | D12: 3066143.6 | E12: 2898502.45 | G12: 2578053.06 | H12: 2408459.51 | I12: 2163790.73 | K12: =IF(C12=0,0,((D12/C12)*100)-100) -> -1.09 | L12: =IF(E12=0,0,((D12/E12)*100)-100) -> 5.78 | M12: =IF(G12=0,0,((D12/G12)*100)-100) -> 18.93 | N12: =IF(H12=0,0,((D12/H12)*100)-100) -> 27.31 | O12: =IF(I12=0,0,((D12/I12)*100)-100) -> 41.7 | Q12: 3100000 | R12: =((D12/Q12)*100)-100 -> -1.09 | S12: =D12/$D$31*100 -> 6.9
A13: Paranagu | C13: 3300000 | D13: 3136877.33 | E13: 2949277.7 | G13: 3047458.92 | H13: 2744627.2000000002 | I13: 2025476.32 | K13: =IF(C13=0,0,((D13/C13)*100)-100) -> -4.94 | L13: =IF(E13=0,0,((D13/E13)*100)-100) -> 6.36 | M13: =IF(G13=0,0,((D13/G13)*100)-100) -> 2.93 | N13: =IF(H13=0,0,((D13/H13)*100)-100) -> 14.29 | O13: =IF(I13=0,0,((D13/I13)*100)-100) -> 54.87 | Q13: 3300000 | R13: =((D13/Q13)*100)-100 -> -4.94 | S13: =D13/$D$31*100 -> 7.06
A14: Centenrio | C14: 975000 | D14: 974981.33 | E14: 968754.95 | G14: 796004.15 | H14: 740913.06 | I14: 678628.99 | K14: =IF(C14=0,0,((D14/C14)*100)-100) -> 0 | L14: =IF(E14=0,0,((D14/E14)*100)-100) -> 00.64 | M14: =IF(G14=0,0,((D14/G14)*100)-100) -> 22.48 | N14: =IF(H14=0,0,((D14/H14)*100)-100) -> 31.59 | O14: =IF(I14=0,0,((D14/I14)*100)-100) -> 43.67 | Q14: 975000 | R14: =((D14/Q14)*100)-100 -> 0 | S14: =D14/$D$31*100 -> 2.2
A15: So Brz | C15: 3300000 | D15: 3130319.22 | E15: 2929932.44 | G15: 2636563.14 | H15: 2416193.17 | I15: 2329184.68 | K15: =IF(C15=0,0,((D15/C15)*100)-100) -> -5.14 | L15: =IF(E15=0,0,((D15/E15)*100)-100) -> 6.84 | M15: =IF(G15=0,0,((D15/G15)*100)-100) -> 18.73 | N15: =IF(H15=0,0,((D15/H15)*100)-100) -> 29.56 | O15: =IF(I15=0,0,((D15/I15)*100)-100) -> 34.4 | Q15: 3300000 | R15: =((D15/Q15)*100)-100 -> -5.14 | S15: =D15/$D$31*100 -> 7.05
A16: Arapongas | C16: 650000 | D16: 471750.67 | E16: 567546.12 | G16: 535712.17 | H16: 525431 | I16: 512017.71 | K16: =IF(C16=0,0,((D16/C16)*100)-100) -> -27.42 | L16: =IF(E16=0,0,((D16/E16)*100)-100) -> -16.88 | M16: =IF(G16=0,0,((D16/G16)*100)-100) -> -11.94 | N16: =IF(H16=0,0,((D16/H16)*100)-100) -> -10.22 | O16: =IF(I16=0,0,((D16/I16)*100)-100) -> -7.86 | Q16: 650000 | R16: =((D16/Q16)*100)-100 -> -27.42 | S16: =D16/$D$31*100 -> 1.06
A17: Guarapuava | C17: 1450000 | D17: 1396245.35 | E17: 1198167.57 | G17: 1071901.62 | H17: 850680.37 | I17: 917160.62 | K17: =IF(C17=0,0,((D17/C17)*100)-100) -> -3.71 | L17: =IF(E17=0,0,((D17/E17)*100)-100) -> 16.53 | M17: =IF(G17=0,0,((D17/G17)*100)-100) -> 30.26 | N17: =IF(H17=0,0,((D17/H17)*100)-100) -> 64.13 | O17: =IF(I17=0,0,((D17/I17)*100)-100) -> 52.24 | Q17: 1450000 | R17: =((D17/Q17)*100)-100 -> -3.71 | S17: =D17/$D$31*100 -> 3.14
A18: Apucarana | C18: 1500000 | D18: 1403236.24 | E18: 1349913.63 | G18: 1269616.22 | H18: 1125887.79 | I18: 1220208.5 | K18: =IF(C18=0,0,((D18/C18)*100)-100) -> -6.45 | L18: =IF(E18=0,0,((D18/E18)*100)-100) -> 3.95 | M18: =IF(G18=0,0,((D18/G18)*100)-100) -> 10.52 | N18: =IF(H18=0,0,((D18/H18)*100)-100) -> 24.63 | O18: =IF(I18=0,0,((D18/I18)*100)-100) -> 15 | Q18: 1500000 | R18: =((D18/Q18)*100)-100 -> -6.45 | S18: =D18/$D$31*100 -> 3.16
A19: Ah | C19: 1450000 | D19: 1312830.43 | E19: 1250461.28 | G19: 1112568.55 | H19: 1313085.34 | I19: 1219063.35 | K19: =IF(C19=0,0,((D19/C19)*100)-100) -> -9.46 | L19: =IF(E19=0,0,((D19/E19)*100)-100) -> 4.99 | M19: =IF(G19=0,0,((D19/G19)*100)-100) -> 18 | N19: =IF(H19=0,0,((D19/H19)*100)-100) -> -00.02 | O19: =IF(I19=0,0,((D19/I19)*100)-100) -> 7.69 | Q19: 1450000 | R19: =((D19/Q19)*100)-100 -> -9.46 | S19: =D19/$D$31*100 -> 2.96
A20: P.G. Centro | C20: 1800000 | D20: 1685033.92 | E20: 1621539.08 | G20: 1427395.17 | H20: 1172555.14 | I20: 1229802.63 | K20: =IF(C20=0,0,((D20/C20)*100)-100) -> -6.39 | L20: =IF(E20=0,0,((D20/E20)*100)-100) -> 3.92 | M20: =IF(G20=0,0,((D20/G20)*100)-100) -> 18.05 | N20: =IF(H20=0,0,((D20/H20)*100)-100) -> 43.71 | O20: =IF(I20=0,0,((D20/I20)*100)-100) -> 37.02 | Q20: 1800000 | R20: =((D20/Q20)*100)-100 -> -6.39 | S20: =D20/$D$31*100 -> 3.79
A21: Maring | C21: 2270000 | D21: 2074674.78 | E21: 2148664.18 | G21: 1917077.84 | H21: 1666612.91 | I21: 1631549.09 | K21: =IF(C21=0,0,((D21/C21)*100)-100) -> -8.6 | L21: =IF(E21=0,0,((D21/E21)*100)-100) -> -3.44 | M21: =IF(G21=0,0,((D21/G21)*100)-100) -> 8.22 | N21: =IF(H21=0,0,((D21/H21)*100)-100) -> 24.48 | O21: =IF(I21=0,0,((D21/I21)*100)-100) -> 27.16 | Q21: 2270000 | R21: =((D21/Q21)*100)-100 -> -8.6 | S21: =D21/$D$31*100 -> 4.67
A22: Araucria Nova | C22: 2150000 | D22: 1944219.72 | E22: 1771505.39 | G22: 1780480.88 | H22: 0 | I22: 0 | K22: =IF(C22=0,0,((D22/C22)*100)-100) -> -9.57 | L22: =IF(E22=0,0,((D22/E22)*100)-100) -> 9.75 | M22: =IF(G22=0,0,((D22/G22)*100)-100) -> 9.2 | N22: =IF(H22=0,0,((D22/H22)*100)-100) -> 0 | O22: =IF(I22=0,0,((D22/I22)*100)-100) -> 0 | Q22: 2150000 | R22: =((D22/Q22)*100)-100 -> -9.57 | S22: =D22/$D$31*100 -> 4.38
A23: Total Super | C23: =SUM(C7:C22) -> 28115000 | D23: =SUM(D7:D22) -> 25996258.190000001 | E23: =SUM(E7:E22) -> 24910911.289999999 | G23: =SUM(G7:G22) -> 23070635.850000001 | H23: =SUM(H7:H22) -> 20003510.210000001 | I23: =SUM(I7:I22) -> 18766580.300000001 | J23: =SUM(C23:I23) -> 140862895.84 | K23: =((D23/C23)*100)-100 -> -7.54 | L23: =IF(E23=0,0,((D23/E23)*100)-100) -> 4.36 | M23: =((D23/G23)*100)-100 -> 12.68 | N23: =((D23/H23)*100)-100 -> 29.96 | O23: =IF(I23=0,0,((D23/I23)*100)-100) -> 38.52 | Q23: =SUM(Q7:Q22) -> 28115000 | R23: =((D23/Q23)*100)-100 -> -7.54 | S23: =D23/$D$31*100 -> 58.54
A25: Londrina | C25: 2570000 | D25: 2263517.14 | E25: 2267200.38 | G25: 2171009.87 | H25: 1924035.39 | I25: 2766236.2 | K25: =IF(C25=0,0,((D25/C25)*100)-100) -> -11.93 | L25: =IF(E25=0,0,((D25/E25)*100)-100) -> -00.16 | M25: =IF(G25=0,0,((D25/G25)*100)-100) -> 4.26 | N25: =IF(H25=0,0,((D25/H25)*100)-100) -> 17.64 | O25: =IF(I25=0,0,((D25/I25)*100)-100) -> -18.17 | Q25: 2570000 | R25: =((D25/Q25)*100)-100 -> -11.93 | S25: =D25/$D$31*100 -> 5.1
A26: S.J. Pinhais | C26: 4400000 | D26: 4232056.53 | E26: 3902807.35 | G26: 3645420.62 | H26: 3044573.9 | I26: 1811814.94 | K26: =IF(C26=0,0,((D26/C26)*100)-100) -> -3.82 | L26: =IF(E26=0,0,((D26/E26)*100)-100) -> 8.44 | M26: =IF(G26=0,0,((D26/G26)*100)-100) -> 16.09 | N26: =IF(H26=0,0,((D26/H26)*100)-100) -> 39 | O26: =IF(I26=0,0,((D26/I26)*100)-100) -> 133.58 | Q26: 4400000 | R26: =((D26/Q26)*100)-100 -> -3.82 | S26: =D26/$D$31*100 -> 9.53
A27: P.G. Nova | C27: 3450000 | D27: 3144267.2 | E27: 2828673.94 | G27: 3093350.35 | H27: 2415180.4 | I27: 1877316.35 | K27: =IF(C27=0,0,((D27/C27)*100)-100) -> -8.86 | L27: =IF(E27=0,0,((D27/E27)*100)-100) -> 11.16 | M27: =IF(G27=0,0,((D27/G27)*100)-100) -> 1.65 | N27: =IF(H27=0,0,((D27/H27)*100)-100) -> 30.19 | O27: =IF(I27=0,0,((D27/I27)*100)-100) -> 67.49 | Q27: 3450000 | R27: =((D27/Q27)*100)-100 -> -8.86 | S27: =D27/$D$31*100 -> 7.08
A28: Nilo Peanha | C28: 9000000 | D28: 8773217.8900000006 | E28: 7819661.0300000003 | G28: 6720514.0499999998 | H28: 0 | I28: 0 | K28: =IF(C28=0,0,((D28/C28)*100)-100) -> -2.52 | L28: =IF(E28=0,0,((D28/E28)*100)-100) -> 12.19 | M28: =IF(G28=0,0,((D28/G28)*100)-100) -> 30.54 | N28: =IF(H28=0,0,((D28/H28)*100)-100) -> 0 | O28: =IF(I28=0,0,((D28/I28)*100)-100) -> 0 | Q28: 9000000 | R28: =((D28/Q28)*100)-100 -> -2.52 | S28: =D28/$D$31*100 -> 19.76
A29: Total Hiper | C29: =SUM(C25:C28) -> 19420000 | D29: =SUM(D25:D28) -> 18413058.760000002 | E29: =SUM(E25:E28) -> 16818342.699999999 | G29: =SUM(G25:G28) -> 15630294.890000001 | H29: =SUM(H25:H28) -> 7383789.6900000004 | I29: =SUM(I25:I28) -> 6455367.4900000002 | J29: =SUM(C29:I29) -> 84120853.530000001 | K29: =((D29/C29)*100)-100 -> -5.19 | L29: =IF(E29=0,0,((D29/E29)*100)-100) -> 9.48 | M29: =((D29/G29)*100)-100 -> 17.8 | N29: =((D29/H29)*100)-100 -> 149.37 | O29: =IF(I29=0,0,((D29/I29)*100)-100) -> 185.24 | Q29: =SUM(Q25:Q28) -> 19420000 | R29: =((D29/Q29)*100)-100 -> -5.19 | S29: =D29/$D$31*100 -> 41.46
A31: Total Geral | C31: =C23+C29 -> 47535000 | D31: =D23+D29 -> 44409316.950000003 | E31: =E23+E29 -> 41729253.990000002 | G31: =G23+G29 -> 38700930.740000002 | H31: =H23+H29 -> 27387299.899999999 | I31: =I23+I29 -> 25221947.789999999 | K31: =((D31/C31)*100)-100 -> -6.58 | L31: =IF(E31=0,0,((D31/E31)*100)-100) -> 6.42 | M31: =((D31/G31)*100)-100 -> 14.75 | N31: =((D31/H31)*100)-100 -> 62.15 | O31: =IF(I31=0,0,((D31/I31)*100)-100) -> 76.07 | Q31: =Q23+Q29 -> 47535000 | R31: =((D31/Q31)*100)-100 -> -6.58 | S31: =S23+S29 -> 100
C32: Resumo por Regio - Outubro/2002
C33: Descrio das Aberturas | H33: Valor | I33: %
C34: Curitiba (2,3,6,7,10,11,17,21) | H34: =D7+D8+D11+D12+D14+D15+D19+D28 -> 20565326 | I34: =H34/$D$31 -> 0.46310000000000001
C35: Curitiba e Metrop. (Ctba. 4,5,8,14,23) | H35: =H34+D9+D10+D13+D27+D22 -> 30882803 | I35: =H35/$D$31 -> 0.69540000000000002
C36: Metropolitana (4,5,8,14,23) | H36: =H35-H34 -> 10317477 | I36: =H36/$D$31 -> 0.23230000000000001
C37: Norte (9,12,15,20) | H37: =D25+D16+D18+D22 -> 6082724 | I37: =H37/$D$31 -> 0.13700000000000001
C38: Centro-Oeste (13,18,19) | H38: =D17+D20+D27 -> 6225546 | I38: =H38/$D$31 -> 0.14019999999999999
C39: Ponta Grossa (18,19) | H39: =H38-D17 -> 4829301 | I39: =H39/$D$31 -> 0.1087
C40: Super (2,3,4,5,6,7,8,10,11,12,13,15,17,18,20,23) | H40: =D23 -> 25996258 | I40: =H40/$D$31 -> 0.58540000000000003
C41: Hiper (9,14,19,21) | H41: =D29 -> 18413059 | I41: =H41/$D$31 -> 0.41460000000000002
C42: Curitiba, Metropolitana e Centro-Oeste | H42: =D31-H37 -> 38326593 | I42: =H42/$D$31 -> 0.86299999999999999
C43: Araucria | H43: =D10+D22 -> 2962843 | I43: =H43/$D$31 -> 6.6699999999999995E-2