A2: Periodo: | C2: 40087 | D2: a | E2: 31/10/2009 | H2: Vendas Acumuladas por Filial | Q2: =NOW() -> 40118.306673495397
A4: v.1 | C4: Vendas 2009 | G4: Vendas de Anos Anteriores | K4: Percentuais ( % ) | Q4: Meta Mensal | U4: Margem
A5: Lojas | C5: Previsao | D5: Realizada | E5: Mes Anterior | G5: Vendas 2008 | H5: Vendas 2007 | I5: Vendas 2006 | K5: % Prev | L5: % MA | M5: 2008 | N5: 2007 | O5: 2006 | Q5: Previsao Mes | R5: Final | S5: Part. | U5: Meta | V5: Coml | W5: Dif
A7: S. Felicidade | C7: 2950000 | D7: 2887927 | E7: 2668612 | G7: 2399250 | H7: 2006223 | I7: 839141 | K7: =IF(C7=0,0,((D7/C7)*100)-100) -> -2.1 | L7: =IF(D7=0,0,IF(E7=0,0,((D7/E7)*100)-100)) -> 8.22 | M7: =IF(G7=0,0,((D7/G7)*100)-100) -> 20.37 | N7: =IF(H7=0,0,((D7/H7)*100)-100) -> 43.95 | O7: =IF(D7=0,0,IF(I7=0,0,((D7/I7)*100)-100)) -> 244.15 | Q7: 2950000 | R7: =IF(D7=0,0,((D7/Q7)*100)-100) -> -2.1 | S7: =IF(D7=0,0,(D7/$D$44)*100) -> 2.66 | U7: 16.5 | V7: 16.31 | W7: =V7-U7 -> -0.19
A8: Lapa | C8: 2300000 | D8: 2329149 | E8: 2099593 | G8: 1926360 | H8: 1469223 | I8: 1101152 | K8: =IF(C8=0,0,((D8/C8)*100)-100) -> 1.27 | L8: =IF(D8=0,0,IF(E8=0,0,((D8/E8)*100)-100)) -> 10.93 | M8: =IF(G8=0,0,((D8/G8)*100)-100) -> 20.91 | N8: =IF(H8=0,0,((D8/H8)*100)-100) -> 58.53 | O8: =IF(D8=0,0,IF(I8=0,0,((D8/I8)*100)-100)) -> 111.52 | Q8: 1900000 | R8: =IF(D8=0,0,((D8/Q8)*100)-100) -> 22.59 | S8: =IF(D8=0,0,(D8/$D$44)*100) -> 2.14 | U8: 15.74 | V8: 15.09 | W8: =V8-U8 -> -0.65
A9: Araucaria | C9: 1400000 | D9: 1344868 | E9: 1261606 | G9: 1182225 | H9: 1007328 | I9: 870513 | K9: =IF(C9=0,0,((D9/C9)*100)-100) -> -3.94 | L9: =IF(D9=0,0,IF(E9=0,0,((D9/E9)*100)-100)) -> 6.6 | M9: =IF(G9=0,0,((D9/G9)*100)-100) -> 13.76 | N9: =IF(H9=0,0,((D9/H9)*100)-100) -> 33.51 | O9: =IF(D9=0,0,IF(I9=0,0,((D9/I9)*100)-100)) -> 54.49 | Q9: 1400000 | R9: =IF(D9=0,0,((D9/Q9)*100)-100) -> -3.94 | S9: =IF(D9=0,0,(D9/$D$44)*100) -> 1.24 | U9: 17.2 | V9: 16.07 | W9: =V9-U9 -> -1.13
A10: Hauer | C10: 4300000 | D10: 3853252 | E10: 3658403 | G10: 3880592 | H10: 3244185 | I10: 2984393 | K10: =IF(C10=0,0,((D10/C10)*100)-100) -> -10.39 | L10: =IF(D10=0,0,IF(E10=0,0,((D10/E10)*100)-100)) -> 5.33 | M10: =IF(G10=0,0,((D10/G10)*100)-100) -> -0.7 | N10: =IF(H10=0,0,((D10/H10)*100)-100) -> 18.77 | O10: =IF(D10=0,0,IF(I10=0,0,((D10/I10)*100)-100)) -> 29.11 | Q10: 4300000 | R10: =IF(D10=0,0,((D10/Q10)*100)-100) -> -10.39 | S10: =IF(D10=0,0,(D10/$D$44)*100) -> 3.55 | U10: 15.9 | V10: 15.54 | W10: =V10-U10 -> -0.36
A11: Paranagua | C11: 2140000 | D11: 2104447 | E11: 1993216 | G11: 1903589 | H11: 1758747 | I11: 1597490 | K11: =IF(C11=0,0,((D11/C11)*100)-100) -> -1.66 | L11: =IF(D11=0,0,IF(E11=0,0,((D11/E11)*100)-100)) -> 5.58 | M11: =IF(G11=0,0,((D11/G11)*100)-100) -> 10.55 | N11: =IF(H11=0,0,((D11/H11)*100)-100) -> 19.66 | O11: =IF(D11=0,0,IF(I11=0,0,((D11/I11)*100)-100)) -> 31.73 | Q11: 2140000 | R11: =IF(D11=0,0,((D11/Q11)*100)-100) -> -1.66 | S11: =IF(D11=0,0,(D11/$D$44)*100) -> 1.94 | U11: 17.9 | V11: 16.4 | W11: =V11-U11 -> -1.5
A12: Centenario | C12: 1380000 | D12: 1319094 | E12: 1231252 | G12: 1278312 | H12: 1084938 | I12: 926367 | K12: =IF(C12=0,0,((D12/C12)*100)-100) -> -4.41 | L12: =IF(D12=0,0,IF(E12=0,0,((D12/E12)*100)-100)) -> 7.13 | M12: =IF(G12=0,0,((D12/G12)*100)-100) -> 3.19 | N12: =IF(H12=0,0,((D12/H12)*100)-100) -> 21.58 | O12: =IF(D12=0,0,IF(I12=0,0,((D12/I12)*100)-100)) -> 42.39 | Q12: 1380000 | R12: =IF(D12=0,0,((D12/Q12)*100)-100) -> -4.41 | S12: =IF(D12=0,0,(D12/$D$44)*100) -> 1.21 | U12: 16.25 | V12: 14.59 | W12: =V12-U12 -> -1.66
A13: Sitio Cercado | C13: 2380000 | D13: 2336130 | E13: 2201172 | G13: 2003761 | H13: 1638747 | I13: 1219593 | K13: =IF(C13=0,0,((D13/C13)*100)-100) -> -1.84 | L13: =IF(D13=0,0,IF(E13=0,0,((D13/E13)*100)-100)) -> 6.13 | M13: =IF(G13=0,0,((D13/G13)*100)-100) -> 16.59 | N13: =IF(H13=0,0,((D13/H13)*100)-100) -> 42.56 | O13: =IF(D13=0,0,IF(I13=0,0,((D13/I13)*100)-100)) -> 91.55 | Q13: 2380000 | R13: =IF(D13=0,0,((D13/Q13)*100)-100) -> -1.84 | S13: =IF(D13=0,0,(D13/$D$44)*100) -> 2.15 | U13: 16.7 | V13: 15.21 | W13: =V13-U13 -> -1.49
A14: Apucarana | C14: 2799999 | D14: 2810676 | E14: 2561218 | G14: 2540969 | H14: 2377022 | I14: 1708661 | K14: =IF(C14=0,0,((D14/C14)*100)-100) -> 0.38 | L14: =IF(D14=0,0,IF(E14=0,0,((D14/E14)*100)-100)) -> 9.74 | M14: =IF(G14=0,0,((D14/G14)*100)-100) -> 10.61 | N14: =IF(H14=0,0,((D14/H14)*100)-100) -> 18.24 | O14: =IF(D14=0,0,IF(I14=0,0,((D14/I14)*100)-100)) -> 64.5 | Q14: 2800000 | R14: =IF(D14=0,0,((D14/Q14)*100)-100) -> 0.38 | S14: =IF(D14=0,0,(D14/$D$44)*100) -> 2.59 | U14: 17 | V14: 16.42 | W14: =V14-U14 -> -0.58
A15: Ah | C15: 1900000 | D15: 1749002 | E15: 1615544 | G15: 1645024 | H15: 1510695 | I15: 1115148 | K15: =IF(C15=0,0,((D15/C15)*100)-100) -> -7.95 | L15: =IF(D15=0,0,IF(E15=0,0,((D15/E15)*100)-100)) -> 8.26 | M15: =IF(G15=0,0,((D15/G15)*100)-100) -> 6.32 | N15: =IF(H15=0,0,((D15/H15)*100)-100) -> 15.77 | O15: =IF(D15=0,0,IF(I15=0,0,((D15/I15)*100)-100)) -> 56.84 | Q15: 1900000 | R15: =IF(D15=0,0,((D15/Q15)*100)-100) -> -7.95 | S15: =IF(D15=0,0,(D15/$D$44)*100) -> 1.61 | U15: 17.8 | V15: 15.95 | W15: =V15-U15 -> -1.85
A16: P.G. Centro | C16: 2280000 | D16: 1987870 | E16: 1869464 | G16: 2060524 | H16: 1900573 | I16: 1565581 | K16: =IF(C16=0,0,((D16/C16)*100)-100) -> -12.81 | L16: =IF(D16=0,0,IF(E16=0,0,((D16/E16)*100)-100)) -> 6.33 | M16: =IF(G16=0,0,((D16/G16)*100)-100) -> -3.53 | N16: =IF(H16=0,0,((D16/H16)*100)-100) -> 4.59 | O16: =IF(D16=0,0,IF(I16=0,0,((D16/I16)*100)-100)) -> 26.97 | Q16: 2280000 | R16: =IF(D16=0,0,((D16/Q16)*100)-100) -> -12.81 | S16: =IF(D16=0,0,(D16/$D$44)*100) -> 1.83 | U16: 17.62 | V16: 16.92 | W16: =V16-U16 -> -0.7
A17: Maringa | C17: 3199999 | D17: 3117598 | E17: 2923617 | G17: 3255576 | H17: 2509523 | I17: 2290307 | K17: =IF(C17=0,0,((D17/C17)*100)-100) -> -2.58 | L17: =IF(D17=0,0,IF(E17=0,0,((D17/E17)*100)-100)) -> 6.63 | M17: =IF(G17=0,0,((D17/G17)*100)-100) -> -4.24 | N17: =IF(H17=0,0,((D17/H17)*100)-100) -> 24.23 | O17: =IF(D17=0,0,IF(I17=0,0,((D17/I17)*100)-100)) -> 36.12 | Q17: 3200000 | R17: =IF(D17=0,0,((D17/Q17)*100)-100) -> -2.58 | S17: =IF(D17=0,0,(D17/$D$44)*100) -> 2.87 | U17: 18.2 | V17: 16.54 | W17: =V17-U17 -> -1.66
A18: Araucaria Nova | C18: 3900000 | D18: 3838778 | E18: 3436657 | G18: 3250246 | H18: 2441179 | I18: 2053774 | K18: =IF(C18=0,0,((D18/C18)*100)-100) -> -1.57 | L18: =IF(D18=0,0,IF(E18=0,0,((D18/E18)*100)-100)) -> 11.7 | M18: =IF(G18=0,0,((D18/G18)*100)-100) -> 18.11 | N18: =IF(H18=0,0,((D18/H18)*100)-100) -> 57.25 | O18: =IF(D18=0,0,IF(I18=0,0,((D18/I18)*100)-100)) -> 86.91 | Q18: 3900000 | R18: =IF(D18=0,0,((D18/Q18)*100)-100) -> -1.57 | S18: =IF(D18=0,0,(D18/$D$44)*100) -> 3.53 | U18: 16.3 | V18: 15.38 | W18: =V18-U18 -> -0.92
A19: Cristo Rei | C19: 2300000 | D19: 2206012 | E19: 1995501 | G19: 1840761 | H19: 1539865 | I19: 1493982 | K19: =IF(C19=0,0,((D19/C19)*100)-100) -> -4.09 | L19: =IF(D19=0,0,IF(E19=0,0,((D19/E19)*100)-100)) -> 10.55 | M19: =IF(G19=0,0,((D19/G19)*100)-100) -> 19.84 | N19: =IF(H19=0,0,((D19/H19)*100)-100) -> 43.26 | O19: =IF(D19=0,0,IF(I19=0,0,((D19/I19)*100)-100)) -> 47.66 | Q19: 2300000 | R19: =IF(D19=0,0,((D19/Q19)*100)-100) -> -4.09 | S19: =IF(D19=0,0,(D19/$D$44)*100) -> 2.03 | U19: 17.25 | V19: 16.85 | W19: =V19-U19 -> -0.4
A20: Campo Largo | C20: 3000000 | D20: 3485494 | E20: 3067593 | G20: 2389024 | H20: 0 | I20: 0 | K20: =IF(C20=0,0,((D20/C20)*100)-100) -> 16.18 | L20: =IF(D20=0,0,IF(E20=0,0,((D20/E20)*100)-100)) -> 13.62 | M20: =IF(G20=0,0,((D20/G20)*100)-100) -> 45.9 | N20: =IF(H20=0,0,((D20/H20)*100)-100) -> 0 | O20: =IF(D20=0,0,IF(I20=0,0,((D20/I20)*100)-100)) -> 0 | Q20: 3000000 | R20: =IF(D20=0,0,((D20/Q20)*100)-100) -> 16.18 | S20: =IF(D20=0,0,(D20/$D$44)*100) -> 3.21 | U20: 16.8 | V20: 16.27 | W20: =V20-U20 -> -0.53
A21: Brasilia | C21: 2800000 | D21: 2517461 | E21: 2384538 | G21: 2305239 | H21: 882289 | I21: 697681 | K21: =IF(C21=0,0,((D21/C21)*100)-100) -> -10.09 | L21: =IF(D21=0,0,IF(E21=0,0,((D21/E21)*100)-100)) -> 5.57 | M21: =IF(G21=0,0,((D21/G21)*100)-100) -> 9.21 | N21: =IF(H21=0,0,((D21/H21)*100)-100) -> 185.33 | O21: =IF(D21=0,0,IF(I21=0,0,((D21/I21)*100)-100)) -> 260.83 | Q21: 2800000 | R21: =IF(D21=0,0,((D21/Q21)*100)-100) -> -10.09 | S21: =IF(D21=0,0,(D21/$D$44)*100) -> 2.32 | U21: 16.7 | V21: 15.54 | W21: =V21-U21 -> -1.16
A22: Total Super | C22: =SUM(C7:C21) -> 39029998 | D22: =SUM(D7:D21) -> 37887758 | E22: =SUM(E7:E21) -> 34967986 | G22: =SUM(G7:G21) -> 33861452 | H22: =SUM(H7:H21) -> 25370537 | I22: =SUM(I7:I21) -> 20463783 | J22: =SUM(C22:I22) -> 191581514 | K22: =IF(D22=0,0,((D22/C22)*100)-100) -> -2.93 | L22: =IF(D22=0,0,IF(E22=0,0,((D22/E22)*100)-100)) -> 8.35 | M22: =IF(G22=0,0,IF(D22=0,0,((D22/G22)*100)-100)) -> 11.89 | N22: =IF(H22=0,0,IF(D22=0,0,((D22/H22)*100)-100)) -> 49.34 | O22: =IF(D22=0,0,IF(I22=0,0,((D22/I22)*100)-100)) -> 85.15 | Q22: =SUM(Q7:Q21) -> 38630000 | R22: =IF(D22=0,0,((D22/Q22)*100)-100) -> -1.92 | S22: =IF(D22=0,0,(D22/$D$44)*100) -> 34.89 | U22: 16.87 | V22: 15.95 | W22: =V22-U22 -> -0.92
A24: Pinheirinho | C24: 4900000 | D24: 4875586 | E24: 4570171 | G24: 4401582 | H24: 3674218 | I24: 2841105 | K24: =IF(C24=0,0,((D24/C24)*100)-100) -> -0.5 | L24: =IF(D24=0,0,IF(E24=0,0,((D24/E24)*100)-100)) -> 6.68 | M24: =IF(G24=0,0,((D24/G24)*100)-100) -> 10.77 | N24: =IF(H24=0,0,((D24/H24)*100)-100) -> 32.7 | O24: =IF(D24=0,0,IF(I24=0,0,((D24/I24)*100)-100)) -> 71.61 | Q24: 4900000 | R24: =IF(D24=0,0,IF(Q24=0,0,((D24/Q24)*100)-100)) -> -0.5 | S24: =IF(D24=0,0,(D24/$D$44)*100) -> 4.49 | U24: 15.5 | V24: 15.01 | W24: =V24-U24 -> -0.49
A25: Londrina | C25: 4000000 | D25: 3692713 | E25: 3325595 | G25: 3762990 | H25: 3148523 | I25: 2865115 | K25: =IF(C25=0,0,((D25/C25)*100)-100) -> -7.68 | L25: =IF(D25=0,0,IF(E25=0,0,((D25/E25)*100)-100)) -> 11.04 | M25: =IF(G25=0,0,((D25/G25)*100)-100) -> -1.87 | N25: =IF(H25=0,0,((D25/H25)*100)-100) -> 17.28 | O25: =IF(D25=0,0,IF(I25=0,0,((D25/I25)*100)-100)) -> 28.89 | Q25: 4000000 | R25: =IF(D25=0,0,IF(Q25=0,0,((D25/Q25)*100)-100)) -> -7.68 | S25: =IF(D25=0,0,(D25/$D$44)*100) -> 3.4 | U25: 16.5 | V25: 15.62 | W25: =V25-U25 -> -0.88
A26: So Brz | C26: 5500000 | D26: 5134753 | E26: 4816415 | G26: 4793945 | H26: 4221696 | I26: 2958470 | K26: =IF(C26=0,0,((D26/C26)*100)-100) -> -6.64 | L26: =IF(D26=0,0,IF(E26=0,0,((D26/E26)*100)-100)) -> 6.61 | M26: =IF(G26=0,0,((D26/G26)*100)-100) -> 7.11 | N26: =IF(H26=0,0,((D26/H26)*100)-100) -> 21.63 | O26: =IF(D26=0,0,IF(I26=0,0,((D26/I26)*100)-100)) -> 73.56 | Q26: 5500000 | R26: =IF(D26=0,0,IF(Q26=0,0,((D26/Q26)*100)-100)) -> -6.64 | S26: =IF(D26=0,0,(D26/$D$44)*100) -> 4.73 | U26: 15.8 | V26: 15.1 | W26: =V26-U26 -> -0.7
A27: S.J. Pinhais | C27: 5900000 | D27: 5791520 | E27: 5299678 | G27: 5335659 | H27: 4594351 | I27: 3965134 | K27: =IF(C27=0,0,((D27/C27)*100)-100) -> -1.84 | L27: =IF(D27=0,0,IF(E27=0,0,((D27/E27)*100)-100)) -> 9.28 | M27: =IF(G27=0,0,((D27/G27)*100)-100) -> 8.54 | N27: =IF(H27=0,0,((D27/H27)*100)-100) -> 26.06 | O27: =IF(D27=0,0,IF(I27=0,0,((D27/I27)*100)-100)) -> 46.06 | Q27: 5900000 | R27: =IF(D27=0,0,IF(Q27=0,0,((D27/Q27)*100)-100)) -> -1.84 | S27: =IF(D27=0,0,(D27/$D$44)*100) -> 5.33 | U27: 15.7 | V27: 15.24 | W27: =V27-U27 -> -0.46
A28: P.G. Nova | C28: 5400000 | D28: 5079643 | E28: 4495374 | G28: 5226438 | H28: 4342599 | I28: 3509309 | K28: =IF(C28=0,0,((D28/C28)*100)-100) -> -5.93 | L28: =IF(D28=0,0,IF(E28=0,0,((D28/E28)*100)-100)) -> 13 | M28: =IF(G28=0,0,((D28/G28)*100)-100) -> -2.81 | N28: =IF(H28=0,0,((D28/H28)*100)-100) -> 16.97 | O28: =IF(D28=0,0,IF(I28=0,0,((D28/I28)*100)-100)) -> 44.75 | Q28: 5400000 | R28: =IF(D28=0,0,IF(Q28=0,0,((D28/Q28)*100)-100)) -> -5.93 | S28: =IF(D28=0,0,(D28/$D$44)*100) -> 4.68 | U28: 15.8 | V28: 14.87 | W28: =V28-U28 -> -0.93
A29: Nilo Pecanha | C29: 12800000 | D29: 12838828 | E29: 11793638 | G29: 12114686 | H29: 10188606 | I29: 8881439 | K29: =IF(C29=0,0,((D29/C29)*100)-100) -> 0.3 | L29: =IF(D29=0,0,IF(E29=0,0,((D29/E29)*100)-100)) -> 8.86 | M29: =IF(G29=0,0,((D29/G29)*100)-100) -> 5.98 | N29: =IF(H29=0,0,((D29/H29)*100)-100) -> 26.01 | O29: =IF(D29=0,0,IF(I29=0,0,((D29/I29)*100)-100)) -> 44.56 | Q29: 12800000 | R29: =IF(D29=0,0,IF(Q29=0,0,((D29/Q29)*100)-100)) -> 0.3 | S29: =IF(D29=0,0,(D29/$D$44)*100) -> 11.82 | U29: 15.1 | V29: 15.84 | W29: =V29-U29 -> 0.74
A30: Champagnat | C30: 7700000 | D30: 6970672 | E30: 6676772 | G30: 6748002 | H30: 5886944 | I30: 5352479 | K30: =IF(C30=0,0,((D30/C30)*100)-100) -> -9.47 | L30: =IF(D30=0,0,IF(E30=0,0,((D30/E30)*100)-100)) -> 4.4 | M30: =IF(G30=0,0,((D30/G30)*100)-100) -> 3.3 | N30: =IF(H30=0,0,((D30/H30)*100)-100) -> 18.41 | O30: =IF(D30=0,0,IF(I30=0,0,((D30/I30)*100)-100)) -> 30.23 | Q30: 7700000 | R30: =IF(D30=0,0,IF(Q30=0,0,((D30/Q30)*100)-100)) -> -9.47 | S30: =IF(D30=0,0,(D30/$D$44)*100) -> 6.42 | U30: 16 | V30: 16.28 | W30: =V30-U30 -> 0.28
A31: Santa Candida | C31: 7300000 | D31: 6911522 | E31: 6324032 | G31: 6110075 | H31: 4802169 | I31: 4043377 | K31: =IF(C31=0,0,((D31/C31)*100)-100) -> -5.32 | L31: =IF(D31=0,0,IF(E31=0,0,((D31/E31)*100)-100)) -> 9.29 | M31: =IF(G31=0,0,((D31/G31)*100)-100) -> 13.12 | N31: =IF(H31=0,0,((D31/H31)*100)-100) -> 43.93 | O31: =IF(D31=0,0,IF(I31=0,0,((D31/I31)*100)-100)) -> 70.93 | Q31: 7300000 | R31: =IF(D31=0,0,IF(Q31=0,0,((D31/Q31)*100)-100)) -> -5.32 | S31: =IF(D31=0,0,(D31/$D$44)*100) -> 6.36 | U31: 15.25 | V31: 15.29 | W31: =V31-U31 -> 0.04
A32: Paranagu Raia | C32: 7600000 | D32: 7161698 | E32: 6567242 | G32: 6627633 | H32: 5467510 | I32: 4883265 | K32: =IF(C32=0,0,((D32/C32)*100)-100) -> -5.77 | L32: =IF(D32=0,0,IF(E32=0,0,((D32/E32)*100)-100)) -> 9.05 | M32: =IF(G32=0,0,((D32/G32)*100)-100) -> 8.06 | N32: =IF(H32=0,0,((D32/H32)*100)-100) -> 30.99 | O32: =IF(D32=0,0,IF(I32=0,0,((D32/I32)*100)-100)) -> 46.66 | Q32: 7600000 | R32: =IF(D32=0,0,IF(Q32=0,0,((D32/Q32)*100)-100)) -> -5.77 | S32: =IF(D32=0,0,(D32/$D$44)*100) -> 6.59 | U32: 17.9 | V32: 16.86 | W32: =V32-U32 -> -1.04
A33: Torres | C33: 5800000 | D33: 5053259 | E33: 4747478 | G33: 0 | H33: 0 | I33: 0 | K33: =IF(C33=0,0,((D33/C33)*100)-100) -> -12.87 | L33: =IF(D33=0,0,IF(E33=0,0,((D33/E33)*100)-100)) -> 6.44 | M33: =IF(G33=0,0,((D33/G33)*100)-100) -> 0 | N33: =IF(H33=0,0,((D33/H33)*100)-100) -> 0 | O33: =IF(D33=0,0,IF(I33=0,0,((D33/I33)*100)-100)) -> 0 | Q33: 5800000 | R33: =IF(D33=0,0,IF(Q33=0,0,((D33/Q33)*100)-100)) -> -12.87 | S33: =IF(D33=0,0,(D33/$D$44)*100) -> 4.65 | U33: 15.7 | V33: 15.05 | W33: =V33-U33 -> -0.65
A34: Total Hiper | C34: =SUM(C24:C33) -> 66900000 | D34: =SUM(D24:D33) -> 63510194 | E34: =SUM(E24:E33) -> 58616395 | G34: =SUM(G24:G33) -> 55121010 | H34: =SUM(H24:H33) -> 46326616 | I34: =SUM(I24:I33) -> 39299693 | J34: =SUM(C34:I34) -> 329773908 | K34: =IF(D34=0,0,((D34/C34)*100)-100) -> -5.07 | L34: =IF(D34=0,0,IF(E34=0,0,((D34/E34)*100)-100)) -> 8.35 | M34: =IF(G34=0,0,IF(D34=0,0,((D34/G34)*100)-100)) -> 15.22 | N34: =IF(H34=0,0,IF(D34=0,0,((D34/H34)*100)-100)) -> 37.09 | O34: =IF(D34=0,0,IF(I34=0,0,((D34/I34)*100)-100)) -> 61.6 | Q34: =SUM(Q24:Q33) -> 66900000 | R34: =IF(D34=0,0,((D34/Q34)*100)-100) -> -5.07 | S34: =IF(D34=0,0,(D34/$D$44)*100) -> 58.48 | U34: 13.84 | V34: 13.71 | W34: =V34-U34 -> -0.13
A36: Total s/ 27, 32 | B36: =B22+B34 -> 0 | C36: =C22+C34 -> 105929998 | D36: =D22+D34 -> 101397952 | E36: =E22+E34 -> 93584381 | F36: =F22+F34 -> 0 | G36: =G22+G34 -> 88982462 | H36: =H22+H34 -> 71697153 | I36: =I22+I34 -> 59763476 | J36: =SUM(C36:I36) -> 521355422 | K36: =IF(D36=0,0,((D36/C36)*100)-100) -> -4.28 | L36: =IF(D36=0,0,IF(E36=0,0,((D36/E36)*100)-100)) -> 8.35 | M36: =IF(G36=0,0,IF(D36=0,0,((D36/G36)*100)-100)) -> 13.95 | N36: =IF(H36=0,0,IF(D36=0,0,((D36/H36)*100)-100)) -> 41.43 | O36: =IF(D36=0,0,IF(I36=0,0,((D36/I36)*100)-100)) -> 69.67 | Q36: =Q22+Q34 -> 105530000 | R36: =IF(D36=0,0,((D36/Q36)*100)-100) -> -3.92 | S36: =IF(D36=0,0,(D36/$D$44)*100) -> 93.36 | U36: 14.95 | V36: 14.55 | W36: =V36-U36 -> -0.4
A38: Campo Largo | C38: 0 | D38: 0 | E38: 0 | G38: 0 | H38: 0 | I38: 0 | K38: =IF(C38=0,0,((D38/C38)*100)-100) -> 0 | L38: =IF(D38=0,0,IF(E38=0,0,((D38/E38)*100)-100)) -> 0 | M38: =IF(G38=0,0,((D38/G38)*100)-100) -> 0 | N38: =IF(H38=0,0,((D38/H38)*100)-100) -> 0 | O38: =IF(D38=0,0,IF(I38=0,0,((D38/I38)*100)-100)) -> 0 | Q38: 0 | R38: =IF(Q38=0,0,IF(D38=0,0,((D38/Q38)*100)-100)) -> 0 | S38: =IF(D38=0,0,(D38/$D$44)*100) -> 0 | U38: 0 | V38: 0 | W38: =V38-U38 -> 0
A39: Uvaranas | C39: 5500000 | D39: 4866586 | E39: 4490197 | G39: 0 | H39: 0 | I39: 0 | K39: =IF(C39=0,0,((D39/C39)*100)-100) -> -11.52 | L39: =IF(D39=0,0,IF(E39=0,0,((D39/E39)*100)-100)) -> 8.38 | M39: =IF(G39=0,0,((D39/G39)*100)-100) -> 0 | N39: =IF(H39=0,0,((D39/H39)*100)-100) -> 0 | O39: =IF(D39=0,0,IF(I39=0,0,((D39/I39)*100)-100)) -> 0 | Q39: 5500000 | R39: =IF(Q39=0,0,IF(D39=0,0,((D39/Q39)*100)-100)) -> -11.52 | S39: =IF(D39=0,0,(D39/$D$44)*100) -> 4.48 | U39: 15.45 | V39: 14.72 | W39: =V39-U39 -> -0.73
A40: Novo Mundo | C40: 582178 | D40: 2339476 | E40: 0 | G40: 0 | H40: 0 | I40: 0 | K40: =IF(C40=0,0,((D40/C40)*100)-100) -> 301.85 | L40: =IF(D40=0,0,IF(E40=0,0,((D40/E40)*100)-100)) -> 0 | M40: =IF(G40=0,0,((D40/G40)*100)-100) -> 0 | N40: =IF(H40=0,0,((D40/H40)*100)-100) -> 0 | O40: =IF(D40=0,0,IF(I40=0,0,((D40/I40)*100)-100)) -> 0 | Q40: 582174 | R40: =IF(Q40=0,0,IF(D40=0,0,((D40/Q40)*100)-100)) -> 301.85 | S40: =IF(D40=0,0,(D40/$D$44)*100) -> 2.15 | U40: 0 | V40: 11.46 | W40: =V40-U40 -> 11.46
A41: Torres | C41: 0 | D41: 0 | E41: 0 | G41: 0 | H41: 0 | I41: 0 | K41: =IF(C41=0,0,((D41/C41)*100)-100) -> 0 | L41: =IF(D41=0,0,IF(E41=0,0,((D41/E41)*100)-100)) -> 0 | M41: =IF(G41=0,0,((D41/G41)*100)-100) -> 0 | N41: =IF(H41=0,0,((D41/H41)*100)-100) -> 0 | O41: =IF(D41=0,0,IF(I41=0,0,((D41/I41)*100)-100)) -> 0 | Q41: 0 | R41: =IF(Q41=0,0,IF(D41=0,0,((D41/Q41)*100)-100)) -> 0 | S41: =IF(D41=0,0,(D41/$D$44)*100) -> 0 | U41: 0 | V41: 0 | W41: =V41-U41 -> 0
A42: Total Lojas Novas | C42: =SUM(C38:C41) -> 6082178 | D42: =SUM(D38:D41) -> 7206062 | E42: =SUM(E38:E41) -> 4490197 | G42: =SUM(G38:G41) -> 0 | H42: =SUM(H38:H41) -> 0 | I42: =SUM(I38:I41) -> 0 | K42: =IF(D42=0,0,((D42/C42)*100)-100) -> 18.48 | L42: =IF(D42=0,0,IF(E42=0,0,((D42/E42)*100)-100)) -> 60.48 | M42: =IF(G42=0,0,IF(D42=0,0,((D42/G42)*100)-100)) -> 0 | N42: =IF(H42=0,0,IF(D42=0,0,((D42/H42)*100)-100)) -> 0 | O42: =IF(D42=0,0,IF(I42=0,0,((D42/I42)*100)-100)) -> 0 | Q42: =SUM(Q38:Q41) -> 6082174 | R42: =IF(Q42=0,0,IF(D42=0,0,((D42/Q42)*100)-100)) -> 18.48 | S42: =IF(D42=0,0,(D42/$D$44)*100) -> 6.64
A44: Total Geral | C44: =C22+C34+C42 -> 112012176 | D44: =D22+D34+D42 -> 108604014 | E44: =E22+E34+E42 -> 98074578 | G44: =G22+G34+G42 -> 88982462 | H44: =H22+H34+H42 -> 71697153 | I44: =I22+I34+I42 -> 59763476 | K44: =IF(D44=0,0,((D44/C44)*100)-100) -> -3.04 | L44: =IF(D44=0,0,IF(E44=0,0,((D44/E44)*100)-100)) -> 10.74 | M44: =IF(G44=0,0,IF(D44=0,0,((D44/G44)*100)-100)) -> 22.05 | N44: =IF(H44=0,0,IF(D44=0,0,((D44/H44)*100)-100)) -> 51.48 | O44: =IF(D44=0,0,IF(I44=0,0,((D44/I44)*100)-100)) -> 81.72 | Q44: =Q22+Q34+Q42 -> 111612174 | R44: =IF(D44=0,0,((D44/Q44)*100)-100) -> -2.7 | S44: =S22+S34+S42 -> 100.01 | U44: 14.89 | V44: 14.49 | W44: =V44-U44 -> -0.4
C45: Resumo por Regiao - Outubro/2002
C46: Descricao das Aberturas | H46: Valor | I46: % | M46: Margem Comercial | R46: Meta | S46: Real | U46: Dif
C47: Curitiba (3,6,7,10,11,13,17,21,22,24,26,27,28,34) | H47: 56610171 | I47: =IF(D44=0,0,H47/$D$44) -> 0.52129999999999999 | L47: 99 | M47: Empresa | R47: 16.11 | S47: 15.59 | U47: =S47-R47 -> -0.52
C48: Curitiba e Metrop. (Ctba. 4,5,8,14,23,25;31) | H48: 78139567 | I48: =IF(D44=0,0,H48/$D$44) -> 0.71950000000000003 | L48: 207 | M48: Super | R48: 16.87 | S48: 15.94 | U48: =S48-R48 -> -0.93
C49: Metropolitana (4,5,8,14,23,25;31) | H49: 21529396 | I49: =IF(D44=0,0,H49/$D$44) -> 0.19819999999999999 | L49: 208 | M49: Hiper | R49: 15.71 | S49: 15.4 | U49: =S49-R49 -> -0.31
C50: Norte (9,15,20) | H50: =D25+D15+D18 -> 9280493 | I50: =IF(D44=0,0,H50/$D$44) -> 8.5500000000000007E-2 | L50: 204 | M50: Regional Gilberto | R50: 15.46 | S50: 15.27 | U50: =S50-R50 -> -0.19
C51: Ponta Grossa (18,19,32) | H51: =D17+D28+D39 -> 13063827 | I51: =IF(D44=0,0,H51/$D$44) -> 0.1203 | L51: 205 | M51: Regional Edison | R51: 16.91 | S51: 15.98 | U51: =S51-R51 -> -0.93
C52: Super (3,4,5,7,8,10,13,15,17,18,20,23,26,28,34) | H52: 37887758 | I52: =IF(D44=0,0,H52/$D$44) -> 0.34889999999999999 | L52: 206 | M52: Regional Jorge | R52: 17.18 | S52: 16.14 | U52: =S52-R52 -> -1.04
C53: Hiper (6,9,11,14,19,21,22,24,25,26,27) | H53: 63510194 | I53: =IF(D44=0,0,H53/$D$44) -> 0.58479999999999999 | L53: 209 | M53: Regio - Curitiba | R53: 17.18 | S53: 15.43 | U53: =S53-R53 -> -1.75
C54: Curitiba, Metropolitana e Ponta Grossa | H54: =D44-H50 -> 99323521 | I54: =IF(D44=0,0,H54/$D$44) -> 0.91449999999999998 | L54: 200 | M54: Regio - Metropolitana | R54: 15.1 | S54: 15.96 | U54: =S54-R54 -> 0.86
C55: Araucaria | H55: =D9+D19 -> 3550880 | I55: =IF(D44=0,0,H55/$D$44) -> 3.27E-2 | L55: 201 | M55: Regio - Centro Oeste | R55: 15.67 | S55: 15.14 | U55: =S55-R55 -> -0.53