A2: Periodo: | C2: 39022 | D2: a | E2: 39051 | H2: Vendas Acumuladas por Filial | Q2: =NOW() -> 39062.562653819397
A4: v.1 | C4: Vendas 2006 | G4: Vendas de Anos Anteriores | K4: Percentuais ( % ) | Q4: Meta Mensal | U4: Margem
A5: Lojas | C5: Previsao | D5: Realizada | E5: Mes Anterior | G5: Vendas 2005 | H5: Vendas 2004 | I5: Vendas 2003 | K5: % Prev | L5: % MA | M5: 2005 | N5: 2004 | O5: 2003 | Q5: Previsao Mes | R5: Final | S5: Part. | U5: Meta | V5: Condor
A7: Xaxim | C7: 730000 | D7: 685769 | E7: 697681 | G7: 697819 | H7: 788192 | I7: 685690 | K7: =IF(C7=0,0,((D7/C7)*100)-100) -> -6.06 | L7: =IF(D7=0,0,IF(E7=0,0,((D7/E7)*100)-100)) -> -1.71 | M7: =IF(G7=0,0,((D7/G7)*100)-100) -> -1.73 | N7: =IF(H7=0,0,((D7/H7)*100)-100) -> -12.99 | O7: =IF(D7=0,0,IF(I7=0,0,((D7/I7)*100)-100)) -> 0.01 | Q7: 730000 | R7: =IF(D7=0,0,((D7/Q7)*100)-100) -> -6.06 | S7: =IF(D7=0,0,(D7/$D$37)*100) -> 1.2 | U7: 16.4 | V7: 16.34
A8: S. Felicidade | C8: 780000 | D8: 755195 | E8: 839141 | G8: 713436 | H8: 764881 | I8: 703822 | K8: =IF(C8=0,0,((D8/C8)*100)-100) -> -3.18 | L8: =IF(D8=0,0,IF(E8=0,0,((D8/E8)*100)-100)) -> -10 | M8: =IF(G8=0,0,((D8/G8)*100)-100) -> 5.85 | N8: =IF(H8=0,0,((D8/H8)*100)-100) -> -1.27 | O8: =IF(D8=0,0,IF(I8=0,0,((D8/I8)*100)-100)) -> 7.3 | Q8: 780000 | R8: =IF(D8=0,0,((D8/Q8)*100)-100) -> -3.18 | S8: =IF(D8=0,0,(D8/$D$37)*100) -> 1.32 | U8: 16.5 | V8: 15.44
A9: Lapa | C9: 1300000 | D9: 1045624 | E9: 1101152 | G9: 1145940 | H9: 1103731 | I9: 999119 | K9: =IF(C9=0,0,((D9/C9)*100)-100) -> -19.57 | L9: =IF(D9=0,0,IF(E9=0,0,((D9/E9)*100)-100)) -> -5.04 | M9: =IF(G9=0,0,((D9/G9)*100)-100) -> -8.75 | N9: =IF(H9=0,0,((D9/H9)*100)-100) -> -5.26 | O9: =IF(D9=0,0,IF(I9=0,0,((D9/I9)*100)-100)) -> 4.65 | Q9: 1300000 | R9: =IF(D9=0,0,((D9/Q9)*100)-100) -> -19.57 | S9: =IF(D9=0,0,(D9/$D$37)*100) -> 1.83 | U9: 16.25 | V9: 15.91
A10: Araucaria | C10: 995000 | D10: 951590 | E10: 870513 | G10: 905743 | H10: 965195 | I10: 960318 | K10: =IF(C10=0,0,((D10/C10)*100)-100) -> -4.36 | L10: =IF(D10=0,0,IF(E10=0,0,((D10/E10)*100)-100)) -> 9.31 | M10: =IF(G10=0,0,((D10/G10)*100)-100) -> 5.06 | N10: =IF(H10=0,0,((D10/H10)*100)-100) -> -1.41 | O10: =IF(D10=0,0,IF(I10=0,0,((D10/I10)*100)-100)) -> -0.91 | Q10: 995000 | R10: =IF(D10=0,0,((D10/Q10)*100)-100) -> -4.36 | S10: =IF(D10=0,0,(D10/$D$37)*100) -> 1.67 | U10: 17.55 | V10: 17.36
A11: Pinheirinho | C11: 0 | D11: 0 | E11: 0 | G11: 0 | H11: 0 | I11: 0 | K11: =IF(C11=0,0,((D11/C11)*100)-100) -> 0 | L11: =IF(D11=0,0,IF(E11=0,0,((D11/E11)*100)-100)) -> 0 | M11: =IF(G11=0,0,((D11/G11)*100)-100) -> 0 | N11: =IF(H11=0,0,((D11/H11)*100)-100) -> 0 | O11: =IF(D11=0,0,IF(I11=0,0,((D11/I11)*100)-100)) -> 0 | Q11: 0 | R11: =IF(D11=0,0,((D11/Q11)*100)-100) -> 0 | S11: =IF(D11=0,0,(D11/$D$37)*100) -> 0 | U11: 0 | V11: 0
A12: Hauer | C12: 3050000 | D12: 2858825 | E12: 2984393 | G12: 2936690 | H12: 3260562 | I12: 2812507 | K12: =IF(C12=0,0,((D12/C12)*100)-100) -> -6.27 | L12: =IF(D12=0,0,IF(E12=0,0,((D12/E12)*100)-100)) -> -4.21 | M12: =IF(G12=0,0,((D12/G12)*100)-100) -> -2.65 | N12: =IF(H12=0,0,((D12/H12)*100)-100) -> -12.32 | O12: =IF(D12=0,0,IF(I12=0,0,((D12/I12)*100)-100)) -> 1.65 | Q12: 3050000 | R12: =IF(D12=0,0,((D12/Q12)*100)-100) -> -6.27 | S12: =IF(D12=0,0,(D12/$D$37)*100) -> 5.01 | U12: 16.96 | V12: 17.68
A13: Paranagua | C13: 1560000 | D13: 1511416 | E13: 1597490 | G13: 1477946 | H13: 3426785 | I13: 2908812 | K13: =IF(C13=0,0,((D13/C13)*100)-100) -> -3.11 | L13: =IF(D13=0,0,IF(E13=0,0,((D13/E13)*100)-100)) -> -5.39 | M13: =IF(G13=0,0,((D13/G13)*100)-100) -> 2.26 | N13: =IF(H13=0,0,((D13/H13)*100)-100) -> -55.89 | O13: =IF(D13=0,0,IF(I13=0,0,((D13/I13)*100)-100)) -> -48.04 | Q13: 1560000 | R13: =IF(D13=0,0,((D13/Q13)*100)-100) -> -3.11 | S13: =IF(D13=0,0,(D13/$D$37)*100) -> 2.65 | U13: 17.4 | V13: 18.07
A14: Centenario | C14: 920000 | D14: 893567 | E14: 926367 | G14: 914666 | H14: 947251 | I14: 875210 | K14: =IF(C14=0,0,((D14/C14)*100)-100) -> -2.87 | L14: =IF(D14=0,0,IF(E14=0,0,((D14/E14)*100)-100)) -> -3.54 | M14: =IF(G14=0,0,((D14/G14)*100)-100) -> -2.31 | N14: =IF(H14=0,0,((D14/H14)*100)-100) -> -5.67 | O14: =IF(D14=0,0,IF(I14=0,0,((D14/I14)*100)-100)) -> 2.1 | Q14: 920000 | R14: =IF(D14=0,0,((D14/Q14)*100)-100) -> -2.87 | S14: =IF(D14=0,0,(D14/$D$37)*100) -> 1.57 | U14: 16.6 | V14: 16.86
A15: Sao Braz | C15: 3130000 | D15: 3059997 | E15: 2958470 | G15: 2933655 | H15: 3102683 | I15: 3023430 | K15: =IF(C15=0,0,((D15/C15)*100)-100) -> -2.24 | L15: =IF(D15=0,0,IF(E15=0,0,((D15/E15)*100)-100)) -> 3.43 | M15: =IF(G15=0,0,((D15/G15)*100)-100) -> 4.31 | N15: =IF(H15=0,0,((D15/H15)*100)-100) -> -1.38 | O15: =IF(D15=0,0,IF(I15=0,0,((D15/I15)*100)-100)) -> 1.21 | Q15: 3130000 | R15: =IF(D15=0,0,((D15/Q15)*100)-100) -> -2.24 | S15: =IF(D15=0,0,(D15/$D$37)*100) -> 5.36 | U15: 16.9 | V15: 15.68
A16: Sitio Cercado | C16: 1250000 | D16: 1148940 | E16: 1219593 | G16: 1306201 | H16: 1671628 | I16: 1313024 | K16: =IF(C16=0,0,((D16/C16)*100)-100) -> -8.08 | L16: =IF(D16=0,0,IF(E16=0,0,((D16/E16)*100)-100)) -> -5.79 | M16: =IF(G16=0,0,((D16/G16)*100)-100) -> -12.04 | N16: =IF(H16=0,0,((D16/H16)*100)-100) -> -31.27 | O16: =IF(D16=0,0,IF(I16=0,0,((D16/I16)*100)-100)) -> -12.5 | Q16: 1250000 | R16: =IF(D16=0,0,((D16/Q16)*100)-100) -> -8.08 | S16: =IF(D16=0,0,(D16/$D$37)*100) -> 2.01 | U16: 17.5 | V16: 17.59
A17: Apucarana | C17: 1850000 | D17: 1652922 | E17: 1708661 | G17: 1793560 | H17: 1650599 | I17: 1307066 | K17: =IF(C17=0,0,((D17/C17)*100)-100) -> -10.65 | L17: =IF(D17=0,0,IF(E17=0,0,((D17/E17)*100)-100)) -> -3.26 | M17: =IF(G17=0,0,((D17/G17)*100)-100) -> -7.84 | N17: =IF(H17=0,0,((D17/H17)*100)-100) -> 0.14 | O17: =IF(D17=0,0,IF(I17=0,0,((D17/I17)*100)-100)) -> 26.46 | Q17: 1850000 | R17: =IF(D17=0,0,((D17/Q17)*100)-100) -> -10.65 | S17: =IF(D17=0,0,(D17/$D$37)*100) -> 2.9 | U17: 16.35 | V17: 16.6
A18: Ahu | C18: 1250000 | D18: 1060950 | E18: 1115148 | G18: 1149965 | H18: 1069087 | I18: 1209111 | K18: =IF(C18=0,0,((D18/C18)*100)-100) -> -15.12 | L18: =IF(D18=0,0,IF(E18=0,0,((D18/E18)*100)-100)) -> -4.86 | M18: =IF(G18=0,0,((D18/G18)*100)-100) -> -7.74 | N18: =IF(H18=0,0,((D18/H18)*100)-100) -> -0.76 | O18: =IF(D18=0,0,IF(I18=0,0,((D18/I18)*100)-100)) -> -12.25 | Q18: 1250000 | R18: =IF(D18=0,0,((D18/Q18)*100)-100) -> -15.12 | S18: =IF(D18=0,0,(D18/$D$37)*100) -> 1.86 | U18: 17.16 | V18: 18.24
A19: P.G. Centro | C19: 1695000 | D19: 1525109 | E19: 1565581 | G19: 1521294 | H19: 1625827 | I19: 1480289 | K19: =IF(C19=0,0,((D19/C19)*100)-100) -> -10.02 | L19: =IF(D19=0,0,IF(E19=0,0,((D19/E19)*100)-100)) -> -2.59 | M19: =IF(G19=0,0,((D19/G19)*100)-100) -> 0.25 | N19: =IF(H19=0,0,((D19/H19)*100)-100) -> -6.19 | O19: =IF(D19=0,0,IF(I19=0,0,((D19/I19)*100)-100)) -> 3.03 | Q19: 1695000 | R19: =IF(D19=0,0,((D19/Q19)*100)-100) -> -10.02 | S19: =IF(D19=0,0,(D19/$D$37)*100) -> 2.67 | U19: 18.2 | V19: 19.02
A20: Maringa | C20: 2480000 | D20: 2182257 | E20: 2290307 | G20: 2195786 | H20: 2215052 | I20: 1925330 | K20: =IF(C20=0,0,((D20/C20)*100)-100) -> -12.01 | L20: =IF(D20=0,0,IF(E20=0,0,((D20/E20)*100)-100)) -> -4.72 | M20: =IF(G20=0,0,((D20/G20)*100)-100) -> -0.62 | N20: =IF(H20=0,0,((D20/H20)*100)-100) -> -1.48 | O20: =IF(D20=0,0,IF(I20=0,0,((D20/I20)*100)-100)) -> 13.34 | Q20: 2480000 | R20: =IF(D20=0,0,((D20/Q20)*100)-100) -> -12.01 | S20: =IF(D20=0,0,(D20/$D$37)*100) -> 3.82 | U20: 17.75 | V20: 18.17
A21: Araucaria Nova | C21: 2060000 | D21: 2117706 | E21: 2053774 | G21: 1919627 | H21: 2158737 | I21: 1918227 | K21: =IF(C21=0,0,((D21/C21)*100)-100) -> 2.8 | L21: =IF(D21=0,0,IF(E21=0,0,((D21/E21)*100)-100)) -> 3.11 | M21: =IF(G21=0,0,((D21/G21)*100)-100) -> 10.32 | N21: =IF(H21=0,0,((D21/H21)*100)-100) -> -1.9 | O21: =IF(D21=0,0,IF(I21=0,0,((D21/I21)*100)-100)) -> 10.4 | Q21: 2060000 | R21: =IF(D21=0,0,((D21/Q21)*100)-100) -> 2.8 | S21: =IF(D21=0,0,(D21/$D$37)*100) -> 3.71 | U21: 17.7 | V21: 17.57
A22: Total Super | C22: =SUM(C7:C21) -> 23050000 | D22: =SUM(D7:D21) -> 21449867 | E22: =SUM(E7:E21) -> 21928271 | G22: =SUM(G7:G21) -> 21612328 | H22: =SUM(H7:H21) -> 24750210 | I22: =SUM(I7:I21) -> 22121955 | J22: =SUM(C22:I22) -> 134912631 | K22: =IF(D22=0,0,((D22/C22)*100)-100) -> -6.94 | L22: =IF(D22=0,0,IF(E22=0,0,((D22/E22)*100)-100)) -> -2.18 | M22: =IF(G22=0,0,IF(D22=0,0,((D22/G22)*100)-100)) -> -0.75 | N22: =IF(H22=0,0,IF(D22=0,0,((D22/H22)*100)-100)) -> -13.33 | O22: =IF(D22=0,0,IF(I22=0,0,((D22/I22)*100)-100)) -> -3.04 | Q22: =SUM(Q7:Q21) -> 23050000 | R22: =IF(D22=0,0,((D22/Q22)*100)-100) -> -6.94 | S22: =IF(D22=0,0,(D22/$D$37)*100) -> 37.58 | U22: 16.08 | V22: 17.31
A24: Pinheirinho | C24: 2770000 | D24: 2761205 | E24: 2841105 | G24: 1815919 | H24: 1978795 | I24: 1753520 | K24: =IF(C24=0,0,((D24/C24)*100)-100) -> -0.32 | L24: =IF(D24=0,0,IF(E24=0,0,((D24/E24)*100)-100)) -> -2.81 | M24: =IF(G24=0,0,((D24/G24)*100)-100) -> 52.06 | N24: =IF(H24=0,0,((D24/H24)*100)-100) -> 39.54 | O24: =IF(D24=0,0,IF(I24=0,0,((D24/I24)*100)-100)) -> 57.47 | Q24: 2770000 | R24: =IF(D24=0,0,IF(Q24=0,0,((D24/Q24)*100)-100)) -> -0.32 | S24: =IF(D24=0,0,(D24/$D$37)*100) -> 4.84 | U24: 16.8 | V24: 16.27
A25: Londrina | C25: 2900000 | D25: 2418021 | E25: 2865115 | G25: 2668430 | H25: 2547298 | I25: 2109010 | K25: =IF(C25=0,0,((D25/C25)*100)-100) -> -16.62 | L25: =IF(D25=0,0,IF(E25=0,0,((D25/E25)*100)-100)) -> -15.6 | M25: =IF(G25=0,0,((D25/G25)*100)-100) -> -9.38 | N25: =IF(H25=0,0,((D25/H25)*100)-100) -> -5.08 | O25: =IF(D25=0,0,IF(I25=0,0,((D25/I25)*100)-100)) -> 14.65 | Q25: 2900000 | R25: =IF(D25=0,0,IF(Q25=0,0,((D25/Q25)*100)-100)) -> -16.62 | S25: =IF(D25=0,0,(D25/$D$37)*100) -> 4.24 | U25: 15.73 | V25: 15.77
A26: S.J. Pinhais | C26: 4000000 | D26: 3761323 | E26: 3965134 | G26: 3980852 | H26: 4442919 | I26: 4002822 | K26: =IF(C26=0,0,((D26/C26)*100)-100) -> -5.97 | L26: =IF(D26=0,0,IF(E26=0,0,((D26/E26)*100)-100)) -> -5.14 | M26: =IF(G26=0,0,((D26/G26)*100)-100) -> -5.51 | N26: =IF(H26=0,0,((D26/H26)*100)-100) -> -15.34 | O26: =IF(D26=0,0,IF(I26=0,0,((D26/I26)*100)-100)) -> -6.03 | Q26: 4000000 | R26: =IF(D26=0,0,IF(Q26=0,0,((D26/Q26)*100)-100)) -> -5.97 | S26: =IF(D26=0,0,(D26/$D$37)*100) -> 6.59 | U26: 16.2 | V26: 16.7
A27: P.G. Nova | C27: 3500000 | D27: 3312323 | E27: 3509309 | G27: 3457516 | H27: 3474685 | I27: 2603643 | K27: =IF(C27=0,0,((D27/C27)*100)-100) -> -5.36 | L27: =IF(D27=0,0,IF(E27=0,0,((D27/E27)*100)-100)) -> -5.61 | M27: =IF(G27=0,0,((D27/G27)*100)-100) -> -4.2 | N27: =IF(H27=0,0,((D27/H27)*100)-100) -> -4.67 | O27: =IF(D27=0,0,IF(I27=0,0,((D27/I27)*100)-100)) -> 27.22 | Q27: 3500000 | R27: =IF(D27=0,0,IF(Q27=0,0,((D27/Q27)*100)-100)) -> -5.36 | S27: =IF(D27=0,0,(D27/$D$37)*100) -> 5.8 | U27: 16.4 | V27: 16.92
A28: Nilo Pecanha | C28: 8690000 | D28: 8854454 | E28: 8881439 | G28: 8525811 | H28: 8160995 | I28: 8215743 | K28: =IF(C28=0,0,((D28/C28)*100)-100) -> 1.89 | L28: =IF(D28=0,0,IF(E28=0,0,((D28/E28)*100)-100)) -> -0.3 | M28: =IF(G28=0,0,((D28/G28)*100)-100) -> 3.85 | N28: =IF(H28=0,0,((D28/H28)*100)-100) -> 8.5 | O28: =IF(D28=0,0,IF(I28=0,0,((D28/I28)*100)-100)) -> 7.77 | Q28: 8690000 | R28: =IF(D28=0,0,IF(Q28=0,0,((D28/Q28)*100)-100)) -> 1.89 | S28: =IF(D28=0,0,(D28/$D$37)*100) -> 15.51 | U28: 16.4 | V28: 16.87
A29: Champagnat | C29: 5300000 | D29: 5096445 | E29: 5352479 | G29: 5369429 | H29: 5378049 | I29: 0 | K29: =IF(C29=0,0,((D29/C29)*100)-100) -> -3.84 | L29: =IF(D29=0,0,IF(E29=0,0,((D29/E29)*100)-100)) -> -4.78 | M29: =IF(G29=0,0,((D29/G29)*100)-100) -> -5.08 | N29: =IF(H29=0,0,((D29/H29)*100)-100) -> -5.24 | O29: =IF(D29=0,0,IF(I29=0,0,((D29/I29)*100)-100)) -> 0 | Q29: 5300000 | R29: =IF(D29=0,0,IF(Q29=0,0,((D29/Q29)*100)-100)) -> -3.84 | S29: =IF(D29=0,0,(D29/$D$37)*100) -> 8.93 | U29: 16.4 | V29: 17.49
A30: Santa Candida | C30: 4300000 | D30: 3667978 | E30: 4043377 | G30: 4153152 | H30: 4370194 | I30: 0 | K30: =IF(C30=0,0,((D30/C30)*100)-100) -> -14.7 | L30: =IF(D30=0,0,IF(E30=0,0,((D30/E30)*100)-100)) -> -9.28 | M30: =IF(G30=0,0,((D30/G30)*100)-100) -> -11.68 | N30: =IF(H30=0,0,((D30/H30)*100)-100) -> -16.07 | O30: =IF(D30=0,0,IF(I30=0,0,((D30/I30)*100)-100)) -> 0 | Q30: 4300000 | R30: =IF(D30=0,0,IF(Q30=0,0,((D30/Q30)*100)-100)) -> -14.7 | S30: =IF(D30=0,0,(D30/$D$37)*100) -> 6.43 | U30: 16.37 | V30: 17.13
A31: Paranagu Raia | C31: 4630000 | D31: 4577830 | E31: 4883265 | G31: 4257889 | H31: 0 | I31: 0 | K31: =IF(C31=0,0,((D31/C31)*100)-100) -> -1.13 | L31: =IF(D31=0,0,IF(E31=0,0,((D31/E31)*100)-100)) -> -6.25 | M31: =IF(G31=0,0,((D31/G31)*100)-100) -> 7.51 | N31: =IF(H31=0,0,((D31/H31)*100)-100) -> 0 | O31: =IF(D31=0,0,IF(I31=0,0,((D31/I31)*100)-100)) -> 0 | Q31: 4630000 | R31: =IF(D31=0,0,IF(Q31=0,0,((D31/Q31)*100)-100)) -> -1.13 | S31: =IF(D31=0,0,(D31/$D$37)*100) -> 8.02 | U31: 16.3 | V31: 17.58
A32: Total Hiper | C32: =SUM(C24:C31) -> 36090000 | D32: =SUM(D24:D31) -> 34449579 | E32: =SUM(E24:E31) -> 36341223 | G32: =SUM(G24:G31) -> 34228998 | H32: =SUM(H24:H31) -> 30352935 | I32: =SUM(I24:I31) -> 18684738 | J32: =SUM(C32:I32) -> 190147473 | K32: =IF(D32=0,0,((D32/C32)*100)-100) -> -4.55 | L32: =IF(D32=0,0,IF(E32=0,0,((D32/E32)*100)-100)) -> -5.21 | M32: =IF(G32=0,0,IF(D32=0,0,((D32/G32)*100)-100)) -> 0.64 | N32: =IF(H32=0,0,IF(D32=0,0,((D32/H32)*100)-100)) -> 13.5 | O32: =IF(D32=0,0,IF(I32=0,0,((D32/I32)*100)-100)) -> 84.37 | Q32: =SUM(Q24:Q31) -> 36090000 | R32: =IF(D32=0,0,((D32/Q32)*100)-100) -> -4.55 | S32: =IF(D32=0,0,(D32/$D$37)*100) -> 60.36 | U32: 16.31 | V32: 16.94
A34: Cristo Rei | C34: 1460000 | D34: 1178261 | E34: 1493982 | G34: 0 | H34: 0 | I34: 0 | K34: =IF(C34=0,0,((D34/C34)*100)-100) -> -19.3 | L34: =IF(D34=0,0,IF(E34=0,0,((D34/E34)*100)-100)) -> -21.13 | M34: =IF(G34=0,0,((D34/G34)*100)-100) -> 0 | N34: =IF(H34=0,0,((D34/H34)*100)-100) -> 0 | O34: =IF(D34=0,0,IF(I34=0,0,((D34/I34)*100)-100)) -> 0 | Q34: 1460000 | R34: =IF(Q34=0,0,IF(D34=0,0,((D34/Q34)*100)-100)) -> -19.3 | S34: =IF(D34=0,0,(D34/$D$37)*100) -> 2.06 | U34: 17 | V34: 18.59
A35: Total Lojas Novas | C35: =SUM(C34) -> 1460000 | D35: =SUM(D34) -> 1178261 | E35: =SUM(E34) -> 1493982 | G35: =SUM(G34) -> 0 | H35: =SUM(H34) -> 0 | I35: =SUM(I34) -> 0 | K35: =IF(D35=0,0,((D35/C35)*100)-100) -> -19.3 | L35: =IF(D35=0,0,IF(E35=0,0,((D35/E35)*100)-100)) -> -21.13 | M35: =IF(G35=0,0,IF(D35=0,0,((D35/G35)*100)-100)) -> 0 | N35: =IF(H35=0,0,IF(D35=0,0,((D35/H35)*100)-100)) -> 0 | O35: =IF(D35=0,0,IF(I35=0,0,((D35/I35)*100)-100)) -> 0 | Q35: =SUM(Q34) -> 1460000 | R35: =IF(D35=0,0,((D35/Q35)*100)-100) -> -19.3 | S35: =IF(D35=0,0,(D35/$D$37)*100) -> 2.06 | U35: =U34 -> 17 | V35: =V34 -> 18.59
A37: Total Geral | C37: =C22+C32+C35 -> 60600000 | D37: =D22+D32+D35 -> 57077707 | E37: =E22+E32+E35 -> 59763476 | G37: =G22+G32+G35 -> 55841326 | H37: =H22+H32+H35 -> 55103145 | I37: =I22+I32+I35 -> 40806693 | K37: =IF(D37=0,0,((D37/C37)*100)-100) -> -5.81 | L37: =IF(D37=0,0,IF(E37=0,0,((D37/E37)*100)-100)) -> -4.49 | M37: =IF(G37=0,0,IF(D37=0,0,((D37/G37)*100)-100)) -> 2.21 | N37: =IF(H37=0,0,IF(D37=0,0,((D37/H37)*100)-100)) -> 3.58 | O37: =IF(D37=0,0,IF(I37=0,0,((D37/I37)*100)-100)) -> 39.87 | Q37: =Q22+Q32+Q35 -> 60600000 | R37: =IF(D37=0,0,((D37/Q37)*100)-100) -> -5.81 | S37: =S22+S32+S35 -> 100 | U37: 16.22 | V37: 17.09
C38: Resumo por Regiao - Outubro/2002
C39: Descricao das Aberturas | H39: Valor | I39: %
C40: Curitiba (2,3,6,7,10,11,13,17,21,22) | H40: =D7+D8+D11+D12+D14+D15+D16+D18+D28+D29+D30+D24+D34 -> 32021586 | I40: =IF(D37=0,0,H40/$D$37) -> 0.56100000000000005
C41: Curitiba e Metrop. (Ctba. 4,5,8,13,14,23) | H41: =H40+D9+D10+D13+D26+D21+D31 -> 45987075 | I41: =IF(D37=0,0,H41/$D$37) -> 0.80569999999999997
C42: Metropolitana (4,5,8,14,23) | H42: =H41-H40 -> 13965489 | I42: =IF(D37=0,0,H42/$D$37) -> 0.2447
C43: Norte (9,15,20) | H43: =D25+D17+D20 -> 6253200 | I43: =IF(D37=0,0,H43/$D$37) -> 0.1096
C44: Ponta Grossa (18,19) | H44: =D19+D27 -> 4837432 | I44: =IF(D37=0,0,H44/$D$37) -> 8.48E-2
C45: Super (2,3,4,5,6,7,8,10,11,13,15,17,18,20,23) | H45: =D22 -> 21449867 | I45: =IF(D37=0,0,H45/$D$37) -> 0.37580000000000002
C46: Hiper (6,9,14,19,21,22,24) | H46: =D32 -> 34449579 | I46: =IF(D37=0,0,H46/$D$37) -> 0.60360000000000003
C47: Curitiba, Metropolitana e Ponta Grossa | H47: =D37-H43 -> 50824507 | I47: =IF(D37=0,0,H47/$D$37) -> 0.89039999999999997
C48: Araucaria | H48: =D10+D21 -> 3069296 | I48: =IF(D37=0,0,H48/$D$37) -> 5.3800000000000001E-2