A2: Periodo: | C2: 38657 | D2: a | E2: 38686 | H2: Vendas Acumuladas por Filial | Q2: =NOW() -> 38751.424218749999
A4: v.1 | C4: Vendas 2005 | G4: Vendas de Anos Anteriores | K4: Percentuais ( % ) | Q4: Meta Mensal | U4: Margem
A5: Lojas | C5: Previsao | D5: Realizada | E5: Mes Anterior | G5: Vendas 2004 | H5: Vendas 2003 | I5: Vendas 2002 | K5: % Prev | L5: % MA | M5: 2004 | N5: 2003 | O5: 2002 | Q5: Previsao Mes | R5: Final | S5: Part. | U5: Meta | V5: Condor
A7: Xaxim | C7: 800000 | D7: 697819 | E7: 754298 | G7: 788192 | H7: 685690 | I7: 546343 | K7: =IF(C7=0,0,((D7/C7)*100)-100) -> -12.77 | L7: =IF(D7=0,0,IF(E7=0,0,((D7/E7)*100)-100)) -> -7.49 | M7: =IF(G7=0,0,((D7/G7)*100)-100) -> -11.47 | N7: =IF(H7=0,0,((D7/H7)*100)-100) -> 1.77 | O7: =IF(D7=0,0,IF(I7=0,0,((D7/I7)*100)-100)) -> 27.73 | Q7: 800000 | R7: =IF(D7=0,0,((D7/Q7)*100)-100) -> -12.77 | S7: =IF(D7=0,0,(D7/$D$35)*100) -> 1.25 | U7: 16.8 | V7: 15.42
A8: S. Felicidade | C8: 800000 | D8: 713436 | E8: 721653 | G8: 764881 | H8: 703822 | I8: 653352 | K8: =IF(C8=0,0,((D8/C8)*100)-100) -> -10.82 | L8: =IF(D8=0,0,IF(E8=0,0,((D8/E8)*100)-100)) -> -1.14 | M8: =IF(G8=0,0,((D8/G8)*100)-100) -> -6.73 | N8: =IF(H8=0,0,((D8/H8)*100)-100) -> 1.37 | O8: =IF(D8=0,0,IF(I8=0,0,((D8/I8)*100)-100)) -> 9.2 | Q8: 800000 | R8: =IF(D8=0,0,((D8/Q8)*100)-100) -> -10.82 | S8: =IF(D8=0,0,(D8/$D$35)*100) -> 1.28 | U8: 16.75 | V8: 15.67
A9: Lapa | C9: 1140000 | D9: 1145940 | E9: 1219423 | G9: 1103731 | H9: 999119 | I9: 949798 | K9: =IF(C9=0,0,((D9/C9)*100)-100) -> 0.52 | L9: =IF(D9=0,0,IF(E9=0,0,((D9/E9)*100)-100)) -> -6.03 | M9: =IF(G9=0,0,((D9/G9)*100)-100) -> 3.82 | N9: =IF(H9=0,0,((D9/H9)*100)-100) -> 14.7 | O9: =IF(D9=0,0,IF(I9=0,0,((D9/I9)*100)-100)) -> 20.65 | Q9: 1140000 | R9: =IF(D9=0,0,((D9/Q9)*100)-100) -> 0.52 | S9: =IF(D9=0,0,(D9/$D$35)*100) -> 2.05 | U9: 16.9 | V9: 15.62
A10: Araucaria | C10: 1040000 | D10: 905743 | E10: 919908 | G10: 965195 | H10: 960318 | I10: 1078118 | K10: =IF(C10=0,0,((D10/C10)*100)-100) -> -12.91 | L10: =IF(D10=0,0,IF(E10=0,0,((D10/E10)*100)-100)) -> -1.54 | M10: =IF(G10=0,0,((D10/G10)*100)-100) -> -6.16 | N10: =IF(H10=0,0,((D10/H10)*100)-100) -> -5.68 | O10: =IF(D10=0,0,IF(I10=0,0,((D10/I10)*100)-100)) -> -15.99 | Q10: 1040000 | R10: =IF(D10=0,0,((D10/Q10)*100)-100) -> -12.91 | S10: =IF(D10=0,0,(D10/$D$35)*100) -> 1.62 | U10: 18.1 | V10: 17.23
A11: Pinheirinho | C11: 2100000 | D11: 1815919 | E11: 1955750 | G11: 1978795 | H11: 1753520 | I11: 1627986 | K11: =IF(C11=0,0,((D11/C11)*100)-100) -> -13.53 | L11: =IF(D11=0,0,IF(E11=0,0,((D11/E11)*100)-100)) -> -7.15 | M11: =IF(G11=0,0,((D11/G11)*100)-100) -> -8.23 | N11: =IF(H11=0,0,((D11/H11)*100)-100) -> 3.56 | O11: =IF(D11=0,0,IF(I11=0,0,((D11/I11)*100)-100)) -> 11.54 | Q11: 2100000 | R11: =IF(D11=0,0,((D11/Q11)*100)-100) -> -13.53 | S11: =IF(D11=0,0,(D11/$D$35)*100) -> 3.25 | U11: 17.45 | V11: 15.64
A12: Hauer | C12: 3260000 | D12: 2936690 | E12: 3216533 | G12: 3260562 | H12: 2812507 | I12: 2494420 | K12: =IF(C12=0,0,((D12/C12)*100)-100) -> -9.92 | L12: =IF(D12=0,0,IF(E12=0,0,((D12/E12)*100)-100)) -> -8.7 | M12: =IF(G12=0,0,((D12/G12)*100)-100) -> -9.93 | N12: =IF(H12=0,0,((D12/H12)*100)-100) -> 4.42 | O12: =IF(D12=0,0,IF(I12=0,0,((D12/I12)*100)-100)) -> 17.73 | Q12: 3260000 | R12: =IF(D12=0,0,((D12/Q12)*100)-100) -> -9.92 | S12: =IF(D12=0,0,(D12/$D$35)*100) -> 5.26 | U12: 17 | V12: 16.62
A13: Paranagua | C13: 1500000 | D13: 1477946 | E13: 1533391 | G13: 3426785 | H13: 2908812 | I13: 2786696 | K13: =IF(C13=0,0,((D13/C13)*100)-100) -> -1.47 | L13: =IF(D13=0,0,IF(E13=0,0,((D13/E13)*100)-100)) -> -3.62 | M13: =IF(G13=0,0,((D13/G13)*100)-100) -> -56.87 | N13: =IF(H13=0,0,((D13/H13)*100)-100) -> -49.19 | O13: =IF(D13=0,0,IF(I13=0,0,((D13/I13)*100)-100)) -> -46.96 | Q13: 1500000 | R13: =IF(D13=0,0,((D13/Q13)*100)-100) -> -1.47 | S13: =IF(D13=0,0,(D13/$D$35)*100) -> 2.65 | U13: 17.59 | V13: 16.59
A14: Centenario | C14: 1020000 | D14: 914666 | E14: 963591 | G14: 947251 | H14: 875210 | I14: 816938 | K14: =IF(C14=0,0,((D14/C14)*100)-100) -> -10.33 | L14: =IF(D14=0,0,IF(E14=0,0,((D14/E14)*100)-100)) -> -5.08 | M14: =IF(G14=0,0,((D14/G14)*100)-100) -> -3.44 | N14: =IF(H14=0,0,((D14/H14)*100)-100) -> 4.51 | O14: =IF(D14=0,0,IF(I14=0,0,((D14/I14)*100)-100)) -> 11.96 | Q14: 1020000 | R14: =IF(D14=0,0,((D14/Q14)*100)-100) -> -10.33 | S14: =IF(D14=0,0,(D14/$D$35)*100) -> 1.64 | U14: 17.1 | V14: 15.42
A15: Arapongas | C15: 0 | D15: 0 | E15: 0 | G15: 0 | H15: 0 | I15: 0 | K15: =IF(C15=0,0,((D15/C15)*100)-100) -> 0 | L15: =IF(D15=0,0,IF(E15=0,0,((D15/E15)*100)-100)) -> 0 | M15: =IF(D15=0,0,IF(G15=0,0,((D15/G15)*100)-100)) -> 0 | N15: =IF(D15=0,0,IF(H15=0,0,((D15/H15)*100)-100)) -> 0 | O15: =IF(D15=0,0,IF(I15=0,0,((D15/I15)*100)-100)) -> 0 | Q15: 0 | R15: =IF(D15=0,0,((D15/Q15)*100)-100) -> 0 | S15: =IF(D15=0,0,(D15/$D$35)*100) -> 0 | U15: 0 | V15: 0
A16: Sao Braz | C16: 3200000 | D16: 2933655 | E16: 3101849 | G16: 3102683 | H16: 3023430 | I16: 2696200 | K16: =IF(C16=0,0,((D16/C16)*100)-100) -> -8.32 | L16: =IF(D16=0,0,IF(E16=0,0,((D16/E16)*100)-100)) -> -5.42 | M16: =IF(G16=0,0,((D16/G16)*100)-100) -> -5.45 | N16: =IF(H16=0,0,((D16/H16)*100)-100) -> -2.97 | O16: =IF(D16=0,0,IF(I16=0,0,((D16/I16)*100)-100)) -> 8.81 | Q16: 3200000 | R16: =IF(D16=0,0,((D16/Q16)*100)-100) -> -8.32 | S16: =IF(D16=0,0,(D16/$D$35)*100) -> 5.25 | U16: 17 | V16: 16.08
A17: Sitio Cercado | C17: 1300000 | D17: 1306201 | E17: 1399709 | G17: 1671628 | H17: 1313024 | I17: 1061698 | K17: =IF(C17=0,0,((D17/C17)*100)-100) -> 0.48 | L17: =IF(D17=0,0,IF(E17=0,0,((D17/E17)*100)-100)) -> -6.68 | M17: =IF(G17=0,0,((D17/G17)*100)-100) -> -21.86 | N17: =IF(H17=0,0,((D17/H17)*100)-100) -> -0.52 | O17: =IF(D17=0,0,IF(I17=0,0,((D17/I17)*100)-100)) -> 23.03 | Q17: 1300000 | R17: =IF(D17=0,0,((D17/Q17)*100)-100) -> 0.48 | S17: =IF(D17=0,0,(D17/$D$35)*100) -> 2.34 | U17: 16 | V17: 16.02
A18: Apucarana | C18: 1600000 | D18: 1793560 | E18: 1770813 | G18: 1650599 | H18: 1307066 | I18: 1260187 | K18: =IF(C18=0,0,((D18/C18)*100)-100) -> 12.1 | L18: =IF(D18=0,0,IF(E18=0,0,((D18/E18)*100)-100)) -> 1.28 | M18: =IF(G18=0,0,((D18/G18)*100)-100) -> 8.66 | N18: =IF(H18=0,0,((D18/H18)*100)-100) -> 37.22 | O18: =IF(D18=0,0,IF(I18=0,0,((D18/I18)*100)-100)) -> 42.32 | Q18: 1600000 | R18: =IF(D18=0,0,((D18/Q18)*100)-100) -> 12.1 | S18: =IF(D18=0,0,(D18/$D$35)*100) -> 3.21 | U18: 18.5 | V18: 16.24
A19: Ahu | C19: 1140000 | D19: 1149965 | E19: 1173008 | G19: 1069087 | H19: 1209111 | I19: 1116627 | K19: =IF(C19=0,0,((D19/C19)*100)-100) -> 0.87 | L19: =IF(D19=0,0,IF(E19=0,0,((D19/E19)*100)-100)) -> -1.96 | M19: =IF(G19=0,0,((D19/G19)*100)-100) -> 7.57 | N19: =IF(H19=0,0,((D19/H19)*100)-100) -> -4.89 | O19: =IF(D19=0,0,IF(I19=0,0,((D19/I19)*100)-100)) -> 2.99 | Q19: 1140000 | R19: =IF(D19=0,0,((D19/Q19)*100)-100) -> 0.87 | S19: =IF(D19=0,0,(D19/$D$35)*100) -> 2.06 | U19: 17.91 | V19: 15.22
A20: P.G. Centro | C20: 1780000 | D20: 1521294 | E20: 1564418 | G20: 1625827 | H20: 1480289 | I20: 1434642 | K20: =IF(C20=0,0,((D20/C20)*100)-100) -> -14.53 | L20: =IF(D20=0,0,IF(E20=0,0,((D20/E20)*100)-100)) -> -2.76 | M20: =IF(G20=0,0,((D20/G20)*100)-100) -> -6.43 | N20: =IF(H20=0,0,((D20/H20)*100)-100) -> 2.77 | O20: =IF(D20=0,0,IF(I20=0,0,((D20/I20)*100)-100)) -> 6.04 | Q20: 1780000 | R20: =IF(D20=0,0,((D20/Q20)*100)-100) -> -14.53 | S20: =IF(D20=0,0,(D20/$D$35)*100) -> 2.72 | U20: 18 | V20: 17.04
A21: Maringa | C21: 2280000 | D21: 2195786 | E21: 2419642 | G21: 2215052 | H21: 1925330 | I21: 1900663 | K21: =IF(C21=0,0,((D21/C21)*100)-100) -> -3.69 | L21: =IF(D21=0,0,IF(E21=0,0,((D21/E21)*100)-100)) -> -9.25 | M21: =IF(G21=0,0,((D21/G21)*100)-100) -> -0.87 | N21: =IF(H21=0,0,((D21/H21)*100)-100) -> 14.05 | O21: =IF(D21=0,0,IF(I21=0,0,((D21/I21)*100)-100)) -> 15.53 | Q21: 2280000 | R21: =IF(D21=0,0,((D21/Q21)*100)-100) -> -3.69 | S21: =IF(D21=0,0,(D21/$D$35)*100) -> 3.93 | U21: 19.2 | V21: 17.01
A22: Araucaria Nova | C22: 2200000 | D22: 1919627 | E22: 2041811 | G22: 2158737 | H22: 1918227 | I22: 1678009 | K22: =IF(C22=0,0,((D22/C22)*100)-100) -> -12.74 | L22: =IF(D22=0,0,IF(E22=0,0,((D22/E22)*100)-100)) -> -5.98 | M22: =IF(G22=0,0,((D22/G22)*100)-100) -> -11.08 | N22: =IF(H22=0,0,((D22/H22)*100)-100) -> 0.07 | O22: =IF(D22=0,0,IF(I22=0,0,((D22/I22)*100)-100)) -> 14.4 | Q22: 2200000 | R22: =IF(D22=0,0,((D22/Q22)*100)-100) -> -12.74 | S22: =IF(D22=0,0,(D22/$D$35)*100) -> 3.44 | U22: 18 | V22: 17.67
A23: Sitio Cercado | C23: 0 | D23: 0 | E23: 0 | G23: 0 | H23: 0 | I23: 0 | K23: =IF(C23=0,0,((D23/C23)*100)-100) -> 0 | L23: =IF(D23=0,0,IF(E23=0,0,((D23/E23)*100)-100)) -> 0 | M23: =IF(G23=0,0,((D23/G23)*100)-100) -> 0 | N23: =IF(H23=0,0,((D23/H23)*100)-100) -> 0 | O23: =IF(D23=0,0,IF(I23=0,0,((D23/I23)*100)-100)) -> 0 | Q23: 0 | R23: =IF(Q23=0,0,IF(D23=0,0,((D23/Q23)*100)-100)) -> 0 | S23: =IF(D23=0,0,(D23/$D$35)*100) -> 0 | U23: 0 | V23: 0
A24: Total Super | C24: =SUM(C7:C23) -> 25160000 | D24: =SUM(D7:D23) -> 23428247 | E24: =SUM(E7:E23) -> 24755797 | G24: =SUM(G7:G23) -> 26729005 | H24: =SUM(H7:H23) -> 23875475 | I24: =SUM(I7:I23) -> 22101677 | J24: =SUM(C24:I24) -> 146050201 | K24: =IF(D24=0,0,((D24/C24)*100)-100) -> -6.88 | L24: =IF(D24=0,0,IF(E24=0,0,((D24/E24)*100)-100)) -> -5.36 | M24: =IF(G24=0,0,IF(D24=0,0,((D24/G24)*100)-100)) -> -12.35 | N24: =IF(H24=0,0,IF(D24=0,0,((D24/H24)*100)-100)) -> -1.87 | O24: =IF(D24=0,0,IF(I24=0,0,((D24/I24)*100)-100)) -> 6 | Q24: =SUM(Q7:Q23) -> 25160000 | R24: =IF(D24=0,0,((D24/Q24)*100)-100) -> -6.88 | S24: =IF(D24=0,0,(D24/$D$35)*100) -> 41.96 | U24: 17.55 | V24: 16.36
A26: Londrina | C26: 2600000 | D26: 2668430 | E26: 3096380 | G26: 2547298 | H26: 2109010 | I26: 2119294 | K26: =IF(C26=0,0,((D26/C26)*100)-100) -> 2.63 | L26: =IF(D26=0,0,IF(E26=0,0,((D26/E26)*100)-100)) -> -13.82 | M26: =IF(G26=0,0,((D26/G26)*100)-100) -> 4.76 | N26: =IF(H26=0,0,((D26/H26)*100)-100) -> 26.53 | O26: =IF(D26=0,0,IF(I26=0,0,((D26/I26)*100)-100)) -> 25.91 | Q26: 2600000 | R26: =IF(D26=0,0,IF(Q26=0,0,((D26/Q26)*100)-100)) -> 2.63 | S26: =IF(D26=0,0,(D26/$D$35)*100) -> 4.78 | U26: 18.87 | V26: 14.37
A27: S.J. Pinhais | C27: 4300000 | D27: 3980852 | E27: 4422822 | G27: 4442919 | H27: 4002822 | I27: 3595558 | K27: =IF(C27=0,0,((D27/C27)*100)-100) -> -7.42 | L27: =IF(D27=0,0,IF(E27=0,0,((D27/E27)*100)-100)) -> -9.99 | M27: =IF(G27=0,0,((D27/G27)*100)-100) -> -10.4 | N27: =IF(H27=0,0,((D27/H27)*100)-100) -> -0.55 | O27: =IF(D27=0,0,IF(I27=0,0,((D27/I27)*100)-100)) -> 10.72 | Q27: 4300000 | R27: =IF(D27=0,0,IF(Q27=0,0,((D27/Q27)*100)-100)) -> -7.42 | S27: =IF(D27=0,0,(D27/$D$35)*100) -> 7.13 | U27: 16.8 | V27: 15.28
A28: P.G. Nova | C28: 3600000 | D28: 3457516 | E28: 3773369 | G28: 3474685 | H28: 2603643 | I28: 2918797 | K28: =IF(C28=0,0,((D28/C28)*100)-100) -> -3.96 | L28: =IF(D28=0,0,IF(E28=0,0,((D28/E28)*100)-100)) -> -8.37 | M28: =IF(G28=0,0,((D28/G28)*100)-100) -> -0.49 | N28: =IF(H28=0,0,((D28/H28)*100)-100) -> 32.8 | O28: =IF(D28=0,0,IF(I28=0,0,((D28/I28)*100)-100)) -> 18.46 | Q28: 3600000 | R28: =IF(D28=0,0,IF(Q28=0,0,((D28/Q28)*100)-100)) -> -3.96 | S28: =IF(D28=0,0,(D28/$D$35)*100) -> 6.19 | U28: 16.95 | V28: 15.27
A29: Nilo Pecanha | C29: 8300000 | D29: 8525811 | E29: 9475278 | G29: 8160995 | H29: 8215743 | I29: 6563607 | K29: =IF(C29=0,0,((D29/C29)*100)-100) -> 2.72 | L29: =IF(D29=0,0,IF(E29=0,0,((D29/E29)*100)-100)) -> -10.02 | M29: =IF(G29=0,0,((D29/G29)*100)-100) -> 4.47 | N29: =IF(H29=0,0,((D29/H29)*100)-100) -> 3.77 | O29: =IF(D29=0,0,IF(I29=0,0,((D29/I29)*100)-100)) -> 29.9 | Q29: 8300000 | R29: =IF(D29=0,0,IF(Q29=0,0,((D29/Q29)*100)-100)) -> 2.72 | S29: =IF(D29=0,0,(D29/$D$35)*100) -> 15.27 | U29: 16.5 | V29: 16
A30: Champagnat | C30: 5500000 | D30: 5369429 | E30: 6161013 | G30: 5378049 | H30: 0 | I30: 0 | K30: =IF(C30=0,0,((D30/C30)*100)-100) -> -2.37 | L30: =IF(D30=0,0,IF(E30=0,0,((D30/E30)*100)-100)) -> -12.85 | M30: =IF(G30=0,0,((D30/G30)*100)-100) -> -0.16 | N30: =IF(H30=0,0,((D30/H30)*100)-100) -> 0 | O30: =IF(D30=0,0,IF(I30=0,0,((D30/I30)*100)-100)) -> 0 | Q30: 5500000 | R30: =IF(D30=0,0,IF(Q30=0,0,((D30/Q30)*100)-100)) -> -2.37 | S30: =IF(D30=0,0,(D30/$D$35)*100) -> 9.62 | U30: 16.6 | V30: 16.64
A31: Santa Candida | C31: 4800000 | D31: 4153152 | E31: 4775401 | G31: 4370194 | H31: 0 | I31: 0 | K31: =IF(C31=0,0,((D31/C31)*100)-100) -> -13.48 | L31: =IF(D31=0,0,IF(E31=0,0,((D31/E31)*100)-100)) -> -13.03 | M31: =IF(G31=0,0,((D31/G31)*100)-100) -> -4.97 | N31: =IF(H31=0,0,((D31/H31)*100)-100) -> 0 | O31: =IF(D31=0,0,IF(I31=0,0,((D31/I31)*100)-100)) -> 0 | Q31: 4800000 | R31: =IF(D31=0,0,IF(Q31=0,0,((D31/Q31)*100)-100)) -> -13.48 | S31: =IF(D31=0,0,(D31/$D$35)*100) -> 7.44 | U31: 16.25 | V31: 14.71
A32: Paranagu Raia | C32: 4500000 | D32: 4257889 | E32: 4657320 | G32: 0 | H32: 0 | I32: 0 | K32: =IF(C32=0,0,((D32/C32)*100)-100) -> -5.38 | L32: =IF(D32=0,0,IF(E32=0,0,((D32/E32)*100)-100)) -> -8.58 | M32: =IF(G32=0,0,((D32/G32)*100)-100) -> 0 | N32: =IF(H32=0,0,((D32/H32)*100)-100) -> 0 | O32: =IF(D32=0,0,IF(I32=0,0,((D32/I32)*100)-100)) -> 0 | Q32: 4500000 | R32: =IF(D32=0,0,IF(Q32=0,0,((D32/Q32)*100)-100)) -> -5.38 | S32: =IF(D32=0,0,(D32/$D$35)*100) -> 7.62 | U32: 15.5 | V32: 16.52
A33: Total Hiper | C33: =SUM(C26:C32) -> 33600000 | D33: =SUM(D26:D32) -> 32413079 | E33: =SUM(E26:E32) -> 36361583 | G33: =SUM(G26:G32) -> 28374140 | H33: =SUM(H26:H32) -> 16931218 | I33: =SUM(I26:I32) -> 15197256 | J33: =SUM(C33:I33) -> 162877276 | K33: =IF(D33=0,0,((D33/C33)*100)-100) -> -3.53 | L33: =IF(D33=0,0,IF(E33=0,0,((D33/E33)*100)-100)) -> -10.86 | M33: =IF(G33=0,0,IF(D33=0,0,((D33/G33)*100)-100)) -> 14.23 | N33: =IF(H33=0,0,IF(D33=0,0,((D33/H33)*100)-100)) -> 91.44 | O33: =IF(D33=0,0,IF(I33=0,0,((D33/I33)*100)-100)) -> 113.28 | Q33: =SUM(Q26:Q32) -> 33600000 | R33: =IF(D33=0,0,((D33/Q33)*100)-100) -> -3.53 | S33: =IF(D33=0,0,(D33/$D$35)*100) -> 58.04 | U33: 16.62 | V33: 15.71
A35: Total Geral | C35: =C24+C33 -> 58760000 | D35: =D24+D33 -> 55841326 | E35: =E24+E33 -> 61117380 | G35: =G24+G33 -> 55103145 | H35: =H24+H33 -> 40806693 | I35: =I24+I33 -> 37298933 | K35: =IF(D33=0,0,((D35/C35)*100)-100) -> -4.97 | L35: =IF(D35=0,0,IF(E35=0,0,((D35/E35)*100)-100)) -> -8.63 | M35: =IF(G35=0,0,IF(D35=0,0,((D35/G35)*100)-100)) -> 1.34 | N35: =IF(H35=0,0,IF(D35=0,0,((D35/H35)*100)-100)) -> 36.84 | O35: =IF(D35=0,0,IF(I35=0,0,((D35/I35)*100)-100)) -> 49.71 | Q35: =Q24+Q33 -> 58760000 | R35: =IF(D35=0,0,((D35/Q35)*100)-100) -> -4.97 | S35: =S24+S33 -> 100 | U35: 17.01 | V35: 15.98
C36: Resumo por Regiao - Outubro/2002
C37: Descricao das Aberturas | H37: Valor | I37: %
C38: Curitiba (2,3,6,7,10,11,17,21,22) | H38: =D7+D8+D11+D12+D14+D16+D19+D29+D30+D32 -> 29315279 | I38: =IF(D35=0,0,H38/$D$35) -> 0.52500000000000002
C39: Curitiba e Metrop. (Ctba. 4,5,8,14,23) | H39: =H38+D9+D10+D13+D28+D23 -> 36302424 | I39: =IF(D35=0,0,H39/$D$35) -> 0.65010000000000001
C40: Metropolitana (4,5,8,14,23) | H40: =H39-H38 -> 6987145 | I40: =IF(D35=0,0,H40/$D$35) -> 0.12509999999999999
C41: Norte (9,15,20) | H41: =D26+D18+D23 -> 4461990 | I41: =IF(D35=0,0,H41/$D$35) -> 7.9899999999999999E-2
C42: Centro-Oeste (13,18,19) | H42: =D17+D20+D28 -> 6285011 | I42: =IF(D35=0,0,H42/$D$35) -> 0.11260000000000001
C43: Ponta Grossa (18,19) | H43: =H42-D17 -> 4978810 | I43: =IF(D35=0,0,H43/$D$35) -> 8.9200000000000002E-2
C44: Super (2,3,4,5,6,7,8,10,11,13,15,17,18,20,23) | H44: =D24 -> 23428247 | I44: =IF(D35=0,0,H44/$D$35) -> 0.41959999999999997
C45: Hiper (9,14,19,21,22,24) | H45: =D33 -> 32413079 | I45: =IF(D35=0,0,H45/$D$35) -> 0.58040000000000003
C46: Curitiba, Metropolitana e Centro-Oeste | H46: =D35-H41 -> 51379336 | I46: =IF(D35=0,0,H46/$D$35) -> 0.92010000000000003
C47: Araucaria | H47: =D10+D23 -> 905743 | I47: =IF(D35=0,0,H47/$D$35) -> 1.6199999999999999E-2