A2: Periodo: | C2: 40148 | D2: a | E2: 31/12/2009 | H2: Vendas Acumuladas por Filial | Q2: =NOW() -> 40179.246330092603
A4: v.1 | C4: Vendas 2009 | G4: Vendas de Anos Anteriores | K4: Percentuais ( % ) | Q4: Meta Mensal | U4: Margem
A5: Lojas | C5: Previsao | D5: Realizada | E5: Mes Anterior | G5: Vendas 2008 | H5: Vendas 2007 | I5: Vendas 2006 | K5: % Prev | L5: % MA | M5: 2008 | N5: 2007 | O5: 2006 | Q5: Previsao Mes | R5: Final | S5: Part. | U5: Meta | V5: Coml | W5: Dif
A7: S. Felicidade | C7: 3300000 | D7: 3470654 | E7: 2821335 | G7: 2918228 | H7: 2607526 | I7: 942108 | K7: =IF(C7=0,0,((D7/C7)*100)-100) -> 5.17 | L7: =IF(D7=0,0,IF(E7=0,0,((D7/E7)*100)-100)) -> 23.01 | M7: =IF(G7=0,0,((D7/G7)*100)-100) -> 18.93 | N7: =IF(H7=0,0,((D7/H7)*100)-100) -> 33.1 | O7: =IF(D7=0,0,IF(I7=0,0,((D7/I7)*100)-100)) -> 268.39 | Q7: 3300000 | R7: =IF(D7=0,0,((D7/Q7)*100)-100) -> 5.17 | S7: =IF(D7=0,0,(D7/$D$44)*100) -> 2.57 | U7: 16.5 | V7: 16.11 | W7: =V7-U7 -> -0.39
A8: Lapa | C8: 2700000 | D8: 2775609 | E8: 2141055 | G8: 2531216 | H8: 2017250 | I8: 1405810 | K8: =IF(C8=0,0,((D8/C8)*100)-100) -> 2.8 | L8: =IF(D8=0,0,IF(E8=0,0,((D8/E8)*100)-100)) -> 29.64 | M8: =IF(G8=0,0,((D8/G8)*100)-100) -> 9.66 | N8: =IF(H8=0,0,((D8/H8)*100)-100) -> 37.59 | O8: =IF(D8=0,0,IF(I8=0,0,((D8/I8)*100)-100)) -> 97.44 | Q8: 2700000 | R8: =IF(D8=0,0,((D8/Q8)*100)-100) -> 2.8 | S8: =IF(D8=0,0,(D8/$D$44)*100) -> 2.05 | U8: 16.5 | V8: 14.98 | W8: =V8-U8 -> -1.52
A9: Araucaria | C9: 1600000 | D9: 1613968 | E9: 1248865 | G9: 1482404 | H9: 1278446 | I9: 1127622 | K9: =IF(C9=0,0,((D9/C9)*100)-100) -> 0.87 | L9: =IF(D9=0,0,IF(E9=0,0,((D9/E9)*100)-100)) -> 29.23 | M9: =IF(G9=0,0,((D9/G9)*100)-100) -> 8.88 | N9: =IF(H9=0,0,((D9/H9)*100)-100) -> 26.24 | O9: =IF(D9=0,0,IF(I9=0,0,((D9/I9)*100)-100)) -> 43.13 | Q9: 1600000 | R9: =IF(D9=0,0,((D9/Q9)*100)-100) -> 0.87 | S9: =IF(D9=0,0,(D9/$D$44)*100) -> 1.19 | U9: 16.35 | V9: 15.86 | W9: =V9-U9 -> -0.49
A10: Hauer | C10: 4700000 | D10: 4450850 | E10: 3703759 | G10: 4035050 | H10: 4217488 | I10: 3740747 | K10: =IF(C10=0,0,((D10/C10)*100)-100) -> -5.3 | L10: =IF(D10=0,0,IF(E10=0,0,((D10/E10)*100)-100)) -> 20.17 | M10: =IF(G10=0,0,((D10/G10)*100)-100) -> 10.3 | N10: =IF(H10=0,0,((D10/H10)*100)-100) -> 5.53 | O10: =IF(D10=0,0,IF(I10=0,0,((D10/I10)*100)-100)) -> 18.98 | Q10: 4700000 | R10: =IF(D10=0,0,((D10/Q10)*100)-100) -> -5.3 | S10: =IF(D10=0,0,(D10/$D$44)*100) -> 3.29 | U10: 15.9 | V10: 15 | W10: =V10-U10 -> -0.9
A11: Paranagua | C11: 2670000 | D11: 2814643 | E11: 1923429 | G11: 2420389 | H11: 2411778 | I11: 2096973 | K11: =IF(C11=0,0,((D11/C11)*100)-100) -> 5.42 | L11: =IF(D11=0,0,IF(E11=0,0,((D11/E11)*100)-100)) -> 46.33 | M11: =IF(G11=0,0,((D11/G11)*100)-100) -> 16.29 | N11: =IF(H11=0,0,((D11/H11)*100)-100) -> 16.7 | O11: =IF(D11=0,0,IF(I11=0,0,((D11/I11)*100)-100)) -> 34.22 | Q11: 2670000 | R11: =IF(D11=0,0,((D11/Q11)*100)-100) -> 5.42 | S11: =IF(D11=0,0,(D11/$D$44)*100) -> 2.08 | U11: 17.9 | V11: 15.87 | W11: =V11-U11 -> -2.03
A12: Centenario | C12: 1510000 | D12: 1449006 | E12: 1236381 | G12: 1407684 | H12: 1299733 | I12: 1156486 | K12: =IF(C12=0,0,((D12/C12)*100)-100) -> -4.04 | L12: =IF(D12=0,0,IF(E12=0,0,((D12/E12)*100)-100)) -> 17.2 | M12: =IF(G12=0,0,((D12/G12)*100)-100) -> 2.94 | N12: =IF(H12=0,0,((D12/H12)*100)-100) -> 11.48 | O12: =IF(D12=0,0,IF(I12=0,0,((D12/I12)*100)-100)) -> 25.29 | Q12: 1510000 | R12: =IF(D12=0,0,((D12/Q12)*100)-100) -> -4.04 | S12: =IF(D12=0,0,(D12/$D$44)*100) -> 1.07 | U12: 16 | V12: 14.51 | W12: =V12-U12 -> -1.49
A13: Sitio Cercado | C13: 2699990 | D13: 2872143 | E13: 2263674 | G13: 2390993 | H13: 2254251 | I13: 1654068 | K13: =IF(C13=0,0,((D13/C13)*100)-100) -> 6.38 | L13: =IF(D13=0,0,IF(E13=0,0,((D13/E13)*100)-100)) -> 26.88 | M13: =IF(G13=0,0,((D13/G13)*100)-100) -> 20.12 | N13: =IF(H13=0,0,((D13/H13)*100)-100) -> 27.41 | O13: =IF(D13=0,0,IF(I13=0,0,((D13/I13)*100)-100)) -> 73.64 | Q13: 2700000 | R13: =IF(D13=0,0,((D13/Q13)*100)-100) -> 6.38 | S13: =IF(D13=0,0,(D13/$D$44)*100) -> 2.12 | U13: 15.9 | V13: 14.46 | W13: =V13-U13 -> -1.44
A14: Apucarana | C14: 3400000 | D14: 3563740 | E14: 2500116 | G14: 3136054 | H14: 3265544 | I14: 2437091 | K14: =IF(C14=0,0,((D14/C14)*100)-100) -> 4.82 | L14: =IF(D14=0,0,IF(E14=0,0,((D14/E14)*100)-100)) -> 42.54 | M14: =IF(G14=0,0,((D14/G14)*100)-100) -> 13.64 | N14: =IF(H14=0,0,((D14/H14)*100)-100) -> 9.13 | O14: =IF(D14=0,0,IF(I14=0,0,((D14/I14)*100)-100)) -> 46.23 | Q14: 3400000 | R14: =IF(D14=0,0,((D14/Q14)*100)-100) -> 4.82 | S14: =IF(D14=0,0,(D14/$D$44)*100) -> 2.64 | U14: 17 | V14: 15.46 | W14: =V14-U14 -> -1.54
A15: Ah | C15: 2100000 | D15: 1992791 | E15: 1678604 | G15: 1765243 | H15: 1807683 | I15: 1304102 | K15: =IF(C15=0,0,((D15/C15)*100)-100) -> -5.11 | L15: =IF(D15=0,0,IF(E15=0,0,((D15/E15)*100)-100)) -> 18.72 | M15: =IF(G15=0,0,((D15/G15)*100)-100) -> 12.89 | N15: =IF(H15=0,0,((D15/H15)*100)-100) -> 10.24 | O15: =IF(D15=0,0,IF(I15=0,0,((D15/I15)*100)-100)) -> 52.81 | Q15: 2100000 | R15: =IF(D15=0,0,((D15/Q15)*100)-100) -> -5.11 | S15: =IF(D15=0,0,(D15/$D$44)*100) -> 1.47 | U15: 17.7 | V15: 15.9 | W15: =V15-U15 -> -1.8
A16: P.G. Centro | C16: 2600000 | D16: 2343619 | E16: 1828417 | G16: 2493558 | H16: 2292692 | I16: 1909438 | K16: =IF(C16=0,0,((D16/C16)*100)-100) -> -9.86 | L16: =IF(D16=0,0,IF(E16=0,0,((D16/E16)*100)-100)) -> 28.18 | M16: =IF(G16=0,0,((D16/G16)*100)-100) -> -6.01 | N16: =IF(H16=0,0,((D16/H16)*100)-100) -> 2.22 | O16: =IF(D16=0,0,IF(I16=0,0,((D16/I16)*100)-100)) -> 22.74 | Q16: 2600000 | R16: =IF(D16=0,0,((D16/Q16)*100)-100) -> -9.86 | S16: =IF(D16=0,0,(D16/$D$44)*100) -> 1.73 | U16: 17.8 | V16: 17.19 | W16: =V16-U16 -> -0.61
A17: Maringa | C17: 3500000 | D17: 3215740 | E17: 2812854 | G17: 3246917 | H17: 2857016 | I17: 2493320 | K17: =IF(C17=0,0,((D17/C17)*100)-100) -> -8.12 | L17: =IF(D17=0,0,IF(E17=0,0,((D17/E17)*100)-100)) -> 14.32 | M17: =IF(G17=0,0,((D17/G17)*100)-100) -> -0.96 | N17: =IF(H17=0,0,((D17/H17)*100)-100) -> 12.56 | O17: =IF(D17=0,0,IF(I17=0,0,((D17/I17)*100)-100)) -> 28.97 | Q17: 3500000 | R17: =IF(D17=0,0,((D17/Q17)*100)-100) -> -8.12 | S17: =IF(D17=0,0,(D17/$D$44)*100) -> 2.38 | U17: 17.5 | V17: 15.86 | W17: =V17-U17 -> -1.64
A18: Araucaria Nova | C18: 4400000 | D18: 4741182 | E18: 3809254 | G18: 4167224 | H18: 3517293 | I18: 2697552 | K18: =IF(C18=0,0,((D18/C18)*100)-100) -> 7.75 | L18: =IF(D18=0,0,IF(E18=0,0,((D18/E18)*100)-100)) -> 24.46 | M18: =IF(G18=0,0,((D18/G18)*100)-100) -> 13.77 | N18: =IF(H18=0,0,((D18/H18)*100)-100) -> 34.8 | O18: =IF(D18=0,0,IF(I18=0,0,((D18/I18)*100)-100)) -> 75.76 | Q18: 4400000 | R18: =IF(D18=0,0,((D18/Q18)*100)-100) -> 7.75 | S18: =IF(D18=0,0,(D18/$D$44)*100) -> 3.51 | U18: 16.2 | V18: 15.52 | W18: =V18-U18 -> -0.68
A19: Cristo Rei | C19: 2350000 | D19: 2341252 | E19: 2141745 | G19: 1885774 | H19: 1676192 | I19: 1404831 | K19: =IF(C19=0,0,((D19/C19)*100)-100) -> -0.37 | L19: =IF(D19=0,0,IF(E19=0,0,((D19/E19)*100)-100)) -> 9.32 | M19: =IF(G19=0,0,((D19/G19)*100)-100) -> 24.15 | N19: =IF(H19=0,0,((D19/H19)*100)-100) -> 39.68 | O19: =IF(D19=0,0,IF(I19=0,0,((D19/I19)*100)-100)) -> 66.66 | Q19: 2350000 | R19: =IF(D19=0,0,((D19/Q19)*100)-100) -> -0.37 | S19: =IF(D19=0,0,(D19/$D$44)*100) -> 1.73 | U19: 18.15 | V19: 16.84 | W19: =V19-U19 -> -1.31
A20: Campo Largo | C20: 3400000 | D20: 4029722 | E20: 3430551 | G20: 2976092 | H20: 0 | I20: 0 | K20: =IF(C20=0,0,((D20/C20)*100)-100) -> 18.52 | L20: =IF(D20=0,0,IF(E20=0,0,((D20/E20)*100)-100)) -> 17.47 | M20: =IF(G20=0,0,((D20/G20)*100)-100) -> 35.4 | N20: =IF(H20=0,0,((D20/H20)*100)-100) -> 0 | O20: =IF(D20=0,0,IF(I20=0,0,((D20/I20)*100)-100)) -> 0 | Q20: 3400000 | R20: =IF(D20=0,0,((D20/Q20)*100)-100) -> 18.52 | S20: =IF(D20=0,0,(D20/$D$44)*100) -> 2.98 | U20: 16.5 | V20: 16.28 | W20: =V20-U20 -> -0.22
A21: Brasilia | C21: 3100000 | D21: 2885511 | E21: 2300496 | G21: 2642511 | H21: 1054122 | I21: 922447 | K21: =IF(C21=0,0,((D21/C21)*100)-100) -> -6.92 | L21: =IF(D21=0,0,IF(E21=0,0,((D21/E21)*100)-100)) -> 25.43 | M21: =IF(G21=0,0,((D21/G21)*100)-100) -> 9.2 | N21: =IF(H21=0,0,((D21/H21)*100)-100) -> 173.74 | O21: =IF(D21=0,0,IF(I21=0,0,((D21/I21)*100)-100)) -> 212.81 | Q21: 3100000 | R21: =IF(D21=0,0,((D21/Q21)*100)-100) -> -6.92 | S21: =IF(D21=0,0,(D21/$D$44)*100) -> 2.13 | U21: 16.7 | V21: 15 | W21: =V21-U21 -> -1.7
A22: Total Super | C22: =SUM(C7:C21) -> 44029990 | D22: =SUM(D7:D21) -> 44560430 | E22: =SUM(E7:E21) -> 35840535 | G22: =SUM(G7:G21) -> 39499337 | H22: =SUM(H7:H21) -> 32557014 | I22: =SUM(I7:I21) -> 25292595 | J22: =SUM(C22:I22) -> 221779901 | K22: =IF(D22=0,0,((D22/C22)*100)-100) -> 1.2 | L22: =IF(D22=0,0,IF(E22=0,0,((D22/E22)*100)-100)) -> 24.33 | M22: =IF(G22=0,0,IF(D22=0,0,((D22/G22)*100)-100)) -> 12.81 | N22: =IF(H22=0,0,IF(D22=0,0,((D22/H22)*100)-100)) -> 36.87 | O22: =IF(D22=0,0,IF(I22=0,0,((D22/I22)*100)-100)) -> 76.18 | Q22: =SUM(Q7:Q21) -> 44030000 | R22: =IF(D22=0,0,((D22/Q22)*100)-100) -> 1.2 | S22: =IF(D22=0,0,(D22/$D$44)*100) -> 32.96 | U22: 16.79 | V22: 15.64 | W22: =V22-U22 -> -1.15
A24: Pinheirinho | C24: 5600000 | D24: 6490892 | E24: 4453880 | G24: 5248171 | H24: 4959218 | I24: 3808732 | K24: =IF(C24=0,0,((D24/C24)*100)-100) -> 15.91 | L24: =IF(D24=0,0,IF(E24=0,0,((D24/E24)*100)-100)) -> 45.74 | M24: =IF(G24=0,0,((D24/G24)*100)-100) -> 23.68 | N24: =IF(H24=0,0,((D24/H24)*100)-100) -> 30.89 | O24: =IF(D24=0,0,IF(I24=0,0,((D24/I24)*100)-100)) -> 70.42 | Q24: 5600000 | R24: =IF(D24=0,0,IF(Q24=0,0,((D24/Q24)*100)-100)) -> 15.91 | S24: =IF(D24=0,0,(D24/$D$44)*100) -> 4.8 | U24: 15 | V24: 15 | W24: =V24-U24 -> 0
A25: Londrina | C25: 4400000 | D25: 4486827 | E25: 3459344 | G25: 4177137 | H25: 4065656 | I25: 3290867 | K25: =IF(C25=0,0,((D25/C25)*100)-100) -> 1.97 | L25: =IF(D25=0,0,IF(E25=0,0,((D25/E25)*100)-100)) -> 29.7 | M25: =IF(G25=0,0,((D25/G25)*100)-100) -> 7.41 | N25: =IF(H25=0,0,((D25/H25)*100)-100) -> 10.36 | O25: =IF(D25=0,0,IF(I25=0,0,((D25/I25)*100)-100)) -> 36.34 | Q25: 4400000 | R25: =IF(D25=0,0,IF(Q25=0,0,((D25/Q25)*100)-100)) -> 1.97 | S25: =IF(D25=0,0,(D25/$D$44)*100) -> 3.32 | U25: 16 | V25: 14.44 | W25: =V25-U25 -> -1.56
A26: So Brz | C26: 6250000 | D26: 6287956 | E26: 4964298 | G26: 5776156 | H26: 5600128 | I26: 3799285 | K26: =IF(C26=0,0,((D26/C26)*100)-100) -> 0.61 | L26: =IF(D26=0,0,IF(E26=0,0,((D26/E26)*100)-100)) -> 26.66 | M26: =IF(G26=0,0,((D26/G26)*100)-100) -> 8.86 | N26: =IF(H26=0,0,((D26/H26)*100)-100) -> 12.28 | O26: =IF(D26=0,0,IF(I26=0,0,((D26/I26)*100)-100)) -> 65.5 | Q26: 6250000 | R26: =IF(D26=0,0,IF(Q26=0,0,((D26/Q26)*100)-100)) -> 0.61 | S26: =IF(D26=0,0,(D26/$D$44)*100) -> 4.65 | U26: 15.4 | V26: 14.59 | W26: =V26-U26 -> -0.81
A27: S.J. Pinhais | C27: 6600000 | D27: 7024458 | E27: 5596976 | G27: 6123208 | H27: 6178320 | I27: 5010440 | K27: =IF(C27=0,0,((D27/C27)*100)-100) -> 6.43 | L27: =IF(D27=0,0,IF(E27=0,0,((D27/E27)*100)-100)) -> 25.5 | M27: =IF(G27=0,0,((D27/G27)*100)-100) -> 14.72 | N27: =IF(H27=0,0,((D27/H27)*100)-100) -> 13.7 | O27: =IF(D27=0,0,IF(I27=0,0,((D27/I27)*100)-100)) -> 40.2 | Q27: 6600000 | R27: =IF(D27=0,0,IF(Q27=0,0,((D27/Q27)*100)-100)) -> 6.43 | S27: =IF(D27=0,0,(D27/$D$44)*100) -> 5.2 | U27: 15 | V27: 15.01 | W27: =V27-U27 -> 0.01
A28: P.G. Nova | C28: 6550000 | D28: 6153431 | E28: 4734949 | G28: 6264119 | H28: 5649542 | I28: 4378304 | K28: =IF(C28=0,0,((D28/C28)*100)-100) -> -6.05 | L28: =IF(D28=0,0,IF(E28=0,0,((D28/E28)*100)-100)) -> 29.96 | M28: =IF(G28=0,0,((D28/G28)*100)-100) -> -1.77 | N28: =IF(H28=0,0,((D28/H28)*100)-100) -> 8.92 | O28: =IF(D28=0,0,IF(I28=0,0,((D28/I28)*100)-100)) -> 40.54 | Q28: 6550000 | R28: =IF(D28=0,0,IF(Q28=0,0,((D28/Q28)*100)-100)) -> -6.05 | S28: =IF(D28=0,0,(D28/$D$44)*100) -> 4.55 | U28: 15.5 | V28: 14.82 | W28: =V28-U28 -> -0.68
A29: Nilo Pecanha | C29: 15000000 | D29: 15406385 | E29: 12223727 | G29: 13959308 | H29: 13064868 | I29: 11483309 | K29: =IF(C29=0,0,((D29/C29)*100)-100) -> 2.71 | L29: =IF(D29=0,0,IF(E29=0,0,((D29/E29)*100)-100)) -> 26.04 | M29: =IF(G29=0,0,((D29/G29)*100)-100) -> 10.37 | N29: =IF(H29=0,0,((D29/H29)*100)-100) -> 17.92 | O29: =IF(D29=0,0,IF(I29=0,0,((D29/I29)*100)-100)) -> 34.16 | Q29: 15000000 | R29: =IF(D29=0,0,IF(Q29=0,0,((D29/Q29)*100)-100)) -> 2.71 | S29: =IF(D29=0,0,(D29/$D$44)*100) -> 11.4 | U29: 15 | V29: 15.3 | W29: =V29-U29 -> 0.3
A30: Champagnat | C30: 8100000 | D30: 7478730 | E30: 6326708 | G30: 7386695 | H30: 6827320 | I30: 6062519 | K30: =IF(C30=0,0,((D30/C30)*100)-100) -> -7.67 | L30: =IF(D30=0,0,IF(E30=0,0,((D30/E30)*100)-100)) -> 18.21 | M30: =IF(G30=0,0,((D30/G30)*100)-100) -> 1.25 | N30: =IF(H30=0,0,((D30/H30)*100)-100) -> 9.54 | O30: =IF(D30=0,0,IF(I30=0,0,((D30/I30)*100)-100)) -> 23.36 | Q30: 8100000 | R30: =IF(D30=0,0,IF(Q30=0,0,((D30/Q30)*100)-100)) -> -7.67 | S30: =IF(D30=0,0,(D30/$D$44)*100) -> 5.53 | U30: 16.2 | V30: 15.79 | W30: =V30-U30 -> -0.41
A31: Santa Candida | C31: 7950000 | D31: 8640010 | E31: 6588962 | G31: 7072443 | H31: 6642183 | I31: 5055288 | K31: =IF(C31=0,0,((D31/C31)*100)-100) -> 8.68 | L31: =IF(D31=0,0,IF(E31=0,0,((D31/E31)*100)-100)) -> 31.13 | M31: =IF(G31=0,0,((D31/G31)*100)-100) -> 22.16 | N31: =IF(H31=0,0,((D31/H31)*100)-100) -> 30.08 | O31: =IF(D31=0,0,IF(I31=0,0,((D31/I31)*100)-100)) -> 70.91 | Q31: 7950000 | R31: =IF(D31=0,0,IF(Q31=0,0,((D31/Q31)*100)-100)) -> 8.68 | S31: =IF(D31=0,0,(D31/$D$44)*100) -> 6.39 | U31: 15.5 | V31: 14.83 | W31: =V31-U31 -> -0.67
A32: Paranagu Raia | C32: 8800000 | D32: 9502619 | E32: 6732048 | G32: 8300852 | H32: 7828703 | I32: 6346041 | K32: =IF(C32=0,0,((D32/C32)*100)-100) -> 7.98 | L32: =IF(D32=0,0,IF(E32=0,0,((D32/E32)*100)-100)) -> 41.15 | M32: =IF(G32=0,0,((D32/G32)*100)-100) -> 14.48 | N32: =IF(H32=0,0,((D32/H32)*100)-100) -> 21.38 | O32: =IF(D32=0,0,IF(I32=0,0,((D32/I32)*100)-100)) -> 49.74 | Q32: 8800000 | R32: =IF(D32=0,0,IF(Q32=0,0,((D32/Q32)*100)-100)) -> 7.98 | S32: =IF(D32=0,0,(D32/$D$44)*100) -> 7.03 | U32: 17.3 | V32: 16.3 | W32: =V32-U32 -> -1
A33: Torres | C33: 6500000 | D33: 6528880 | E33: 4957340 | G33: 8083661 | H33: 0 | I33: 0 | K33: =IF(C33=0,0,((D33/C33)*100)-100) -> 0.44 | L33: =IF(D33=0,0,IF(E33=0,0,((D33/E33)*100)-100)) -> 31.7 | M33: =IF(G33=0,0,((D33/G33)*100)-100) -> -19.23 | N33: =IF(H33=0,0,((D33/H33)*100)-100) -> 0 | O33: =IF(D33=0,0,IF(I33=0,0,((D33/I33)*100)-100)) -> 0 | Q33: 6500000 | R33: =IF(D33=0,0,IF(Q33=0,0,((D33/Q33)*100)-100)) -> 0.44 | S33: =IF(D33=0,0,(D33/$D$44)*100) -> 4.83 | U33: 15.45 | V33: 15.12 | W33: =V33-U33 -> -0.33
A34: Total Hiper | C34: =SUM(C24:C33) -> 75750000 | D34: =SUM(D24:D33) -> 78000188 | E34: =SUM(E24:E33) -> 60038232 | G34: =SUM(G24:G33) -> 72391750 | H34: =SUM(H24:H33) -> 60815938 | I34: =SUM(I24:I33) -> 49234785 | J34: =SUM(C34:I34) -> 396230893 | K34: =IF(D34=0,0,((D34/C34)*100)-100) -> 2.97 | L34: =IF(D34=0,0,IF(E34=0,0,((D34/E34)*100)-100)) -> 29.92 | M34: =IF(G34=0,0,IF(D34=0,0,((D34/G34)*100)-100)) -> 7.75 | N34: =IF(H34=0,0,IF(D34=0,0,((D34/H34)*100)-100)) -> 28.26 | O34: =IF(D34=0,0,IF(I34=0,0,((D34/I34)*100)-100)) -> 58.42 | Q34: =SUM(Q24:Q33) -> 75750000 | R34: =IF(D34=0,0,((D34/Q34)*100)-100) -> 2.97 | S34: =IF(D34=0,0,(D34/$D$44)*100) -> 57.7 | U34: 15.62 | V34: 15.21 | W34: =V34-U34 -> -0.41
A36: Total s/ 27, 32 | B36: =B22+B34 -> 0 | C36: =C22+C34 -> 119779990 | D36: =D22+D34 -> 122560618 | E36: =E22+E34 -> 95878767 | F36: =F22+F34 -> 0 | G36: =G22+G34 -> 111891087 | H36: =H22+H34 -> 93372952 | I36: =I22+I34 -> 74527380 | J36: =SUM(C36:I36) -> 618010794 | K36: =IF(D36=0,0,((D36/C36)*100)-100) -> 2.32 | L36: =IF(D36=0,0,IF(E36=0,0,((D36/E36)*100)-100)) -> 27.83 | M36: =IF(G36=0,0,IF(D36=0,0,((D36/G36)*100)-100)) -> 9.54 | N36: =IF(H36=0,0,IF(D36=0,0,((D36/H36)*100)-100)) -> 31.26 | O36: =IF(D36=0,0,IF(I36=0,0,((D36/I36)*100)-100)) -> 64.45 | Q36: =Q22+Q34 -> 119780000 | R36: =IF(D36=0,0,((D36/Q36)*100)-100) -> 2.32 | S36: =IF(D36=0,0,(D36/$D$44)*100) -> 90.67 | U36: 16.05 | V36: 15.36 | W36: =V36-U36 -> -0.69
A38: Campo Largo | C38: 0 | D38: 0 | E38: 0 | G38: 0 | H38: 0 | I38: 0 | K38: =IF(C38=0,0,((D38/C38)*100)-100) -> 0 | L38: =IF(D38=0,0,IF(E38=0,0,((D38/E38)*100)-100)) -> 0 | M38: =IF(G38=0,0,((D38/G38)*100)-100) -> 0 | N38: =IF(H38=0,0,((D38/H38)*100)-100) -> 0 | O38: =IF(D38=0,0,IF(I38=0,0,((D38/I38)*100)-100)) -> 0 | Q38: 0 | R38: =IF(Q38=0,0,IF(D38=0,0,((D38/Q38)*100)-100)) -> 0 | S38: =IF(D38=0,0,(D38/$D$44)*100) -> 0 | U38: 0 | V38: 0 | W38: =V38-U38 -> 0
A39: Uvaranas | C39: 6300000 | D39: 5949870 | E39: 4591080 | G39: 0 | H39: 0 | I39: 0 | K39: =IF(C39=0,0,((D39/C39)*100)-100) -> -5.56 | L39: =IF(D39=0,0,IF(E39=0,0,((D39/E39)*100)-100)) -> 29.6 | M39: =IF(G39=0,0,((D39/G39)*100)-100) -> 0 | N39: =IF(H39=0,0,((D39/H39)*100)-100) -> 0 | O39: =IF(D39=0,0,IF(I39=0,0,((D39/I39)*100)-100)) -> 0 | Q39: 6300000 | R39: =IF(Q39=0,0,IF(D39=0,0,((D39/Q39)*100)-100)) -> -5.56 | S39: =IF(D39=0,0,(D39/$D$44)*100) -> 4.4 | U39: 15.15 | V39: 14.36 | W39: =V39-U39 -> -0.79
A40: Novo Mundo | C40: 6500000 | D40: 6667828 | E40: 5919007 | G40: 0 | H40: 0 | I40: 0 | K40: =IF(C40=0,0,((D40/C40)*100)-100) -> 2.58 | L40: =IF(D40=0,0,IF(E40=0,0,((D40/E40)*100)-100)) -> 12.65 | M40: =IF(G40=0,0,((D40/G40)*100)-100) -> 0 | N40: =IF(H40=0,0,((D40/H40)*100)-100) -> 0 | O40: =IF(D40=0,0,IF(I40=0,0,((D40/I40)*100)-100)) -> 0 | Q40: 6500000 | R40: =IF(Q40=0,0,IF(D40=0,0,((D40/Q40)*100)-100)) -> 2.58 | S40: =IF(D40=0,0,(D40/$D$44)*100) -> 4.93 | U40: 14.8 | V40: 14.15 | W40: =V40-U40 -> -0.65
A41: Torres | C41: 0 | D41: 0 | E41: 0 | G41: 0 | H41: 0 | I41: 0 | K41: =IF(C41=0,0,((D41/C41)*100)-100) -> 0 | L41: =IF(D41=0,0,IF(E41=0,0,((D41/E41)*100)-100)) -> 0 | M41: =IF(G41=0,0,((D41/G41)*100)-100) -> 0 | N41: =IF(H41=0,0,((D41/H41)*100)-100) -> 0 | O41: =IF(D41=0,0,IF(I41=0,0,((D41/I41)*100)-100)) -> 0 | Q41: 0 | R41: =IF(Q41=0,0,IF(D41=0,0,((D41/Q41)*100)-100)) -> 0 | S41: =IF(D41=0,0,(D41/$D$44)*100) -> 0 | U41: 0 | V41: 0 | W41: =V41-U41 -> 0
A42: Total Lojas Novas | C42: =SUM(C38:C41) -> 12800000 | D42: =SUM(D38:D41) -> 12617698 | E42: =SUM(E38:E41) -> 10510087 | G42: =SUM(G38:G41) -> 0 | H42: =SUM(H38:H41) -> 0 | I42: =SUM(I38:I41) -> 0 | K42: =IF(D42=0,0,((D42/C42)*100)-100) -> -1.42 | L42: =IF(D42=0,0,IF(E42=0,0,((D42/E42)*100)-100)) -> 20.05 | M42: =IF(G42=0,0,IF(D42=0,0,((D42/G42)*100)-100)) -> 0 | N42: =IF(H42=0,0,IF(D42=0,0,((D42/H42)*100)-100)) -> 0 | O42: =IF(D42=0,0,IF(I42=0,0,((D42/I42)*100)-100)) -> 0 | Q42: =SUM(Q38:Q41) -> 12800000 | R42: =IF(Q42=0,0,IF(D42=0,0,((D42/Q42)*100)-100)) -> -1.42 | S42: =IF(D42=0,0,(D42/$D$44)*100) -> 9.33
A44: Total Geral | C44: =C22+C34+C42 -> 132579990 | D44: =D22+D34+D42 -> 135178316 | E44: =E22+E34+E42 -> 106388854 | G44: =G22+G34+G42 -> 111891087 | H44: =H22+H34+H42 -> 93372952 | I44: =I22+I34+I42 -> 74527380 | K44: =IF(D44=0,0,((D44/C44)*100)-100) -> 1.96 | L44: =IF(D44=0,0,IF(E44=0,0,((D44/E44)*100)-100)) -> 27.06 | M44: =IF(G44=0,0,IF(D44=0,0,((D44/G44)*100)-100)) -> 20.81 | N44: =IF(H44=0,0,IF(D44=0,0,((D44/H44)*100)-100)) -> 44.77 | O44: =IF(D44=0,0,IF(I44=0,0,((D44/I44)*100)-100)) -> 81.38 | Q44: =Q22+Q34+Q42 -> 132580000 | R44: =IF(D44=0,0,((D44/Q44)*100)-100) -> 1.96 | S44: =S22+S34+S42 -> 99.99 | U44: 15.95 | V44: 15.26 | W44: =V44-U44 -> -0.69
C45: Resumo por Regiao - Outubro/2002
C46: Descricao das Aberturas | H46: Valor | I46: % | M46: Margem Comercial | R46: Meta | S46: Real | U46: Dif
C47: Curitiba (3,6,7,10,11,13,17,21,22,24,26,27,28,34) | H47: 67920212 | I47: =IF(D44=0,0,H47/$D$44) -> 0.50239999999999996 | L47: 99 | M47: Empresa | R47: 15.94 | S47: 15.26 | U47: =S47-R47 -> -0.68
C48: Curitiba e Metrop. (Ctba. 4,5,8,14,23,25;31) | H48: 93683107 | I48: =IF(D44=0,0,H48/$D$44) -> 0.69299999999999995 | L48: 207 | M48: Super | R48: 16.78 | S48: 15.64 | U48: =S48-R48 -> -1.14
C49: Metropolitana (4,5,8,14,23,25;31) | H49: 25762895 | I49: =IF(D44=0,0,H49/$D$44) -> 0.19059999999999999 | L49: 208 | M49: Hiper | R49: 15.52 | S49: 15.07 | U49: =S49-R49 -> -0.45
C50: Norte (9,15,20) | H50: =D25+D15+D18 -> 11220800 | I50: =IF(D44=0,0,H50/$D$44) -> 8.3000000000000004E-2 | L50: 204 | M50: Regional Gilberto | R50: 15.37 | S50: 15.02 | U50: =S50-R50 -> -0.35
C51: Ponta Grossa (18,19,32) | H51: =D17+D28+D39 -> 15319041 | I51: =IF(D44=0,0,H51/$D$44) -> 0.1133 | L51: 205 | M51: Regional Edison | R51: 16.75 | S51: 15.7 | U51: =S51-R51 -> -1.05
C52: Super (3,4,5,7,8,10,13,15,17,18,20,23,26,28,34) | H52: 44560430 | I52: =IF(D44=0,0,H52/$D$44) -> 0.3296 | L52: 206 | M52: Regional Jorge | R52: 16.76 | S52: 15.16 | U52: =S52-R52 -> -1.6
C53: Hiper (6,9,11,14,19,21,22,24,25,26,27) | H53: 78000188 | I53: =IF(D44=0,0,H53/$D$44) -> 0.57699999999999996 | L53: 209 | M53: Regio - Curitiba | R53: 16.76 | S53: 15.12 | U53: =S53-R53 -> -1.64
C54: Curitiba, Metropolitana e Ponta Grossa | H54: =D44-H50 -> 123957516 | I54: =IF(D44=0,0,H54/$D$44) -> 0.91700000000000004 | L54: 200 | M54: Regio - Metropolitana | R54: 0 | S54: 15.73 | U54: =S54-R54 -> 15.73
C55: Araucaria | H55: =D9+D19 -> 3955220 | I55: =IF(D44=0,0,H55/$D$44) -> 2.93E-2 | L55: 201 | M55: Regio - Centro Oeste | R55: 15.65 | S55: 15.02 | U55: =S55-R55 -> -0.63