A2: Periodo: | B2: 41183 | C2: a | D2: 41192 | G2: Vendas Acumuladas por Filial | P2: =NOW() -> 41193.354557754632
A4: v.New | B4: Vendas 2012 | F4: Vendas de Anos Anteriores | J4: Percentuais ( % ) | P4: Meta Mensal | T4: Margem
A5: Lojas | B5: Previsao | C5: Realizada | D5: Mes Anterior | F5: Vendas 2011 | G5: Vendas 2010 | H5: Vendas 2009 | J5: % Prev | K5: % MA | L5: 2011 | M5: 2010 | N5: 2009 | P5: Previsao Mes | Q5: Final | R5: Part. | T5: Meta | U5: Coml | V5: Sell O. | W5: Dif
A6: S. Felicidade | B6: 1510000 | C6: 1519598.94 | D6: 1659016.31 | F6: 1365759.82 | G6: 1203620.93 | H6: 1053959.57 | J6: =IF(B6=0,0,((C6/B6)*100)-100) -> 0.63569139072848202 | K6: =IF(C6=0,0,IF(D6=0,0,((C6/D6)*100)-100)) -> -8.4036165985613565 | L6: =IF(F6=0,0,((C6/F6)*100)-100) -> 11.26399515838736 | M6: =IF(G6=0,0,((C6/G6)*100)-100) -> 26.252286091435778 | N6: =IF(C6=0,0,IF(H6=0,0,((C6/H6)*100)-100)) -> 44.18000303370269 | P6: 4500000 | Q6: =IF(C6=0,0,((C6/P6)*100)-100) -> -66.231134666666662 | R6: =IF(C6=0,0,(C6/$C$44)*100) -> 2.2561832206372521 | T6: 17.25 | U6: 17.358983443355125 | V6: 19.14460998505303 | W6: =U6-T6 -> 0.10898344335512533
A7: Lapa | B7: 1130000 | C7: 1101911.88 | D7: 1258191.09 | F7: 1084992.83 | G7: 999144.86 | H7: 948468.32 | J7: =IF(B7=0,0,((C7/B7)*100)-100) -> -2.4856743362831963 | K7: =IF(C7=0,0,IF(D7=0,0,((C7/D7)*100)-100)) -> -12.4209439442144 | L7: =IF(F7=0,0,((C7/F7)*100)-100) -> 1.559369751779812 | M7: =IF(G7=0,0,((C7/G7)*100)-100) -> 10.285497540366649 | N7: =IF(C7=0,0,IF(H7=0,0,((C7/H7)*100)-100)) -> 16.178037448841721 | P7: 3100000 | Q7: =IF(C7=0,0,((C7/P7)*100)-100) -> -64.454455483870973 | R7: =IF(C7=0,0,(C7/$C$44)*100) -> 1.6360337118140191 | T7: 15.15 | U7: 15.690846576588321 | V7: 17.905445243044298 | W7: =U7-T7 -> 0.54084657658832036
A8: Araucaria | B8: 674999 | C8: 612884.63 | D8: 574015.02 | F8: 590599.82 | G8: 579817.68 | H8: 560128.57 | J8: =IF(B8=0,0,((C8/B8)*100)-100) -> -9.2021425216926218 | K8: =IF(C8=0,0,IF(D8=0,0,((C8/D8)*100)-100)) -> 6.7715318668839046 | L8: =IF(F8=0,0,((C8/F8)*100)-100) -> 3.7732503880546489 | M8: =IF(G8=0,0,((C8/G8)*100)-100) -> 5.7029909815788926 | N8: =IF(C8=0,0,IF(H8=0,0,((C8/H8)*100)-100)) -> 9.4185625989404684 | P8: 1700000 | Q8: =IF(C8=0,0,((C8/P8)*100)-100) -> -63.947962941176471 | R8: =IF(C8=0,0,(C8/$C$44)*100) -> 0.9099637950474424 | T8: 16.5 | U8: 17.333563104690679 | V8: 18.953187470209524 | W8: =U8-T8 -> 0.83356310469067907
A9: Hauer | B9: 1740000 | C9: 1623507.78 | D9: 1795709.57 | F9: 1576391.42 | G9: 1529601.69 | H9: 1429884.05 | J9: =IF(B9=0,0,((C9/B9)*100)-100) -> -6.694955172413799 | K9: =IF(C9=0,0,IF(D9=0,0,((C9/D9)*100)-100)) -> -9.5896236717165806 | L9: =IF(F9=0,0,((C9/F9)*100)-100) -> 2.9888744256169701 | M9: =IF(G9=0,0,((C9/G9)*100)-100) -> 6.1392511929036999 | N9: =IF(C9=0,0,IF(H9=0,0,((C9/H9)*100)-100)) -> 13.541218954082339 | P9: 5200000 | Q9: =IF(C9=0,0,((C9/P9)*100)-100) -> -68.778696538461531 | R9: =IF(C9=0,0,(C9/$C$44)*100) -> 2.4104590463915665 | T9: 16.61 | U9: 17.058466088779689 | V9: 18.575645445936821 | W9: =U9-T9 -> 0.44846608877968919
A10: Paranagua | B10: 1000000 | C10: 998988.89 | D10: 943237.54 | F10: 824786.51 | G10: 817805.99 | H10: 815225.31 | J10: =IF(B10=0,0,((C10/B10)*100)-100) -> -0.10111100000000306 | K10: =IF(C10=0,0,IF(D10=0,0,((C10/D10)*100)-100)) -> 5.9106373141170678 | L10: =IF(F10=0,0,((C10/F10)*100)-100) -> 21.12090557834172 | M10: =IF(G10=0,0,((C10/G10)*100)-100) -> 22.154753354154337 | N10: =IF(C10=0,0,IF(H10=0,0,((C10/H10)*100)-100)) -> 22.541446854735156 | P10: 2700000 | Q10: =IF(C10=0,0,((C10/P10)*100)-100) -> -63.000411481481486 | R10: =IF(C10=0,0,(C10/$C$44)*100) -> 1.4832216000499669 | T10: 17.82 | U10: 17.856400585195697 | V10: 19.858463571101375 | W10: =U10-T10 -> 3.6400585195696777E-2
A11: Sitio Cercado | B11: 1474000 | C11: 1341663.51 | D11: 1525833.97 | F11: 1272948.52 | G11: 1056681.14 | H11: 874239.64 | J11: =IF(B11=0,0,((C11/B11)*100)-100) -> -8.9780522388059723 | K11: =IF(C11=0,0,IF(D11=0,0,((C11/D11)*100)-100)) -> -12.07015072550783 | L11: =IF(F11=0,0,((C11/F11)*100)-100) -> 5.3980965388922471 | M11: =IF(G11=0,0,((C11/G11)*100)-100) -> 26.969570971996347 | N11: =IF(C11=0,0,IF(H11=0,0,((C11/H11)*100)-100)) -> 53.46633218324439 | P11: 4100000 | Q11: =IF(C11=0,0,((C11/P11)*100)-100) -> -67.276499756097564 | R11: =IF(C11=0,0,(C11/$C$44)*100) -> 1.9919984275609457 | T11: 15.85 | U11: 15.399269187845766 | V11: 17.499731218001152 | W11: =U11-T11 -> -0.45073081215423372
A12: Apucarana | B12: 1074000 | C12: 1045823.97 | D12: 1168678.13 | F12: 932678.62 | G12: 1107328.75 | H12: 1113754.2 | J12: =IF(B12=0,0,((C12/B12)*100)-100) -> -2.6234664804469361 | K12: =IF(C12=0,0,IF(D12=0,0,((C12/D12)*100)-100)) -> -10.51223231156041 | L12: =IF(F12=0,0,((C12/F12)*100)-100) -> 12.131225866419015 | M12: =IF(G12=0,0,((C12/G12)*100)-100) -> -5.554337860368932 | N12: =IF(C12=0,0,IF(H12=0,0,((C12/H12)*100)-100)) -> -6.0992120164395374 | P12: 3200000 | Q12: =IF(C12=0,0,((C12/P12)*100)-100) -> -67.318000937500003 | R12: =IF(C12=0,0,(C12/$C$44)*100) -> 1.5527587120153143 | T12: 15.3 | U12: 16.033979341666839 | V12: 18.329075341426723 | W12: =U12-T12 -> 0.73397934166683854
A13: Ahú | B13: 897500 | C13: 881516.13 | D13: 922849.37 | F13: 851726.05 | G13: 659473.94 | H13: 630309.4 | J13: =IF(B13=0,0,((C13/B13)*100)-100) -> -1.7809325905292468 | K13: =IF(C13=0,0,IF(D13=0,0,((C13/D13)*100)-100)) -> -4.4788717794757815 | L13: =IF(F13=0,0,((C13/F13)*100)-100) -> 3.4976128768164187 | M13: =IF(G13=0,0,((C13/G13)*100)-100) -> 33.669592766622458 | N13: =IF(C13=0,0,IF(H13=0,0,((C13/H13)*100)-100)) -> 39.854511133738441 | P13: 2700000 | Q13: =IF(C13=0,0,((C13/P13)*100)-100) -> -67.351254444444436 | R13: =IF(C13=0,0,(C13/$C$44)*100) -> 1.3088071127682457 | T13: 16.68 | U13: 17.259755984272232 | V13: 19.206455189878373 | W13: =U13-T13 -> 0.57975598427223218
A14: P.G. Centro | B14: 896997 | C14: 946662.94 | D14: 846847.62 | F14: 799505.79 | G14: 741178.7 | H14: 800662.52 | J14: =IF(B14=0,0,((C14/B14)*100)-100) -> 5.5369126095182111 | K14: =IF(C14=0,0,IF(D14=0,0,((C14/D14)*100)-100)) -> 11.786691919852103 | L14: =IF(F14=0,0,((C14/F14)*100)-100) -> 18.406014295406152 | M14: =IF(G14=0,0,((C14/G14)*100)-100) -> 27.723980735010329 | N14: =IF(C14=0,0,IF(H14=0,0,((C14/H14)*100)-100)) -> 18.234951225142893 | P14: 2600000 | Q14: =IF(C14=0,0,((C14/P14)*100)-100) -> -63.589886923076925 | R14: =IF(C14=0,0,(C14/$C$44)*100) -> 1.4055320681041865 | T14: 18.03 | U14: 17.584708354591339 | V14: 19.266244055143851 | W14: =U14-T14 -> -0.44529164540866262
A15: Maringa | B15: 1490000 | C15: 1485032.93 | D15: 1414627.72 | F15: 1260977.48 | G15: 1142118.91 | H15: 1192434.3 | J15: =IF(B15=0,0,((C15/B15)*100)-100) -> -0.33336040268456202 | K15: =IF(C15=0,0,IF(D15=0,0,((C15/D15)*100)-100)) -> 4.9769426262904091 | L15: =IF(F15=0,0,((C15/F15)*100)-100) -> 17.768394246025693 | M15: =IF(G15=0,0,((C15/G15)*100)-100) -> 30.024371105106752 | N15: =IF(C15=0,0,IF(H15=0,0,((C15/H15)*100)-100)) -> 24.537924647085376 | P15: 4600000 | Q15: =IF(C15=0,0,((C15/P15)*100)-100) -> -67.716675434782616 | R15: =IF(C15=0,0,(C15/$C$44)*100) -> 2.2048622768582447 | T15: 16.95 | U15: 17.460514138228572 | V15: 19.360049147192985 | W15: =U15-T15 -> 0.51051413822857228
A16: Centenario | B16: 0 | C16: 0 | D16: 0 | F16: 0 | G16: 0 | H16: 0 | J16: =IF(B16=0,0,((C16/B16)*100)-100) -> 0 | K16: =IF(C16=0,0,IF(D16=0,0,((C16/D16)*100)-100)) -> 0 | L16: =IF(F16=0,0,((C16/F16)*100)-100) -> 0 | M16: =IF(G16=0,0,((C16/G16)*100)-100) -> 0 | N16: =IF(C16=0,0,IF(H16=0,0,((C16/H16)*100)-100)) -> 0 | P16: 0 | Q16: =IF(C16=0,0,((C16/P16)*100)-100) -> 0 | R16: =IF(C16=0,0,(C16/$C$44)*100) -> 0 | T16: 0 | U16: 0 | V16: 0 | W16: =U16-T16 -> 0
A17: Cristo Rei | B17: 1195000 | C17: 1148374.26 | D17: 1149464.96 | F17: 1035689.21 | G17: 878649.67 | H17: 788933.03 | J17: =IF(B17=0,0,((C17/B17)*100)-100) -> -3.9017355648535528 | K17: =IF(C17=0,0,IF(D17=0,0,((C17/D17)*100)-100)) -> -9.4887624934642645E-2 | L17: =IF(F17=0,0,((C17/F17)*100)-100) -> 10.880199282948993 | M17: =IF(G17=0,0,((C17/G17)*100)-100) -> 30.697626051575241 | N17: =IF(C17=0,0,IF(H17=0,0,((C17/H17)*100)-100)) -> 45.560423550779717 | P17: 3600000 | Q17: =IF(C17=0,0,((C17/P17)*100)-100) -> -68.100715000000008 | R17: =IF(C17=0,0,(C17/$C$44)*100) -> 1.7050174675850467 | T17: 17.78 | U17: 18.001351588984587 | V17: 19.653384106676164 | W17: =U17-T17 -> 0.22135158898458585
A18: Fazenda | B18: 1605000 | C18: 1604028.43 | D18: 1835104.19 | F18: 1345389.37 | G18: 1123340.79 | H18: 0 | J18: =IF(B18=0,0,((C18/B18)*100)-100) -> -6.0533956386294108E-2 | K18: =IF(C18=0,0,IF(D18=0,0,((C18/D18)*100)-100)) -> -12.59196950555706 | L18: =IF(F18=0,0,((C18/F18)*100)-100) -> 19.224104617386701 | M18: =IF(G18=0,0,((C18/G18)*100)-100) -> 42.79090052449709 | N18: =IF(C18=0,0,IF(H18=0,0,((C18/H18)*100)-100)) -> 0 | P18: 4800000 | Q18: =IF(C18=0,0,((C18/P18)*100)-100) -> -66.582741041666665 | R18: =IF(C18=0,0,(C18/$C$44)*100) -> 2.3815376109640582 | T18: 14 | U18: 16.734339982988956 | V18: 18.469532899737942 | W18: =U18-T18 -> 2.7343399829889563
A19: Campo Largo | B19: 1690000 | C19: 1757670.1 | D19: 1913301.17 | F19: 1743230.13 | G19: 1515572.04 | H19: 1319924.69 | J19: =IF(B19=0,0,((C19/B19)*100)-100) -> 4.0041479289940867 | K19: =IF(C19=0,0,IF(D19=0,0,((C19/D19)*100)-100)) -> -8.1341647849407792 | L19: =IF(F19=0,0,((C19/F19)*100)-100) -> 0.82834559542635589 | M19: =IF(G19=0,0,((C19/G19)*100)-100) -> 15.974038423142204 | N19: =IF(C19=0,0,IF(H19=0,0,((C19/H19)*100)-100)) -> 33.164423191447383 | P19: 5100000 | Q19: =IF(C19=0,0,((C19/P19)*100)-100) -> -65.535880392156855 | R19: =IF(C19=0,0,(C19/$C$44)*100) -> 2.6096529042299812 | T19: 16.3 | U19: 16.468913449685466 | V19: 18.547552040624687 | W19: =U19-T19 -> 0.16891344968546562
A20: Brasilia | B20: 1180000 | C20: 1149298.73 | D20: 1322755.89 | F20: 1174106.31 | G20: 1000064.5 | H20: 941369.47 | J20: =IF(B20=0,0,((C20/B20)*100)-100) -> -2.6018025423728801 | K20: =IF(C20=0,0,IF(D20=0,0,((C20/D20)*100)-100)) -> -13.113316017817908 | L20: =IF(F20=0,0,((C20/F20)*100)-100) -> -2.1128904417522563 | M20: =IF(G20=0,0,((C20/G20)*100)-100) -> 14.922460501297664 | N20: =IF(C20=0,0,IF(H20=0,0,((C20/H20)*100)-100)) -> 22.087954477639897 | P20: 3750000 | Q20: =IF(C20=0,0,((C20/P20)*100)-100) -> -69.352033866666673 | R20: =IF(C20=0,0,(C20/$C$44)*100) -> 1.7063900492887312 | T20: 15.8 | U20: 15.448236604246487 | V20: 18.120902500257703 | W20: =U20-T20 -> -0.35176339575351356
A21: Cajuru | B21: 2100000 | C21: 2020757.57 | D21: 2228687.49 | F21: 1971058.96 | G21: 1913509.96 | H21: 0 | J21: =IF(B21=0,0,((C21/B21)*100)-100) -> -3.773449047619053 | K21: =IF(C21=0,0,IF(D21=0,0,((C21/D21)*100)-100)) -> -9.3297028377899807 | L21: =IF(F21=0,0,((C21/F21)*100)-100) -> 2.5214167109440524 | M21: =IF(G21=0,0,((C21/G21)*100)-100) -> 5.6047583886106338 | N21: =IF(C21=0,0,IF(H21=0,0,((C21/H21)*100)-100)) -> 0 | P21: 6200000 | Q21: =IF(C21=0,0,((C21/P21)*100)-100) -> -67.407135967741937 | R21: =IF(C21=0,0,(C21/$C$44)*100) -> 3.0002648741053397 | T21: 16.2 | U21: 16.168122275053506 | V21: 18.197361705293524 | W21: =U21-T21 -> -3.1877724946493657E-2
A22: Total Super | B22: =SUM(B6:B21) -> 19657496 | C22: =SUM(C6:C21) -> 19237720.689999998 | D22: =SUM(D6:D21) -> 20558320.039999999 | F22: =SUM(F6:F21) -> 17829840.84 | G22: =SUM(G6:G21) -> 16267909.550000001 | H22: =SUM(H6:H21) -> 12469293.07 | I22: =SUM(B22:H22) -> 106020580.19 | J22: =IF(C22=0,0,((C22/B22)*100)-100) -> -2.1354464983739661 | K22: =IF(C22=0,0,IF(D22=0,0,((C22/D22)*100)-100)) -> -6.4236734686031269 | L22: =IF(F22=0,0,IF(C22=0,0,((C22/F22)*100)-100)) -> 7.8961997621510847 | M22: =IF(G22=0,0,IF(C22=0,0,((C22/G22)*100)-100)) -> 18.25564084231091 | N22: =IF(C22=0,0,IF(H22=0,0,((C22/H22)*100)-100)) -> 54.280764611140853 | P22: =SUM(P6:P21) -> 57850000 | Q22: =IF(C22=0,0,((C22/P22)*100)-100) -> -66.745513068280047 | R22: =IF(C22=0,0,(C22/$C$44)*100) -> 28.562682877420336 | T22: 16.337164174419776 | U22: 16.734487348979179 | V22: 18.68186007434959 | W22: =U22-T22 -> 0.39732317455940347
A23: Pinheirinho | B23: 1878000 | C23: 1859988.12 | D23: 2042771.38 | F23: 1961462.07 | G23: 1799423.4 | H23: 1865405.97 | J23: =IF(B23=0,0,((C23/B23)*100)-100) -> -0.95909904153353409 | K23: =IF(C23=0,0,IF(D23=0,0,((C23/D23)*100)-100)) -> -8.9478079529389021 | L23: =IF(F23=0,0,((C23/F23)*100)-100) -> -5.1733832405946032 | M23: =IF(G23=0,0,((C23/G23)*100)-100) -> 3.3657848397436823 | N23: =IF(C23=0,0,IF(H23=0,0,((C23/H23)*100)-100)) -> -0.29043811841128786 | P23: 5800000 | Q23: =IF(C23=0,0,IF(P23=0,0,((C23/P23)*100)-100)) -> -67.931239310344836 | R23: =IF(C23=0,0,(C23/$C$44)*100) -> 2.7615668032307443 | T23: 16.25 | U23: 15.945284596763981 | V23: 17.81915103844857 | W23: =U23-T23 -> -0.30471540323601864
A24: Londrina | B24: 2530000 | C24: 2327791.22 | D24: 1850880.82 | F24: 1940945.79 | G24: 1690795.91 | H24: 1354752.47 | J24: =IF(B24=0,0,((C24/B24)*100)-100) -> -7.9924418972331921 | K24: =IF(C24=0,0,IF(D24=0,0,((C24/D24)*100)-100)) -> 25.766672540266541 | L24: =IF(F24=0,0,((C24/F24)*100)-100) -> 19.930769421437589 | M24: =IF(G24=0,0,((C24/G24)*100)-100) -> 37.674287371561036 | N24: =IF(C24=0,0,IF(H24=0,0,((C24/H24)*100)-100)) -> 71.824098611903651 | P24: 7500000 | Q24: =IF(C24=0,0,IF(P24=0,0,((C24/P24)*100)-100)) -> -68.962783733333339 | R24: =IF(C24=0,0,(C24/$C$44)*100) -> 3.4561247401967248 | T24: 16.58 | U24: 16.203672458219856 | V24: 17.956435379973637 | W24: =U24-T24 -> -0.37632754178014238
A25: São Bráz | B25: 2077000 | C25: 2045850.6 | D25: 2290183.5 | F25: 2268607.68 | G25: 2098376.73 | H25: 1924350.88 | J25: =IF(B25=0,0,((C25/B25)*100)-100) -> -1.4997303803562829 | K25: =IF(C25=0,0,IF(D25=0,0,((C25/D25)*100)-100)) -> -10.668704057993608 | L25: =IF(F25=0,0,((C25/F25)*100)-100) -> -9.8191098427384418 | M25: =IF(G25=0,0,((C25/G25)*100)-100) -> -2.5031792074819634 | N25: =IF(C25=0,0,IF(H25=0,0,((C25/H25)*100)-100)) -> 6.3138028133414252 | P25: 6400000 | Q25: =IF(C25=0,0,IF(P25=0,0,((C25/P25)*100)-100)) -> -68.033584375000004 | R25: =IF(C25=0,0,(C25/$C$44)*100) -> 3.0375210683225764 | T25: 16.2 | U25: 15.500928127400895 | V25: 17.225344094040885 | W25: =U25-T25 -> -0.69907187259910408
A26: S.J. Pinhais | B26: 2373700 | C26: 2372977.04 | D26: 2509142.9 | F26: 2806429.71 | G26: 2379256.67 | H26: 2166342.6 | J26: =IF(B26=0,0,((C26/B26)*100)-100) -> -3.0457092303151967E-2 | K26: =IF(C26=0,0,IF(D26=0,0,((C26/D26)*100)-100)) -> -5.4267877688432833 | L26: =IF(F26=0,0,((C26/F26)*100)-100) -> -15.444985792998892 | M26: =IF(G26=0,0,((C26/G26)*100)-100) -> -0.26393243230877772 | N26: =IF(C26=0,0,IF(H26=0,0,((C26/H26)*100)-100)) -> 9.5384008051173481 | P26: 6900000 | Q26: =IF(C26=0,0,IF(P26=0,0,((C26/P26)*100)-100)) -> -65.60902840579709 | R26: =IF(C26=0,0,(C26/$C$44)*100) -> 3.523213158207029 | T26: 16.6 | U26: 16.642317335695754 | V26: 18.158370179595167 | W26: =U26-T26 -> 4.2317335695752689E-2
A27: P.G. Nova | B27: 2835000 | C27: 2758710.58 | D27: 2910493.08 | F27: 2636319.63 | G27: 2238249.01 | H27: 2023719.3 | J27: =IF(B27=0,0,((C27/B27)*100)-100) -> -2.6909848324514911 | K27: =IF(C27=0,0,IF(D27=0,0,((C27/D27)*100)-100)) -> -5.2150098223219317 | L27: =IF(F27=0,0,((C27/F27)*100)-100) -> 4.6424928376382013 | M27: =IF(G27=0,0,((C27/G27)*100)-100) -> 23.25306825445665 | N27: =IF(C27=0,0,IF(H27=0,0,((C27/H27)*100)-100)) -> 36.318835324642095 | P27: 8300000 | Q27: =IF(C27=0,0,IF(P27=0,0,((C27/P27)*100)-100)) -> -66.76252313253012 | R27: =IF(C27=0,0,(C27/$C$44)*100) -> 4.095920546766413 | T27: 16.05 | U27: 16.014378344103065 | V27: 17.498035821503247 | W27: =U27-T27 -> -3.5621655896935778E-2
A28: Nilo Pecanha | B28: 5915000 | C28: 5894762.8200000003 | D28: 6039942.0899999999 | F28: 5371237.3899999997 | G28: 4914680.53 | H28: 4695170.83 | J28: =IF(B28=0,0,((C28/B28)*100)-100) -> -0.34213322062551299 | K28: =IF(C28=0,0,IF(D28=0,0,((C28/D28)*100)-100)) -> -2.4036533436366057 | L28: =IF(F28=0,0,((C28/F28)*100)-100) -> 9.7468309811568474 | M28: =IF(G28=0,0,((C28/G28)*100)-100) -> 19.941932827930927 | N28: =IF(C28=0,0,IF(H28=0,0,((C28/H28)*100)-100)) -> 25.549485491244624 | P28: 17500000 | Q28: =IF(C28=0,0,IF(P28=0,0,((C28/P28)*100)-100)) -> -66.315641028571434 | R28: =IF(C28=0,0,(C28/$C$44)*100) -> 8.7520888663691299 | T28: 16.7 | U28: 16.857779261761713 | V28: 18.372795716656164 | W28: =U28-T28 -> 0.1577792617617142
A29: Champagnat | B29: 2540000 | C29: 2503474.58 | D29: 2460559.75 | F29: 2466999.22 | G29: 2364812.89 | H29: 2488509.09 | J29: =IF(B29=0,0,((C29/B29)*100)-100) -> -1.438008661417328 | K29: =IF(C29=0,0,IF(D29=0,0,((C29/D29)*100)-100)) -> 1.7441084289865358 | L29: =IF(F29=0,0,((C29/F29)*100)-100) -> 1.47853147679551 | M29: =IF(G29=0,0,((C29/G29)*100)-100) -> 5.8635374742058275 | N29: =IF(C29=0,0,IF(H29=0,0,((C29/H29)*100)-100)) -> 0.6013837787508578 | P29: 7800000 | Q29: =IF(C29=0,0,IF(P29=0,0,((C29/P29)*100)-100)) -> -67.904172051282046 | R29: =IF(C29=0,0,(C29/$C$44)*100) -> 3.7169658335559861 | T29: 16.9 | U29: 16.579581487102619 | V29: 18.072794244229954 | W29: =U29-T29 -> -0.32041851289737977
A30: Araucária Nova | B30: 2962000 | C30: 2952965.44 | D30: 3244626.85 | F30: 2267987.62 | G30: 1865230.69 | H30: 1427635.01 | J30: =IF(B30=0,0,((C30/B30)*100)-100) -> -0.305015530047271 | K30: =IF(C30=0,0,IF(D30=0,0,((C30/D30)*100)-100)) -> -8.9890586339689662 | L30: =IF(F30=0,0,((C30/F30)*100)-100) -> 30.202008774633413 | M30: =IF(G30=0,0,((C30/G30)*100)-100) -> 58.316365682359645 | N30: =IF(C30=0,0,IF(H30=0,0,((C30/H30)*100)-100)) -> 106.843165046786 | P30: 8600000 | Q30: =IF(C30=0,0,IF(P30=0,0,((C30/P30)*100)-100)) -> -65.663192558139542 | R30: =IF(C30=0,0,(C30/$C$44)*100) -> 4.3843351699427355 | T30: 15.95 | U30: 16.031570694576093 | V30: 17.58645337210584 | W30: =U30-T30 -> 8.1570694576093672E-2
A31: Santa Candida | B31: 3150000 | C31: 3108160.86 | D31: 3461080.61 | F31: 3282064.21 | G31: 3041104.89 | H31: 2571588.37 | J31: =IF(B31=0,0,((C31/B31)*100)-100) -> -1.3282266666666658 | K31: =IF(C31=0,0,IF(D31=0,0,((C31/D31)*100)-100)) -> -10.196808158131859 | L31: =IF(F31=0,0,((C31/F31)*100)-100) -> -5.2985968242224004 | M31: =IF(G31=0,0,((C31/G31)*100)-100) -> 2.2049870828361833 | N31: =IF(C31=0,0,IF(H31=0,0,((C31/H31)*100)-100)) -> 20.865411286643806 | P31: 9600000 | Q31: =IF(C31=0,0,IF(P31=0,0,((C31/P31)*100)-100)) -> -67.623324374999996 | R31: =IF(C31=0,0,(C31/$C$44)*100) -> 4.6147573512873405 | T31: 16.55 | U31: 16.161512116847131 | V31: 18.086690693351052 | W31: =U31-T31 -> -0.38848788315286953
A32: Paranaguá Raia | B32: 3455000 | C32: 3395959.38 | D32: 3568922.38 | F32: 3095364.54 | G32: 2901710.71 | H32: 2614820.15 | J32: =IF(B32=0,0,((C32/B32)*100)-100) -> -1.7088457308248906 | K32: =IF(C32=0,0,IF(D32=0,0,((C32/D32)*100)-100)) -> -4.8463648570580631 | L32: =IF(F32=0,0,((C32/F32)*100)-100) -> 9.7111288869387948 | M32: =IF(G32=0,0,((C32/G32)*100)-100) -> 17.033009813717783 | N32: =IF(C32=0,0,IF(H32=0,0,((C32/H32)*100)-100)) -> 29.873535661716545 | P32: 10000000 | Q32: =IF(C32=0,0,IF(P32=0,0,((C32/P32)*100)-100)) -> -66.040406200000007 | R32: =IF(C32=0,0,(C32/$C$44)*100) -> 5.0420583809578634 | T32: 18.862300000000001 | U32: 18.314677385805481 | V32: 19.907826527065232 | W32: =U32-T32 -> -0.54762261419451974
A33: Novo Mundo | B33: 2511000 | C33: 2610277.73 | D33: 2848490.8 | F33: 2440606.61 | G33: 2228015.24 | H33: 0 | J33: =IF(B33=0,0,((C33/B33)*100)-100) -> 3.953712863401023 | K33: =IF(C33=0,0,IF(D33=0,0,((C33/D33)*100)-100)) -> -8.3627817930814388 | L33: =IF(F33=0,0,((C33/F33)*100)-100) -> 6.9520060834384196 | M33: =IF(G33=0,0,((C33/G33)*100)-100) -> 17.157085963200132 | N33: =IF(C33=0,0,IF(H33=0,0,((C33/H33)*100)-100)) -> 0 | P33: 8100000 | Q33: =IF(C33=0,0,IF(P33=0,0,((C33/P33)*100)-100)) -> -67.774349012345681 | R33: =IF(C33=0,0,(C33/$C$44)*100) -> 3.8755389074100663 | T33: 15.8 | U33: 15.878757499111023 | V33: 17.99002965864479 | W33: =U33-T33 -> 7.8757499111022256E-2
A34: Água Verde | B34: 2803000 | C34: 2662996.48 | D34: 2792885.44 | F34: 2451151.44 | G34: 0 | H34: 0 | J34: =IF(B34=0,0,((C34/B34)*100)-100) -> -4.9947741705315707 | K34: =IF(C34=0,0,IF(D34=0,0,((C34/D34)*100)-100)) -> -4.6507084801874328 | L34: =IF(F34=0,0,((C34/F34)*100)-100) -> 8.6426744811817855 | M34: =IF(G34=0,0,((C34/G34)*100)-100) -> 0 | N34: =IF(C34=0,0,IF(H34=0,0,((C34/H34)*100)-100)) -> 0 | P34: 8500000 | Q34: =IF(C34=0,0,IF(P34=0,0,((C34/P34)*100)-100)) -> -68.670629647058831 | R34: =IF(C34=0,0,(C34/$C$44)*100) -> 3.9538116384788116 | T34: 16.9 | U34: 17.551191997820439 | V34: 18.974449211438689 | W34: =U34-T34 -> 0.65119199782044035
A35: Uvaranas | B35: 2344000 | C35: 2290882.21 | D35: 2562043.13 | F35: 2388288.08 | G35: 2213169.41 | H35: 1912054.7 | J35: =IF(B35=0,0,((C35/B35)*100)-100) -> -2.2661173208191201 | K35: =IF(C35=0,0,IF(D35=0,0,((C35/D35)*100)-100)) -> -10.58377655024097 | L35: =IF(F35=0,0,((C35/F35)*100)-100) -> -4.0784807668595846 | M35: =IF(G35=0,0,((C35/G35)*100)-100) -> 3.511380540904895 | N35: =IF(C35=0,0,IF(H35=0,0,((C35/H35)*100)-100)) -> 19.812587474615654 | P35: 7500000 | Q35: =IF(C35=0,0,IF(P35=0,0,((C35/P35)*100)-100)) -> -69.454903866666669 | R35: =IF(C35=0,0,(C35/$C$44)*100) -> 3.4013250908548183 | T35: 15.97 | U35: 16.278041314049055 | V35: 17.687039863127662 | W35: =U35-T35 -> 0.30804131404905455
A36: Torres | B36: 2710000 | C36: 2565036.51 | D36: 2893260.58 | F36: 2638403.39 | G36: 2114998.57 | H36: 1891767.64 | J36: =IF(B36=0,0,((C36/B36)*100)-100) -> -5.3492062730627339 | K36: =IF(C36=0,0,IF(D36=0,0,((C36/D36)*100)-100)) -> -11.344435142444041 | L36: =IF(F36=0,0,((C36/F36)*100)-100) -> -2.780730205171551 | M36: =IF(G36=0,0,((C36/G36)*100)-100) -> 21.278403984925617 | N36: =IF(C36=0,0,IF(H36=0,0,((C36/H36)*100)-100)) -> 35.589406212699572 | P36: 8100000 | Q36: =IF(C36=0,0,IF(P36=0,0,((C36/P36)*100)-100)) -> -68.332882592592597 | R36: =IF(C36=0,0,(C36/$C$44)*100) -> 3.8083682357556374 | T36: 16.25 | U36: 16.024359095769753 | V36: 17.967586671894974 | W36: =U36-T36 -> -0.22564090423024652
A37: Total Hiper | B37: =SUM(B23:B36) -> 40083700 | C37: =SUM(C23:C36) -> 39349833.57 | D37: =SUM(D23:D36) -> 41475283.310000002 | F37: =SUM(F23:F36) -> 38015867.380000003 | G37: =SUM(G23:G36) -> 31849824.650000002 | H37: =SUM(H23:H36) -> 26936117.010000002 | I37: =SUM(B37:H37) -> 217710625.91999999 | J37: =IF(C37=0,0,((C37/B37)*100)-100) -> -1.8308350526523185 | K37: =IF(C37=0,0,IF(D37=0,0,((C37/D37)*100)-100)) -> -5.1246177732257649 | L37: =IF(F37=0,0,IF(C37=0,0,((C37/F37)*100)-100)) -> 3.5089721264699847 | M37: =IF(G37=0,0,IF(C37=0,0,((C37/G37)*100)-100)) -> 23.548038340612962 | N37: =IF(C37=0,0,IF(H37=0,0,((C37/H37)*100)-100)) -> 46.08576861836255 | P37: =SUM(P23:P36) -> 120600000 | Q37: =IF(C37=0,0,((C37/P37)*100)-100) -> -67.371613955223879 | R37: =IF(C37=0,0,(C37/$C$44)*100) -> 58.423595791335877 | T37: 16.609876246454295 | U37: 16.518226348371311 | V37: 18.168849345910967 | W37: =U37-T37 -> -9.1649898082984294E-2
A38: Total 33,36,38,39,10 | B38: =B22+B37 -> 59741196 | C38: =C22+C37 -> 58587554.259999998 | D38: =D22+D37 -> 62033603.350000001 | E38: =E22+E37 -> 0 | F38: =F22+F37 -> 55845708.219999999 | G38: =G22+G37 -> 48117734.200000003 | H38: =H22+H37 -> 39405410.079999998 | I38: =SUM(B38:H38) -> 323731206.10999995 | J38: =IF(C38=0,0,((C38/B38)*100)-100) -> -1.9310656920895894 | K38: =IF(C38=0,0,IF(D38=0,0,((C38/D38)*100)-100)) -> -5.5551328697722795 | L38: =IF(F38=0,0,IF(C38=0,0,((C38/F38)*100)-100)) -> 4.9096808463753234 | M38: =IF(G38=0,0,IF(C38=0,0,((C38/G38)*100)-100)) -> 21.758755340562132 | N38: =IF(C38=0,0,IF(H38=0,0,((C38/H38)*100)-100)) -> 48.678960937233825 | P38: =P22+P37 -> 178450000 | Q38: =IF(C38=0,0,((C38/P38)*100)-100) -> -67.168644292518906 | R38: =IF(C38=0,0,(C38/$C$44)*100) -> 86.986278668756214 | T38: 16.520141911956365 | U38: 16.589237483387652 | V38: 18.337300772657308 | W38: =U38-T38 -> 6.9095571431287084E-2
A39: S.J.P - Rua Joinvile | B39: 2180000 | C39: 2184203.11 | D39: 2452826.87 | F39: 0 | G39: 0 | H39: 0 | J39: =IF(B39=0,0,((C39/B39)*100)-100) -> 0.19280321100916353 | K39: =IF(C39=0,0,IF(D39=0,0,((C39/D39)*100)-100)) -> -10.951598879051744 | L39: =IF(F39=0,0,((C39/F39)*100)-100) -> 0 | M39: =IF(G39=0,0,((C39/G39)*100)-100) -> 0 | N39: =IF(C39=0,0,IF(H39=0,0,((C39/H39)*100)-100)) -> 0 | P39: 6400000 | Q39: =IF(P39=0,0,IF(C39=0,0,((C39/P39)*100)-100)) -> -65.871826406249994 | R39: =IF(C39=0,0,(C39/$C$44)*100) -> 3.2429361968663271 | T39: 16.5 | U39: 16.311152931194208 | V39: 17.918853727847683 | W39: =U39-T39 -> -0.18884706880579216
A40: Castro | B40: 1408000 | C40: 1311320.37 | D40: 1605536.3 | F40: 0 | G40: 0 | H40: 0 | J40: =IF(B40=0,0,((C40/B40)*100)-100) -> -6.8664509943181713 | K40: =IF(C40=0,0,IF(D40=0,0,((C40/D40)*100)-100)) -> -18.325087386688168 | L40: =IF(F40=0,0,((C40/F40)*100)-100) -> 0 | M40: =IF(G40=0,0,((C40/G40)*100)-100) -> 0 | N40: =IF(C40=0,0,IF(H40=0,0,((C40/H40)*100)-100)) -> 0 | P40: 4250000 | Q40: =IF(P40=0,0,IF(C40=0,0,((C40/P40)*100)-100)) -> -69.145403058823533 | R40: =IF(C40=0,0,(C40/$C$44)*100) -> 1.9469472752289714 | T40: 17.2 | U40: 16.334983021730988 | V40: 17.893414276787293 | W40: =U40-T40 -> -0.86501697826901136
A41: Colombo | B41: 1540000 | C41: 1704954.27 | D41: 1952154.62 | F41: 1982787.95 | G41: 0 | H41: 0 | J41: =IF(B41=0,0,((C41/B41)*100)-100) -> 10.71131623376624 | K41: =IF(C41=0,0,IF(D41=0,0,((C41/D41)*100)-100)) -> -12.662949310849157 | L41: =IF(F41=0,0,((C41/F41)*100)-100) -> -14.012273980180282 | M41: =IF(G41=0,0,((C41/G41)*100)-100) -> 0 | N41: =IF(C41=0,0,IF(H41=0,0,((C41/H41)*100)-100)) -> 0 | P41: 4950000 | Q41: =IF(P41=0,0,IF(C41=0,0,((C41/P41)*100)-100)) -> -65.556479393939384 | R41: =IF(C41=0,0,(C41/$C$44)*100) -> 2.5313845085518647 | T41: 16 | U41: 15.837455792875899 | V41: 18.118664561014882 | W41: =U41-T41 -> -0.16254420712410145
A42: Pinhais | B42: 2105000 | C42: 2079426.52 | D42: 2340026.24 | F42: 0 | G42: 0 | H42: 0 | J42: =IF(B42=0,0,((C42/B42)*100)-100) -> -1.2148921615201829 | K42: =IF(C42=0,0,IF(D42=0,0,((C42/D42)*100)-100)) -> -11.136615288553358 | L42: =IF(F42=0,0,((C42/F42)*100)-100) -> 0 | M42: =IF(G42=0,0,((C42/G42)*100)-100) -> 0 | N42: =IF(C42=0,0,IF(H42=0,0,((C42/H42)*100)-100)) -> 0 | P42: 6350000 | Q42: =IF(P42=0,0,IF(C42=0,0,((C42/P42)*100)-100)) -> -67.253125669291336 | R42: =IF(C42=0,0,(C42/$C$44)*100) -> 3.087372002886573 | T42: 16 | U42: 14.816410521685563 | V42: 17.429882254266911 | W42: =U42-T42 -> -1.1835894783144365
A43: Campo Comprido | B43: 1645000 | C43: 1485180.48 | D43: 1901930.11 | F43: 0 | G43: 0 | H43: 479199.98 | J43: =IF(B43=0,0,((C43/B43)*100)-100) -> -9.715472340425535 | K43: =IF(C43=0,0,IF(D43=0,0,((C43/D43)*100)-100)) -> -21.911931874300052 | L43: =IF(F43=0,0,((C43/F43)*100)-100) -> 0 | M43: =IF(G43=0,0,((C43/G43)*100)-100) -> 0 | N43: =IF(C43=0,0,IF(H43=0,0,((C43/H43)*100)-100)) -> 209.92916151624217 | P43: 5100000 | Q43: =IF(P43=0,0,IF(C43=0,0,((C43/P43)*100)-100)) -> -70.878814117647067 | R43: =IF(C43=0,0,(C43/$C$44)*100) -> 2.2050813477100606 | T43: 16 | U43: 17.032491485479259 | V43: 18.750412885846711 | W43: =U43-T43 -> 1.0324914854792588
A44: Total Geral | B44: =B22+B37+SUM(B39:B43) -> 68619196 | C44: =C22+C37+SUM(C39:C43) -> 67352639.00999999 | D44: =D22+D37+SUM(D39:D43) -> 72286077.49000001 | F44: =F22+F37+SUM(F39:F43) -> 57828496.170000002 | G44: =G22+G37+SUM(G39:G43) -> 48117734.200000003 | H44: =H22+H37+SUM(H39:H43) -> 39884610.059999995 | J44: =IF(C44=0,0,((C44/B44)*100)-100) -> -1.8457764937963077 | K44: =IF(C44=0,0,IF(D44=0,0,((C44/D44)*100)-100)) -> -6.8248806012229721 | L44: =IF(F44=0,0,IF(C44=0,0,((C44/F44)*100)-100)) -> 16.46963602857943 | M44: =IF(G44=0,0,IF(C44=0,0,((C44/G44)*100)-100)) -> 39.974668653454557 | N44: =IF(C44=0,0,IF(H44=0,0,((C44/H44)*100)-100)) -> 68.868741373373723 | P44: =P22+P37+SUM(P39:P43) -> 205500000 | Q44: =IF(C44=0,0,((C44/P44)*100)-100) -> -67.224993182481754 | R44: =R22+R37+SUM(R39:R43) -> 100 | T44: 16.486000000000001 | U44: 16.51127904126945 | V44: 18.290648115615689 | W44: =U44-T44 -> 2.5279041269449465E-2
A46: Água Verde | B46: 0 | C46: 0 | D46: 0 | F46: 0 | G46: 0 | H46: 0 | J46: =IF(B46=0,0,((C46/B46)*100)-100) -> 0 | K46: =IF(C46=0,0,IF(D46=0,0,((C46/D46)*100)-100)) -> 0 | L46: =IF(F46=0,0,((C46/F46)*100)-100) -> 0 | M46: =IF(G46=0,0,((C46/G46)*100)-100) -> 0 | N46: =IF(C46=0,0,IF(H46=0,0,((C46/H46)*100)-100)) -> 0 | P46: =B46 -> 0 | Q46: =IF(C46=0,0,IF(P46=0,0,((C46/P46)*100)-100)) -> 0 | R46: =IF(C46=0,0,(C46/$C$44)*100) -> 0 | T46: 14.95 | U46: 0 | W46: =U46-T46 -> -14.95
A47: Total Geral | B47: =B44+B46 -> 68619196 | C47: =C44+C46 -> 67352639.00999999 | D47: =D44+D46 -> 72286077.49000001 | F47: =F44+F46 -> 57828496.170000002 | G47: =G44+G46 -> 48117734.200000003 | H47: =H44+H46 -> 39884610.059999995 | J47: =IF(C47=0,0,((C47/B47)*100)-100) -> -1.8457764937963077 | K47: =IF(C47=0,0,IF(D47=0,0,((C47/D47)*100)-100)) -> -6.8248806012229721 | L47: =IF(F47=0,0,IF(C47=0,0,((C47/F47)*100)-100)) -> 16.46963602857943 | M47: =IF(G47=0,0,IF(C47=0,0,((C47/G47)*100)-100)) -> 39.974668653454557 | N47: =IF(C47=0,0,IF(H47=0,0,((C47/H47)*100)-100)) -> 68.868741373373723 | P47: =P44+P46 -> 205500000 | Q47: =IF(C47=0,0,((C47/P47)*100)-100) -> -67.224993182481754 | R47: =R25+R40+R46 -> 4.9844683435515478 | T47: 16.493353199737285 | U47: 16.51127904126945 | W47: =U47-T47 -> 1.792584153216481E-2