A2: Periodo: | B2: 40483 | C2: a | D2: 40512 | G2: Vendas Acumuladas por Filial | P2: =NOW() -> 40547.679488773145
A4: v.New | B4: Vendas 2010 | F4: Vendas de Anos Anteriores | J4: Percentuais ( % ) | P4: Meta Mensal | T4: Margem
A5: Lojas | B5: Previsao | C5: Realizada | D5: Mes Anterior | F5: Vendas 2009 | G5: Vendas 2008 | H5: Vendas 2007 | J5: % Prev | K5: % MA | L5: 2009 | M5: 2008 | N5: 2007 | P5: Previsao Mes | Q5: Final | R5: Part. | T5: Meta | U5: Coml | V5: Dif
A6: S. Felicidade | B6: 3100000 | C6: 3177102.5 | D6: 3371168.01 | F6: 2821335.32 | G6: 2466661.53 | H6: 2207525.51 | J6: =IF(B6=0,0,((C6/B6)*100)-100) -> 2.4871774193548504 | K6: =IF(C6=0,0,IF(D6=0,0,((C6/D6)*100)-100)) -> -5.7566252831166338 | L6: =IF(F6=0,0,((C6/F6)*100)-100) -> 12.609886441998668 | M6: =IF(G6=0,0,((C6/G6)*100)-100) -> 28.801720923583702 | N6: =IF(C6=0,0,IF(H6=0,0,((C6/H6)*100)-100)) -> 43.921439893122681 | P6: 3100000 | Q6: =IF(C6=0,0,((C6/P6)*100)-100) -> 2.4871774193548504 | R6: =IF(C6=0,0,(C6/$C$41)*100) -> 2.5857751277412069 | T6: 17.502400000000002 | U6: 16.790034315858556 | V6: =U6-T6 -> -0.71236568414144585
A7: Lapa | B7: 2300000 | C7: 2309851.44 | D7: 2554116.3 | F7: 2141055.29 | G7: 2060785.93 | H7: 1658787.05 | J7: =IF(B7=0,0,((C7/B7)*100)-100) -> 0.42832347826087869 | K7: =IF(C7=0,0,IF(D7=0,0,((C7/D7)*100)-100)) -> -9.5635762553177415 | L7: =IF(F7=0,0,((C7/F7)*100)-100) -> 7.8837828611142413 | M7: =IF(G7=0,0,((C7/G7)*100)-100) -> 12.085947714132544 | N7: =IF(C7=0,0,IF(H7=0,0,((C7/H7)*100)-100)) -> 39.249425657139057 | P7: 2300000 | Q7: =IF(C7=0,0,((C7/P7)*100)-100) -> 0.42832347826087869 | R7: =IF(C7=0,0,(C7/$C$41)*100) -> 1.879938214876357 | T7: 16.348500000000001 | U7: 15.121679860069271 | V7: =U7-T7 -> -1.2268201399307301
A8: Araucaria | B8: 1450001 | C8: 1475206.07 | D8: 1542711.24 | F8: 1248864.46 | G8: 1194062.36 | H8: 1077581.65 | J8: =IF(B8=0,0,((C8/B8)*100)-100) -> 1.7382794908417338 | K8: =IF(C8=0,0,IF(D8=0,0,((C8/D8)*100)-100)) -> -4.3757488925795371 | L8: =IF(F8=0,0,((C8/F8)*100)-100) -> 18.123793033553071 | M8: =IF(G8=0,0,((C8/G8)*100)-100) -> 23.545144660618902 | N8: =IF(C8=0,0,IF(H8=0,0,((C8/H8)*100)-100)) -> 36.899702217460742 | P8: 1450000 | Q8: =IF(C8=0,0,((C8/P8)*100)-100) -> 1.7383496551724136 | R8: =IF(C8=0,0,(C8/$C$41)*100) -> 1.2006383691111173 | T8: 16.82 | U8: 16.516308802877962 | V8: =U8-T8 -> -0.3036911971220384
A9: Hauer | B9: 3980000 | C9: 3913639.31 | D9: 4348085.95 | F9: 3703759.01 | G9: 3686253.12 | H9: 3526502.16 | J9: =IF(B9=0,0,((C9/B9)*100)-100) -> -1.6673540201005039 | K9: =IF(C9=0,0,IF(D9=0,0,((C9/D9)*100)-100)) -> -9.9916755325409383 | L9: =IF(F9=0,0,((C9/F9)*100)-100) -> 5.6666834811155837 | M9: =IF(G9=0,0,((C9/G9)*100)-100) -> 6.1684909472521525 | N9: =IF(C9=0,0,IF(H9=0,0,((C9/H9)*100)-100)) -> 10.977935995366011 | P9: 3980000 | Q9: =IF(C9=0,0,((C9/P9)*100)-100) -> -1.6673540201005039 | R9: =IF(C9=0,0,(C9/$C$41)*100) -> 3.1852265347901936 | T9: 16.204699999999999 | U9: 15.848977406147323 | V9: =U9-T9 -> -0.35572259385267557
A10: Paranagua | B10: 2150000 | C10: 2161215.14 | D10: 2282985.31 | F10: 1923429.34 | G10: 1861341.31 | H10: 1855241.38 | J10: =IF(B10=0,0,((C10/B10)*100)-100) -> 0.52163441860466264 | K10: =IF(C10=0,0,IF(D10=0,0,((C10/D10)*100)-100)) -> -5.3338131203305892 | L10: =IF(F10=0,0,((C10/F10)*100)-100) -> 12.362596070204489 | M10: =IF(G10=0,0,((C10/G10)*100)-100) -> 16.110630994376834 | N10: =IF(C10=0,0,IF(H10=0,0,((C10/H10)*100)-100)) -> 16.492396261665959 | P10: 2150000 | Q10: =IF(C10=0,0,((C10/P10)*100)-100) -> 0.52163441860466264 | R10: =IF(C10=0,0,(C10/$C$41)*100) -> 1.7589663395215394 | T10: 17.951000000000001 | U10: 17.208376580223288 | V10: =U10-T10 -> -0.74262341977671298
A11: Centenario | B11: 0 | C11: 0 | D11: 0 | F11: 0 | G11: 0 | H11: 0 | J11: =IF(B11=0,0,((C11/B11)*100)-100) -> 0 | K11: =IF(C11=0,0,IF(D11=0,0,((C11/D11)*100)-100)) -> 0 | L11: =IF(F11=0,0,((C11/F11)*100)-100) -> 0 | M11: =IF(G11=0,0,((C11/G11)*100)-100) -> 0 | N11: =IF(C11=0,0,IF(H11=0,0,((C11/H11)*100)-100)) -> 0 | P11: 0 | Q11: =IF(C11=0,0,((C11/P11)*100)-100) -> 0 | R11: =IF(C11=0,0,(C11/$C$41)*100) -> 0 | T11: 0 | U11: 0 | V11: =U11-T11 -> 0
A12: Sitio Cercado | B12: 2500000 | C12: 2671753.96 | D12: 2924421.74 | F12: 2263674.1 | G12: 1939822.67 | H12: 1829767.73 | J12: =IF(B12=0,0,((C12/B12)*100)-100) -> 6.8701584000000082 | K12: =IF(C12=0,0,IF(D12=0,0,((C12/D12)*100)-100)) -> -8.6399227766649034 | L12: =IF(F12=0,0,((C12/F12)*100)-100) -> 18.027323809553678 | M12: =IF(G12=0,0,((C12/G12)*100)-100) -> 37.731865975151237 | N12: =IF(C12=0,0,IF(H12=0,0,((C12/H12)*100)-100)) -> 46.016017016542321 | P12: 2500000 | Q12: =IF(C12=0,0,((C12/P12)*100)-100) -> 6.8701584000000082 | R12: =IF(C12=0,0,(C12/$C$41)*100) -> 2.1744828620455512 | T12: 16.776499999999999 | U12: 14.759544699991761 | V12: =U12-T12 -> -2.0169553000082381
A13: Apucarana | B13: 2700000 | C13: 2869706.01 | D13: 3047037.02 | F13: 2500115.56 | G13: 2520812.47 | H13: 2647928.55 | J13: =IF(B13=0,0,((C13/B13)*100)-100) -> 6.2854077777777775 | K13: =IF(C13=0,0,IF(D13=0,0,((C13/D13)*100)-100)) -> -5.8197852154746812 | L13: =IF(F13=0,0,((C13/F13)*100)-100) -> 14.782934673627636 | M13: =IF(G13=0,0,((C13/G13)*100)-100) -> 13.84051944173379 | N13: =IF(C13=0,0,IF(H13=0,0,((C13/H13)*100)-100)) -> 8.3755077152667212 | P13: 2869000 | Q13: =IF(C13=0,0,((C13/P13)*100)-100) -> 2.4608225862650102E-2 | R13: =IF(C13=0,0,(C13/$C$41)*100) -> 2.3355917615460813 | T13: 15.83 | U13: 15.826331631789698 | V13: =U13-T13 -> -3.6683682103024751E-3
A14: Ahú | B14: 1850000 | C14: 1894952.57 | D14: 1956771.47 | F14: 1678603.53 | G14: 1651041.3 | H14: 1600220.68 | J14: =IF(B14=0,0,((C14/B14)*100)-100) -> 2.4298686486486503 | K14: =IF(C14=0,0,IF(D14=0,0,((C14/D14)*100)-100)) -> -3.1592294219211965 | L14: =IF(F14=0,0,((C14/F14)*100)-100) -> 12.88863249322489 | M14: =IF(G14=0,0,((C14/G14)*100)-100) -> 14.773177993790938 | N14: =IF(C14=0,0,IF(H14=0,0,((C14/H14)*100)-100)) -> 18.418202794379596 | P14: 1850000 | Q14: =IF(C14=0,0,((C14/P14)*100)-100) -> 2.4298686486486503 | R14: =IF(C14=0,0,(C14/$C$41)*100) -> 1.5422609826895037 | T14: 17.732099999999999 | U14: 16.774731200792008 | V14: =U14-T14 -> -0.95736879920799112
A15: P.G. Centro | B15: 1949999 | C15: 1996459.63 | D15: 2053022.82 | F15: 1828416.66 | G15: 2088553.07 | H15: 1960699.48 | J15: =IF(B15=0,0,((C15/B15)*100)-100) -> 2.3825976321013371 | K15: =IF(C15=0,0,IF(D15=0,0,((C15/D15)*100)-100)) -> -2.7551174516413823 | L15: =IF(F15=0,0,((C15/F15)*100)-100) -> 9.1906278079964494 | M15: =IF(G15=0,0,((C15/G15)*100)-100) -> -4.4094373910259321 | N15: =IF(C15=0,0,IF(H15=0,0,((C15/H15)*100)-100)) -> 1.8238465590861352 | P15: 1950000 | Q15: =IF(C15=0,0,((C15/P15)*100)-100) -> 2.3825451282051233 | R15: =IF(C15=0,0,(C15/$C$41)*100) -> 1.6248753871785415 | T15: 19.25 | U15: 17.666496967935185 | V15: =U15-T15 -> -1.5835030320648151
A16: Maringa | B16: 3000000 | C16: 3341001.24 | D16: 3471446.99 | F16: 2812854.25 | G16: 3190017.04 | H16: 2643368.49 | J16: =IF(B16=0,0,((C16/B16)*100)-100) -> 11.366708000000017 | K16: =IF(C16=0,0,IF(D16=0,0,((C16/D16)*100)-100)) -> -3.757676564722658 | L16: =IF(F16=0,0,((C16/F16)*100)-100) -> 18.776194678412523 | M16: =IF(G16=0,0,((C16/G16)*100)-100) -> 4.7330217395954861 | N16: =IF(C16=0,0,IF(H16=0,0,((C16/H16)*100)-100)) -> 26.391808506425818 | P16: 3200000 | Q16: =IF(C16=0,0,((C16/P16)*100)-100) -> 4.4062887500000016 | R16: =IF(C16=0,0,(C16/$C$41)*100) -> 2.7191687734797765 | T16: 18.803000000000001 | U16: 17.096336366519875 | V16: =U16-T16 -> -1.706663633480126
A17: Araucaria Nova | B17: 4400000 | C17: 4673891.19 | D17: 4906171.55 | F17: 3809254.16 | G17: 3332194.65 | H17: 2801900.5 | J17: =IF(B17=0,0,((C17/B17)*100)-100) -> 6.2247997727272804 | K17: =IF(C17=0,0,IF(D17=0,0,((C17/D17)*100)-100)) -> -4.734452467321475 | L17: =IF(F17=0,0,((C17/F17)*100)-100) -> 22.698328693299914 | M17: =IF(G17=0,0,((C17/G17)*100)-100) -> 40.264650806038617 | N17: =IF(C17=0,0,IF(H17=0,0,((C17/H17)*100)-100)) -> 66.811462077257943 | P17: 4400000 | Q17: =IF(C17=0,0,((C17/P17)*100)-100) -> 6.2247997727272804 | R17: =IF(C17=0,0,(C17/$C$41)*100) -> 3.803979125278695 | T17: 15.6 | U17: 15.880329255161801 | V17: =U17-T17 -> 0.28032925516180107
A18: Cristo Rei | B18: 2450000 | C18: 2528048.88 | D18: 2700737.22 | F18: 2141745.25 | G18: 1831615.97 | H18: 1583201.24 | J18: =IF(B18=0,0,((C18/B18)*100)-100) -> 3.1856685714285646 | K18: =IF(C18=0,0,IF(D18=0,0,((C18/D18)*100)-100)) -> -6.3941185658929101 | L18: =IF(F18=0,0,((C18/F18)*100)-100) -> 18.036861760286385 | M18: =IF(G18=0,0,((C18/G18)*100)-100) -> 38.022867315357587 | N18: =IF(C18=0,0,IF(H18=0,0,((C18/H18)*100)-100)) -> 59.679566698671863 | P18: 2450000 | Q18: =IF(C18=0,0,((C18/P18)*100)-100) -> 3.1856685714285646 | R18: =IF(C18=0,0,(C18/$C$41)*100) -> 2.0575244001784694 | T18: 17.1 | U18: 17.530072440687935 | V18: =U18-T18 -> 0.43007244068793327
A19: Campo Largo | B19: 3750000 | C19: 3796154.38 | D19: 4080096.65 | F19: 3430550.61 | G19: 2449945.82 | H19: 0 | J19: =IF(B19=0,0,((C19/B19)*100)-100) -> 1.2307834666666793 | K19: =IF(C19=0,0,IF(D19=0,0,((C19/D19)*100)-100)) -> -6.9592045080598837 | L19: =IF(F19=0,0,((C19/F19)*100)-100) -> 10.657291250397847 | M19: =IF(G19=0,0,((C19/G19)*100)-100) -> 54.948503310167098 | N19: =IF(C19=0,0,IF(H19=0,0,((C19/H19)*100)-100)) -> 0 | P19: 3750000 | Q19: =IF(C19=0,0,((C19/P19)*100)-100) -> 1.2307834666666793 | R19: =IF(C19=0,0,(C19/$C$41)*100) -> 3.0896080868872953 | T19: 16 | U19: 16.353923677887934 | V19: =U19-T19 -> 0.35392367788793422
A20: Brasilia | B20: 2500000 | C20: 2649750.67 | D20: 2855170.26 | F20: 2300495.86 | G20: 2269434.02 | H20: 920936.09 | J20: =IF(B20=0,0,((C20/B20)*100)-100) -> 5.9900268000000096 | K20: =IF(C20=0,0,IF(D20=0,0,((C20/D20)*100)-100)) -> -7.1946529031161788 | L20: =IF(F20=0,0,((C20/F20)*100)-100) -> 15.181718692595254 | M20: =IF(G20=0,0,((C20/G20)*100)-100) -> 16.758215777517947 | N20: =IF(C20=0,0,IF(H20=0,0,((C20/H20)*100)-100)) -> 187.72362151645075 | P20: 2500000 | Q20: =IF(C20=0,0,((C20/P20)*100)-100) -> 5.9900268000000096 | R20: =IF(C20=0,0,(C20/$C$41)*100) -> 2.1565748593888925 | T20: 16.9 | U20: 15.64889386366303 | V20: =U20-T20 -> -1.2511061363369684
A21: Total Super | B21: =SUM(B6:B20) -> 38080000 | C21: =SUM(C6:C20) -> 39458732.990000002 | D21: =SUM(D6:D20) -> 42093942.530000001 | F21: =SUM(F6:F20) -> 34604153.399999999 | G21: =SUM(G6:G20) -> 32542541.259999998 | H21: =SUM(H6:H20) -> 26313660.509999998 | I21: =SUM(B21:H21) -> 213093030.69 | J21: =IF(C21=0,0,((C21/B21)*100)-100) -> 3.6206223476890784 | K21: =IF(C21=0,0,IF(D21=0,0,((C21/D21)*100)-100)) -> -6.2603058340802988 | L21: =IF(F21=0,0,IF(C21=0,0,((C21/F21)*100)-100)) -> 14.028892814930146 | M21: =IF(G21=0,0,IF(C21=0,0,((C21/G21)*100)-100)) -> 21.252770872264719 | N21: =IF(C21=0,0,IF(H21=0,0,((C21/H21)*100)-100)) -> 49.955316840104672 | P21: =SUM(P6:P20) -> 38449000 | Q21: =IF(C21=0,0,((C21/P21)*100)-100) -> 2.6261619027803107 | R21: =IF(C21=0,0,(C21/$C$41)*100) -> 32.114610824713218 | T21: 16.900091349002103 | U21: 16.294759772518482 | V21: =U21-T21 -> -0.60533157648362135
A22: Pinheirinho | B22: 4800000 | C22: 4650589.63 | D22: 5087765.33 | F22: 4453879.35 | G22: 4231578.15 | H22: 3963957.72 | J22: =IF(B22=0,0,((C22/B22)*100)-100) -> -3.1127160416666726 | K22: =IF(C22=0,0,IF(D22=0,0,((C22/D22)*100)-100)) -> -8.5926860152569162 | L22: =IF(F22=0,0,((C22/F22)*100)-100) -> 4.4166054924680509 | M22: =IF(G22=0,0,((C22/G22)*100)-100) -> 9.9020144529293361 | N22: =IF(C22=0,0,IF(H22=0,0,((C22/H22)*100)-100)) -> 17.321877741925036 | P22: 4800000 | Q22: =IF(C22=0,0,IF(P22=0,0,((C22/P22)*100)-100)) -> -3.1127160416666726 | R22: =IF(C22=0,0,(C22/$C$41)*100) -> 3.7850144887000599 | T22: 16 | U22: 15.590321823342645 | V22: =U22-T22 -> -0.40967817665735495
A23: Londrina | B23: 4000000 | C23: 4030619.44 | D23: 4610006.23 | F23: 3459344.3 | G23: 3538708.86 | H23: 3401417.4 | J23: =IF(B23=0,0,((C23/B23)*100)-100) -> 0.76548599999999567 | K23: =IF(C23=0,0,IF(D23=0,0,((C23/D23)*100)-100)) -> -12.568026182472209 | L23: =IF(F23=0,0,((C23/F23)*100)-100) -> 16.513971737360748 | M23: =IF(G23=0,0,((C23/G23)*100)-100) -> 13.900849136258131 | N23: =IF(C23=0,0,IF(H23=0,0,((C23/H23)*100)-100)) -> 18.498230766973791 | P23: 4000000 | Q23: =IF(C23=0,0,IF(P23=0,0,((C23/P23)*100)-100)) -> 0.76548599999999567 | R23: =IF(C23=0,0,(C23/$C$41)*100) -> 3.2804341368722576 | T23: 16.953600000000002 | U23: 16.137349101854181 | V23: =U23-T23 -> -0.81625089814582097
A24: São Bráz | B24: 5300000 | C24: 5345600.76 | D24: 5928818.1900000004 | F24: 4964297.43 | G24: 4749646.6 | H24: 4758503.7 | J24: =IF(B24=0,0,((C24/B24)*100)-100) -> 0.86039169811320448 | K24: =IF(C24=0,0,IF(D24=0,0,((C24/D24)*100)-100)) -> -9.8369929943829248 | L24: =IF(F24=0,0,((C24/F24)*100)-100) -> 7.6809122615362639 | M24: =IF(G24=0,0,((C24/G24)*100)-100) -> 12.547336890285692 | N24: =IF(C24=0,0,IF(H24=0,0,((C24/H24)*100)-100)) -> 12.33785023640938 | P24: 5300000 | Q24: =IF(C24=0,0,IF(P24=0,0,((C24/P24)*100)-100)) -> 0.86039169811320448 | R24: =IF(C24=0,0,(C24/$C$41)*100) -> 4.3506690413804696 | T24: 16.2 | U24: 15.525722313762916 | V24: =U24-T24 -> -0.67427768623708317
A25: S.J. Pinhais | B25: 5900000 | C25: 6093984.3700000001 | D25: 6619431.1900000004 | F25: 5596975.4500000002 | G25: 5405349.5 | H25: 4982836.35 | J25: =IF(B25=0,0,((C25/B25)*100)-100) -> 3.2878706779660973 | K25: =IF(C25=0,0,IF(D25=0,0,((C25/D25)*100)-100)) -> -7.9379451937470833 | L25: =IF(F25=0,0,((C25/F25)*100)-100) -> 8.8799553337329797 | M25: =IF(G25=0,0,((C25/G25)*100)-100) -> 12.739876857176398 | N25: =IF(C25=0,0,IF(H25=0,0,((C25/H25)*100)-100)) -> 22.299508592129484 | P25: 5900000 | Q25: =IF(C25=0,0,IF(P25=0,0,((C25/P25)*100)-100)) -> 3.2878706779660973 | R25: =IF(C25=0,0,(C25/$C$41)*100) -> 4.9597623031644931 | T25: 16.001999999999999 | U25: 15.858758758188282 | V25: =U25-T25 -> -0.14324124181171705
A26: P.G. Nova | B26: 5400000 | C26: 5924551.9500000002 | D26: 6224828.1900000004 | F26: 4734948.79 | G26: 5053182.46 | H26: 4654789.07 | J26: =IF(B26=0,0,((C26/B26)*100)-100) -> 9.7139250000000175 | K26: =IF(C26=0,0,IF(D26=0,0,((C26/D26)*100)-100)) -> -4.8238478369954834 | L26: =IF(F26=0,0,((C26/F26)*100)-100) -> 25.123886503532816 | M26: =IF(G26=0,0,((C26/G26)*100)-100) -> 17.243974404201509 | N26: =IF(C26=0,0,IF(H26=0,0,((C26/H26)*100)-100)) -> 27.278634131535412 | P26: 5400000 | Q26: =IF(C26=0,0,IF(P26=0,0,((C26/P26)*100)-100)) -> 9.7139250000000175 | R26: =IF(C26=0,0,(C26/$C$41)*100) -> 4.821864914751937 | T26: 15.95 | U26: 15.040273720614433 | V26: =U26-T26 -> -0.90972627938556627
A27: Nilo Pecanha | B27: 12950000 | C27: 12965034.85 | D27: 13824439.5 | F27: 12223726.800000001 | G27: 12047042.460000001 | H27: 10957274.369999999 | J27: =IF(B27=0,0,((C27/B27)*100)-100) -> 0.11609922779922499 | K27: =IF(C27=0,0,IF(D27=0,0,((C27/D27)*100)-100)) -> -6.216560533973194 | L27: =IF(F27=0,0,((C27/F27)*100)-100) -> 6.0645011307026238 | M27: =IF(G27=0,0,((C27/G27)*100)-100) -> 7.620064368894063 | N27: =IF(C27=0,0,IF(H27=0,0,((C27/H27)*100)-100)) -> 18.323539342019785 | P27: 12950000 | Q27: =IF(C27=0,0,IF(P27=0,0,((C27/P27)*100)-100)) -> 0.11609922779922499 | R27: =IF(C27=0,0,(C27/$C$41)*100) -> 10.551961935577449 | T27: 16.5 | U27: 16.457212222611187 | V27: =U27-T27 -> -4.2787777388813453E-2
A28: Champagnat | B28: 6700000 | C28: 6323508.0099999998 | D28: 6772033 | F28: 6326707.2699999996 | G28: 6653191.3099999996 | H28: 6145960.8499999996 | J28: =IF(B28=0,0,((C28/B28)*100)-100) -> -5.6192834328358146 | K28: =IF(C28=0,0,IF(D28=0,0,((C28/D28)*100)-100)) -> -6.6231955750953944 | L28: =IF(F28=0,0,((C28/F28)*100)-100) -> -5.0567536373463895E-2 | M28: =IF(G28=0,0,((C28/G28)*100)-100) -> -4.9552655956919978 | N28: =IF(C28=0,0,IF(H28=0,0,((C28/H28)*100)-100)) -> 2.8888430032872634 | P28: 6700000 | Q28: =IF(C28=0,0,IF(P28=0,0,((C28/P28)*100)-100)) -> -5.6192834328358146 | R28: =IF(C28=0,0,(C28/$C$41)*100) -> 5.1465666381019481 | T28: 16.6 | U28: 16.715322228238943 | V28: =U28-T28 -> 0.11532222823894145
A29: Santa Candida | B29: 7300000 | C29: 7561406.0999999996 | D29: 8484005.8800000008 | F29: 6588961.3099999996 | G29: 5776037.5 | H29: 5302410.75 | J29: =IF(B29=0,0,((C29/B29)*100)-100) -> 3.5809054794520421 | K29: =IF(C29=0,0,IF(D29=0,0,((C29/D29)*100)-100)) -> -10.874577328793649 | L29: =IF(F29=0,0,((C29/F29)*100)-100) -> 14.758696314153966 | M29: =IF(G29=0,0,((C29/G29)*100)-100) -> 30.909920512115775 | N29: =IF(C29=0,0,IF(H29=0,0,((C29/H29)*100)-100)) -> 42.603175357548452 | P29: 7300000 | Q29: =IF(C29=0,0,IF(P29=0,0,((C29/P29)*100)-100)) -> 3.5809054794520421 | R29: =IF(C29=0,0,(C29/$C$41)*100) -> 6.1540651660217573 | T29: 16.25 | U29: 16.039070034870896 | V29: =U29-T29 -> -0.21092996512910389
A30: Paranaguá Raia | B30: 7300000 | C30: 7338451.3499999996 | D30: 7914228.8600000003 | F30: 6732047.3600000003 | G30: 6170524.1299999999 | H30: 5999613.7000000002 | J30: =IF(B30=0,0,((C30/B30)*100)-100) -> 0.52673082191780907 | K30: =IF(C30=0,0,IF(D30=0,0,((C30/D30)*100)-100)) -> -7.2752193572527091 | L30: =IF(F30=0,0,((C30/F30)*100)-100) -> 9.0077202011840711 | M30: =IF(G30=0,0,((C30/G30)*100)-100) -> 18.927520505458247 | N30: =IF(C30=0,0,IF(H30=0,0,((C30/H30)*100)-100)) -> 22.315397573013726 | P30: 7300000 | Q30: =IF(C30=0,0,IF(P30=0,0,((C30/P30)*100)-100)) -> 0.52673082191780907 | R30: =IF(C30=0,0,(C30/$C$41)*100) -> 5.9726071088260078 | T30: 17.999700000000001 | U30: 17.869038676668477 | V30: =U30-T30 -> -0.13066132333152325
A31: Novo Mundo | B31: 0 | C31: 0 | D31: 0 | F31: 0 | G31: 0 | H31: 0 | J31: =IF(B31=0,0,((C31/B31)*100)-100) -> 0 | K31: =IF(C31=0,0,IF(D31=0,0,((C31/D31)*100)-100)) -> 0 | L31: =IF(F31=0,0,((C31/F31)*100)-100) -> 0 | M31: =IF(G31=0,0,((C31/G31)*100)-100) -> 0 | N31: =IF(C31=0,0,IF(H31=0,0,((C31/H31)*100)-100)) -> 0 | P31: 0 | Q31: =IF(C31=0,0,IF(P31=0,0,((C31/P31)*100)-100)) -> 0 | R31: =IF(C31=0,0,(C31/$C$41)*100) -> 0 | T31: 0 | U31: 0 | V31: =U31-T31 -> 0
A32: Uvaranas | B32: 5200000 | C32: 5320517.85 | D32: 5980623.21 | F32: 4591080.24 | G32: 0 | H32: 0 | J32: =IF(B32=0,0,((C32/B32)*100)-100) -> 2.3176509615384617 | K32: =IF(C32=0,0,IF(D32=0,0,((C32/D32)*100)-100)) -> -11.037400899897193 | L32: =IF(F32=0,0,((C32/F32)*100)-100) -> 15.888147709655343 | M32: =IF(G32=0,0,((C32/G32)*100)-100) -> 0 | N32: =IF(C32=0,0,IF(H32=0,0,((C32/H32)*100)-100)) -> 0 | P32: 5200000 | Q32: =IF(C32=0,0,IF(P32=0,0,((C32/P32)*100)-100)) -> 2.3176509615384617 | R32: =IF(C32=0,0,(C32/$C$41)*100) -> 4.3302546024980693 | T32: 15.8 | U32: 14.902527768044235 | V32: =U32-T32 -> -0.89747223195576531
A33: Torres | B33: 5400000 | C33: 5576626.3099999996 | D33: 6122263.2300000004 | F33: 4957340.01 | G33: 0 | H33: 0 | J33: =IF(B33=0,0,((C33/B33)*100)-100) -> 3.2708575925925771 | K33: =IF(C33=0,0,IF(D33=0,0,((C33/D33)*100)-100)) -> -8.91234008571044 | L33: =IF(F33=0,0,((C33/F33)*100)-100) -> 12.492310367067191 | M33: =IF(G33=0,0,((C33/G33)*100)-100) -> 0 | N33: =IF(C33=0,0,IF(H33=0,0,((C33/H33)*100)-100)) -> 0 | P33: 5400000 | Q33: =IF(C33=0,0,IF(P33=0,0,((C33/P33)*100)-100)) -> 3.2708575925925771 | R33: =IF(C33=0,0,(C33/$C$41)*100) -> 4.5386957484390962 | T33: 16.1995 | U33: 16.495653982595798 | V33: =U33-T33 -> 0.29615398259579706
A34: Total Hiper | B34: =SUM(B22:B33) -> 70250000 | C34: =SUM(C22:C33) -> 71130890.620000005 | D34: =SUM(D22:D33) -> 77568442.810000002 | F34: =SUM(F22:F33) -> 64629308.310000002 | G34: =SUM(G22:G33) -> 53625260.970000006 | H34: =SUM(H22:H33) -> 50166763.910000004 | I34: =SUM(B34:H34) -> 387370666.62000006 | J34: =IF(C34=0,0,((C34/B34)*100)-100) -> 1.2539368256227874 | K34: =IF(C34=0,0,IF(D34=0,0,((C34/D34)*100)-100)) -> -8.2991896663034197 | L34: =IF(F34=0,0,IF(C34=0,0,((C34/F34)*100)-100)) -> 10.059804878020046 | M34: =IF(G34=0,0,IF(C34=0,0,((C34/G34)*100)-100)) -> 32.644371949617749 | N34: =IF(C34=0,0,IF(H34=0,0,((C34/H34)*100)-100)) -> 41.788875893230795 | P34: =SUM(P22:P33) -> 70250000 | Q34: =IF(C34=0,0,((C34/P34)*100)-100) -> 1.2539368256227874 | R34: =IF(C34=0,0,(C34/$C$41)*100) -> 57.891896084333553 | T34: 16.449413665480424 | U34: 16.153994080272632 | V34: =U34-T34 -> -0.29541958520779232
A35: Total s/ 27,30 | B35: =B21+B34 -> 108330000 | C35: =C21+C34 -> 110589623.61000001 | D35: =D21+D34 -> 119662385.34 | E35: =E21+E34 -> 0 | F35: =F21+F34 -> 99233461.710000008 | G35: =G21+G34 -> 86167802.230000004 | H35: =H21+H34 -> 76480424.420000002 | I35: =SUM(B35:H35) -> 600463697.31000006 | J35: =IF(C35=0,0,((C35/B35)*100)-100) -> 2.0858705898643137 | K35: =IF(C35=0,0,IF(D35=0,0,((C35/D35)*100)-100)) -> -7.5819662997869415 | L35: =IF(F35=0,0,IF(C35=0,0,((C35/F35)*100)-100)) -> 11.443883650040604 | M35: =IF(G35=0,0,IF(C35=0,0,((C35/G35)*100)-100)) -> 28.342165806681521 | N35: =IF(C35=0,0,IF(H35=0,0,((C35/H35)*100)-100)) -> 44.598600816708199 | P35: =P21+P34 -> 108699000 | Q35: =IF(C35=0,0,((C35/P35)*100)-100) -> 1.7393201501393776 | R35: =IF(C35=0,0,(C35/$C$41)*100) -> 90.006506909046777 | T35: 16.607835212498848 | U35: 16.204219731497101 | V35: =U35-T35 -> -0.40361548100174716
A36: Centenario | B36: 0 | C36: 0 | D36: 0 | F36: 1236381.2 | G36: 1279782.7 | H36: 1146791.31 | J36: =IF(B36=0,0,((C36/B36)*100)-100) -> 0 | K36: =IF(C36=0,0,IF(D36=0,0,((C36/D36)*100)-100)) -> 0 | L36: =IF(F36=0,0,((C36/F36)*100)-100) -> -100 | M36: =IF(G36=0,0,((C36/G36)*100)-100) -> -100 | N36: =IF(C36=0,0,IF(H36=0,0,((C36/H36)*100)-100)) -> 0 | P36: 0.45 | Q36: =IF(P36=0,0,IF(C36=0,0,((C36/P36)*100)-100)) -> 0 | R36: =IF(C36=0,0,(C36/$C$41)*100) -> 0 | T36: 0 | U36: 0 | V36: =U36-T36 -> 0
A37: Cajuru | B37: 3900000 | C37: 4118205.6 | D37: 4968660.87 | F37: 0 | G37: 0 | H37: 0 | J37: =IF(B37=0,0,((C37/B37)*100)-100) -> 5.5950153846153796 | K37: =IF(C37=0,0,IF(D37=0,0,((C37/D37)*100)-100)) -> -17.116387941364977 | L37: =IF(F37=0,0,((C37/F37)*100)-100) -> 0 | M37: =IF(G37=0,0,((C37/G37)*100)-100) -> 0 | N37: =IF(C37=0,0,IF(H37=0,0,((C37/H37)*100)-100)) -> 0 | P37: 3900000 | Q37: =IF(P37=0,0,IF(C37=0,0,((C37/P37)*100)-100)) -> 5.5950153846153796 | R37: =IF(C37=0,0,(C37/$C$41)*100) -> 3.3517186214182746 | T37: 15.5 | U37: 15.57910464693652 | V37: =U37-T37 -> 7.9104646936519529E-2
A38: Novo Mundo | B38: 5300000 | C38: 5457017.9000000004 | D38: 6305417.6500000004 | F38: 5919006.4199999999 | G38: 0 | H38: 0 | J38: =IF(B38=0,0,((C38/B38)*100)-100) -> 2.9626018867924699 | K38: =IF(C38=0,0,IF(D38=0,0,((C38/D38)*100)-100)) -> -13.45509206674042 | L38: =IF(F38=0,0,((C38/F38)*100)-100) -> -7.8051701116418002 | M38: =IF(G38=0,0,((C38/G38)*100)-100) -> 0 | N38: =IF(C38=0,0,IF(H38=0,0,((C38/H38)*100)-100)) -> 0 | P38: 5300000 | Q38: =IF(P38=0,0,IF(C38=0,0,((C38/P38)*100)-100)) -> 2.9626018867924699 | R38: =IF(C38=0,0,(C38/$C$41)*100) -> 4.4413490460123821 | T38: 15.4978 | U38: 15.869699272930731 | V38: =U38-T38 -> 0.37189927293073133
A39: Fazenda | B39: 2850000 | C39: 2703629.19 | D39: 3061194.43 | F39: 0 | G39: 0 | H39: 0 | J39: =IF(B39=0,0,((C39/B39)*100)-100) -> -5.1358178947368458 | K39: =IF(C39=0,0,IF(D39=0,0,((C39/D39)*100)-100)) -> -11.68057920450353 | L39: =IF(F39=0,0,((C39/F39)*100)-100) -> 0 | M39: =IF(G39=0,0,((C39/G39)*100)-100) -> 0 | N39: =IF(C39=0,0,IF(H39=0,0,((C39/H39)*100)-100)) -> 0 | P39: 2850000 | Q39: =IF(P39=0,0,IF(C39=0,0,((C39/P39)*100)-100)) -> -5.1358178947368458 | R39: =IF(C39=0,0,(C39/$C$41)*100) -> 2.2004254235225669 | T39: 15.8 | U39: 15.589681882373817 | V39: =U39-T39 -> -0.21031811762618347
A40: Total Lojas Novas | B40: =SUM(B36:B39) -> 12050000 | C40: =SUM(C36:C39) -> 12278852.689999999 | D40: =SUM(D36:D39) -> 14335272.949999999 | F40: =SUM(F36:F39) -> 7155387.6200000001 | G40: =SUM(G36:G39) -> 1279782.7 | H40: =SUM(H36:H39) -> 1146791.31 | J40: =IF(C40=0,0,((C40/B40)*100)-100) -> 1.8991924481327658 | K40: =IF(C40=0,0,IF(D40=0,0,((C40/D40)*100)-100)) -> -14.345176873663917 | L40: =IF(F40=0,0,IF(C40=0,0,((C40/F40)*100)-100)) -> 71.602900389063734 | M40: =IF(G40=0,0,IF(C40=0,0,((C40/G40)*100)-100)) -> 859.44824773768232 | N40: =IF(C40=0,0,IF(H40=0,0,((C40/H40)*100)-100)) -> 970.71378924208966 | P40: =SUM(P36:P39) -> 12050000.449999999 | Q40: =IF(P40=0,0,IF(C40=0,0,((C40/P40)*100)-100)) -> 1.8991886427689053 | R40: =IF(C40=0,0,(C40/$C$41)*100) -> 9.9934930909532227 | T40: 8.7535269709543559 | U40: 8.6577042402811006 | V40: =U40-T40 -> -9.5822730673255307E-2
A41: Total Geral | B41: =B21+B34+B40 -> 120380000 | C41: =C21+C34+C40 -> 122868476.30000001 | D41: =D21+D34+D40 -> 133997658.29000001 | F41: =F21+F34+F40 -> 106388849.33000001 | G41: =G21+G34+G40 -> 87447584.930000007 | H41: =H21+H34+H40 -> 77627215.730000004 | J41: =IF(C41=0,0,((C41/B41)*100)-100) -> 2.0671841668051343 | K41: =IF(C41=0,0,IF(D41=0,0,((C41/D41)*100)-100)) -> -8.3055048364457491 | L41: =IF(F41=0,0,IF(C41=0,0,((C41/F41)*100)-100)) -> 15.489994556556397 | M41: =IF(G41=0,0,IF(C41=0,0,((C41/G41)*100)-100)) -> 40.5052825625244 | N41: =IF(C41=0,0,IF(H41=0,0,((C41/H41)*100)-100)) -> 58.280153609214096 | P41: =P21+P34+P40 -> 120749000.45 | Q41: =IF(C41=0,0,((C41/P41)*100)-100) -> 1.7552740329951178 | R41: =R21+R34+R40 -> 100 | T41: 15.82162143686659 | U41: 15.450059227274714 | V41: =U41-T41 -> -0.37156220959187536