A2: Periodo: | C2: 38292 | D2: a | E2: 38321 | H2: Vendas Acumuladas por Filial | Q2: =NOW() -> 38322.392375463001
A4: v.1 | C4: Vendas 2004 | G4: Vendas de Anos Anteriores | K4: Percentuais ( % ) | Q4: Meta Mensal | U4: Margem
A5: Lojas | C5: Previsao | D5: Realizada | E5: Mes Anterior | G5: Vendas 2003 | H5: Vendas 2002 | I5: Vendas 2001 | K5: % Prev | L5: % MA | M5: 2003 | N5: 2002 | O5: 2001 | Q5: Previsao Mes | R5: Final | S5: Part. | U5: Meta | V5: Real
A7: Xaxim | C7: 810000 | D7: 788929 | E7: 909085 | G7: 685690 | H7: 546343 | I7: 512236 | K7: =IF(C7=0,0,((D7/C7)*100)-100) -> -2.6 | L7: =IF(D7=0,0,IF(E7=0,0,((D7/E7)*100)-100)) -> -13.22 | M7: =IF(G7=0,0,((D7/G7)*100)-100) -> 15.06 | N7: =IF(H7=0,0,((D7/H7)*100)-100) -> 44.4 | O7: =IF(D7=0,0,IF(I7=0,0,((D7/I7)*100)-100)) -> 54.02 | Q7: 810000 | R7: =IF(D7=0,0,((D7/Q7)*100)-100) -> -2.6 | S7: =IF(D7=0,0,(D7/$D$33)*100) -> 1.43 | U7: 16.45 | V7: 14.6
A8: S. Felicidade | C8: 750000 | D8: 765807 | E8: 814043 | G8: 703822 | H8: 653352 | I8: 553378 | K8: =IF(C8=0,0,((D8/C8)*100)-100) -> 2.11 | L8: =IF(D8=0,0,IF(E8=0,0,((D8/E8)*100)-100)) -> -5.93 | M8: =IF(G8=0,0,((D8/G8)*100)-100) -> 8.81 | N8: =IF(H8=0,0,((D8/H8)*100)-100) -> 17.21 | O8: =IF(D8=0,0,IF(I8=0,0,((D8/I8)*100)-100)) -> 38.39 | Q8: 750000 | R8: =IF(D8=0,0,((D8/Q8)*100)-100) -> 2.11 | S8: =IF(D8=0,0,(D8/$D$33)*100) -> 1.39 | U8: 17.1 | V8: 12.68
A9: Lapa | C9: 1100000 | D9: 1104108 | E9: 1271523 | G9: 999119 | H9: 949798 | I9: 767775 | K9: =IF(C9=0,0,((D9/C9)*100)-100) -> 00.37 | L9: =IF(D9=0,0,IF(E9=0,0,((D9/E9)*100)-100)) -> -13.17 | M9: =IF(G9=0,0,((D9/G9)*100)-100) -> 10.51 | N9: =IF(H9=0,0,((D9/H9)*100)-100) -> 16.25 | O9: =IF(D9=0,0,IF(I9=0,0,((D9/I9)*100)-100)) -> 43.81 | Q9: 1100000 | R9: =IF(D9=0,0,((D9/Q9)*100)-100) -> 00.37 | S9: =IF(D9=0,0,(D9/$D$33)*100) -> 2 | U9: 16.05 | V9: 14.65
A10: Araucaria | C10: 1150000 | D10: 965365 | E10: 1046115 | G10: 960318 | H10: 1078118 | I10: 1532684 | K10: =IF(C10=0,0,((D10/C10)*100)-100) -> -16.06 | L10: =IF(D10=0,0,IF(E10=0,0,((D10/E10)*100)-100)) -> -7.72 | M10: =IF(G10=0,0,((D10/G10)*100)-100) -> 00.53 | N10: =IF(H10=0,0,((D10/H10)*100)-100) -> -10.46 | O10: =IF(D10=0,0,IF(I10=0,0,((D10/I10)*100)-100)) -> -37.01 | Q10: 1150000 | R10: =IF(D10=0,0,((D10/Q10)*100)-100) -> -16.06 | S10: =IF(D10=0,0,(D10/$D$33)*100) -> 1.75 | U10: 17.2 | V10: 16.49
A11: Pinheirinho | C11: 2100000 | D11: 1980196 | E11: 2240021 | G11: 1753520 | H11: 1627986 | I11: 1534606 | K11: =IF(C11=0,0,((D11/C11)*100)-100) -> -5.7 | L11: =IF(D11=0,0,IF(E11=0,0,((D11/E11)*100)-100)) -> -11.6 | M11: =IF(G11=0,0,((D11/G11)*100)-100) -> 12.93 | N11: =IF(H11=0,0,((D11/H11)*100)-100) -> 21.63 | O11: =IF(D11=0,0,IF(I11=0,0,((D11/I11)*100)-100)) -> 29.04 | Q11: 2100000 | R11: =IF(D11=0,0,((D11/Q11)*100)-100) -> -5.7 | S11: =IF(D11=0,0,(D11/$D$33)*100) -> 3.59 | U11: 16.7 | V11: 14.9
A12: Hauer | C12: 3270000 | D12: 3263632 | E12: 3569413 | G12: 2812507 | H12: 2494420 | I12: 2283582 | K12: =IF(C12=0,0,((D12/C12)*100)-100) -> -00.19 | L12: =IF(D12=0,0,IF(E12=0,0,((D12/E12)*100)-100)) -> -8.57 | M12: =IF(G12=0,0,((D12/G12)*100)-100) -> 16.04 | N12: =IF(H12=0,0,((D12/H12)*100)-100) -> 30.84 | O12: =IF(D12=0,0,IF(I12=0,0,((D12/I12)*100)-100)) -> 42.92 | Q12: 3270000 | R12: =IF(D12=0,0,((D12/Q12)*100)-100) -> -00.19 | S12: =IF(D12=0,0,(D12/$D$33)*100) -> 5.91 | U12: 16.1 | V12: 14.66
A13: Paranagua | C13: 3420000 | D13: 3429135 | E13: 3715346 | G13: 2908812 | H13: 2786696 | I13: 2432694 | K13: =IF(C13=0,0,((D13/C13)*100)-100) -> 00.27 | L13: =IF(D13=0,0,IF(E13=0,0,((D13/E13)*100)-100)) -> -7.7 | M13: =IF(G13=0,0,((D13/G13)*100)-100) -> 17.89 | N13: =IF(H13=0,0,((D13/H13)*100)-100) -> 23.05 | O13: =IF(D13=0,0,IF(I13=0,0,((D13/I13)*100)-100)) -> 40.96 | Q13: 3420000 | R13: =IF(D13=0,0,((D13/Q13)*100)-100) -> 00.27 | S13: =IF(D13=0,0,(D13/$D$33)*100) -> 6.21 | U13: 17 | V13: 16.61
A14: Centenario | C14: 1000000 | D14: 947691 | E14: 1070819 | G14: 875210 | H14: 816938 | I14: 690070 | K14: =IF(C14=0,0,((D14/C14)*100)-100) -> -5.23 | L14: =IF(D14=0,0,IF(E14=0,0,((D14/E14)*100)-100)) -> -11.5 | M14: =IF(G14=0,0,((D14/G14)*100)-100) -> 8.28 | N14: =IF(H14=0,0,((D14/H14)*100)-100) -> 16.01 | O14: =IF(D14=0,0,IF(I14=0,0,((D14/I14)*100)-100)) -> 37.33 | Q14: 1000000 | R14: =IF(D14=0,0,((D14/Q14)*100)-100) -> -5.23 | S14: =IF(D14=0,0,(D14/$D$33)*100) -> 1.72 | U14: 16.85 | V14: 14.65
A15: Arapongas | C15: 0 | D15: 0 | E15: 0 | G15: 0 | H15: 541191 | I15: 499531 | K15: =IF(C15=0,0,((D15/C15)*100)-100) -> 0 | L15: =IF(D15=0,0,IF(E15=0,0,((D15/E15)*100)-100)) -> 0 | M15: =IF(D15=0,0,IF(G15=0,0,((D15/G15)*100)-100)) -> 0 | N15: =IF(D15=0,0,IF(H15=0,0,((D15/H15)*100)-100)) -> 0 | O15: =IF(D15=0,0,IF(I15=0,0,((D15/I15)*100)-100)) -> 0 | Q15: 0 | R15: =IF(D15=0,0,((D15/Q15)*100)-100) -> 0 | S15: =IF(D15=0,0,(D15/$D$33)*100) -> 0 | U15: 0 | V15: 0
A16: Sao Braz | C16: 3270000 | D16: 3104497 | E16: 3391369 | G16: 3023430 | H16: 2696200 | I16: 2349485 | K16: =IF(C16=0,0,((D16/C16)*100)-100) -> -5.06 | L16: =IF(D16=0,0,IF(E16=0,0,((D16/E16)*100)-100)) -> -8.46 | M16: =IF(G16=0,0,((D16/G16)*100)-100) -> 2.68 | N16: =IF(H16=0,0,((D16/H16)*100)-100) -> 15.14 | O16: =IF(D16=0,0,IF(I16=0,0,((D16/I16)*100)-100)) -> 32.14 | Q16: 3270000 | R16: =IF(D16=0,0,((D16/Q16)*100)-100) -> -5.06 | S16: =IF(D16=0,0,(D16/$D$33)*100) -> 5.63 | U16: 15.9 | V16: 13.74
A17: Guarapuava | C17: 1600000 | D17: 1672286 | E17: 1928661 | G17: 1313024 | H17: 1061698 | I17: 731012 | K17: =IF(C17=0,0,((D17/C17)*100)-100) -> 4.52 | L17: =IF(D17=0,0,IF(E17=0,0,((D17/E17)*100)-100)) -> -13.29 | M17: =IF(G17=0,0,((D17/G17)*100)-100) -> 27.36 | N17: =IF(H17=0,0,((D17/H17)*100)-100) -> 57.51 | O17: =IF(D17=0,0,IF(I17=0,0,((D17/I17)*100)-100)) -> 128.76 | Q17: 1600000 | R17: =IF(D17=0,0,((D17/Q17)*100)-100) -> 4.52 | S17: =IF(D17=0,0,(D17/$D$33)*100) -> 3.03 | U17: 16.95 | V17: 15.64
A18: Apucarana | C18: 1550000 | D18: 1651372 | E18: 1777628 | G18: 1307066 | H18: 1260187 | I18: 1049838 | K18: =IF(C18=0,0,((D18/C18)*100)-100) -> 6.54 | L18: =IF(D18=0,0,IF(E18=0,0,((D18/E18)*100)-100)) -> -7.1 | M18: =IF(G18=0,0,((D18/G18)*100)-100) -> 26.34 | N18: =IF(H18=0,0,((D18/H18)*100)-100) -> 31.04 | O18: =IF(D18=0,0,IF(I18=0,0,((D18/I18)*100)-100)) -> 57.3 | Q18: 1550000 | R18: =IF(D18=0,0,((D18/Q18)*100)-100) -> 6.54 | S18: =IF(D18=0,0,(D18/$D$33)*100) -> 2.99 | U18: 16.95 | V18: 14.55
A19: Ahu | C19: 1200000 | D19: 1070741 | E19: 1320549 | G19: 1209111 | H19: 1116627 | I19: 1205104 | K19: =IF(C19=0,0,((D19/C19)*100)-100) -> -10.77 | L19: =IF(D19=0,0,IF(E19=0,0,((D19/E19)*100)-100)) -> -18.92 | M19: =IF(G19=0,0,((D19/G19)*100)-100) -> -11.44 | N19: =IF(H19=0,0,((D19/H19)*100)-100) -> -4.11 | O19: =IF(D19=0,0,IF(I19=0,0,((D19/I19)*100)-100)) -> -11.15 | Q19: 1200000 | R19: =IF(D19=0,0,((D19/Q19)*100)-100) -> -10.77 | S19: =IF(D19=0,0,(D19/$D$33)*100) -> 1.94 | U19: 17.3 | V19: 15.68
A20: P.G. Centro | C20: 1850000 | D20: 1626560 | E20: 1750739 | G20: 1480289 | H20: 1434642 | I20: 1087540 | K20: =IF(C20=0,0,((D20/C20)*100)-100) -> -12.08 | L20: =IF(D20=0,0,IF(E20=0,0,((D20/E20)*100)-100)) -> -7.09 | M20: =IF(G20=0,0,((D20/G20)*100)-100) -> 9.88 | N20: =IF(H20=0,0,((D20/H20)*100)-100) -> 13.38 | O20: =IF(D20=0,0,IF(I20=0,0,((D20/I20)*100)-100)) -> 49.56 | Q20: 1850000 | R20: =IF(D20=0,0,((D20/Q20)*100)-100) -> -12.08 | S20: =IF(D20=0,0,(D20/$D$33)*100) -> 2.95 | U20: 17.5 | V20: 16.1
A21: Maringa | C21: 2280000 | D21: 2216961 | E21: 2528510 | G21: 1925330 | H21: 1900663 | I21: 1545033 | K21: =IF(C21=0,0,((D21/C21)*100)-100) -> -2.76 | L21: =IF(D21=0,0,IF(E21=0,0,((D21/E21)*100)-100)) -> -12.32 | M21: =IF(G21=0,0,((D21/G21)*100)-100) -> 15.15 | N21: =IF(H21=0,0,((D21/H21)*100)-100) -> 16.64 | O21: =IF(D21=0,0,IF(I21=0,0,((D21/I21)*100)-100)) -> 43.49 | Q21: 2280000 | R21: =IF(D21=0,0,((D21/Q21)*100)-100) -> -2.76 | S21: =IF(D21=0,0,(D21/$D$33)*100) -> 4.02 | U21: 17.58 | V21: 17.05
A22: Araucaria Nova | C22: 2100000 | D22: 2161873 | E22: 2420547 | G22: 1918227 | H22: 1678009 | I22: 0 | K22: =IF(C22=0,0,((D22/C22)*100)-100) -> 2.95 | L22: =IF(D22=0,0,IF(E22=0,0,((D22/E22)*100)-100)) -> -10.69 | M22: =IF(G22=0,0,((D22/G22)*100)-100) -> 12.7 | N22: =IF(H22=0,0,((D22/H22)*100)-100) -> 28.84 | O22: =IF(D22=0,0,IF(I22=0,0,((D22/I22)*100)-100)) -> 0 | Q22: 2100000 | R22: =IF(D22=0,0,((D22/Q22)*100)-100) -> 2.95 | S22: =IF(D22=0,0,(D22/$D$33)*100) -> 3.92 | U22: 17.2 | V22: 16.34
A23: Total Super | C23: =SUM(C7:C22) -> 27450000 | D23: =SUM(D7:D22) -> 26749153 | E23: =SUM(E7:E22) -> 29754368 | G23: =SUM(G7:G22) -> 23875475 | H23: =SUM(H7:H22) -> 22642868 | I23: =SUM(I7:I22) -> 18774568 | J23: =SUM(C23:I23) -> 149246432 | K23: =IF(D23=0,0,((D23/C23)*100)-100) -> -2.55 | L23: =IF(D23=0,0,IF(E23=0,0,((D23/E23)*100)-100)) -> -10.1 | M23: =IF(G23=0,0,IF(D23=0,0,((D23/G23)*100)-100)) -> 12.04 | N23: =IF(H23=0,0,IF(D23=0,0,((D23/H23)*100)-100)) -> 18.14 | O23: =IF(D23=0,0,IF(I23=0,0,((D23/I23)*100)-100)) -> 42.48 | Q23: =SUM(Q7:Q22) -> 27450000 | R23: =IF(D23=0,0,((D23/Q23)*100)-100) -> -2.55 | S23: =IF(D23=0,0,(D23/$D$33)*100) -> 48.48 | U23: 16.87 | V23: 13.68
A25: Londrina | C25: 2650000 | D25: 2552744 | E25: 2806010 | G25: 2109010 | H25: 2119294 | I25: 1835735 | K25: =IF(C25=0,0,((D25/C25)*100)-100) -> -3.67 | L25: =IF(D25=0,0,IF(E25=0,0,((D25/E25)*100)-100)) -> -9.03 | M25: =IF(G25=0,0,((D25/G25)*100)-100) -> 21.04 | N25: =IF(H25=0,0,((D25/H25)*100)-100) -> 20.45 | O25: =IF(D25=0,0,IF(I25=0,0,((D25/I25)*100)-100)) -> 39.06 | Q25: 2650000 | R25: =IF(D25=0,0,IF(Q25=0,0,((D25/Q25)*100)-100)) -> -3.67 | S25: =IF(D25=0,0,(D25/$D$33)*100) -> 4.63 | U25: 17.3 | V25: 13.1
A26: S.J. Pinhais | C26: 4200000 | D26: 4451299 | E26: 4911701 | G26: 4002822 | H26: 3595558 | I26: 2911965 | K26: =IF(C26=0,0,((D26/C26)*100)-100) -> 5.98 | L26: =IF(D26=0,0,IF(E26=0,0,((D26/E26)*100)-100)) -> -9.37 | M26: =IF(G26=0,0,((D26/G26)*100)-100) -> 11.2 | N26: =IF(H26=0,0,((D26/H26)*100)-100) -> 23.8 | O26: =IF(D26=0,0,IF(I26=0,0,((D26/I26)*100)-100)) -> 52.86 | Q26: 4200000 | R26: =IF(D26=0,0,IF(Q26=0,0,((D26/Q26)*100)-100)) -> 5.98 | S26: =IF(D26=0,0,(D26/$D$33)*100) -> 8.07 | U26: 16.45 | V26: 14.64
A27: P.G. Nova | C27: 3600000 | D27: 3477024 | E27: 3990298 | G27: 2603643 | H27: 2918797 | I27: 2224114 | K27: =IF(C27=0,0,((D27/C27)*100)-100) -> -3.42 | L27: =IF(D27=0,0,IF(E27=0,0,((D27/E27)*100)-100)) -> -12.86 | M27: =IF(G27=0,0,((D27/G27)*100)-100) -> 33.54 | N27: =IF(H27=0,0,((D27/H27)*100)-100) -> 19.13 | O27: =IF(D27=0,0,IF(I27=0,0,((D27/I27)*100)-100)) -> 56.33 | Q27: 3600000 | R27: =IF(D27=0,0,IF(Q27=0,0,((D27/Q27)*100)-100)) -> -3.42 | S27: =IF(D27=0,0,(D27/$D$33)*100) -> 6.3 | U27: 15.7 | V27: 14.96
A28: Nilo Pecanha | C28: 8600000 | D28: 8168245 | E28: 9741202 | G28: 8215743 | H28: 6563607 | I28: 0 | K28: =IF(C28=0,0,((D28/C28)*100)-100) -> -5.02 | L28: =IF(D28=0,0,IF(E28=0,0,((D28/E28)*100)-100)) -> -16.15 | M28: =IF(G28=0,0,((D28/G28)*100)-100) -> -00.58 | N28: =IF(H28=0,0,((D28/H28)*100)-100) -> 24.45 | O28: =IF(D28=0,0,IF(I28=0,0,((D28/I28)*100)-100)) -> 0 | Q28: 8600000 | R28: =IF(D28=0,0,IF(Q28=0,0,((D28/Q28)*100)-100)) -> -5.02 | S28: =IF(D28=0,0,(D28/$D$33)*100) -> 14.8 | U28: 15.2 | V28: 14.67
A29: Champagnat | C29: 5500000 | D29: 5383379 | E29: 6029680 | G29: 0 | H29: 0 | I29: 0 | K29: =IF(C29=0,0,((D29/C29)*100)-100) -> -2.12 | L29: =IF(D29=0,0,IF(E29=0,0,((D29/E29)*100)-100)) -> -10.72 | M29: =IF(G29=0,0,((D29/G29)*100)-100) -> 0 | N29: =IF(H29=0,0,((D29/H29)*100)-100) -> 0 | O29: =IF(D29=0,0,IF(I29=0,0,((D29/I29)*100)-100)) -> 0 | Q29: 5500000 | R29: =IF(D29=0,0,IF(Q29=0,0,((D29/Q29)*100)-100)) -> -2.12 | S29: =IF(D29=0,0,(D29/$D$33)*100) -> 9.76 | U29: 14.5 | V29: 13.93
A30: Santa Candida | C30: 4397636 | D30: 4397636 | E30: 0 | G30: 0 | H30: 0 | I30: 0 | K30: =IF(C30=0,0,((D30/C30)*100)-100) -> 0 | L30: =IF(D30=0,0,IF(E30=0,0,((D30/E30)*100)-100)) -> 0 | M30: =IF(G30=0,0,((D30/G30)*100)-100) -> 0 | N30: =IF(H30=0,0,((D30/H30)*100)-100) -> 0 | O30: =IF(D30=0,0,IF(I30=0,0,((D30/I30)*100)-100)) -> 0 | Q30: 0 | R30: =IF(D30=0,0,IF(Q30=0,0,((D30/Q30)*100)-100)) -> 0 | S30: =IF(D30=0,0,(D30/$D$33)*100) -> 7.97 | U30: 0 | V30: 6.58
A31: Total Hiper | C31: =SUM(C25:C30) -> 28947636 | D31: =SUM(D25:D30) -> 28430327 | E31: =SUM(E25:E30) -> 27478891 | G31: =SUM(G25:G30) -> 16931218 | H31: =SUM(H25:H30) -> 15197256 | I31: =SUM(I25:I30) -> 6971814 | J31: =SUM(C31:I31) -> 123957142 | K31: =IF(D31=0,0,((D31/C31)*100)-100) -> -1.79 | L31: =IF(D31=0,0,IF(E31=0,0,((D31/E31)*100)-100)) -> 3.46 | M31: =IF(G31=0,0,IF(D31=0,0,((D31/G31)*100)-100)) -> 67.92 | N31: =IF(H31=0,0,IF(D31=0,0,((D31/H31)*100)-100)) -> 87.08 | O31: =IF(D31=0,0,IF(I31=0,0,((D31/I31)*100)-100)) -> 307.79 | Q31: =SUM(Q25:Q30) -> 24550000 | R31: =IF(D31=0,0,((D31/Q31)*100)-100) -> 15.81 | S31: =IF(D31=0,0,(D31/$D$33)*100) -> 51.52 | U31: 15.56 | V31: 0
A33: Total Geral | C33: =C23+C31 -> 56397636 | D33: =D23+D31 -> 55179480 | E33: =E23+E31 -> 57233259 | G33: =G23+G31 -> 40806693 | H33: =H23+H31 -> 37840124 | I33: =I23+I31 -> 25746382 | K33: =IF(D31=0,0,((D33/C33)*100)-100) -> -2.16 | L33: =IF(D33=0,0,IF(E33=0,0,((D33/E33)*100)-100)) -> -3.59 | M33: =IF(G33=0,0,IF(D33=0,0,((D33/G33)*100)-100)) -> 35.22 | N33: =IF(H33=0,0,IF(D33=0,0,((D33/H33)*100)-100)) -> 45.82 | O33: =IF(D33=0,0,IF(I33=0,0,((D33/I33)*100)-100)) -> 114.32 | Q33: =Q23+Q31 -> 52000000 | R33: =IF(D33=0,0,((D33/Q33)*100)-100) -> 6.11 | S33: =S23+S31 -> 100 | U33: 16.19 | V33: 14.87
C34: Resumo por Regiao - Outubro/2002
C35: Descricao das Aberturas | H35: Valor | I35: %
C36: Curitiba (2,3,6,7,10,11,17,21,22) | H36: =D7+D8+D11+D12+D14+D16+D19+D28+D29+D30 -> 29870753 | I36: =IF(D33=0,0,H36/$D$33) -> 0.5413
C37: Curitiba e Metrop. (Ctba. 4,5,8,14,23) | H37: =H36+D9+D10+D13+D27+D22 -> 41008258 | I37: =IF(D33=0,0,H37/$D$33) -> 0.74319999999999997
C38: Metropolitana (4,5,8,14,23) | H38: =H37-H36 -> 11137505 | I38: =IF(D33=0,0,H38/$D$33) -> 0.20180000000000001
C39: Norte (9,15,20) | H39: =D25+D18+D22 -> 6365989 | I39: =IF(D33=0,0,H39/$D$33) -> 0.1154
C40: Centro-Oeste (13,18,19) | H40: =D17+D20+D27 -> 6775870 | I40: =IF(D33=0,0,H40/$D$33) -> 0.12280000000000001
C41: Ponta Grossa (18,19) | H41: =H40-D17 -> 5103584 | I41: =IF(D33=0,0,H41/$D$33) -> 9.2499999999999999E-2
C42: Super (2,3,4,5,6,7,8,10,11,13,15,17,18,20,23) | H42: =D23 -> 26749153 | I42: =IF(D33=0,0,H42/$D$33) -> 0.48480000000000001
C43: Hiper (9,14,19,21,22,24) | H43: =D31 -> 28430327 | I43: =IF(D33=0,0,H43/$D$33) -> 0.51519999999999999
C44: Curitiba, Metropolitana e Centro-Oeste | H44: =D33-H39 -> 48813491 | I44: =IF(D33=0,0,H44/$D$33) -> 0.88460000000000005
C45: Araucaria | H45: =D10+D22 -> 3127238 | I45: =IF(D33=0,0,H45/$D$33) -> 5.67E-2