A2: Perodo: | C2: 37926 | E2: 37955 | H2: Vendas Acumuladas por Filial
C4: Vendas 2003 | G4: Vendas de Anos Anteriores | K4: Percentuais ( % ) | R4: %
A5: Lojas | C5: Previso | D5: Realizada | E5: Ms Anterior | G5: Vendas 2002 | H5: Vendas 2001 | I5: Vendas 2000 | K5: % Prev | L5: % MA | M5: 2002 | N5: 2001 | O5: 2000 | Q5: Previso Ms | R5: Final | S5: Part.
A7: Xaxim | C7: 730000 | D7: 685690.24 | E7: 736286.08 | G7: 546342.78 | H7: 512236.27 | I7: 583236.6 | K7: =IF(C7=0,0,((D7/C7)*100)-100) -> -6.07 | L7: =IF(D7=0,0,IF(E7=0,0,((D7/E7)*100)-100)) -> -6.87 | M7: =IF(G7=0,0,((D7/G7)*100)-100) -> 25.51 | N7: =IF(H7=0,0,((D7/H7)*100)-100) -> 33.86 | O7: =IF(D7=0,0,IF(I7=0,0,((D7/I7)*100)-100)) -> 17.57 | Q7: 730000 | R7: =IF(D7=0,0,((D7/Q7)*100)-100) -> -6.07 | S7: =IF(D7=0,0,(D7/$D$30)*100) -> 1.68
A8: S. Felicidade | C8: 770000 | D8: 703821.94 | E8: 721410.3 | G8: 653352.42 | H8: 553377.72 | I8: 591858.03 | K8: =IF(C8=0,0,((D8/C8)*100)-100) -> -8.59 | L8: =IF(D8=0,0,IF(E8=0,0,((D8/E8)*100)-100)) -> -2.44 | M8: =IF(G8=0,0,((D8/G8)*100)-100) -> 7.72 | N8: =IF(H8=0,0,((D8/H8)*100)-100) -> 27.19 | O8: =IF(D8=0,0,IF(I8=0,0,((D8/I8)*100)-100)) -> 18.92 | Q8: 770000 | R8: =IF(D8=0,0,((D8/Q8)*100)-100) -> -8.59 | S8: =IF(D8=0,0,(D8/$D$30)*100) -> 1.72
A9: Lapa | C9: 1060000 | D9: 999119.05 | E9: 1025722.89 | G9: 949798.33 | H9: 767775.17 | I9: 633920.8 | K9: =IF(C9=0,0,((D9/C9)*100)-100) -> -5.74 | L9: =IF(D9=0,0,IF(E9=0,0,((D9/E9)*100)-100)) -> -2.59 | M9: =IF(G9=0,0,((D9/G9)*100)-100) -> 5.19 | N9: =IF(H9=0,0,((D9/H9)*100)-100) -> 30.13 | O9: =IF(D9=0,0,IF(I9=0,0,((D9/I9)*100)-100)) -> 57.61 | Q9: 1060000 | R9: =IF(D9=0,0,((D9/Q9)*100)-100) -> -5.74 | S9: =IF(D9=0,0,(D9/$D$30)*100) -> 2.45
A10: Araucria | C10: 1050000 | D10: 960317.95 | E10: 967398.59 | G10: 1078118.16 | H10: 1532684.03 | I10: 1284380.35 | K10: =IF(C10=0,0,((D10/C10)*100)-100) -> -8.54 | L10: =IF(D10=0,0,IF(E10=0,0,((D10/E10)*100)-100)) -> -00.73 | M10: =IF(G10=0,0,((D10/G10)*100)-100) -> -10.93 | N10: =IF(H10=0,0,((D10/H10)*100)-100) -> -37.34 | O10: =IF(D10=0,0,IF(I10=0,0,((D10/I10)*100)-100)) -> -25.23 | Q10: 1050000 | R10: =IF(D10=0,0,((D10/Q10)*100)-100) -> -8.54 | S10: =IF(D10=0,0,(D10/$D$30)*100) -> 2.35
A11: Pinheirinho | C11: 1950000 | D11: 1753710.94 | E11: 1707863.96 | G11: 1627985.51 | H11: 1534606.13 | I11: 1828331.63 | K11: =IF(C11=0,0,((D11/C11)*100)-100) -> -10.07 | L11: =IF(D11=0,0,IF(E11=0,0,((D11/E11)*100)-100)) -> 2.68 | M11: =IF(G11=0,0,((D11/G11)*100)-100) -> 7.72 | N11: =IF(H11=0,0,((D11/H11)*100)-100) -> 14.28 | O11: =IF(D11=0,0,IF(I11=0,0,((D11/I11)*100)-100)) -> -4.08 | Q11: 1950000 | R11: =IF(D11=0,0,((D11/Q11)*100)-100) -> -10.07 | S11: =IF(D11=0,0,(D11/$D$30)*100) -> 4.3
A12: Hauer | C12: 2950000 | D12: 2812507.17 | E12: 2943839.69 | G12: 2494419.46 | H12: 2283582.26 | I12: 2214211.15 | K12: =IF(C12=0,0,((D12/C12)*100)-100) -> -4.66 | L12: =IF(D12=0,0,IF(E12=0,0,((D12/E12)*100)-100)) -> -4.46 | M12: =IF(G12=0,0,((D12/G12)*100)-100) -> 12.75 | N12: =IF(H12=0,0,((D12/H12)*100)-100) -> 23.16 | O12: =IF(D12=0,0,IF(I12=0,0,((D12/I12)*100)-100)) -> 27.02 | Q12: 2950000 | R12: =IF(D12=0,0,((D12/Q12)*100)-100) -> -4.66 | S12: =IF(D12=0,0,(D12/$D$30)*100) -> 6.89
A13: Paranagu | C13: 3100000 | D13: 2908811.91 | E13: 3000411.66 | G13: 2786695.88 | H13: 2432693.77 | I13: 1991827.25 | K13: =IF(C13=0,0,((D13/C13)*100)-100) -> -6.17 | L13: =IF(D13=0,0,IF(E13=0,0,((D13/E13)*100)-100)) -> -3.05 | M13: =IF(G13=0,0,((D13/G13)*100)-100) -> 4.38 | N13: =IF(H13=0,0,((D13/H13)*100)-100) -> 19.57 | O13: =IF(D13=0,0,IF(I13=0,0,((D13/I13)*100)-100)) -> 46.04 | Q13: 3100000 | R13: =IF(D13=0,0,((D13/Q13)*100)-100) -> -6.17 | S13: =IF(D13=0,0,(D13/$D$30)*100) -> 7.13
A14: Centenrio | C14: 945000 | D14: 875209.78 | E14: 939422.22 | G14: 816938.06 | H14: 690069.73 | I14: 690514.79 | K14: =IF(C14=0,0,((D14/C14)*100)-100) -> -7.39 | L14: =IF(D14=0,0,IF(E14=0,0,((D14/E14)*100)-100)) -> -6.84 | M14: =IF(G14=0,0,((D14/G14)*100)-100) -> 7.13 | N14: =IF(H14=0,0,((D14/H14)*100)-100) -> 26.83 | O14: =IF(D14=0,0,IF(I14=0,0,((D14/I14)*100)-100)) -> 26.75 | Q14: 945000 | R14: =IF(D14=0,0,((D14/Q14)*100)-100) -> -7.39 | S14: =IF(D14=0,0,(D14/$D$30)*100) -> 2.14
A15: So Brz | C15: 3050000 | D15: 3023429.98 | E15: 3012100.73 | G15: 2696199.99 | H15: 2349485 | I15: 2302537.71 | K15: =IF(C15=0,0,((D15/C15)*100)-100) -> -00.87 | L15: =IF(D15=0,0,IF(E15=0,0,((D15/E15)*100)-100)) -> 00.38 | M15: =IF(G15=0,0,((D15/G15)*100)-100) -> 12.14 | N15: =IF(H15=0,0,((D15/H15)*100)-100) -> 28.68 | O15: =IF(D15=0,0,IF(I15=0,0,((D15/I15)*100)-100)) -> 31.31 | Q15: 3050000 | R15: =IF(D15=0,0,((D15/Q15)*100)-100) -> -00.87 | S15: =IF(D15=0,0,(D15/$D$30)*100) -> 7.41
A16: Guarapuava | C16: 1350000 | D16: 1313024.27 | E16: 1332496.11 | G16: 1061698.18 | H16: 731012.25 | I16: 852223.32 | K16: =IF(C16=0,0,((D16/C16)*100)-100) -> -2.74 | L16: =IF(D16=0,0,IF(E16=0,0,((D16/E16)*100)-100)) -> -1.46 | M16: =IF(G16=0,0,((D16/G16)*100)-100) -> 23.67 | N16: =IF(H16=0,0,((D16/H16)*100)-100) -> 79.62 | O16: =IF(D16=0,0,IF(I16=0,0,((D16/I16)*100)-100)) -> 54.07 | Q16: 1350000 | R16: =IF(D16=0,0,((D16/Q16)*100)-100) -> -2.74 | S16: =IF(D16=0,0,(D16/$D$30)*100) -> 3.22
A17: Apucarana | C17: 1300000 | D17: 1307066.16 | E17: 1345962.39 | G17: 1260186.57 | H17: 1049837.49 | I17: 1144560.05 | K17: =IF(C17=0,0,((D17/C17)*100)-100) -> 00.54 | L17: =IF(D17=0,0,IF(E17=0,0,((D17/E17)*100)-100)) -> -2.89 | M17: =IF(G17=0,0,((D17/G17)*100)-100) -> 3.72 | N17: =IF(H17=0,0,((D17/H17)*100)-100) -> 24.5 | O17: =IF(D17=0,0,IF(I17=0,0,((D17/I17)*100)-100)) -> 14.2 | Q17: 1300000 | R17: =IF(D17=0,0,((D17/Q17)*100)-100) -> 00.54 | S17: =IF(D17=0,0,(D17/$D$30)*100) -> 3.2
A18: Ah | C18: 1300000 | D18: 1209111.05 | E18: 1260855.75 | G18: 1116626.59 | H18: 1205104.36 | I18: 1153641.14 | K18: =IF(C18=0,0,((D18/C18)*100)-100) -> -6.99 | L18: =IF(D18=0,0,IF(E18=0,0,((D18/E18)*100)-100)) -> -4.1 | M18: =IF(G18=0,0,((D18/G18)*100)-100) -> 8.28 | N18: =IF(H18=0,0,((D18/H18)*100)-100) -> 00.33 | O18: =IF(D18=0,0,IF(I18=0,0,((D18/I18)*100)-100)) -> 4.81 | Q18: 1300000 | R18: =IF(D18=0,0,((D18/Q18)*100)-100) -> -6.99 | S18: =IF(D18=0,0,(D18/$D$30)*100) -> 2.96
A19: P.G. Centro | C19: 1680000 | D19: 1480288.69 | E19: 1617595.38 | G19: 1434642.4 | H19: 1087540.41 | I19: 1195578.36 | K19: =IF(C19=0,0,((D19/C19)*100)-100) -> -11.89 | L19: =IF(D19=0,0,IF(E19=0,0,((D19/E19)*100)-100)) -> -8.49 | M19: =IF(G19=0,0,((D19/G19)*100)-100) -> 3.18 | N19: =IF(H19=0,0,((D19/H19)*100)-100) -> 36.11 | O19: =IF(D19=0,0,IF(I19=0,0,((D19/I19)*100)-100)) -> 23.81 | Q19: 1680000 | R19: =IF(D19=0,0,((D19/Q19)*100)-100) -> -11.89 | S19: =IF(D19=0,0,(D19/$D$30)*100) -> 3.63
A20: Maring | C20: 2100000 | D20: 1925329.55 | E20: 1989247.42 | G20: 1900662.92 | H20: 1545033.03 | I20: 1596202.25 | K20: =IF(C20=0,0,((D20/C20)*100)-100) -> -8.32 | L20: =IF(D20=0,0,IF(E20=0,0,((D20/E20)*100)-100)) -> -3.21 | M20: =IF(G20=0,0,((D20/G20)*100)-100) -> 1.3 | N20: =IF(H20=0,0,((D20/H20)*100)-100) -> 24.61 | O20: =IF(D20=0,0,IF(I20=0,0,((D20/I20)*100)-100)) -> 20.62 | Q20: 2100000 | R20: =IF(D20=0,0,((D20/Q20)*100)-100) -> -8.32 | S20: =IF(D20=0,0,(D20/$D$30)*100) -> 4.72
A21: Araucria Nova | C21: 1900000 | D21: 1918226.61 | E21: 1858623.54 | G21: 1678009.22 | H21: 0 | I21: 0 | K21: =IF(C21=0,0,((D21/C21)*100)-100) -> 00.96 | L21: =IF(D21=0,0,IF(E21=0,0,((D21/E21)*100)-100)) -> 3.21 | M21: =IF(G21=0,0,((D21/G21)*100)-100) -> 14.32 | N21: =IF(H21=0,0,((D21/H21)*100)-100) -> 0 | O21: =IF(D21=0,0,IF(I21=0,0,((D21/I21)*100)-100)) -> 0 | Q21: 1900000 | R21: =IF(D21=0,0,((D21/Q21)*100)-100) -> 00.96 | S21: =IF(D21=0,0,(D21/$D$30)*100) -> 4.7
A22: Total Super | C22: =SUM(C7:C21) -> 25235000 | D22: =SUM(D7:D21) -> 23875665.289999999 | E22: =SUM(E7:E21) -> 24459236.710000001 | G22: =SUM(G7:G21) -> 22101676.469999999 | H22: =SUM(H7:H21) -> 18275037.620000001 | I22: =SUM(I7:I21) -> 18063023.43 | J22: =SUM(C22:I22) -> 132009639.52 | K22: =IF(D22=0,0,((D22/C22)*100)-100) -> -5.39 | L22: =IF(D22=0,0,IF(E22=0,0,((D22/E22)*100)-100)) -> -2.39 | M22: =IF(D22=0,0,((D22/G22)*100)-100) -> 8.03 | N22: =IF(D22=0,0,((D22/H22)*100)-100) -> 30.65 | O22: =IF(D22=0,0,IF(I22=0,0,((D22/I22)*100)-100)) -> 32.18 | Q22: =SUM(Q7:Q21) -> 25235000 | R22: =IF(D22=0,0,((D22/Q22)*100)-100) -> -5.39 | S22: =IF(D22=0,0,(D22/$D$30)*100) -> 58.51
A24: Londrina | C24: 2400000 | D24: 2109010.02 | E24: 2177152.89 | G24: 2119294.13 | H24: 1835734.97 | I24: 2596850.8 | K24: =IF(C24=0,0,((D24/C24)*100)-100) -> -12.12 | L24: =IF(D24=0,0,IF(E24=0,0,((D24/E24)*100)-100)) -> -3.13 | M24: =IF(G24=0,0,((D24/G24)*100)-100) -> -00.49 | N24: =IF(H24=0,0,((D24/H24)*100)-100) -> 14.89 | O24: =IF(D24=0,0,IF(I24=0,0,((D24/I24)*100)-100)) -> -18.79 | Q24: 2400000 | R24: =IF(D24=0,0,((D24/Q24)*100)-100) -> -12.12 | S24: =IF(D24=0,0,(D24/$D$30)*100) -> 5.17
A25: S.J. Pinhais | C25: 4050000 | D25: 4002821.89 | E25: 4050213.21 | G25: 3595557.78 | H25: 2911964.58 | I25: 1886711.73 | K25: =IF(C25=0,0,((D25/C25)*100)-100) -> -1.16 | L25: =IF(D25=0,0,IF(E25=0,0,((D25/E25)*100)-100)) -> -1.17 | M25: =IF(G25=0,0,((D25/G25)*100)-100) -> 11.33 | N25: =IF(H25=0,0,((D25/H25)*100)-100) -> 37.46 | O25: =IF(D25=0,0,IF(I25=0,0,((D25/I25)*100)-100)) -> 112.16 | Q25: 4050000 | R25: =IF(D24=0,0,((D25/Q25)*100)-100) -> -1.16 | S25: =IF(D25=0,0,(D25/$D$30)*100) -> 9.81
A26: P.G. Nova | C26: 3000000 | D26: 2603643.03 | E26: 3003183.32 | G26: 2918796.79 | H26: 2224113.5 | I26: 1918819.37 | K26: =IF(C26=0,0,((D26/C26)*100)-100) -> -13.21 | L26: =IF(D26=0,0,IF(E26=0,0,((D26/E26)*100)-100)) -> -13.3 | M26: =IF(G26=0,0,((D26/G26)*100)-100) -> -10.8 | N26: =IF(H26=0,0,((D26/H26)*100)-100) -> 17.06 | O26: =IF(D26=0,0,IF(I26=0,0,((D26/I26)*100)-100)) -> 35.69 | Q26: 3000000 | R26: =IF(D25=0,0,((D26/Q26)*100)-100) -> -13.21 | S26: =IF(D26=0,0,(D26/$D$30)*100) -> 6.38
A27: Nilo Peanha | C27: 8250000 | D27: 8215743.1399999997 | E27: 8446863.1300000008 | G27: 6563606.2999999998 | H27: 0 | I27: 0 | K27: =IF(C27=0,0,((D27/C27)*100)-100) -> -00.42 | L27: =IF(D27=0,0,IF(E27=0,0,((D27/E27)*100)-100)) -> -2.74 | M27: =IF(G27=0,0,((D27/G27)*100)-100) -> 25.17 | N27: =IF(H27=0,0,((D27/H27)*100)-100) -> 0 | O27: =IF(D27=0,0,IF(I27=0,0,((D27/I27)*100)-100)) -> 0 | Q27: 8250000 | R27: =IF(D26=0,0,((D27/Q27)*100)-100) -> -00.42 | S27: =IF(D27=0,0,(D27/$D$30)*100) -> 20.13
A28: Total Hiper | C28: =SUM(C24:C27) -> 17700000 | D28: =SUM(D24:D27) -> 16931218.079999998 | E28: =SUM(E24:E27) -> 17677412.550000001 | G28: =SUM(G24:G27) -> 15197255 | H28: =SUM(H24:H27) -> 6971813.0499999998 | I28: =SUM(I24:I27) -> 6402381.9000000004 | J28: =SUM(C28:I28) -> 80880080.579999998 | K28: =IF(D28=0,0,((D28/C28)*100)-100) -> -4.34 | L28: =IF(D28=0,0,IF(E28=0,0,((D28/E28)*100)-100)) -> -4.22 | M28: =IF(D28=0,0,((D28/G28)*100)-100) -> 11.41 | N28: =IF(D28=0,0,((D28/H28)*100)-100) -> 142.85 | O28: =IF(D28=0,0,IF(I28=0,0,((D28/I28)*100)-100)) -> 164.45 | Q28: =SUM(Q24:Q27) -> 17700000 | R28: =IF(D28=0,0,((D28/Q28)*100)-100) -> -4.34 | S28: =IF(D28=0,0,(D28/$D$30)*100) -> 41.49
A30: Total Geral | C30: =C22+C28 -> 42935000 | D30: =D22+D28 -> 40806883.369999997 | E30: =E22+E28 -> 42136649.259999998 | G30: =G22+G28 -> 37298931.469999999 | H30: =H22+H28 -> 25246850.670000002 | I30: =I22+I28 -> 24465405.329999998 | K30: =IF(D28=0,0,((D30/C30)*100)-100) -> -4.96 | L30: =IF(D30=0,0,IF(E30=0,0,((D30/E30)*100)-100)) -> -3.16 | M30: =IF(D30=0,0,((D30/G30)*100)-100) -> 9.4 | N30: =IF(D30=0,0,((D30/H30)*100)-100) -> 61.63 | O30: =IF(D30=0,0,IF(I30=0,0,((D30/I30)*100)-100)) -> 66.79 | Q30: =Q22+Q28 -> 42935000 | R30: =IF(D30=0,0,((D30/Q30)*100)-100) -> -4.96 | S30: =S22+S28 -> 100
C31: Resumo por Regio - Outubro/2002
C32: Descrio das Aberturas | H32: Valor | I32: %
C33: Curitiba (2,3,6,7,10,11,17,21) | H33: =D7+D8+D11+D12+D14+D15+D18+D27 -> 19279224 | I33: =IF(D30=0,0,H33/$D$30) -> 0.47249999999999998
C34: Curitiba e Metrop. (Ctba. 4,5,8,14,23) | H34: =H33+D9+D10+D13+D26+D21 -> 28669343 | I34: =IF(D31=0,0,H34/$D$30) -> 0
C35: Metropolitana (4,5,8,14,23) | H35: =H34-H33 -> 9390119 | I35: =IF(D32=0,0,H35/$D$30) -> 0
C36: Norte (9,12,15,20) | H36: =D24+D17+D21 -> 5334303 | I36: =IF(D33=0,0,H36/$D$30) -> 0
C37: Centro-Oeste (13,18,19) | H37: =D16+D19+D26 -> 5396956 | I37: =IF(D34=0,0,H37/$D$30) -> 0
C38: Ponta Grossa (18,19) | H38: =H37-D16 -> 4083932 | I38: =IF(D35=0,0,H38/$D$30) -> 0
C39: Super (2,3,4,5,6,7,8,10,11,12,13,15,17,18,20,23) | H39: =D22 -> 23875665 | I39: =IF(D36=0,0,H39/$D$30) -> 0
C40: Hiper (9,14,19,21) | H40: =D28 -> 16931218 | I40: =IF(D37=0,0,H40/$D$30) -> 0
C41: Curitiba, Metropolitana e Centro-Oeste | H41: =D30-H36 -> 35472580 | I41: =IF(D38=0,0,H41/$D$30) -> 0
C42: Araucria | H42: =D10+D21 -> 2878545 | I42: =IF(D39=0,0,H42/$D$30) -> 0