A2: Perodo: | C2: 37956 | E2: 37986 | H2: Vendas Acumuladas por Filial
C4: Vendas 2003 | G4: Vendas de Anos Anteriores | K4: Percentuais ( % ) | R4: %
A5: Lojas | C5: Previso | D5: Realizada | E5: Ms Anterior | G5: Vendas 2002 | H5: Vendas 2001 | I5: Vendas 2000 | K5: % Prev | L5: % MA | M5: 2002 | N5: 2001 | O5: 2000 | Q5: Previso Ms | R5: Final | S5: Part.
A7: Xaxim | C7: 900000 | D7: 912713.18 | E7: 685690.24 | G7: 715470.68 | H7: 668693.11 | I7: 817033.56 | K7: =IF(C7=0,0,((D7/C7)*100)-100) -> 1.41 | L7: =IF(E7=0,0,((D7/E7)*100)-100) -> 33.11 | M7: =IF(G7=0,0,((D7/G7)*100)-100) -> 27.57 | N7: =IF(H7=0,0,((D7/H7)*100)-100) -> 36.49 | O7: =IF(I7=0,0,((D7/I7)*100)-100) -> 11.71 | Q7: 900000 | R7: =((D7/Q7)*100)-100 -> 1.41 | S7: =D7/$D$31*100 -> 1.71
A8: S. Felicidade | C8: 970000 | D8: 906360.02 | E8: 703821.94 | G8: 840170.37 | H8: 738195.39 | I8: 838043.78 | K8: =IF(C8=0,0,((D8/C8)*100)-100) -> -6.56 | L8: =IF(E8=0,0,((D8/E8)*100)-100) -> 28.78 | M8: =IF(G8=0,0,((D8/G8)*100)-100) -> 7.88 | N8: =IF(H8=0,0,((D8/H8)*100)-100) -> 22.78 | O8: =IF(I8=0,0,((D8/I8)*100)-100) -> 8.15 | Q8: 970000 | R8: =((D8/Q8)*100)-100 -> -6.56 | S8: =D8/$D$31*100 -> 1.7
A9: Lapa | C9: 1450000 | D9: 1327648.75 | E9: 999119.05 | G9: 1175125.12 | H9: 1030554.15 | I9: 855225.38 | K9: =IF(C9=0,0,((D9/C9)*100)-100) -> -8.44 | L9: =IF(E9=0,0,((D9/E9)*100)-100) -> 32.88 | M9: =IF(G9=0,0,((D9/G9)*100)-100) -> 12.98 | N9: =IF(H9=0,0,((D9/H9)*100)-100) -> 28.83 | O9: =IF(I9=0,0,((D9/I9)*100)-100) -> 55.24 | Q9: 1450000 | R9: =((D9/Q9)*100)-100 -> -8.44 | S9: =D9/$D$31*100 -> 2.49
A10: Araucria | C10: 1500000 | D10: 1152368.78 | E10: 1024477.54 | G10: 1273977.36 | H10: 1978607.97 | I10: 1742232.52 | K10: =IF(C10=0,0,((D10/C10)*100)-100) -> -23.18 | L10: =IF(E10=0,0,((D10/E10)*100)-100) -> 12.48 | M10: =IF(G10=0,0,((D10/G10)*100)-100) -> -9.55 | N10: =IF(H10=0,0,((D10/H10)*100)-100) -> -41.76 | O10: =IF(I10=0,0,((D10/I10)*100)-100) -> -33.86 | Q10: 1500000 | R10: =((D10/Q10)*100)-100 -> -23.18 | S10: =D10/$D$31*100 -> 2.16
A11: Pinheirinho | C11: 2790000 | D11: 2502786.65 | E11: 1755425.17 | G11: 2222677.44 | H11: 2281457.93 | I11: 2538517.39 | K11: =IF(C11=0,0,((D11/C11)*100)-100) -> -10.29 | L11: =IF(E11=0,0,((D11/E11)*100)-100) -> 42.57 | M11: =IF(G11=0,0,((D11/G11)*100)-100) -> 12.6 | N11: =IF(H11=0,0,((D11/H11)*100)-100) -> 9.7 | O11: =IF(I11=0,0,((D11/I11)*100)-100) -> -1.41 | Q11: 2790000 | R11: =((D11/Q11)*100)-100 -> -10.29 | S11: =D11/$D$31*100 -> 4.69
A12: Hauer | C12: 3720000 | D12: 3620014.47 | E12: 2812507.17 | G12: 3293202.72 | H12: 3025352.17 | I12: 3051366.33 | K12: =IF(C12=0,0,((D12/C12)*100)-100) -> -2.69 | L12: =IF(E12=0,0,((D12/E12)*100)-100) -> 28.71 | M12: =IF(G12=0,0,((D12/G12)*100)-100) -> 9.92 | N12: =IF(H12=0,0,((D12/H12)*100)-100) -> 19.66 | O12: =IF(I12=0,0,((D12/I12)*100)-100) -> 18.64 | Q12: 3720000 | R12: =((D12/Q12)*100)-100 -> -2.69 | S12: =D12/$D$31*100 -> 6.79
A13: Paranagu | C13: 3850000 | D13: 4030455.63 | E13: 2908811.91 | G13: 3619739.3 | H13: 3427206.49 | I13: 3008610.45 | K13: =IF(C13=0,0,((D13/C13)*100)-100) -> 4.69 | L13: =IF(E13=0,0,((D13/E13)*100)-100) -> 38.56 | M13: =IF(G13=0,0,((D13/G13)*100)-100) -> 11.35 | N13: =IF(H13=0,0,((D13/H13)*100)-100) -> 17.6 | O13: =IF(I13=0,0,((D13/I13)*100)-100) -> 33.96 | Q13: 3850000 | R13: =((D13/Q13)*100)-100 -> 4.69 | S13: =D13/$D$31*100 -> 7.56
A14: Centenrio | C14: 1150000 | D14: 1084407.81 | E14: 875209.78 | G14: 961206.45 | H14: 800899.25 | I14: 858778.58 | K14: =IF(C14=0,0,((D14/C14)*100)-100) -> -5.7 | L14: =IF(E14=0,0,((D14/E14)*100)-100) -> 23.9 | M14: =IF(G14=0,0,((D14/G14)*100)-100) -> 12.82 | N14: =IF(H14=0,0,((D14/H14)*100)-100) -> 35.4 | O14: =IF(I14=0,0,((D14/I14)*100)-100) -> 26.27 | Q14: 1150000 | R14: =((D14/Q14)*100)-100 -> -5.7 | S14: =D14/$D$31*100 -> 2.03
A15: So Brz | C15: 3950000 | D15: 3857056.27 | E15: 3023429.98 | G15: 3421456.85 | H15: 3102407.99 | I15: 3297102.48 | K15: =IF(C15=0,0,((D15/C15)*100)-100) -> -2.35 | L15: =IF(E15=0,0,((D15/E15)*100)-100) -> 27.57 | M15: =IF(G15=0,0,((D15/G15)*100)-100) -> 12.73 | N15: =IF(H15=0,0,((D15/H15)*100)-100) -> 24.32 | O15: =IF(I15=0,0,((D15/I15)*100)-100) -> 16.98 | Q15: 3950000 | R15: =((D15/Q15)*100)-100 -> -2.35 | S15: =D15/$D$31*100 -> 7.23
A16: Arapongas | C16: 0 | D16: 0 | E16: 0 | G16: 726386.27 | H16: 740672.26 | I16: 817755.16 | K16: =IF(C16=0,0,((D16/C16)*100)-100) -> 0 | L16: =IF(E16=0,0,((D16/E16)*100)-100) -> 0 | M16: =IF(G16=0,0,((D16/G16)*100)-100) -> -100 | N16: =IF(H16=0,0,((D16/H16)*100)-100) -> -100 | O16: =IF(I16=0,0,((D16/I16)*100)-100) -> -100 | Q16: 0 | R16: =((D16/Q16)*100)-100 -> #DIV/0! | S16: =D16/$D$31*100 -> 0
A17: Guarapuava | C17: 1800000 | D17: 1792699.35 | E17: 1313024.27 | G17: 1425756.33 | H17: 1081223.99 | I17: 1207111.44 | K17: =IF(C17=0,0,((D17/C17)*100)-100) -> -00.41 | L17: =IF(E17=0,0,((D17/E17)*100)-100) -> 36.53 | M17: =IF(G17=0,0,((D17/G17)*100)-100) -> 25.74 | N17: =IF(H17=0,0,((D17/H17)*100)-100) -> 65.8 | O17: =IF(I17=0,0,((D17/I17)*100)-100) -> 48.51 | Q17: 1800000 | R17: =((D17/Q17)*100)-100 -> -00.41 | S17: =D17/$D$31*100 -> 3.36
A18: Apucarana | C18: 2150000 | D18: 1988936.95 | E18: 1418729.85 | G18: 1772893.53 | H18: 1580787.07 | I18: 1703921.09 | K18: =IF(C18=0,0,((D18/C18)*100)-100) -> -7.49 | L18: =IF(E18=0,0,((D18/E18)*100)-100) -> 40.19 | M18: =IF(G18=0,0,((D18/G18)*100)-100) -> 12.19 | N18: =IF(H18=0,0,((D18/H18)*100)-100) -> 25.82 | O18: =IF(I18=0,0,((D18/I18)*100)-100) -> 16.73 | Q18: 2150000 | R18: =((D18/Q18)*100)-100 -> -7.49 | S18: =D18/$D$31*100 -> 3.73
A19: Ah | C19: 1700000 | D19: 1395022.75 | E19: 1209111.05 | G19: 1333595.35 | H19: 1605842.47 | I19: 1715801.56 | K19: =IF(C19=0,0,((D19/C19)*100)-100) -> -17.94 | L19: =IF(E19=0,0,((D19/E19)*100)-100) -> 15.38 | M19: =IF(G19=0,0,((D19/G19)*100)-100) -> 4.61 | N19: =IF(H19=0,0,((D19/H19)*100)-100) -> -13.13 | O19: =IF(I19=0,0,((D19/I19)*100)-100) -> -18.7 | Q19: 1700000 | R19: =((D19/Q19)*100)-100 -> -17.94 | S19: =D19/$D$31*100 -> 2.62
A20: P.G. Centro | C20: 2230000 | D20: 2002496.09 | E20: 1553134.92 | G20: 1866162.24 | H20: 1440371.87 | I20: 1517326.56 | K20: =IF(C20=0,0,((D20/C20)*100)-100) -> -10.2 | L20: =IF(E20=0,0,((D20/E20)*100)-100) -> 28.93 | M20: =IF(G20=0,0,((D20/G20)*100)-100) -> 7.31 | N20: =IF(H20=0,0,((D20/H20)*100)-100) -> 39.03 | O20: =IF(I20=0,0,((D20/I20)*100)-100) -> 31.98 | Q20: 2230000 | R20: =((D20/Q20)*100)-100 -> -10.2 | S20: =D20/$D$31*100 -> 3.75
A21: Maring | C21: 2550000 | D21: 2239845.07 | E21: 2062288.82 | G21: 2144144.69 | H21: 1950005.92 | I21: 2061257.3 | K21: =IF(C21=0,0,((D21/C21)*100)-100) -> -12.16 | L21: =IF(E21=0,0,((D21/E21)*100)-100) -> 8.61 | M21: =IF(G21=0,0,((D21/G21)*100)-100) -> 4.46 | N21: =IF(H21=0,0,((D21/H21)*100)-100) -> 14.86 | O21: =IF(I21=0,0,((D21/I21)*100)-100) -> 8.66 | Q21: 2550000 | R21: =((D21/Q21)*100)-100 -> -12.16 | S21: =D21/$D$31*100 -> 4.2
A22: Araucria Nova | C22: 2650000 | D22: 2564260.82 | E22: 1918226.61 | G22: 2213291.93 | H22: 0 | I22: 0 | K22: =IF(C22=0,0,((D22/C22)*100)-100) -> -3.24 | L22: =IF(E22=0,0,((D22/E22)*100)-100) -> 33.68 | M22: =IF(G22=0,0,((D22/G22)*100)-100) -> 15.86 | N22: =IF(H22=0,0,((D22/H22)*100)-100) -> 0 | O22: =IF(I22=0,0,((D22/I22)*100)-100) -> 0 | Q22: 2650000 | R22: =((D22/Q22)*100)-100 -> -3.24 | S22: =D22/$D$31*100 -> 4.81
A23: Total Super | C23: =SUM(C7:C22) -> 33360000 | D23: =SUM(D7:D22) -> 31377072.59 | E23: =SUM(E7:E22) -> 24263008.300000001 | G23: =SUM(G7:G22) -> 29005256.629999999 | H23: =SUM(H7:H22) -> 25452278.030000001 | I23: =SUM(I7:I22) -> 26030083.579999998 | J23: =SUM(C23:I23) -> 169487699.13 | K23: =((D23/C23)*100)-100 -> -5.94 | L23: =IF(E23=0,0,((D23/E23)*100)-100) -> 29.32 | M23: =((D23/G23)*100)-100 -> 8.18 | N23: =((D23/H23)*100)-100 -> 23.28 | O23: =IF(I23=0,0,((D23/I23)*100)-100) -> 20.54 | Q23: =SUM(Q7:Q22) -> 33360000 | R23: =((D23/Q23)*100)-100 -> -5.94 | S23: =D23/$D$31*100 -> 58.82
A25: Londrina | C25: 3550000 | D25: 2771984.28 | E25: 2109010.02 | G25: 2811074.04 | H25: 2707490.12 | I25: 3373794.86 | K25: =IF(C25=0,0,((D25/C25)*100)-100) -> -21.92 | L25: =IF(E25=0,0,((D25/E25)*100)-100) -> 31.44 | M25: =IF(G25=0,0,((D25/G25)*100)-100) -> -1.39 | N25: =IF(H25=0,0,((D25/H25)*100)-100) -> 2.38 | O25: =IF(I25=0,0,((D25/I25)*100)-100) -> -17.84 | Q25: 3550000 | R25: =((D25/Q25)*100)-100 -> -21.92 | S25: =D25/$D$31*100 -> 5.2
A26: S.J. Pinhais | C26: 5100000 | D26: 5171503.96 | E26: 4002821.89 | G26: 4671974.19 | H26: 4001073.33 | I26: 2886319.91 | K26: =IF(C26=0,0,((D26/C26)*100)-100) -> 1.4 | L26: =IF(E26=0,0,((D26/E26)*100)-100) -> 29.2 | M26: =IF(G26=0,0,((D26/G26)*100)-100) -> 10.69 | N26: =IF(H26=0,0,((D26/H26)*100)-100) -> 29.25 | O26: =IF(I26=0,0,((D26/I26)*100)-100) -> 79.17 | Q26: 5100000 | R26: =((D26/Q26)*100)-100 -> 1.4 | S26: =D26/$D$31*100 -> 9.69
A27: P.G. Nova | C27: 4600000 | D27: 3789695.88 | E27: 2603643.03 | G27: 3882893.37 | H27: 3237957.19 | I27: 3559069.08 | K27: =IF(C27=0,0,((D27/C27)*100)-100) -> -17.62 | L27: =IF(E27=0,0,((D27/E27)*100)-100) -> 45.55 | M27: =IF(G27=0,0,((D27/G27)*100)-100) -> -2.4 | N27: =IF(H27=0,0,((D27/H27)*100)-100) -> 17.04 | O27: =IF(I27=0,0,((D27/I27)*100)-100) -> 6.48 | Q27: 4600000 | R27: =((D27/Q27)*100)-100 -> -17.62 | S27: =D27/$D$31*100 -> 7.1
A28: Nilo Peanha | C28: 10500000 | D28: 10232180.33 | E28: 8215743.1399999997 | G28: 8652524.8499999996 | H28: 0 | I28: 0 | K28: =IF(C28=0,0,((D28/C28)*100)-100) -> -2.55 | L28: =IF(E28=0,0,((D28/E28)*100)-100) -> 24.54 | M28: =IF(G28=0,0,((D28/G28)*100)-100) -> 18.26 | N28: =IF(H28=0,0,((D28/H28)*100)-100) -> 0 | O28: =IF(I28=0,0,((D28/I28)*100)-100) -> 0 | Q28: 10500000 | R28: =((D28/Q28)*100)-100 -> -2.55 | S28: =D28/$D$31*100 -> 19.18
A29: Total Hiper | C29: =SUM(C25:C28) -> 23750000 | D29: =SUM(D25:D28) -> 21965364.449999999 | E29: =SUM(E25:E28) -> 16931218.079999998 | G29: =SUM(G25:G28) -> 20018466.449999999 | H29: =SUM(H25:H28) -> 9946520.6400000006 | I29: =SUM(I25:I28) -> 9819183.8499999996 | J29: =SUM(C29:I29) -> 102430753.47 | K29: =((D29/C29)*100)-100 -> -7.51 | L29: =IF(E29=0,0,((D29/E29)*100)-100) -> 29.73 | M29: =((D29/G29)*100)-100 -> 9.73 | N29: =((D29/H29)*100)-100 -> 120.83 | O29: =IF(I29=0,0,((D29/I29)*100)-100) -> 123.7 | Q29: =SUM(Q25:Q28) -> 23750000 | R29: =((D29/Q29)*100)-100 -> -7.51 | S29: =D29/$D$31*100 -> 41.18
A31: Total Geral | C31: =C23+C29 -> 57110000 | D31: =D23+D29 -> 53342437.039999999 | E31: =E23+E29 -> 41194226.380000003 | G31: =G23+G29 -> 49023723.079999998 | H31: =H23+H29 -> 35398798.670000002 | I31: =I23+I29 -> 35849267.43 | K31: =((D31/C31)*100)-100 -> -6.6 | L31: =IF(E31=0,0,((D31/E31)*100)-100) -> 29.49 | M31: =((D31/G31)*100)-100 -> 8.81 | N31: =((D31/H31)*100)-100 -> 50.69 | O31: =IF(I31=0,0,((D31/I31)*100)-100) -> 48.8 | Q31: =Q23+Q29 -> 57110000 | R31: =((D31/Q31)*100)-100 -> -6.6 | S31: =S23+S29 -> 100
C32: Resumo por Regio - Outubro/2002
C33: Descrio das Aberturas | H33: Valor | I33: %
C34: Curitiba (2,3,6,7,10,11,17,21) | H34: =D7+D8+D11+D12+D14+D15+D19+D28 -> 24510541 | I34: =H34/$D$31 -> 0.45950000000000002
C35: Curitiba e Metrop. (Ctba. 4,5,8,14,23) | H35: =H34+D9+D10+D13+D27+D22 -> 37374971 | I35: =H35/$D$31 -> 0.70069999999999999
C36: Metropolitana (4,5,8,14,23) | H36: =H35-H34 -> 12864430 | I36: =H36/$D$31 -> 0.2412
C37: Norte (9,12,15,20) | H37: =D25+D16+D18+D22 -> 7325182 | I37: =H37/$D$31 -> 0.13730000000000001
C38: Centro-Oeste (13,18,19) | H38: =D17+D20+D27 -> 7584891 | I38: =H38/$D$31 -> 0.14219999999999999
C39: Ponta Grossa (18,19) | H39: =H38-D17 -> 5792192 | I39: =H39/$D$31 -> 0.1086
C40: Super (2,3,4,5,6,7,8,10,11,12,13,15,17,18,20,23) | H40: =D23 -> 31377073 | I40: =H40/$D$31 -> 0.58819999999999995
C41: Hiper (9,14,19,21) | H41: =D29 -> 21965364 | I41: =H41/$D$31 -> 0.4118
C42: Curitiba, Metropolitana e Centro-Oeste | H42: =D31-H37 -> 46017255 | I42: =H42/$D$31 -> 0.86270000000000002
C43: Araucria | H43: =D10+D22 -> 3716630 | I43: =H43/$D$31 -> 6.9699999999999998E-2