A2: Periodo: | C2: 38322 | D2: a | E2: 38352 | H2: Vendas Acumuladas por Filial | Q2: =NOW() -> 38364.642587615701
A4: v.1 | C4: Vendas 2004 | G4: Vendas de Anos Anteriores | K4: Percentuais ( % ) | Q4: Meta Mensal | U4: Margem
A5: Lojas | C5: Previsao | D5: Realizada | E5: Mes Anterior | G5: Vendas 2003 | H5: Vendas 2002 | I5: Vendas 2001 | K5: % Prev | L5: % MA | M5: 2003 | N5: 2002 | O5: 2001 | Q5: Previsao Mes | R5: Final | S5: Part. | U5: Meta | V5: Real
A7: Xaxim | C7: 990000 | D7: 1001769 | E7: 788192 | G7: 911440 | H7: 715471 | I7: 668693 | K7: =IF(C7=0,0,((D7/C7)*100)-100) -> 1.19 | L7: =IF(D7=0,0,IF(E7=0,0,((D7/E7)*100)-100)) -> 27.1 | M7: =IF(G7=0,0,((D7/G7)*100)-100) -> 9.91 | N7: =IF(H7=0,0,((D7/H7)*100)-100) -> 40.02 | O7: =IF(D7=0,0,IF(I7=0,0,((D7/I7)*100)-100)) -> 49.81 | Q7: 990000 | R7: =IF(D7=0,0,((D7/Q7)*100)-100) -> 1.19 | S7: =IF(D7=0,0,(D7/$D$33)*100) -> 1.35 | U7: 16.45 | V7: 14.02
A8: S. Felicidade | C8: 950000 | D8: 945394 | E8: 764881 | G8: 904437 | H8: 840170 | I8: 738195 | K8: =IF(C8=0,0,((D8/C8)*100)-100) -> -00.48 | L8: =IF(D8=0,0,IF(E8=0,0,((D8/E8)*100)-100)) -> 23.6 | M8: =IF(G8=0,0,((D8/G8)*100)-100) -> 4.53 | N8: =IF(H8=0,0,((D8/H8)*100)-100) -> 12.52 | O8: =IF(D8=0,0,IF(I8=0,0,((D8/I8)*100)-100)) -> 28.07 | Q8: 950000 | R8: =IF(D8=0,0,((D8/Q8)*100)-100) -> -00.48 | S8: =IF(D8=0,0,(D8/$D$33)*100) -> 1.27 | U8: 17.1 | V8: 13.23
A9: Lapa | C9: 1400000 | D9: 1477567 | E9: 1103731 | G9: 1325987 | H9: 1175125 | I9: 1030554 | K9: =IF(C9=0,0,((D9/C9)*100)-100) -> 5.54 | L9: =IF(D9=0,0,IF(E9=0,0,((D9/E9)*100)-100)) -> 33.87 | M9: =IF(G9=0,0,((D9/G9)*100)-100) -> 11.43 | N9: =IF(H9=0,0,((D9/H9)*100)-100) -> 25.74 | O9: =IF(D9=0,0,IF(I9=0,0,((D9/I9)*100)-100)) -> 43.38 | Q9: 1400000 | R9: =IF(D9=0,0,((D9/Q9)*100)-100) -> 5.54 | S9: =IF(D9=0,0,(D9/$D$33)*100) -> 1.99 | U9: 16.05 | V9: 14.64
A10: Araucaria | C10: 1500000 | D10: 1217436 | E10: 965195 | G10: 1149818 | H10: 1273977 | I10: 1978608 | K10: =IF(C10=0,0,((D10/C10)*100)-100) -> -18.84 | L10: =IF(D10=0,0,IF(E10=0,0,((D10/E10)*100)-100)) -> 26.13 | M10: =IF(G10=0,0,((D10/G10)*100)-100) -> 5.88 | N10: =IF(H10=0,0,((D10/H10)*100)-100) -> -4.44 | O10: =IF(D10=0,0,IF(I10=0,0,((D10/I10)*100)-100)) -> -38.47 | Q10: 1500000 | R10: =IF(D10=0,0,((D10/Q10)*100)-100) -> -18.84 | S10: =IF(D10=0,0,(D10/$D$33)*100) -> 1.64 | U10: 17.16 | V10: 16.12
A11: Pinheirinho | C11: 2750000 | D11: 2811997 | E11: 1978795 | G11: 2492674 | H11: 2222678 | I11: 2281458 | K11: =IF(C11=0,0,((D11/C11)*100)-100) -> 2.25 | L11: =IF(D11=0,0,IF(E11=0,0,((D11/E11)*100)-100)) -> 42.11 | M11: =IF(G11=0,0,((D11/G11)*100)-100) -> 12.81 | N11: =IF(H11=0,0,((D11/H11)*100)-100) -> 26.51 | O11: =IF(D11=0,0,IF(I11=0,0,((D11/I11)*100)-100)) -> 23.25 | Q11: 2750000 | R11: =IF(D11=0,0,((D11/Q11)*100)-100) -> 2.25 | S11: =IF(D11=0,0,(D11/$D$33)*100) -> 3.78 | U11: 16.8 | V11: 14.08
A12: Hauer | C12: 4200000 | D12: 4305640 | E12: 3260562 | G12: 3612408 | H12: 3293203 | I12: 3025352 | K12: =IF(C12=0,0,((D12/C12)*100)-100) -> 2.52 | L12: =IF(D12=0,0,IF(E12=0,0,((D12/E12)*100)-100)) -> 32.05 | M12: =IF(G12=0,0,((D12/G12)*100)-100) -> 19.19 | N12: =IF(H12=0,0,((D12/H12)*100)-100) -> 30.74 | O12: =IF(D12=0,0,IF(I12=0,0,((D12/I12)*100)-100)) -> 42.32 | Q12: 4200000 | R12: =IF(D12=0,0,((D12/Q12)*100)-100) -> 2.52 | S12: =IF(D12=0,0,(D12/$D$33)*100) -> 5.79 | U12: 15.92 | V12: 14.47
A13: Paranagua | C13: 4350000 | D13: 4734317 | E13: 3426785 | G13: 4019754 | H13: 3619739 | I13: 3427207 | K13: =IF(C13=0,0,((D13/C13)*100)-100) -> 8.83 | L13: =IF(D13=0,0,IF(E13=0,0,((D13/E13)*100)-100)) -> 38.16 | M13: =IF(G13=0,0,((D13/G13)*100)-100) -> 17.78 | N13: =IF(H13=0,0,((D13/H13)*100)-100) -> 30.79 | O13: =IF(D13=0,0,IF(I13=0,0,((D13/I13)*100)-100)) -> 38.14 | Q13: 4350000 | R13: =IF(D13=0,0,((D13/Q13)*100)-100) -> 8.83 | S13: =IF(D13=0,0,(D13/$D$33)*100) -> 6.37 | U13: 17 | V13: 15.48
A14: Centenario | C14: 1280000 | D14: 1177519 | E14: 947251 | G14: 1083253 | H14: 961206 | I14: 800899 | K14: =IF(C14=0,0,((D14/C14)*100)-100) -> -8.01 | L14: =IF(D14=0,0,IF(E14=0,0,((D14/E14)*100)-100)) -> 24.31 | M14: =IF(G14=0,0,((D14/G14)*100)-100) -> 8.7 | N14: =IF(H14=0,0,((D14/H14)*100)-100) -> 22.5 | O14: =IF(D14=0,0,IF(I14=0,0,((D14/I14)*100)-100)) -> 47.02 | Q14: 1280000 | R14: =IF(D14=0,0,((D14/Q14)*100)-100) -> -8.01 | S14: =IF(D14=0,0,(D14/$D$33)*100) -> 1.58 | U14: 16.85 | V14: 13.65
A15: Arapongas | C15: 0 | D15: 0 | E15: 0 | G15: 0 | H15: 0 | I15: 0 | K15: =IF(C15=0,0,((D15/C15)*100)-100) -> 0 | L15: =IF(D15=0,0,IF(E15=0,0,((D15/E15)*100)-100)) -> 0 | M15: =IF(D15=0,0,IF(G15=0,0,((D15/G15)*100)-100)) -> 0 | N15: =IF(D15=0,0,IF(H15=0,0,((D15/H15)*100)-100)) -> 0 | O15: =IF(D15=0,0,IF(I15=0,0,((D15/I15)*100)-100)) -> 0 | Q15: 0 | R15: =IF(D15=0,0,((D15/Q15)*100)-100) -> 0 | S15: =IF(D15=0,0,(D15/$D$33)*100) -> 0 | U15: 0 | V15: 0
A16: Sao Braz | C16: 4100000 | D16: 4128995 | E16: 3102683 | G16: 3851197 | H16: 3421457 | I16: 3102408 | K16: =IF(C16=0,0,((D16/C16)*100)-100) -> 00.71 | L16: =IF(D16=0,0,IF(E16=0,0,((D16/E16)*100)-100)) -> 33.08 | M16: =IF(G16=0,0,((D16/G16)*100)-100) -> 7.21 | N16: =IF(H16=0,0,((D16/H16)*100)-100) -> 20.68 | O16: =IF(D16=0,0,IF(I16=0,0,((D16/I16)*100)-100)) -> 33.09 | Q16: 4100000 | R16: =IF(D16=0,0,((D16/Q16)*100)-100) -> 00.71 | S16: =IF(D16=0,0,(D16/$D$33)*100) -> 5.56 | U16: 15.6 | V16: 14.04
A17: Guarapuava | C17: 2400000 | D17: 2396301 | E17: 1671628 | G17: 1789837 | H17: 1425756 | I17: 1081224 | K17: =IF(C17=0,0,((D17/C17)*100)-100) -> -00.15 | L17: =IF(D17=0,0,IF(E17=0,0,((D17/E17)*100)-100)) -> 43.35 | M17: =IF(G17=0,0,((D17/G17)*100)-100) -> 33.88 | N17: =IF(H17=0,0,((D17/H17)*100)-100) -> 68.07 | O17: =IF(D17=0,0,IF(I17=0,0,((D17/I17)*100)-100)) -> 121.63 | Q17: 2400000 | R17: =IF(D17=0,0,((D17/Q17)*100)-100) -> -00.15 | S17: =IF(D17=0,0,(D17/$D$33)*100) -> 3.23 | U17: 15.72 | V17: 15.11
A18: Apucarana | C18: 2400000 | D18: 2332125 | E18: 1650599 | G18: 1987508 | H18: 1772894 | I18: 1580787 | K18: =IF(C18=0,0,((D18/C18)*100)-100) -> -2.83 | L18: =IF(D18=0,0,IF(E18=0,0,((D18/E18)*100)-100)) -> 41.29 | M18: =IF(G18=0,0,((D18/G18)*100)-100) -> 17.34 | N18: =IF(H18=0,0,((D18/H18)*100)-100) -> 31.54 | O18: =IF(D18=0,0,IF(I18=0,0,((D18/I18)*100)-100)) -> 47.53 | Q18: 2400000 | R18: =IF(D18=0,0,((D18/Q18)*100)-100) -> -2.83 | S18: =IF(D18=0,0,(D18/$D$33)*100) -> 3.14 | U18: 16.5 | V18: 14.34
A19: Ahu | C19: 1600000 | D19: 1363099 | E19: 1069087 | G19: 1388111 | H19: 1333595 | I19: 1605843 | K19: =IF(C19=0,0,((D19/C19)*100)-100) -> -14.81 | L19: =IF(D19=0,0,IF(E19=0,0,((D19/E19)*100)-100)) -> 27.5 | M19: =IF(G19=0,0,((D19/G19)*100)-100) -> -1.8 | N19: =IF(H19=0,0,((D19/H19)*100)-100) -> 2.21 | O19: =IF(D19=0,0,IF(I19=0,0,((D19/I19)*100)-100)) -> -15.12 | Q19: 1600000 | R19: =IF(D19=0,0,((D19/Q19)*100)-100) -> -14.81 | S19: =IF(D19=0,0,(D19/$D$33)*100) -> 1.83 | U19: 17.3 | V19: 14.59
A20: P.G. Centro | C20: 2400000 | D20: 2205951 | E20: 1625827 | G20: 1998807 | H20: 1866162 | I20: 1440372 | K20: =IF(C20=0,0,((D20/C20)*100)-100) -> -8.09 | L20: =IF(D20=0,0,IF(E20=0,0,((D20/E20)*100)-100)) -> 35.68 | M20: =IF(G20=0,0,((D20/G20)*100)-100) -> 10.36 | N20: =IF(H20=0,0,((D20/H20)*100)-100) -> 18.21 | O20: =IF(D20=0,0,IF(I20=0,0,((D20/I20)*100)-100)) -> 53.15 | Q20: 2400000 | R20: =IF(D20=0,0,((D20/Q20)*100)-100) -> -8.09 | S20: =IF(D20=0,0,(D20/$D$33)*100) -> 2.97 | U20: 17.36 | V20: 15.91
A21: Maringa | C21: 2900000 | D21: 2753746 | E21: 2215052 | G21: 2235655 | H21: 2144145 | I21: 1950006 | K21: =IF(C21=0,0,((D21/C21)*100)-100) -> -5.04 | L21: =IF(D21=0,0,IF(E21=0,0,((D21/E21)*100)-100)) -> 24.32 | M21: =IF(G21=0,0,((D21/G21)*100)-100) -> 23.17 | N21: =IF(H21=0,0,((D21/H21)*100)-100) -> 28.43 | O21: =IF(D21=0,0,IF(I21=0,0,((D21/I21)*100)-100)) -> 41.22 | Q21: 2900000 | R21: =IF(D21=0,0,((D21/Q21)*100)-100) -> -5.04 | S21: =IF(D21=0,0,(D21/$D$33)*100) -> 3.71 | U21: 17.24 | V21: 14.95
A22: Araucaria Nova | C22: 2800000 | D22: 2798594 | E22: 2158737 | G22: 2558861 | H22: 2213292 | I22: 0 | K22: =IF(C22=0,0,((D22/C22)*100)-100) -> -00.05 | L22: =IF(D22=0,0,IF(E22=0,0,((D22/E22)*100)-100)) -> 29.64 | M22: =IF(G22=0,0,((D22/G22)*100)-100) -> 9.37 | N22: =IF(H22=0,0,((D22/H22)*100)-100) -> 26.44 | O22: =IF(D22=0,0,IF(I22=0,0,((D22/I22)*100)-100)) -> 0 | Q22: 2800000 | R22: =IF(D22=0,0,((D22/Q22)*100)-100) -> -00.05 | S22: =IF(D22=0,0,(D22/$D$33)*100) -> 3.77 | U22: 17 | V22: 15.96
A23: Total Super | C23: =SUM(C7:C22) -> 36020000 | D23: =SUM(D7:D22) -> 35650450 | E23: =SUM(E7:E22) -> 26729005 | G23: =SUM(G7:G22) -> 31309747 | H23: =SUM(H7:H22) -> 28278870 | I23: =SUM(I7:I22) -> 24711606 | J23: =SUM(C23:I23) -> 182699678 | K23: =IF(D23=0,0,((D23/C23)*100)-100) -> -1.03 | L23: =IF(D23=0,0,IF(E23=0,0,((D23/E23)*100)-100)) -> 33.38 | M23: =IF(G23=0,0,IF(D23=0,0,((D23/G23)*100)-100)) -> 13.86 | N23: =IF(H23=0,0,IF(D23=0,0,((D23/H23)*100)-100)) -> 26.07 | O23: =IF(D23=0,0,IF(I23=0,0,((D23/I23)*100)-100)) -> 44.27 | Q23: =SUM(Q7:Q22) -> 36020000 | R23: =IF(D23=0,0,((D23/Q23)*100)-100) -> -1.03 | S23: =IF(D23=0,0,(D23/$D$33)*100) -> 47.98 | U23: 16.71 | V23: 14.8
A25: Londrina | C25: 3500000 | D25: 3484194 | E25: 2547298 | G25: 2768913 | H25: 2811074 | I25: 2707490 | K25: =IF(C25=0,0,((D25/C25)*100)-100) -> -00.45 | L25: =IF(D25=0,0,IF(E25=0,0,((D25/E25)*100)-100)) -> 36.78 | M25: =IF(G25=0,0,((D25/G25)*100)-100) -> 25.83 | N25: =IF(H25=0,0,((D25/H25)*100)-100) -> 23.95 | O25: =IF(D25=0,0,IF(I25=0,0,((D25/I25)*100)-100)) -> 28.69 | Q25: 3500000 | R25: =IF(D25=0,0,IF(Q25=0,0,((D25/Q25)*100)-100)) -> -00.45 | S25: =IF(D25=0,0,(D25/$D$33)*100) -> 4.69 | U25: 16.3 | V25: 13.46
A26: S.J. Pinhais | C26: 5700000 | D26: 5973276 | E26: 4442919 | G26: 5157448 | H26: 4671974 | I26: 4001073 | K26: =IF(C26=0,0,((D26/C26)*100)-100) -> 4.79 | L26: =IF(D26=0,0,IF(E26=0,0,((D26/E26)*100)-100)) -> 34.44 | M26: =IF(G26=0,0,((D26/G26)*100)-100) -> 15.82 | N26: =IF(H26=0,0,((D26/H26)*100)-100) -> 27.85 | O26: =IF(D26=0,0,IF(I26=0,0,((D26/I26)*100)-100)) -> 49.29 | Q26: 5700000 | R26: =IF(D26=0,0,IF(Q26=0,0,((D26/Q26)*100)-100)) -> 4.79 | S26: =IF(D26=0,0,(D26/$D$33)*100) -> 8.04 | U26: 15.7 | V26: 14.31
A27: P.G. Nova | C27: 5000000 | D27: 4889066 | E27: 3474685 | G27: 3784885 | H27: 3882893 | I27: 3237957 | K27: =IF(C27=0,0,((D27/C27)*100)-100) -> -2.22 | L27: =IF(D27=0,0,IF(E27=0,0,((D27/E27)*100)-100)) -> 40.71 | M27: =IF(G27=0,0,((D27/G27)*100)-100) -> 29.17 | N27: =IF(H27=0,0,((D27/H27)*100)-100) -> 25.91 | O27: =IF(D27=0,0,IF(I27=0,0,((D27/I27)*100)-100)) -> 50.99 | Q27: 5000000 | R27: =IF(D27=0,0,IF(Q27=0,0,((D27/Q27)*100)-100)) -> -2.22 | S27: =IF(D27=0,0,(D27/$D$33)*100) -> 6.58 | U27: 15.95 | V27: 15.39
A28: Nilo Pecanha | C28: 11800000 | D28: 10610322 | E28: 8160995 | G28: 10207124 | H28: 8652525 | I28: 0 | K28: =IF(C28=0,0,((D28/C28)*100)-100) -> -10.08 | L28: =IF(D28=0,0,IF(E28=0,0,((D28/E28)*100)-100)) -> 30.01 | M28: =IF(G28=0,0,((D28/G28)*100)-100) -> 3.95 | N28: =IF(H28=0,0,((D28/H28)*100)-100) -> 22.63 | O28: =IF(D28=0,0,IF(I28=0,0,((D28/I28)*100)-100)) -> 0 | Q28: 11800000 | R28: =IF(D28=0,0,IF(Q28=0,0,((D28/Q28)*100)-100)) -> -10.08 | S28: =IF(D28=0,0,(D28/$D$33)*100) -> 14.28 | U28: 15 | V28: 13.94
A29: Champagnat | C29: 7500000 | D29: 6737674 | E29: 5378049 | G29: 0 | H29: 0 | I29: 0 | K29: =IF(C29=0,0,((D29/C29)*100)-100) -> -10.16 | L29: =IF(D29=0,0,IF(E29=0,0,((D29/E29)*100)-100)) -> 25.28 | M29: =IF(G29=0,0,((D29/G29)*100)-100) -> 0 | N29: =IF(H29=0,0,((D29/H29)*100)-100) -> 0 | O29: =IF(D29=0,0,IF(I29=0,0,((D29/I29)*100)-100)) -> 0 | Q29: 7500000 | R29: =IF(D29=0,0,IF(Q29=0,0,((D29/Q29)*100)-100)) -> -10.16 | S29: =IF(D29=0,0,(D29/$D$33)*100) -> 9.07 | U29: 13.87 | V29: 13.94
A30: Santa Candida | C30: 7500000 | D30: 6955104 | E30: 4370194 | G30: 0 | H30: 0 | I30: 0 | K30: =IF(C30=0,0,((D30/C30)*100)-100) -> -7.27 | L30: =IF(D30=0,0,IF(E30=0,0,((D30/E30)*100)-100)) -> 59.15 | M30: =IF(G30=0,0,((D30/G30)*100)-100) -> 0 | N30: =IF(H30=0,0,((D30/H30)*100)-100) -> 0 | O30: =IF(D30=0,0,IF(I30=0,0,((D30/I30)*100)-100)) -> 0 | Q30: 7500000 | R30: =IF(D30=0,0,IF(Q30=0,0,((D30/Q30)*100)-100)) -> -7.27 | S30: =IF(D30=0,0,(D30/$D$33)*100) -> 9.36 | U30: 0 | V30: 10.51
A31: Total Hiper | C31: =SUM(C25:C30) -> 41000000 | D31: =SUM(D25:D30) -> 38649636 | E31: =SUM(E25:E30) -> 28374140 | G31: =SUM(G25:G30) -> 21918370 | H31: =SUM(H25:H30) -> 20018466 | I31: =SUM(I25:I30) -> 9946520 | J31: =SUM(C31:I31) -> 159907132 | K31: =IF(D31=0,0,((D31/C31)*100)-100) -> -5.73 | L31: =IF(D31=0,0,IF(E31=0,0,((D31/E31)*100)-100)) -> 36.21 | M31: =IF(G31=0,0,IF(D31=0,0,((D31/G31)*100)-100)) -> 76.33 | N31: =IF(H31=0,0,IF(D31=0,0,((D31/H31)*100)-100)) -> 93.07 | O31: =IF(D31=0,0,IF(I31=0,0,((D31/I31)*100)-100)) -> 288.57 | Q31: =SUM(Q25:Q30) -> 41000000 | R31: =IF(D31=0,0,((D31/Q31)*100)-100) -> -5.73 | S31: =IF(D31=0,0,(D31/$D$33)*100) -> 52.02 | U31: 12.37 | V31: 13.51
A33: Total Geral | C33: =C23+C31 -> 77020000 | D33: =D23+D31 -> 74300086 | E33: =E23+E31 -> 55103145 | G33: =G23+G31 -> 53228117 | H33: =H23+H31 -> 48297336 | I33: =I23+I31 -> 34658126 | K33: =IF(D31=0,0,((D33/C33)*100)-100) -> -3.53 | L33: =IF(D33=0,0,IF(E33=0,0,((D33/E33)*100)-100)) -> 34.84 | M33: =IF(G33=0,0,IF(D33=0,0,((D33/G33)*100)-100)) -> 39.59 | N33: =IF(H33=0,0,IF(D33=0,0,((D33/H33)*100)-100)) -> 53.84 | O33: =IF(D33=0,0,IF(I33=0,0,((D33/I33)*100)-100)) -> 114.38 | Q33: =Q23+Q31 -> 77020000 | R33: =IF(D33=0,0,((D33/Q33)*100)-100) -> -3.53 | S33: =S23+S31 -> 100 | U33: 15.89 | V33: 14.13
C34: Resumo por Regiao - Outubro/2002
C35: Descricao das Aberturas | H35: Valor | I35: %
C36: Curitiba (2,3,6,7,10,11,17,21,22) | H36: =D7+D8+D11+D12+D14+D16+D19+D28+D29+D30 -> 40037513 | I36: =IF(D33=0,0,H36/$D$33) -> 0.53890000000000005
C37: Curitiba e Metrop. (Ctba. 4,5,8,14,23) | H37: =H36+D9+D10+D13+D27+D22 -> 55154493 | I37: =IF(D33=0,0,H37/$D$33) -> 0.74229999999999996
C38: Metropolitana (4,5,8,14,23) | H38: =H37-H36 -> 15116980 | I38: =IF(D33=0,0,H38/$D$33) -> 0.20349999999999999
C39: Norte (9,15,20) | H39: =D25+D18+D22 -> 8614913 | I39: =IF(D33=0,0,H39/$D$33) -> 0.1159
C40: Centro-Oeste (13,18,19) | H40: =D17+D20+D27 -> 9491318 | I40: =IF(D33=0,0,H40/$D$33) -> 0.12770000000000001
C41: Ponta Grossa (18,19) | H41: =H40-D17 -> 7095017 | I41: =IF(D33=0,0,H41/$D$33) -> 9.5500000000000002E-2
C42: Super (2,3,4,5,6,7,8,10,11,13,15,17,18,20,23) | H42: =D23 -> 35650450 | I42: =IF(D33=0,0,H42/$D$33) -> 0.4798
C43: Hiper (9,14,19,21,22,24) | H43: =D31 -> 38649636 | I43: =IF(D33=0,0,H43/$D$33) -> 0.5202
C44: Curitiba, Metropolitana e Centro-Oeste | H44: =D33-H39 -> 65685173 | I44: =IF(D33=0,0,H44/$D$33) -> 0.8841
C45: Araucaria | H45: =D10+D22 -> 4016030 | I45: =IF(D33=0,0,H45/$D$33) -> 5.4100000000000002E-2